,Reg no.,Name,Incorp-orated,Dissolved,Type1,0693025,"AA COLLECTION LIMITED",1999-11-01,,"Private, ltd by shares"2,0693152,"AEKAO CHEMICALS (HONG KONG) LIMITED
藝高化工(香港)有限公司",1999-11-01,2002-02-08,"Private, ltd by shares"3,0692971,"AEROTECH INTERNATIONAL LIMITED
航科國際有限公司",1999-11-01,2019-04-04,"Private, ltd by shares"4,0693027,"ALEA INSURANCE LIMITED",1999-11-01,,"Private, ltd by shares"5,0692999,"ALFAA ORGANISATION LIMITED
創傑市場資訊機構有限公司",1999-11-01,2013-11-06,"Private, ltd by shares"6,0693055,"ALIONE TECHNOLOGY SOLUTIONS LIMITED
亞里安(中國)有限公司",1999-11-01,2002-04-12,"Private, ltd by shares"7,0693117,"ALLIED KING INVESTMENT LIMITED
帝聯投資有限公司",1999-11-01,2014-01-09,"Private, ltd by shares"8,0692995,"ALLTEK TECHNOLOGY (H.K.) LIMITED
全科科技(香港)有限公司",1999-11-01,,"Private, ltd by shares"9,0692952,"ALPHA ELECTRONICS (HK) LIMITED
奧科電子有限公司",1999-11-01,2016-07-15,"Private, ltd by shares"10,0693063,"ANTON INTERNATIONAL (ASIA) LIMITED
安騰國際(亞洲)有限公司",1999-11-01,2004-04-02,"Private, ltd by shares"11,0693011,"ARABIAN TRADERS LIMITED",1999-11-01,2005-02-18,"Private, ltd by shares"12,0693112,"ARTIQUE ASIA INTERNATIONAL LIMITED
雅寶齋亞洲國際有限公司",1999-11-01,,"Private, ltd by shares"13,0693005,"ASCENTWAY INTERNATIONAL LIMITED
洱威國際有限公司",1999-11-01,2005-06-03,"Private, ltd by shares"14,0692991,"ASIA CHINA MANAGEMENT LIMITED (d2009-07-17)
亞中管理有限公司",1999-11-01,2009-07-17,"Private, ltd by shares"15,0692986,"ASIAN FUNDS ASSOCIATION LIMITED
亞太基金會有限公司",1999-11-01,2006-04-07,"Private, ltd by shares"16,0692980,"ATEC CORPORATE SERVICES LIMITED
雅達商業服務有限公司",1999-11-01,2017-06-02,"Private, ltd by shares"17,0692961,"AZURE GROUP LIMITED (d2006-04-07)
雅舒有限公司",1999-11-01,2006-04-07,"Private, ltd by shares"18,0693059,"BANYAN CONSULTANCY &amp; PLANNING LIMITED",1999-11-01,2007-03-09,"Private, ltd by shares"19,0693083,"BAUD DATA TECHNOLOGY (HK) CO., LIMITED",1999-11-01,2004-04-23,"Private, ltd by shares"20,0693155,"BEST CREATION INTERNATIONAL LIMITED (d2002-05-17)
永升國際有限公司",1999-11-01,2002-05-17,"Private, ltd by shares"21,0693014,"BEST CREATIVE TRADING CO. LIMITED
創藝貿易有限公司",1999-11-01,2006-06-23,"Private, ltd by shares"22,0693154,"BEST LUCK FAR EAST LIMITED
創發遠東有限公司",1999-11-01,,"Private, ltd by shares"23,0693095,"BEST LUCK INDUSTRIES LIMITED
力亨實業有限公司",1999-11-01,2016-03-24,"Private, ltd by shares"24,0693045,"BEST ROUTE DEVELOPMENT LIMITED
力盈發展有限公司",1999-11-01,2002-10-04,"Private, ltd by shares"25,0693164,"BESTFUL CONSULTANTS LIMITED
百豐顧問有限公司",1999-11-01,2015-07-16,"Private, ltd by shares"26,0693068,"BILLION ASIA HOLDINGS LIMITED
億亞集團(遠東)有限公司",1999-11-01,2010-03-26,"Private, ltd by shares"27,0693072,"BONAFIDE ENTERPRISE LIMITED
盈天企業有限公司",1999-11-01,,"Private, ltd by shares"28,0692972,"BRIAN MOORE INTERNATIONAL LIMITED",1999-11-01,2012-07-13,"Private, ltd by shares"29,0693099,"BRIGHT PROFIT (HK) LIMITED
溢升(香港)有限公司",1999-11-01,2006-04-07,"Private, ltd by shares"30,0692978,"CARTINI HOLDING LIMITED
卡特妳集團有限公司",1999-11-01,2006-06-16,"Private, ltd by shares"31,0693118,"CENTURY PLANNER LIMITED
迪創有限公司",1999-11-01,2003-03-14,"Private, ltd by shares"32,0692993,"CHARTER PROJECT TECHNOLOGY LIMITED
志益科技有限公司",1999-11-01,2001-10-19,"Private, ltd by shares"33,0693091,"CHEONG YIP HOLDINGS LIMITED
昌業集團有限公司",1999-11-01,2003-07-25,"Private, ltd by shares"34,0693132,"Chief Surveying Consultants Limited
智富測量顧問有限公司",1999-11-01,,"Private, ltd by shares"35,0693133,"CHINA CONCEPT TRADING LIMITED (d2008-09-23)
中永貿易有限公司",1999-11-01,2008-09-23,"Private, ltd by shares"36,0693161,"CHINA MEDICAL INFORMATION NETWORK LIMITED
中國中醫藥信息網有限公司",1999-11-01,2004-02-20,"Private, ltd by shares"37,0693015,"CHINA UNI-PHARM INTERNATIONAL LIMITED
中聯醫藥國際有限公司",1999-11-01,2008-06-13,"Private, ltd by shares"38,0692966,"CHINA VENTURE CAPITAL CONSULTANCY LIMITED
中國風險投資顧問有限公司",1999-11-01,2009-03-20,"Private, ltd by shares"39,0693128,"CHINA WEALTHY (HONG KONG) LIMITED
中永(香港)有限公司",1999-11-01,2007-05-18,"Private, ltd by shares"40,0693114,"CHINA-HK SHIPPING LIMITED
華港船務有限公司",1999-11-01,,"Private, ltd by shares"41,0692985,"CHINATONE GROUP LIMITED
智通科技集團有限公司",1999-11-01,2008-08-08,"Private, ltd by shares"42,0693006,"CHOY LEE FAT (BUK SING) ASSOCIATION LIMITED
蔡李佛(北勝)總會有限公司",1999-11-01,,"Ltd by guarantee"43,0693021,"CHUN HUNG (LOGISTICS) WAREHOUSE &amp; TRANSPORTATION CO. LIMITED
振雄(物流)貯運有限公司",1999-11-01,2014-01-10,"Private, ltd by shares"44,0693160,"CHUN YEUNG MEDICINES FOR FISHES &amp; SHRIMPS (CHINA) COMPANY LIMITED
振洋魚蝦葯物(中國)有限公司",1999-11-01,2002-07-19,"Private, ltd by shares"45,0693113,"CITY TECH HOLDINGS LIMITED
港科集團有限公司",1999-11-01,2008-09-12,"Private, ltd by shares"46,0693053,"COLSON ASIA (H.K.) LIMITED",1999-11-01,2018-11-30,"Private, ltd by shares"47,0693144,"CONGREAT DEVELOPMENT LIMITED
昌基發展有限公司",1999-11-01,,"Private, ltd by shares"48,0693143,"CONGREAT ENTERPRISES LIMITED
昌基企業有限公司",1999-11-01,2011-11-11,"Private, ltd by shares"49,0692984,"CU RESEARCH LIMITED
富聯資訊有限公司",1999-11-01,2005-04-22,"Private, ltd by shares"50,0693165,"DATACELL TECHNOLOGY LIMITED
盈通科技有限公司",1999-11-01,,"Private, ltd by shares"51,0692990,"DRAGON CREST LIMITED (d2008-11-21)
僑峻有限公司",1999-11-01,2008-11-21,"Private, ltd by shares"52,0693130,"E-BIZ INTERNATIONAL LIMITED (d2015-06-19)",1999-11-01,2015-06-19,"Private, ltd by shares"53,0693023,"E-MATRIX INTERNET TECHNOLOGY LIMITED
爾美卓互聯網科技有限公司",1999-11-01,2006-05-12,"Private, ltd by shares"54,0693038,"EASTWIN ENTERPRISE LIMITED
卓亨企業有限公司",1999-11-01,2006-05-19,"Private, ltd by shares"55,0692968,"EASY (HANG FUNG) TRANSPORTATION CO. LIMITED
依時(恒豐)貨運有限公司",1999-11-01,2007-12-21,"Private, ltd by shares"56,0693051,"EASY PROFIT ENGINEERING LIMITED
盈富工程有限公司",1999-11-01,,"Private, ltd by shares"57,0693141,"ETERNAL GRACE LIMITED (d2006-08-11)
永頌有限公司",1999-11-01,2006-08-11,"Private, ltd by shares"58,0693124,"EVER ASIA 2000 LIMITED
永亞2000有限公司",1999-11-01,2015-11-06,"Private, ltd by shares"59,0693032,"EVER CAST INVESTMENT LIMITED
永吉投資有限公司",1999-11-01,2011-10-28,"Private, ltd by shares"60,0693120,"EVER CREATIVE LIMITED (d2001-11-09)
迪陞有限公司",1999-11-01,2001-11-09,"Private, ltd by shares"61,0693134,"EVER SMART TRADING LIMITED (d2001-06-22)
佳卓貿易有限公司",1999-11-01,2001-06-22,"Private, ltd by shares"62,0693010,"EVERLITE ASIA INDUSTRIES LIMITED
恒利亞洲實業有限公司",1999-11-01,2005-04-15,"Private, ltd by shares"63,0693150,"EVERWIN TRANSPORTATION LIMITED
盈佳貨運有限公司",1999-11-01,,"Private, ltd by shares"64,0692998,"EXCEL MASTER DEVELOPMENT LIMITED
凌鋒發展有限公司",1999-11-01,2002-12-06,"Private, ltd by shares"65,0693111,"FAIRY FARM HOLDINGS LIMITED
仙桃源控股有限公司",1999-11-01,2008-11-21,"Private, ltd by shares"66,0693162,"FEI TAN MOTOR TRADING CO. LIMITED
飛騰汽車貿易有限公司",1999-11-01,2006-12-15,"Private, ltd by shares"67,0693054,"FLYING NETWORK LIMITED
科捷網絡有限公司",1999-11-01,2006-04-07,"Private, ltd by shares"68,0693026,"FMC INVESTMENT MANAGEMENT (HONG KONG) LIMITED
科創投資管理(香港)有限公司",1999-11-01,2008-11-28,"Private, ltd by shares"69,0692981,"FORTUNA DEVELOPMENT LIMITED
康富特發展有限公司",1999-11-01,,"Private, ltd by shares"70,0693107,"FORTUNE SOURCE INVESTMENTS LIMITED
瑞源投資有限公司",1999-11-01,2006-04-07,"Private, ltd by shares"71,0693033,"FOUNDATION INDUSTRIES CO., LIMITED
置建實業有限公司",1999-11-01,2003-08-15,"Private, ltd by shares"72,0693043,"FULL POWER FAR EAST LIMITED
萬富遠東有限公司",1999-11-01,2007-11-23,"Private, ltd by shares"73,0693018,"FUNG YEUNG TONG NATURAL HERBAGE DEVELOPMENT COMPANY LIMITED
鳳陽堂天然藥品發展有限公司",1999-11-01,2006-04-07,"Private, ltd by shares"74,0693057,"FunTown Hong Kong Limited
戲谷香港股份有限公司",1999-11-01,,"Private, ltd by shares"75,0693071,"GE CAPITAL TRADE SERVICES, LIMITED
2 財務有限公司",1999-11-01,2019-01-29,"Private, ltd by shares"76,0693159,"GIANT (CHINA) LIMITED
偉宏(中國)有限公司",1999-11-01,2006-04-07,"Private, ltd by shares"77,0693156,"GLOBAL STAR DEVELOPMENT LIMITED (d2018-09-21)
裕陞發展有限公司",1999-11-01,2018-09-21,"Private, ltd by shares"78,0693094,"GLOBAL STAR INDUSTRIAL LIMITED
富陞實業有限公司",1999-11-01,2018-11-16,"Private, ltd by shares"79,0693028,"GLORY ASIA (HONG KONG) LIMITED
高亞(香港)有限公司",1999-11-01,2006-04-07,"Private, ltd by shares"80,0693149,"GOLDEN HORSE TRANSPORTATION LIMITED
金馬貨運有限公司",1999-11-01,2008-03-14,"Private, ltd by shares"81,0692951,"GOLDEN LIGHT (HK) TRADING COMPANY LIMITED
金剛(香港)貿易有限公司",1999-11-01,2009-03-20,"Private, ltd by shares"82,0693039,"GOLDEN TOP INDUSTRIES LIMITED
溢陞實業有限公司",1999-11-01,2007-01-27,"Private, ltd by shares"83,0693019,"GRAND STEEL WINDOWS (HONG KONG) LIMITED
大方鋼窗(香港)有限公司",1999-11-01,,"Private, ltd by shares"84,0693085,"GREATER CHINA INVESTMENTS CORPORATION LIMITED
大中華投資集團有限公司",1999-11-01,,"Private, ltd by shares"85,0692996,"GREEN HILL PRODUCTS LIMITED (d2007-03-16)
普美企業有限公司",1999-11-01,2007-03-16,"Private, ltd by shares"86,0693073,"GROW SHINE LIMITED
生輝有限公司",1999-11-01,2012-06-15,"Private, ltd by shares"87,0692957,"GS PARTNERS LIMITED",1999-11-01,2006-04-07,"Private, ltd by shares"88,0692982,"GUARANTEE TRAVEL LIMITED
保誠旅遊有限公司",1999-11-01,,"Private, ltd by shares"89,0693137,"GUO YE SLOPE &amp; FOUNDATION ENGINEERING CONSULTANT LIMITED
國葉邊坡與基礎工程顧問有限公司",1999-11-01,2002-03-08,"Private, ltd by shares"90,0692962,"HANG TAI CONSTRUCTION ENG. LIMITED
恒泰建築工程有限公司",1999-11-01,2002-04-12,"Private, ltd by shares"91,0692967,"HARVESTER INVESTMENT COMPANY LIMITED
志達投資發展有限公司",1999-11-01,2005-08-12,"Private, ltd by shares"92,0693069,"HAUYOU INTERNATIONAL POWER LIMITED
華友國際電力有限公司",1999-11-01,2011-11-11,"Private, ltd by shares"93,0693004,"HEALTH PLUS FOOD LIMITED
健康燒味有限公司",1999-11-01,2002-03-08,"Private, ltd by shares"94,0692976,"HERLIA LIMITED",1999-11-01,2005-04-01,"Private, ltd by shares"95,0692989,"HIGH ELEVATION LIMITED (d2006-04-07)",1999-11-01,2006-04-07,"Private, ltd by shares"96,0693062,"HING WAH INTERNATIONAL HOLDING LIMITED
興華國際集團有限公司",1999-11-01,2008-03-14,"Private, ltd by shares"97,0693147,"HO KEE ENGINEERING LIMITED
灝基工程有限公司",1999-11-01,2003-12-05,"Private, ltd by shares"98,0693020,"HONG KONG ALLIANZ INVESTMENT HOLDING LIMITED
香港聯合投資控股集團有限公司",1999-11-01,,"Private, ltd by shares"99,0693007,"HONG KONG ASSOCIATION OF PRIVATE PRACTICE OPTOMETRISTS LIMITED (THE)
香港執業眼科視光師協會有限公司",1999-11-01,,"Ltd by guarantee"100,0693000,"HONG KONG PLUMBING PROMOTION LIMITED
香港水務推廣有限公司",1999-11-01,,"Private, ltd by shares"101,0692983,"HONG KONG RU HWA ELECTRONIC COMPANY LIMITED
香港如華電子股份有限公司",1999-11-01,2008-08-08,"Private, ltd by shares"102,0693104,"HONG KONG TREE LIMITED
別樹一網有限公司",1999-11-01,2006-04-07,"Private, ltd by shares"103,0693022,"HONG KONG WA SIE CLOTHING (GROUPS) LIMITED
香港華士服飾集團有限公司",1999-11-01,2006-04-07,"Private, ltd by shares"104,0693052,"HONGKONG 99 HOLDINGS LIMITED
香港九九控股有限公司",1999-11-01,2003-07-18,"Private, ltd by shares"105,0692974,"IBEAUTY ASIA LIMITED",1999-11-01,2002-07-12,"Private, ltd by shares"106,0692975,"IMAGE KNITTING FACTORY LIMITED
新意織造廠有限公司",1999-11-01,2002-07-19,"Private, ltd by shares"107,0693067,"INNO-SKY TECHNOLOGY LIMITED
創天數碼有限公司",1999-11-01,2002-01-04,"Private, ltd by shares"108,0693041,"INTELLIGENT MANAGEMENT LIMITED (d2008-05-02)
思穎管理有限公司",1999-11-01,2008-05-02,"Private, ltd by shares"109,0693090,"INTERNATIONAL TECHNOLOGY HOLDINGS LIMITED (d2006-04-07)
國際科技集團有限公司",1999-11-01,2006-04-07,"Private, ltd by shares"110,0693080,"JADE HOUSE FAST FOOD LIMITED
翠豪閣美食快餐廳有限公司",1999-11-01,2009-10-16,"Private, ltd by shares"111,0692977,"JANG &amp; CHANG ETRADING LIMITED",1999-11-01,2001-03-23,"Private, ltd by shares"112,0693065,"JAYCORE LIMITED (d2013-02-01)",1999-11-01,2013-02-01,"Private, ltd by shares"113,0693001,"JEANSWEAR SERVICES FAR EAST LIMITED",1999-11-01,,"Private, ltd by shares"114,0692959,"JETLINE CONSTRUCTION CO., LIMITED
哲其建設有限公司",1999-11-01,,"Private, ltd by shares"115,0693078,"JIACAI MEDICAL CO. LIMITED
嘉彩醫藥有限公司",1999-11-01,2005-10-21,"Private, ltd by shares"116,0693082,"JIAN QIAO DECORATION ENGINEERING COMPANY LIMITED
劍橋裝飾工程有限公司",1999-11-01,2010-02-12,"Private, ltd by shares"117,0693046,"JIN YUAN HOLDINGS (CHINA) LIMITED
金源控股(中國)有限公司",1999-11-01,,"Private, ltd by shares"118,0693070,"KAMAN TRADING (HONG KONG) COMPANY LIMITED
嘉文貿易(香港)有限公司",1999-11-01,,"Private, ltd by shares"119,0693148,"KING STAR GROUP LIMITED
亨駿集團有限公司",1999-11-01,,"Private, ltd by shares"120,0692988,"KINGSTON TAXATION SERVICES LIMITED
成業稅務服務有限公司",1999-11-01,2002-02-08,"Private, ltd by shares"121,0693100,"KINGSWIN (HK) LIMITED
盈亨(香港)有限公司",1999-11-01,,"Private, ltd by shares"122,0693097,"KINGSWIN INDUSTRIAL LIMITED (d2005-07-15)
金運工業有限公司",1999-11-01,2005-07-15,"Private, ltd by shares"123,0693101,"KINGSWIN INTERNATIONAL LIMITED (d2005-03-04)
盈駿國際有限公司",1999-11-01,2005-03-04,"Private, ltd by shares"124,0693017,"KNIGHT KING COMPANY LIMITED",1999-11-01,,"Private, ltd by shares"125,0693074,"KONDON (HONG KONG) LIMITED
光中(香港)有限公司",1999-11-01,2006-04-07,"Private, ltd by shares"126,0692960,"KWAN TAI INVESTMENT HOLDINGS COMPANY LIMITED
均泰控股有限公司",1999-11-01,,"Private, ltd by shares"127,0692979,"LAPLAND CIVIL ENGINEERING LIMITED
立利土木工程有限公司",1999-11-01,2011-05-20,"Private, ltd by shares"128,0693086,"LEE HING LOGISTICS LIMITED
利興物流有限公司",1999-11-01,,"Private, ltd by shares"129,0693030,"MANDEX TECHNOLOGY LIMITED
明益科技有限公司",1999-11-01,,"Private, ltd by shares"130,0693139,"MAXTECH TECHNOLOGY LIMITED
宏科科技有限公司",1999-11-01,,"Private, ltd by shares"131,0693024,"MERCOM ASIA LIMITED",1999-11-01,2001-05-18,"Private, ltd by shares"132,0692970,"MI YIA INTERNATIONAL (HOLDINGS) LIMITED
美亞國際(集團)有限公司",1999-11-01,2011-01-07,"Private, ltd by shares"133,0693109,"MILLENNIUM ISLAND LIMITED",1999-11-01,2002-05-03,"Private, ltd by shares"134,0693145,"MINDBOND CORPORATION LIMITED",1999-11-01,2019-07-26,"Private, ltd by shares"135,0693106,"MING-TAI LIMITED",1999-11-01,2001-11-30,"Private, ltd by shares"136,0693044,"MULTI-TRADE TRADING LIMITED
溢升貿易有限公司",1999-11-01,,"Private, ltd by shares"137,0693047,"NATION EMPLOYMENT AGENCY LIMITED
力業僱傭中心有限公司",1999-11-01,,"Private, ltd by shares"138,0692969,"NEW CENTURY PROPERTY MANAGEMENT LIMITED
新世紀物業管理有限公司",1999-11-01,2006-07-07,"Private, ltd by shares"139,0693123,"NEW WEALTH 2000 LIMITED
新豐2000有限公司",1999-11-01,,"Private, ltd by shares"140,0692954,"NEWPORT PHARMACEUTICALS COMPANY LIMITED
新港藥業有限公司",1999-11-01,2008-12-01,"Private, ltd by shares"141,0693116,"NM (ASIA) LIMITED",1999-11-01,2010-06-25,"Private, ltd by shares"142,0693035,"OCEAN WINNER ENTERPRISES LIMITED
海勝企業有限公司",1999-11-01,,"Private, ltd by shares"143,0693131,"ORIENT ASIA INTERNATIONAL LIMITED (d2002-08-02)
東威國際有限公司",1999-11-01,2002-08-02,"Private, ltd by shares"144,0693061,"PACIFIC LOCUS COMPANY LIMITED
經緯(太平洋)有限公司",1999-11-01,,"Private, ltd by shares"145,0693049,"PACIFIC SOURCING HOLDINGS LIMITED
鏊祥集團有限公司",1999-11-01,2006-04-07,"Private, ltd by shares"146,0693077,"PARADEN INVESTMENT LIMITED
百潤投資有限公司",1999-11-01,,"Private, ltd by shares"147,0692958,"PHOTO2U COMPANY LIMITED",1999-11-01,2005-10-14,"Private, ltd by shares"148,0693122,"PLANNER GROUP LIMITED
遠誠有限公司",1999-11-01,2001-03-16,"Private, ltd by shares"149,0693121,"PLANNER LINK LIMITED
和捷有限公司",1999-11-01,2003-11-07,"Private, ltd by shares"150,0693135,"POLY DRAGON (ASIA) LIMITED
滙聯(亞洲)有限公司",1999-11-01,2011-11-11,"Private, ltd by shares"151,0693153,"POLY LINK (HK) LIMITED
裕陞(香港)有限公司",1999-11-01,2015-09-11,"Private, ltd by shares"152,0693096,"POLY LINK INDUSTRIAL LIMITED
達盈實業有限公司",1999-11-01,2015-10-09,"Private, ltd by shares"153,0693042,"POLY PACIFIC DEVELOPMENT LIMITED
聚寶發展有限公司",1999-11-01,2004-01-09,"Private, ltd by shares"154,0693115,"POWER BEST INVESTMENT LIMITED (d2004-05-28)
佳力投資有限公司",1999-11-01,2004-05-28,"Private, ltd by shares"155,0693058,"PRESTIGE TALENT INTERNATIONAL (HK) LIMITED
信智國際(香港)有限公司",1999-11-01,2007-03-09,"Private, ltd by shares"156,0693088,"PRETTY MARK LIMITED (d2002-03-08)
百徽有限公司",1999-11-01,2002-03-08,"Private, ltd by shares"157,0693102,"REGENT CHANCE DEVELOPMENT LIMITED
盈亨發展有限公司",1999-11-01,,"Private, ltd by shares"158,0693163,"REGENT STAR INTERNATIONAL LIMITED
振達國際有限公司",1999-11-01,,"Private, ltd by shares"159,0693079,"RICH MAGIC LIMITED
裕奇有限公司",1999-11-01,,"Private, ltd by shares"160,0692955,"RIGHT START LIMITED (d2011-08-26)
亨生有限公司",1999-11-01,2011-08-26,"Private, ltd by shares"161,0693034,"ROCK TRADING COMPANY LIMITED (HK)
磐石貿易有限公司",1999-11-01,,"Private, ltd by shares"162,0693087,"ROOT DENTAL CARE LIMITED
根本牙醫診所有限公司",1999-11-01,2016-03-18,"Private, ltd by shares"163,0693127,"ROYAL RICHEST LIMITED (d2002-07-19)
英耀有限公司",1999-11-01,2002-07-19,"Private, ltd by shares"164,0693126,"ROYAL WELL LIMITED
誠綽有限公司",1999-11-01,,"Private, ltd by shares"165,0693105,"S. Y. &amp; SHEEN JV LIMITED",1999-11-01,2006-04-07,"Private, ltd by shares"166,0693140,"SCINSURER.COM LIMITED",1999-11-01,2003-02-28,"Private, ltd by shares"167,0692963,"SENZAKI COMPANY LIMITED
先崎有限公司",1999-11-01,2010-02-26,"Private, ltd by shares"168,0693066,"SHIELD HONG KONG LIMITED
盾牌香港有限公司",1999-11-01,,"Private, ltd by shares"169,0693060,"SHING FUNG PETROLEUM COMPANY LIMITED
盛豐石油有限公司",1999-11-01,,"Private, ltd by shares"170,0693081,"SILVER EXCEL INTERNATIONAL LIMITED
卓銀國際有限公司",1999-11-01,2014-07-11,"Private, ltd by shares"171,0692973,"SILVERSTONE TECHNOLOGY LIMITED (d2009-03-20)",1999-11-01,2009-03-20,"Private, ltd by shares"172,0693076,"SINO HEAD DEVELOPMENT LIMITED
中鼎發展有限公司",1999-11-01,,"Private, ltd by shares"173,0692964,"SINORAIL OVERSEAS DEVELOPMENT LIMITED
華鐵海外發展有限公司",1999-11-01,2008-03-14,"Private, ltd by shares"174,0692997,"SMART RAINBOW LIMITED
卓虹有限公司",1999-11-01,,"Private, ltd by shares"175,0693151,"SMART SUCCESS TRANSPORTATION LIMITED
駿成運輸有限公司",1999-11-01,2006-06-16,"Private, ltd by shares"176,0693129,"SMART WEALTHY (HONG KONG) LIMITED
俊裕(香港)有限公司",1999-11-01,,"Private, ltd by shares"177,0693012,"Smiths Detection Hong Kong Limited",1999-11-01,,"Private, ltd by shares"178,0693064,"SOURCE OF LIFE COMPANY LIMITED
生命之源有限公司",1999-11-01,2002-08-02,"Private, ltd by shares"179,0693119,"SPEED CENTURY LIMITED
迅迪有限公司",1999-11-01,,"Private, ltd by shares"180,0693089,"STAR MANAGEMENT CONSULTANTS LIMITED
達輝管理顧問有限公司",1999-11-01,2017-05-19,"Private, ltd by shares"181,0693002,"STOCKE.COM CO. LIMITED",1999-11-01,2006-04-07,"Private, ltd by shares"182,0693084,"STRONGNET.COM CO., LIMITED",1999-11-01,,"Private, ltd by shares"183,0693031,"SUN CONCORD DEVELOPMENT LIMITED
日和發展有限公司",1999-11-01,,"Private, ltd by shares"184,0693075,"SUN LEE AIR-CONDITION ENGINEERING TRADING LIMITED
新利冷氣工程貿易有限公司",1999-11-01,,"Private, ltd by shares"185,0693142,"SUN YAT SEN FOUNDATION LIMITED
孫中山香港基金會有限公司",1999-11-01,2009-03-20,"Private, ltd by shares"186,0692992,"SUNITY INTERNATIONAL LIMITED
勝智國際有限公司",1999-11-01,,"Private, ltd by shares"187,0693157,"SUNNY MIND DEVELOPMENT LIMITED
天捷發展有限公司",1999-11-01,2016-11-18,"Private, ltd by shares"188,0692987,"SUNYORK GLOBAL LIMITED
陽日國際有限公司",1999-11-01,,"Private, ltd by shares"189,0692956,"TESO.ADD COMPANY LIMITED
添力能源有限公司",1999-11-01,,"Private, ltd by shares"190,0693138,"TOP CHANNEL CONSTRUCTION MATERIALS LIMITED
昌明建築材料有限公司",1999-11-01,,"Private, ltd by shares"191,0693037,"TOP RICH ENTERPRISES LIMITED (d2009-12-18)
盈發企業有限公司",1999-11-01,2009-12-18,"Private, ltd by shares"192,0693136,"TOP RICHEST DEVELOPMENT LIMITED
嘉柏發展有限公司",1999-11-01,2005-09-02,"Private, ltd by shares"193,0693098,"TOPRISE MANAGEMENT LIMITED
溢升管理有限公司",1999-11-01,2001-11-23,"Private, ltd by shares"194,0693110,"TREASURE DELTA LIMITED",1999-11-01,2002-06-07,"Private, ltd by shares"195,0693146,"UNITED PHARMACIES (HK) LIMITED",1999-11-01,,"Private, ltd by shares"196,0693056,"UNIVERSAL ALUMINIUM &amp; STEEL ENGINEERING LIMITED
環球鋁鋼工程有限公司",1999-11-01,2012-01-04,"Private, ltd by shares"197,0692953,"W &amp; A CO., LIMITED
威鎰有限公司",1999-11-01,2004-06-04,"Private, ltd by shares"198,0693016,"WAI KEI (HK) COMPANY LIMITED
香港衛奇有限公司",1999-11-01,2018-06-01,"Private, ltd by shares"199,0693050,"WALL INTERNATIONAL ASIA LIMITED (d2006-06-30)
華爾國際亞洲有限公司",1999-11-01,2006-06-30,"Private, ltd by shares"200,0693036,"WANTON INTERNATIONAL LIMITED
運東國際有限公司",1999-11-01,2006-04-07,"Private, ltd by shares"201,0693125,"WEALTHY PLANNER LIMITED
利焯有限公司",1999-11-01,,"Private, ltd by shares"202,0693158,"WELL KNOWN TECHNOLOGY LIMITED
偉俊科技有限公司",1999-11-01,2008-06-13,"Private, ltd by shares"203,0693029,"WELLIN ENGINEERING LIMITED
惠興工程有限公司",1999-11-01,,"Private, ltd by shares"204,0693009,"WILSONIC DEVELOPMENT COMPANY LIMITED
中博華瑞數碼科技有限公司",1999-11-01,2018-06-01,"Private, ltd by shares"205,0693092,"WIN BRILLIANT HOLDINGS LIMITED
永揚集團有限公司",1999-11-01,2015-03-20,"Private, ltd by shares"206,0693040,"WIN GLORY INDUSTRIAL LIMITED (d2007-03-16)
勝輝實業有限公司",1999-11-01,2007-03-16,"Private, ltd by shares"207,0693093,"WING YICK DEVELOPMENT LIMITED
榮益拓展有限公司",1999-11-01,,"Private, ltd by shares"208,0693103,"WINNER FAME DEVELOPMENT LIMITED
達盈發展有限公司",1999-11-01,2006-04-07,"Private, ltd by shares"209,0692994,"WORLD GRADE DEVELOPMENT LIMITED
世傑發展有限公司",1999-11-01,2005-04-29,"Private, ltd by shares"210,0693003,"WSA ONLINE (HK) PTY. LIMITED",1999-11-01,2006-04-07,"Private, ltd by shares"211,0693008,"YANG GUANG (AN DA) GROUP LIMITED
陽光(安達)集團有限公司",1999-11-01,2006-04-07,"Private, ltd by shares"212,0693013,"YES WIN ENTERPRISES LIMITED
有盈企業有限公司",1999-11-01,2008-09-19,"Private, ltd by shares"213,0693108,"YONGHANG INTERNATIONAL TRANSPORTATION (H.K.) LIMITED
永航(香港)國際貨運有限公司",1999-11-01,2006-04-07,"Private, ltd by shares"214,0692965,"YUAN CHIEN COMPUTER COMPANY LIMITED
遠見電腦有限公司",1999-11-01,,"Private, ltd by shares"215,0693048,"ZHONGGUANCUN SOFT LIMITED
中關村軟件有限公司",1999-11-01,2002-02-01,"Private, ltd by shares"