,Reg no.,Name,Incorp-orated,Dissolved,Type1,0694811,"2000.COM TECHNOLOGY LIMITED
2000科技有限公司",1999-11-17,2002-01-25,"Private, ltd by shares"2,0694802,"A-PEX SYSTEMS LIMITED",1999-11-17,,"Private, ltd by shares"3,0694910,"ADVANCED PROJECT TECHNOLOGY LIMITED (HK)
浩益科技有限公司",1999-11-17,,"Private, ltd by shares"4,0695004,"AGC DESIGN LIMITED (HK)
創智建築師有限公司",1999-11-17,,"Private, ltd by shares"5,0694744,"ALLIED RICHEST LIMITED
焯佳有限公司",1999-11-17,,"Private, ltd by shares"6,0694818,"ALVIN MARBLE COMPANY LIMITED
方正石材有限公司",1999-11-17,2008-06-06,"Private, ltd by shares"7,0694841,"AMC LIMITED (d2002-11-08)
文博昌有限公司",1999-11-17,2002-11-08,"Private, ltd by shares"8,0694843,"AMMED (HONG KONG ISLAND CENTER) LIMITED",1999-11-17,,"Private, ltd by shares"9,0694795,"ASIA MOTOR SERVICES COMPANY LIMITED
亞洲汽車服務有限公司",1999-11-17,,"Private, ltd by shares"10,0694747,"ASIAN BEST ENTERPRISES LIMITED
佳雅企業有限公司",1999-11-17,2015-09-18,"Private, ltd by shares"11,0694860,"ASKEY (H.K.) LIMITED
亞旭(香港)有限公司",1999-11-17,2007-03-23,"Private, ltd by shares"12,0694903,"AUTOMAX (ASIA) LIMITED
歐亞汽車零件有限公司",1999-11-17,2012-04-05,"Private, ltd by shares"13,0694886,"B &amp; D ENGINEERING LIMITED (d2006-03-10)
權志工程有限公司",1999-11-17,2006-03-10,"Private, ltd by shares"14,0694769,"BEIJING CENTERGATE TECHNOLOGIES (HONG KONG) CO. LIMITED
北京中關村科技(香港)有限公司",1999-11-17,2012-11-23,"Private, ltd by shares"15,0694820,"BEST GATEWAY INTERNATIONAL LIMITED (d2003-03-28)
冠一環球有限公司",1999-11-17,2003-03-28,"Private, ltd by shares"16,0694981,"BEST RICH PROPERTY AGENCY LIMITED
富佳地產有限公司",1999-11-17,2010-01-29,"Private, ltd by shares"17,0694745,"BEST RICHEST LIMITED
佳焯有限公司",1999-11-17,2006-04-13,"Private, ltd by shares"18,0694999,"BEST SMART HOLDINGS LIMITED
百俊集團有限公司",1999-11-17,,"Private, ltd by shares"19,0694803,"BIG RED TRIANGLE COMPANY (H.K.) LIMITED (THE)",1999-11-17,2001-04-06,"Private, ltd by shares"20,0694875,"BILLION NEW LIMITED
新萬有限公司",1999-11-17,2019-10-04,"Private, ltd by shares"21,0694851,"BILLION PLANNER DEVELOPMENT LIMITED
億明發展有限公司",1999-11-17,,"Private, ltd by shares"22,0694966,"BILLION SUMMIT ASIA LIMITED
億峰亞洲有限公司",1999-11-17,2006-04-13,"Private, ltd by shares"23,0694885,"BRIGHTEN GLASS &amp; METAL WORKS LIMITED
新鴻泰玻璃金屬工程有限公司",1999-11-17,2003-09-05,"Private, ltd by shares"24,0694780,"BROADWISE PRESS CORPORATION LIMITED
博滙智訊有限公司",1999-11-17,2005-04-22,"Private, ltd by shares"25,0694928,"CALEB ENTERPRISE LIMITED
嘉納企業有限公司",1999-11-17,,"Private, ltd by shares"26,0694775,"CAMPUS ONLINE LIMITED (d2006-03-25)
校園在線有限公司",1999-11-17,2006-03-25,"Private, ltd by shares"27,0694855,"CANDOUR MOTORS COMPANY LIMITED
駿傑汽車有限公司",1999-11-17,2008-02-15,"Private, ltd by shares"28,0694899,"CARR LIMITED
加來有限公司",1999-11-17,2008-03-20,"Private, ltd by shares"29,0694878,"CH INDUSTRIES LIMITED (d2006-08-11)
知行國際有限公司",1999-11-17,2006-08-11,"Private, ltd by shares"30,0694853,"CHANCELLOR INTERNATIONAL LIMITED
昌盛隆國際有限公司",1999-11-17,2008-03-28,"Private, ltd by shares"31,0694979,"CHARMTEX LIMITED (d2012-02-03)
彩迪有限公司",1999-11-17,2012-02-03,"Private, ltd by shares"32,0694884,"CHE WUI PROPERTY AGENCY LIMITED
浙滙物業代理有限公司",1999-11-17,2004-05-14,"Private, ltd by shares"33,0694972,"CHI SHING GEM JEWELRY LIMITED
智成晶石首飾有限公司",1999-11-17,,"Private, ltd by shares"34,0694921,"CHIEF INTERIOR CONTRACTING LIMITED
致毅室內裝飾工程有限公司",1999-11-17,,"Private, ltd by shares"35,0694800,"CHINA BRIGHT GROUP CO. LIMITED
華興創控股有限公司",1999-11-17,,"Private, ltd by shares"36,0694874,"CHINA CRYSTAL INTERNATIONAL LIMITED (d2003-04-25)
中晶國際有限公司",1999-11-17,2003-04-25,"Private, ltd by shares"37,0694893,"CHINA GREEN ENVIRONMENTAL PROTECTION EQUIPMENTS INTERNATIONAL LIMITED
中綠環保設備國際有限公司",1999-11-17,2002-07-19,"Private, ltd by shares"38,0694982,"CHINA MODERN METAL LIMITED
中洋金屬製品有限公司",1999-11-17,2006-07-14,"Private, ltd by shares"39,0694755,"CHINA POTATOPAK COMPANY LIMITED",1999-11-17,2012-12-07,"Private, ltd by shares"40,0694794,"CHINA SYNERGY PROGRAMME FOR OUTSTANDING YOUTH LIMITED
海外傑青匯中華有限公司",1999-11-17,,"Ltd by guarantee"41,0694887,"CHINAEURO CONSULT LIMITED",1999-11-17,,"Private, ltd by shares"42,0694771,"CITY GOLF CLUB LIMITED",1999-11-17,2010-11-19,"Private, ltd by shares"43,0694751,"CITY PLANNER INTERNATIONAL LIMITED
怡港國際有限公司",1999-11-17,2009-01-09,"Private, ltd by shares"44,0694789,"CNI INTERNATIONAL LIMITED
益顧國際有限公司",1999-11-17,2015-09-18,"Private, ltd by shares"45,0694739,"CONNECT INC. (INDUSTRIES) LIMITED",1999-11-17,,"Private, ltd by shares"46,0694920,"COSMODE (H.K.) LIMITED
衆城(香港)有限公司",1999-11-17,,"Private, ltd by shares"47,0694956,"CREATIVE FORUM COMPANY LIMITED
創意堂有限公司",1999-11-17,2007-07-13,"Private, ltd by shares"48,0694897,"CST ELECTRONICS COMPANY LIMITED
思泰電子有限公司",1999-11-17,,"Private, ltd by shares"49,0694932,"CYBER CONSULTANTS LIMITED (d2012-04-05)
嘉銘顧問有限公司",1999-11-17,2012-04-05,"Private, ltd by shares"50,0694944,"CYBERWEALTH INTERNATIONAL LIMITED
富采國際有限公司",1999-11-17,,"Private, ltd by shares"51,0694838,"DORFOSS CORPORATION LIMITED
盈鎰企業有限公司",1999-11-17,2006-04-13,"Private, ltd by shares"52,0694877,"DRAGON GLORY LIMITED (d2012-06-08)
龍輝有限公司",1999-11-17,2012-06-08,"Private, ltd by shares"53,0694852,"DRAGON RICHEST DEVELOPMENT LIMITED
龍高發展有限公司",1999-11-17,2013-10-04,"Private, ltd by shares"54,0694748,"DRAGON VICTORY TRADING LIMITED (d2011-06-03)
龍輝貿易有限公司",1999-11-17,2011-06-03,"Private, ltd by shares"55,0694832,"DRAGON WINNER (HONG KONG) LIMITED
駿龍(香港)有限公司",1999-11-17,2007-06-22,"Private, ltd by shares"56,0694859,"DTF (H.K.) LIMITED",1999-11-17,,"Private, ltd by shares"57,0694790,"DURAN INTERNATIONAL CHEMICAL (CHINA) CO. LIMITED
杜然國際化工(中國)有限公司",1999-11-17,,"Private, ltd by shares"58,0694822,"E-FREE DEVELOPMENT COMPANY LIMITED
皜山發展有限公司",1999-11-17,2004-04-23,"Private, ltd by shares"59,0694892,"E-SOLUTIONS TECHNOLOGY LIMITED (d2002-02-22)
意訊科技有限公司",1999-11-17,2002-02-22,"Private, ltd by shares"60,0694976,"E.COM CONSULTING LIMITED",1999-11-17,2002-06-07,"Private, ltd by shares"61,0694894,"ECAMPUS LIMITED
易學有限公司",1999-11-17,2012-09-14,"Private, ltd by shares"62,0694783,"ECO (HONG KONG) COMPANY LIMITED
伊高(香港)有限公司",1999-11-17,2014-04-17,"Private, ltd by shares"63,0694858,"ECOM PUBLISHING LIMITED
易通出版有限公司",1999-11-17,2006-04-13,"Private, ltd by shares"64,0694792,"EM'S CONCEPT INTERNATIONAL LIMITED",1999-11-17,2006-04-13,"Private, ltd by shares"65,0694997,"Emperor Precious Metals Holdings Limited
英皇貴金屬控股有限公司",1999-11-17,,"Private, ltd by shares"66,0694845,"ENTIRE MEDICAL &amp; DENTAL CENTRE LIMITED
綜合醫護服務有限公司",1999-11-17,2011-04-21,"Private, ltd by shares"67,0694957,"EPG (CHINA) LIMITED
易普集(中國)有限公司",1999-11-17,2016-02-05,"Private, ltd by shares"68,0694994,"ESTEC ELECTRONICS COMPANY LIMITED",1999-11-17,2013-06-07,"Private, ltd by shares"69,0694793,"ETS WOLF SA &amp; CIE (ASIA) LIMITED
和富仕有限公司",1999-11-17,2010-05-28,"Private, ltd by shares"70,0694773,"EURO WATCH GALLERY CO. LIMITED
歐洲錶坊有限公司",1999-11-17,2007-07-09,"Private, ltd by shares"71,0694967,"EVERSKY LIMITED (d2006-04-13)
天恒行有限公司",1999-11-17,2006-04-13,"Private, ltd by shares"72,0694810,"EWCT LIMITED (d2014-05-23)",1999-11-17,2014-05-23,"Private, ltd by shares"73,0694808,"EXCEL SUCCESS ENGINEERING LIMITED
卓成工程有限公司",1999-11-17,2006-09-01,"Private, ltd by shares"74,0694854,"EXCELLENCE KNITTING LIMITED
卓越織造有限公司",1999-11-17,2004-03-12,"Private, ltd by shares"75,0694941,"EXCELLENT GROUP TRADING LIMITED (d2003-06-27)
康群貿易有限公司",1999-11-17,2003-06-27,"Private, ltd by shares"76,0694998,"FANCY INDUSTRIAL LIMITED (d2003-07-18)
弘興實業有限公司",1999-11-17,2003-07-18,"Private, ltd by shares"77,0694922,"FASTER COMMERCIAL SERVICES LIMITED
快達商業服務有限公司",1999-11-17,2006-04-13,"Private, ltd by shares"78,0694754,"FLARE STAR TRAVEL SERVICE LIMITED
耀星旅遊有限公司",1999-11-17,2005-01-28,"Private, ltd by shares"79,0694812,"FLASH PACKET TECHNOLOGY LIMITED",1999-11-17,2001-07-20,"Private, ltd by shares"80,0694952,"FLORENCE ENTERPRISE LIMITED
科森企業有限公司",1999-11-17,2015-09-04,"Private, ltd by shares"81,0694888,"FOREVER PROFIT INVESTMENT LIMITED
盈恒投資有限公司",1999-11-17,,"Private, ltd by shares"82,0694827,"FOREVER RICHEST LIMITED (d2003-05-16)
卓裕行有限公司",1999-11-17,2003-05-16,"Private, ltd by shares"83,0695003,"FORTUNE MATE BUILDING MATERIALS COMPANY LIMITED
美順建築材料有限公司",1999-11-17,2019-03-15,"Private, ltd by shares"84,0694987,"FOSTERS COMPANY LIMITED
科多有限公司",1999-11-17,2010-04-23,"Private, ltd by shares"85,0694766,"FUNG LIN WAH GROUP LIMITED
豐年華集團有限公司",1999-11-17,,"Private, ltd by shares"86,0694817,"GALAXY INCORPORATION LIMITED
銀河國際有限公司",1999-11-17,2005-10-28,"Private, ltd by shares"87,0694762,"GLOBAL CONCEPT INVESTMENT LIMITED
環球概念投資有限公司",1999-11-17,2014-02-28,"Private, ltd by shares"88,0694763,"GLOBAL UNIVERSAL LIMITED (d2006-04-13)
環球世界有限公司",1999-11-17,2006-04-13,"Private, ltd by shares"89,0694765,"GLOBAL.COM LIMITED
環球網絡有限公司",1999-11-17,,"Private, ltd by shares"90,0694968,"GLOBALINK ASIA LIMITED
世聯亞洲有限公司",1999-11-17,2005-02-04,"Private, ltd by shares"91,0694848,"GOLD CITY INDUSTRIAL LIMITED
金域實業有限公司",1999-11-17,2011-12-02,"Private, ltd by shares"92,0694954,"GOLDEN FIELD INVESTMENT (HONG KONG) LIMITED
金田投資(香港)有限公司",1999-11-17,,"Private, ltd by shares"93,0694842,"GOLDEN HARVEST INTERNATIONAL ENTERPRISES LIMITED
豐盈國際企業有限公司",1999-11-17,,"Private, ltd by shares"94,0694807,"GOLDEN SEA ENGINEERING LIMITED
金海工程有限公司",1999-11-17,2001-04-12,"Private, ltd by shares"95,0694915,"GOLDMAN CONSULTANTS LIMITED (d2009-10-02)
金興顧問有限公司",1999-11-17,2009-10-02,"Private, ltd by shares"96,0694750,"GOLF WORLD INTERNATIONAL LIMITED
高球國際有限公司",1999-11-17,2002-11-22,"Private, ltd by shares"97,0694869,"GOODEVER INTERNATIONAL LIMITED (d2001-11-16)
晉利國際有限公司",1999-11-17,2001-11-16,"Private, ltd by shares"98,0695009,"GRACE SHEEN (FAR EAST) LIMITED
悅順(遠東)有限公司",1999-11-17,2006-04-13,"Private, ltd by shares"99,0695006,"GRAND FORTUNE TECHNOLOGY LIMITED
宏富科技有限公司",1999-11-17,2003-05-09,"Private, ltd by shares"100,0694764,"GREAT KING (HONG KONG) LIMITED (d2006-04-13)
大中華(香港)有限公司",1999-11-17,2006-04-13,"Private, ltd by shares"101,0694969,"GREAT SCENE LIMITED
偉境有限公司",1999-11-17,2003-05-02,"Private, ltd by shares"102,0694870,"GREAT WELL 2000 LIMITED
大華2000有限公司",1999-11-17,,"Private, ltd by shares"103,0694945,"GREAT YEAR CONSULTANTS LIMITED
安年顧問有限公司",1999-11-17,2007-03-30,"Private, ltd by shares"104,0694911,"GREENFIELD DEVELOPMENT LIMITED
展暉發展有限公司",1999-11-17,2002-05-17,"Private, ltd by shares"105,0694900,"GREENSBOROUGH LIMITED
格力寶有限公司",1999-11-17,2015-04-10,"Private, ltd by shares"106,0694758,"GREENSTAR TECHNOLOGY LIMITED (d2002-12-06)
輝達科技有限公司",1999-11-17,2002-12-06,"Private, ltd by shares"107,0694942,"GROUP VANTAGE HOLDINGS LIMITED
集成集團有限公司",1999-11-17,,"Private, ltd by shares"108,0694798,"GUANGDONG TIANHE (HONG KONG) LIMITED
廣東天河(香港)有限公司",1999-11-17,2019-02-15,"Private, ltd by shares"109,0694880,"H.K. COMPUTER TECHNOLOGY LIMITED
香港電腦科技有限公司",1999-11-17,2017-09-22,"Private, ltd by shares"110,0694799,"H2OIL CORPORATION (H.K.) LIMITED
微爆科技集團有限公司",1999-11-17,2006-04-13,"Private, ltd by shares"111,0694778,"HANG SHING METAL PRODUCTS COMPANY LIMITED
恒勝金屬制品有限公司",1999-11-17,2011-12-02,"Private, ltd by shares"112,0694929,"HEALTH SUPPLEMENT ASIA LIMITED
雅仕亞洲有限公司",1999-11-17,2008-09-26,"Private, ltd by shares"113,0694786,"HEMEN INTERNATIONAL CORPORATION LIMITED
海門國際有限公司",1999-11-17,,"Private, ltd by shares"114,0694804,"HING LAI FASHION WHOLESALE LIMITED
興麗時裝批發有限公司",1999-11-17,2011-03-11,"Private, ltd by shares"115,0694767,"HKU-PASTEUR RESEARCH CENTRE LIMITED
香港大學－巴斯德研究中心有限公司",1999-11-17,,"Ltd by guarantee"116,0694805,"HON DING PHARMACEUTICS LIMITED
漢定藥業有限公司",1999-11-17,,"Private, ltd by shares"117,0694995,"HONG KONG MENG QI FASHION DEVELOPMENT LIMITED
香港蒙琪時裝發展有限公司",1999-11-17,2006-04-13,"Private, ltd by shares"118,0694839,"HONG KONG SHIPS SUPPLIES CO., LIMITED
香港輪船用品有限公司",1999-11-17,,"Private, ltd by shares"119,0694840,"HONG KONG WILL JOINS INTERNATIONAL INVESTMENT DEVELOPMENT LIMITED
香港韋而津時國際投資發展有限公司",1999-11-17,2006-04-13,"Private, ltd by shares"120,0694801,"HONG KONG XIDUOLI INDUSTRIAL LIMITED
香港喜多利實業有限公司",1999-11-17,2006-04-13,"Private, ltd by shares"121,0694847,"HONG KONG ZHENGZEXIANG INDUSTRIAL DEV. LIMITED
香港正澤祥實業發展有限公司",1999-11-17,,"Private, ltd by shares"122,0695007,"HONOR LINK TECHNOLOGY LIMITED
鴻軒科技有限公司",1999-11-17,,"Private, ltd by shares"123,0694756,"HOWSON ASSOCIATES LIMITED",1999-11-17,2006-04-13,"Private, ltd by shares"124,0694913,"HRC LINK LIMITED",1999-11-17,2003-08-08,"Private, ltd by shares"125,0694819,"HUA QIAO CONSTRUCTION ENGINEERING LIMITED
華僑建築工程有限公司",1999-11-17,,"Private, ltd by shares"126,0694879,"I LAND HK LIMITED",1999-11-17,2002-07-19,"Private, ltd by shares"127,0694904,"I.R. &amp; S. GROUP LIMITED",1999-11-17,2016-07-15,"Private, ltd by shares"128,0694809,"IENET.NET LIMITED",1999-11-17,2004-07-23,"Private, ltd by shares"129,0694959,"iLex Holdings Co., Limited
華愷控股有限公司",1999-11-17,2018-09-14,"Private, ltd by shares"130,0694933,"INFRO TECHNOLOGY LIMITED
港建科技有限公司",1999-11-17,2008-03-28,"Private, ltd by shares"131,0695000,"INNOVISION GROUP LIMITED (d2012-05-18)
喬新有限公司",1999-11-17,2012-05-18,"Private, ltd by shares"132,0694907,"INTELLIGENT ENGINEERING LIMITED (d2008-03-28)
欣備利智能工程有限公司",1999-11-17,2008-03-28,"Private, ltd by shares"133,0694988,"IVANHOC LIMITED
勳豪有限公司",1999-11-17,,"Private, ltd by shares"134,0694924,"JAPAN BEAUTY CONSULTANT COMPANY LIMITED",1999-11-17,2006-04-13,"Private, ltd by shares"135,0694901,"JOHNSTONE LIMITED (d2009-09-29)
莊雄有限公司",1999-11-17,2009-09-29,"Private, ltd by shares"136,0694946,"JOY &amp; PEACE ENERGY INVESTMENTS LIMITED
嘉欣能源投資有限公司",1999-11-17,,"Private, ltd by shares"137,0694813,"K B S JEWELLERY DESIGN LIMITED",1999-11-17,2002-02-01,"Private, ltd by shares"138,0694916,"KAILOON ENTERPRISES COMPANY LIMITED
啟龍企業有限公司",1999-11-17,2008-04-25,"Private, ltd by shares"139,0694791,"KAIXIN INTERNATIONAL (HK) LIMITED
佳信國際(香港)有限公司",1999-11-17,,"Private, ltd by shares"140,0694896,"KEE JIA (HONG KONG) WOOD CO., LIMITED
香港可佳木業有限公司",1999-11-17,2011-08-05,"Private, ltd by shares"141,0694787,"KEVIN HOLDINGS LIMITED (d2009-04-17)
加宏控股有限公司",1999-11-17,2009-04-17,"Private, ltd by shares"142,0694866,"KIN MING CONSTRUCTION (HK) COMPANY LIMITED
建銘建築有限公司",1999-11-17,2006-04-13,"Private, ltd by shares"143,0694955,"KINGSBORO INVESTMENT LIMITED
百邦投資有限公司",1999-11-17,2005-02-04,"Private, ltd by shares"144,0694905,"KWOK SAU INDUSTRIAL LIMITED",1999-11-17,2006-04-13,"Private, ltd by shares"145,0694962,"KWONG YING SCAFFOLDING COMPANY LIMITED
廣英棚業工程有限公司",1999-11-17,2010-02-26,"Private, ltd by shares"146,0694980,"KWONG'S COMICS LIMITED
鄺氏漫畫有限公司",1999-11-17,,"Private, ltd by shares"147,0694891,"LAI MING DESIGN &amp; INTERIOR COMPANY LIMITED
麗明設計工程有限公司",1999-11-17,2006-05-26,"Private, ltd by shares"148,0694989,"LANGLEE LIMITED (d2010-05-07)
量利有限公司",1999-11-17,2010-05-07,"Private, ltd by shares"149,0694930,"LE GAVROCHE LIMITED (d2002-05-24)",1999-11-17,2002-05-24,"Private, ltd by shares"150,0694760,"LEADWAY TECHNOLOGY CORPORATION LIMITED
領光科技(集團)有限公司",1999-11-17,2016-02-19,"Private, ltd by shares"151,0694844,"LEO INTERNATIONAL DEVELOPMENT LIMITED
利澳國際發展有限公司",1999-11-17,2009-04-03,"Private, ltd by shares"152,0694951,"LINK RESOURCES LIMITED (d2004-11-26)
寶磊有限公司",1999-11-17,2004-11-26,"Private, ltd by shares"153,0694984,"LOLLYLOTS LIMITED",1999-11-17,2011-12-02,"Private, ltd by shares"154,0694868,"LONG VIEW ASIA LIMITED
璟豐亞洲有限公司",1999-11-17,2005-10-07,"Private, ltd by shares"155,0694978,"LUCKY WAY ENTERPRISES LIMITED
利永企業有限公司",1999-11-17,,"Private, ltd by shares"156,0694753,"LUEN HING SHING RESOURCES LIMITED
聯興盛資源有限公司",1999-11-17,2014-07-04,"Private, ltd by shares"157,0694788,"MACD LIMITED (d2003-03-28)",1999-11-17,2003-03-28,"Private, ltd by shares"158,0694759,"MAIN POWER LIGHTING MFG COMPANY LIMITED
美威燈飾有限公司",1999-11-17,2013-01-18,"Private, ltd by shares"159,0694782,"MAO YUEN INTERNATIONAL INVESTMENT (HOLDING) LIMITED
茂源國際投資(集團)有限公司",1999-11-17,2007-03-30,"Private, ltd by shares"160,0694917,"MAXLIFE INDUSTRIAL LIMITED
鉅生實業有限公司",1999-11-17,2006-07-21,"Private, ltd by shares"161,0694761,"MEDIA GENESIS LIMITED",1999-11-17,,"Private, ltd by shares"162,0694881,"MEGATEC ASIA TECHNOLOGY LIMITED
文達亞洲科技有限公司",1999-11-17,2006-04-13,"Private, ltd by shares"163,0694909,"MERRYLAND CORPORATION LIMITED
美簾有限公司",1999-11-17,2018-06-22,"Private, ltd by shares"164,0694961,"Metamind Limited
邁達意有限公司",1999-11-17,,"Private, ltd by shares"165,0694738,"MIC CO., LIMITED",1999-11-17,2007-03-30,"Private, ltd by shares"166,0694781,"MILLENNIUM HARBOUR LIMITED",1999-11-17,2018-03-09,"Private, ltd by shares"167,0694830,"MILLION BEST (HONG KONG) LIMITED
萬業(香港)有限公司",1999-11-17,2014-05-30,"Private, ltd by shares"168,0694912,"MILLION TREASURE ENTERPRISE LIMITED (d2004-01-16)
億茂企業有限公司",1999-11-17,2004-01-16,"Private, ltd by shares"169,0694898,"MILLRACE MANUFACTURING COMPANY LIMITED (THE)",1999-11-17,2006-04-13,"Private, ltd by shares"170,0694823,"MING CHIU COMPANY LIMITED
明釗有限公司",1999-11-17,2002-11-01,"Private, ltd by shares"171,0694902,"MINGA LIMITED (d2007-04-20)
冕雅有限公司",1999-11-17,2007-04-20,"Private, ltd by shares"172,0694919,"NAMTI HOLDINGS LIMITED",1999-11-17,2004-07-23,"Private, ltd by shares"173,0694821,"NEW MILLENNIUM INVESTMENT LIMITED
千禧年投資有限公司",1999-11-17,,"Private, ltd by shares"174,0694837,"NOBLE PACIFIC INTERNATIONAL LIMITED
卓海國際有限公司",1999-11-17,2001-09-21,"Private, ltd by shares"175,0694784,"NORTH SHORE INTERNATIONAL LIMITED (HK)",1999-11-17,,"Private, ltd by shares"176,0694906,"OCEAN FINE ENTERPRISES CORP. LIMITED
泛海企業有限公司",1999-11-17,,"Private, ltd by shares"177,0694938,"ONFAITH INTERNATIONAL LIMITED
安鷹國際有限公司",1999-11-17,2005-08-19,"Private, ltd by shares"178,0694826,"ORIENTALIA TRADING LIMITED",1999-11-17,2006-04-13,"Private, ltd by shares"179,0694949,"ORIGINS LIMITED (d2008-02-06)
讚新有限公司",1999-11-17,2008-02-06,"Private, ltd by shares"180,0694865,"PACIFIC ONE NET LIMITED
一寬頻有限公司",1999-11-17,,"Private, ltd by shares"181,0694849,"PACKAPHARMA LIMITED
百佳藥業有限公司",1999-11-17,2011-12-02,"Private, ltd by shares"182,0694768,"PDASIA LIMITED
掌中華有限公司",1999-11-17,,"Private, ltd by shares"183,0694936,"PEAK INVESTMENT LIMITED (d2007-06-22)
浪濤投資有限公司",1999-11-17,2007-06-22,"Private, ltd by shares"184,0694975,"PERFECT LINK GLOBAL CONSULTANTS LIMITED
聯通環球顧問有限公司",1999-11-17,,"Private, ltd by shares"185,0694908,"PERFECT MORE ADVERTISING LIMITED
比華利廣告有限公司",1999-11-17,,"Private, ltd by shares"186,0694861,"Petzup Laboratories Limited",1999-11-17,,"Private, ltd by shares"187,0694973,"PING WING TRANSPORTATION LIMITED
炳榮運輸有限公司",1999-11-17,2012-05-25,"Private, ltd by shares"188,0694740,"POINT (INT'L) HIGH-LEVEL EQUIPMENT CO., LIMITED
普英特(國際)高層設備有限公司",1999-11-17,2006-04-13,"Private, ltd by shares"189,0695005,"POLY EXPAND (HONG KONG) LIMITED
百展(香港)有限公司",1999-11-17,,"Private, ltd by shares"190,0694996,"POS (CHINA) NEW TECHNOLOGY HOLDING LIMITED
普斯(中國)新技術控股有限公司",1999-11-17,2007-03-30,"Private, ltd by shares"191,0694977,"POWER LOGIC LIMITED (d2007-12-14)
權榮有限公司",1999-11-17,2007-12-14,"Private, ltd by shares"192,0694923,"PRECISION PUBLISHING LIMITED (d2009-05-13)",1999-11-17,2009-05-13,"Private, ltd by shares"193,0694986,"PRESSURE SENSOR LIMITED
感應科技有限公司",1999-11-17,,"Private, ltd by shares"194,0694948,"PROFIT PRINCIPLE LIMITED
凱聯有限公司",1999-11-17,,"Private, ltd by shares"195,0694970,"REAL LEGEND LIMITED (d2002-01-18)
真銘有限公司",1999-11-17,2002-01-18,"Private, ltd by shares"196,0694797,"RELIANCETEK ENGINEERING COMPANY LIMITED
保海科技有限公司",1999-11-17,2002-11-22,"Private, ltd by shares"197,0694965,"RICH UNION LIMITED (d2002-10-11)
聯富行有限公司",1999-11-17,2002-10-11,"Private, ltd by shares"198,0694863,"ROSBUCK LIMITED",1999-11-17,2006-04-13,"Private, ltd by shares"199,0694960,"ROTOSALE INTERNATIONAL LIMITED",1999-11-17,,"Private, ltd by shares"200,0694939,"ROXY HONG KONG LIMITED
樂怡香港有限公司",1999-11-17,,"Private, ltd by shares"201,0694850,"ROYAL BASE DEVELOPMENT LIMITED
明基發展有限公司",1999-11-17,2002-08-30,"Private, ltd by shares"202,0694746,"ROYAL WEALTH ENTERPRISES LIMITED
利昇企業有限公司",1999-11-17,2010-07-30,"Private, ltd by shares"203,0694815,"SAN ENTERPRISES CO., LIMITED",1999-11-17,2006-04-28,"Private, ltd by shares"204,0694872,"SANYA SUNNY BAY DEVELOPMENT COMPANY LIMITED
三亞太陽灣開發有限公司",1999-11-17,2005-04-15,"Private, ltd by shares"205,0694867,"SEA COAST INTERNATIONAL TRADING LIMITED
海岸國際貿易有限公司",1999-11-17,,"Private, ltd by shares"206,0694925,"SEEDNET IT SOLUTIONS LIMITED
思絡聯網策略有限公司",1999-11-17,2004-06-25,"Private, ltd by shares"207,0694926,"SEGE COMPANY LIMITED",1999-11-17,2003-11-07,"Private, ltd by shares"208,0694862,"SELITE HONG KONG LIMITED
立緬香港有限公司",1999-11-17,,"Private, ltd by shares"209,0695002,"SHEEN HARVEST (FAR EAST) LIMITED
豐順(遠東)有限公司",1999-11-17,,"Private, ltd by shares"210,0694953,"SINO-HONG KONG CHINESE MEDICINE SPECIALTY CLINIC LIMITED
京港中醫專科診所有限公司",1999-11-17,2006-12-15,"Private, ltd by shares"211,0694836,"SKY FOCUS INVESTMENT LIMITED
天鴻投資有限公司",1999-11-17,2008-03-14,"Private, ltd by shares"212,0694785,"SKY PLAY (H.K.) COMPANY LIMITED
明翔(香港)有限公司",1999-11-17,,"Private, ltd by shares"213,0694833,"SKY WELL ENTERPRISES LIMITED (d2004-11-19)
天運企業有限公司",1999-11-17,2004-11-19,"Private, ltd by shares"214,0694971,"SKYLINE ASIA LIMITED
盈天亞洲有限公司",1999-11-17,,"Private, ltd by shares"215,0695010,"SMART &amp; WELL EMBROIDERY LIMITED
萬利綉花有限公司",1999-11-17,,"Private, ltd by shares"216,0694741,"SMART EXPERT LIMITED (d2010-05-28)
俊仕有限公司",1999-11-17,2010-05-28,"Private, ltd by shares"217,0694806,"SMART LEADER ENGINEERING LIMITED (d2001-03-30)
俊裕工程有限公司",1999-11-17,2001-03-30,"Private, ltd by shares"218,0694950,"SMART MEDIA LIMITED (d2005-07-29)
聰雅有限公司",1999-11-17,2005-07-29,"Private, ltd by shares"219,0694835,"SMART TECH INTERNATIONAL INVESTMENT COMPANY LIMITED
東成國際投資有限公司",1999-11-17,2008-03-14,"Private, ltd by shares"220,0694991,"SMARTECH (H.K.) LIMITED (d2002-05-17)
量子科技有限公司",1999-11-17,2002-05-17,"Private, ltd by shares"221,0694934,"SPD HK LIMITED",1999-11-17,2011-10-21,"Private, ltd by shares"222,0694856,"SPEED LOGISTICS LIMITED (HK)
富溢貨運有限公司",1999-11-17,,"Private, ltd by shares"223,0694831,"SPEED WIN (HONG KONG) LIMITED
迅裕(香港)有限公司",1999-11-17,2001-11-16,"Private, ltd by shares"224,0694772,"SPLENDID INDUSTRIAL LIMITED (d2001-04-12)
榮樟製品有限公司",1999-11-17,2001-04-12,"Private, ltd by shares"225,0694834,"STAR WEALTH ENTERPRISES LIMITED
星裕企業有限公司",1999-11-17,,"Private, ltd by shares"226,0695001,"STARCET INTERNATIONAL LIMITED",1999-11-17,,"Private, ltd by shares"227,0694825,"STEBILE COMPANY LIMITED
斯貝爾有限公司",1999-11-17,2005-01-14,"Private, ltd by shares"228,0694776,"STONE ART LIMITED (HK)
石藝軒有限公司",1999-11-17,,"Private, ltd by shares"229,0694857,"SUCSTART CO., LIMITED
堅新機械股份有限公司",1999-11-17,2007-07-06,"Private, ltd by shares"230,0694777,"T &amp; P PROPERTY AGENCY COMPANY LIMITED
金利行物業代理有限公司",1999-11-17,,"Private, ltd by shares"