,Reg no.,Name,Incorp-orated,Dissolved,Type231,0694779,"TAK SHUN HONG (H.K.) COMPANY LIMITED
香港得信行有限公司",1999-11-17,,"Private, ltd by shares"232,0694757,"TENZAN PRODUCTIONS LIMITED
天山制作有限公司",1999-11-17,,"Private, ltd by shares"233,0694828,"TESCOM HONG KONG TRADING LIMITED",1999-11-17,,"Private, ltd by shares"234,0694816,"TINY WORLD INDUSTRIAL COMPANY LIMITED
添禧實業有限公司",1999-11-17,2008-08-08,"Private, ltd by shares"235,0694963,"TOP CYBER ASIA LIMITED
盈科亞洲有限公司",1999-11-17,,"Private, ltd by shares"236,0694914,"TOPMAGIC INTERNATIONAL LIMITED
高智國際有限公司",1999-11-17,2002-12-27,"Private, ltd by shares"237,0694864,"TOPSTARS ADVERTISING (HK) LIMITED
鼎盛廣告(香港)有限公司",1999-11-17,,"Private, ltd by shares"238,0694770,"TOWNGAS INVESTMENT COMPANY LIMITED
煤氣投資有限公司",1999-11-17,,"Private, ltd by shares"239,0694883,"TRAMAT CO. LIMITED",1999-11-17,2003-03-28,"Private, ltd by shares"240,0694937,"TRANSWORLD CONSULTANTS LIMITED (d2002-11-29)
縱橫顧問有限公司",1999-11-17,2002-11-29,"Private, ltd by shares"241,0694974,"TREASURE KITCHEN DESIGN COMPANY LIMITED
敦煌櫥櫃設計有限公司",1999-11-17,,"Private, ltd by shares"242,0694882,"TREASURE-GLORY MANUFACTURING LIMITED
華寶中港合營製衣有限公司",1999-11-17,,"Private, ltd by shares"243,0694935,"TRI-CONNECTION LIMITED
訊盛有限公司",1999-11-17,2011-12-02,"Private, ltd by shares"244,0694993,"TRIO INT'L (HK) LIMITED
中洲國際(香港)有限公司",1999-11-17,,"Private, ltd by shares"245,0694990,"TUNG FAT GARMENT TRADING COMPANY LIMITED
同發製衣貿易有限公司",1999-11-17,2006-11-17,"Private, ltd by shares"246,0694895,"TUTTESTETICA (H.K.) LIMITED
全美(香港)有限公司",1999-11-17,2007-07-27,"Private, ltd by shares"247,0694985,"ULTRANS CARGO EXPRESS COMPANY LIMITED
優擇貨運有限公司",1999-11-17,2003-05-16,"Private, ltd by shares"248,0694889,"UNIONATIONAL LOGISTICS (CHINA) LIMITED
滙怡貨運(中國)有限公司",1999-11-17,2012-11-16,"Private, ltd by shares"249,0694958,"UNITEC ELECTRONIC COMPANY LIMITED
滙科電子有限公司",1999-11-17,2008-03-28,"Private, ltd by shares"250,0694931,"UNITED APPAREL CO LIMITED
聯合服裝有限公司",1999-11-17,,"Private, ltd by shares"251,0695008,"UNITED OCEAN INDUSTRIAL LIMITED
裕洋實業有限公司",1999-11-17,,"Private, ltd by shares"252,0694983,"USA FREIGHTER BASING LIMITED",1999-11-17,2004-01-21,"Private, ltd by shares"253,0694871,"VICTORY 2000 LIMITED
大昌2000有限公司",1999-11-17,,"Private, ltd by shares"254,0694927,"WAH KEE VEGETABLE WHOLESALE COMPANY LIMITED
華記蔬菜有限公司",1999-11-17,2005-02-04,"Private, ltd by shares"255,0694749,"WAPMAN LIMITED",1999-11-17,2006-04-13,"Private, ltd by shares"256,0694873,"WEALTH 2000 LIMITED (d2009-04-03)
世發2000有限公司",1999-11-17,2009-04-03,"Private, ltd by shares"257,0694943,"WEBWIDE INTERNATIONAL LIMITED
浩緯國際有限公司",1999-11-17,2008-03-28,"Private, ltd by shares"258,0694964,"WIDE SUMMIT LIMITED
廣山有限公司",1999-11-17,2006-04-13,"Private, ltd by shares"259,0694876,"WIDEWAY LIMITED (d2002-03-01)
廣惠有限公司",1999-11-17,2002-03-01,"Private, ltd by shares"260,0694846,"WILSON &amp; WONG DEVELOPMENT LIMITED
偉信行貿易發展有限公司",1999-11-17,,"Private, ltd by shares"261,0694947,"WINELIGHT LIMITED
倍盛有限公司",1999-11-17,2005-01-14,"Private, ltd by shares"262,0694940,"WING FUNG FINANCIAL GROUP LIMITED
永豐金融集團有限公司",1999-11-17,,"Private, ltd by shares"263,0694743,"WINNER CHANCE LIMITED (d2011-04-15)
陞昌有限公司",1999-11-17,2011-04-15,"Private, ltd by shares"264,0694829,"WORLDWIDE CITY LIMITED
煌億有限公司",1999-11-17,2005-02-04,"Private, ltd by shares"265,0694742,"WORLDWIDE TALENT LIMITED
綽進有限公司",1999-11-17,,"Private, ltd by shares"266,0694737,"WTC CURTAIN SUPPLIERS LIMITED
永泰祥窗簾工程有限公司",1999-11-17,,"Private, ltd by shares"267,0694992,"XINHUA FINANCIAL NETWORK LIMITED
新華財經有限公司",1999-11-17,,"Private, ltd by shares"268,0694774,"Y5Zone Limited",1999-11-17,,"Private, ltd by shares"269,0694752,"YAT FUNG (GIFT) COMPANY LIMITED
溢鋒(精品)有限公司",1999-11-17,2001-05-25,"Private, ltd by shares"270,0694890,"YOU MING XIAN TRADING (HONG KONG) COMPANY LIMITED
侑明鮮貿易(香港)有限公司",1999-11-17,2006-04-13,"Private, ltd by shares"271,0694918,"ZENKO PHARMACEUTICAL (HK) LIMITED
盈高藥業(香港)有限公司",1999-11-17,2006-03-24,"Private, ltd by shares"272,0694814,"ZHAOGUAN GLASS LIMITED
兆冠玻璃有限公司",1999-11-17,,"Private, ltd by shares"273,0694796,"ZHONG YING INTERNATIONAL DEVELOPMENT LIMITED
中盈國際發展有限公司",1999-11-17,2006-03-03,"Private, ltd by shares"274,0694824,"ZHONGSHAN &amp; HONGKONG SANDSTONES CO., LIMITED
中港砂石有限公司",1999-11-17,2014-05-23,"Private, ltd by shares"