,Reg no.,Name,Incorp-orated,Dissolved,Type227,1672609,"Keona Limited (d2013-08-02)",2011-10-18,2013-08-02,"Private, ltd by shares"228,1672550,"KINGSTONE GROUP INTERNATIONAL COMPANY LIMITED
金石集團有限公司",2011-10-18,2019-10-11,"Private, ltd by shares"229,1672555,"KINGSUN INT'L INDUSTRY INVESTMENT CO., LIMITED
金陽國際實業投資有限公司",2011-10-18,,"Private, ltd by shares"230,1672367,"KOREA QINGXIU COSMETIC CO., LIMITED
韓國卿秀化妝品有限公司",2011-10-18,2015-08-07,"Private, ltd by shares"231,1672273,"Kyosay Global Product Development Limited
香港科賽(環球)產品開發有限公司",2011-10-18,,"Private, ltd by shares"232,1672500,"L &amp; H FAR EAST COMPANY LIMITED
金康遠東有限公司",2011-10-18,2019-07-26,"Private, ltd by shares"233,1672425,"LASAVO TRADING LIMITED",2011-10-18,,"Private, ltd by shares"234,1672542,"LC NETWORK CO., LIMITED
龍宸網絡有限公司",2011-10-18,2016-09-15,"Private, ltd by shares"235,1672552,"LDEN LIMITED
億達諾有限公司",2011-10-18,,"Private, ltd by shares"236,1672610,"Letico Limited",2011-10-18,2013-08-02,"Private, ltd by shares"237,1672288,"Lexin (Trading) Limited
樂信港有限公司",2011-10-18,2015-08-07,"Private, ltd by shares"238,1672428,"LI DU DEVELOPMENT CO., LIMITED
麗都發展有限公司",2011-10-18,,"Private, ltd by shares"239,1672494,"LIGHT SECONDS TECHNOLOGY (INTERNATIONAL) LIMITED
光秒科技(國際)有限公司",2011-10-18,2017-06-23,"Private, ltd by shares"240,1672352,"LinkPoint International Limited
萬匯國際有限公司",2011-10-18,2014-10-31,"Private, ltd by shares"241,1672522,"LONYUNG LIGHTING (HONGKONG) HOLDINGS CO., LIMITED
隆源照明(香港)控股有限公司",2011-10-18,2017-12-15,"Private, ltd by shares"242,1672537,"LOSTNOTE ENTERTAINMENT GROUP LIMITED
迷音娛樂集團有限公司",2011-10-18,2015-10-09,"Private, ltd by shares"243,1672232,"Luminus Capital Limited
律明投資有限公司",2011-10-18,2013-09-27,"Private, ltd by shares"244,1672234,"Luminus Investment Management Limited
律明投資管理有限公司",2011-10-18,2013-09-27,"Private, ltd by shares"245,1672611,"Macadia Limited (d2013-08-02)",2011-10-18,2013-08-02,"Private, ltd by shares"246,1672289,"Mader International Limited",2011-10-18,,"Private, ltd by shares"247,1672350,"Maptech Limited",2011-10-18,2016-06-10,"Private, ltd by shares"248,1672480,"MARCHING JOY LIMITED",2011-10-18,,"Private, ltd by shares"249,1672414,"MASTER GROUP GLOBAL CO., LIMITED
萬事泰集團環球有限公司",2011-10-18,,"Private, ltd by shares"250,1672491,"MAYRA CORPORATION LIMITED",2011-10-18,,"Private, ltd by shares"251,1672314,"Mega Machine International (Hong Kong) Limited
美格機械國際(香港)有限公司",2011-10-18,,"Private, ltd by shares"252,1672250,"METHODOLOGY COMPANY LIMITED",2011-10-18,,"Private, ltd by shares"253,1672568,"Metichi Limited",2011-10-18,,"Private, ltd by shares"254,1672373,"MetroTek International Limited
萬測國際有限公司",2011-10-18,,"Private, ltd by shares"255,1672475,"Microdisk Electronic (HK) CO., Limited
微磐電子香港有限公司",2011-10-18,2017-10-27,"Private, ltd by shares"256,1672274,"Million Points Ocean Petroleum Transportation Company Limited
萬方石油運輸有限公司",2011-10-18,2019-09-27,"Private, ltd by shares"257,1672325,"MILLION PROMISE HOLDINGS LIMITED
萬承集團有限公司",2011-10-18,2019-03-29,"Private, ltd by shares"258,1672391,"MING DAO (HONGKONG) GROUP SHARE LIMITED
明道(香港)集團股份有限公司",2011-10-18,,"Private, ltd by shares"259,1672294,"Motivity Electronics H.K. Co., Limited
摩特維電子科技(香港)有限公司",2011-10-18,,"Private, ltd by shares"260,1672598,"MUD OFFICE LIMITED
墨室有限公司",2011-10-18,,"Private, ltd by shares"261,1672255,"MULTIBOND ENGINEERING LIMITED
萬邦工程有限公司",2011-10-18,2019-01-18,"Private, ltd by shares"262,1672390,"MULTITRADE FINANCIAL GROUP LIMITED
大通金融有限公司",2011-10-18,,"Private, ltd by shares"263,1672519,"NEW EARTH INDUSTRIAL CO., LIMITED
興漢實業有限公司",2011-10-18,,"Private, ltd by shares"264,1672321,"NEW ZEALAND SHUERFU INT'L DAIRY LIMITED
新西蘭舒爾福國際乳業有限公司",2011-10-18,2016-06-10,"Private, ltd by shares"265,1672592,"NHK Shipping Limited",2011-10-18,2017-06-23,"Private, ltd by shares"266,1672303,"NLGBK INTERNATIONAL TRADING COMPANY LIMITED",2011-10-18,,"Private, ltd by shares"267,1672258,"Nordic Food Limited
北歐食品有限公司",2011-10-18,2016-12-02,"Private, ltd by shares"268,1672324,"Noxwell Trade Limited",2011-10-18,,"Private, ltd by shares"269,1672331,"NSYY LIMITED",2011-10-18,,"Private, ltd by shares"270,1672222,"OIMIS CO., LIMITED
歐密斯有限公司",2011-10-18,,"Private, ltd by shares"271,1672387,"OMEGAZETA INVENT CO. LIMITED",2011-10-18,2018-10-26,"Private, ltd by shares"272,1672440,"Ominia Technology Co., Limited
歐子明科技有限公司",2011-10-18,2015-02-06,"Private, ltd by shares"273,1672326,"ONE ALPHA ASIA GROUP (HK) LIMITED",2011-10-18,2015-08-07,"Private, ltd by shares"274,1672339,"ORIENTAL DIAMOND HOLDINGS LIMITED
東鑽集團有限公司",2011-10-18,2016-09-30,"Private, ltd by shares"275,1672231,"ORXITY INTERNATIONAL INVESTMENT COMPANY LIMITED
巴黎金城(國際)投資有限公司",2011-10-18,2015-07-17,"Private, ltd by shares"276,1672236,"P72 TRADING LIMITED",2011-10-18,2015-11-06,"Private, ltd by shares"277,1672228,"Pacific Shine Logistics Limited",2011-10-18,,"Private, ltd by shares"278,1672347,"PAK FENG ENTERPRISES LIMITED (d2014-11-07)
百豐企業有限公司",2011-10-18,2014-11-07,"Private, ltd by shares"279,1672349,"PAK WING CONSTRUCTION COMPANY LIMITED
柏榮建築工程有限公司",2011-10-18,,"Private, ltd by shares"280,1672566,"PEACE QUEEN OCEAN ENGINEERING CO., LIMITED
和平皇后海洋工程有限公司",2011-10-18,2013-03-28,"Private, ltd by shares"281,1672422,"PERFECT WIN ENTERPRISES LIMITED
均泰企業有限公司",2011-10-18,,"Private, ltd by shares"282,1672221,"PINK MARTINI (CHINA) LIMITED
紅粉馬丁尼(中國)有限公司",2011-10-18,,"Private, ltd by shares"283,1672486,"Primo Performance Limited",2011-10-18,,"Private, ltd by shares"284,1672449,"PROFIELD HOLDINGS LIMITED
進展場控股有限公司",2011-10-18,2018-03-23,"Private, ltd by shares"285,1672336,"Proper Mate International Limited
博栢國際有限公司",2011-10-18,,"Private, ltd by shares"286,1672474,"PROTIC LIMITED (HK)
寶德有限公司",2011-10-18,,"Private, ltd by shares"287,1672342,"PROUD IDEA LIMITED
煌意有限公司",2011-10-18,,"Private, ltd by shares"288,1672307,"Pytheas Investments Limited",2011-10-18,2014-06-27,"Private, ltd by shares"289,1672281,"QINGDAO YOUCHENG INDUSTRY CO., LIMITED
青島銪乘貿易有限公司",2011-10-18,,"Private, ltd by shares"290,1672476,"Quality Horizons Company Limited",2011-10-18,,"Private, ltd by shares"291,1672465,"RAPID IDEA INTERNATIONAL LIMITED
高意國際有限公司",2011-10-18,2015-04-02,"Private, ltd by shares"292,1672544,"REAL-TIME PRECISION INDUSTRIAL CO., LIMITED
瑞時精密工業有限公司",2011-10-18,2019-11-22,"Private, ltd by shares"293,1672436,"RECYCLING PRINTING CONSUMABLES CO., LIMITED
香港瑞賽科打印設備有限公司",2011-10-18,,"Private, ltd by shares"294,1672315,"RED DRAGON DISTRIBUTION LIMITED",2011-10-18,2019-08-23,"Private, ltd by shares"295,1672547,"RIAZ TELECOM HK LIMITED",2011-10-18,2016-06-10,"Private, ltd by shares"296,1672455,"RICH INTERNATIONAL (HK) INDUSTRY CO., LIMITED
盈丰國際(香港)實業有限公司",2011-10-18,2018-02-09,"Private, ltd by shares"297,1672545,"Richief Logistics Limited
卓峰貨運代理有限公司",2011-10-18,,"Private, ltd by shares"298,1672573,"Richland Group International Limited
萬利豐環球有限公司",2011-10-18,,"Private, ltd by shares"299,1672594,"RICHLAND INTERNATIONAL INVESTMENT (HONG KONG) CO., LIMITED
沃衍國際投資(香港)有限公司",2011-10-18,,"Private, ltd by shares"300,1672427,"RIGHT KEY ENTERPRISES LIMITED
萃聯企業有限公司",2011-10-18,,"Private, ltd by shares"301,1672454,"Rodeo (Hong Kong) Life Science Co. Limited
羅迪歐(香港)生命科學有限公司",2011-10-18,2016-01-22,"Private, ltd by shares"302,1672413,"Ros E Hijos Limited",2011-10-18,,"Private, ltd by shares"303,1672308,"ROSY TRADING LIMITED
萊士貿易有限公司",2011-10-18,2017-10-20,"Private, ltd by shares"304,1672357,"RUIXIANG INTERNATIONAL INVESTMENT CO., LIMITED
瑞祥國際投資有限公司",2011-10-18,2015-08-07,"Private, ltd by shares"305,1672559,"RUNCO CO., LIMITED
鑫潤永泰有限公司",2011-10-18,2016-10-07,"Private, ltd by shares"306,1672499,"RUYIFANG HEALTH LOSE WEIGHT SKILL SPREAD LIMITED
如一芳養生減肥技能傳播有限公司",2011-10-18,2015-08-07,"Private, ltd by shares"307,1672282,"SABOR INVESTMENT COMPANY LIMITED",2011-10-18,,"Private, ltd by shares"308,1672374,"Sai Hui Science And Technology Limited
賽輝科技有限公司",2011-10-18,,"Private, ltd by shares"309,1672497,"SAKI TRADE HONG KONG CO., LIMITED
咲貿易香港有限公司",2011-10-18,2017-06-23,"Private, ltd by shares"310,1672481,"SANBOND LIMITED
順邦有限公司",2011-10-18,,"Private, ltd by shares"311,1672337,"SANDWICH EXPRESS LIMITED (d2013-06-21)",2011-10-18,2013-06-21,"Private, ltd by shares"312,1672463,"SANXING ELECTRIC (FOSHAN) CO., LIMITED
三星電器(佛山)有限公司",2011-10-18,2017-06-23,"Private, ltd by shares"313,1672354,"SCENIC SAPPHIRE LIMITED
景藍有限公司",2011-10-18,2016-10-14,"Private, ltd by shares"314,1672300,"SenSen Networks Hong Kong Limited",2011-10-18,,"Private, ltd by shares"315,1672267,"SHANGHAI OUYADA PUMP INDUSTRY LIMITED
上海歐亞達泵業有限公司",2011-10-18,,"Private, ltd by shares"316,1672429,"SHANGHAI RM EDIFICE ELECTRICAL LIMITED
上海人民建築電器有限公司",2011-10-18,,"Private, ltd by shares"317,1672404,"SHARAZOR TRADING CO., LIMITED
薩拉如貿易有限公司",2011-10-18,,"Private, ltd by shares"318,1672249,"SHENG CO., LIMITED
生有限公司",2011-10-18,2020-10-30,"Private, ltd by shares"319,1672403,"Sheng Da Shi Dai Company Limited
聖大時代有限公司",2011-10-18,2013-06-14,"Private, ltd by shares"320,1672518,"SHIBAO DELION LIMITED
世寶得利恩有限公司",2011-10-18,2016-06-10,"Private, ltd by shares"321,1672459,"Sinkiang Farm 224 Team Agricultural Develop Limited
新疆農墾二二四團農業開發有限公司",2011-10-18,2017-08-25,"Private, ltd by shares"322,1672543,"SKY VENTURE STRATEGICS LIMITED
天匡國際有限公司",2011-10-18,,"Private, ltd by shares"323,1672278,"SKYWAK LIMITED",2011-10-18,2015-12-31,"Private, ltd by shares"324,1672380,"Skyway Holding Group Co., Limited
天泓國際控股有限公司",2011-10-18,2018-07-13,"Private, ltd by shares"325,1672368,"Smart Decisions International Limited",2011-10-18,,"Private, ltd by shares"326,1672378,"SOUTH CHINA MINERAL RESOURCES LIMITED
中南礦產資源有限公司",2011-10-18,,"Private, ltd by shares"327,1672599,"Spink China Limited",2011-10-18,,"Private, ltd by shares"328,1672386,"SRX (HK) CO., LIMITED
三人行(香港)有限公司",2011-10-18,,"Private, ltd by shares"329,1672521,"SSW (HONG KONG) CO., LIMITED",2011-10-18,2019-08-16,"Private, ltd by shares"330,1672240,"STAR YOUNG ELECTRONIC LIMITED
星揚電子有限公司",2011-10-18,2019-03-22,"Private, ltd by shares"331,1672560,"STARTEK TECHNOLOGY CO., LIMITED
仕達科技(香港)有限公司",2011-10-18,,"Private, ltd by shares"332,1672285,"STELLAR ARTEC (HONGKONG) CO., LIMITED
恆星閥門科技(香港)有限公司",2011-10-18,,"Private, ltd by shares"333,1672304,"Sun Miracle (HK) Limited
太奇 (香港) 有限公司",2011-10-18,2016-05-20,"Private, ltd by shares"334,1672437,"SUNDOO LIMITED
深度家紡有限公司",2011-10-18,,"Private, ltd by shares"335,1672485,"SUNLI ENERGY MANAGEMENT INTERNATIONAL COMPANY LIMITED
新利節能國際有限公司",2011-10-18,,"Private, ltd by shares"336,1672607,"SUPPLY FULLY (HOLDINGS) LIMITED
聚通(控股)有限公司",2011-10-18,2014-04-17,"Private, ltd by shares"337,1672482,"SUPREME (CK) COMPANY LIMITED
創基紙品印刷貿易有限公司",2011-10-18,2014-08-29,"Private, ltd by shares"338,1672563,"SUSANNE INTERNATION CO., LIMITED
心語國際有限公司",2011-10-18,,"Private, ltd by shares"339,1672226,"Swift Logistics (HK) Limited
順利達物流(香港)有限公司",2011-10-18,,"Private, ltd by shares"340,1672405,"SWIRE WASTE MANAGEMENT LIMITED
太古惠明有限公司",2011-10-18,,"Private, ltd by shares"341,1672588,"Talent Asia Media and Management (Hong Kong) Limited
騰龍亞洲媒體及管理 (香港) 有限公司",2011-10-18,2017-01-13,"Private, ltd by shares"342,1672451,"TAOSHI OPTICS (HK) LIMITED
陶氏光學(香港)有限公司",2011-10-18,,"Private, ltd by shares"343,1672420,"TECH (HONG KONG) INTERNATIONAL TRADING LIMITED
德盛(香港)國際貿易有限公司",2011-10-18,,"Private, ltd by shares"344,1672233,"Thinq (Hong Kong) Limited",2011-10-18,,"Private, ltd by shares"345,1672407,"THOMPSON IMPEX (HK) LIMITED
蘊發國際貿易有限公司",2011-10-18,2012-12-28,"Private, ltd by shares"346,1672538,"TIANYF (HK) CO., LIMITED
天億福(香港)珠寶有限公司",2011-10-18,2018-06-22,"Private, ltd by shares"347,1672527,"TONG CHI GROUP (GERMANY) LIMITED
通馳集團(德國)有限公司",2011-10-18,,"Private, ltd by shares"348,1672504,"Topsearch iService Investment Limited",2011-10-18,2018-03-16,"Private, ltd by shares"349,1672311,"TORTUGA ENTERPRISES LIMITED",2011-10-18,2016-06-10,"Private, ltd by shares"350,1672505,"TREADEX LIMITED (d2015-08-07)",2011-10-18,2015-08-07,"Private, ltd by shares"351,1672309,"TRINLEY GLOBAL (HK) LIMITED",2011-10-18,,"Private, ltd by shares"352,1672488,"TURBO CAPITAL LIMITED
信富有限公司",2011-10-18,2015-08-07,"Private, ltd by shares"353,1672489,"TURBO SUCCESS LIMITED (d2015-10-23)
凱成有限公司",2011-10-18,2015-10-23,"Private, ltd by shares"354,1672248,"U.S.A. Hua Yu San Mobile Co., Limited
美國花雨傘移動有限公司",2011-10-18,,"Private, ltd by shares"355,1672344,"UNITED MAGAZINE LIMITED
聯合周刊雜誌有限公司",2011-10-18,,"Private, ltd by shares"356,1672462,"UNO TRADING CO., LIMITED",2011-10-18,2016-06-10,"Private, ltd by shares"357,1672581,"UNYPRIME GROUP LIMITED",2011-10-18,2015-08-07,"Private, ltd by shares"358,1672227,"V.D. Investments HK Limited",2011-10-18,,"Private, ltd by shares"359,1672365,"VERY NICE MEDICAL CENTRE LIMITED
美凱醫療中心有限公司",2011-10-18,2015-10-16,"Private, ltd by shares"360,1672399,"Vfab Technology (HK) Company Limited
偉孚科技有限公司",2011-10-18,,"Private, ltd by shares"361,1672495,"VOICEALL TELESERVICES LIMITED",2011-10-18,2016-06-10,"Private, ltd by shares"362,1672401,"WALLNESS COMPANY LIMITED",2011-10-18,2018-07-13,"Private, ltd by shares"363,1672312,"WANKAIYANG BIOTECHNOLOGY LIMITED
萬開洋生物科技有限公司",2011-10-18,,"Private, ltd by shares"364,1672264,"WATCHING MEDIA LIMITED
看一看新媒體有限公司",2011-10-18,2018-06-01,"Private, ltd by shares"365,1672458,"WEALTHY SAPPHIRE INTERNATIONAL LIMITED
富石國際有限公司",2011-10-18,,"Private, ltd by shares"366,1672369,"WEIHAI MINGBA TIAXIA PUMP LIMITED
威海名霸天下泵業有限公司",2011-10-18,2015-08-07,"Private, ltd by shares"367,1672253,"WENZHOU DONGTIAN IMPORT &amp; EXPORT LIMITED
溫州東田進出口有限公司",2011-10-18,,"Private, ltd by shares"368,1672286,"WESYD CO., LIMITED
威希得有限公司",2011-10-18,,"Private, ltd by shares"369,1672524,"WIN-WIN PRODUCTS CO., LIMITED
雙興實業有限公司",2011-10-18,,"Private, ltd by shares"370,1672553,"WINTAI SHARE (HK) CO., LIMITED
永泰股份(香港)有限公司",2011-10-18,,"Private, ltd by shares"371,1672348,"WORKS ACT LIMITED
工程本色有限公司",2011-10-18,,"Private, ltd by shares"372,1672517,"WORLD QUALITY FINE FOOD LIMITED",2011-10-18,,"Private, ltd by shares"373,1672353,"WORLDWIDE SUPPLY LIMITED",2011-10-18,2013-08-23,"Private, ltd by shares"374,1672496,"WOW! Creations HK Limited
逸縉香港有限公司",2011-10-18,,"Private, ltd by shares"375,1672523,"WYWK JV LIMITED
華逸永基合營有限公司",2011-10-18,2019-08-02,"Private, ltd by shares"376,1672338,"Xing Rui International Investment Limited
星瑞國際投資有限公司",2011-10-18,,"Private, ltd by shares"377,1672376,"XUN JIE LABOUR PROTECTION TRADE CO., LIMITED
迅傑勞保貿易有限公司",2011-10-18,,"Private, ltd by shares"378,1672246,"YIJIANG FENGQING CHEMICAL (GUANG ZHOU) SHARES GROUP LIMITED
一江風情化工(廣州)股份集團有限公司",2011-10-18,2015-08-07,"Private, ltd by shares"379,1672346,"YIWU GREENHILL LIMITED",2011-10-18,,"Private, ltd by shares"380,1672364,"YIWU JINNIU KNIT HOSIERY LIMITED
義烏市金牛針織襪業有限公司",2011-10-18,,"Private, ltd by shares"381,1672392,"YIXING REFRIGERANT PRODUCT CO., LIMITED
義星製冷貿易有限公司",2011-10-18,2016-12-02,"Private, ltd by shares"382,1672531,"YONKER ELECTRONICS CO., LIMITED
悅凱電子有限公司",2011-10-18,2019-03-15,"Private, ltd by shares"383,1672516,"YOUNG ACADEMY CANTONESE OPERA TROUPE COMPANY LIMITED (THE)
演藝青年粵劇團有限公司",2011-10-18,,"Ltd by guarantee"384,1672472,"ZHEJIANG JUNFEI MACHINERY COMPANY LIMITED
浙江駿斐機械有限公司",2011-10-18,2013-04-12,"Private, ltd by shares"385,1672579,"ZHONG HAI LONG GROUP CO., LIMITED
中海龍集團有限公司",2011-10-18,2019-07-05,"Private, ltd by shares"386,1672272,"ZHONGGANG (HK) GROUP CO., LIMITED
中港(香港)集團有限公司",2011-10-18,2017-06-23,"Private, ltd by shares"387,1672461,"ZHONGHUA XINTIANDI GROUP LIMITED (d2014-06-06)
中華新天地集團有限公司",2011-10-18,2014-06-06,"Private, ltd by shares"388,1672287,"ZHONGSHAN HONTE LIGHTING CO., LIMITED
中山市鴻泰照明有限公司",2011-10-18,2019-11-29,"Private, ltd by shares"389,1672456,"ZHONGSHAN YAYE LIGHTING CO., LIMITED (d2018-06-08)
中山市雅業燈飾有限公司",2011-10-18,2018-06-08,"Private, ltd by shares"390,1672546,"ZIRANTANG (HONGKONG) LIMITED
自然堂(香港)有限公司",2011-10-18,2017-06-23,"Private, ltd by shares"391,1672565,"ZIXIN BIOLOGICAL TECHNOLOGY CO., LIMITED
紫鑫生物科技有限公司",2011-10-18,2015-08-07,"Private, ltd by shares"392,1672329,"ZOOM-DATA TECHNOLOGY LIMITED
縱訊信息科技有限公司",2011-10-18,2015-08-07,"Private, ltd by shares"393,1672412,"ZYCHAN TECHNOLOGY CO., LIMITED
子辰技術有限公司",2011-10-18,,"Private, ltd by shares"