,Reg no.,Name,Incorp-orated,Dissolved,Type1,1672464,"A-TRONIC H.K. LIMITED",2011-10-18,,"Private, ltd by shares"2,1672513,"AAzone Technology (Asia) Limited
領凱科技(亞洲)有限公司",2011-10-18,2014-08-08,"Private, ltd by shares"3,1672424,"ACELUMI ENTERPRISES LIMITED",2011-10-18,2020-04-03,"Private, ltd by shares"4,1672578,"ACKLAND LEVART (H.K.) LIMITED",2011-10-18,2017-06-23,"Private, ltd by shares"5,1672443,"ACT INTERNATIONAL TRADING LIMITED",2011-10-18,,"Private, ltd by shares"6,1672370,"AEROSPACE FORUM ASIA LIMITED",2011-10-18,,"Ltd by guarantee"7,1672421,"ALMERCO HITEK HONG KONG CO., LIMITED",2011-10-18,2019-07-12,"Private, ltd by shares"8,1672271,"ALPHASIGHTS LIMITED
奧法賽有限公司",2011-10-18,,"Private, ltd by shares"9,1672612,"Alumi Limited",2011-10-18,,"Private, ltd by shares"10,1672441,"AMPLE TIME LIMITED
時代有限公司",2011-10-18,,"Private, ltd by shares"11,1672292,"ANAMNESIA HONG KONG LIMITED",2011-10-18,2015-08-07,"Private, ltd by shares"12,1672301,"APM INVESTMENT COMPANY LIMITED",2011-10-18,,"Private, ltd by shares"13,1672540,"APS - Kofrey JV Limited
聯和 － 高暉聯營有限公司",2011-10-18,,"Private, ltd by shares"14,1672280,"ARAD TRADING COMPANY LIMITED
阿拉德貿易有限公司",2011-10-18,2014-10-31,"Private, ltd by shares"15,1672597,"ARETE FOOD &amp; WINE CONSULTING LIMITED",2011-10-18,,"Private, ltd by shares"16,1672493,"Aros International Limited",2011-10-18,2014-07-04,"Private, ltd by shares"17,1672237,"ASIA PACIFIC (HONG KONG) VALUE LIMITED
亞太(香港)泵閥有限公司",2011-10-18,2015-03-27,"Private, ltd by shares"18,1672525,"ASIA TRADING HOUSE CO., LIMITED
亞升國際貿易有限公司",2011-10-18,,"Private, ltd by shares"19,1672509,"ASIAN FISH MARKET LIMITED",2011-10-18,2018-06-08,"Private, ltd by shares"20,1672444,"ASIANITEX LIMITED",2011-10-18,2016-06-10,"Private, ltd by shares"21,1672293,"ATHENA (GREATER CHINA) LIMITED
睿智(大中華)有限公司",2011-10-18,2018-06-15,"Private, ltd by shares"22,1672439,"B.l.an.co Limited",2011-10-18,2018-05-18,"Private, ltd by shares"23,1672554,"BAOLI (HK) INVESTMENT MANAGE CO., LIMITED
寶力(香港)投資管理有限公司",2011-10-18,2015-08-07,"Private, ltd by shares"24,1672600,"Baragon Limited",2011-10-18,,"Private, ltd by shares"25,1672442,"BAROIS LIMITED",2011-10-18,2015-08-07,"Private, ltd by shares"26,1672306,"BeiJing MingYuanXinDa Chemicals Co., Limited
北京明遠信達化工有限公司",2011-10-18,2016-06-10,"Private, ltd by shares"27,1672242,"Benett Import &amp; Export Co., Limited
伯納特進出口有限公司",2011-10-18,,"Private, ltd by shares"28,1672541,"BENZ NEW ENERGY AUTOMOTIVE GROUP (HK) LIMITED
奔馳新能源汽車集團(香港)有限公司",2011-10-18,2015-08-07,"Private, ltd by shares"29,1672330,"BEST PROMISE HOLDINGS LIMITED
佳承集團有限公司",2011-10-18,2015-01-30,"Private, ltd by shares"30,1672319,"BEST PROMOTORS GROUP LIMITED",2011-10-18,,"Private, ltd by shares"31,1672283,"BFCS HOLDINGS LIMITED",2011-10-18,2015-08-07,"Private, ltd by shares"32,1672450,"BILLION TRENDY LIMITED
億進有限公司",2011-10-18,2015-08-07,"Private, ltd by shares"33,1672323,"BLC LIMITED (d2015-12-24)",2011-10-18,2015-12-24,"Private, ltd by shares"34,1672284,"BLOOM INTERNATIONAL MEDIA LIMITED",2011-10-18,2014-02-14,"Private, ltd by shares"35,1672355,"Blue Heaven (Hong Kong) Pty Limited",2011-10-18,2013-04-05,"Private, ltd by shares"36,1672320,"BOC INTERNATIONAL GOLDEN GOODNESS GROUP CO., LIMITED
中銀國際金善集團有限公司",2011-10-18,,"Private, ltd by shares"37,1672530,"BOOMON ELECTRONIC INTERNATIONAL CO., LIMITED
褒滿國際電氣有限公司",2011-10-18,,"Private, ltd by shares"38,1672478,"Broadsword International Limited (d2015-08-14)",2011-10-18,2015-08-14,"Private, ltd by shares"39,1672256,"CAMBRIDGE EDUCATIONAL HORIZONS ASIA LIMITED",2011-10-18,2017-06-23,"Private, ltd by shares"40,1672417,"Camper China Limited
坎波爾中國有限公司",2011-10-18,,"Private, ltd by shares"41,1672602,"Campora Limited",2011-10-18,2018-01-05,"Private, ltd by shares"42,1672298,"CENTRE OF THE UNIVERSE PRODUCTIONS LIMITED",2011-10-18,2015-03-27,"Private, ltd by shares"43,1672358,"CHAMPION WAY INDUSTRIAL (HONG KONG) LIMITED
晉偉(香港)有限公司",2011-10-18,2014-06-20,"Private, ltd by shares"44,1672235,"CHAOYI (HK) INDUSTRIAL CO., LIMITED
超毅(香港)實業有限公司",2011-10-18,2015-08-07,"Private, ltd by shares"45,1672262,"ChaseDream Limited",2011-10-18,,"Private, ltd by shares"46,1672529,"CHATERS AUCTION LIMITED
佳德拍賣有限公司",2011-10-18,,"Private, ltd by shares"47,1672460,"CHIEF CROWN LIMITED
志豪有限公司",2011-10-18,,"Private, ltd by shares"48,1672515,"China Build Strategies Limited",2011-10-18,2018-06-08,"Private, ltd by shares"49,1672561,"CHINA GREEN CAN CO., LIMITED
中國綠色罐頭有限公司",2011-10-18,,"Private, ltd by shares"50,1672447,"CHINA HEAVY-DUTY TRUCK INTERNATIONAL LIMITED
中國重型汽車國際有限公司",2011-10-18,,"Private, ltd by shares"51,1672229,"CHINA LINK PLUMBING ENGINEERING LIMITED
華興水務工程有限公司",2011-10-18,,"Private, ltd by shares"52,1672572,"China Manufacturing Management International Forum Co., Limited
中國製造業管理國際論壇有限公司",2011-10-18,,"Private, ltd by shares"53,1672416,"China Newstar Energy Co., Limited
中成新星油田工程技術服務股份有限公司",2011-10-18,2019-05-31,"Private, ltd by shares"54,1672259,"CHINA RUI BAO INVESTMENT LIMITED
中國瑞寶(投資)有限公司",2011-10-18,2018-06-08,"Private, ltd by shares"55,1672276,"CHINA SCIENCE &amp; MERCHANTS (HONG KONG) INVESTMENT MANAGEMENT CO., LIMITED
中科招商(香港)創業投資管理有限公司",2011-10-18,,"Private, ltd by shares"56,1672484,"CHINA SPRING AND AUTUMN INTERNATIONAL HUAYU AUCTION LIMITED
中國春秋華宇國際拍賣有限公司",2011-10-18,2016-06-10,"Private, ltd by shares"57,1672536,"CHINESE NATION FIRST MANOR INTERNATIONAL GROUP LIMITED
中華民族第一莊園國際集團有限公司",2011-10-18,2016-06-10,"Private, ltd by shares"58,1672539,"CHUN KIT (HK) ENTERPRISE LIMITED
俊傑(香港)企業有限公司",2011-10-18,2017-09-22,"Private, ltd by shares"59,1672389,"CHUN WAH DEVELOPMENT (HK) CO LIMITED
進華發展(香港)有限公司",2011-10-18,,"Private, ltd by shares"60,1672302,"CIN CIN COMPANY LIMITED
千千國際有限公司",2011-10-18,,"Private, ltd by shares"61,1672318,"CITO INTERNATIONAL HOLDINGS LIMITED
智拓國際控股有限公司",2011-10-18,2019-11-15,"Private, ltd by shares"62,1672551,"COLAB Consulting Limited (HK)",2011-10-18,,"Private, ltd by shares"63,1672492,"COLOR-BRIGHT TRADING CO. LIMITED
彩而麗有限公司",2011-10-18,,"Private, ltd by shares"64,1672502,"Company Registration Number 1672502 Limited
公司註冊編號 1672502 有限公司",2011-10-18,,"Private, ltd by shares"65,1672418,"CUCKOO SOFT OUTFIT ADEVISE INTERNATIONAL CO., LIMITED
布穀鳥軟裝設計國際有限公司",2011-10-18,2016-06-10,"Private, ltd by shares"66,1672384,"D &amp; T INDUSTRIAL LIMITED
達通行有限公司",2011-10-18,2020-03-27,"Private, ltd by shares"67,1672372,"DALIAN ZHENTEC MACHINERY CO., LIMITED",2011-10-18,2015-02-06,"Private, ltd by shares"68,1672601,"Damias Limited",2011-10-18,2018-01-05,"Private, ltd by shares"69,1672498,"DE XUNTONG TECHNOLOGY (HK) LIMITED
德訊通科技(香港)有限公司",2011-10-18,,"Private, ltd by shares"70,1672503,"DECH GROUP CO., LIMITED",2011-10-18,,"Private, ltd by shares"71,1672263,"DEEP BLUE MARITIME CONSULTING LIMITED",2011-10-18,2019-08-16,"Private, ltd by shares"72,1672426,"DHH ARCHITECTS &amp; DESIGN CO., LIMITED",2011-10-18,,"Private, ltd by shares"73,1672239,"DIRECO SHIPPING CO., LIMITED",2011-10-18,2015-08-07,"Private, ltd by shares"74,1672332,"DOUBLE DRAGON HOLDINGS LIMITED
倍龍集團有限公司",2011-10-18,2017-06-23,"Private, ltd by shares"75,1672260,"DR CHAN CHI KIN CARDIOLOGY LIMITED
陳志堅心臟科醫生有限公司",2011-10-18,,"Private, ltd by shares"76,1672366,"DRAGON FONG TONG LIMITED
龍方堂有限公司",2011-10-18,,"Private, ltd by shares"77,1672511,"DUTCHIES CO., LIMITED (THE)
達奇士有限公司",2011-10-18,2017-07-28,"Private, ltd by shares"78,1672415,"DYNASTY F&amp;B GROUP LIMITED
皇朝飲食集團有限公司",2011-10-18,,"Private, ltd by shares"79,1672291,"E-Fun International Co., Limited
伊帆國際集團有限公司",2011-10-18,,"Private, ltd by shares"80,1672419,"E-TRADE INVESTMENT LIMITED
東貿企業投資有限公司",2011-10-18,,"Private, ltd by shares"81,1672590,"Econowise Investments Limited
經慧投資有限公司",2011-10-18,2016-06-10,"Private, ltd by shares"82,1672445,"Ekkemai Holdings Limited",2011-10-18,,"Private, ltd by shares"83,1672434,"ELEGANT VOYAGE INTERNATIONAL LIMITED
雅航國際有限公司",2011-10-18,2014-03-28,"Private, ltd by shares"84,1672603,"Eltara Limited",2011-10-18,,"Private, ltd by shares"85,1672557,"EMPIRE INTERNATIONAL EXPORT CO., LIMITED
皇朝國際出口有限公司",2011-10-18,,"Private, ltd by shares"86,1672520,"ENCOREBIS LIMITED",2011-10-18,2016-04-01,"Private, ltd by shares"87,1672473,"EPEC Limited (HK)",2011-10-18,,"Private, ltd by shares"88,1672313,"Estede International Limited",2011-10-18,,"Private, ltd by shares"89,1672351,"EVERNEW CORPORATION (HONG KONG) LIMITED
百新集團(香港)有限公司",2011-10-18,2017-01-20,"Private, ltd by shares"90,1672446,"EVK FITTING GROUP CO., LIMITED
易維凱集團有限公司",2011-10-18,,"Private, ltd by shares"91,1672270,"Ex2SP Excellent Electronic &amp; Sports Products (HK) Limited",2011-10-18,,"Private, ltd by shares"92,1672584,"EXCELIO TECHNOLOGY (HONG KONG) COMPANY LIMITED
卓捷創芯科技(香港)有限公司",2011-10-18,,"Private, ltd by shares"93,1672479,"EXCHANGE CLUB LIMITED
樂雅薈有限公司",2011-10-18,2017-04-28,"Private, ltd by shares"94,1672580,"FANTASIA MAGIC LIMITED",2011-10-18,2019-01-04,"Private, ltd by shares"95,1672402,"FAR-SIGHT CHINA PUBLICATION LIMITED
瞭望中國出版社有限公司",2011-10-18,,"Private, ltd by shares"96,1672510,"FELIX (HONGKONG) TECHNOLOGY CO., LIMITED
菲利克斯(香港)科技有限公司",2011-10-18,2018-11-09,"Private, ltd by shares"97,1672469,"FIVE STAR IMPORT AND EXPORT TRADING CO., LIMITED
五星進出口貿易有限公司",2011-10-18,2019-09-13,"Private, ltd by shares"98,1672410,"FLEXTECH PRODUCTION ASIA CO., LIMITED",2011-10-18,2016-08-26,"Private, ltd by shares"99,1672261,"FOODMART (SHANGHAI) LIMITED
富馬(上海)有限公司",2011-10-18,,"Private, ltd by shares"100,1672252,"FOSHAN CITY NANHAI CHUANGZONG ZIRCONIUM ALUMINIUM PRODUCTS CO., LIMITED
創眾鋯鋁制品實業有限公司",2011-10-18,2020-05-29,"Private, ltd by shares"101,1672409,"FRANCE MING YANG INTL.(HONG KONG) CO., LIMITED
法國銘洋國際(香港)實業有限公司",2011-10-18,,"Private, ltd by shares"102,1672269,"FU TAT BURG LIMITED
富達堡有限公司",2011-10-18,,"Private, ltd by shares"103,1672411,"FUNG SOURCING LIMITED",2011-10-18,2017-09-15,"Private, ltd by shares"104,1672466,"FUTURE RICH CONSULTANTS LIMITED
豐盛顧問有限公司",2011-10-18,,"Private, ltd by shares"105,1672586,"Galla Sauna &amp; Swimming Pool Construction Co. Limited
嘉華桑拿泳池工程有限公司",2011-10-18,,"Private, ltd by shares"106,1672605,"Gatali Limited",2011-10-18,2017-07-28,"Private, ltd by shares"107,1672507,"GENG SHENG TANG INTERNATIONAL HOLDING GROUP CO., LIMITED
耕盛堂國際控股集團有限公司",2011-10-18,2018-01-19,"Private, ltd by shares"108,1672567,"Germany Boloni Aluminum (Hongkong) International Group Limited
德國博諾尼鋁業(香港)國際集團有限公司",2011-10-18,2018-07-13,"Private, ltd by shares"109,1672356,"GERMANY FALLS PETROLEUM (GROUP) LIMITED
德國福爾斯石油(集團)有限公司",2011-10-18,2016-06-10,"Private, ltd by shares"110,1672361,"GERMANY FENGWUYOU INT'L GROUP CO., LIMITED
德國縫無憂國際集團有限公司",2011-10-18,,"Private, ltd by shares"111,1672333,"GERMANY FURMAN (CHINA) LUBRICATING OIL LIMITED
德國福曼(中國)潤滑油有限公司",2011-10-18,,"Private, ltd by shares"112,1672562,"GERMANY SOUTH OF GREEN BIOLOGICAL ENGINEERING LIMITED
德國綠之南生物工程有限公司",2011-10-18,,"Private, ltd by shares"113,1672408,"Ginger's International Group Company Limited
姜氏國際集團有限公司",2011-10-18,2016-06-10,"Private, ltd by shares"114,1672400,"GLASS TECHNOLOGY LIMITED (HK)
盈實玻璃有限公司",2011-10-18,,"Private, ltd by shares"115,1672383,"Global Flight Asia Limited
環球航空亞洲有限公司",2011-10-18,2018-06-08,"Private, ltd by shares"116,1672305,"GLOBAL GOWN CO., LIMITED
格魯實業有限公司",2011-10-18,2017-11-17,"Private, ltd by shares"117,1672556,"Golden Icon Consulting Limited
新世紀金標顧問有限公司",2011-10-18,2015-08-07,"Private, ltd by shares"118,1672532,"GOLDEN LAKE PROPERTY LIMITED
金湖物業有限公司",2011-10-18,,"Private, ltd by shares"119,1672310,"GOLDEN SOURCE ENTERPRISES WORLDWIDE LIMITED
金源企業環球有限公司",2011-10-18,2018-04-20,"Private, ltd by shares"120,1672241,"GOLDEN SOURCES HONG KONG CORPORATION LIMITED
金源(香港)企業有限公司",2011-10-18,,"Private, ltd by shares"121,1672382,"Goldengrand Investment Company Limited",2011-10-18,2013-04-05,"Private, ltd by shares"122,1672596,"Goldenside Company Limited
金域旅運有限公司",2011-10-18,,"Private, ltd by shares"123,1672275,"GOOD LUCK TOYS CO., LIMITED
大運玩具有限公司",2011-10-18,,"Private, ltd by shares"124,1672277,"Good Sun Industrial Limited
佳之陽實業有限公司",2011-10-18,,"Private, ltd by shares"125,1672534,"GP15 Company Limited",2011-10-18,,"Private, ltd by shares"126,1672448,"GRAPE INTERNATIONAL TRADING(HK)COMPANY LIMITED
香港格瑞普國際貿易有限公司",2011-10-18,,"Private, ltd by shares"127,1672593,"GREEN PLANT TECHNOLOGY LIMITED
綠園科技有限公司",2011-10-18,,"Private, ltd by shares"128,1672433,"GRID-TECH INTERNATIONAL CO., LIMITED
網格電子有限公司",2011-10-18,2016-06-10,"Private, ltd by shares"129,1672340,"GUAN YU GARMENT LIMITED
冠宇服飾有限公司",2011-10-18,,"Private, ltd by shares"130,1672327,"Guangxin CNC Technology Limited
廣鑫數控科技有限公司",2011-10-18,2014-11-07,"Private, ltd by shares"131,1672490,"GUIDE SOFTWARE LIMITED",2011-10-18,2015-03-27,"Private, ltd by shares"132,1672251,"GuoJin Technology Group Pte. Limited
國金科技集團有限公司",2011-10-18,2015-08-07,"Private, ltd by shares"133,1672558,"H&amp;D INTERNATIONAL GROUP LIMITED
奧馳車輛配件有限公司",2011-10-18,,"Private, ltd by shares"134,1672363,"H.K. FURNITURE CITY LIMITED
香港傢俬城有限公司",2011-10-18,2016-04-15,"Private, ltd by shares"135,1672295,"H.K. INT'L FINANCE RUIHUA SPONSION LIMITED
香港國際金融瑞華擔保有限公司",2011-10-18,2017-06-23,"Private, ltd by shares"136,1672279,"HAIJIN (CHINA) GROUP LIMITED
海進(中國)集團有限公司",2011-10-18,2017-09-01,"Private, ltd by shares"137,1672467,"HAND IN HAND (INTERNATIONAL) TECHNOLOGY LIMITED
眾合(國際)科技有限公司",2011-10-18,,"Private, ltd by shares"138,1672508,"HANG KUM LIMITED
恒鑫創新有限公司",2011-10-18,2017-06-23,"Private, ltd by shares"139,1672385,"HAO XUAN INTERNATIONAL INDUSTRY LIMITED
昊軒國際實業有限公司",2011-10-18,2015-08-07,"Private, ltd by shares"140,1672604,"HAO YI (HK) CO., LIMITED
浩猗(香港)有限公司",2011-10-18,,"Private, ltd by shares"141,1672244,"HAOYU TIANCHENG ELECTRONICS HONGKONG COMPANY LIMITED
昊宇天成電子香港有限公司",2011-10-18,,"Private, ltd by shares"142,1672371,"HATHAWAY INVESTMENT MANAGEMENT (HK) LIMITED",2011-10-18,2015-08-07,"Private, ltd by shares"143,1672595,"Hausie Limited
哈仕有限公司",2011-10-18,,"Private, ltd by shares"144,1672398,"HAYASHIROKU (HONG KONG) LIMITED
華林應用材料(香港)有限公司",2011-10-18,,"Private, ltd by shares"145,1672471,"HEART HEALTH (HONG KONG) BIOLOGY TECHNOLOGY LIMITED
心安健(香港)生物科技有限公司",2011-10-18,2015-08-07,"Private, ltd by shares"146,1672438,"HeQi Trade Co., Limited (d2015-08-07)
和奇貿易有限公司",2011-10-18,2015-08-07,"Private, ltd by shares"147,1672574,"Highway (Hongkong) Technology Co., Limited
海岳威(香港)科技有限公司",2011-10-18,,"Private, ltd by shares"148,1672583,"HK BAOJIE INTERNATIONAL CO., LIMITED
香港寶捷國際有限公司",2011-10-18,2016-06-10,"Private, ltd by shares"149,1672570,"HK BAOSHICHI APPAREL LIMITED
香港寶獅馳服飾有限公司",2011-10-18,2017-06-23,"Private, ltd by shares"150,1672388,"HK BEN YUAN CONSULTANCY MANAGEMENT LIMITED
香港本源諮詢管理有限公司",2011-10-18,2019-07-12,"Private, ltd by shares"151,1672397,"HK Eternal Concord International Investment Consulting Limited
香港永謙致和國際投資咨詢有限公司",2011-10-18,2015-06-26,"Private, ltd by shares"152,1672528,"HK HELLO EVERYONE TECHNOLOGY CO., LIMITED
香港大家好科技有限公司",2011-10-18,2019-07-12,"Private, ltd by shares"153,1672247,"HK HUAN CO., LIMITED
香港萱華有限公司",2011-10-18,,"Private, ltd by shares"154,1672322,"HK JINGU (GROUP) INT'L HOLDING LIMITED
香港金穀(集團)國際控股有限公司",2011-10-18,2016-06-10,"Private, ltd by shares"155,1672341,"HK KAIBO INT'L DRESS LIMITED
香港凱博國際服飾有限公司",2011-10-18,2015-08-07,"Private, ltd by shares"156,1672257,"HK LG DIGITAL ELECTRON CO., LIMITED",2011-10-18,2015-08-07,"Private, ltd by shares"157,1672477,"HK LIXIN FASHION CO., LIMITED
香港利鑫服飾有限公司",2011-10-18,2017-05-12,"Private, ltd by shares"158,1672430,"HK MINGBO TRADING LIMITED
香港銘博貿易有限公司",2011-10-18,2013-04-19,"Private, ltd by shares"159,1672453,"HK MINGZHU CHUANGZHAN DOOR LIMITED
香港明珠創展門業有限公司",2011-10-18,2016-06-10,"Private, ltd by shares"160,1672379,"HK SHENGFENG TRADING LIMITED
香港盛峰貿易有限公司",2011-10-18,,"Private, ltd by shares"161,1672290,"HK SURPLUS VAST LIMITED
香港盈瀚有限公司",2011-10-18,,"Private, ltd by shares"162,1672526,"HK XIANGWANJIA BUSINESS GROUP LIMITED
香港祥萬佳商業集團有限公司",2011-10-18,2015-04-02,"Private, ltd by shares"163,1672381,"HOI CHUN DEVELOPMENT (HK) CO LIMITED
海進發展(香港)有限公司",2011-10-18,,"Private, ltd by shares"164,1672512,"Hong Kong Architectural Design Union Limited
香港建築設計聯盟有限公司",2011-10-18,,"Ltd by guarantee"165,1672569,"HONG KONG BAYOU ENTERPRISE CO., LIMITED
香港百耀企業有限公司",2011-10-18,2017-06-23,"Private, ltd by shares"166,1672254,"HONG KONG CHINESE CULTURAL INDUSTRY INVESTMENT COMPANY LIMITED
香港中國文化產業投資有限公司",2011-10-18,2018-07-13,"Private, ltd by shares"167,1672394,"Hong Kong Fullerton International Trade Co., Limited
香港富樂屯國際貿易有限公司",2011-10-18,2017-06-23,"Private, ltd by shares"168,1672487,"HONG KONG GREEN LIGHT MEDIA CO., LIMITED
香港綠色之光傳媒有限公司",2011-10-18,2018-07-13,"Private, ltd by shares"169,1672334,"HONG KONG HONG SHENG PROPERTY CONSULTANT SERVICE LIMITED
香港弘晟物業顧問服務有限公司",2011-10-18,2017-10-06,"Private, ltd by shares"170,1672265,"HONG KONG INTELLIGENCE INVESTMENT LIMITED
香港智力投資有限公司",2011-10-18,2015-03-27,"Private, ltd by shares"171,1672316,"HONG KONG POLLUX TECHNOLOGIES COMPANY LIMITED
香港普樂仕科技有限公司",2011-10-18,,"Private, ltd by shares"172,1672360,"Hong Kong Rong Sheng International Holdings Group Limited
香港榮盛國際控股集團有限公司",2011-10-18,2020-09-25,"Private, ltd by shares"173,1672395,"HONG KONG SEAPORT INVESTMENT LIMITED
香港海港投資有限公司",2011-10-18,2016-08-12,"Private, ltd by shares"174,1672243,"HONG KONG V-MIX FOOD GROUP LIMITED
香港維美斯食品集團有限公司",2011-10-18,2018-04-06,"Private, ltd by shares"175,1672564,"HONG KONG WANSHENG ART AUCTION CO., LIMITED
香港萬盛藝術品競拍有限公司",2011-10-18,2016-06-10,"Private, ltd by shares"176,1672406,"HONG KONG ZHI CHENG MARKETING PLANNING LIMITED
香港智誠營銷策劃有限公司",2011-10-18,2018-07-13,"Private, ltd by shares"177,1672377,"HONG KONG ZI MIN GROUP CO., LIMITED
香港姿敏集團有限公司",2011-10-18,2013-06-21,"Private, ltd by shares"178,1672423,"HONGKONG HOUFULAI CULTURE CREATIVE GROUP CO., LIMITED
香港厚福萊文化創意集團有限公司",2011-10-18,,"Private, ltd by shares"179,1672501,"HONGKONG HUAXING ELECTRONICS LIMITED
香港華興電子有限公司",2011-10-18,,"Private, ltd by shares"180,1672435,"HONGKONG JIAYAO TRADING CO., LIMITED
香港佳瑤貿易有限公司",2011-10-18,2019-03-29,"Private, ltd by shares"181,1672359,"HONGKONG JINYI OPTICAL CO., LIMITED
香港金儀光學器材有限公司",2011-10-18,,"Private, ltd by shares"182,1672457,"HONGKONG LIGE GROUP CO., LIMITED
香港麗鴿集團有限公司",2011-10-18,2017-06-23,"Private, ltd by shares"183,1672238,"HONGKONG LONG JUN METAL PRODUCTS COMPANY LIMITED
香港龍軍金屬製品有限公司",2011-10-18,,"Private, ltd by shares"184,1672345,"Hongkong Milloy Garments Co., Limited
香港米洛伊服飾有限公司",2011-10-18,2015-08-07,"Private, ltd by shares"185,1672575,"HONGKONG OESEN FURNITURE (INVESTMENT) CO., LIMITED
香港歐意軒家俱(投資)有限公司",2011-10-18,2019-05-24,"Private, ltd by shares"186,1672362,"HONGKONG SHENGJUAN TRADING CO., LIMITED
香港盛聚安貿易有限公司",2011-10-18,,"Private, ltd by shares"187,1672223,"HONGKONG SOLARIS COMPANY LIMITED
香港索拉瑞有限公司",2011-10-18,,"Private, ltd by shares"188,1672245,"HONGKONG XINSILU INVESTMENT MANAGEMENT LIMITED
香港新絲路投資管理有限公司",2011-10-18,2016-02-26,"Private, ltd by shares"189,1672297,"HONGKONG ZINIKA FINERY CO., LIMITED
香港子妮卡服飾有限公司",2011-10-18,2015-08-07,"Private, ltd by shares"190,1672585,"HONGKONG ZIRANTANG LIFE ACADEMY OF SCIENCE LIMITED
香港自然堂生命科學院有限公司",2011-10-18,2017-06-23,"Private, ltd by shares"191,1672224,"HONOR DECORATION ENGINEERING LIMITED
軒雅裝修工程有限公司",2011-10-18,,"Private, ltd by shares"192,1672514,"HP LONDON INTERNATIONAL LIMITED
宏蓬國際有限公司",2011-10-18,2017-06-23,"Private, ltd by shares"193,1672335,"HUA TONG GROUP IMPORT&amp;EXPORT CO., LIMITED
華通機電集團樂清進出口有限公司",2011-10-18,2018-07-13,"Private, ltd by shares"194,1672225,"HUALI WORLD CO., LIMITED
華麗世界有限公司",2011-10-18,2017-06-23,"Private, ltd by shares"195,1672576,"HUAQIN INTERNATIONAL (CHINA) LIMITED
華秦國際(中國)有限公司",2011-10-18,2015-08-07,"Private, ltd by shares"196,1672468,"HUAWEI SECURITY INTERNATIONAL LIMITED
華衛保安國際有限公司",2011-10-18,,"Private, ltd by shares"197,1672571,"HUIFA PACKAGING PRODUCTS (HK) CO., LIMITED
匯發包裝製品(香港)有限公司",2011-10-18,,"Private, ltd by shares"198,1672549,"HUSUN LIMITED
恒尙國際有限公司",2011-10-18,,"Private, ltd by shares"199,1672431,"HUXIA GOLD CO., LIMITED
華夏黃金有限公司",2011-10-18,2016-06-10,"Private, ltd by shares"200,1672296,"HWK Investment Limited",2011-10-18,2019-11-29,"Private, ltd by shares"201,1672432,"i-GDW (Hong Kong) Limited",2011-10-18,2015-10-30,"Private, ltd by shares"202,1672343,"i-GEM Limited (d2015-10-30)",2011-10-18,2015-10-30,"Private, ltd by shares"203,1672230,"ICRIS:1672230 (no English name)
龍禹控股有限公司",2011-10-18,2017-02-24,"Private, ltd by shares"204,1672375,"ICRIS:1672375 (no English name)
香港塞貝諾(國際)服飾有限公司",2011-10-18,2015-08-07,"Private, ltd by shares"205,1672613,"IMC INTERNATIONAL HOLDINGS LIMITED (d2015-08-07)",2011-10-18,2015-08-07,"Private, ltd by shares"206,1672393,"INFINITY SECURITIES LIMITED",2011-10-18,,"Private, ltd by shares"207,1672606,"Inlitac Limited",2011-10-18,2013-08-02,"Private, ltd by shares"208,1672317,"INTERNET PROMOTION GROUP CO., LIMITED
互聯促銷集團有限公司",2011-10-18,2015-08-07,"Private, ltd by shares"209,1672589,"IPS Intellectual Property Services Limited",2011-10-18,2017-06-23,"Private, ltd by shares"210,1672535,"ITALY NATURE PRODCHEM INDUSTRIAL CO., LIMITED
義大利瑞保誠實業有限公司",2011-10-18,2018-07-13,"Private, ltd by shares"211,1672582,"iZENEhk, Limited
載豐香港有限公司",2011-10-18,,"Private, ltd by shares"212,1672266,"JADON LIMITED (d2016-05-20)",2011-10-18,2016-05-20,"Private, ltd by shares"213,1672608,"Jezia Limited",2011-10-18,2013-08-02,"Private, ltd by shares"214,1672506,"JIEFU METALS LIMITED",2011-10-18,2017-09-22,"Private, ltd by shares"215,1672470,"JINBAO HONGKONG CO., LIMITED
錦寶(香港)有限公司",2011-10-18,2014-12-24,"Private, ltd by shares"216,1672548,"JINGYING INTERNATIONAL LIQUOR HOLDINGS LIMITED
晶瑩國際酒業控股有限公司",2011-10-18,,"Private, ltd by shares"217,1672533,"JINRIEDU GROUP LIMITED
金日教育集團有限公司",2011-10-18,2019-09-13,"Private, ltd by shares"218,1672591,"JKR Company Limited",2011-10-18,2018-07-13,"Private, ltd by shares"219,1672577,"Joanne HK Limited",2011-10-18,2017-02-24,"Private, ltd by shares"220,1672268,"JOIA TRADING LIMITED",2011-10-18,,"Private, ltd by shares"221,1672452,"JOYSHINE OPTOELECTRONIC COMPANY LIMITED",2011-10-18,2017-06-23,"Private, ltd by shares"222,1672396,"JUN HUI FUND INVESTMENT LIMITED
俊輝基金投資有限公司",2011-10-18,2017-06-23,"Private, ltd by shares"223,1672328,"JUNTAI INTERNATIONAL TRADING CO., LIMITED
君泰國際貿易有限公司",2011-10-18,2014-06-06,"Private, ltd by shares"224,1672587,"KAMET INTERNATIONAL LIMITED",2011-10-18,2017-06-23,"Private, ltd by shares"225,1672483,"KAMIMPEX (HK) Limited",2011-10-18,2013-09-13,"Private, ltd by shares"226,1672299,"KawashimaHongKong Limited
川島香港有限公司",2011-10-18,,"Private, ltd by shares"