,Reg no.,Name,Incorp-orated,Dissolved,Type218,0909660,"WORLD-WIDE DUTY FREE PARTNERS LIMITED",2004-07-02,2009-11-27,"Private, ltd by shares"219,0909598,"XIONG SHAN PROPERTIES LIMITED
紅山置業有限公司",2004-07-02,,"Private, ltd by shares"220,0909574,"YI FABRIC LIMITED
衣田布有限公司",2004-07-02,2005-11-11,"Private, ltd by shares"221,0909651,"YOUNGSUN (INTERNATIONAL) DEVELOPMENT LIMITED
陽新發展有限公司",2004-07-02,2012-10-26,"Private, ltd by shares"222,0909647,"YU QIANG (HONG KONG) LIMITED
瑜强(香港)有限公司",2004-07-02,2007-07-20,"Private, ltd by shares"223,0909640,"YULILUNG (HK) UNDERWEARS LIMITED
香港粵利濃內衣有限公司",2004-07-02,2010-01-22,"Private, ltd by shares"