,Reg no.,Name,Incorp-orated,Dissolved,Type1,0909746,"1IT HONG KONG LIMITED",2004-07-02,2012-07-13,"Private, ltd by shares"2,0909745,"3 DYNAMICS (ASIA) LIMITED
創域動能(亞洲)有限公司",2004-07-02,,"Private, ltd by shares"3,0909545,"A &amp; T UNLIMIT LIMITED
艾唐國際有限公司",2004-07-02,,"Private, ltd by shares"4,0909711,"A-PLUX INDUSTRIAL CO., LIMITED
品冠工藝實業有限公司",2004-07-02,2012-09-28,"Private, ltd by shares"5,0909535,"ACTION PRO INTERNATIONAL (HK) LIMITED
力豐國際(香港)有限公司",2004-07-02,2011-03-11,"Private, ltd by shares"6,0909715,"ADVANCED LINK INTERNATIONAL LIMITED
佳寧國際有限公司",2004-07-02,2009-11-27,"Private, ltd by shares"7,0909532,"AH RONG PROPERTIES LIMITED
亞榮置業有限公司",2004-07-02,2011-03-04,"Private, ltd by shares"8,0909564,"AIXIN CAREER (HK) CO., LIMITED
愛信事業(香港)有限公司",2004-07-02,2005-10-28,"Private, ltd by shares"9,0909563,"ALJC ATELIER LIMITED
樁正安樑設計室有限公司",2004-07-02,,"Private, ltd by shares"10,0909688,"AMERICAN OI LIK GAR FASHION INTERNATIONAL LIMITED
美國愛力格時裝國際有限公司",2004-07-02,2017-10-06,"Private, ltd by shares"11,0909682,"AMERICAN PROFESSION SECURITY AND HEALTH ENVIRONMENT PRODUCT APPRAISAL CENTER LIMITED
美國職業安全與健康環保產品鑒定中心有限公司",2004-07-02,2009-11-27,"Private, ltd by shares"12,0909629,"ART FORT LIMITED
藝堡有限公司",2004-07-02,2012-10-26,"Private, ltd by shares"13,0909568,"ASIAHOOD LIMITED
愛上網有限公司",2004-07-02,2011-03-04,"Private, ltd by shares"14,0909627,"BAIYUAN JEWEL GROUP (HONGKONG) LIMITED
百緣珠寶集團(香港)有限公司",2004-07-02,2018-03-09,"Private, ltd by shares"15,0909581,"BEAUTY CORAL LIMITED
珊瑚有限公司",2004-07-02,2011-03-04,"Private, ltd by shares"16,0909729,"BEST INTERNATIONAL INFORMATION (H.K.) LIMITED
貝斯特國際資訊(香港)有限公司",2004-07-02,2008-12-12,"Private, ltd by shares"17,0909620,"BIG MILLION INTERNATIONAL LIMITED
大億國際有限公司",2004-07-02,,"Private, ltd by shares"18,0909605,"BIOTEX INTERNATIONAL LIMITED (d2013-06-07)
英諾(香港)投資有限公司",2004-07-02,2013-06-07,"Private, ltd by shares"19,0909587,"BRIGHTAKE LIMITED
耀廸有限公司",2004-07-02,,"Private, ltd by shares"20,0909731,"BROCO (HK) INTERNATIONAL CO., LIMITED
博科(香港)國際有限公司",2004-07-02,,"Private, ltd by shares"21,0909710,"CHINA DIVERSIFIED PETRO HONG KONG LIMITED
中原石油業供應有限公司",2004-07-02,2008-12-12,"Private, ltd by shares"22,0909596,"CHINA FOREST PACKAGING CO., LIMITED
中國富瑞特包裝有限公司",2004-07-02,2009-04-09,"Private, ltd by shares"23,0909739,"CHINA LAUNDRY STORE STANDARD AUTHENTICATION CENTER LIMITED
中國洗衣店標準認證中心有限公司",2004-07-02,2009-11-27,"Private, ltd by shares"24,0909695,"CHINA MIRAKLE 3D TECHNOLOGY (GROUP) COMPANY LIMITED
中國美立柯立體科技(集團)有限公司",2004-07-02,2005-12-02,"Private, ltd by shares"25,0909733,"CHINA TONG LIMITED",2004-07-02,2012-10-26,"Private, ltd by shares"26,0909740,"CHINA WASHING TECHNOLOGY AND EQUIPMENT ACADEME LIMITED
中國洗滌技術與裝備研究所有限公司",2004-07-02,2009-11-27,"Private, ltd by shares"27,0909552,"CHINESE STAR INVESTMENT LIMITED
龍豐投資有限公司",2004-07-02,2008-07-11,"Private, ltd by shares"28,0909562,"CHUKSON TECHNOLOGY LIMITED
集信科技有限公司",2004-07-02,2006-12-22,"Private, ltd by shares"29,0909621,"CITY BRIGHT DEVELOPMENT LIMITED
城輝發展有限公司",2004-07-02,,"Private, ltd by shares"30,0909569,"CK INTERNATIONAL TRADING LIMITED",2004-07-02,2009-11-27,"Private, ltd by shares"31,0909683,"CODA HOLDINGS LIMITED (HK)
歌達控股有限公司",2004-07-02,,"Private, ltd by shares"32,0909539,"COLORFUL ACCESSORIES COMPANY LIMITED
彩飾企業有限公司",2004-07-02,2013-02-08,"Private, ltd by shares"33,0909656,"CONCEPT MARKETING ASIA LIMITED",2004-07-02,,"Private, ltd by shares"34,0909616,"CROWN TIME DEVELOPMENT LIMITED (d2010-03-12)
泰億發展有限公司",2004-07-02,2010-03-12,"Private, ltd by shares"35,0909593,"DALLAS ENGINEERING LIMITED (d2010-06-25)
大東工程有限公司",2004-07-02,2010-06-25,"Private, ltd by shares"36,0909668,"DATAMASTER TECHNOLOGY LIMITED
高悅科技有限公司",2004-07-02,2006-08-04,"Private, ltd by shares"37,0909602,"DAYWOOD INTERNATIONAL LIMITED
順輝國際有限公司",2004-07-02,2013-01-04,"Private, ltd by shares"38,0909604,"DAYWOOD LIMITED (d2019-04-04)
奧迪有限公司",2004-07-02,2019-04-04,"Private, ltd by shares"39,0909662,"DELTA CHINA HOLDINGS LIMITED",2004-07-02,,"Private, ltd by shares"40,0909557,"DING SHENG XING INTERNATIONAL GROUP HOLDINGS LIMITED
鼎盛興國際集團控股有限公司",2004-07-02,2015-03-27,"Private, ltd by shares"41,0909533,"DON'S RESTAURANT LIMITED
東一棧有限公司",2004-07-02,2011-03-25,"Private, ltd by shares"42,0909670,"DR.JKL, Limited
中串科技有限公司",2004-07-02,2017-02-24,"Private, ltd by shares"43,0909661,"DYNAMIC BOND INVESTMENTS LIMITED",2004-07-02,2013-09-19,"Private, ltd by shares"44,0909692,"DYNAMIC SOLUTIONS LIMITED (d2008-05-16)",2004-07-02,2008-05-16,"Private, ltd by shares"45,0909565,"E-BOND TECHNOLOGY LIMITED
一本科技有限公司",2004-07-02,,"Private, ltd by shares"46,0909713,"EMORNING INTERNATIONAL (HONG KONG) LIMITED
伊墨林國際(香港)有限公司",2004-07-02,2006-01-06,"Private, ltd by shares"47,0909725,"EPOCH VISION LIMITED (d2009-11-27)",2004-07-02,2009-11-27,"Private, ltd by shares"48,0909572,"ESPOW INTERNATIONAL LIMITED
毅士柏國際有限公司",2004-07-02,2018-05-18,"Private, ltd by shares"49,0909548,"EXCEL RICHLY CHEMICAL LIMITED
新誠臻化工有限公司",2004-07-02,2017-05-19,"Private, ltd by shares"50,0909594,"EXCELLENT TRADER INTERNATIONAL LIMITED
業佳國際有限公司",2004-07-02,2009-11-27,"Private, ltd by shares"51,0909703,"EXCELLWAY TECHNOLOGIES CO., LIMITED
錦程科技有限公司",2004-07-02,2019-01-18,"Private, ltd by shares"52,0909705,"FAI TAT (HONG KONG) PACKAGING PRODUCTS LIMITED
輝達(香港)包裝材料制品有限公司",2004-07-02,2015-07-03,"Private, ltd by shares"53,0909635,"FAME CHAMPION INTERNATIONAL LIMITED
譽冠國際有限公司",2004-07-02,2019-04-04,"Private, ltd by shares"54,0909698,"FASTWIN MARITIME CONSULTANTS COMPANY LIMITED
凱捷海事諮詢有限公司",2004-07-02,2013-05-10,"Private, ltd by shares"55,0909529,"FIRSTEC MARITIME LIMITED
首天客海運有限公司",2004-07-02,,"Private, ltd by shares"56,0909700,"FORDA LIMITED (d2017-02-24)
福澤有限公司",2004-07-02,2017-02-24,"Private, ltd by shares"57,0909667,"FORTUNATE YEAR TRADING LIMITED
德澤貿易有限公司",2004-07-02,,"Private, ltd by shares"58,0909704,"FOUNDATION M. CONSULTANT LIMITED
意‧創理財有限公司",2004-07-02,,"Private, ltd by shares"59,0909666,"FOUR SEAS ENTERPRISES (JAPAN) LIMITED
四洲企業（日本）有限公司",2004-07-02,,"Private, ltd by shares"60,0909575,"FRANCE CHANTS INT'L TRADING CO., LIMITED
法國創美時國際貿易有限公司",2004-07-02,2008-12-12,"Private, ltd by shares"61,0909734,"FRANCE DEBOLAN (INTERNATIONAL) COSMETIC. DRESS. LEATHER GROUP LIMITED
法國黛博蘭(國際)美容．服飾．皮具集團有限公司",2004-07-02,,"Private, ltd by shares"62,0909625,"FRANCE LOUIS WEAR (HK) INT'L LIMITED
法國路易斯服飾(香港)國際有限公司",2004-07-02,2007-07-13,"Private, ltd by shares"63,0909694,"FULIN INTERNATIONAL FORWARDING AGENCY (HONG KONG) LIMITED
富臨國際貨運代理(香港)有限公司",2004-07-02,2018-03-23,"Private, ltd by shares"64,0909664,"GABAL ENTERPRISE LIMITED
嘉堡實業有限公司",2004-07-02,,"Private, ltd by shares"65,0909720,"GAINFLEX LIMITED
興栢有限公司",2004-07-02,,"Private, ltd by shares"66,0909742,"GDC COSMETIC (HONG KONG) COMPANY LIMITED
卓思化粧品有限公司",2004-07-02,2007-10-05,"Private, ltd by shares"67,0909736,"GERMANT BOMEI (H.K.) BIOLOGICAL TECHNOLOGY DEVELOPMENT CO., LIMITED
德國柏美(香港)生物科技發展有限公司",2004-07-02,2019-04-04,"Private, ltd by shares"68,0909583,"GIANT GLORY LIMITED (d2007-10-12)
江榮有限公司",2004-07-02,2007-10-12,"Private, ltd by shares"69,0909576,"GLOBAL C.M.D. &amp; C. CO. LIMITED",2004-07-02,2009-11-27,"Private, ltd by shares"70,0909709,"GLOBAL TECH INDUSTRIAL LIMITED
寶達實業有限公司",2004-07-02,2007-12-14,"Private, ltd by shares"71,0909615,"GOOD HARVEST INTERNATIONAL LIMITED
潤豪國際有限公司",2004-07-02,,"Private, ltd by shares"72,0909573,"GOOD MORNING HEALTH LIMITED
成振健康有限公司",2004-07-02,2009-11-27,"Private, ltd by shares"73,0909639,"GOODING MARINE SERVICE CO., LIMITED
古音亭機電設備有限公司",2004-07-02,,"Private, ltd by shares"74,0909743,"GRACE TAXATION CONSULTANTS LIMITED
恩典稅務顧問有限公司",2004-07-02,2005-09-09,"Private, ltd by shares"75,0909727,"GRAND DOUBLE INVESTMENTS LIMITED
程達投資有限公司",2004-07-02,,"Private, ltd by shares"76,0909659,"GRAND DUKE TRADING LIMITED",2004-07-02,2017-09-29,"Private, ltd by shares"77,0909584,"GRANDLEY LIMITED (HK)
會利有限公司",2004-07-02,,"Private, ltd by shares"78,0909690,"GREAT STAR ELECTRONICS TECHNOLOGY LIMITED
英星電子科技有限公司",2004-07-02,2013-12-27,"Private, ltd by shares"79,0909588,"GREATBEST LIMITED (HK)
基廸有限公司",2004-07-02,,"Private, ltd by shares"80,0909536,"GREATWALL HOLDINGS INTERNATIONAL LIMITED
長城集團國際有限公司",2004-07-02,,"Private, ltd by shares"81,0909645,"GREEN MAN LIMITED
綠色人有限公司",2004-07-02,2006-12-22,"Private, ltd by shares"82,0909730,"H.K. MILKY WAY INT'L GROUP LIMITED
香港銀河國際集團有限公司",2004-07-02,2008-12-12,"Private, ltd by shares"83,0909689,"H.K. YINTAI HOLDINGS LIMITED
香港銀泰集團有限公司",2004-07-02,2015-07-03,"Private, ltd by shares"84,0909650,"H.M.C. LIMITED",2004-07-02,2011-11-11,"Private, ltd by shares"85,0909592,"HARBOUR MARK LIMITED
港貿有限公司",2004-07-02,,"Private, ltd by shares"86,0909537,"HEXA HOLDINGS LIMITED (d2009-11-27)
凱莎集團有限公司",2004-07-02,2009-11-27,"Private, ltd by shares"87,0909653,"HIGH TECHNOLOGY KNITTING LIMITED
高科技針織有限公司",2004-07-02,2016-03-18,"Private, ltd by shares"88,0909674,"HK SHENGFENG INT'L ENTERPRISE GROUP LIMITED
香港盛豐國際企業集團有限公司",2004-07-02,2009-11-27,"Private, ltd by shares"89,0909737,"HKCCCU LOGOS ACADEMY PARENTS ASSOCIATION LIMITED (THE)
香港華人基督教聯會真道書院家長會有限公司",2004-07-02,2014-02-12,"Ltd by guarantee"90,0909531,"HKKF LOGISTICS LIMITED
港九客運有限公司",2004-07-02,,"Private, ltd by shares"91,0909706,"HONG KONG BAILI WOODPECKER CLOTHING &amp; ACCESSORIES (INTERNATIONAL) LIMITED
香港百利啄木鳥服飾(國際)有限公司",2004-07-02,2011-03-04,"Private, ltd by shares"92,0909679,"HONG KONG GOLD SEA INVESTMENT &amp; HOLDING MANAGEMENT CO., LIMITED
香港金海投資控股股份有限公司",2004-07-02,2011-03-04,"Private, ltd by shares"93,0909676,"HONG KONG NUO WEI ER INT'L LIGHTINGS ELECTRICAL APPLIANCES COMPANY LIMITED
香港諾威爾國際照明電器有限公司",2004-07-02,2008-12-12,"Private, ltd by shares"94,0909644,"HONG KONG TRANSLATORS AND INTERPRETERS ASSOCIATION LIMITED
香港翻譯協會有限公司",2004-07-02,,"Private, ltd by shares"95,0909652,"HONG KONG XINLIDA INT'L GROUP INVESTMENT CO., LIMITED
香港信利達國際集團投資有限公司",2004-07-02,2009-11-27,"Private, ltd by shares"96,0909680,"HONG KONG YAHUATING DECORATION PROJECT LIMITED
香港雅華庭裝飾工程有限公司",2004-07-02,2008-12-12,"Private, ltd by shares"97,0909732,"HONG KONG ZHONG XIN INTERNATIONAL GROUP LIMITED
香港眾信國際集團有限公司",2004-07-02,2010-03-12,"Private, ltd by shares"98,0909677,"HONGKONG DABOWEN SHOES LIMITED
香港大博文鞋業有限公司",2004-07-02,2009-06-26,"Private, ltd by shares"99,0909728,"HONGKONG HONG YUAN (INT'L) FASHION LIMITED
香港宏源(國際)時裝有限公司",2004-07-02,2009-11-27,"Private, ltd by shares"100,0909636,"HUGE POWER INTERNATIONAL LIMITED (d2013-11-01)
鉅源國際有限公司",2004-07-02,2013-11-01,"Private, ltd by shares"101,0909722,"HUNTER'S SPECIALTIES HONG KONG LIMITED",2004-07-02,2018-05-18,"Private, ltd by shares"102,0909560,"i easy padala Limited",2004-07-02,2012-10-26,"Private, ltd by shares"103,0909582,"INFINITIVE KNITTING FACTORY LIMITED
永如針織廠有限公司",2004-07-02,2010-10-29,"Private, ltd by shares"104,0909624,"INT'L CHK SPACE LOGISTICS GROUP LIMITED
國際中港空間物流集團有限公司",2004-07-02,2008-08-22,"Private, ltd by shares"105,0909747,"INTEQ ASIA LIMITED",2004-07-02,2009-04-03,"Private, ltd by shares"106,0909649,"INTERNATIONAL (HONG KONG) ANDY TOOLS LIMITED
國際(香港)安迪工具有限公司",2004-07-02,,"Private, ltd by shares"107,0909556,"ITALY DENG XI LU GARMENT DEVELOPMENT LIMITED
意大利登喜路服飾發展有限公司",2004-07-02,2010-04-23,"Private, ltd by shares"108,0909599,"ITALY JACKS DANNY GARMENT GROUP HK LIMITED
意大利杰斯丹尼服飾集團香港有限公司",2004-07-02,2008-12-12,"Private, ltd by shares"109,0909675,"ITALY OUDILAIKE FASHION LIMITED
意大利歐迪萊柯服飾有限公司",2004-07-02,2017-02-24,"Private, ltd by shares"110,0909678,"ITALY TIANYUANDAISHU SHOES LIMITED
意大利天元袋鼠鞋業有限公司",2004-07-02,2010-11-19,"Private, ltd by shares"111,0909546,"JADE OCEAN LOGISTICS LIMITED
皓光物流有限公司",2004-07-02,2012-05-25,"Private, ltd by shares"112,0909717,"JAPAN JUKI TECHNOLOGY INTERNATIONAL (HONG KONG) LIMITED
日本重機科技國際(香港)有限公司",2004-07-02,2013-02-08,"Private, ltd by shares"113,0909608,"JIA SHENG INTERNATIONAL CONSULTANT (HK) LIMITED
佳盛國際拍賣(香港)有限公司",2004-07-02,2019-12-27,"Private, ltd by shares"114,0909544,"JIT (HONG KONG) LOGISTICS LIMITED
福達(香港)物流有限公司",2004-07-02,2014-09-06,"Private, ltd by shares"115,0909719,"JIU TIAN SHEN DEVELOPMENT (HONG KONG) LIMITED
九天神發展(香港)有限公司",2004-07-02,2013-09-19,"Private, ltd by shares"116,0909721,"JIU TIAN SHEN INTERNATIONAL LIMITED
九天神國際有限公司",2004-07-02,2013-09-19,"Private, ltd by shares"117,0909590,"JIU TIAN SHEN INVESTMENT (HONG KONG) LIMITED
九天神投資(香港)有限公司",2004-07-02,2013-09-19,"Private, ltd by shares"118,0909610,"JUMBO VIEW HOLDINGS LIMITED (d2011-03-04)
溢豐控股有限公司",2004-07-02,2011-03-04,"Private, ltd by shares"119,0909708,"JUMBO VIEW TRADING LIMITED
寶景貿易有限公司",2004-07-02,2007-02-09,"Private, ltd by shares"120,0909744,"KIN YAT ROBOT COMPANY LIMITED
建溢機械人有限公司",2004-07-02,,"Private, ltd by shares"121,0909643,"KOREA GOLD PENGUIN (INT'L) FINERY LIMITED
韓國金企鵝(國際)服飾有限公司",2004-07-02,2011-03-04,"Private, ltd by shares"122,0909571,"KWONG RONG PHARMACEUTICAL LIMITED
廣榮藥業有限公司",2004-07-02,2011-03-04,"Private, ltd by shares"123,0909665,"LD METALS COMPANY LIMITED
李氏礦業有限公司",2004-07-02,2009-11-27,"Private, ltd by shares"124,0909555,"LIK HANG REPAIR CONSTRUCTION ENGINEERING CO., LIMITED
力行維修建築工程有限公司",2004-07-02,,"Private, ltd by shares"125,0909741,"LIN FAT INTERNATIONAL TRADING COMPANY LIMITED
林氏國際貿易有限公司",2004-07-02,2008-07-11,"Private, ltd by shares"126,0909714,"LOGIC ADD LIMITED
勵加有限公司",2004-07-02,2011-03-04,"Private, ltd by shares"127,0909527,"LONG SEN INVESTMENTS (HONG KONG) LIMITED
龍森投資(香港)有限公司",2004-07-02,,"Private, ltd by shares"128,0909712,"LUCKY ASSOCIATES INVESTMENTS LIMITED (d2011-03-04)
兆協投資有限公司",2004-07-02,2011-03-04,"Private, ltd by shares"129,0909617,"LUCKY KING INVESTMENT LIMITED
盛啟投資有限公司",2004-07-02,,"Private, ltd by shares"130,0909658,"MAGIC MODERN INTERNATIONAL LIMITED",2004-07-02,2018-02-23,"Private, ltd by shares"131,0909623,"MASTER OCEAN LIMITED (d2010-05-14)
海弘有限公司",2004-07-02,2010-05-14,"Private, ltd by shares"132,0909634,"MAX SCENE INTERNATIONAL LIMITED
協景國際有限公司",2004-07-02,,"Private, ltd by shares"133,0909607,"MAXDO LIMITED
億寶有限公司",2004-07-02,,"Private, ltd by shares"134,0909648,"MEI CHI ENGINEERING COMPANY LIMITED
美志工程有限公司",2004-07-02,,"Private, ltd by shares"135,0909550,"MENIC LIMITED
萬榮有限公司",2004-07-02,,"Private, ltd by shares"136,0909654,"Mitsui Bussan Frontier (China) Co., Limited
三井物產電材(中國)有限公司",2004-07-02,,"Private, ltd by shares"137,0909672,"MYLAB TECHNOLOGY CO., LIMITED
麥博科技有限公司",2004-07-02,2009-10-02,"Private, ltd by shares"138,0909718,"NEW AGE PAPER CO. LIMITED
新時代紙業有限公司",2004-07-02,,"Private, ltd by shares"139,0909663,"NEW HORIZON INVESTMENTS AND HOLDINGS LIMITED",2004-07-02,2013-09-19,"Private, ltd by shares"140,0909724,"NEWGEN TRADING LIMITED",2004-07-02,2010-06-25,"Private, ltd by shares"141,0909681,"NEWPOWER TRADING LIMITED
新力量貿易有限公司",2004-07-02,2005-10-21,"Private, ltd by shares"142,0909684,"Nilpeter China Limited
紐博泰中國有限公司",2004-07-02,,"Private, ltd by shares"143,0909628,"NINGBO LONG TERM INTERNATIONAL TRADE CO., LIMITED
寧波路通國際貿易有限公司",2004-07-02,2008-07-11,"Private, ltd by shares"144,0909580,"NO. 8 LIMITED (HK)",2004-07-02,2019-04-04,"Private, ltd by shares"145,0909630,"NOBLE ELITE LIMITED (d2010-12-17)
晉禧有限公司",2004-07-02,2010-12-17,"Private, ltd by shares"146,0909577,"ORIENTAL GOLDEN INVESTMENT LIMITED
東方金德投資有限公司",2004-07-02,,"Private, ltd by shares"147,0909586,"ORIENTAL REGENT LIMITED (d2007-12-14)
華峻有限公司",2004-07-02,2007-12-14,"Private, ltd by shares"148,0909618,"PACIFIC GAIN (H.K.) LIMITED (d2012-04-27)
創益(香港)有限公司",2004-07-02,2012-04-27,"Private, ltd by shares"149,0909657,"PARTNER ASSET HOLDINGS LIMITED",2004-07-02,2008-05-16,"Private, ltd by shares"150,0909735,"PEARL SCIENTIFIC LIMITED
派爾生物科技有限公司",2004-07-02,2005-11-04,"Private, ltd by shares"151,0909669,"PING ON TONG CHINESE MEDICAL CENTRE LIMITED
平安堂中醫診所有限公司",2004-07-02,,"Private, ltd by shares"152,0909673,"PLIMSOLL MANAGEMENT CONSULTANCY (H.K.) LIMITED (THE)
普萊德爾管理顧問(香港)有限公司",2004-07-02,2015-10-02,"Private, ltd by shares"153,0909609,"POLYKING DEVELOPMENT LIMITED
寶景發展有限公司",2004-07-02,2011-03-04,"Private, ltd by shares"154,0909547,"POLYTRONIC INTERNATIONAL TECHNOLOGIES LIMITED
寶創國際科技有限公司",2004-07-02,,"Private, ltd by shares"155,0909549,"POWER WINNING LIMITED
柏誠有限公司",2004-07-02,2015-03-20,"Private, ltd by shares"156,0909538,"POWER-TECH AUTOMOTIVE SYSTEMS LIMITED
力科汽車系統有限公司",2004-07-02,2009-11-27,"Private, ltd by shares"157,0909716,"PRAISE BRIGHT (HONG KONG) LIMITED
嘉朗(香港)有限公司",2004-07-02,2011-03-11,"Private, ltd by shares"158,0909699,"PRETTY RENEW LIMITED",2004-07-02,,"Private, ltd by shares"159,0909559,"PRO-DIVE TOUR LIMITED
美國潛水旅行社有限公司",2004-07-02,2011-10-07,"Private, ltd by shares"160,0909702,"PROACTIVE MEDICARE (CHANGSHA) COMPANY LIMITED
香港保康動力(長沙)有限公司",2004-07-02,2013-04-12,"Private, ltd by shares"161,0909585,"PROSPERSON LIMITED
昌峻有限公司",2004-07-02,2007-10-05,"Private, ltd by shares"162,0909566,"REAL GAIN (HK) GROUP LIMITED
盈信(香港)集團有限公司",2004-07-02,2005-10-28,"Private, ltd by shares"163,0909558,"RFID GLOBAL LIMITED
利富德環球有限公司",2004-07-02,2016-01-29,"Private, ltd by shares"164,0909626,"SAINT-LO JEWELRY INTERNATIONAL LIMITED
聖洛珠寶國際有限公司",2004-07-02,,"Private, ltd by shares"165,0909561,"SALLAND INDUSTRIES LIMITED (d2005-09-30)
新南實業有限公司",2004-07-02,2005-09-30,"Private, ltd by shares"166,0909696,"SEACO INTERNATIONAL LIMITED",2004-07-02,2011-03-04,"Private, ltd by shares"167,0909632,"SHABEY INTERNATIONAL COMPANY LIMITED",2004-07-02,,"Private, ltd by shares"168,0909600,"SHEN ZHOU PHARMACEUTICAL (HONG KONG) LIMITED
神州製藥(香港)有限公司",2004-07-02,2014-11-07,"Private, ltd by shares"169,0909601,"SHUN HING PLASTIC FACTORY LIMITED
順興塑膠製品有限公司",2004-07-02,,"Private, ltd by shares"170,0909612,"SILVER BASE INDUSTRIAL LIMITED
兆基實業有限公司",2004-07-02,,"Private, ltd by shares"171,0909726,"SINO AGRI INTERNATIONAL (GROUP) LIMITED
華農國際(集團)有限公司",2004-07-02,,"Private, ltd by shares"172,0909606,"SINO CONNECTOR LIMITED
恒亞有限公司",2004-07-02,2015-07-17,"Private, ltd by shares"173,0909541,"SINO ELITE EDUCATION LIMITED
漢中培菁教育有限公司",2004-07-02,2009-01-16,"Private, ltd by shares"174,0909633,"SINO NOVEL HOLDINGS LIMITED
華穎集團有限公司",2004-07-02,2010-01-15,"Private, ltd by shares"175,0909611,"SINOGAIN INTERNATIONAL LIMITED (d2008-05-16)
啟兆國際有限公司",2004-07-02,2008-05-16,"Private, ltd by shares"176,0909613,"SINOTOP ENTERPRISES LIMITED (d2006-01-27)
忠達企業有限公司",2004-07-02,2006-01-27,"Private, ltd by shares"177,0909567,"SOLAR TRADING COMPANY LIMITED
翔豐興業有限公司",2004-07-02,2008-09-05,"Private, ltd by shares"178,0909622,"STAR BASE LIMITED (d2010-09-24)
星創有限公司",2004-07-02,2010-09-24,"Private, ltd by shares"179,0909646,"STONE INT'L (HK) GROUP CLOTHING LIMITED
詩多爾國際(香港)集團服飾有限公司",2004-07-02,2009-06-26,"Private, ltd by shares"180,0909693,"SUN TONG LANDSCAPE LIMITED
新塘園藝有限公司",2004-07-02,2010-05-24,"Private, ltd by shares"181,0909540,"SUNFAIR COMPUTER LIMITED
新輝電腦有限公司",2004-07-02,,"Private, ltd by shares"182,0909738,"SUNNY CRYSTAL CO. LIMITED
泓陽貿易有限公司",2004-07-02,,"Private, ltd by shares"183,0909551,"SUNNY LINKER ENTERPRISES LIMITED
創聯貿易有限公司",2004-07-02,2010-07-30,"Private, ltd by shares"184,0909614,"SUNNY-WISE EDUCATION COMPANY LIMITED
光日晉才教育有限公司",2004-07-02,2007-11-23,"Private, ltd by shares"185,0909701,"SUNSAIL LIMITED
陽帆有限公司",2004-07-02,2011-05-13,"Private, ltd by shares"186,0909748,"SUNWAY EXPRESS COMPANY LIMITED
中正物流集團有限公司",2004-07-02,,"Private, ltd by shares"187,0909687,"SUPREME GROUP (HK) LIMITED (d2006-10-27)
優越集團(香港)有限公司",2004-07-02,2006-10-27,"Private, ltd by shares"188,0909595,"SYOUNTIME INDUSTRIAL LIMITED
幸福之光實業有限公司",2004-07-02,2009-11-27,"Private, ltd by shares"189,0909530,"SYSLINK ASIA PACIFIC LIMITED",2004-07-02,,"Private, ltd by shares"190,0909686,"SZTE COMPANY LIMITED
深示展有限公司",2004-07-02,2010-11-05,"Private, ltd by shares"191,0909697,"T&amp;H LOGISTICS (HK) COMPANY LIMITED
天濠國際物流香港有限公司",2004-07-02,,"Private, ltd by shares"192,0909707,"TAIWAN YADE MOTORBIKE DEVELOPMENT TECHNOLOGY LIMITED
台灣雅得摩托車研發科技有限公司",2004-07-02,2008-12-12,"Private, ltd by shares"193,0909655,"TARLETON PROPERTY (HK) LIMITED",2004-07-02,,"Private, ltd by shares"194,0909591,"TOP ALLIANCE LIMITED
盟泰有限公司",2004-07-02,,"Private, ltd by shares"195,0909619,"TOP PACIFIC HOLDINGS LIMITED (d2011-03-04)
威高集團有限公司",2004-07-02,2011-03-04,"Private, ltd by shares"196,0909553,"TOPIC TRADE LIMITED (d2016-02-26)
拓普貿易有限公司",2004-07-02,2016-02-26,"Private, ltd by shares"197,0909749,"TSI INTERNATIONAL GROUP LIMITED",2004-07-02,2020-09-17,"Private, ltd by shares"198,0909554,"TUNG FONG WING HING PLASTIC MANUFACTORY LIMITED
東方榮興塑膠製品有限公司",2004-07-02,2011-08-05,"Private, ltd by shares"199,0909671,"UART LIMITED (HK)",2004-07-02,,"Private, ltd by shares"200,0909642,"US WANBAOLUO INT'L GROUP LIMITED
美國萬寶螺國際集團有限公司",2004-07-02,2010-02-12,"Private, ltd by shares"201,0909641,"USA CADANO INVESTMENT LIMITED
美國卡登路投資有限公司",2004-07-02,2015-07-03,"Private, ltd by shares"202,0909685,"USA ZEBRA (INTERNATIONAL) HOLDINGS LIMITED
美國斑馬(國際)集團有限公司",2004-07-02,2009-11-27,"Private, ltd by shares"203,0909570,"VILLAGE SQUARE LIMITED (THE)",2004-07-02,2010-09-03,"Private, ltd by shares"204,0909528,"WAH CHUN TECHNOLOGY HK LIMITED
華進科技香港有限公司",2004-07-02,2013-04-19,"Private, ltd by shares"205,0909543,"WAH HUNG INVESTMENT LIMITED
華雄投資有限公司",2004-07-02,2006-06-02,"Private, ltd by shares"206,0909597,"WAN MA (HONGKONG) CO., LIMITED
萬馬(香港)有限公司",2004-07-02,,"Private, ltd by shares"207,0909578,"WELL FORM ENTERPRISES (HOLDINGS) LIMITED
華豐企業(集團)有限公司",2004-07-02,2010-11-26,"Private, ltd by shares"208,0909603,"WENTEK DEVELOPMENT LIMITED
偉昇發展有限公司",2004-07-02,2006-07-28,"Private, ltd by shares"209,0909691,"WIDE HORIZON INVESTMENT LIMITED
廣域投資有限公司",2004-07-02,,"Private, ltd by shares"210,0909637,"WIDER TOUGH (HONG KONG) LIMITED
弘毅(香港)有限公司",2004-07-02,2008-11-28,"Private, ltd by shares"211,0909723,"WISDOM BLOOM INVESTMENTS LIMITED",2004-07-02,,"Private, ltd by shares"212,0909631,"WISDOM CHAMP HOLDINGS LIMITED
慧采集團有限公司",2004-07-02,2006-09-22,"Private, ltd by shares"213,0909542,"WISE BUSINESS CONSULTING LIMITED (HK)
偉業商務顧問有限公司",2004-07-02,,"Private, ltd by shares"214,0909589,"WISESON LIMITED
志俊有限公司",2004-07-02,,"Private, ltd by shares"215,0909638,"WO HENG (H.K.) INDUSTRIAL LIMITED
沃恒(香港)實業有限公司",2004-07-02,2009-11-27,"Private, ltd by shares"216,0909534,"WONG MA TRANSPORTATION CALL CENTRE LIMITED
皇馬運輸電召中心有限公司",2004-07-02,2011-01-14,"Private, ltd by shares"217,0909579,"WORLD TRADE OFFICE (HK) LIMITED",2004-07-02,2011-03-04,"Private, ltd by shares"