,Reg no.,Name,Incorp-orated,Dissolved,Type1,0058877,"ABACO ENTERPRISES LIMITED",1978-03-07,2003-12-19,"Private, ltd by shares"2,0058878,"ADDIS ENTERPRISES LIMITED
喜時發展有限公司",1978-03-07,,"Private, ltd by shares"3,0058880,"AGRA ENTERPRISES LIMITED (d1994-10-28)",1978-03-07,1994-10-28,"Private, ltd by shares"4,0058815,"ALTAS ENTERPRISE LIMITED",1978-03-07,,"Private, ltd by shares"5,0058885,"ANICO AGENCIES (H.K.) LIMITED",1978-03-07,1996-10-18,"Private, ltd by shares"6,0058856,"ARIBEIT LIMITED",1978-03-07,2003-03-28,"Private, ltd by shares"7,0058865,"AVENIDA COMPANY LIMITED
幸運利有限公司",1978-03-07,2005-08-05,"Private, ltd by shares"8,0058855,"BARSAN LIMITED (d1994-06-24)",1978-03-07,1994-06-24,"Private, ltd by shares"9,0058820,"BLADON MARKETING HONG KONG LIMITED",1978-03-07,1995-08-25,"Private, ltd by shares"10,0058818,"CARINDA LIMITED (d1986-09-26)
佳年達有限公司",1978-03-07,1986-09-26,"Private, ltd by shares"11,0058822,"CHENG KWOK SHING INVESTMENT LIMITED
鄭國成投資有限公司",1978-03-07,,"Private, ltd by shares"12,0058849,"CHEUNG FUNG HIP FUNG COMPANY LIMITED
張豐協豐有限公司",1978-03-07,2015-12-11,"Private, ltd by shares"13,0058811,"CHI FAT PIECEGOODS CO., LIMITED
志發布業有限公司",1978-03-07,2015-02-06,"Private, ltd by shares"14,0058844,"CHOON NANG ELECTRICAL APPLIANCE MANUFACTORY LIMITED
春南電器製造廠有限公司",1978-03-07,,"Private, ltd by shares"15,0058852,"CLIMAX EXPORT (FAR EAST) LIMITED",1978-03-07,2004-12-06,"Private, ltd by shares"16,0058831,"CORAL SEA LIMITED (d2002-02-08)
珊瑚海有限公司",1978-03-07,2002-02-08,"Private, ltd by shares"17,0058860,"DING WING KNITTING FACTORY LIMITED
定榮織造廠有限公司",1978-03-07,1995-09-29,"Private, ltd by shares"18,0058851,"DUTA ENTERPRISES LIMITED
一達企業有限公司",1978-03-07,1996-02-16,"Private, ltd by shares"19,0058871,"EAST ASIA FISHERIES LIMITED
東亞漁業有限公司",1978-03-07,1995-04-21,"Private, ltd by shares"20,0058812,"EAST ASIA PACIFIC FOODS (H.K.) LIMITED
東亞太食品實業(香港)有限公司",1978-03-07,2005-02-18,"Private, ltd by shares"21,0058830,"ECONOMY TRADING COMPANY LIMITED",1978-03-07,1997-01-31,"Private, ltd by shares"22,0058881,"EMSLEY COMPANY LIMITED",1978-03-07,1991-08-30,"Private, ltd by shares"23,0058850,"EULON INDUSTRIES LIMITED",1978-03-07,,"Private, ltd by shares"24,0058827,"FITCO INDUSTRIES LIMITED
富康實業有限公司",1978-03-07,2014-12-19,"Private, ltd by shares"25,0058866,"FOREMOST FINANCE LIMITED (d1989-04-27)
富茂財務有限公司",1978-03-07,1989-04-27,"Private, ltd by shares"26,0058839,"FU SHING FOODS COMPANY LIMITED
富成飲食有限公司",1978-03-07,1997-06-27,"Private, ltd by shares"27,0058862,"GEORGE BRANDON &amp; ASSOCIATES LIMITED",1978-03-07,1995-09-29,"Private, ltd by shares"28,0058876,"GLOBAL ENGINEERING &amp; CONSTRUCTION COMPANY LIMITED",1978-03-07,1995-09-29,"Private, ltd by shares"29,0058825,"GOLDEN HERITAGE COMPANY LIMITED",1978-03-07,,"Private, ltd by shares"30,0058870,"GOLDEN KINGDOM ENTERPRISES LIMITED",1978-03-07,2003-07-11,"Private, ltd by shares"31,0058847,"HARDWOOD MARKETING (H.K.) LIMITED",1978-03-07,1995-08-25,"Private, ltd by shares"32,0058824,"HONEYFORD COMPANY LIMITED",1978-03-07,1992-02-08,"Private, ltd by shares"33,0058813,"HOO CHART ENTERPRISE LIMITED
浩策企業有限公司",1978-03-07,,"Private, ltd by shares"34,0058861,"ICEBERG LIMITED (HK)",1978-03-07,,"Private, ltd by shares"35,0058872,"INCHLEY FINANCE COMPANY LIMITED
英資財務有限公司",1978-03-07,1995-08-25,"Private, ltd by shares"36,0058883,"JACKIE &amp; JOHN COMPANY LIMITED",1978-03-07,1991-02-15,"Private, ltd by shares"37,0058807,"K. CHING TRADING COMPANY LIMITED
基盛貿易有限公司",1978-03-07,,"Private, ltd by shares"38,0058809,"KAM WING REALTY LIMITED
錦榮地產有限公司",1978-03-07,1995-08-25,"Private, ltd by shares"39,0058858,"KARIMAC LIMITED
嘉利萬有限公司",1978-03-07,2013-06-14,"Private, ltd by shares"40,0058854,"KUNDAMAL BHARATI ELECTRONICS (HK) LIMITED",1978-03-07,1996-02-16,"Private, ltd by shares"41,0058817,"LAU AND MA TRADING COMPANY LIMITED
慶強貿易有限公司",1978-03-07,1995-08-25,"Private, ltd by shares"42,0058857,"LEGALMAN DEVELOPMENT COMPANY LIMITED
高利文發展有限公司",1978-03-07,1985-06-26,"Private, ltd by shares"43,0058842,"MARATHON FOOTWEAR LIMITED",1978-03-07,2002-02-08,"Private, ltd by shares"44,0058875,"MARCH REAL ESTATE COMPANY LIMITED",1978-03-07,1995-09-29,"Private, ltd by shares"45,0058819,"MEGANTIC LIMITED (d2002-02-08)
美嘉狄有限公司",1978-03-07,2002-02-08,"Private, ltd by shares"46,0058874,"MELITTA HONG KONG LIMITED
美樂家香港有限公司",1978-03-07,,"Private, ltd by shares"47,0058863,"MONFIN (HONG KONG) LIMITED",1978-03-07,1995-09-29,"Private, ltd by shares"48,0058841,"NAM LEE INVESTMENT COMPANY LIMITED
南利置業有限公司",1978-03-07,1996-02-16,"Private, ltd by shares"49,0058806,"ONDULINE (FAR EAST) LIMITED",1978-03-07,2007-04-27,"Private, ltd by shares"50,0058840,"PAK KEE TRANSPORTATION COMPANY, LIMITED
北記運輸有限公司",1978-03-07,2005-01-21,"Private, ltd by shares"51,0058869,"POMPEII TRADING CO. LIMITED",1978-03-07,1983-01-21,"Private, ltd by shares"52,0058832,"QUALAND LIMITED (d1996-02-23)
葛蘭有限公司",1978-03-07,1996-02-23,"Private, ltd by shares"53,0058873,"RICHARDSON FINDLEY LIMITED",1978-03-07,2006-04-13,"Private, ltd by shares"54,0058816,"ROLAND INVESTMENTS LIMITED",1978-03-07,2002-12-06,"Private, ltd by shares"55,0058853,"SAKS TRADING COMPANY (HONG KONG) LIMITED
式時貿易(香港)有限公司",1978-03-07,1994-01-11,"Private, ltd by shares"56,0058843,"SAPNA INTERNATIONAL (H.K.) LIMITED (d1987-01-23)",1978-03-07,1987-01-23,"Private, ltd by shares"57,0058879,"SATHASK DRIAM INTERNATIONAL LIMITED",1978-03-07,2003-06-27,"Private, ltd by shares"58,0058859,"SHAN KEE CONSTRUCTION COMPANY LIMITED
湘記建築有限公司",1978-03-07,1981-07-21,"Private, ltd by shares"59,0058821,"SIAR INTERNATIONAL CONSULTANTS (HONG KONG) LIMITED",1978-03-07,1987-01-23,"Private, ltd by shares"60,0058867,"SIENA LIMITED (d1991-07-26)",1978-03-07,1991-07-26,"Private, ltd by shares"61,0058836,"SILVER MOUNT COMPANY LIMITED (THE)",1978-03-07,2003-01-10,"Private, ltd by shares"62,0058882,"SKYLON COMPANY LIMITED",1978-03-07,1983-01-15,"Private, ltd by shares"63,0058814,"SPEAKMAN CONSULTANTS LIMITED (d1993-08-27)",1978-03-07,1993-08-27,"Private, ltd by shares"64,0058884,"STALLION FINANCE AND INVESTMENT LIMITED",1978-03-07,1995-09-29,"Private, ltd by shares"65,0058848,"TAIKOO SPORTSWEAR LIMITED
太古運動用品有限公司",1978-03-07,,"Private, ltd by shares"66,0058808,"TEMPO REALTY LIMITED
添寶地產有限公司",1978-03-07,2002-02-08,"Private, ltd by shares"67,0058838,"TERMITE BAITING SYSTEM LIMITED
白蟻防治系統有限公司",1978-03-07,2012-08-17,"Private, ltd by shares"68,0058810,"TEXTRON (HK) LIMITED",1978-03-07,2002-11-08,"Private, ltd by shares"69,0058835,"TIN YIN ARTIFICIAL FLOWERS FACTORY LIMITED
天然花廠有限公司",1978-03-07,1996-02-16,"Private, ltd by shares"70,0058823,"TINIC WATCH LIMITED
天力電子錶有限公司",1978-03-07,2002-02-08,"Private, ltd by shares"71,0058834,"TRANS-UNIVERSAL TABLE TENNIS FACTORY LIMITED
環球乒乓球拍廠有限公司",1978-03-07,1991-10-18,"Private, ltd by shares"72,0058826,"TRANSPORT SERVICES ASIA LIMITED",1978-03-07,2004-02-27,"Private, ltd by shares"73,0058837,"UNITED BRANDS SYNDICATE LIMITED",1978-03-07,2004-10-29,"Private, ltd by shares"74,0058829,"VERBURGT (FAR EAST) LIMITED",1978-03-07,2002-08-30,"Private, ltd by shares"75,0058805,"VERY LONG INVESTMENT LIMITED
好長置業有限公司",1978-03-07,2007-07-20,"Private, ltd by shares"76,0058868,"WAH WAI TAI (HONG KONG) COMMERCIAL COMPANY LIMITED
華威泰(香港)商業有限公司",1978-03-07,2018-06-22,"Private, ltd by shares"77,0058864,"YEE HON MAN &amp; SONS CO., LIMITED
余漢文父子有限公司",1978-03-07,1987-11-20,"Private, ltd by shares"78,0058846,"YEE KAI DEVELOPMENT COMPANY, LIMITED
義佳發展有限公司",1978-03-07,1988-03-21,"Private, ltd by shares"79,0058828,"YIP WAH WEAVING FACTORY LIMITED
業華布廠有限公司",1978-03-07,1982-01-04,"Private, ltd by shares"80,0058833,"YUEN YAU DEVELOPMENT COMPANY LIMITED
源有發展有限公司",1978-03-07,,"Private, ltd by shares"81,0058845,"YUNG SHUN HO INVESTMENT COMPANY LIMITED
容順好置業有限公司",1978-03-07,,"Private, ltd by shares"