,Reg no.,Name,Incorp-orated,Dissolved,Type1,0050768,"AUGUST MOON ENTERTAINMENT LIMITED (d1992-09-18)",1976-12-21,1992-09-18,"Private, ltd by shares"2,0050788,"BADMINTON ENTERPRISES LIMITED (d1980-08-13)",1976-12-21,1980-08-13,"Private, ltd by shares"3,0050789,"BAIRAM ENTERPRISES LIMITED",1976-12-21,1988-01-29,"Private, ltd by shares"4,0050790,"BALBO ENTERPRISES LIMITED",1976-12-21,1996-05-24,"Private, ltd by shares"5,0050791,"BALBRIDGE ENTERPRISES LIMITED",1976-12-21,2003-11-28,"Private, ltd by shares"6,0050792,"BALCASTLE ENTERPRISES LIMITED",1976-12-21,2002-06-07,"Private, ltd by shares"7,0050793,"BALCROSS ENTERPRISES LIMITED
寶源發企業有限公司",1976-12-21,2003-11-28,"Private, ltd by shares"8,0050794,"BALMARTIN ENTERPRISES LIMITED",1976-12-21,1981-07-31,"Private, ltd by shares"9,0050795,"BARLETTA ENTERPRISES LIMITED",1976-12-21,2003-11-28,"Private, ltd by shares"10,0050783,"CARNIVAL CLOTHINGS LIMITED
佳年華製衣廠有限公司",1976-12-21,1996-04-25,"Private, ltd by shares"11,0050801,"CHAS MACINTOSH HONGKONG LIMITED",1976-12-21,1991-02-12,"Private, ltd by shares"12,0050786,"DACONG LIMITED",1976-12-21,1993-05-03,"Private, ltd by shares"13,0050775,"DE BURGH LIMITED (d2005-09-09)",1976-12-21,2005-09-09,"Private, ltd by shares"14,0050779,"FK ADMINISTRATION LIMITED",1976-12-21,,"Private, ltd by shares"15,0050804,"H. &amp; LAMB INTERNATIONAL LIMITED",1976-12-21,1978-08-11,"Private, ltd by shares"16,0050763,"IRE YIN LABOURERS AND MERCHANTS MUTUAL ASSOC. LIMITED
愛賢工商互助社有限公司",1976-12-21,,"Ltd by guarantee"17,0050802,"IWASAKI INDUSTRIES (HONG KONG) LIMITED
香港岩崎產業有限公司",1976-12-21,1995-10-27,"Private, ltd by shares"18,0050784,"JOBENSENG GODOWN (HONG KONG) LIMITED
通利貨倉有限公司",1976-12-21,2005-08-19,"Private, ltd by shares"19,0050770,"KESTREL INTERNATIONAL DEVELOPMENT LIMITED",1976-12-21,2003-04-25,"Private, ltd by shares"20,0050811,"KIN WAH PLASTIC MANUFACTORY LIMITED
建華塑膠製品廠有限公司",1976-12-21,1995-10-27,"Private, ltd by shares"21,0050806,"KWOK YEUNG (HK) COMPANY LIMITED
國陽(香港)有限公司",1976-12-21,1995-12-29,"Private, ltd by shares"22,0050805,"KWONG HING HONG PETROLEUM LIMITED
光興行石油有限公司",1976-12-21,2001-05-18,"Private, ltd by shares"23,0050777,"LEE LOY REALTY LIMITED",1976-12-21,,"Private, ltd by shares"24,0050780,"LOCKWOOD INVESTMENT LIMITED",1976-12-21,2003-11-28,"Private, ltd by shares"25,0050782,"Luen Yick Painting &amp; Waterproofing Limited
聯益油漆防水有限公司",1976-12-21,,"Private, ltd by shares"26,0050812,"MEW FEI COMPANY LIMITED",1976-12-21,1995-09-29,"Private, ltd by shares"27,0050797,"MOK CHUEN PROPERTIES LIMITED",1976-12-21,1981-08-28,"Private, ltd by shares"28,0050772,"MORAY SHIPPING LIMITED",1976-12-21,1998-03-04,"Private, ltd by shares"29,0050800,"OI FAI COMPANY LIMITED
靄暉有限公司",1976-12-21,1996-01-26,"Private, ltd by shares"30,0050807,"PAK-HOK PAI NG SHIU CHUNG INVESTMENT LIMITED
白鶴派吳肇鍾置業有限公司",1976-12-21,2003-11-28,"Private, ltd by shares"31,0050771,"PALK STRAIT MARITIME (H.K.) LIMITED",1976-12-21,1992-08-28,"Private, ltd by shares"32,0050803,"PON YOU FUNG INVESTMENT COMPANY LIMITED
潘月歡置業有限公司",1976-12-21,,"Private, ltd by shares"33,0050766,"REMEX ELECTRONICS LIMITED",1976-12-21,2000-07-28,"Private, ltd by shares"34,0050781,"RESONANT TRADING LIMITED",1976-12-21,2003-11-28,"Private, ltd by shares"35,0050799,"SAI ON COMPANY LIMITED (d1990-01-25)
世安有限公司",1976-12-21,1990-01-25,"Private, ltd by shares"36,0050774,"SEAOCEAN LIMITED (d1995-07-28)",1976-12-21,1995-07-28,"Private, ltd by shares"37,0050778,"SHUN ON REALTY LIMITED
信安地產有限公司",1976-12-21,2013-03-08,"Private, ltd by shares"38,0050798,"SHUNG LAI (NOMINEES) LIMITED
崇禮(代理人)有限公司",1976-12-21,2009-12-11,"Private, ltd by shares"39,0050776,"SIGMA (HONG KONG) COMPANY LIMITED
司馬香港有限公司",1976-12-21,2000-12-15,"Private, ltd by shares"40,0050764,"SIR ROBERT BLACK COLLEGE OF EDUCATION PAST STUDENTS' ASSOCIATION LIMITED
柏立基教育學院校友會有限公司",1976-12-21,,"Ltd by guarantee"41,0050765,"SUN-FACTORS (MANUFACTURE) CO., LIMITED
新暉(製造)有限公司",1976-12-21,,"Private, ltd by shares"42,0050769,"TIMES HOUSING MAINTENANCE AND MANAGEMENT COMPANY LIMITED
太時樓宇管理保養有限公司",1976-12-21,2003-06-27,"Private, ltd by shares"43,0050767,"TIMFOIL INVESTMENT COMPANY, LIMITED
添福投資有限公司",1976-12-21,,"Private, ltd by shares"44,0050773,"TIVERTON SHIPPING LIMITED",1976-12-21,1997-02-28,"Private, ltd by shares"45,0050808,"VANITY FUR CREATIONS LIMITED",1976-12-21,1996-02-23,"Private, ltd by shares"46,0050796,"W S TRADING LIMITED",1976-12-21,,"Private, ltd by shares"47,0050810,"WAYWAH DYEING AND FINISHING FACTORY LIMITED
滙華整染廠有限公司",1976-12-21,2020-07-03,"Private, ltd by shares"48,0050785,"WOODFORDE FINANCE LIMITED",1976-12-21,1995-08-25,"Private, ltd by shares"49,0050809,"YATCO ENTERPRISES LIMITED
日高企業有限公司",1976-12-21,2003-03-21,"Private, ltd by shares"50,0050787,"ZIMMERMANN HOBBS INTERNATIONAL (H.K.) LIMITED",1976-12-21,1996-09-13,"Private, ltd by shares"