,Reg no.,Name,Incorp-orated,Dissolved,Type1,2235301,"Chi Yang Trading Limited
吉陽有限公司",2015-05-09,2019-03-01,"Private, ltd by shares"2,2235300,"IT Factor Sales Pro Limited",2015-05-09,,"Private, ltd by shares"3,2235305,"JIK-FOOK FOOD (HK) LIMITED
稷福食品(香港)有限公司",2015-05-09,,"Private, ltd by shares"4,2235306,"LIFE SPORTS LIMITED",2015-05-09,,"Private, ltd by shares"5,2235304,"Sayoshi Limited",2015-05-09,2018-09-07,"Private, ltd by shares"6,2235302,"Seize &amp; Co. International Limited",2015-05-09,,"Private, ltd by shares"7,2235303,"Vivid Amazilla Cloud Information Technology Limited
栩迅雲端信息技術有限公司",2015-05-09,,"Private, ltd by shares"