,Reg no.,Name,Incorp-orated,Dissolved,Type1,1169416,"8883 LIMITED (d2011-03-04)
8883有限公司",2007-09-21,2011-03-04,"Private, ltd by shares"2,1169318,"A-SMART (FAR EAST) LIMITED
智馬(遠東)有限公司",2007-09-21,,"Private, ltd by shares"3,1169258,"A.D-Signed Limited",2007-09-21,2017-07-28,"Private, ltd by shares"4,1169337,"AAR HOLDING COMPANY LIMITED
高昇紙品有限公司",2007-09-21,2016-10-28,"Private, ltd by shares"5,1169311,"ABAMBEE LIMITED",2007-09-21,2012-10-19,"Private, ltd by shares"6,1169333,"ACRT TRADING COMPANY LIMITED
千億嘉佳億貿易有限公司",2007-09-21,2017-05-19,"Private, ltd by shares"7,1169364,"AMERICA JONES INTERNATIONAL INVEST GROUP LIMITED
美國鐘斯國際投資集團有限公司",2007-09-21,2011-05-27,"Private, ltd by shares"8,1169233,"AMERICAN SUNTEK INTERNATIONAL LIMITED
美商三智電腦有限公司",2007-09-21,,"Private, ltd by shares"9,1169581,"ANHUA INT'L (HK) CO., LIMITED
安華國際(香港)有限公司",2007-09-21,,"Private, ltd by shares"10,1169606,"Anton Holding (HK) Limited",2007-09-21,2013-06-07,"Private, ltd by shares"11,1169524,"ART SENSE LIMITED
藝承有限公司",2007-09-21,2015-07-24,"Private, ltd by shares"12,1169289,"ASCENT POWER INTERNATIONAL LIMITED
陞權國際有限公司",2007-09-21,2014-01-03,"Private, ltd by shares"13,1169437,"ASIA TRADE LINK LIMITED
商務亞太有限公司",2007-09-21,,"Private, ltd by shares"14,1169405,"ATLAS CHINA (INDUSTRY) LIMITED",2007-09-21,,"Private, ltd by shares"15,1169302,"AUSTRALIA XIBEI INT'L GROUP LIMITED
澳大利亞喜貝國際集團有限公司",2007-09-21,2015-01-30,"Private, ltd by shares"16,1169358,"BERTELSMANN MUSIC (NANJING) CO., LIMITED
博德曼國際音樂(南京)股份有限公司",2007-09-21,2012-12-21,"Private, ltd by shares"17,1169353,"BEST INFORMATION GLOBAL LIMITED",2007-09-21,2012-12-21,"Private, ltd by shares"18,1169570,"BEST INT'L TRADE COMPANY LIMITED
世佳國際貿易有限公司",2007-09-21,,"Private, ltd by shares"19,1169241,"BEST ZONE (HONG KONG) LIMITED
佳域(香港)有限公司",2007-09-21,2011-05-27,"Private, ltd by shares"20,1169547,"BILLION CHINESE DEVELOPMENT LIMITED
億華發展有限公司",2007-09-21,2011-05-27,"Private, ltd by shares"21,1169424,"BINDA INTERNATIONAL HK GROUP CO., LIMITED
彬達國際(香港)集團有限公司",2007-09-21,2017-05-19,"Private, ltd by shares"22,1169254,"BLOOM LUCK INDUSTRIAL LIMITED
毅福實業有限公司",2007-09-21,2009-07-10,"Private, ltd by shares"23,1169591,"BO FUNG TRADING (HK) LIMITED
寶豐貿易(香港)有限公司",2007-09-21,2012-12-21,"Private, ltd by shares"24,1169542,"BOWIN DEVELOPMENT LIMITED
寶豐發展有限公司",2007-09-21,,"Private, ltd by shares"25,1169294,"BROAD TRADER DEVELOPMENT LIMITED
裕宇發展有限公司",2007-09-21,2014-01-03,"Private, ltd by shares"26,1169450,"BROADER LINK INVESTMENTS LIMITED
港衡投資有限公司",2007-09-21,,"Private, ltd by shares"27,1169410,"BUCKINGHAM 9A LIMITED (THE)",2007-09-21,2011-10-21,"Private, ltd by shares"28,1169408,"BUCKINGHAM 9B LIMITED (THE)",2007-09-21,2009-10-23,"Private, ltd by shares"29,1169411,"BUCKINGHAM 9C LIMITED (THE)",2007-09-21,2011-09-02,"Private, ltd by shares"30,1169403,"BUCKINGHAM 9E LIMITED (THE)",2007-09-21,2009-10-23,"Private, ltd by shares"31,1169439,"C S Development Limited",2007-09-21,,"Private, ltd by shares"32,1169276,"CABOT CONSULTING LIMITED",2007-09-21,,"Private, ltd by shares"33,1169237,"CALI-LOUIS CREATIVE COMPANY LIMITED
樂韻創意有限公司",2007-09-21,2009-02-20,"Private, ltd by shares"34,1169499,"CANTON OCEAN LIMITED
粵洋有限公司",2007-09-21,,"Private, ltd by shares"35,1169599,"CELADON MINING LIMITED
斯萊登資源投資有限公司",2007-09-21,,"Private, ltd by shares"36,1169298,"CELLUBE.COM LIMITED",2007-09-21,2012-05-04,"Private, ltd by shares"37,1169447,"CHAMP JOYMENT LIMITED
佰基有限公司",2007-09-21,,"Private, ltd by shares"38,1169435,"CHARMING WIN INVESTMENT LIMITED
燦宏投資有限公司",2007-09-21,,"Private, ltd by shares"39,1169372,"CHARTER FANTASY DEVELOPMENT LIMITED
慶嘉發展有限公司",2007-09-21,2012-04-27,"Private, ltd by shares"40,1169385,"CHARTER FANTASY INTERNATIONAL LIMITED
慶嘉國際有限公司",2007-09-21,2011-05-27,"Private, ltd by shares"41,1169379,"CHARTER SUMMIT DEVELOPMENT LIMITED
溢嘉發展有限公司",2007-09-21,2010-02-12,"Private, ltd by shares"42,1169299,"CHEN CHENG ENTERPRISE LIMITED
鋥晟企業有限公司",2007-09-21,2013-09-27,"Private, ltd by shares"43,1169521,"CHIEF TOP LIMITED
進登有限公司",2007-09-21,,"Private, ltd by shares"44,1169398,"CHINA CIVILIZATION GROUP LIMITED (d2019-02-08)
華夏文明集團有限公司",2007-09-21,2019-02-08,"Private, ltd by shares"45,1169320,"CHINA INTERNATIONAL DIVINATORY CULTURE GROUP LIMITED
中國國際易學文化集團有限公司",2007-09-21,2011-06-03,"Private, ltd by shares"46,1169537,"CHINA LOGISTICS ASSET INVESTMENT CO., LIMITED
中國物流資產投資有限公司",2007-09-21,,"Private, ltd by shares"47,1169504,"CHINA RICHLAND HOLDINGS LIMITED
中騰集團有限公司",2007-09-21,,"Private, ltd by shares"48,1169313,"CHINA STEEL INTERNATIONAL LIMITED
華鋼國際有限公司",2007-09-21,2020-06-19,"Private, ltd by shares"49,1169229,"CHINESE ELDERLY CULTURAL INDUSTRY FOUNDATION LIMITED (THE)
中華老年文化產業基金會有限公司",2007-09-21,,"Private, ltd by shares"50,1169336,"CHIP SOURCE CO., LIMITED
芯源電子有限公司",2007-09-21,,"Private, ltd by shares"51,1169383,"CIMC Raffles Yacht Limited",2007-09-21,,"Private, ltd by shares"52,1169217,"CLEOPATRA BIOTECHNOLOGY INTERNATIONAL GROUP LIMITED
可麗奧生物技術國際集團有限公司",2007-09-21,2017-05-19,"Private, ltd by shares"53,1169354,"COASTECH INTERNATIONAL LIMITED
新匯海有限公司",2007-09-21,,"Private, ltd by shares"54,1169491,"COME PROFIT LIMITED
盈奔有限公司",2007-09-21,2020-04-09,"Private, ltd by shares"55,1169214,"CONPRO INTERNATIONAL LIMITED",2007-09-21,2018-09-28,"Private, ltd by shares"56,1169279,"COZY TEXTILE CO., LIMITED
可姿紡織品有限公司",2007-09-21,2017-07-07,"Private, ltd by shares"57,1169295,"CROWN IMPORT &amp; EXPORT (HK) LIMITED",2007-09-21,,"Private, ltd by shares"58,1169496,"CYBER EXPERT LIMITED
科卓有限公司",2007-09-21,2013-11-15,"Private, ltd by shares"59,1169568,"D&amp;S (H.K.) INTERNATIONAL LIMITED
東昇(香港)國際有限公司",2007-09-21,2017-12-29,"Private, ltd by shares"60,1169486,"DB HONG KONG SCIENCE TECHNOLOGY COMPANY LIMITED
香港盾伯科技有限公司",2007-09-21,2011-05-27,"Private, ltd by shares"61,1169345,"DECO-PRO CHINA LIMITED",2007-09-21,2010-09-24,"Private, ltd by shares"62,1169307,"DELIGHT POWER LIMITED
欣源有限公司",2007-09-21,2016-10-28,"Private, ltd by shares"63,1169502,"DELUXE FORTUNE LIMITED
豪登有限公司",2007-09-21,,"Private, ltd by shares"64,1169517,"DeMarcheli Limited",2007-09-21,,"Private, ltd by shares"65,1169455,"DIGIAPEX COMPANY LIMITED
廸訊科有限公司",2007-09-21,2019-03-29,"Private, ltd by shares"66,1169462,"DING FENG CO., LIMITED
鼎灃股份有限公司",2007-09-21,2013-01-11,"Private, ltd by shares"67,1169454,"DOUBLE WILL INVESTMENTS LIMITED
活泰投資有限公司",2007-09-21,2014-10-24,"Private, ltd by shares"68,1169550,"DRAGON SMART LIMITED (d2018-05-18)
津龍有限公司",2007-09-21,2018-05-18,"Private, ltd by shares"69,1169274,"DRAGON STRONG DEVELOPMENT LIMITED
龍健發展有限公司",2007-09-21,2020-05-08,"Private, ltd by shares"70,1169544,"E-JET LIMITED
二捷有限公司",2007-09-21,,"Private, ltd by shares"71,1169569,"E-PROFIT LIMITED (d2011-03-18)
薏發有限公司",2007-09-21,2011-03-18,"Private, ltd by shares"72,1169470,"East N West Resources Company Limited
東西環保有限公司",2007-09-21,2012-12-21,"Private, ltd by shares"73,1169341,"EAST PROUD HOLDINGS LIMITED
東傲集團有限公司",2007-09-21,2018-02-02,"Private, ltd by shares"74,1169562,"EASY GRANT LIMITED
薏高有限公司",2007-09-21,,"Private, ltd by shares"75,1169500,"ECHO RAY LIMITED
創希有限公司",2007-09-21,,"Private, ltd by shares"76,1169284,"ELEGANT NOBLE (HONG KONG) LIMITED
雅妍(香港)有限公司",2007-09-21,,"Private, ltd by shares"77,1169269,"EMPIRE CHAMP DEVELOPMENT LIMITED
君卓發展有限公司",2007-09-21,,"Private, ltd by shares"78,1169373,"ENGINEERS.hk Limited
工程(香港)裝修設計有限公司",2007-09-21,2013-02-01,"Private, ltd by shares"79,1169536,"ESSENSE CORPORATION LIMITED
杰承有限公司",2007-09-21,2018-05-18,"Private, ltd by shares"80,1169238,"EVER BRIGHTON (HONG KONG) LIMITED
世輝(香港)有限公司",2007-09-21,,"Private, ltd by shares"81,1169283,"EVER FULLY INTERNATIONAL LIMITED
恒盈國際有限公司",2007-09-21,2012-12-21,"Private, ltd by shares"82,1169523,"EVER PROSPEROUS LIMITED (d2015-09-18)
丰樂有限公司",2007-09-21,2015-09-18,"Private, ltd by shares"83,1169512,"EVERBEAM LIMITED (d2012-04-27)",2007-09-21,2012-04-27,"Private, ltd by shares"84,1169246,"EVEREST INT'L CO., LIMITED",2007-09-21,2020-01-17,"Private, ltd by shares"85,1169436,"EVERLASTING INVESTMENT LIMITED
丰盛投資有限公司",2007-09-21,,"Private, ltd by shares"86,1169225,"EzTop International Co. Limited
惟盛科技有限公司",2007-09-21,2010-01-22,"Private, ltd by shares"87,1169346,"F1MEDIA (H.K.) LIMITED
福益藍牙技術有限公司",2007-09-21,,"Private, ltd by shares"88,1169423,"FAMOUS MALL INTERNATIONAL LIMITED
名坊國際有限公司",2007-09-21,2011-12-16,"Private, ltd by shares"89,1169526,"FANCY DRAGON LIMITED (HK)
迎佳有限公司",2007-09-21,,"Private, ltd by shares"90,1169501,"FANCY WIN LIMITED
迎利有限公司",2007-09-21,,"Private, ltd by shares"91,1169515,"FANTOR LIMITED (HK)
益鋒有限公司",2007-09-21,,"Private, ltd by shares"92,1169343,"FAR AIM (HK) INT'L BIOLOGY TECHNOLOGY LIMITED
香港遠通國際生物科技有限公司",2007-09-21,2012-12-21,"Private, ltd by shares"93,1169514,"FLYMEN LIMITED
快威有限公司",2007-09-21,2015-07-24,"Private, ltd by shares"94,1169516,"FORD BRIGHT LIMITED (d2010-07-16)
丰明有限公司",2007-09-21,2010-07-16,"Private, ltd by shares"95,1169196,"FORETOON DIGITAL (HK) COMPANY LIMITED
科藝通數碼(香港)有限公司",2007-09-21,,"Private, ltd by shares"96,1169553,"FORMWELL LIMITED (d2011-03-25)
豐拓有限公司",2007-09-21,2011-03-25,"Private, ltd by shares"97,1169567,"FORT FORTUNE LIMITED
可福有限公司",2007-09-21,,"Private, ltd by shares"98,1169507,"FORTUNE TOP CORPORATION LIMITED (d2011-07-15)
拓利有限公司",2007-09-21,2011-07-15,"Private, ltd by shares"99,1169321,"FOSHAN SALON CERAMICS DEVELOPMENT CO., LIMITED
佛山市砂龍陶瓷開發有限公司",2007-09-21,2015-07-24,"Private, ltd by shares"100,1169365,"FRANCE YISIKUAIMEI BIOLOGY TECHNOLOGY LIMITED
法國伊斯快美生物科技有限公司",2007-09-21,2011-05-27,"Private, ltd by shares"101,1169456,"FREE BOOST INVESTMENTS LIMITED
營發投資有限公司",2007-09-21,,"Private, ltd by shares"102,1169430,"FROST-TECH LIMITED (HK)",2007-09-21,,"Private, ltd by shares"103,1169344,"FRUITFUL FOOD &amp; BEVERAGE COMPANY LIMITED
溢昇食品有限公司",2007-09-21,,"Private, ltd by shares"104,1169438,"FULL EFFORT INVESTMENT LIMITED
丰收投資有限公司",2007-09-21,2009-04-30,"Private, ltd by shares"105,1169598,"FULLY HERO LIMITED
豐雄有限公司",2007-09-21,2012-03-30,"Private, ltd by shares"106,1169530,"FULLY SHINE LIMITED
丰順有限公司",2007-09-21,,"Private, ltd by shares"107,1169325,"GGSCHMITT &amp; SONS LIMITED",2007-09-21,2017-05-19,"Private, ltd by shares"108,1169293,"GLEE MAPLE LIMITED
悅楓有限公司",2007-09-21,2013-02-01,"Private, ltd by shares"109,1169433,"GLOBAL RICH INTERNATIONAL INDUSTRIAL LIMITED
富高國際實業有限公司",2007-09-21,,"Private, ltd by shares"110,1169452,"GLOBE HOME LIMITED
佳泛有限公司",2007-09-21,,"Private, ltd by shares"111,1169490,"GLORY (VON RICHLAND) INDUSTRIAL LIMITED
光榮(寶潤發)實業有限公司",2007-09-21,2011-11-11,"Private, ltd by shares"112,1169564,"GOLDEN CUP LIMITED (d2009-04-09)
金杯有限公司",2007-09-21,2009-04-09,"Private, ltd by shares"113,1169247,"GOLDEN LIFE MEDICAL CONSULTING LIMITED
香港金生健康醫療投資(國際控股)有限公司",2007-09-21,2012-12-21,"Private, ltd by shares"114,1169361,"GOLDEN LUXERY LIMITED
金映有限公司",2007-09-21,2010-06-16,"Private, ltd by shares"115,1169209,"GOLDEN SEAS HOLDINGS LIMITED
鑫瀛控股有限公司",2007-09-21,2012-12-21,"Private, ltd by shares"116,1169566,"GOLDEN THUNDER LIMITED (d2011-11-04)
金雷有限公司",2007-09-21,2011-11-04,"Private, ltd by shares"117,1169492,"GOOD PROFIT YEAR LIMITED
全年旺有限公司",2007-09-21,,"Private, ltd by shares"118,1169348,"GOODIES INTERNATIONAL (HOLDINGS) LIMITED
高得樂國際(集團)有限公司",2007-09-21,2016-01-29,"Private, ltd by shares"119,1169461,"GRACE WILL HOLDINGS LIMITED
龍祐控股有限公司",2007-09-21,,"Private, ltd by shares"120,1169596,"GREENVIEW BIOTECH CO. LIMITED
綠佳生物工程有限公司",2007-09-21,2012-04-13,"Private, ltd by shares"121,1169230,"GUANG DONG XIANG BAI LIN PINE FURNITURE INDUSTRY LIMITED
廣東香柏林松木家具實業有限公司",2007-09-21,2011-05-27,"Private, ltd by shares"122,1169592,"GUANGDONG BAIWEI GROUP LIMITED
廣東百威集團有限公司",2007-09-21,2011-05-27,"Private, ltd by shares"123,1169579,"GUANGDONG FOSHAN XIANCHENG CERAMIC LIMITED
廣東佛山仙城陶瓷有限公司",2007-09-21,2015-01-30,"Private, ltd by shares"124,1169602,"GUANGDONG-HONGKONG-MACAO GREATER BAY AREA FORUM GROUP CO., LIMITED
粵港澳大灣區論壇集團有限公司",2007-09-21,,"Private, ltd by shares"125,1169443,"GUDI COMPANY LIMITED
古諦國際有限公司",2007-09-21,2016-09-23,"Private, ltd by shares"126,1169520,"GUILIN LIMITED (d2014-05-02)
桂林有限公司",2007-09-21,2014-05-02,"Private, ltd by shares"127,1169538,"H I&amp;C Partners Limited
香港宏控股有限公司",2007-09-21,2016-04-15,"Private, ltd by shares"128,1169549,"H.K. BAICHENG REAL ESTATE INVESTMENT MANAGEMENT LIMITED
香港佰城置業投資管理有限公司",2007-09-21,2011-05-27,"Private, ltd by shares"129,1169355,"H.K. BROTHER DRESS LIMITED (d2012-12-21)
香港兄弟服飾有限公司",2007-09-21,2012-12-21,"Private, ltd by shares"130,1169577,"H.K. INT'L TALENTED PERSON DEVELOPMENT EDUCATION (GROUP) LIMITED
香港國際人才發展教育(集團)有限公司",2007-09-21,2012-04-13,"Private, ltd by shares"131,1169459,"HAOKAI (HONGKONG) ENTERPRISE CO., LIMITED
皓凱(香港)實業有限公司",2007-09-21,2015-07-24,"Private, ltd by shares"132,1169418,"HARVEST FULL WORLDWIDE LIMITED
和豐環球有限公司",2007-09-21,,"Private, ltd by shares"133,1169590,"He-Ro Consulting Limited",2007-09-21,,"Private, ltd by shares"134,1169465,"HEAD UNIQUE LIMITED
軒才有限公司",2007-09-21,2009-06-05,"Private, ltd by shares"135,1169419,"HEALTH TOP INTERNATIONAL LIMITED
康博國際有限公司",2007-09-21,,"Private, ltd by shares"136,1169300,"HEALTH TOUCH FOOT SPA &amp; NAIL COMPANY LIMITED
足道休閒美甲有限公司",2007-09-21,,"Private, ltd by shares"137,1169340,"HENRY WANG TORNADO LIMITED",2007-09-21,2011-06-03,"Private, ltd by shares"138,1169203,"HIGH EASE INVESTMENT LIMITED
高誼投資有限公司",2007-09-21,,"Private, ltd by shares"139,1169397,"HIGHMIEN SOLAR ENERGY GREEN SOURCES LIMITED
皇明太陽能綠色能源有限公司",2007-09-21,2011-05-27,"Private, ltd by shares"140,1169202,"HIGHWAY TRADING LIMITED
高晉貿易有限公司",2007-09-21,,"Private, ltd by shares"141,1169380,"HK BONUS MECHANISM ELECTRON CO., LIMITED
香港寶萊斯機械電子有限公司",2007-09-21,2011-05-27,"Private, ltd by shares"142,1169224,"HK DTC COMPANY LIMITED",2007-09-21,2010-04-23,"Private, ltd by shares"143,1169360,"HK GUANSHENG GROUP LIMITED
香港冠盛集團有限公司",2007-09-21,,"Private, ltd by shares"144,1169420,"HK HIBOXING MODEL INDUSTRIAL COMPANY LIMITED
香港海博星模型實業有限公司",2007-09-21,,"Private, ltd by shares"145,1169394,"HK MELAND DEVELOPMENT LIMITED
香港美聯發展有限公司",2007-09-21,2011-05-27,"Private, ltd by shares"146,1169349,"HK SHENGHUA INT'L INVESTMENT GROUP LIMITED
香港升華國際投資集團有限公司",2007-09-21,2011-05-27,"Private, ltd by shares"147,1169407,"HK XISONGWU GROUP LIMITED
香港西松屋集團有限公司",2007-09-21,2011-05-27,"Private, ltd by shares"148,1169200,"HON LUNG CORPORATION LIMITED
漢龍興業有限公司",2007-09-21,2012-12-21,"Private, ltd by shares"149,1169583,"HONG KONG CENTURY TRADING LIMITED
香港世紀貿易有限公司",2007-09-21,2018-04-20,"Private, ltd by shares"150,1169552,"Hong Kong Changlong Investment Development Corporation Limited
香港昌隆投資開發有限公司",2007-09-21,,"Private, ltd by shares"151,1169272,"HONG KONG EVANGELTANG MEDICINE GROUP LIMITED
香港福音堂藥業集團有限公司",2007-09-21,2015-01-30,"Private, ltd by shares"152,1169342,"HONG KONG FIVE CONTINENTS INT'L TRADING LIMITED
香港五洲國際貿易有限公司",2007-09-21,2012-11-30,"Private, ltd by shares"153,1169551,"HONG KONG FOR MING EDUCATION FOUNDATION LIMITED
香港科明教育基金會有限公司",2007-09-21,,"Ltd by guarantee"154,1169303,"HONG KONG GRANT INTERNATIONAL TRADE CO., LIMITED",2007-09-21,2011-05-27,"Private, ltd by shares"155,1169223,"HONG KONG HAI RUN INVESTMENT HOLDINGS LIMITED
香港海潤投資控股有限公司",2007-09-21,2020-04-29,"Private, ltd by shares"156,1169328,"HONG KONG HU JIN SEWING MACHINES LIMITED
香港滬金衣車有限公司",2007-09-21,2012-12-21,"Private, ltd by shares"157,1169326,"HONG KONG HUAGANG INTERNATIONAL CO., LIMITED
香港華港國際控股有限公司",2007-09-21,2014-01-03,"Private, ltd by shares"158,1169332,"HONG KONG JELONG INT'L INVESTMENT LIMITED
香港辰隆國際投資有限公司",2007-09-21,,"Private, ltd by shares"159,1169381,"HONG KONG JING JIE INTERNATIONAL GROUP LIMITED
香港晶傑國際集團有限公司",2007-09-21,2011-05-27,"Private, ltd by shares"160,1169548,"Hong Kong Kaite Investment Development Corporation Limited
香港凱特投資開發有限公司",2007-09-21,,"Private, ltd by shares"161,1169236,"HONG KONG LI DA SI FURNITURE COMPANY LIMITED
香港利達斯家具有限公司",2007-09-21,2017-07-28,"Private, ltd by shares"162,1169488,"HONG KONG LONGTENG GARMENT GROUP LIMITED
香港龍騰服飾集團有限公司",2007-09-21,2011-06-03,"Private, ltd by shares"163,1169330,"HONG KONG MIRAKO ELECTRONICS CO., LIMITED
香港名瑞科電子有限公司",2007-09-21,2017-10-27,"Private, ltd by shares"164,1169484,"HONG KONG RISING MEDICAL CO., LIMITED
香港日升醫療器械有限公司",2007-09-21,,"Private, ltd by shares"165,1169249,"HONG KONG TE NAI TE FURNITURE GROUP LIMITED
香港特耐特家具集團有限公司",2007-09-21,2011-05-27,"Private, ltd by shares"166,1169384,"HONG KONG TEMSION INTERNATIONAL TRADING GROUP LIMITED
香港天盛國際貿易集團有限公司",2007-09-21,2016-03-04,"Private, ltd by shares"167,1169323,"HONG KONG WORLD BUSINESS INTERNATIONAL LIMITED
香港萬豪國際商務有限公司",2007-09-21,,"Private, ltd by shares"168,1169374,"HONG KONG XIAO NI REN FIGURE-BUILDING TECHNOLOGY GROUP LIMITED
香港小妮人纖體科技集團有限公司",2007-09-21,2011-05-27,"Private, ltd by shares"169,1169264,"HONG KONG XIN JIA HUA DYEING &amp; WEAVING COMPANY LIMITED
香港新嘉華染織有限公司",2007-09-21,2018-03-09,"Private, ltd by shares"170,1169376,"HONG KONG XIONG YA INDUSTRY INTERNATIONAL HOLDINGS LIMITED
香港雄雅實業國際控股有限公司",2007-09-21,2011-05-27,"Private, ltd by shares"171,1169446,"HONGKONG CREST SCIENCE AND TECHNOLOGY CO., LIMITED
香港凱瑞斯通科技有限公司",2007-09-21,2010-04-16,"Private, ltd by shares"172,1169378,"HONGKONG GOLD COIN DEVELOPMENT LIMITED
香港金幣開發有限公司",2007-09-21,2011-05-27,"Private, ltd by shares"173,1169425,"HONGKONG LIRAN BIO-TECHNOLOGY INTERNATIONAL LIMITED
香港利仁生物科技國際有限公司",2007-09-21,2011-05-27,"Private, ltd by shares"174,1169324,"HongKong Richsky Finance Technology Limited
香港富甲天下金融科技有限公司",2007-09-21,2012-12-21,"Private, ltd by shares"175,1169412,"HONGKONG RUNDA INTERNATIONAL INVESTMENT CONSULTANT MANAGEMENT LIMITED
香港潤達國際投資諮詢管理有限公司",2007-09-21,2011-05-27,"Private, ltd by shares"176,1169317,"HOPE TOUGH (HONG KONG) LIMITED
浩毅(香港)有限公司",2007-09-21,2011-06-03,"Private, ltd by shares"177,1169574,"HUAQI MACHINERY (HK) GROUP LIMITED
華企機械(香港)集團有限公司",2007-09-21,2012-12-21,"Private, ltd by shares"178,1169497,"HUGE FOCUS LIMITED (d2015-05-08)
巨鋒有限公司",2007-09-21,2015-05-08,"Private, ltd by shares"179,1169428,"HUGE LINK (HK) LIMITED
巨興(香港)有限公司",2007-09-21,2011-02-25,"Private, ltd by shares"180,1169505,"HYPERION WORLD LIMITED",2007-09-21,2012-01-27,"Private, ltd by shares"181,1169449,"Infinity Eight Trading Company Limited",2007-09-21,2017-12-01,"Private, ltd by shares"182,1169560,"INTERFID LIMITED",2007-09-21,,"Private, ltd by shares"183,1169240,"Intermediary Platform Co Limited
中介平台服務有限公司",2007-09-21,,"Private, ltd by shares"184,1169576,"INUSS (H.K.) CO. LIMITED",2007-09-21,2013-05-03,"Private, ltd by shares"185,1169432,"ITACHI INTERNATIONAL LIMITED
中億國際企業有限公司",2007-09-21,2015-01-30,"Private, ltd by shares"186,1169309,"ITAKE LIMITED (d2009-08-14)
億德(香港)有限公司",2007-09-21,2009-08-14,"Private, ltd by shares"187,1169426,"J&amp;A BROTHERS LIMITED",2007-09-21,2011-05-27,"Private, ltd by shares"188,1169528,"JANCON LIMITED (d2013-04-05)
兆高有限公司",2007-09-21,2013-04-05,"Private, ltd by shares"189,1169487,"JAPAN FINE WORKMANSHIP REFRIGERANT MATERIAL LIMITED
日本精工冷凍材料有限公司",2007-09-21,2015-09-04,"Private, ltd by shares"190,1169304,"JAPAN SANYANG ELECTRICAL APPLIANCES INT'L LIMITED
日本三洋電器國際有限公司",2007-09-21,2010-03-19,"Private, ltd by shares"191,1169396,"JOHNNY TRAVEL INTERNATIONAL LIMITED
巨星國際旅遊有限公司",2007-09-21,,"Private, ltd by shares"192,1169243,"JOHNSON INDUSTRIAL COMPANY LIMITED
忠信實業有限公司",2007-09-21,,"Private, ltd by shares"193,1169199,"JOINBEST CORPORATION LIMITED
聯佳興業有限公司",2007-09-21,2014-07-04,"Private, ltd by shares"194,1169442,"JOINT SUCCESS PROPERTIES LIMITED
進昇置業有限公司",2007-09-21,,"Private, ltd by shares"195,1169389,"K &amp; N ENGINEERING COMPANY LIMITED
傑毅工程有限公司",2007-09-21,,"Private, ltd by shares"196,1169404,"Kate &amp; McKenzie (HK) Limited
啟致(香港)有限公司",2007-09-21,2015-01-30,"Private, ltd by shares"197,1169204,"KDF INTERNATIONAL COMPANY LIMITED
康德豐國際貿易有限公司",2007-09-21,2013-11-22,"Private, ltd by shares"198,1169369,"KEYMAN PRODUCTION LIMITED
鎖匙人製作有限公司",2007-09-21,,"Private, ltd by shares"199,1169227,"KING LOYAL INVESTMENT LIMITED
威來投資有限公司",2007-09-21,2012-05-04,"Private, ltd by shares"200,1169597,"KING SHINE CORPORATION LIMITED (d2010-07-16)
京明有限公司",2007-09-21,2010-07-16,"Private, ltd by shares"201,1169513,"KING TECH LIMITED (d2018-05-18)
勁迪有限公司",2007-09-21,2018-05-18,"Private, ltd by shares"202,1169290,"KINGDOM LINK HOLDINGS LIMITED
皇聯集團有限公司",2007-09-21,,"Private, ltd by shares"203,1169527,"KINGS INTERNATIONAL GROUP (HK) LIMITED
錦洲國際集團(香港)有限公司",2007-09-21,,"Private, ltd by shares"204,1169226,"KONG WA HOLDINGS LIMITED
港華集團有限公司",2007-09-21,2011-05-27,"Private, ltd by shares"205,1169392,"KOREA TSDN DRESS LIMITED
韓國泰絲蒂諾服飾有限公司",2007-09-21,2011-05-27,"Private, ltd by shares"206,1169363,"KRD DEVELOPMENT COMPANY LIMITED
豐源拓展有限公司",2007-09-21,2011-05-27,"Private, ltd by shares"207,1169463,"KUNGLORY LIMITED
裕棠企業有限公司",2007-09-21,2011-03-04,"Private, ltd by shares"208,1169593,"KUNMING GUANSHENGYUAN GROUP LIMITED
昆明冠生園集團有限公司",2007-09-21,2011-05-27,"Private, ltd by shares"209,1169595,"KUNMING JIQINGXIANG GROUP LIMITED
昆明吉慶祥集團有限公司",2007-09-21,2011-05-27,"Private, ltd by shares"210,1169335,"LABSIC GROUP HONG KONG LIMITED
樂鉑斯集團香港有限公司",2007-09-21,2012-08-03,"Private, ltd by shares"211,1169421,"LABTECH INSTRUMENTS (HONG KONG) LIMITED
萊伯泰科儀器(香港)有限公司",2007-09-21,2015-03-27,"Private, ltd by shares"212,1169393,"LAVEN ELECTRON (HK) LIMITED
拉文電子(香港)有限公司",2007-09-21,2017-01-06,"Private, ltd by shares"213,1169301,"LE SOLEIL INTERNATIONAL HOLDINGS LIMITED",2007-09-21,,"Private, ltd by shares"214,1169322,"LEADER LUXURY HOLDINGS LIMITED
領豪集團有限公司",2007-09-21,2011-05-27,"Private, ltd by shares"215,1169413,"LEISURE INTERNATIONAL LIMITED
丰日國際有限公司",2007-09-21,,"Private, ltd by shares"216,1169285,"LIHEBO INT'L INVESTMENT GROUP (HK) LIMITED
利河伯國際投資集團(香港)有限公司",2007-09-21,,"Private, ltd by shares"217,1169357,"LIHENSE ELECTRONIC CO., LIMITED
新力合電子(香港)有限公司",2007-09-21,2019-11-01,"Private, ltd by shares"218,1169391,"LIN SIN LEASING COMPANY LIMITED
領先租賃有限公司",2007-09-21,2014-12-05,"Private, ltd by shares"219,1169563,"LINZOOM INVESTMENT AND DEVELOPMENT CO., LIMITED
領宙投資發展有限公司",2007-09-21,,"Private, ltd by shares"220,1169510,"LIONS CLUB OF HARBOUR VIEW CHARITY FOUNDATION LIMITED
維港獅子會慈善基金有限公司",2007-09-21,,"Ltd by guarantee"221,1169509,"LORDTON LIMITED
萊登有限公司",2007-09-21,,"Private, ltd by shares"222,1169535,"LUCKY RICH LIMITED (d2015-02-27)
六發有限公司",2007-09-21,2015-02-27,"Private, ltd by shares"