,Reg no.,Name,Incorp-orated,Dissolved,Type223,1169467,"LUEN SUI TECHNOLOGY (HK) LIMITED
聯瑞科技(香港)有限公司",2007-09-21,2012-04-20,"Private, ltd by shares"224,1169218,"Luxbrands International Group Limited
銳港名店國際集團有限公司",2007-09-21,,"Private, ltd by shares"225,1169359,"LUXURY GEMS INTERNATIONAL LIMITED
宏豐寶石國際有限公司",2007-09-21,,"Private, ltd by shares"226,1169362,"M H L ENERGY LIMITED
美荷發展有限公司",2007-09-21,2012-12-21,"Private, ltd by shares"227,1169468,"MAIN FORUM INTERNATIONAL LIMITED
集揚國際有限公司",2007-09-21,,"Private, ltd by shares"228,1169388,"MANCHESTER INTERNATIONAL LIMITED
文昌國際有限公司",2007-09-21,2019-03-29,"Private, ltd by shares"229,1169460,"Mapletree MIC Shenyang SA (HKSAR) Limited",2007-09-21,,"Private, ltd by shares"230,1169525,"MARS CORPORATION LIMITED (d2009-09-11)
馬仕有限公司",2007-09-21,2009-09-11,"Private, ltd by shares"231,1169222,"MAX BLOOM HOLDINGS LIMITED
隆盛集團有限公司",2007-09-21,,"Private, ltd by shares"232,1169220,"MAX FAME TECHNOLOGY DEVELOPMENT LIMITED
裕榮科技發展有限公司",2007-09-21,2013-04-05,"Private, ltd by shares"233,1169216,"MAX VANTAGE INVESTMENT LIMITED (d2016-05-20)
廣益投資有限公司",2007-09-21,2016-05-20,"Private, ltd by shares"234,1169474,"MEGA DEPOT GROUP LIMITED
錦財集團有限公司",2007-09-21,2017-10-20,"Private, ltd by shares"235,1169215,"MEGA FAIR TRADING LIMITED
萬誠貿易有限公司",2007-09-21,,"Private, ltd by shares"236,1169212,"MEGA UNION INVESTMENT LIMITED (d2010-03-19)
百聯投資有限公司",2007-09-21,2010-03-19,"Private, ltd by shares"237,1169377,"METRO CHAMPION INVESTMENTS LIMITED
文昌投資有限公司",2007-09-21,,"Private, ltd by shares"238,1169464,"METRO SEA LIMITED
廣越有限公司",2007-09-21,,"Private, ltd by shares"239,1169262,"MH (HONGKONG) INTERNATIONAL WINE CO., LIMITED
酩匯(香港)國際酒業有限公司",2007-09-21,2011-05-27,"Private, ltd by shares"240,1169251,"MILANO INVESTMENTS LIMITED",2007-09-21,2020-03-27,"Private, ltd by shares"241,1169334,"MILLENNIUM INTERNATIONAL FINANCIAL LIMITED",2007-09-21,2018-05-18,"Private, ltd by shares"242,1169287,"MILLION RAINBOW INTERNATIONAL LIMITED
萬虹國際有限公司",2007-09-21,,"Private, ltd by shares"243,1169458,"MK INTERNATIONAL TRADING COMPANY LIMITED
馬克國際有限公司",2007-09-21,2012-03-02,"Private, ltd by shares"244,1169352,"MODEL ONE LIMITED
天驕模特兒管理有限公司",2007-09-21,,"Private, ltd by shares"245,1169315,"MONTRASIO INTERNATIONAL LIMITED
孟特利歐國際有限公司",2007-09-21,2012-12-21,"Private, ltd by shares"246,1169541,"MUSIC POWERHOUSE LIMITED
無限音樂科技有限公司",2007-09-21,,"Private, ltd by shares"247,1169208,"MUTUAL STAR ENTERPRISE LIMITED
普星企業有限公司",2007-09-21,2012-12-21,"Private, ltd by shares"248,1169356,"NATURAL ALLIED LIMITED
然匯有限公司",2007-09-21,2012-12-21,"Private, ltd by shares"249,1169194,"Natural Network Limited
自然脈絡有限公司",2007-09-21,,"Private, ltd by shares"250,1169605,"NDT L 3 WW LIMITED",2007-09-21,,"Private, ltd by shares"251,1169559,"NEW FUTURE (H.K.) LIMITED
新未來(香港)有限公司",2007-09-21,2013-06-07,"Private, ltd by shares"252,1169573,"NEW POND LIMITED
新塘有限公司",2007-09-21,,"Private, ltd by shares"253,1169205,"NEW STATE TRADING LIMITED (d2011-05-27)
新邦貿易有限公司",2007-09-21,2011-05-27,"Private, ltd by shares"254,1169250,"NEW TREND TECHNOLOGY LIMITED (d2011-05-27)
新建科技有限公司",2007-09-21,2011-05-27,"Private, ltd by shares"255,1169268,"NEWS FRONTIER DEVELOPMENT LIMITED
訊拓發展有限公司",2007-09-21,2015-01-30,"Private, ltd by shares"256,1169339,"NGAI DRAGON TRANSPORTATION LIMITED
藝龍運輸有限公司",2007-09-21,,"Private, ltd by shares"257,1169211,"NGAI YEUNG LIMITED
毅揚有限公司",2007-09-21,2015-03-06,"Private, ltd by shares"258,1169329,"NINEHILLS INTERNATIONAL TRADE LIMITED
玖山國際貿易有限公司",2007-09-21,,"Private, ltd by shares"259,1169445,"NIYU 258 (HK) INVESTMENT LIMITED
擬宇258(香港)投資有限公司",2007-09-21,2011-05-27,"Private, ltd by shares"260,1169434,"NOBLE CROWN PROPERTIES LIMITED
皇冠置業有限公司",2007-09-21,2019-06-28,"Private, ltd by shares"261,1169451,"NORK LIGHTING CO. LIMITED
諾克照明電器有限公司",2007-09-21,2012-02-24,"Private, ltd by shares"262,1169466,"NOW RICH LIMITED
保愉有限公司",2007-09-21,,"Private, ltd by shares"263,1169277,"PALM FULL DEVELOPMENT LIMITED
棕盛發展有限公司",2007-09-21,,"Private, ltd by shares"264,1169587,"PANDALINK INTERNATIONAL LIMITED
豐竹國際有限公司",2007-09-21,,"Private, ltd by shares"265,1169248,"PEACE STAR HOLDINGS LIMITED
和星集團有限公司",2007-09-21,2017-05-19,"Private, ltd by shares"266,1169232,"PHOENIX LINK LIMITED
鳳匯有限公司",2007-09-21,2015-09-11,"Private, ltd by shares"267,1169390,"PINE STREET CAPITAL ADVISORS (HK) LIMITED",2007-09-21,2009-05-08,"Private, ltd by shares"268,1169406,"Plinth Co., Limited",2007-09-21,2009-11-27,"Private, ltd by shares"269,1169601,"POLEE GROUP CO., LIMITED
博遠集團有限公司",2007-09-21,2013-04-12,"Private, ltd by shares"270,1169280,"POLY PILOT INTERNATIONAL LIMITED
信昂國際有限公司",2007-09-21,2011-05-27,"Private, ltd by shares"271,1169292,"POWER TRANSPORTATION CHINA HONG KONG LIMITED
力駒貨運中港有限公司",2007-09-21,,"Private, ltd by shares"272,1169522,"PRESTIGE ALLIANCE LIMITED (d2011-03-25)
燦昇有限公司",2007-09-21,2011-03-25,"Private, ltd by shares"273,1169511,"PRESTIGE PROFIT LIMITED
燦利有限公司",2007-09-21,2011-09-23,"Private, ltd by shares"274,1169366,"PRIME VISION LIMITED (d2011-05-06)
培瑛有限公司",2007-09-21,2011-05-06,"Private, ltd by shares"275,1169498,"ProLab Tech Limited
保立科技有限公司",2007-09-21,,"Private, ltd by shares"276,1169531,"PROWELL INVESTMENT LIMITED
寶偉投資有限公司",2007-09-21,2014-01-03,"Private, ltd by shares"277,1169368,"Quanzhou Befair Bags Co., Limited
泉州碧輝包袋有限公司",2007-09-21,,"Private, ltd by shares"278,1169314,"QUICK LINK INTERNATIONAL GROUP LIMITED",2007-09-21,2012-12-21,"Private, ltd by shares"279,1169539,"QUN JIA INDUSTRIAL (HONG KONG) COMPANY LIMITED
群佳實業 (香港) 有限公司",2007-09-21,2012-12-21,"Private, ltd by shares"280,1169257,"RAINBOW DRAGON TRADING LIMITED (d2011-05-27)
采龍貿易有限公司",2007-09-21,2011-05-27,"Private, ltd by shares"281,1169584,"REPHIDIM ASSET MANAGEMENT (HK) CO., LIMITED",2007-09-21,2012-12-21,"Private, ltd by shares"282,1169244,"RICH LOYAL INVESTMENT LIMITED
富臨投資有限公司",2007-09-21,,"Private, ltd by shares"283,1169600,"RICHWILL SHIPPING HOLDINGS LIMITED
怡運海運控股有限公司",2007-09-21,,"Private, ltd by shares"284,1169473,"RIGHT POLE INVESTMENTS LIMITED
尚弘投資有限公司",2007-09-21,,"Private, ltd by shares"285,1169242,"RISE STAR TRADING LIMITED
晉星貿易有限公司",2007-09-21,2018-02-09,"Private, ltd by shares"286,1169239,"RIVER ENTERPRISE LIMITED
裕江企業有限公司",2007-09-21,2011-05-27,"Private, ltd by shares"287,1169557,"RIXINSHENG MOLD (HK) CO., LIMITED
日欣盛模具(香港)有限公司",2007-09-21,,"Private, ltd by shares"288,1169485,"ROAMER WATCHES HOLDING LIMITED
羅馬鐘錶控股有限公司",2007-09-21,,"Private, ltd by shares"289,1169575,"ROUNDWAY (H.K) INDUSTRY GROUP CO., LIMITED
圓通(香港)實業集團有限公司",2007-09-21,,"Private, ltd by shares"290,1169578,"ROYAL CHART LIMITED
公澤有限公司",2007-09-21,2009-09-11,"Private, ltd by shares"291,1169540,"ROYAL PRINCESS LIMITED
公子有限公司",2007-09-21,2014-01-03,"Private, ltd by shares"292,1169338,"S INTERIOR DESIGN LIMITED",2007-09-21,,"Private, ltd by shares"293,1169453,"SAM TAT ENGINEERING LIMITED
三達工程有限公司",2007-09-21,2012-01-06,"Private, ltd by shares"294,1169481,"SAMMAX INVESTMENTS LIMITED
佳幸投資有限公司",2007-09-21,,"Private, ltd by shares"295,1169409,"SANLIAN MACHINE (HK) CO., LIMITED
三聯機械(香港)有限公司",2007-09-21,2012-12-21,"Private, ltd by shares"296,1169312,"SAPPHIRE DELIGHT LIMITED (d2015-02-27)
蔚樂有限公司",2007-09-21,2015-02-27,"Private, ltd by shares"297,1169472,"SEATO LIMITED (HK)
盛圖(香港)有限公司",2007-09-21,,"Private, ltd by shares"298,1169319,"SEEPOWER TECHNOLOGY LIMITED
視寶嘉科技有限公司",2007-09-21,2020-03-27,"Private, ltd by shares"299,1169555,"SHANGHAI XIONGMAO CABLE TECHNOLOGY LIMITED
上海熊貓電線電纜科技有限公司",2007-09-21,,"Private, ltd by shares"300,1169543,"SHARE PROFIT LIMITED
派盈有限公司",2007-09-21,2009-09-11,"Private, ltd by shares"301,1169545,"SHARE WELL LIMITED
派滙有限公司",2007-09-21,2019-09-27,"Private, ltd by shares"302,1169589,"SHENGFU COAL INDUSTRY JIAODIAN LIMITED
聖富煤業焦電有限公司",2007-09-21,2011-05-27,"Private, ltd by shares"303,1169508,"SHINY RAY LIMITED
順希有限公司",2007-09-21,2013-07-26,"Private, ltd by shares"304,1169275,"SILK GLOBE CO., LIMITED
希合國際有限公司",2007-09-21,2011-06-03,"Private, ltd by shares"305,1169305,"SINCE INT'L HOLDING LIMITED
星氏國際控股有限公司",2007-09-21,2011-11-04,"Private, ltd by shares"306,1169351,"SINO COSMOS INTERNATIONAL LIMITED
中灝國際有限公司",2007-09-21,,"Private, ltd by shares"307,1169235,"SINO DRAGON TRADING LIMITED
漢龍貿易有限公司",2007-09-21,,"Private, ltd by shares"308,1169296,"SINO FOREST HOLDINGS LIMITED
華森集團有限公司",2007-09-21,,"Private, ltd by shares"309,1169234,"SINO KING ASIA PACIFIC LIMITED
中威亞太有限公司",2007-09-21,2009-07-31,"Private, ltd by shares"310,1169308,"SINOSI OIL &amp; CHEMICAL LIMITED
中彰石化有限公司",2007-09-21,2016-12-30,"Private, ltd by shares"311,1169429,"SKY BILLION INVESTMENT LIMITED
軒億投資有限公司",2007-09-21,2015-04-24,"Private, ltd by shares"312,1169603,"SKY CENTER TECHNOLOGY LIMITED
中天盛科技有限公司",2007-09-21,2014-01-03,"Private, ltd by shares"313,1169471,"SLIMMING MEDICAL BEAUTY CENTRE LIMITED
醫學纖形美容中心有限公司",2007-09-21,2015-12-24,"Private, ltd by shares"314,1169427,"SMOOTHWAY INVESTMENT LIMITED (d2013-03-01)
迎順投資有限公司",2007-09-21,2013-03-01,"Private, ltd by shares"315,1169417,"SOLAR CREATION LIMITED
旭昇創建有限公司",2007-09-21,,"Private, ltd by shares"316,1169375,"SPC SERVICE LIMITED",2007-09-21,2015-09-04,"Private, ltd by shares"317,1169518,"SPOTACT LIMITED
津泰有限公司",2007-09-21,2018-05-25,"Private, ltd by shares"318,1169316,"SPREAD COMET HOLDINGS LIMITED
展彗集團有限公司",2007-09-21,,"Private, ltd by shares"319,1169297,"SPREAD SHEEN INTERNATIONAL LIMITED
展燿國際有限公司",2007-09-21,,"Private, ltd by shares"320,1169245,"SSS ASIAN ENTERPRISES HONG KONG LIMITED",2007-09-21,,"Private, ltd by shares"321,1169565,"STAR EASY LIMITED
薏昇有限公司",2007-09-21,2013-12-27,"Private, ltd by shares"322,1169370,"Starr Healthcare No.1 Limited",2007-09-21,2010-01-22,"Private, ltd by shares"323,1169440,"Starr Healthcare No.2 Limited",2007-09-21,2010-01-29,"Private, ltd by shares"324,1169195,"STYLE &amp; SHADES (HK) LIMITED",2007-09-21,,"Private, ltd by shares"325,1169231,"SUN ELEGANT INVESTMENT LIMITED
麗明投資有限公司",2007-09-21,2009-12-18,"Private, ltd by shares"326,1169282,"SUN WEALTH HOLDINGS LIMITED
旭源集團有限公司",2007-09-21,,"Private, ltd by shares"327,1169489,"SUNNI INTERNATIONAL GROUP LIMITED
桑尼國際集團有限公司",2007-09-21,2020-06-19,"Private, ltd by shares"328,1169561,"SUNNY SPEED LIMITED
舜捷有限公司",2007-09-21,,"Private, ltd by shares"329,1169252,"SUNSHINE FAST (HONG KONG) LIMITED
晴捷(香港)有限公司",2007-09-21,2019-03-08,"Private, ltd by shares"330,1169228,"SUNTANDY ELECTRONICS TECHNOLOGY CO., LIMITED
新特爾電子科技有限公司",2007-09-21,2011-05-27,"Private, ltd by shares"331,1169571,"SURE GRAND LIMITED (d2010-07-02)
定嘉有限公司",2007-09-21,2010-07-02,"Private, ltd by shares"332,1169273,"SURPLUS HILL CORPORATION LIMITED
盈峰興業有限公司",2007-09-21,,"Private, ltd by shares"333,1169534,"SURPLUS TOP LIMITED
裕拓有限公司",2007-09-21,,"Private, ltd by shares"334,1169422,"SURPLUS YEAR (ASIA) LIMITED
裕年(亞洲)有限公司",2007-09-21,,"Private, ltd by shares"335,1169271,"TALENT SMART ENTERPRISE LIMITED
創俊企業有限公司",2007-09-21,2013-04-12,"Private, ltd by shares"336,1169270,"TALENT STAR ENGINEERING LIMITED (d2011-05-13)
駿星工程有限公司",2007-09-21,2011-05-13,"Private, ltd by shares"337,1169267,"TALENT SUN INVESTMENT LIMITED
迪暉投資有限公司",2007-09-21,2017-06-09,"Private, ltd by shares"338,1169506,"TARGET TOP LIMITED
泰彤有限公司",2007-09-21,2015-01-30,"Private, ltd by shares"339,1169580,"TATA GLOBAL LIMITED
他她世界有限公司",2007-09-21,,"Private, ltd by shares"340,1169493,"TAXUS RESOURCES GROUP (HOLDINGS) LIMITED
紫杉源集團(控股)有限公司",2007-09-21,2009-08-14,"Private, ltd by shares"341,1169265,"TEAM LAND INVESTMENT LIMITED (d2014-01-30)
滙原投資有限公司",2007-09-21,2014-01-30,"Private, ltd by shares"342,1169400,"TIBMILLER INTERNATIONAL LIMITED",2007-09-21,2015-07-24,"Private, ltd by shares"343,1169415,"TNF Consultancy Limited
天富康健顧問有限公司",2007-09-21,2018-04-20,"Private, ltd by shares"344,1169554,"TOFFLON INTERNATIONAL LIMITED
東富龍國際有限公司",2007-09-21,2009-03-13,"Private, ltd by shares"345,1169607,"TOP AIR INTERNATIONAL LIMITED
德威(香港)國際有限公司",2007-09-21,2017-02-03,"Private, ltd by shares"346,1169414,"TOP ALLIANCE INC. LIMITED
拓昇興業有限公司",2007-09-21,,"Private, ltd by shares"347,1169263,"TOP GRAND TECHNOLOGY LIMITED
宏昇科技有限公司",2007-09-21,2018-11-16,"Private, ltd by shares"348,1169260,"TOP KEEN ASIA PACIFIC LIMITED
銳高亞太有限公司",2007-09-21,,"Private, ltd by shares"349,1169259,"TOP SHINE TECHNOLOGY DEVELOPMENT LIMITED
昇輝科技發展有限公司",2007-09-21,2019-09-20,"Private, ltd by shares"350,1169256,"TOP SURPLUS TRADING LIMITED (d2011-06-03)
盈天貿易有限公司",2007-09-21,2011-06-03,"Private, ltd by shares"351,1169529,"TOPCON CORPORATION LIMITED
拓康有限公司",2007-09-21,,"Private, ltd by shares"352,1169441,"TRAVELTEC International - Asia Limited",2007-09-21,,"Private, ltd by shares"353,1169477,"TREAD UP INTERNATIONAL LIMITED
錦博國際有限公司",2007-09-21,2011-05-27,"Private, ltd by shares"354,1169475,"TRIMMING STAR GROUP LIMITED
喜業集團有限公司",2007-09-21,,"Private, ltd by shares"355,1169371,"TRINITY FORTUNE DEVELOPMENT LIMITED
富坤發展有限公司",2007-09-21,,"Private, ltd by shares"356,1169532,"TRIPLE SOURCES LIMITED
三本有限公司",2007-09-21,2018-04-20,"Private, ltd by shares"357,1169291,"TRIUMPH WIDER INTERNATIONAL LIMITED
勝宏國際有限公司",2007-09-21,2014-03-21,"Private, ltd by shares"358,1169594,"TRUE STRONG LIMITED (d2010-07-16)
真堅有限公司",2007-09-21,2010-07-16,"Private, ltd by shares"359,1169558,"TRUFUL LIMITED
卓丰有限公司",2007-09-21,,"Private, ltd by shares"360,1169210,"TRULY AMASS INFORMATION TECHNOLOGY CO., LIMITED
信積信息科技有限公司",2007-09-21,,"Private, ltd by shares"361,1169253,"TRUMP ENGINEERING LIMITED (d2016-01-29)
勝利工程有限公司",2007-09-21,2016-01-29,"Private, ltd by shares"362,1169478,"TRUMP WAVE INVESTMENTS LIMITED
貿迅投資有限公司",2007-09-21,2015-04-02,"Private, ltd by shares"363,1169444,"TRUSTY ENGINEERING (INTERNATIONAL) LIMITED
信誠工程(國際)有限公司",2007-09-21,2018-04-20,"Private, ltd by shares"364,1169572,"U.S.A. AOXUE ORAL CAVITY TEND CENTER (HK) LIMITED
美國澳雪口腔護理中心(香港)有限公司",2007-09-21,2012-12-21,"Private, ltd by shares"365,1169367,"UNIQUE BRIGHT INTERNATIONAL LIMITED
旭暉國際有限公司",2007-09-21,2015-06-19,"Private, ltd by shares"366,1169219,"UNITED BEST TECHNOLOGY LIMITED
晉滙科技有限公司",2007-09-21,2014-01-03,"Private, ltd by shares"367,1169306,"UNITED INVESTMENT (HK) LIMITED
聯邦投資(香港)有限公司",2007-09-21,2009-06-05,"Private, ltd by shares"368,1169386,"UNIVERSKY INTERNATIONAL LEADING LIMITED
慧騰達通國際先導有限公司",2007-09-21,,"Private, ltd by shares"369,1169582,"UP (UNIVERSALPOWER) INDUSTRY LIMITED
浩宇實業發展有限公司",2007-09-21,2014-01-03,"Private, ltd by shares"370,1169399,"USA CARGILL INT'L CHEMICAL TECHNOLOGY HOLDING GROUP LIMITED
美國嘉吉國際化工科技控股集團有限公司",2007-09-21,2011-05-27,"Private, ltd by shares"371,1169482,"USA SUNISO INT'L GROUP HOLDINGS LIMITED
美國太陽國際集團控股有限公司",2007-09-21,2015-09-11,"Private, ltd by shares"372,1169503,"V Cycle Company Limited
樂循環有限公司",2007-09-21,,"Private, ltd by shares"373,1169479,"VAST ASSET LIMITED (d2014-08-22)
佰泰有限公司",2007-09-21,2014-08-22,"Private, ltd by shares"374,1169585,"VICTORY ELITE COMPANY LIMITED
威宜貿易有限公司",2007-09-21,2019-11-22,"Private, ltd by shares"375,1169483,"VIEW WIN INVESTMENTS LIMITED
晉沛投資有限公司",2007-09-21,2009-06-26,"Private, ltd by shares"376,1169476,"VIGARON INTERNATIONAL LIMITED
創宜國際有限公司",2007-09-21,,"Private, ltd by shares"377,1169431,"W &amp; R LIMITED (d2012-04-13)",2007-09-21,2012-04-13,"Private, ltd by shares"378,1169495,"W Business Limited (HK)
宏晉商業服務有限公司",2007-09-21,,"Private, ltd by shares"379,1169469,"W.H. TRADING LIMITED (d2009-02-13)",2007-09-21,2009-02-13,"Private, ltd by shares"380,1169546,"WATERFULL LIMITED (HK)
泉水有限公司",2007-09-21,,"Private, ltd by shares"381,1169201,"WEALTH BILLION INVESTMENT LIMITED (d2014-01-03)
億丰投資有限公司",2007-09-21,2014-01-03,"Private, ltd by shares"382,1169221,"WEALTH PINE INVESTMENT LIMITED
康栢投資有限公司",2007-09-21,,"Private, ltd by shares"383,1169206,"WEALTH WAY ENGINEERING LIMITED
晉寶工程有限公司",2007-09-21,2015-10-23,"Private, ltd by shares"384,1169213,"WEALTHY BASE DEVELOPMENT LIMITED
康基發展有限公司",2007-09-21,,"Private, ltd by shares"385,1169586,"WEBBER COMPONENTS LIMITED
萬博集團有限公司",2007-09-21,2017-01-27,"Private, ltd by shares"386,1169197,"WELL ELEGANT DEVELOPMENT LIMITED
裕采發展有限公司",2007-09-21,,"Private, ltd by shares"387,1169286,"WELL JOY HOLDINGS LIMITED
利欣集團有限公司",2007-09-21,,"Private, ltd by shares"388,1169588,"WGD INTERNATIONAL LIMITED
王廣東國際有限公司",2007-09-21,,"Private, ltd by shares"389,1169310,"Whitebox (Hong Kong) Limited",2007-09-21,2020-06-19,"Private, ltd by shares"390,1169207,"WHOLE GOLD INTERNATIONAL STOCK LIMITED
三金國際股份有限公司",2007-09-21,,"Private, ltd by shares"391,1169281,"WIDE CREATION DEVELOPMENT LIMITED
弘創發展有限公司",2007-09-21,,"Private, ltd by shares"392,1169278,"WIN GROUP TRADING LIMITED (d2011-05-27)
勝滙貿易有限公司",2007-09-21,2011-05-27,"Private, ltd by shares"393,1169402,"WINGS TIME INDUSTRIES LIMITED
穎時鐘錶實業有限公司",2007-09-21,,"Private, ltd by shares"394,1169480,"WINSON TERRACE INTERNATIONAL LIMITED
敦年國際有限公司",2007-09-21,2013-01-25,"Private, ltd by shares"395,1169288,"WISE BIRCH LIMITED
智樺有限公司",2007-09-21,2018-01-19,"Private, ltd by shares"396,1169608,"Woduschegg Limited",2007-09-21,2019-01-18,"Private, ltd by shares"397,1169261,"WORLDWIDE BUSINESS DEVELOPMENT LIMITED
宇業發展有限公司",2007-09-21,2013-05-10,"Private, ltd by shares"398,1169331,"XINGUIZU (HK) INTERNATIONAL GROUP LIMITED
新貴族(香港)國際集團有限公司",2007-09-21,2015-07-31,"Private, ltd by shares"399,1169604,"XIONG SHENG ELECTRONIC LIMITED
熊升電子有限公司",2007-09-21,2015-01-30,"Private, ltd by shares"400,1169266,"YI LONG (HONG KONG) LIMITED
易龍(香港)有限公司",2007-09-21,2018-11-16,"Private, ltd by shares"401,1169533,"YIELD KIT LIMITED
宇杰有限公司",2007-09-21,,"Private, ltd by shares"402,1169401,"YILAIGE (HK) SHOES LIMITED
依萊閣(香港)鞋業有限公司",2007-09-21,2011-06-03,"Private, ltd by shares"403,1169347,"YINLU HONGKONG INVESTMENT COMPANY LIMITED
香港垠祿投資有限公司",2007-09-21,2010-12-31,"Private, ltd by shares"404,1169350,"YINLU HONGKONG PROPERTY MANAGEMENT COMPANY LIMITED
香港垠祿物業管理有限公司",2007-09-21,2010-12-31,"Private, ltd by shares"405,1169387,"YIQI CO., LIMITED
熠祈有限公司",2007-09-21,,"Private, ltd by shares"406,1169494,"YORK OASIS LIMITED
仁奧有限公司",2007-09-21,,"Private, ltd by shares"407,1169448,"YORKLON WALLCOVERINGS (H.K.) LIMITED
約克倫牆紙牆布(香港)有限公司",2007-09-21,2016-04-29,"Private, ltd by shares"408,1169382,"YueGang Investment Company Limited
粵鋼置業有限公司",2007-09-21,2011-02-28,"Private, ltd by shares"409,1169556,"YUH JOU COMPANY LIMITED
(台灣)鈺洲有限公司",2007-09-21,,"Private, ltd by shares"410,1169457,"ZEAL ENGINEERING LIMITED
兆益工程有限公司",2007-09-21,2018-07-20,"Private, ltd by shares"411,1169198,"ZHEJIANG GENUINE CONSTRUCTION EQUIPMENT CO., LIMITED
浙江傑瑞英工程機械有限公司",2007-09-21,2018-05-18,"Private, ltd by shares"412,1169327,"ZHEN HUA INTERNATIONAL EDUCATION INVESTMENT GROUP LIMITED
振華國際教育投資集團有限公司",2007-09-21,2011-05-27,"Private, ltd by shares"413,1169255,"ZHENZHE INTERNATIONAL TRADE (H.K) CO., LIMITED
真哲國際貿易(香港)有限公司",2007-09-21,2012-02-24,"Private, ltd by shares"414,1169519,"ZHONGGANG TECHNOLOGY (H.K) CO., LIMITED
中港科技(香港)有限公司",2007-09-21,2014-01-03,"Private, ltd by shares"415,1169395,"ZHONGNONG INT'L FERTILIZER IMPORT &amp; EXPORT GROUP (XINJIANG) LIMITED
中農國際化肥進出口集團(新疆)有限公司",2007-09-21,2011-05-27,"Private, ltd by shares"