,Reg no.,Name,Incorp-orated,Dissolved,Type1,2917602,"Betterment Science Limited",2020-02-23,,"Private, ltd by shares"2,2917601,"Homtoc Technology Co., Limited
涵拓科技有限公司",2020-02-23,,"Private, ltd by shares"3,2917603,"ONS Service Limited
敖信有限公司",2020-02-23,,"Private, ltd by shares"4,2917600,"Twin Gates Management Consulting Co., Limited
雙門管理顧問有限公司",2020-02-23,,"Private, ltd by shares"5,2917599,"Xiang Rui Yun International Logistics Co., Limited
祥瑞云國際物流有限公司",2020-02-23,,"Private, ltd by shares"