,Reg no.,Name,Incorp-orated,Dissolved,Type1,3096181,"A. Star P. Marketing Limited
聚星圖有限公司",2021-10-25,,"Private, ltd by shares"2,3095776,"ABLE UNIVERSAL LIMITED
藝高環球有限公司",2021-10-25,,"Private, ltd by shares"3,3096094,"Abyssal Wealth (HK) Biological Industrial Limited
深海廣利(香港)生物實業有限公司",2021-10-25,,"Private, ltd by shares"4,3095798,"ACCESS HUMAN CAPITAL LIMITED",2021-10-25,,"Private, ltd by shares"5,3096174,"Aces Apparel Limited",2021-10-25,,"Private, ltd by shares"6,3095801,"Achelous Investment Limited",2021-10-25,,"Private, ltd by shares"7,3095786,"ACIT Group Limited
嘉堃集團有限公司",2021-10-25,,"Private, ltd by shares"8,3096184,"AD PLUS TRADING LIMITED",2021-10-25,,"Private, ltd by shares"9,3096116,"AGO MEDICAL DIAGNOSTIC IMAGING CENTRE LIMITED
領先醫學診斷掃描中心有限公司",2021-10-25,,"Private, ltd by shares"10,3096019,"Aksofar BIO Limited
耀遠生物有限公司",2021-10-25,,"Private, ltd by shares"11,3096060,"All in Life Shop Limited
晴凱有限公司",2021-10-25,,"Private, ltd by shares"12,3095835,"ALLY VENTURES LIMITED",2021-10-25,,"Private, ltd by shares"13,3096151,"ALNWICK ASIA LIMITED",2021-10-25,,"Private, ltd by shares"14,3095881,"AlphaMaker Limited",2021-10-25,,"Private, ltd by shares"15,3096053,"AN XIANG GROUP LIMITED",2021-10-25,,"Private, ltd by shares"16,3095869,"Aomei Zhongyuan Gene Technology Co., Limited
澳美中源基因科技有限公司",2021-10-25,,"Private, ltd by shares"17,3095876,"Aorui Culture Communication Limited
鰲瑞文化傳播有限公司",2021-10-25,,"Private, ltd by shares"18,3096016,"APPLO INTERNATIONAL (HONGKONG) CO., LIMITED
艾普勒國際(香港)有限公司",2021-10-25,,"Private, ltd by shares"19,3096044,"Aqua Electronics Trading Limited",2021-10-25,,"Private, ltd by shares"20,3096090,"AR GLOBAL TRADE AND LOGISTICS LIMITED
艾爾環球貿易物流有限公司",2021-10-25,,"Private, ltd by shares"21,3096107,"Arisi Partners Limited",2021-10-25,,"Private, ltd by shares"22,3096122,"Arterest Limited",2021-10-25,,"Private, ltd by shares"23,3096117,"ASIA INTER TRADING LIMITED
亞洲國際貿易有限公司",2021-10-25,,"Private, ltd by shares"24,3096186,"Auska international Limited
燊豐國際有限公司",2021-10-25,,"Private, ltd by shares"25,3096012,"Avalon Property Management Limited (HK)",2021-10-25,,"Private, ltd by shares"26,3095941,"Babychuuhk Limited",2021-10-25,,"Private, ltd by shares"27,3096095,"BAILEY TRADE LIMITED
柏睿貿易有限公司",2021-10-25,,"Private, ltd by shares"28,3096183,"Baohui Trading Co., Limited
保輝貿易有限公司",2021-10-25,,"Private, ltd by shares"29,3096017,"Beawin Industries Limited
因勝實業有限公司",2021-10-25,,"Private, ltd by shares"30,3096022,"BERTICAR INTERNATIONAL LIMITED",2021-10-25,,"Private, ltd by shares"31,3096084,"Best Craft Bath Kitchen Limited",2021-10-25,,"Private, ltd by shares"32,3095796,"Big Zeee Limited (The)",2021-10-25,,"Private, ltd by shares"33,3096101,"Bonjour New Retail Technology Limited
卓悅新零售科技有限公司",2021-10-25,,"Private, ltd by shares"34,3096056,"Bonjour New Retail Technology Management Limited
卓悅新零售科技管理有限公司",2021-10-25,,"Private, ltd by shares"35,3095913,"BONROY TRADE CO., LIMITED",2021-10-25,,"Private, ltd by shares"36,3096046,"Boonstar International Co., Limited
保斯特國際有限公司",2021-10-25,,"Private, ltd by shares"37,3096126,"BRISOL ELECTRONICS TRADING CO., LIMITED
睿晟電子貿易有限公司",2021-10-25,,"Private, ltd by shares"38,3096169,"BRITHTEN DRAGON TRADING DEVELOP LIMITED
輝龍行貿易拓展有限公司",2021-10-25,,"Private, ltd by shares"39,3096143,"Broad Yuhua (Hong Kong) International Trading Co., Limited
卓遠裕華(香港)國際商貿有限公司",2021-10-25,,"Private, ltd by shares"40,3095986,"Broccoli Vegan Cafe Company Limited (The)
西蘭花素食有限公司",2021-10-25,,"Private, ltd by shares"41,3096048,"BSL TRADING CO., LIMITED
寶詩萊貿易有限公司",2021-10-25,,"Private, ltd by shares"42,3095931,"Builtcon Limited",2021-10-25,,"Private, ltd by shares"43,3096025,"C.T MYSTERY LIMITED
燭印有限公司",2021-10-25,,"Private, ltd by shares"44,3096153,"Capsolo Limited",2021-10-25,,"Private, ltd by shares"45,3096140,"CASQUE CONSULTING LIMITED",2021-10-25,,"Private, ltd by shares"46,3095959,"CFIP LIMITED
中免國際平行進口有限公司",2021-10-25,,"Private, ltd by shares"47,3095928,"CHARMING HEALTH CARE CENTRE CO. LIMITED
雋溋沐足保健中心有限公司",2021-10-25,,"Private, ltd by shares"48,3095995,"Chem Shipping Limited",2021-10-25,,"Private, ltd by shares"49,3095784,"Cheung Shing Masonry Decoration Engineering Limited
祥盛泥水裝飾工程有限公司",2021-10-25,,"Private, ltd by shares"50,3095814,"China Technology Industry Energy Limited
中科產業能源有限公司",2021-10-25,,"Private, ltd by shares"51,3095926,"CHINA ZHENGHONG INDUSTRIAL CO., LIMITED
中國正泓實業集團有限公司",2021-10-25,,"Private, ltd by shares"52,3095894,"CHIPTEK ELECTRONICS LIMITED",2021-10-25,,"Private, ltd by shares"53,3096098,"Chow Four Trading Company Limited
炒貨有限公司",2021-10-25,,"Private, ltd by shares"54,3096055,"CHUN FUK CATERING LIMITED
駿福飲食有限公司",2021-10-25,,"Private, ltd by shares"55,3096074,"Chun Huan (HK) Technology Limited
純環（香港）科技有限公司",2021-10-25,,"Private, ltd by shares"56,3095808,"CHUN YIK TRANSPORTATION COMPANY LIMITED
進億運輸有限公司",2021-10-25,,"Private, ltd by shares"57,3095859,"CIAO GRAZIA FASHION CO., LIMITED
豪雅時尚有限公司",2021-10-25,,"Private, ltd by shares"58,3095918,"Cirrus Studio Limited",2021-10-25,,"Private, ltd by shares"59,3096023,"CITE SOLUTIONS (HK) CO., LIMITED",2021-10-25,,"Private, ltd by shares"60,3095983,"Clear Novel Materials (HK) Co., Limited
科麗爾新材料(香港)有限公司",2021-10-25,,"Private, ltd by shares"61,3095828,"COLOUR PLANTS MANAGEMENT LIMITED
同慶管理有限公司",2021-10-25,,"Private, ltd by shares"62,3096024,"Come First Engineering Co., Limited
浩蓉工程有限公司",2021-10-25,,"Private, ltd by shares"63,3096109,"Congqi Trading Co., Limited
從起貿易有限公司",2021-10-25,,"Private, ltd by shares"64,3096118,"Cool World (HK) Trade Limited
酷界(香港)貿易有限公司",2021-10-25,,"Private, ltd by shares"65,3095998,"Cosset Artist Management Limited
土城藝人管理有限公司",2021-10-25,,"Private, ltd by shares"66,3095908,"Cosset Entertainment Limited
土城娛樂有限公司",2021-10-25,,"Private, ltd by shares"67,3095774,"COURTWELL HOLDINGS LIMITED
國威控股有限公司",2021-10-25,,"Private, ltd by shares"68,3095789,"Cowendar Investment Limited",2021-10-25,,"Private, ltd by shares"69,3095802,"Darkhorse Holding Limited
黑馬控股有限公司",2021-10-25,,"Private, ltd by shares"70,3095896,"Deepreg doctor group (Hong Kong) Limited
香港善孕醫生集團有限公司",2021-10-25,,"Private, ltd by shares"71,3096148,"DEGLINGO TIM LIMITED",2021-10-25,,"Private, ltd by shares"72,3096115,"Dexiang Network Technology Co., Limited
德祥網絡科技責任有限公司",2021-10-25,,"Private, ltd by shares"73,3096182,"DHC Group Co., Limited
樂佳樂集團有限公司",2021-10-25,,"Private, ltd by shares"74,3095978,"Dingdonshop Limited",2021-10-25,,"Private, ltd by shares"75,3096000,"DIVUS HOLDING LIMITED (b2021-10-25)
非凡天地控股有限公司",2021-10-25,,"Private, ltd by shares"76,3095830,"DONGGUAN YINGTAI XINTONG ENERGY CO., LIMITED
東莞市盈泰芯通能源有限公司",2021-10-25,,"Private, ltd by shares"77,3096009,"Dr. Ankey So Clinic Limited",2021-10-25,,"Private, ltd by shares"78,3096128,"Duckduck Limited",2021-10-25,,"Private, ltd by shares"79,3096119,"DYSEAN HONG KONG GARMENT CO., LIMITED
黛雅森尚香港服裝有限公司",2021-10-25,,"Private, ltd by shares"80,3096139,"E-Commerce Operation Services Limited",2021-10-25,,"Private, ltd by shares"81,3095857,"Eastern District (HK) Trading Limited",2021-10-25,,"Private, ltd by shares"82,3095903,"EASTERN INTERNATIONAL SHIPPING (HK) LIMITED
正東國際航運(香港)有限公司",2021-10-25,,"Private, ltd by shares"83,3096167,"EASTERN METAL RESOURCES LIMITED
東盛金屬資源有限公司",2021-10-25,,"Private, ltd by shares"84,3096061,"EASY CONSULTANCY LIMITED
譽時顧問有限公司",2021-10-25,,"Private, ltd by shares"85,3095889,"Elementomic Analytics &amp; Diagnostics Limited
元譜有限公司",2021-10-25,,"Private, ltd by shares"86,3095902,"Elin International Trade Co., Limited
藝霖國際貿易有限公司",2021-10-25,,"Private, ltd by shares"87,LF7266353,"Elite Capital VI Limited Partnership Fund
溢聯六期投資有限合夥基金",2021-10-25,,"Limited Partnership Fund"88,LF7266354,"Elite Capital VII Limited Partnership Fund
溢聯七期投資有限合夥基金",2021-10-25,,"Limited Partnership Fund"89,LF7266355,"Elite Capital VIII Limited Partnership Fund
溢聯八期投資有限合夥基金",2021-10-25,,"Limited Partnership Fund"90,3096070,"Emmett (Hong Kong) Holding Limited
埃米特（香港）控股有限公司",2021-10-25,,"Private, ltd by shares"91,3096177,"Endoscopy Industry Alliance Co., Limited
內鏡產業聯盟有限公司",2021-10-25,,"Private, ltd by shares"92,3095975,"Evisne Co., Limited",2021-10-25,,"Private, ltd by shares"93,3095775,"EXCEL WIN ASIA LIMITED
卓勝亞洲有限公司",2021-10-25,,"Private, ltd by shares"94,3095942,"Excellent International Human Resources Limited
超級國際人力資源有限公司",2021-10-25,,"Private, ltd by shares"95,3095811,"EXPERT K1 LIMITED",2021-10-25,,"Private, ltd by shares"96,3095907,"Fa-Brother Engineering Company Limited
巴庫工程有限公司",2021-10-25,,"Private, ltd by shares"97,3096168,"FAITH KINDNESS TRADING DEVELOP LIMITED
仁信貿易拓展有限公司",2021-10-25,,"Private, ltd by shares"98,3095952,"FasionAI Holdings HK Limited",2021-10-25,,"Private, ltd by shares"99,3095964,"Fat Goose Company Limited",2021-10-25,,"Private, ltd by shares"100,3095937,"FCF6786 Limited
鳳誠鋒有限公司",2021-10-25,,"Private, ltd by shares"101,3095883,"FENG&amp;JUAN (H.K.) CO., LIMITED
晟和厚德(香港)貿易有限公司",2021-10-25,,"Private, ltd by shares"102,3096156,"Focus Marine Engineering (Hong Kong) Co., Limited",2021-10-25,,"Private, ltd by shares"103,3096102,"Forest Landscaping Services Limited
樹霖園藝有限公司",2021-10-25,,"Private, ltd by shares"104,3095855,"Forever Sunshine Limited
永光飲食有限公司",2021-10-25,,"Private, ltd by shares"105,3095797,"FORTUNE INCREMENT HOLDINGS LIMITED
增富集團有限公司",2021-10-25,,"Private, ltd by shares"106,3096013,"FU YUE F&amp;B CO. LIMITED
虎玥飲食有限公司",2021-10-25,,"Private, ltd by shares"107,3096067,"Fung Yee Company Limited
豐義有限公司",2021-10-25,,"Private, ltd by shares"108,3095826,"Funiu Information Technology Co., Limited
伏牛信息科技有限公司",2021-10-25,,"Private, ltd by shares"109,3095997,"Future Start Music Academy Company Limited
未來之星音樂學院有限公司",2021-10-25,,"Private, ltd by shares"110,3096104,"GAINLONG LIMITED
永利隆有限公司",2021-10-25,,"Private, ltd by shares"111,3095957,"GALLEON INTERNATIONAL HOLDINGS LIMITED
朗進國際集團有限公司",2021-10-25,,"Private, ltd by shares"112,3096166,"GBI TRADING SERVICES LIMITED
僑豐貿易服務有限公司",2021-10-25,,"Private, ltd by shares"113,3096099,"GCC Austen Partners Limited
金柬凱德資本有限公司",2021-10-25,,"Private, ltd by shares"114,3095992,"GENCHEN TRADING CO., LIMITED
亙辰貿易有限公司",2021-10-25,,"Private, ltd by shares"115,3095780,"GENUINE BRIGHT LIMITED
淳輝有限公司",2021-10-25,,"Private, ltd by shares"116,3096076,"Global Trends International Group Limited
壹線趨勢國際(集團)有限公司",2021-10-25,,"Private, ltd by shares"117,3096078,"GOLDEN WILL LIMITED
金成行有限公司",2021-10-25,,"Private, ltd by shares"118,3095788,"Golden-Wranker Investment Limited",2021-10-25,,"Private, ltd by shares"119,3096131,"Goodway Electronics Trading Co., Limited",2021-10-25,,"Private, ltd by shares"120,3095848,"GR ENERGY CO., LIMITED
天河能源發展有限公司",2021-10-25,,"Private, ltd by shares"121,3095893,"Gratefully Company Limited",2021-10-25,,"Private, ltd by shares"122,3095905,"GREAT EASTERN IMP AND EXP CO., LIMITED
東方偉業進出口有限公司",2021-10-25,,"Private, ltd by shares"123,3095773,"Greater Bay Area Hong Kong Bespoke Medical Service Center Company Limited
大灣區香港專屬醫療服務中心有限公司",2021-10-25,,"Private, ltd by shares"124,3095932,"GREATER BAY TRADING LIMITED
貝格瑞特貿易有限公司",2021-10-25,,"Private, ltd by shares"125,3095833,"Guanghua Shoes Material Limited
廣華鞋材有限公司",2021-10-25,,"Private, ltd by shares"126,3095842,"Guangyaoyang Co., Limited
光耀陽有限公司",2021-10-25,,"Private, ltd by shares"127,3095951,"Guizhou Maotai Guoyan Wine Shares Limited
貴州茅臺國宴酒業股份有限公司",2021-10-25,,"Private, ltd by shares"128,3095860,"H&amp;K AUDIO TECHNOLOGY LIMITED
加持音響科藝有限公司",2021-10-25,,"Private, ltd by shares"129,3095782,"HAI SOON INTERNATIONAL TRADING PTE LIMITED (b2021-10-25)
海順國際貿易私人有限公司",2021-10-25,,"Private, ltd by shares"130,3095971,"Haloyork Limited
科之美(香港)科技有限公司",2021-10-25,,"Private, ltd by shares"131,3095981,"HAMPTON ONE LIMITED",2021-10-25,,"Private, ltd by shares"132,3096100,"Handsome Decoration Design Limited
卿宸裝飾設計有限公司",2021-10-25,,"Private, ltd by shares"133,3095946,"Hangzhou Zhongce Technology Shares Limited
杭州中策科技股份有限公司",2021-10-25,,"Private, ltd by shares"134,3095969,"Hanwu Trading (HK) Limited",2021-10-25,,"Private, ltd by shares"135,3096112,"Hanyi Food Holding Group Co., Limited
含飴食品控股集團有限公司",2021-10-25,,"Private, ltd by shares"136,3096030,"HaoDing Transportation Limited
浩鼎運輸有限公司",2021-10-25,,"Private, ltd by shares"137,3095968,"HAOYUAN TRADING LIMITED
昊遠貿易有限公司",2021-10-25,,"Private, ltd by shares"138,3096152,"Harvest Full International Trading Limited
盈實國際貿易有限公司",2021-10-25,,"Private, ltd by shares"139,3096052,"HE YANG GROUP LIMITED",2021-10-25,,"Private, ltd by shares"140,3096123,"Healthy and Physiocare Group Limited
健康和理療集團有限公司",2021-10-25,,"Private, ltd by shares"141,3095888,"Heavy Chains Limited",2021-10-25,,"Private, ltd by shares"142,3095861,"HELLO BODY LIMITED
享瘦體齡管理有限公司",2021-10-25,,"Private, ltd by shares"143,3095977,"Hentrans Air Limited
金聯空運有限公司",2021-10-25,,"Private, ltd by shares"144,3095954,"HGW (HONG KONG) COMPANY LIMITED
恆基微香港有限公司",2021-10-25,,"Private, ltd by shares"145,3095817,"High Notes Music Limited",2021-10-25,,"Private, ltd by shares"146,3095898,"HK Bemod Holding Limited",2021-10-25,,"Private, ltd by shares"147,3096071,"Hk DGG Group Limited
香港法瑪集團有限公司",2021-10-25,,"Private, ltd by shares"148,3096121,"HK HENGTAI YONGSHENG INT'L CO., LIMITED
香港恒泰永盛國際有限公司",2021-10-25,,"Private, ltd by shares"149,3096154,"HK HESHUNXING TRADING LIMITED
香港禾順興貿易有限公司",2021-10-25,,"Private, ltd by shares"150,3096031,"HK HONGYUN INDUSTRIAL LIMITED
香港宏運實業有限公司",2021-10-25,,"Private, ltd by shares"151,3096072,"HK LANSHEDAI INT'L CULTURAL TRADE GROUP CO., LIMITED
香港蘭奢待國際文化貿易集團有限公司",2021-10-25,,"Private, ltd by shares"152,3096034,"HK LINGCHUANG INDUSTRIAL LIMITED
香港領闖實業有限公司",2021-10-25,,"Private, ltd by shares"153,3096147,"HK TEENAGERS BABUDOU SPORTING GOODS LIMITED
香港青少年巴布豆體育用品有限公司",2021-10-25,,"Private, ltd by shares"154,3096045,"HK YANGHUI CONSULTING LIMITED
香港陽暉諮詢有限公司",2021-10-25,,"Private, ltd by shares"155,3095984,"HK ZOVAN TRADING CO., LIMITED
香港卓凡貿易有限公司",2021-10-25,,"Private, ltd by shares"156,3095880,"HKC Capital Limited
港陸資本有限公司",2021-10-25,,"Private, ltd by shares"157,3095805,"HOI WAH HOLDINGS LIMITED
凱樺集團有限公司",2021-10-25,,"Private, ltd by shares"158,3095778,"HOKE INVESTMENTS LIMITED
昊基投資有限公司",2021-10-25,,"Private, ltd by shares"159,3095917,"Hong Kong Angel Art Troupe Company Limited
香港天使藝術團有限公司",2021-10-25,,"Private, ltd by shares"160,3096103,"Hong Kong BaoZhuangGe Limited
香港寶妝格有限公司",2021-10-25,,"Private, ltd by shares"161,3096073,"Hong Kong Biao Wan'an Technology Co., Limited
香港標萬安科技有限公司",2021-10-25,,"Private, ltd by shares"162,3096065,"Hong Kong Color Code Co., Limited",2021-10-25,,"Private, ltd by shares"163,3096014,"Hong Kong Core Rich Electronic Limited
香港芯隆電子有限公司",2021-10-25,,"Private, ltd by shares"164,3096049,"Hong Kong EverBeauty International Trading Co., Limited
香港大美國際貿易有限公司",2021-10-25,,"Private, ltd by shares"165,3096120,"Hong Kong Feng Yan Network Technology Co., Limited
香港豐焱網絡科技有限公司",2021-10-25,,"Private, ltd by shares"166,3096003,"HONG KONG HETAI PAPER LIMITED
香港和泰紙業有限公司",2021-10-25,,"Private, ltd by shares"167,3095882,"Hong Kong Huachen Investment Co., Limited
香港華辰投資有限公司",2021-10-25,,"Private, ltd by shares"168,3096036,"Hong Kong huaru Taoli Co., Limited
香港華如桃李有限公司",2021-10-25,,"Private, ltd by shares"169,3095967,"Hong Kong Hungsheng International Trading Co., Limited
香港宏盛國際貿易有限公司",2021-10-25,,"Private, ltd by shares"170,3095783,"Hong Kong Lanbaoquan Limited
香港蘭寶泉有限公司",2021-10-25,,"Private, ltd by shares"171,3095870,"Hong Kong Liyun Trading Co., Limited
香港利云貿易有限公司",2021-10-25,,"Private, ltd by shares"172,3095899,"Hong Kong Meige Makeup Limited
香港美格妝有限公司",2021-10-25,,"Private, ltd by shares"173,3095799,"Hong Kong Meik Limited
香港美可有限公司",2021-10-25,,"Private, ltd by shares"174,3096092,"Hong Kong Meiyi Beauty Limited
香港美憶美妝有限公司",2021-10-25,,"Private, ltd by shares"175,3095806,"Hong Kong Nenghuida Co., Limited
香港能慧達有限公司",2021-10-25,,"Private, ltd by shares"176,3096114,"Hong Kong Nice International Limited
香港奈斯國際有限公司",2021-10-25,,"Private, ltd by shares"177,3096047,"Hong Kong Pingshun Network Co., Limited
香港平順網絡有限公司",2021-10-25,,"Private, ltd by shares"178,3095935,"Hong Kong Resources Deyue Limited
香港資源德悅有限公司",2021-10-25,,"Private, ltd by shares"179,3095930,"Hong Kong Resources Jinhe Limited
香港資源錦合有限公司",2021-10-25,,"Private, ltd by shares"180,3095927,"Hong Kong Resources Jinyue Limited
香港資源錦悅有限公司",2021-10-25,,"Private, ltd by shares"181,3095919,"Hong Kong Resources Yinghe Limited
香港資源盈合有限公司",2021-10-25,,"Private, ltd by shares"182,3095906,"Hong Kong Resources Yingyue Limited
香港資源盈悅有限公司",2021-10-25,,"Private, ltd by shares"183,3095792,"Hong Kong Seafever Ship Management Co., Limited
香港海福瑞船舶管理有限公司",2021-10-25,,"Private, ltd by shares"184,3095892,"Hong Kong Skyline Design Center Co., Limited
香港天際設計中心有限公司",2021-10-25,,"Private, ltd by shares"185,3096064,"Hong Kong Stable Trading Limited
香港穩健貿易有限公司",2021-10-25,,"Private, ltd by shares"186,3096097,"HONG KONG WANBAOYUAN JEWELRY COMPANY LIMITED
香港萬寶源首飾有限公司",2021-10-25,,"Private, ltd by shares"187,3095958,"HONG KONG WANGXINXIN TRADING LIMITED
香港王鑫商貿有限公司",2021-10-25,,"Private, ltd by shares"188,3095990,"HONG KONG XELEX LIMITED
香港燊焱實業有限公司",2021-10-25,,"Private, ltd by shares"189,3096110,"Hong Kong Xingchi International Trade Co., Limited
香港星馳國際貿易有限公司",2021-10-25,,"Private, ltd by shares"190,3096081,"Hong Kong YaTingYuan Limited
香港雅婷苑有限公司",2021-10-25,,"Private, ltd by shares"191,3096088,"Hong Kong YaXinZhuang Limited
香港雅欣妝有限公司",2021-10-25,,"Private, ltd by shares"192,3095901,"HONG KONG YIMEILI TRADING CO., LIMITED
香港伊美貿易有限公司",2021-10-25,,"Private, ltd by shares"193,3095834,"Hong Kong Yuantian International Trade Co., Limited
香港遠天國際貿易有限公司",2021-10-25,,"Private, ltd by shares"194,3096180,"HONG KONG YUCHUAN TRADE DEVELOPMENT CO., LIMITED
香港玉川貿易拓展有限公司",2021-10-25,,"Private, ltd by shares"195,3095929,"Hong Kong Yuedong Network Technology Co., Limited
香港躍動網絡科技有限公司",2021-10-25,,"Private, ltd by shares"196,3095924,"Hongkong Bloomall International Trading Co., Limited
寶麗馬(香港)國際貿易有限公司",2021-10-25,,"Private, ltd by shares"197,3096137,"HONGKONG CAIFEI INTERNATIONAL HOLDINGS LIMITED
香港才妃國際控股有限公司",2021-10-25,,"Private, ltd by shares"198,3095877,"HONGKONG CHUN YU TRADING LIMITED
香港俊宇貿易有限公司",2021-10-25,,"Private, ltd by shares"199,3095985,"HONGKONG EERDUOSI APPAREL LIMITED
香港鄂爾多斯服飾有限公司",2021-10-25,,"Private, ltd by shares"200,3095994,"HongKong JiuShi Trading Limited
香港久石貿易有限公司",2021-10-25,,"Private, ltd by shares"201,3096108,"Hongkong Kobon Co., Limited
香港可邦有限公司",2021-10-25,,"Private, ltd by shares"202,3095886,"Hongkong Mirai Star Limited
香港未來新星有限公司",2021-10-25,,"Private, ltd by shares"203,3096068,"HongKong Phelps Academy Of Sciences Co., Limited
香港菲爾普思科學院有限公司",2021-10-25,,"Private, ltd by shares"204,3096162,"HONGKONG QIN YU CHENG ELECTRONICS CO., LIMITED
香港欽宇承電子有限公司",2021-10-25,,"Private, ltd by shares"205,3095966,"Hongkong Qiyue Technology Limited
香港奇躍科技有限公司",2021-10-25,,"Private, ltd by shares"206,3096029,"HongKong Richang Trading Limited
香港日暢貿易有限公司",2021-10-25,,"Private, ltd by shares"207,3095909,"Hongkong Tongyan International Development Co., Limited
香港同硯國際發展有限公司",2021-10-25,,"Private, ltd by shares"208,3096059,"HongKong Wyne Tranding Co., Limited
香港維致貿易有限公司",2021-10-25,,"Private, ltd by shares"209,3096087,"HRH TECHNOLOGY (HK) CO., LIMITED
合融匯科技 (香港) 有限公司",2021-10-25,,"Private, ltd by shares"210,3096011,"Huama Tengyun Trading Co., Limited
華馬騰雲貿易有限公司",2021-10-25,,"Private, ltd by shares"211,3096175,"Huazw Trading Limited
花之舞貿易有限公司",2021-10-25,,"Private, ltd by shares"212,LF7266356,"Huge Greater China Limited Partnership Fund
大丞粵港發展有限合夥基金",2021-10-25,,"Limited Partnership Fund"213,3095872,"Huixin I.T Holdings Limited
慧心互動科技控股有限公司",2021-10-25,,"Private, ltd by shares"214,3095961,"Huiyou Business Services Limited
匯友商務有限公司",2021-10-25,,"Private, ltd by shares"215,3095912,"Hundred Gain Investment Consultants Limited
佰利投資顧問有限公司",2021-10-25,,"Private, ltd by shares"216,LF7266352,"IMM Global Battery LPF",2021-10-25,,"Limited Partnership Fund"217,3096080,"Indacom Limited
英達康有限公司",2021-10-25,,"Private, ltd by shares"218,3095960,"Infinity Bearing &amp; Equipment Company Limited
無限軸承設備有限公司",2021-10-25,,"Private, ltd by shares"219,3096057,"Inspiration Dance &amp; Art Academy Limited
靈感舞蹈藝術學院有限公司",2021-10-25,,"Private, ltd by shares"220,3095923,"Insta Imaging Company Limited
醫達影像有限公司",2021-10-25,,"Private, ltd by shares"221,3095873,"Intercontinental Holding Group Limited
洲際控股集團有限公司",2021-10-25,,"Private, ltd by shares"222,3095810,"International Robot Education Development Association Limited
國際機器人教育發展協會有限公司",2021-10-25,,"Private, ltd by shares"223,3096135,"INTERNATIONAL TAEKWONDO ASSOCIATION LIMITED
國際跆拳道協會有限公司",2021-10-25,,"Private, ltd by shares"224,3095884,"InzTech Limited",2021-10-25,,"Private, ltd by shares"225,3096039,"Ipsum Tech Engineering Group Limited",2021-10-25,,"Private, ltd by shares"226,3095938,"Java Express (HK) Company Limited",2021-10-25,,"Private, ltd by shares"227,3095914,"JCM INTERNATIONAL LIMITED",2021-10-25,,"Private, ltd by shares"228,3096132,"JetJetMedia Tech Limited",2021-10-25,,"Private, ltd by shares"229,3096163,"JIA MEI DA INDUSTRIAL CO., LIMITED
佳美達實業有限公司",2021-10-25,,"Private, ltd by shares"230,3096159,"JIAKELE TECHNOLOGY COMPANY LIMITED",2021-10-25,,"Private, ltd by shares"231,3096051,"JIAXIN ELECTRONIC (HK) CO., LIMITED
佳欣電子有限公司",2021-10-25,,"Private, ltd by shares"232,3095874,"Jietian Industry Co., Limited
捷恬實業有限公司",2021-10-25,,"Private, ltd by shares"233,3096172,"Jinbo International Trade (China) Co. , Limited
金波國際貿易(中國)有限公司",2021-10-25,,"Private, ltd by shares"234,3095948,"Jing Baoneng Technology Limited
京寶能科技有限公司",2021-10-25,,"Private, ltd by shares"235,3096149,"JKM Christy Indonesia Limited",2021-10-25,,"Private, ltd by shares"236,3095934,"JOINCOM CHINA LIMITED
聚客中國有限公司",2021-10-25,,"Private, ltd by shares"237,3096069,"JUBAOCHENG TECHNOLOGY CO., LIMITED
聚寶程科技有限公司",2021-10-25,,"Private, ltd by shares"238,3096124,"JUBEI TECHNOLOGY COMPANY LIMITED
聚唄科技投資控股(中國)有限公司",2021-10-25,,"Private, ltd by shares"239,3096173,"JUKELINE ELECTRONIC CO., LIMITED
桔科菱電子有限公司",2021-10-25,,"Private, ltd by shares"