,Reg no.,Name,Incorp-orated,Dissolved,Type240,3095965,"JUMBO GOLD FINANCE LIMITED
金多寶財務有限公司",2021-10-25,,"Private, ltd by shares"241,3095980,"Jxstrong Technology (Hong Kong) Co., Limited
捷信思創科技(香港)有限公司",2021-10-25,,"Private, ltd by shares"242,3096040,"K.T.Expert Limited
廚廁達人有限公司",2021-10-25,,"Private, ltd by shares"243,3095832,"KA SIU PROPERTY AGENCY LIMITED
家兆地產代理有限公司",2021-10-25,,"Private, ltd by shares"244,3095940,"Kaze Development Limited
逸風發展有限公司",2021-10-25,,"Private, ltd by shares"245,3095866,"KCR Limited (HK)
饗傳承有限公司",2021-10-25,,"Private, ltd by shares"246,3095865,"KeyTek Semiconductor HongKong Limited",2021-10-25,,"Private, ltd by shares"247,3095921,"KIMWEAR GLOBAL CO., LIMITED",2021-10-25,,"Private, ltd by shares"248,3096127,"King Word Limited
錦世有限公司",2021-10-25,,"Private, ltd by shares"249,3096035,"Kingland Industrial Co Limited
金輪實業有限公司",2021-10-25,,"Private, ltd by shares"250,3095879,"Kings Sports Association Limited",2021-10-25,,"Private, ltd by shares"251,3096170,"KO FULL TAT TRADING DEVELOP LIMITED
高富達貿易拓展有限公司",2021-10-25,,"Private, ltd by shares"252,3095953,"KOBE TRADING LIMITED",2021-10-25,,"Private, ltd by shares"253,3095822,"Koko Construction Material Company Limited",2021-10-25,,"Private, ltd by shares"254,3096178,"Kopak Advisory Services Limited
高栢諮詢顧問服務有限公司",2021-10-25,,"Private, ltd by shares"255,3096005,"Korea (Dr. water) Co., Limited
韓國（水博士）有限公司",2021-10-25,,"Private, ltd by shares"256,3096018,"Korea hixiu Asia Pacific liability Limited
韓國姬秀亞太地區責任有限公司",2021-10-25,,"Private, ltd by shares"257,3095852,"Kori Erbe Limited",2021-10-25,,"Private, ltd by shares"258,3095785,"LAKC Investments Limited",2021-10-25,,"Private, ltd by shares"259,3096093,"Lanqilong Network Technology Co., Limited
藍啟隆網絡科技責任有限公司",2021-10-25,,"Private, ltd by shares"260,3095911,"LEASPUR DEVELOPMENT (HK) CO., LIMITED
宏治發展（香港）有限公司",2021-10-25,,"Private, ltd by shares"261,3096038,"LERISOFOTO LIMITED",2021-10-25,,"Private, ltd by shares"262,3096138,"LFX (Investments) Limited",2021-10-25,,"Private, ltd by shares"263,3095863,"LIANSEN CORPORATION LIMITED
聯森科技有限公司",2021-10-25,,"Private, ltd by shares"264,3096058,"LIMSA MANAGEMENT COMPANY LIMITED
麟莎管理有限公司",2021-10-25,,"Private, ltd by shares"265,3095987,"LinKe Intelligent Technology Co., Limited
鏈可智能科技有限公司",2021-10-25,,"Private, ltd by shares"266,3095816,"LONG WIN CONSULTING LIMITED
長贏諮詢有限公司",2021-10-25,,"Private, ltd by shares"267,3095851,"LONGFENG CO., LIMITED
龍峰貿易有限公司",2021-10-25,,"Private, ltd by shares"268,3096111,"LOTTE SHOPPING LIMITED
樂天百貨有限公司",2021-10-25,,"Private, ltd by shares"269,3095862,"Lotus Trade Inc Co., Limited
香港健蓮貿易有限公司",2021-10-25,,"Private, ltd by shares"270,3095943,"Lucent Colour (H.K.) Company Limited
朗臣(香港)有限公司",2021-10-25,,"Private, ltd by shares"271,3096141,"Lucky Bun Trading Limited
幸運包貿易有限公司",2021-10-25,,"Private, ltd by shares"272,3096050,"Lung Wan Electronics Trading Limited",2021-10-25,,"Private, ltd by shares"273,3095779,"MANGREAT LIMITED
民基有限公司",2021-10-25,,"Private, ltd by shares"274,3096176,"MATONG CO., LIMITED
馬通有限公司",2021-10-25,,"Private, ltd by shares"275,3095850,"MAXBRIDGE INTERNATIONAL LIMITED",2021-10-25,,"Private, ltd by shares"276,3096027,"MC Intelligent Services Limited",2021-10-25,,"Private, ltd by shares"277,3095846,"McGill Safety Supply Limited",2021-10-25,,"Private, ltd by shares"278,3096136,"Melbourne Cyber Security Limited",2021-10-25,,"Private, ltd by shares"279,3096161,"MERGE LEISURE BEAUTY CENTRE LIMITED
融合休閑美容中心有限公司",2021-10-25,,"Private, ltd by shares"280,3095821,"Meritocratic Wealth Consultancy Limited
銳領財富顧問有限公司",2021-10-25,,"Private, ltd by shares"281,3096129,"Min Meng Technology Limited",2021-10-25,,"Private, ltd by shares"282,3095945,"Miracle Generations International Limited
奇蹟世代國際有限公司",2021-10-25,,"Ltd by guarantee"283,3095838,"MO CHENG GROUP HOLDINGS LIMITED
莫程集團控股有限公司",2021-10-25,,"Private, ltd by shares"284,3095809,"Mobfa Co., Limited",2021-10-25,,"Private, ltd by shares"285,3095939,"Mockuai Technology (HK) Limited
魔筷科技(香港)有限公司",2021-10-25,,"Private, ltd by shares"286,3096063,"Mola International Trading Co., Limited
摩拉國際貿易有限公司",2021-10-25,,"Private, ltd by shares"287,3095823,"Mono Red Limited",2021-10-25,,"Private, ltd by shares"288,3095800,"Moreria Group Limited",2021-10-25,,"Private, ltd by shares"289,3096037,"MOVING LIFE PRODUCTS CO., LIMITED
恒活製品有限公司",2021-10-25,,"Private, ltd by shares"290,3095979,"Nasr Trade E-commerce Co., Limited
娜莎貿易電子商務有限公司",2021-10-25,,"Private, ltd by shares"291,3096133,"New Balance Lead (China) Co., Limited
新百倫領跑(中國)有限公司",2021-10-25,,"Private, ltd by shares"292,3095804,"New Diet Technologies (HK) Limited",2021-10-25,,"Private, ltd by shares"293,3095813,"New United Wealth Management Limited
金聯理財有限公司",2021-10-25,,"Private, ltd by shares"294,3095839,"Nine Fortune Engineering Limited
九運工程有限公司",2021-10-25,,"Private, ltd by shares"295,3095787,"NOASH Investment Limited",2021-10-25,,"Private, ltd by shares"296,3095867,"OBSBOT Technology Limited
睿影科技有限公司",2021-10-25,,"Private, ltd by shares"297,3096171,"October Company Limited
拾月有限公司",2021-10-25,,"Private, ltd by shares"298,3095936,"ON1ON SQUARED LIMITED",2021-10-25,,"Private, ltd by shares"299,3095915,"One Global Catering Company Limited
致一餐飲有限公司",2021-10-25,,"Private, ltd by shares"300,3096086,"OPPS! Production Limited",2021-10-25,,"Private, ltd by shares"301,3095841,"Oriental Company Limited",2021-10-25,,"Private, ltd by shares"302,3096028,"Oxbridge Economics Limited
康橋經濟社有限公司",2021-10-25,,"Private, ltd by shares"303,3095853,"Pacific Essence Limited",2021-10-25,,"Private, ltd by shares"304,3095920,"Painless Group Limited
無痛空間集團有限公司",2021-10-25,,"Private, ltd by shares"305,3095897,"PAN OCEAN ADVISORY GROUP LIMITED",2021-10-25,,"Private, ltd by shares"306,3095824,"PAPERCLIP PARTNERS LIMITED",2021-10-25,,"Private, ltd by shares"307,3095974,"PAULMANN HONG KONG LIMITED
柏曼香港有限公司",2021-10-25,,"Private, ltd by shares"308,3096085,"Pegasus Kin Lung Basketball Club Company Limited
建龍飛馬籃球會有限公司",2021-10-25,,"Private, ltd by shares"309,3095807,"PicPicPic Company Limited
啪啪啪有限公司",2021-10-25,,"Private, ltd by shares"310,3095963,"Pixel&amp;Quill Limited",2021-10-25,,"Private, ltd by shares"311,3096075,"Pixmax Limited",2021-10-25,,"Private, ltd by shares"312,3096043,"Powerlinker Charging Tech Limited",2021-10-25,,"Private, ltd by shares"313,3095916,"Primetek Trading Company Limited",2021-10-25,,"Private, ltd by shares"314,3096007,"Profusive Foods and Beverages Limited
豐盈飲食有限公司",2021-10-25,,"Private, ltd by shares"315,3096113,"PROJECT ZERO LIMITED",2021-10-25,,"Private, ltd by shares"316,3096091,"PYFONG INTERNATIONAL LIMITED
佰豐國際有限公司",2021-10-25,,"Private, ltd by shares"317,3095868,"Q Brands (HK) Co. Limited",2021-10-25,,"Private, ltd by shares"318,3096001,"QH GROUP LIMITED",2021-10-25,,"Private, ltd by shares"319,3096146,"Qianya (Hong Kong) Holding Limited
千雅（香港）控股有限公司",2021-10-25,,"Private, ltd by shares"320,3096010,"R-Studio (Hong Kong) Trading Limited
蓮舍 (香港) 貿易有限公司",2021-10-25,,"Private, ltd by shares"321,3095900,"RENLEK CATERING LIMITED",2021-10-25,,"Private, ltd by shares"322,3096158,"RNC Medical Aesthetic Limited",2021-10-25,,"Private, ltd by shares"323,3095864,"Rockniku Electronics Technology Co., Limited
比思電子科技有限公司",2021-10-25,,"Private, ltd by shares"324,3095982,"ROYAL MACHINERY RENTAL COMPANY LIMITED
豐駿機械租賃有限公司",2021-10-25,,"Private, ltd by shares"325,3095891,"Safe Engineering Consultancy Limited
四富工程顧問有限公司",2021-10-25,,"Private, ltd by shares"326,3095858,"SCAI TECHNOLOGY LIMITED
盛才科技有限公司",2021-10-25,,"Private, ltd by shares"327,3095955,"SEENERRAY TECHNOLOGY (HK) LIMITED",2021-10-25,,"Private, ltd by shares"328,3095843,"Selead Marine Engineering &amp; Services Limited",2021-10-25,,"Private, ltd by shares"329,3095991,"Shangjing New Material Co., Limited
尚景新材料有限公司",2021-10-25,,"Private, ltd by shares"330,3096008,"Shengyao Network Technology Co., Limited
聖耀網絡科技有限公司",2021-10-25,,"Private, ltd by shares"331,3095827,"SHENZHEN TAILI PCB TECHNOLOGY CO., LIMITED
深圳泰力電路技術有限公司",2021-10-25,,"Private, ltd by shares"332,3095890,"Shore Limited (HK)",2021-10-25,,"Private, ltd by shares"333,3096020,"SicFan Hong Kong Limited",2021-10-25,,"Private, ltd by shares"334,3096077,"SINO TREND CONSULTANTS LIMITED
華創顧問有限公司",2021-10-25,,"Private, ltd by shares"335,3096015,"Siraj CK Capital Limited",2021-10-25,,"Private, ltd by shares"336,3096164,"Six Stars Pet Wholesale Company Limited
六星級寵物批發有限公司",2021-10-25,,"Private, ltd by shares"337,3096096,"SK International Business Limited",2021-10-25,,"Private, ltd by shares"338,3096134,"SKH Labs Limited",2021-10-25,,"Private, ltd by shares"339,3096042,"Skyline Diamond Limited",2021-10-25,,"Private, ltd by shares"340,3095970,"Slashies Production Company Limited",2021-10-25,,"Private, ltd by shares"341,3096079,"SMART LINK HONG KONG INVESTMENT LIMITED
駿興香港投資有限公司",2021-10-25,,"Private, ltd by shares"342,3095950,"SMILING GLORY LIMITED
笑譽有限公司",2021-10-25,,"Private, ltd by shares"343,3096165,"So Creative Arts Psychotherapy and Consultancy Company Limited
陪住你心理服務及顧問有限公司",2021-10-25,,"Private, ltd by shares"344,3095976,"Spin Online Games Limited",2021-10-25,,"Private, ltd by shares"345,3095854,"Spruce International Limited",2021-10-25,,"Private, ltd by shares"346,3096002,"Stoneleigh Solutions Limited (HK)
斯通利方案有限公司",2021-10-25,,"Private, ltd by shares"347,3096033,"SU SHI LIMITED
魚旨有限公司",2021-10-25,,"Private, ltd by shares"348,3095849,"SUMMIT ELECTRICAL SOLUTION LIMITED",2021-10-25,,"Private, ltd by shares"349,3095904,"SUNFORD SUPPLY CHAIN (HONG KONG) LIMITED
善福供應鏈(香港)有限公司",2021-10-25,,"Private, ltd by shares"350,3096179,"SUNRISE BRIGHT CONSTRUCTION CO. LIMITED
旭盛建築有限公司",2021-10-25,,"Private, ltd by shares"351,3096145,"SUPER NOVA Global Trading Limited
盈聚新星全球有限公司",2021-10-25,,"Private, ltd by shares"352,3096082,"SUPER TOPRICH LIMITED
永富德有限公司",2021-10-25,,"Private, ltd by shares"353,3095781,"SWEET HOME CORPORATION LIMITED
家和行有限公司",2021-10-25,,"Private, ltd by shares"354,3095793,"Ta Yang Creative Development Limited
大洋創展有限公司",2021-10-25,,"Private, ltd by shares"355,3096026,"TaiHe Network Technology Co., Limited
泰和網絡科技責任有限公司",2021-10-25,,"Private, ltd by shares"356,3096106,"Taiwan Hongqingting International Group Co., Limited
台灣紅蜻蜓國際集團有限公司",2021-10-25,,"Private, ltd by shares"357,3095840,"TAP SAGA ENTERTAINMENT LIMITED
指尖傳奇娛樂有限公司",2021-10-25,,"Private, ltd by shares"358,3095856,"Tappole Software Limited
太魄軟件有限公司",2021-10-25,,"Private, ltd by shares"359,3096041,"TARGETUP ENTERPRISES LIMITED",2021-10-25,,"Private, ltd by shares"360,3096185,"ThermoDeg Corporation Limited",2021-10-25,,"Private, ltd by shares"361,3096062,"THREETINKER TECHNOLOGY (HK) LIMITED
三豐智合（香港）科技有限公司",2021-10-25,,"Private, ltd by shares"362,3095825,"Tianmei Gift Co., Limited
天美禮品有限公司",2021-10-25,,"Private, ltd by shares"363,3095794,"TIANSHUO TRADING LIMITED
天碩貿易有限公司",2021-10-25,,"Private, ltd by shares"364,3095790,"Tinext Investment Limited",2021-10-25,,"Private, ltd by shares"365,3095989,"TipExlm Trading HK Co., Limited",2021-10-25,,"Private, ltd by shares"366,3095973,"Titan Sun Development Limited",2021-10-25,,"Private, ltd by shares"367,3095847,"TK METAL CO., LIMITED
泰科金屬有限公司",2021-10-25,,"Private, ltd by shares"368,3096006,"Tofveve Limited",2021-10-25,,"Private, ltd by shares"369,3095925,"Tonsin Financial Holding Limited
東新金融控股有限公司",2021-10-25,,"Private, ltd by shares"370,3095933,"TOP LINK INDUSTRY LIMITED
尚軒實業有限公司",2021-10-25,,"Private, ltd by shares"371,3096066,"Top Success Management Investment Limited
頂勝管理投資有限公司",2021-10-25,,"Private, ltd by shares"372,3095831,"TOP WIN INTERNATIONAL LOGISTICS CO., LIMITED
世航運通國際物流有限公司",2021-10-25,,"Private, ltd by shares"373,3096144,"Topcare Furniture Co., Limited
宏康傢俱有限公司",2021-10-25,,"Private, ltd by shares"374,3095815,"TOWINSOURCE HK LIMITED
勝遠香港有限公司",2021-10-25,,"Private, ltd by shares"375,3096032,"TRINITY TD GROUP LIMITED",2021-10-25,,"Private, ltd by shares"376,3095818,"Triumphella Exports Limited
香港煌耀有限公司",2021-10-25,,"Private, ltd by shares"377,3096155,"TUEN MUN NEW LIFE TEMPLE DENTAL CLINIC LIMITED
屯門新生命堂牙科診所有限公司",2021-10-25,,"Ltd by guarantee"378,3095837,"United People International Limited",2021-10-25,,"Private, ltd by shares"379,OF0000032,"Vered Investment Fund OFC
薔薇資管投資開放式基金型公司",2021-10-25,,"Open-ended Fund Company"380,3095887,"Via Vinci Limited",2021-10-25,,"Private, ltd by shares"381,3095829,"Wafung Corporate Service Limited
華豐企業服務有限公司",2021-10-25,,"Private, ltd by shares"382,3095878,"WAPI Holdings Limited",2021-10-25,,"Private, ltd by shares"383,3095791,"We Solution Limited",2021-10-25,,"Private, ltd by shares"384,3095947,"Wealth Corner Stone Limited
裕基隆有限公司",2021-10-25,,"Private, ltd by shares"385,3095895,"Weigao Standard Parts Co., Limited
唯高標准件有限公司",2021-10-25,,"Private, ltd by shares"386,3095820,"WEKAAN INTERNATIONAL (HK) LIMITED
偉康安國際(香港)有限公司",2021-10-25,,"Private, ltd by shares"387,3095845,"WENHUA STAR SHIP LIMITED",2021-10-25,,"Private, ltd by shares"388,3095803,"WFAFA Co., Limited",2021-10-25,,"Private, ltd by shares"389,3096021,"Win Bridge Service (Hong Kong) Limited
雲橋服務(香港)有限公司",2021-10-25,,"Private, ltd by shares"390,3095777,"WINPOOL INTERNATIONAL LIMITED
威濠國際有限公司",2021-10-25,,"Private, ltd by shares"391,3096083,"WINRICH INVESTMENT DEVELOPMENT LIMITED (b2021-10-25)
永富投資發展有限公司",2021-10-25,,"Private, ltd by shares"392,3095871,"Wise Standing Management Limited
智優(香港)管理有限公司",2021-10-25,,"Private, ltd by shares"393,3096150,"WONIU CATERING INVESTMENT MANAGEMENT COMPANY LIMITED
蝸牛餐飲投資管理有限公司",2021-10-25,,"Private, ltd by shares"394,3095972,"WORLD FLASHY SHANG ZHONGRONG GROUP LIMITED
世界華商中融集團有限公司",2021-10-25,,"Private, ltd by shares"395,3096160,"WORLD PEACE TONGYI PROMOTION LIMITED
世界和平統壹促進會有限公司",2021-10-25,,"Private, ltd by shares"396,3095962,"Wuxuan International Trade Co., Limited
無軒國際貿易有限公司",2021-10-25,,"Private, ltd by shares"397,3095819,"Wyofa Co., Limited",2021-10-25,,"Private, ltd by shares"398,3096125,"Xiamen Hensley Trading Co., Limited
廈門亨斯利貿易有限公司",2021-10-25,,"Private, ltd by shares"399,3095999,"XieDa Enterprises Investments (China) Limited
恊大企業投資（中國）有限公司",2021-10-25,,"Private, ltd by shares"400,3096089,"XIN YUEN GROUP LIMITED
鑫雨集團有限公司",2021-10-25,,"Private, ltd by shares"401,3095988,"Xindao Electronic Technology Co., Limited
新導電子科技有限公司",2021-10-25,,"Private, ltd by shares"402,3095795,"XINGBO INDUSTRY LIMITED
星博實業有限公司",2021-10-25,,"Private, ltd by shares"403,3095993,"XingSheng (HongKong) Group Co., Limited
星笙（香港）集團有限公司",2021-10-25,,"Private, ltd by shares"404,3096157,"XINTAIQIANG (HONGKONG) SHIPPING CO., LIMITED
鑫泰強(香港)海運有限公司",2021-10-25,,"Private, ltd by shares"405,3096054,"Xuan Ji Trading Co., Limited
旋吉貿易有限公司",2021-10-25,,"Private, ltd by shares"406,3096142,"Xuquan Trading (HK) Limited
香港許泉貿易有限公司",2021-10-25,,"Private, ltd by shares"407,3095836,"YAOHAO INVESTMENT GROUP LIMITED
耀豪投資集團有限公司",2021-10-25,,"Private, ltd by shares"408,3095910,"YETI LIMITED",2021-10-25,,"Private, ltd by shares"409,3096130,"YIJIN INTERNATIONAL LIMITED
易進國際有限公司",2021-10-25,,"Private, ltd by shares"410,3095844,"Yongkang Hongbin Industry And Tradeon Co., Limited
永康市紅斌工貿有限公司",2021-10-25,,"Private, ltd by shares"411,3095922,"Youthica Co., Limited
優思卡有限公司",2021-10-25,,"Private, ltd by shares"412,3095875,"YOUTHWELL BIOTECH LIMITED
益生活生物科技有限公司",2021-10-25,,"Private, ltd by shares"413,3096105,"YOWAY SEMICONDUCTOR LIMITED
有為半導體有限公司",2021-10-25,,"Private, ltd by shares"414,3095812,"YS (HK) INTERNATIONAL TRADE LIMITED
香港宇盛國際貿易有限公司",2021-10-25,,"Private, ltd by shares"415,3095885,"ZA INVESTMENT HOLDINGS LIMITED
匯才投資控股有限公司",2021-10-25,,"Private, ltd by shares"416,3095944,"Zaiyun Group (HK) Co., Limited
載雲集團(香港)有限公司",2021-10-25,,"Private, ltd by shares"417,3096004,"ZHEN GROUP CO., LIMITED
甄氏集團有限公司",2021-10-25,,"Private, ltd by shares"418,3095956,"ZHIFA TRADE CO., LIMITED
志發貿易有限公司",2021-10-25,,"Private, ltd by shares"419,3095949,"Zhongguancun Technology Innovation Group Limited
中關村科技創新集團有限公司",2021-10-25,,"Private, ltd by shares"420,3095996,"Zhongyuan Dayu International Co., Limited
中原大禹國際有限公司",2021-10-25,,"Private, ltd by shares"