,Reg no.,Name,Incorp-orated,Dissolved,Type226,2216042,"HONG KONG YAHUAXUN TRADE LIMITED
香港亞華訊貿易有限公司",2015-03-25,2020-09-11,"Private, ltd by shares"227,2216138,"HONG KONG YANLI ELECTRONIC CO., LIMITED
香港硏利電子有限公司",2015-03-25,,"Private, ltd by shares"228,2215702,"HONG KONG YASHEN DAILY CHEMICAL LIMITED
香港雅紳日化有限公司",2015-03-25,2018-11-16,"Private, ltd by shares"229,2216050,"Hong Kong Yonghuida Group Limited
香港永輝達集團有限公司",2015-03-25,,"Private, ltd by shares"230,2216137,"Hong Kong Yuhto Lighting Technology Co., Limited
香港瑞德照明科技有限公司",2015-03-25,,"Private, ltd by shares"231,2215809,"Hong Kong Zhengjiuhang Group International Chain Co., Limited
香港蒸灸行集團國際連鎖有限公司",2015-03-25,2019-07-05,"Private, ltd by shares"232,2215844,"Hongkong Angela Group Limited
香港安載集團有限公司",2015-03-25,,"Private, ltd by shares"233,2215889,"HONGKONG AOFEISI FURNITURE CO., LIMITED
香港奧菲斯傢俱有限公司",2015-03-25,,"Private, ltd by shares"234,2216051,"HONGKONG BAISHENG INNOVATE LIMITED
香港百勝創新有限公司",2015-03-25,2017-08-04,"Private, ltd by shares"235,2215839,"HONGKONG BLOOM INDUSTRIAL LIMITED",2015-03-25,2019-07-26,"Private, ltd by shares"236,2215766,"HONGKONG BOYAN BIOLOGY EXPLOITATION TECHNOLOGY LIMITED
香港博研生物開發科技有限公司",2015-03-25,2019-01-18,"Private, ltd by shares"237,2215732,"HONGKONG CC (HOLDINGS) GROUP CO., LIMITED
香港蔡蔡(控股)集團有限公司",2015-03-25,,"Private, ltd by shares"238,2215714,"Hongkong Coocoo Co., Limited
香港微團國際集團有限公司",2015-03-25,2019-01-18,"Private, ltd by shares"239,2215747,"HONGKONG FAST IMMIGRATION LIMITED
香港快移出入境服務有限公司",2015-03-25,2018-10-26,"Private, ltd by shares"240,2215759,"HONGKONG FUNS CO., LIMITED
香港範家居有限公司",2015-03-25,2018-03-23,"Private, ltd by shares"241,2215976,"HONGKONG GOLIGHT TECHNOLOGY (SHENZHEN) LIMITED
香港伽藍特科技(深圳)有限公司",2015-03-25,,"Private, ltd by shares"242,2216049,"HONGKONG GREATWALL DECORATION ENGINEERING CO., LIMITED
香港長城裝飾設計工程有限公司",2015-03-25,2018-11-23,"Private, ltd by shares"243,2216007,"HONGKONG HUALAIJIA TRADE LIMITED
香港華萊佳貿易有限公司",2015-03-25,2018-03-16,"Private, ltd by shares"244,2216020,"HONGKONG IDEAL COOPERATION CO., LIMITED
香港艾迪歐實業有限公司",2015-03-25,2016-08-19,"Private, ltd by shares"245,2216095,"HongKong Jelly Co., Limited
香港傑利有限公司",2015-03-25,,"Private, ltd by shares"246,2215745,"HONGKONG JIA FLOURISHING TRADING LIMITED
香港順佳旺貿易有限公司",2015-03-25,2016-06-10,"Private, ltd by shares"247,2216030,"Hongkong Jiuhua Industrial Co., Limited
香港九華實業有限公司",2015-03-25,,"Private, ltd by shares"248,2216181,"HongKong Lady Jewelry Co., Limited
香港貴夫人珠寶國際有限公司",2015-03-25,,"Private, ltd by shares"249,2215970,"HONGKONG LISHANG BIOTECHNOLOGY LIMITED
香港麗尚生物科技有限公司",2015-03-25,2019-01-18,"Private, ltd by shares"250,2215934,"HONGKONG LUISA LIMITED
香港路易莎有限公司",2015-03-25,2019-01-18,"Private, ltd by shares"251,2215998,"HONGKONG MEIYA DISPLAY CO., LIMITED
香港美雅包裝展示製品有限公司",2015-03-25,,"Private, ltd by shares"252,2215995,"HONGKONG MINGJIANXIN ELCTRONICS LIMITED",2015-03-25,2019-01-18,"Private, ltd by shares"253,2216194,"HONGKONG MINSDA PRINTING CO., LIMITED
香港銘盛達印刷有限公司",2015-03-25,,"Private, ltd by shares"254,2215761,"HONGKONG MIYA JEWELRY CO., LIMITED
香港米亞珠寶有限公司",2015-03-25,2020-08-28,"Private, ltd by shares"255,2216062,"HONGKONG NICHOME SHARE CO., LIMITED
香港二丁目股份有限公司",2015-03-25,2019-01-18,"Private, ltd by shares"256,2215881,"Hongkong Ocean Energy-Saving Technology Co., Limited
香港鷗遜節能科技有限公司",2015-03-25,,"Private, ltd by shares"257,2216089,"HongKong Shenghehang Import&amp;Export Co., Limited
香港盛和行進出口有限公司",2015-03-25,2018-07-20,"Private, ltd by shares"258,2216018,"HONGKONG SHENGRONG GROUP LIMITED
香港盛榮集團有限公司",2015-03-25,,"Private, ltd by shares"259,2215779,"HONGKONG SINOSUN TECHNOLOGY LIMITED
香港華夏盛科技有限公司",2015-03-25,,"Private, ltd by shares"260,2215769,"HONGKONG SUITATYUEN TRADING LIMITED
香港瑞達源商貿有限公司",2015-03-25,2017-03-17,"Private, ltd by shares"261,2215879,"HONGKONG SUNLERY SCIENCE AND TECHNOLOGY DEVELOPMENT CO., LIMITED
香港思德利科技發展有限公司",2015-03-25,2018-01-12,"Private, ltd by shares"262,2215940,"HONGKONG SUPESTONE TECHNOLOGY LIMITED
香港太空石科技有限公司",2015-03-25,,"Private, ltd by shares"263,2215960,"HONGKONG SURPLUS RUI INDUSTRIAL COMPANY LIMITED
香港盈瑞實業有限公司",2015-03-25,,"Private, ltd by shares"264,2216113,"HONGKONG VCHOICE LIMITED
香港唯選有限公司",2015-03-25,,"Private, ltd by shares"265,2215955,"HONGKONG WINNIETEAM TINY BUSINESS OPERATION (TRAIN) CO., LIMITED
香港維尼團微商運營(培訓)有限公司",2015-03-25,2018-03-16,"Private, ltd by shares"266,2216186,"Hongkong Xin Jia Yuan Trade Co., Limited
香港新佳源貿易有限公司",2015-03-25,,"Private, ltd by shares"267,2215711,"HONGKONG XINKANG TRADING CO., LIMITED
香港信康貿易有限公司",2015-03-25,2019-01-18,"Private, ltd by shares"268,2216029,"HONGKONG YISHUNBAO TRADE LIMITED
香港伊順寶貿易有限公司",2015-03-25,2019-01-18,"Private, ltd by shares"269,2215713,"HONGKONG ZCY FASHION LIMITED
香港眾創玉服裝有限公司",2015-03-25,,"Private, ltd by shares"270,2216011,"Honglian Electrician (Hongkong) Co., Limited",2015-03-25,2019-09-13,"Private, ltd by shares"271,2215758,"HUA DUN TRADING LIMITED
華頓貿易有限公司",2015-03-25,2016-04-01,"Private, ltd by shares"272,2215716,"Hua Long Grand International Holding Limited",2015-03-25,,"Private, ltd by shares"273,2216001,"HUA QING INDUSTRIAL LIMITED
華清實業有限公司",2015-03-25,2019-01-18,"Private, ltd by shares"274,2215698,"HUAXIA AREA EDUCATION PROMOTION ASSOCIATION CO., LIMITED (d2019-11-22)
華夏區域教育促進會有限公司",2015-03-25,2019-11-22,"Private, ltd by shares"275,2215811,"HUNG TAT (HK) ELECTRONIC INDUSTRY LIMITED
鴻達(香港)電子實業有限公司",2015-03-25,,"Private, ltd by shares"276,2216008,"HY BUY TRADING CO., LIMITED
昊禹貿易有限公司",2015-03-25,,"Private, ltd by shares"277,2216124,"HYPERION DEVELOPMENT (HK) LIMITED (THE)
凱弼莨投資置業(香港)有限公司",2015-03-25,2018-12-14,"Private, ltd by shares"278,2215897,"IAB HK LIMITED",2015-03-25,,"Private, ltd by shares"279,2215837,"IAN ALEXANDER WIKINSKI LIMITED",2015-03-25,2019-01-18,"Private, ltd by shares"280,2215916,"ICRIS:2215916 (no English name)
中國好筆墨書畫研究有限公司",2015-03-25,,"Private, ltd by shares"281,2216099,"ICRIS:2216099 (no English name)
囍愛有限公司",2015-03-25,2018-03-23,"Private, ltd by shares"282,2215990,"Im.medy Trading Company Limited
微。治形貿易有限公司",2015-03-25,2016-12-02,"Private, ltd by shares"283,2215864,"Imperial Majesty International Group (H.K) LIMITED
皇室國際集團(香港)有限公司",2015-03-25,2019-12-20,"Private, ltd by shares"284,2215873,"Imperium Chemicals Limited",2015-03-25,,"Private, ltd by shares"285,2215983,"Infinity Capital Private Limited",2015-03-25,,"Private, ltd by shares"286,2216153,"Inkit Technology Company Limited
香港吉嘉科技有限公司",2015-03-25,2018-01-12,"Private, ltd by shares"287,2215885,"INTERNATIONAL CAPITAL INVESTMENT LIMITED
誠頊國際投資有限公司",2015-03-25,,"Private, ltd by shares"288,2216105,"International Gems &amp;Jewelry Trading Limited",2015-03-25,2018-12-14,"Private, ltd by shares"289,2215802,"INTERNATIONAL PACIFIC INDUSTRIAL LIMITED
國際太平實業有限公司",2015-03-25,2019-11-15,"Private, ltd by shares"290,2216165,"International University of Hong Kong Limited",2015-03-25,2016-07-08,"Private, ltd by shares"291,2215728,"INVITATIONAL EDUCATION RESEARCH INSTITUTE COMPANY LIMITED
啟發潛能教育研究社有限公司",2015-03-25,2020-09-25,"Private, ltd by shares"292,2215784,"IT MEDICAL LIMITED",2015-03-25,,"Private, ltd by shares"293,2215867,"ITALY AMANI (HK) INVESTMENT LIMITED
意大利阿瑪尼(香港)投資有限公司",2015-03-25,2019-08-23,"Private, ltd by shares"294,2215723,"JACT (H.K.) TECHNOLOGY LIMITED
香港捷航科技有限公司",2015-03-25,2016-10-07,"Private, ltd by shares"295,2216015,"JAG-UFS GROUP HOLDINGS LIMITED",2015-03-25,,"Private, ltd by shares"296,2215804,"JEFACTORIA CO., LIMITED",2015-03-25,2019-01-18,"Private, ltd by shares"297,2215753,"JIA SHUN WANG TRADING LIMITED
佳順旺貿易有限公司",2015-03-25,2016-06-10,"Private, ltd by shares"298,2216004,"JIAHUA BLEACHING WEAVING CO., LIMITED
佳華漂染織造有限公司",2015-03-25,2017-10-20,"Private, ltd by shares"299,2216088,"JIANGS ANIMAL PRODUCT CO., LIMITED
蔣氏動物用品有限公司",2015-03-25,,"Private, ltd by shares"300,2215739,"JILI (HONG KONG) TECHNOLOGY CO., LIMITED
吉利(香港)科技有限公司",2015-03-25,,"Private, ltd by shares"301,2215763,"Jinkan Marine (Hong Kong) Limited
晉侃海事(香港)有限公司",2015-03-25,,"Private, ltd by shares"302,2215915,"JINOULAI TRADING CO., LIMITED
金歐來貿易有限公司",2015-03-25,2019-01-18,"Private, ltd by shares"303,2216141,"JINXINGJIAN LIMITED
金興建有限公司",2015-03-25,2015-11-27,"Private, ltd by shares"304,2216118,"JINZAO (HK) TRADE LIMITED
香港金造貿易有限公司",2015-03-25,2019-02-08,"Private, ltd by shares"305,2215813,"JNJ TRADING LIMITED (HK)",2015-03-25,,"Private, ltd by shares"306,2216148,"JOY FISHING TACKLE LIMITED
喜悅漁具有限公司",2015-03-25,,"Private, ltd by shares"307,2215760,"JR COMMERCIAL BUSINESS (HK) CO., LIMITED",2015-03-25,,"Private, ltd by shares"308,2215719,"JSD INTERNATIONAL TRADE CO., LIMITED",2015-03-25,,"Private, ltd by shares"309,2215695,"JUKEN INTERNATIONAL TRADING CO., LIMITED
香港匯川貿易有限公司",2015-03-25,,"Private, ltd by shares"310,2216076,"JUNSHENG INTERNATIONAL (HONG KONG) CO., LIMITED
君晟國際(香港)有限公司",2015-03-25,2019-01-18,"Private, ltd by shares"311,2215672,"Ka Hui Business Consulting Company Limited
嘉匯商務顧問有限公司",2015-03-25,,"Private, ltd by shares"312,2215774,"KAM YUEN ENGINEERING SERVICES LIMITED
金源機械工程服務有限公司",2015-03-25,,"Private, ltd by shares"313,2215849,"KEIDASON CORP LIMITED
凱德信有限公司",2015-03-25,,"Private, ltd by shares"314,2215772,"KELIANG LIGHTING CO., LIMITED
科亮照明有限公司",2015-03-25,,"Private, ltd by shares"315,2215673,"Keylin Trade Co., Limited",2015-03-25,2018-06-29,"Private, ltd by shares"316,2215727,"KING FIRM ENTERPRISES LIMITED
奇芬企業有限公司",2015-03-25,,"Private, ltd by shares"317,2215852,"KING TIN GRAB-MOUNTED LORRIES COMPANY LIMITED
景天夾斗車運輸有限公司",2015-03-25,,"Private, ltd by shares"318,2215859,"KING WAI TRANSPORTATION COMPANY LIMITED
經緯物流(香港)有限公司",2015-03-25,,"Private, ltd by shares"319,2215726,"King Yu Jewelry Company Limited
景裕首飾有限公司",2015-03-25,,"Private, ltd by shares"320,2216025,"KLEOX GROUP LIMITED",2015-03-25,2018-12-14,"Private, ltd by shares"321,2216160,"Kondai International Holding Limited
江大國際控股有限公司",2015-03-25,,"Private, ltd by shares"322,2216164,"Kondai International Limited
江大國際有限公司",2015-03-25,,"Private, ltd by shares"323,2215856,"Kopu Travel Limited
靠譜旅行有限公司",2015-03-25,2019-11-15,"Private, ltd by shares"324,2215928,"KOREA HONGLOIAH MEDICINE COSMETICS INTERNATIONAL LIMITED
韓國康萊雅藥妝國際有限公司",2015-03-25,,"Private, ltd by shares"325,2216182,"KUNCHI (HONGKONG) TRADE DEVELOPMENT CO., LIMITED
鯤馳(香港)貿易發展有限公司",2015-03-25,,"Private, ltd by shares"326,2216106,"LEADING-FRESH INTERNATIONAL TRADING CO., LIMITED
領鮮國際貿易有限公司",2015-03-25,2020-09-04,"Private, ltd by shares"327,2216017,"LEDA LIGHTING COMPANY LIMITED
樂達照明有限公司",2015-03-25,,"Private, ltd by shares"328,2215684,"LEOC GROUP Company Limited",2015-03-25,2018-05-25,"Private, ltd by shares"329,2216192,"LEUNG CHI KONG COMPANY LIMITED
梁志剛有限公司",2015-03-25,,"Private, ltd by shares"330,2215861,"LI&amp;NUNG INTERNATIONAL LIMITED
利能國際貿易有限公司",2015-03-25,,"Private, ltd by shares"331,2216208,"LIGHTHOUSE HONG KONG LIMITED
星光匯香港有限公司",2015-03-25,,"Private, ltd by shares"332,2215888,"Lingher Electronics (HK) Co., Limited
淩海電子(香港)有限公司",2015-03-25,,"Private, ltd by shares"333,2215696,"LINK ON INTERNATIONAL TRADING LIMITED
利安國際貿易有限公司",2015-03-25,,"Private, ltd by shares"334,2216156,"LINKAPP TECHNO MATERIAL CO., LIMITED
通用科技材料有限公司",2015-03-25,2017-12-01,"Private, ltd by shares"335,2216114,"Liso Technology Limited
聯搜科技有限公司",2015-03-25,,"Private, ltd by shares"336,2215787,"Lissan Development (HK) Limited
力信發展(香港)有限公司",2015-03-25,,"Private, ltd by shares"337,2216163,"Lordway International Private Limited",2015-03-25,2019-05-17,"Private, ltd by shares"338,2216110,"LOUDNESS MANAGEMENT LIMITED",2015-03-25,,"Private, ltd by shares"339,2216081,"LOVE &amp; SOLAR CO., LIMITED
博愛太陽能有限公司",2015-03-25,,"Private, ltd by shares"340,2216146,"LUEN PANG RECYCLING LIMITED
聯鵬回收有限公司",2015-03-25,,"Private, ltd by shares"341,2215815,"Luvi Hair Designing Limited",2015-03-25,,"Private, ltd by shares"342,2215647,"M&amp;D FASHION LIMITED
麥迪時裝有限公司",2015-03-25,2020-09-18,"Private, ltd by shares"343,2216052,"MACAU FOOTBALL MATCH INFORMATION CO., LIMITED
澳門富特博賽事咨訊有限公司",2015-03-25,2017-03-24,"Private, ltd by shares"344,2215648,"Manggis International (HK) Limited
山竹國際(香港)有限公司",2015-03-25,,"Private, ltd by shares"345,2216096,"MANSON ENTERPRISE LIMITED",2015-03-25,,"Private, ltd by shares"346,2215953,"MANVI INDUSTRY COMPANY LIMITED
漫維實業有限公司",2015-03-25,2019-01-18,"Private, ltd by shares"347,2216022,"Marco Polo Business Services Limited",2015-03-25,2018-08-17,"Private, ltd by shares"348,2215721,"Marmet Analytics Limited",2015-03-25,,"Private, ltd by shares"349,2215857,"MAXGEN BIOTECH CO LIMITED",2015-03-25,,"Private, ltd by shares"350,2215829,"Maxima Optical Limited
極點光學有限公司",2015-03-25,,"Private, ltd by shares"351,2215730,"MAXJO TECHNIK CO., LIMITED
邁拓技術有限公司",2015-03-25,,"Private, ltd by shares"352,2215936,"MEDICLO LIMITED",2015-03-25,2019-02-08,"Private, ltd by shares"353,2215883,"MEEWOO LIMITED",2015-03-25,2019-01-18,"Private, ltd by shares"354,2215646,"MEGAWORTH PROPERTY LIMITED
嘉富置業管理有限公司",2015-03-25,2019-01-18,"Private, ltd by shares"355,2215668,"Melsin Medical Co., Limited",2015-03-25,2019-05-03,"Private, ltd by shares"356,2215918,"MENG XUN MACHINERY (HONG KONG) LIMITED
萌訊機械(香港)有限公司",2015-03-25,,"Private, ltd by shares"357,2215682,"MENGLILAI TRADING CO., LIMITED
夢利萊貿易有限公司",2015-03-25,2016-07-08,"Private, ltd by shares"358,2215974,"MERCOEAST HOLDINGS LIMITED",2015-03-25,2016-09-09,"Private, ltd by shares"359,2215919,"Merry-Go-Round Cookies Limited
旋轉曲奇有限公司",2015-03-25,2016-08-12,"Private, ltd by shares"360,2215671,"MIAOYIFANG (HK) BIOLOGICAL TECHNOLOGY LIMITED
苗一坊(香港)生物科技有限公司",2015-03-25,,"Private, ltd by shares"361,2215788,"Minglam Trading Limited
林明貿易有限公司",2015-03-25,2019-01-18,"Private, ltd by shares"362,2215994,"MINGZHU INDUSTRIAL LIMITED
明珠實業有限公司",2015-03-25,2020-01-03,"Private, ltd by shares"363,2215790,"MISTER Q ENTERPRISE LIMITED
楷澤實業發展有限公司",2015-03-25,,"Private, ltd by shares"364,2215660,"MOBILE LORD LIMITED",2015-03-25,,"Private, ltd by shares"365,2215734,"MobileSearch HK Limited
奇點機智香港有限公司",2015-03-25,,"Private, ltd by shares"366,2215816,"MONEYMAN INVESTMENT CO., LIMITED",2015-03-25,,"Private, ltd by shares"367,2215827,"MPG FASHION GROUP CO., LIMITED",2015-03-25,,"Private, ltd by shares"368,2216154,"MRC ENTERPRISES LIMITED",2015-03-25,,"Private, ltd by shares"369,2215903,"MUSHANG ELECTRONIC (HONGKONG) LIMITED
睦尚電子(香港)有限公司",2015-03-25,,"Private, ltd by shares"370,2215773,"MWell International Limited
萬薈國際有限公司",2015-03-25,2019-02-15,"Private, ltd by shares"371,2215957,"N&amp;N TRADING CO., LIMITED",2015-03-25,,"Private, ltd by shares"372,2216090,"NAPPY VALLEY LIMITED (THE)",2015-03-25,2019-01-18,"Private, ltd by shares"373,2215644,"Netplus Technology (Hong Kong) Limited
網加科技(香港)有限公司",2015-03-25,2019-01-18,"Private, ltd by shares"374,2215855,"NEW ERA FUND MANAGEMENT HONGKONG CO., LIMITED
新紀元基金管理香港有限公司",2015-03-25,2019-06-14,"Private, ltd by shares"375,2216005,"NEW ERA YOUTH ORGANISATION COMPANY LIMITED
新青會有限公司",2015-03-25,,"Ltd by guarantee"376,2216189,"NEW TOWN DEVELOPMENT LIMITED
新城拓展有限公司",2015-03-25,,"Private, ltd by shares"377,2216079,"NEWDEGREE (USA) INTERNATIONAL CO., LIMITED
新百倫(美國)國際有限公司",2015-03-25,2019-01-18,"Private, ltd by shares"378,2215836,"NINE EMBELLISH MILLION RAW BUSINESS INVESTMENT ADVISER LIMITED
九潤億生商貿投資顧問有限公司",2015-03-25,2018-02-09,"Private, ltd by shares"379,2215922,"Ningbo Leven Co., Limited
寧波樂文有限公司",2015-03-25,,"Private, ltd by shares"380,2215878,"Noorlux (Hong Kong) Optoelectronics Co., Limited
諾克斯(香港)光電科技有限公司",2015-03-25,,"Private, ltd by shares"381,2215945,"NOSAMA ELECTRONICS (HK) CO., LIMITED",2015-03-25,2019-01-18,"Private, ltd by shares"382,2215796,"NUMARINE 105HT HULL12 LIMITED",2015-03-25,,"Private, ltd by shares"383,2215675,"OCARS IMPORT AND EXPORT CO., LIMITED
奧卡斯進出口有限公司",2015-03-25,,"Private, ltd by shares"384,2215891,"OCEAN OIL LIMITED",2015-03-25,,"Private, ltd by shares"385,2215799,"Omet Tech Limited
歐默特科技發展有限公司",2015-03-25,2018-07-27,"Private, ltd by shares"386,2215786,"ONE DIRECTION TECHNOLOGY CO., LIMITED",2015-03-25,2020-07-10,"Private, ltd by shares"387,2216157,"One One Zero Two Co., Limited
壹壹零貳有限公司",2015-03-25,2019-01-18,"Private, ltd by shares"388,2215925,"ONLINE PLATFORM LIMITED (d2017-11-17)
網上平台有限公司",2015-03-25,2017-11-17,"Private, ltd by shares"389,2215710,"OnMyApps Marketing Limited",2015-03-25,2019-11-22,"Private, ltd by shares"390,2215807,"ORIENTAL ASIA PAC INDUSTRIAL LIMITED
東方亞太實業有限公司",2015-03-25,2017-05-26,"Private, ltd by shares"391,2215751,"ORIENTAL SINOLAND LIMITED
東方中利有限公司",2015-03-25,2019-01-18,"Private, ltd by shares"392,2215846,"OTTAWA INTERNATIONAL LIMITED",2015-03-25,,"Private, ltd by shares"393,2216069,"PACCO INTERNATIONAL TRADING CO., LIMITED
帕柯國際貿易有限公司",2015-03-25,,"Private, ltd by shares"394,2215767,"PAI TRADE (HONG KONG) CO., LIMITED
八億貿易(香港)有限公司",2015-03-25,,"Private, ltd by shares"395,2215822,"Parity Capital Limited",2015-03-25,2018-08-24,"Private, ltd by shares"396,2216085,"PARKIN ENGINEERING LIMITED
柏建工程有限公司",2015-03-25,2019-06-28,"Private, ltd by shares"397,2215680,"PAWS CHARITY HONG KONG ASSOCIATION LIMITED
香港小腳板公益金有限公司",2015-03-25,,"Ltd by guarantee"398,2215917,"Performance Capital Limited",2015-03-25,2020-11-13,"Private, ltd by shares"399,2216054,"PET A FRIEND LIMITED
寵牠用品有限公司",2015-03-25,,"Private, ltd by shares"400,2216183,"PineappleSoft Limited",2015-03-25,,"Private, ltd by shares"401,2216045,"Plus1 Electronic Limited
普樂仕電子有限公司",2015-03-25,,"Private, ltd by shares"402,2216177,"Po Chi Tong Trading Limited
寶芝堂貿易有限公司",2015-03-25,,"Private, ltd by shares"403,2215926,"POLENG INVESTMENT LIMITED
浦寧投資有限公司",2015-03-25,2017-12-08,"Private, ltd by shares"404,2215780,"POWERSTAR TIRE LIMITED
威力星實業有限公司",2015-03-25,,"Private, ltd by shares"405,2216026,"PRECIOUS ONE HK LIMITED
琳瑯有限公司",2015-03-25,2017-07-07,"Private, ltd by shares"406,2215920,"PREMIUMCAR COMPANY LIMITED",2015-03-25,2017-10-06,"Private, ltd by shares"407,2215697,"PROFESSIONALS HONG KONG DEVELOPMENT LIMITED
專業香港發展有限公司",2015-03-25,,"Private, ltd by shares"408,2215694,"PROFIT KING INTERNATIONAL TRADING LIMITED
生利國際貿易有限公司",2015-03-25,,"Private, ltd by shares"409,2216040,"Prosperity Trade (Group) Company Limited
興潤(集團)有限公司",2015-03-25,,"Private, ltd by shares"410,2215845,"PRUDENTIAL CREDIT ASIA LIMITED
信誠信貸亞洲有限公司",2015-03-25,,"Private, ltd by shares"411,2216006,"PURE EDUCATION CENTRE LIMITED
寶兒教育中心有限公司",2015-03-25,2019-01-18,"Private, ltd by shares"412,2215921,"Pure Yoga (PP) Limited",2015-03-25,,"Private, ltd by shares"413,2216126,"Purity Prod Limited",2015-03-25,2018-12-14,"Private, ltd by shares"414,2215962,"Q&amp;Q TRADING CO., LIMITED",2015-03-25,,"Private, ltd by shares"415,2215959,"QCC Design Limited",2015-03-25,,"Private, ltd by shares"416,2216021,"QCPLUS INSPECTION CO., LIMITED
桔星驗貨服務有限公司",2015-03-25,,"Private, ltd by shares"417,2215935,"QH MANAGEMENT SERVICES LIMITED
前海特華管理服務有限公司",2015-03-25,,"Private, ltd by shares"418,2215894,"QIANJING RISK MANAGEMENT LIMITED",2015-03-25,2019-12-20,"Private, ltd by shares"419,2215968,"QIANJUN ELECTRONICS TECHNOLOGY (HK) CO., LIMITED
千駿電子科技(香港)有限公司",2015-03-25,2018-03-09,"Private, ltd by shares"420,2215870,"Qingdao HongTongYuan Hair Products Co., Limited
青島鴻通緣發製品有限公司",2015-03-25,2017-08-25,"Private, ltd by shares"421,2216179,"RAAHAT TRADELINKS PVT LIMITED",2015-03-25,,"Private, ltd by shares"422,2215708,"RAWIN INTERNATIONAL (HK) LIMITED
雷雲國際(香港)有限公司",2015-03-25,,"Private, ltd by shares"423,2215938,"Rayark International Limited
雷亞遊戲香港有限公司",2015-03-25,,"Private, ltd by shares"424,2216123,"RELAX (HK) COMMERCE AND TRADE LIMITED
瑞來克斯(香港)商貿有限公司",2015-03-25,,"Private, ltd by shares"425,2216046,"RICHEST (HK) DEVELOPMENT LIMITED
瑞吉斯發展有限公司",2015-03-25,,"Private, ltd by shares"426,2216185,"Ricofeliz Capital (HK) Limited
富盈資本(香港)有限公司",2015-03-25,,"Private, ltd by shares"427,2215965,"Roadstar Asia (Hong Kong) Limited",2015-03-25,,"Private, ltd by shares"428,2215706,"RONGLI (CHINA) INDUSTRIAL CO., LIMITED
容立(中國)實業有限公司",2015-03-25,2017-05-26,"Private, ltd by shares"429,2215950,"Rotor-Industries Limited",2015-03-25,2018-08-24,"Public, ltd by shares"430,2215664,"ROYAL IMPORT &amp; EXPORT INTERNATIONAL TRADING CO., LIMITED
羅雅貿易有限公司",2015-03-25,2019-11-01,"Private, ltd by shares"431,2215869,"S.A.M (Kowloon City) Limited",2015-03-25,,"Private, ltd by shares"432,2215663,"SAI KUNG PATSY HOUSE ELECTRICAL COMPANY LIMITED
西貢百事家居電業有限公司",2015-03-25,,"Private, ltd by shares"433,2216191,"SAILOR EDUCATION CONSULTING LIMITED
香港三樂教育諮詢服務有限公司",2015-03-25,2017-10-06,"Private, ltd by shares"434,2215972,"SAINT COS INTERNATIONAL (HK) CO., LIMITED",2015-03-25,,"Private, ltd by shares"435,2216044,"SAMWOO TRADE CO., LIMITED
三友科技貿易有限公司",2015-03-25,,"Private, ltd by shares"436,2215913,"SAMWOOD GLOBAL LIMITED
森活環球有限公司",2015-03-25,2019-01-18,"Private, ltd by shares"437,2216057,"San Sheng Assets Management Company Limited
三生萬物資產管理有限公司",2015-03-25,2018-12-07,"Private, ltd by shares"438,2216171,"Sanlin Fashion (HK) Limited
三林時裝(香港)有限公司",2015-03-25,,"Private, ltd by shares"439,2216031,"SCIGRACE TECHNOLOGY CO., LIMITED
科雅科技有限公司",2015-03-25,2018-03-02,"Private, ltd by shares"440,2215860,"SEEDM LIMITED",2015-03-25,,"Private, ltd by shares"441,2215798,"SHADOW OPTRONICS LIMITED
協達光電有限公司",2015-03-25,,"Private, ltd by shares"442,2215840,"SHANDONG ANDA AUTO PARTS CO., LIMITED
山東安達汽車配件有限公司",2015-03-25,,"Private, ltd by shares"443,2215679,"SHANGHAI PEOPLE ENTERPRISE HOLDING TECHNOLOGY GROUP LIMITED
上海人民企業控股科技集團有限公司",2015-03-25,,"Private, ltd by shares"444,2216035,"SHANTOU AKD TOYS CO., LIMITED
汕頭市奧可迪玩具有限公司",2015-03-25,,"Private, ltd by shares"445,2216092,"SHENG YUAN TECHNOLOGY DEVELOPMENT LIMITED
聖元科技開發有限公司",2015-03-25,,"Private, ltd by shares"446,2215659,"Shenzhen Hikun Technology Co., Limited
深圳海坤科技有限公司",2015-03-25,,"Private, ltd by shares"447,2215665,"SHENZHEN HONSEN TECHNOLOGY CO., LIMITED
深圳市宏程科技有限公司",2015-03-25,2019-01-18,"Private, ltd by shares"448,2215902,"SHENZHENCITY HONGYA SILICON RUBBER PRODUCTS LIMITED
深圳市弘亞矽橡塑製品有限公司",2015-03-25,2019-01-18,"Private, ltd by shares"449,2215678,"SHI MEI INTERNATIONAL LIMITED
施美國際有限公司",2015-03-25,,"Private, ltd by shares"450,2216133,"SHIELD TECHNOLOGY CO., LIMITED
希爾德科技有限公司",2015-03-25,2017-08-04,"Private, ltd by shares"451,2215699,"SHINE FULL CAPITAL RESOURCES LIMITED
盛富資本有限公司",2015-03-25,,"Private, ltd by shares"452,2215923,"SHINWOO LOGISTICS (HK) CO., LIMITED
信宇物流(香港)有限公司",2015-03-25,,"Private, ltd by shares"453,2215770,"Shorelight Education Hong Kong Limited",2015-03-25,,"Private, ltd by shares"