,Reg no.,Name,Incorp-orated,Dissolved,Type454,2216038,"Shun Fat Food Development Limited
順發飲食發展有限公司",2015-03-25,,"Private, ltd by shares"455,2215691,"SHUN TAT DRAYAGE LIMITED
順達拖運有限公司",2015-03-25,,"Private, ltd by shares"456,2215961,"Shun Tin Motor Investments Limited
順天汽車貿易有限公司",2015-03-25,,"Private, ltd by shares"457,2215973,"SIMPLIFY LIMITED (HK)",2015-03-25,,"Private, ltd by shares"458,2215949,"Sino Project (Hong Kong) Limited
豐冠(香港)有限公司",2015-03-25,,"Private, ltd by shares"459,2215712,"Sinovest Group Limited",2015-03-25,2016-11-18,"Private, ltd by shares"460,2215930,"SKIN1004 HK LIMITED
天使肌膚香港有限公司",2015-03-25,2018-02-09,"Private, ltd by shares"461,2215933,"SKINMATE LIMITED",2015-03-25,2018-07-06,"Private, ltd by shares"462,2215843,"SKYB TOYS COMPANY LIMITED
浩天寶寶玩具有限公司",2015-03-25,2019-04-12,"Private, ltd by shares"463,2215700,"SMART KING INC. LIMITED
金興興業有限公司",2015-03-25,,"Private, ltd by shares"464,2215952,"SOUFUN INVESTMENTS LIMITED",2015-03-25,2018-08-03,"Private, ltd by shares"465,2216128,"Southwest Danung (Hong Kong) Co., Limited
西南大農(香港)有限公司",2015-03-25,2017-09-29,"Private, ltd by shares"466,2215653,"Spicyman Limited
醬神有限公司",2015-03-25,,"Private, ltd by shares"467,2215808,"STANDARD INTERNATIONAL ENTERPRISE LIMITED
標準國際企業有限公司",2015-03-25,,"Private, ltd by shares"468,2215669,"STAR CENTURY PANDAHO LIMITED
星世紀潘大吼有限公司",2015-03-25,2019-01-18,"Private, ltd by shares"469,2215705,"STARWAY INC. LIMITED
星威興業有限公司",2015-03-25,,"Private, ltd by shares"470,2216000,"Strait Asset Management (Hongkong) Company Limited
海峽資產管理(香港)有限公司",2015-03-25,,"Private, ltd by shares"471,2216112,"SU HU ELECTRONIC TECHNOLOGY CO., LIMITED
宿滬電子科技有限公司",2015-03-25,2019-01-18,"Private, ltd by shares"472,2215966,"SUN KONG CHUN COMPANY LIMITED
新港駿有限公司",2015-03-25,,"Private, ltd by shares"473,2216199,"Sunedison Solar Holdings 10 (Hong Kong) Limited",2015-03-25,2017-09-15,"Private, ltd by shares"474,2216198,"Sunedison Solar Holdings 11 (Hong Kong) Limited",2015-03-25,2018-02-02,"Private, ltd by shares"475,2216197,"Sunedison Solar Holdings 12 (Hong Kong) Limited",2015-03-25,2017-09-15,"Private, ltd by shares"476,2216196,"Sunedison Solar Holdings 13 (Hong Kong) Limited",2015-03-25,2017-09-15,"Private, ltd by shares"477,2216195,"Sunedison Solar Holdings 14 (Hong Kong) Limited",2015-03-25,2018-02-02,"Private, ltd by shares"478,2216193,"Sunedison Solar Holdings 15 (Hong Kong) Limited",2015-03-25,2017-09-15,"Private, ltd by shares"479,2216203,"Sunedison Solar Holdings 6 (Hong Kong) Limited",2015-03-25,2018-01-19,"Private, ltd by shares"480,2216202,"Sunedison Solar Holdings 7 (Hong Kong) Limited",2015-03-25,2017-09-15,"Private, ltd by shares"481,2216201,"Sunedison Solar Holdings 8 (Hong Kong) Limited",2015-03-25,2017-09-15,"Private, ltd by shares"482,2216200,"Sunedison Solar Holdings 9 (Hong Kong) Limited",2015-03-25,2017-10-20,"Private, ltd by shares"483,2215652,"SUNIL TRADE CO., LIMITED",2015-03-25,2018-12-14,"Private, ltd by shares"484,2216149,"SUNKOO HOLDINGS LIMITED
上古控股有限公司",2015-03-25,2016-09-02,"Private, ltd by shares"485,2216086,"Sunlux Technology (HK) Co., Limited
聖多思科技(香港)有限公司",2015-03-25,,"Private, ltd by shares"486,2215988,"SUNSHINE E-COMMERCE (HK) LIMITED
金潤陽光電子商務(香港)有限公司",2015-03-25,2020-03-27,"Private, ltd by shares"487,2216143,"Super A Advertisement &amp; Agent Company Limited
智強廣告及代理有限公司",2015-03-25,,"Private, ltd by shares"488,2215709,"Supervision Technology (HK) CO., Limited
卓越視覺科技(香港)有限公司",2015-03-25,2019-12-20,"Private, ltd by shares"489,2215701,"SURE FIT INC LIMITED
生立有限公司",2015-03-25,,"Private, ltd by shares"490,2216184,"SWISSHUG SANITARY PRODUCTS COMPANY LIMITED
瑞心衛生用品有限公司",2015-03-25,2016-06-24,"Private, ltd by shares"491,2215877,"SWITZERLAND KARINE (HK) WATCH INDUSTRY LIMITED
瑞士卡瑞尼 (香港) 表業有限公司",2015-03-25,2019-12-20,"Private, ltd by shares"492,2215996,"SyncForce Development Limited",2015-03-25,,"Private, ltd by shares"493,2215722,"Sytun Machinery Limited
內蒙古四通機械有限公司",2015-03-25,,"Private, ltd by shares"494,2215677,"TAI MEI TECHNOLOGY COMPANY LIMITED
泰美科技責任有限公司",2015-03-25,,"Private, ltd by shares"495,2215681,"TAIWAN KANGYU (GROUP) CO., LIMITED
臺灣康渝(集團)有限公司",2015-03-25,2019-01-18,"Private, ltd by shares"496,2215914,"TAIWAN MAGAR ELECTRONIC APPLIANCE LIMITED
台灣美格爾電子電器有限公司",2015-03-25,,"Private, ltd by shares"497,2215880,"TEAMWAY (W.F.) ENGINEERING COMPANY LIMITED
聯合(永鋒)工程有限公司",2015-03-25,,"Private, ltd by shares"498,2215717,"TECH TREK ELECTRONIC (HK) CO., LIMITED
特克電子(香港)有限公司",2015-03-25,,"Private, ltd by shares"499,2215676,"TENDA INDUSTRY CO., LIMITED
騰達工貿有限公司",2015-03-25,2019-09-13,"Private, ltd by shares"500,2215645,"TENG FUNG INTERNATIONAL GROUP LIMITED
騰灃國際集團有限公司",2015-03-25,2018-12-14,"Private, ltd by shares"501,2216130,"TG HARDWARE CO., LIMITED",2015-03-25,2019-09-20,"Private, ltd by shares"502,2216205,"THINKABLE DESIGN &amp; CONTRACTING LIMITED
創思設計工程有限公司",2015-03-25,2019-07-12,"Private, ltd by shares"503,2216109,"Tiger and Power Company Limited
虎權實業有限公司",2015-03-25,,"Private, ltd by shares"504,2215820,"TIMSOLUTIO LIMITED",2015-03-25,,"Private, ltd by shares"505,2215932,"TIN CHUN SECURITY SYSTEM LIMITED
天俊保安系統有限公司",2015-03-25,,"Private, ltd by shares"506,2216097,"Titan Equities Limited",2015-03-25,2019-01-18,"Private, ltd by shares"507,2215931,"TOME Semiconductor (HK) CO., LIMITED
拓緯半導體(香港)有限公司",2015-03-25,,"Private, ltd by shares"508,2215874,"TONGYUE TRADING LIMITED
通越貿易有限公司",2015-03-25,2018-12-14,"Private, ltd by shares"509,2215666,"Top-Tech Biological Technology (Hong Kong) Company Limited
托泰生物科技(香港)有限公司",2015-03-25,2018-03-29,"Private, ltd by shares"510,2216145,"Trade Trade Phone Group Limited
吹吹豐集團有限公司",2015-03-25,,"Private, ltd by shares"511,2215642,"TRADECRAFT SERVICES LIMITED",2015-03-25,2019-01-18,"Private, ltd by shares"512,2215987,"TREASURE BLESS LUCK INDUSTRIAL LIMITED
寶福實業有限公司",2015-03-25,2019-01-11,"Private, ltd by shares"513,2216028,"TREMENDOUS ENTERTAINMENT (HK) COMPANY LIMITED",2015-03-25,,"Private, ltd by shares"514,2215825,"TRI-GREAT (HK) LIMITED
萊元有限公司",2015-03-25,,"Private, ltd by shares"515,2216188,"Tu Casa Limited
杜卡莎有限公司",2015-03-25,,"Private, ltd by shares"516,2215782,"U2 TECHNOLOGY CO., LIMITED
優圖科技有限公司",2015-03-25,2018-09-07,"Private, ltd by shares"517,2216170,"UG Resources Limited",2015-03-25,,"Private, ltd by shares"518,2216111,"UNION MATERIALS SUPPLIES COMPANY LIMITED
聯合物料供應有限公司",2015-03-25,,"Private, ltd by shares"519,2216139,"UNISHOW CO., LIMITED",2015-03-25,2018-12-21,"Private, ltd by shares"520,2216175,"UNITED ASIA GLOBAL PACIFIC LIMITED",2015-03-25,2018-12-14,"Private, ltd by shares"521,2215854,"UNITED EVERGOLDEN INTERNATIONAL CO., LIMITED
和永鑫國際有限公司",2015-03-25,2017-08-25,"Private, ltd by shares"522,2215939,"UNITY MEDICAL CENTRE LIMITED
哲朗醫務中心有限公司",2015-03-25,,"Private, ltd by shares"523,2215980,"Uriel Import And Export Company Limited
舞烈日進出口有限公司",2015-03-25,,"Private, ltd by shares"524,2215819,"VAARITEX INTERNATIONAL LIMITED",2015-03-25,,"Private, ltd by shares"525,2215662,"Vanguard Group Trading Co., Limited",2015-03-25,,"Private, ltd by shares"526,2215910,"Venom Computers Limited",2015-03-25,,"Private, ltd by shares"527,2216074,"VENTRONIX CO LIMITED",2015-03-25,2020-07-24,"Private, ltd by shares"528,2216073,"VICSTAR CHEMICAL LIMITED",2015-03-25,2018-12-14,"Private, ltd by shares"529,2215868,"Vinicoeur HK Limited",2015-03-25,,"Private, ltd by shares"530,2215992,"Vitalis Limited (HK)",2015-03-25,,"Private, ltd by shares"531,2216168,"Vpop Display Products Limited
蔚普展示製品有限公司",2015-03-25,,"Private, ltd by shares"532,2215657,"W&amp;D INTERNATIONAL TECHNOLOGY TRADING LIMITED
萬迪國際技術貿易有限公司",2015-03-25,,"Private, ltd by shares"533,2215979,"Wah Fung Tai Development Limited
華豐泰發展有限公司",2015-03-25,,"Private, ltd by shares"534,2215890,"WANG WAH BAKERY CO., LIMITED
宏華食品有限公司",2015-03-25,2018-11-02,"Private, ltd by shares"535,2215986,"WANG WEI ENTERPRISES LIMITED
宏為企業有限公司",2015-03-25,,"Private, ltd by shares"536,2216150,"WANSHANGCE (CHINA) COMMERCIAL DESIGN LIMITED
萬商策(中國)商業設計有限公司",2015-03-25,2019-01-18,"Private, ltd by shares"537,2216115,"WEINA INTERNATIONAL HOLDING (HK) GROUP CO., LIMITED
唯納國際控股(香港)集團有限公司",2015-03-25,,"Private, ltd by shares"538,2215948,"West Link Helicopters Limited (HK)",2015-03-25,2020-06-26,"Public, ltd by shares"539,2215654,"Westar International Trade Company Limited",2015-03-25,,"Private, ltd by shares"540,2215947,"WILLING ELECTRONICS (HONG KONG) LIMITED
威霖電子(香港)有限公司",2015-03-25,2019-11-15,"Private, ltd by shares"541,2215729,"Win Pioneer Commodity Trading &amp; Resources Limited
永鋒商品資源交易有限公司",2015-03-25,,"Private, ltd by shares"542,2216187,"Win-Start Industrial Co., Limited
共贏工貿有限公司",2015-03-25,2019-01-18,"Private, ltd by shares"543,2215793,"WY IDEA LIMITED
華欣創意有限公司",2015-03-25,,"Private, ltd by shares"544,2216176,"XIA MEDINA HAK COMPANY LIMITED",2015-03-25,2018-12-14,"Private, ltd by shares"545,2216119,"XIAMEN HUITENG TRADE &amp; DEVELOPMENT CO., LIMITED
廈門輝騰貿易發展有限公司",2015-03-25,2019-01-18,"Private, ltd by shares"546,2215984,"Xiangxing China Limited",2015-03-25,2019-12-20,"Private, ltd by shares"547,2215871,"Ximan International Training Chain Organization Limited
茜曼國際培訓連鎖機構有限公司",2015-03-25,,"Private, ltd by shares"548,2215838,"Xingtian Trading Co. Limited
興天(廈門)貿易有限公司",2015-03-25,,"Private, ltd by shares"549,2216151,"YAFUDUN OIL CHEMICAL INDUSTRY (GERMANY) LIMITED
雅富頓石油化工(德國)有限公司",2015-03-25,,"Private, ltd by shares"550,2215865,"YiAn Trading Limited
逸安貿易有限公司",2015-03-25,,"Private, ltd by shares"551,2216056,"YICHENG PENSION INTERNATIONAL HOLDINGS LIMITED
億誠養老國際控股有限公司",2015-03-25,2017-11-03,"Private, ltd by shares"552,2215982,"YIK FUNG HONG TRADING LIMITED
益豐行貿易有限公司",2015-03-25,,"Private, ltd by shares"553,2216013,"YIWU HK PVT. LIMITED",2015-03-25,,"Private, ltd by shares"554,2215896,"YIWU MAIKE DIGITAL IMAGING CO., LIMITED
義烏麥客數碼影像有限公司",2015-03-25,,"Private, ltd by shares"555,2215901,"YONGXINGYUAN TRADE LIMITED
永興源貿易有限公司",2015-03-25,,"Private, ltd by shares"556,2215785,"You-San (HongKong) Technology Co., Limited
優三(香港)科技有限公司",2015-03-25,,"Private, ltd by shares"557,2216174,"YS IMMIGRATION CONSULTANTS LIMITED
垚森投資移民顧問有限公司",2015-03-25,2018-10-26,"Private, ltd by shares"558,2216002,"Yuefeng Trade Import And Export Co., Limited
越豐貿易進出口有限公司",2015-03-25,2018-09-28,"Private, ltd by shares"559,2215725,"YUN CHA ZHI BANG INTERNATIONAL TRADE LIMITED
雲茶之邦國際貿易有限公司",2015-03-25,,"Private, ltd by shares"560,2215805,"YUNTENG INTERNATIONAL INDUSTRY CO., LIMITED
雲騰國際實業有限公司",2015-03-25,,"Private, ltd by shares"561,2215821,"ZHENHONG INDUSTRY AND TRADE CO., LIMITED",2015-03-25,2019-12-13,"Private, ltd by shares"562,2215942,"ZHONG QIAN TECHNOLOGY (HK) COMPANY LIMITED
中乾科技(香港)有限公司",2015-03-25,2019-12-20,"Private, ltd by shares"563,2216180,"ZHONGJIETOYS INDUSTRIAL (HK) LIMITED
中傑玩具實業香港有限公司",2015-03-25,,"Private, ltd by shares"564,2215744,"ZILLION PARTNERS LIMITED",2015-03-25,,"Private, ltd by shares"565,2215738,"Zreh (HK) Limited
自然(香港)有限公司",2015-03-25,2019-01-18,"Private, ltd by shares"566,2215674,"ZT 9 DEVELOPMENT HONGKONG LIMITED",2015-03-25,,"Private, ltd by shares"567,2216041,"ZTST International Trading Co., Limited",2015-03-25,2019-01-18,"Private, ltd by shares"