,Reg no.,Name,Incorp-orated,Dissolved,Type1,2216173,"(HONG KONG) BAI XIANG DEVELOPMENT CO., LIMITED
(香港)百祥發展有限公司",2015-03-25,2017-01-13,"Private, ltd by shares"2,2215736,"136 INC LIMITED",2015-03-25,2019-05-24,"Private, ltd by shares"3,2216048,"2 WOLVES LIMITED
香港雙狼有限公司",2015-03-25,,"Private, ltd by shares"4,2215740,"318 CORPORATION LIMITED",2015-03-25,,"Private, ltd by shares"5,2215985,"90 Group (Holdings) Limited
玖零控股集團有限公司",2015-03-25,,"Private, ltd by shares"6,2215764,"A-HOME HOUSEWARE CO., LIMITED
香港眾鑫家居用品有限公司",2015-03-25,,"Private, ltd by shares"7,2215703,"A-Tech Eng. &amp; Trading Limited
奧科工程貿易有限公司",2015-03-25,,"Private, ltd by shares"8,2215649,"A.L.T INTERNATIONAL GROUP (HONG KONG) CO., LIMITED
安立泰國際集團(香港)有限公司",2015-03-25,,"Private, ltd by shares"9,2215964,"AA PLACE (PVG) LIMITED
優優地帶有限公司",2015-03-25,2017-09-29,"Private, ltd by shares"10,2215946,"Acadine Technologies Holdings Limited
明辨科技集團有限公司",2015-03-25,,"Private, ltd by shares"11,2215783,"Add One Industrial Co., Limited
嘉億實業集團有限公司",2015-03-25,,"Private, ltd by shares"12,2215794,"AEROCUSHION INTERNATIONAL CO., LIMITED
艾克遜國際有限公司",2015-03-25,,"Private, ltd by shares"13,2215830,"AFI TRADE AND LOGISTICS LIMITED",2015-03-25,,"Private, ltd by shares"14,2215978,"AFS CORPORATION LIMITED
愛凡仕股份有限公司",2015-03-25,,"Private, ltd by shares"15,2216162,"Agent Internationale Private Limited",2015-03-25,2018-12-14,"Private, ltd by shares"16,2215812,"AISHANG WEIWEI INT'L TRADE LIMITED
艾尚薇薇國際貿易有限公司",2015-03-25,2019-01-18,"Private, ltd by shares"17,2216101,"AKAYA INC LIMITED
明萱堂有限公司",2015-03-25,,"Private, ltd by shares"18,2216190,"ALIMIND LIMITED",2015-03-25,,"Private, ltd by shares"19,2215737,"ALLIED SHINE CONSULTANTS LIMITED
聯富顧問有限公司",2015-03-25,,"Private, ltd by shares"20,2215851,"Alpha Enterprise Limited
卓暉實業有限公司",2015-03-25,,"Private, ltd by shares"21,2216084,"ALTRAC TECHNOLOGY CO., LIMITED",2015-03-25,2019-08-30,"Private, ltd by shares"22,2216080,"Always Success Rich Limited
恒成達有限公司",2015-03-25,2018-07-20,"Private, ltd by shares"23,2215999,"Amazone Marketing &amp; Sales Limited",2015-03-25,,"Private, ltd by shares"24,2216070,"AN Traders Far East Co. Limited",2015-03-25,,"Private, ltd by shares"25,2215907,"AOJIDANNU INTERNATIONAL GROUP CO., LIMITED
傲吉丹奴國際集團有限公司",2015-03-25,2018-10-05,"Private, ltd by shares"26,2216039,"AONE TRADING (HK) LIMITED
安一貿易(香港)有限公司",2015-03-25,,"Private, ltd by shares"27,2215841,"APPS NOBLE LIMITED",2015-03-25,2019-01-18,"Private, ltd by shares"28,2215977,"Argo Apparel Group Limited",2015-03-25,2019-06-28,"Private, ltd by shares"29,2216103,"ARRLUX LIGHTING CO., LIMITED
正威照明有限公司",2015-03-25,2019-09-27,"Private, ltd by shares"30,2216023,"ASAHI CO., LIMITED
朝日商事有限公司",2015-03-25,,"Private, ltd by shares"31,2215707,"ASIA BLOCK CAPITAL LIMITED
亞方資本有限公司",2015-03-25,,"Private, ltd by shares"32,2215692,"ASIAN SINO INC LIMITED
亞太中華有限公司",2015-03-25,2019-01-18,"Private, ltd by shares"33,2216169,"B &amp; A HOLDINGS LIMITED
北鴻科控股有限公司",2015-03-25,,"Private, ltd by shares"34,2215911,"BAXIN INVESTMENT CO., LIMITED
巴新投資有限公司",2015-03-25,,"Private, ltd by shares"35,2216071,"Bella Beauty Hair Product Co., Limited",2015-03-25,,"Private, ltd by shares"36,2215866,"BELLATRIX HOLDINGS LIMITED (HK)",2015-03-25,,"Private, ltd by shares"37,2215781,"BERNINGHAM LIMITED",2015-03-25,2018-12-14,"Private, ltd by shares"38,2215826,"BEST MACHINING TECHNOLOGY COMPANY LIMITED
倍斯通科技有限公司",2015-03-25,,"Private, ltd by shares"39,2215687,"BESTAR ELECTRONIC TECHNOLOGY CO., LIMITED
佰仕達電子科技有限公司",2015-03-25,2017-10-13,"Private, ltd by shares"40,2215847,"Beta Joy Health Co. Limited",2015-03-25,,"Private, ltd by shares"41,2215969,"BIEN ENGINEERING COMPANY LIMITED
渼安工程有限公司",2015-03-25,,"Private, ltd by shares"42,2215963,"Big Bang Design Limited
天毅設計有限公司",2015-03-25,,"Private, ltd by shares"43,2215892,"BILANG GROUP (ASIA) TECHNOLOGY DEVELOPMENT LIMITED
碧浪集團 (亞洲) 科技發展有限公司",2015-03-25,2019-01-18,"Private, ltd by shares"44,2216003,"BIN YING OPTOELECTRONICS CO., LIMITED
香港彬贏光電有限公司",2015-03-25,,"Private, ltd by shares"45,2215937,"BINYUAN HK LIMITED
彬源有限公司",2015-03-25,2019-01-18,"Private, ltd by shares"46,2215831,"BKD Development Limited",2015-03-25,2016-09-23,"Private, ltd by shares"47,2215884,"BLACK ROCK INTERNATIONAL TRADE CO., LIMITED (d2018-12-07)
黑石國際貿易有限公司",2015-03-25,2018-12-07,"Private, ltd by shares"48,2215967,"Blue International Group Limited (d2018-08-03)
藍調國際集團有限公司",2015-03-25,2018-08-03,"Private, ltd by shares"49,2216117,"Blue Jumbo Technology Company Limited
藍嘉寶科技有限公司",2015-03-25,,"Private, ltd by shares"50,2215667,"BLUENET INTERNATIONAL (HK) CO. LIMITED
藍際國際(香港)有限公司",2015-03-25,,"Private, ltd by shares"51,2215656,"BOSSBE (HK) TECHNOLOGY CO., LIMITED
伯思比(香港)科技有限公司",2015-03-25,,"Private, ltd by shares"52,2216065,"BOTNET CO., LIMITED
搏特科技有限公司",2015-03-25,2019-01-18,"Private, ltd by shares"53,2215741,"BRIGHT FIELD CONSULTANTS LIMITED
業豐顧問有限公司",2015-03-25,2020-05-15,"Private, ltd by shares"54,2215754,"BRIGHTLAND CORPORATION LIMITED
卓越五洲有限公司",2015-03-25,,"Private, ltd by shares"55,2215742,"BRILLIANT UNIPAC PROPERTIES LIMITED
卓越寰亞置業有限公司",2015-03-25,2018-12-14,"Private, ltd by shares"56,2216033,"BROADSEAS ELECTRONICS CO., LIMITED
佰德匯電子有限公司",2015-03-25,,"Private, ltd by shares"57,2216063,"BSH SERVICES LIMITED (HK)",2015-03-25,,"Private, ltd by shares"58,2215876,"BULL SHIJIA (HK) INT'L SHOES INDUSTRY CO., LIMITED
公牛世家(香港)國際鞋業有限公司",2015-03-25,,"Private, ltd by shares"59,2216094,"Busy Bee Personal Care Limited (HK)",2015-03-25,,"Private, ltd by shares"60,2215757,"BUYASSOCIATION (HONG KONG) LIMITED",2015-03-25,,"Private, ltd by shares"61,2215853,"CAMABIO TECHNOLOGY CO., LIMITED
凱邁科技有限公司",2015-03-25,,"Private, ltd by shares"62,2215828,"CAROTE INTERNATIONAL LIMITED (HK)
卡羅特國際有限公司",2015-03-25,,"Private, ltd by shares"63,2216204,"CENTRAL CHINA INTERNATIONAL INVESTMENT COMPANY LIMITED
中州國際投資有限公司",2015-03-25,,"Private, ltd by shares"64,2216055,"Ceylon Trading and Consultancy Limited",2015-03-25,,"Private, ltd by shares"65,2215833,"CHANGHONG BUSINESS LIMITED
長紅貿易有限公司",2015-03-25,2018-08-24,"Private, ltd by shares"66,2215875,"CHINA CAREER PLANNING ASSOCIATION LIMITED
中國生涯規劃協會有限公司",2015-03-25,,"Private, ltd by shares"67,2216009,"CHINA DRAGONS (HK) LIMITED",2015-03-25,2020-09-25,"Private, ltd by shares"68,2215944,"China Green Board Corporation Limited",2015-03-25,,"Private, ltd by shares"69,2216144,"CHINA HEALTH ORGANIZATION UNION HOLDINGS LIMITED
中國健康組織聯盟控股有限公司",2015-03-25,2019-01-18,"Private, ltd by shares"70,2216014,"China HK Good Luck (International) The Whole Soft Outfit Co., Limited
中國香港好運來(國際)整體軟裝有限公司",2015-03-25,,"Private, ltd by shares"71,2215862,"CHINA HUMAN CAPITAL MANAGEMENT LIMITED
中國人力資本管理科技有限公司",2015-03-25,,"Private, ltd by shares"72,2216091,"CHINA LINGYILING COMMERCE INVESTMENT MANAGEMENT CO., LIMITED
中國零壹零商業投資管理有限公司",2015-03-25,,"Private, ltd by shares"73,2215661,"CHINA MEDICAL ROBOTICS ASSOCIATION LIMITED
中國醫用機器人協會有限公司",2015-03-25,2019-01-18,"Private, ltd by shares"74,2215908,"CHINA SOURCE TECHNOLOGY (HK) LIMITED",2015-03-25,2016-05-13,"Private, ltd by shares"75,2215929,"CHINA UNITED MOULD LIMITED
聯合模具(中國)有限公司",2015-03-25,,"Private, ltd by shares"76,2215795,"CHINA WIN AUSPICIOUS CO., LIMITED
中國映祥瑞有限公司",2015-03-25,,"Private, ltd by shares"77,2216158,"CHINESE METASYNTHETIC INTERNATIONAL HOLDINGS GROUP LIMITED
中國大成智慧國際控股集團有限公司",2015-03-25,,"Private, ltd by shares"78,2215886,"CHITAT INDUSTRY (HK) LIMITED
香港志達貿易實業有限公司",2015-03-25,,"Private, ltd by shares"79,2215801,"Choiceness Bright Longlife (HK) Limited
彩運至尚(香港)有限公司",2015-03-25,2017-11-17,"Private, ltd by shares"80,2215956,"CHUANGLI ELECTRONICS TRADING CO., LIMITED
創力電子貿易有限公司",2015-03-25,2019-04-04,"Private, ltd by shares"81,2215690,"Chui Global Consulting Limited",2015-03-25,2019-12-20,"Private, ltd by shares"82,2216060,"Chunmanyuan Limited
春滿園有限公司",2015-03-25,2020-05-29,"Private, ltd by shares"83,2216166,"Ciamei Limited",2015-03-25,,"Private, ltd by shares"84,2215752,"Circle Life Limited (d2018-08-10)
圓滿軒有限公司",2015-03-25,2018-08-10,"Private, ltd by shares"85,2216047,"CLOUD BUSINESS FUTURE HOLDING (HK) LIMITED
雲商未來控股(香港)有限公司",2015-03-25,2018-12-14,"Private, ltd by shares"86,2215981,"Cloud Decoration Technology (Hong Kong) Limited
雲萬家科技(香港)有限公司",2015-03-25,,"Private, ltd by shares"87,2215912,"CMG Packaging Company Limited",2015-03-25,2018-11-23,"Private, ltd by shares"88,2216107,"COASTAL ENERGY INTERNATIOAL LIMITED
海岸能源國際有限公司",2015-03-25,,"Private, ltd by shares"89,2216108,"COASTAL INVESTMENT LIMITED",2015-03-25,,"Private, ltd by shares"90,2216172,"Colborne Interest Limited",2015-03-25,,"Private, ltd by shares"91,2216019,"COMPAKS OUTDOOR EQUIPMENT CO., LIMITED",2015-03-25,,"Private, ltd by shares"92,2215904,"Constant Success Auto Limited
豐實汽車有限公司",2015-03-25,2018-08-31,"Private, ltd by shares"93,2216093,"COSMOS JEWELRY LIMITED
宙顏飾品有限公司",2015-03-25,,"Private, ltd by shares"94,2215688,"CZJ AUTO PARTS LIMITED
香港車之傑汽配有限公司",2015-03-25,,"Private, ltd by shares"95,2216043,"DATANG AGRICULTURE AND FORESTRY TECHNOLOGY GROUP (CHINA) LIMITED
大唐農林科技集團(中國)有限公司",2015-03-25,2019-01-18,"Private, ltd by shares"96,2215975,"De Shun Group (International) Investment Limited
德順集團(國際)投資有限公司",2015-03-25,,"Private, ltd by shares"97,2215887,"DEMOCRATIC REALM LIMITED
港民領域有限公司",2015-03-25,2016-09-15,"Ltd by guarantee"98,2216178,"DESIGN CONCEPT AND CO., LIMITED",2015-03-25,,"Private, ltd by shares"99,2216058,"Desserts Tavern Limited
甜棧有限公司",2015-03-25,,"Private, ltd by shares"100,2216098,"DEXING ELECTRONIC (HONGKONG) LIMITED
德興電子(香港)有限公司",2015-03-25,,"Private, ltd by shares"101,2215800,"DIDWW HK LIMITED",2015-03-25,,"Private, ltd by shares"102,2215823,"DINGXIN TRADING CO., LIMITED
鼎鑫貿易有限公司",2015-03-25,2019-12-20,"Private, ltd by shares"103,2215989,"DONGLIN INVESTMENTS (HONG KONG) MANAGEMENT LIMITED
東霖投資(香港)管理有限公司",2015-03-25,,"Private, ltd by shares"104,2216072,"Double LW Limited
雙樂韋有限公司",2015-03-25,2019-08-09,"Private, ltd by shares"105,2215733,"DRAGON MASTER SHIPPING LIMITED
龍禧船務有限公司",2015-03-25,2017-08-18,"Private, ltd by shares"106,2215941,"DREAMS LAB COMPANY LIMITED
夢之館有限公司",2015-03-25,,"Private, ltd by shares"107,2215775,"DUOMI HOLDING INTERNATIONAL LIMITED
香港多米控股國際有限公司",2015-03-25,,"Private, ltd by shares"108,2215817,"E-Canton Trading Company Limited
依坎頓貿易有限公司",2015-03-25,,"Private, ltd by shares"109,2216122,"E-TROPHY LIMITED
易奬盃製品有限公司",2015-03-25,,"Private, ltd by shares"110,2215765,"East Ocean Profit Smart Limited
東海盈富有限公司",2015-03-25,,"Private, ltd by shares"111,2215777,"EASTBERRY LIMITED (d2018-12-14)",2015-03-25,2018-12-14,"Private, ltd by shares"112,2216032,"Ebco HK Limited
艾伯克香港有限公司",2015-03-25,,"Private, ltd by shares"113,2215893,"Edu Global Services Limited",2015-03-25,2019-12-06,"Private, ltd by shares"114,2215899,"EMGY GROUP LIMITED",2015-03-25,2016-09-02,"Private, ltd by shares"115,2216066,"EnergyUncovered Limited",2015-03-25,2017-11-17,"Private, ltd by shares"116,2215735,"ENJOE GROUP LIMITED
英爵集團有限公司",2015-03-25,,"Private, ltd by shares"117,2216132,"Eontech International Co., Limited
嘉昱國際有限公司",2015-03-25,,"Private, ltd by shares"118,2215906,"ETERNAL LIFE MUSIC CHARITY FOUNDATION LIMITED
生命樂章慈善基金有限公司",2015-03-25,,"Ltd by guarantee"119,2216010,"Eternity ZY Information Technology (China) Limited
久夕中國有限公司",2015-03-25,,"Private, ltd by shares"120,2215924,"Eurasian Financial Group Limited
歐亞金融集團有限公司",2015-03-25,2019-01-18,"Private, ltd by shares"121,2216075,"ExPRO PRODUCTION COMPANY LIMITED
天一製作有限公司",2015-03-25,2016-11-25,"Private, ltd by shares"122,2215670,"Falcon Concept (HK) Limited
隼榆(香港) 有限公司",2015-03-25,,"Private, ltd by shares"123,2216083,"FAMOUS CONCEPT ASIA PACIFIC LIMITED
名創亞太有限公司",2015-03-25,,"Private, ltd by shares"124,2216142,"Fansky Fortune Investment Company Limited",2015-03-25,2020-05-15,"Private, ltd by shares"125,2216167,"FAST PRODUCTION LIMITED
盛諾製作有限公司",2015-03-25,2016-11-25,"Private, ltd by shares"126,2215900,"FEDERATION OF HK JIANGSU COMMUNITY ORGANISATIONS LIMITED
香港江蘇社團總會有限公司",2015-03-25,,"Ltd by guarantee"127,2216125,"Fei Si Ting Bedroom Article International Limited
菲斯汀寢室用品(國際)有限公司",2015-03-25,,"Private, ltd by shares"128,2215748,"Feng Yin International Corporation Limited
豐繹國際事業有限公司",2015-03-25,,"Private, ltd by shares"129,2215715,"FengXi International Group Limited",2015-03-25,2019-12-20,"Private, ltd by shares"130,2215683,"FEROZ Beauty &amp; Health International Academy Limited
麗康國際學院有限公司",2015-03-25,,"Private, ltd by shares"131,2216037,"FLT TRADING CO., LIMITED
豐利達貿易有限公司",2015-03-25,2016-07-29,"Private, ltd by shares"132,2216059,"FLYING BOX LIMITED (HK)",2015-03-25,,"Private, ltd by shares"133,2215686,"FOH CHEONG COMPANY LIMITED
香港富昌股份有限公司",2015-03-25,,"Private, ltd by shares"134,2215755,"FORTUNE WAY HONG KONG INVESTMENT LIMITED
滙富香港投資有限公司",2015-03-25,,"Private, ltd by shares"135,2216129,"FRANCE FASHIYIER COSMETICS INT'L HOLDING GROUP LIMITED
法國法詩伊爾化妝品國際控股集團有限公司",2015-03-25,2020-11-13,"Private, ltd by shares"136,2215818,"France Yuwei Bio-Engineering Co., Limited
法國瑜瑋生物工程有限公司",2015-03-25,2019-01-18,"Private, ltd by shares"137,2215651,"Galaxy Logistics Trade Limited
銀河物流貿易有限公司",2015-03-25,2018-12-14,"Private, ltd by shares"138,2215834,"GAMEONIY LIMITED
香港佳姆隆有限公司",2015-03-25,2019-10-11,"Private, ltd by shares"139,2215768,"Gather-In Hostel Limited
尚聚(青年)旅舍有限公司",2015-03-25,2019-09-06,"Private, ltd by shares"140,2215882,"GCS Developments Limited (HK)",2015-03-25,2017-06-30,"Private, ltd by shares"141,2215643,"GEOMAX VENTURES LIMITED",2015-03-25,,"Private, ltd by shares"142,2215832,"GeoNedra Limited",2015-03-25,,"Private, ltd by shares"143,2216120,"German Your Feeding Technology Group Company Limited
德國尤爾哺育科技集團有限公司",2015-03-25,2020-07-03,"Private, ltd by shares"144,2215771,"Germany Kloke International Petrochemical Group Limited
德國克洛克國際石化集團有限公司",2015-03-25,,"Private, ltd by shares"145,2215898,"GERMANY YOUDUN MACHINE (INT'L) LIMITED
德國優頓機械(國際)有限公司",2015-03-25,2019-01-18,"Private, ltd by shares"146,2215655,"Giantplus International Company Limited
捷普斯運動科技有限公司",2015-03-25,,"Private, ltd by shares"147,2215718,"GLOBAL CRYPTO ASSETS APPLICATION CO., LIMITED
全球加密數字資產應用有限公司",2015-03-25,,"Private, ltd by shares"148,2215806,"GLOBAL ELITE INTERNATIONAL ENTERPRISE LIMITED
輝煌國際企業有限公司",2015-03-25,2020-05-15,"Private, ltd by shares"149,2215803,"GLOBAL HANTOK TECHNOLOGY COMPANY LIMITED
香港漢唐科技(國際)有限公司",2015-03-25,,"Private, ltd by shares"150,2215791,"Global Link Consultancy Limited",2015-03-25,,"Private, ltd by shares"151,2215863,"GLOBAL SOURCING CENTER HK LIMITED",2015-03-25,,"Private, ltd by shares"152,2215993,"Glory Journey Development Limited
程凱發展有限公司",2015-03-25,,"Private, ltd by shares"153,2215746,"GLORY RICH HONG KONG DEVELOPMENT LIMITED
榮豐香港發展有限公司",2015-03-25,,"Private, ltd by shares"154,2215850,"GOLDEN INTERNATIONAL SHIPPING AGENT COMPANY LIMITED
金都國際貨運代理有限公司",2015-03-25,,"Private, ltd by shares"155,2216136,"GOOD LIFE INTERNATIONAL TRADE CO., LIMITED
美好生活國際貿易有限公司",2015-03-25,,"Private, ltd by shares"156,2215958,"Grand Wisdom Global Financial Investment (HK) Limited
智高點環球理財(香港)有限公司",2015-03-25,,"Private, ltd by shares"157,2216036,"GUANGDONG FOSHAN WANDA CERAMIC LIMITED
廣東佛山萬達建陶有限公司",2015-03-25,,"Private, ltd by shares"158,2215895,"GUANGDONG GOOD SUN NEW ENERGY CO., LIMITED
廣東美好太陽能新能源有限公司",2015-03-25,2019-12-20,"Private, ltd by shares"159,2215743,"GUANGZHOU JINGHUI PRINTING CO., LIMITED
廣州景輝印刷有限公司",2015-03-25,2017-09-15,"Private, ltd by shares"160,2215991,"GUIDING HARDWARE CO., LIMITED",2015-03-25,,"Private, ltd by shares"161,2215971,"Guo Tai Import and Export Trading (Hong Kong) Limited
國泰進出口貿易(香港)有限公司",2015-03-25,2018-12-14,"Private, ltd by shares"162,2216207,"GWW-Pro-Marketing Limited",2015-03-25,,"Private, ltd by shares"163,2216100,"GX Industries Limited
廣信工業有限公司",2015-03-25,2020-05-08,"Private, ltd by shares"164,2216068,"H.K.GLOBAL CO-CREATING (INTERNATIONAL) TRADING CO., LIMITED
香港伍洲聯創(國際)貿易有限公司",2015-03-25,2016-03-18,"Private, ltd by shares"165,2216082,"HAI YI LE TRADING CO., LIMITED
海怡樂貿易有限公司",2015-03-25,,"Private, ltd by shares"166,2216147,"HAIR ACCESSORY EXPORT COMPANY LIMITED",2015-03-25,,"Private, ltd by shares"167,2215842,"Haituo YouPin Printing &amp; packing Company Limited
海拓優品印刷包裝有限公司",2015-03-25,,"Private, ltd by shares"168,2215749,"HANG LAP LIMITED
行立有限公司",2015-03-25,,"Private, ltd by shares"169,2216159,"Hang Lee Group Limited
恒利控股集團有限公司",2015-03-25,,"Private, ltd by shares"170,2216161,"Hang Lee Industrial Group Limited
恒利實業集團有限公司",2015-03-25,,"Private, ltd by shares"171,2215720,"HANG LIK LIMITED
行力有限公司",2015-03-25,,"Private, ltd by shares"172,2215954,"HangZhou YingYing Import &amp; Export Co., Limited
杭州瑩瑩進出口有限公司",2015-03-25,,"Private, ltd by shares"173,2215810,"Happy Forever Investment Limited
喜洋洋投資有限公司",2015-03-25,,"Private, ltd by shares"174,2216206,"HBBC LIMITED (HK)",2015-03-25,,"Private, ltd by shares"175,2216064,"Head to Toes Limited",2015-03-25,2019-03-15,"Private, ltd by shares"176,2215909,"HEBEI LUYUAN CYCLES CO., LIMITED
河北綠源童車有限公司",2015-03-25,2019-12-20,"Private, ltd by shares"177,2215762,"HENG FU TAI INVESTMENT LIMITED
恆富泰投資有限公司",2015-03-25,2019-11-29,"Private, ltd by shares"178,2216027,"HEXI BIOLOGICAL TECHNOLOGY CO., LIMITED
赫汐生物科技有限公司",2015-03-25,2019-01-18,"Private, ltd by shares"179,2216102,"HHET TECHNOLOGY CO., LIMITED
鴻和泰科技有限公司",2015-03-25,,"Private, ltd by shares"180,2215650,"HIGH EXCELLENCE TRADE CO., LIMITED
崇卓貿易有限公司",2015-03-25,,"Private, ltd by shares"181,2216134,"Hing Sum Development Limited
馨心拓展有限公司",2015-03-25,,"Private, ltd by shares"182,2216034,"HK AIRU TRADE LIMITED
香港愛路貿易有限公司",2015-03-25,,"Private, ltd by shares"183,2216155,"HK BAD KIDS IMPT&amp;EXPT TRADE LIMITED
香港壞孩子進出口貿易有限公司",2015-03-25,2019-01-18,"Private, ltd by shares"184,2215848,"HK CHUNQIU ENVIRONMENTAL PROTECTION ENGINEERING LIMITED
香港春秋環保工程有限公司",2015-03-25,2019-08-02,"Private, ltd by shares"185,2216131,"HK CYNLNE TRADING LIMITED",2015-03-25,2019-01-18,"Private, ltd by shares"186,2215905,"HK DINGSHENG INT'L BIOLOGY TECHNOLOGY LIMITED
香港鼎盛國際生物科技有限公司",2015-03-25,,"Private, ltd by shares"187,2215835,"HK DOUBLE ARROW CLOCK INDUSTRY CO., LIMITED
香港雙箭鍾業有限公司",2015-03-25,2018-09-07,"Private, ltd by shares"188,2216078,"HK EID TRADING LIMITED
香港伊德貿易有限公司",2015-03-25,,"Private, ltd by shares"189,2215724,"HK HAIMA CHUANGDIAN GROUP LIMITED (d2019-01-18)
香港海馬床墊集團有限公司",2015-03-25,2019-01-18,"Private, ltd by shares"190,2216140,"HK HUAXIA TRADING CO., LIMITED
香港華夏貿易有限公司",2015-03-25,,"Private, ltd by shares"191,2215797,"HK KANGHUI INDUSTRIAL LIMITED
香港康匯實業有限公司",2015-03-25,2019-01-18,"Private, ltd by shares"192,2215778,"HK KLT (INT'L) BUILDING MATERIALS TECHNOLOGY LIMITED
香港科魯特(國際)建材科技有限公司",2015-03-25,2019-04-12,"Private, ltd by shares"193,2215689,"HK LIUHE GROUP CO., LIMITED
香港六和集團有限公司",2015-03-25,2017-09-22,"Private, ltd by shares"194,2216077,"HK MASIKADUN SANITARY LIMITED
香港馬斯卡頓衛浴有限公司",2015-03-25,,"Private, ltd by shares"195,2215776,"HK MENGHANG HOTEL MANAGEMENT CO., LIMITED
香港夢航酒店管理有限公司",2015-03-25,,"Private, ltd by shares"196,2216067,"HK OLD AGE ARTS ASSOCIATION CO., LIMITED
香港老年藝術協會有限公司",2015-03-25,2019-01-18,"Private, ltd by shares"197,2216087,"HK QICHUANG LIANFA TECHNOLOGY CO., LIMITED
香港奇創聯發科技有限公司",2015-03-25,2018-03-02,"Private, ltd by shares"198,2216061,"HK RONGCHEN COMMERCE AND TRADE CO., LIMITED
香港榮辰商貿有限公司",2015-03-25,,"Private, ltd by shares"199,2216152,"HK RONGYUANBAORUI CATERING MANAGEMENT LIMITED
香港融元寶瑞餐飲管理有限公司",2015-03-25,2019-01-18,"Private, ltd by shares"200,2215997,"HK ROYAL GIRL (INT'L) LIMITED
香港皇家女孩(國際)有限公司",2015-03-25,2019-01-18,"Private, ltd by shares"201,2216116,"Hk TianYuan Stock Co., Limited
香港天源股份有限公司",2015-03-25,2019-01-18,"Private, ltd by shares"202,2215658,"HK TRADE CHEER INDUSTRIAL LIMITED
香港貿奕實業有限公司",2015-03-25,,"Private, ltd by shares"203,2215731,"HK TRJK CO., LIMITED
香港天潤金控有限公司",2015-03-25,,"Private, ltd by shares"204,2215756,"HK Wan Zhao International Development Limited
香港萬兆國際發展有限公司",2015-03-25,2019-01-18,"Private, ltd by shares"205,2216053,"HK ZIYUN INT'L GROUP HOLDING LIMITED
香港紫韻國際集團控股有限公司",2015-03-25,,"Private, ltd by shares"206,2215750,"hmv Artiste Management Limited",2015-03-25,,"Private, ltd by shares"207,2216121,"Holiday Designs Holding Limited",2015-03-25,2020-03-27,"Private, ltd by shares"208,2216127,"HOME ENGINEERING LIMITED (THE)
家．裝修工程有限公司",2015-03-25,2018-10-05,"Private, ltd by shares"209,2215951,"HONG KONG AOQING TRADING LIMITED
香港傲青商貿有限公司",2015-03-25,,"Private, ltd by shares"210,2215824,"Hong Kong Botion International Trade Co., Limited
香港博欣國際貿易有限公司",2015-03-25,,"Private, ltd by shares"211,2216016,"HONG KONG CHENGZHANXING TRADE LIMITED
香港誠展興貿易有限公司",2015-03-25,2017-12-15,"Private, ltd by shares"212,2215872,"HONG KONG ENPOWER INTERNATIONAL CO., LIMITED
香港慕雪晴天國際有限公司",2015-03-25,2016-07-15,"Private, ltd by shares"213,2215704,"Hong Kong Golden Central Jewellery Company Limited
香港金中環珠寶有限公司",2015-03-25,2020-03-27,"Private, ltd by shares"214,2216104,"Hong Kong Hing Yuen Engineering Limited
香港興源工程有限公司",2015-03-25,,"Private, ltd by shares"215,2216012,"Hong Kong International Chamber of Professionals Limited
香港國際專業人員商會有限公司",2015-03-25,,"Ltd by guarantee"216,2215943,"Hong Kong KL Tourism Group Co., Limited
香港康旅天一旅業集團有限公司",2015-03-25,,"Private, ltd by shares"217,2216024,"HONG KONG LIHENGTENG TRADE LIMITED
香港利恒騰貿易有限公司",2015-03-25,2018-08-24,"Private, ltd by shares"218,2215927,"Hong Kong Most International Group Co., Limited
香港莫斯特國際集團有限公司",2015-03-25,,"Private, ltd by shares"219,2215792,"HONG KONG NOVA TREASURE INTERNATIONAL LIMITED
香港新星財富國際有限公司",2015-03-25,,"Private, ltd by shares"220,2215693,"HONG KONG PROFIT TIME LIMITED
香港利時有限公司",2015-03-25,,"Private, ltd by shares"221,2216135,"HONG KONG SOCIETY OF NEUROMUSCULAR DISEASES LIMITED (THE)
香港神經肌肉疾病學會有限公司",2015-03-25,,"Ltd by guarantee"222,2215685,"HONG KONG SOMMET INTERNATIONAL COMPANY LIMITED
香港索美國際有限公司",2015-03-25,2019-07-12,"Private, ltd by shares"223,2215858,"HONG KONG TIANYI DYNASTY FURNITURE INTERNATIONAL HOLDINGS LIMITED
香港天頤王朝家俬國際集團有限公司",2015-03-25,2019-01-18,"Private, ltd by shares"224,2215814,"HONG KONG TRADE DIGITAL LIMITED
香港愛數貿易有限公司",2015-03-25,2019-09-27,"Private, ltd by shares"225,2215789,"HONG KONG VAPESOON TECHNOLOGY CO., LIMITED",2015-03-25,2017-07-07,"Private, ltd by shares"