,Reg no.,Name,Incorp-orated,Dissolved,Type222,1486516,"HAN KO WEALTH CO., LIMITED
漢科創富有限公司",2010-07-29,2014-12-05,"Private, ltd by shares"223,1486912,"HANG ON DOOR INDUSTRY (HK) LIMITED
恒安門業(香港)有限公司",2010-07-29,2020-05-15,"Private, ltd by shares"224,1486309,"HANGXIN PRACTICAL TECHNOLOGY CO., LIMITED
航新實用技術(香港)有限公司",2010-07-29,2015-10-16,"Private, ltd by shares"225,1486541,"HAOYU (HONGKONG) INTERNATIONAL TRADE LIMITED
香港浩宇國際貿易有限公司",2010-07-29,2014-12-05,"Private, ltd by shares"226,1486431,"HARVEST FINE LIMITED
豐明有限公司",2010-07-29,2018-04-06,"Private, ltd by shares"227,1486352,"HARVESTSEEDSYNCO CONSULTANCY LIMITED
穗智盛信顧問有限公司",2010-07-29,,"Private, ltd by shares"228,1486929,"HE XING YUAN INTERNATIONAL TRADING CO., LIMITED
合興源國際貿易有限公司",2010-07-29,2020-05-22,"Private, ltd by shares"229,1486434,"HEALTH KEY LIMITED
康啟有限公司",2010-07-29,,"Private, ltd by shares"230,1486799,"Health Medical Groups Limited
盈康醫學集團有限公司",2010-07-29,2019-03-29,"Private, ltd by shares"231,1486798,"HEALTH TRUTH LIMITED
康諦有限公司",2010-07-29,,"Private, ltd by shares"232,1486438,"HEALTHY PROFIT LIMITED
潤康有限公司",2010-07-29,,"Private, ltd by shares"233,1486329,"HELO (HK) INDUSTRY CO., LIMITED
哈樂(香港)實業有限公司",2010-07-29,2017-04-21,"Private, ltd by shares"234,1486781,"HENAN KUANGYE CRANE CO., LIMITED
河南礦冶起重機有限公司",2010-07-29,2019-04-26,"Private, ltd by shares"235,1486780,"HENGXIN PHARMA CO., LIMITED
恒鑫制藥有限公司",2010-07-29,,"Private, ltd by shares"236,1486755,"HIGHLAN HOLDINGS LIMITED
凱倫控股有限公司",2010-07-29,,"Private, ltd by shares"237,1486460,"HILDEN ASSOCIATES LIMITED",2010-07-29,,"Private, ltd by shares"238,1486857,"Hillhouse Investment Management Limited
高瓴投資管理有限公司",2010-07-29,,"Private, ltd by shares"239,1486713,"HILTECH ENGINEERING LIMITED
海樂工程有限公司",2010-07-29,,"Private, ltd by shares"240,1486688,"HIP WAH (HONG KONG) INDUSTRIAL LIMITED
協華(香港)實業有限公司",2010-07-29,,"Private, ltd by shares"241,1486917,"HK BOHUA INTERNATIONAL TRADING COMPANY LIMITED
香港博華國際貿易有限公司",2010-07-29,2014-12-05,"Private, ltd by shares"242,1486318,"HK CHI XIANG TRADING LIMITED
香港馳翔貿易有限公司",2010-07-29,2014-01-30,"Private, ltd by shares"243,1486924,"HK CREFIT NEW ENERGY INDUSTRIAL INVESTMENT LIMITED
香港創利新能源產業投資有限公司",2010-07-29,2017-04-21,"Private, ltd by shares"244,1486968,"HK EAST GROUP (INTERNATIONAL) SHOES LIMITED
香港東方集團(國際)鞋業有限公司",2010-07-29,2017-04-21,"Private, ltd by shares"245,1486921,"HK EOULU TRADING LIMITED
香港伊歐陸貿易有限公司",2010-07-29,,"Private, ltd by shares"246,1486846,"HK FIVE GREEN HEALTH INDUSTRY INT'L GROUP LIMITED
香港五綠健康產業國際集團有限公司",2010-07-29,,"Private, ltd by shares"247,1486750,"HK HENGGUANG TRADING CO., LIMITED
香港恒光貿易有限公司",2010-07-29,2014-12-05,"Private, ltd by shares"248,1486585,"HK KEY STORE ELECTRONIC KEY LIMITED
香港金鎖電子鑰匙有限公司",2010-07-29,,"Private, ltd by shares"249,1486661,"HK PRESTIGE TRADING LIMITED
香港威信貿易有限公司",2010-07-29,2016-01-08,"Private, ltd by shares"250,1486622,"HK ROTO INT'L CARGO AGENT CO., LIMITED
香港強潤通國際貨運代理有限公司",2010-07-29,2014-12-05,"Private, ltd by shares"251,1486403,"HK ROYAL INT'L INDUSTRY GROUP LIMITED
香港皇家國際實業集團有限公司",2010-07-29,2014-12-05,"Private, ltd by shares"252,1486424,"HK SHANGTANG DECORATE DESIGN ENGINEERING LIMITED
香港尚堂裝飾設計工程有限公司",2010-07-29,2014-12-05,"Private, ltd by shares"253,1486831,"HK ST.LONG INT'L HOLDINGS LIMITED
香港聖龍國際控股有限公司",2010-07-29,2018-04-06,"Private, ltd by shares"254,1486771,"HK YIXIANG IMPORT AND EXPORT LIMITED
香港亦翔進出口有限公司",2010-07-29,2018-12-07,"Private, ltd by shares"255,1486732,"HK ZIJIN TONGCHUANG ADVANCED DESIGN LIMITED
香港紫金同創高端設計有限公司",2010-07-29,2014-12-05,"Private, ltd by shares"256,1486706,"HLX INTERNATIONAL LIMITED
三小國際有限公司",2010-07-29,2018-03-02,"Private, ltd by shares"257,1486421,"HONG KONG (CHINA) COLOURED ASSETS INVESTMENT MANAGEMENT LIMITED
香港(中國)有色資產投資管理有限公司",2010-07-29,,"Private, ltd by shares"258,1486298,"HONG KONG (INTERNATIONAL) YACHT CLUB HOLDINGS LIMITED
香港(國際)遊艇會控股有限公司",2010-07-29,2013-09-13,"Private, ltd by shares"259,1486730,"HONG KONG ANYWALK INTERNATIONAL FASHIONS LIMITED
香港安尼沃克國際服飾有限公司",2010-07-29,,"Private, ltd by shares"260,1486454,"HONG KONG CHEUNG YING INTERNATIONAL GROUP LIMITED
香港長盈國際集團有限公司",2010-07-29,2018-10-05,"Private, ltd by shares"261,1486955,"HONG KONG CREATIVE UNION INDUSTRIAL LIMITED",2010-07-29,,"Private, ltd by shares"262,1486670,"Hong Kong EG Sam Tung International Investment Holding Limited
香港鷹騎三通國際投資(集團)有限公司",2010-07-29,,"Private, ltd by shares"263,1486343,"Hong Kong Hung Kung International Trading Limited
香港鴻冠國際貿易有限公司",2010-07-29,2018-04-06,"Private, ltd by shares"264,1486469,"HONG KONG JOYFUL &amp; PERFECT CORPORATION LIMITED
香港喜滿緣實業有限公司",2010-07-29,2015-07-10,"Private, ltd by shares"265,1486357,"HONG KONG KAMORN TECHNOLOGY CO., LIMITED
香港凱蒙科技有限公司",2010-07-29,,"Private, ltd by shares"266,1486489,"HONG KONG MAVERICK TECHNOLOGY CO., LIMITED
香港瑪沃銳克科技有限公司",2010-07-29,2015-07-10,"Private, ltd by shares"267,1486446,"HONG KONG SABOTEN CO., LIMITED",2010-07-29,,"Private, ltd by shares"268,1486405,"HONGKONG ASIA COMMERCIAL CO., LIMITED
香港亞洲商業有限公司",2010-07-29,2018-04-06,"Private, ltd by shares"269,1486667,"HONGKONG BAILI CO., LIMITED
香港百利有限公司",2010-07-29,,"Private, ltd by shares"270,1486766,"HONGKONG BEST CHOICE ELECTRONIC LIMITED
香港保時真電子有限公司",2010-07-29,2015-07-10,"Private, ltd by shares"271,1486636,"HONGKONG BESTONE INVESTMENT AND DEVELOPMENT CO., LIMITED
香港百世通投資發展有限公司",2010-07-29,,"Private, ltd by shares"272,1486756,"HONGKONG BORY INVESTMENT CO., LIMITED
香港博睿投資股份有限公司",2010-07-29,2017-04-21,"Private, ltd by shares"273,1486867,"HONGKONG CHANGTAI INDUSTRIAL SHARES CO., LIMITED
香港昌泰實業股份有限公司",2010-07-29,,"Private, ltd by shares"274,1486872,"HONGKONG CHUANGHONG INT'L INDUSTRIAL CO., LIMITED
香港創鴻投資集團有限公司",2010-07-29,2017-04-21,"Private, ltd by shares"275,1486885,"HONGKONG CIIC INTERNATIONAL ENTERPRISE DEVELOPMENT CO., LIMITED
香港中智國際企業發展有限公司",2010-07-29,2016-03-24,"Private, ltd by shares"276,1486817,"HONGKONG DAFENG HOUSEWARE CO., LIMITED
香港大豐家居用品有限公司",2010-07-29,,"Private, ltd by shares"277,1486415,"HONGKONG DONGYUAN INTERNATIONAL TRADING CO., LIMITED
香港東源國際貿易有限公司",2010-07-29,2015-07-10,"Private, ltd by shares"278,1486514,"HONGKONG EENTER TECHNOLOGIES CO., LIMITED
香港易安特科技有限公司",2010-07-29,2012-11-23,"Private, ltd by shares"279,1486334,"HONGKONG GANGYIZI (INT'L) FASHION LIMITED
香港港億姿(國際)服飾有限公司",2010-07-29,2019-03-01,"Private, ltd by shares"280,1486818,"HONGKONG GOLDENTEAM LIMITED
香港金和有限公司",2010-07-29,,"Private, ltd by shares"281,1486875,"HONGKONG GUANFANGHUN ART &amp; CRAFT CO., LIMITED
香港官坊魂美術工藝品有限公司",2010-07-29,2015-07-10,"Private, ltd by shares"282,1486712,"HONGKONG H&amp;H HEALTH CO., LIMITED
香港壹心草本大健康有限公司",2010-07-29,,"Private, ltd by shares"283,1486315,"HONGKONG HAN XIE TAI GROUP CO., LIMITED
香港漢協泰集團有限公司",2010-07-29,2017-04-21,"Private, ltd by shares"284,1486477,"HONGKONG INTERNATIONAL LONG CHENG LIMITED
香港國際龍城有限公司",2010-07-29,2017-12-22,"Private, ltd by shares"285,1486339,"HONGKONG JIAXINYUAN TRADING LIMITED
香港嘉鑫源貿易有限公司",2010-07-29,2016-03-24,"Private, ltd by shares"286,1486669,"HongKong Jinli Trading Co., Limited
香港金利貿易有限公司",2010-07-29,2012-10-05,"Private, ltd by shares"287,1486869,"HONGKONG JUNXIANG TRADING CO., LIMITED
香港君翔貿易有限公司",2010-07-29,2020-07-03,"Private, ltd by shares"288,1486358,"HONGKONG KNN LED TECHNOLOGY CO., LIMITED
香港旭鋒偉業科技有限公司",2010-07-29,2017-04-21,"Private, ltd by shares"289,1486962,"HONGKONG KNOPP CORE BATTERY TECHNOLOGY CO., LIMITED
香港諾普芯電池科技有限公司",2010-07-29,,"Private, ltd by shares"290,1486603,"HONGKONG KYLIN TECHNOLOGY CO., LIMITED
香港宏祥科技有限公司",2010-07-29,2016-12-30,"Private, ltd by shares"291,1486378,"HONGKONG LEMO INDUSTRY LIMITED
香港樂美實業有限公司",2010-07-29,2017-04-21,"Private, ltd by shares"292,1486384,"HONGKONG LUODAN TEXTILE GROUP CO., LIMITED
香港羅丹紡織集團有限公司",2010-07-29,2015-07-10,"Private, ltd by shares"293,1486860,"HONGKONG MASTER IMPORT &amp; EXPORT CO., LIMITED
香港萬事德進出口有限公司",2010-07-29,2014-12-05,"Private, ltd by shares"294,1486884,"HONGKONG MINGLIU INTERNATIONAL COSMETIC CO., LIMITED
香港名流國際化妝品有限公司",2010-07-29,,"Private, ltd by shares"295,1486524,"HONGKONG PANY GROUP CO., LIMITED
香港派尼集團有限公司",2010-07-29,2013-01-18,"Private, ltd by shares"296,1486692,"HONGKONG RBT INDUSTRIAL CO., LIMITED
機器人實業(香港)有限公司",2010-07-29,2018-09-07,"Private, ltd by shares"297,1486943,"HONGKONG SCENERY BAMBOO INDUSTRY INVESTMENT CO., LIMITED
香港山水竹木業投資有限公司",2010-07-29,2014-12-05,"Private, ltd by shares"298,1486833,"HONGKONG SHENG LEI SHI JEWELRY LIMITED
香港聖雷詩飾品有限公司",2010-07-29,2017-10-06,"Private, ltd by shares"299,1486436,"HONGKONG SIMAO CO., LIMITED
香港四貿有限公司",2010-07-29,2014-12-05,"Private, ltd by shares"300,1486490,"HONGKONG SINOSUN INTERNATIONAL TRADING CO., LIMITED",2010-07-29,2014-12-05,"Private, ltd by shares"301,1486866,"HONGKONG TIANJI INVESTMENT CONSULTING LIMITED
香港天基投資顧問有限公司",2010-07-29,2014-12-05,"Private, ltd by shares"302,1486877,"HONGKONG TIANYI HOLDING GROUP CO., LIMITED
香港天一控股集團有限公司",2010-07-29,2015-07-10,"Private, ltd by shares"303,1486697,"HONGKONG TONSON INTERNATIONAL HOLDINGS LIMITED
香港東森泉國際控股有限公司",2010-07-29,2019-05-03,"Private, ltd by shares"304,1486853,"HONGKONG WORLD ASIA INVESTMENT HOLDING GROUP CO., LIMITED
香港世亞投資控股集團有限公司",2010-07-29,2015-07-10,"Private, ltd by shares"305,1486856,"HONGKONG XUNTUO TECHNOLOGY CO., LIMITED
香港訊拓科技有限公司",2010-07-29,2017-04-21,"Private, ltd by shares"306,1486388,"HONGKONG YANGYI GROUP LIMITED
香港洋逸集團有限公司",2010-07-29,,"Private, ltd by shares"307,1486483,"HONGKONG YONGSHENG RUBBER LIMITED
香港永盛橡膠有限公司",2010-07-29,2016-02-19,"Private, ltd by shares"308,1486465,"HONOURWAY (HK) INDUSTRIAL LIMITED
鴻威(香港)實業有限公司",2010-07-29,2014-12-05,"Private, ltd by shares"309,1486827,"Hopefull Property Consultants Limited
合富地產顧問有限公司",2010-07-29,,"Private, ltd by shares"310,1486910,"HUA JIN DA TECHNOLOGY CO., LIMITED
華金達科技有限公司",2010-07-29,2015-04-02,"Private, ltd by shares"311,1486521,"HUA YU HONG KONG DEVELOPMENT LIMITED
華譽香港發展有限公司",2010-07-29,,"Private, ltd by shares"312,1486822,"HUAXIA IMMIGRATION CONSULTING CO., LIMITED
華夏移民顧問有限公司",2010-07-29,,"Private, ltd by shares"313,1486349,"HUI FENG INTERNATIONAL SHIPPING COMPANY LIMITED
惠豐國際海運有限公司",2010-07-29,2018-04-06,"Private, ltd by shares"314,1486615,"HUNGDA INTERNATIONAL TRADING LIMITED
鴻達國際貿易有限公司",2010-07-29,2019-07-19,"Private, ltd by shares"315,1486581,"Huta Bancowa Limited",2010-07-29,2019-05-03,"Private, ltd by shares"316,1486744,"IDEAL WAFER TECHNOLOGY (HK) CO., LIMITED
志芯科技(香港)有限公司",2010-07-29,2012-01-27,"Private, ltd by shares"317,1486807,"iGen6 New Media Company Limited
越世代創新媒體有限公司",2010-07-29,,"Private, ltd by shares"318,1486558,"IMPEX SOLUTIONS LIMITED (d2015-07-10)
進出口解答有限公司",2010-07-29,2015-07-10,"Private, ltd by shares"319,1486654,"INFINITY TRADING GROUP LIMITED",2010-07-29,2015-07-10,"Private, ltd by shares"320,1486679,"INFO WHEEL LIMITED
訊滙有限公司",2010-07-29,,"Private, ltd by shares"321,1486306,"INMANUEL COMPANY LIMITED
葡萄樹有限公司",2010-07-29,,"Private, ltd by shares"322,1486632,"INNO EAST LIMITED
東新有限公司",2010-07-29,,"Private, ltd by shares"323,1486737,"Inspectorio Limited",2010-07-29,2019-02-22,"Private, ltd by shares"324,1486854,"INSTANT GAIN HOLDINGS LIMITED
迅福集團有限公司",2010-07-29,2016-06-10,"Private, ltd by shares"325,1486967,"INSTITUTE OF FINANCIAL ACCOUNTANTS SOCIAL ENTERPRISE (HONG KONG) LIMITED
英國註冊財務會計師公會社會企業(香港)有限公司",2010-07-29,2014-01-30,"Private, ltd by shares"326,1486724,"InterAsia Solutions Limited",2010-07-29,2014-12-05,"Private, ltd by shares"327,1486368,"Intergroup Corporation Limited",2010-07-29,,"Private, ltd by shares"328,1486681,"INTERNATIONAL HEALTH CARE GROUP LIMITED
國際醫薈集團有限公司",2010-07-29,,"Private, ltd by shares"329,1486535,"INTREND BULLION LIMITED
天策金業有限公司",2010-07-29,2014-01-24,"Private, ltd by shares"330,1486333,"ISHINE SOFTWARE CO., LIMITED
(香港)盈盛世紀軟件有限公司",2010-07-29,,"Private, ltd by shares"331,1486944,"ITALY JIA JUN INTERNATIONAL CO. LIMITED
意大利嘉駿國際有限公司",2010-07-29,2019-05-03,"Private, ltd by shares"332,1486773,"ITALY MEIJIATAO INTERNATIONAL CERAMIC TECHNOLOGY CO., LIMITED
意大利美家陶國際陶瓷科技有限公司",2010-07-29,2020-11-13,"Private, ltd by shares"333,1486444,"ITAMOMO ENTERPRISES LIMITED
意樂企業有限公司",2010-07-29,,"Private, ltd by shares"334,1486616,"J2 HONG KONG LIMITED",2010-07-29,,"Private, ltd by shares"335,1486886,"JACA JEWELRY LIMITED
傑卡珠寶有限公司",2010-07-29,,"Private, ltd by shares"336,1486331,"JANNET MILLER DYNASTY LIMITED
美亞皇朝有限公司",2010-07-29,,"Private, ltd by shares"337,1486815,"JAPAN TOSHIBA (HK) INTERNATIONAL INVESTMENT HOLDING LIMITED
日本東芝(香港)國際投資控股有限公司",2010-07-29,2013-08-30,"Private, ltd by shares"338,1486949,"JAPAN YUTIAN INDUSTRIAL (HONGKONG) CO., LIMITED
日本雨田實業(香港)有限公司",2010-07-29,2014-12-05,"Private, ltd by shares"339,1486751,"JASON MANAGEMENT CONSULTING CO., LIMITED
捷勝管理顧問有限公司",2010-07-29,2012-05-11,"Private, ltd by shares"340,1486320,"JEDI CAPITAL LIMITED (d2014-12-05)
絕對資本投資集團有限公司",2010-07-29,2014-12-05,"Private, ltd by shares"341,1486619,"JH COMPANY LIMITED",2010-07-29,2018-04-06,"Private, ltd by shares"342,1486522,"JIA HONG TECHNOLOGY CO., LIMITED (d2013-12-20)
嘉鴻科技有限公司",2010-07-29,2013-12-20,"Private, ltd by shares"343,1486409,"JIAMEI ANJU INT'L BUILDING MATERIALS HOME GROUP LIMITED
嘉美安居國際建材家居集團有限公司",2010-07-29,2018-04-06,"Private, ltd by shares"344,1486870,"JIAYU LEATHER INTERNATIONAL TRADING CO., LIMITED
佳鈺皮具國際貿易有限公司",2010-07-29,2015-07-10,"Private, ltd by shares"345,1486927,"JILIN PROVINCE CHINA BIO ENERGY LIMITED
吉林省神州生物能源有限公司",2010-07-29,,"Private, ltd by shares"346,1486888,"JIN FENG DA INTERNATIONAL TRADING CO., LIMITED
金豐達國際貿易有限公司",2010-07-29,,"Private, ltd by shares"347,1486523,"JIN FENG INVESTMENT DEVELOPMENT CO., LIMITED
錦豐投資發展有限公司",2010-07-29,2016-03-24,"Private, ltd by shares"348,1486638,"Jinjun Electronic Technology Co., Limited",2010-07-29,2014-12-05,"Private, ltd by shares"349,1486648,"JINSHUIHE INVESTMENT LIMITED
金水河投資有限公司",2010-07-29,,"Private, ltd by shares"350,1486664,"JOB GALLERY CONSULTANCY LIMITED",2010-07-29,,"Private, ltd by shares"351,1486634,"JOLLY ELITE LIMITED
嘉鏗有限公司",2010-07-29,2014-12-24,"Private, ltd by shares"352,1486683,"JOLLY SKY LIMITED
天欣行有限公司",2010-07-29,,"Private, ltd by shares"353,1486530,"JOY STEP MANAGEMENT LIMITED
嘉順管理有限公司",2010-07-29,,"Private, ltd by shares"354,1486850,"KAICHENG INTERNATIONAL ENTERPRISE CO., LIMITED
凱誠國際企業有限公司",2010-07-29,,"Private, ltd by shares"355,1486656,"KBR HONG KONG LIMITED
奇寶香港有限公司",2010-07-29,2013-09-06,"Private, ltd by shares"356,1486583,"KCHAIN ENTERPRISES LIMITED
錦程工貿有限公司",2010-07-29,,"Private, ltd by shares"357,1486441,"KEN-E ASIA (HK) CO. LIMITED
權威亞洲(香港)有限公司",2010-07-29,2013-04-05,"Private, ltd by shares"358,1486716,"KETEE INTERNATIONAL LIMITED
祈易國際有限公司",2010-07-29,,"Private, ltd by shares"359,1486540,"KEY MIND MANAGEMENT LIMITED
啓思管理有限公司",2010-07-29,2019-02-08,"Private, ltd by shares"360,1486468,"KEY ON BUILDING MATERIALS LIMITED
建安琪建材有限公司",2010-07-29,,"Private, ltd by shares"361,1486795,"KIDSKIDS INTERNATIONAL LIMITED
親貝(香港)有限公司",2010-07-29,2019-12-27,"Private, ltd by shares"362,1486547,"KING GLORY HOLDINGS LIMITED
帝輝集團有限公司",2010-07-29,,"Private, ltd by shares"363,1486442,"KING TALENT LIMITED
皇傑有限公司",2010-07-29,,"Private, ltd by shares"364,1486682,"KINGCAMP OUTDOOR PRODUCTS COMPANY (H.K) LIMITED
皇家營地戶外用品有限公司",2010-07-29,,"Private, ltd by shares"365,1486941,"KINGDINGFENG GROUP CO., LIMITED
金鼎豐集團有限公司",2010-07-29,,"Private, ltd by shares"366,1486942,"Kingkok Technology Company Limited
京科科技有限公司",2010-07-29,,"Private, ltd by shares"367,1486455,"KKS HOLDING LIMITED",2010-07-29,,"Private, ltd by shares"368,1486658,"KMC TRADING COMPANY LIMITED",2010-07-29,,"Private, ltd by shares"369,1486464,"KONG KEE ENGINEERING LIMITED
江記工程有限公司",2010-07-29,,"Private, ltd by shares"370,1486711,"KOREA SAN XING WANG ELECTRONICS GROUP LIMITED
韓國三星王電子集團有限公司",2010-07-29,2020-05-22,"Private, ltd by shares"371,1486458,"KUI TUNG (HK) SHIPPING LIMITED
鉅通(香港)船務有限公司",2010-07-29,2017-04-21,"Private, ltd by shares"372,1486550,"KUVIZ CO., LIMITED
酷唯思有限公司",2010-07-29,,"Private, ltd by shares"373,1486518,"LAI NUO INDUSTRY LIMITED
萊諾實業有限公司",2010-07-29,,"Private, ltd by shares"374,1486509,"LANTAU INTERNATIONAL LEARNING CENTRE LIMITED",2010-07-29,,"Private, ltd by shares"375,1486913,"LAS AMERICAS TRADING COMPANY LIMITED
美洲商貿有限公司",2010-07-29,2015-02-18,"Private, ltd by shares"376,1486653,"LE PRINTEMPS CLUB COMPANY LIMITED
春天會有限公司",2010-07-29,2015-07-10,"Private, ltd by shares"377,1486485,"Le Rivoli Limited",2010-07-29,2016-03-24,"Private, ltd by shares"378,1486299,"Leader Hom Yu Centre Co. Limited
玄滙堪輿研究中心有限公司",2010-07-29,,"Private, ltd by shares"379,1486685,"LEADER JOY LIMITED (d2020-05-08)
領欣有限公司",2010-07-29,2020-05-08,"Private, ltd by shares"380,1486389,"LED ON (INT.) LIMITED
萊依迪安和有限公司",2010-07-29,2013-03-15,"Private, ltd by shares"381,1486584,"LEDVOL OPTOELECTRONICS CO., LIMITED
聯方光電有限公司",2010-07-29,2019-07-05,"Private, ltd by shares"382,1486646,"LEGEND GLOBAL HOLDINGS LIMITED
勵進國際控股有限公司",2010-07-29,,"Private, ltd by shares"383,1486635,"LINK FAI LIMITED
領輝行有限公司",2010-07-29,,"Private, ltd by shares"384,1486741,"LOGIC FACTORY INTERNATIONAL PUBLISHING LIMITED",2010-07-29,2016-03-24,"Private, ltd by shares"385,1486738,"LUEN SING ELECTRONIC TOYS INDUSTRIAL (HK) COMPANY LIMITED
香港聯昇電子玩具實業有限公司",2010-07-29,,"Private, ltd by shares"386,1486633,"M BY M LIMITED",2010-07-29,2015-03-20,"Private, ltd by shares"387,1486360,"MAK'S GROUP (H.K.) LIMITED
麥氏集團(香港)有限公司",2010-07-29,,"Private, ltd by shares"388,1486437,"MAKARX INDUSTRIAL CO., LIMITED
麥卡科斯實業有限公司",2010-07-29,,"Private, ltd by shares"389,1486896,"Malone &amp; Vivian Parterners Co., Limited",2010-07-29,2015-07-10,"Private, ltd by shares"390,1486689,"MANY SOURCE LIMITED
萬利源有限公司",2010-07-29,2018-12-21,"Private, ltd by shares"391,1486340,"MARKETING VILLAS LIMITED",2010-07-29,,"Private, ltd by shares"392,1486832,"MARUTO TSUSHO CO., LIMITED
丸都通商株式會社有限公司",2010-07-29,,"Private, ltd by shares"393,1486425,"Maruuchi Corporation HongKong Limited
丸內商事(香港)有限公司",2010-07-29,2019-05-03,"Private, ltd by shares"394,1486539,"MARVEL PACKAGING CO., LIMITED
香港奇跡包裝製品有限公司",2010-07-29,2015-07-10,"Private, ltd by shares"395,1486525,"MASSON INTERNATIONAL BUSINESS CO., LIMITED
美晨國際商務有限公司",2010-07-29,2017-04-21,"Private, ltd by shares"396,1486639,"MASTER PRIDE LIMITED
萬傲有限公司",2010-07-29,,"Private, ltd by shares"397,1486694,"MAX SUCCESS CORPORATION LIMITED
滿成行有限公司",2010-07-29,2018-04-06,"Private, ltd by shares"398,1486398,"MEGA SHELL LIMITED
愛顯有限公司",2010-07-29,,"Private, ltd by shares"399,1486958,"MeGo Technology Limited (HK)
美果科技有限公司",2010-07-29,,"Private, ltd by shares"400,1486528,"MENG ZHI DUI CO., LIMITED
夢之隊有限公司",2010-07-29,2018-03-02,"Private, ltd by shares"401,1486461,"MERCURY INTERNATIONAL FINANCE AND INVESTMENTS GROUP LIMITED
中國國際金融投資股份有限公司",2010-07-29,2014-12-05,"Private, ltd by shares"402,1486641,"MERIT ELITE LIMITED
優豪有限公司",2010-07-29,,"Private, ltd by shares"403,1486959,"MEYOO HOUSEWARES INDUSTRY CO., LIMITED
明益家居實業有限公司",2010-07-29,2014-12-05,"Private, ltd by shares"404,1486767,"MGR Senior Care Management China Limited",2010-07-29,,"Private, ltd by shares"405,1486813,"MIC CONSULTING LIMITED (d2013-04-12)
華策諮詢有限公司",2010-07-29,2013-04-12,"Private, ltd by shares"406,1486533,"MILAN, RONNIE INTERNATIONAL ADORNMENT GROUP CO., LIMITED
米蘭，博羅尼國際裝飾集團有限公司",2010-07-29,2014-12-05,"Private, ltd by shares"407,1486395,"Milora Limited",2010-07-29,,"Private, ltd by shares"408,1486472,"MK ELECTRON CO., LIMITED
銘起電子有限公司",2010-07-29,2014-12-05,"Private, ltd by shares"409,1486723,"MOONFALL ENTERPRISE CO., LIMITED
登月企業有限公司",2010-07-29,2017-04-21,"Private, ltd by shares"410,1486548,"MORAL BRIGHT CONSULTANTS LIMITED
德耀顧問有限公司",2010-07-29,,"Private, ltd by shares"411,1486361,"MORAL WISDOM LIMITED (d2015-08-07)
德智有限公司",2010-07-29,2015-08-07,"Private, ltd by shares"412,1486407,"Morning Sun International (China) Limited
晨陽國際(中國)有限公司",2010-07-29,2016-12-02,"Private, ltd by shares"413,1486513,"MTG INTERNATIONAL GROUP (HONG KONG) COMPANY LIMITED
寓意真禮國際集團(香港)有限公司",2010-07-29,2015-07-10,"Private, ltd by shares"414,1486677,"MY AVIATION CO., LIMITED",2010-07-29,2012-01-13,"Private, ltd by shares"415,1486466,"NATIONS TRADING (HONG KONG) LIMITED",2010-07-29,2013-06-07,"Private, ltd by shares"416,1486802,"NEASTCO TECHNOLOGY CO., LIMITED
思酷科技有限公司",2010-07-29,2019-12-27,"Private, ltd by shares"417,1486659,"Neuvomedica Limited",2010-07-29,,"Private, ltd by shares"418,1486556,"NEW ABLE TECHNOLOGY LIMITED
俊新科技有限公司",2010-07-29,,"Private, ltd by shares"419,1486496,"NEW FANCY HOLDINGS LIMITED
新穎集團有限公司",2010-07-29,,"Private, ltd by shares"420,1486851,"NEW MONARCH LIMITED
新帝國際有限公司",2010-07-29,2015-07-10,"Private, ltd by shares"421,1486552,"NEW SUNSHINE EXPORTS CO., LIMITED",2010-07-29,,"Private, ltd by shares"422,1486443,"NEW TRADE CORPORATION LIMITED
新貿有限公司",2010-07-29,2014-06-13,"Private, ltd by shares"423,1486728,"NEXEL OPTO LIMITED
歷索有限公司",2010-07-29,2011-09-02,"Private, ltd by shares"424,1486300,"NEXXO CHINA CO., LIMITED",2010-07-29,2020-10-23,"Private, ltd by shares"425,1486381,"NIMRABY INTERNATIONAL TRADING CO., LIMITED
尼米樂貝國際貿易有限公司",2010-07-29,2014-12-05,"Private, ltd by shares"426,1486710,"NINGBO DONGMI MACHINE PARTS CO., LIMITED
寧波市東密機械配件有限公司",2010-07-29,,"Private, ltd by shares"427,1486663,"NINGBO EFFORTS AUTOPARTS IMP. &amp; EXP. CO., LIMITED
寧波市艾菲斯汽車配件進出口有限公司",2010-07-29,,"Private, ltd by shares"428,1486820,"NINGBO GREENGUIDE CO., LIMITED
寧波格瑞日用品有限公司",2010-07-29,2016-11-11,"Private, ltd by shares"429,1486582,"NIRVANA COSMETIC CO. LIMITED",2010-07-29,,"Private, ltd by shares"430,1486825,"OFFSIDE GRAPHIC DESIGN(HK) LIMITED
越位圖形設計(香港)有限公司",2010-07-29,,"Private, ltd by shares"431,1486326,"OMA Holdings Limited",2010-07-29,,"Private, ltd by shares"432,1486561,"ON FAITH TRANSPORTATION LIMITED
安信運輸有限公司",2010-07-29,2019-07-19,"Private, ltd by shares"433,1486791,"ONE:PLATFORM GROUP LIMITED",2010-07-29,2014-12-05,"Private, ltd by shares"434,1486631,"ORIENTAL TIME WATCH DESIGN CO., LIMITED
奧侖特鈡表設計有限公司",2010-07-29,2017-06-30,"Private, ltd by shares"435,1486347,"OSTIMPEX LIMITED",2010-07-29,2015-07-10,"Private, ltd by shares"436,1486327,"P S Sourcing Limited",2010-07-29,2013-03-01,"Private, ltd by shares"437,1486453,"P&amp;J INDUSTRIAL COMPANY LIMITED
耀利實業有限公司",2010-07-29,,"Private, ltd by shares"