,Reg no.,Name,Incorp-orated,Dissolved,Type659,1486499,"YAU FAT CONSTRUCTION COMPANY LIMITED
友發建築有限公司",2010-07-29,,"Private, ltd by shares"660,1486394,"YINGHONG (HONG KONG) TECHNOLOGY CO., LIMITED
香港映宏科技有限公司",2010-07-29,2012-02-10,"Private, ltd by shares"661,1486335,"YINTAI LAND (GROUP) LIMITED
銀泰置地(集團)有限公司",2010-07-29,,"Private, ltd by shares"662,1486779,"YISI TECHNOLOGY LIMITED
毅思科技(香港)有限公司",2010-07-29,2012-01-20,"Private, ltd by shares"663,1486621,"YIWU ASIA TEXTILE CO., LIMITED
義烏市亞太紡織品有限公司",2010-07-29,2016-03-24,"Private, ltd by shares"664,1486379,"YIXIANG INDUSTRY INVESTMENT GROUP (CHINA) LIMITED
怡祥實業投資集團(中國)有限公司",2010-07-29,2015-07-10,"Private, ltd by shares"665,1486757,"YONGQI (HK) INDUSTRIES CO., LIMITED
永奇(香港)實業有限公司",2010-07-29,,"Private, ltd by shares"666,1486359,"YONGSHENG C&amp;H LIMITED
永勝禮品有限公司",2010-07-29,2015-07-10,"Private, ltd by shares"667,1486764,"Youway Premiums And Gifts Co., Limited
優唯禮品有限公司",2010-07-29,,"Private, ltd by shares"668,1486698,"YS Sound Balancing Workshop Limited
聲音平衡工作室有限公司",2010-07-29,,"Private, ltd by shares"669,1486372,"YU SHING INTERNATIONAL LIMITED
蕊誠國際有限公司",2010-07-29,,"Private, ltd by shares"670,1486560,"YUAN DA ENTERPRISE (HK) YUAN YI REN LIMITED
苑大企業(香港)苑衣人有限公司",2010-07-29,2019-03-29,"Private, ltd by shares"671,1486572,"YUANTONG ELECTRONICS TECH LIMITED
元通電子科技有限公司",2010-07-29,2015-07-10,"Private, ltd by shares"672,1486647,"YUCHENHUIBO TECHNOLOGY CO., LIMITED
深圳市禹臣慧博科技有限公司",2010-07-29,2019-11-01,"Private, ltd by shares"673,1486467,"YUCHUAN GROUP CO., LIMITED
裕川集團有限公司",2010-07-29,2017-11-17,"Private, ltd by shares"674,1486726,"YUEN HING LIMITED
原興有限公司",2010-07-29,2018-04-06,"Private, ltd by shares"675,1486412,"Yuen Kai Shun Chinese Medical Clinic Limited
袁啟順中醫診所有限公司",2010-07-29,,"Private, ltd by shares"676,1486578,"YUPHENG (HK) GROUP HOLDING LIMITED
香港譽豐集團控股有限公司",2010-07-29,,"Private, ltd by shares"677,1486498,"YXH TECHNOLOGY (HONGKONG) CO., LIMITED
宇昕航科技(香港)有限公司",2010-07-29,2014-12-05,"Private, ltd by shares"678,1486474,"ZANSON INDUSTRIAL LIMITED
三盛實業有限公司",2010-07-29,,"Private, ltd by shares"679,1486793,"ZHEJIANG GREATHAO INDUSTRY &amp; TRADE CO., LIMITED
浙江非常好工貿有限公司",2010-07-29,2012-12-07,"Private, ltd by shares"680,1486362,"ZHEJIANG HINAWAY TECH. LIMITED
浙江海納衛科技有限公司",2010-07-29,2019-12-27,"Private, ltd by shares"681,1486841,"ZHEJIANG OCEAN LOCK MANUFACTURE CO., LIMITED
浙江歐迅鎖業有限公司",2010-07-29,,"Private, ltd by shares"682,1486479,"ZHONG HENG INVESTMENT MANAGEMENT CO., LIMITED
中恒投資管理有限公司",2010-07-29,2013-02-15,"Private, ltd by shares"683,1486708,"ZHONGNAN CONSTRUCTION GROUP HOLDINGS CO., LIMITED
中南建設集團股份有限公司",2010-07-29,,"Private, ltd by shares"684,1486532,"ZHONGXINNUO SHARE CO., LIMITED
中信諾股份有限公司",2010-07-29,2019-04-26,"Private, ltd by shares"685,1486808,"ZUANSHI CONDUIT GROUP (HONGKONG) LIMITED
鑽石管業集團(香港)有限公司",2010-07-29,2017-04-21,"Private, ltd by shares"686,1486874,"ZYD ENERGY MINERAL GROUP HOLDINGS LIMITED
兆億達能源礦產集團控股有限公司",2010-07-29,,"Private, ltd by shares"