,Reg no.,Name,Incorp-orated,Dissolved,Type438,1486868,"Page Consultants Limited (d2014-12-05)",2010-07-29,2014-12-05,"Private, ltd by shares"439,1486859,"Page Studio Limited (d2014-12-05)",2010-07-29,2014-12-05,"Private, ltd by shares"440,1486902,"Panna Capital Limited",2010-07-29,2015-02-18,"Private, ltd by shares"441,1486411,"PAUL COWLING LIMITED",2010-07-29,2019-03-29,"Private, ltd by shares"442,1486487,"PAUL NIEHANS INTERNATIONAL (HK) LIMITED
瑞士博妮漢斯國際(香港)有限公司",2010-07-29,2014-03-07,"Private, ltd by shares"443,1486758,"Peak Scientific Instruments Hong Kong Limited",2010-07-29,,"Private, ltd by shares"444,1486772,"PENGCHENG ELECTRONIC (HK) CO., LIMITED
鵬成(香港)電子有限公司",2010-07-29,2015-07-10,"Private, ltd by shares"445,1486903,"PERFECT OASIS LIMITED (d2012-10-26)
巧施有限公司",2010-07-29,2012-10-26,"Private, ltd by shares"446,1486406,"Perfect Partner Limited (HK)",2010-07-29,,"Private, ltd by shares"447,1486861,"PERFECT TUNE INVESTMENTS LIMITED
綽韻投資有限公司",2010-07-29,,"Private, ltd by shares"448,1486848,"PERITO ENGINEERING LIMITED
柏力圖工程有限公司",2010-07-29,,"Private, ltd by shares"449,1486961,"Pine View Investment &amp; Consulting Limited
松景投資管理咨詢有限公司",2010-07-29,2012-11-16,"Private, ltd by shares"450,1486746,"PLAMD INDUSTRIAL HOLDING CO., LIMITED
帕蘭德工業股份有限公司",2010-07-29,,"Private, ltd by shares"451,1486376,"POLY IMMIGRATION LIMITED
保利投資移民有限公司",2010-07-29,2015-06-12,"Private, ltd by shares"452,1486502,"POWER EXPRESS TECHNOLOGY LIMITED
威通科技有限公司",2010-07-29,2017-03-03,"Private, ltd by shares"453,1486364,"POWER WISH LIMITED (d2014-05-02)
威望有限公司",2010-07-29,2014-05-02,"Private, ltd by shares"454,1486386,"POWERTECH SPORT COMPANY LIMITED",2010-07-29,2014-05-02,"Private, ltd by shares"455,1486567,"POWERWAY INTERNATIONAL INVESTMENT LIMITED
福威國際投資有限公司",2010-07-29,,"Private, ltd by shares"456,1486687,"Prestige Glory Investment Co., Limited",2010-07-29,2017-10-20,"Private, ltd by shares"457,1486695,"PROFIT LINK (H.K.) COMPANY LIMITED
利年(香港)有限公司",2010-07-29,2015-10-09,"Private, ltd by shares"458,1486445,"PROFIT TREASURE LIMITED (d2019-04-04)
寶澤有限公司",2010-07-29,2019-04-04,"Private, ltd by shares"459,1486922,"PRORAND INTERNATIONAL LIMITED
普瑞國際有限公司",2010-07-29,2019-06-06,"Private, ltd by shares"460,1486482,"PROSPEROUS CENTURY ASIA HOME BUYERS CO., LIMITED
盛世亞洲置業有限公司",2010-07-29,2018-03-02,"Private, ltd by shares"461,1486950,"PROSPEROUS TOWER LIMITED",2010-07-29,,"Private, ltd by shares"462,1486627,"QH Customer Relationship Management Limited
齊豪會員服務有限公司",2010-07-29,2018-03-02,"Private, ltd by shares"463,1486668,"QIANHUI TECHNOLOGY LIMITED (d2012-11-09)
乾輝科技有限公司",2010-07-29,2012-11-09,"Private, ltd by shares"464,1486617,"QINGDAO LIXINGDE IMPORT&amp;EXPORT CO., LIMITED
青島立興得進出口有限公司",2010-07-29,,"Private, ltd by shares"465,1486338,"Qualitethik Limited",2010-07-29,2014-12-05,"Private, ltd by shares"466,1486964,"QUALITY LIFE INTERNATIONAL EDUCATION GROUP CO., LIMITED
優質人生國際教育集團有限公司",2010-07-29,2018-01-05,"Private, ltd by shares"467,1486573,"RAINBOW (HK) INDUSTRIAL LIMITED
彩俊(香港)實業有限公司",2010-07-29,2016-03-24,"Private, ltd by shares"468,1486786,"RALD CAPITAL (CHINA) LIMITED
蘭德資本(中國)有限公司",2010-07-29,2017-04-21,"Private, ltd by shares"469,1486891,"RAYONTEX (HK) LIMITED",2010-07-29,2013-03-22,"Private, ltd by shares"470,1486752,"REAL RICH INTERNATIONAL LIMITED
裕富國際有限公司",2010-07-29,2019-05-03,"Private, ltd by shares"471,1486643,"REALINK CITY LIMITED
滙利成有限公司",2010-07-29,2011-02-18,"Private, ltd by shares"472,1486666,"REALLY ELECTRONICS (HK) LIMITED
睿利電子(香港)有限公司",2010-07-29,,"Private, ltd by shares"473,1486546,"REDRA BUSINESS CO., LIMITED",2010-07-29,2017-04-21,"Private, ltd by shares"474,1486810,"Refined Collection Group (Hong Kong) Company Limited
雅品滙集團(香港)有限公司",2010-07-29,,"Private, ltd by shares"475,1486906,"Related Investment II Limited",2010-07-29,2016-06-03,"Private, ltd by shares"476,1486517,"RICH CHAMP HOLDINGS LIMITED
富凱集團有限公司",2010-07-29,,"Private, ltd by shares"477,1486511,"RICH CONCEPT ASIA INVESTMENT LIMITED
創發亞太投資有限公司",2010-07-29,,"Private, ltd by shares"478,1486898,"RICH KONG TECHNOLOGY ELECTRONIC (HK) LIMITED
香港富港科技電子有限公司",2010-07-29,2014-12-05,"Private, ltd by shares"479,1486586,"RICH SMART INTERNATIONAL INVESTMENT LIMITED
俊發國際投資有限公司",2010-07-29,2019-10-04,"Private, ltd by shares"480,1486703,"RICH STATE INTERNATIONAL GROUP LIMITED
裕國國際有限公司",2010-07-29,2012-12-21,"Private, ltd by shares"481,1486893,"RIDGE CAPITAL LIMITED (d2012-11-09)",2010-07-29,2012-11-09,"Private, ltd by shares"482,1486672,"RONGE INVESTMENT LIMITED
融濟投資有限公司",2010-07-29,2014-12-05,"Private, ltd by shares"483,1486529,"RUN JIN ASIA LIMITED
潤金亞洲有限公司",2010-07-29,2014-12-05,"Private, ltd by shares"484,1486624,"Sailking International Co., Limited
賽爾嘉國際有限公司",2010-07-29,,"Private, ltd by shares"485,1486976,"Sanxintong International Trade Co., Limited
三信通國際貿易有限公司",2010-07-29,2014-12-05,"Private, ltd by shares"486,1486344,"SAWAL COMPANY LIMITED",2010-07-29,2017-04-21,"Private, ltd by shares"487,1486640,"SEAZON (HK) TEXTILES CO., LIMITED
致興(香港)紡織服裝有限公司",2010-07-29,,"Private, ltd by shares"488,1486954,"SecondMarket Asia Limited",2010-07-29,2013-08-23,"Private, ltd by shares"489,1486399,"Seengoo China Limited
森穀中國有限公司",2010-07-29,2014-12-24,"Private, ltd by shares"490,1486946,"SEIWA OPUTO (H.K.) CO., LIMITED
誠和光學(香港)有限公司",2010-07-29,2020-04-24,"Private, ltd by shares"491,1486366,"SENROC BUILDING TECHNOLOGY LIMITED
承諾建築科技有限公司",2010-07-29,2013-12-06,"Private, ltd by shares"492,1486422,"SHAMITE SANITARY WARE (GERMANY) INT'L LIMITED
莎米特衛浴(德國)國際有限公司",2010-07-29,2014-12-05,"Private, ltd by shares"493,1486598,"SHAN HUAN (H.K.) COMPANY LIMITED
山環(香港)有限公司",2010-07-29,2011-12-02,"Private, ltd by shares"494,1486830,"SHANDONG HELI CERAMICS TECHNOLOGY CO., LIMITED (d2016-12-16)
山東和立陶瓷科技有限公司",2010-07-29,2016-12-16,"Private, ltd by shares"495,1486883,"SHANGHAI JIXIANG BUILDING DECORATIVE MATERIALS CO., LIMITED
上海吉祥建築裝飾材料有限公司",2010-07-29,2016-03-24,"Private, ltd by shares"496,1486691,"SHANGHAI JUNLIN DEVELOPMENT LIMITED
上海君臨發展有限公司",2010-07-29,2012-06-01,"Private, ltd by shares"497,1486527,"SHANGHAI KANGHAIYILONG TEXTILES LIMITED
上海康海一龍紡織品有限公司",2010-07-29,,"Private, ltd by shares"498,1486804,"SHANGHAI NEW FORTUNE RESOURCE CO., LIMITED
上海新富源有限公司",2010-07-29,2017-04-21,"Private, ltd by shares"499,1486839,"SHANGHAI WISDOM INDUSTRY LIMITED
上海威斯德實業有限公司",2010-07-29,2014-12-05,"Private, ltd by shares"500,1486837,"SHANGHAI XINXING MEDICINE TECHNOLOGY LIMITED
上海鑫星醫藥科技有限公司",2010-07-29,2018-04-20,"Private, ltd by shares"501,1486770,"SHANGHIA ZUOFEINA TEXTILES LIMITED
上海佐菲娜紡織品有限公司",2010-07-29,2017-04-21,"Private, ltd by shares"502,1486374,"SHANGTANG (HK) INT'L HOME GROUP LIMITED
尚堂(香港)國際家居集團有限公司",2010-07-29,2014-12-05,"Private, ltd by shares"503,1486684,"SHANSHAN PHARMACEUTICALS CO., LIMITED
山山藥業有限公司",2010-07-29,2016-03-24,"Private, ltd by shares"504,1486763,"SHANXI PRUNUS SPRING WINE INDUSTRY LIMITED
山西杏花春酒業有限公司",2010-07-29,2014-12-05,"Private, ltd by shares"505,1486512,"SHARP CREATION HOLDINGS LIMITED
銳創集團有限公司",2010-07-29,,"Private, ltd by shares"506,1486714,"SHEK SHAN INVESTMENT COMPANY LIMITED
錫山投資有限公司",2010-07-29,2020-04-24,"Private, ltd by shares"507,1486977,"SHENZHEN BOMIC ELECTRONIC TECHNOLOGY CO., LIMITED
深圳市搏脈電子科技有限公司",2010-07-29,,"Private, ltd by shares"508,1486351,"SHENZHEN EVERBRIGHT OPTOELECTRONICS CO., LIMITED
深圳市永明光電有限公司",2010-07-29,,"Private, ltd by shares"509,1486965,"ShenZhen Royalstar Electronics Limited",2010-07-29,2017-11-24,"Private, ltd by shares"510,1486908,"SHENZHEN SKYSTONE TECHNOLOGY CO., LIMITED
深圳補天石科技有限公司",2010-07-29,,"Private, ltd by shares"511,1486972,"SHENZHEN WANYING ELECTRONICS LIMITED
深圳萬贏電子科技有限公司",2010-07-29,2016-10-07,"Private, ltd by shares"512,1486878,"SHENZHEN YINGYU TECHNOLOGY LIMITED
深圳市盈宇科技有限公司",2010-07-29,2013-09-06,"Private, ltd by shares"513,1486760,"SHENZHEN YUANFANG FURNITURE LIMITED
深圳圓方家具有限公司",2010-07-29,2014-12-05,"Private, ltd by shares"514,1486367,"SHINE LUCKY LIMITED
光福有限公司",2010-07-29,,"Private, ltd by shares"515,1486796,"Shining Star (HongKong) Technology Limited
星漢香港科技有限公司",2010-07-29,2018-06-22,"Private, ltd by shares"516,1486382,"SHINY. CO., LIMITED
盛安貿易企業有限公司",2010-07-29,2019-10-04,"Private, ltd by shares"517,1486699,"SHUN SHING LOGISTIC ENGINEERING LIMITED
迅誠物流工程有限公司",2010-07-29,,"Private, ltd by shares"518,1486907,"SHUNDA HARDWARE INTERNATIONAL CO., LIMITED
順達五金國際有限公司",2010-07-29,2016-03-24,"Private, ltd by shares"519,1486828,"SHUOYUAN INTERNATIONAL CO., LIMITED
碩垣國際實業有限公司",2010-07-29,2015-02-18,"Private, ltd by shares"520,1486769,"SICHUAN LUZHOU OLD WINESHOP WINE INDUSTRY LIMITED
四川瀘州老酒坊酒業有限公司",2010-07-29,2014-12-05,"Private, ltd by shares"521,1486557,"Silk Road Associates Limited (HK)",2010-07-29,,"Private, ltd by shares"522,1486551,"SILVERWAY INTERNATIONAL INDUSTRIAL LIMITED
銀億國際實業有限公司",2010-07-29,,"Private, ltd by shares"523,1486842,"Simple International Limited
簡單國際有限公司",2010-07-29,2019-12-27,"Private, ltd by shares"524,1486543,"SIN KING SHIPPING AGENCIES COMPANY LIMITED
善景船務代理有限公司",2010-07-29,,"Private, ltd by shares"525,1486829,"Sino Any-Tech Co., Limited
賽納艾科有限公司",2010-07-29,2018-09-21,"Private, ltd by shares"526,1486952,"SINO GOGING GROUP LIMITED
中華國晶集團有限公司",2010-07-29,2015-07-10,"Private, ltd by shares"527,1486492,"SIYUAN (HONGKONG) INTERNATIONAL TRADE LIMITED
香港思遠國際貿易有限公司",2010-07-29,2014-12-05,"Private, ltd by shares"528,1486797,"SKY LUCKY INTERNATIONAL TRADING LIMITED
天琪國際貿易有限公司",2010-07-29,,"Private, ltd by shares"529,1486544,"SKYTOP CONSTRUCTION ENGINEERING LIMITED
領天建築工程有限公司",2010-07-29,,"Private, ltd by shares"530,1486901,"SMART EFFORT INVESTMENTS LIMITED
雙盛投資有限公司",2010-07-29,,"Private, ltd by shares"531,1486314,"SNOWDROP JEWELS (HK) PVT. LIMITED",2010-07-29,2014-04-11,"Private, ltd by shares"532,1486748,"SNOWFOREST INTERNATIONAL (H.K.) CO., LIMITED
雪林國際(香港)有限公司",2010-07-29,,"Private, ltd by shares"533,1486355,"SNS LIMITED (HK)",2010-07-29,,"Private, ltd by shares"534,1486956,"SOLANAS LIMITED",2010-07-29,,"Private, ltd by shares"535,1486336,"SOURCES FOR EXPORT AND IMPORT TRADING COMPANY LIMITED",2010-07-29,,"Private, ltd by shares"536,1486765,"SOWZE Security (China) Company Limited
守望者安防(中國)有限公司",2010-07-29,,"Private, ltd by shares"537,1486576,"SPECIAL SOUND AUDIO EQUIPMENT CO., LIMITED
遠勝音響器材有限公司",2010-07-29,2019-03-29,"Private, ltd by shares"538,1486559,"SPEED WAY SHIPPING LIMITED
迅成船務有限公司",2010-07-29,,"Private, ltd by shares"539,1486587,"SPREAD ELECTRONICS TECHNOLOGY LIMITED
創弘電子科技有限公司",2010-07-29,2014-12-05,"Private, ltd by shares"540,1486702,"STANDYEAR LIMITED
立年有限公司",2010-07-29,,"Private, ltd by shares"541,1486889,"STAR AV LIMITED
星滙影音國際有限公司",2010-07-29,,"Private, ltd by shares"542,1486447,"STRONG GRAND LIMITED
堅偉有限公司",2010-07-29,2019-02-15,"Private, ltd by shares"543,1486864,"STRONGOPTO GROUP (HK) CO., LIMITED
世創集團(香港)有限公司",2010-07-29,2015-10-16,"Private, ltd by shares"544,1486809,"SUCCESS HEALTH INTERNATIONAL TRADING LIMITED
成康國際貿易有限公司",2010-07-29,,"Private, ltd by shares"545,1486589,"SUCCESS TREND HOLDINGS LIMITED
安成集團有限公司",2010-07-29,,"Private, ltd by shares"546,1486588,"SUN GRACE HOLDINGS LIMITED
嘉熙集團有限公司",2010-07-29,,"Private, ltd by shares"547,1486590,"SUN KING INTERNATIONAL INVESTMENT LIMITED
帝輝國際投資有限公司",2010-07-29,2016-12-16,"Private, ltd by shares"548,1486844,"SUN SHING FUNERAL LIMITED
生誠有限公司",2010-07-29,2013-08-16,"Private, ltd by shares"549,1486651,"SUNLIGHT CORPORATION LIMITED (d2012-12-28)
滿熙有限公司",2010-07-29,2012-12-28,"Private, ltd by shares"550,1486592,"SUNNY CONCEPT TECHNOLOGY LIMITED
明創科技有限公司",2010-07-29,2015-12-31,"Private, ltd by shares"551,1486591,"SUNNY WEALTH HOLDINGS LIMITED
康耀集團有限公司",2010-07-29,2019-01-11,"Private, ltd by shares"552,1486890,"SUNRIDGE LIMITED (d2012-11-09)
尚恒發展有限公司",2010-07-29,2012-11-09,"Private, ltd by shares"553,1486308,"SUNRISE NETWORK &amp; ENGINEERING COMPANY LIMITED
旭日網絡工程有限公司",2010-07-29,,"Private, ltd by shares"554,1486821,"SUNRISE TOOLS COMPANY LIMITED",2010-07-29,2018-05-18,"Private, ltd by shares"555,1486317,"SUNSHOW INDUSTRIAL CO., LIMITED
尚翔實業有限公司",2010-07-29,2019-09-27,"Private, ltd by shares"556,1486595,"SUNWAY ASIA INVESTMENT LIMITED
朗威亞太投資有限公司",2010-07-29,2015-07-10,"Private, ltd by shares"557,1486608,"SUNWAY INTERNATIONAL TRADING (HK) CO., LIMITED
雙威國際貿易(香港)有限公司",2010-07-29,2016-03-24,"Private, ltd by shares"558,1486911,"SURE ADVANCE HOLDINGS LIMITED
通程控股有限公司",2010-07-29,,"Private, ltd by shares"559,1486705,"SURE WILL LIMITED
意志有限公司",2010-07-29,,"Private, ltd by shares"560,1486610,"SWISS NEOS (HONGKONG) CLOCKS &amp; WATCHES GROUP CO., LIMITED
瑞士雷歐時(香港)鐘錶集團有限公司",2010-07-29,2019-01-25,"Private, ltd by shares"561,1486904,"SWITZERLAND ROCHE SPECIAL NUTRITION FOOD CO., LIMITED
瑞士羅氏特殊營養食品有限公司",2010-07-29,2015-04-17,"Private, ltd by shares"562,1486414,"SXPC TECHNOLOGY CO., LIMITED
香港碩鑫電子有限公司",2010-07-29,2018-01-05,"Private, ltd by shares"563,1486353,"TAIWAN ZHENGXIN RUBBER INT'L GROUP LIMITED
臺灣正新橡膠國際集團有限公司",2010-07-29,2014-12-05,"Private, ltd by shares"564,1486370,"TALENT DRAGON CORPORATION LIMITED
智龍有限公司",2010-07-29,2017-04-21,"Private, ltd by shares"565,1486753,"TANCH INTERNATIONAL LIMITED
唐成國際有限公司",2010-07-29,,"Private, ltd by shares"566,1486873,"TAPECARE TECHNOLOGY (HONG KONG) CO., LIMITED
香港豪泰科技有限公司",2010-07-29,,"Private, ltd by shares"567,1486775,"TGI Solution Limited
香港宸瀚有限公司",2010-07-29,,"Private, ltd by shares"568,1486377,"THAI'S RESTAURANT LIMITED
正宗泰國菜坊有限公司",2010-07-29,,"Private, ltd by shares"569,1486696,"Third Place Limited (d2019-03-29)",2010-07-29,2019-03-29,"Private, ltd by shares"570,1486505,"TIANCI INVESTMENT GROUP LIMITED
天賜投資集團有限公司",2010-07-29,2014-12-05,"Private, ltd by shares"571,1486566,"TIANJIN QIANGGONG HYDRAULIC MACHINERY CO., LIMITED
天津強工液壓機械有限公司",2010-07-29,,"Private, ltd by shares"572,1486312,"Tianlu International Publishing Group (Hong Kong) Company Limited
天潞國際出版集團(香港)有限公司",2010-07-29,2018-04-06,"Private, ltd by shares"573,1486579,"TIGERS METAL PRODUCTS CO., LIMITED",2010-07-29,,"Private, ltd by shares"574,1486840,"TIK INDUSTRIAL CO., LIMITED
藍雁工業有限公司",2010-07-29,,"Private, ltd by shares"575,1486637,"TIN LUM LEATHER COMPANY LIMITED
田霖皮革有限公司",2010-07-29,2018-04-06,"Private, ltd by shares"576,1486295,"TLR DESIGN ORG. LIMITED
香港譚誠品牌設計整合機構有限公司",2010-07-29,2014-04-04,"Private, ltd by shares"577,1486960,"TO-FLOURISH INTERNATIONAL LIMITED
同豐國際有限公司",2010-07-29,,"Private, ltd by shares"578,1486834,"TOKIN LIMITED
圖健有限公司",2010-07-29,,"Private, ltd by shares"579,1486321,"TOMAN (HONG KONG) SHARE CO., LIMITED
唐盟(香港)股份有限公司",2010-07-29,2014-12-05,"Private, ltd by shares"580,1486568,"TONG CHUANG IMPORT &amp; EXPORT TRADING CO., LIMITED
同創國際進出口貿易有限公司",2010-07-29,2014-12-05,"Private, ltd by shares"581,1486945,"TOP CENTURY (FAR EAST) LIMITED
信恒(遠東)有限公司",2010-07-29,,"Private, ltd by shares"582,1486577,"TOP CHARM INTERNATIONAL INDUSTRIAL LIMITED
威懋國際實業有限公司",2010-07-29,2014-12-05,"Private, ltd by shares"583,1486597,"TOP CROWN HOLDINGS LIMITED
冠揚集團有限公司",2010-07-29,2019-09-27,"Private, ltd by shares"584,1486601,"TOP FANCY MANAGEMENT LIMITED
怡高管理有限公司",2010-07-29,2015-07-10,"Private, ltd by shares"585,1486915,"TOP FRONTIER HOLDINGS LIMITED
匯揚控股有限公司",2010-07-29,2019-05-03,"Private, ltd by shares"586,1486593,"TOP KIND HOLDINGS LIMITED
良達集團有限公司",2010-07-29,,"Private, ltd by shares"587,1486761,"TOP-PLUS INTERNATIONAL TRADING CO., LIMITED
富騰國際貿易有限公司",2010-07-29,,"Private, ltd by shares"588,1486788,"TOPSON TECHNOLOGY (HONGKONG) LIMITED
多普森科技(香港)有限公司",2010-07-29,2013-06-14,"Private, ltd by shares"589,1486718,"TOPTREND INTERNATIONAL INDUSTRIAL LIMITED",2010-07-29,2017-11-17,"Private, ltd by shares"590,1486451,"TRADE EASY LIMITED
貿順有限公司",2010-07-29,,"Private, ltd by shares"591,1486923,"TRADE MERIT INVESTMENTS LIMITED
能業投資有限公司",2010-07-29,,"Private, ltd by shares"592,1486655,"TRADER PROFIT LIMITED
集利行有限公司",2010-07-29,2011-08-12,"Private, ltd by shares"593,1486432,"TREE WORKSHOP LIMITED",2010-07-29,2020-05-22,"Private, ltd by shares"594,1486380,"TREND EAST LIMITED
東毅有限公司",2010-07-29,2019-05-03,"Private, ltd by shares"595,1486600,"TREND INTERNATIONAL INVESTMENT LIMITED
進毅國際投資有限公司",2010-07-29,2013-07-12,"Private, ltd by shares"596,1486307,"Tria Pharmaceutical Group Limited
鼎亞大成醫藥集團有限公司",2010-07-29,2014-12-05,"Private, ltd by shares"597,1486676,"TRK INJECTION MOULD CO., LIMITED
泰睿科精密模具塑膠製品有限公司",2010-07-29,2013-12-20,"Private, ltd by shares"598,1486325,"TT MOTORS LIMITED (HK)
大棠汽車服務有限公司",2010-07-29,2019-05-03,"Private, ltd by shares"599,1486836,"TUBINO LIMITED",2010-07-29,2011-07-22,"Private, ltd by shares"600,1486292,"TUNG CHAK ELECTRONICS ENVIRONMENTAL RECYCLING COMPANY LIMITED
東澤電子環保回收有限公司",2010-07-29,,"Private, ltd by shares"601,1486645,"Two Of A Kind Limited",2010-07-29,2013-02-08,"Private, ltd by shares"602,1486974,"UK LUYIWEINA HEALTH MANAGEMENT CO., LIMITED
英國路易薇娜健康管理有限公司",2010-07-29,2014-12-05,"Private, ltd by shares"603,1486526,"Ultrabeing Limited",2010-07-29,,"Private, ltd by shares"604,1486951,"UNCANNY JEWELLERY (HK) LIMITED
安卡尼珠寶(香港)有限公司",2010-07-29,2018-01-19,"Private, ltd by shares"605,1486605,"UNI ASIA INVESTMENT LIMITED
寰宇亞太投資有限公司",2010-07-29,,"Private, ltd by shares"606,1486937,"UNION ELECTRONICS INTERNATIONAL LIMITED
巨集電子(國際)有限公司",2010-07-29,2014-12-12,"Private, ltd by shares"607,1486452,"UNION SPREAD LIMITED (d2017-04-21)
展協有限公司",2010-07-29,2017-04-21,"Private, ltd by shares"608,1486602,"UNION STAR INTERNATIONAL INVESTMENT LIMITED
星滙國際投資有限公司",2010-07-29,,"Private, ltd by shares"609,1486826,"UNITED FORCE FURNITURE CO., LIMITED
合正傢俱有限公司",2010-07-29,,"Private, ltd by shares"610,1486506,"UNITED GRACE INTERNATIONAL INVESTMENT LIMITED
滙欣國際投資有限公司",2010-07-29,,"Private, ltd by shares"611,1486932,"United Overseas Trading Co., Limited
聯合海外貿易有限公司",2010-07-29,2017-04-21,"Private, ltd by shares"612,1486604,"UNITED SUCCESS GARMENT LIMITED
滙興製衣有限公司",2010-07-29,2019-05-24,"Private, ltd by shares"613,1486792,"UNITED WORLD COLLEGE USA GREATER CHINA FOUNDATION LIMITED",2010-07-29,2015-08-07,"Ltd by guarantee"614,1486784,"UNUSUAL INTERNATIONAL LIMITED
卡特國際有限公司",2010-07-29,,"Private, ltd by shares"615,1486609,"USA WOERMAN TOOIS INTERNATIONAL LIMITED
美國沃爾曼工具國際有限公司",2010-07-29,2016-03-24,"Private, ltd by shares"616,1486811,"USP HK INT'L INVESTMENT DEVELOP LIMITED
天下萬興香港國際投資發展有限公司",2010-07-29,,"Private, ltd by shares"617,1486777,"VANGUARD INTERNATIONAL TRADING LIMITED (HK)
維佳國際貿易有限公司",2010-07-29,,"Private, ltd by shares"618,1486657,"VANTAGE ELECTRONICS TECHNOLOGY LIMITED
智益電子科技有限公司",2010-07-29,,"Private, ltd by shares"619,1486402,"VISBRIDGE INTERNATIONAL GROUP LIMITED
萬事吉國際集團有限公司",2010-07-29,,"Private, ltd by shares"620,1486953,"VOTOO (CHINA) CO., LIMITED
沃電(中國)有限公司",2010-07-29,,"Private, ltd by shares"621,1486642,"WAHYICK TECHNOLOGY COMPANY LIMITED
華益科技有限公司",2010-07-29,2016-01-22,"Private, ltd by shares"622,1486649,"WAI LEE FAT LIMITED
威利發有限公司",2010-07-29,2014-05-02,"Private, ltd by shares"623,1486305,"Wai Yi's Company Limited
湋一實業有限公司",2010-07-29,,"Private, ltd by shares"624,1486847,"WAILEEPO (CHINA) LIMITED
威利寶(中國)有限公司",2010-07-29,,"Private, ltd by shares"625,1486855,"WAN CHENG GREEN ISLAND COMMERCE (HONG KONG) COMPANY LIMITED
萬城綠洲商業(香港)有限公司",2010-07-29,,"Private, ltd by shares"626,1486393,"WAT GROUP CO., LIMITED",2010-07-29,2020-05-22,"Private, ltd by shares"627,1486715,"WAZAN CO., LIMITED",2010-07-29,2016-12-16,"Private, ltd by shares"628,1486762,"Webcommerce Media Solutions Limited",2010-07-29,,"Private, ltd by shares"629,1486607,"WELL FAMOUS GARMENT LIMITED
佳榮製衣有限公司",2010-07-29,,"Private, ltd by shares"630,1486720,"WELL HARVEST FINANCE LIMITED
裕豐財務有限公司",2010-07-29,,"Private, ltd by shares"631,1486973,"WELLFOOD CO., LIMITED
維一貿易有限公司",2010-07-29,2020-07-24,"Private, ltd by shares"632,1486385,"WIDE SILVER LIMITED
銀廣有限公司",2010-07-29,,"Private, ltd by shares"633,1486456,"WILBER CREATIONS CO., LIMITED
偉博藝術創作有限公司",2010-07-29,2017-04-07,"Private, ltd by shares"634,1486845,"WIN KING FOOTWEAR (H.K) CO., LIMITED
萬成鞋業(香港)有限公司",2010-07-29,2016-03-18,"Private, ltd by shares"635,1486790,"WIN TREND INTERNATIONAL TRADING LIMITED
凱順國際貿易有限公司",2010-07-29,,"Private, ltd by shares"636,1486301,"WING WING COMPANY LIMITED
榮榮有限公司",2010-07-29,2012-03-02,"Private, ltd by shares"637,1486486,"WinKong Marine Engineering Co., Limited",2010-07-29,,"Private, ltd by shares"638,1486843,"Winmika Rushan (Hong Kong) Company Limited
滙美嘉乳山(香港)有限公司",2010-07-29,2015-03-13,"Private, ltd by shares"639,1486852,"Winmika Taian (Hong Kong) Company Limited
滙美嘉泰安(香港)有限公司",2010-07-29,2015-03-13,"Private, ltd by shares"640,1486717,"WINNER TEAM LIMITED (d2011-11-04)
凱賢有限公司",2010-07-29,2011-11-04,"Private, ltd by shares"641,1486450,"WINTOP GLOBAL SOURCES CO., LIMITED
萬通環球資源有限公司",2010-07-29,,"Private, ltd by shares"642,1486722,"WISDOM LINE LIMITED
智恩有限公司",2010-07-29,,"Private, ltd by shares"643,1486957,"WISDOM TECHNOLOGY INTERNATIONAL LIMITED
匯智科技國際有限公司",2010-07-29,2018-05-04,"Private, ltd by shares"644,1486899,"WISE ALLY HOLDINGS LIMITED
麗年控股有限公司",2010-07-29,,"Private, ltd by shares"645,1486519,"WO FU HONG KONG HOLDINGS LIMITED
和富香港集團有限公司",2010-07-29,2014-12-05,"Private, ltd by shares"646,1486876,"WORLD CULTURE (KITCHEN FOOD) INT'L GROUP LIMITED
世界文化(廚房美食)國際集團有限公司",2010-07-29,,"Private, ltd by shares"647,1486391,"WORLD GREAT LIMITED
世偉有限公司",2010-07-29,,"Private, ltd by shares"648,1486332,"World Max International Trading Limited
偉宏國際貿易有限公司",2010-07-29,2017-01-20,"Private, ltd by shares"649,1486819,"WUHAN TOPMED TRADING COMPANY LIMITED",2010-07-29,2018-08-31,"Private, ltd by shares"650,1486665,"WUI KIN CATERING COMPANY LIMITED
匯建餐飲有限公司",2010-07-29,2014-12-05,"Private, ltd by shares"651,1486739,"XIAMEN TAISENG SEAFOODS CO., LIMITED
廈門泰誠水產食品有限公司",2010-07-29,2019-12-20,"Private, ltd by shares"652,1486510,"XIAMEN XINKESTONE IMPORT &amp; EXPORT LIMITED
廈門市鑫科石進出口有限公司",2010-07-29,2016-03-24,"Private, ltd by shares"653,1486936,"XIANGJIANG TECHNOLOGY CO., LIMITED
香江科技有限公司",2010-07-29,2014-12-05,"Private, ltd by shares"654,1486862,"XIN FANG INDUSTRY (HK) LIMITED
新芳實業(香港)有限公司",2010-07-29,,"Private, ltd by shares"655,1486480,"Xing Bai Jia Tang (Hong Kong) Limited
興百佳堂(香港)有限公司",2010-07-29,2015-07-10,"Private, ltd by shares"656,1486580,"Xingyang International Trade Co., Limited
星陽國際貿易有限公司",2010-07-29,2014-12-05,"Private, ltd by shares"657,1486940,"XM INTERNATIONAL LIMITED
迅馳國際有限公司",2010-07-29,,"Private, ltd by shares"658,1486652,"Yants Trading Co., Limited
源起貿易有限公司",2010-07-29,2015-07-10,"Private, ltd by shares"