,Reg no.,Name,Incorp-orated,Dissolved,Type1,1486928,"3b SANMA LIMITED",2010-07-29,,"Private, ltd by shares"2,1486433,"AAI PROPERTIES LIMITED",2010-07-29,2014-12-05,"Private, ltd by shares"3,1486473,"ABLE KING ENTERPRISES &amp; LOGISTICS LIMITED
正榮企業物流有限公司",2010-07-29,,"Private, ltd by shares"4,1486400,"ABLE LOYAL LIMITED (b2010-07-29)
誼成有限公司",2010-07-29,2017-11-17,"Private, ltd by shares"5,1486429,"Acme Opto-electronic Technology Limited
景致光電科技有限公司",2010-07-29,2015-07-10,"Private, ltd by shares"6,1486644,"Acmell International Co., Limited
極質國際有限公司",2010-07-29,,"Private, ltd by shares"7,1486423,"AE GLOBAL HOLDING LIMITED",2010-07-29,2015-07-24,"Private, ltd by shares"8,1486304,"ALL ASPECTS LIMITED (d2011-10-14)
弦方投資有限公司",2010-07-29,2011-10-14,"Private, ltd by shares"9,1486787,"ALLIANTECH INDUSTRIAL CO., LIMITED
安科工業有限公司",2010-07-29,2015-07-10,"Private, ltd by shares"10,1486611,"ALLIED FIELD LIMITED
集田有限公司",2010-07-29,,"Private, ltd by shares"11,1486493,"ALLIED LUCK TECHNOLOGY LIMITED
滙福科技有限公司",2010-07-29,,"Private, ltd by shares"12,1486531,"ALLIED STAR INTERNATIONAL INDUSTRIAL LIMITED
星滙國際實業有限公司",2010-07-29,2014-12-05,"Private, ltd by shares"13,1486612,"ALLIED WING LIMITED
集頴有限公司",2010-07-29,,"Private, ltd by shares"14,1486975,"AMIE HIFESTYLE&amp;HOME DECOR (HK) CO., LIMITED
香港艾美飾家軟裝設計有限公司",2010-07-29,2018-04-06,"Private, ltd by shares"15,1486721,"AN YING TECHNOLOGY (HK) CO., LIMITED
安盈科技(香港)有限公司",2010-07-29,,"Private, ltd by shares"16,1486916,"Anchors Commercial Surveyors (Asia) Limited
安佳思商業測量師行(亞洲)有限公司",2010-07-29,,"Private, ltd by shares"17,1486478,"APACHE IPS LIMITED",2010-07-29,,"Private, ltd by shares"18,1486783,"ASIA UNITE LIMITED
亞洲聯合有限公司",2010-07-29,,"Private, ltd by shares"19,1486704,"ASIAN SOURCING &amp; SUPPLIER'S LIMITED",2010-07-29,,"Private, ltd by shares"20,1486462,"BAAKNIN LIMITED",2010-07-29,,"Private, ltd by shares"21,1486354,"BABYLON STAR INDUSTRIAL CO., LIMITED
巴比倫天星工業有限公司",2010-07-29,,"Private, ltd by shares"22,1486947,"BaiLee Trading Co., Limited
佰利貿易有限公司",2010-07-29,2019-03-01,"Private, ltd by shares"23,1486733,"Bailu International Co., Limited
百綠國際有限公司",2010-07-29,2019-12-27,"Private, ltd by shares"24,1486674,"BAOLAI ELECTRONICS CO., LIMITED
香港寶來電子有限公司",2010-07-29,2017-04-21,"Private, ltd by shares"25,1486881,"BAONOR INDUSTRIAL CO., LIMITED
寶譽國際實業有限公司",2010-07-29,2015-07-10,"Private, ltd by shares"26,1486849,"BCC TECHNOLOGY COMPANY LIMITED",2010-07-29,,"Private, ltd by shares"27,1486800,"BEIJING CHAODUN PLASTIC PRODUCE LIMITED
北京超盾塑料製品有限公司",2010-07-29,2017-04-21,"Private, ltd by shares"28,1486914,"BETTER SEASON LIMITED (HK)
才穎有限公司",2010-07-29,,"Private, ltd by shares"29,1486435,"BLACKSANDS PACIFIC EQUATORIAL GUINEA LIMITED",2010-07-29,2019-03-29,"Private, ltd by shares"30,1486554,"BLOOM (HK) INTERNATIONAL CO., LIMITED
花漾香港有限公司",2010-07-29,2015-07-10,"Private, ltd by shares"31,1486727,"BNK GROUP LIMITED",2010-07-29,2012-02-10,"Private, ltd by shares"32,1486743,"BONUS WEALTH MANAGEMENT CO., LIMITED
寶言財富管理有限公司",2010-07-29,2012-01-13,"Private, ltd by shares"33,1486387,"BOSICALA (HK) INVESTMENT DEVELOPMENT LIMITED
波西卡諾(香港)投資發展有限公司",2010-07-29,2014-12-05,"Private, ltd by shares"34,1486296,"BRAND FIRST INTERNATIONAL LIMITED",2010-07-29,,"Private, ltd by shares"35,1486909,"BRAND NEW IMAGE LIMITED",2010-07-29,2015-03-27,"Private, ltd by shares"36,1486805,"BRAVO MUSICAL INSTRUMENT CO., LIMITED
寶威樂器有限公司",2010-07-29,2015-07-10,"Private, ltd by shares"37,1486650,"BREUER &amp; YANG TRADE AND CONSULTANCY LIMITED
伯揚貿易顧問有限公司",2010-07-29,2014-12-05,"Private, ltd by shares"38,1486507,"BRIGHTER CHINA LIMITED
光中行有限公司",2010-07-29,,"Private, ltd by shares"39,1486625,"BRIGHTON WIN LIMITED
光勝有限公司",2010-07-29,2014-12-05,"Private, ltd by shares"40,1486346,"BRILLIANT-J COMPANY LIMITED
博瑞景有限公司",2010-07-29,2019-08-30,"Private, ltd by shares"41,1486293,"Broad Arrow Limited",2010-07-29,,"Private, ltd by shares"42,1486675,"BSG AUTO PARTS CO., LIMITED
巴實布汽配有限公司",2010-07-29,,"Private, ltd by shares"43,1486801,"BUILDTOLAST CO., LIMITED
中國基業長青有限公司",2010-07-29,,"Private, ltd by shares"44,1486719,"C &amp; Y (HK) LIMITED",2010-07-29,2018-12-28,"Private, ltd by shares"45,1486311,"CANADA'S SUNCOR ENERGY LIMITED
加拿大森科爾能源有限公司",2010-07-29,2014-12-05,"Private, ltd by shares"46,1486887,"CEQE INNOVATION (HK) INDUSTRIAL CO., LIMITED
思科國際貿易有限公司",2010-07-29,,"Private, ltd by shares"47,1486824,"CGK GROUP Company Limited",2010-07-29,2015-07-10,"Private, ltd by shares"48,1486401,"CHAMP COUNTRY LIMITED
國采有限公司",2010-07-29,,"Private, ltd by shares"49,1486404,"CHAMP MOST LIMITED
祥多有限公司",2010-07-29,,"Private, ltd by shares"50,1486948,"CHANG SHUO TEXTILE (HK) LIMITED
香港長碩紡織有限公司",2010-07-29,2015-12-18,"Private, ltd by shares"51,1486785,"Charitable Choice Limited
擇善坊有限公司",2010-07-29,,"Ltd by guarantee"52,1486812,"CHARMPHY INTERNATIONAL TRADE CO., LIMITED
暢飛國際貿易有限公司",2010-07-29,2018-08-31,"Private, ltd by shares"53,1486408,"CHEER POINT CORPORATION LIMITED
志中有限公司",2010-07-29,,"Private, ltd by shares"54,1486410,"CHEER SKY CORPORATION LIMITED
至天有限公司",2010-07-29,,"Private, ltd by shares"55,1486348,"CHESTERLUX LIMITED",2010-07-29,2019-03-29,"Private, ltd by shares"56,1486709,"CHINA (HK) HAIFAN GROUP LIMITED
中國(香港)海帆集團有限公司",2010-07-29,2014-12-05,"Private, ltd by shares"57,1486892,"CHINA AKON GROUP CO., LIMITED
中國亞港集團有限公司",2010-07-29,2019-08-09,"Private, ltd by shares"58,1486342,"CHINA ASEAN INT'L FINANCIAL SERVICES GROUP LIMITED
中國東盟國際金融服務集團有限公司",2010-07-29,2012-06-08,"Private, ltd by shares"59,1486700,"China Brand Strategic Association Limited
中國品牌戰略促進會有限公司",2010-07-29,2014-12-05,"Private, ltd by shares"60,1486383,"CHINA CHUNCHEN INT'L GROUP HOLDING LIMITED
中國春晨國際集團股份有限公司",2010-07-29,2017-04-21,"Private, ltd by shares"61,1486930,"CHINA CONVERGE INTERNATIONAL TRADING LIMITED
中匯通國際貿易有限公司",2010-07-29,2014-12-19,"Private, ltd by shares"62,1486701,"CHINA DISTILLERY LIMITED
中國釀酒有限公司",2010-07-29,2019-05-03,"Private, ltd by shares"63,1486471,"CHINA EVERBRIGHT TRADING CO., LIMITED
中國光大貿易有限公司",2010-07-29,2019-05-03,"Private, ltd by shares"64,1486365,"CHINA GLOBAL GREENTECH GROUP CO., LIMITED
中國綠色能源國際集團有限公司",2010-07-29,2015-07-10,"Private, ltd by shares"65,1486536,"CHINA GREAT INTERNATIONAL INVESTMENT LIMITED
華昌國際投資有限公司",2010-07-29,,"Private, ltd by shares"66,1486413,"CHINA HAPPY CORPORATION LIMITED
華喜有限公司",2010-07-29,,"Private, ltd by shares"67,1486971,"CHINA HARMONY COMMERCIAL REAL ESTATE DEVELOPMENT CO., LIMITED
中國和諧商業不動產發展有限公司",2010-07-29,2014-12-19,"Private, ltd by shares"68,1486759,"CHINA HK SHUNDI CULTURE INDUSTRY GROUP INT'L LIMITED
中國香港舜地文化產業集團國際有限公司",2010-07-29,2014-12-05,"Private, ltd by shares"69,1486970,"CHINA MACHINE &amp; EQUIPMENT GROUP LIMITED
中國機械設備集團有限公司",2010-07-29,2018-03-02,"Private, ltd by shares"70,1486816,"CHINA MINING ENERGY GROUP LIMITED
中國礦業能源集團有限公司",2010-07-29,,"Private, ltd by shares"71,1486823,"CHINA SINCERE (HONG KONG) RESOURCES LIMITED
中誠信(香港)資源有限公司",2010-07-29,2015-04-02,"Private, ltd by shares"72,1486814,"CHINA STAR INTERNATIONAL TRADING LIMITED
華星國際貿易有限公司",2010-07-29,2019-03-15,"Private, ltd by shares"73,1486313,"CHINA TOUVE ENVIRONMENTAL LIGHTING ENGINEERING CO., LIMITED
中國托維環境亮化工程有限公司",2010-07-29,2015-07-03,"Private, ltd by shares"74,1486673,"CHIYULONG INTERNATIONAL TRADING CO., LIMITED
馳域龍國際貿易有限公司",2010-07-29,2013-12-20,"Private, ltd by shares"75,1486871,"Choice Hair Care Centre Company Limited
卓思護髮用品中心有限公司",2010-07-29,,"Private, ltd by shares"76,1486371,"CHONG FUNG (HK) HOLDINGS INVESTMENT LIMITED
創豐(香港)控股投資有限公司",2010-07-29,,"Private, ltd by shares"77,1486439,"CHONG MING LIMITED
莊明有限公司",2010-07-29,2020-09-18,"Private, ltd by shares"78,1486835,"CHOSEN INT'L TRADING INVESTMENT LIMITED
中盛國際貿易投資有限公司",2010-07-29,2019-02-15,"Private, ltd by shares"79,1486350,"Chuang Jian Construction Engineering Limited
創建建築工程有限公司",2010-07-29,,"Private, ltd by shares"80,1486297,"CHUNGFOR LAPSHUN OPTOELECTRONICS COMPANY LIMITED
中科立信光電有限公司",2010-07-29,2012-05-11,"Private, ltd by shares"81,1486392,"CHYAOYEE ELECTRONICS (HK) CO., LIMITED
喬業電子(香港)有限公司",2010-07-29,2020-04-09,"Private, ltd by shares"82,1486337,"Classic Happiness Company Limited",2010-07-29,,"Private, ltd by shares"83,1486449,"Company Registration Number 1486449 Limited",2010-07-29,2013-07-19,"Private, ltd by shares"84,1486537,"Company Registration Number 1486537 Limited
公司註冊編號 1486537 有限公司",2010-07-29,2014-02-14,"Private, ltd by shares"85,1486774,"Company Registration Number 1486774 Limited
公司註冊編號 1486774 有限公司",2010-07-29,2014-03-28,"Private, ltd by shares"86,1486963,"CORPORATE MARKET LIMITED (d2016-05-13)
強實有限公司",2010-07-29,2016-05-13,"Private, ltd by shares"87,1486736,"CREATIVE YICK MAINTENANCE ENGINEERING LIMITED
創益維修工程有限公司",2010-07-29,,"Private, ltd by shares"88,1486538,"CROWN (HK) INDUSTRIAL LIMITED
創冠(香港)實業有限公司",2010-07-29,2014-12-05,"Private, ltd by shares"89,1486542,"CROWN CONCEPT INTERNATIONAL INVESTMENT LIMITED
創冠國際投資有限公司",2010-07-29,2019-03-29,"Private, ltd by shares"90,1486918,"Curts Manufacturing Solutions Limited
柯氏科技發展有限公司",2010-07-29,2016-12-30,"Private, ltd by shares"91,1486620,"CX METAL MANUFACTURING CO., LIMITED
創鑫金屬製品有限公司",2010-07-29,,"Private, ltd by shares"92,1486863,"D.I. Hong Kong Limited",2010-07-29,,"Private, ltd by shares"93,1486534,"DAI WAH CAPITAL LIMITED
大華企業財務顧問有限公司",2010-07-29,2018-04-06,"Private, ltd by shares"94,1486934,"DANA OPTOTECH LIMITED",2010-07-29,2019-03-29,"Private, ltd by shares"95,1486613,"DAO SUNG GUOBO INTERNATIONAL UNION CULTURAL ARTWORK COLLECTION MUSEUM LIMITED
道尚國博國際聯合文化藝術品收藏博物館有限公司",2010-07-29,2019-05-03,"Private, ltd by shares"96,1486671,"DE WEI INTERNATIONAL HOLDINGS CO., LIMITED
德威國際控股有限公司",2010-07-29,2017-11-10,"Private, ltd by shares"97,1486618,"DEAN ASIA LIMITED
偉亞有限公司",2010-07-29,,"Private, ltd by shares"98,1486693,"DECRATECH LIMITED",2010-07-29,2017-08-11,"Private, ltd by shares"99,1486925,"DELTA CAPITAL INVESTMENTS LIMITED (d2015-07-10)
域豪投資有限公司",2010-07-29,2015-07-10,"Private, ltd by shares"100,1486882,"DERAIN CO., LIMITED
德潤國際實業有限公司",2010-07-29,2019-01-04,"Private, ltd by shares"101,1486427,"DESHINE INDUSTRIAL GROUP LIMITED
德信實業集團有限公司",2010-07-29,2014-12-05,"Private, ltd by shares"102,1486729,"DEUTSCHLAND FASHION FORMULA INDUSTRY (GROUP) LIMITED
德國楓尚志典工業(集團)有限公司",2010-07-29,2015-07-10,"Private, ltd by shares"103,1486470,"DICK GARY LIMITED
的鳳有限公司",2010-07-29,,"Private, ltd by shares"104,1486614,"DIGITAL ZONE LIMITED
數碼地帶有限公司",2010-07-29,2020-01-31,"Private, ltd by shares"105,1486596,"DINGCHUANG TECHNOLOGY (HK) CO., LIMITED
鼎創科技(香港)有限公司",2010-07-29,,"Private, ltd by shares"106,1486481,"DIVA DIAM (HK) LIMITED",2010-07-29,,"Private, ltd by shares"107,1486448,"DONESINE INTERNATIONAL BUSINESS LIMITED
東晨國際商務有限公司",2010-07-29,,"Private, ltd by shares"108,1486599,"DONG MING COMPANY LIMITED",2010-07-29,2017-04-21,"Private, ltd by shares"109,1486789,"DONGFANG SANYANG FEDERATION ELECTRONICS TECHNOLOGY LIMITED
東方三洋聯邦電子科技有限公司",2010-07-29,2014-12-05,"Private, ltd by shares"110,1486416,"DONGGUAN AOWEI SPORTING GOODS COMPANY LIMITED
東莞市奧唯體育用品有限公司",2010-07-29,,"Private, ltd by shares"111,1486626,"DRAGON PROPERTY LIMITED (HK)
龍置有限公司",2010-07-29,,"Private, ltd by shares"112,1486865,"Dream Works International Cultural Development (Hong Kong) Co., Limited
夢工廠國際文化發展(香港)有限公司",2010-07-29,2015-04-17,"Private, ltd by shares"113,1486515,"DUO BAO FAR EAST CO., LIMITED
奪寶遠東有限公司",2010-07-29,2017-04-21,"Private, ltd by shares"114,1486931,"DYNAMIC QUALITY LIMITED
展妙有限公司",2010-07-29,2013-07-26,"Private, ltd by shares"115,1486457,"E-Execute Limited",2010-07-29,2013-01-18,"Private, ltd by shares"116,1486740,"E-STAR INTERNATIONAL TRADING CO., LIMITED
宜適達國際貿易有限公司",2010-07-29,2014-12-05,"Private, ltd by shares"117,1486419,"EAC (H.K.) LIMITED
鑫淼環球(香港)有限公司",2010-07-29,2019-08-09,"Private, ltd by shares"118,1486935,"EAGLE CENTURY HOLDINGS LIMITED
佳越控股有限公司",2010-07-29,2014-12-05,"Private, ltd by shares"119,1486417,"EARNING KING LIMITED
君得有限公司",2010-07-29,,"Private, ltd by shares"120,1486880,"EARTH OLD PEOPLE LONGEVITY PARADISE (ZYD) INDUSTRIES LIMITED
地球村老人長壽樂園(兆億達)實業有限公司",2010-07-29,,"Private, ltd by shares"121,1486328,"EAST ASIA INTERNATIONAL TRADE LIMITED
東亞國際貿易有限公司",2010-07-29,2020-05-22,"Private, ltd by shares"122,1486571,"East Digital Technology Trading Co., Limited",2010-07-29,2014-12-05,"Private, ltd by shares"123,1486628,"EAST HORN LIMITED
宜鴻有限公司",2010-07-29,,"Private, ltd by shares"124,1486794,"EAST TERRA LIMITED
東地有限公司",2010-07-29,,"Private, ltd by shares"125,1486966,"EASTERN FOREST INTERNATIONAL LIMITED
嘯林國際有限公司",2010-07-29,,"Private, ltd by shares"126,1486920,"EASTOP INDUSTRY DEVELOPMENT LIMITED
益東實業發展有限公司",2010-07-29,2020-01-31,"Private, ltd by shares"127,1486545,"EASY BRIGHT INTERNATIONAL INVESTMENT LIMITED
順明國際投資有限公司",2010-07-29,,"Private, ltd by shares"128,1486363,"EasyPass Trading Co., Limited
易點通貿易有限公司",2010-07-29,,"Private, ltd by shares"129,1486390,"EBEST GROUP CO., LIMITED (d2018-04-06)
易百思特集團有限公司",2010-07-29,2018-04-06,"Private, ltd by shares"130,1486933,"EBLE (HK) FURNISHING COMPANY LIMITED
艾博家居用品有限公司",2010-07-29,2018-12-07,"Private, ltd by shares"131,1486686,"EDVANTAGE EDUCATION (HONG KONG) LIMITED
安達教育(香港)有限公司",2010-07-29,2012-03-23,"Private, ltd by shares"132,1486660,"EGOODS (HONG KONG) INTERNATIONAL GROUP LIMITED
易通(香港)國際集團有限公司",2010-07-29,2013-12-20,"Private, ltd by shares"133,1486418,"ELEGANT SPEED LIMITED
采迅有限公司",2010-07-29,,"Private, ltd by shares"134,1486294,"ELEMENT GLOBAL LIMITED (THE)
玄方環球有限公司",2010-07-29,2018-02-23,"Private, ltd by shares"135,1486939,"ELITE PLAN INVESTMENTS LIMITED
賢思投資有限公司",2010-07-29,,"Private, ltd by shares"136,1486310,"EMERALD SEAS LIMITED",2010-07-29,2013-08-02,"Private, ltd by shares"137,1486484,"EnC ENGINEERING LIMITED
櫻澤工程有限公司",2010-07-29,2014-06-27,"Private, ltd by shares"138,1486895,"EPIC ELEMENTS COMPANY LIMITED",2010-07-29,2014-12-05,"Private, ltd by shares"139,1486630,"ETERNAL LINK INVESTMENT LIMITED
香港怡暉投資有限公司",2010-07-29,,"Private, ltd by shares"140,1486420,"ETERNAL SUNNY LIMITED (d2014-12-05)
永明有限公司",2010-07-29,2014-12-05,"Private, ltd by shares"141,1486938,"Euro-asian Ruisheng Industrial Co., Limited
歐亞瑞升實業有限公司",2010-07-29,,"Private, ltd by shares"142,1486549,"EVER GRACE GARMENT LIMITED
永嘉製衣有限公司",2010-07-29,,"Private, ltd by shares"143,1486553,"EVER GRAND ASIA INVESTMENT LIMITED
永浩亞太投資有限公司",2010-07-29,2016-03-24,"Private, ltd by shares"144,1486623,"EVERFULL CITY LIMITED
百富盛有限公司",2010-07-29,,"Private, ltd by shares"145,1486375,"EvoTRADE Limited (HK)",2010-07-29,,"Private, ltd by shares"146,1486319,"Excel Win Investments Limited
皓信投資有限公司",2010-07-29,2014-02-07,"Private, ltd by shares"147,1486555,"FAITH CONSTRUCTION ENGINEERING LIMITED
信成建築工程有限公司",2010-07-29,,"Private, ltd by shares"148,1486562,"FAITHWAY ASIA INVESTMENT LIMITED
信高亞太投資有限公司",2010-07-29,2014-12-05,"Private, ltd by shares"149,1486563,"FAMOUS (HK) INDUSTRIAL LIMITED
凱榮(香港)實業有限公司",2010-07-29,2014-12-05,"Private, ltd by shares"150,1486565,"FAMOUS ELECTRONICS TECHNOLOGY LIMITED
譽榮電子科技有限公司",2010-07-29,,"Private, ltd by shares"151,1486569,"FANCY CONSTRUCTION ENGINEERING LIMITED
藝豪建築工程有限公司",2010-07-29,,"Private, ltd by shares"152,1486570,"FANCY DRAGON HOLDINGS LIMITED
龍穎集團有限公司",2010-07-29,,"Private, ltd by shares"153,1486426,"FANCY PEACE LIMITED
宜和有限公司",2010-07-29,,"Private, ltd by shares"154,1486574,"FAST EXPRESS TRANSPORTATION LIMITED (d2015-07-10)
迅領運輸有限公司",2010-07-29,2015-07-10,"Private, ltd by shares"155,1486494,"FAST INTERNATIONAL INDUSTRIAL LIMITED
捷榮國際實業有限公司",2010-07-29,2016-03-24,"Private, ltd by shares"156,1486316,"FAVOUR WEDDING LIMITED",2010-07-29,,"Private, ltd by shares"157,1486373,"FC (CHINA) CO LIMITED
鋒俊(中國)有限公司",2010-07-29,2016-03-18,"Private, ltd by shares"158,1486926,"FDRS INTERNATIONAL TRADING LIMITED
富達融盛國際貿易有限公司",2010-07-29,2015-07-10,"Private, ltd by shares"159,1486749,"Finefox International (HK) Limited
鋒狐國際(香港)有限公司",2010-07-29,,"Private, ltd by shares"160,1486838,"FIRECOMMS CHINA LIMITED
飛爾康中國有限公司",2010-07-29,2015-03-20,"Private, ltd by shares"161,1486662,"FITO INGREDIENTS LIMITED",2010-07-29,,"Private, ltd by shares"162,1486782,"FOREVER WELL INT'L GROUP LIMITED
佳恒國際集團有限公司",2010-07-29,,"Private, ltd by shares"163,1486428,"FORTUNE EARNER LIMITED
裕得有限公司",2010-07-29,,"Private, ltd by shares"164,1486754,"FORTUNE TRADE COMPANY LIMITED (d2016-04-22)
福禧國際貿易有限公司",2010-07-29,2016-04-22,"Private, ltd by shares"165,1486459,"FORTUNE TRADE CONSULTANTS CO., LIMITED
鑫海貿易顧問有限公司",2010-07-29,,"Private, ltd by shares"166,1486776,"FRANCE MESAPPAS INT'L HOLDING (HK) LIMITED
法國美莎帕國際控股(香港)有限公司",2010-07-29,,"Private, ltd by shares"167,1486900,"FRANCE NIGER (CHINA) LIMITED
法國尼格(中國)有限公司",2010-07-29,,"Private, ltd by shares"168,1486768,"FRENCH GOLD FOX DRESS HOLDINGS LIMITED
法國金狐狸服飾控股有限公司",2010-07-29,2014-12-05,"Private, ltd by shares"169,1486345,"FRENCH LEMON LANDSCAPE ARCHITECTURAL DESIGN GROUP INTERNATIONAL (HK) CO., LIMITED
法國萊蒙國際建築景觀設計集團(香港)有限公司",2010-07-29,,"Private, ltd by shares"170,1486463,"FRIDENS CHILE INDUSTRIAL CO., LIMITED
智友實業有限公司",2010-07-29,2014-12-05,"Private, ltd by shares"171,1486323,"FRONTIER FINANCIAL ADVISORY SERVICES LIMITED
領譽理財服務有限公司",2010-07-29,,"Private, ltd by shares"172,1486440,"FU WING GROUP LIMITED
富穎集團有限公司",2010-07-29,,"Private, ltd by shares"173,1486734,"FUBON SECURITIES (HONG KONG) LIMITED
富邦證券(香港)有限公司",2010-07-29,,"Private, ltd by shares"174,1486905,"FUGEJIA (HONGKONG) CO., LIMITED
弗戈佳(香港)有限公司",2010-07-29,2019-02-15,"Private, ltd by shares"175,1486497,"FULL WEALTH TECHNOLOGY LIMITED (d2013-08-09)
富惠科技有限公司",2010-07-29,2013-08-09,"Private, ltd by shares"176,1486488,"FUNSTATION COMPANY LIMITED",2010-07-29,2012-01-06,"Private, ltd by shares"177,1486564,"FURUIDA INDUSTRIAL CO., LIMITED
福瑞達實業有限公司",2010-07-29,2020-05-08,"Private, ltd by shares"178,1486629,"FUTURE GREEN LIMITED
明栢有限公司",2010-07-29,,"Private, ltd by shares"179,1486725,"G&amp;Z Solutions Limited",2010-07-29,2019-03-08,"Private, ltd by shares"180,1486680,"GDP Group Limited",2010-07-29,2014-02-21,"Private, ltd by shares"181,1486396,"GERMANY BIKS HEAT ENERGY TECH. (CHINA) LIMITED
德國比克斯熱能科技(中國)有限公司",2010-07-29,2014-12-05,"Private, ltd by shares"182,1486606,"GERMANY KD GROUP CO., LIMITED
德國凱迪集團有限公司",2010-07-29,2016-03-24,"Private, ltd by shares"183,1486322,"GLOBAL ART PRODUCTS LIMITED",2010-07-29,2018-02-15,"Private, ltd by shares"184,1486731,"GLOBAL DESIGN TECHNOLOGY LIMITED
環球設計科技集團有限公司",2010-07-29,2016-03-24,"Private, ltd by shares"185,1486397,"Global Elite Industry Co., Limited
艾略特環球實業有限公司",2010-07-29,2014-12-05,"Private, ltd by shares"186,1486341,"GLOBAL ENERGY CONSORTIUM COMPANY LIMITED",2010-07-29,2012-08-10,"Private, ltd by shares"187,1486575,"GLOBAL GROW LIMITED",2010-07-29,2019-12-27,"Private, ltd by shares"188,1486520,"GLOBAL HAKKA EVANGELISM ASSOCIATION LIMITED (THE)
全球客家福音協會有限公司",2010-07-29,,"Ltd by guarantee"189,1486803,"GLOBAL TECHNOLOGIES GROUP (HK) CO., LIMITED
浩宇聯合科技有限公司",2010-07-29,,"Private, ltd by shares"190,1486594,"Global Transport E-commerce (HK) Co., Limited
環球運電子商務(香港)有限公司",2010-07-29,2018-01-05,"Private, ltd by shares"191,1486897,"GLOBALTEL INTERNATIONAL GROUP LIMITED
環球通信國際集團有限公司",2010-07-29,2016-02-19,"Private, ltd by shares"192,1486690,"GLORY SURE KING GROUP LIMITED",2010-07-29,2012-12-28,"Private, ltd by shares"193,1486369,"GOLDEN ACCESS INVESTMENT LIMITED
金濠投資(國際)有限公司",2010-07-29,,"Private, ltd by shares"194,1486678,"GOLDEN AIRLINES LIMITED",2010-07-29,,"Private, ltd by shares"195,1486476,"GOLDEN HO (HK) INVESTMENT LIMITED
金浩(香港)投資有限公司",2010-07-29,,"Private, ltd by shares"196,1486707,"Golden Seal Consultancy Services Limited
金璽顧問服務有限公司",2010-07-29,,"Private, ltd by shares"197,1486747,"GOLDEN SEAL CORPORATE SERVICES LIMITED
金璽秘書會計有限公司",2010-07-29,2017-09-22,"Private, ltd by shares"198,1486500,"GOOD SPREAD CONSULTANTS LIMITED
佳揚顧問有限公司",2010-07-29,2019-12-06,"Private, ltd by shares"199,1486894,"GOODNESS HEALTHCARE CO., LIMITED
格耐斯醫療用品有限公司",2010-07-29,2015-01-30,"Private, ltd by shares"200,1486501,"GRAND CHINA INTERNATIONAL INVESTMENT LIMITED
泰華國際投資有限公司",2010-07-29,2016-03-24,"Private, ltd by shares"201,1486302,"GRAND PACIFIC INTERNATIONAL (HONG KONG) COMPANY LIMITED
鴻亞國際股份(香港)有限公司",2010-07-29,2017-12-01,"Private, ltd by shares"202,1486742,"GRAND ROYALE INTERNATIONAL (HK) PRIVATE LIMITED
尊皇國際(香港)有限公司",2010-07-29,2014-12-05,"Private, ltd by shares"203,1486504,"GRAND STEP TECHNOLOGY LIMITED
宏達科技有限公司",2010-07-29,2012-03-30,"Private, ltd by shares"204,1486508,"GRAND WAY SHIPPING LIMITED
浩威船務有限公司",2010-07-29,2019-05-03,"Private, ltd by shares"205,1486879,"GRANFFIN FASHION LIMITED
格蘭芬服飾有限公司",2010-07-29,2016-01-08,"Private, ltd by shares"206,1486969,"GREAT HOMELEAF IMMIGRATION CONSULTANT CO., LIMITED
家葉海外出國移民顧問有限公司",2010-07-29,2015-01-16,"Private, ltd by shares"207,1486735,"GREAT SINO DEVELOPMENT LIMITED",2010-07-29,,"Private, ltd by shares"208,1486330,"Great Virtue (HK) Investment Limited
俊品(香港)投資有限公司",2010-07-29,,"Private, ltd by shares"209,1486495,"Greater Bay Area Professional Services Group Limited
大灣區專業服務集團有限公司",2010-07-29,,"Private, ltd by shares"210,1486356,"GREATWINS INTERNATIONAL LIMITED
勇勝國際貿易有限公司",2010-07-29,,"Private, ltd by shares"211,1486430,"GREEN EFFORT ENTERPRISE LIMITED
安富興業有限公司",2010-07-29,,"Private, ltd by shares"212,1486503,"GREEN SOURCE DEVELOPMENT CORPORATION LIMITED
綠之源實業發展有限公司",2010-07-29,2014-12-05,"Private, ltd by shares"213,1486806,"GREEN-LIFE DESIGN CO., LIMITED
格睿設計有限公司",2010-07-29,,"Private, ltd by shares"214,1486778,"GUANGDONG AOKEMA ELECTRICAL LIMITED
廣東澳柯瑪電器有限公司",2010-07-29,2014-12-05,"Private, ltd by shares"215,1486491,"GUANGDONG FOSHAN XUEHUA CERAMICS LIMITED
廣東佛山雪花陶瓷有限公司",2010-07-29,,"Private, ltd by shares"216,1486858,"Guangzhou Anrui Electronics Limited
廣州安瑞電子有限公司",2010-07-29,,"Private, ltd by shares"217,1486324,"GUIZHOU WUXING WINE SHARE LIMITED (d2014-12-05)
貴州五星酒股份有限公司",2010-07-29,2014-12-05,"Private, ltd by shares"218,1486475,"H.K. LINGLONG IMPORTS &amp; EXPORTS TRADE LIMITED
香港玲瓏進出口貿易有限公司",2010-07-29,2018-04-06,"Private, ltd by shares"219,1486919,"H.R JEWELRY GROUP LIMITED
恒蓉珠寶集團有限公司",2010-07-29,2014-12-05,"Private, ltd by shares"220,1486303,"Hai Yue Group Limited
海粵集團有限公司",2010-07-29,,"Private, ltd by shares"221,1486745,"HALLELUJAH (HK) INTERNATIONAL COMPANY LIMITED
哈裏路亞(香港)國際有限公司",2010-07-29,2014-12-05,"Private, ltd by shares"