,Reg no.,Name,Incorp-orated,Dissolved,Type1,1893096,"1000cc Limited
千色概念有限公司",2013-04-17,,"Private, ltd by shares"2,1893462,"360 SERVICES DEVELOPMENT LIMITED
全方位服務發展有限公司",2013-04-17,,"Private, ltd by shares"3,1893254,"3D RESOURCES LIMITED (HK)",2013-04-17,2019-01-18,"Private, ltd by shares"4,1893183,"A MILK LIMITED",2013-04-17,2015-03-13,"Private, ltd by shares"5,1893263,"A97 CONCEPT LIMITED",2013-04-17,,"Private, ltd by shares"6,1893158,"ADMIRAL INVESTMENT LIMITED
安泓投資有限公司",2013-04-17,,"Private, ltd by shares"7,1893267,"ADP NATURAL SCIENCES LIMITED
五方科研有限公司",2013-04-17,,"Private, ltd by shares"8,1892907,"AFRESHOOT HAIR CENTER CO. LIMITED
愛髮生美髮有限公司",2013-04-17,2017-12-01,"Private, ltd by shares"9,1893322,"AGILEBEAR INTERNATIONAL TRADING (HK) LIMITED
上海飛熊國際貿易(香港)有限公司",2013-04-17,2019-02-01,"Private, ltd by shares"10,1892889,"AGRIMAX INDAH (HK) LIMITED",2013-04-17,2019-12-27,"Private, ltd by shares"11,1892830,"Ai Hua Xin Technology (HK) Co., Limited
艾華信科技(香港)有限公司",2013-04-17,2019-09-20,"Private, ltd by shares"12,1893204,"ai3xue.com Limited
愛上學電子教育有限公司",2013-04-17,2018-06-29,"Private, ltd by shares"13,1893006,"AL FAYYOMY CO., LIMITED
弗尤穆貿易有限公司",2013-04-17,,"Private, ltd by shares"14,1892883,"ALTAMIRA FOUNDATION LIMITED
阿爾達米拉基金會有限公司",2013-04-17,,"Ltd by guarantee"15,1893134,"AM Ideas Limited
源耀意念有限公司",2013-04-17,,"Private, ltd by shares"16,1893133,"AMJ TRADE CO., LIMITED
聖亞貿易有限公司",2013-04-17,,"Private, ltd by shares"17,1893316,"ANGELICA ENTERPRISES PTY LIMITED",2013-04-17,2019-02-01,"Private, ltd by shares"18,1892916,"Anjaneya Inc. Limited",2013-04-17,2018-05-11,"Private, ltd by shares"19,1893032,"ANMEIDA DEVELOPMENT CO., LIMITED
安美達發展有限公司",2013-04-17,2017-12-01,"Private, ltd by shares"20,1893442,"ARIHANT GEMS INTERNATIONAL LIMITED",2013-04-17,,"Private, ltd by shares"21,1893307,"ASGONU LIMITED",2013-04-17,2017-12-01,"Private, ltd by shares"22,1893425,"ASIA PACIFIC INDUSTRIAL CONSULTANCY LIMITED",2013-04-17,,"Private, ltd by shares"23,1893444,"Asian Landscape Architecture Co., Limited
亞洲風景園林有限公司",2013-04-17,2018-12-28,"Private, ltd by shares"24,1892903,"ASKA MANAGEMENT LIMITED",2013-04-17,2018-12-28,"Private, ltd by shares"25,1893073,"Astrum Lux (HK) Limited",2013-04-17,2015-06-12,"Private, ltd by shares"26,1893130,"Australian Capital Enterprise (HK) Limited",2013-04-17,2019-12-06,"Private, ltd by shares"27,1893278,"Azure Limited (HK)
湛藍有限公司",2013-04-17,2017-12-01,"Private, ltd by shares"28,1893008,"Azurea Trading Limited",2013-04-17,2019-02-01,"Private, ltd by shares"29,1893173,"BABEL GROUP (ASIA) LIMITED",2013-04-17,,"Private, ltd by shares"30,1893227,"BAIFENG WINE COMPANY LIMITED
百豐酒業有限公司",2013-04-17,2014-06-13,"Private, ltd by shares"31,1893174,"BAISHAXI INTERNATIONAL (HONG KONG) LIMITED
白沙溪國際(香港)有限公司",2013-04-17,,"Private, ltd by shares"32,1893238,"BALTCROWN LIMITED",2013-04-17,2020-01-10,"Private, ltd by shares"33,1893057,"BANDA (HK) TECHNOLOGY CO., LIMITED
班達(香港)科技有限公司",2013-04-17,2017-12-01,"Private, ltd by shares"34,1893314,"BARRISTER ALLIANCE LIMITED",2013-04-17,2016-12-09,"Private, ltd by shares"35,1893230,"BARROW ORGANIZATION LIMITED",2013-04-17,2016-07-29,"Private, ltd by shares"36,1893155,"Bary Power Technology Co., Limited
百瑞能源科技有限公司",2013-04-17,,"Private, ltd by shares"37,1892952,"BASAMES TRADE COMPANY LIMITED
百盛世貿易有限公司",2013-04-17,2018-12-07,"Private, ltd by shares"38,1892960,"BEAGE GLOBAL LIMITED",2013-04-17,2019-02-01,"Private, ltd by shares"39,1893016,"BEETHOVEN INFORMATION TECHNOLOGY LIMITED",2013-04-17,2016-12-09,"Private, ltd by shares"40,1892994,"BEIJING NOBEL BIOTECHNOLOGY CO., LIMITED
北京諾貝爾生物科技有限公司",2013-04-17,2016-12-09,"Private, ltd by shares"41,1893431,"BENEFIT SKY INTERNATIONAL TRADING LIMITED",2013-04-17,2015-09-18,"Private, ltd by shares"42,1893197,"BERRYDIRECT GLOBAL LIMITED",2013-04-17,2015-05-08,"Private, ltd by shares"43,1892880,"Best Choice Printing Packaging Company Limited
超卓印刷包裝有限公司",2013-04-17,2018-11-09,"Private, ltd by shares"44,1893187,"BEST DEAL (HK) FASHION CO., LIMITED
佳易(香港)時裝有限公司",2013-04-17,,"Private, ltd by shares"45,1893201,"BEZALEL INTERNATIONAL LIMITED",2013-04-17,2019-09-06,"Private, ltd by shares"46,1893356,"BHAV TECHNOLOGY CHINA LIMITED",2013-04-17,,"Private, ltd by shares"47,1893019,"BIG DIPPER GROUP CO., LIMITED
北鬥星集團有限公司",2013-04-17,2016-12-09,"Private, ltd by shares"48,1893091,"BIG HUGE (HONG KONG) LIMITED
浩鵬(香港)有限公司",2013-04-17,2016-01-29,"Private, ltd by shares"49,1892976,"BIG OCEAN ENERGY LIMITED",2013-04-17,2017-12-01,"Private, ltd by shares"50,1893217,"BLACK AND WHITE OPTO ELECTRONIC ECO COMPANY LIMITED
明淦光電節能有限公司",2013-04-17,2015-07-17,"Private, ltd by shares"51,1892781,"BLOOM HOLDING LIMITED
繁盛控股有限公司",2013-04-17,2018-04-20,"Private, ltd by shares"52,1893039,"BOLLE TECHNOLOGY LIMITED
寶力科技有限公司",2013-04-17,2019-07-05,"Private, ltd by shares"53,1893172,"Borun International Limited
柏潤國際有限公司",2013-04-17,,"Private, ltd by shares"54,1892853,"BOXDIRECT INVESTMENTS (HONG KONG) LIMITED",2013-04-17,,"Private, ltd by shares"55,1892897,"BRAZIL HEIKA BIOLOGICAL DEVELOP HOLDING LIMITED
巴西黑卡生物開發控股有限公司",2013-04-17,,"Private, ltd by shares"56,1893368,"BRIGHT SUMMIT ENTERPRISE (HONG KONG) LIMITED
光明頂企業發展(香港)有限公司",2013-04-17,2016-01-08,"Private, ltd by shares"57,1892793,"BRIGHT TIME INC. LIMITED
時輝興業有限公司",2013-04-17,,"Private, ltd by shares"58,1892775,"BRILLIANT GOAL LIMITED
優目有限公司",2013-04-17,,"Private, ltd by shares"59,1892886,"Brilliant Tech Global Limited
比力達科技有限公司",2013-04-17,,"Private, ltd by shares"60,1893346,"BRITISH ROYAL INT'L DANCE TRAINING LIMITED
英國皇佳國際舞蹈培訓有限公司",2013-04-17,,"Private, ltd by shares"61,1893074,"BST IMPORT AND EXPORT LIMITED
佰斯特進出口有限公司",2013-04-17,,"Private, ltd by shares"62,1893308,"Business Trade Agency Co Limited
生意轉讓業務代理(仲介)有限公司",2013-04-17,2016-01-08,"Private, ltd by shares"63,1892887,"BUYBESTPRINT LIMITED
百佳印有限公司",2013-04-17,2019-09-27,"Private, ltd by shares"64,1892936,"C &amp; A DIGITAL TECHNOLOGY LIMITED
錦銳(香港)數碼科技有限公司",2013-04-17,2017-11-03,"Private, ltd by shares"65,1892966,"C&amp;M LIVING INDUSTRY LIMITED
超美家居實業有限公司",2013-04-17,2019-02-01,"Private, ltd by shares"66,1893411,"Canterbury International Investments HK Limited",2013-04-17,2015-10-30,"Private, ltd by shares"67,1892856,"Cape Horn Logistics and Shipping Services (HK) Limited",2013-04-17,2016-12-09,"Private, ltd by shares"68,1892808,"CAPITAL ENGINEERING LIMITED (HK)
滙都工程有限公司",2013-04-17,,"Private, ltd by shares"69,1893203,"CARISMA COMPANY LIMITED",2013-04-17,2018-07-06,"Private, ltd by shares"70,1893092,"CarLoft China Limited",2013-04-17,2020-10-30,"Private, ltd by shares"71,1893223,"CARLTON STAR TRADING LIMITED",2013-04-17,,"Private, ltd by shares"72,1893285,"Carpag International Limited",2013-04-17,,"Private, ltd by shares"73,1893359,"CATHAI TAO IMPORTS LIMITED",2013-04-17,2016-12-09,"Private, ltd by shares"74,1893286,"CATILON DECORATION CO., LIMITED
卡天龍飾品有限公司",2013-04-17,,"Private, ltd by shares"75,1893149,"Centerlab Investment Holding Limited",2013-04-17,,"Private, ltd by shares"76,1892794,"CHAMPION (CHINA) LIMITED (d2017-06-30)
萬豪(中國)有限公司",2013-04-17,2017-06-30,"Private, ltd by shares"77,1893240,"CHANG YING SHIPPING LIMITED
長盈船務有限公司",2013-04-17,,"Private, ltd by shares"78,1892885,"Chemkey H.Q. Group Limited
宏麒集團有限公司",2013-04-17,2018-10-05,"Private, ltd by shares"79,1892844,"CHENZHOU TOP GRAPHITE COMPANY LIMITED
郴州拓普石墨有限公司",2013-04-17,2016-12-09,"Private, ltd by shares"80,1893188,"CHEUK SHING TRANSPORTATION LIMITED
卓誠運輸有限公司",2013-04-17,,"Private, ltd by shares"81,1892906,"CHINA AGRICULTURE AND COMMERCE NETWORK LIMITED
中國農商網有限公司",2013-04-17,2016-09-23,"Private, ltd by shares"82,1893341,"CHINA BO &amp; BUSINESS LAW SERVICES LIMITED
中國博商法律服務有限公司",2013-04-17,2018-10-05,"Private, ltd by shares"83,1893145,"CHINA CHUANTONG CULTURE PROMOTION ASSOCIATION LIMITED
中華傳統文化促進會有限公司",2013-04-17,2019-02-01,"Private, ltd by shares"84,1893022,"CHINA FOREVER INVESTMENT DEVELOPMENT GROUP LIMITED
中國卓永投資股份發展集團有限公司",2013-04-17,,"Private, ltd by shares"85,1893258,"China Garment Texworld Co., Limited
中服(香港)有限公司",2013-04-17,2017-12-01,"Private, ltd by shares"86,1893388,"CHINA HEALTH PROMOTION NEWSPAPER LIMITED
中國健康促進報刊有限公司",2013-04-17,2017-12-01,"Private, ltd by shares"87,1893162,"CHINA IMPEX LIMITED
中華外貿有限公司",2013-04-17,,"Private, ltd by shares"88,1893335,"CHINA INTERNATIONAL RADIO TV EDUCATION INVESTMENT LIMITED
中國國際廣播電視教育投資有限公司",2013-04-17,,"Private, ltd by shares"89,1893083,"CHINA NINGBO TRACTOR GROUP LIMITED
中國寧波拖拉機集團有限公司",2013-04-17,2016-12-09,"Private, ltd by shares"90,1893384,"CHINA PACIFIC OCEAN CONSTRUCT GROUP CO., LIMITED
中國太平洋建設集團有限公司",2013-04-17,2019-02-01,"Private, ltd by shares"91,1893033,"CHINA RESEARCH INSTITUTE OF ARTS AND HUMANITIES LIMITED
中國人文藝術研究院有限公司",2013-04-17,2019-02-08,"Private, ltd by shares"92,1893272,"China Spirit Limited (HK)",2013-04-17,,"Private, ltd by shares"93,1892988,"China Thousands Charming International Company Limited
中國千易國際有限公司",2013-04-17,,"Private, ltd by shares"94,1893248,"China Western Resources &amp; Investments Limited
中國西部資源投資有限公司",2013-04-17,,"Private, ltd by shares"95,1893014,"CHOPIN TECHNOLOGY CO., LIMITED
肖邦科技有限公司",2013-04-17,,"Private, ltd by shares"96,1892845,"CHUANG HE YING INDUSTRIAL CO., LIMITED
創和盈實業有限公司",2013-04-17,,"Private, ltd by shares"97,1892821,"CITY-HOUSE PROPERTY LIMITED
港城物業代理有限公司",2013-04-17,,"Private, ltd by shares"98,1893211,"CL GOLD LIMITED
翠綠金號有限公司",2013-04-17,2015-12-04,"Private, ltd by shares"99,1892968,"CL KKUM Company Limited",2013-04-17,2015-08-14,"Private, ltd by shares"100,1892784,"Clavrix Pvt Limited",2013-04-17,2017-12-01,"Private, ltd by shares"101,1893387,"ClickBuyTouch Limited",2013-04-17,,"Private, ltd by shares"102,1892832,"CN &amp; CN INTERNATIONAL INVESTMENT CO., LIMITED
誠恩國際投資有限公司",2013-04-17,2020-04-09,"Private, ltd by shares"103,1892836,"Comestri Hong Kong Limited",2013-04-17,,"Private, ltd by shares"104,1893363,"COMMERCIAL LEADER GROUP (HONG KONG) LIMITED
商業統領集團(香港)有限公司",2013-04-17,2015-11-06,"Private, ltd by shares"105,1893369,"Company Registration Number 1893369 Limited
公司註冊編號 1893369 有限公司",2013-04-17,,"Private, ltd by shares"106,1893168,"COMPRELO EN CHINA LIMITED",2013-04-17,,"Private, ltd by shares"107,1892835,"CONCEPT ONE LOGISTICS COMPANY LIMITED
雋發物流有限公司",2013-04-17,2014-10-31,"Private, ltd by shares"108,1893261,"CONMANY GARMENTS (HONGKONG) CO., LIMITED
珂曼尼服飾(香港)有限公司",2013-04-17,2019-02-01,"Private, ltd by shares"109,1893251,"Cook In (China) Limited
烹飪文化 (中國) 有限公司",2013-04-17,2015-10-02,"Private, ltd by shares"110,1893276,"CTM Overseas Education Centre Limited",2013-04-17,,"Private, ltd by shares"111,1893473,"D.R. Global International import-export HK Co., Limited",2013-04-17,,"Private, ltd by shares"112,1893078,"DA XIN INTERNATIONAL TRADE CO., LIMITED
達鑫國際貿易有限公司",2013-04-17,2017-04-21,"Private, ltd by shares"113,1893268,"DARK SAMURAI FINANCIAL GROUP LIMITED
黑武士金融集團有限公司",2013-04-17,2016-12-09,"Private, ltd by shares"114,1893337,"DASINA INTERNATIONAL CO., LIMITED
德爾信(國際)有限公司",2013-04-17,,"Private, ltd by shares"115,1893035,"DCH (HK) ENTERPRISE CO., LIMITED
德誠行(香港)有限公司",2013-04-17,,"Private, ltd by shares"116,1893243,"DE KING TECHNOLOGY (HK) LIMITED
凱德科技(香港)有限公司",2013-04-17,,"Private, ltd by shares"117,1892792,"DE-XMAS LIGHTING LIMITED
德邁斯燈飾貿易有限公司",2013-04-17,,"Private, ltd by shares"118,1893241,"DECENCY HOLDINGS LIMITED
德聖控股有限公司",2013-04-17,,"Private, ltd by shares"119,1892934,"DECENT INTERNATIONAL COMPANY LIMITED
鼎夏國際有限公司",2013-04-17,,"Private, ltd by shares"120,1893292,"DESCHAMPS INTERNATIONAL INDUSTRIAL LIMITED
德尚國際實業有限公司",2013-04-17,,"Private, ltd by shares"121,1893213,"DESCO OVERSEAS (HK) LIMITED",2013-04-17,,"Private, ltd by shares"122,1893270,"DEVELLAR LIMITED",2013-04-17,2014-05-23,"Private, ltd by shares"123,1893460,"DFZZ JEWELLERY (HK) CO., LIMITED
香港東方鉆族珠寶有限公司",2013-04-17,,"Private, ltd by shares"124,1893159,"Digital District HK Limited",2013-04-17,2018-12-28,"Private, ltd by shares"125,1892859,"DING MAO COMMERCIAL MANAGEMENT LIMITED
鼎茂商務管理有限公司",2013-04-17,2020-01-10,"Private, ltd by shares"126,1893222,"DIRECT MARINE PRINTING SUPPLY LIMITED",2013-04-17,,"Private, ltd by shares"127,1893052,"Display Tent Co., Limited
迪斯雷帳篷有限公司",2013-04-17,,"Private, ltd by shares"128,1893069,"DONG JIANG INTERNATIONAL TRADING LIMITED
東江國際貿易有限公司",2013-04-17,2016-12-09,"Private, ltd by shares"129,1893038,"Dongguan Pure-Air Tech Co., Limited
東莞執信環保科技有限公司",2013-04-17,,"Private, ltd by shares"130,1893135,"DOXEN TRADING LIMITED
東星商貿有限公司",2013-04-17,2017-12-15,"Private, ltd by shares"131,1892791,"DRAGON WAY (CHINA) LIMITED
冠龍(中國)有限公司",2013-04-17,2018-09-14,"Private, ltd by shares"132,1893405,"Dream Giant Project Inc Limited",2013-04-17,,"Private, ltd by shares"133,1893067,"DUO COURT OF HONGKONG LEATHER TRADE CO., LIMITED
香港朵閣皮具貿易有限公司",2013-04-17,2016-12-09,"Private, ltd by shares"134,1893157,"Dwltech Holding Group Limited",2013-04-17,2018-10-05,"Private, ltd by shares"135,1893283,"EASTCHINA TROPHY INTERNATIONAL MOTORS LIMITED
東華創富國際汽車有限公司",2013-04-17,,"Private, ltd by shares"136,1893296,"EASTERN X-SUM TRADING LIMITED",2013-04-17,,"Private, ltd by shares"137,1893299,"EBIC STATIONERY LIMITED",2013-04-17,,"Private, ltd by shares"138,1893290,"ELITE MACHINERY &amp; EQUIPMENT (HONGKONG) CO., LIMITED",2013-04-17,,"Private, ltd by shares"139,1892788,"Elites Trading Limited
易士達貿易有限公司",2013-04-17,,"Private, ltd by shares"140,1893421,"ELRAYA CO., LIMITED",2013-04-17,2018-12-28,"Private, ltd by shares"141,1893095,"ENERGETIC ZINC (HK) CO., LIMITED
卓鑫(香港)貿易有限公司",2013-04-17,2019-11-08,"Private, ltd by shares"142,1893477,"engageSPARK Limited",2013-04-17,,"Private, ltd by shares"143,1893102,"ENGLAND ROYAL GROUP (CHINA) CO., LIMITED
英國皇家集團(中國)有限公司",2013-04-17,2016-12-09,"Private, ltd by shares"144,1893002,"ERNST &amp; YOUNG AKT INVESTMENTS LIMITED",2013-04-17,,"Private, ltd by shares"145,1893350,"Euro Polymers Limited",2013-04-17,,"Private, ltd by shares"146,1893465,"Eurotrade Global International Limited",2013-04-17,2020-09-30,"Private, ltd by shares"147,1892957,"EVER RISE ENTERPRISES LIMITED
恒晟企業有限公司",2013-04-17,2019-02-01,"Private, ltd by shares"148,1893361,"EverLast Sourcing Co., Limited",2013-04-17,2020-04-03,"Private, ltd by shares"149,1892997,"EVI HONG KONG LIMITED",2013-04-17,2020-01-10,"Private, ltd by shares"150,1893340,"FANCY IMPEX (HK) LIMITED",2013-04-17,,"Private, ltd by shares"151,1892785,"Far East Tagesbau Synergy Limited",2013-04-17,2017-12-01,"Private, ltd by shares"152,1892870,"FARM66 INVESTMENT LIMITED
綠芝園投資有限公司",2013-04-17,,"Private, ltd by shares"153,1892996,"FARNCE HAITOR MINING LIMITED
法國海塔爾礦業有限公司",2013-04-17,,"Private, ltd by shares"154,1892872,"FASHION BEAUTY HONG INTERNATIONAL TRADING CO., LIMITED
尚麗行國際貿易有限公司",2013-04-17,2015-12-04,"Private, ltd by shares"155,1893020,"FAVORA GROUP CO., LIMITED
福潤多集團有限公司",2013-04-17,2017-12-15,"Private, ltd by shares"156,1893330,"FEEDBACK MANUFACTURING CO., LIMITED
深圳市龍珊科技有限公司",2013-04-17,,"Private, ltd by shares"157,1892774,"FEI Home Appliance Electronics Limited",2013-04-17,,"Private, ltd by shares"158,1893376,"FENG YUAN TRADING INTERNATIONAL LIMITED
豐源貿易國際有限公司",2013-04-17,,"Private, ltd by shares"159,1893170,"FINIMA INNOVATIONS COMPANY LIMITED",2013-04-17,,"Private, ltd by shares"160,1892909,"Firestone (Hong Kong) Investment Co., Limited
火石(香港)投資有限公司",2013-04-17,2017-12-01,"Private, ltd by shares"161,1893125,"FIRMA LIMITED (HK)",2013-04-17,2017-12-01,"Private, ltd by shares"162,1893031,"FIRST PIONEER CONSULTANTS LIMITED
第一先鋒顧問有限公司",2013-04-17,,"Private, ltd by shares"163,1892811,"FIRST TARGET (ASIA) LIMITED
輝泰(亞洲)有限公司",2013-04-17,2019-02-01,"Private, ltd by shares"164,1893355,"FLYING GROUP (HK) LIMITED (d2019-02-01)
飛揚集團(香港)有限公司",2013-04-17,2019-02-01,"Private, ltd by shares"165,1893215,"FOHONG COMMUNICATION (HK) CO., LIMITED
科宏通信(香港)有限公司",2013-04-17,2018-08-31,"Private, ltd by shares"166,1893247,"Foreview Technology (HK) Co., Limited
中安視信(香港)科技有限公司",2013-04-17,,"Private, ltd by shares"167,1892875,"Fortuna Consulting Limited (HK)",2013-04-17,,"Private, ltd by shares"168,1893327,"FOSHAN GUDE FURNITURE CO., LIMITED (d2016-12-09)
佛山市顧德家具有限公司",2013-04-17,2016-12-09,"Private, ltd by shares"169,1892884,"FRANCE ATTRACT POWER INTERNATIONAL TEXTILE FASHION LIMITED
法國萬有引力國際針織服飾有限公司",2013-04-17,2018-11-30,"Private, ltd by shares"170,1893166,"FRANCE MAYSWAN INTERNATIONAL ORGANISMS TECHNOLOGY LIMITED
法國美萱國際生物科技有限公司",2013-04-17,2017-03-24,"Private, ltd by shares"171,1893026,"France woodpecker Leather Limited
法國啄木鳥皮具有限公司",2013-04-17,2016-12-09,"Private, ltd by shares"172,1892940,"FRANCE YAXIN INTERNATIONAL COSMETICS GROUP CO., LIMITED
法國雅欣國際化妝品集團有限公司",2013-04-17,2018-08-31,"Private, ltd by shares"173,1892878,"FRIENDSHIP TRADING IMPORT &amp; EXPORT CO., LIMITED
友誼商貿進出口有限公司",2013-04-17,,"Private, ltd by shares"174,1893233,"Frontier Camp Solutions Limited
開拓營地系統有限公司",2013-04-17,,"Private, ltd by shares"175,1892782,"FU-ONE INTERNATIONAL CO., LIMITED
復煌國際有限公司",2013-04-17,2017-12-08,"Private, ltd by shares"176,1893179,"FULL COLOUR TRADING INTERNATIONAL LIMITED
花華貿易國際有限公司",2013-04-17,,"Private, ltd by shares"177,1893440,"FULLY WIN INVESTMENT GROUP HOLDINGS LIMITED
富利投資集團股份有限公司",2013-04-17,,"Private, ltd by shares"178,1893323,"FUNG YUN INTERNATIONAL LIMITED
香港豐源國際有限公司",2013-04-17,2018-11-16,"Private, ltd by shares"179,1892980,"Future Spring Trading Company Limited
四海通力貿易股份有限公司",2013-04-17,2015-10-30,"Private, ltd by shares"180,1892979,"FUZHOU BENA POWER CO., LIMITED
福州百納機電有限公司",2013-04-17,,"Private, ltd by shares"181,1893432,"G-matrix Hong Kong Limited
智網香港有限公司",2013-04-17,,"Private, ltd by shares"182,1892773,"GABY HOLDINGS LIMITED",2013-04-17,,"Private, ltd by shares"183,1893474,"GAIL TURNER PHOTOGRAPHY LIMITED",2013-04-17,2016-12-30,"Private, ltd by shares"184,1893235,"GARAGE SEVEN DESIGN LIMITED",2013-04-17,,"Private, ltd by shares"185,1893150,"GAUDI TECHNOLOGY LIMITED
歌迪科技有限公司",2013-04-17,2020-01-10,"Private, ltd by shares"186,1892795,"GENERAL INC LIMITED (d2014-10-03)
將軍有限公司",2013-04-17,2014-10-03,"Private, ltd by shares"187,1893289,"GERMANY WST GROUP CO., LIMITED
德國威斯特集團有限公司",2013-04-17,2019-12-06,"Private, ltd by shares"188,1893453,"Gironde Capital Limited",2013-04-17,2016-12-09,"Private, ltd by shares"189,1893464,"GLO MED GROUP LIMITED",2013-04-17,2017-03-17,"Private, ltd by shares"190,1893392,"GLOBAL ADVISORY BOARD (HK) PEER GROUP MEETINGS LIMITED
全球私人董事會(香港)圓桌會議有限公司",2013-04-17,,"Private, ltd by shares"191,1893415,"GLOBAL CARE GROUP LIMITED (HK)",2013-04-17,,"Private, ltd by shares"192,1893461,"GLOBAL FLAGS HK LIMITED
旗威建築(香港)有限公司",2013-04-17,2016-12-09,"Private, ltd by shares"193,1893049,"GLOBAL PURCHASING CENTER (HONG KONG) LIMITED
全球商品採購中心(香港)有限公司",2013-04-17,2018-07-06,"Private, ltd by shares"194,1892929,"GLOBEMAN LIMITED",2013-04-17,2018-12-28,"Private, ltd by shares"195,1893144,"Glorytek Corporation Limited
格瑞泰有限公司",2013-04-17,,"Private, ltd by shares"196,1893479,"Go Solutions Company Limited
啟動資訊科技有限公司",2013-04-17,,"Private, ltd by shares"197,1893141,"Go4Fiber China Limited
高科光纖中國有限公司",2013-04-17,,"Private, ltd by shares"198,1892879,"GOLD FAI ELECTRICAL ENGINEERING LIMITED
金輝電器工程有限公司",2013-04-17,,"Private, ltd by shares"199,1893352,"GOLD NINE IMPORT &amp; EXPORT LIMITED
金玖進出口有限公司",2013-04-17,2015-07-31,"Private, ltd by shares"200,1893165,"Gold Rich Property Agency Company Limited
金富物業代理有限公司",2013-04-17,,"Private, ltd by shares"201,1892823,"GOLDEN ART FOREVER LIMITED
金藝瑞禾有限公司",2013-04-17,,"Private, ltd by shares"202,1892817,"GOLDEN GLOBE TRADING LIMITED (d2014-06-20)
金環球貿易有限公司",2013-04-17,2014-06-20,"Private, ltd by shares"203,1893250,"Golden Way Heavy Industry Hong Kong Limited
金威重工香港有限公司",2013-04-17,2020-01-31,"Private, ltd by shares"204,1893354,"Golden Wing Development Limited",2013-04-17,,"Private, ltd by shares"205,1893459,"GOLDSUN LACE CO., LIMITED
金太陽蕾絲有限公司",2013-04-17,2016-12-09,"Private, ltd by shares"206,1893003,"Gongye - Balu Limited",2013-04-17,,"Private, ltd by shares"207,1892871,"GOOD GOAL LIMITED",2013-04-17,,"Private, ltd by shares"208,1893015,"GOODVEG AGRICULTURE GROUP COMPANY LIMITED
高域農業集團有限公司",2013-04-17,2016-12-09,"Private, ltd by shares"209,1892779,"GRACE HEALTH MANAGEMENT INTERNATIONAL HOLDINGS LIMITED
天慈國際健康管理集團有限公司",2013-04-17,2020-01-10,"Private, ltd by shares"210,1893118,"GRAND PROSPERITY SHIPPING LIMITED
欣盛船務有限公司",2013-04-17,,"Private, ltd by shares"211,1892840,"GRANDE INDUSTRIAL LIMITED
香港高德實業有限公司",2013-04-17,,"Private, ltd by shares"212,1893378,"GREAT HONESTY TECHNOLOGY CO., LIMITED",2013-04-17,2017-06-16,"Private, ltd by shares"213,1893458,"GREENLAND ENVIRONMENTAL LIMITED (HK)
綠原環保有限公司",2013-04-17,,"Private, ltd by shares"214,1892896,"GREENWAY TRADING HK CO., LIMITED",2013-04-17,2017-12-01,"Private, ltd by shares"215,1893121,"GUANGDONG FOSHAN HONGCHENG CERAMICS LIMITED
廣東佛山鴻程陶瓷有限公司",2013-04-17,,"Private, ltd by shares"216,1892925,"GUANGDONG FOSHAN JIAXING MINGTAO CERAMICS CO., LIMITED
廣東佛山嘉馨明陶陶瓷有限公司",2013-04-17,2019-02-01,"Private, ltd by shares"217,1893050,"GUANGZHOU (ZHUANGCHEN) ANQI ARTICLES OF EVERYDAY USE CO., LIMITED
廣州(莊臣)安琪日用品有限公司",2013-04-17,,"Private, ltd by shares"218,1893076,"GUANGZHOU DCH TRADING LIMITED
廣州帝暢貿易有限公司",2013-04-17,,"Private, ltd by shares"219,1893089,"GUANGZHOU HONGGUAN TOOLS LIMITED
廣州宏觀工具有限公司",2013-04-17,,"Private, ltd by shares"220,1893478,"GUANGZHOU LONGXIN LEATHER CO., LIMITED
廣州市隆鑫皮具有限公司",2013-04-17,2016-12-09,"Private, ltd by shares"221,1892973,"Gui Source International Group Co., Limited
桂源國際集團有限公司",2013-04-17,,"Private, ltd by shares"222,1893060,"GUIZHOU MIAOZU PHARMACEUTICAL CO., LIMITED (d2016-12-09)
貴州苗族藥業有限公司",2013-04-17,2016-12-09,"Private, ltd by shares"223,1893383,"H L GLOBAL CO., LIMITED
海藍環球有限公司",2013-04-17,,"Private, ltd by shares"224,1893271,"H&amp;S Capital Limited",2013-04-17,,"Private, ltd by shares"225,1893156,"HAD LIMITED
中國海德教育集團有限公司",2013-04-17,2016-12-09,"Private, ltd by shares"226,1892858,"HAIDA CONTAINER (HONGKONG) CO., LIMITED
海達貨櫃(香港)有限公司",2013-04-17,2017-11-24,"Private, ltd by shares"227,1893302,"HAINA IMP &amp; EXP TRADING LIMITED
海納進出口貿易有限公司",2013-04-17,,"Private, ltd by shares"228,1893328,"HAIYUANBO MARINE SUPPLY CO., LIMITED
海源泊船舶物資供應有限公司",2013-04-17,2016-12-09,"Private, ltd by shares"229,1892910,"HALLO (HK) INTERNATIONAL INDUSTRY &amp; TRADE CO., LIMITED
香港哈羅國際工貿有限公司",2013-04-17,2015-10-09,"Private, ltd by shares"230,1892890,"HAO XING INTERNATIONAL BUSINESS PREMISES CO., LIMITED
豪興國際事務所有限公司",2013-04-17,,"Private, ltd by shares"231,1892920,"Health Botanical Corporation Limited",2013-04-17,2019-02-01,"Private, ltd by shares"232,1893399,"HEBEI RICON WIRE MESH LIMITED",2013-04-17,2020-09-30,"Private, ltd by shares"233,1893161,"HEGUAN TECHNOLOGY (HK) LIMITED
和冠科技(香港)有限公司",2013-04-17,2016-12-09,"Private, ltd by shares"