,Reg no.,Name,Incorp-orated,Dissolved,Type672,1892981,"XUNDATONG INTERNATIONAL TRADING LIMITED
迅達通國際貿易有限公司",2013-04-17,2019-02-01,"Private, ltd by shares"673,1892857,"XUNER ELECTRONIC TECHNOLOGY (HK) LIMITED
訊爾電子科技(香港)有限公司",2013-04-17,2017-12-01,"Private, ltd by shares"674,1892824,"Xunteng International Trading Co., Limited
訊騰國際貿易有限公司",2013-04-17,,"Private, ltd by shares"675,1893011,"YA XIN ELECTRONICS LIMITED
雅馨電子有限公司",2013-04-17,2016-12-09,"Private, ltd by shares"676,1892975,"YAOFENG TECHNOLOGY (HK) LIMITED
堯峰科技(香港)有限公司",2013-04-17,,"Private, ltd by shares"677,1893063,"YC MACHINERY CO., LIMITED",2013-04-17,,"Private, ltd by shares"678,1893047,"YESEL GIFTS MANUFACTURING LIMITED
越上禮品製造有限公司",2013-04-17,,"Private, ltd by shares"679,1893305,"YHK-TRADING LIMITED",2013-04-17,2019-02-01,"Private, ltd by shares"680,1893265,"Yibida Hong Kong Industrial Co., Limited
藝必達香港貿易有限公司",2013-04-17,,"Private, ltd by shares"681,1893320,"YIBU HUIHUANG STAIRS CO., LIMITED
藝步輝煌樓梯有限公司",2013-04-17,2016-12-09,"Private, ltd by shares"682,1893021,"YICHENGXINGYE (HK) INDUSTRIAL CO., LIMITED
毅成興業(香港)實業有限公司",2013-04-17,2019-02-01,"Private, ltd by shares"683,1893244,"YiLong International Holdings Limited
億隆國際控股有限公司",2013-04-17,,"Private, ltd by shares"684,1892839,"YINXIANG INTERNATIONAL SHARES LIMITED
銀祥國際股份有限公司",2013-04-17,,"Private, ltd by shares"685,1893371,"YIRAN ELECTRIC TOOLS CO., LIMITED
宜然電子工具有限公司",2013-04-17,,"Private, ltd by shares"686,1893129,"YIWU FORTUNE IMPORT &amp; EXPORT TRADING CO., LIMITED",2013-04-17,2019-02-01,"Private, ltd by shares"687,1892850,"YIWU JOY IMPORT &amp; EXPORT CO., LIMITED
義烏市喜悦進出口有限公司",2013-04-17,2018-09-21,"Private, ltd by shares"688,1893366,"YIWU PINGAN TRADE LIMITED
義烏平安貿易有限公司",2013-04-17,2016-12-09,"Private, ltd by shares"689,1893068,"YMS (HK) TRADING LIMITED
優邁斯(香港)商貿有限公司",2013-04-17,2017-12-01,"Private, ltd by shares"690,1893199,"YOHAI GROUP (CHINA) INCORPORATED LIMITED
粵海集團(中國)股份有限公司",2013-04-17,2016-12-09,"Private, ltd by shares"691,1893099,"YONGLONG INTERNATIONAL (GROUP) LIMITED
永隆國際集團(控股)有限公司",2013-04-17,2016-12-09,"Private, ltd by shares"692,1893390,"YOUBON TECHNOLOGY LIMITED
優邦科技有限公司",2013-04-17,2017-08-04,"Private, ltd by shares"693,1893288,"Yours Trading (HK) Limited",2013-04-17,,"Private, ltd by shares"694,1893339,"YUAN FUND LIMITED
昱安基金有限公司",2013-04-17,2018-09-14,"Private, ltd by shares"695,1893077,"YUNHAITIAN GROUP LIMITED
雲海天集團有限公司",2013-04-17,2020-01-10,"Private, ltd by shares"696,1892991,"Yuzhe Commerce And Trade Limited
煜喆商貿有限公司",2013-04-17,,"Private, ltd by shares"697,1893418,"ZETA INDUSTRY CORPORATION LIMITED
澤泰實業有限公司",2013-04-17,,"Private, ltd by shares"698,1893252,"ZH INVERSIONES ORIENTALES LIMITED",2013-04-17,2019-02-01,"Private, ltd by shares"699,1893147,"ZHEJIANG CHANGYU TRADING CO., LIMITED
浙江昌裕貿易有限公司",2013-04-17,,"Private, ltd by shares"700,1892869,"ZHENDONG FURNITURE ACCESSORY CO., LIMITED
振東傢俱配件有限公司",2013-04-17,,"Private, ltd by shares"701,1893329,"ZHONG SUI INTERNATIONAL LIMITED
中穗國際有限公司",2013-04-17,2015-10-16,"Private, ltd by shares"702,1892826,"ZHONGLIANJIA FURNITURE CO., LIMITED
深圳市中聯佳傢具有限公司",2013-04-17,,"Private, ltd by shares"703,1892985,"ZHONGSHAN CITY SHUOYU LIGHTING CO., LIMITED
中山市爍宇照明有限公司",2013-04-17,2016-12-09,"Private, ltd by shares"704,1893407,"ZHU RIGHT VEGETABLE WHOLESALE CO. LIMITED
竺權菜業總批發有限公司",2013-04-17,,"Private, ltd by shares"705,1893037,"ZHUHAI (HONGKONG) INDUSTRY LIMITED
祝海(香港)實業有限公司",2013-04-17,2019-02-01,"Private, ltd by shares"706,1893416,"ZHUOYU (HONG KONG) INTERNATIONAL CO., LIMITED
卓禹(香港)國際貿易有限公司",2013-04-17,,"Private, ltd by shares"707,1893072,"Zola Innovation Co., Limited",2013-04-17,,"Private, ltd by shares"708,1893056,"ZONGLOW TRADING LIMITED
宗羅貿易有限公司",2013-04-17,2016-12-09,"Private, ltd by shares"709,1893364,"Zuccia Limited",2013-04-17,2019-09-06,"Private, ltd by shares"