,Reg no.,Name,Incorp-orated,Dissolved,Type440,1892895,"Minsheng Jiaxuan Leasing Limited
民生嘉軒租賃有限公司",2013-04-17,,"Private, ltd by shares"441,1892783,"Minsheng Jiayi Leasing Limited
民生嘉義租賃有限公司",2013-04-17,,"Private, ltd by shares"442,1893365,"Missky Crystal Arts&amp;Gifts CO., Limited
思琪水晶工藝禮品有限公司",2013-04-17,2019-02-01,"Private, ltd by shares"443,1892972,"MITI INTERNATIONAL TRADING LIMITED
美特國際貿易有限公司",2013-04-17,2017-12-01,"Private, ltd by shares"444,1893195,"MORGAN OIL FILM BEARING COMPANY LIMITED
摩根油膜軸承有限公司",2013-04-17,2019-12-27,"Private, ltd by shares"445,1893317,"Msss Diamond (HK) Management Limited
香港蜜司夢緹管理有限公司",2013-04-17,,"Private, ltd by shares"446,1893343,"Nadi Leaf Consult Limited
納迪葉顧問有限公司",2013-04-17,,"Private, ltd by shares"447,1893338,"NANCHANG WEALTHY COTTON KNITTING CLOTHING CO., LIMITED
南昌威爾斯服裝制衣有限公司",2013-04-17,2016-12-09,"Private, ltd by shares"448,1893331,"NANJING COLORMAX TECHNOLOGY CO., LIMITED",2013-04-17,,"Private, ltd by shares"449,1893171,"NEED SOURCING LIMITED",2013-04-17,2017-12-01,"Private, ltd by shares"450,1892798,"NEW CHAMPION ELECTRONICS LIMITED
新冠電子有限公司",2013-04-17,2017-12-01,"Private, ltd by shares"451,1893017,"NEW HOP SHING ENGINEERING LIMITED
新合成工程有限公司",2013-04-17,,"Private, ltd by shares"452,1893435,"NEW LIFE M.C.A. LIMITED",2013-04-17,2019-12-06,"Private, ltd by shares"453,1892978,"NEW VISION SERVICES LIMITED",2013-04-17,,"Private, ltd by shares"454,1892982,"New Way Experience Association Limited
新路歷程協會有限公司",2013-04-17,2020-05-22,"Ltd by guarantee"455,1893275,"Nextage Hong Kong Limited",2013-04-17,,"Private, ltd by shares"456,1893424,"Nha Trang Catering Service Limited
芽莊餐飲管理有限公司",2013-04-17,,"Private, ltd by shares"457,1893025,"NICH INTERNATIONAL INVESTMENT GROUP LIMITED
耐馳國際投資集團有限公司",2013-04-17,2016-12-09,"Private, ltd by shares"458,1893181,"Niko Concept (Hong Kong) Group Co., Limited
尼可概念(香港)集團有限公司",2013-04-17,,"Private, ltd by shares"459,1893164,"Ningbo Freedom International Trading Company Limited
寧波孚潤國際貿易有限公司",2013-04-17,,"Private, ltd by shares"460,1892865,"Noble Investment Consultancy Limited
樂寶投資顧問有限公司",2013-04-17,2016-03-04,"Private, ltd by shares"461,1893226,"NORDHILL SALES LIMITED",2013-04-17,2018-12-28,"Private, ltd by shares"462,1893163,"North Point Consulting Limited",2013-04-17,,"Private, ltd by shares"463,1893463,"Northpoint Corporation Limited",2013-04-17,2020-10-09,"Private, ltd by shares"464,1893414,"NOVA (CHINA) LIMITED
諾威(中國)有限公司",2013-04-17,,"Private, ltd by shares"465,1892816,"OCEAN Fortune Logistics Co., Limited
通富物流有限公司",2013-04-17,,"Private, ltd by shares"466,1892864,"OCEANIC IMPORT &amp; EXPORT CO., LIMITED",2013-04-17,2017-03-31,"Private, ltd by shares"467,1893315,"OGIS LIMITED",2013-04-17,2018-12-28,"Private, ltd by shares"468,1892944,"Oktech Holding Co., Limited
歐科控股有限公司",2013-04-17,2016-12-09,"Private, ltd by shares"469,1893111,"OLAN TRADING LIMITED
歐蘭貿易有限公司",2013-04-17,,"Private, ltd by shares"470,1893087,"One Add One (H.K.) Limited",2013-04-17,2019-06-06,"Private, ltd by shares"471,1893260,"ONLINE EDUCATION SERVICES LIMITED (d2015-10-30)",2013-04-17,2015-10-30,"Private, ltd by shares"472,1892848,"ONLY ONE INTERNATIONAL GROUP LIMITED
歐尼國際集團有限公司",2013-04-17,,"Private, ltd by shares"473,1892803,"ORIENTAL ELECTRONICS LIMITED
東成電子有限公司",2013-04-17,2016-10-14,"Private, ltd by shares"474,1893043,"Orix Import &amp; Export Co., Limited",2013-04-17,2018-11-09,"Private, ltd by shares"475,1893081,"Over-asia Total Services Co., Limited
聯亞通(香港)國際物流有限公司",2013-04-17,2019-02-01,"Private, ltd by shares"476,1892819,"OVERSEAS INTERNATIONAL CAPITAL LIMITED
海外國際資本有限公司",2013-04-17,,"Private, ltd by shares"477,1893208,"PACIFIC CONCEPTS LIMITED
百念有限公司",2013-04-17,2016-11-11,"Private, ltd by shares"478,1892805,"PANAVIEW TECHNOLOGY LIMITED
宏美技術有限公司",2013-04-17,,"Private, ltd by shares"479,1893357,"PANCY FASHION CO., LIMITED",2013-04-17,,"Private, ltd by shares"480,1893295,"PATTI ASIA PACIFIC LIMITED
柏迪亞太有限公司",2013-04-17,2016-09-09,"Private, ltd by shares"481,1892984,"Pengli International Limited",2013-04-17,2016-12-09,"Private, ltd by shares"482,1893480,"Perfectly Worded Limited
言繹有限公司",2013-04-17,2019-02-01,"Private, ltd by shares"483,1893082,"PETRODELTA CO., LIMITED",2013-04-17,2016-12-09,"Private, ltd by shares"484,1893097,"PHAETON TIANCHENG INDUSTRIAL COMPANY LIMITED
輝騰天成實業有限公司",2013-04-17,,"Private, ltd by shares"485,1893449,"Phee Sua Co., Limited
妃蘇股份有限公司",2013-04-17,2019-02-01,"Private, ltd by shares"486,1893192,"PIN FUNG LIMITED
品風有限公司",2013-04-17,2014-10-17,"Private, ltd by shares"487,1893064,"PINK DUCK LIMITED (d2014-04-25)",2013-04-17,2014-04-25,"Private, ltd by shares"488,1892854,"PLAY HOUSE MANAGEMENT SERVICES LIMITED",2013-04-17,,"Private, ltd by shares"489,1892789,"POLARIS NETWORKS LIMITED (HK)",2013-04-17,2017-12-01,"Private, ltd by shares"490,1893237,"PolyStar Chemicals Limited
保利星化工有限公司",2013-04-17,2019-02-01,"Private, ltd by shares"491,1892919,"PRISUN INTERNATIONAL LIMITED",2013-04-17,,"Private, ltd by shares"492,1892849,"Project 20 International Holdings Limited",2013-04-17,,"Private, ltd by shares"493,1893381,"PROMODENT LIMITED",2013-04-17,,"Private, ltd by shares"494,1893132,"PROSPERITY TECHNOLOGY CO., LIMITED
中興盛科技有限公司",2013-04-17,,"Private, ltd by shares"495,1892814,"Prostar Technology Limited
鑫睿電子科技有限公司",2013-04-17,,"Private, ltd by shares"496,1892993,"Provending Machine Co., Limited",2013-04-17,,"Private, ltd by shares"497,1893079,"PUCHEN LIMITED
香港普宸科技有限公司",2013-04-17,,"Private, ltd by shares"498,1893408,"PUZZLE ONLINE SOLVER LIMITED (THE)",2013-04-17,2016-05-13,"Private, ltd by shares"499,1893439,"QINGDAO FOREVER RUBBER CO., LIMITED
青島永恒橡膠有限公司",2013-04-17,2019-10-11,"Private, ltd by shares"500,1893417,"R &amp; R FIRE &amp; SOUND PROOF BUILDING MATERIALS LIMITED
戶信防火隔音建材有限公司",2013-04-17,,"Private, ltd by shares"501,1892963,"RADIANT FORTUNES LIMITED
永長運有限公司",2013-04-17,2016-03-04,"Private, ltd by shares"502,1893386,"Ratuu Co., Limited
銳途有限公司",2013-04-17,2016-12-09,"Private, ltd by shares"503,1892813,"RICH ASIA ENGINEERING LIMITED
達亞工程有限公司",2013-04-17,,"Private, ltd by shares"504,1892799,"Rich Base Technology Co., Limited
裕基科技有限公司",2013-04-17,,"Private, ltd by shares"505,1893190,"RICHMORAL (HONGKONG) CO., LIMITED
香港富德通有限公司",2013-04-17,2019-02-01,"Private, ltd by shares"506,1893151,"RIGHT ONE INTERNATIONAL TRANDING LIMITED
正一國際貿易有限公司",2013-04-17,2018-01-05,"Private, ltd by shares"507,1893303,"RISING METAL MANUFACTORY LIMITED
溢昇五金製品(香港)有限公司",2013-04-17,,"Private, ltd by shares"508,1892987,"ROCKET INTERNATIONAL LOGISTICS CO., LIMITED
瑞天祥國際物流(香港)有限公司",2013-04-17,,"Private, ltd by shares"509,1893103,"RONG SHENG INTERNATIONAL DEVELOPMENT LIMITED
榮生國際發展有限公司",2013-04-17,,"Private, ltd by shares"510,1893093,"ROSE ANGEL LIMITED",2013-04-17,2020-10-23,"Private, ltd by shares"511,1892970,"ROYAL (HONGKONG) HOME FURNISHING DECORATION CO., LIMITED
皇家(香港)家居軟裝飾有限公司",2013-04-17,2019-02-01,"Private, ltd by shares"512,1893232,"ROYCEPORT SALES LIMITED",2013-04-17,2016-12-09,"Private, ltd by shares"513,1893109,"ROYOU Enterprise (Hong Kong) Limited
路友實業(香港)有限公司",2013-04-17,2018-11-02,"Private, ltd by shares"514,1893009,"Rubicon International Property Investment Co., Limited
瑞必肯國際房地產投資有限公司",2013-04-17,,"Private, ltd by shares"515,1893086,"RUISHENG BUSINESS TECHNOLOGY CO., LIMITED
瑞升商貿科技有限公司",2013-04-17,,"Private, ltd by shares"516,1893374,"S BODY BEAUTY LIMITED",2013-04-17,2016-12-09,"Private, ltd by shares"517,1893246,"SANWA CORPORATION LIMITED
三和股份有限公司",2013-04-17,,"Private, ltd by shares"518,1893196,"SEA FREIGHT &amp; FORWARDING SERVICES HK LIMITED",2013-04-17,2015-12-31,"Private, ltd by shares"519,1893210,"SECOND NATURE PEST CONTROL COMPANY LIMITED
學然蟲害管理有限公司",2013-04-17,,"Private, ltd by shares"520,1893169,"SEEWELL GLOBAL CONSULTING CO., LIMITED
思華木易諮詢服務有限公司",2013-04-17,2016-12-09,"Private, ltd by shares"521,1893142,"SEIF ASIA LIMITED",2013-04-17,,"Private, ltd by shares"522,1893389,"Serious Tech Limited",2013-04-17,,"Private, ltd by shares"523,1893436,"SERPHITECH LIMITED
澤菲特有限公司",2013-04-17,2016-12-09,"Private, ltd by shares"524,1893472,"SGM Limited (d2017-07-28)",2013-04-17,2017-07-28,"Private, ltd by shares"525,1893375,"SHANDONG GOLDEN LAND AGRICULTURAL TRADE CO., LIMITED
山東金大地農業貿易有限公司",2013-04-17,2017-12-01,"Private, ltd by shares"526,1893212,"SHANG SING LIMITED
商升有限公司",2013-04-17,2015-09-25,"Private, ltd by shares"527,1892905,"SHANGHAI BIAOTONG ELECTROMECHANICAL EQUIPMENT CO., LIMITED
上海標通機電設備有限公司",2013-04-17,2020-01-10,"Private, ltd by shares"528,1892822,"SHANGHAI COOLAPEX CO., LIMITED
上海冰峰科技有限公司",2013-04-17,2016-12-09,"Private, ltd by shares"529,1893028,"SHANGHAI GREAT SHEPHERD ELECTROMECHANICAL CO., LIMITED
上海大牧人機電有限公司",2013-04-17,,"Private, ltd by shares"530,1892937,"Shanghai Joyhon Hospital Investment Management Co., Limited
上海嘉煌醫院投資管理有限公司",2013-04-17,2018-09-14,"Private, ltd by shares"531,1892942,"SHANGHAI KEITH MACHINERY TECHNOLOGY CO., LIMITED
上海基斯機電科技有限公司",2013-04-17,,"Private, ltd by shares"532,1893116,"SHANGHAI PEOPLE ELECTRICAL APPLIANCE ELECTROMER LIMITED
上海人民電器機電有限公司",2013-04-17,2019-11-08,"Private, ltd by shares"533,1892967,"SHANGHAI RAILWAY EXPRESS LOGISTICS LIMITED
上海中鐵快運物流有限公司",2013-04-17,2016-12-09,"Private, ltd by shares"534,1893189,"SHARK SCIENCE AND TECHNOLOGY LIMITED
鯊魚科技有限公司",2013-04-17,2014-08-15,"Private, ltd by shares"535,1893342,"SHAYONA TRADING CO., LIMITED",2013-04-17,,"Private, ltd by shares"536,1892974,"Shen Zhen Ka Si Te Electronics Limited
深圳卡斯特電子有限公司",2013-04-17,2016-12-09,"Private, ltd by shares"537,1893256,"Shen Zhen Microchips Technology Co., Limited",2013-04-17,2019-12-20,"Private, ltd by shares"538,1892989,"SHENGXUN GLOBAL INVESTMENT LIMITED
勝訊環球投資有限公司",2013-04-17,2016-12-09,"Private, ltd by shares"539,1892917,"SHENZHEN KIMELY TECHNOLOGY CO., LIMITED
深圳金佰利科技有限公司",2013-04-17,2018-12-28,"Private, ltd by shares"540,1892851,"Shenzhen Linghangda Electronics Co., Limited
深圳市菱杭達電子有限公司",2013-04-17,,"Private, ltd by shares"541,1893467,"SHENZHEN SHUILONG COMPANY LIMITED",2013-04-17,2020-10-16,"Private, ltd by shares"542,1892930,"SHIHAIDAYI GLASS INTERNATIONAL CO., LIMITED",2013-04-17,2016-09-30,"Private, ltd by shares"543,1892860,"SHIMAI INDUSTRIAL CO., LIMITED
時邁實業有限公司",2013-04-17,,"Private, ltd by shares"544,1893259,"Shine Spring Investment Limited
尚泉投資有限公司",2013-04-17,2014-10-24,"Private, ltd by shares"545,1893242,"Shoqase International Limited",2013-04-17,,"Private, ltd by shares"546,1893065,"SHUNMEI (HK) TRADE CO., LIMITED (d2016-12-09)
順美(香港)貿易有限公司",2013-04-17,2016-12-09,"Private, ltd by shares"547,1892913,"Siam-Sino International Limited
泰中互利國際有限公司",2013-04-17,,"Private, ltd by shares"548,1892953,"SICHUAN CUISINE LIMITED
蜀香有限公司",2013-04-17,2017-12-08,"Private, ltd by shares"549,1892837,"SIDE WORKS LIMITED
邊位製作有限公司",2013-04-17,,"Private, ltd by shares"550,1893438,"SILVERTEX (HK) LIMITED",2013-04-17,2016-04-22,"Private, ltd by shares"551,1893198,"SINO JADE INTERNATIONAL (HONG KONG) LIMITED
中灝國際(香港)有限公司",2013-04-17,2019-02-01,"Private, ltd by shares"552,1893427,"SINO SWISS TRAVEL LIMITED",2013-04-17,,"Private, ltd by shares"553,1892787,"SINO-SEACOASTA (HK) LIMITED
神州海岸(香港)有限公司",2013-04-17,,"Private, ltd by shares"554,1892820,"SINOSUN DEVELOPMENT LIMITED
中陽發展有限公司",2013-04-17,,"Private, ltd by shares"555,1892932,"Sinovision Technology Co., Limited
華視特電子科技有限公司",2013-04-17,2018-08-31,"Private, ltd by shares"556,1893058,"SKY CODE COSMETICS LIMITED
天情美妝有限公司",2013-04-17,2013-11-22,"Private, ltd by shares"557,1893409,"Skyhub International Group Limited
愛世港國際集團有限公司",2013-04-17,,"Private, ltd by shares"558,1892914,"SKYLINE INTERNATIONAL TRADE CO., LIMITED (d2016-12-09)
天灝國際貿易有限公司",2013-04-17,2016-12-09,"Private, ltd by shares"559,1892958,"SKYVISION INTERNATIONAL HOLDINGS CO., LIMITED",2013-04-17,2018-02-23,"Private, ltd by shares"560,1893273,"SMART APPS MARKETING COMPANY LIMITED",2013-04-17,2019-09-20,"Private, ltd by shares"561,1893224,"SMART EAGLE INTERNATIONAL LIMITED
智鷹國際有限公司",2013-04-17,,"Private, ltd by shares"562,1892804,"SMART FORTUNE (CHINA) LIMITED
駿運(中國)有限公司",2013-04-17,,"Private, ltd by shares"563,1893024,"SMART INTELL INT'L CO., LIMITED
敏睿國際有限公司",2013-04-17,,"Private, ltd by shares"564,1893456,"Smartclick Limited (HK)",2013-04-17,2018-03-23,"Private, ltd by shares"565,1892891,"SOLUX INTERNATIONAL LIMITED
陽明香港國際有限公司",2013-04-17,,"Private, ltd by shares"566,1892772,"SONG LIN LIMITED",2013-04-17,2016-06-03,"Private, ltd by shares"567,1893136,"SOUTHERN HARVEST DEVELOPMENT COMPANY LIMITED
南盛合利發展有限公司",2013-04-17,,"Private, ltd by shares"568,1893177,"SPACE SUPPLY CHAIN SERVICE (H.K.) CO. LIMITED
華洋供應鏈服務(香港)有限公司",2013-04-17,,"Private, ltd by shares"569,1892786,"SPAZIO SHOES LIMITED",2013-04-17,,"Private, ltd by shares"570,1892790,"SPEEDY BRIGHT (ASIA) LIMITED
迅輝(亞洲)有限公司",2013-04-17,2019-02-01,"Private, ltd by shares"571,1893027,"SPLENDENT JETARTS INDUSTRY LIMITED",2013-04-17,2016-12-02,"Private, ltd by shares"572,1893120,"ST. CLAIR CONSULTING LIMITED",2013-04-17,,"Private, ltd by shares"573,1892904,"Star International Express Co., Limited
速達國際貨運代理香港有限公司",2013-04-17,2019-02-01,"Private, ltd by shares"574,1893324,"Staray Technology Co., Limited
賽瑞通訊科技有限公司",2013-04-17,,"Private, ltd by shares"575,1892915,"Start Asia Industrial Limited
啓亞實業有限公司",2013-04-17,,"Private, ltd by shares"576,1892933,"STRATASIA PACKAGING CO., LIMITED
亞洲藝略包裝有限公司",2013-04-17,,"Private, ltd by shares"577,1893108,"STUDY TOUR 365 LIMITED
遊學365有限公司",2013-04-17,,"Private, ltd by shares"578,1893282,"SUCCESS ASSET MANAGEMENT LIMITED
實德資產管理有限公司",2013-04-17,,"Private, ltd by shares"579,1893293,"SUCCESS INTERNATIONAL EDUCATION AND IMMIGRATION CONSULTANCY LIMITED
實德國際升學及移民顧問有限公司",2013-04-17,,"Private, ltd by shares"580,1893406,"SUGAR AND SPICE LIMITED (HK)",2013-04-17,2018-01-19,"Private, ltd by shares"581,1893137,"SUIKU TRADING CO., LIMITED
適億客商貿有限公司",2013-04-17,2019-02-01,"Private, ltd by shares"582,1892921,"SUNNY FASHIONS CO LIMITED
陽光服裝有限公司",2013-04-17,2019-08-30,"Private, ltd by shares"583,1893193,"Sunshine Growing Industry Co., Limited",2013-04-17,,"Private, ltd by shares"584,1893428,"Superior Brokerage Services Co Limited
鴻安國際運通有限公司",2013-04-17,,"Private, ltd by shares"585,1892911,"SUPERTECH ELECTRONIC LIMITED
領睿電子股份有限公司",2013-04-17,2019-02-01,"Private, ltd by shares"586,1893107,"Supreme Fortune Consulting Limited
鼎盛顧問有限公司",2013-04-17,2015-01-02,"Private, ltd by shares"587,1893143,"SWISS POLYMERIC INTERNATIONAL LIMITED",2013-04-17,,"Private, ltd by shares"588,1893167,"SWITZERLAND HUI JIA REN INTERNATIONAL (HONG KONG) LIMITED
瑞士蕙佳人國際(香港)有限公司",2013-04-17,2020-01-10,"Private, ltd by shares"589,1892780,"SYNERGY AND PRUDENCE ENTERPRISES CONSULTING LIMITED
康信企業顧問有限公司",2013-04-17,,"Private, ltd by shares"590,1893200,"SYNERGY REAL ESTATE (HK) LIMITED",2013-04-17,,"Private, ltd by shares"591,1893401,"Synthesis IAE Advisory Limited
綜觀移民留學顧問有限公司",2013-04-17,,"Private, ltd by shares"592,1893255,"Systech Limited (HK)
研佳科技(香港)有限公司",2013-04-17,2018-12-14,"Private, ltd by shares"593,1893451,"T-Source Limited (HK)",2013-04-17,2019-02-01,"Private, ltd by shares"594,1893106,"TAIMENG (HONG KONG) CO., LIMITED
泰盟(香港)有限公司",2013-04-17,2014-09-12,"Private, ltd by shares"595,1893080,"TAIWAN JIERRUI INDUSTRIAL PRODUCTS CO., LIMITED
臺灣集爾銳工業用品有限公司",2013-04-17,,"Private, ltd by shares"596,1893294,"TAIWAN NUOSEN ELECTRIC APPLIANCE CO., LIMITED
臺灣諾森電器有限公司",2013-04-17,,"Private, ltd by shares"597,1892999,"TAIWAN TAILI TOOLS LIMITED
臺灣泰利工具有限公司",2013-04-17,2019-02-01,"Private, ltd by shares"598,1893128,"TANDWAY INDUSTRIAL LIMITED
天地匯實業有限公司",2013-04-17,2020-01-10,"Private, ltd by shares"599,1893413,"Teksky International Limited
卓明國際(香港)有限公司",2013-04-17,2016-12-09,"Private, ltd by shares"600,1892922,"TELBROOKS LIMITED",2013-04-17,2017-12-01,"Private, ltd by shares"601,1893301,"TELLE MERE TELLE FILLE LIMITED",2013-04-17,2016-12-09,"Private, ltd by shares"602,1893422,"Thousands eTrading Limited
譽千里商貿有限公司",2013-04-17,2019-02-01,"Private, ltd by shares"603,1893332,"TIN SUN (HONG KONG) MEDIA LIMITED
天辰(香港)傳媒有限公司",2013-04-17,,"Private, ltd by shares"604,1893112,"TINCO BATHROOM PRODUCTS CO., LIMITED
鼎高衛浴用品有限公司",2013-04-17,,"Private, ltd by shares"605,1893084,"TJL INDUSTRY GROUP CO., LIMITED
耀信實業集團有限公司",2013-04-17,,"Private, ltd by shares"606,1892863,"TMI ASIA LIMITED",2013-04-17,,"Private, ltd by shares"607,1893396,"TNLPOWER LIMITED",2013-04-17,2019-02-01,"Private, ltd by shares"608,1892901,"Tokyo Restaurants Factory Company Limited
東京餐廳工場有限公司",2013-04-17,2015-10-16,"Private, ltd by shares"609,1893441,"TONGHE INVESTMENT MANAGEMENT LIMITED
同和投資管理有限公司",2013-04-17,,"Private, ltd by shares"610,1893075,"TOP HOUSEWARE CO., LIMITED",2013-04-17,2019-10-11,"Private, ltd by shares"611,1893207,"TOP SHINE INVESTMENT GROUP LIMITED
天鑫投資集團有限公司",2013-04-17,,"Private, ltd by shares"612,1893382,"TOP TEXTILE CO., LIMITED
拓普紡織有限公司",2013-04-17,2017-06-09,"Private, ltd by shares"613,1893446,"TPD SYSTEMS ASIA LIMITED",2013-04-17,,"Private, ltd by shares"614,1893236,"TRAILROAD LIMITED",2013-04-17,2016-12-09,"Private, ltd by shares"615,1893184,"Treasure Elite Global Limited",2013-04-17,,"Private, ltd by shares"616,1893284,"TREEMAN TECHNOLOGY CO., LIMITED
樹人科技有限公司",2013-04-17,2018-03-16,"Private, ltd by shares"617,1892990,"TRILLION CAPITAL TAX SERVICES LIMITED
盈豐稅務及諮詢有限公司",2013-04-17,,"Private, ltd by shares"618,1893053,"TUWELL INTERNATIONAL INDUSTRY CO., LIMITED
拓威國際實業有限公司",2013-04-17,2015-07-31,"Private, ltd by shares"619,1892941,"Tyhe International Architectural Design Co., Limited
鈦合國際建築設計有限公司",2013-04-17,2014-10-31,"Private, ltd by shares"620,1892810,"U Design Production Limited",2013-04-17,2015-03-20,"Private, ltd by shares"621,1892815,"U-Med Products Limited
醫通用品有限公司",2013-04-17,,"Private, ltd by shares"622,1893318,"UELAX TECHNOLOGY (HK) CO., LIMITED
優利萊科技(香港)有限公司",2013-04-17,2016-12-09,"Private, ltd by shares"623,1893372,"UNITED EDUCATION ASIA LIMITED
聯合教育亞洲有限公司",2013-04-17,2020-04-29,"Private, ltd by shares"624,1893373,"UNITED INTERNATIONAL IMP &amp; EXP CO., LIMITED
聯合國際進出口有限公司",2013-04-17,,"Private, ltd by shares"625,1893426,"Unlibox Limited",2013-04-17,2018-08-03,"Private, ltd by shares"626,1893154,"Uno Human Resource Development Limited
優諾人力資源發展有限公司",2013-04-17,,"Private, ltd by shares"627,1892898,"UPHOLDING LUSTRE INTERNATIONAL LIMITED
尚澤國際有限公司",2013-04-17,2019-07-19,"Private, ltd by shares"628,1893036,"UPLINK GROUP ASIA LIMITED
上進集團亞洲有限公司",2013-04-17,2014-11-14,"Private, ltd by shares"629,1893300,"Urban Transportation Infrastructure (Chongqing) Shapingba Limited
城市交通設施(重慶)沙坪壩有限公司",2013-04-17,,"Private, ltd by shares"630,1893297,"Urban Transportation Infrastructure (Tianjin) Limited
城市交通設施(天津)有限公司",2013-04-17,2018-05-04,"Private, ltd by shares"631,1893471,"V &amp; M TECHNOLOGY CO., LIMITED
維茂科技有限公司",2013-04-17,2016-12-09,"Private, ltd by shares"632,1893266,"Valerie Gioielli Limited",2013-04-17,2018-02-02,"Private, ltd by shares"633,1892806,"VERACITY SHIPPING CO., LIMITED
誠信海運有限公司",2013-04-17,,"Private, ltd by shares"634,1893351,"VERONA GLOBAL CO., LIMITED
維羅娜環球有限公司",2013-04-17,2016-08-05,"Private, ltd by shares"635,1893219,"VERYCOM COMMERCE LIMITED",2013-04-17,2016-12-09,"Private, ltd by shares"636,1893220,"VIAMAC LIMITED",2013-04-17,,"Private, ltd by shares"637,1892777,"VINO PHILO GROUP LIMITED",2013-04-17,2016-12-09,"Private, ltd by shares"638,1893117,"VISMAX COMPANY LIMITED
維瑪詩電子有限公司",2013-04-17,,"Private, ltd by shares"639,1892923,"VOGNEE FASHION TRADE LIMITED
維格時尚貿易有限公司",2013-04-17,2018-09-28,"Private, ltd by shares"640,1893191,"WAI LAM ADVERTISING ENGINEERING LIMITED
偉林廣告工程有限公司",2013-04-17,,"Private, ltd by shares"641,1893398,"WANG TAI BUILDING MATERIALS LIMITED
宏大建材有限公司",2013-04-17,,"Private, ltd by shares"642,1892841,"WANGDU INTERNATIONAL CO., LIMITED
旺都國際有限公司",2013-04-17,2015-07-10,"Private, ltd by shares"643,1893370,"Wei Tong Plastic Technology Co., Limited
偉桐塑膠科技有限公司",2013-04-17,2016-12-09,"Private, ltd by shares"644,1893005,"WEIGUANG HOLDING (HONGKONG) GROUP LIMITED
維廣控股(香港)集團有限公司",2013-04-17,2017-12-01,"Private, ltd by shares"645,1893280,"WELCOME MANAGEMENT CONSULTANTS COMPANY LIMITED
維康管理顧問有限公司",2013-04-17,2015-05-15,"Private, ltd by shares"646,1893319,"WELLNESS PROPERTY DEVELOPMENT LIMITED
匯雋地產發展有限公司",2013-04-17,,"Private, ltd by shares"647,1892956,"WELLSTONE CHEMICAL INDUSTRY LIMITED
佳石化工有限公司",2013-04-17,,"Private, ltd by shares"648,1893380,"WESCO INTERNATIONAL LIMITED
韋斯科國際有限公司",2013-04-17,2017-12-01,"Private, ltd by shares"649,1893098,"WESTDONG LIMITED",2013-04-17,2019-02-01,"Private, ltd by shares"650,1893114,"WiKi Online Marketing Limited",2013-04-17,2014-11-14,"Private, ltd by shares"651,1893186,"Wilber Woodmate Associates Limited
偉博活銘工程有限公司",2013-04-17,2016-12-09,"Private, ltd by shares"652,1892828,"Willynne International Co., Limited
威琳國際有限公司",2013-04-17,2019-09-06,"Private, ltd by shares"653,1892846,"WING KEE ALUMINUM ENGINEERING LIMITED
榮記建材工程有限公司",2013-04-17,,"Private, ltd by shares"654,1893066,"WING SING DEVELOPMENT CONSULTANTS LIMITED
永昇發展顧問有限公司",2013-04-17,2019-10-11,"Private, ltd by shares"655,1893410,"WINSUN (GLOBAL) TRADING LIMITED
宏星(環球)貿易有限公司",2013-04-17,2018-08-03,"Private, ltd by shares"656,1893131,"WINTER ONE LIMITED",2013-04-17,,"Private, ltd by shares"657,1892948,"WIRELESS POINT LIMITED",2013-04-17,2020-01-10,"Private, ltd by shares"658,1892807,"WISE TECH INTERNATIONAL ENTERPRISE LIMITED
智達國際企業有限公司",2013-04-17,2018-10-05,"Private, ltd by shares"659,1892866,"Wiz.Biz Corporation Limited
為之商務股份有限公司",2013-04-17,,"Private, ltd by shares"660,1893430,"WKI Management Limited",2013-04-17,,"Private, ltd by shares"661,1893194,"WONSTAR INTERNATIONAL LIMITED
萬爾達國際有限公司",2013-04-17,,"Private, ltd by shares"662,1892881,"Wood Haven Holdings Limited",2013-04-17,2017-12-01,"Private, ltd by shares"663,1893029,"World Tennis Players and Clubs Limited",2013-04-17,,"Private, ltd by shares"664,1893457,"WORLDWIDE OCEAN LIMITED
世海國際海洋有限公司",2013-04-17,,"Private, ltd by shares"665,1892971,"Xing Hong Electronic Technology Limited
興弘電子科技有限公司",2013-04-17,2016-12-09,"Private, ltd by shares"666,1893423,"XINHENGDA INTERNATIONAL ASSET MANAGEMENT CO., LIMITED
信恒達國際資產管理有限公司",2013-04-17,,"Private, ltd by shares"667,1893279,"XINMEI INDUSTRY DEVELOPMENT CO., LIMITED
欣美實業發展有限公司",2013-04-17,,"Private, ltd by shares"668,1892935,"XINTAI INT'L BUSINESS (HK) LIMITED
鑫泰國際商貿(香港)有限公司",2013-04-17,,"Private, ltd by shares"669,1893443,"XTRABONUS INTERNATIONAL (H.K) LIMITED",2013-04-17,,"Private, ltd by shares"670,1893470,"Xu Huang (HK) Co. Limited
旭皇(香港)有限公司",2013-04-17,,"Private, ltd by shares"671,1892912,"XUN SHENG CO., LIMITED
巽昇有限公司",2013-04-17,2016-05-27,"Private, ltd by shares"