,Reg no.,Name,Incorp-orated,Dissolved,Type234,1892947,"HEHUA YANRONG BEAUTY INDUSTRY LIMITED
和華妍容美業有限公司",2013-04-17,2016-12-09,"Private, ltd by shares"235,1893348,"HENCHUANG GROUP INVESTMENT (HOLDING) CO., LIMITED
恒創集團投資(控股)有限公司",2013-04-17,,"Private, ltd by shares"236,1893055,"HENG ZE TE TRADING COMPANY LIMITED
恒澤特貿易有限公司",2013-04-17,2016-04-08,"Private, ltd by shares"237,1892892,"HENGWEIDA (U.S.A) PHYTOCHEMICALS IMPORT &amp; EXPORT LIMITED (d2016-12-09)
恒威達(美國)植物素進出口貿易有限公司",2013-04-17,2016-12-09,"Private, ltd by shares"238,1893360,"HGAC Asia Pacific Limited",2013-04-17,2015-06-12,"Private, ltd by shares"239,1893239,"HHH Holdings Limited (HK)",2013-04-17,,"Private, ltd by shares"240,1892876,"HIGH GAME LIMITED",2013-04-17,,"Private, ltd by shares"241,1892927,"HK AIGE (HOME FURNISHING) GROUP LIMITED
香港愛格(家居)集團有限公司",2013-04-17,2018-11-16,"Private, ltd by shares"242,1892986,"HK BROADWAY DEVELOPMENT TECHNOLOGY CO., LIMITED
香港博偉發展科技有限公司",2013-04-17,,"Private, ltd by shares"243,1893030,"HK CHUANGXIN HOME GROUP LIMITED
香港創新家居集團有限公司",2013-04-17,2016-12-09,"Private, ltd by shares"244,1893119,"HK DINGYU INT'L GROUP LIMITED
香港鼎裕國際集團有限公司",2013-04-17,2017-12-01,"Private, ltd by shares"245,1893013,"HK Enjoylink Technology Development Co., Limited
香港興聯科技發展有限公司",2013-04-17,2016-12-09,"Private, ltd by shares"246,1893362,"HK FUTENG DENTAL LAB CO., LIMITED
香港富騰義齒有限公司",2013-04-17,,"Private, ltd by shares"247,1892928,"HK GOLDEN OCEAN INTERNATIONAL TRADING CO., LIMITED
香港金海國際貿易有限公司",2013-04-17,2018-05-11,"Private, ltd by shares"248,1893061,"HK HERITAGE ENVIRONMENTAL PROTECTION TECHNOLOGY LIMITED
香港傳承環保科技有限公司",2013-04-17,,"Private, ltd by shares"249,1893175,"HK INTLAROW TECHNOLOGY INDUSTRY CO., LIMITED
香港國際箭牌科技實業有限公司",2013-04-17,,"Private, ltd by shares"250,1892943,"HK JIAKUN INTERNATIONAL INDUSTRY CO., LIMITED
香港嘉坤國際實業有限公司",2013-04-17,2016-12-09,"Private, ltd by shares"251,1892998,"HK LANDI INT'L HOTEL GROUP MANAGEMENT LIMITED
香港瀾蒂國際酒店集團管理有限公司",2013-04-17,2016-12-09,"Private, ltd by shares"252,1892899,"HK LANNERET IMP.&amp;EXP CO., LIMITED
香港雄瑛進出口有限公司",2013-04-17,,"Private, ltd by shares"253,1893104,"HK LIANTONG INTERNATIONAL TRADING LIMITED
香港連通國際貿易有限公司",2013-04-17,2015-05-08,"Private, ltd by shares"254,1893126,"HK MABOSHI BIOTECHNOLOGY (GROUP) LIMITED
香港馬博士生物科技(集團)有限公司",2013-04-17,2016-12-09,"Private, ltd by shares"255,1893034,"HK NANTU INTERNATIONAL GROUP DEVELOPMENT CO., LIMITED
香港南兔國際集團發展有限公司",2013-04-17,2016-12-09,"Private, ltd by shares"256,1892924,"HK RICH GALAXY INDUSTRY LIMITED
香港富成實業有限公司",2013-04-17,2019-02-01,"Private, ltd by shares"257,1893059,"HK SHINE EAST INTERNATIONAL TRADING CO., LIMITED
香港盛東國際貿易有限公司",2013-04-17,2018-05-11,"Private, ltd by shares"258,1893185,"HK SHUANGHUI INDUSTRY DEVELOPMENT CO., LIMITED
香港雙輝實業發展有限公司",2013-04-17,2016-12-09,"Private, ltd by shares"259,1892969,"HK WANHUA PAPER CO., LIMITED
香港萬華紙業有限公司",2013-04-17,2018-11-02,"Private, ltd by shares"260,1892902,"HK ZHUOERSHI INT'L INDUSTRY GROUP LIMITED
香港卓爾仕國際實業集團有限公司",2013-04-17,2016-12-09,"Private, ltd by shares"261,1893231,"HOME COLLECTION GROUP LIMITED
家薈綜合服務集團有限公司",2013-04-17,2017-12-01,"Private, ltd by shares"262,1892867,"Honesty Technology &amp; Consultancy Limited
香港誠科工程咨詢有限公司",2013-04-17,,"Private, ltd by shares"263,1893176,"HONG KONG BAISHENG INT'L ELECTRONICS CO., LIMITED
香港百盛國際電子有限公司",2013-04-17,2016-01-08,"Private, ltd by shares"264,1893253,"HONG KONG BAO LI YUAN INTERNATIONAL TRADING CO., LIMITED
香港寶利源國際貿易有限公司",2013-04-17,2016-12-09,"Private, ltd by shares"265,1893234,"Hong Kong Beautiful Fortress Chain (International) Enterprise Limited
香港美麗堡(國際)連鎖企業有限公司",2013-04-17,2016-12-09,"Private, ltd by shares"266,1893160,"HONG KONG BI SHOU FANG BEAUTY BODY LIMITED
香港碧瘦坊美容美體有限公司",2013-04-17,2016-09-23,"Private, ltd by shares"267,1892825,"HONG KONG CHAMP FAR EAST LIMITED
香港卓杰遠東有限公司",2013-04-17,,"Private, ltd by shares"268,1893345,"HONG KONG CHLOE TRADING LIMITED
香港婭蔻貿易有限公司",2013-04-17,,"Private, ltd by shares"269,1892931,"HONG KONG ETERNITY GROUP CO., LIMITED
香港恩特妮蒂集團有限公司",2013-04-17,,"Private, ltd by shares"270,1892926,"HONG KONG HAND IN HAND INTERNATIONAL TRADING LIMITED
香港海之洋國際貿易有限公司",2013-04-17,2016-08-19,"Private, ltd by shares"271,1892977,"Hong Kong HSZE International Garments Co., Limited
香港華仕卓爾(國際)服飾有限公司",2013-04-17,2018-07-13,"Private, ltd by shares"272,1892939,"HONG KONG JIA MING GROUP LIMITED
香港嘉明集團有限公司",2013-04-17,2016-12-09,"Private, ltd by shares"273,1893152,"HONG KONG KINA ELECTRONIC INDUSTRIAL CO., LIMITED
香港建亞電子實業有限公司",2013-04-17,2019-02-01,"Private, ltd by shares"274,1893353,"HONG KONG LANMEI WEAVE LIMITED
香港藍美紡織有限公司",2013-04-17,2017-12-01,"Private, ltd by shares"275,1893127,"HONG KONG LUMENGHAO LEATHER LIMITED
香港路蒙豪皮具有限公司",2013-04-17,2017-12-01,"Private, ltd by shares"276,1893448,"HONG KONG MIRACLE TRADING DEVELOPMENT LIMITED
香港美域高貿易發展有限公司",2013-04-17,2017-12-01,"Private, ltd by shares"277,1893123,"HONG KONG NANFU TECHNOLOGY CO., LIMITED
香港南孚科技有限公司",2013-04-17,2018-09-28,"Private, ltd by shares"278,1893100,"HONG KONG NANYANG DEVELOPMENT COMPANY LIMITED
香港南洋發展有限公司",2013-04-17,2018-08-03,"Private, ltd by shares"279,1893113,"HONG KONG ROYAL MAHOGANY FURNITURE INVESTMENT GROUP LIMITED
香港皇家紅木家俱投資集團有限公司",2013-04-17,2016-12-09,"Private, ltd by shares"280,1893400,"HONG KONG SHENG WEI CO., LIMITED
香港盛為有限公司",2013-04-17,,"Private, ltd by shares"281,1892950,"Hong Kong Siga Electronics Co., Limited
香港賽佳電子有限公司",2013-04-17,2018-12-14,"Private, ltd by shares"282,1893395,"HONG KONG SOCIALITE GROUP LIMITED
香港名媛集團有限公司",2013-04-17,2019-02-01,"Private, ltd by shares"283,1893262,"HONG KONG WAH LAM INTERNATIONAL HOTEL MANAGEMENT LIMITED
香港華林國際酒店管理有限公司",2013-04-17,,"Private, ltd by shares"284,1893105,"HONG KONG XINBAO GROUP INVESTMENT CO., LIMITED
香港信寶集團投資有限公司",2013-04-17,2018-10-05,"Private, ltd by shares"285,1892893,"HONGJI GREAT CAUSE (HK) INT'L INVESTMENT DEVELOPMENT LIMITED
鴻基偉業(香港)國際投資發展有限公司",2013-04-17,2020-01-10,"Private, ltd by shares"286,1892802,"HONGKONG BOCHAXUAN BIOLOGY TECHNOLOGY CO., LIMITED
香港柏茶軒生物科技有限公司",2013-04-17,,"Private, ltd by shares"287,1893153,"Hongkong Cardino International Trade Co., Limited
香港卡迪諾國際貿易有限公司",2013-04-17,2020-01-10,"Private, ltd by shares"288,1893358,"HongKong Changer co., Limited
香港燦基股份有限公司",2013-04-17,2017-12-01,"Private, ltd by shares"289,1893277,"HongKong Cldy Investment Industrial Company Limited
香港成樂迪衣投資實業有限公司",2013-04-17,2019-02-01,"Private, ltd by shares"290,1893206,"HONGKONG CONTISULA HOTELS &amp; RESORTS HOLDINGS LIMITED
香港環洲酒店管理(集團)有限公司",2013-04-17,2016-12-09,"Private, ltd by shares"291,1893042,"Hongkong coocu Limited
香港玖玖工業有限公司",2013-04-17,2016-12-09,"Private, ltd by shares"292,1893377,"HONGKONG DEFEI INDUSTRY CO., LIMITED
香港德飛實業有限公司",2013-04-17,2018-08-17,"Private, ltd by shares"293,1892908,"HONGKONG DIAMOND SKATEBOARD LIMITED",2013-04-17,,"Private, ltd by shares"294,1893433,"HONGKONG EAST TIMES INVESTMENT HOLDING GROUP LIMITED
香港東方時代投資控股集團有限公司",2013-04-17,2017-12-01,"Private, ltd by shares"295,1893007,"Hongkong Greenxin Touch Display Co., Limited
香港格林鑫觸摸顯示股份有限公司",2013-04-17,,"Private, ltd by shares"296,1893403,"HONGKONG HDJ INTERNATIONAL GROUP LIMITED
香港惠迪吉國際集團有限公司",2013-04-17,2019-02-01,"Private, ltd by shares"297,1893394,"HONGKONG JIN HAN FANG HEALTH MANAGEMENT CHAIN CO., LIMITED
香港金瀚方健康管理連鎖有限公司",2013-04-17,,"Private, ltd by shares"298,1893469,"HONGKONG JIN PENG FEI TECHNOLOGY CO., LIMITED
香港勁鵬飛科技有限公司",2013-04-17,,"Private, ltd by shares"299,1892959,"HONGKONG JINFU INTERNATIONAL TRADING CO., LIMITED
香港金富國際貿易有限公司",2013-04-17,2015-02-18,"Private, ltd by shares"300,1893221,"HONGKONG LIFULI GROUP CO., LIMITED
香港利複利集團有限公司",2013-04-17,2020-01-10,"Private, ltd by shares"301,1893309,"HONGKONG LIMEI TRADING LIMITED
香港力美貿易有限公司",2013-04-17,2016-05-27,"Private, ltd by shares"302,1893281,"HONGKONG LIMMENG INTERNATIONAL TRADE LIMITED
香港林夢國際貿易有限公司",2013-04-17,,"Private, ltd by shares"303,1892855,"HONGKONG MASTEL TECHNOLOGY CO., LIMITED
香港中訊在線科技有限公司",2013-04-17,2018-11-16,"Private, ltd by shares"304,1893101,"HONGKONG NEW HOPE CO., LIMITED
香港新駿貿易有限公司",2013-04-17,2020-01-10,"Private, ltd by shares"305,1893321,"Hongkong Rigel Lighting Group Limited
香港瑞格照明集團有限公司",2013-04-17,2016-12-09,"Private, ltd by shares"306,1893054,"HONGKONG RONGTU INTERNATIONAL CO., LIMITED
香港榮途國際有限公司",2013-04-17,,"Private, ltd by shares"307,1892888,"HONGKONG SANYI GROUP CO., LIMITED
香港三益國際貿易有限公司",2013-04-17,2019-02-01,"Private, ltd by shares"308,1893333,"Hongkong Senhong Photoelectric Technology Co., Limited
香港森泓光電科技有限公司",2013-04-17,2016-12-09,"Private, ltd by shares"309,1893245,"HONGKONG SHARE E-ZONE TECHNOLOGY CO., LIMITED
香港炫音族科技有限公司",2013-04-17,2020-01-24,"Private, ltd by shares"310,1893209,"HONGKONG SHUANGYU TECHNOLOGY CO., LIMITED
香港雙宇科技有限公司",2013-04-17,,"Private, ltd by shares"311,1893336,"HONGKONG SHUNDA MOLD PRODUCTS CO., LIMITED
香港順達模具製品有限公司",2013-04-17,,"Private, ltd by shares"312,1892847,"HONGKONG TAILE DIGITAL IMAGING LIMITED
香港泰樂數碼影像有限公司",2013-04-17,2018-01-12,"Private, ltd by shares"313,1892962,"HONGKONG TEMAO GROUP CO., LIMITED
香港特貿集團有限公司",2013-04-17,2019-02-01,"Private, ltd by shares"314,1893429,"HONGKONG WANGSHANTANG FENGSHUI SOLUTION CO., LIMITED
香港旺善堂周易風水決策有限公司",2013-04-17,2020-09-25,"Private, ltd by shares"315,1893012,"HONGKONG XINDA INDUSTRY LIMITED
香港鑫達實業有限公司",2013-04-17,,"Private, ltd by shares"316,1893048,"HONGKONG XINGFENG BUSINESS CO., LIMITED
香港興豐國際貿易有限公司",2013-04-17,2017-12-01,"Private, ltd by shares"317,1892918,"HONGKONG XINHUALI PRINTING LIMITED
香港欣華麗印刷有限公司",2013-04-17,,"Private, ltd by shares"318,1892882,"HongKong Xinyuan Holding Co., Limited
香港鑫源股份有限公司",2013-04-17,2018-04-06,"Private, ltd by shares"319,1892955,"HONGKONG YIDAIJIAREN COSMETICS CO., LIMITED
香港伊戴佳人化妝品有限公司",2013-04-17,2019-02-01,"Private, ltd by shares"320,1893094,"HONGKONG ZHONGGUHENG HOME FURNISHING GROUP CO., LIMITED
香港中古亨家居集團有限公司",2013-04-17,2016-12-09,"Private, ltd by shares"321,1893347,"HONGKONG ZPL INTERNATIONAL TRADING CO., LIMITED
香港實華國際貿易有限公司",2013-04-17,2015-02-27,"Private, ltd by shares"322,1892831,"HOPESUN INDUSTRIES LIMITED
合盛輕工發展有限公司",2013-04-17,,"Private, ltd by shares"323,1893001,"Huacheng International Trading Limited
華程國際貿易有限公司",2013-04-17,2017-12-01,"Private, ltd by shares"324,1893146,"Huahon Tubes Co., Limited
華泓管業有限公司",2013-04-17,2014-09-05,"Private, ltd by shares"325,1893115,"HUANEI JINDE PIPE INDUSTRY LIMITED
華內金德管業有限公司",2013-04-17,2016-12-09,"Private, ltd by shares"326,1893274,"Hungtex Development Holdings (Hong Kong) Limited
鴻達興業集團(香港)有限公司",2013-04-17,,"Private, ltd by shares"327,1892801,"HWA GUAN INTERNATIONAL (HONG KONG) LIMITED
華冠國際(香港)有限公司",2013-04-17,2015-08-14,"Private, ltd by shares"328,1893138,"Hylands Law Firm Limited",2013-04-17,2014-12-24,"Private, ltd by shares"329,1892949,"I&amp;N INTERNATIONAL TRADING CO., LIMITED
艾恩國際貿易有限公司",2013-04-17,,"Private, ltd by shares"330,1893298,"I-CONNECT (CHINA) LIMITED
恒鼎昌科技有限公司",2013-04-17,2014-11-21,"Private, ltd by shares"331,1892852,"iArkitek Limited
喜居點裝修工程有限公司",2013-04-17,,"Private, ltd by shares"332,1893379,"Iberia Trade Company Limited
伊比利亞貿易有限公司",2013-04-17,2019-02-01,"Private, ltd by shares"333,1893004,"ICRIS:1893004 (no English name)
668 配件零售有限公司",2013-04-17,2015-07-24,"Private, ltd by shares"334,1893434,"ICRIS:1893434 (no English name)
一靜管理咨詢有限公司",2013-04-17,2015-12-24,"Private, ltd by shares"335,1893257,"IDMS Vision (Asia) Limited
艾莫特(亞洲)有限公司",2013-04-17,2020-01-10,"Private, ltd by shares"336,1892965,"INDIAN GUM RESOURCES HOLDINGS LIMITED
印度膠資源控股有限公司",2013-04-17,2016-01-15,"Private, ltd by shares"337,1893466,"INDUSTRIAL COMPUTING LIMITED (HK)",2013-04-17,2020-04-29,"Private, ltd by shares"338,1892946,"Infinite Urban International Architectural Design Co., Limited
英弗國際建築設計有限公司",2013-04-17,2014-10-17,"Private, ltd by shares"339,1892900,"INOVA ELECTRIC CO., LIMITED
致創電器有限公司",2013-04-17,,"Private, ltd by shares"340,1893367,"INTELLIGENT TRADING COMPANY LIMITED
匯雋貿易有限公司",2013-04-17,2017-12-01,"Private, ltd by shares"341,1893090,"International Bioengineering (Group) Company Limited
國際生物工程(集團)有限公司",2013-04-17,,"Private, ltd by shares"342,1893269,"IQ EQ Consultants (HK) Limited",2013-04-17,,"Private, ltd by shares"343,1893475,"Isometric Creative Limited",2013-04-17,2018-09-28,"Private, ltd by shares"344,1893140,"ITALIAN LUOMADISI ENVIRONMENTAL DECORATIVE MATERIALS INTERNATIONAL ENTERPRISE GROUP CO., LIMITED
意大利羅瑪蒂思環保裝飾材料國際企業集團有限公司",2013-04-17,2017-12-01,"Private, ltd by shares"345,1893229,"ITALY JIAMINUO GROUP CO., LIMITED
意大利嘉迷諾集團股份有限公司",2013-04-17,2016-12-09,"Private, ltd by shares"346,1893218,"IVMCapital Limited",2013-04-17,2016-11-25,"Private, ltd by shares"347,1893291,"J P (Asia) Engineering Limited
海洋(亞洲)工程管理有限公司",2013-04-17,2016-12-09,"Private, ltd by shares"348,1893420,"J&amp;A CAKE SHOP LIMITED",2013-04-17,,"Private, ltd by shares"349,1892894,"J&amp;L New Material Co., Limited
杰林新材料有限公司",2013-04-17,2016-02-26,"Private, ltd by shares"350,1892834,"JEWELL INDUSTRY CO., LIMITED
潔威爾實業有限公司",2013-04-17,2018-09-14,"Private, ltd by shares"351,1893287,"JIAJIAYIGOU INTERNATIONAL BUSINESS (HK) LIMITED
家家宜購國際商務(香港)有限公司",2013-04-17,2016-12-09,"Private, ltd by shares"352,1893264,"JIANGYI INTERNATIONAL TRADE LIMITED
香港江屹國際貿易有限公司",2013-04-17,2017-12-01,"Private, ltd by shares"353,1893071,"JIN DING TIAN COMPANY LIMITED
金鼎天有限公司",2013-04-17,,"Private, ltd by shares"354,1892861,"JIN MEN SONG SHI ARISTOCRATIC FAMILY MAKE WINE LIMITED
金門宋氏世家釀酒有限公司",2013-04-17,2018-11-30,"Private, ltd by shares"355,1893385,"JINGYUNTONG (HK) COMPANY LIMITED
京運通(香港)有限公司",2013-04-17,,"Private, ltd by shares"356,1893468,"Jinshan Steel Co., Limited
金山鋼鐵有限公司",2013-04-17,2018-09-21,"Private, ltd by shares"357,1893228,"JLM ENERGY LIMITED",2013-04-17,2016-12-09,"Private, ltd by shares"358,1892800,"JMI Aviation &amp; Consulting Limited",2013-04-17,2014-12-05,"Private, ltd by shares"359,1893447,"Join Honors Tech Co., Limited
億誠恒達科技有限公司",2013-04-17,,"Private, ltd by shares"360,1892873,"Joinvest Industrial Limited
融欣實業有限公司",2013-04-17,2018-07-13,"Private, ltd by shares"361,1892961,"Joying Mandarin Training Services Limited
佳言普通話培訓有限公司",2013-04-17,2015-07-24,"Private, ltd by shares"362,1893202,"JOYMIE LIMITED
紹興宏美貿易有限公司",2013-04-17,2014-07-11,"Private, ltd by shares"363,1893041,"JOYO DEVELOPMENT GROUP CO., LIMITED
卓雅發展集團有限公司",2013-04-17,2020-08-28,"Private, ltd by shares"364,1893225,"JTS THERMAL INSULATION CONSULTANTS LIMITED",2013-04-17,,"Private, ltd by shares"365,1893304,"Juntong International Trading Limited
駿通國際貿易有限公司",2013-04-17,,"Private, ltd by shares"366,1893023,"JUNYU AUTO ACCESSORIES CO., LIMITED
俊宇汽車用品有限公司",2013-04-17,2018-06-15,"Private, ltd by shares"367,1893310,"KA LUNG INT'L INDUSTRIAL (HK) LIMITED
嘉隆(香港)國際實業有限公司",2013-04-17,2018-01-19,"Private, ltd by shares"368,1893062,"Kafa Commerce And Trade Limited
凱發商貿有限公司",2013-04-17,2019-02-01,"Private, ltd by shares"369,1893452,"Kambridge Capital Limited",2013-04-17,2016-12-09,"Private, ltd by shares"370,1893070,"KANG MEI INTERNATIONAL MEDICAL GROUP LIMITED
康美國際醫療集團有限公司",2013-04-17,,"Private, ltd by shares"371,1893312,"KARI GALLERY LIMITED
家蕙薈有限公司",2013-04-17,2014-08-08,"Private, ltd by shares"372,1892938,"KE ZHUANG INTERNATIONAL INDUSTRIAL LIMITED
可莊國際實業有限公司",2013-04-17,,"Private, ltd by shares"373,1893085,"Keen Result Holdings Limited
健績控股有限公司",2013-04-17,2019-10-25,"Private, ltd by shares"374,1893216,"KEEPTIME INDUSTRIAL (HONG KONG) CO., LIMITED
凱泰實業(香港)有限公司",2013-04-17,,"Private, ltd by shares"375,1893437,"KELION TECHNOLOGY CO., LIMITED
科萊昂科技有限公司",2013-04-17,,"Private, ltd by shares"376,1892862,"KESIDIER INTERNATIONAL TRADE CO., LIMITED
恒德進出口有限公司",2013-04-17,2019-02-01,"Private, ltd by shares"377,1892809,"KEY GLORY CONSULTANTS LIMITED
啟耀顧問有限公司",2013-04-17,2016-03-24,"Private, ltd by shares"378,1893205,"KIDDY MASTER COMPANY LIMITED",2013-04-17,2019-02-01,"Private, ltd by shares"379,1893445,"KIDGOLAND INTERNATIONAL COMPANY LIMITED",2013-04-17,,"Private, ltd by shares"380,1893139,"KING MOUTAIN CAPITAL MANAGEMENT LIMITED
金牧童資本管理有限公司",2013-04-17,2018-12-21,"Private, ltd by shares"381,1892983,"KINGAMA POWER MACHINERY CO., LIMITED",2013-04-17,2019-02-01,"Private, ltd by shares"382,1893412,"KINGDOM FINE TECHNOLOGY LIMITED
建藤科技有限公司",2013-04-17,,"Private, ltd by shares"383,1893450,"KINGFITTING LIMITED
金飛訊有限公司",2013-04-17,,"Private, ltd by shares"384,1893182,"KINGLAND C&amp;D COMPANY LIMITED",2013-04-17,2017-12-01,"Private, ltd by shares"385,1893044,"KIU INVESTMENT LIMITED
翹投資有限公司",2013-04-17,,"Private, ltd by shares"386,1893344,"Kjeldsens Limited
丹麥藍罐曲奇有限公司",2013-04-17,,"Private, ltd by shares"387,1893455,"Kongo Department Store (HK) International Holdings Limited
港九百貨(香港)國際控股有限公司",2013-04-17,2016-05-27,"Private, ltd by shares"388,1893180,"KOPICHEM LIMITED
優悅咖啡有限公司",2013-04-17,2016-12-09,"Private, ltd by shares"389,1893306,"KOREA DAVIOOW INTERNATIONAL CORPORATION LIMITED
韓國大宇國際株式會社有限公司",2013-04-17,2016-12-09,"Private, ltd by shares"390,1892945,"KOREA HUAMEISHI INT'L ENTERPRISE GROUP CO., LIMITED
韓國花美時國際企業集團有限公司",2013-04-17,2015-10-23,"Private, ltd by shares"391,1893110,"KOREA JINYOU INT'L GROUP LIMITED
韓國錦友國際集團有限公司",2013-04-17,2019-02-01,"Private, ltd by shares"392,1893326,"KOREA PSAUCY INTERNATIONAL INVESMENT LIMITED
韓國朴尚熙國際投資有限公司",2013-04-17,,"Private, ltd by shares"393,1893393,"KOREA TEFUTE INTERNATIONAL GROUP LIMITED
韓國特福特國際集團有限公司",2013-04-17,2019-02-01,"Private, ltd by shares"394,1893325,"KRONE GROUP LIMITED",2013-04-17,2019-12-06,"Private, ltd by shares"395,1892842,"L &amp; K STRUCTURAL ENGINEERING LIMITED
誠科工程有限公司",2013-04-17,,"Private, ltd by shares"396,1892992,"LANG BO ELECTRONICS TECHNOLOGY LIMITED
浪博電子科技有限公司",2013-04-17,2016-12-09,"Private, ltd by shares"397,1893178,"LEABRIAN SCIENCE AND TECHNOLOGY LIMITED
領智科技有限公司",2013-04-17,2014-08-15,"Private, ltd by shares"398,1893404,"League of Desserts Company Limited
甜品聯盟有限公司",2013-04-17,2014-10-24,"Private, ltd by shares"399,1893010,"LEGEND OF GOLD &amp; JADE HK CO., LIMITED
香港鈺祉緣珠寶首飾有限公司",2013-04-17,2020-05-15,"Private, ltd by shares"400,1893046,"LegenDay Technology Co., Limited
睿陽實業有限公司",2013-04-17,,"Private, ltd by shares"401,1893311,"LEINFO INTERNATIONAL TECHNOLOGY CO., LIMITED
匯能國際電子科技有限公司",2013-04-17,2016-08-19,"Private, ltd by shares"402,1893419,"LENESYS TECHNOLOGY LIMITED
藍溢科技有限公司",2013-04-17,2015-07-03,"Private, ltd by shares"403,1893249,"LEOPOLIS METALS (NF) &amp; TRADE CO. LIMITED",2013-04-17,2016-12-09,"Private, ltd by shares"404,1892833,"LIAO TRADING CO., LIMITED
麗奧貿易有限公司",2013-04-17,2016-12-09,"Private, ltd by shares"405,1892964,"LINKS BUILDING MATERIAL COMPANY LIMITED
凌克建材有限公司",2013-04-17,,"Private, ltd by shares"406,1893391,"LISHENG INDUSTRY (HK) CO., LIMITED
恒升(香港)實業有限公司",2013-04-17,2019-12-13,"Private, ltd by shares"407,1893402,"LIVING AQUA HK LIMITED
活水水族香港有限公司",2013-04-17,,"Private, ltd by shares"408,1892951,"Loeki Holding Limited
奇權實業有限公司",2013-04-17,2015-09-11,"Private, ltd by shares"409,1893454,"LOHAS PROPERTY LIMITED
康城物業有限公司",2013-04-17,,"Private, ltd by shares"410,1893018,"LONGREEN INDUSTRIAL HK CO., LIMITED
朗潤實業香港有限公司",2013-04-17,2020-05-22,"Private, ltd by shares"411,1893040,"LUCENT TRANS LIMITED",2013-04-17,,"Private, ltd by shares"412,1893124,"LUNGTECH INNOVATION GROUP CO., LIMITED
龍科創新集團有限公司",2013-04-17,2018-12-28,"Private, ltd by shares"413,1892843,"LUSON FOOTWEAR LIMITED
陸正鞋業有限公司",2013-04-17,,"Private, ltd by shares"414,1893051,"LX INTERNATIONAL TRAVEL COMPANY LIMITED
龍行國際旅遊有限公司",2013-04-17,2016-12-09,"Private, ltd by shares"415,1892868,"Maclong United International (H.K) Co., Limited
麥朗國際(香港)有限公司",2013-04-17,2018-10-05,"Private, ltd by shares"416,1892838,"MAJ TECHNOLOGY CO., LIMITED
邁傑科技有限公司",2013-04-17,2014-10-03,"Private, ltd by shares"417,1893214,"MAJAR LIMITED (d2016-12-09)",2013-04-17,2016-12-09,"Private, ltd by shares"418,1893148,"MAN GA KAM YUEN LIMITED
萬家金源有限公司",2013-04-17,,"Private, ltd by shares"419,1892796,"MANON LIMITED (HK)
文安有限公司",2013-04-17,,"Private, ltd by shares"420,1892778,"March Green Hotel &amp; Golf Management Limited
瑪詩格林酒店高爾夫管理有限公司",2013-04-17,,"Private, ltd by shares"421,1892797,"MARK SINO INC. LIMITED
德華興業有限公司",2013-04-17,2016-04-08,"Private, ltd by shares"422,1892818,"MARK TIME TRADING LIMITED
正泰貿易有限公司",2013-04-17,2014-04-25,"Private, ltd by shares"423,1892812,"MAXTOP INTERNATIONAL ENTERPRISE LIMITED
滙高國際企業有限公司",2013-04-17,,"Private, ltd by shares"424,1893334,"MAY AN DEVELOPMENT CO., LIMITED
美安貿易發展有限公司",2013-04-17,2019-10-25,"Private, ltd by shares"425,1892954,"Mds Bright Day Limited",2013-04-17,2015-03-20,"Private, ltd by shares"426,1893122,"MEGSEN OIL (AMERICAN) INT'L CO., LIMITED
美格森石油(美國)國際有限公司",2013-04-17,2016-12-09,"Private, ltd by shares"427,1893313,"MEIGE FURNITURE CO., LIMITED
美格家具有限公司",2013-04-17,2017-09-15,"Private, ltd by shares"428,1893349,"MEIJI LIGHTING TECHNOLOGY CO., LIMITED
美吉照明科技有限公司",2013-04-17,,"Private, ltd by shares"429,1893088,"MELCAT LIMITED",2013-04-17,2020-05-29,"Private, ltd by shares"430,1892995,"Melody Asia Co., Limited
美樂地有限公司",2013-04-17,2017-12-01,"Private, ltd by shares"431,1893045,"MESHINE TECHNOLOGY LIMITED
美欣科技有限公司",2013-04-17,2019-08-23,"Private, ltd by shares"432,1892827,"MESOSCRIPT ARCHITECTS LIMITED
中觀景和建築設計有限公司",2013-04-17,2015-08-07,"Private, ltd by shares"433,1892877,"Messodie Energy Limited",2013-04-17,2019-02-01,"Private, ltd by shares"434,1893397,"METALTREE LIMITED (HK)
鉑梵設計集團有限公司",2013-04-17,,"Private, ltd by shares"435,1892829,"METIS Science and Technology disemination Co., Limited
香港新思維科技傳播有限公司",2013-04-17,2020-11-13,"Private, ltd by shares"436,1893476,"MILLION BASE (HK) TRADING LIMITED
萬基(香港)貿易有限公司",2013-04-17,,"Private, ltd by shares"437,1893000,"MING YEE FUNERAL MANAGEMENT CO., LIMITED
明義殯葬管理有限公司",2013-04-17,2017-12-01,"Private, ltd by shares"438,1892874,"Minsheng Jiahan Leasing Limited
民生嘉翰租賃有限公司",2013-04-17,,"Private, ltd by shares"439,1892776,"Minsheng Jiajun Leasing Limited
民生嘉俊租賃有限公司",2013-04-17,,"Private, ltd by shares"