,Reg no.,Name,Incorp-orated,Dissolved,Type1,0170605,"ALBERT TSANG JEWELRY DESIGN LIMITED
瀚林珠寶有限公司",1986-06-18,,"Private, ltd by shares"2,0170643,"AMWAITON LIMITED",1986-06-18,2005-05-20,"Private, ltd by shares"3,0170637,"BBC FAR EAST LIMITED",1986-06-18,1999-04-16,"Private, ltd by shares"4,0170603,"BIGFO OPTICAL LIMITED
浩光眼鏡有限公司",1986-06-18,1993-04-09,"Private, ltd by shares"5,0170639,"BURDURAS LIMITED",1986-06-18,1997-01-03,"Private, ltd by shares"6,0170596,"C. K. HAIR &amp; BEAUTY PRODUCTS LIMITED
精工美髮美容產品有限公司",1986-06-18,,"Private, ltd by shares"7,0170609,"CENTURY FOOTWEAR MANUFACTORY LIMITED
世紀鞋廠有限公司",1986-06-18,1996-12-20,"Private, ltd by shares"8,0170593,"CHAN KING LUEN FOUNDATION FUND LIMITED
陳經綸慈善基金有限公司",1986-06-18,1997-04-25,"Ltd by guarantee"9,0170657,"CHEER HONEST COMPANY LIMITED
紀樂有限公司",1986-06-18,,"Private, ltd by shares"10,0170616,"CHEUNG YEUNG INVESTMENTS LIMITED
張楊置業有限公司",1986-06-18,,"Private, ltd by shares"11,0170618,"DEARATE COMPANY LIMITED",1986-06-18,2003-02-14,"Private, ltd by shares"12,0170679,"EASTERN HARBOUR CROSSING COMPANY LIMITED",1986-06-18,2009-04-07,"Private, ltd by shares"13,0170619,"FAIRFIELDS INDUSTRIAL COMPANY LIMITED
快富實業有限公司",1986-06-18,1998-10-16,"Private, ltd by shares"14,0170627,"FANIC INVESTMENT LIMITED
泛域投資有限公司",1986-06-18,2002-12-13,"Private, ltd by shares"15,0170663,"FAST LANE EXPRESS LIMITED (THE)",1986-06-18,1996-12-20,"Private, ltd by shares"16,0170655,"FINE PACIFIC INDUSTRIAL COMPANY LIMITED
豐洋實業有限公司",1986-06-18,,"Private, ltd by shares"17,0170669,"FOOK TIN GARMENT MANUFACTURERS LIMITED
富田時裝廠有限公司",1986-06-18,2020-04-17,"Private, ltd by shares"18,0170653,"GAIN EASE DEVELOPMENT (HOLDINGS) LIMITED
僑裕發展(集團)有限公司",1986-06-18,2003-04-03,"Private, ltd by shares"19,0170662,"GOLD BROAD DEVELOPMENT LIMITED
高博發展有限公司",1986-06-18,2005-06-10,"Private, ltd by shares"20,0170658,"GRAND FORM COMPANY LIMITED
紀偉有限公司",1986-06-18,2000-05-26,"Private, ltd by shares"21,0170660,"GRAND YORK LIMITED (d1999-09-10)
統樂有限公司",1986-06-18,1999-09-10,"Private, ltd by shares"22,0170623,"GREENE, BELFIELD-SMITH, DELTON (ASIA) LIMITED",1986-06-18,1995-03-10,"Private, ltd by shares"23,0170635,"HI LAUDA LIMITED",1986-06-18,1991-03-17,"Private, ltd by shares"24,0170656,"HK HEARING DEAF STUDENT EDUCATION CO. LIMITED
香港聽覺失聰學生教育有限公司",1986-06-18,2018-04-20,"Private, ltd by shares"25,0170654,"HKCA INTERNATIONAL LIMITED
港加美貿易有限公司",1986-06-18,2001-07-20,"Private, ltd by shares"26,0170612,"HONG KONG TOUGH GLASS LIMITED
香港強化玻璃有限公司",1986-06-18,,"Private, ltd by shares"27,0170625,"HWA SHIA CONSTRUCTION &amp; DECORATION COMPANY LIMITED
華夏建築裝飾有限公司",1986-06-18,1997-01-03,"Private, ltd by shares"28,0170620,"JEDEN COMPANY LIMITED
精敦有限公司",1986-06-18,1997-01-03,"Private, ltd by shares"29,0170645,"JORSBURG LIMITED
爽馳有限公司",1986-06-18,1997-02-21,"Private, ltd by shares"30,0170626,"KADO INDUSTRIAL COMPANY LIMITED
盈創(疊高)實業有限公司",1986-06-18,,"Private, ltd by shares"31,0170601,"KAM TANG FURNITURE DECORATION COMPANY LIMITED
金騰傢俬燈飾裝修有限公司",1986-06-18,1996-12-20,"Private, ltd by shares"32,0170599,"KIOI CAPITAL MANAGEMENT LIMITED",1986-06-18,2002-05-10,"Private, ltd by shares"33,0170633,"KORNWELL INVESTMENTS LIMITED
百興投資有限公司",1986-06-18,2002-12-20,"Private, ltd by shares"34,0170611,"KUNI-STARS COMPANY LIMITED
中日龍股份有限公司",1986-06-18,,"Private, ltd by shares"35,0170614,"KUO CHIAU BUSINESS COMPUTER COMPANY LIMITED
國喬事務電腦實業股份有限公司",1986-06-18,1996-12-20,"Private, ltd by shares"36,0170600,"KWONG TAI CHINA AGENCY COMPANY LIMITED
廣泰中國代理有限公司",1986-06-18,,"Private, ltd by shares"37,0170649,"L.W. CHENG INVESTMENT COMPANY LIMITED
鄭良詠投資有限公司",1986-06-18,,"Private, ltd by shares"38,0170634,"LA LUNA APPAREL LIMITED",1986-06-18,2003-04-25,"Private, ltd by shares"39,0170666,"LAW KWEI CHUNG &amp; SONS COMPANY LIMITED
羅貴冲父子有限公司",1986-06-18,,"Private, ltd by shares"40,0170642,"LEXVALE LIMITED (d1991-09-27)",1986-06-18,1991-09-27,"Private, ltd by shares"41,0170672,"LION ADVERTISING LIMITED
獅王廣告有限公司",1986-06-18,,"Private, ltd by shares"42,0170641,"LUXEMARK LIMITED (d2002-12-13)",1986-06-18,2002-12-13,"Private, ltd by shares"43,0170638,"MALTANIA LIMITED",1986-06-18,1997-03-14,"Private, ltd by shares"44,0170604,"MASTER JET SYSTEM LIMITED
中港貨運有限公司",1986-06-18,2002-10-25,"Private, ltd by shares"45,0170632,"METRO GLORY INVESTMENT LIMITED (d2008-11-28)
銘剛投資有限公司",1986-06-18,2008-11-28,"Private, ltd by shares"46,0170675,"MING YUEN ENTERPRISES LIMITED
明遠企業有限公司",1986-06-18,2011-02-18,"Private, ltd by shares"47,0170661,"ON FULL DYEING AND WEAVING FACTORY LIMITED
安富織染廠有限公司",1986-06-18,2002-10-11,"Private, ltd by shares"48,0170671,"P. MAN INTERNATIONAL LIMITED
柏文發展(國際)有限公司",1986-06-18,1996-01-24,"Private, ltd by shares"49,0170598,"POINT OF VIEW LIMITED (d1997-01-31)",1986-06-18,1997-01-31,"Private, ltd by shares"50,0170629,"PREFIX INVESTMENT LIMITED
基展投資有限公司",1986-06-18,1997-01-03,"Private, ltd by shares"51,0170674,"PREMIER ADVERTISING INTERNATIONAL LIMITED
美亞美廣告國際有限公司",1986-06-18,2004-06-11,"Private, ltd by shares"52,0170667,"PRODUCTION WORKSHOP LIMITED (d1996-12-20)
奇藝廣告有限公司",1986-06-18,1996-12-20,"Private, ltd by shares"53,0170610,"PROSPEROUS PROMOTION LIMITED
錦豐推廣有限公司",1986-06-18,2019-06-14,"Private, ltd by shares"54,0170631,"PYLON DEVELOPMENT LIMITED (d1997-01-03)
派麟發展有限公司",1986-06-18,1997-01-03,"Private, ltd by shares"55,0170608,"QUEENWILL TRAVEL SERVICES LIMITED
金獅旅遊有限公司",1986-06-18,2010-06-25,"Private, ltd by shares"56,0170652,"RICAL EXPRESS (CHINA) LIMITED
力高貨運(中國)有限公司",1986-06-18,2010-02-05,"Private, ltd by shares"57,0170607,"RISGAIN TRADING INTERNATIONAL COMPANY LIMITED
儷緻時裝國際有限公司",1986-06-18,2004-02-20,"Private, ltd by shares"58,0170597,"ROSEWOOD TEXTILE (H.K.) LIMITED",1986-06-18,1997-11-25,"Private, ltd by shares"59,0170646,"S &amp; B PACIFIC LIMITED
盛邦太平有限公司",1986-06-18,2001-03-16,"Private, ltd by shares"60,0170676,"S.K. KOLMAN (H.K.) LIMITED
仕高文(香港)有限公司",1986-06-18,1996-05-05,"Private, ltd by shares"61,0170640,"SAVILLS PROPERTY MANAGEMENT LIMITED
第一太平戴維斯物業管理有限公司",1986-06-18,,"Private, ltd by shares"62,0170606,"SHENNEX COMPANY LIMITED",1986-06-18,1996-12-20,"Private, ltd by shares"63,0170602,"SHUN SING ELECTROPLATING COMPANY LIMITED
信昇電鍍有限公司",1986-06-18,2011-08-05,"Private, ltd by shares"64,0170621,"SHUN TECK HONG COMPANY LIMITED
順德行木業有限公司",1986-06-18,2003-05-30,"Private, ltd by shares"65,0170613,"SILVERBACK TRANSNATIONAL, S.A. LIMITED",1986-06-18,1996-12-20,"Private, ltd by shares"66,0170644,"SUROCCO LIMITED",1986-06-18,1989-04-27,"Private, ltd by shares"67,0170665,"TAI HUNG TO COMPANY LIMITED",1986-06-18,1996-12-20,"Private, ltd by shares"68,0170594,"TAI PO YAU LOCK ASSOCIATION LIMITED
大埔友樂聯誼會有限公司",1986-06-18,1997-05-30,"Ltd by guarantee"69,0170622,"TAURUS PRODUCTS (FAR EAST) LIMITED",1986-06-18,1997-04-22,"Private, ltd by shares"70,0170636,"TENDICKS LIMITED
丹德有限公司",1986-06-18,1991-08-17,"Private, ltd by shares"71,0170673,"TOY INNOVATORS LIMITED",1986-06-18,1996-12-20,"Private, ltd by shares"72,0170595,"TRAVEL TRADE PUBLISHERS ASSOCIATION LIMITED",1986-06-18,1993-06-16,"Ltd by guarantee"73,0170678,"TRAVELEX TRAVEL SERVICES (CHINA) LIMITED
通濟隆旅行社(中國)有限公司",1986-06-18,2011-12-30,"Private, ltd by shares"74,0170648,"TUNG NAM WAI TAT INDUSTRIAL COMPANY LIMITED
東南偉達吸塑及植毛有限公司",1986-06-18,2017-11-24,"Private, ltd by shares"75,0170650,"UNICORN JEWELRY COMPANY LIMITED
麒麟珠寶有限公司",1986-06-18,2003-06-20,"Private, ltd by shares"76,0170668,"UNIQUE TECHNOLOGY (ASIA) LIMITED
裕利科技(亞洲)有限公司",1986-06-18,1996-12-20,"Private, ltd by shares"77,0170630,"VAKON DEVELOPMENT LIMITED
亨港發展有限公司",1986-06-18,2002-12-13,"Private, ltd by shares"78,0170677,"Viavi Solutions (Greater China) Limited",1986-06-18,,"Private, ltd by shares"79,0170628,"VICKS INVESTMENT LIMITED
力同投資有限公司",1986-06-18,1988-07-15,"Private, ltd by shares"80,0170670,"VIEW MORE DEVELOPMENT LIMITED
金煌發展有限公司",1986-06-18,,"Private, ltd by shares"81,0170617,"WELD-TEC EQUIPMENT SUPPLIES LIMITED
維特焊接器材有限公司",1986-06-18,,"Private, ltd by shares"82,0170615,"WELL TUNE KNITTERS LIMITED
和通織造廠有限公司",1986-06-18,1994-03-06,"Private, ltd by shares"83,0170647,"WILSON REFINER SERVICE (HONG KONG) LIMITED
威信冶煉服務香港有限公司",1986-06-18,1997-02-28,"Private, ltd by shares"84,0170659,"WORLD FINE INVESTMENT LIMITED (d1997-09-19)
顯運投資有限公司",1986-06-18,1997-09-19,"Private, ltd by shares"85,0170624,"YEELONG TRADING LIMITED
英港貿易有限公司",1986-06-18,1993-07-30,"Private, ltd by shares"86,0170664,"YUE PAK GROUPS LIMITED
裕北集團有限公司",1986-06-18,,"Private, ltd by shares"87,0170651,"YUWONO INVESTMENT COMPANY LIMITED
余氏投資有限公司",1986-06-18,2005-12-02,"Private, ltd by shares"