,Reg no.,Name,Incorp-orated,Dissolved,Type220,1159969,"MERCURY MODELS LIMITED (d2009-03-13)",2007-08-20,2009-03-13,"Private, ltd by shares"221,1159891,"MINGSHI LEADER INSTITUTE CO., LIMITED
名仕領袖學院有限公司",2007-08-20,2011-04-15,"Private, ltd by shares"222,1159735,"MINIMAX GROUP LIMITED
耀川國際有限公司",2007-08-20,,"Private, ltd by shares"223,1159855,"MJM (International) Group Limited
美加美(國際)集團有限公司",2007-08-20,,"Private, ltd by shares"224,1159797,"MOBILEGATE LIMITED",2007-08-20,2014-12-24,"Private, ltd by shares"225,1159933,"MONEY INTERNATIONAL TRADING COMPANY LIMITED
萬利國際興業有限公司",2007-08-20,2011-04-15,"Private, ltd by shares"226,1159712,"Mountrain Corporation Limited",2007-08-20,2019-04-12,"Private, ltd by shares"227,1159796,"MULTI SENSE LIMITED
拓成有限公司",2007-08-20,2014-12-24,"Private, ltd by shares"228,1159833,"NETYCOM TECHNOLOGY LIMITED
尼泰康科技有限公司",2007-08-20,2011-06-10,"Private, ltd by shares"229,1159768,"NEW RUIFENG TRADING (HONGKONG) COMPANY LIMITED
新瑞豐貿易(香港)有限公司",2007-08-20,2019-05-17,"Private, ltd by shares"230,1159725,"NEW SAILING (HK) INTERNATIONAL LIMITED
新成(香港)國際有限公司",2007-08-20,,"Private, ltd by shares"231,1159889,"NEW YANGTZE NAVIGATION (HONGKONG) CO., LIMITED
新長江航運(香港)有限公司",2007-08-20,,"Private, ltd by shares"232,1159653,"NIK NAK OVERSEAS LIMITED",2007-08-20,2013-11-22,"Private, ltd by shares"233,1159941,"NK DEVELOPMENT LIMITED
藝嘉企業發展有限公司",2007-08-20,,"Private, ltd by shares"234,1159924,"NOBTEL CO., LIMITED",2007-08-20,2017-02-24,"Private, ltd by shares"235,1159648,"OBSIDIAN (HONG KONG) HOTEL MANAGEMENT LIMITED
奧斯汀(香港)酒店管理有限公司",2007-08-20,2013-04-12,"Private, ltd by shares"236,1159872,"OCEAN CRANE LIMITED
揚海有限公司",2007-08-20,2015-07-17,"Private, ltd by shares"237,1159848,"OCTOPUS TRADING LIMITED (HK)
發達貿易有限公司",2007-08-20,,"Private, ltd by shares"238,1159676,"OSITEK (HONG KONG) INCORPORATION LIMITED
歐泰生物科技(香港)有限公司",2007-08-20,,"Private, ltd by shares"239,1159843,"OVERSEAS TRAVEL COMPANY LIMITED
海外旅遊有限公司",2007-08-20,,"Private, ltd by shares"240,1159660,"PABUK (HOLDINGS) COMPANY LIMITED
帕布(控股)有限公司",2007-08-20,,"Private, ltd by shares"241,1159800,"POINT VICTORY LIMITED
勝券有限公司",2007-08-20,2015-10-23,"Private, ltd by shares"242,1159930,"POS LOGISTICS LIMITED (HK)
普兆物流有限公司",2007-08-20,,"Private, ltd by shares"243,1159692,"Precise Biometrics Asia Limited",2007-08-20,2011-04-15,"Private, ltd by shares"244,1159834,"PREFERENCE PHARMACEUTICALS COMPANY LIMITED
柏豐藥業有限公司",2007-08-20,2017-04-28,"Private, ltd by shares"245,1159878,"PROFIT CROWN HOLDINGS LIMITED
君盈集團有限公司",2007-08-20,2010-10-15,"Private, ltd by shares"246,1159896,"PROUDER INDUSTRIAL LIMITED
寶駿達實業有限公司",2007-08-20,,"Private, ltd by shares"247,1159967,"PURUILAI (FINLAND) DEVELOPMENT LIMITED
普瑞萊(芬蘭)發展有限公司",2007-08-20,,"Private, ltd by shares"248,1159642,"PushAuction Limited
易寶香港有限公司",2007-08-20,,"Private, ltd by shares"249,1159909,"QINGDAO TIN LIMITED
青島錫業有限公司",2007-08-20,2020-06-12,"Private, ltd by shares"250,1159875,"RICH FIRST LIMITED (d2011-02-11)
始豐有限公司",2007-08-20,2011-02-11,"Private, ltd by shares"251,1159845,"RICH LAND CAPITAL LIMITED
富田資本管理有限公司",2007-08-20,2011-03-25,"Private, ltd by shares"252,1159749,"RICH POWER TECHNOLOGY GROUP LIMITED
銳普科技集團有限公司",2007-08-20,2019-05-17,"Private, ltd by shares"253,1159885,"RISE MAX LIMITED (b2007-08-20)
陞宏有限公司",2007-08-20,2019-05-17,"Private, ltd by shares"254,1159951,"ROSEDALE ENTERPRISES LIMITED",2007-08-20,,"Private, ltd by shares"255,1159748,"RT&amp;I GROUP CO., LIMITED
中華能源投資有限公司",2007-08-20,2013-11-22,"Private, ltd by shares"256,1159958,"RUITAO INDUSTRIAL LIMITED
瑞濤實業有限公司",2007-08-20,2018-05-11,"Private, ltd by shares"257,1159906,"RYDER INVESTMENTS LIMITED (d2012-11-16)",2007-08-20,2012-11-16,"Private, ltd by shares"258,1159733,"S.A. Ricci Investments Limited",2007-08-20,2012-11-16,"Private, ltd by shares"259,1159799,"SAIKAN INTERNATIONAL CEREMONY LIMITED
彩冠國際典禮有限公司",2007-08-20,2009-02-27,"Private, ltd by shares"260,1159903,"SANKAWA MARKETING (HK) LIMITED
三川拓展(香港)有限公司",2007-08-20,2011-04-15,"Private, ltd by shares"261,1159678,"SEABREEZE LIMITED
海泠有限公司",2007-08-20,,"Private, ltd by shares"262,1159773,"SEEKERCHOICE TECHNOLOGIES GROUP CO., LIMITED
星海創科技集團有限公司",2007-08-20,2011-04-15,"Private, ltd by shares"263,1159971,"SFJ INTERNATIONAL CO., LIMITED",2007-08-20,,"Private, ltd by shares"264,1159675,"SHANG JU COMPUTER KNITTING COMPANY LIMITED
尚居電腦針織有限公司",2007-08-20,2011-04-01,"Private, ltd by shares"265,1159929,"SHANGHAI FUSHI TONGQING INT'L GROUP LIMITED
上海富仕同慶國際集團有限公司",2007-08-20,2019-05-17,"Private, ltd by shares"266,1159921,"SHANGHAI HONGHUANXI GROUP HOLDING LIMITED
上海紅歡喜集團股份有限公司",2007-08-20,2019-05-17,"Private, ltd by shares"267,1159774,"SHANGHAI JINNUODA CONDUIT LIMITED
上海金諾達管業有限公司",2007-08-20,2011-04-15,"Private, ltd by shares"268,1159698,"SHANTOU HENGTAI FOOTWEAR CO., LIMITED
汕頭市亨泰鞋業有限公司",2007-08-20,,"Private, ltd by shares"269,1159832,"SHENG QIQI INNOVATION TECHNOLOGY GROUP (HONG KONG) INTERNATIONAL RESEARCH &amp; DEVELOPMENT CENTER LIMITED
聖騏祺創科集團(香港)國際研究開發中心有限公司",2007-08-20,2012-11-16,"Private, ltd by shares"270,1159762,"SHENZHEN JINGZHUO TECHNOLOGY CO., LIMITED
精焯電路技術有限公司",2007-08-20,2015-02-13,"Private, ltd by shares"271,1159890,"SHINING SUN LIMITED
朗日有限公司",2007-08-20,,"Private, ltd by shares"272,1159700,"SHORYO INTERNATIONAL (HONG KONG) CO., LIMITED
昌菱國際(香港)有限公司",2007-08-20,,"Private, ltd by shares"273,1159935,"SHUN CHEUNG LOGISTICS LIMITED
順翔物流有限公司",2007-08-20,2010-07-23,"Private, ltd by shares"274,1159702,"SILICORP CO., LIMITED
晶盟科技有限公司",2007-08-20,2012-01-06,"Private, ltd by shares"275,1159881,"SINO CHOICE INTERNATIONAL LIMITED
彩華國際有限公司",2007-08-20,,"Private, ltd by shares"276,1159651,"SINO-UNIVERSE ENTERPRISES LIMITED
琛宇實業有限公司",2007-08-20,2012-11-16,"Private, ltd by shares"277,1159641,"SINOTEC TRADING CO., LIMITED
協科貿易有限公司",2007-08-20,,"Private, ltd by shares"278,1159912,"SKY BRAVE LIMITED
傲天有限公司",2007-08-20,2013-01-16,"Private, ltd by shares"279,1159953,"SKY PRO ENGINEERING LIMITED
天普工程有限公司",2007-08-20,,"Private, ltd by shares"280,1159813,"SKY TREND INC. LIMITED
天卓興業有限公司",2007-08-20,,"Private, ltd by shares"281,1159945,"SMITH &amp; NEPHEW SUZHOU HOLDINGS LIMITED",2007-08-20,,"Private, ltd by shares"282,1159928,"SOHO REAL ESTATE COMPANY LIMITED
蘇豪物業有限公司",2007-08-20,,"Private, ltd by shares"283,1159724,"STAR DRAGON INTERNATIONAL LIMITED
九洲國際集團有限公司",2007-08-20,2013-02-01,"Private, ltd by shares"284,1159695,"STAR LIGHT OPTO-ELECTRONIC CO., LIMITED
星光光電(香港)有限公司",2007-08-20,,"Private, ltd by shares"285,1159717,"STO ELECTRONICS HONG KONG LIMITED
建鋒電子香港有限公司",2007-08-20,,"Private, ltd by shares"286,1159981,"SUPER HOUSEWARE COMPANY LIMITED
長豐家庭用品有限公司",2007-08-20,2016-04-15,"Private, ltd by shares"287,1159803,"SUPER STAR HONG KONG DEVELOPMENT LIMITED
明星香港發展有限公司",2007-08-20,,"Private, ltd by shares"288,1159806,"SUZUKO INTERNATIONAL LIMITED
鈴晃國際有限公司",2007-08-20,2018-03-29,"Private, ltd by shares"289,1159666,"SWISS ASIAN PROPERTY LIMITED
瑞亞置業有限公司",2007-08-20,2019-04-12,"Private, ltd by shares"290,1159714,"THOUSANDSMILE INDUSTRIAL DEVELOPMENT LIMITED
千里實業發展有限公司",2007-08-20,2012-11-16,"Private, ltd by shares"291,1159954,"TOFF INVESTMENT GROUP LIMITED
拓福投資集團有限公司",2007-08-20,,"Private, ltd by shares"292,1159743,"TOM COMMERCIAL CONSULTANTS LIMITED
湯姆商業咨詢有限公司",2007-08-20,,"Private, ltd by shares"293,1159817,"TONGKE ELECTRONICS CO., LIMITED
香港通科電子有限公司",2007-08-20,2019-07-05,"Private, ltd by shares"294,1159977,"TONY SAMUELS CAPITAL LIMITED",2007-08-20,,"Private, ltd by shares"295,1159914,"TOP DIAMOND LIMITED
天鑽有限公司",2007-08-20,,"Private, ltd by shares"296,1159718,"TOP FINANCIAL MANAGEMENT LIMITED
第一金融管理有限公司",2007-08-20,,"Private, ltd by shares"297,1159722,"TOP HOLDINGS GROUP LIMITED
第一控股集團有限公司",2007-08-20,,"Private, ltd by shares"298,1159830,"TOPPING INDUSTRIAL CORPORATION LIMITED
托品工業有限公司",2007-08-20,2010-03-26,"Private, ltd by shares"299,1159908,"TRANS AFRICA TRADE AGENCY LIMITED",2007-08-20,2011-04-15,"Private, ltd by shares"300,1159825,"TRICOM INVESTMENT (GROUP) LIMITED
卓佳投資(集團)有限公司",2007-08-20,2015-07-17,"Private, ltd by shares"301,1159966,"UC COLLECTION INTERNATIONAL LIMITED
億誠國際貿易有限公司",2007-08-20,,"Private, ltd by shares"302,1159752,"UNIK CONSTRUCTION ENGINEERING (PTY) LIMITED",2007-08-20,,"Private, ltd by shares"303,1159824,"Union Chemicals (China) Company Limited
聯塑化工(中國)有限公司",2007-08-20,,"Private, ltd by shares"304,1159816,"Union Chemicals Company Limited
聯塑化工貿易有限公司",2007-08-20,,"Private, ltd by shares"305,1159758,"UNITED STATES FLOWER UMBRELLA INTERNATIONAL FASHION LIMITED (THE)
美國花雨傘國際時裝有限公司",2007-08-20,2011-04-15,"Private, ltd by shares"306,1159730,"UNIVERSAL SECRETARY SERVICE LIMITED",2007-08-20,2011-12-23,"Private, ltd by shares"307,1159734,"UP TO DATE PARTY LIMITED",2007-08-20,2013-05-31,"Private, ltd by shares"308,1159913,"USA BIOLOGICAL SCIENCE INSTITUTE LIMITED
美國生命科學研究院有限公司",2007-08-20,2011-04-15,"Private, ltd by shares"309,1159715,"USA TONICE PETROLEUM (CHINA) LIMITED
美國特耐斯石油(中國)有限公司",2007-08-20,,"Private, ltd by shares"310,1159837,"V&amp;D PROPERTY INVESTMENTS LIMITED",2007-08-20,2013-11-08,"Private, ltd by shares"311,1159791,"VICTORY CENTRE LIMITED (d2011-06-10)
域中有限公司",2007-08-20,2011-06-10,"Private, ltd by shares"312,1159770,"VINON TOOLS INDUSTRIAL CO., LIMITED
威能工具實業有限公司",2007-08-20,,"Private, ltd by shares"313,1159957,"VINYL GROUP LIMITED (d2013-11-22)",2007-08-20,2013-11-22,"Private, ltd by shares"314,1159959,"W WIDE ENTERPRISES LIMITED",2007-08-20,,"Private, ltd by shares"315,1159697,"WAI LEE PAPER PRODUCT COMPANY LIMITED
維利紙品有限公司",2007-08-20,2009-01-16,"Private, ltd by shares"316,1159842,"WAI NAM INDUSTRIAL LIMITED
偉林實業有限公司",2007-08-20,,"Private, ltd by shares"317,1159643,"WEALCHY INTERNATIONAL LIMITED
緯緻國際有限公司",2007-08-20,,"Private, ltd by shares"318,1159905,"WEDI CHEMISTRYPLASTIC LIMITED
德國竟誠化工貿易有限公司",2007-08-20,2011-04-15,"Private, ltd by shares"319,1159793,"WELL HONOUR INVESTMENT (GROUP) LIMITED
偉恒投資(集團)有限公司",2007-08-20,,"Private, ltd by shares"320,1159894,"WEST CORK CONSULTING LIMITED",2007-08-20,2011-11-18,"Private, ltd by shares"321,1159860,"WHOLE GRAND LIMITED
全廣有限公司",2007-08-20,,"Private, ltd by shares"322,1159870,"WIDE LINK LIMITED (d2010-02-26)
滙宏有限公司",2007-08-20,2010-02-26,"Private, ltd by shares"323,1159807,"WILLIAM CORPORATION LIMITED
威廉有限公司",2007-08-20,,"Private, ltd by shares"324,1159873,"WINNER LINK LIMITED (d2015-07-17)
惠盟有限公司",2007-08-20,2015-07-17,"Private, ltd by shares"325,1159864,"WINNER WAY LIMITED
勝惠有限公司",2007-08-20,,"Private, ltd by shares"326,1159847,"WINTEK INTERNATIONAL GROUP LIMITED",2007-08-20,2011-04-15,"Private, ltd by shares"327,1159882,"WISE BUSINESS INTERNATIONAL LIMITED
偉業國際有限公司",2007-08-20,2010-12-17,"Private, ltd by shares"328,1159819,"WORLD CHINESE AND CHINESE BUSINESS INTERNATIONAL FUND MANAGEMENT GROUP LIMITED
世界華裔華商國際基金管理集團有限公司",2007-08-20,2012-11-16,"Private, ltd by shares"329,1159841,"WORLD CHINESE EXTERNAL LABOR TRADE GROUP LIMITED
世界華人對外勞務經貿集團有限公司",2007-08-20,2012-11-16,"Private, ltd by shares"330,1159904,"XIAMEN GUANGYANG TRADING CO., LIMITED
廈門廣洋貿易有限公司",2007-08-20,2015-07-17,"Private, ltd by shares"331,1159821,"XIN FENG INT'L CULTURE COMMUNICATION LIMITED
鑫峰國際文化傳播有限公司",2007-08-20,2014-12-24,"Private, ltd by shares"332,1159688,"XIN RUI INTERNATIONAL SEA LOGISTICS LIMITED
鑫瑞國際海運有限公司",2007-08-20,2012-04-27,"Private, ltd by shares"333,1159812,"XING YI DESIGN LIMITED
型逸室內設計有限公司",2007-08-20,,"Private, ltd by shares"334,1159771,"XIYONG TECHNOLOGY COMPANY LIMITED",2007-08-20,2015-07-17,"Private, ltd by shares"335,1159750,"XUZHOU EVERBRIGHT SINSING DUCTILE IRON PIPES CO., LIMITED",2007-08-20,,"Private, ltd by shares"336,1159647,"YAU BONG WAN DAT GROUP (HK) LIMITED
友邦萬達國際實業集團(香港)有限公司",2007-08-20,2011-04-15,"Private, ltd by shares"337,1159772,"YI AN (HONGKONG) CO., LIMITED
易安(香港)有限公司",2007-08-20,,"Private, ltd by shares"338,1159658,"YINGFENG CO., LIMITED
盈鋒國際貿易有限公司",2007-08-20,2009-12-11,"Private, ltd by shares"339,1159760,"YIP RESOURCE &amp; SERVICE LIMITED
一品資源與服務有限公司",2007-08-20,2014-12-24,"Private, ltd by shares"340,1159662,"YONGSHENGYE HONGKONG TRADING CO., LIMITED
永盛業香港有限公司",2007-08-20,2017-04-13,"Private, ltd by shares"341,1159849,"YOULI HOLDING CO., LIMITED
香港友立股份有限公司",2007-08-20,,"Private, ltd by shares"342,1159654,"YUET FOOK (HK) CO., LIMITED
悅福(香港)有限公司",2007-08-20,,"Private, ltd by shares"343,1159721,"ZDNAV CO., LIMITED
中大科技領航有限公司",2007-08-20,2012-02-03,"Private, ltd by shares"344,1159934,"ZHONG ZHI (HONG KONG) TRADING COMPANY LIMITED
中志(香港)經貿有限公司",2007-08-20,2011-04-15,"Private, ltd by shares"345,1159899,"ZHONGNONG UNITED INTERNATIONAL FERTILIZER IMPORT AND EXPORT GROUP (YANTAI) LIMITED
中農聯合國際化肥進出口集團(煙臺)有限公司",2007-08-20,2012-11-16,"Private, ltd by shares"