,Reg no.,Name,Incorp-orated,Dissolved,Type1,1159856,"4-TEC SOLUTIONS LIMITED
科研顧問有限公司",2007-08-20,,"Private, ltd by shares"2,1159901,"ABSOLUTE LASER SKIN CARE LIMITED",2007-08-20,,"Private, ltd by shares"3,1159978,"ACADEMY KINDERGARTEN (TIN SHUI WAI) LIMITED
翰林幼稚園(天水圍)有限公司",2007-08-20,,"Ltd by guarantee"4,1159655,"ACE AUSTRALIA LIMITED",2007-08-20,2010-04-09,"Private, ltd by shares"5,1159723,"ACESTAR INTERNATIONAL LIMITED
鼎毅國際有限公司",2007-08-20,,"Private, ltd by shares"6,1159939,"Actmax Developments Limited",2007-08-20,2008-12-12,"Private, ltd by shares"7,1159853,"ADVANCE GLORY LIMITED
耀進有限公司",2007-08-20,,"Private, ltd by shares"8,1159766,"AE3 COMPANY LIMITED",2007-08-20,2014-12-24,"Private, ltd by shares"9,1159911,"AFRICA DEVELOPMENT INTERNATIONAL LIMITED",2007-08-20,2012-11-16,"Private, ltd by shares"10,1159948,"AIM Ultramar Limited",2007-08-20,2016-02-05,"Private, ltd by shares"11,1159952,"ALBOKARI TRADING CO., LIMITED
布卡瑞貿易有限公司",2007-08-20,,"Private, ltd by shares"12,1159755,"ALPHASHION (HK) LIMITED
友城國際有限公司",2007-08-20,2020-06-12,"Private, ltd by shares"13,1159938,"Andritz Fabrics and Rolls Asia Holding Limited",2007-08-20,,"Private, ltd by shares"14,1159895,"ANGLO-FRENCH WINE INTERNATIONAL GROUP (CHINA) CO., LIMITED
英法洋酒國際集團(中國)有限公司",2007-08-20,2012-05-25,"Private, ltd by shares"15,1159943,"Antex Group Limited
安達企業集團有限公司",2007-08-20,2011-12-09,"Private, ltd by shares"16,1159820,"APEX GROUP INTERNATIONAL LIMITED
頂點美食國際有限公司",2007-08-20,2019-11-08,"Private, ltd by shares"17,1159728,"APEX MATERIAL CO., LIMITED",2007-08-20,2012-11-16,"Private, ltd by shares"18,1159983,"APPLE CARGO FREIGHT LIMITED
永恒聯運有限公司",2007-08-20,2011-04-15,"Private, ltd by shares"19,1159670,"ARK GLOBAL BUSINESS SOLUTIONS LIMITED",2007-08-20,2014-08-01,"Private, ltd by shares"20,1159691,"ARTREND GROUP LIMITED
藝康控股有限公司",2007-08-20,,"Private, ltd by shares"21,1159857,"ASIA HILL LIMITED
鼎亞有限公司",2007-08-20,,"Private, ltd by shares"22,1159979,"AUSTOR ENERGY-SAVING LIGHTING LIMITED
奧皆華節能照明電器有限公司",2007-08-20,2011-01-07,"Private, ltd by shares"23,1159701,"BAIDUO TRADING LIMITED
百多貿易有限公司",2007-08-20,2012-11-16,"Private, ltd by shares"24,1159694,"BAILITONG HOLDINGS LIMITED
百利通集團有限公司",2007-08-20,,"Private, ltd by shares"25,1159846,"BEAUTIFUL WORLD INT'L GROUP (HK) LIMITED
美世界國際集團(香港)有限公司",2007-08-20,,"Private, ltd by shares"26,1159919,"Beauty Factor Limited",2007-08-20,2018-12-14,"Private, ltd by shares"27,1159686,"BEIS UNITY LIMITED
三元融匯有限公司",2007-08-20,,"Private, ltd by shares"28,1159681,"BELLA HEALTH CARE PRODUCTS LIMITED",2007-08-20,2014-12-24,"Private, ltd by shares"29,1159780,"BEST PLAN TRADING LIMITED
藍圖貿易有限公司",2007-08-20,,"Private, ltd by shares"30,1159829,"BEST POWER (CHINA) LIMITED
力佳(中國)有限公司",2007-08-20,,"Private, ltd by shares"31,1159818,"BFT MARINE (HK) LIMITED
豐安達海事(香港)有限公司",2007-08-20,,"Private, ltd by shares"32,1159696,"Bio Pharm Holdings, Limited",2007-08-20,2017-04-13,"Private, ltd by shares"33,1159689,"BORCHI INVESTMENT &amp; TRADING COMPANY LIMITED
博爾奇投資貿易有限公司",2007-08-20,2018-03-23,"Private, ltd by shares"34,1159823,"BRITURE (HK) CO., LIMITED
布萊特(香港)有限公司",2007-08-20,2016-03-04,"Private, ltd by shares"35,1159859,"C-OCEAN (HONGKONG) LIMITED
誠洋(香港)有限公司",2007-08-20,,"Private, ltd by shares"36,1159916,"C.K.V. (Nominees) Limited",2007-08-20,2009-07-24,"Private, ltd by shares"37,1159965,"CADAMOSTO (HK) LIMITED",2007-08-20,2010-12-17,"Private, ltd by shares"38,1159810,"Calenasia Limited",2007-08-20,2009-09-25,"Private, ltd by shares"39,1159960,"CAMS INTERNATIONAL LIMITED
匯雄興業有限公司",2007-08-20,2010-01-08,"Private, ltd by shares"40,1159703,"CANONICAL INVESTMENTS LIMITED",2007-08-20,,"Private, ltd by shares"41,1159744,"CARGO A CLUB LIMITED",2007-08-20,,"Private, ltd by shares"42,1159674,"Cast Art Music Academy Limited
卓藝音樂訓練中心有限公司",2007-08-20,2015-07-17,"Private, ltd by shares"43,1159892,"CERES INTERNATIONAL TRADE LIMITED
賽銳國際貿易有限公司",2007-08-20,2009-04-17,"Private, ltd by shares"44,1159787,"CHEER RIGHT LIMITED
興致有限公司",2007-08-20,,"Private, ltd by shares"45,1159705,"Chief Idea Limited
集意有限公司",2007-08-20,,"Private, ltd by shares"46,1159740,"CHINA AEROSPACE GENERAL EQUIPMENT GROUP CORPORATION LIMITED
中國航天通用裝備集團有限公司",2007-08-20,,"Private, ltd by shares"47,1159917,"CHINA JIA LIAN INVESTMENT (H.K.) LIMITED
中國佳蓮投資(香港)有限公司",2007-08-20,2018-12-28,"Private, ltd by shares"48,1159867,"CHINA PIONEER DEVELOPMENT LIMITED (d2011-04-15)
華鋒發展有限公司",2007-08-20,2011-04-15,"Private, ltd by shares"49,1159665,"CHINA RADIO TECH. LIMITED
中國無線技術有限公司",2007-08-20,2018-04-27,"Private, ltd by shares"50,1159745,"China Ramble Paper Company Limited
中國遠博紙業有限公司",2007-08-20,,"Private, ltd by shares"51,1159865,"CHINA TRADER LIMITED
華商有限公司",2007-08-20,,"Private, ltd by shares"52,1159751,"CHINA UNIVERSAL EXPRESS COMPANY LIMITED
華宇快運有限公司",2007-08-20,2013-11-15,"Private, ltd by shares"53,1159972,"CHINA WORLD PEACE FOUNDATION LIMITED
中國世界和平基金會有限公司",2007-08-20,,"Ltd by guarantee"54,1159640,"CHITE LIYA CO., LIMITED
琪特力亞有限公司",2007-08-20,2014-12-24,"Private, ltd by shares"55,1159850,"CITYLOVER (HK) INTERNATIONAL GROUP CO., LIMITED
都市情人(香港)國際集團有限公司",2007-08-20,2018-03-23,"Private, ltd by shares"56,1159980,"CLEANSING STREAM MINISTRIES, HONG KONG, LIMITED",2007-08-20,2014-03-20,"Ltd by guarantee"57,1159671,"Club Miracle Limited (d2011-04-15)",2007-08-20,2011-04-15,"Private, ltd by shares"58,1159699,"CONTEMPHOME LIMITED",2007-08-20,,"Private, ltd by shares"59,1159781,"CONTRACT ENGINEERING &amp; SUPPLYING (PTY) LIMITED",2007-08-20,,"Private, ltd by shares"60,1159785,"COSMO ACE LIMITED
宇嘉有限公司",2007-08-20,2010-04-09,"Private, ltd by shares"61,1159656,"Decomur Limited",2007-08-20,2015-02-06,"Private, ltd by shares"62,1159839,"DHARAGLOBAL LIMITED",2007-08-20,,"Private, ltd by shares"63,1159788,"DHL eCommerce (Hong Kong) Limited
敦豪電子商務物流(香港)有限公司",2007-08-20,,"Private, ltd by shares"64,1159693,"DLONG INDUSTRIAL LIMITED
帝龍工業有限公司",2007-08-20,,"Private, ltd by shares"65,1159753,"DONGHAI RIFENG CONDUIT LIMITED
東海日豐管業有限公司",2007-08-20,2013-11-22,"Private, ltd by shares"66,1159893,"DONGRAN ELECTRIC (HONGKONG) LIMITED
東然電氣(香港)有限公司",2007-08-20,2012-11-16,"Private, ltd by shares"67,1159982,"DU'S INDUSTRY (HONG KONG) LIMITED
杜氏實業(香港)有限公司",2007-08-20,2012-11-23,"Private, ltd by shares"68,1159883,"EAGLE PROSPER INVESTMENTS LIMITED (d2009-04-17)
鵬盛投資有限公司",2007-08-20,2009-04-17,"Private, ltd by shares"69,1159974,"EAST POWER (CHINA) LIMITED
東電(中國)有限公司",2007-08-20,2013-11-22,"Private, ltd by shares"70,1159801,"EASY MILLION LIMITED (HK)
美依有限公司",2007-08-20,,"Private, ltd by shares"71,1159897,"ECOLUTIONS NEW ENERGY INVESTMENT CO., LIMITED
艾庫樂森新能源投資有限公司",2007-08-20,,"Private, ltd by shares"72,1159961,"EDIM INTERNATIONAL LIGHTING TECHNOLOGY (HONGKONG) CO., LIMITED
一定國際照明科技(香港)有限公司",2007-08-20,2017-04-13,"Private, ltd by shares"73,1159827,"EIHON ACCESSORIES MFY TRADING COMPANY LIMITED
香港藝行飾品有限公司",2007-08-20,,"Private, ltd by shares"74,1159729,"EMAXA GROUP LIMITED",2007-08-20,,"Private, ltd by shares"75,1159915,"ENGLAND ETON 1838 TEXTILE INTERNATIONAL GROUP LIMITED
英國伊頓1838紡織國際集團有限公司",2007-08-20,2011-04-15,"Private, ltd by shares"76,1159639,"EUROPE AIERSIYAN INT'L DRESS LIMITED
歐洲艾爾斯岩國際服飾有限公司",2007-08-20,2012-11-16,"Private, ltd by shares"77,1159926,"EVER BLOOMING ASIA TRADING CO. LIMITED
恆利來亞洲貿易有限公司",2007-08-20,,"Private, ltd by shares"78,1159869,"EVER EAST LIMITED (d2011-04-15)
恒東有限公司",2007-08-20,2011-04-15,"Private, ltd by shares"79,1159836,"EVER STRATEGY (HK) LIMITED
恒策(香港)有限公司",2007-08-20,2016-04-15,"Private, ltd by shares"80,1159776,"F-BARTL GROUP LIMITED (d2014-12-24)",2007-08-20,2014-12-24,"Private, ltd by shares"81,1159840,"F1 INT'L LEAGUE MATCH (CHINA) SPECIAL TRAINING LIMITED
一級方程式國際賽聯(中國)特訓有限公司",2007-08-20,2011-04-15,"Private, ltd by shares"82,1159854,"FINE VICTORY LIMITED
輝勝有限公司",2007-08-20,,"Private, ltd by shares"83,1159900,"FINERSOURCE INTERNATIONAL CO., LIMITED
豪資國際有限公司",2007-08-20,2010-07-23,"Private, ltd by shares"84,1159808,"FIRMWILL FAR EAST LIMITED
金堅遠東有限公司",2007-08-20,,"Private, ltd by shares"85,1159944,"Five Rocks Limited (HK)
五洛有限公司",2007-08-20,,"Private, ltd by shares"86,1159844,"FOCH GROUP LIMITED
方元集團有限公司",2007-08-20,2017-04-13,"Private, ltd by shares"87,1159866,"FOREIGN CURTAIN CONSULTANT LIMITED
科倫窗簾工程有限公司",2007-08-20,2009-10-23,"Private, ltd by shares"88,1159884,"FOREVER GREEN INVESTMENTS LIMITED (d2010-01-29)
長青投資有限公司",2007-08-20,2010-01-29,"Private, ltd by shares"89,1159659,"FORTUNE ELECTRONICS INDUSTRIAL LIMITED
華晨電子實業有限公司",2007-08-20,2018-09-07,"Private, ltd by shares"90,1159794,"FORTUNE INCOME LIMITED
運鑫有限公司",2007-08-20,,"Private, ltd by shares"91,1159828,"FORTUNE STATE ENTERPRISE LIMITED",2007-08-20,,"Private, ltd by shares"92,1159759,"FOSHAN KINGFULLY INDUSTRY CO., LIMITED
佛山市金富力實業有限公司",2007-08-20,2012-01-06,"Private, ltd by shares"93,1159798,"FRANCE SOLEIL LEVE WINE INVESTMENT GROUP (HONG KONG) LIMITED
法國啟陽酒業投資集團(香港)有限公司",2007-08-20,,"Private, ltd by shares"94,1159947,"FRANKLYN GLOBAL INTERNATIONAL LIMITED",2007-08-20,2012-11-16,"Private, ltd by shares"95,1159732,"FTW BUSINESS SERVICES LIMITED
港駿商業服務有限公司",2007-08-20,,"Private, ltd by shares"96,1159789,"FULL AMASS INDUSTRIAL DEVELOPMENT PTY. LIMITED
東富盈實業發展有限公司",2007-08-20,,"Private, ltd by shares"97,1159871,"GAINLY LIMITED (HK)
進利有限公司",2007-08-20,,"Private, ltd by shares"98,1159822,"GBY INDUSTRIAL (HONG KONG) LIMITED
百源實業(香港)有限公司",2007-08-20,2012-12-14,"Private, ltd by shares"99,1159937,"GCL HOME FASHIONS CO. LIMITED
奇勝家紡有限公司",2007-08-20,,"Private, ltd by shares"100,1159886,"GET RICH TRADING LIMITED
皆富貿易有限公司",2007-08-20,,"Private, ltd by shares"101,1159949,"GLOBAL DESIGN GROUP CO., LIMITED
家樂集團有限公司",2007-08-20,,"Private, ltd by shares"102,1159858,"GLORIOUS CAPITAL LIMITED (d2011-01-21)
采都有限公司",2007-08-20,2011-01-21,"Private, ltd by shares"103,1159710,"GOEVER LIMITED",2007-08-20,,"Private, ltd by shares"104,1159874,"GOLDEN OCEAN ENTERPRISES LIMITED
金洋企業有限公司",2007-08-20,,"Private, ltd by shares"105,1159802,"GOLDEN ON INC. LIMITED
金安興業有限公司",2007-08-20,,"Private, ltd by shares"106,1159880,"GOLDEN POWER INTERNATIONAL LIMITED
金栢國際有限公司",2007-08-20,,"Private, ltd by shares"107,1159920,"GOOD NEWS KNOWLEDGE TRADEMARK AGENT INTERNATIONAL (HK) LIMITED
好消息知識產權代理國際 ( 香港 ) 有限公司",2007-08-20,2011-04-15,"Private, ltd by shares"108,1159664,"GR (INT'L) IC LIMITED
戈爾(國際)集成電路有限公司",2007-08-20,2011-04-15,"Private, ltd by shares"109,1159673,"GRAND VIEW TECHNOLOGY LIMITED
泰印科技有限公司",2007-08-20,2018-01-19,"Private, ltd by shares"110,1159811,"GREAT FULL CHEMICAL PLASTIC TRADE (HK) LIMITED
怡豐化塑貿易(香港)有限公司",2007-08-20,2012-11-16,"Private, ltd by shares"111,1159704,"GUIHO SHIPPING (HK) LIMITED
桂航船務(香港)有限公司",2007-08-20,2016-04-15,"Private, ltd by shares"112,1159663,"H.K SHINING LEAVES INT'L FASHION LIMITED
香港希麗維絲國際時裝有限公司",2007-08-20,2011-04-15,"Private, ltd by shares"113,1159927,"H.K. BEAUTY INDUSTRY (INT'L) MANAGEMENT LIMITED
香港美業(國際)管理有限公司",2007-08-20,2011-04-15,"Private, ltd by shares"114,1159805,"HAI RUN TONG ENTERPRISES (HONGKONG) LIMITED
海潤通企業(香港)有限公司",2007-08-20,,"Private, ltd by shares"115,1159669,"HANWOODS DESIGN &amp; CONSTRUCTION INTERNATIONAL GROUP LIMITED
五茲國際建築設計集團有限公司",2007-08-20,2015-01-23,"Private, ltd by shares"116,1159861,"HAPPY LUCK LIMITED
瑞欣有限公司",2007-08-20,,"Private, ltd by shares"117,1159863,"HARVEST CREST LIMITED
峰發有限公司",2007-08-20,2011-09-02,"Private, ltd by shares"118,1159727,"HASTINGS ASIA LIMITED",2007-08-20,2018-11-23,"Private, ltd by shares"119,1159708,"HEALTH PARK (HK) INDUSTRIAL LIMITED
康柏(香港)實業有限公司",2007-08-20,2017-12-01,"Private, ltd by shares"120,1159792,"HEMISHERE LIMITED
半球有限公司",2007-08-20,,"Private, ltd by shares"121,1159649,"HIKING INDUSTRIAL CO., LIMITED (d2018-11-09)
弘生貿易有限公司",2007-08-20,2018-11-09,"Private, ltd by shares"122,1159956,"HK BAIFU INT'L CHAMBER SCHEME INVESTMENT MANAGE LIMITED
香港百富國際會所策劃投資管理有限公司",2007-08-20,2012-11-16,"Private, ltd by shares"123,1159898,"HK BAKER INT'L LIMITED
香港巴可國際有限公司",2007-08-20,,"Private, ltd by shares"124,1159645,"HK CLEMENT INVESTMENT MANAGEMENT (HOLDING) LIMITED
香港平元堂投資管理(控股)有限公司",2007-08-20,2008-06-13,"Private, ltd by shares"125,1159936,"HK ETCETRA LIMITED
香港前景路有限公司",2007-08-20,2012-11-16,"Private, ltd by shares"126,1159672,"HK FEELY DRESS GROUP LIMITED
香港芾誘服飾集團有限公司",2007-08-20,2011-04-15,"Private, ltd by shares"127,1159783,"HK HEI INTERNATIONAL TRADING CO., LIMITED
香港合益國際貿易有限公司",2007-08-20,2010-09-10,"Private, ltd by shares"128,1159767,"HK HUAFA INT'L INVESTMENT (ZHEJIANG) DEVELOPMENT LIMITED
香港華發國際投資(浙江)發展有限公司",2007-08-20,2012-11-16,"Private, ltd by shares"129,1159668,"HK KAMAS INTERNATIONAL HOLDING CO., LIMITED
香港康麥斯國際控股有限公司",2007-08-20,2013-03-08,"Private, ltd by shares"130,1159910,"HK KECHENG TEXTILE GROUP LIMITED
香港可誠紡織品集團有限公司",2007-08-20,2013-11-22,"Private, ltd by shares"131,1159711,"HK ORANGE DIAMOND FASHION LIMITED
香港橘鑽服飾有限公司",2007-08-20,2012-11-16,"Private, ltd by shares"132,1159782,"HK TECHNOLOGY CONSULTING LIMITED",2007-08-20,2011-02-11,"Private, ltd by shares"133,1159852,"HK WUXI TRADE ASSOCIATION LIMITED
香港無錫商會有限公司",2007-08-20,,"Ltd by guarantee"134,1159862,"HOI PAK (HK) DEVELOPMENT LIMITED
海柏(香港)發展有限公司",2007-08-20,,"Private, ltd by shares"135,1159923,"HOME PLUS HONG KONG CO., LIMITED",2007-08-20,2017-04-28,"Private, ltd by shares"136,1159826,"HONG KONG BOND INDUSTRIAL LIMITED
香港邦德實業有限公司",2007-08-20,2019-09-13,"Private, ltd by shares"137,1159778,"HONG KONG CHINA EUROPE INTERNATIONAL BUSINESS UNIVERSITY LIMITED
香港中歐國際商學院有限公司",2007-08-20,,"Private, ltd by shares"138,1159973,"HONG KONG DING YIM INDUSTRIAL LIMITED
香港鼎鑫實業有限公司",2007-08-20,2012-11-16,"Private, ltd by shares"139,1159741,"HONG KONG EVERRICH TRADING COMPANY LIMITED
香港新希望貿易有限公司",2007-08-20,2018-06-01,"Private, ltd by shares"140,1159932,"HONG KONG GIANT ASIA CONTAINER DEVELOPMENT LIMITED
香港大亞集裝箱發展有限公司",2007-08-20,2014-12-24,"Private, ltd by shares"141,1159779,"HONG KONG GOLDEN STAR INTERNATIONAL INVESTMENT COMPANY LIMITED
香港金星國際投資有限公司",2007-08-20,2018-08-10,"Private, ltd by shares"142,1159765,"HONG KONG HIGHER CONTINUING EDUCATION COLLEGE CO., LIMITED
香港高等繼續教育學院有限公司",2007-08-20,2012-11-16,"Private, ltd by shares"143,1159786,"HONG KONG J.D GROUP LIMITED
香港錦東集團有限公司",2007-08-20,2009-01-09,"Private, ltd by shares"144,1159736,"HONG KONG JINYINLAI INTERNATIONAL INVESTMENT HOLDINGS LIMITED
香港金銀來(國際)投資股份有限公司",2007-08-20,2012-11-16,"Private, ltd by shares"145,1159683,"HONG KONG KAIDA TRADING DEVELOPMENT LIMITED
香港凱達貿易發展有限公司",2007-08-20,2010-01-22,"Private, ltd by shares"146,1159679,"HONG KONG MING TAT LEE LIMITED
香港明達利有限公司",2007-08-20,2012-11-16,"Private, ltd by shares"147,1159950,"HONG KONG POTUNG HUA LINGUISTIC CENTRE LIMITED
香港普通話語音教研所有限公司",2007-08-20,2013-11-22,"Private, ltd by shares"148,1159657,"HONG KONG PROSPERITY WOOD (INT'L) INDUSTRY CO., LIMITED
香港興隆(國際)實業有限公司",2007-08-20,2012-05-18,"Private, ltd by shares"149,1159709,"HONG KONG PUMP TECHNOLOGY COMPANY LIMITED
香港水泵科技有限公司",2007-08-20,,"Private, ltd by shares"150,1159738,"HONG KONG SKY DEVELOPMENT LIMITED
香港天展有限公司",2007-08-20,2012-11-16,"Private, ltd by shares"151,1159706,"HONG KONG TAIDA INTERNATIONAL SHIPPING LIMITED
香港泰達國際海運有限公司",2007-08-20,2009-01-30,"Private, ltd by shares"152,1159775,"HONG KONG THREECIRCLE ELECTRONIC COMPANY LIMITED
香港三環電子有限公司",2007-08-20,,"Private, ltd by shares"153,1159761,"HONG KONG ZANG LONG INTERNATIONAL CO., LIMITED
香港藏龍國際有限公司",2007-08-20,2017-04-13,"Private, ltd by shares"154,1159976,"HONG KONG, JIANG XI AND TAIWAN YOUTH EXCHANGE PROMOTION ASSOCIATION LIMITED
贛港台青年交流促進會有限公司",2007-08-20,,"Ltd by guarantee"155,1159747,"HONG LEE INVESTMENT (HOLDINGS) COMPANY LIMITED
康利投資(控股)有限公司",2007-08-20,2020-07-10,"Private, ltd by shares"156,1159716,"HONG SHI OPTICAL LIMITED
鴻視有限公司",2007-08-20,2015-12-31,"Private, ltd by shares"157,1159835,"HONGKONG DADE BIO-PHARM GROUP LIMITED
香港大德生物制藥集團有限公司",2007-08-20,2014-12-24,"Private, ltd by shares"158,1159769,"HONGKONG DONGLIN INTERNATIONAL LIMITED
香港東麟國際有限公司",2007-08-20,2018-09-14,"Private, ltd by shares"159,1159784,"HONGKONG FENGTAI TRADING CO., LIMITED
香港豐泰貿易有限公司",2007-08-20,2009-01-02,"Private, ltd by shares"160,1159925,"HONGKONG GENERATION TREASURE INT'L SHOES INDUSTRY LIMITED
香港一代大亨國際鞋業有限公司",2007-08-20,2011-04-15,"Private, ltd by shares"161,1159684,"HONGKONG GUCI CERAMIC INDUSTRY CO., LIMITED
香港古瓷瓷業有限公司",2007-08-20,,"Private, ltd by shares"162,1159690,"HONGKONG JIANGHAI HOTEL INTERNATIONAL GROUP MANAGEMENT CO., LIMITED
香港江海酒店管理國際集團有限公司",2007-08-20,2011-04-15,"Private, ltd by shares"163,1159763,"HONGKONG JINBAO INTERNATIONAL SHIPPING LIMITED
香港金寶國際船務有限公司",2007-08-20,2013-11-22,"Private, ltd by shares"164,1159975,"HONGKONG JOYLUM INTERNATIONAL FITNESS CENTER LIMITED
香港健力美國際健身會所有限公司",2007-08-20,2016-01-15,"Private, ltd by shares"165,1159931,"HONGKONG KEYU INT'L GROUP LIMITED
香港科宇國際集團有限公司",2007-08-20,2011-04-15,"Private, ltd by shares"166,1159940,"HONGKONG PEARLMAR JEWELRY CO., LIMITED
香港珀爾瑪珠寶有限公司",2007-08-20,,"Private, ltd by shares"167,1159918,"HONGKONG SHANGLILA DRESS LIMITED
香港香格里拉服飾有限公司",2007-08-20,2011-12-09,"Private, ltd by shares"168,1159720,"HONGKONG SHUIYA INTERNATIONAL GROUP LIMITED
香港睡雅國際集團有限公司",2007-08-20,,"Private, ltd by shares"169,1159963,"HONGKONG TERRAN PROPERTIES CO., LIMITED
香港天潤置業有限公司",2007-08-20,2018-04-27,"Private, ltd by shares"170,1159713,"HONGKONG YINGHUA TECHNOLOGY CO., LIMITED (d2016-01-08)
香港英華科技有限公司",2007-08-20,2016-01-08,"Private, ltd by shares"171,1159742,"HONGTAI (HONGKONG) CO., LIMITED",2007-08-20,2012-11-16,"Private, ltd by shares"172,1159876,"HONOUR CITY HOLDINGS LIMITED
康城集團有限公司",2007-08-20,2009-04-03,"Private, ltd by shares"173,1159731,"HOX ARCHITECTURE DESIGN URBANISM LIMITED",2007-08-20,2009-02-13,"Private, ltd by shares"174,1159739,"HUAXIN INTERNATIONAL TRADING LIMITED
華欣國際貿易有限公司",2007-08-20,2016-08-26,"Private, ltd by shares"175,1159814,"IKONTEK LIMITED
光技工業香港有限公司",2007-08-20,2017-04-21,"Private, ltd by shares"176,1159946,"INTERNATIONAL TAOISM PROMOTION INSTITUTE LIMITED
國際易學促進會有限公司",2007-08-20,2011-04-15,"Private, ltd by shares"177,1159809,"ITALY OSCAR INTERNATIONAL GARMENT (HK) LIMITED
意大利奧斯卡國際服飾(香港)有限公司",2007-08-20,2011-04-15,"Private, ltd by shares"178,1159756,"J-SKY ENTERPRISES CO., LIMITED
靖天實業有限公司",2007-08-20,2015-02-13,"Private, ltd by shares"179,1159682,"JANE'S GALLERY HOLDINGS LIMITED
鴻儒集團有限公司",2007-08-20,,"Private, ltd by shares"180,1159795,"JAPAN FEIYAGE SEWING MACHINE (HONG KONG) LIMITED
日本菲雅格縫紉機(香港)有限公司",2007-08-20,2011-04-15,"Private, ltd by shares"181,1159907,"JAPAN HONGCHENG GROUP LIMITED
日本鴻成集團有限公司",2007-08-20,2015-01-02,"Private, ltd by shares"182,1159902,"JAPAN URO CO., LIMITED
日本悠萊株式會社有限公司",2007-08-20,2011-04-15,"Private, ltd by shares"183,1159687,"JEWOO MFG (H.K.) LIMITED
制宇通商有限公司",2007-08-20,2013-03-22,"Private, ltd by shares"184,1159737,"JG COMPANY LIMITED
財聯有限公司",2007-08-20,2016-03-04,"Private, ltd by shares"185,1159964,"JINGS LIMITED (d2016-03-11)
鷹時有限公司",2007-08-20,2016-03-11,"Private, ltd by shares"186,1159719,"JOINWIN INTERNATIONAL TRADING CO., LIMITED
佳穎國貿有限公司",2007-08-20,2018-01-19,"Private, ltd by shares"187,1159644,"JUNE HARDWARE (HK) LIMITED
眾億五金(香港)有限公司",2007-08-20,2011-04-15,"Private, ltd by shares"188,1159646,"Jyoti Shipping Limited",2007-08-20,,"Private, ltd by shares"189,1159955,"KA CHAK INDUSTRIAL LIMITED
嘉澤實業有限公司",2007-08-20,2011-04-15,"Private, ltd by shares"190,1159652,"KANASAWA SURFACE TREATMENT PROFESSIONAL CO. LIMITED
金澤表面處理專業有限公司",2007-08-20,,"Private, ltd by shares"191,1159838,"KAO YUAN INT'L MANAGEMENT GROUP LIMITED
高袁國際管理集團(香港)有限公司",2007-08-20,2019-03-22,"Private, ltd by shares"192,1159650,"KOREA BILUN SHOES AND DRESS LIMITED
韓國比倫鞋服有限公司",2007-08-20,2015-07-17,"Private, ltd by shares"193,1159922,"KOREA IHUI COSMETIC COMPANY LIMITED
韓國易卉化妝品株式會社有限公司",2007-08-20,2011-04-15,"Private, ltd by shares"194,1159677,"KOREA PILIE FASHION LIMITED
韓國皮利鶚服飾有限公司",2007-08-20,2011-04-15,"Private, ltd by shares"195,1159661,"KUDE INTERNATIONAL CO., LIMITED
庫德國際有限公司",2007-08-20,2020-04-03,"Private, ltd by shares"196,1159777,"L&amp;H INC (H.K.) LIMITED",2007-08-20,2015-07-17,"Private, ltd by shares"197,1159851,"LAISSING &amp; CO. LIMITED
麗成行有限公司",2007-08-20,2010-01-08,"Private, ltd by shares"198,1159764,"LANDE GROUP (HONGKONG) LIMITED
蘭德集團(香港)有限公司",2007-08-20,2016-01-15,"Private, ltd by shares"199,1159879,"LEAD TREND INDUSTRIES LIMITED
力昌實業有限公司",2007-08-20,,"Private, ltd by shares"200,1159685,"LEADFRAME TECHNOLOGY LIMITED
維科科技有限公司",2007-08-20,2018-07-06,"Private, ltd by shares"201,1159667,"LEASING INTERNATIONAL LIMITED",2007-08-20,2011-01-07,"Private, ltd by shares"202,1159887,"LI CHEONG WAH LIMITED
利昌樺有限公司",2007-08-20,,"Private, ltd by shares"203,1159970,"LIFE FUND CHARITY LIMITED (THE)",2007-08-20,2016-07-22,"Ltd by guarantee"204,1159754,"LIGHT SPEED ELECTRONICS (HONG KONG) CO., LIMITED
光速電子(香港)有限公司",2007-08-20,2011-04-15,"Private, ltd by shares"205,1159968,"LINK EQUIPMENT &amp; SYSTEMS LIMITED
力通設備及系統有限公司",2007-08-20,2016-04-01,"Private, ltd by shares"206,1159790,"LL Land Properties Limited
仲益置業有限公司",2007-08-20,,"Private, ltd by shares"207,1159868,"LOCKWAY LIMITED (d2012-11-16)
諾偉有限公司",2007-08-20,2012-11-16,"Private, ltd by shares"208,1159680,"LODDA TECHNOLOGY GROUP LIMITED
樂達科技集團有限公司",2007-08-20,2011-04-15,"Private, ltd by shares"209,1159757,"LOGICON INTERNATIONAL LIMITED
羅澤通貿易有限公司",2007-08-20,,"Private, ltd by shares"210,1159804,"LONGON FAR EAST LIMITED
長安遠東有限公司",2007-08-20,2016-06-24,"Private, ltd by shares"211,1159831,"Longview Capital Partners Limited",2007-08-20,2008-12-24,"Private, ltd by shares"212,1159746,"LOSON FINANCE GROUP LIMITED
龍盛金融集團有限公司",2007-08-20,2011-04-15,"Private, ltd by shares"213,1159707,"LOYAL LEGEND INTERNATIONAL LIMITED
利訊國際責任有限公司",2007-08-20,2014-12-24,"Private, ltd by shares"214,1159942,"LTI SOLUTION CO., LIMITED
萊維特國際有限公司",2007-08-20,2016-04-22,"Private, ltd by shares"215,1159815,"Luen Fung Hong Plastic Materials (China) Company Limited
聯豐行塑膠原料(中國)有限公司",2007-08-20,,"Private, ltd by shares"216,1159726,"MAGIC BOW MUSIC COMPANY LIMITED",2007-08-20,2010-09-24,"Private, ltd by shares"217,1159962,"MAN YEE LOK SEE COMPANY LIMITED
萬頤樂鍶有限公司",2007-08-20,,"Private, ltd by shares"218,1159888,"MB WEALTH LIMITED (HK)
寶順國際財富有限公司",2007-08-20,,"Private, ltd by shares"219,1159877,"MEGA EAGLE HOLDINGS LIMITED
巨鷹集團有限公司",2007-08-20,2009-06-26,"Private, ltd by shares"