,Reg no.,Name,Incorp-orated,Dissolved,Type1,0501686,"A-COM COMPUTER (HONG KONG) LIMITED
中凌電腦(香港)有限公司",1994-12-29,2006-08-11,"Private, ltd by shares"2,0501830,"A. UNITE INTERNATIONAL (CHINA) LIMITED
合一國際(中國)有限公司",1994-12-29,2003-11-28,"Private, ltd by shares"3,0501698,"ACHIEVEMENT (MING KEE) TRANSPORTATION COMPANY LIMITED
日合成(明記)運輸有限公司",1994-12-29,2000-10-05,"Private, ltd by shares"4,0501748,"AIRSMITH ENGINEERING LIMITED
雅風機電工程有限公司",1994-12-29,2014-08-01,"Private, ltd by shares"5,0501732,"ALLWIN CHEMICAL LIMITED
浩洋化工有限公司",1994-12-29,2020-04-29,"Private, ltd by shares"6,0501791,"ALYSON MAR CONSULTANCY LIMITED
馬幗英顧問有限公司",1994-12-29,2002-10-25,"Private, ltd by shares"7,0501654,"AMERICAN WIRE ROPES (HONG KONG) LIMITED
美國鋼纜(香港)有限公司",1994-12-29,2005-07-29,"Private, ltd by shares"8,0501548,"ANALYTICA CAPITAL MANAGEMENT LIMITED
惠康資產管理有限公司",1994-12-29,,"Private, ltd by shares"9,0501797,"APPA FAITH LIMITED
雅嘉信有限公司",1994-12-29,2009-09-18,"Private, ltd by shares"10,0501607,"ARCHCORP DESIGN ENGINEERS (H.K.) LIMITED
篙建工程師事務所(香港)有限公司",1994-12-29,1998-06-05,"Private, ltd by shares"11,0501540,"ARTISTIC &amp; CREATIVE (H.K.) LIMITED
藝創(香港)有限公司",1994-12-29,,"Private, ltd by shares"12,0501765,"ARTKNIT KNITWEAR COMPANY LIMITED
雅麗織藝有限公司",1994-12-29,2006-05-08,"Private, ltd by shares"13,0501733,"ASIA PACIFIC STRATEGIES LIMITED
亞太聯合策略有限公司",1994-12-29,2004-08-27,"Private, ltd by shares"14,0501659,"ASIAN NEWSPAPER FOCUS LIMITED",1994-12-29,2019-08-02,"Private, ltd by shares"15,0501728,"AUSTIN HUGHES COMMUNICATIONS (ASIA) LIMITED",1994-12-29,2005-08-05,"Private, ltd by shares"16,0501575,"BASS TECHNOLOGY LIMITED
比斯技術有限公司",1994-12-29,1998-10-09,"Private, ltd by shares"17,0501657,"BAUHAUS LIMITED",1994-12-29,,"Private, ltd by shares"18,0501713,"BENISON INTERNATIONAL (H.K.) LIMITED
恩祿國際(香港)有限公司",1994-12-29,,"Private, ltd by shares"19,0501703,"BIG CASSEROLE LIMITED
大煲大有限公司",1994-12-29,2002-06-14,"Private, ltd by shares"20,0501604,"BK (ASIA) COMPANY LIMITED
美奧(亞洲)有限公司",1994-12-29,1999-05-14,"Private, ltd by shares"21,0501771,"BO SHING JEWELLERY CO. LIMITED
寶盛珠寶首飾有限公司",1994-12-29,2004-01-16,"Private, ltd by shares"22,0501541,"BRITTA COMPANY LIMITED
培利達有限公司",1994-12-29,2014-12-19,"Private, ltd by shares"23,0501561,"BROCHY LIMITED
一申時裝有限公司",1994-12-29,2003-09-26,"Private, ltd by shares"24,0501625,"C &amp; J CO., LIMITED",1994-12-29,2015-03-13,"Private, ltd by shares"25,0501656,"CALCAR ENTERPRISES COMPANY (HK) LIMITED
洛昌企業有限公司",1994-12-29,1999-05-14,"Private, ltd by shares"26,0501644,"CALIFORNIA DIRECT LIMITED (d2001-12-21)",1994-12-29,2001-12-21,"Private, ltd by shares"27,0501589,"CARRY SPEED INTERNATIONAL LIMITED
加利迅國際有限公司",1994-12-29,1998-07-03,"Private, ltd by shares"28,0501662,"CARTIER-FLEMING INTERNATIONAL LIMITED",1994-12-29,2003-02-14,"Private, ltd by shares"29,0501774,"CHEUNG TAT PRECISION PRODUCTS LIMITED
昌達精密製品有限公司",1994-12-29,2004-09-30,"Private, ltd by shares"30,0501661,"CHINA HONG KONG SPECIAL REGION PUBLISHER (GROUP) SHARE HOLDINGS COMPANY LIMITED
中國香港特區報社(集團)股份有限公司",1994-12-29,2001-02-16,"Private, ltd by shares"31,0501767,"CHINA INTELLIGENCE TECHNOLOGIES LIMITED
中國捷能科技有限公司",1994-12-29,,"Private, ltd by shares"32,0501606,"CHINA PALACE DEVELOPMENT LIMITED
中國頤和發展有限公司",1994-12-29,1999-02-12,"Private, ltd by shares"33,0501792,"CHINA PROFIT ENTERPRISES COMPANY LIMITED
利中華企業有限公司",1994-12-29,2003-11-28,"Private, ltd by shares"34,0501605,"CHINA SUNSHINE INTERNATIONAL DEVELOPMENT LIMITED
中國陽光國際發展有限公司",1994-12-29,1999-02-12,"Private, ltd by shares"35,0501600,"CHINAPLUS INTERNATIONAL LIMITED
華晉恒業有限公司",1994-12-29,,"Private, ltd by shares"36,0501816,"CHUN SHUN INDUSTRIAL LIMITED
鎮信實業有限公司",1994-12-29,2005-11-25,"Private, ltd by shares"37,0501650,"CHUNG CHEONG INTERNATIONAL HONG KONG LIMITED
中昌國際香港有限公司",1994-12-29,2006-10-13,"Private, ltd by shares"38,0501560,"CITY LEVEL LIMITED",1994-12-29,2004-02-20,"Private, ltd by shares"39,0501559,"CITY-UP LIMITED
城高有限公司",1994-12-29,,"Private, ltd by shares"40,0501571,"COMFORT INTERNATIONAL KNITTERS CO., LIMITED
偉倫國際針織有限公司",1994-12-29,,"Private, ltd by shares"41,0501576,"D &amp; L INTERNATIONAL LIMITED (d2010-05-28)
德利通國際有限公司",1994-12-29,2010-05-28,"Private, ltd by shares"42,0501787,"DAILY JUMBO MANAGEMENT LIMITED
維瀚管理有限公司",1994-12-29,2002-05-24,"Private, ltd by shares"43,0501735,"DAILY TIME ADVERTISING AGENCY LIMITED
日泰廣告有限公司",1994-12-29,2004-08-27,"Private, ltd by shares"44,0501593,"DELROC TRADING LIMITED",1994-12-29,2002-09-06,"Private, ltd by shares"45,0501685,"DENSTAR ENTERPRISE LIMITED
嘉星企業有限公司",1994-12-29,2002-07-26,"Private, ltd by shares"46,0501558,"DINGBATS H.K. LIMITED
星仔香港有限公司",1994-12-29,,"Private, ltd by shares"47,0501826,"DIS COMPANY LIMITED
達思有限公司",1994-12-29,2008-06-13,"Private, ltd by shares"48,0501717,"DOLLAR ASSETS LIMITED",1994-12-29,2003-11-21,"Private, ltd by shares"49,0501622,"DOMINATOR INVESTMENT GROUP LIMITED",1994-12-29,2006-08-11,"Private, ltd by shares"50,0501828,"DONG HE INTERNATIONAL TECHNOLOGY LIMITED
東翮國際科技有限公司",1994-12-29,2003-11-28,"Private, ltd by shares"51,0501793,"DONSAB FAR EAST LIMITED
同達遠東有限公司",1994-12-29,2002-09-06,"Private, ltd by shares"52,0501710,"DOO RAE (HK) LIMITED",1994-12-29,1999-04-16,"Private, ltd by shares"53,0501726,"DOR SHING INTERNATIONAL LIMITED
多誠國際有限公司",1994-12-29,2003-11-28,"Private, ltd by shares"54,0501817,"DOWN &amp; CRAFTS LIMITED
萬美羽絨有限公司",1994-12-29,2002-06-21,"Private, ltd by shares"55,0501773,"DRAGON BONANZA HOLDINGS COMPANY LIMITED
龍邦集團有限公司",1994-12-29,2001-12-21,"Private, ltd by shares"56,0501568,"DRAGON-SKY INTERNATIONAL TRADING BUSINESS COMPANY LIMITED
龍天國際貿易有限公司",1994-12-29,2015-04-17,"Private, ltd by shares"57,0501655,"EAST CIRCLE SHIPPING COMPANY LIMITED
東環船務有限公司",1994-12-29,2000-06-16,"Private, ltd by shares"58,0501832,"EAST PROPERTY CONSULTANT CO. LIMITED
東怡物業顧問行有限公司",1994-12-29,1999-05-14,"Private, ltd by shares"59,0501549,"EAST TAK INDUSTRY TRADING LIMITED
新東德企業貿易有限公司",1994-12-29,2005-06-03,"Private, ltd by shares"60,0501569,"EASTOP SHIPPING (CHINA) LIMITED
東達航運(中國)有限公司",1994-12-29,1998-04-02,"Private, ltd by shares"61,0501536,"ECON DEVELOPMENTS LIMITED
誼康發展有限公司",1994-12-29,2004-04-30,"Private, ltd by shares"62,0501777,"EDDY INTERNATIONAL LIMITED
宏亮國際(香港)有限公司",1994-12-29,,"Private, ltd by shares"63,0501754,"ELEEN INTERNATIONAL LIMITED",1994-12-29,2000-09-29,"Private, ltd by shares"64,0501537,"EON MIGHT INVESTMENTS LIMITED
誼威投資有限公司",1994-12-29,2003-11-28,"Private, ltd by shares"65,0501572,"EVER SOUND DEVELOPMENT COMPANY LIMITED
寧凱發展有限公司",1994-12-29,1997-08-01,"Private, ltd by shares"66,0501635,"EVERCHEERING (H.K.) COMPANY LIMITED
辛協香港有限公司",1994-12-29,,"Private, ltd by shares"67,0501574,"EVERGREEN INTERNATIONAL TI-GOLD COMPANY LIMITED
長榮國際鈦金有限公司",1994-12-29,,"Private, ltd by shares"68,0501626,"EVERICH (CHINA) KNITTING FACTORY LIMITED
永捷紡織廠(中國)有限公司",1994-12-29,,"Private, ltd by shares"69,0501603,"EVERICH YEAR DEVELOPMENT LIMITED
永豐年發展有限公司",1994-12-29,,"Private, ltd by shares"70,0501591,"EVERICH YEAR INTERNATIONAL LIMITED
永豐年國際有限公司",1994-12-29,2003-02-07,"Private, ltd by shares"71,0501640,"EXCELLENT CHINA LIMITED (d2002-04-12)
賽能中國有限公司",1994-12-29,2002-04-12,"Private, ltd by shares"72,0501762,"FABULOUS BEAT INCORPORATE MUSIC LIMITED",1994-12-29,2004-04-16,"Private, ltd by shares"73,0501582,"FAIR CHOICE PACIFIC LIMITED
輝澤太平洋有限公司",1994-12-29,1998-10-09,"Private, ltd by shares"74,0501722,"FALK OCEAN INTERNATIONAL LIMITED",1994-12-29,2005-01-21,"Private, ltd by shares"75,0501630,"FASTER GARMENT LIMITED
發利製衣有限公司",1994-12-29,2003-11-28,"Private, ltd by shares"76,0501628,"FASTER SHIPPING LIMITED
發利船務有限公司",1994-12-29,2002-09-27,"Private, ltd by shares"77,0501729,"FECDA ENGINEERING COMPANY LIMITED
中匯工程有限公司",1994-12-29,2003-11-28,"Private, ltd by shares"78,0501702,"FEIHUA SHIPPING LIMITED
飛華船務有限公司",1994-12-29,2000-09-15,"Private, ltd by shares"79,0501802,"FILL LUCK LIMITED
富運鴻有限公司",1994-12-29,2002-06-07,"Private, ltd by shares"80,0501676,"FOOTWEAR WORKSHOP LIMITED
富域鞋業有限公司",1994-12-29,2009-05-15,"Private, ltd by shares"81,0501809,"FORDA ARTS &amp; PRINTING COMPANY LIMITED
福達印刷有限公司",1994-12-29,,"Private, ltd by shares"82,0501760,"FORE-TECH MOULDING ENGINEERING COMPANY LIMITED
福達工模工程有限公司",1994-12-29,2002-10-25,"Private, ltd by shares"83,0501714,"FRONTIERS DEVELOPMENT LIMITED",1994-12-29,2018-09-04,"Private, ltd by shares"84,0501721,"FU HOP YICK INVESTMENT LIMITED
富合益置業有限公司",1994-12-29,,"Private, ltd by shares"85,0501619,"FUJITEC DEVELOPMENT LIMITED
富士達發展有限公司",1994-12-29,,"Private, ltd by shares"86,0501618,"FUJITEC INTERNATIONAL LIMITED (d2004-04-16)
富士達國際有限公司",1994-12-29,2004-04-16,"Private, ltd by shares"87,0501788,"FUTURE NETWORK HOLDING COMPANY LIMITED
富國網絡集團有限公司",1994-12-29,,"Private, ltd by shares"88,0501796,"G &amp; H MANAGEMENT SERVICES LIMITED
G&amp;H管理有限公司",1994-12-29,,"Private, ltd by shares"89,0501578,"GAIN EARTH INTERNATIONAL LIMITED
旺宇國際有限公司",1994-12-29,2000-06-30,"Private, ltd by shares"90,0501580,"GAIN EARTH LIMITED
辰滙有限公司",1994-12-29,2005-04-29,"Private, ltd by shares"91,0501701,"GAIN HAIL WORLDWIDE LIMITED
浩暉環球有限公司",1994-12-29,2004-08-27,"Private, ltd by shares"92,0501545,"GENIUS FAITH LIMITED
采傑有限公司",1994-12-29,2002-10-11,"Private, ltd by shares"93,0501804,"GET SUCCESS INTERNATIONAL LIMITED
奮富國際有限公司",1994-12-29,2003-11-28,"Private, ltd by shares"94,0501552,"GIFTED CONSULTATION LIMITED
天澤顧問有限公司",1994-12-29,2009-06-26,"Private, ltd by shares"95,0501790,"GLORY ENTERPRISES (FAR EAST) LIMITED
基榮企業(遠東)有限公司",1994-12-29,1999-01-22,"Private, ltd by shares"96,0501651,"GOLDBASE ENTERPRISES LIMITED
錦基企業有限公司",1994-12-29,2002-03-15,"Private, ltd by shares"97,0501806,"Golden Alliance Marine (HK) Limited
昱海船舶設備(香港)有限公司",1994-12-29,,"Private, ltd by shares"98,0501573,"GOLDEN EXCEL DEVELOPMENT COMPANY LIMITED
永寧發展有限公司",1994-12-29,2001-01-12,"Private, ltd by shares"99,0501805,"GOLDEN POUND CONSULTANTS LIMITED",1994-12-29,2002-09-06,"Private, ltd by shares"100,0501716,"GOLDEN PREMIUM INVESTMENTS LIMITED",1994-12-29,2001-05-13,"Private, ltd by shares"101,0501595,"GOLDEN TIMES INDUSTRIAL LIMITED (d2013-07-12)
金泰工業有限公司",1994-12-29,2013-07-12,"Private, ltd by shares"102,0501820,"GOLDION LIMITED
金研有限公司",1994-12-29,,"Private, ltd by shares"103,0501674,"GOOD YEAR ENTERPRISES HOLDING LIMITED
嘉年實業股份有限公司",1994-12-29,2013-02-15,"Private, ltd by shares"104,0501824,"GRADEWELL LIMITED (d2004-04-16)
振緯有限公司",1994-12-29,2004-04-16,"Private, ltd by shares"105,0501609,"GUANGSHING ENTERPRISE INVESTMENTS LIMITED
廣城企業投資有限公司",1994-12-29,1999-01-22,"Private, ltd by shares"106,0501608,"GUANGWAH INTERNATIONAL DEVELOPMENT LIMITED
廣華國際發展有限公司",1994-12-29,2009-05-15,"Private, ltd by shares"107,0501620,"H &amp; D GRAFICO LIMITED",1994-12-29,2006-06-09,"Private, ltd by shares"108,0501724,"HAMPSTEAD PRINTING COMPANY LIMITED
漢達絲印有限公司",1994-12-29,1999-10-09,"Private, ltd by shares"109,0501825,"HANG WEI COMPANY LIMITED
恒瑋有限公司",1994-12-29,2017-02-17,"Private, ltd by shares"110,0501794,"HAO HSLANG DEVELOPMENT LIMITED
浩翔發展有限公司",1994-12-29,1998-12-18,"Private, ltd by shares"111,0501741,"HARVEST LEATHER WARE LIMITED
豐皮具製品有限公司",1994-12-29,2015-04-17,"Private, ltd by shares"112,0501838,"HENRY BUILDING &amp; CIVIL WORKS COMPANY LIMITED
亨澤建築有限公司",1994-12-29,2001-06-22,"Private, ltd by shares"113,0501715,"HIGH STANDARD TRADING LIMITED (d2002-03-28)",1994-12-29,2002-03-28,"Private, ltd by shares"114,0501798,"HIN KEE LEASE COMPANY LIMITED
顯記租賃有限公司",1994-12-29,2005-11-25,"Private, ltd by shares"115,0501542,"HOMING (HOLDINGS) LIMITED
鴻銘(集團)有限公司",1994-12-29,,"Private, ltd by shares"116,0501611,"HONG KONG DRAGON (GROUP) COMPANY LIMITED
香港龍的(集團)有限公司",1994-12-29,2003-11-28,"Private, ltd by shares"117,0501751,"HONG KONG FEDERATION OF EDUCATION WORKERS EDUCATION ORGANISATION LIMITED
香港教育工作者聯會教育機構有限公司",1994-12-29,,"Ltd by guarantee"118,0501746,"HONG KONG FEDERATION OF INSURERS (THE)
香港保險業聯會",1994-12-29,,"Ltd by guarantee"119,0501807,"HONG KONG YELLOW RIVER INDUSTRIAL (GROUP) COMPANY LIMITED
香港黃河實業集團發展有限公司",1994-12-29,,"Private, ltd by shares"120,0501691,"HOPEFULL (H.K.) COMPANY LIMITED
寶圖(香港)有限公司",1994-12-29,,"Private, ltd by shares"121,0501550,"HOTLINERS CORPORATION LIMITED
匯宏科技有限公司",1994-12-29,1998-07-03,"Private, ltd by shares"122,0501712,"HUAMEI CHINA ENTERPRISES CO., LIMITED
華美中國企業有限公司",1994-12-29,2002-06-28,"Private, ltd by shares"123,0501631,"HUARICH INVESTMENT COMPANY LIMITED (d2006-01-20)
華智中國投資有限公司",1994-12-29,2006-01-20,"Private, ltd by shares"124,0501623,"HUNG HING DECORATION ENGINEERING COMPANY LIMITED
洪興裝飾工程有限公司",1994-12-29,2011-12-30,"Private, ltd by shares"125,0501742,"HUNTER SOCKS KNITTING FACTORY (H.K.) LIMITED
香港亨達織襪廠有限公司",1994-12-29,,"Private, ltd by shares"126,0501547,"I-SPOTMAGIC TECHNOLOGY LIMITED
互網點科技有限公司",1994-12-29,2002-07-12,"Private, ltd by shares"127,0501803,"IMPACT ENTERTAINMENT (ASIA) LIMITED
藝能娛樂(亞洲)有限公司",1994-12-29,2017-03-31,"Private, ltd by shares"128,0501799,"IMPACT ENTERTAINMENT (INTERNATIONAL) LIMITED
藝能娛樂(國際)有限公司",1994-12-29,,"Private, ltd by shares"129,0501673,"IMPACT FOODS (HONG KONG) LIMITED
傳意食品(香港)有限公司",1994-12-29,2003-11-28,"Private, ltd by shares"130,0501599,"INSUPER INTERNATIONAL LIMITED
顯超國際有限公司",1994-12-29,2002-08-09,"Private, ltd by shares"131,0501533,"INTERACT SYSTEMS LIMITED (d1998-04-24)",1994-12-29,1998-04-24,"Private, ltd by shares"132,0501730,"INTERNATIONAL (HOTEL MANAGEMENT) LIMITED
國際宇航(酒店管理)有限公司",1994-12-29,2003-11-28,"Private, ltd by shares"133,0501645,"INTERNATIONAL STRATEGIC GROUP LIMITED
國際策略集團有限公司",1994-12-29,2001-07-20,"Private, ltd by shares"134,0501769,"J &amp; K INTERNATIONAL LIMITED (d2000-10-20)
J&amp;K國際有限公司",1994-12-29,2000-10-20,"Private, ltd by shares"135,0501638,"J. J. INVESTMENT (INT'L) LIMITED
焌鍵投資(國際)有限公司",1994-12-29,2020-05-15,"Private, ltd by shares"136,0501821,"JAMWELL LIMITED (d2006-03-07)
晉偉有限公司",1994-12-29,2006-03-07,"Private, ltd by shares"137,0501823,"JANNING LIMITED
晉承有限公司",1994-12-29,,"Private, ltd by shares"138,0501567,"JAPAN SUPERBALL LIMITED
東邦貿易有限公司",1994-12-29,2006-06-09,"Private, ltd by shares"139,0501833,"JAYKARA (H.K.) LIMITED",1994-12-29,,"Private, ltd by shares"140,0501811,"JIN HAI GROUP LIMITED
金海國際集團有限公司",1994-12-29,2003-12-19,"Private, ltd by shares"141,0501708,"JIUH LONG MANUFACTURE LIMITED
鉅龍興業有限公司",1994-12-29,2001-09-21,"Private, ltd by shares"142,0501643,"JUMBO PROPERTY CONSULTANT CO. LIMITED
駿堡物業地產代理有限公司",1994-12-29,2000-09-15,"Private, ltd by shares"143,0501677,"K AND K REALTY LIMITED
國君置業有限公司",1994-12-29,2016-08-26,"Private, ltd by shares"144,0501636,"K.E.M. (INTERNATIONAL) COMPANY LIMITED
根斯道夫(國際)有限公司",1994-12-29,2004-04-16,"Private, ltd by shares"145,0501663,"KAREN COOPER LIMITED (d2002-05-24)",1994-12-29,2002-05-24,"Private, ltd by shares"146,0501570,"KARO INTERNATIONAL COMPANY LIMITED",1994-12-29,2006-06-09,"Private, ltd by shares"147,0501835,"KENYES (HK) LIMITED
鍵益(香港)有限公司",1994-12-29,1998-09-04,"Private, ltd by shares"148,0501800,"KIDSTONE LIMITED
基斯頓有限公司",1994-12-29,2004-08-27,"Private, ltd by shares"149,0501700,"KIN YAU TRANSPORTATION COMPANY LIMITED
建友運輸有限公司",1994-12-29,2002-04-26,"Private, ltd by shares"150,0501669,"KING TECHNOLOGY LIMITED
金興科技有限公司",1994-12-29,2008-08-29,"Private, ltd by shares"151,0501667,"KING WU INTERNATIONAL LIMITED",1994-12-29,2004-10-08,"Private, ltd by shares"152,0501562,"KINGDOM CONSULTANTS LIMITED (d1998-06-06)
統一顧問有限公司",1994-12-29,1998-06-06,"Private, ltd by shares"153,0501615,"KINGDOM PRODUCTIONS LIMITED (d2001-04-20)
統一製作有限公司",1994-12-29,2001-04-20,"Private, ltd by shares"154,0501745,"KINGSBOND INTERNATIONAL DEVELOPMENT LIMITED
金邦國際發展有限公司",1994-12-29,2003-06-20,"Private, ltd by shares"155,0501556,"KONG CHUN COMPANY LIMITED
港峻有限公司",1994-12-29,2010-12-03,"Private, ltd by shares"156,0501814,"KONG KEE TRANSPORTATION LIMITED
江記貨運有限公司",1994-12-29,2002-10-11,"Private, ltd by shares"157,0501557,"KONG WAI COMPANY LIMITED
港瑋有限公司",1994-12-29,2003-11-28,"Private, ltd by shares"158,0501551,"KOO CHIN COMPANY LIMITED
古青有限公司",1994-12-29,2001-03-30,"Private, ltd by shares"159,0501665,"L &amp; W SERVICES (H.K.) LIMITED
利盈行(香港)有限公司",1994-12-29,2001-07-27,"Private, ltd by shares"160,0501763,"LANFORD INTERNATIONAL TRADING LIMITED
聯發國際貿易有限公司",1994-12-29,2001-08-31,"Private, ltd by shares"161,0501642,"LEEWARDS INTERNATIONAL LIMITED
明珩國際有限公司",1994-12-29,2004-04-30,"Private, ltd by shares"162,0501639,"LI-YUAN INTERNATIONAL LIMITED (d2000-09-15)
力園國際有限公司",1994-12-29,2000-09-15,"Private, ltd by shares"163,0501693,"LING NAN (HK) LIMITED
凌南(香港)有限公司",1994-12-29,,"Private, ltd by shares"164,0501711,"LMZ CHINA MARKET DEVELOPMENT LIMITED
華智中國市場拓展有限公司",1994-12-29,2002-04-26,"Private, ltd by shares"165,0501587,"LONG BUSY INTERNATIONAL LIMITED
朗勤國際有限公司",1994-12-29,2006-03-17,"Private, ltd by shares"166,0501592,"LONGBUSY INVESTMENT LIMITED
朗勤投資有限公司",1994-12-29,2004-06-25,"Private, ltd by shares"167,0501588,"LONGLORY INTERNATIONAL LIMITED
朗斯國際有限公司",1994-12-29,2006-06-09,"Private, ltd by shares"168,0501594,"LONGLORY INVESTMENT LIMITED
朗斯投資有限公司",1994-12-29,,"Private, ltd by shares"169,0501759,"LONGLORY LIMITED (d2002-07-26)
朗斯有限公司",1994-12-29,2002-07-26,"Private, ltd by shares"170,0501827,"LUCKABLE LIMITED
運達寶有限公司",1994-12-29,,"Private, ltd by shares"171,0501819,"LUCKWARD LIMITED
運訊有限公司",1994-12-29,2006-06-23,"Private, ltd by shares"172,0501610,"LUEN HING HONG BUILDING MATERIALS LIMITED
聯興行建築材料有限公司",1994-12-29,,"Private, ltd by shares"173,0501627,"LUEN SHING CONSTRUCTION LIMITED
聯成建築有限公司",1994-12-29,2018-12-09,"Private, ltd by shares"174,0501566,"Majesty Wealth Management Limited
萬卓財富管理有限公司",1994-12-29,,"Private, ltd by shares"175,0501752,"MANDARIN SPORT FISHING CLUB LIMITED (THE)",1994-12-29,,"Ltd by guarantee"176,0501836,"MANFONG PEARLS LIMITED
萬方珍珠有限公司",1994-12-29,,"Private, ltd by shares"177,0501815,"MANY COUNTRIES YOUTH TRAVEL CO. LIMITED
萬國青年旅遊有限公司",1994-12-29,2001-06-22,"Private, ltd by shares"178,0501633,"MARYFAME ASIA LIMITED
萬利隆亞洲有限公司",1994-12-29,2003-03-07,"Private, ltd by shares"179,0501634,"MARYFAME PACIFIC LIMITED
萬利隆太平洋有限公司",1994-12-29,1998-12-18,"Private, ltd by shares"180,0501678,"MASTER HERO DEVELOPMENT LIMITED
首豪發展有限公司",1994-12-29,1998-05-15,"Private, ltd by shares"181,0501597,"MAX CARRY INTERNATIONAL LIMITED
加利泰國際有限公司",1994-12-29,,"Private, ltd by shares"182,0501538,"MAXCO CONSTRUCTION &amp; ENGINEERING COMPANY LIMITED
美樂工程有限公司",1994-12-29,1998-02-20,"Private, ltd by shares"183,0501602,"MERRY CHINA DEVELOPMENT LIMITED
美利華發展有限公司",1994-12-29,2003-11-28,"Private, ltd by shares"184,0501584,"MERRY CHINA ENGINEERING LIMITED
美利華工程有限公司",1994-12-29,2003-11-28,"Private, ltd by shares"185,0501629,"MERRY CHINA GARMENT LIMITED
美利華製衣有限公司",1994-12-29,2003-11-28,"Private, ltd by shares"186,0501590,"MERRY CHINA INTERNATIONAL LIMITED
美利華國際有限公司",1994-12-29,2014-07-11,"Private, ltd by shares"187,0501596,"MERRY CHINA PACIFIC LIMITED
美利華太平洋有限公司",1994-12-29,2001-03-16,"Private, ltd by shares"188,0501579,"MERRY DRAGON INTERNATIONAL (HOLDINGS) LIMITED (d2010-02-26)
富美龍國際(集團)有限公司",1994-12-29,2010-02-26,"Private, ltd by shares"189,0501764,"MILLENNIUM MAGNETICS (GROUP) LIMITED
萬年磁(集團)有限公司",1994-12-29,2003-06-13,"Private, ltd by shares"190,0501725,"MINDA TRADING COMPANY LIMITED
明大貿易有限公司",1994-12-29,2003-07-25,"Private, ltd by shares"191,0501612,"MOSCOW (ORIENTAL) INTERNATIONAL TRADING LIMITED
莫斯科(東方)國際貿易有限公司",1994-12-29,2004-04-16,"Private, ltd by shares"192,0501737,"N &amp; L COMPUTER ENGINEERING LIMITED",1994-12-29,2005-11-25,"Private, ltd by shares"193,0501739,"NANHAI HOLDINGS (HONG KONG) LIMITED
南海集團(香港)有限公司",1994-12-29,2002-09-27,"Private, ltd by shares"194,0501801,"NEVILLE LIMITED (d2000-05-26)
利鑫有限公司",1994-12-29,2000-05-26,"Private, ltd by shares"195,0501778,"NEW PLANNING COMPANY LIMITED
大記電業有限公司",1994-12-29,,"Private, ltd by shares"196,0501818,"NICHIYAKU KOGYO FAR EAST LIMITED
遠東日葯工業有限公司",1994-12-29,2002-11-22,"Private, ltd by shares"197,0501743,"NJR (H.K.) LIMITED
新日本無線(香港)有限公司",1994-12-29,2002-09-05,"Private, ltd by shares"198,0501813,"OHTA INK HONG KONG LIMITED
太田油墨香港有限公司",1994-12-29,2012-01-20,"Private, ltd by shares"199,0501535,"OILKEY (HONG KONG) LIMITED",1994-12-29,2004-06-25,"Private, ltd by shares"200,0501658,"OMNICON EVENTS LIMITED",1994-12-29,,"Private, ltd by shares"201,0501646,"ORIENTAL APPAREL LIMITED
東成衣有限公司",1994-12-29,,"Private, ltd by shares"202,0501747,"P.C.S. SERVICES COMPANY LIMITED
英傑服務有限公司",1994-12-29,2016-04-30,"Private, ltd by shares"203,0501689,"PACIFIC CITY TECHNOLOGY (H.K.) LIMITED
佳都科技(香港)有限公司",1994-12-29,2019-01-11,"Private, ltd by shares"204,0501632,"PACIFIC RIM COMMUNICATIONS LIMITED",1994-12-29,2005-11-25,"Private, ltd by shares"205,0501831,"PARAWIN MANUFACTURING CO., LIMITED
必偉製衣有限公司",1994-12-29,,"Private, ltd by shares"206,0501704,"PEACE TRADING TEXTILE COMPANY LIMITED
安和行有限公司",1994-12-29,1997-11-14,"Private, ltd by shares"207,0501660,"PINNACLE CONSULTING LIMITED (d2005-11-25)",1994-12-29,2005-11-25,"Private, ltd by shares"208,0501758,"POLY TECHNOLOGIES LIMITED",1994-12-29,2014-02-21,"Private, ltd by shares"209,0501583,"POLYSEA SHIPPING LIMITED
海中寶船務有限公司",1994-12-29,1998-07-03,"Private, ltd by shares"210,0501601,"POON WING KEE COMPANY LIMITED
潘永記有限公司",1994-12-29,,"Private, ltd by shares"211,0501641,"PRECIOSA INTERNATIONAL (H.K.) LIMITED
寶仕奧莎國際(香港)有限公司",1994-12-29,,"Private, ltd by shares"212,0501653,"PRINF COMPANY LIMITED
富環香港有限公司",1994-12-29,2010-11-12,"Private, ltd by shares"213,0501727,"PROCHINA INVESTMENTS LIMITED
利中華國際投資有限公司",1994-12-29,2002-06-21,"Private, ltd by shares"214,0501812,"PROGRESSIVE (HONG KONG) ENTERPRISES CO., LIMITED
精進(香港)企業有限公司",1994-12-29,2006-06-09,"Private, ltd by shares"215,0501749,"PROPERTY AGENCIES ASSOCIATION LIMITED
地產代理聯會有限公司",1994-12-29,2016-08-26,"Ltd by guarantee"216,0501692,"QTA LIMITED (d2005-08-26)",1994-12-29,2005-08-26,"Private, ltd by shares"217,0501810,"QUKO INT'L DEVELOPMENT LIMITED
翹高國際發展有限公司",1994-12-29,,"Private, ltd by shares"218,0501786,"RHYKA VACUUM PLATING (H.K.) LIMITED
麗川真空鍍膜(香港)有限公司",1994-12-29,2010-12-02,"Private, ltd by shares"219,0501784,"RHYTHM ELECTRONICS (H.K.) LIMITED
麗聲電子(香港)有限公司",1994-12-29,2003-11-28,"Private, ltd by shares"220,0501785,"RHYTHM PRECISION (H.K.) LIMITED
麗聲精密零件(香港)有限公司",1994-12-29,2013-02-14,"Private, ltd by shares"221,0501581,"RIGHTMAN PUBLISHING LIMITED
正文社出版有限公司",1994-12-29,,"Private, ltd by shares"222,0501789,"RISING ENTERPRISES (HK) LIMITED
偉成企業(香港)有限公司",1994-12-29,,"Private, ltd by shares"223,0501705,"RODA INTERNATIONAL HONG KONG LIMITED
羅達國際有限公司",1994-12-29,1999-07-12,"Private, ltd by shares"224,0501780,"ROSAL (H.K.) LIMITED",1994-12-29,2004-02-13,"Private, ltd by shares"