,Reg no.,Name,Incorp-orated,Dissolved,Type225,0501668,"RU LONG ENTERPRISES LIMITED
日榮企業有限公司",1994-12-29,,"Private, ltd by shares"226,0501577,"RUBYMARK FINANCE COMPANY LIMITED
寶擴財務有限公司",1994-12-29,2004-06-18,"Private, ltd by shares"227,0501696,"RUOYCHAI MERCHANDISE (H. K.) COMPANY LIMITED
華商貿易(香港)有限公司",1994-12-29,2002-07-12,"Private, ltd by shares"228,0501766,"SALON (VIETNAM) LIMITED (THE)",1994-12-29,2000-12-15,"Private, ltd by shares"229,0501795,"SAMCO (H.K.) LIMITED
偉浩企業有限公司",1994-12-29,2002-08-09,"Private, ltd by shares"230,0501775,"SANDEN CHINA COMPANY, LIMITED
新電中國有限公司",1994-12-29,2015-06-12,"Private, ltd by shares"231,0501734,"SCANDINAVIAN HOUSE, HANOI LIMITED",1994-12-29,2003-11-28,"Private, ltd by shares"232,0501707,"SEE FUNG INDUSTRIAL CO. LIMITED
時豐工業有限公司",1994-12-29,2005-03-30,"Private, ltd by shares"233,0501776,"SH REALTY DEVELOPMENT (H.K.) LIMITED
淞華房地產開發(香港)有限公司",1994-12-29,2001-07-20,"Private, ltd by shares"234,0501664,"SHEENY DRAGON ENTERPRISE INVESTMENTS LIMITED
聖龍企業投資有限公司",1994-12-29,2002-05-03,"Private, ltd by shares"235,0501757,"SHI YUN SHIPPING AGENCY COMPANY LIMITED
時運船務有限公司",1994-12-29,2003-07-11,"Private, ltd by shares"236,0501783,"SHIV IMPEX LIMITED
斯福出入口有限公司",1994-12-29,2003-10-10,"Private, ltd by shares"237,0501647,"SHUN YICK PAPER CO., LIMITED
順益紙品有限公司",1994-12-29,2015-12-18,"Private, ltd by shares"238,0501671,"SILVER MANAGEMENT LIMITED (d2002-03-15)
銀輝管理有限公司",1994-12-29,2002-03-15,"Private, ltd by shares"239,0501822,"SMARTRAY LEATHER GOODS LIMITED
晉耀皮具有限公司",1994-12-29,2003-10-03,"Private, ltd by shares"240,0501750,"SOCIETY OF WORLDWIDE ETHNIC CHINESE PHOTOGRAPHERS LIMITED (THE)
世界華人攝影學會有限公司",1994-12-29,,"Ltd by guarantee"241,0501719,"SOUTHERN (ASIA PACIFIC) LIMITED
南通(亞洲太平洋)有限公司",1994-12-29,2004-04-16,"Private, ltd by shares"242,0501687,"SPEED WHEEL INTERNATIONAL LIMITED
展熹國際有限公司",1994-12-29,2003-09-26,"Private, ltd by shares"243,0501621,"SPEEDTECH INDUSTRIAL SUPPLIES LIMITED
飛達工業設備有限公司",1994-12-29,2003-04-25,"Private, ltd by shares"244,0501723,"STAR-TEC GROUP LIMITED
馳達科技集團有限公司",1994-12-29,2004-08-27,"Private, ltd by shares"245,0501684,"STARON ENTERPRISE LIMITED
星美企業有限公司",1994-12-29,2011-12-30,"Private, ltd by shares"246,0501694,"STYLE ADVERTISING LIMITED
時式廣告有限公司",1994-12-29,1999-06-11,"Private, ltd by shares"247,0501753,"SUCCESS HEAD LIMITED
綽亨有限公司",1994-12-29,2002-01-18,"Private, ltd by shares"248,0501683,"SUCCESS UNION INDUSTRIAL LIMITED
誠聯實業有限公司",1994-12-29,,"Private, ltd by shares"249,0501738,"SUM KEE TRANSPORTATION COMPANY LIMITED
森記運輸有限公司",1994-12-29,,"Private, ltd by shares"250,0501555,"SUNBEST POLYFOAM FACTORY LIMITED
日佳發泡膠廠有限公司",1994-12-29,2008-11-14,"Private, ltd by shares"251,0501781,"SUNDERLAND TECHNOLOGY LIMITED (d2006-06-09)
日達科研有限公司",1994-12-29,2006-06-09,"Private, ltd by shares"252,0501709,"SUNG WON (H.K.) LIMITED
成元香港有限公司",1994-12-29,1999-12-03,"Private, ltd by shares"253,0501761,"SUNNY POWER LIMITED (d2001-03-16)",1994-12-29,2001-03-16,"Private, ltd by shares"254,0501586,"SUPERGO INTERNATIONAL LIMITED
嘉翠星國際有限公司",1994-12-29,2003-10-17,"Private, ltd by shares"255,0501731,"SURPLUS (ASIA) DEVELOPMENT LIMITED
盈業(亞洲)發展有限公司",1994-12-29,2003-11-28,"Private, ltd by shares"256,0501718,"SURPLUS RESOURCES LIMITED",1994-12-29,2003-11-28,"Private, ltd by shares"257,0501744,"SZETO GAMING SUPPLIES (INTERNATIONAL) COMPANY LIMITED
司徒國際娛樂用品供應有限公司",1994-12-29,2002-08-09,"Private, ltd by shares"258,0501648,"T &amp; Y RESOURCE LIMITED
東宇製衣配件有限公司",1994-12-29,2003-11-28,"Private, ltd by shares"259,0501756,"T.C. ASSOCIATES LIMITED
東正洋行有限公司",1994-12-29,2003-02-21,"Private, ltd by shares"260,0501649,"TIMOON ENTERPRISE (H.K.) CO., LIMITED
嚮濠化工塗料有限公司",1994-12-29,2004-08-27,"Private, ltd by shares"261,0501829,"TIN SHING MACHINERY ENGINEERING LIMITED
天盛機器工程有限公司",1994-12-29,2004-12-03,"Private, ltd by shares"262,0501770,"TRADE MARK DEVELOPMENT LIMITED
展智發展有限公司",1994-12-29,,"Private, ltd by shares"263,0501779,"TRANSNATION SHIPPING LIMITED
晉達航運有限公司",1994-12-29,,"Private, ltd by shares"264,0501682,"TREW LIMITED (d1998-06-05)
駿匯洋行有限公司",1994-12-29,1998-06-05,"Private, ltd by shares"265,0501598,"TRIANGLE WORLDWIDE GROUP LIMITED
世顯國際有限公司",1994-12-29,2010-07-09,"Private, ltd by shares"266,0501706,"TSE'S BROTHERS COMPANY LIMITED
謝氏兄弟有限公司",1994-12-29,,"Private, ltd by shares"267,0501834,"TST INTERNATIONAL LIMITED (d2004-08-27)
信漢國際有限公司",1994-12-29,2004-08-27,"Private, ltd by shares"268,0501740,"TUNG SHUN PRINTING LIMITED
東信印刷有限公司",1994-12-29,2015-10-02,"Private, ltd by shares"269,0501614,"U-CYBER PROPERTY INVESTMENT COMPANY LIMITED
航宇物業投資有限公司",1994-12-29,2007-01-19,"Private, ltd by shares"270,0501672,"U-CYBER PROPERTY MANAGEMENT COMPANY LIMITED
航宇物業管理有限公司",1994-12-29,2005-12-09,"Private, ltd by shares"271,0501563,"UNION COMPUTER LIMITED
統一電腦有限公司",1994-12-29,2005-11-25,"Private, ltd by shares"272,0501617,"UNION INFORMATION LIMITED
統一資訊有限公司",1994-12-29,2003-11-28,"Private, ltd by shares"273,0501616,"UNION RESOURCES LIMITED (d2002-04-26)
統一資源有限公司",1994-12-29,2002-04-26,"Private, ltd by shares"274,0501688,"UNITED EAGLE INTERNATIONAL LIMITED (d2012-03-09)
鷹隆國際有限公司",1994-12-29,2012-03-09,"Private, ltd by shares"275,0501565,"UNITED GARMENT LIMITED (d2004-08-27)
統一製衣有限公司",1994-12-29,2004-08-27,"Private, ltd by shares"276,0501553,"UNITED UNIVERSAL LIMITED (d2004-09-24)
統一環球有限公司",1994-12-29,2004-09-24,"Private, ltd by shares"277,0501564,"UNITY ELECTRONIC LIMITED (d2003-11-28)
統一電子有限公司",1994-12-29,2003-11-28,"Private, ltd by shares"278,0501690,"UNIVERSAL PETROL-CHEMICAL DEVELOPMENT LIMITED
環球石油化工發展有限公司",1994-12-29,2015-07-10,"Private, ltd by shares"279,0501554,"UPPER COMPANY LIMITED
登成有限公司",1994-12-29,,"Private, ltd by shares"280,0501670,"UPPER TECHNOLOGY LIMITED (d2003-11-28)
高科科技有限公司",1994-12-29,2003-11-28,"Private, ltd by shares"281,0501546,"VAST BUSINESS DEVELOPMENT LIMITED
進業發展有限公司",1994-12-29,2004-04-16,"Private, ltd by shares"282,0501539,"VASTLAND PROPERTIES LIMITED
宏地置業有限公司",1994-12-29,1998-04-24,"Private, ltd by shares"283,0501699,"VINCENT TRADING (HK) LIMITED (d1998-02-20)
永盛貿易(香港)有限公司",1994-12-29,1998-02-20,"Private, ltd by shares"284,0501782,"VIRGO STAR (ENTERPRISES) LIMITED
耀澄(企業)有限公司",1994-12-29,2004-03-05,"Private, ltd by shares"285,0501652,"VITA GREEN PHARMACEUTICAL (H.K.) LIMITED",1994-12-29,,"Private, ltd by shares"286,0501543,"WAH HA (H.K.) LIMITED
華厦(香港)有限公司",1994-12-29,,"Private, ltd by shares"287,0501613,"WAH WING COMPANY LIMITED
華榮行有限公司",1994-12-29,,"Private, ltd by shares"288,0501768,"WAI YEUNG ELECTRONICS INDUSTRIAL LIMITED
偉洋電子實業有限公司",1994-12-29,,"Private, ltd by shares"289,0501544,"WATERMAN INTERNATIONAL LIMITED (d2001-04-20)",1994-12-29,2001-04-20,"Private, ltd by shares"290,0501680,"WELL SPARK INVESTMENTS LIMITED
緯柏投資有限公司",1994-12-29,,"Private, ltd by shares"291,0501666,"WELLANE GROUP COMPANY LIMITED
威靈集團有限公司",1994-12-29,,"Private, ltd by shares"292,0501772,"WHITE DOVE INTERNATIONAL CARGO (HK) LIMITED",1994-12-29,2004-04-16,"Private, ltd by shares"293,0501837,"WIDE YIELD ELECTRICAL ENTERPRISE LIMITED
偉溢電業有限公司",1994-12-29,2004-09-03,"Private, ltd by shares"294,0501637,"WING LEE FINANCE COMPANY LIMITED (d1999-03-12)
榮利財務有限公司",1994-12-29,1999-03-12,"Private, ltd by shares"295,0501839,"WING LI TRADING (CHINA) COMPANY LIMITED
榮利貿易(中國)有限公司",1994-12-29,2009-10-09,"Private, ltd by shares"296,0501808,"WING SHING MARINE ENGINEERING LIMITED
永成海事工程有限公司",1994-12-29,1999-06-11,"Private, ltd by shares"297,0501736,"WINTEX DYEING FACTORY LIMITED (d2002-05-17)
永達漂染廠有限公司",1994-12-29,2002-05-17,"Private, ltd by shares"298,0501679,"WISETEX INVESTMENTS LIMITED
緯德投資有限公司",1994-12-29,2016-05-27,"Private, ltd by shares"299,0501720,"WONG YAT SING COMPANY LIMITED
黃日陞有限公司",1994-12-29,2005-11-25,"Private, ltd by shares"300,0501675,"XUANWU (H.K.) COMPANY LIMITED
玄武(香港)有限公司",1994-12-29,2003-03-21,"Private, ltd by shares"301,0501681,"YETSON INVESTIGATION LIMITED
溢熹調查有限公司",1994-12-29,2007-08-10,"Private, ltd by shares"302,0501534,"YIK SUN TONG MEDICAL PRODUCT COMPANY LIMITED
益生堂藥業有限公司",1994-12-29,2019-11-01,"Private, ltd by shares"303,0501755,"YING'S INTERNATIONAL FINANCE LIMITED
英士國際財務有限公司",1994-12-29,,"Private, ltd by shares"304,0501624,"YIU CHUN COMPANY LIMITED
要專有限公司",1994-12-29,1999-04-16,"Private, ltd by shares"305,0501697,"YUM CHA CHA ASIA LIMITED",1994-12-29,2008-04-11,"Private, ltd by shares"306,0501695,"ZHEN BAO JEWELLERY LIMITED
珍寶珠寶有限公司",1994-12-29,,"Private, ltd by shares"307,0501585,"ZUISSE ENGINEERING HONG KONG LIMITED
瑞森工程香港有限公司",1994-12-29,,"Private, ltd by shares"