,Reg no.,Name,Incorp-orated,Dissolved,Type241,3134007,"MINISEA TECHNOLOGY LIMITED
香港小海洋科技有限公司",2022-03-10,,"Private, ltd by shares"242,3133831,"MOONSTONE TRADE CO., LIMITED",2022-03-10,,"Private, ltd by shares"243,3134154,"Moonwalker Ventures Limited",2022-03-10,,"Private, ltd by shares"244,3133811,"MY WEB ON DEMAND LIMITED",2022-03-10,,"Private, ltd by shares"245,3134143,"Neteuler Technology Limited
香港歐拉智聯科技有限公司",2022-03-10,,"Private, ltd by shares"246,3133986,"New Moon Legend Limited",2022-03-10,,"Private, ltd by shares"247,3133952,"New Sunrise Home Appliance Co., Limited",2022-03-10,,"Private, ltd by shares"248,3134005,"NINGBO MAXTORS CNC MACHINERY CO., LIMITED",2022-03-10,,"Private, ltd by shares"249,3134174,"Nirvana Limited (HK)",2022-03-10,,"Private, ltd by shares"250,3134098,"Noah Architecture Limited
諾亞建築工程有限公司",2022-03-10,,"Private, ltd by shares"251,3134127,"Nomad Tech Solution Limited",2022-03-10,,"Private, ltd by shares"252,3133816,"OCEAN PETROLEUM EQUIPMENT LIMITED",2022-03-10,,"Private, ltd by shares"253,3134124,"OPUS 1 MUSIC FOUNDATION LIMITED
品壹音樂基金有限公司",2022-03-10,,"Ltd by guarantee"254,3134083,"PAZ INSTITUTE LIMITED",2022-03-10,,"Private, ltd by shares"255,3134082,"PENG YUAN INTERNATIONAL CO., LIMITED
鵬遠國際有限公司",2022-03-10,,"Private, ltd by shares"256,3134071,"Performance International Home Limited
帕美國際家居有限公司",2022-03-10,,"Private, ltd by shares"257,3134064,"PERPETUAL GARDEN LIMITED
峻源藝有限公司",2022-03-10,,"Private, ltd by shares"258,3133983,"Petrichor Limited (The)
柏川科研有限公司",2022-03-10,,"Private, ltd by shares"259,3133852,"Philomuse Limited
心靈共振有限公司",2022-03-10,,"Private, ltd by shares"260,3134035,"Photon Capital Limited
光子資本有限公司",2022-03-10,,"Private, ltd by shares"261,3134073,"Pigeons Communications Limited
千鴿傳播有限公司",2022-03-10,,"Private, ltd by shares"262,3134133,"PINGO TRADING COMPANY LIMITED
拼高貿易有限公司",2022-03-10,,"Private, ltd by shares"263,3133872,"Pinxianhui trading Limited
品鮮匯貿易有限公司",2022-03-10,,"Private, ltd by shares"264,3133911,"PINXIN PLASTICIZATION CO., LIMITED
品信塑化有限公司",2022-03-10,,"Private, ltd by shares"265,3133906,"Plant Mut Yeah Limited
種乜嘢有限公司",2022-03-10,,"Private, ltd by shares"266,3133818,"Pluscomp Electronics Limited",2022-03-10,,"Private, ltd by shares"267,3133892,"Prospero International (Hong Kong) Co., Limited",2022-03-10,,"Private, ltd by shares"268,3133998,"PXD International Supply Chain Limited
鵬鑫達國際供應鏈有限公司",2022-03-10,,"Private, ltd by shares"269,3133964,"QIAOYU TRADE LIMITED
僑渝貿易有限公司",2022-03-10,,"Private, ltd by shares"270,3134068,"QINGGAUNG TRADE CO., LIMITED
清廣貿易有限公司",2022-03-10,,"Private, ltd by shares"271,3133969,"RANMAO STUDIO CO., LIMITED
香港暢娛時空網絡科技有限公司",2022-03-10,,"Private, ltd by shares"272,3133858,"RED MOUNTAIN NEW MATERIALS LIMITED
紅山新材料有限公司",2022-03-10,,"Private, ltd by shares"273,3134016,"Red Sum Sum Limited
紅嬸嬸有限公司",2022-03-10,,"Private, ltd by shares"274,3133854,"Reeds Global Jewelry Limited
域仕環球珠寶有限公司",2022-03-10,,"Private, ltd by shares"275,3134150,"RICHIE INFORMATION TECHNOLOGY LIMITED
益富資訊科技有限公司",2022-03-10,,"Private, ltd by shares"276,3134008,"RUN TAO TRADE LIMITED
潤濤貿易有限公司",2022-03-10,,"Private, ltd by shares"277,3133981,"Russia Akang Chemical Agriculture Group Co., Limited
俄羅斯阿康化工農業集團有限公司",2022-03-10,,"Private, ltd by shares"278,3133820,"Russian White Bear Craft Beer Co., Limited
俄羅斯白熊精釀啤酒有限公司",2022-03-10,,"Private, ltd by shares"279,3133835,"Ryan Jewellery Co., Limited
銳銀珠寶有限公司",2022-03-10,,"Private, ltd by shares"280,3134014,"SA.VI.TA INTRNATIONAL CO., LIMITED",2022-03-10,,"Private, ltd by shares"281,3134080,"Sansi Electronic Engineering Co., Limited",2022-03-10,,"Private, ltd by shares"282,3134156,"SARVAJNA LIMITED
薩般若海有限公司",2022-03-10,,"Private, ltd by shares"283,3134139,"Sega Enterprise Limited
世家實業有限公司",2022-03-10,,"Private, ltd by shares"284,3133865,"SEMILUMENS TECHNOLOGY (HONGKONG) CO., LIMITED
香港集明光電技術有限公司",2022-03-10,,"Private, ltd by shares"285,3133890,"Shengcai Packaging Technology (HK) Co., Limited
盛彩包裝科技(香港)有限公司",2022-03-10,,"Private, ltd by shares"286,3133926,"Shenzhen Hongocean Freight Forwarding Co., Limited
深圳市鴻海通國際貨運代理有限公司",2022-03-10,,"Private, ltd by shares"287,3133962,"SHIZHAN E-COMMERCE LIMITED
香港施展電子商務有限公司",2022-03-10,,"Private, ltd by shares"288,3133925,"Shree Trade Co., Limited
斯里貿易有限公司",2022-03-10,,"Private, ltd by shares"289,3134041,"Shumiao Technology Limited
黍苗科技有限公司",2022-03-10,,"Private, ltd by shares"290,3134122,"SHUN HUI LIMITED",2022-03-10,,"Private, ltd by shares"291,3134109,"Silicon Technology Limited
矽谷科技有限公司",2022-03-10,,"Private, ltd by shares"292,3133995,"Skytel Group Co., Limited
天信集團股份有限公司",2022-03-10,,"Private, ltd by shares"293,3133943,"SOUFFLE LIMITED",2022-03-10,,"Private, ltd by shares"294,3133812,"Sportscard Gems Limited",2022-03-10,,"Private, ltd by shares"295,3133992,"Starhubfuture Investment Hong Kong Limited
星和未來投資香港有限公司",2022-03-10,,"Private, ltd by shares"296,3133895,"Starley Consultancy (Hong Kong) Limited
星源諮詢(香港)有限公司",2022-03-10,,"Private, ltd by shares"297,3134017,"Startup Market Limited (The)",2022-03-10,,"Private, ltd by shares"298,3133917,"Summer Design &amp; Trading Company Limited
森馬設計貿易有限公司",2022-03-10,,"Private, ltd by shares"299,3134067,"Sun Power Solutions Limited
新能技術有限公司",2022-03-10,,"Private, ltd by shares"300,3134128,"SUNLIGHT PATIO FURNITURE CO., LIMITED",2022-03-10,,"Private, ltd by shares"301,3133886,"TAITAI STACK (HONG KONG) LIMITED
太太棧(香港)有限公司",2022-03-10,,"Private, ltd by shares"302,3134034,"TAIWAN TONGYI INTERNATIONAL NEW ENERGY LIMITED
臺灣統一國際新能源有限公司",2022-03-10,,"Private, ltd by shares"303,3133945,"TALENTKIDS (GLOBAL) DISCOVER RESEARCH INSTITUTE CENTER LIMITED
天賦奇童(全球)發現研究中心有限公司",2022-03-10,,"Private, ltd by shares"304,3133920,"Tao Xin Trading Co., Limited
淘新貿易有限公司",2022-03-10,,"Private, ltd by shares"305,3133808,"TCLY PARTNERS LIMITED
歐上港管理有限公司",2022-03-10,,"Private, ltd by shares"306,3133933,"TIRAMISU LIMITED",2022-03-10,,"Private, ltd by shares"307,3134165,"TOOTBOX LIMITED",2022-03-10,,"Private, ltd by shares"308,3133905,"TOUCHSTONE-TAM TECHNOLOGY GROUP LIMITED
點炻貿促通科技有限公司",2022-03-10,,"Private, ltd by shares"309,3133837,"Tridom Agriscience Limited",2022-03-10,,"Private, ltd by shares"310,3133830,"Trihero Group Co., Limited
英豪電氣有限公司",2022-03-10,,"Private, ltd by shares"311,3133841,"Tsing Hwa Rubber Ind. Co., Limited",2022-03-10,,"Private, ltd by shares"312,3133829,"TSW INTERNATIONAL (HONGKONG) LIMITED
天順和國際(香港)有限公司",2022-03-10,,"Private, ltd by shares"313,3134074,"TTYY International Limited",2022-03-10,,"Private, ltd by shares"314,3134137,"UK WALDAU INTERNATIONAL CO., LIMITED
英國沃道姆國際有限公司",2022-03-10,,"Private, ltd by shares"315,3133884,"ULTRAMETAS LIMITED
香港超元科技有限公司",2022-03-10,,"Private, ltd by shares"316,3134001,"Umie (Hongkong) International Trading Co., Limited
譽鳴（香港）國際貿易有限公司",2022-03-10,,"Private, ltd by shares"317,3134115,"UNIPIA HK Limited
池家有限公司",2022-03-10,,"Private, ltd by shares"318,3134002,"UNIWELLS TRADING LIMITED
優尼韋爾貿易有限公司",2022-03-10,,"Private, ltd by shares"319,3133956,"USA Federal Medicine (Hong Kong) International Co., Limited
美國聯邦醫藥(香港)國際有限公司",2022-03-10,,"Private, ltd by shares"320,3134094,"USA MAGIC CHYMISTRY LIMITED
美國魔力化學有限公司",2022-03-10,,"Private, ltd by shares"321,3133922,"VAST SEA ELECTRONICS COMPANY LIMITED
浩瀚如海電子有限公司",2022-03-10,,"Private, ltd by shares"322,3134102,"VerseDigito Limited",2022-03-10,,"Private, ltd by shares"323,3133973,"Versemedia Limited",2022-03-10,,"Private, ltd by shares"324,3134149,"VEX Solutions Limited
睿格有限公司",2022-03-10,,"Private, ltd by shares"325,3133861,"Vibrantlize Towing Service Limited
活力拖車服務有限公司",2022-03-10,,"Private, ltd by shares"326,3134095,"VINA TRADE LIMITED",2022-03-10,,"Private, ltd by shares"327,3134123,"VUMINBOX INTERNATIONAL TRADE LIMITED
母音博世國際貿易有限公司",2022-03-10,,"Private, ltd by shares"328,3134089,"WANGJAN TRADING LIMITED
弘忻貿易有限公司",2022-03-10,,"Private, ltd by shares"329,3134058,"Wanguo Interactive Technology Co., Limited
萬國互動科技有限公司",2022-03-10,,"Private, ltd by shares"330,3133915,"WE.SOUL LIMITED",2022-03-10,,"Private, ltd by shares"331,3133899,"Wellink Business Development (Hong Kong) Limited
智麟商業發展(香港)有限公司",2022-03-10,,"Private, ltd by shares"332,3134020,"WENZHOU TINSI STEEL CO., LIMITED
溫州青實鋼鐵有限公司",2022-03-10,,"Private, ltd by shares"333,3133853,"WhipCreation Limited",2022-03-10,,"Private, ltd by shares"334,3134059,"WIESE (HK) CO., LIMITED
維澤香港有限公司",2022-03-10,,"Private, ltd by shares"335,3133947,"WISDOM DIGITAL AND TECHNOLOGY INTERNATIONAL TRADING CO., LIMITED
智慧數科國際貿易有限公司",2022-03-10,,"Private, ltd by shares"336,3134077,"WME BIOLOGICAL TECHNOLOGY CO., LIMITED
為美生物科技有限公司",2022-03-10,,"Private, ltd by shares"337,3133921,"Wo Lik Material Engineering Limited
和力建材工程有限公司",2022-03-10,,"Private, ltd by shares"338,3134161,"WONDERING NOMAD LIMITED",2022-03-10,,"Private, ltd by shares"339,3134032,"WSS EXPRESS MARITIME SERVICE &amp; LOGISTIC COMPANY LIMITED",2022-03-10,,"Private, ltd by shares"340,3133817,"WT Network Technology Limited
浤泰網路科技有限公司",2022-03-10,,"Private, ltd by shares"341,3134019,"Wuxi Xiou Electric Vehicle Limited
無錫喜歐電動車有限公司",2022-03-10,,"Private, ltd by shares"342,3133869,"XIAOGU INDUSTRIAL CO., LIMITED
曉穀實業有限公司",2022-03-10,,"Private, ltd by shares"343,3134044,"Xilan Chuan (Hong Kong) Trading Limited
希藍納川（香港）貿易有限公司",2022-03-10,,"Private, ltd by shares"344,3133896,"Xinjiabai Energy Investment (Group) Co., Limited
新佳柏能源投資(集團)有限公司",2022-03-10,,"Private, ltd by shares"345,3134062,"Xinyu Group Hong Kong Co., Limited
鑫裕集團香港有限公司",2022-03-10,,"Private, ltd by shares"346,3133934,"Xuli Technology Company Limited
旭立科技有限公司",2022-03-10,,"Private, ltd by shares"347,3133851,"Yi Jiangnan Technology Limited
憶江南科技有限公司",2022-03-10,,"Private, ltd by shares"348,3134086,"Yi Kwan Consultants Limited
以群顧問有限公司",2022-03-10,,"Private, ltd by shares"349,3134078,"YIWU AIDIBU TRADING CO., LIMITED
義烏市哎蒂布貿易有限公司",2022-03-10,,"Private, ltd by shares"350,3133857,"YIWU HUI SHUO TRADE CO., LIMITED
義烏慧碩貿易有限公司",2022-03-10,,"Private, ltd by shares"351,3133810,"Yoshi International Company Limited
友思國際有限公司",2022-03-10,,"Private, ltd by shares"352,3133935,"YOUKADA CO., LIMITED",2022-03-10,,"Private, ltd by shares"353,3133924,"Yu An Trading Co., Limited (b2022-03-10)
宇安貿易有限公司",2022-03-10,,"Private, ltd by shares"354,3133958,"YUEGANGAO INTERNATIONAL GROUP CO., LIMITED
粵港澳國際集團有限公司",2022-03-10,,"Private, ltd by shares"355,3133814,"YUHUANQUEEN CO., LIMITED
玉環娘娘有限公司",2022-03-10,,"Private, ltd by shares"356,3134172,"Yun Zhan Investment Consulting Co., Limited
雲展投資咨詢（香港）有限公司",2022-03-10,,"Private, ltd by shares"357,3134000,"Yuntong International Affairs Co., Limited
雲瞳國際事務有限公司",2022-03-10,,"Private, ltd by shares"358,3134134,"Yuyuan Electronic Technology Co., Limited
豫元電子科技有限公司",2022-03-10,,"Private, ltd by shares"359,3133972,"YZ (HONGKONG) TECHNOLOGY LIMITED
永造(香港)科技有限公司",2022-03-10,,"Private, ltd by shares"360,3134079,"ZHANJIA SPORTING GOODS CO., LIMITED
站佳運動用品有限公司",2022-03-10,,"Private, ltd by shares"361,3133908,"Zhizunbao International Holding Group (HK) Co., Limited
至尊寶國際控股集團(香港)有限公司",2022-03-10,,"Private, ltd by shares"362,3134169,"Zhong Bai (HK) Technology Co., Limited
香港中百科技有限公司",2022-03-10,,"Private, ltd by shares"363,3133844,"Zhong Kexin (Hong Kong) Investment Limited
中柯信（香港）投資有限公司",2022-03-10,,"Private, ltd by shares"364,3133887,"ZHONGHONG SHANGHUI (HONGKONG) INTERNATIONAL GROUP LIMITED
中鴻商匯(香港)國際集團有限公司",2022-03-10,,"Private, ltd by shares"365,3134132,"Zhongrui Hengyuan (Hong Kong) Holdings Limited
中瑞恒遠（香港）控股有限公司",2022-03-10,,"Private, ltd by shares"366,3133809,"Zhun Fat International Company Limited
竣發國際有限公司",2022-03-10,,"Private, ltd by shares"367,3133875,"ZOMCHAIN TECHNOLOGY CO., LIMITED
香港縱誠科技有限公司",2022-03-10,,"Private, ltd by shares"368,3133876,"ZXP INTERNATIONAL LIMITED
展星鵬國際有限公司",2022-03-10,,"Private, ltd by shares"