,Reg no.,Name,Incorp-orated,Dissolved,Type1,3133990,"1671 Company Limited",2022-03-10,,"Private, ltd by shares"2,3133989,"1982 Company Limited",2022-03-10,,"Private, ltd by shares"3,3134042,"60's Limited (The)
淥烚年代有限公司",2022-03-10,,"Private, ltd by shares"4,3134056,"ACE-TECH GROUP LIMITED
香港傾芯集團有限公司",2022-03-10,,"Private, ltd by shares"5,3133941,"AFFHAN Sourcing Agent CO., Limited",2022-03-10,,"Private, ltd by shares"6,3134106,"AG Salon Limited",2022-03-10,,"Private, ltd by shares"7,3134119,"Agematch Technology Internet Co., Limited
愛邁馳科技有限公司",2022-03-10,,"Private, ltd by shares"8,3133862,"AIMILE IMPORT&amp;EXPORT CO., LIMITED
艾米勒進出口有限公司",2022-03-10,,"Private, ltd by shares"9,3134069,"AIRPLUS ASIA-PACIFIC AIRTRAVEL SERVICES CO., LIMITED
沐昂（亞太）航空服務有限公司",2022-03-10,,"Private, ltd by shares"10,3133828,"Alcatel Technology Hong Kong Limited
阿爾卡特科技香港有限公司",2022-03-10,,"Private, ltd by shares"11,3133938,"ALDHURASI TRADING COMPANY LIMITED
爾多臘希貿易有限公司",2022-03-10,,"Private, ltd by shares"12,3133999,"Alex Global Products HK Limited",2022-03-10,,"Private, ltd by shares"13,3133838,"ALX LIMITED (HK)",2022-03-10,,"Private, ltd by shares"14,3134047,"Amy Jorgine Colfelt Limited",2022-03-10,,"Private, ltd by shares"15,3134168,"Anraya (Hongkong) E-Commerce Co., Limited
安睿亞（香港）電子商務有限公司",2022-03-10,,"Private, ltd by shares"16,3133980,"Aohaihui Limited
奧海匯有限公司",2022-03-10,,"Private, ltd by shares"17,3133888,"ASAD TRADING COMPANY LIMITED
艾賽德貿易有限公司",2022-03-10,,"Private, ltd by shares"18,3133848,"AsuderSober Technology Co., Limited
索伯科技有限公司",2022-03-10,,"Private, ltd by shares"19,3133864,"AY-Colour Company Limited",2022-03-10,,"Private, ltd by shares"20,3133971,"Bairun Engineering International Co., Limited
佰潤工程國際有限公司",2022-03-10,,"Private, ltd by shares"21,3133821,"BALLISTIC (HK) CO., LIMITED",2022-03-10,,"Private, ltd by shares"22,3133907,"Benefit the People Meridian Limited
惠民奇穴有限公司",2022-03-10,,"Private, ltd by shares"23,3133982,"BHDT ASIA PACIFIC LIMITED",2022-03-10,,"Private, ltd by shares"24,3133963,"Black Kite Re Limited",2022-03-10,,"Public, ltd by shares"25,3134175,"Bluemoon Import &amp; Export Co., Limited",2022-03-10,,"Private, ltd by shares"26,3134096,"BohongWen trading co., Limited
博泓貿易有限公司",2022-03-10,,"Private, ltd by shares"27,3134006,"Boundary X Limited",2022-03-10,,"Private, ltd by shares"28,3133944,"BREAD PUDDING LIMITED",2022-03-10,,"Private, ltd by shares"29,3133931,"BTW Energy International Limited
潤成國際能源(香港)有限公司",2022-03-10,,"Private, ltd by shares"30,3133850,"BTWO Hong Kong Biotechnology Limited
貝塔香港生物科技有限公司",2022-03-10,,"Private, ltd by shares"31,3134141,"Cargo Technology (Hong Kong) Limited
嘉宏科技(香港)有限公司",2022-03-10,,"Private, ltd by shares"32,3134101,"Chaamyuen Family Foods Limited
杉原家飯糰茶屋有限公司",2022-03-10,,"Private, ltd by shares"33,3133991,"Chan Ting Bong Workshop Limited
陳定幫工作室有限公司",2022-03-10,,"Private, ltd by shares"34,3134173,"CHANG YI SEAFOOD TRADING CO., LIMITED
長益水產貿易有限公司",2022-03-10,,"Private, ltd by shares"35,3133928,"CHEF RAY LIMITED",2022-03-10,,"Private, ltd by shares"36,3133968,"Chelion HongKong Co., Limited
聯科熙和香港有限公司",2022-03-10,,"Private, ltd by shares"37,3133902,"CHINA INDIVIDUAL CREDIT OWING REORGANIZATION LIMITED
中國個人信用債務重組有限公司",2022-03-10,,"Private, ltd by shares"38,3133953,"China International Capital Corporation (Asia) Asset Management Co., Limited
中國國際金融(亞洲)資產管理有限公司",2022-03-10,,"Private, ltd by shares"39,3133901,"China International Culture Association Limited
中國國際文化促進會有限公司",2022-03-10,,"Private, ltd by shares"40,3133942,"CHOUX LIMITED",2022-03-10,,"Private, ltd by shares"41,3133832,"Chun Winn Engineering Company Limited
駿運工程有限公司",2022-03-10,,"Private, ltd by shares"42,3133904,"CNShipforShop Limited",2022-03-10,,"Private, ltd by shares"43,3133951,"Coeng Ping Commerce Limited
長平商貿有限公司",2022-03-10,,"Private, ltd by shares"44,3133959,"COSLC Investment 1 Co., Limited",2022-03-10,,"Private, ltd by shares"45,3133932,"CREAM BULEE LIMITED",2022-03-10,,"Private, ltd by shares"46,3133978,"CSPW MANAGEMENT LIMITED",2022-03-10,,"Private, ltd by shares"47,3134090,"Cuifei Shipping (Hong Kong) Co., Limited
璀翡航運（香港）有限公司",2022-03-10,,"Private, ltd by shares"48,3133949,"Custompro (HK) Technology Limited
凱普潤（香港）科技有限公司",2022-03-10,,"Private, ltd by shares"49,3134025,"CWH 42 LIMITED",2022-03-10,,"Private, ltd by shares"50,3134028,"CWH 44 LIMITED",2022-03-10,,"Private, ltd by shares"51,3134027,"CWH GLOBAL LIMITED",2022-03-10,,"Private, ltd by shares"52,3134116,"D.H Trading Limited
大海流通有限公司",2022-03-10,,"Private, ltd by shares"53,3134129,"Dao Corp Limited",2022-03-10,,"Private, ltd by shares"54,3134055,"Daqi shoe material Co., Limited
大器鞋材有限公司",2022-03-10,,"Private, ltd by shares"55,3134118,"DAYAOFANG (HONG KONG) CO., LIMITED
大藥房（香港）有限公司",2022-03-10,,"Private, ltd by shares"56,3134030,"Deminghui Company Limited
德明慧有限公司",2022-03-10,,"Private, ltd by shares"57,3133961,"Dingyi Technology (Hong Kong) Limited
鼎溢科技(香港)有限公司",2022-03-10,,"Private, ltd by shares"58,3134111,"DY Trading Limited
大養有限公司",2022-03-10,,"Private, ltd by shares"59,3134051,"ECO Home Groups Limited
尚饌有限公司",2022-03-10,,"Private, ltd by shares"60,3133979,"Eco Living Interior Design Limited
環保家居室內設計有限公司",2022-03-10,,"Private, ltd by shares"61,3133866,"EL Psychology Service &amp; Family Clinic Limited",2022-03-10,,"Private, ltd by shares"62,3134043,"Elite Strategies Corporation Limited",2022-03-10,,"Private, ltd by shares"63,3134110,"Elite Technologies Limited
精英科技有限公司",2022-03-10,,"Private, ltd by shares"64,3133900,"EMMA INTERNATIONAL (HONG KONG) CO., LIMITED
省心國際商務(香港)有限公司",2022-03-10,,"Private, ltd by shares"65,3133826,"Entropy Electronic Technology (HK) Limited
恩特洛普科技(香港)有限公司",2022-03-10,,"Private, ltd by shares"66,3134031,"Enzo Studio Limited",2022-03-10,,"Private, ltd by shares"67,3133819,"Eternity Consultant (International) Company Limited
駿穎國際顧問有限公司",2022-03-10,,"Private, ltd by shares"68,3133923,"EURO-ASIA ZHONGZHENG CAPITAL LIMITED
歐亞中正資本有限公司",2022-03-10,,"Private, ltd by shares"69,3133834,"Evosky Limited",2022-03-10,,"Private, ltd by shares"70,3134138,"eye.tel Limited",2022-03-10,,"Private, ltd by shares"71,3134081,"Fayis Hong Kong Medical Research Center Group Co., Limited
發醫滋(香港)醫學研究中心集團有限公司",2022-03-10,,"Private, ltd by shares"72,3133994,"Fire Of Hope E-commerce Limited
希望之火電子商務有限公司",2022-03-10,,"Private, ltd by shares"73,3133827,"Flourish Developing Company Limited
科興業務工程有限公司",2022-03-10,,"Private, ltd by shares"74,3133840,"FOREVER SHEPHERD LIMITED",2022-03-10,,"Private, ltd by shares"75,3133918,"FOXCO International Trading Co., Limited
福世國際貿易有限公司",2022-03-10,,"Private, ltd by shares"76,3134087,"FRANDAK LOGISTICS LIMITED",2022-03-10,,"Private, ltd by shares"77,3133929,"G ANGO LIMITED",2022-03-10,,"Private, ltd by shares"78,3133916,"G I Properties Limited",2022-03-10,,"Private, ltd by shares"79,3134010,"Gamerock Digital Entertainment Co., Limited
滾石數字娛樂有限公司",2022-03-10,,"Private, ltd by shares"80,3133993,"GAZ (HK) ACCESSORIES LIMITED",2022-03-10,,"Private, ltd by shares"81,3134015,"GERMANY WEILIPUR ELECTROMECHANICAL LIMITED
德國威利譜機電有限公司",2022-03-10,,"Private, ltd by shares"82,3133815,"GM BIOTECHNOLOGY CO., LIMITED
國明生物科技有限公司",2022-03-10,,"Private, ltd by shares"83,3134085,"GO FUN LIMITED",2022-03-10,,"Private, ltd by shares"84,3134120,"GO GLOBAL TRADING Limited
金海洋全球貿易有限公司",2022-03-10,,"Private, ltd by shares"85,3133946,"Good Day Hong Kong Enterprise Limited
浩天香港實業有限公司",2022-03-10,,"Private, ltd by shares"86,3134114,"Goodgate International Trading (HK) Co., Limited
好蓋特國際貿易(香港)有限公司",2022-03-10,,"Private, ltd by shares"87,3133955,"Graval MetaArt Consulting Limited
博浩元藝術顧問有限公司",2022-03-10,,"Private, ltd by shares"88,3134038,"Great Create Marketing Company Limited
宏創市場有限公司",2022-03-10,,"Private, ltd by shares"89,3133987,"Great Legend Limited (b2022-03-10)",2022-03-10,,"Private, ltd by shares"90,3134167,"Great Sail Shipping Limited",2022-03-10,,"Private, ltd by shares"91,3134004,"GROWAY INTERNATIONAL TRADING LIMITED
格洛威國際貿易有限公司",2022-03-10,,"Private, ltd by shares"92,3133846,"GS Solutions Int. Limited",2022-03-10,,"Private, ltd by shares"93,3134065,"GUANGDONG HONGFENG CABLE CO., LIMITED
廣東紅楓電纜有限公司",2022-03-10,,"Private, ltd by shares"94,3133997,"Guohang Group (HK) Limited
國航集團(香港)有限公司",2022-03-10,,"Private, ltd by shares"95,3134107,"Gwee Food and Beverage Limited",2022-03-10,,"Private, ltd by shares"96,3133859,"HAKKA TRADE HONG KONG LIMITED
客家貿易香港有限公司",2022-03-10,,"Private, ltd by shares"97,3134130,"Haorui International Trading Co., Limited
浩睿國際貿易有限公司",2022-03-10,,"Private, ltd by shares"98,3134097,"HE GROUP LIMITED",2022-03-10,,"Private, ltd by shares"99,3134108,"HENGXIN PLASTIC TECHNOLOGY CO., LIMITED
恒新塑膠科技有限公司",2022-03-10,,"Private, ltd by shares"100,3134049,"HengYuan Enterprise Co., Limited
恒源嘉企業有限公司",2022-03-10,,"Private, ltd by shares"101,3133988,"High Standard(HongKong)Business Co., Limited
高標（香港）商務有限公司",2022-03-10,,"Private, ltd by shares"102,3134157,"Highertop Group Limited
海力拓集團有限公司",2022-03-10,,"Private, ltd by shares"103,3134026,"HK BEAM MEDICAL CO., LIMITED
香港沃來達國際貿易有限公司",2022-03-10,,"Private, ltd by shares"104,3133937,"HK Brighture Trading Co., Limited
香港明途貿易有限公司",2022-03-10,,"Private, ltd by shares"105,3133985,"HK CHENYAN TRADING CO., LIMITED
香港忱研貿易有限公司",2022-03-10,,"Private, ltd by shares"106,3134142,"HK GUANYING TRADE CO., LIMITED
香港冠英貿易有限公司",2022-03-10,,"Private, ltd by shares"107,3134145,"HK JUNBO TRADE CO., LIMITED
香港俊博貿易有限公司",2022-03-10,,"Private, ltd by shares"108,3134147,"HK PC TRADE LIMITED
香港朋晨貿易有限公司",2022-03-10,,"Private, ltd by shares"109,3134135,"HK THE CORE SOURCE TRADE LIMITED
香港芯源貿易有限公司",2022-03-10,,"Private, ltd by shares"110,3133849,"HK YINK TECHNOLOGY LIMITED
香港銀嘉科技有限公司",2022-03-10,,"Private, ltd by shares"111,3134022,"HK YUNFAN BEAT CO., LIMITED
香港雲帆跳動有限公司",2022-03-10,,"Private, ltd by shares"112,3133863,"HK YUNKE TRADING CO., LIMITED
香港雲科貿易有限公司",2022-03-10,,"Private, ltd by shares"113,3133836,"HK ZHONG MAI LIMITED
香港中脈有限公司",2022-03-10,,"Private, ltd by shares"114,3134024,"HKEVMall Limited
金勾貿易國際有限公司",2022-03-10,,"Private, ltd by shares"115,3134009,"HOI FAT TRANSPORTATION COMPANY LIMITED
凱發運輸有限公司",2022-03-10,,"Private, ltd by shares"116,3133894,"HONEST INDUSTRIES LIMITED
志誠實業有限公司",2022-03-10,,"Private, ltd by shares"117,3134013,"HONG KONG (SINGAPORE) PAINTING AND CALLIGRAPHY ACADEMY CO., LIMITED
香港(新加坡)書畫院有限公司",2022-03-10,,"Private, ltd by shares"118,3133996,"Hong Kong Baiyang Garment Trading Co., Limited
香港百洋服裝貿易有限公司",2022-03-10,,"Private, ltd by shares"119,3133957,"Hong Kong Beijia Electronic Materials Company Limited
香港貝加電子材料有限公司",2022-03-10,,"Private, ltd by shares"120,3134036,"Hong Kong Bestele Technology Co., Limited
香港貝斯特通訊有限公司",2022-03-10,,"Private, ltd by shares"121,3134162,"HONG KONG CAIYUAN INTERNATIONAL TRADE LIMITED
香港才源國際貿易有限公司",2022-03-10,,"Private, ltd by shares"122,3134003,"Hong Kong Can Art Limited
香港燦藝有限公司",2022-03-10,,"Private, ltd by shares"123,3133903,"Hong Kong Causeway Bay Industrial Group Limited
香港銅鑼灣產業集團有限公司",2022-03-10,,"Private, ltd by shares"124,3133883,"Hong Kong Datang Great Wealth Technology Co., Limited
香港大唐鴻鑫科技有限公司",2022-03-10,,"Private, ltd by shares"125,3134048,"Hong Kong Fanxi Trading Co., Limited
香港梵希貿易有限公司",2022-03-10,,"Private, ltd by shares"126,3133960,"Hong Kong Finny International Trade Co., Limited
香港芬妮國際貿易有限公司",2022-03-10,,"Private, ltd by shares"127,3133977,"Hong Kong Haililaozhen International Management Limited
香港海里撈針國際管理有限公司",2022-03-10,,"Private, ltd by shares"128,3134117,"Hong Kong honey nest International Investment Corporation Limited
香港蜜巢國際投資有限公司",2022-03-10,,"Private, ltd by shares"129,3133927,"Hong Kong Jing Yue Trading Co., Limited
香港鯨躍貿易有限公司",2022-03-10,,"Private, ltd by shares"130,3134153,"Hong Kong Kemi Import &amp; Export Trading Co., Limited
香港刻米進出口貿易有限公司",2022-03-10,,"Private, ltd by shares"131,3133910,"Hong Kong Lijiada Co., Limited
香港利佳達有限公司",2022-03-10,,"Private, ltd by shares"132,3134121,"HONG KONG LIQI IMPORT &amp; EXPORT CO., LIMITED
香港立啟進出口有限公司",2022-03-10,,"Private, ltd by shares"133,3134063,"Hong Kong Liye Holding Co., Limited
香港立業控股有限公司",2022-03-10,,"Private, ltd by shares"134,3133860,"HONG KONG MKING HOUSE LIMITED
香港慕王家居有限公司",2022-03-10,,"Private, ltd by shares"135,3133868,"HONG KONG MOORE FILM AND TELEVISION CULTURE DEVELOPMENT LIMITED
香港摩爾影視文化發展有限公司",2022-03-10,,"Private, ltd by shares"136,3134099,"Hong Kong PoWoTong Pharmacy Co., Limited
香港保和堂大藥房有限公司",2022-03-10,,"Private, ltd by shares"137,3134148,"Hong Kong Quyi Technology Co., Limited
香港趣壹科技有限公司",2022-03-10,,"Private, ltd by shares"138,3134144,"Hong Kong Raincome International Trading Co., Limited
香港雨來國際貿易有限公司",2022-03-10,,"Private, ltd by shares"139,3134158,"Hong Kong RFA Technology Co., Limited
香港真時科技有限公司",2022-03-10,,"Private, ltd by shares"140,3134053,"Hong Kong Sinfree Group Co., Limited
香港鑫悅集團有限公司",2022-03-10,,"Private, ltd by shares"141,3133873,"Hong Kong Sun Sky Holdings Group Co., Limited
香港晴天控股集團有限公司",2022-03-10,,"Private, ltd by shares"142,3133823,"Hong Kong Suomo Trading Co., Limited
香港索漠貿易有限公司",2022-03-10,,"Private, ltd by shares"143,3134029,"HONG KONG TUOLANG TRADING CO., LIMITED
香港拓浪貿易有限公司",2022-03-10,,"Private, ltd by shares"144,3134039,"Hong Kong Tuyi Import &amp; Export Trade Limited
香港途一進出口貿易有限公司",2022-03-10,,"Private, ltd by shares"145,3134088,"Hong Kong Wanqi Co., Limited
香港萬祺有限公司",2022-03-10,,"Private, ltd by shares"146,3134054,"Hong Kong Wantao Trading Co., Limited
香港萬淘貿易有限公司",2022-03-10,,"Private, ltd by shares"147,3134045,"Hong kong Xinfei New Material Co., Limited
香港新菲新材料有限公司",2022-03-10,,"Private, ltd by shares"148,3134037,"Hong Kong Xingjia Technology Co., Limited
香港星嘉科技有限公司",2022-03-10,,"Private, ltd by shares"149,3133966,"Hong Kong Xiyinuoda Fishing Tackle Co., Limited
香港禧億諾達漁具有限公司",2022-03-10,,"Private, ltd by shares"150,3133879,"Hong Kong Yihe Industrial Co., Limited
香港頤和實業有限公司",2022-03-10,,"Private, ltd by shares"151,3133855,"Hong Kong Zhicheng Business Limited
香港至成商務有限公司",2022-03-10,,"Private, ltd by shares"152,3134057,"Hong kong Zhuoxun Microelectronics Co., Limited
香港卓訊微電子有限公司",2022-03-10,,"Private, ltd by shares"153,3134163,"HongKong BoWen Institute of Technology Limited
香港博文理工學院有限公司",2022-03-10,,"Private, ltd by shares"154,3133870,"HONGKONG FURUNZE INTERNATIONAL LIMITED
香港福潤澤國際貿易有限公司",2022-03-10,,"Private, ltd by shares"155,3134170,"HONGKONG HAOFENGSHENG TRADING LIMITED
香港豪豐勝貿易有限公司",2022-03-10,,"Private, ltd by shares"156,3134100,"HONGKONG HONGCHUANGYUAN TRADING CO., LIMITED
香港鴻創源貿易有限公司",2022-03-10,,"Private, ltd by shares"157,3134046,"Hongkong Innovations Packaging Manufacturer Co., Limited
香港禮成包裝製品有限公司",2022-03-10,,"Private, ltd by shares"158,3134125,"HONGKONG LICMORE INFORMATION TECHNOLOGY LIMITED
香港立多資訊科技有限公司",2022-03-10,,"Private, ltd by shares"159,3134155,"HONGKONG LIDONGSHENG INDUSTRIAL CO., LIMITED
香港利東盛實業有限公司",2022-03-10,,"Private, ltd by shares"160,3134072,"HONGKONG MAPLE TRADING CO., LIMITED
香港楓木貿易有限公司",2022-03-10,,"Private, ltd by shares"161,3133878,"HONGKONG RUIXI INDUSTRIAL LIMITED
香港瑞熙實業有限公司",2022-03-10,,"Private, ltd by shares"162,3133898,"House of Grace Limited (HK)
恩家厨房有限公司",2022-03-10,,"Private, ltd by shares"163,3134151,"HSE TRADE LIMITED
慧晟貿易有限公司",2022-03-10,,"Private, ltd by shares"164,3134076,"HUAKANG FOOD LIMITED
華康食品有限公司",2022-03-10,,"Private, ltd by shares"165,3134018,"Huaneng International Holdings Limited
華能國際控股有限公司",2022-03-10,,"Private, ltd by shares"166,3133909,"Huanxin Technology Co., Limited
環芯科技有限公司",2022-03-10,,"Private, ltd by shares"167,3133893,"HUAWAN INTERNATIONAL TRADING (HK) LIMITED
華萬國際貿易(香港)有限公司",2022-03-10,,"Private, ltd by shares"168,3133897,"Huayongkang Industrial Co., Limited
華永康實業有限公司",2022-03-10,,"Private, ltd by shares"169,3133845,"Huayuan Optics-electrical technology Co., Limited
華遠光電科技有限公司",2022-03-10,,"Private, ltd by shares"170,3133877,"Huen International Investment Management Limited
華恩國際投資管理有限公司",2022-03-10,,"Private, ltd by shares"171,3134113,"Human Resources Vocational Training Information Management Center Co., Limited
人力資源職業培訓信息管理中心有限公司",2022-03-10,,"Private, ltd by shares"172,3133919,"Hung Kei Professional Cleaning and Housekeeping Services Limited
洪記專業清潔及管家服務有限公司",2022-03-10,,"Private, ltd by shares"173,3133939,"ICOOL CO., LIMITED",2022-03-10,,"Private, ltd by shares"174,3133913,"ICRIS:3133913 (no English name)
雲彩一有限公司",2022-03-10,,"Private, ltd by shares"175,3133974,"ICRIS:3133974 (no English name)
香港統一集團食品有限公司",2022-03-10,,"Private, ltd by shares"176,3134011,"ICRIS:3134011 (no English name)
華帝智能廚衛科技有限公司",2022-03-10,,"Private, ltd by shares"177,3134052,"IEONGS (HONG KONG) TRADING LIMITED
利時 (香港) 貿易有限公司",2022-03-10,,"Private, ltd by shares"178,3134033,"Innovation Cloud Limited
雲創有限公司",2022-03-10,,"Private, ltd by shares"179,3134061,"Innovation Force Trading Limited",2022-03-10,,"Private, ltd by shares"180,3133881,"Intehand (HK) Co., Limited
億天航(香港)有限公司",2022-03-10,,"Private, ltd by shares"181,3134066,"IronTube Games Limited",2022-03-10,,"Private, ltd by shares"182,3133842,"ITALIAN PIAGET TECHNOLOGY CO., LIMITED
意大利伯爵科技有限公司",2022-03-10,,"Private, ltd by shares"183,3134104,"ITALY APES HEAD SHOES &amp; CLOTHING LIMITED
意大利猿人頭鞋服有限公司",2022-03-10,,"Private, ltd by shares"184,3134023,"Italy Finliy Paints Co., Limited
意大利芬俐塗料有限公司",2022-03-10,,"Private, ltd by shares"185,3133976,"JAPAN JIYE CO., LIMITED
日本吉野株式會社有限公司",2022-03-10,,"Private, ltd by shares"186,3134152,"JDSY INTERNATIONAL TRADE CO., LIMITED",2022-03-10,,"Private, ltd by shares"187,3133984,"JIADONG TRADING CO., LIMITED
佳東貿易有限公司",2022-03-10,,"Private, ltd by shares"188,3133813,"JIASHANG (HONG KONG) CO., LIMITED
嘉尚(香港)有限公司",2022-03-10,,"Private, ltd by shares"189,3134040,"JIEWAY TRADING LIMITED
捷偉貿易有限公司",2022-03-10,,"Private, ltd by shares"190,3133948,"JINCHEN INDUSTRY CO., LIMITED
山東錦宸工業科技有限公司",2022-03-10,,"Private, ltd by shares"191,3133824,"JINYAN INDUSTRY LIMITED
金妍實業有限公司",2022-03-10,,"Private, ltd by shares"192,3133882,"JNJE Company Limited",2022-03-10,,"Private, ltd by shares"193,3134146,"Jobio Limited",2022-03-10,,"Private, ltd by shares"194,3134105,"JOYBOY DIGITAL LIMITED",2022-03-10,,"Private, ltd by shares"195,3134103,"JOYFULAI TECHNOLOGY LIMITED
巧夫智能科技有限公司",2022-03-10,,"Private, ltd by shares"196,3134084,"Kaitai Electronic Trading Limited
開泰電子商行有限公司",2022-03-10,,"Private, ltd by shares"197,3133967,"KALIXIN CO., LIMITED
卡利幸有限公司",2022-03-10,,"Private, ltd by shares"198,3134093,"KINGS WILL CORPORATION LIMITED",2022-03-10,,"Private, ltd by shares"199,3134160,"KOC And U Fintech Limited",2022-03-10,,"Private, ltd by shares"200,3134091,"KT Accounts Limited",2022-03-10,,"Private, ltd by shares"201,3133975,"KWG NEWENERGY DEVELOPMENT CO., LIMITED
昆吾新能源發展有限公司",2022-03-10,,"Private, ltd by shares"202,3133936,"L&amp;S KNIGHT INTERNATIONAL LIMITED (HK)",2022-03-10,,"Private, ltd by shares"203,3133954,"La Marne International Group (China) Limited
馬恩國際集團(中國)有限公司",2022-03-10,,"Private, ltd by shares"204,3133885,"LAFF COMPANY LIMITED",2022-03-10,,"Private, ltd by shares"205,3133912,"LANBAOSHI LIMITED
藍寶石實業有限公司",2022-03-10,,"Private, ltd by shares"206,3134131,"LANWU GROUP COMPANY LIMITED
懶悟集團有限公司",2022-03-10,,"Private, ltd by shares"207,3134126,"Learig Consulting Limited",2022-03-10,,"Private, ltd by shares"208,3133950,"Lightening Whale Limited
追光鯨魚有限公司",2022-03-10,,"Private, ltd by shares"209,3133940,"Line Auto Group Limited",2022-03-10,,"Private, ltd by shares"210,3133822,"LINFENG IMP AND EXP LIMITED
林峰進出口有限公司",2022-03-10,,"Private, ltd by shares"211,3133970,"LING LEUNG COMPANY LIMITED
凌亮有限公司",2022-03-10,,"Private, ltd by shares"212,3133930,"Lion House (Hong Kong) Limited
獅藝舘（香港）龍獅國術總會有限公司",2022-03-10,,"Private, ltd by shares"213,3134159,"LIROS GLOBAL HOLDING LIMITED
里羅斯全球控股有限公司",2022-03-10,,"Private, ltd by shares"214,3134164,"Long Le International Co., Limited
龍樂國際有限公司",2022-03-10,,"Private, ltd by shares"215,3134060,"LONG YUNSHENG INDUSTRIAL CO., LIMITED
龍運盛實業有限公司",2022-03-10,,"Private, ltd by shares"216,3133839,"LONGKEDA LIMITED
龍科達有限公司",2022-03-10,,"Private, ltd by shares"217,3134050,"LoWahbase Company Limited
耀華資本有限公司",2022-03-10,,"Private, ltd by shares"218,3133889,"Maketh Partners Limited",2022-03-10,,"Private, ltd by shares"219,3134075,"MANMUSA International Limited
曼穆國際有限公司",2022-03-10,,"Private, ltd by shares"220,3134012,"Manta Rain Consulting Service Limited
曼塔瑞恩咨詢服務有限公司",2022-03-10,,"Private, ltd by shares"221,3134166,"Maples Company Limited
萬楓行有限公司",2022-03-10,,"Private, ltd by shares"222,3134112,"MASSY HARVEST TRADING CO., LIMITED
大豐收貿易有限公司",2022-03-10,,"Private, ltd by shares"223,3133856,"MAYBELLINE ASIA PACIFIC LIMITED
美寶蓮亞太有限公司",2022-03-10,,"Private, ltd by shares"224,3134021,"Maynos Jewelry Hong Kong Co., Limited
美諾思珠寶香港有限公司",2022-03-10,,"Private, ltd by shares"225,3133867,"MD2 LIMITED (HK)",2022-03-10,,"Private, ltd by shares"226,3133871,"MD3 LIMITED (HK)",2022-03-10,,"Private, ltd by shares"227,3133874,"MD4 LIMITED",2022-03-10,,"Private, ltd by shares"228,3133880,"MD5 LIMITED",2022-03-10,,"Private, ltd by shares"229,3133965,"Mei Jet Cleaning Service Co. Limited
美捷清潔服務有限公司",2022-03-10,,"Private, ltd by shares"230,3134070,"Meigaa Technology Co., Limited
美嘉嘉科技有限公司",2022-03-10,,"Private, ltd by shares"231,3134140,"MEIMING TRADE CO., LIMITED
美名貿易有限公司",2022-03-10,,"Private, ltd by shares"232,3133843,"Meliora Technology Co Limited",2022-03-10,,"Private, ltd by shares"233,3134092,"Mendel G.J. International HK Co., Limited
孟德爾國際(香港)有限公司",2022-03-10,,"Private, ltd by shares"234,3134171,"Metaorse International Company Limited
元馬國際有限公司",2022-03-10,,"Private, ltd by shares"235,3134136,"METASMART LIMITED",2022-03-10,,"Private, ltd by shares"236,3133914,"MFMIC Technology Company Limited
夢飛馬科技有限公司",2022-03-10,,"Private, ltd by shares"237,3133891,"Mia Line-Media Production (HK) Limited
美亞線上媒體制作香港有限公司",2022-03-10,,"Private, ltd by shares"238,3133847,"Mid-Summer Wonder International Limited",2022-03-10,,"Private, ltd by shares"239,3133833,"Mingbo Hardware Products Co., Limited
銘博五金制品有限公司",2022-03-10,,"Private, ltd by shares"240,3133825,"Mingchumingmen group (Hong Kong) Limited
名出名門集團(香港)有限公司",2022-03-10,,"Private, ltd by shares"