,Reg no.,Name,Incorp-orated,Dissolved,Type222,1011300,"ORIENT SSC MEDIA DEVELOPMENT COMPANY LIMITED (THE)
東方文華傳媒發展有限公司",2005-12-02,2011-10-21,"Private, ltd by shares"223,1011365,"ORIENTAL INTERNATIONAL CULTURAL ECONOMIC EXCHANGE CENTRE LIMITED
東方國際文化經濟交流中心有限公司",2005-12-02,2016-04-22,"Private, ltd by shares"224,1011611,"PANIRA HONG KONG LIMITED
潘伊香港有限公司",2005-12-02,2011-12-09,"Private, ltd by shares"225,1011615,"PENAVICO &amp; CL (HONG KONG) CO., LIMITED
中遠海運物流(香港)有限公司",2005-12-02,,"Private, ltd by shares"226,1011493,"PHILVINTON COMPANY LIMITED
顯楷子暘有限公司",2005-12-02,2007-10-26,"Private, ltd by shares"227,1011436,"PINE FAMOUS LIMITED (d2010-04-23)
栢譽有限公司",2005-12-02,2010-04-23,"Private, ltd by shares"228,1011581,"PIONEER INVESTMENT (GROUP) LIMITED
創業投資(集團)有限公司",2005-12-02,2011-05-20,"Private, ltd by shares"229,1011435,"POWER KEEN LIMITED
銳強有限公司",2005-12-02,,"Private, ltd by shares"230,1011473,"POWER MOBILE CHINA LIMITED",2005-12-02,2010-06-25,"Private, ltd by shares"231,1011334,"POWER SUCCESS (HONG KONG) LIMITED
隆威(香港)有限公司",2005-12-02,,"Private, ltd by shares"232,1011634,"POWER WORLD (CHINA) INVESTMENT LIMITED
協誠(中國)投資有限公司",2005-12-02,,"Private, ltd by shares"233,1011614,"PRART (HONG KONG) COMPANY LIMITED
專藝(香港)有限公司",2005-12-02,2011-12-09,"Private, ltd by shares"234,1011503,"PREMIER CHINA GROUP LIMITED",2005-12-02,,"Private, ltd by shares"235,1011619,"PRIME CAPITAL (HONG KONG) LIMITED",2005-12-02,2015-04-02,"Private, ltd by shares"236,1011618,"PRIME CAPITAL GLOBAL LIMITED",2005-12-02,2011-12-09,"Private, ltd by shares"237,1011544,"PROFIT LAND (H.K.) LIMITED
大地(香港)有限公司",2005-12-02,2008-05-23,"Private, ltd by shares"238,1011508,"PROSPERITY FOREVER AND EVER LIMITED
鼎晟有限公司",2005-12-02,,"Private, ltd by shares"239,1011591,"PROSPEROUS INVESTMENT (GROUP) LIMITED
裕豐投資(集團)有限公司",2005-12-02,2011-12-09,"Private, ltd by shares"240,1011545,"QINGHUA HOLDING (GROUP) GUANGDIAN ENGINEERING LIMITED
清華控股(集團)光電工程有限公司",2005-12-02,2010-04-30,"Private, ltd by shares"241,1011367,"Rainbow Fashion Wholesale Company Limited
彩虹時裝批發行有限公司",2005-12-02,2020-07-24,"Private, ltd by shares"242,1011514,"REDWALL GROUP (H.K.) LIMITED
紅墻集團(香港)有限公司",2005-12-02,2006-10-06,"Private, ltd by shares"243,1011590,"RELIANCE MANAGEMENT LIMITED (d2010-07-30)
榮興管理有限公司",2005-12-02,2010-07-30,"Private, ltd by shares"244,1011613,"REXVILLA COMPANY LIMITED",2005-12-02,2016-07-29,"Private, ltd by shares"245,1011486,"RFID SYSTEM &amp; SUPPLIES LIMITED
射頻科技系統資源有限公司",2005-12-02,,"Private, ltd by shares"246,1011330,"RICH GOLD TRADING LIMITED (d2020-03-27)
金發貿易有限公司",2005-12-02,2020-03-27,"Private, ltd by shares"247,1011426,"RIGHT MAX ENGINEERING LIMITED
正豐工程有限公司",2005-12-02,2009-05-08,"Private, ltd by shares"248,1011329,"RIGHT STATE DEVELOPMENT LIMITED (d2010-11-19)
正邦發展有限公司",2005-12-02,2010-11-19,"Private, ltd by shares"249,1011326,"RISE BASE (HONG KONG) LIMITED
振基(香港)有限公司",2005-12-02,2012-06-01,"Private, ltd by shares"250,1011325,"RISE BASE DEVELOPMENT LIMITED
振基發展有限公司",2005-12-02,,"Private, ltd by shares"251,1011419,"RISE SPREAD ENGINEERING LIMITED
振揚工程有限公司",2005-12-02,2010-12-03,"Private, ltd by shares"252,1011417,"RISE SPREAD INDUSTRIAL LIMITED (d2006-12-22)
振揚實業有限公司",2005-12-02,2006-12-22,"Private, ltd by shares"253,1011321,"RISE VIEW (HONG KONG) LIMITED
晉景(香港)有限公司",2005-12-02,2010-07-30,"Private, ltd by shares"254,1011469,"SAMWELL WORLDWIDE LIMITED",2005-12-02,,"Private, ltd by shares"255,1011320,"SCI-GROUP INTERNATIONAL LIMITED
科聯國際有限公司",2005-12-02,2011-12-16,"Private, ltd by shares"256,1011596,"SEAVIEW INVESTMENT (GROUP) LIMITED
海景投資(集團)有限公司",2005-12-02,,"Private, ltd by shares"257,1011549,"Shanghai PharmaKem Trading Co. Limited",2005-12-02,2010-04-23,"Private, ltd by shares"258,1011450,"SHANGHAI RIVER STONE TRADING (HONG KONG) LIMITED
上海羅浮仕貿易(香港)有限公司",2005-12-02,,"Private, ltd by shares"259,1011413,"SHARP WELL ENGINEERING LIMITED
建彩工程有限公司",2005-12-02,2007-06-08,"Private, ltd by shares"260,1011431,"SHINE HONEST LIMITED
暉信有限公司",2005-12-02,,"Private, ltd by shares"261,1011409,"SHINE LOGISTICS LIMITED
光輝物流有限公司",2005-12-02,,"Private, ltd by shares"262,1011480,"SIN CHONG INDUSTRIAL (H.K.) LIMITED
先創實業(香港)有限公司",2005-12-02,2011-12-09,"Private, ltd by shares"263,1011554,"SINGAPORE HUIHONG GROUP LIMITED
新加坡滙虹集團有限公司",2005-12-02,2011-12-09,"Private, ltd by shares"264,1011506,"SINO CROWN GROUP HOLDINGS LIMITED",2005-12-02,2008-05-09,"Private, ltd by shares"265,1011572,"SINO INDUSTRIAL LIMITED (d2009-07-24)
華夏實業有限公司",2005-12-02,2009-07-24,"Private, ltd by shares"266,1011407,"SINO STAR ASIA PACIFIC LIMITED (d2010-12-03)
華星亞太有限公司",2005-12-02,2010-12-03,"Private, ltd by shares"267,1011599,"SINO UNION FAR EAST LIMITED
華聯遠東有限公司",2005-12-02,2007-10-03,"Private, ltd by shares"268,1011593,"SINOTEX INVESTMENT (GROUP) LIMITED (d2008-05-30)
華富投資(集團)有限公司",2005-12-02,2008-05-30,"Private, ltd by shares"269,1011566,"SINTEX INTERNATIONAL ENTERPRISE LIMITED
先達國際企業有限公司",2005-12-02,,"Private, ltd by shares"270,1011433,"SKY CHARM CORPORATION LIMITED
天雋有限公司",2005-12-02,,"Private, ltd by shares"271,1011595,"SKY SUCCESS INVESTMENT (GROUP) LIMITED
天成投資(集團)有限公司",2005-12-02,2015-08-21,"Private, ltd by shares"272,1011630,"SMART ASIA OPTICAL LIMITED",2005-12-02,,"Private, ltd by shares"273,1011574,"SMART WEALTH DEVELOPMENT LIMITED
進富發展有限公司",2005-12-02,2015-04-10,"Private, ltd by shares"274,1011428,"SMARTLY TECHNOLOGY LIMITED
機敏科技有限公司",2005-12-02,2013-12-20,"Private, ltd by shares"275,1011586,"SMOOTH INVESTMENT (GROUP) LIMITED
順隆投資(集團)有限公司",2005-12-02,2007-05-18,"Private, ltd by shares"276,1011526,"SONHOO TECHNOLOGY HOLDINGS (INT'L) CO., LIMITED
商虎科技控股(國際)有限公司",2005-12-02,,"Private, ltd by shares"277,1011597,"SPEEDY PROFIT INTERNATIONAL CONSULTANTS LIMITED
溢康國際顧問有限公司",2005-12-02,2020-11-13,"Private, ltd by shares"278,1011434,"SPREAD TALENT LIMITED (b2005-12-02)
弘傑有限公司",2005-12-02,,"Private, ltd by shares"279,1011402,"STALLION INTERIOR DESIGN COMPANY LIMITED
駿驥室內設計有限公司",2005-12-02,2010-07-30,"Private, ltd by shares"280,1011414,"STAR PORT INTERNATIONAL LIMITED
星港國際有限公司",2005-12-02,,"Private, ltd by shares"281,1011410,"STAR RISE INTERNATIONAL LIMITED (d2011-12-09)
星晉國際有限公司",2005-12-02,2011-12-09,"Private, ltd by shares"282,1011424,"STEP MAX INDUSTRIAL LIMITED
毅豐實業有限公司",2005-12-02,2011-06-30,"Private, ltd by shares"283,1011430,"STEP UP CORPORATION LIMITED
進展有限公司",2005-12-02,,"Private, ltd by shares"284,1011449,"STRONG ARM INVESTMENTS LIMITED",2005-12-02,,"Private, ltd by shares"285,1011422,"STRONG TECHNOLOGY LIMITED (d2008-08-15)
優秀科技有限公司",2005-12-02,2008-08-15,"Private, ltd by shares"286,1011403,"SUCCESS CONCEPT INDUSTRIAL LIMITED
創成實業有限公司",2005-12-02,,"Private, ltd by shares"287,1011342,"SUN GIANT DEVELOPMENT LIMITED
泰暉發展有限公司",2005-12-02,,"Private, ltd by shares"288,1011384,"SUN KING (HONG KONG) LIMITED
帝輝(香港)有限公司",2005-12-02,,"Private, ltd by shares"289,1011333,"SUN MAX INTERNATIONAL LIMITED
佳日國際有限公司",2005-12-02,,"Private, ltd by shares"290,1011438,"SUN PRIDE LIMITED (d2011-07-08)
傲暉有限公司",2005-12-02,2011-07-08,"Private, ltd by shares"291,1011429,"SUNNY SIGHT LIMITED (d2020-04-03)
朗銘有限公司",2005-12-02,2020-04-03,"Private, ltd by shares"292,1011332,"SUNSTEP DEVELOPMENT LIMITED
旭達發展有限公司",2005-12-02,,"Private, ltd by shares"293,1011379,"SUNSTEP INTERNATIONAL LIMITED
旭達國際有限公司",2005-12-02,2010-04-23,"Private, ltd by shares"294,1011584,"SUNTEX INVESTMENT (GROUP) LIMITED
新達投資(集團)有限公司",2005-12-02,2008-05-16,"Private, ltd by shares"295,1011411,"SUPREME GARMENT MANUFACTURING LIMITED
卓達製衣有限公司",2005-12-02,2012-04-13,"Private, ltd by shares"296,1011451,"SwissTech Limited
瑞士億科有限公司",2005-12-02,,"Private, ltd by shares"297,1011538,"SWITCH FLOW (HK) LIMITED
鼎峰科技(香港)有限公司",2005-12-02,2011-12-09,"Private, ltd by shares"298,1011346,"T &amp; T NAM CHEONG COLLECTION LIMITED",2005-12-02,2007-05-11,"Private, ltd by shares"299,1011487,"TAO YUAN INTERNATIONAL (HOLDINGS) LIMITED
桃源國際(控股)有限公司",2005-12-02,2008-03-14,"Private, ltd by shares"300,1011502,"TDN INTERNATIONAL LIMITED",2005-12-02,2017-08-18,"Private, ltd by shares"301,1011504,"TECHMARK TRADE LIMITED",2005-12-02,2007-11-09,"Private, ltd by shares"302,1011621,"TECHNOLOGY CONSULTING GROUP (TCG) LIMITED
科創顧問有限公司",2005-12-02,,"Private, ltd by shares"303,1011460,"TIMES CREEK BOOKS &amp; RECORDS LIMITED
流水響圖書唱片有限公司",2005-12-02,2011-12-09,"Private, ltd by shares"304,1011400,"TOP DRAGON ASIA PACIFIC LIMITED (d2008-03-07)
天龍亞太有限公司",2005-12-02,2008-03-07,"Private, ltd by shares"305,1011396,"TOP FAITH ENGINEERING LIMITED (d2011-12-09)
信廣工程有限公司",2005-12-02,2011-12-09,"Private, ltd by shares"306,1011580,"TOP PROFIT INTERNATIONAL INDUSTRIAL LIMITED
裕利國際實業有限公司",2005-12-02,2011-12-09,"Private, ltd by shares"307,1011602,"TOPLAND FAR EAST LIMITED
泰豐遠東有限公司",2005-12-02,,"Private, ltd by shares"308,1011542,"TRADE WAY LIMITED (d2011-05-20)
丰貿有限公司",2005-12-02,2011-05-20,"Private, ltd by shares"309,1011582,"TRANS-WORLD INVESTMENT (GROUP) LIMITED
天下投資(集團)有限公司",2005-12-02,2010-04-23,"Private, ltd by shares"310,1011347,"TRI-DYNAMIC ENTERPRISE LIMITED
三義實業有限公司",2005-12-02,2016-09-23,"Private, ltd by shares"311,1011427,"TRIUMPH LUCK LIMITED
凱福有限公司",2005-12-02,2020-07-10,"Private, ltd by shares"312,1011374,"TRIUMPH MAX INTERNATIONAL LIMITED (d2011-12-09)
勝豐國際有限公司",2005-12-02,2011-12-09,"Private, ltd by shares"313,1011398,"TRIUMPH WAY INDUSTRIAL LIMITED
凱進實業有限公司",2005-12-02,2010-06-11,"Private, ltd by shares"314,1011425,"TRIUMPH WAY LIMITED
勝途有限公司",2005-12-02,,"Private, ltd by shares"315,1011452,"U.S.A PLAYBOY (H.K) INT'L CLOTHES GROUP LIMITED
美國花花公子(香港)國際服飾集團有限公司",2005-12-02,2010-04-23,"Private, ltd by shares"316,1011289,"UNI PROGRESS HOLDINGS CO., LIMITED
聯創控股有限公司",2005-12-02,,"Private, ltd by shares"317,1011588,"UNITEX INVESTMENT (GROUP) LIMITED
永聯投資(集團)有限公司",2005-12-02,2011-12-09,"Private, ltd by shares"318,1011288,"UNIVERSAL TRADING HOLDINGS LIMITED
宇宙貿易集團有限公司",2005-12-02,2015-04-02,"Private, ltd by shares"319,1011380,"UV SUPPORT ASIA LIMITED",2005-12-02,2013-01-25,"Private, ltd by shares"320,1011608,"ViTech Product &amp; Service Limited
維達產品及顧問有限公司",2005-12-02,,"Private, ltd by shares"321,1011478,"WAH FAT BLISTER INDUSTRIAL COMPANY LIMITED
華發吸塑實業有限公司",2005-12-02,2015-04-02,"Private, ltd by shares"322,1011339,"WAVE POWER DEVELOPMENT LIMITED
力濤發展有限公司",2005-12-02,,"Private, ltd by shares"323,1011397,"WAVE POWER INDUSTRIAL LIMITED
力濤實業有限公司",2005-12-02,2007-12-21,"Private, ltd by shares"324,1011338,"WAVE POWER TRADING LIMITED
力濤貿易有限公司",2005-12-02,,"Private, ltd by shares"325,1011335,"WEALTH BILLION INTERNATIONAL LIMITED (d2013-01-25)
兆溢國際有限公司",2005-12-02,2013-01-25,"Private, ltd by shares"326,1011381,"WEALTH CHAMP DEVELOPMENT LIMITED
富昌發展有限公司",2005-12-02,,"Private, ltd by shares"327,1011404,"WEALTH CONCEPT INDUSTRIAL LIMITED (d2010-02-12)
裕成實業有限公司",2005-12-02,2010-02-12,"Private, ltd by shares"328,1011377,"WEALTH FAME INTERNATIONAL LIMITED
康譽國際有限公司",2005-12-02,,"Private, ltd by shares"329,1011373,"WEALTH FIELD INTERNATIONAL LIMITED (d2007-05-04)
榮田國際有限公司",2005-12-02,2007-05-04,"Private, ltd by shares"330,1011368,"WELL PINE TRADING LIMITED
佳栢貿易有限公司",2005-12-02,2011-12-09,"Private, ltd by shares"331,1011390,"WELL SPREAD ENGINEERING LIMITED
廣益工程有限公司",2005-12-02,,"Private, ltd by shares"332,1011362,"WELL YEAR (HONG KONG) LIMITED
佳年(香港)有限公司",2005-12-02,,"Private, ltd by shares"333,1011423,"WELL YEAR TRADING LIMITED (d2006-12-29)
佳年貿易有限公司",2005-12-02,2006-12-29,"Private, ltd by shares"334,1011568,"White Magic International Limited
白潔神奇國際有限公司",2005-12-02,2012-09-28,"Private, ltd by shares"335,1011416,"WIDE SHINE LIMITED
展朗有限公司",2005-12-02,,"Private, ltd by shares"336,1011415,"WILLGAIN CORPORATION LIMITED
志得有限公司",2005-12-02,2013-12-20,"Private, ltd by shares"337,1011420,"WIN STEP TRADING LIMITED
凱進貿易有限公司",2005-12-02,2015-04-02,"Private, ltd by shares"338,1011600,"WINCOM INVESTMENT COMPANY LIMITED
雲錦投資有限公司",2005-12-02,2011-12-09,"Private, ltd by shares"339,1011463,"WISE GARMENT LIMITED
惠家製衣有限公司",2005-12-02,2008-09-05,"Private, ltd by shares"340,1011575,"WISE WIZ (H.K.) LIMITED",2005-12-02,2011-12-09,"Private, ltd by shares"341,1011496,"XIAN ZHI WEI DIGITAL TECHNOLOGY LIMITED
旋之威數碼科技有限公司",2005-12-02,2007-07-27,"Private, ltd by shares"342,1011628,"XIANGFENG ELECTRONIC LIMITED
祥鋒電子有限公司",2005-12-02,2010-04-23,"Private, ltd by shares"343,1011537,"XINLIANFA TECHNOLOGY CO., LIMITED
鑫聯發科技有限公司",2005-12-02,2010-04-23,"Private, ltd by shares"344,1011405,"XMD HONG KONG LIMITED",2005-12-02,2011-04-08,"Private, ltd by shares"345,1011553,"YANGZI TECHNOLOGY (HONG KONG) LIMITED
揚子新科技電氣有限公司",2005-12-02,2010-04-23,"Private, ltd by shares"346,1011546,"YONGHONG INTERNATIONAL INVESTMENT GROUP LIMITED
永泓國際投資集團有限公司",2005-12-02,2011-06-30,"Private, ltd by shares"347,1011316,"YUAN JUN TRADING LIMITED
元均貿易有限公司",2005-12-02,,"Private, ltd by shares"348,1011587,"YUE LONG INTERNATIONAL INDUSTRIAL LIMITED
裕朗國際實業有限公司",2005-12-02,2009-08-07,"Private, ltd by shares"349,1011505,"ZARTHA INVEST LIMITED",2005-12-02,2015-08-07,"Private, ltd by shares"350,1011563,"ZENITH ENTERPRISE LIMITED (d2011-07-29)
兆昌企業有限公司",2005-12-02,2011-07-29,"Private, ltd by shares"351,1011406,"ZILVER (FAR EAST) LIMITED
耀輝(遠東)有限公司",2005-12-02,2009-06-19,"Private, ltd by shares"