,Reg no.,Name,Incorp-orated,Dissolved,Type1,1011509,"ADVANCED MULTI-MEDIA &amp; ENTERTAINMENT CO., LIMITED
華創傳媒有限公司",2005-12-02,2007-02-09,"Private, ltd by shares"2,1011483,"ADVANTAGE EQUITIES LIMITED
優財有限公司",2005-12-02,,"Private, ltd by shares"3,1011447,"AGROMICRON LIMITED",2005-12-02,2013-01-25,"Private, ltd by shares"4,1011507,"ALBRIGHT ASIA LIMITED",2005-12-02,2011-03-11,"Private, ltd by shares"5,1011314,"ALLIED HERO INTERNATIONAL LIMITED
滙雄國際有限公司",2005-12-02,2007-03-30,"Private, ltd by shares"6,1011467,"ALLSENSE TECHNOLOGY LIMITED
傲森科技有限公司",2005-12-02,,"Private, ltd by shares"7,1011585,"ALWAYS INVESTMENT (GROUP) LIMITED
恒威投資(集團)有限公司",2005-12-02,2007-05-18,"Private, ltd by shares"8,1011343,"ARBOR TOYS COMPANY LIMITED
華軒洋行有限公司",2005-12-02,,"Private, ltd by shares"9,1011617,"ART PLAN LIMITED (d2008-04-03)",2005-12-02,2008-04-03,"Private, ltd by shares"10,1011578,"ASIA LINK GARMENT LIMITED
恒亞製衣有限公司",2005-12-02,2011-12-09,"Private, ltd by shares"11,1011418,"ASIA PACIFIC INTERNATIONAL TRADING &amp; ENGINEERING LIMITED",2005-12-02,2017-06-30,"Private, ltd by shares"12,1011315,"ASO NOOR TRADING COMPANY LIMITED
阿索隆貿易有限公司",2005-12-02,2018-02-02,"Private, ltd by shares"13,1011471,"Autek International Investment Limited",2005-12-02,2009-01-16,"Private, ltd by shares"14,1011513,"AUTHPAI (H.K.) COMPANY LIMITED
歐時派(香港)有限公司",2005-12-02,,"Private, ltd by shares"15,1011571,"BEST FAMOUS (HK) LIMITED
名威(香港)有限公司",2005-12-02,2009-01-14,"Private, ltd by shares"16,1011309,"BEST YEAR DEVELOPMENT LIMITED
佳年發展有限公司",2005-12-02,,"Private, ltd by shares"17,1011306,"BILLION BASE (HONG KONG) LIMITED
億基(香港)有限公司",2005-12-02,2010-04-30,"Private, ltd by shares"18,1011560,"BILLION SUCCESS INTERNATIONAL TRADING LIMITED
億成國際貿易有限公司",2005-12-02,,"Private, ltd by shares"19,1011476,"BLUE MOON (CHINA) FIREWORKS MFG. LIMITED (d2012-05-11)
藍月亮(中國)煙花製造有限公司",2005-12-02,2012-05-11,"Private, ltd by shares"20,1011605,"BRIGHT A LITE (HK) LIMITED
百麗(香港)有限公司",2005-12-02,2015-08-21,"Private, ltd by shares"21,1011363,"BRIGHT LOGISTICS LIMITED (HK)
輝煌物流有限公司",2005-12-02,,"Private, ltd by shares"22,1011361,"BRIGHT STAR ASIA PACIFIC LIMITED
星輝亞太有限公司",2005-12-02,,"Private, ltd by shares"23,1011536,"BUONMEZZI INTERNATIONAL BUILDING MATERIALS LIMITED
鵬明國際建材有限公司",2005-12-02,2010-06-18,"Private, ltd by shares"24,1011559,"CAREER CENTER LIMITED (THE)
職業中心有限公司",2005-12-02,,"Private, ltd by shares"25,1011601,"CASE INTERNATIONAL LIMITED (HK)",2005-12-02,,"Private, ltd by shares"26,1011603,"Cathay Sun Limited
金凱盛世有限公司",2005-12-02,,"Private, ltd by shares"27,1011499,"CENTRAL CAPITAL INVESTMENTS LIMITED (d2011-12-09)",2005-12-02,2011-12-09,"Private, ltd by shares"28,1011500,"CENTRALAND HOLDINGS LIMITED",2005-12-02,,"Private, ltd by shares"29,1011485,"CHAMAN LIMITED
上民有限公司",2005-12-02,2015-09-25,"Private, ltd by shares"30,1011543,"CHAN YING KEE TRANSPORT COMPANY LIMITED
陳英記運輸有限公司",2005-12-02,2008-03-28,"Private, ltd by shares"31,1011606,"CHANGE SIGHT DESIGN GROUP U.S.A. LIMITED
全景賽特(美國)規劃建築與景觀設計有限公司",2005-12-02,2011-12-09,"Private, ltd by shares"32,1011358,"CHANNEL LOGISTICS LIMITED (d2018-09-07)
領導物流有限公司",2005-12-02,2018-09-07,"Private, ltd by shares"33,1011468,"CHARM SPREAD LIMITED (d2019-10-11)
倡弘有限公司",2005-12-02,2019-10-11,"Private, ltd by shares"34,1011364,"CHARM TECHNOLOGY LIMITED (d2010-04-23)
魅力科技有限公司",2005-12-02,2010-04-23,"Private, ltd by shares"35,1011472,"CHERISH RAINBOW (HONG KONG) LIMITED",2005-12-02,2020-10-16,"Private, ltd by shares"36,1011531,"CHINA LUOHE PETROCHEMICAL GROUP CO., LIMITED
中國漯河石化集團有限公司",2005-12-02,,"Private, ltd by shares"37,1011303,"CHINA MAX INTERNATIONAL LIMITED
溢華國際有限公司",2005-12-02,,"Private, ltd by shares"38,1011610,"CHINA SPECIAL COMMUNICATION (GROUP) CO., LIMITED
中國特種通訊(集團)有限公司",2005-12-02,,"Private, ltd by shares"39,1011524,"CHINA ZHONGYOU ENERGY GROUP CO., LIMITED
中國中油能源集團股份有限公司",2005-12-02,,"Private, ltd by shares"40,1011519,"CHINESE XIAOYANGREN MILKY INDUSTRY LIMITED
中國小洋人乳業有限公司",2005-12-02,2010-11-26,"Private, ltd by shares"41,1011495,"CHUEN SHING INDUSTRIES (HK) CO. LIMITED
泉成實業(香港)有限公司",2005-12-02,,"Private, ltd by shares"42,1011556,"Cinema Italiano Limited
意大利電影制作有限公司",2005-12-02,2008-04-25,"Private, ltd by shares"43,1011376,"CITI-FORTUNE INDUSTRIAL LIMITED
裕城實業有限公司",2005-12-02,2012-02-10,"Private, ltd by shares"44,1011622,"CONNAISSANCE INVESTMENT HOLDING LIMITED
知源投資集團有限公司",2005-12-02,2010-04-23,"Private, ltd by shares"45,1011489,"COOG (ASIA) COMPANY LIMITED (d2014-10-03)
浩林(亞洲)有限公司",2005-12-02,2014-10-03,"Private, ltd by shares"46,1011408,"COOG ENTERPRISES LIMITED
浩林企業有限公司",2005-12-02,2020-11-13,"Private, ltd by shares"47,1011589,"COSMOS INVESTMENT (GROUP) LIMITED
宇宙投資(集團)有限公司",2005-12-02,2010-05-20,"Private, ltd by shares"48,1011401,"COUNTRY SKY ENGINEERING LIMITED
國天工程有限公司",2005-12-02,,"Private, ltd by shares"49,1011383,"COUNTRY SKY INDUSTRIAL LIMITED
國天實業有限公司",2005-12-02,2010-04-23,"Private, ltd by shares"50,1011296,"CROWN DRAGON INTERNATIONAL LIMITED
龍冠國際有限公司",2005-12-02,,"Private, ltd by shares"51,1011530,"CRYSTAL LAND LIMITED
晶廣有限公司",2005-12-02,,"Private, ltd by shares"52,1011539,"CRYSTAL RAYS LIMITED
明通興業有限公司",2005-12-02,2008-02-29,"Private, ltd by shares"53,1011352,"CYCLO-ENERGY LIMITED
二機環能有限公司",2005-12-02,2010-04-23,"Private, ltd by shares"54,1011350,"DAXIAN TECHNOLOGY LIMITED
大顯科技有限公司",2005-12-02,2009-09-04,"Private, ltd by shares"55,1011286,"DELPHIN PROAIR INTERNATIONAL LIMITED
德運環保國際有限公司",2005-12-02,,"Private, ltd by shares"56,1011317,"DESIGN EDGE EAST COMPANY LIMITED",2005-12-02,2013-06-28,"Private, ltd by shares"57,1011465,"DRAGON MORE LIMITED
龍茂有限公司",2005-12-02,2012-08-24,"Private, ltd by shares"58,1011366,"DYNAMIC TECH LIMITED (d2009-06-26)
動力技術有限公司",2005-12-02,2009-06-26,"Private, ltd by shares"59,1011501,"EAST CENTURY TRADING LIMITED",2005-12-02,2016-07-29,"Private, ltd by shares"60,1011345,"EAST GIANT TRADING LIMITED
鉅東貿易有限公司",2005-12-02,2014-06-20,"Private, ltd by shares"61,1011344,"EAST SMART (HONG KONG) LIMITED
東俊(香港)有限公司",2005-12-02,2010-04-23,"Private, ltd by shares"62,1011633,"EAST UNION TRADING LIMITED (d2011-05-20)
東薈貿易有限公司",2005-12-02,2011-05-20,"Private, ltd by shares"63,1011461,"EAST WAYFONG TRADING (HK) LIMITED
東滙豐貿易(香港)有限公司",2005-12-02,2014-03-14,"Private, ltd by shares"64,1011561,"EASTERN INTERNATIONAL TRADING LIMITED (d2010-04-23)
大東國際貿易有限公司",2005-12-02,2010-04-23,"Private, ltd by shares"65,1011382,"EASTLINK INDUSTRIAL LIMITED (d2011-04-01)
東順實業有限公司",2005-12-02,2011-04-01,"Private, ltd by shares"66,1011629,"EASTMAN ENGRG (HK) CO. LIMITED
東名工程(香港)有限公司",2005-12-02,,"Private, ltd by shares"67,1011439,"ELITE CHARM LIMITED (d2012-12-21)
錦昌有限公司",2005-12-02,2012-12-21,"Private, ltd by shares"68,1011340,"ELITE GRAIN INTERNATIONAL LIMITED
麗禾國際有限公司",2005-12-02,2015-04-02,"Private, ltd by shares"69,1011412,"ENCORE EVENT TECHNOLOGIES (HK) HOLDING LIMITED
項目制作(香港)有限公司",2005-12-02,,"Private, ltd by shares"70,1011511,"ENSURE MEDICAL (HONG KONG) LIMITED
怡新醫療(香港)有限公司",2005-12-02,2010-04-23,"Private, ltd by shares"71,1011525,"ERA ASIA LIMITED
意邦企業有限公司",2005-12-02,2018-05-11,"Private, ltd by shares"72,1011337,"EVER CROWN TRADING LIMITED (d2009-10-02)
恒冠貿易有限公司",2005-12-02,2009-10-02,"Private, ltd by shares"73,1011573,"EVER POINT INTERNATIONAL ENTERPRISE LIMITED
恒邦國際企業有限公司",2005-12-02,2020-09-04,"Private, ltd by shares"74,1011523,"EVER PROSPERITY CO., LIMITED",2005-12-02,2013-10-25,"Private, ltd by shares"75,1011349,"EVERNEW GLOBAL LIMITED
恒新環宇有限公司",2005-12-02,2011-12-09,"Private, ltd by shares"76,1011375,"EVERON ASIA PACIFIC LIMITED
安永亞太有限公司",2005-12-02,2008-03-20,"Private, ltd by shares"77,1011598,"EZU AUCTION LIMITED
儀租拍賣有限公司",2005-12-02,,"Private, ltd by shares"78,1011475,"FABULOUS MOTORS LIMITED
駿滙汽車貿易有限公司",2005-12-02,2009-11-20,"Private, ltd by shares"79,1011372,"FAITH SPREAD INDUSTRIAL LIMITED
信廣實業有限公司",2005-12-02,2010-05-20,"Private, ltd by shares"80,1011331,"FAME CITY DEVELOPMENT LIMITED
譽城發展有限公司",2005-12-02,,"Private, ltd by shares"81,1011328,"FAME FIELD DEVELOPMENT LIMITED
榮田發展有限公司",2005-12-02,2010-12-24,"Private, ltd by shares"82,1011323,"FAME WELL TRADING LIMITED
康譽貿易有限公司",2005-12-02,,"Private, ltd by shares"83,1011291,"FANCY FAME INTERNATIONAL LIMITED
嘉譽國際有限公司",2005-12-02,2020-11-13,"Private, ltd by shares"84,1011604,"Far Eastern Industries (Holdings) Limited
華成興實業控股有限公司",2005-12-02,2019-02-22,"Private, ltd by shares"85,1011355,"FIACO ELECTRONICS LIMITED
富雅高電子有限公司",2005-12-02,2010-05-28,"Private, ltd by shares"86,1011386,"FINBASE INTERNATIONAL LIMITED",2005-12-02,2011-10-14,"Private, ltd by shares"87,1011318,"FINE FAITH INTERNATIONAL LIMITED
信明國際有限公司",2005-12-02,2017-08-18,"Private, ltd by shares"88,1011305,"FINE KING INTERNATIONAL LIMITED (d2010-07-02)
帝輝國際有限公司",2005-12-02,2010-07-02,"Private, ltd by shares"89,1011301,"FOREVER CROWN INTERNATIONAL LIMITED
恒冠國際有限公司",2005-12-02,2013-01-25,"Private, ltd by shares"90,1011299,"FOREVER HAPPY INTERNATIONAL LIMITED
永悅國際有限公司",2005-12-02,,"Private, ltd by shares"91,1011297,"FORTUNE CITY TRADING LIMITED (d2007-06-01)
裕城貿易有限公司",2005-12-02,2007-06-01,"Private, ltd by shares"92,1011636,"FOUNDING FAITH (INTERNATIONAL) CO., LIMITED
鑄信 (國際) 有限公司",2005-12-02,2010-10-22,"Private, ltd by shares"93,1011458,"FUDA SHARES GROUPS LIMITED
富達股份集團有限公司",2005-12-02,2010-04-23,"Private, ltd by shares"94,1011533,"FULL COIN LIMITED
滿至有限公司",2005-12-02,2011-09-30,"Private, ltd by shares"95,1011481,"FULL KEUNG FORMWORK ENGINEERING COMPANY LIMITED
富強板模工程有限公司",2005-12-02,2011-12-09,"Private, ltd by shares"96,1011464,"FUND PORT LIMITED (d2011-09-30)
銀港有限公司",2005-12-02,2011-09-30,"Private, ltd by shares"97,1011378,"FUTURE LOGISTICS LIMITED (HK)
明日物流有限公司",2005-12-02,,"Private, ltd by shares"98,1011462,"FUTURE TALENT LIMITED (HK)
雅廸有限公司",2005-12-02,,"Private, ltd by shares"99,1011446,"GAIN BENEFIT LIMITED
潤益有限公司",2005-12-02,,"Private, ltd by shares"100,1011293,"GAIN FAITH (HONG KONG) LIMITED
信得(香港)有限公司",2005-12-02,2014-12-12,"Private, ltd by shares"101,1011294,"GAIN FAITH TRADING LIMITED
信得貿易有限公司",2005-12-02,,"Private, ltd by shares"102,1011298,"GIANT HILL INTERNATIONAL LIMITED
鉅峰國際有限公司",2005-12-02,2011-05-27,"Private, ltd by shares"103,1011623,"GILLESPIE ARCHITECTURAL PRODUCTS (CHINA) COMPANY LIMITED",2005-12-02,,"Private, ltd by shares"104,1011592,"GLOBALINK INVESTMENT (GROUP) LIMITED
高昇投資(集團)有限公司",2005-12-02,,"Private, ltd by shares"105,1011594,"GLORY INVESTMENT (GROUP) LIMITED
榮興投資(集團)有限公司",2005-12-02,2019-08-02,"Private, ltd by shares"106,1011583,"GLORY LINK FAR EAST LIMITED
創榮遠東有限公司",2005-12-02,,"Private, ltd by shares"107,1011569,"GLORY SUCCESS INVESTMENT DEVELOPMENT LIMITED
香港和盛發展有限公司",2005-12-02,2014-03-14,"Private, ltd by shares"108,1011607,"GNP Aviation Limited",2005-12-02,2008-12-12,"Private, ltd by shares"109,1011292,"GOLD EXCEL (HONG KONG) LIMITED
金卓(香港)有限公司",2005-12-02,,"Private, ltd by shares"110,1011579,"GOLDEN TIME INVESTMENT (GROUP) LIMITED
金泰投資(集團)有限公司",2005-12-02,2011-12-09,"Private, ltd by shares"111,1011290,"GOOD PALACE DEVELOPMENT LIMITED
浩庭發展有限公司",2005-12-02,2017-05-19,"Private, ltd by shares"112,1011295,"GOOD WAVE TRADING LIMITED
海濤貿易有限公司",2005-12-02,2015-04-02,"Private, ltd by shares"113,1011357,"GOOGOOPLEX AND BEYOND LIMITED",2005-12-02,2011-12-09,"Private, ltd by shares"114,1011528,"GRAND ENTERPRISES (ZHEN KONG) ENGINEERING COMPANY LIMITED
偉業(深港)鐵板模有限公司",2005-12-02,2013-04-19,"Private, ltd by shares"115,1011457,"GROUP ALLIANCE LIMITED (d2008-06-20)
合滙有限公司",2005-12-02,2008-06-20,"Private, ltd by shares"116,1011360,"H &amp; K TECHNOLOGY LIMITED (d2013-01-25)
合鍵科技有限公司",2005-12-02,2013-01-25,"Private, ltd by shares"117,1011392,"H &amp; P GENERAL AVIATION SERVICE CO., LIMITED
宏誠通用飛機維修服務有限公司",2005-12-02,2019-01-11,"Private, ltd by shares"118,1011552,"H.K GOLDION CORPORATION GROUP HOUSEHOLD TEXTILES LIMITED
香港金利來企業集團家用紡織品有限公司",2005-12-02,2011-09-23,"Private, ltd by shares"119,1011555,"H.K HUATONG INT'L INDUSTRY LIMITED
香港華通國際實業有限公司",2005-12-02,2010-04-23,"Private, ltd by shares"120,1011551,"H.K MEIBANG INT'L IMMOVABLE PROPERTY OPERATION ORGANIZATION LIMITED
香港美邦國際不動產運營機構有限公司",2005-12-02,2010-04-23,"Private, ltd by shares"121,1011492,"H.K. INT'L WAYUET FOODSTUFF GROUP LIMITED
香港國際華粵食品集團有限公司",2005-12-02,2013-01-25,"Private, ltd by shares"122,1011498,"HABITAT PROPERTY LIMITED (HK)",2005-12-02,,"Private, ltd by shares"123,1011491,"HABITAT PROPERTY MANAGEMENT LIMITED (HK)",2005-12-02,,"Private, ltd by shares"124,1011527,"HANG JU MEAT COMPANY LIMITED
恒宇肉類有限公司",2005-12-02,,"Private, ltd by shares"125,1011394,"HAPPY TECHNOLOGY LIMITED (d2010-04-23)
樂意科技有限公司",2005-12-02,2010-04-23,"Private, ltd by shares"126,1011443,"HEAD SKY LIMITED
天一有限公司",2005-12-02,,"Private, ltd by shares"127,1011454,"HEALTH ASCENT LIMITED (d2018-05-25)
昇康有限公司",2005-12-02,2018-05-25,"Private, ltd by shares"128,1011558,"HEALTHY BRIGHT INTERNATIONAL TRADING LIMITED
康輝國際貿易有限公司",2005-12-02,2008-08-29,"Private, ltd by shares"129,1011521,"HEXAGONAL INTERNATIONAL LIMITED
恒信國際實業有限公司",2005-12-02,2010-07-09,"Private, ltd by shares"130,1011354,"HI-MEDIA CHINA LIMITED",2005-12-02,2014-07-18,"Private, ltd by shares"131,1011512,"HK HONG DING SHI ER DA (INT'L) GARMENT LIMITED
香港鴻頂詩爾達(國際)制衣有限公司",2005-12-02,2010-04-23,"Private, ltd by shares"132,1011520,"HK SAR NEWSPAPER GROUP LIMITED
香港特區報業集團有限公司",2005-12-02,,"Private, ltd by shares"133,1011624,"HK SONGXIA INT'L LIGHTING ELECTRICAL APPLIANCE CO., LIMITED
1011624香港國際照明電器有限公司",2005-12-02,,"Private, ltd by shares"134,1011459,"HK ZHOU SIU SENG JEWELLERY INT'L GROUP LIMITED
香港周先生珠寶金行國際集團有限公司",2005-12-02,,"Private, ltd by shares"135,1011391,"HMI Industrial Limited
香港巨豐實業有限公司",2005-12-02,,"Private, ltd by shares"136,1011535,"Hong Kong International Credit Limited",2005-12-02,,"Private, ltd by shares"137,1011474,"HONG KONG PAINT PRODUCTS GROUP OF CHINA LIMITED
香港中華制漆集團有限公司",2005-12-02,2010-10-22,"Private, ltd by shares"138,1011529,"HONG KONG PANG SUM INDUSTRIAL (GROUP) LIMITED
香港鵬森實業(集團)有限公司",2005-12-02,2010-06-18,"Private, ltd by shares"139,1011627,"HONG KONG VISSAM GROUP LIMITED
香港偉森集團有限公司",2005-12-02,,"Private, ltd by shares"140,1011484,"HONGKONG BLISS FIBERBOARD GROUP LIMITED
香港福人中纖板集團有限公司",2005-12-02,2011-12-09,"Private, ltd by shares"141,1011445,"HONGKONG GOLD PAKLEE JEWELLERY INT'L GROUP LIMITED
香港金鉑麗珠寶國際集團有限公司",2005-12-02,2010-04-23,"Private, ltd by shares"142,1011442,"HONGKONG GRAND ELECTRICAL LIMITED
香港格蘭特電氣有限公司",2005-12-02,2013-12-06,"Private, ltd by shares"143,1011567,"HONOUR DRAGON ENTERPRISE LIMITED
信龍企業有限公司",2005-12-02,2012-01-13,"Private, ltd by shares"144,1011497,"HTOPLIA (CHINA) CO., LIMITED
特普朗(中國)有限公司",2005-12-02,,"Private, ltd by shares"145,1011370,"HUGE BRIGHT INDUSTRIAL LIMITED
泰暉實業有限公司",2005-12-02,2011-12-09,"Private, ltd by shares"146,1011517,"HUGE DIGITAL TECHNOLOGY COMPANY LIMITED
招商聚通數碼科技有限公司",2005-12-02,2013-01-25,"Private, ltd by shares"147,1011356,"HUGE FINE (HONG KONG) LIMITED
泰暉(香港)有限公司",2005-12-02,,"Private, ltd by shares"148,1011562,"HUGO STAR INTERNATIONAL TRADING LIMITED
鴻星國際貿易有限公司",2005-12-02,,"Private, ltd by shares"149,1011635,"ICRIS:1011635 (no English name)
金莎投資有限公司",2005-12-02,2008-11-21,"Private, ltd by shares"150,1011482,"IMAGINE CLOCK WATCH CO., LIMITED
幻象鐘錶有限公司",2005-12-02,,"Private, ltd by shares"151,1011612,"IMOM COMPANY LIMITED
愛母親有限公司",2005-12-02,,"Private, ltd by shares"152,1011616,"INFUSION MEDIA LIMITED (d2010-04-23)",2005-12-02,2010-04-23,"Private, ltd by shares"153,1011479,"INNOK LEATHER LIMITED
譽力皮革有限公司",2005-12-02,2015-10-30,"Private, ltd by shares"154,1011565,"INNOVATE (HK) LIMITED
創新(香港)有限公司",2005-12-02,2010-04-23,"Private, ltd by shares"155,1011625,"INTERNATIONAL BUSINESS ASSOCIATION LIMITED
國際商貿協會有限公司",2005-12-02,2015-01-02,"Ltd by guarantee"156,1011287,"INTERNATIONAL ENTERTAINMENT MEDIA GROUP, LIMITED
國際育樂傳播集團有限公司",2005-12-02,2010-04-30,"Private, ltd by shares"157,1011541,"JAPAN HONDA GROUP LIMITED
日本本田集團有限公司",2005-12-02,2010-04-30,"Private, ltd by shares"158,1011470,"JAPAN OPERATOR ALLIANCE LIMITED
新豪國際旅行社有限公司",2005-12-02,,"Private, ltd by shares"159,1011532,"JATAT LIMITED
瑋立有限公司",2005-12-02,2019-06-06,"Private, ltd by shares"160,1011516,"JC INTERNATIONAL LOGISTICS HONG KONG COMPANY LIMITED
香港錦程國際物流有限公司",2005-12-02,2010-04-30,"Private, ltd by shares"161,1011547,"JET SYSTEM LIMITED
捷運興業有限公司",2005-12-02,,"Private, ltd by shares"162,1011518,"JIAWEI PV MODULE MANUFACTURING (SHENZHEN) COMPANY LIMITED
珈偉光伏組件製造(深圳)有限公司",2005-12-02,2006-11-24,"Private, ltd by shares"163,1011515,"JIAWEI RENEWABLE ENERGY DEVELOPMENT COMPANY LIMITED
珈偉可再生能源發展有限公司",2005-12-02,2006-11-24,"Private, ltd by shares"164,1011353,"JOINART DEVELOPMENT LIMITED
聯藝發展有限公司",2005-12-02,2009-08-07,"Private, ltd by shares"165,1011399,"JOINSMART ENGINEERING LIMITED
精聯工程有限公司",2005-12-02,,"Private, ltd by shares"166,1011395,"JOINT LOGISTICS LIMITED
接合物流有限公司",2005-12-02,,"Private, ltd by shares"167,1011351,"JOINT SHARP INTERNATIONAL LIMITED
精聯國際有限公司",2005-12-02,,"Private, ltd by shares"168,1011348,"JOINWAY INTERNATIONAL LIMITED
滙揚國際有限公司",2005-12-02,,"Private, ltd by shares"169,1011310,"JOINWIDE DEVELOPMENT LIMITED
廣聯發展有限公司",2005-12-02,,"Private, ltd by shares"170,1011313,"JOY BRIGHT DEVELOPMENT LIMITED
悅明發展有限公司",2005-12-02,,"Private, ltd by shares"171,1011311,"JOY CREATION INTERNATIONAL LIMITED
創欣國際有限公司",2005-12-02,,"Private, ltd by shares"172,1011393,"JOY FAME ENGINEERING LIMITED
嘉譽工程有限公司",2005-12-02,2016-07-29,"Private, ltd by shares"173,1011308,"JOY SMART INTERNATIONAL LIMITED (d2011-06-24)
俊宜國際有限公司",2005-12-02,2011-06-24,"Private, ltd by shares"174,1011304,"JOY WEALTH INTERNATIONAL LIMITED
康悅國際有限公司",2005-12-02,,"Private, ltd by shares"175,1011564,"JUMBO INVESTMENT LIMITED
榮捷投資有限公司",2005-12-02,,"Private, ltd by shares"176,1011522,"KANGLI ELECTRONICS (HONG KONG) COMPANY LIMITED
康力電子(香港)有限公司",2005-12-02,2010-04-23,"Private, ltd by shares"177,1011456,"KASRI CO., LIMITED",2005-12-02,2010-07-23,"Private, ltd by shares"178,1011302,"KEEN RISE (HONG KONG) LIMITED
建昇(香港)有限公司",2005-12-02,,"Private, ltd by shares"179,1011631,"KGE INDUSTRIAL (HK) LIMITED
耀基實業 (香港) 有限公司",2005-12-02,,"Private, ltd by shares"180,1011389,"KING FINE INDUSTRIAL LIMITED
帝輝實業有限公司",2005-12-02,,"Private, ltd by shares"181,1011341,"KINGSON ACCOUNTING &amp; SECRETARIAL SERVICES LIMITED
宏盈會計秘書服務有限公司",2005-12-02,2014-03-14,"Private, ltd by shares"182,1011576,"KOREA CARTIER COSMETIC CORPORATION LIMITED
韓國卡迪婭化妝品株式會社有限公司",2005-12-02,2015-08-21,"Private, ltd by shares"183,1011494,"KOREA RENHE TONG MEDICINE INT'L GROUP LIMITED
韓國仁和堂制藥國際集團有限公司",2005-12-02,2010-04-23,"Private, ltd by shares"184,1011421,"KRinHK LIMITED
合韓商貿策劃有限公司",2005-12-02,2013-01-25,"Private, ltd by shares"185,1011540,"LAMINTE INTERNATIONAL LIMITED
雷明登國際有限公司",2005-12-02,2010-07-30,"Private, ltd by shares"186,1011577,"LEADER CONSULTANTS LIMITED
領先顧問有限公司",2005-12-02,,"Private, ltd by shares"187,1011609,"LEGEND RICH HOLDINGS LIMITED
利駿豐集團有限公司",2005-12-02,2015-07-31,"Private, ltd by shares"188,1011490,"LIMESTONE COAST WINES LIMITED",2005-12-02,,"Private, ltd by shares"189,1011440,"LINE CREATION LIMITED (d2006-11-17)
創緯有限公司",2005-12-02,2006-11-17,"Private, ltd by shares"190,1011455,"LITONG ELECTRONICS TECHNOLOGY COMPANY LIMITED
立東電子科技有限公司",2005-12-02,2016-03-18,"Private, ltd by shares"191,1011477,"LIYOU ECOLOGY SYSTEMS (ASIA) COMPANY LIMITED
力優環境系統(亞洲)有限公司",2005-12-02,2010-07-16,"Private, ltd by shares"192,1011336,"LONG HILL DEVELOPMENT LIMITED
長峰發展有限公司",2005-12-02,2011-12-09,"Private, ltd by shares"193,1011322,"LONG MOUNT INTERNATIONAL LIMITED
長峰國際有限公司",2005-12-02,2011-07-29,"Private, ltd by shares"194,1011453,"LONSER INTERNATIONAL (H.K) CO., LIMITED
朗思國際(香港)有限公司",2005-12-02,2010-10-22,"Private, ltd by shares"195,1011388,"LUCID TECHNOLOGY LIMITED (d2011-06-30)
明亮科技有限公司",2005-12-02,2011-06-30,"Private, ltd by shares"196,1011319,"LUCK MASTER INTERNATIONAL LIMITED (d2011-05-13)
萬福國際有限公司",2005-12-02,2011-05-13,"Private, ltd by shares"197,1011359,"LUCK RISE INVESTMENT (HK) LIMITED
祥昇投資(香港)有限公司",2005-12-02,2011-12-09,"Private, ltd by shares"198,1011534,"MARKET GLOBAL LIMITED",2005-12-02,,"Private, ltd by shares"199,1011312,"MAX BASE (HONG KONG) LIMITED
沛基(香港)有限公司",2005-12-02,2012-05-11,"Private, ltd by shares"200,1011327,"MAX BASE DEVELOPMENT LIMITED
沛基發展有限公司",2005-12-02,,"Private, ltd by shares"201,1011385,"MAX BASE INDUSTRIAL LIMITED
沛基實業有限公司",2005-12-02,,"Private, ltd by shares"202,1011324,"MAX DRAGON TRADING LIMITED
佳龍貿易有限公司",2005-12-02,2016-01-29,"Private, ltd by shares"203,1011448,"MAX SHARP LIMITED
佳鋒有限公司",2005-12-02,,"Private, ltd by shares"204,1011387,"MAX STEP ENGINEERING LIMITED
毅豐工程有限公司",2005-12-02,2013-07-05,"Private, ltd by shares"205,1011307,"MAXBASE INTERNATIONAL LIMITED
沛基國際有限公司",2005-12-02,,"Private, ltd by shares"206,1011466,"MEGA INDUSTRIAL INVESTMENT (H.K.) LIMITED
美佳實業投資(香港)有限公司",2005-12-02,2020-05-29,"Private, ltd by shares"207,1011570,"MERCURY INTERNATIONAL LIMITED
馬得利國際有限公司",2005-12-02,2018-11-30,"Private, ltd by shares"208,1011632,"MF Global Foreign Exchange HK Limited
明富環球外匯香港有限公司",2005-12-02,2009-07-03,"Private, ltd by shares"209,1011620,"N G P REAL ESTATE (HK) INVESTMENT ADVISER LIMITED
農谷平地産(香港)投資顧問有限公司",2005-12-02,2010-04-23,"Private, ltd by shares"210,1011550,"NACEL ASIA LIMITED
納賽爾亞洲有限公司",2005-12-02,2013-09-19,"Private, ltd by shares"211,1011557,"NEW CONTINENTAL INTERNATIONAL LIMITED
兆興香港有限公司",2005-12-02,,"Private, ltd by shares"212,1011444,"NEW GAIN ENGINEERING LIMITED
新澤工程有限公司",2005-12-02,2013-01-18,"Private, ltd by shares"213,1011437,"NEW GAIN INDUSTRIAL LIMITED (d2009-12-24)
新澤實業有限公司",2005-12-02,2009-12-24,"Private, ltd by shares"214,1011371,"NEWILL DEVELOPMENT LIMITED
新圖發展有限公司",2005-12-02,2017-08-18,"Private, ltd by shares"215,1011510,"NINGBO CAPITAL INTERNATIONAL INVESTMENT &amp; ASSET MANAGEMENT CONSORTIUM LIMITED
寧波資本國際有限公司",2005-12-02,2017-03-31,"Private, ltd by shares"216,1011626,"NINGBO GREAT SUPERIOR HOUSEWARES COMPANY LIMITED
寧波弘上家用品有限公司",2005-12-02,2008-12-12,"Private, ltd by shares"217,1011548,"NOBLE CAPITAL GROUP HOLDING LIMITED
尚錦集團控股有限公司",2005-12-02,2011-12-16,"Private, ltd by shares"218,1011432,"NOW LOGISTICS LIMITED
現在物流有限公司",2005-12-02,2011-05-27,"Private, ltd by shares"219,1011441,"OCEAN IMPACT LIMITED
海懋有限公司",2005-12-02,,"Private, ltd by shares"220,1011369,"OCEAN WAVE DEVELOPMENT LIMITED
海濤發展有限公司",2005-12-02,,"Private, ltd by shares"221,1011488,"OpenBook Asia Limited",2005-12-02,2013-01-25,"Private, ltd by shares"