,Reg no.,Name,Incorp-orated,Dissolved,Type1,2830121,"Beach-code International Limited",2019-05-18,,"Private, ltd by shares"2,2830126,"CHINA PETROLEUM TRADE INTERNATIONAL GROUPS CO., LIMITED
中油貿易國際集團有限公司",2019-05-18,,"Private, ltd by shares"3,2830116,"HMI Group Limited (HK)
誠譽國際集團有限公司",2019-05-18,,"Private, ltd by shares"4,2830118,"HONGKONG APESTAR TECHNOLOGY LIMITED
香港猩球科技有限公司",2019-05-18,,"Private, ltd by shares"5,2830124,"K18 Limited (HK)",2019-05-18,,"Private, ltd by shares"6,2830122,"KENNYTHAI LIMITED
百花堂有限公司",2019-05-18,,"Private, ltd by shares"7,2830120,"KoinPlus Limited",2019-05-18,,"Private, ltd by shares"8,2830117,"L's Watch Group (HK) Limited
丹尼爾鐘錶集團(香港)有限公司",2019-05-18,,"Private, ltd by shares"9,2830123,"MING RUI LIMITED
銘睿有限公司",2019-05-18,,"Private, ltd by shares"10,2830119,"Sen Xia Guo Group Co., Limited
森夏果集團股份有限公司",2019-05-18,,"Private, ltd by shares"11,2830125,"Twenty and Elite Pictures Limited
決世恒信影業有限公司",2019-05-18,,"Private, ltd by shares"