,Reg no.,Name,Incorp-orated,Dissolved,Type1,1344844,"16 STEPS AHEAD LIMITED",2009-06-11,2012-02-10,"Private, ltd by shares"2,1344895,"1960s LIMITED",2009-06-11,,"Private, ltd by shares"3,1344727,"A DESIGN SOLUTION LIMITED",2009-06-11,2020-10-30,"Private, ltd by shares"4,1344661,"A1 PROPERTY MORTGAGE COMPANY LIMITED
第一地產按揭有限公司",2009-06-11,2013-08-30,"Private, ltd by shares"5,1344859,"ACTIVE VALOUR INTERNATIONAL LIMITED
環晶態國際有限公司",2009-06-11,2013-08-30,"Private, ltd by shares"6,1344899,"Addi Lee &amp; Partners Construction Limited
李鴻仁建設有限公司",2009-06-11,2020-04-29,"Private, ltd by shares"7,1344593,"ADEL GARDEN UNITED DEVELOPMENT CO., LIMITED
奧迪爾莊園聯合發展有限公司",2009-06-11,2011-12-16,"Private, ltd by shares"8,1344703,"Advanced Power Tech. Limited
艾普特高科有限公司",2009-06-11,2020-04-29,"Private, ltd by shares"9,1344605,"ALLIANCE HERO LIMITED
合豪有限公司",2009-06-11,2015-11-20,"Private, ltd by shares"10,1344606,"ALLIED EMPEROR LIMITED
聯帝有限公司",2009-06-11,,"Private, ltd by shares"11,1344589,"ALLRICH INVESTMENT LIMITED
全發投資有限公司",2009-06-11,2012-02-24,"Private, ltd by shares"12,1344821,"ALPHA JOY INTERNATIONAL LIMITED
雅悅國際有限公司",2009-06-11,2013-08-23,"Private, ltd by shares"13,1344537,"Alpha Xinshidai Concepts Limited",2009-06-11,,"Private, ltd by shares"14,1344698,"AMBIANCE LIMITED (d2015-04-30)
品峰有限公司",2009-06-11,2015-04-30,"Private, ltd by shares"15,1344892,"ANJOY LOGISTICS (HK) CO., LIMITED
安暢物流(香港)有限公司",2009-06-11,,"Private, ltd by shares"16,1344880,"ASIA BEAUTY &amp; COSMETICS GROUP LIMITED
亞洲美容化妝品集團有限公司",2009-06-11,,"Private, ltd by shares"17,1344714,"ASIA LANGRUN TELEVISION MEDIA GROUP (HK) LIMITED
亞洲朗潤影視傳媒集團(香港)有限公司",2009-06-11,2013-08-30,"Private, ltd by shares"18,1344857,"Asia Trade Partners Limited",2009-06-11,,"Private, ltd by shares"19,1344585,"AUZO TRADING CO., LIMITED",2009-06-11,2020-11-06,"Private, ltd by shares"20,1344657,"BAIZHAO INDUSTRIAL CO., LIMITED
百兆塑膠製品有限公司",2009-06-11,,"Private, ltd by shares"21,1344839,"BEST CONCORD INVESTMENTS LIMITED
佳泰投資有限公司",2009-06-11,2019-03-19,"Private, ltd by shares"22,1344883,"BESTEL CHINA LIMITED
優通科技(中國)有限公司",2009-06-11,2013-11-15,"Private, ltd by shares"23,1344822,"BILLION FULL HOLDINGS LIMITED
通億集團有限公司",2009-06-11,2015-06-26,"Private, ltd by shares"24,1344730,"BILLION TOP GROUP HOLDINGS LIMITED
兆億控股有限公司",2009-06-11,2014-10-10,"Private, ltd by shares"25,1344639,"Biocair Asia Limited
百優康亞洲有限公司",2009-06-11,,"Private, ltd by shares"26,1344539,"BMD TECHNOLOGY LIMITED
比銘迪科技有限公司",2009-06-11,2016-09-15,"Private, ltd by shares"27,1344753,"BOGATHY (HONG KONG) LIMITED",2009-06-11,2015-06-26,"Private, ltd by shares"28,1344824,"BRAND RICH INTERNATIONAL LIMITED
名豐國際有限公司",2009-06-11,2014-05-02,"Private, ltd by shares"29,1344758,"BRILLIANCE ENTERPRISE CO., LIMITED
鼎輝實業有限公司",2009-06-11,2013-08-30,"Private, ltd by shares"30,1344736,"C &amp; L DEVELOPMENT LIMITED
蔻蓮妙國際有限公司",2009-06-11,,"Private, ltd by shares"31,1344677,"CAN ACHIEVE TECHNOLOGY (HK) HOLDING LIMITED
佳成科技(香港)股份有限公司",2009-06-11,2013-08-30,"Private, ltd by shares"32,1344734,"CENTRALINK TECHNOLOGY LIMITED
正興科技有限公司",2009-06-11,,"Private, ltd by shares"33,1344563,"CHAMPION LUCK LIMITED (d2013-03-28)
卓樂有限公司",2009-06-11,2013-03-28,"Private, ltd by shares"34,1344881,"CHI SHING INTERNATIONAL INVESTMENT AND DEVELOPMENT COMPANY LIMITED
置城國際投資發展有限公司",2009-06-11,2012-11-16,"Private, ltd by shares"35,1344777,"CHINA EAST ASIA INVESTMENT LIMITED
中國東亞投資有限公司",2009-06-11,2015-06-26,"Private, ltd by shares"36,1344544,"CHINA MEIHUA GROUP LIMITED (HK)
中國美華集團有限公司",2009-06-11,2017-11-24,"Private, ltd by shares"37,1344602,"CHINA SMART (H.K.) LIMITED
華傑(香港)有限公司",2009-06-11,2017-01-13,"Private, ltd by shares"38,1344887,"CHINA TAIZILONG FASHION LIMITED
中國太子龍服飾有限公司",2009-06-11,2015-06-26,"Private, ltd by shares"39,1344902,"CHOY LIN INDUSTRIAL COMPANY LIMITED
彩林實業有限公司",2009-06-11,2015-12-31,"Private, ltd by shares"40,1344566,"CHUANGWEI ELECTRIC APPLIANCE GROUP (CHINA) LIMITED
創維電器集團(中國)有限公司",2009-06-11,2013-08-30,"Private, ltd by shares"41,1344687,"CHUNG SHUN HONG LIMITED
中信行有限公司",2009-06-11,,"Private, ltd by shares"42,1344631,"COMFORD INDUSTRIAL LIMITED
安福實業有限公司",2009-06-11,2013-08-30,"Private, ltd by shares"43,1344604,"CONEXUS HONG KONG LIMITED",2009-06-11,2015-06-26,"Private, ltd by shares"44,1344686,"CONTINENTAL ENTERPRISE LIMITED
四洲企業有限公司",2009-06-11,2020-04-03,"Private, ltd by shares"45,1344613,"COTHAI RUBBER CO., LIMITED
交泰橡膠有限公司",2009-06-11,,"Private, ltd by shares"46,1344572,"CREATE SCAFFOLDING LIMITED
創建棚業工程有限公司",2009-06-11,,"Private, ltd by shares"47,1344594,"DAC HUU INVESTMENT LIMITED",2009-06-11,2011-05-13,"Private, ltd by shares"48,1344741,"DARLENSE INTERNATIONAL (HK) CO., LIMITED
達倫仕國際(香港)有限公司",2009-06-11,2016-10-21,"Private, ltd by shares"49,1344610,"DAY GLORY LIMITED
日銀有限公司",2009-06-11,,"Private, ltd by shares"50,1344635,"DAYGAIN INDUSTRIAL LIMITED
日富實業有限公司",2009-06-11,,"Private, ltd by shares"51,1344591,"DAYGAIN INVESTMENT LIMITED
日發投資有限公司",2009-06-11,,"Private, ltd by shares"52,1344826,"DONGYU INT'L GROUP HOLDINGS INVESTMENT (CHINA) LIMITED
東宇國際集團控股投資(中國)有限公司",2009-06-11,2013-08-30,"Private, ltd by shares"53,1344647,"DR. HUI MAN CHUN DENTAL CLINIC LIMITED
許文晉牙科醫務所有限公司",2009-06-11,2015-04-17,"Private, ltd by shares"54,1344830,"DRAGON GOAL INTERNATIONAL LIMITED (d2012-09-28)
龍高國際有限公司",2009-06-11,2012-09-28,"Private, ltd by shares"55,1344636,"DRAGON MEETING (PROFESSORS) CHINESE MEDICINE COMPANY LIMITED
龍滙(教授館)中醫藥有限公司",2009-06-11,,"Private, ltd by shares"56,1344783,"Dragonlott Management (HK) Limited
龍彩管理有限公司",2009-06-11,2014-10-10,"Private, ltd by shares"57,1344542,"Dreamial Technology Limited
理想科創有限公司",2009-06-11,,"Private, ltd by shares"58,1344597,"DYNASTY KING DEVELOPMENT LIMITED (d2010-12-31)
天皇發展有限公司",2009-06-11,2010-12-31,"Private, ltd by shares"59,1344845,"EARTH BUDDY GREEN PACKAGING (EUROPE) LIMITED
球誼環保包裝(歐洲)有限公司",2009-06-11,2014-10-10,"Private, ltd by shares"60,1344849,"EARTH BUDDY GREEN PACKAGING LIMITED
球誼環保包裝有限公司",2009-06-11,2014-10-10,"Private, ltd by shares"61,1344707,"EAST INT'L INTELLIGENCE BRAND CONSULTING GROUP LIMITED
東靈通國際品牌咨詢集團有限公司",2009-06-11,,"Private, ltd by shares"62,1344884,"EAST KINGLAND HK LIMITED
誠庭香港有限公司",2009-06-11,2015-07-24,"Private, ltd by shares"63,1344762,"EASTERN HERO INVESTMENTS LIMITED
東雄投資有限公司",2009-06-11,,"Private, ltd by shares"64,1344549,"eBorders Limited",2009-06-11,2013-08-30,"Private, ltd by shares"65,1344778,"EDUCATION SOCIAL ENTERPRISE LIMITED
教育社企有限公司",2009-06-11,,"Ltd by guarantee"66,1344587,"EIH HOLDINGS LIMITED
依拉爾控股有限公司",2009-06-11,2019-02-08,"Private, ltd by shares"67,1344850,"ELADOR INDUSTRIES LIMITED",2009-06-11,2017-02-03,"Private, ltd by shares"68,1344761,"EMPECO LIMITED (d2013-06-07)",2009-06-11,2013-06-07,"Private, ltd by shares"69,1344624,"Enlighten Wisdom Education Limited
啓賢教育有限公司",2009-06-11,,"Private, ltd by shares"70,1344886,"ESCATRONIC HKG Limited",2009-06-11,2015-01-02,"Private, ltd by shares"71,1344814,"ETERNAL PROFIT LOGISTICS LIMITED
利恒物流有限公司",2009-06-11,2013-01-25,"Private, ltd by shares"72,1344568,"ETIHAD COMPANY LIMITED",2009-06-11,2013-08-30,"Private, ltd by shares"73,1344570,"FALCON LUCK LIMITED (d2017-08-05)
福鷹有限公司",2009-06-11,2017-08-05,"Private, ltd by shares"74,1344579,"FDE GLOBAL CO., LIMITED
見合國際有限公司",2009-06-11,,"Private, ltd by shares"75,1344851,"FERUM INTERNATIONAL LIMITED
福麟國際有限公司",2009-06-11,2017-09-01,"Private, ltd by shares"76,1344893,"FOK HING (HK) INVESTMENT COMPANY LIMITED
復興(香港)投資有限公司",2009-06-11,,"Private, ltd by shares"77,1344641,"FONTEC SCREWS LIMITED",2009-06-11,,"Private, ltd by shares"78,1344558,"FOOTWEAR COMPANY INTERNATIONAL LIMITED (THE)",2009-06-11,,"Private, ltd by shares"79,1344896,"Foresto Education Limited
森信教育有限公司",2009-06-11,,"Private, ltd by shares"80,1344712,"FORSTER INTERNATIONAL INDUSTRIAL LIMITED
科達國際實業有限公司",2009-06-11,2014-10-10,"Private, ltd by shares"81,1344696,"FRANCE CALUOU INT'L GROUP LIMITED
法國佧羅狐國際集團有限公司",2009-06-11,,"Private, ltd by shares"82,1344740,"FRANCE SHENSI INT'L CLOTHING LIMITED
法國紳斯國際服裝有限公司",2009-06-11,2014-10-10,"Private, ltd by shares"83,1344533,"FRANCHI TRADING (HONG KONG) LIMITED
法蘭琦貿易(香港)有限公司",2009-06-11,,"Private, ltd by shares"84,1344725,"FU WAH DECORATING &amp; AGENCY LIMITED
富華裝潢置業有限公司",2009-06-11,,"Private, ltd by shares"85,1344638,"FULL ASIA INTERNATIONAL LIMITED
富東國際有限公司",2009-06-11,,"Private, ltd by shares"86,1344595,"FULLINK INVESTMENT LIMITED
裕業投資有限公司",2009-06-11,,"Private, ltd by shares"87,1344816,"FULLWAY INDUSTRIES LIMITED (d2016-03-04)
全威實業有限公司",2009-06-11,2016-03-04,"Private, ltd by shares"88,1344682,"FULLY GROUP HOLDING LIMITED
富莉集團有限公司",2009-06-11,2013-08-30,"Private, ltd by shares"89,1344627,"GAINLAND HOLDINGS LIMITED
信利集團有限公司",2009-06-11,2015-06-26,"Private, ltd by shares"90,1344612,"GAINLINK INTERNATIONAL LIMITED (d2010-06-11)
匯業國際有限公司",2009-06-11,2010-06-11,"Private, ltd by shares"91,1344535,"GEDOS TECHNOLOGY CO., LIMITED
基多斯科技有限公司",2009-06-11,,"Private, ltd by shares"92,1344808,"GENERAL SERVICE (CHINA) LIMITED
通用服務(中國)有限公司",2009-06-11,2011-10-07,"Private, ltd by shares"93,1344769,"GERE INTERNATIONAL CO., LIMITED
格瑞國際(香港)建築裝飾工程有限公司",2009-06-11,2013-08-30,"Private, ltd by shares"94,1344546,"GERMANY YUANDONG BAOMA FASHION INT'L LIMITED
德國遠東寶馬服飾國際有限公司",2009-06-11,2013-08-30,"Private, ltd by shares"95,1344545,"Global Roaming Solutions Limited",2009-06-11,2014-10-10,"Private, ltd by shares"96,1344877,"GLORY CROSS TEXTILE SOURCING CO., LIMITED
榮基紡織有限公司",2009-06-11,,"Private, ltd by shares"97,1344780,"GOLD NOBLE DEVELOPMENT LIMITED
高寶發展有限公司",2009-06-11,2011-12-30,"Private, ltd by shares"98,1344671,"GOLDEN EASTWAY LIMITED
金東陞有限公司",2009-06-11,,"Private, ltd by shares"99,1344659,"GOLDEN ETERNAL FAME LIMITED
金恒譽有限公司",2009-06-11,,"Private, ltd by shares"100,1344716,"GOLDEN EVER RICH LIMITED
金恒福有限公司",2009-06-11,,"Private, ltd by shares"101,1344706,"GOLDEN FORTUNA LIMITED
金鴻福有限公司",2009-06-11,2018-02-23,"Private, ltd by shares"102,1344720,"GOLDEN GLORY FORD LIMITED
金耀豐有限公司",2009-06-11,,"Private, ltd by shares"103,1344745,"GOLDEN KING CAPITAL LIMITED
金建財有限公司",2009-06-11,,"Private, ltd by shares"104,1344719,"GOLDEN LEGEND FORTUNE LIMITED
金駿運有限公司",2009-06-11,,"Private, ltd by shares"105,1344744,"GOLDEN LEISURE TIME LIMITED
金盛世有限公司",2009-06-11,,"Private, ltd by shares"106,1344735,"GOLDEN LONG LAST LIMITED
金恒創有限公司",2009-06-11,,"Private, ltd by shares"107,1344678,"GOLDEN OCEAN HARBOUR LIMITED
金海港有限公司",2009-06-11,2010-12-24,"Private, ltd by shares"108,1344746,"GOLDEN PORT LIMITED
金港豐有限公司",2009-06-11,2013-05-10,"Private, ltd by shares"109,1344726,"GOLDEN PROFIT BRIGHT LIMITED
金寶輝有限公司",2009-06-11,,"Private, ltd by shares"110,1344672,"GOLDEN PROFIT LINK LIMITED (d2013-08-30)
金盈昇有限公司",2009-06-11,2013-08-30,"Private, ltd by shares"111,1344710,"GOLDEN RICH INCOME LIMITED
金晉富有限公司",2009-06-11,,"Private, ltd by shares"112,1344749,"GOLDEN VINCENT LIMITED
金永勝有限公司",2009-06-11,,"Private, ltd by shares"113,1344715,"GOLDEN WAYFORD LIMITED
金威豐有限公司",2009-06-11,,"Private, ltd by shares"114,1344729,"GOLDEN WINRICH LIMITED
金滙富有限公司",2009-06-11,,"Private, ltd by shares"115,1344688,"GOLDEN YORK RISE LIMITED
金旭昇有限公司",2009-06-11,2012-04-05,"Private, ltd by shares"116,1344806,"GOOD CHANCE INTERNATIONAL DEVELOPMENT LIMITED
卓昇國際發展有限公司",2009-06-11,,"Private, ltd by shares"117,1344713,"GOOD LABEL LIMITED
佳利保有限公司",2009-06-11,2012-11-16,"Private, ltd by shares"118,1344788,"GOOD LUCK INVESTMENT (GROUP) LIMITED
爍柏集團有限公司",2009-06-11,2016-01-15,"Private, ltd by shares"119,1344654,"GRACE FORCE HONG KONG CO., LIMITED",2009-06-11,,"Private, ltd by shares"120,1344556,"GRAND DRAGON (H.K) INTERNATIONAL TRADE CO., LIMITED
浩龍(香港)國際貿易有限公司",2009-06-11,,"Private, ltd by shares"121,1344626,"Great High Enterprise Company Limited",2009-06-11,,"Private, ltd by shares"122,1344693,"GREAT SEA GLOBAL LIMITED
富海環球有限公司",2009-06-11,2019-03-15,"Private, ltd by shares"123,1344601,"GREAT SUN DEVELOPMENT LIMITED (d2015-11-06)
大新發展有限公司",2009-06-11,2015-11-06,"Private, ltd by shares"124,1344578,"GREAT WILL LIMITED (d2017-03-24)
偉志有限公司",2009-06-11,2017-03-24,"Private, ltd by shares"125,1344770,"HARVEST PROPERTIES LIMITED (HK)
創陞置業有限公司",2009-06-11,,"Private, ltd by shares"126,1344534,"HEBEI SHENZHOU SATCOM CO., LIMITED
河北神州衛星通信設備有限公司",2009-06-11,,"Private, ltd by shares"127,1344731,"Herun (H.K.) Machinery Co., Limited
香港和潤機械有限公司",2009-06-11,2018-09-14,"Private, ltd by shares"128,1344701,"HILLS CONSTRUCTION LIMITED (HK)
好時建設有限公司",2009-06-11,,"Private, ltd by shares"129,1344781,"HK CHAOWEI POWER SUPPLY INT'L GROUP LIMITED
香港超威電源國際集團有限公司",2009-06-11,2014-10-10,"Private, ltd by shares"130,1344858,"HK FUCHEN INVESTMENT INDUSTRIAL DEVELOPMENT LIMITED
香港富晨投資實業發展有限公司",2009-06-11,,"Private, ltd by shares"131,1344702,"HK LUCKY STAR (INT'L) ELECTRON LIMITED
香港好運星(國際)電子有限公司",2009-06-11,2013-08-30,"Private, ltd by shares"132,1344792,"HK NEW JIN JIANG FOOD (GROUP) LIMITED
香港新錦江食品(集團)有限公司",2009-06-11,2013-08-30,"Private, ltd by shares"133,1344784,"HK RITONGSONGXIA INT'L ELECTRICAL LIMITED
香港日通1344784國際電氣有限公司",2009-06-11,,"Private, ltd by shares"134,1344669,"HK SCARECROW FASHION SHARES LIMITED
香港稻草人服飾控股有限公司",2009-06-11,2013-08-30,"Private, ltd by shares"135,1344676,"HK SHIPKING FASHION INT'L LIMITED
香港船王服飾國際有限公司",2009-06-11,2013-08-30,"Private, ltd by shares"136,1344785,"HK TIANNENG POWER SUPPLY INT'L GROUP LIMITED
香港天能電源國際集團有限公司",2009-06-11,2017-02-03,"Private, ltd by shares"137,1344634,"HK XIYATU STATIONERY DEVELOPMENT LIMITED
香港西亞圖文具發展有限公司",2009-06-11,2013-08-30,"Private, ltd by shares"138,1344786,"HK YINGSHI HARDWARE (INT'L) GROUP LIMITED
香港應氏五金(國際)集團有限公司",2009-06-11,,"Private, ltd by shares"139,1344739,"HO HO GEROCOMY CENTRE LIMITED
好好護老中心有限公司",2009-06-11,2012-01-06,"Private, ltd by shares"140,1344796,"Holland Potato Limited
荷蘭薯條有限公司",2009-06-11,2012-03-23,"Private, ltd by shares"141,1344574,"HON KEE ENGINEERING LIMITED
漢記工程有限公司",2009-06-11,2014-11-21,"Private, ltd by shares"142,1344809,"HONG KONG FU RUI DA PAINT LIMITED
香港福瑞達塗料有限公司",2009-06-11,2013-08-30,"Private, ltd by shares"143,1344645,"HONG KONG HJS LIMITED
香港華捷盛有限公司",2009-06-11,,"Private, ltd by shares"144,1344581,"HONG KONG HUA FU COMPANY LIMITED
香港華福有限公司",2009-06-11,,"Private, ltd by shares"145,1344768,"HONG KONG MACAU YUNFU YOUTH EXCHANGE PROMOTION ASSOCIATION LIMITED
雲浮港澳青年交流促進會有限公司",2009-06-11,,"Ltd by guarantee"146,1344869,"HONG KONG NAM CHEONG SHAM YIP TRANSPORT COMPANY LIMITED
香港南昌深業運輸有限公司",2009-06-11,2012-06-22,"Private, ltd by shares"147,1344577,"Hong Kong OTB Intellectual Resources Limited
香港橙色網球智力資源有限公司",2009-06-11,2020-01-24,"Private, ltd by shares"148,1344764,"Hong Kong Paris Apple Limited
香港巴黎蘋果有限公司",2009-06-11,2013-08-30,"Private, ltd by shares"149,1344879,"Hong Kong Top Level Environment Design Company Limited
香港高藝景觀設計工程有限公司",2009-06-11,2017-02-03,"Private, ltd by shares"150,1344840,"HONG KONG XINXIN INVESTMENT GROUP LIMITED
香港鑫鑫投資集團有限公司",2009-06-11,,"Private, ltd by shares"151,1344540,"HONGFASHENG TECHNOLOGY (HONGKONG) LIMITED
宏發盛科技(香港)有限公司",2009-06-11,2018-02-23,"Private, ltd by shares"152,1344665,"HONGKONG DEIFU ELECTRONICS LIMITED
香港德福電子有限公司",2009-06-11,2015-09-11,"Private, ltd by shares"153,1344623,"HONGKONG DIHUA SHIPPING DEVELOPMENT LIMITED
香港帝華船舶發展有限公司",2009-06-11,2014-10-10,"Private, ltd by shares"154,1344856,"HONGKONG GOTEIN TECHNOLOGY CO., LIMITED
香港國騰科技有限公司",2009-06-11,,"Private, ltd by shares"155,1344846,"HONGKONG LINRUI INDUSTRIAL CO., LIMITED
香港麟瑞實業有限公司",2009-06-11,,"Private, ltd by shares"156,1344818,"HONGKONG LIVABLE HOME INTERNATIONAL ESTATE LIMITED
香港宜家國際地產有限公司",2009-06-11,,"Private, ltd by shares"157,1344552,"HONGKONG LONGNEW INTERNATIONAL CO., LIMITED
香港創超國際有限公司",2009-06-11,2012-01-13,"Private, ltd by shares"158,1344571,"HONGKONG NADE TECHNOLOGY LIMITED
香港納德科技有限公司",2009-06-11,2014-10-10,"Private, ltd by shares"159,1344640,"HONGKONG OUYA GROUP CO., LIMITED
香港歐雅集團有限公司",2009-06-11,,"Private, ltd by shares"160,1344663,"HONGKONG TELECOM CREATE-LINK INTERNATIONAL LIMITED
香港電訊創聯國際有限公司",2009-06-11,2011-08-19,"Private, ltd by shares"161,1344550,"HOWELL P C B LIMITED
豪威線路板有限公司",2009-06-11,2020-01-31,"Private, ltd by shares"162,1344779,"HUNG KONG PEARL COMPANY LIMITED
鴻江珍珠有限公司",2009-06-11,,"Private, ltd by shares"163,1344890,"HYSNTI DIAMOND COMPANY LIMITED
香港恒興泰業鑽石有限公司",2009-06-11,,"Private, ltd by shares"164,1344901,"I-STAR TECHNOLOGY COMPANY LIMITED
網星科技有限公司",2009-06-11,,"Private, ltd by shares"165,1344565,"I.L.C. SECURITY INVESTMENTS LIMITED",2009-06-11,2019-02-08,"Private, ltd by shares"166,1344878,"IAN ALEXANDER WIKINSKI LIMITED (d2014-10-10)",2009-06-11,2014-10-10,"Private, ltd by shares"167,1344633,"ICRIS:1344633 (no English name)
香港赫菲斯曼集團有限公司",2009-06-11,2013-08-30,"Private, ltd by shares"168,1344833,"INTERGEARS INTERNATIONAL LIMITED
英格國際有限公司",2009-06-11,,"Private, ltd by shares"169,1344807,"Interior Services Limited",2009-06-11,,"Private, ltd by shares"170,1344751,"INTERNATIONAL NETWORK FOR EDUCATION PROMOTION LIMITED
國際教育促進聯合會有限公司",2009-06-11,2013-08-30,"Private, ltd by shares"171,1344862,"INTERNATIONAL TRADE SOURCING CO., LIMITED",2009-06-11,2014-10-10,"Private, ltd by shares"172,1344567,"ITALY BINNU INT'L GROUP (CHINA) LIMITED
意大利賓奴國際集團(中國)有限公司",2009-06-11,2013-08-30,"Private, ltd by shares"173,1344680,"ITALY SHAYU FASHION SHARES LIMITED
意大利鯊魚服飾控股有限公司",2009-06-11,2013-08-30,"Private, ltd by shares"174,1344711,"J &amp; K Wellness Limited
星星活力有限公司",2009-06-11,,"Private, ltd by shares"175,1344666,"J&amp;E HOUSEHOLD COMPANY LIMITED
寧波晟樂國際貿易有限公司",2009-06-11,,"Private, ltd by shares"176,1344543,"J&amp;T INVESTMENTS LIMITED",2009-06-11,2014-06-27,"Private, ltd by shares"177,1344718,"JACKEN LIMITED
捷球有限公司",2009-06-11,2015-09-25,"Private, ltd by shares"178,1344894,"JAGUEY COMPANY LIMITED
尊榕股份有限公司",2009-06-11,2013-08-30,"Private, ltd by shares"179,1344754,"JAPAN ZUOTIAN SEWING MACHINE DEVICE (H.K.) LIMITED
日本佐田衣車設備(香港)有限公司",2009-06-11,2019-03-15,"Private, ltd by shares"180,1344692,"JD CORPORATE SOLUTIONS LIMITED",2009-06-11,2013-06-28,"Private, ltd by shares"181,1344797,"JET BILLION DEVELOPMENT LIMITED
億捷發展有限公司",2009-06-11,2012-01-06,"Private, ltd by shares"182,1344865,"JIE CAI TRADING (HONG KONG) LIMITED
潔采貿易(香港)有限公司",2009-06-11,,"Private, ltd by shares"183,1344874,"Jiecheng International (HK) Limited (d2018-11-09)
捷誠國際(香港)有限公司",2009-06-11,2018-11-09,"Private, ltd by shares"184,1344629,"JINHONG INDUSTRY (H.K) LIMITED
錦鴻實業(香港)有限公司",2009-06-11,2014-10-10,"Private, ltd by shares"185,1344829,"JINYUAN LEATHER GOODS LIMITED
錦源皮具有限公司",2009-06-11,2017-02-03,"Private, ltd by shares"186,1344700,"JMC TRADING CO., LIMITED",2009-06-11,2019-10-11,"Private, ltd by shares"187,1344855,"JSK TRADING CO, (HK) LIMITED",2009-06-11,2019-03-15,"Private, ltd by shares"188,1344765,"Jupiter Watch &amp; Jewelry Inc. Limited",2009-06-11,2012-06-08,"Private, ltd by shares"189,1344685,"K &amp; K DEPARTMENT STORE (GROUP) INVESTMENT LIMITED
港港百貨(集團)投資有限公司",2009-06-11,2019-03-15,"Private, ltd by shares"190,1344709,"Ka King Investments (Hong Kong) Limited
嘉勁投資(香港)有限公司",2009-06-11,,"Private, ltd by shares"191,1344697,"KAI CHUN INDUSTRIAL COMPANY LIMITED
岐浚實業有限公司",2009-06-11,2016-10-21,"Private, ltd by shares"192,1344875,"KAI SHING DEVELOPMENT ENGINEERING COMPANY LIMITED
佳盛發展工程有限公司",2009-06-11,,"Private, ltd by shares"193,1344866,"KEUNG KEE (HK) CONSTRUCTION LIMITED (d2012-07-20)
強記(香港)建築有限公司",2009-06-11,2012-07-20,"Private, ltd by shares"194,1344805,"KEY SAFE INTERNATIONAL DEVELOPMENT LIMITED
安僑國際發展有限公司",2009-06-11,,"Private, ltd by shares"195,1344752,"King's Ceramics International Limited",2009-06-11,2017-03-10,"Private, ltd by shares"196,1344616,"KINGDOM CHOICE LIMITED (d2016-11-18)
君彩有限公司",2009-06-11,2016-11-18,"Private, ltd by shares"197,1344803,"KOREA CRYSTAL INTERNATION GROUP (FASHION) LIMITED
韓國水晶閣國際集團(服飾)有限公司",2009-06-11,,"Private, ltd by shares"198,1344655,"KOREA ENC INTERNATIONAL COSMETICS LIMITED
韓國尹恩熙(國際)化裝品有限公司",2009-06-11,2013-08-30,"Private, ltd by shares"199,1344872,"KOREA FAMOUS BEAUTY EMBROIDERY CO., LIMITED
韓國名門麗繡株式會社有限公司",2009-06-11,2014-10-10,"Private, ltd by shares"200,1344747,"KOREA RUNGRADO RYONGAK TRADING CO., LIMITED",2009-06-11,2010-12-31,"Private, ltd by shares"201,1344642,"KOU DEERE COSMETICS (SHANGHAI) LIMITED
蔻迪爾化妝品(上海)有限公司",2009-06-11,2013-08-30,"Private, ltd by shares"202,1344863,"L&amp;R TECHNOLOGY INDUSTRY CO., LIMITED
習創科技(深圳)有限公司",2009-06-11,,"Private, ltd by shares"203,1344743,"LANDWELL ENGINEERING LIMITED
置和工程有限公司",2009-06-11,,"Private, ltd by shares"204,1344721,"LEAD PROFIT INTERNATIONAL HOLDINGS LIMITED
利昇國際集團有限公司",2009-06-11,2015-06-26,"Private, ltd by shares"205,1344582,"LEADING WINNER LIMITED
領勝有限公司",2009-06-11,,"Private, ltd by shares"206,1344835,"LEADTIME INTERNATIONAL LIMITED
力泰國際有限公司",2009-06-11,2016-04-22,"Private, ltd by shares"207,1344766,"LEGEND GLORY PROPERTIES LIMITED
駿榮置業有限公司",2009-06-11,,"Private, ltd by shares"208,1344670,"LENO HOLDINGS LIMITED
雷諾集團有限公司",2009-06-11,2015-06-26,"Private, ltd by shares"209,1344575,"LEO FORTUNE LIMITED (d2013-08-30)",2009-06-11,2013-08-30,"Private, ltd by shares"210,1344799,"LETEC (INTERNATIONAL) HOLDINGS GROUP LIMITED
樂技(國際)控股集團有限公司",2009-06-11,2013-08-30,"Private, ltd by shares"211,1344827,"LIMACO HK LIMITED",2009-06-11,2019-03-15,"Private, ltd by shares"212,1344763,"LONG BASE INTERNATIONAL HOLDINGS LIMITED
栢基國際集團有限公司",2009-06-11,2020-06-19,"Private, ltd by shares"213,1344699,"LONG PROFIT INTERNATIONAL ENTERPRISE LIMITED
長利國際企業有限公司",2009-06-11,2012-06-22,"Private, ltd by shares"214,1344897,"Lotus Communication Limited
蓮花通訊科技有限公司",2009-06-11,,"Private, ltd by shares"215,1344876,"LOUVER BUILDING MATERIAL (AUSTRALIA) LIMITED
路威德建材(澳洲)有限公司",2009-06-11,2020-01-10,"Private, ltd by shares"216,1344559,"M2 EXCLUSIVE DESIGN LIMITED",2009-06-11,,"Private, ltd by shares"217,1344888,"Macquarie Meters 4 Limited",2009-06-11,,"Private, ltd by shares"218,1344650,"MAGIC SOUND TECHNOLOGY (HK) CO., LIMITED
明佳科技(香港)有限公司",2009-06-11,2014-01-03,"Private, ltd by shares"219,1344737,"MAGIC WAY TECHNOLOGY LIMITED
創陞科技有限公司",2009-06-11,,"Private, ltd by shares"220,1344607,"MAIN CAPITAL DEVELOPMENT LIMITED
萬利豐發展有限公司",2009-06-11,,"Private, ltd by shares"221,1344615,"MAIN CAPITAL LIMITED (d2010-10-29)
萬富利有限公司",2009-06-11,2010-10-29,"Private, ltd by shares"222,1344800,"MAINGATE ENTERPRISES LIMITED
明基企業有限公司",2009-06-11,2013-08-30,"Private, ltd by shares"