,Reg no.,Name,Incorp-orated,Dissolved,Type223,1344555,"MANDAX INTERNATIONAL GROUP LIMITED
曼德士國際集團有限公司",2009-06-11,2013-08-30,"Private, ltd by shares"224,1344588,"MANIFEST MARINE LIMITED",2009-06-11,,"Private, ltd by shares"225,1344870,"MANTANGHONG GROUP (CHINA) CO., LIMITED
滿堂紅集團(中國)有限公司",2009-06-11,2020-04-29,"Private, ltd by shares"226,1344584,"MANTON LIMITED (d2013-03-22)
萬登有限公司",2009-06-11,2013-03-22,"Private, ltd by shares"227,1344658,"MARC GROUP PRIVATE LIMITED",2009-06-11,,"Private, ltd by shares"228,1344891,"MARUSHIN SANGYO (HK) CO., LIMITED
丸心香港有限公司",2009-06-11,2014-05-23,"Private, ltd by shares"229,1344619,"MARWICK DEVELOPMENT LIMITED (d2012-11-09)
美域發展有限公司",2009-06-11,2012-11-09,"Private, ltd by shares"230,1344596,"MARWICK INVESTMENT LIMITED
美域投資有限公司",2009-06-11,,"Private, ltd by shares"231,1344547,"MAX TECH INTELLIGENT ENGINEERING (HONG KONG) COMPANY LIMITED
美芝特智能工程香港有限公司",2009-06-11,,"Private, ltd by shares"232,1344757,"MAX WISDOM TRADING LIMITED
美智貿易有限公司",2009-06-11,2015-02-18,"Private, ltd by shares"233,1344724,"MAXVIEW LIMITED (d2015-06-26)
景廣有限公司",2009-06-11,2015-06-26,"Private, ltd by shares"234,1344819,"MAXWAY INDUSTRIES LIMITED (d2014-05-09)
萬宏實業有限公司",2009-06-11,2014-05-09,"Private, ltd by shares"235,1344628,"MAXWOOD HOLDINGS LIMITED
萬域集團有限公司",2009-06-11,2014-10-10,"Private, ltd by shares"236,1344705,"McGrace Led Lighting Solution Limited
綠度環球投資顧問有限公司",2009-06-11,2013-08-30,"Private, ltd by shares"237,1344598,"MECO INDUSTRY INTERNATIONAL CO., LIMITED
美高工業國際有限公司",2009-06-11,2013-08-30,"Private, ltd by shares"238,1344576,"MINGLAI (HK) BEDROOM DECORATION LIMITED
銘萊(香港)寢飾有限公司",2009-06-11,2015-06-26,"Private, ltd by shares"239,1344580,"MIO-FENICE INTERNATIONAL TRADING LIMITED
妙峰姿國際科貿有限公司",2009-06-11,,"Private, ltd by shares"240,1344820,"Momentum - Asia, Limited",2009-06-11,,"Private, ltd by shares"241,1344759,"MULTI CHOICE CONSTRUCTION ENGINEERING LIMITED
萬昌建築工程有限公司",2009-06-11,,"Private, ltd by shares"242,1344630,"MZ M&amp;E EQUIPMENT SALES AND SERVICE CO., LIMITED",2009-06-11,,"Private, ltd by shares"243,1344622,"NAM ON YUEN COMPANY LIMITED
南安緣有限公司",2009-06-11,,"Private, ltd by shares"244,1344583,"NEON GROUP CO., LIMITED
知恩集團有限公司",2009-06-11,,"Private, ltd by shares"245,1344841,"NEW BOUNDARY DEVELOPMENT LIMITED
境新發展有限公司",2009-06-11,,"Private, ltd by shares"246,1344838,"NEW GOAL INTERNATIONAL LIMITED (d2013-08-30)
新志國際有限公司",2009-06-11,2013-08-30,"Private, ltd by shares"247,1344668,"NEW-LAUNCH SPORTS LIMITED
新階有限公司",2009-06-11,2018-01-05,"Private, ltd by shares"248,1344793,"NEWEY TECHNOLOGY LIMITED
年華科技有限公司",2009-06-11,2015-12-11,"Private, ltd by shares"249,1344599,"NEWTON INVESTMENT LIMITED
新通投資有限公司",2009-06-11,2013-11-22,"Private, ltd by shares"250,1344854,"NOTIANEL INTERNATIONAL GROUP CO., LIMITED
諾天利國際集團有限公司",2009-06-11,2018-08-31,"Private, ltd by shares"251,1344717,"OCEAN SMART LIMITED (d2015-09-11)
雋海有限公司",2009-06-11,2015-09-11,"Private, ltd by shares"252,1344742,"OLYMPIC TECHNOLOGY DEVELOPMENT LIMITED
世運科技發展有限公司",2009-06-11,2013-08-30,"Private, ltd by shares"253,1344569,"ONLINE KINGDOM LIMITED
網上王國有限公司",2009-06-11,,"Private, ltd by shares"254,1344790,"ORCHIDEA FINDINGS LIMITED",2009-06-11,2013-03-22,"Private, ltd by shares"255,1344637,"OUPU ELECTRICAL (CHINA) SHARE LIMITED
歐普電器(中國)股份有限公司",2009-06-11,2015-06-26,"Private, ltd by shares"256,1344828,"PACIFIC ALLIANCE HOLDINGS LIMITED
聯太集團有限公司",2009-06-11,2013-08-30,"Private, ltd by shares"257,1344621,"PACIFIC COAST SHIPPING LIMITED
太平洋海岸船務有限公司",2009-06-11,2012-11-02,"Private, ltd by shares"258,1344694,"PAME OCEAN LOGISTICS LIMITED
翔海物流有限公司",2009-06-11,,"Private, ltd by shares"259,1344794,"PANAVIEW INVESTMENT (GROUP) LIMITED
佳景投資(集團)有限公司",2009-06-11,,"Private, ltd by shares"260,1344900,"PDCA GLOBAL CO., LIMITED",2009-06-11,2013-08-30,"Private, ltd by shares"261,1344832,"PERFECT WELL TOURS LIMITED
永佳旅遊有限公司",2009-06-11,,"Private, ltd by shares"262,1344681,"PERPETUAL INVESTMENT (CHINA) LIMITED
長恆投資(中國)有限公司",2009-06-11,2018-01-26,"Private, ltd by shares"263,1344560,"POSITIVE CHINESE MEDICINE CLINIC LIMITED
正方中醫診療所有限公司",2009-06-11,,"Private, ltd by shares"264,1344831,"POWER RICH HOLDINGS LIMITED (d2012-01-06)
力富集團有限公司",2009-06-11,2012-01-06,"Private, ltd by shares"265,1344649,"POWER SKY ELECTRONIC TECHNOLOGY CO., LIMITED
勁天電子科技企業有限公司",2009-06-11,,"Private, ltd by shares"266,1344674,"PROFI COLLECTION CO., LIMITED
易諾廚具有限公司",2009-06-11,2016-11-25,"Private, ltd by shares"267,1344767,"PROFIT HILL INVESTMENTS LIMITED
盈峰投資有限公司",2009-06-11,,"Private, ltd by shares"268,1344625,"QLS ELECTRONICS LIMITED
日輝企業有限公司",2009-06-11,2013-05-10,"Private, ltd by shares"269,1344646,"RED MUSIC MEDIA LIMITED
旭日創作有限公司",2009-06-11,2012-11-30,"Private, ltd by shares"270,1344795,"RICHLUCK DEVELOPMENT LIMITED
祥豐發展有限公司",2009-06-11,,"Private, ltd by shares"271,1344590,"RICHMARK PROPERTY COMPANY LIMITED
富高物業有限公司",2009-06-11,2012-01-13,"Private, ltd by shares"272,1344885,"RIO GRANDE ENTERPRISE LIMITED",2009-06-11,2016-04-22,"Private, ltd by shares"273,1344592,"RISING FALCON LIMITED
騰昇有限公司",2009-06-11,,"Private, ltd by shares"274,1344802,"RISING SUN ENTERPRISES LIMITED
昇日企業有限公司",2009-06-11,,"Private, ltd by shares"275,1344864,"RONGSONG TECHNOLOGY CO., LIMITED
榮淞科技有限公司",2009-06-11,2013-07-12,"Private, ltd by shares"276,1344614,"RQD (Hong Kong) Investment Company Limited
榮東強(香港)投資有限公司",2009-06-11,2016-03-24,"Private, ltd by shares"277,1344551,"Seaglobal Industrial Limited",2009-06-11,,"Private, ltd by shares"278,1344852,"SHANGHAI CHANGWANG CONDUIT CO., LIMITED
上海暢王管業有限公司",2009-06-11,2013-08-30,"Private, ltd by shares"279,1344664,"SHANGHAI CHUANCHENG TEXTILES LIMITED
上海傳承紡織品有限公司",2009-06-11,2020-01-10,"Private, ltd by shares"280,1344673,"SHANGHAI HONGZHENG TEXTILE (HK) LIMITED
上海宏正紡織品(香港)有限公司",2009-06-11,,"Private, ltd by shares"281,1344691,"SHANGHAI KANGCHENG TEXTILE (HK) LIMITED
上海康誠紡織品(香港)有限公司",2009-06-11,2019-03-15,"Private, ltd by shares"282,1344861,"Shanghai Lingchi Motor Co., Limited
上海凌馳車業有限公司",2009-06-11,,"Private, ltd by shares"283,1344789,"SHANGHAI OUTENG ELECTRICAL WELDING EQUIPMENT LIMITED
上海歐騰電器焊接設備有限公司",2009-06-11,,"Private, ltd by shares"284,1344704,"SHANGHAI PROPITIOUS PLANK CO., LIMITED
上海吉祥板材有限公司",2009-06-11,2015-06-26,"Private, ltd by shares"285,1344708,"SHANGHAI SANLONG PUMP INDUSTRY LIMITED
上海三龍泵業有限公司",2009-06-11,2015-06-26,"Private, ltd by shares"286,1344684,"SHANGHAI XINLAN TEXTILE (HK) LIMITED
上海鑫瀾紡織品(香港)有限公司",2009-06-11,2014-10-10,"Private, ltd by shares"287,1344825,"SHEN HUA PLASTIC MOLDS CO. LIMITED
勝華塑膠模具有限公司",2009-06-11,,"Private, ltd by shares"288,1344660,"SHENZHEN SUFF INDUSTRY CO., LIMITED
深圳雪峰實業有限公司",2009-06-11,2018-08-31,"Private, ltd by shares"289,1344532,"SHENZHEN TOP POWER CO., LIMITED
深圳市拓普電源有限公司",2009-06-11,,"Private, ltd by shares"290,1344531,"SHERMAN INT'L FASHION LIMITED
莎蔓國際時裝有限公司",2009-06-11,2017-02-03,"Private, ltd by shares"291,1344689,"SHINE STAR INVESTMENTS LIMITED
朗星投資有限公司",2009-06-11,,"Private, ltd by shares"292,1344889,"SHUI CHEUNG TECHNOLOGY LIMITED
瑞翔科技有限公司",2009-06-11,,"Private, ltd by shares"293,1344812,"SIJI HAIER WATER HEATER (DALU) LIMITED
四季海爾熱水器 (大陸) 有限公司",2009-06-11,2013-08-30,"Private, ltd by shares"294,1344656,"SIMT TECHNOLOGY (HONGKONG) LIMITED
香港思德科科技有限公司",2009-06-11,,"Private, ltd by shares"295,1344756,"SINO FIELD INTERNATIONAL INDUSTRIAL LIMITED
中怡國際實業有限公司",2009-06-11,2016-02-05,"Private, ltd by shares"296,1344600,"SKY POP LIMITED
天栢有限公司",2009-06-11,2015-04-10,"Private, ltd by shares"297,1344815,"SKY TOP LOGISTICS LIMITED
天高物流有限公司",2009-06-11,2020-01-31,"Private, ltd by shares"298,1344728,"SKYLAND GROUP HOLDINGS LIMITED
天地控股有限公司",2009-06-11,,"Private, ltd by shares"299,1344738,"SKYLAND TECHNOLOGY DEVELOPMENT LIMITED
天下科技發展有限公司",2009-06-11,2011-04-08,"Private, ltd by shares"300,1344573,"SKYWIN HONG KONG PARKING LIMITED
中港停車塲有限公司",2009-06-11,2014-10-10,"Private, ltd by shares"301,1344834,"Square Workshop Company Limited
四方工塲有限公司",2009-06-11,,"Private, ltd by shares"302,1344810,"STANDARD INTERNATIONAL DEVELOPMENT LIMITED (d2011-09-23)
標準國際發展有限公司",2009-06-11,2011-09-23,"Private, ltd by shares"303,1344775,"STAR RAINBOW INVESTMENTS LIMITED
彩星投資有限公司",2009-06-11,,"Private, ltd by shares"304,1344541,"STARLIT PROPERTIES AGENTS LIMITED
星港物業代理有限公司",2009-06-11,2015-01-02,"Private, ltd by shares"305,1344760,"Success Precision Engineering Co., Limited
銳志精密工程有限公司",2009-06-11,,"Private, ltd by shares"306,1344868,"Summit International Capital Management Limited
盛峰國際資本管理有限公司",2009-06-11,2019-01-18,"Private, ltd by shares"307,1344798,"SUN STRONG PROPERTY INTERNATIONAL LIMITED
信昌國際置業有限公司",2009-06-11,,"Private, ltd by shares"308,1344722,"SUN TARGET GROUP HOLDINGS LIMITED
泰盛控股有限公司",2009-06-11,2013-08-30,"Private, ltd by shares"309,1344811,"SUNNY BRIGHT ENTERPRISE LIMITED (HK)
新輝企業有限公司",2009-06-11,,"Private, ltd by shares"310,1344837,"SUNRISE MEDICINE LIMITED
太陽昇藥業有限公司",2009-06-11,2011-09-09,"Private, ltd by shares"311,1344755,"SUNSHINY COMMERCIAL (HONGKONG) CO., LIMITED
尚帥商貿(香港)有限公司",2009-06-11,,"Private, ltd by shares"312,1344804,"SUNTECH INVESTMENT MANAGEMENT CO., LIMITED
商泰頤投資管理有限公司",2009-06-11,2015-06-26,"Private, ltd by shares"313,1344898,"SUPER RAINBOW DISPLAY TECHNOLOGY (HONG KONG) CO., LIMITED
佳虹顯示科技(香港)有限公司",2009-06-11,2019-03-15,"Private, ltd by shares"314,1344553,"T &amp; T International Limited
富漁國際有限公司",2009-06-11,,"Private, ltd by shares"315,1344813,"TAI TUNG HOLDINGS (HK) LIMITED
香港泰桐控股有限公司",2009-06-11,,"Private, ltd by shares"316,1344620,"TAIHUA (INTERNATIONAL) GROUP LIMITED
泰華(國際)集團有限公司",2009-06-11,2013-08-30,"Private, ltd by shares"317,1344801,"TARGET SUCCESS DEVELOPMENT LIMITED
泰升發展有限公司",2009-06-11,,"Private, ltd by shares"318,1344632,"THAI LIME (HK) LIMITED",2009-06-11,,"Private, ltd by shares"319,1344648,"THREE TREE INTERNATIONAL CO., LIMITED
三棵樹國際有限公司",2009-06-11,2016-10-28,"Private, ltd by shares"320,1344787,"TIANLIDA COMPANY LIMITED
天利達國際有限公司",2009-06-11,,"Private, ltd by shares"321,1344748,"TIHOME (H.K.) INDUSTRIAL LIMITED
泰宏實業(香港)有限公司",2009-06-11,2014-08-01,"Private, ltd by shares"322,1344882,"TIME CAPSULE TECHNOLOGY LIMITED
時光科技有限公司",2009-06-11,2013-07-26,"Private, ltd by shares"323,1344853,"TIN LAP HONG TRADING LIMITED
天立行貿易有限公司",2009-06-11,,"Private, ltd by shares"324,1344538,"TLC - HEALTH &amp; COSMETICS LIMITED",2009-06-11,2017-02-03,"Private, ltd by shares"325,1344782,"TOOLS &amp; TOOLS LIMITED",2009-06-11,2018-02-02,"Private, ltd by shares"326,1344723,"TOP STEP LIMITED (HK)
頂陞有限公司",2009-06-11,2019-06-06,"Private, ltd by shares"327,1344651,"TOPO TECHNOLOGY CO., LIMITED
太普科技有限公司",2009-06-11,,"Private, ltd by shares"328,1344842,"TORPEDO LIMITED",2009-06-11,,"Private, ltd by shares"329,1344652,"TPF Food &amp; Beverage Limited",2009-06-11,,"Private, ltd by shares"330,1344562,"TRADECITY TRADING COMPANY LIMITED",2009-06-11,2011-11-04,"Private, ltd by shares"331,1344823,"Trillion Global Holdings Limited
兆業集團有限公司",2009-06-11,,"Private, ltd by shares"332,1344690,"TRIO SUCCESS DEVELOPMENT LIMITED
泓達拓展有限公司",2009-06-11,2016-02-05,"Private, ltd by shares"333,1344683,"TRIUMPHANT FLY DEVELOPMENT (INT'L) LIMITED
耀飛發展(國際)有限公司",2009-06-11,2013-08-30,"Private, ltd by shares"334,1344653,"TUNE HOTELS INDIA SERVICES LIMITED",2009-06-11,2010-11-05,"Private, ltd by shares"335,1344530,"U.S.A MASIKE GROUP (CHINA) LIMITED
美國馬斯柯集團(中國)有限公司",2009-06-11,2013-08-30,"Private, ltd by shares"336,1344773,"ULTRA ELITE LIMITED",2009-06-11,,"Private, ltd by shares"337,1344548,"UNIQUE DREAM LIMITED
無雙有限公司",2009-06-11,,"Private, ltd by shares"338,1344836,"UNIVERSE ASIA INTERNATIONAL LIMITED",2009-06-11,,"Private, ltd by shares"339,1344609,"USA PARKER BEDDING (HK) COMPANY LIMITED
美國派克床墊(香港)有限公司",2009-06-11,2017-02-03,"Private, ltd by shares"340,1344791,"V-FIT LIMITED",2009-06-11,2011-01-14,"Private, ltd by shares"341,1344608,"VANLIE INDUSTRIES CO., LIMITED
萬利首飾包裝有限公司",2009-06-11,2015-06-26,"Private, ltd by shares"342,1344564,"VOGUISH FURNITURE LIMITED",2009-06-11,2013-08-30,"Private, ltd by shares"343,1344643,"WA HOLDINGS CO., LIMITED
艾華控股有限公司",2009-06-11,2018-02-23,"Private, ltd by shares"344,1344586,"WAI MEI BEAUTY LIMITED
惟美堂有限公司",2009-06-11,2010-10-15,"Private, ltd by shares"345,1344675,"WAN CHENG FENG INVESTMENT LIMITED
萬成豐投資有限公司",2009-06-11,,"Private, ltd by shares"346,1344617,"Waterstream Capital Partners (HK) Limited",2009-06-11,,"Private, ltd by shares"347,1344847,"WEALTHY PROSPECT LIMITED
興盛發展(香港)有限公司",2009-06-11,,"Private, ltd by shares"348,1344871,"WELL WINNER INTERNATIONAL (HK) LIMITED
鼎勝國際(香港)有限公司",2009-06-11,2013-08-30,"Private, ltd by shares"349,1344603,"Wellness Development Training Centre Limited
無界全人發展培訓中心有限公司",2009-06-11,,"Private, ltd by shares"350,1344771,"Westech International (HK) Limited",2009-06-11,,"Private, ltd by shares"351,1344644,"WIHITOP TECHNOLOGY (H.K.) LIMITED
維海特科技(香港)有限公司",2009-06-11,,"Private, ltd by shares"352,1344848,"Willy Metals Trade Co., Limited",2009-06-11,,"Private, ltd by shares"353,1344774,"WIN REACH TRADING LIMITED (d2013-12-06)
凱達貿易有限公司",2009-06-11,2013-12-06,"Private, ltd by shares"354,1344776,"WING LEE TRANSPORTATION AGENT LIMITED
永利貨運代理有限公司",2009-06-11,,"Private, ltd by shares"355,1344750,"WING SHING HANDBAG LIMITED
榮盛手袋有限公司",2009-06-11,,"Private, ltd by shares"356,1344611,"WINLUCK LIMITED
勝福有限公司",2009-06-11,,"Private, ltd by shares"357,1344772,"WISE JADE LIMITED
智翠有限公司",2009-06-11,,"Private, ltd by shares"358,1344667,"WMH CORPORATION LIMITED",2009-06-11,,"Private, ltd by shares"359,1344557,"XIANG HE INTERNATIONAL (H.K.) LIMITED
翔禾國際(香港)有限公司",2009-06-11,,"Private, ltd by shares"360,1344903,"XIYUAN MARINE LIMITED
西源船舶有限公司",2009-06-11,2011-10-28,"Private, ltd by shares"361,1344733,"YICK LUNG INTERNATIONAL GROUP LIMITED
億龍香港國際有限公司",2009-06-11,2013-08-30,"Private, ltd by shares"362,1344679,"YING HAO INTERNATIONAL CO., LIMITED
鷹豪國際有限公司",2009-06-11,2020-06-12,"Private, ltd by shares"363,1344867,"YONG WANG ENGINEERING CO., LIMITED (d2012-08-17)
永旺工程有限公司",2009-06-11,2012-08-17,"Private, ltd by shares"364,1344561,"YOUHANG LOGISTICS HONG KONG LIMITED
佑航物流香港有限公司",2009-06-11,2012-09-21,"Private, ltd by shares"365,1344873,"YUANXIANG INVESTMENT DEVELOPMENT (HK) COMPANY LIMITED
遠翔投資發展(香港)有限公司",2009-06-11,,"Private, ltd by shares"366,1344904,"YUE'S KITCHEN EXPRESS COMPANY LIMITED
粵廚有限公司",2009-06-11,2013-08-30,"Private, ltd by shares"367,1344554,"YUMO (HONG KONG) TRADE LIMITED
香港宇莫貿易有限公司",2009-06-11,2010-12-03,"Private, ltd by shares"368,1344732,"YUNNAN TIN HONG KONG (HOLDING) GROUP CO., LIMITED
雲錫香港(控股)集團有限公司",2009-06-11,,"Private, ltd by shares"369,1344536,"ZAMSON LIMITED (d2013-08-23)
迅新有限公司",2009-06-11,2013-08-23,"Private, ltd by shares"370,1344817,"Zeif Enterprise Limited",2009-06-11,2019-11-22,"Private, ltd by shares"371,1344843,"ZHEJIANG GRAND COMPANY LIMITED
遠大發有限公司",2009-06-11,,"Private, ltd by shares"372,1344662,"ZHI YUAN GROUP CO., LIMITED
志遠集團有限公司",2009-06-11,2018-02-02,"Private, ltd by shares"373,1344860,"ZIMMERN (HK) TECHNOLOGY LIMITED
香港志文信息科技有限公司",2009-06-11,2017-12-15,"Private, ltd by shares"374,1344618,"ZIRKIND GROUP LIMITED",2009-06-11,,"Private, ltd by shares"375,1344695,"ZUO XIAN SUPERNATURAL COMPANY LIMITED
苮女山有限公司",2009-06-11,2013-06-07,"Private, ltd by shares"