,Reg no.,Name,Incorp-orated,Dissolved,Type1,2818494,"AMA Sourcing Group Limited
豐沛採購集團有限公司",2019-04-19,,"Private, ltd by shares"2,2818514,"BASOILL LIMITED",2019-04-19,,"Private, ltd by shares"3,2818495,"BOARDWALK CONTRACT LIGHTING LIMITED
博華工程燈飾有限公司",2019-04-19,,"Private, ltd by shares"4,2818520,"FanSHIYuAN Limited
香港梵世緣文化傳播有限公司",2019-04-19,,"Private, ltd by shares"5,2818499,"GH Intelligence Consulting Limited (HK)",2019-04-19,,"Private, ltd by shares"6,2818519,"HANGCHUNG BUSINESS SECRETARIES LIMITED
恒創商務秘書有限公司",2019-04-19,,"Private, ltd by shares"7,2818518,"Hong Kong East's Reputation Biotechnology Co., Limited
香港東方美譽生物科技有限公司",2019-04-19,,"Private, ltd by shares"8,2818521,"HONGKONG JIN (INTERNATIONAL) TRADINGS LIMITED
香港瑾(國際)貿易有限公司",2019-04-19,,"Private, ltd by shares"9,2818500,"HONGKONG PROSPEROUS WEALTH LIMITED
香港旺財實業有限公司",2019-04-19,,"Private, ltd by shares"10,2818502,"Inthebuy Limited
易樂買科技有限公司",2019-04-19,,"Private, ltd by shares"11,2818506,"Jiehaoda Trading Co., Limited
捷昊達貿易有限公司",2019-04-19,,"Private, ltd by shares"12,2818496,"JUFENG TRADE HONGKONG LIMITED
聚豐貿易香港有限公司",2019-04-19,,"Private, ltd by shares"13,2818508,"KA SING (HOLDINGS) LIMITED
富揚實業(集團)有限公司",2019-04-19,,"Private, ltd by shares"14,2818510,"Karly Win Limited
萬嘉利有限公司",2019-04-19,,"Private, ltd by shares"15,2818516,"OguRalston Limited
歐古勞斯頓香港有限公司",2019-04-19,,"Private, ltd by shares"16,2818513,"ORGANIZATION HZ LIMITED",2019-04-19,,"Private, ltd by shares"17,2818497,"PINII LIGHTING (HONG KONG) CO., LIMITED
品一燈飾(香港)有限公司",2019-04-19,,"Private, ltd by shares"18,2818515,"Polon Electronics Technology Co., Limited
波龍電子科技有限公司",2019-04-19,,"Private, ltd by shares"19,2818509,"QIPU INTERNATIONAL INVESTMENT CO., LIMITED
啓浦國際投資有限公司",2019-04-19,,"Private, ltd by shares"20,2818511,"Quanzhou Hecere Electronic Co., Limited",2019-04-19,,"Private, ltd by shares"21,2818507,"Ramona Trading Limited
雷蒙納（香港）貿易有限公司",2019-04-19,,"Private, ltd by shares"22,2818504,"Set Sail Trading Co., Limited
啟航行貿易有限公司",2019-04-19,,"Private, ltd by shares"23,2818498,"TENYIDE TECH R&amp;D LIMITED
天易德科技研發有限公司",2019-04-19,,"Private, ltd by shares"24,2818505,"VG SOLAR CAPITAL CO., LIMITED",2019-04-19,,"Private, ltd by shares"25,2818512,"XHV Co., Limited",2019-04-19,,"Private, ltd by shares"26,2818501,"XIAODAI INDUSTRIAL CO., LIMITED
蕭岱實業有限公司",2019-04-19,,"Private, ltd by shares"27,2818517,"XUN YU CLOTHING CO., LIMITED
尋譽服飾有限公司",2019-04-19,,"Private, ltd by shares"28,2818503,"ZHANJIA TECHNOLOGY LIMITED
展佳科技有限公司",2019-04-19,,"Private, ltd by shares"