,Reg no.,Name,Incorp-orated,Dissolved,Type1,3127572,"Ace Concept Limited",2022-02-13,,"Private, ltd by shares"2,3127564,"Good Holdings Limited
挺好控股有限公司",2022-02-13,,"Private, ltd by shares"3,3127560,"GP44 LIMITED",2022-02-13,,"Private, ltd by shares"4,3127569,"Kwan Hong Bakery Limited
均香餅家有限公司",2022-02-13,,"Private, ltd by shares"5,3127559,"Muzi Engineering Limited
木子工程有限公司",2022-02-13,,"Private, ltd by shares"6,3127568,"One6 Limited",2022-02-13,,"Private, ltd by shares"7,3127566,"Play My Idea Hong Kong Limited
忠於己意香港有限公司",2022-02-13,,"Private, ltd by shares"8,3127567,"Proway Speech Therapy Limited
諾道言語治療有限公司",2022-02-13,,"Private, ltd by shares"9,3127561,"Seeds Archery Services Limited
種籽射箭服務有限公司",2022-02-13,,"Private, ltd by shares"10,3127565,"Study Land International Limited",2022-02-13,,"Private, ltd by shares"11,3127570,"TL59 LIMITED",2022-02-13,,"Private, ltd by shares"12,3127563,"Unity Professional Limited
沃萊專業有限公司",2022-02-13,,"Private, ltd by shares"13,3127571,"Wing Tsuen Trading Company Limited",2022-02-13,,"Private, ltd by shares"14,3127562,"YIPPEE TUMMY CATERING LIMITED
溢雋鼎有限公司",2022-02-13,,"Private, ltd by shares"