,Reg no.,Name,Incorp-orated,Dissolved,Type1,0063549,"8888 INVESTMENT COMPANY LIMITED
八八八八投資有限公司",1978-09-12,,"Private, ltd by shares"2,0063561,"ART SEA INVESTMENTS LIMITED",1978-09-12,2018-06-01,"Private, ltd by shares"3,0063599,"BANDEL LIMITED (HK)",1978-09-12,,"Private, ltd by shares"4,0063610,"BISON ENTERPRISES LIMITED",1978-09-12,,"Private, ltd by shares"5,0063596,"CARTER FORD COMPANY LIMITED
加達福有限公司",1978-09-12,2005-08-26,"Private, ltd by shares"6,0063535,"CHA KWO LING HOP YEE TONG ASSOCIATION LIMITED
茶果嶺合義堂聯誼會有限公司",1978-09-12,,"Ltd by guarantee"7,0063536,"CHINESE CHURCH OF CHRISTIAN EVANGELISM LIMITED (THE)
中華基督徒播道會有限公司",1978-09-12,1995-02-17,"Ltd by guarantee"8,0063555,"CLEMATIS LIMITED (d1998-10-09)",1978-09-12,1998-10-09,"Private, ltd by shares"9,0063571,"COLOSSUS LIMITED (d1992-01-31)",1978-09-12,1992-01-31,"Private, ltd by shares"10,0063576,"CUPOLA LIMITED (d1986-07-25)",1978-09-12,1986-07-25,"Private, ltd by shares"11,0063570,"DIASTAR LIMITED (d1995-10-27)",1978-09-12,1995-10-27,"Private, ltd by shares"12,0063540,"DILLINGHAM CONSTRUCTION (H.K.) LIMITED
德寧恒建築(香港)有限公司",1978-09-12,2013-04-23,"Private, ltd by shares"13,0063604,"DOR MEI FACTORY LIMITED
多美製造廠有限公司",1978-09-12,1994-08-27,"Private, ltd by shares"14,0063559,"EXPORTEX LIMITED (d1994-04-29)
雅仕堡洋行有限公司",1978-09-12,1994-04-29,"Private, ltd by shares"15,0063541,"FAN FAN LIMITED (d1997-08-23)
隆發置業有限公司",1978-09-12,1997-08-23,"Private, ltd by shares"16,0063582,"FANSHAWE ESTATES LIMITED (d1985-11-29)",1978-09-12,1985-11-29,"Private, ltd by shares"17,0063583,"GELSTON ESTATES LIMITED",1978-09-12,1984-07-13,"Private, ltd by shares"18,0063584,"GLEDHILL ESTATES LIMITED",1978-09-12,1989-05-30,"Private, ltd by shares"19,0063553,"GOODENIA LIMITED",1978-09-12,2005-08-26,"Private, ltd by shares"20,0063580,"GOODSTRING INVESTMENTS LIMITED",1978-09-12,1995-10-27,"Private, ltd by shares"21,0063560,"GREEN ISLAND SHIP BROKERS LIMITED",1978-09-12,1990-06-21,"Private, ltd by shares"22,0063575,"GREEN STAR LIMITED",1978-09-12,1997-02-21,"Private, ltd by shares"23,0063585,"HALLGARTEN ESTATES LIMITED",1978-09-12,1986-04-25,"Private, ltd by shares"24,0063607,"HITACHI EAST ASIA LIMITED
日立遠東有限公司",1978-09-12,,"Private, ltd by shares"25,0063542,"HOI LUEN CHEMICAL MATERIALS COMPANY LIMITED
海聯化工原料有限公司",1978-09-12,1996-01-26,"Private, ltd by shares"26,0063538,"HOI YUET CHIU CHAU LIMITED
凱悅潮州酒樓有限公司",1978-09-12,2002-04-14,"Private, ltd by shares"27,0063601,"HONG KONG HAM MANUFACTORY LIMITED
香港火腿廠有限公司",1978-09-12,,"Private, ltd by shares"28,0063586,"HONGKONG LAND (RECREATIONS) LIMITED",1978-09-12,,"Private, ltd by shares"29,0063573,"HUD STRUCTURAL STEEL LIMITED",1978-09-12,1991-12-26,"Private, ltd by shares"30,0063593,"IOR (ASIA) LIMITED",1978-09-12,1989-12-29,"Private, ltd by shares"31,0063537,"JOKARI ASSOCIATION OF HONG KONG LIMITED (THE)",1978-09-12,1995-11-24,"Ltd by guarantee"32,0063572,"KAI CUTLERY (H.K.) LIMITED
貝印香港有限公司",1978-09-12,,"Private, ltd by shares"33,0063587,"KAMMINS ESTATES LIMITED",1978-09-12,2003-02-21,"Private, ltd by shares"34,0063548,"KENSTON LIMITED (HK)",1978-09-12,2020-11-12,"Private, ltd by shares"35,0063558,"KI MEE METAL &amp; PLASTIC FACTORY LIMITED
奇美五金塑膠廠有限公司",1978-09-12,,"Private, ltd by shares"36,0063534,"KI SO JI ASSOCIATION LIMITED
木曾路聯誼會有限公司",1978-09-12,1997-09-19,"Ltd by guarantee"37,0063612,"KIN CHING ASH LIMITED",1978-09-12,1997-09-03,"Private, ltd by shares"38,0063546,"KIN SING (EI CORE) COMPANY LIMITED
建聲(火牛鐵)有限公司",1978-09-12,1996-02-23,"Private, ltd by shares"39,0063588,"KIRKNESS ESTATES LIMITED",1978-09-12,1983-04-04,"Private, ltd by shares"40,0063589,"LADENBAUX ESTATES LIMITED
利登寶置業有限公司",1978-09-12,1996-02-23,"Private, ltd by shares"41,0063590,"LAPINET TRADING LIMITED
立便利貿易有限公司",1978-09-12,2011-08-19,"Private, ltd by shares"42,0063557,"LETSAN (INTERNATIONAL) TRADING COMPANY LIMITED",1978-09-12,1995-06-01,"Private, ltd by shares"43,0063569,"LINNET LIMITED (d1984-03-28)",1978-09-12,1984-03-28,"Private, ltd by shares"44,0063539,"LOVELAND DEVELOPMENT LIMITED
樂富年發展有限公司",1978-09-12,2000-11-14,"Private, ltd by shares"45,0063606,"MA PO COMPANY LIMITED
馬報有限公司",1978-09-12,2003-08-15,"Private, ltd by shares"46,0063591,"MABY ESTATES LIMITED",1978-09-12,1993-11-26,"Private, ltd by shares"47,0063592,"MARWITH ESTATES LIMITED
馬怡時置業有限公司",1978-09-12,2002-03-05,"Private, ltd by shares"48,0063574,"MAXIM NOVELTY COMPANY LIMITED
同寧貿易有限公司",1978-09-12,,"Private, ltd by shares"49,0063609,"MOON TUNG PROPERTY INVESTMENT COMPANY, LIMITED
滿通地產有限公司",1978-09-12,2009-07-31,"Private, ltd by shares"50,0063552,"NAM HOI METAL COMPANY LIMITED
南開五金有限公司",1978-09-12,2008-02-01,"Private, ltd by shares"51,0063563,"NEIKO LIMITED (d1991-06-12)
立工有限公司",1978-09-12,1991-06-12,"Private, ltd by shares"52,0063600,"ORNAMENTAL FISH INDUSTRIES LIMITED",1978-09-12,1993-08-27,"Private, ltd by shares"53,0063568,"PHAETON LIMITED (d1997-12-30)",1978-09-12,1997-12-30,"Private, ltd by shares"54,0063567,"PHOEBUS LIMITED (d2005-10-14)",1978-09-12,2005-10-14,"Private, ltd by shares"55,0063595,"PLOUGH COMPANY LIMITED (THE)
七星有限公司",1978-09-12,2015-08-14,"Private, ltd by shares"56,0063603,"PUI CHING (KIN YIP) COMPANY LIMITED
佩貞建業有限公司",1978-09-12,1995-11-24,"Private, ltd by shares"57,0063594,"SANG FU METAL FOUNDRY LIMITED
生富五金鑄造有限公司",1978-09-12,2002-04-12,"Private, ltd by shares"58,0063550,"SEAL SPECIALITY FIBRES LIMITED",1978-09-12,1991-09-11,"Private, ltd by shares"59,0063543,"SHING FAT GARMENT FACTORY LIMITED
誠發製衣廠有限公司",1978-09-12,1996-02-23,"Private, ltd by shares"60,0063581,"SOPHISTRONIC LIMITED
訊創有限公司",1978-09-12,2007-12-19,"Private, ltd by shares"61,0063611,"SPADE ACE AIR CARGO (HK) LIMITED",1978-09-12,1994-08-26,"Private, ltd by shares"62,0063566,"SPANNER LIMITED (d1997-02-21)",1978-09-12,1997-02-21,"Private, ltd by shares"63,0063565,"SPARROW LIMITED (d1991-09-27)",1978-09-12,1991-09-27,"Private, ltd by shares"64,0063608,"SPENCER STUART MANAGEMENT CONSULTANTS (ASIA) LIMITED",1978-09-12,1993-12-29,"Private, ltd by shares"65,0063564,"SPIRAL LIMITED (d1986-12-15)",1978-09-12,1986-12-15,"Private, ltd by shares"66,0063598,"SUNKY PRINTING EQUIPMENT LIMITED
新僑印刷器材有限公司",1978-09-12,2006-09-01,"Private, ltd by shares"67,0063605,"TASTY FOOD MANUFACTORY LIMITED
鮮美食品廠有限公司",1978-09-12,1983-12-05,"Private, ltd by shares"68,0063547,"THOMASIA LIMITED
東馬有限公司",1978-09-12,1984-06-26,"Private, ltd by shares"69,0063577,"TONIA LIMITED (d2008-07-11)",1978-09-12,2008-07-11,"Private, ltd by shares"70,0063556,"TRI-TURBO AIRCRAFT, LIMITED",1978-09-12,1996-02-23,"Private, ltd by shares"71,0063554,"TRIGGER LIMITED (d1986-05-19)",1978-09-12,1986-05-19,"Private, ltd by shares"72,0063602,"TSANG'S MANUFACTURING COMPANY LIMITED
曾氏製品有限公司",1978-09-12,2019-05-31,"Private, ltd by shares"73,0063551,"WAI LEE CANTEEN &amp; MEMBERS CLUB LIMITED
偉利食堂會員俱樂部有限公司",1978-09-12,1995-11-24,"Private, ltd by shares"74,0063562,"WANG TAT WATCH CASE AND PARTS MANUFACTORY LIMITED
宏達錶業製品廠有限公司",1978-09-12,2011-01-28,"Private, ltd by shares"75,0063578,"WESLA LIMITED",1978-09-12,1998-04-24,"Private, ltd by shares"76,0063545,"WINDOM ENTERPRISES LIMITED",1978-09-12,2019-08-16,"Private, ltd by shares"77,0063597,"YEE FAT PACKING FACTORY LIMITED
義發包裝廠有限公司",1978-09-12,1997-01-31,"Private, ltd by shares"78,0063544,"YEE PO HING INVESTMENT COMPANY LIMITED",1978-09-12,,"Private, ltd by shares"79,0063579,"ZEBRA MARINE SERVICES LIMITED (d1980-08-22)",1978-09-12,1980-08-22,"Private, ltd by shares"