,Reg no.,Name,Incorp-orated,Dissolved,Type424,0793495,"VITA HERB INTERNATIONAL LIMITED
百良堂有限公司",2002-04-17,2007-08-31,"Private, ltd by shares"425,0793786,"VMAX POWER CO., LIMITED",2002-04-17,2008-06-27,"Private, ltd by shares"426,0793487,"VPOWER HOLDINGS LIMITED
偉能集團有限公司",2002-04-17,,"Private, ltd by shares"427,0793699,"WAH NING PHARMACEUTICAL (INTERNATIONAL) LIMITED
華寧藥業(國際)有限公司",2002-04-17,,"Private, ltd by shares"428,0793342,"WAH ON SIGN BOARD COMPANY LIMITED
華安廣告製作有限公司",2002-04-17,,"Private, ltd by shares"429,0793698,"WAN SHI INDUSTRIAL INTERNATIONAL INVESTMENT (HONG KONG) LIMITED
萬氏興業國際投資(香港)有限公司",2002-04-17,2015-06-05,"Private, ltd by shares"430,0793389,"WATER INT'L DEVELOPMENT CO., LIMITED
沃頓國際發展有限公司",2002-04-17,2009-09-11,"Private, ltd by shares"431,0793756,"WATER-MARKS GROUP COMPANY LIMITED
維泰斯集團有限公司",2002-04-17,2016-02-26,"Private, ltd by shares"432,0793665,"WAYSUN HONG KONG LIMITED
永信香港有限公司",2002-04-17,2007-08-31,"Private, ltd by shares"433,0793503,"WELL ASIA (H.K.) LIMITED
恒英(香港)有限公司",2002-04-17,2019-08-23,"Private, ltd by shares"434,0793477,"WELL ASIA ENTERPRISES LIMITED (d2007-08-31)
偉中企業有限公司",2002-04-17,2007-08-31,"Private, ltd by shares"435,0793552,"WELL ASIA HOLDINGS LIMITED
恒英集團有限公司",2002-04-17,,"Private, ltd by shares"436,0793476,"WELL ASIA INDUSTRIAL LIMITED
恒英實業有限公司",2002-04-17,2007-09-14,"Private, ltd by shares"437,0793610,"WELLNESS PLACE LIMITED (THE)
樂康堂有限公司",2002-04-17,2008-04-11,"Private, ltd by shares"438,0793555,"WELLTIME LIMITED (d2007-08-31)
泰彩有限公司",2002-04-17,2007-08-31,"Private, ltd by shares"439,0793518,"WENDY LEE SCHOOL OF BALLET LIMITED
慧琦舞集有限公司",2002-04-17,,"Private, ltd by shares"440,0793632,"WIDE SPACE LIMITED (d2005-11-18)",2002-04-17,2005-11-18,"Private, ltd by shares"441,0793746,"WING CHEONG TECHNOLOGY LIMITED
永昌科技影音有限公司",2002-04-17,2012-05-25,"Private, ltd by shares"442,0793622,"WING FUNG TSAN LIMITED
永豐棧有限公司",2002-04-17,2018-07-13,"Private, ltd by shares"443,0793722,"WINGS ENGINEERING GROUP LIMITED
永利工程集團有限公司",2002-04-17,2015-06-05,"Private, ltd by shares"444,0793387,"WINKLE INTERNATIONAL HOLDINGS LIMITED
偉基國際集團有限公司",2002-04-17,2007-08-31,"Private, ltd by shares"445,0793635,"WINMARK-CHAMP WEALTH (VIETNAM) LIMITED",2002-04-17,2004-12-03,"Private, ltd by shares"446,0793673,"WINNING TEAM HOLDINGS LIMITED
合威集團有限公司",2002-04-17,2008-12-05,"Private, ltd by shares"447,0793346,"WINPLUS ENTERPRISES LIMITED
滙柏企業有限公司",2002-04-17,,"Private, ltd by shares"448,0793718,"WINPOWER INTERNATIONAL LIMITED (d2006-06-16)
偉力國際有限公司",2002-04-17,2006-06-16,"Private, ltd by shares"449,0793385,"WISELAND HOLDINGS LIMITED (d2011-07-15)
威隆集團有限公司",2002-04-17,2011-07-15,"Private, ltd by shares"450,0793347,"WO SANG HONG (HOLDINGS) LIMITED
和生行(控股)有限公司",2002-04-17,,"Private, ltd by shares"451,0793668,"WORLD CITY LIMITED (d2010-12-03)
運城有限公司",2002-04-17,2010-12-03,"Private, ltd by shares"452,0793663,"WORLD RAINBOW CORPORATION LIMITED (d2007-08-10)
偉彩有限公司",2002-04-17,2007-08-10,"Private, ltd by shares"453,0793562,"WORLDTEX DEVELOPMENT LIMITED
宇達發展有限公司",2002-04-17,,"Private, ltd by shares"454,0793710,"WTO &amp; CHINA BRAND MANAGEMENT CONSULTING LIMITED
世貿組織與中國品牌管理咨詢有限公司",2002-04-17,2007-08-31,"Private, ltd by shares"455,0793429,"XENIO (H.K.) LIMITED
迪尼奧(香港)有限公司",2002-04-17,2006-12-01,"Private, ltd by shares"456,0793409,"XIAOXINYUAN HEALTH INDUSTRY (HK) LIMITED
孝心圓健康產業(香港)有限公司",2002-04-17,,"Private, ltd by shares"457,0793660,"XROSSOVER LIMITED (d2012-06-01)",2002-04-17,2012-06-01,"Private, ltd by shares"458,0793682,"YICK TAI ENGINEERING (HK) LIMITED
益大工程(香港)有限公司",2002-04-17,2013-06-28,"Private, ltd by shares"459,0793731,"YOEMAN ENGINEERING CO. LIMITED
營運機械工程有限公司",2002-04-17,,"Private, ltd by shares"460,0793578,"YOUNG DONG (H.K.) LIMITED
永東企業(香港)有限公司",2002-04-17,,"Private, ltd by shares"