,Reg no.,Name,Incorp-orated,Dissolved,Type210,0793588,"HONG KONG MARCH SPACE ART LIMITED
香港三月空間藝術有限公司",2002-04-17,2007-08-31,"Private, ltd by shares"211,0793471,"HONG KONG MING YAN CLOTHING (GROUP) COMPANY LIMITED
香港名人服飾(集團)有限公司",2002-04-17,2007-08-31,"Private, ltd by shares"212,0793708,"HONG KONG OPTOELECTRONICS ASSOCIATION LIMITED
香港光電協會有限公司",2002-04-17,2010-02-26,"Ltd by guarantee"213,0793356,"HONG KONG SUPER VIEW METALLIC ELECTRICAL APPLIANCES AND STOVES MANUFACTURING LIMITED
香港超境金屬電器燃具制造有限公司",2002-04-17,2007-08-31,"Private, ltd by shares"214,0793760,"HONG KONG TAI TAI LE BLOC LIMITED
香港太太樂集團有限公司",2002-04-17,2007-08-31,"Private, ltd by shares"215,0793686,"HONG KONG WENTING INTERNATIONAL FASHION LIMITED
香港文婷國際服飾有限公司",2002-04-17,2007-08-31,"Private, ltd by shares"216,0793742,"HONG LUEN LIMITED
匡聯有限公司",2002-04-17,2004-12-17,"Private, ltd by shares"217,0793366,"HONG TONG HAI INVESTMENTS LIMITED
泓通海投資有限公司",2002-04-17,,"Private, ltd by shares"218,0793489,"HONGKONG CHINA SUN PHARMACEUTICAL GROUP LIMITED
香港中盛藥業集團有限公司",2002-04-17,,"Private, ltd by shares"219,0793766,"HONGKONG LINGXIAN INTERNATIONAL HOLDINGS LIMITED (d2008-10-03)
香港領先國際集團有限公司",2002-04-17,2008-10-03,"Private, ltd by shares"220,0793761,"HONGKONG PAN-PACIFIC CRUISER LIMITED
香港泛太平洋郵輪有限公司",2002-04-17,,"Private, ltd by shares"221,0793519,"HORWATH (CHINA) CONSULTANTS LIMITED
浩華(中國)諮詢顧問有限公司",2002-04-17,2014-05-30,"Private, ltd by shares"222,0793499,"HSCC LIMITED (d2010-07-23)",2002-04-17,2010-07-23,"Private, ltd by shares"223,0793336,"I-STAR ASSOCIATES LIMITED",2002-04-17,2010-12-03,"Private, ltd by shares"224,0793350,"ICRIS:0793350 (no English name)
香港名龍資產經營諮詢有限公司",2002-04-17,2003-10-03,"Private, ltd by shares"225,0793611,"ICRIS:0793611 (no English name)
香港華聯國際集團出版社有限公司",2002-04-17,2007-08-31,"Private, ltd by shares"226,0793789,"ILIVE LEARNING (HONG KONG) COMPANY LIMITED
活學網(香港)有限公司",2002-04-17,2011-02-11,"Private, ltd by shares"227,0793441,"INSTANT DATA FORMS (SICHUAN) LIMITED
現成電腦紙(四川)有限公司",2002-04-17,2019-02-01,"Private, ltd by shares"228,0793542,"INTER FRANCHINE INTERNATIONAL LIMITED
中法國際有限公司",2002-04-17,2007-05-11,"Private, ltd by shares"229,0793511,"INTERNATIONAL TRANSIT TECHNOLOGY LIMITED",2002-04-17,2004-07-02,"Private, ltd by shares"230,0793532,"IPS HOLDINGS LIMITED (d2007-05-04)
融建控股有限公司",2002-04-17,2007-05-04,"Private, ltd by shares"231,0793633,"ITALY DELICATE DRESS (HK) LIMITED
意大利迪拉卡丹服飾(香港)有限公司",2002-04-17,2017-12-01,"Private, ltd by shares"232,0793497,"ITALY DILISA INTERNATIONAL HOLDING CLOTHING COMPANY LIMITED
意大利荻里莎國際集團服飾有限公司",2002-04-17,2007-08-31,"Private, ltd by shares"233,0793697,"ITALY JIPAI INT'L GARMENT LIMITED
意大利積派國際服飾有限公司",2002-04-17,2010-09-24,"Private, ltd by shares"234,0793714,"ITALY PLAYBOY (H.K.) INT'L FINERY LIMITED
意大利花花公子(香港)國際服飾有限公司",2002-04-17,2003-04-25,"Private, ltd by shares"235,0793496,"ITALY PRINCE FLOWER (H.K.) INTERNATIONAL FASHION GROUP COMPANY LIMITED
意大利花花公子(香港)國際服飾集團有限公司",2002-04-17,2005-04-22,"Private, ltd by shares"236,0793454,"ITALY ROWLAND DENTON (HONG KONG) FASHION LIMITED
意大利羅蘭丹頓(香港)服飾有限公司",2002-04-17,2007-08-31,"Private, ltd by shares"237,0793570,"ITALY VALENTINO CLASSICAL DRESS LIMITED
意大利華倫天奴經典服飾有限公司",2002-04-17,2007-08-31,"Private, ltd by shares"238,0793509,"ITALY VALENTINO DRESS (HK) INDUSTRY LIMITED
意大利華倫天奴服飾(香港)實業有限公司",2002-04-17,2007-08-31,"Private, ltd by shares"239,0793526,"ITALY VALENTINO INTERNATIONAL GROUP (H.K.) CO. LIMITED
意大利華倫天奴國際機構(香港)有限公司",2002-04-17,2004-08-13,"Private, ltd by shares"240,0793397,"ITALY VALENTINO.LUYI INTERNATIONAL GROUP CO., LIMITED
意大利華倫天奴‧路易國際集團有限公司",2002-04-17,,"Private, ltd by shares"241,0793763,"ITALY VALONDENO TONY INT'L GROUP LIMITED
意大利華倫丹奴‧登尼國際集團有限公司",2002-04-17,2007-08-31,"Private, ltd by shares"242,0793712,"ITALY WALYEYEPAR INTERNATIONAL GROUP (HONG KONG) CLOTHING COMPANY LIMITED
意大利華爾依派國際集團(香港)服飾有限公司",2002-04-17,2007-08-31,"Private, ltd by shares"243,0793711,"ITS RICHTECH INTERNATIONAL CO., LIMITED
富裕科技國際有限公司",2002-04-17,2011-02-18,"Private, ltd by shares"244,0793754,"J&amp;S BURKRAY (HK) CO., LIMITED
佳陽寶瑞(香港)有限公司",2002-04-17,2007-08-31,"Private, ltd by shares"245,0793585,"JAPAN YUE YUAN TANG (HONGKONG) LIMITED
日本玥圓堂(香港)有限公司",2002-04-17,2007-08-31,"Private, ltd by shares"246,0793436,"JIANLONG LOGISTICS INTERNATIONAL LIMITED
建龍物流國際有限公司",2002-04-17,2012-03-23,"Private, ltd by shares"247,0793407,"JINAN LUGU (HK) TECHNOLOGY DEVELOPMENT LIMITED
暨南綠谷(香港)科技開發有限公司",2002-04-17,2014-03-14,"Private, ltd by shares"248,0793790,"JJ SAMSON &amp; ASSOCIATES LIMITED
詠東顧問有限公司",2002-04-17,,"Private, ltd by shares"249,0793757,"JOHNNY AND VIVIAN ANIMAL CLINIC LIMITED
元朗動物診所有限公司",2002-04-17,,"Private, ltd by shares"250,0793559,"JOIN BILLION TRADING LIMITED (d2016-01-15)
集億貿易有限公司",2002-04-17,2016-01-15,"Private, ltd by shares"251,0793485,"JOIN CENTURY INDUSTRIAL LIMITED
中廣實業有限公司",2002-04-17,,"Private, ltd by shares"252,0793563,"JOIN LEGEND TRADING LIMITED
恒聯貿易有限公司",2002-04-17,2005-05-20,"Private, ltd by shares"253,0793478,"JOIN LOGIC LIMITED (d2005-09-09)
仲德有限公司",2002-04-17,2005-09-09,"Private, ltd by shares"254,0793703,"JPBC (H.K.) LIMITED",2002-04-17,2007-08-31,"Private, ltd by shares"255,0793597,"JS MERCHANDISING COMPANY LIMITED",2002-04-17,,"Private, ltd by shares"256,0793765,"KAM FULLY INVESTMENT LIMITED
金富盈投資有限公司",2002-04-17,2007-09-07,"Private, ltd by shares"257,0793419,"KAM LUNG HOLDING LIMITED (d2005-06-03)
錦隆集團有限公司",2002-04-17,2005-06-03,"Private, ltd by shares"258,0793604,"KAM WING TRAVEL GROUP LIMITED
金榮旅運有限公司",2002-04-17,,"Private, ltd by shares"259,0793759,"KAMSON BUILDING MATERIAL ENG. LIMITED (d2003-09-05)
金城建築材料工程有限公司",2002-04-17,2003-09-05,"Private, ltd by shares"260,0793679,"KARRIE TECHNOLOGIES COMPANY LIMITED
嘉利環球科技有限公司",2002-04-17,,"Private, ltd by shares"261,0793501,"KAUAI (NO. 1) COMPANY LIMITED",2002-04-17,,"Private, ltd by shares"262,0793609,"KAZ BUSINESS SERVICES HONGKONG LIMITED",2002-04-17,2007-10-12,"Private, ltd by shares"263,0793667,"KEENWORLD ENTERPRISES LIMITED
景華企業有限公司",2002-04-17,2003-07-04,"Private, ltd by shares"264,0793730,"KEI YUEN DEVELOPMENT (CHINA) LIMITED
基源擴展(中國)有限公司",2002-04-17,,"Private, ltd by shares"265,0793513,"KIDS NETWORK LIMITED
傑思小天才有限公司",2002-04-17,2004-12-24,"Private, ltd by shares"266,0793666,"KING WINNER DEVELOPMENT LIMITED
佳運發展有限公司",2002-04-17,2012-05-11,"Private, ltd by shares"267,0793669,"L.K. ENGINEERING LIMITED
聯基(機電網絡)工程有限公司",2002-04-17,2016-12-09,"Private, ltd by shares"268,0793343,"Lai's International Investment Company Limited
黎氏國際投資有限公司",2002-04-17,,"Private, ltd by shares"269,0793676,"LAP SHING (ASIA) COMPANY LIMITED
立成(亞洲)有限公司",2002-04-17,2006-07-07,"Private, ltd by shares"270,0793498,"LARGESS INTERNATIONAL SHIPPING CO., LIMITED
連莊國際海運有限公司",2002-04-17,2019-07-05,"Private, ltd by shares"271,0793694,"LOGISTICS PERFECT LIMITED",2002-04-17,2002-12-27,"Private, ltd by shares"272,0793653,"LONGFAITH HONG KONG LIMITED
永誠香港有限公司",2002-04-17,2004-09-24,"Private, ltd by shares"273,0793628,"LOYAL CHAMP LIMITED (d2003-12-05)",2002-04-17,2003-12-05,"Private, ltd by shares"274,0793629,"LUCKY TEAM LIMITED
幸運星廣告有限公司",2002-04-17,,"Private, ltd by shares"275,0793435,"LUEN SHING HING COMPANY LIMITED
聯盛興有限公司",2002-04-17,2007-08-31,"Private, ltd by shares"276,0793365,"LUK CHAN CHINESE INTERNATIONAL EDUCATION CORPORATION LIMITED
陸陳漢語國際教育集團有限公司",2002-04-17,,"Private, ltd by shares"277,0793579,"LUNG WAH PHARMACY COMPANY LIMITED
龍華中西藥房有限公司",2002-04-17,2003-10-03,"Private, ltd by shares"278,0793732,"LUXCOAT LIMITED
力仕高有限公司",2002-04-17,2005-07-29,"Private, ltd by shares"279,0793606,"MACAU CLUB COMPANY LIMITED
澳門會所有限公司",2002-04-17,2007-08-31,"Private, ltd by shares"280,0793646,"MACY CREATION (CHINA) LIMITED
華美創作有限公司",2002-04-17,2018-12-28,"Private, ltd by shares"281,0793462,"MANY POWER ENTERPRISE CO. LIMITED
瞿成鞋業有限公司",2002-04-17,2003-10-17,"Private, ltd by shares"282,0793590,"MARINE INTERNATIONAL LIMITED (HK)
盟潤國際有限公司",2002-04-17,2019-01-04,"Private, ltd by shares"283,0793469,"MASTER GROUP INTERNATIONAL LIMITED
萬達集團國際有限公司",2002-04-17,,"Private, ltd by shares"284,0793773,"MASTER POWER CONSULTANTS LIMITED
萬勵顧問有限公司",2002-04-17,2006-06-30,"Private, ltd by shares"285,0793438,"MASTER SPIRIT (HONG KONG) LIMITED
健威國際(香港)有限公司",2002-04-17,2011-03-18,"Private, ltd by shares"286,0793776,"MAY'S BUILDING PRODUCTS LIMITED
美心建材有限公司",2002-04-17,2004-12-24,"Private, ltd by shares"287,0793472,"MEN CHAT PROPERTY INTERNATIONAL INVESTMENT GROUP COMPANY LIMITED
萬卓置業國際投資集團有限公司",2002-04-17,2004-08-27,"Private, ltd by shares"288,0793577,"METIS SPORT, CULTURE &amp; COMMUNICATION LIMITED
美體思體育文化發展有限公司",2002-04-17,,"Private, ltd by shares"289,0793723,"MILLION TEAM INVESTMENT LIMITED (d2005-09-16)
明添投資有限公司",2002-04-17,2005-09-16,"Private, ltd by shares"290,0793531,"MIRACLE KNITTING ENTERPRISES LIMITED
奇織企業有限公司",2002-04-17,2010-01-15,"Private, ltd by shares"291,0793736,"MOBILE CARE (HK) LIMITED",2002-04-17,,"Private, ltd by shares"292,0793527,"MOON ENTERPRISE COMPANY LIMITED
滿莊企業有限公司",2002-04-17,2009-07-29,"Private, ltd by shares"293,0793725,"Morgan Private Capital Management Partners Limited",2002-04-17,,"Private, ltd by shares"294,0793338,"MORII HONG KONG LIMITED
森井香港有限公司",2002-04-17,,"Private, ltd by shares"295,0793640,"MOTION LINK MANAGEMENT LIMITED
動域管理有限公司",2002-04-17,2008-11-14,"Private, ltd by shares"296,0793670,"MULTINATIONAL LIMITED (d2007-08-31)
跨國有限公司",2002-04-17,2007-08-31,"Private, ltd by shares"297,0793405,"NAGATA HONG KONG COMPANY LIMITED
永田(香港)有限公司",2002-04-17,,"Private, ltd by shares"298,0793500,"NET PROFIT CENTER (HOLDINGS) LIMITED
西北聯網科技(控股)有限公司",2002-04-17,2004-07-23,"Private, ltd by shares"299,0793502,"NEW COAST LIMITED (d2014-03-14)
新海岸有限公司",2002-04-17,2014-03-14,"Private, ltd by shares"300,0793706,"NEW CONCEPT EDUCATION INSTITUTE LIMITED
新思維教育服務有限公司",2002-04-17,,"Ltd by guarantee"301,0793490,"NEW GOLDEN ROAD INTERNATIONAL CO., LIMITED
香港聚鑫國際有限公司",2002-04-17,2018-04-06,"Private, ltd by shares"302,0793394,"NEW SHORE INTERNATIONAL INDUSTRIAL GROUP (HONG KONG) LIMITED
新岸國際實業集團(香港)有限公司",2002-04-17,2005-10-28,"Private, ltd by shares"303,0793612,"NEW TOWN DEVELOPMENT LIMITED (d2004-05-28)
新港建設有限公司",2002-04-17,2004-05-28,"Private, ltd by shares"304,0793383,"NEWORLD CONSTRUCTION ENGINEERING LIMITED
新偉建築工程有限公司",2002-04-17,,"Private, ltd by shares"305,0793625,"NGAGYUR DZOGCHEN NYIDZONG MAHAYANA BUDDHISM DHARMA CENTRE LIMITED
古舊派竹慶-寧宗寺大乘佛學中心有限公司",2002-04-17,2017-07-14,"Ltd by guarantee"306,0793657,"NICE HERO CORPORATION LIMITED
鴻運有限公司",2002-04-17,,"Private, ltd by shares"307,0793548,"NICO GLOBAL LIMITED
瀝高有限公司",2002-04-17,,"Private, ltd by shares"308,0793486,"NINAJAMES INTERNATIONAL COMPANY LIMITED",2002-04-17,,"Private, ltd by shares"309,0793702,"NRG INTERNATIONAL LIMITED (d2010-07-23)",2002-04-17,2010-07-23,"Private, ltd by shares"310,0793514,"NS GROUP LIMITED
新松集團有限公司",2002-04-17,2006-12-08,"Private, ltd by shares"311,0793534,"OATIZ CONSULTING LIMITED
歐泰投資顧問有限公司",2002-04-17,2003-08-22,"Private, ltd by shares"312,0793369,"OCEAN FIRST INTERNATIONAL ENTERPRISES LIMITED
凱暉國際企業有限公司",2002-04-17,2011-11-18,"Private, ltd by shares"313,0793772,"OCEANWAY TRANSPORTATION LIMITED
遠洋運輸有限公司",2002-04-17,,"Private, ltd by shares"314,0793491,"ONLINENGLISH LIMITED",2002-04-17,2005-11-25,"Private, ltd by shares"315,0793627,"OPTROM (HONG KONG) INTERNATIONAL LIMITED
愛普拓樂(香港)有限公司",2002-04-17,2015-12-04,"Private, ltd by shares"316,0793358,"ORIENTAL CENTURY INTERNATIONAL LIMITED",2002-04-17,2004-07-09,"Private, ltd by shares"317,0793783,"ORIENTAL TRADE DEVELOPMENT COMPANY LIMITED
東商發展有限公司",2002-04-17,2007-08-31,"Private, ltd by shares"318,0793791,"ORIOX ENERGY ASSOCIATES LIMITED",2002-04-17,2020-01-03,"Private, ltd by shares"319,0793727,"OVERSEAS FAVOUR DEVELOPMENT LIMITED
鴻宜實業發展有限公司",2002-04-17,2015-04-24,"Private, ltd by shares"320,0793674,"OVERSEAS GROUP CORPORATION LIMITED
僑團有限公司",2002-04-17,,"Private, ltd by shares"321,0793582,"OXSTAND-BOND INTERNATIONAL COLLEGE LIMITED",2002-04-17,2016-03-04,"Private, ltd by shares"322,0793363,"PACGAIN TECHNOLOGY LIMITED",2002-04-17,2019-05-31,"Private, ltd by shares"323,0793484,"PACIFIC ACTION LIMITED
紀東有限公司",2002-04-17,,"Private, ltd by shares"324,0793556,"PACIFIC KINETIC LIMITED (d2008-08-14)
廣鵬有限公司",2002-04-17,2008-08-14,"Private, ltd by shares"325,0793659,"PACIFIC LAND GROUP LIMITED
藍天集團有限公司",2002-04-17,2007-03-30,"Private, ltd by shares"326,0793550,"PACIFIC UNICON LIMITED
漢怡有限公司",2002-04-17,2012-12-07,"Private, ltd by shares"327,0793408,"PACIFIC URBAN SYSTEMS (H.K.) LIMITED
太平城都系統(香港)有限公司",2002-04-17,2012-04-13,"Private, ltd by shares"328,0793750,"PARAGON NETWORK CENTRE LIMITED
激之館上綱中心有限公司",2002-04-17,2004-12-03,"Private, ltd by shares"329,0793675,"PASTACK CO., LIMITED",2002-04-17,2015-06-05,"Private, ltd by shares"330,0793678,"PHOENIX LAMPS INDIA LIMITED",2002-04-17,2019-10-18,"Private, ltd by shares"331,0793381,"PLATINUM INTERNATIONAL CONSULTANTS LIMITED",2002-04-17,,"Private, ltd by shares"332,0793410,"POLYTECH (CHINA) ENTERPRISES LIMITED
晉利(中國)企業有限公司",2002-04-17,2010-08-20,"Private, ltd by shares"333,0793334,"POLYTRADING LIMITED
意大利保利有限公司",2002-04-17,,"Private, ltd by shares"334,0793707,"PRAYING HEARTS COUNSELLING CENTRE LIMITED
心暖心輔導中心有限公司",2002-04-17,,"Ltd by guarantee"335,0793650,"PREMIER LEISURE GROUP LIMITED (d2009-04-09)",2002-04-17,2009-04-09,"Private, ltd by shares"336,0793536,"PREMIER PROMOTIONS LIMITED (HK)
博美雅推廣有限公司",2002-04-17,,"Private, ltd by shares"337,0793575,"PRIME INTERNATIONAL CORPORATION LIMITED
匯浚國際集團有限公司",2002-04-17,,"Private, ltd by shares"338,0793561,"PROASIA INVESTMENT LIMITED
國恒投資有限公司",2002-04-17,2005-07-29,"Private, ltd by shares"339,0793788,"PROED LIMITED (d2008-10-03)",2002-04-17,2008-10-03,"Private, ltd by shares"340,0793580,"PROFDEL LIMITED",2002-04-17,2007-10-05,"Private, ltd by shares"341,0793733,"PROFESSIONAL DISPLAY SYSTEMS COMPANY LIMITED",2002-04-17,2005-09-23,"Private, ltd by shares"342,0793464,"PROFIT DESTINATION CONSULTANT LIMITED
盈達顧問有限公司",2002-04-17,2008-06-27,"Private, ltd by shares"343,0793520,"PROGRESSIVE LEARNING LIMITED (d2015-06-05)",2002-04-17,2015-06-05,"Private, ltd by shares"344,0793537,"PROSPERITY UNITED DEVELOPMENT LIMITED
駿興聯合發展有限公司",2002-04-17,2004-08-13,"Private, ltd by shares"345,0793779,"QIAOAYI INTERNATIONAL FASHION (H.K.) LIMITED
俏阿姨國際時裝(香港)有限公司",2002-04-17,2007-08-31,"Private, ltd by shares"346,0793743,"RASCHIG FAR EAST LIMITED",2002-04-17,2018-07-27,"Private, ltd by shares"347,0793608,"RAY ON CONSTRUCTION MANAGEMENT COMPANY LIMITED
威安建築工程管理有限公司",2002-04-17,2008-12-24,"Private, ltd by shares"348,0793683,"REDFORD HOLDINGS LIMITED (HK)
泓福控股有限公司",2002-04-17,,"Private, ltd by shares"349,0793685,"REDFORD INSURANCE BROKERS LIMITED
泓福保險顧問有限公司",2002-04-17,2003-10-03,"Private, ltd by shares"350,0793400,"REFINEMENT ELECTRIC INTERNATIONAL GROUP (H.K.) LIMITED
精工電器國際集團(香港)有限公司",2002-04-17,2006-04-13,"Private, ltd by shares"351,0793361,"RICH ASIA PACIFIC CORPORATION LIMITED
富亞太平洋有限公司",2002-04-17,2003-10-17,"Private, ltd by shares"352,0793480,"RICH EASE LIMITED (d2006-08-25)
裕宜有限公司",2002-04-17,2006-08-25,"Private, ltd by shares"353,0793631,"RIGHT LOYAL LIMITED (d2005-10-28)",2002-04-17,2005-10-28,"Private, ltd by shares"354,0793541,"ROSSTONE ELECTRONICS INTERNATIONAL GROUP (ASIA) LIMITED
美商羅斯通電子集團(亞洲)有限公司",2002-04-17,,"Private, ltd by shares"355,0793494,"ROYN INTERNATIONAL (HONG KONG) LIMITED
隴鑫國際(香港)有限公司",2002-04-17,2004-12-10,"Private, ltd by shares"356,0793352,"RTT GLOBAL LIMITED
萬泰豐有限公司",2002-04-17,2011-03-11,"Private, ltd by shares"357,0793360,"SEA PALACE MARKETING LIMITED
怡凱拓展有限公司",2002-04-17,2005-11-04,"Private, ltd by shares"358,0793638,"SEOUL MEDIA LIMITED",2002-04-17,2007-08-31,"Private, ltd by shares"359,0793412,"SHANGHAI CLUB MANAGEMENT COMPANY LIMITED",2002-04-17,2012-10-26,"Private, ltd by shares"360,0793467,"SHEN ZHEN BAOXINIAO FASHION LIMITED
深圳報喜鳥服飾有限公司",2002-04-17,2004-03-26,"Private, ltd by shares"361,0793649,"SHINING TECH QUALITY CONTROL LIMITED
明科品質控制有限公司",2002-04-17,,"Private, ltd by shares"362,0793337,"SHIVINA MANUFACTURING COMPANY LIMITED",2002-04-17,,"Private, ltd by shares"363,0793355,"SI TRADING LIMITED (d2015-01-16)",2002-04-17,2015-01-16,"Private, ltd by shares"364,0793362,"SILVER FAIR ASSOCIATES LIMITED
銀發實業有限公司",2002-04-17,2011-07-29,"Private, ltd by shares"365,0793619,"SIMONT PETRO-CHEM CO. LIMITED
施美特石油化工有限公司",2002-04-17,,"Private, ltd by shares"366,0793749,"SINCERE EXPRESS LIMITED (d2002-12-27)",2002-04-17,2002-12-27,"Private, ltd by shares"367,0793771,"SINO MASTER CONSULTANTS LIMITED
御華顧問有限公司",2002-04-17,2013-12-27,"Private, ltd by shares"368,0793524,"SINO MAX (CHINA) LIMITED
盈楓(中國)有限公司",2002-04-17,2006-10-13,"Private, ltd by shares"369,0793473,"SINO MECHANICS COMPANY LIMITED
中港動力實業有限公司",2002-04-17,2012-08-10,"Private, ltd by shares"370,0793770,"SINOTEAM CONSULTANTS LIMITED
中行顧問有限公司",2002-04-17,,"Private, ltd by shares"371,0793373,"SKY INTERNATIONAL DEVELOPMENT LIMITED
天誠國際發展有限公司",2002-04-17,2011-03-25,"Private, ltd by shares"372,0793379,"SKYFORD INTERNATIONAL INVESTMENTS LIMITED
晨山國際投資有限公司",2002-04-17,,"Private, ltd by shares"373,0793717,"SMART MANAGE LIMITED
俊仁有限公司",2002-04-17,2007-08-31,"Private, ltd by shares"374,0793654,"SMARTALENT CONSULTANTS LIMITED
智輝顧問有限公司",2002-04-17,,"Private, ltd by shares"375,0793720,"SMARTEEM INTERNATIONAL LIMITED
協雅國際有限公司",2002-04-17,2010-12-03,"Private, ltd by shares"376,0793488,"SME ACCOUNTING CONSULTANTS LIMITED
中小企業會計顧問有限公司",2002-04-17,,"Private, ltd by shares"377,0793433,"SNOWMAN TIN PACKAGING MANUFACTORY LIMITED
星輝行製罐有限公司",2002-04-17,2010-04-01,"Private, ltd by shares"378,0793566,"SO HUNG YIP TRADITIONAL CHINESE MEDICAL RESEARCH CENTRE LIMITED
蘇雄業國醫研究院有限公司",2002-04-17,2011-07-29,"Private, ltd by shares"379,0793452,"SOUTH BAY INTERNATIONAL DEVELOPMENT LIMITED
南灣國際發展有限公司",2002-04-17,2008-01-25,"Private, ltd by shares"380,0793431,"SOUTH PACIFIC TRADING LIMITED
南太貿易有限公司",2002-04-17,,"Private, ltd by shares"381,0793515,"SPRING POWER INTERNATIONAL LIMITED
新動力國際有限公司",2002-04-17,2007-12-28,"Private, ltd by shares"382,0793724,"ST. GABRIAL MEDICARE MANAGEMENT SERVICES LIMITED
聖基比奧康健管理服務有限公司",2002-04-17,2007-06-29,"Private, ltd by shares"383,0793787,"St. Paul's Hospital Renal Dialysis Centre Company Limited
聖保祿醫院腎科透析中心有限公司",2002-04-17,,"Private, ltd by shares"384,0793621,"STYLAND ENTERPRISES LIMITED
大凌企業有限公司",2002-04-17,,"Private, ltd by shares"385,0793475,"SUCCESS EAST LIMITED (d2006-04-07)
樂東有限公司",2002-04-17,2006-04-07,"Private, ltd by shares"386,0793370,"SUCCESS EDUCATIONAL CENTRE LIMITED
進昇教育中心有限公司",2002-04-17,2017-06-30,"Private, ltd by shares"387,0793386,"SUCCESS INTERNATIONAL HOLDINGS LIMITED
天盛國際集團有限公司",2002-04-17,,"Private, ltd by shares"388,0793427,"SUM MEI ENTERTAINMENT PRODUCTION LIMITED
心美娛樂製作有限公司",2002-04-17,,"Private, ltd by shares"389,0793677,"SUMISHO STEEL CORPORATION (HONG KONG) LIMITED
住商鋼鐵製品(香港)有限公司",2002-04-17,2019-01-01,"Private, ltd by shares"390,0793416,"SUN LANGUAGE SERVICES LIMITED
新語言服務有限公司",2002-04-17,2007-11-30,"Private, ltd by shares"391,0793684,"SUN SHING CONSTRUCTION INDUSTRIAL LIMITED
日昇建業有限公司",2002-04-17,2009-08-14,"Private, ltd by shares"392,0793565,"SUNNY EYE TECH LIMITED
祥樂視科有限公司",2002-04-17,,"Private, ltd by shares"393,0793446,"SUNSHINE INTERNATIONAL HOLDINGS LIMITED
新龍國際集團有限公司",2002-04-17,,"Private, ltd by shares"394,0793418,"SUNTOL MEDICAL LIMITED
新圖醫藥有限公司",2002-04-17,,"Private, ltd by shares"395,0793616,"SUPER LLOYD HOLDINGS LIMITED
萊特集團有限公司",2002-04-17,2002-12-13,"Private, ltd by shares"396,0793576,"Super Q Asia Limited
鮑棧有限公司",2002-04-17,2017-09-01,"Private, ltd by shares"397,0793545,"T&amp;T INTERNATIONAL (DEVELOPMENT) LIMITED
凱浚國際(發展)有限公司",2002-04-17,2009-09-11,"Private, ltd by shares"398,0793671,"TALENT CENTRE CORPORATION LIMITED (d2005-10-07)
智達有限公司",2002-04-17,2005-10-07,"Private, ltd by shares"399,0793617,"TALENT CHAIN INTERNATIONAL INVESTMENTS LIMITED
德昌國際投資有限公司",2002-04-17,,"Private, ltd by shares"400,0793692,"TECHNOLOGY TOUCH COMPANY LIMITED
創科通訊有限公司",2002-04-17,2007-08-31,"Private, ltd by shares"401,0793492,"TEL DRAGON COMMUNICATIONS CO. LIMITED
天衢通訊有限公司",2002-04-17,,"Private, ltd by shares"402,0793744,"TENG YUE INDUSTRIAL HONG KONG LIMITED
香港騰躍實業有限公司",2002-04-17,2008-10-03,"Private, ltd by shares"403,0793605,"TER JINN ENVIRONMENTAL TECHNOLOGY LIMITED
特勁環保科技有限公司",2002-04-17,2015-08-28,"Private, ltd by shares"404,0793624,"THREETWOONE FILM PRODUCTION LIMITED
三二一聲畫製作有限公司",2002-04-17,2013-05-31,"Private, ltd by shares"405,0793734,"TIKO CORPORATION LIMITED
技高(集團)有限公司",2002-04-17,,"Private, ltd by shares"406,0793508,"TOP KINETIC INTERNATIONAL LIMITED
旭基國際有限公司",2002-04-17,,"Private, ltd by shares"407,0793479,"TOPWEST DEVELOPMENT LIMITED
天維發展有限公司",2002-04-17,2005-01-14,"Private, ltd by shares"408,0793652,"TOTAL HEALTH COMPANY LIMITED
弘匡堂有限公司",2002-04-17,,"Private, ltd by shares"409,0793593,"TOU TSAI BIU AUTO SERVICES COMPANY LIMITED
土霽鑣汽車服務有限公司",2002-04-17,2020-11-06,"Private, ltd by shares"410,0793453,"TRADEMASTER GROUP LIMITED
第一興業控股有限公司",2002-04-17,2007-08-31,"Private, ltd by shares"411,0793568,"TRIPLE LINE LIMITED (d2005-06-17)",2002-04-17,2005-06-17,"Private, ltd by shares"412,0793371,"TUNG HEI ENGINEERING COMPANY LIMITED
東熹工程有限公司",2002-04-17,2003-12-19,"Private, ltd by shares"413,0793341,"TVT (INT'L) INDUSTRIES CO., LIMITED
合一(國際)實業有限公司",2002-04-17,2008-10-03,"Private, ltd by shares"414,0793572,"U.K. DANCERUL (H.K.) INT'L FINERY LIMITED
英國登喜路(香港)國際服飾有限公司",2002-04-17,2007-02-16,"Private, ltd by shares"415,0793390,"U.S.A VALNITOU CLOTHING INT'L GROUP LIMITED
美國華倫天奴服飾國際集團有限公司",2002-04-17,2007-08-31,"Private, ltd by shares"416,0793554,"UNISOURCE LIMITED (d2003-07-18)
紀和有限公司",2002-04-17,2003-07-18,"Private, ltd by shares"417,0793468,"UNITED CERAMICS MANUFACTORY LIMITED
聯合陶瓷有限公司",2002-04-17,2013-09-06,"Private, ltd by shares"418,0793626,"UNITED CROWN . HERCULES ASSOCIATE COMPANY LIMITED
冠聯‧靈動聯營有限公司",2002-04-17,,"Private, ltd by shares"419,0793388,"UNITED INTERNATIONAL HOLDINGS LIMITED
華聯國際集團有限公司",2002-04-17,,"Private, ltd by shares"420,0793651,"USEFUL THINGS LIMITED",2002-04-17,2007-08-31,"Private, ltd by shares"421,0793741,"VICTORY GAIN INDUSTRIES LIMITED
精盈實業有限公司",2002-04-17,2007-08-31,"Private, ltd by shares"422,0793443,"VICTORY WAY HOLDINGS LIMITED
滙偉集團有限公司",2002-04-17,,"Private, ltd by shares"423,0793587,"VISION CONSULTANTS LIMITED (d2013-03-28)
威視咨詢有限公司",2002-04-17,2013-03-28,"Private, ltd by shares"