,Reg no.,Name,Incorp-orated,Dissolved,Type1,0793574,"A PLUS 2 COMPUTER LIMITED
毅進易電腦有限公司",2002-04-17,,"Private, ltd by shares"2,0793623,"A. J. DANI (ASIA) INVESTMENT LIMITED
亞約丹尼(亞洲)投資顧問有限公司",2002-04-17,2003-05-30,"Private, ltd by shares"3,0793547,"A.S.W. COMPANY LIMITED
鑽昇有限公司",2002-04-17,2006-01-13,"Private, ltd by shares"4,0793583,"ABROAD CHINA EXCHANGE LIMITED
進華交流有限公司",2002-04-17,2012-03-02,"Private, ltd by shares"5,0793762,"ACCIB ENTERPRISE LIMITED
亞欣實業有限公司",2002-04-17,2013-06-28,"Private, ltd by shares"6,0793630,"ACT 2 CHINA UN LIMITED",2002-04-17,2015-06-05,"Private, ltd by shares"7,0793421,"ALL WISDOM CORPORATE SERVICES LIMITED
捷思商業服務有限公司",2002-04-17,,"Private, ltd by shares"8,0793414,"ALLRICH MOTORS COMPANY LIMITED
全發汽車有限公司",2002-04-17,,"Private, ltd by shares"9,0793517,"AMERICA SAI TE XI YA HOLDING LIMITED
美國賽特西亞集團有限公司",2002-04-17,2007-08-31,"Private, ltd by shares"10,0793691,"AMERSHAM 1129 LIMITED",2002-04-17,2007-06-01,"Private, ltd by shares"11,0793705,"ANHUI FRATERNITY ASSOCIATION (HONG KONG) LIMITED (THE)
香港安徽聯誼總會有限公司",2002-04-17,,"Ltd by guarantee"12,0793442,"AQUA BIONIC CORPORATION LIMITED
沃特爾生物環保科技有限公司",2002-04-17,2007-03-16,"Private, ltd by shares"13,0793601,"Archer Services Limited (HK)",2002-04-17,,"Private, ltd by shares"14,0793457,"ARCHIDESIGN (CHINA) LIMITED
築安建築師(中國)有限公司",2002-04-17,2017-12-08,"Private, ltd by shares"15,0793647,"ARIZONA CHEMICAL ASIA LIMITED",2002-04-17,2020-09-19,"Private, ltd by shares"16,0793758,"ARON BEST ACCOUNTANCY AND SECRETARIAL COMPANY LIMITED
雅朗會計秘書有限公司",2002-04-17,,"Private, ltd by shares"17,0793573,"ARTHUR E LIMITED
愛快易有限公司",2002-04-17,,"Private, ltd by shares"18,0793639,"ASAP ENTERPRISES LIMITED (d2009-05-22)",2002-04-17,2009-05-22,"Private, ltd by shares"19,0793507,"ASIA CONCORD LIMITED (d2007-01-12)
漢鵬有限公司",2002-04-17,2007-01-12,"Private, ltd by shares"20,0793482,"ASIA EAST (H.K.) LIMITED (d2013-06-28)
順東(香港)有限公司",2002-04-17,2013-06-28,"Private, ltd by shares"21,0793558,"ASIA EAST HOLDINGS LIMITED (d2012-12-14)
順東集團有限公司",2002-04-17,2012-12-14,"Private, ltd by shares"22,0793551,"ASIA EAST INVESTMENT LIMITED (d2008-05-23)
嘉東投資有限公司",2002-04-17,2008-05-23,"Private, ltd by shares"23,0793557,"ASIA EAST TRADING LIMITED
順東貿易有限公司",2002-04-17,2011-03-25,"Private, ltd by shares"24,0793483,"ASIA LUCKY (H.K.) LIMITED (d2010-04-23)
偉運(香港)有限公司",2002-04-17,2010-04-23,"Private, ltd by shares"25,0793560,"ASIA LUCKY HOLDINGS LIMITED (d2014-01-17)
偉運集團有限公司",2002-04-17,2014-01-17,"Private, ltd by shares"26,0793778,"ASIA UNIFICATION RESEARCH INSTITUTE LIMITED
亞洲一體化研究院有限公司",2002-04-17,2007-08-31,"Private, ltd by shares"27,0793481,"ASIACITI (H.K.) LIMITED (d2006-06-30)
成運(香港)有限公司",2002-04-17,2006-06-30,"Private, ltd by shares"28,0793506,"ASIACITI TECHNOLOGIES LIMITED
怡匯科技有限公司",2002-04-17,2004-07-23,"Private, ltd by shares"29,0793420,"ASIAN FAMOUS (HONG KONG) LIMITED
明滙達(香港)有限公司",2002-04-17,2005-04-01,"Private, ltd by shares"30,0793466,"AST ENGINEERING LIMITED (d2007-08-31)
盈和工程有限公司",2002-04-17,2007-08-31,"Private, ltd by shares"31,0793595,"ASTECK LIMITED
亞士達有限公司",2002-04-17,,"Private, ltd by shares"32,0793403,"AUSTRILIA WELDON INT'L INV. LIMITED
澳大利亞威爾登國際投資有限公司",2002-04-17,2007-08-31,"Private, ltd by shares"33,0793423,"BAG AND GEAR CO., LIMITED",2002-04-17,2011-09-16,"Private, ltd by shares"34,0793716,"BANNER SPAN CO., LIMITED
聯傑科技有限公司",2002-04-17,,"Private, ltd by shares"35,0793353,"BEAUTY &amp; CARE (H.K.) LIMITED
美樂寶貿易(香港)有限公司",2002-04-17,,"Private, ltd by shares"36,0793586,"BENEFIT HARBOUR SHIPPING AGENCY LIMITED
盛利港有限公司",2002-04-17,2007-07-06,"Private, ltd by shares"37,0793719,"BEST REWARD HOLDINGS LIMITED (d2008-01-04)
鴻圖集團有限公司",2002-04-17,2008-01-04,"Private, ltd by shares"38,0793372,"BESTKING INTERNATIONAL DEVELOPMENT LIMITED
寶基國際發展有限公司",2002-04-17,2020-05-15,"Private, ltd by shares"39,0793376,"BESTKING INTERNATIONAL INDUSTRIES LIMITED
寶基國際實業有限公司",2002-04-17,2015-06-05,"Private, ltd by shares"40,0793440,"BESTKING INTERNATIONAL INVESTMENTS LIMITED
寶基國際投資有限公司",2002-04-17,2016-09-30,"Private, ltd by shares"41,0793444,"BESTOP HOLDINGS LIMITED (d2008-09-12)
寶康新集團有限公司",2002-04-17,2008-09-12,"Private, ltd by shares"42,0793701,"BEYOND DEVELOPMENT LIMITED (d2007-08-31)",2002-04-17,2007-08-31,"Private, ltd by shares"43,0793428,"BIG APPLE SANDWICH SHOP LIMITED (THE)
大蘋果三文治店有限公司",2002-04-17,2015-09-18,"Private, ltd by shares"44,0793690,"BLUE WORKS LIMITED
布魯和施有限公司",2002-04-17,2011-06-17,"Private, ltd by shares"45,0793748,"BLUE-GOLD INT'L (HK) CHAIN MARKETING LIMITED
蘭金國際(香港)健康美容品營銷連鎖有限公司",2002-04-17,2005-04-22,"Private, ltd by shares"46,0793395,"BODELO INTERNATIONAL OIL (FAR EAST) LIMITED
堡德龍國際石油(遠東)有限公司",2002-04-17,2008-10-03,"Private, ltd by shares"47,0793339,"BOMEI INTERNATIONAL (HONG KONG) INDUSTRIAL CO., LIMITED
博美國際(香港)實業有限公司",2002-04-17,2005-02-18,"Private, ltd by shares"48,0793600,"bostone Group Limited
博石集團有限公司",2002-04-17,,"Private, ltd by shares"49,0793715,"BREZZE HONG KONG LIMITED",2002-04-17,2015-12-04,"Private, ltd by shares"50,0793344,"C &amp; C PRO (HK) COMPANY LIMITED",2002-04-17,2007-09-14,"Private, ltd by shares"51,0793422,"C &amp; P MANAGEMENT LIMITED
匯進達管理有限公司",2002-04-17,,"Private, ltd by shares"52,0793656,"C.O.C. MANUFACTURING LIMITED
頑張制品有限公司",2002-04-17,2004-09-30,"Private, ltd by shares"53,0793726,"CANTON FAIR LIMITED (d2007-09-21)
粵暉有限公司",2002-04-17,2007-09-21,"Private, ltd by shares"54,0793775,"CANTON LOYAL LIMITED
佳粵有限公司",2002-04-17,,"Private, ltd by shares"55,0793516,"CARE RESULTANT COMPANY LIMITED
奇藝公司大夫有限公司",2002-04-17,2005-11-18,"Private, ltd by shares"56,0793728,"CARTEL HOLDINGS LIMITED (d2003-10-17)
加達集團有限公司",2002-04-17,2003-10-17,"Private, ltd by shares"57,0793437,"CENTURY INSURANCE AND FINANCIAL SERVICES LIMITED
世紀保險理財策劃有限公司",2002-04-17,,"Private, ltd by shares"58,0793525,"CHARM NOBLE INTERNATIONAL LIMITED
宏浚國際有限公司",2002-04-17,,"Private, ltd by shares"59,0793404,"CHENG FILMS &amp; VIDEO PRODUCTION LIMITED
誠影視製作有限公司",2002-04-17,,"Private, ltd by shares"60,0793607,"CHEUNG WING INTERIOR CONTRACTOR COMPANY LIMITED
長榮裝修工程有限公司",2002-04-17,,"Private, ltd by shares"61,0793424,"CHI WAH ENGINEERING CO., LIMITED
志華建築工程有限公司",2002-04-17,,"Private, ltd by shares"62,0793655,"CHINA CAREER DEVELOPMENT LIMITED
中祥發展有限公司",2002-04-17,2004-10-15,"Private, ltd by shares"63,0793380,"CHINA CONSULTANTS LIMITED (d2007-08-31)
中國顧問有限公司",2002-04-17,2007-08-31,"Private, ltd by shares"64,0793533,"CHINA CREDIT INTERNATIONAL INDUSTRIAL DEVELOPMENT LIMITED
中國誠信國際實業發展有限公司",2002-04-17,2008-06-27,"Private, ltd by shares"65,0793747,"CHINA HK DIGITAL CAMERA CENTER LIMITED
中港數碼器材特賣店有限公司",2002-04-17,2003-12-19,"Private, ltd by shares"66,0793357,"CHINA INTERNATIONAL ART CULTURE PHOTOGRAPHY ASSOCIATION LIMITED
國際華夏文化藝術攝影協會有限公司",2002-04-17,2007-08-31,"Private, ltd by shares"67,0793538,"CHINA INVESTMENT INTERNATIONAL GROUP LIMITED
中國投資國際集團有限公司",2002-04-17,,"Private, ltd by shares"68,0793451,"CHINA LINK NETWORK COMMUNICATION LIMITED
中國通網絡傳播有限公司",2002-04-17,2007-04-20,"Private, ltd by shares"69,0793529,"CHINA MEDICAL HEALTH WORK LIMITED
中國醫學保健事業有限公司",2002-04-17,2007-08-31,"Private, ltd by shares"70,0793406,"CHINA NET-PC (BEIJING) LIMITED
中國網絡電腦(北京)有限公司",2002-04-17,2008-01-25,"Private, ltd by shares"71,0793564,"CHINA TIME TECHNOLOGIES LIMITED (d2007-08-31)
永泰科技有限公司",2002-04-17,2007-08-31,"Private, ltd by shares"72,0793445,"CHINA WORLD INTERNATIONAL HOLDINGS LIMITED
中威國際集團有限公司",2002-04-17,2012-05-25,"Private, ltd by shares"73,0793349,"CHINAGATE (HONG KONG) LIMITED
啟華(香港)有限公司",2002-04-17,,"Private, ltd by shares"74,0793713,"CHINAWELL TECHNOLOGIES LIMITED
嘉華科技有限公司",2002-04-17,2007-07-27,"Private, ltd by shares"75,0793581,"CHINCHA HEALTH EXTRACTS LIMITED
千茶健康精華有限公司",2002-04-17,2006-07-07,"Private, ltd by shares"76,0793393,"CHINESE WORLD PUBLISHING LIMITED
世界華人圖書出版有限公司",2002-04-17,2008-07-04,"Private, ltd by shares"77,0793459,"CHUN HUNG (HONG KONG) INDUSTRIES CO., LIMITED
俊雄(香港)實業有限公司",2002-04-17,,"Private, ltd by shares"78,0793784,"CHUN YUEN INVESTMENTS COMPANY LIMITED",2002-04-17,2015-06-05,"Private, ltd by shares"79,0793681,"CHUNG LUEN MECHANICAL ENGINEERING LIMITED
忠聯機械工程有限公司",2002-04-17,,"Private, ltd by shares"80,0793505,"CITIMARK HOLDINGS LIMITED
基建集團有限公司",2002-04-17,2009-06-05,"Private, ltd by shares"81,0793636,"CLEARWATER BAY REALTY COMPANY LIMITED
泓業地產代理有限公司",2002-04-17,2002-12-13,"Private, ltd by shares"82,0793700,"COMFORTHOME GROUP LIMITED
嘉翔集團有限公司",2002-04-17,,"Private, ltd by shares"83,0793615,"CONCORD INTERNATIONAL LIMITED (d2005-02-18)
康高國際有限公司",2002-04-17,2005-02-18,"Private, ltd by shares"84,0793644,"CONNECT COMMUNICATION LIMITED",2002-04-17,,"Private, ltd by shares"85,0793753,"COOL-POWER (H.K.) INT'L LIMITED
科寶爾(香港)國際有限公司",2002-04-17,2007-08-31,"Private, ltd by shares"86,0793641,"COSMEC INTERNATIONAL LIMITED
高絲鎂國際有限公司",2002-04-17,2009-05-15,"Private, ltd by shares"87,0793584,"CROSS BORDER SERVICES LIMITED (HK)
跨境服務有限公司",2002-04-17,,"Private, ltd by shares"88,0793672,"CROWN ON INTERNATIONAL LIMITED
均安國際有限公司",2002-04-17,2009-09-11,"Private, ltd by shares"89,0793689,"CRYSTAL PROFITS INVESTMENT LIMITED (d2007-08-31)
勵晶投資有限公司",2002-04-17,2007-08-31,"Private, ltd by shares"90,0793458,"D &amp; K UTENSIL (INT'L) LIMITED
美雅潔具設備(國際)有限公司",2002-04-17,2003-11-14,"Private, ltd by shares"91,0793384,"DAH DEI INJECTION MACHINERY CO. LIMITED
大地注塑機械有限公司",2002-04-17,2015-03-27,"Private, ltd by shares"92,0793738,"DASH MANAGEMENT LIMITED (d2005-11-18)
正豐管理有限公司",2002-04-17,2005-11-18,"Private, ltd by shares"93,0793415,"DCM INTERIOR SERVICES LIMITED
三本室內設計工程有限公司",2002-04-17,,"Private, ltd by shares"94,0793662,"DESTIWORKS LIMITED",2002-04-17,2010-10-08,"Private, ltd by shares"95,0793598,"DIAMOND BAG (HONGKONG) LIMITED
香港鑽石手袋有限公司",2002-04-17,2016-03-29,"Private, ltd by shares"96,0793614,"DIGNITY ASIA LIMITED
亞盛有限公司",2002-04-17,,"Private, ltd by shares"97,0793354,"DRAGON EMS ENGINEERS, LIMITED
龍駿工程技術有限公司",2002-04-17,2006-12-01,"Private, ltd by shares"98,0793460,"DTD LOGISTICS COMPANY LIMITED
通程物流有限公司",2002-04-17,2007-08-31,"Private, ltd by shares"99,0793688,"DYNAMIC DRAGON TECHNOLOGY LIMITED
展龍科技有限公司",2002-04-17,,"Private, ltd by shares"100,0793793,"E-BEAUTY INTERNATIONAL LIMITED (d2011-12-09)",2002-04-17,2011-12-09,"Private, ltd by shares"101,0793364,"EAST EMPIRE INVESTMENTS COMPANY LIMITED",2002-04-17,2005-10-07,"Private, ltd by shares"102,0793777,"EAST OCEAN LOGISTICS LIMITED (d2010-11-12)
瀛海貨運有限公司",2002-04-17,2010-11-12,"Private, ltd by shares"103,0793378,"EASTAR INTERNATIONAL INVESTMENTS LIMITED
東誠國際投資有限公司",2002-04-17,2011-06-17,"Private, ltd by shares"104,0793382,"EASTKING CONSTRUCTION ENGINEERING LIMITED
東基建築工程有限公司",2002-04-17,2017-06-26,"Private, ltd by shares"105,0793634,"EDARWA INT'L (HK) HI-TECH COSMETICS LIMITED
愛德華國際(香港)高新技術化妝品有限公司",2002-04-17,2007-08-31,"Private, ltd by shares"106,0793599,"EESYSTEM TECHNOLOGY LIMITED
東旭科技有限公司",2002-04-17,2007-03-16,"Private, ltd by shares"107,0793368,"EJEL (HONGKONG) ELECTRONICS COMPANY LIMITED
香港毅捷電子企業有限公司",2002-04-17,2008-10-03,"Private, ltd by shares"108,0793643,"ELECPRO TRADING LIMITED
立邦貿易有限公司",2002-04-17,2007-09-14,"Private, ltd by shares"109,0793709,"ESTATE OF WANG TEH HUEI (NO. 2) LIMITED (THE)",2002-04-17,,"Private, ltd by shares"110,0793751,"ESUN-INFO TECHNOLOGY CO., LIMITED
驛尚信科技有限公司",2002-04-17,2004-10-08,"Private, ltd by shares"111,0793618,"ETERNAL INT'L HOLDING LIMITED
依特諾國際集團有限公司",2002-04-17,2007-08-31,"Private, ltd by shares"112,0793745,"Eurasco China Investment Holdings Limited
歐元投資控股有限公司",2002-04-17,2010-02-19,"Private, ltd by shares"113,0793735,"EVER UNION INTERNATIONAL TRADING LIMITED
恆聯國際貿易有限公司",2002-04-17,2015-06-05,"Private, ltd by shares"114,0793721,"EXCELSOFT (HONG KONG) LIMITED",2002-04-17,2009-09-11,"Private, ltd by shares"115,0793367,"FABRIX COMPANY LIMITED
灃業有限公司",2002-04-17,2010-12-03,"Private, ltd by shares"116,0793417,"FAIRWAY BUILDING MATERIALS LIMITED
富榮建材有限公司",2002-04-17,,"Private, ltd by shares"117,0793687,"FAITH DRAGONS LIMITED
義龍有限公司",2002-04-17,2003-09-26,"Private, ltd by shares"118,0793474,"FAMILY LEARNING ASSOCIATION LIMITED
家庭學習協會有限公司",2002-04-17,,"Private, ltd by shares"119,0793774,"FASTWAY TRANSPORTATION LIMITED (d2009-11-13)
捷達運輸有限公司",2002-04-17,2009-11-13,"Private, ltd by shares"120,0793535,"FEI LUNG COMPUTER EMBROIDERY &amp; LABEL FACTORY LIMITED
飛龍電腦機繡商標廠有限公司",2002-04-17,,"Private, ltd by shares"121,0793785,"FELCON INTERNATIONAL DEVELOPMENT LIMITED
福港國際貿易發展有限公司",2002-04-17,,"Private, ltd by shares"122,0793769,"FILTHESSA SAILETTO PACIFIC LIMITED",2002-04-17,2003-12-19,"Private, ltd by shares"123,0793402,"FINECOM SHIPPING LIMITED
惠濟海運有限公司",2002-04-17,,"Private, ltd by shares"124,0793729,"FIRST CHINA INDUSTRIAL LIMITED
華冠實業有限公司",2002-04-17,2019-02-01,"Private, ltd by shares"125,0793359,"FIRST VENTURE COMPANY LIMITED
佳沃有限公司",2002-04-17,2010-12-03,"Private, ltd by shares"126,0793521,"Fives Real Estate Limited
五已不動產有限公司",2002-04-17,,"Private, ltd by shares"127,0793661,"FLYING DRAGON SHOESTOWN CHINA LIMITED
龍騰鞋業中國有限公司",2002-04-17,2009-05-22,"Private, ltd by shares"128,0793449,"FONTAINE ENTERPRISE LIMITED
楓丹企業有限公司",2002-04-17,2007-08-31,"Private, ltd by shares"129,0793740,"FOREVER BILLION (ASIA) LIMITED
精億(亞洲)有限公司",2002-04-17,2015-01-23,"Private, ltd by shares"130,0793463,"FOREVER WEALTH (H.K.) TRADING DEVELOPMENT LIMITED
恒富(香港)貿易發展有限公司",2002-04-17,2003-07-11,"Private, ltd by shares"131,0793695,"FORTUNE PROPERTY DEVELOPMENT COMPANY LIMITED
連運發展有限公司",2002-04-17,,"Private, ltd by shares"132,0793569,"FRANCE BANI VIOLET (HK) INT'L LIMITED
法國巴尼紫羅蘭(香港)國際有限公司",2002-04-17,2007-08-31,"Private, ltd by shares"133,0793455,"FRANCE BIG MOUTH CROCODILE (INTERNATIONAL) FASHION LIMITED
法國大嘴鱷魚(國際)服飾有限公司",2002-04-17,2007-08-31,"Private, ltd by shares"134,0793396,"FRANCE DUPENG.BADI INTERNATIONAL GROUP CO., LIMITED
法國都彭‧巴迪國際集團有限公司",2002-04-17,2015-06-05,"Private, ltd by shares"135,0793592,"FRANCE FANTASY INTERNATIONAL FASHION (H.K.) LIMITED
法國梵蒂士國際服飾(香港)有限公司",2002-04-17,,"Private, ltd by shares"136,0793603,"FRANCE GOLDENDREAM INTERNATIONAL FASHION LEATHER (THE FAR EAST) LIMITED
法國金象國際服飾皮具(遠東)有限公司",2002-04-17,2007-08-31,"Private, ltd by shares"137,0793591,"FRANCE HUASHIDENGNU INTERNATIONAL CO., LIMITED
法國華仕登奴國際有限公司",2002-04-17,2007-08-31,"Private, ltd by shares"138,0793530,"FRANCE KINDUN DRESS (HK) INT'L GROUP LIMITED
法國金盾服飾(香港)國際集團有限公司",2002-04-17,2007-08-31,"Private, ltd by shares"139,0793447,"FRANCE KINDUN INT'L (HK) DRESS LIMITED
法國金盾國際(香港)服飾有限公司",2002-04-17,2009-09-11,"Private, ltd by shares"140,0793764,"FRANCE MONGEL INT'L GARMENT (H.K.) LIMITED
法國蒙格爾國際服飾(香港)有限公司",2002-04-17,2007-08-31,"Private, ltd by shares"141,0793589,"FRANCE SAMMI GROUP (H.K.) LIMITED
法國申美集團(香港)有限公司",2002-04-17,2007-08-31,"Private, ltd by shares"142,0793780,"FRANCE VALEN SAINTLONG (HK) INT'L GROUP LIMITED
法國華倫聖帝龍(香港)國際集團有限公司",2002-04-17,2007-08-31,"Private, ltd by shares"143,0793752,"FRANCE WOODPECKER GARMENT INT'L ENTERPRISE LIMITED
法國啄木鳥服飾國際企業有限公司",2002-04-17,2007-08-31,"Private, ltd by shares"144,0793637,"FREE YON INDUSTRIES LIMITED
暉揚實業有限公司",2002-04-17,,"Private, ltd by shares"145,0793645,"FREEVERSE DESIGN (INTERNATIONAL) LIMITED
富思設計顧問(國際)有限公司",2002-04-17,2008-01-04,"Private, ltd by shares"146,0793392,"FRONT LINE INFORMATION LIMITED (d2004-06-11)
前線資訊有限公司",2002-04-17,2004-06-11,"Private, ltd by shares"147,0793792,"FSOFT LIMITED",2002-04-17,2008-10-03,"Private, ltd by shares"148,0793504,"FULLMATE ENTERPRISES LIMITED
富美企業有限公司",2002-04-17,2012-10-12,"Private, ltd by shares"149,0793546,"FUNRISE LIMITED (d2006-06-30)",2002-04-17,2006-06-30,"Private, ltd by shares"150,0793351,"GATES 2 CHINA LIMITED",2002-04-17,2015-07-31,"Private, ltd by shares"151,0793613,"GENIUS FIDELITY LIMITED",2002-04-17,2007-06-08,"Private, ltd by shares"152,0793399,"GENMA TECHNOLOGY HONG KONG LIMITED
金瑪科技(香港)有限公司",2002-04-17,2007-08-31,"Private, ltd by shares"153,0793696,"GLOBAL ESTATE LIMITED
高寶置業有限公司",2002-04-17,2009-08-14,"Private, ltd by shares"154,0793549,"GLOBAL PROFESSIONAL SERVICES LIMITED (d2005-01-14)",2002-04-17,2005-01-14,"Private, ltd by shares"155,0793411,"GLOBAL REACH HOLDINGS LIMITED (d2004-05-14)
全球延伸控股有限公司",2002-04-17,2004-05-14,"Private, ltd by shares"156,0793340,"GLOBAL SUCCESS (CHINA) TRADING LIMITED
利晉(中國)貿易有限公司",2002-04-17,2019-07-26,"Private, ltd by shares"157,0793664,"GLORY HERO ASIA LIMITED
永豪亞洲有限公司",2002-04-17,2007-08-31,"Private, ltd by shares"158,0793755,"GOLD CASTLE (ETERNITY) INDUSTRIAL LIMITED
金堡(永恆)實業有限公司",2002-04-17,2009-09-11,"Private, ltd by shares"159,0793375,"GOLD UNITED INTERNATIONAL DEVELOPMENT LIMITED (d2006-09-29)
金源國際發展有限公司",2002-04-17,2006-09-29,"Private, ltd by shares"160,0793377,"GOLD UNITED INTERNATIONAL INDUSTRIES LIMITED
金聯國際實業有限公司",2002-04-17,,"Private, ltd by shares"161,0793782,"GOLDEN DRAGON TRADING COMPANY LIMITED (d2005-07-08)
金之龍貿易有限公司",2002-04-17,2005-07-08,"Private, ltd by shares"162,0793539,"GOLDLEAD FINANCE INT'L LIMITED
金尊金融國際有限公司",2002-04-17,2007-08-31,"Private, ltd by shares"163,0793439,"GOLDSTAR INTERNATIONAL INDUSTRIES LIMITED
高誠國際實業有限公司",2002-04-17,2010-12-03,"Private, ltd by shares"164,0793450,"GOLDSTAR INTERNATIONAL INVESTMENTS LIMITED (d2017-09-29)
高誠國際投資有限公司",2002-04-17,2017-09-29,"Private, ltd by shares"165,0793434,"GOODKING JUNHUA INTERNATIONAL AUCTION UNITED GROUP LIMITED
古今君華國際拍賣聯合集團有限公司",2002-04-17,2006-08-25,"Private, ltd by shares"166,0793737,"Gorgeous Wealth Limited
東方國際商業融資顧問有限公司",2002-04-17,,"Private, ltd by shares"167,0793432,"Grain &amp; More Limited",2002-04-17,,"Private, ltd by shares"168,0793781,"GRAND ATLANTIC INVESTMENTS COMPANY LIMITED",2002-04-17,2006-10-13,"Private, ltd by shares"169,0793430,"GRAND EASTERN DEVELOPMENT COMPANY LIMITED (d2004-02-06)
宜君發展有限公司",2002-04-17,2004-02-06,"Private, ltd by shares"170,0793768,"GRAND MARINE COMPANY LIMITED
昌大海運有限公司",2002-04-17,2009-01-16,"Private, ltd by shares"171,0793425,"GRAVITAS PARTNERSHIP LIMITED",2002-04-17,2015-02-18,"Private, ltd by shares"172,0793739,"GREAT CHINA TOP TECHNOLOGY LIMITED
大中華高新科技有限公司",2002-04-17,,"Private, ltd by shares"173,0793680,"GREEN'S TRADING COMPANY LIMITED
綠子日本時裝有限公司",2002-04-17,,"Private, ltd by shares"174,0793594,"H.F. INTERNATIONAL INDUSTRIES LIMITED
鴻飛國際實業有限公司",2002-04-17,,"Private, ltd by shares"175,0793398,"H.K. FOMENGTE INTERNATIONAL FASHION LIMITED
香港佛蒙特國際服裝有限公司",2002-04-17,2005-02-08,"Private, ltd by shares"176,0793465,"H.K. HENGMING INT'L GROUP LIMITED
香港恒明國際集團有限公司",2002-04-17,2016-06-30,"Private, ltd by shares"177,0793391,"H.K. LUCK'S LOVE GARMENT INT'L GROUP LIMITED
香港緣之戀服飾國際集團有限公司",2002-04-17,2007-08-31,"Private, ltd by shares"178,0793493,"H.K. MESTEC INT'L FURNITURE LIMITED
香港美思達國際家具有限公司",2002-04-17,2008-10-03,"Private, ltd by shares"179,0793540,"H.K. XINLIN (INT'L) FOOD LIMITED
香港新林(國際)食品有限公司",2002-04-17,2008-10-03,"Private, ltd by shares"180,0793658,"HAGAKI LIMITED",2002-04-17,2007-10-05,"Private, ltd by shares"181,0793596,"HANDS DESIGN (H.K.) LIMITED
手創設計(香港)有限公司",2002-04-17,,"Private, ltd by shares"182,0793413,"HAWIN COMPANY LIMITED
樺建有限公司",2002-04-17,2016-09-15,"Private, ltd by shares"183,0793348,"HEAT STATION INTERNATIONAL CORPORATION LIMITED",2002-04-17,2011-12-09,"Private, ltd by shares"184,0793648,"HENG JIAN INTERNATIONAL CO. LIMITED
恒健國際有限公司",2002-04-17,2012-10-12,"Private, ltd by shares"185,0793642,"HENG RUN INTERNATIONAL INVESTMENT LIMITED (d2008-10-03)
恆潤國際投資有限公司",2002-04-17,2008-10-03,"Private, ltd by shares"186,0793522,"HERO BRIGHT INTERNATIONAL LIMITED
鴻英國際有限公司",2002-04-17,2010-12-03,"Private, ltd by shares"187,0793345,"HERO MODE MANAGEMENT SERVICES LIMITED
豪滿管理服務有限公司",2002-04-17,,"Private, ltd by shares"188,0793767,"HIDEYOSHI MORGAN WELLESLEY LIMITED",2002-04-17,2007-06-01,"Private, ltd by shares"189,0793512,"HITOP INTERNATIONAL TRADING LIMITED
盛昕國際貿易有限公司",2002-04-17,2017-06-16,"Private, ltd by shares"190,0793567,"HK BEST.E (INT'L) FASHION LIMITED
香港蓓絲特‧依(國際)時裝有限公司",2002-04-17,2007-08-31,"Private, ltd by shares"191,0793401,"HK BOER INT'L GROUP LIMITED
香港波爾國際集團有限公司",2002-04-17,2010-12-03,"Private, ltd by shares"192,0793456,"HK CROCODILE FASHION FAR EAST LIMITED
香港鱷魚服飾遠東有限公司",2002-04-17,2003-12-24,"Private, ltd by shares"193,0793335,"HK CROCODILE FASHION LIMITED
香港鱷魚服飾股份有限公司",2002-04-17,2003-12-24,"Private, ltd by shares"194,0793374,"HK LEADER INTERNATIONAL DEVELOPMENT LIMITED
港隆國際發展有限公司",2002-04-17,2010-07-09,"Private, ltd by shares"195,0793510,"HK TISSILE LIGHTING CO., LIMITED
香港天時利燈飾有限公司",2002-04-17,2009-07-10,"Private, ltd by shares"196,0793571,"HK WOLFTIME (CHINA) CHAIN REGIE DEV. LIMITED
香港狼情歲月(中國)連鎖專賣發展有限公司",2002-04-17,2007-08-31,"Private, ltd by shares"197,0793693,"HOLIDAY MEDIA INT'L HOLDING LIMITED
假日傳媒國際集團有限公司",2002-04-17,2004-10-29,"Private, ltd by shares"198,0793461,"HON PO (CHINA) CATERING MANAGEMENT LIMITED
漢寶(中國)飲食管理有限公司",2002-04-17,2017-09-15,"Private, ltd by shares"199,0793553,"HONCA INVESTMENT LIMITED
高嘉投資有限公司",2002-04-17,2018-11-16,"Private, ltd by shares"200,0793448,"HONG KONG (INTERNATIONAL) ONE DRAGON GROUP LIMITED
香港(國際)一條龍集團有限公司",2002-04-17,2010-03-05,"Private, ltd by shares"201,0793602,"HONG KONG ANGEL HOUSE INTERIOR DESIGN CO., LIMITED
香港天使居室內設計有限公司",2002-04-17,2007-08-31,"Private, ltd by shares"202,0793470,"HONG KONG APPLE INTERNATIONAL FASHION GROUP COMPANY LIMITED
香港蘋果國際服飾集團有限公司",2002-04-17,2007-08-31,"Private, ltd by shares"203,0793426,"HONG KONG BOLANG ENTERPRISE DEV'T LIMITED
香港搏浪企業發展有限公司",2002-04-17,2008-10-03,"Private, ltd by shares"204,0793704,"HONG KONG CULTURE ASSOCIATION CHARITABLE FOUNDATION LIMITED
香港各界文化促進會慈善基金有限公司",2002-04-17,,"Ltd by guarantee"205,0793528,"HONG KONG GOTUN INTERNATIONAL PAINT CO., LIMITED
香港喬頓國際塗料有限公司",2002-04-17,2009-09-25,"Private, ltd by shares"206,0793523,"HONG KONG HA LUO DE FURNITURE GROUP LIMITED
香港哈羅德傢俱集團有限公司",2002-04-17,2007-08-31,"Private, ltd by shares"207,0793620,"HONG KONG JARZTIN FOOTWEAR GROUP CO LIMITED
香港佐治天奴鞋業集團有限公司",2002-04-17,2007-08-31,"Private, ltd by shares"208,0793543,"HONG KONG LANGTE LIGHTING TECHNOLOGY INDUSTRIES LIMITED
香港朗特照明科技實業有限公司",2002-04-17,2015-06-05,"Private, ltd by shares"209,0793544,"HONG KONG LOSS AND RECOVERY ASSOCIATION LIMITED
香港權益索償協會有限公司",2002-04-17,2007-08-31,"Private, ltd by shares"