,Reg no.,Name,Incorp-orated,Dissolved,Type1,1718362,"1CENT LIMITED
億分有限公司",2012-03-19,2019-10-04,"Private, ltd by shares"2,1718204,"28 HOLDINGS LIMITED
28控股有限公司",2012-03-19,,"Private, ltd by shares"3,1718175,"3U SPORTS GOODS CO., LIMITED
三友體育用品有限公司",2012-03-19,2019-12-20,"Private, ltd by shares"4,1718334,"620 INTERNATIONAL LIMITED
620 國際有限公司",2012-03-19,2016-12-23,"Private, ltd by shares"5,1718357,"86RESEARCH LIMITED
八六證券研究有限公司",2012-03-19,,"Private, ltd by shares"6,1718117,"a.kho Limited",2012-03-19,,"Private, ltd by shares"7,1718345,"AAT (American Advanced Technology) Limited",2012-03-19,2018-12-21,"Private, ltd by shares"8,1718235,"AbbVie Limited
艾伯維有限公司",2012-03-19,,"Private, ltd by shares"9,1718381,"Achiever Mobile Limited",2012-03-19,2018-04-06,"Private, ltd by shares"10,1718064,"ACM CREATION LIMITED
艾美創藝有限公司",2012-03-19,,"Private, ltd by shares"11,1718285,"ACTIVE WORLD LIMITED (d2015-11-20)",2012-03-19,2015-11-20,"Private, ltd by shares"12,1718177,"Affluenzial Time Real Property Company Limited
建興地產有限公司",2012-03-19,2018-01-12,"Private, ltd by shares"13,1718073,"AIRWORLD ELECTRONICS CO., LIMITED
晨峰電子有限公司",2012-03-19,2018-08-31,"Private, ltd by shares"14,1718126,"ALLDO INDUSTRIAL DEVELOPING CO., LIMITED
奧都實業發展有限公司",2012-03-19,,"Private, ltd by shares"15,1718196,"ALLIANCE INDUSTRIAL MATERIALS LIMITED",2012-03-19,2014-09-05,"Private, ltd by shares"16,1718227,"ALMEX OVERSEAS (HK) LIMITED",2012-03-19,2019-01-04,"Private, ltd by shares"17,1718225,"AMAZE SYMBOL GARMENTS GROUP CO., LIMITED
九鼎服飾集團有限公司",2012-03-19,2018-12-21,"Private, ltd by shares"18,1718036,"ANHUI ANQING SHUGUANG CHEMICAL CO., LIMITED",2012-03-19,,"Private, ltd by shares"19,1718317,"ANJI CONSTAR FURNITURE CO., LIMITED
安吉康仕達家具有限公司",2012-03-19,2015-05-08,"Private, ltd by shares"20,1718174,"AONE SCOVILL (INVESTMENT) CO., LIMITED
恩旺使扣美(投資)有限公司",2012-03-19,2015-11-13,"Private, ltd by shares"21,1718360,"Ark Capital International Group Limited
資本方舟國際集團有限公司",2012-03-19,,"Private, ltd by shares"22,1718047,"ARP RIBBONS &amp; CRAFTS CO., LIMITED
艾博織帶飾品有限公司",2012-03-19,,"Private, ltd by shares"23,1717986,"Arrows Workshop Limited (The)
亞勞仕工作室有限公司",2012-03-19,,"Private, ltd by shares"24,1718021,"Artist (H.K.) Limited (The)",2012-03-19,,"Private, ltd by shares"25,1718296,"ASIA MAX INTERNATIONAL TRADING LIMITED
亞洲麥科斯國際貿易有限公司",2012-03-19,,"Private, ltd by shares"26,1718351,"ASIAN HONG XIANG (HONG KONG) CO., LIMITED
亞洲鴻翔(香港)有限公司",2012-03-19,2014-09-12,"Private, ltd by shares"27,1718277,"ASRONE INTERNATIONAL LIMITED
愛思諾國際有限公司",2012-03-19,2018-08-17,"Private, ltd by shares"28,1718065,"ASTEROIDS CORPORATION LIMITED
星薈貿易有限公司",2012-03-19,2013-06-21,"Private, ltd by shares"29,1718252,"AVD (HK) ELECTRONIC CO., LIMITED",2012-03-19,,"Private, ltd by shares"30,1718333,"Banyan Tree Mkg (HK) Limited",2012-03-19,,"Private, ltd by shares"31,1718029,"BBN IMPORT &amp; EXPORT COMPANY LIMITED
堡耐進出口有限公司",2012-03-19,,"Private, ltd by shares"32,1718276,"BC Media Company Limited
博智紅山媒體有限公司",2012-03-19,2016-11-11,"Private, ltd by shares"33,1718218,"BEIJING YING ZHOU TENG YE MARKETING CONSULTANTS LIMITED
北京盈舟騰業營銷顧問有限公司",2012-03-19,2015-11-13,"Private, ltd by shares"34,1718031,"BELLI BUILDING MATERIALS (CHINA) CO., LIMITED
美國拜利建材(中國)有限公司",2012-03-19,,"Private, ltd by shares"35,1718230,"BESEEM (HK) INDUSTRIAL DEVELOPMENT LIMITED
品信(香港)實業發展有限公司",2012-03-19,,"Private, ltd by shares"36,1718142,"BEST EASTERN INTERNATIONAL TRADING LIMITED
百斯特國際貿易有限公司",2012-03-19,,"Private, ltd by shares"37,1718298,"BESTAO INTERNATIONAL DEVELOPMENT CO., LIMITED
精道世家國際發展有限公司",2012-03-19,,"Private, ltd by shares"38,1718223,"BESTDEALS DEL CARIBE LIMITED",2012-03-19,2019-12-20,"Private, ltd by shares"39,1717991,"Beta Field Global Investment Limited
必偉環球投資有限公司",2012-03-19,,"Private, ltd by shares"40,1718160,"BLACKSTONE HOLDINGS GROUP CO., LIMITED
百仕控股集團有限公司",2012-03-19,2015-06-12,"Private, ltd by shares"41,1718164,"BLANCO &amp; LYNDS FINE WINES DISTRIBUTORS LIMITED",2012-03-19,2016-11-11,"Private, ltd by shares"42,1718108,"BLOSSOM WELL INTERNATIONAL LIMITED
通盛國際有限公司",2012-03-19,2018-03-16,"Private, ltd by shares"43,1718299,"BO SHENG GROUPS (HONG KONG) LIMITED
博盛集團(香港)有限公司",2012-03-19,,"Private, ltd by shares"44,1718055,"BP (CHINA) LIMITED",2012-03-19,2014-12-12,"Private, ltd by shares"45,1718328,"Buxum (HK) Limited",2012-03-19,2019-12-20,"Private, ltd by shares"46,1718257,"CAB HOLDINGS (HONG KONG) LIMITED",2012-03-19,,"Private, ltd by shares"47,1718212,"CAN BEST CONSULTING LIMITED
凱佰特諮詢有限公司",2012-03-19,2017-02-03,"Private, ltd by shares"48,1718176,"CAPITAL LIN (HK) INTERNATIONAL TRADE LIMITED
凱比特林國際貿易有限公司",2012-03-19,2016-11-11,"Private, ltd by shares"49,1718231,"CARBON 3MILLE LIMITED",2012-03-19,,"Private, ltd by shares"50,1718015,"CARIAD APPAREL COMPANY LIMITED
嘉和洋時裝有限公司",2012-03-19,2016-02-05,"Private, ltd by shares"51,1718327,"CARMEN LOGISTICS LIMITED
裕豪物流有限公司",2012-03-19,,"Private, ltd by shares"52,1717998,"CENTRAL ORE COMPANY LIMITED
中心礦業有限公司",2012-03-19,,"Private, ltd by shares"53,1718165,"CENTRE ORIGIN CO., LIMITED
中心技術有限公司",2012-03-19,2019-12-27,"Private, ltd by shares"54,1718306,"CENTURY ENGINEERING (HK) LIMITED
世紀工程(香港)有限公司",2012-03-19,,"Private, ltd by shares"55,1718028,"CHELSEA INTERNATIONAL HOLDINGS LIMITED
卓思國際控股有限公司",2012-03-19,2014-10-24,"Private, ltd by shares"56,1718053,"CHENGBAO INTERNATIONAL HOLDINGS LIMITED
城寶國際控股有限公司",2012-03-19,,"Private, ltd by shares"57,1718173,"Chia Meng Holding Limited
佳盟控股有限公司",2012-03-19,,"Private, ltd by shares"58,1718309,"CHIN TECH INDUSTRIAL CO., LIMITED
香港沁泰工業有限公司",2012-03-19,2015-11-13,"Private, ltd by shares"59,1718228,"CHINA CHARM GEMS CO. LIMITED",2012-03-19,2016-08-26,"Private, ltd by shares"60,1718118,"CHINA ENTERTAINMENT HOLDINGS LIMITED
中娛控股有限公司",2012-03-19,2016-11-11,"Private, ltd by shares"61,1718043,"CHINA GREAT WALL STOCK INDUSTRY CO., LIMITED
中國長城股份實業有限公司",2012-03-19,2015-11-13,"Private, ltd by shares"62,1718371,"CHINA GREEN GIANT MANAGEMENT COLLEGE LIMITED
中國綠色巨人管理學院有限公司",2012-03-19,,"Private, ltd by shares"63,1718321,"China Incense Appreciation Society Limited
中華香道文化研究學會有限公司",2012-03-19,2014-10-03,"Private, ltd by shares"64,1718322,"CHINA INTERNATIONAL MEDIA GROUP (HK) LIMITED
中國國際傳媒集團(香港)有限公司",2012-03-19,2018-12-21,"Private, ltd by shares"65,1718054,"CHINA JIAYI INVESTMENT CO., LIMITED
中國家壹投資有限公司",2012-03-19,2016-02-12,"Private, ltd by shares"66,1718113,"CHINA MANGO MEDIA GROUP LIMITED
中國芒果傳媒集團有限公司",2012-03-19,2015-11-13,"Private, ltd by shares"67,1718237,"CHINA OCEAN GROUP LOGISTICS CO., LIMITED
德航集團國際貨運代理有限公司",2012-03-19,2019-09-06,"Private, ltd by shares"68,1718293,"CHINA PAIN RESEARCH CO., LIMITED
中國疼痛研究會有限公司",2012-03-19,2015-11-13,"Private, ltd by shares"69,1718023,"CHINA PERFECT MACHINERY INDUSTRY CORP., LIMITED",2012-03-19,,"Private, ltd by shares"70,1717977,"CHINA PILLAR STONE FOUNDATION LIMITED
中國柱石基金會有限公司",2012-03-19,,"Ltd by guarantee"71,1717984,"CHINA TIANZUN INT'L GROUP LIMITED
中國天尊國際集團有限公司",2012-03-19,,"Private, ltd by shares"72,1718283,"CHINA YIYUANTONG GROUP CO., LIMITED
中國億源通集團有限公司",2012-03-19,2015-11-13,"Private, ltd by shares"73,1718041,"CHINA-FRANCE MOUTAI RED (FINE WINE) LIMITED
中法茅台紅(酒業)有限公司",2012-03-19,2015-11-13,"Private, ltd by shares"74,1718313,"CHINAFAITH ELECTRONICS CO., LIMITED
華信通電子有限公司",2012-03-19,,"Private, ltd by shares"75,1718179,"CHUANGSHENG (HONG KONG) PROCESS GIFT CO., LIMITED
創勝(香港)工藝禮品有限公司",2012-03-19,,"Private, ltd by shares"76,1718215,"CHURCHILL PROPERTY AGENCY LIMITED
綽譽物業代理有限公司",2012-03-19,2015-09-11,"Private, ltd by shares"77,1718105,"CJK PEACE DEVELOPMENT ASSOCIATION LIMITED
中日韓和平發展聯合會有限公司",2012-03-19,,"Private, ltd by shares"78,1718325,"CleanSea Administration Limited",2012-03-19,2015-07-03,"Private, ltd by shares"79,1718052,"COBERSUN (CHINA) OUTDOORS SERVICE LIMITED
科博(中國)戶外用品有限公司",2012-03-19,2017-11-03,"Private, ltd by shares"80,1718096,"COFCO INTERNATIONAL GROUP FERTILIZERS LIMITED
中糧國際集團化肥有限公司",2012-03-19,2017-11-03,"Private, ltd by shares"81,1718022,"Columbia Hospital Investment (HK) Limited",2012-03-19,,"Private, ltd by shares"82,1718107,"CONCEPTS CONSULTING LIMITED (HK)
大觀站有限公司",2012-03-19,,"Private, ltd by shares"83,1718109,"CooTek HongKong Limited",2012-03-19,,"Private, ltd by shares"84,1718193,"CORE RESOURCE GROUP LIMITED
同盛國際有限公司",2012-03-19,,"Private, ltd by shares"85,1718129,"D-LIZ-YUS COMPANY LIMITED",2012-03-19,,"Private, ltd by shares"86,1718272,"D.K.D. INTERNATIONAL CO., LIMITED",2012-03-19,2016-08-05,"Private, ltd by shares"87,1718026,"DAOKANGNING SEALANT LIMITED
道康寧密封膠有限公司",2012-03-19,2018-08-10,"Private, ltd by shares"88,1718182,"DDK INTERNATIONAL LIMITED (HK)",2012-03-19,,"Private, ltd by shares"89,1718134,"Discovery Infosystem (Hong Kong) Limited",2012-03-19,2015-11-13,"Private, ltd by shares"90,1718060,"DIVATEK LIMITED",2012-03-19,,"Private, ltd by shares"91,1718131,"DONQUIJOTE COMPANY LIMITED
烔螣貿易有限公司",2012-03-19,2013-12-27,"Private, ltd by shares"92,1718307,"Dragon DECO HQ Limited",2012-03-19,2018-11-23,"Private, ltd by shares"93,1718081,"DRAGON FINE DESIGN LIMITED
青林設計有限公司",2012-03-19,,"Private, ltd by shares"94,1718326,"DREAMBEAR ELECTRONICS CO., LIMITED
夢幻熊電子有限公司",2012-03-19,2020-01-03,"Private, ltd by shares"95,1718046,"DTL SERVICE LIMITED",2012-03-19,2017-11-03,"Private, ltd by shares"96,1718255,"EIGHT PO ENGINEERING CO., LIMITED
八宝工程有限公司",2012-03-19,2013-10-25,"Private, ltd by shares"97,1718248,"ESTY COMPANY LIMITED
華米有限公司",2012-03-19,,"Private, ltd by shares"98,1718330,"ETITAN TECHNOLOGIES CO., LIMITED
億天科技有限公司",2012-03-19,,"Private, ltd by shares"99,1718210,"EXCELLENT PIPELINE TECHNOLOGY &amp; ENGINEERING LIMITED
俊威管道科技工程有限公司",2012-03-19,,"Private, ltd by shares"100,1718149,"Excelsior Hardware &amp; Plastic Products Limited
香港鼎晟五金塑膠製品有限公司",2012-03-19,,"Private, ltd by shares"101,1718318,"EXTREME PRO WAXING CENTER LIMITED
愛美仕專業汽車美容中心有限公司",2012-03-19,2014-03-14,"Private, ltd by shares"102,1718180,"FA TIARA AND COSTUME JEWELLERY LIMITED
英姿首飾有限公司",2012-03-19,2016-12-02,"Private, ltd by shares"103,1718120,"Fabrik Corporation Limited",2012-03-19,,"Private, ltd by shares"104,1718358,"FiCV Limited",2012-03-19,2015-10-02,"Private, ltd by shares"105,1718190,"FINATRAX HOLDING GROUP LIMITED",2012-03-19,,"Private, ltd by shares"106,1718259,"FIYA FURNITURE (HK) LIMITED
香港飛亞家俱有限公司",2012-03-19,,"Private, ltd by shares"107,1718368,"Fly &amp; Flow Trading Limited
東南飛貿易有限公司",2012-03-19,2018-04-06,"Private, ltd by shares"108,1718365,"Flying Boat Trading Co., Limited
飛一般貿易有限公司",2012-03-19,,"Private, ltd by shares"109,1718153,"FORBETTER INTERNATIONAL LIMITED
福百特國際投資有限公司",2012-03-19,,"Private, ltd by shares"110,1718382,"FORE CABIN INT'L ENTERPRISES LIMITED
思遠國際企業有限公司",2012-03-19,2014-10-31,"Private, ltd by shares"111,1718356,"Fortune Global Holding (HK) Limited",2012-03-19,2017-11-03,"Private, ltd by shares"112,1718083,"FOSHAN YIYIN TRADING CO., LIMITED
佛山溢銀貿易有限公司",2012-03-19,,"Private, ltd by shares"113,1718095,"FRANCE PIERRE CARDIN BRAND DRESS LIMITED
法國皮爾卡丹品牌服飾有限公司",2012-03-19,2016-11-11,"Private, ltd by shares"114,1718266,"Fung Bong Trading (Hong Kong) Company Limited
豐邦進出口貿易(香港)有限公司",2012-03-19,2019-12-20,"Private, ltd by shares"115,1718051,"FUTURE HOUSE INTERNATIONAL LIMITED",2012-03-19,2015-11-20,"Private, ltd by shares"116,1718374,"FX ONE BULLION LIMITED
日本網絡通貴金屬有限公司",2012-03-19,2015-03-20,"Private, ltd by shares"117,1718352,"G.P. Jade Limited
太嘉翡翠有限公司",2012-03-19,,"Private, ltd by shares"118,1717999,"GLORY WEALTH INVESTMENT TRADING LIMITED
佳盈運投資貿易有限公司",2012-03-19,,"Private, ltd by shares"119,1717997,"GMFLO TECHNOLOGY LIMITED",2012-03-19,,"Private, ltd by shares"120,1718281,"GO TO RESOURCES HOLDINGS CO., LIMITED
國拓資源控股有限公司",2012-03-19,,"Private, ltd by shares"121,1718348,"GOGOSHARE GROUP TECHNOLOGY CO., LIMITED
香港倍享科技集團有限公司",2012-03-19,,"Private, ltd by shares"122,1718161,"GOLDEN MARK PROPERTY LIMITED
金律置業有限公司",2012-03-19,,"Private, ltd by shares"123,1718338,"GRACE BAKING WORKSHOP LIMITED
恩典烘焙工作坊有限公司",2012-03-19,,"Private, ltd by shares"124,1718246,"GRACE DRAGON INTERNATIONAL GROUP LIMITED
欣龍國際集團有限公司",2012-03-19,2018-12-21,"Private, ltd by shares"125,1718288,"GREAT DRAGON INTERNATIONAL TRADING SD CO., LIMITED
大龍國際貿易有限公司",2012-03-19,2016-11-11,"Private, ltd by shares"126,1718372,"Great Mountain (HK) Trading Co. Limited
大山行（香港）貿易有限公司",2012-03-19,,"Private, ltd by shares"127,1718233,"GREENBIZ LIMITED (HK)
香港綠利有限公司",2012-03-19,,"Private, ltd by shares"128,1718242,"Greener Pastures Limited (HK)
悠然綠原有限公司",2012-03-19,,"Private, ltd by shares"129,1718221,"GUANG XIN TRADING COMPANY LIMITED
廣鑫貿易有限公司",2012-03-19,2018-12-21,"Private, ltd by shares"130,1718089,"GUANGDONG FOSHAN KAILISI CERAMICS LIMITED
廣東佛山凱麗斯陶瓷有限公司",2012-03-19,2015-11-13,"Private, ltd by shares"131,1718076,"GUANGDONG FOSHAN SANUOSHI CERAMIC LIMITED
廣東佛山薩諾獅陶瓷有限公司",2012-03-19,,"Private, ltd by shares"132,1718329,"GUANGWEI TOYS INDUSTRY CO., LIMITED
光威玩具有限公司",2012-03-19,,"Private, ltd by shares"133,1718170,"H.I.S. (China) Holding Co., Limited
秀(中國)控股有限公司",2012-03-19,,"Private, ltd by shares"134,1718275,"H.K. BAOSHAN INTERNATIONAL HOLDINGS GROUP COMPANY LIMITED
香港寶善國際控股集團有限公司",2012-03-19,2018-12-21,"Private, ltd by shares"135,1718250,"Ha Wan Limited",2012-03-19,,"Private, ltd by shares"136,1718101,"HACKLIN CHINA LIMITED",2012-03-19,,"Private, ltd by shares"137,1718287,"HAIZHIRUN EDUCATION GROUP CO., LIMITED
海之潤教育集團有限公司",2012-03-19,2015-11-13,"Private, ltd by shares"138,1718354,"HAPPY TRAVELLER CARS CLUB (HONG KONG) LIMITED
天下惠通汽車俱樂部(香港)有限公司",2012-03-19,,"Private, ltd by shares"139,1718127,"HEALTH MATE (HK) INTERNATIONAL COMPANY LIMITED
健康伙伴國際有限公司",2012-03-19,,"Private, ltd by shares"140,1718044,"HEBEI PENGHAI BIOLOGICAL (HK) INTERNATIONAL TRADING LIMITED
河北朋海生物(香港)國際貿易有限公司",2012-03-19,2015-11-13,"Private, ltd by shares"141,1718146,"HEBEI TIANYUN BIOLOGICAL (HK) INTERNATIONAL TRADING LIMITED
河北天運生物(香港)國際貿易有限公司",2012-03-19,2015-11-13,"Private, ltd by shares"142,1718185,"Hengfeng International Resources Limited
恆豐國際資源有限公司",2012-03-19,,"Private, ltd by shares"143,1717985,"Hentic Global Limited",2012-03-19,,"Private, ltd by shares"144,1718194,"HIGH LIGHT TECH-TRADE CO., LIMITED
海來國際科貿有限公司",2012-03-19,2018-12-21,"Private, ltd by shares"145,1717980,"HITTATSU TRADING (HK) CO., LIMITED
必達商社(香港)有限公司",2012-03-19,2014-12-19,"Private, ltd by shares"146,1718135,"HK HAOTIAN PETROLEUM TECHNOLOGY INDUSTRY CO., LIMITED
香港昊天石油科技實業有限公司",2012-03-19,2019-05-10,"Private, ltd by shares"147,1718274,"HK HENG ZUAN SHI JIA JEWELRY LIMITED
香港恒鑽世家珠寶有限公司",2012-03-19,2018-12-21,"Private, ltd by shares"148,1718088,"HK HENGLIDA INVESTMENT CO., LIMITED
香港恒利達投資有限公司",2012-03-19,2015-11-13,"Private, ltd by shares"149,1718192,"HK MELODY ENTERTAINMENT TECHNOLOGY CO., LIMITED
香港麥樂迪娛樂科技有限公司",2012-03-19,2018-09-21,"Private, ltd by shares"150,1718094,"HK PIKAZUNWANG INT'L GROUP (HOLDING) COMPANY LIMITED
香港皮卡尊王國際集團(控股)有限公司",2012-03-19,2019-12-20,"Private, ltd by shares"151,1718079,"HK SINO-TERRACE INTERNATIONAL HOTEL MANAGEMENT LIMITED
香港東方華庭國際酒店管理有限公司",2012-03-19,2016-09-02,"Private, ltd by shares"152,1718018,"HK WINNER INTERNATIONAL INDUSTRIAL CO., LIMITED
香港萬利國際實業有限公司",2012-03-19,,"Private, ltd by shares"153,1718030,"HK YUANHAO INT'L GROUP LIMITED
香港遠豪國際集團有限公司",2012-03-19,2017-11-03,"Private, ltd by shares"154,1718302,"HK ZHONG ZE INDUSTRIAL TECH CO., LIMITED
香港中澤實業科技有限公司",2012-03-19,2015-06-12,"Private, ltd by shares"155,1718168,"HO KWAN INDUSTRY (HK) LIMITED
浩群實業(香港)有限公司",2012-03-19,,"Private, ltd by shares"156,1718280,"HOLYEON GROUP CO., LIMITED
歐億安集團有限公司",2012-03-19,2019-06-14,"Private, ltd by shares"157,1718337,"Homerite International Limited",2012-03-19,2018-12-21,"Private, ltd by shares"158,1718063,"HONG DE BO YUAN DEVELOPMENT (HONG KONG) LIMITED
宏德博源香港發展有限公司",2012-03-19,2017-08-11,"Private, ltd by shares"159,1718315,"HONG KONG EXCEED GROUP LIMITED
香港越地集團有限公司",2012-03-19,,"Private, ltd by shares"160,1718125,"Hong Kong Green Planet Enviromental Equipment Co., Limited
香港綠行星環保設備有限公司",2012-03-19,,"Private, ltd by shares"161,1718208,"HONG KONG HONG SEN TRADE LIMITED
香港弘盛貿易有限公司",2012-03-19,,"Private, ltd by shares"162,1718148,"HONG KONG HUAXI PRINTING CO., LIMITED
香港華熙印刷有限公司",2012-03-19,,"Private, ltd by shares"163,1718057,"HONG KONG IMPERIAL COURT CULTURE AND ARTS LIMITED
香港紫禁宮苑文化藝術有限公司",2012-03-19,2015-08-07,"Private, ltd by shares"164,1718072,"HONG KONG LI QUAN MACHINE LIMITED
香港力泉機械有限公司",2012-03-19,2020-03-27,"Private, ltd by shares"165,1718087,"Hong Kong Mathematical Olympics Learning Company Limited (The)
香港奧數研習有限公司",2012-03-19,,"Private, ltd by shares"166,1718066,"Hong Kong Ming Xiang Shipping Co., Limited
香港銘翔航運有限公司",2012-03-19,,"Private, ltd by shares"167,1718077,"HONG KONG POLIN INVESTMENT COMPANY LIMITED",2012-03-19,2019-12-20,"Private, ltd by shares"168,1718037,"HONG KONG RUNJOY HOLDING GROUP CO., LIMITED
香港朗悅控股集團有限公司",2012-03-19,2018-12-14,"Private, ltd by shares"169,1717995,"HONG KONG SHU MEI XUAN FURNITURE INDUSTRY LIMITED
香港舒美軒家具實業有限公司",2012-03-19,,"Private, ltd by shares"170,1718115,"HONG KONG SUN THING LIMITED
香港順欣有限公司",2012-03-19,,"Private, ltd by shares"171,1718308,"HONG KONG SUNDEAL TECHNOLOGY CO., LIMITED
香港盛迪科技有限公司",2012-03-19,2014-10-03,"Private, ltd by shares"172,1718104,"HONG KONG SUNGO COMPANY LIMITED
香港賞高有限公司",2012-03-19,2016-06-30,"Private, ltd by shares"173,1718014,"HONG KONG TB INTERNATIONAL ELECTRONIC COMMERCE LIMITED
香港提巴國際電子商務有限公司",2012-03-19,2016-11-11,"Private, ltd by shares"174,1718384,"HONG KONG YE YEUNG TRADING LIMITED
香港伊揚貿易有限公司",2012-03-19,,"Private, ltd by shares"175,1718156,"Hong Kong Yi Qi Men Feng Shui Planning Limited
香港易奇門風水策劃有限公司",2012-03-19,2016-11-11,"Private, ltd by shares"176,1718251,"Hong Kong Zheng Wang International Company Limited
香港鄭旺國際集團有限公司",2012-03-19,,"Private, ltd by shares"177,1718260,"HongKong AsiaComm Co., Limited
香港亞訊有限公司",2012-03-19,,"Private, ltd by shares"178,1718152,"HongKong Century Energy Co., Limited
香港力天世紀能源有限公司",2012-03-19,2017-09-15,"Private, ltd by shares"179,1718130,"HONGKONG CHEN YANG INTERNATIONAL TRADING CO., LIMITED
香港宸陽國際貿易有限公司",2012-03-19,,"Private, ltd by shares"180,1718310,"HONGKONG LINGXIANG PHARMACEUTICAL INT'L LIMITED
香港伶翔藥業國際有限公司",2012-03-19,2019-09-13,"Private, ltd by shares"181,1718116,"Hongkong Messi Group Limited
香港美西電子集團有限公司",2012-03-19,2016-11-11,"Private, ltd by shares"182,1718102,"HONGKONG NEW RECORD INT'L EDUCATION GROUP LIMITED
香港新紀錄國際教育集團有限公司",2012-03-19,2015-11-13,"Private, ltd by shares"183,1718163,"HONGKONG QUANSHENG INVESTMENT GROUP CO., LIMITED
香港全勝投資集團有限公司",2012-03-19,2018-11-23,"Private, ltd by shares"184,1718012,"HongKong Shun Long International Logistics Limited
香港順隆國際物流有限公司",2012-03-19,2013-11-29,"Private, ltd by shares"185,1718011,"HONGKONG WANLONG HENGLI CONSULTANT LIMITED
香港萬龍恒利顧問有限公司",2012-03-19,2013-10-11,"Private, ltd by shares"186,1718027,"HONGKONG XINGUANLAN INDUSTRIAL (INTERNATIONAL) CO., LIMITED
香港新觀蘭實業(國際)有限公司",2012-03-19,2015-11-13,"Private, ltd by shares"187,1718098,"HONGKONG YIHAI SHIPPING SERVICE LIMITED
香港益海船務有限公司",2012-03-19,2015-11-13,"Private, ltd by shares"188,1718240,"HONGKONG ZENITH ELECTRONICS CO., LIMITED
香港巔峰電子有限公司",2012-03-19,2015-07-17,"Private, ltd by shares"189,1718136,"HOPER (HK) METAL TECHNOLOGY LIMITED
香港豪博金屬科技有限公司",2012-03-19,2016-02-12,"Private, ltd by shares"190,1718201,"HOPOWER TECHNOLOGY CO., LIMITED
禾電科技有限公司",2012-03-19,2019-06-21,"Private, ltd by shares"191,1718205,"HouseMart Holdings (HK) Co., Limited",2012-03-19,,"Private, ltd by shares"192,1718143,"HTK TECHNOLOGY LIMITED
華電高科技有限公司",2012-03-19,,"Private, ltd by shares"193,1718009,"HUA SHENG TECHNOLOGY GLOBAL LIMITED
華勝科技環球有限公司",2012-03-19,,"Private, ltd by shares"194,1718203,"HUAANDA (H.K) LIMITED
華安達(香港)有限公司",2012-03-19,,"Private, ltd by shares"195,1718376,"HuaXia Culture Co. Limited
華夏文化有限公司",2012-03-19,2015-07-24,"Private, ltd by shares"196,1718350,"Hung Fung Wui Metal Company Limited
鴻豐滙五金有限公司",2012-03-19,,"Private, ltd by shares"197,1718273,"HUNG KEI ENTERPRISE (HONG KONG) LIMITED
鴻基企業(香港)有限公司",2012-03-19,2018-07-13,"Private, ltd by shares"198,1718191,"HUNG SING TRADING (HK) CO., LIMITED
鴻星貿易(香港)有限公司",2012-03-19,2013-09-13,"Private, ltd by shares"199,1718024,"HUPAI HOLDINGS GROUP., LIMITED
虎牌控股集團有限公司",2012-03-19,2017-07-07,"Private, ltd by shares"200,1718050,"IDNOVELL LIMITED",2012-03-19,,"Private, ltd by shares"201,1718291,"IFCG LIMITED",2012-03-19,2019-09-20,"Private, ltd by shares"202,1718249,"IKON Clearing Corporation Limited",2012-03-19,,"Private, ltd by shares"203,1718017,"In-Vision Interior Design Company Limited
築野室內設計有限公司",2012-03-19,,"Private, ltd by shares"204,1718020,"INTERNATIONAL BRAND JEWELRY PRESIDENT CLUB INTERNATIONAL ALLIANCE GROUP CO., LIMITED
國際名牌珠寶總裁俱樂部國際聯盟集團有限公司",2012-03-19,,"Private, ltd by shares"205,1718303,"INTERNATIONAL INDUSTRY TRANSFER INVESTMENT CONSULTING LIMITED
國際產業轉移投資諮詢有限公司",2012-03-19,2017-11-03,"Private, ltd by shares"206,1718359,"International News Public Relations Holdings Limited
國際新聞公關集團有限公司",2012-03-19,,"Private, ltd by shares"207,1718312,"INTERNATIONAL NISHINIHON TRADING LIMITED
國際西日本商工有限公司",2012-03-19,2019-06-06,"Private, ltd by shares"208,1718171,"Internationalize me Limited",2012-03-19,2016-02-05,"Private, ltd by shares"209,1718353,"ION Chemicals Industries Co., Limited",2012-03-19,2014-02-28,"Private, ltd by shares"210,1718158,"Ireland Aijaer Soil Nutrition Center Co., Limited
愛爾蘭愛佳爾土壤營養中心有限公司",2012-03-19,2016-09-02,"Private, ltd by shares"211,1718364,"Iris Enterprises Limited (d2018-12-21)
艾睿思企業有限公司",2012-03-19,2018-12-21,"Private, ltd by shares"212,1718361,"ITALIAN STONE CO. LIMITED (THE)
意大利天然石有限公司",2012-03-19,2017-05-26,"Private, ltd by shares"213,1718119,"ITALY ROYALSTRONG INTERNATIONAL HOLDINGS CORPORATION LIMITED
意大利路易世尊國際控股集團有限公司",2012-03-19,,"Private, ltd by shares"214,1718222,"ITALY TESTONI FASHION CO., LIMITED
義大利鐵獅東尼服飾有限公司",2012-03-19,2018-12-21,"Private, ltd by shares"215,1718010,"ITRAN TRADING LIMITED",2012-03-19,2015-10-09,"Private, ltd by shares"216,1718070,"JACK TEXTILES CO., LIMITED
傑克紡織品有限公司",2012-03-19,2015-11-13,"Private, ltd by shares"217,1718042,"Jaguar Cool Chain Co., Limited
嘉達倉儲有限公司",2012-03-19,,"Private, ltd by shares"218,1718189,"JAPAN JMSTAR CO., LIMITED
日本杰士達株式會社有限公司",2012-03-19,2015-03-27,"Private, ltd by shares"