,Reg no.,Name,Incorp-orated,Dissolved,Type219,1718332,"JC INDUSTRIAL LIMITED
同安實業有限公司",2012-03-19,,"Private, ltd by shares"220,1718114,"JESON DEVELOPMENT (HK) LIMITED
捷森發展(香港)有限公司",2012-03-19,,"Private, ltd by shares"221,1718062,"JESSIBAER INTERNATIONAL CO., LIMITED
婕希貝爾國際有限公司",2012-03-19,2016-11-11,"Private, ltd by shares"222,1718289,"JIA RUI HONGKONG CORPORATION LIMITED
嘉瑞香港股份有限公司",2012-03-19,2018-08-10,"Private, ltd by shares"223,1718262,"JIABAO ELECTRIC APPLIANCE (HK) LIMITED
嘉寶電業有限公司",2012-03-19,2017-10-13,"Private, ltd by shares"224,1718220,"JIATONG INTERNATIONAL (HK) CO., LIMITED
嘉通國際(香港)有限公司",2012-03-19,2016-11-11,"Private, ltd by shares"225,1718144,"JIN DIAN INTERNATIONAL GROUP (HK) LIMITED
今典國際集團(香港)有限公司",2012-03-19,2016-02-12,"Private, ltd by shares"226,1718202,"JINGANG TRADING INDUSTRIAL LIMITED
金剛貿易實業有限公司",2012-03-19,2019-08-09,"Private, ltd by shares"227,1718188,"JINLIHAO UNDERWEAR IND. LIMITED
金利豪內衣實業有限公司",2012-03-19,2016-09-30,"Private, ltd by shares"228,1718304,"JIU TAI (HONG KONG) TRADING LIMITED
香港久泰貿易有限公司",2012-03-19,2015-11-13,"Private, ltd by shares"229,1718124,"JIUDING BARTER NETWORK TECHNOLOGY LIMITED
九鼎易物(香港)網絡科技股份有限公司",2012-03-19,2016-11-11,"Private, ltd by shares"230,1718270,"JPY INT'L TRADE (HK) CO., LIMITED
玖鵬源國際貿易(香港)有限公司",2012-03-19,2017-11-03,"Private, ltd by shares"231,1718090,"JUNHAO INT'L LIMITED
峻豪國際有限公司",2012-03-19,2015-11-13,"Private, ltd by shares"232,1718141,"JW GROUP INVESTMENT LIMITED
錦旭集團投資有限公司",2012-03-19,2016-07-08,"Private, ltd by shares"233,1718339,"K &amp; R MACHINERY LIMITED
溢駿機械有限公司",2012-03-19,,"Private, ltd by shares"234,1718099,"KABUR TRADING CO., LIMITED
卡布貿易有限公司",2012-03-19,2018-11-02,"Private, ltd by shares"235,1718319,"KGN INVESTMENT LIMITED
佳而安投資有限公司",2012-03-19,,"Private, ltd by shares"236,1718234,"Kidsart Limited (d2016-05-27)",2012-03-19,2016-05-27,"Private, ltd by shares"237,1718207,"Kindat Capital Limited",2012-03-19,2013-11-29,"Private, ltd by shares"238,1718139,"KINGLEX INTERNATIONAL INVESTMENT LIMITED
景源國際投資有限公司",2012-03-19,2017-05-12,"Private, ltd by shares"239,1718243,"KINGTAISHING CO., LIMITED
金泰盛有限公司",2012-03-19,2020-01-31,"Private, ltd by shares"240,1718278,"KOWAY TECHNOLOGY LIMITED
科慧科技有限公司",2012-03-19,2017-11-03,"Private, ltd by shares"241,1718004,"KRISHNA KOEMAR TRADING LIMITED",2012-03-19,,"Private, ltd by shares"242,1718217,"KUWEI TECHNOLOGY (HONGKONG) CO., LIMITED
酷微科技(香港)有限公司",2012-03-19,2015-11-13,"Private, ltd by shares"243,1718256,"LAN STRONG ELECTRONIC TECHNOLOGY CO., LIMITED
蘭．思創電子科技有限公司",2012-03-19,2016-11-11,"Private, ltd by shares"244,1718261,"LE YUE INTERNATIONAL HOLDINGS LIMITED
樂悅國際集團有限公司",2012-03-19,2017-11-03,"Private, ltd by shares"245,1718172,"LEAD SYOKAI, KABUSHIKIKAISHA LIMITED",2012-03-19,2015-11-20,"Private, ltd by shares"246,1718264,"LEADER IMPORT &amp; EXPORT CO., LIMITED
凝點進出口有限公司",2012-03-19,2017-11-03,"Private, ltd by shares"247,1718138,"Likho International Trading Limited
力和國際貿易有限公司",2012-03-19,2016-09-23,"Private, ltd by shares"248,1718071,"LIMON ASIA LIMITED
利盟亞洲有限公司",2012-03-19,,"Private, ltd by shares"249,1718336,"LITCOW Corporation Limited",2012-03-19,2020-04-03,"Private, ltd by shares"250,1718265,"LITUO INTERNATIONAL CO., LIMITED
力拓國際控股有限公司",2012-03-19,,"Private, ltd by shares"251,1718286,"LongTeng International Trading Co., Limited
隆騰國際貿易有限公司",2012-03-19,,"Private, ltd by shares"252,1717982,"LOW PRESSURE SYSTEM ASIA LIMITED",2012-03-19,,"Private, ltd by shares"253,1718110,"MACEDON HILL LIMITED
歷山行有限公司",2012-03-19,,"Private, ltd by shares"254,1718363,"MAFON (HONG KONG) CO., LIMITED",2012-03-19,2017-11-03,"Private, ltd by shares"255,1718355,"MAIN INTERNATIONAL LOGISTIC (HK) LIMITED
明斯克國際物流(香港)有限公司",2012-03-19,,"Private, ltd by shares"256,1718137,"MAN SHUN HING TRADING LIMITED
萬順興貿易有限公司",2012-03-19,2018-11-23,"Private, ltd by shares"257,1718349,"Masco Cabinetry Hong Kong Limited",2012-03-19,,"Private, ltd by shares"258,1718199,"MAYLINK INT'L (HK) CO., LIMITED
美霖國際(香港)有限公司",2012-03-19,,"Private, ltd by shares"259,1718040,"MCI Group (Shanghai) Pte. Limited
邁氏會展服務(上海)有限公司",2012-03-19,2013-08-16,"Private, ltd by shares"260,1718056,"MCONE (HONGKONG) LIMITED
邁鼎(香港)有限公司",2012-03-19,,"Private, ltd by shares"261,1718331,"MEGO INTERIOR DESIGN (HONG KONG) LIMITED
名高室內設計(香港)有限公司",2012-03-19,2020-05-15,"Private, ltd by shares"262,1718254,"Merchi International Trading Limited
美奇國際貿易有限公司",2012-03-19,,"Private, ltd by shares"263,1718258,"MICROSYS LIMITED (d2016-03-04)",2012-03-19,2016-03-04,"Private, ltd by shares"264,1718206,"MIDDLE PLASTIC (HONG KONG) CO., LIMITED
銘鼎塑膠有限公司",2012-03-19,2015-07-24,"Private, ltd by shares"265,1718061,"MILL'S GROUP BEVERAGE LIMITED
美時集團飲品有限公司",2012-03-19,,"Private, ltd by shares"266,1717996,"MING DAAT INTERNATIONAL TRADING COMPANY LIMITED
酩達國際貿易有限公司",2012-03-19,,"Private, ltd by shares"267,1718123,"MINSHANG CAPITAL CONSULTING LIMITED
民商資本顧問有限公司",2012-03-19,,"Private, ltd by shares"268,1718295,"Missen Industrial Co., Limited
米森實業有限公司",2012-03-19,,"Private, ltd by shares"269,1718145,"Mobilbox China Limited",2012-03-19,2019-07-05,"Private, ltd by shares"270,1718154,"Moonstar Technology Co., Limited
星月科技有限公司",2012-03-19,,"Private, ltd by shares"271,1718267,"MTI INTERNATIONAL LIMITED",2012-03-19,2016-05-06,"Private, ltd by shares"272,1718133,"Muuyu Limited",2012-03-19,2017-11-03,"Private, ltd by shares"273,1718184,"NAN HAI INTERNATIONAL ENERGY GROUP LIMITED
南海國際能源集團有限公司",2012-03-19,2015-11-13,"Private, ltd by shares"274,1718346,"NAN SHENG INDUSTRY AND TRADE CO., LIMITED
南盛工貿有限公司",2012-03-19,2018-09-07,"Private, ltd by shares"275,1718238,"NANFENG PATENT AGENT (H.K.) LIMITED
南鋒專利事務所(香港)有限公司",2012-03-19,,"Private, ltd by shares"276,1718178,"NAQING INTERNATIONAL TRADE CO., LIMITED
納青國際貿易有限公司",2012-03-19,2019-12-20,"Private, ltd by shares"277,1718147,"Nations Sun City Group Limited
萬國太陽城集團有限公司",2012-03-19,2016-11-11,"Private, ltd by shares"278,1718082,"NC-TOWN (INTERNATIONAL) E-COMMERCE HOLDINGS LIMITED
南希城(國際)電子商務控股有限公司",2012-03-19,2016-11-11,"Private, ltd by shares"279,1718166,"Nenco Limited",2012-03-19,2016-11-11,"Private, ltd by shares"280,1718305,"NESSCALL LIMITED",2012-03-19,2015-11-13,"Private, ltd by shares"281,1718279,"NEW HAIGUI ELITE ALLIANCE CO., LIMITED
新海歸精英聯盟有限公司",2012-03-19,2020-09-11,"Private, ltd by shares"282,1718181,"NEW YU TAI (HOLDINGS) DEVELOPMENT LIMITED
新裕泰(集團)發展有限公司",2012-03-19,,"Private, ltd by shares"283,1718367,"NEWCAP LIMITED (d2015-11-13)",2012-03-19,2015-11-13,"Private, ltd by shares"284,1718151,"NEWEAUSTER HONGKONG CO., LIMITED",2012-03-19,2014-03-28,"Private, ltd by shares"285,1718294,"NEX TRADE (HONGKONG) GROUP CO., LIMITED",2012-03-19,2019-11-08,"Private, ltd by shares"286,1718271,"NISSO INDONESIA RESOURCES (HONG KONG) CO. LIMITED
印尼日順礦業(香港)投資有限公司",2012-03-19,2017-11-03,"Private, ltd by shares"287,1718016,"NOAH (INTERNATIONAL) MEDICAL COSMETIC COMPANY LIMITED
諾亞(國際)醫學美容有限公司",2012-03-19,2018-12-21,"Private, ltd by shares"288,1718005,"NORHAD EQUIPMENT &amp; ENGINEERING CO., LIMITED
鍩海設備工程有限公司",2012-03-19,,"Private, ltd by shares"289,1718121,"NOUVEAU HORIZON BUSINESS CO., LIMITED
歐洲新視野商務有限公司",2012-03-19,2016-11-11,"Private, ltd by shares"290,1718232,"Opolo Tech (Hong Kong) LIMITED
歐普羅科技(香港)有限公司",2012-03-19,,"Private, ltd by shares"291,1718103,"ORANGE CATERING CHAIN MANAGEMENT GROUP (HK) LIMITED
橘舍連鎖餐飲管理集團(香港)有限公司",2012-03-19,2019-12-20,"Private, ltd by shares"292,1717979,"ORCHID INDUSTRIES ASIA LIMITED",2012-03-19,,"Private, ltd by shares"293,1718086,"OSCAR CHINA LIMITED (d2014-12-24)
奧斯卡中國有限公司",2012-03-19,2014-12-24,"Private, ltd by shares"294,1718314,"OZ COSMETICS CO., LIMITED",2012-03-19,2018-10-05,"Private, ltd by shares"295,1718214,"PARALLAX PERCEPTIONS LIMITED",2012-03-19,2014-03-07,"Private, ltd by shares"296,1718239,"POLICY LIMITED
策略控股有限公司",2012-03-19,,"Private, ltd by shares"297,1718097,"Poobo (HK) Technologies Co., Limited
香港普波科技有限公司",2012-03-19,,"Private, ltd by shares"298,1718335,"PRETTYBOOKED LIMITED",2012-03-19,2015-04-02,"Private, ltd by shares"299,1718132,"Primus Holdings (H.K.) Limited",2012-03-19,2019-01-04,"Private, ltd by shares"300,1718219,"PSS GROUP LIMITED (d2015-11-13)",2012-03-19,2015-11-13,"Private, ltd by shares"301,1718162,"PSY LIGHTING (HK) LIMITED
菩盛源照明(香港)有限公司",2012-03-19,,"Private, ltd by shares"302,1718324,"PTH (HK) LIMITED
保達行(香港)有限公司",2012-03-19,,"Private, ltd by shares"303,1718128,"Pure Pure Group Co., Limited
丹雪集團有限公司",2012-03-19,2018-12-21,"Private, ltd by shares"304,1718000,"PURISCENT LIMITED
飄盈香有限公司",2012-03-19,,"Private, ltd by shares"305,1718198,"Putney Trading Co., Limited
普特力貿易有限公司",2012-03-19,2015-10-02,"Private, ltd by shares"306,1718284,"QIAN LONG INTERNATIONAL (CHINA) HOLDING GROUP LIMITED
錢龍國際(中國)控股集團有限公司",2012-03-19,2015-11-13,"Private, ltd by shares"307,1718282,"QUANTA BUSINESS LIMITED",2012-03-19,,"Private, ltd by shares"308,1718323,"Quantum Capital Unlimited HK Limited",2012-03-19,2016-11-11,"Private, ltd by shares"309,1718035,"RARA INTERNATIONAL CO., LIMITED",2012-03-19,,"Private, ltd by shares"310,1718019,"RASA Consulting Limited (d2018-09-14)",2012-03-19,2018-09-14,"Private, ltd by shares"311,1718048,"RED HORSE INVESTMENT GROUP (HK) CO., LIMITED
瑞德昊思投資集團(香港)有限公司",2012-03-19,2017-11-03,"Private, ltd by shares"312,1718034,"RIGHTON ELECTRONICS CO., LIMITED
瑞昂電子有限公司",2012-03-19,2013-07-26,"Private, ltd by shares"313,1718169,"RUIFENG INDUSTRIAL LIMITED
瑞丰實業有限公司",2012-03-19,,"Private, ltd by shares"314,1718100,"RUSSIA KUERSITAN CHEMICAL INDUSTRY GROUP LIMITED
俄羅斯庫爾斯坦化工集團有限公司",2012-03-19,2015-11-13,"Private, ltd by shares"315,1718366,"S &amp; Z Brothers (HK) Limited",2012-03-19,2015-11-13,"Private, ltd by shares"316,1717978,"SAATCHI SUNSHINE INTERNATIONAL MEDIA GROUP CO., LIMITED
盛世陽光國際傳媒(集團)有限公司",2012-03-19,2015-11-13,"Private, ltd by shares"317,1718059,"SABEYA DEVELOPING &amp; INVESTMENT CO., LIMITED (d2016-07-15)
薩比亞發展投資有限公司",2012-03-19,2016-07-15,"Private, ltd by shares"318,1718069,"SAN FU INTERNATIONAL LIMITED
三福國際有限公司",2012-03-19,2016-11-11,"Private, ltd by shares"319,1718157,"Sanchuan (HK) Chemical Technology Limited
三川(香港)化工科技有限公司",2012-03-19,,"Private, ltd by shares"320,1718195,"SENSONOR AS (HK) LIMITED
挪傳科技(香港)有限公司",2012-03-19,2018-07-13,"Private, ltd by shares"321,1718311,"SERS GOLD LIMITED
協薾獅有限公司",2012-03-19,2016-02-12,"Private, ltd by shares"322,1718106,"SERVERS WORLD WIDE LIMITED",2012-03-19,2016-04-15,"Private, ltd by shares"323,1717987,"SEVERIN QUALITY CONTROL LIMITED",2012-03-19,2015-03-27,"Private, ltd by shares"324,1718091,"SHANG HAI BEI JI SHAN FINERY CO., LIMITED
上海北極杉服飾有限公司",2012-03-19,2016-11-11,"Private, ltd by shares"325,1718093,"SHANGHAI MIANYUAN TEXTILE CO., LIMITED (d2015-11-13)
上海棉園紡織品有限公司",2012-03-19,2015-11-13,"Private, ltd by shares"326,1718253,"SHANGHAI SND (HONGKONG) INDUSTRY LIMITED
公司註冊編號 1718253 有限公司",2012-03-19,2015-11-13,"Private, ltd by shares"327,1718078,"Shangrila-Red (Hong Kong) International Investment Limited
香格里紅(香港)國際投資有限公司",2012-03-19,2015-10-02,"Private, ltd by shares"328,1718341,"SHENG YING TOYS COMPANY LIMITED
盛盈玩具有限公司",2012-03-19,,"Private, ltd by shares"329,1718112,"SHENZHEN SHUNTIAN INTERNATIONAL ELECTRONIC CO., LIMITED
深圳市順天國際電子有限公司",2012-03-19,2015-11-13,"Private, ltd by shares"330,1718269,"SHENZHEN YOUTUMALL TECHNOLOGY CO., LIMITED
深圳優途夢科技有限公司",2012-03-19,2017-06-30,"Private, ltd by shares"331,1718074,"SHENZHEN ZHIGAOQIANG COMMERCE LIMITED
深圳市芝高強貿易有限公司",2012-03-19,2019-12-20,"Private, ltd by shares"332,1718292,"SHIN MYUNG COMPANY LIMITED",2012-03-19,2019-04-18,"Private, ltd by shares"333,1718187,"SHIXIANG INTERNATIONAL GROUP LIMITED
實相國際集團有限公司",2012-03-19,2015-11-13,"Private, ltd by shares"334,1718297,"SHUCHAYE CONSULTANCY SERVICES PVT. LIMITED",2012-03-19,2016-03-18,"Private, ltd by shares"335,1718379,"Sino Culture Research Institute &amp; Academy Co. Limited
華夏文化研究院學院有限公司",2012-03-19,2015-07-24,"Private, ltd by shares"336,1718320,"SINOSAIL INTERNATIONAL LIMITED
中賽爾國際有限公司",2012-03-19,,"Private, ltd by shares"337,1718007,"SINOSKY INTERNATIONAL INVESTMENT (GROUPS) LIMITED
華天國際投資(控股)有限公司",2012-03-19,2016-05-06,"Private, ltd by shares"338,1717981,"SINOTECH SCIENCE &amp; TECHNOLOGY (HONG KONG) CO., LIMITED
凌和科技(香港)有限公司",2012-03-19,,"Private, ltd by shares"339,1718049,"SITON INTERNATIONAL TRADING LIMITED
四通國際貿易有限公司",2012-03-19,2015-11-13,"Private, ltd by shares"340,1718075,"SKY INTERNATIONAL GROUP LIMITED (d2018-02-15)",2012-03-19,2018-02-15,"Private, ltd by shares"341,1718150,"SKY TEXTILES HOLDINGS LIMITED
天峰紡織控股有限公司",2012-03-19,,"Private, ltd by shares"342,1718025,"SMARTWELL FOOTWEAR MANUFACTURING LIMITED
聰盈鞋業有限公司",2012-03-19,2019-11-22,"Private, ltd by shares"343,1718268,"Spain Vitobest Limited
西班牙維托貝斯特有限公司",2012-03-19,,"Private, ltd by shares"344,1718067,"SSCC OIL ENGINEERING SERVICE LIMITED
勝油石油技術服務有限公司",2012-03-19,,"Private, ltd by shares"345,1718370,"STEED (HK) INDUSTRY &amp; TRADING LIMITED
升駿工貿(香港)有限公司",2012-03-19,2017-05-19,"Private, ltd by shares"346,1718111,"STEVIA ASIA LIMITED
施威雅亞洲控股有限公司",2012-03-19,2017-12-22,"Private, ltd by shares"347,1717988,"STYLE &amp; SYSTEM CO., LIMITED
元野設計有限公司",2012-03-19,,"Private, ltd by shares"348,1718140,"SUKANG TECH CO., LIMITED
塑康科技有限公司",2012-03-19,2013-11-08,"Private, ltd by shares"349,1718226,"SUN INDUSTRIAL HARDWARE CO., LIMITED
陽光工業五金有限公司",2012-03-19,2016-11-11,"Private, ltd by shares"350,1717990,"SUNDAY PRINTING COMPANY LIMITED
世達印刷有限公司",2012-03-19,2014-01-24,"Private, ltd by shares"351,1718229,"SUPER VICTORY DEVELOPMENT LIMITED
凱超發展有限公司",2012-03-19,2019-07-05,"Private, ltd by shares"352,1718216,"SWISS THUN SANITARY WARE TECHNOLOGY LIMITED
瑞士圖恩衛浴科技有限公司",2012-03-19,2017-11-03,"Private, ltd by shares"353,1718213,"TADU METAL LIMITED",2012-03-19,2016-11-11,"Private, ltd by shares"354,1717994,"TAK LIK INTERNATIONAL DEVELOPMENT COMPANY LIMITED
德力國際發展有限公司",2012-03-19,2017-03-17,"Private, ltd by shares"355,1718344,"TASTESQUARE MEDIA LIMITED",2012-03-19,2019-09-06,"Private, ltd by shares"356,1718122,"Techwin Precision (International) Limited
特可威科技有限公司",2012-03-19,,"Private, ltd by shares"357,1718241,"THEM CO. LIMITED",2012-03-19,,"Private, ltd by shares"358,1718209,"TIAN TIAN MOTORS LIMITED
天天車行有限公司",2012-03-19,2013-09-27,"Private, ltd by shares"359,1717983,"TOMMYPRO ACCOUNTANT LIMITED
專業會計行有限公司",2012-03-19,,"Private, ltd by shares"360,1717992,"Topaz Financial Group Limited
瑭明金融集團有限公司",2012-03-19,,"Private, ltd by shares"361,1718369,"TUNG PO INTERNATIONAL INVESTMENT LIMITED
東寶國際投資有限公司",2012-03-19,2017-11-03,"Private, ltd by shares"362,1718038,"ULYC (HONGKONG) PTE LIMITED
優利佳貿易有限公司",2012-03-19,,"Private, ltd by shares"363,1718045,"Unique Image Studio Limited
完美形象工作室有限公司",2012-03-19,,"Private, ltd by shares"364,1718236,"VARSIKA DESIGN &amp; ENGINEERING LIMITED
慧善家設計工程有限公司",2012-03-19,,"Private, ltd by shares"365,1718245,"VENUS CENTURY INTERNATIONAL TRADING LIMITED
福鑫世紀國際貿易有限公司",2012-03-19,2015-11-13,"Private, ltd by shares"366,1718290,"VENUS OPTO TECHNOLOGY CO., LIMITED",2012-03-19,,"Private, ltd by shares"367,1718159,"Vesa Alliance Corporation Limited
威三聯合有限公司",2012-03-19,2013-11-01,"Private, ltd by shares"368,1718039,"VICTORIA DEVELOPMENT LIMITED (d2013-09-27)
瑋達苡有限公司",2012-03-19,2013-09-27,"Private, ltd by shares"369,1718183,"VITALITY 4 LIFE LIMITED",2012-03-19,,"Private, ltd by shares"370,1718301,"Viwit Holdings Limited",2012-03-19,,"Private, ltd by shares"371,1718167,"WAH MEI TRADING LIMITED
華美貿易企業有限公司",2012-03-19,,"Private, ltd by shares"372,1718080,"WANFENGLONG INDUSTRIAL LIMITED
萬豐隆實業有限公司",2012-03-19,2013-06-28,"Private, ltd by shares"373,1718003,"WANG DA INTERNATIONAL LIMITED
旺達國際(香港)有限公司",2012-03-19,,"Private, ltd by shares"374,1718002,"WARMERCARE CO., LIMITED",2012-03-19,,"Private, ltd by shares"375,1718373,"WEALTHY DEVELOP LIMITED (d2016-11-11)
富康拓展有限公司",2012-03-19,2016-11-11,"Private, ltd by shares"376,1718085,"WENG LI LEI IMMIGRATION (HONG KONG) LIMITED
永利來移民(香港)有限公司",2012-03-19,,"Private, ltd by shares"377,1718008,"WIDER WAY CREATIVE CONSULTANT COMPANY LIMITED
廣凱匯有限公司",2012-03-19,2015-06-19,"Private, ltd by shares"378,1718186,"WINDCAST MEDIA LIMITED
雲頂(香港)傳媒有限公司",2012-03-19,2020-09-25,"Private, ltd by shares"379,1718013,"WING FUNG (CHINA) COMPANY LIMITED
榮烽(中國)有限公司",2012-03-19,,"Private, ltd by shares"380,1718197,"WING TAT LEE DEVELOPMENT LIMITED
榮達利發展有限公司",2012-03-19,2018-11-02,"Private, ltd by shares"381,1718155,"WonKing International Co., Limited
萬維信國際有限公司",2012-03-19,2019-04-26,"Private, ltd by shares"382,1718375,"World Cultural Civilization Co. Limited (The)
世界文化文明有限公司",2012-03-19,2015-07-24,"Private, ltd by shares"383,1718378,"World Cultural Civilization Research Institute &amp; Academy Co. Limited (The)
世界文化文明研究院學院有限公司",2012-03-19,2015-07-24,"Private, ltd by shares"384,1718377,"World Cultural Energy Co. Limited (The)
世界文化能源有限公司",2012-03-19,2015-07-24,"Private, ltd by shares"385,1718380,"World Cultural Energy Research Institute &amp; Academy Co. Limited (The)
世界文化能源研究院學院有限公司",2012-03-19,2015-07-24,"Private, ltd by shares"386,1718347,"WU DI TEXTILES CO., LIMITED
無敵紡織品有限公司",2012-03-19,,"Private, ltd by shares"387,1718211,"XIA'MEN GREE ELECTRICAL EQUIPMENT MARKETING (H.K.) LIMITED
廈門格力電器銷售(香港)有限公司",2012-03-19,2019-01-04,"Private, ltd by shares"388,1717989,"XIN ZHONG CHENG INVESTMENT PTE. LIMITED
新忠誠投資有限公司",2012-03-19,2017-11-03,"Private, ltd by shares"389,1718300,"XINRETEK ELECTRONIC LIMITED
新利泰電子有限公司",2012-03-19,2015-11-13,"Private, ltd by shares"390,1718058,"XJ INTERNATIONAL COMPANY LIMITED
艾克斯傑國際有限公司",2012-03-19,2015-11-20,"Private, ltd by shares"391,1718092,"Ya Mei Huan Yu (HongKong) Tech Co., Limited
亞美環宇(香港)科技有限公司",2012-03-19,2018-12-21,"Private, ltd by shares"392,1718084,"YAMEI (HK) INT'L TRADING LIMITED
亞美(香港)國際貿易有限公司",2012-03-19,,"Private, ltd by shares"393,1718383,"YAT TAI GROUP (HONG KONG) LIMITED
益泰集團(香港)有限公司",2012-03-19,2019-12-27,"Private, ltd by shares"394,1718006,"YEUNG WAH INTERNATIONAL LIMITED
陽華國際有限公司",2012-03-19,2018-12-21,"Private, ltd by shares"395,1718068,"YI CHUAN INTERNATIONAL (HK) LIMITED
一川國際(香港)有限公司",2012-03-19,2018-12-21,"Private, ltd by shares"396,1718001,"YICK FUNG PROPERTIES COMPANY LIMITED
益豐物業有限公司",2012-03-19,,"Private, ltd by shares"397,1718247,"YIWU JUNXIN IMPORT &amp; EXPORT CO., LIMITED
義烏俊鑫進出口有限公司",2012-03-19,2020-03-27,"Private, ltd by shares"398,1718340,"YONJIATHAI (HK) CO., LIMITED
永嘉泰(香港)有限公司",2012-03-19,,"Private, ltd by shares"399,1718316,"YONSEA TECHNOLOGY (HK) CO., LIMITED
香港雍熙科技有限公司",2012-03-19,,"Private, ltd by shares"400,1718032,"Yu Wing International Trading Limited
裕榮國際貿易有限公司",2012-03-19,,"Private, ltd by shares"401,1718343,"YUEN KWONG WO LIMITED
源廣和有限公司",2012-03-19,,"Private, ltd by shares"402,1718342,"YUSHIN FOODS INTERNATIONAL LIMITED
有新食品國際有限公司",2012-03-19,,"Private, ltd by shares"403,1718263,"Z &amp; F GROUP (HK) CO., LIMITED
香港眾福集團有限公司",2012-03-19,,"Private, ltd by shares"404,1718224,"ZHEJIANG CONSTANT POWER MACHINERY CO., LIMITED
浙江康思特動力機械有限公司",2012-03-19,2018-02-15,"Private, ltd by shares"405,1717993,"ZHEN YING INTERNATIONAL LIMITED
真盈國際有限公司",2012-03-19,,"Private, ltd by shares"406,1718244,"ZHONGXIN LIGHTING CO., LIMITED
眾鑫燈飾有限公司",2012-03-19,,"Private, ltd by shares"407,1718033,"ZSD Fiber Communication Co., Limited
中盛達光通訊有限公司",2012-03-19,,"Private, ltd by shares"408,1718200,"ZYT IMMIGRATION SERVICES LIMITED
越港移民服務有限公司",2012-03-19,2016-11-11,"Private, ltd by shares"