,Reg no.,Name,Incorp-orated,Dissolved,Type218,1274525,"LE MEILLEUR TECHNOLOGY LIMITED
美宜科技有限公司",2008-09-22,,"Private, ltd by shares"219,1274470,"LEAP HARVEST LIMITED
鴻爾有限公司",2008-09-22,2020-04-17,"Private, ltd by shares"220,1274644,"LEEKING (HK) PLASTIC ACCESSORIES LIMITED
利軒(香港)橡塑製品有限公司",2008-09-22,2011-01-07,"Private, ltd by shares"221,1274603,"LIGHT HOLDINGS LIMITED
長光有限公司",2008-09-22,,"Private, ltd by shares"222,1274547,"LINGTIAN INDUSTRIAL LIMITED
淩田工業有限公司",2008-09-22,,"Private, ltd by shares"223,1274516,"LINPU DEVELOPMENT (HONG KONG) LIMITED
林普發展(香港)有限公司",2008-09-22,,"Private, ltd by shares"224,1274602,"LISO DISTRIBUTION LIMITED
利索分銷有限公司",2008-09-22,,"Private, ltd by shares"225,1274316,"LONG XI INTERNATIONAL DEVELOPMENT LIMITED
龍禧國際開發有限公司",2008-09-22,2016-05-13,"Private, ltd by shares"226,1274500,"LONGWING DEVELOPMENT LIMITED
朗穎投資發展有限公司",2008-09-22,2012-03-09,"Private, ltd by shares"227,1274355,"LONGXING HARDWARE MOULD (HK) LIMITED
龍星五金模具(香港)有限公司",2008-09-22,2014-01-03,"Private, ltd by shares"228,1274581,"Lotion Holdings Limited",2008-09-22,2009-09-04,"Private, ltd by shares"229,1274664,"LOTUS &amp; WILDE (HK) LIMITED
諾巍(香港)有限公司",2008-09-22,2014-06-20,"Private, ltd by shares"230,1274471,"LUFAITH TECHNOLOGY CO., LIMITED
納菲科技有限公司",2008-09-22,2016-02-05,"Private, ltd by shares"231,1274331,"MDL INTERNATIONAL LIMITED
萬德龍國際有限公司",2008-09-22,2018-09-07,"Private, ltd by shares"232,1274320,"MEDICAL SOURCES CO., LIMITED
邁迪索斯醫療有限公司",2008-09-22,,"Private, ltd by shares"233,1274458,"MEDTECH HK LIMITED (d2012-06-22)",2008-09-22,2012-06-22,"Private, ltd by shares"234,1274449,"MISSION ELECTRONIC LIMITED
美聲實業有限公司",2008-09-22,,"Private, ltd by shares"235,1274490,"MOST BOOM INTERNATIONAL GROUP LIMITED
茂隆國際集團有限公司",2008-09-22,2018-02-15,"Private, ltd by shares"236,1274406,"MULTI-FREQUENCY LIMITED
全頻有限公司",2008-09-22,2012-03-30,"Private, ltd by shares"237,1274646,"NAFNE (HK) ELECTRONIC TECHNOLOGY LIMITED
南灃(香港)電子科技有限公司",2008-09-22,2018-12-14,"Private, ltd by shares"238,1274380,"NAHAI INT'L TRADING CO., LIMITED
納海國際貿易有限公司",2008-09-22,,"Private, ltd by shares"239,1274499,"NEW PENG RICH TECHNOLOGY HK CO., LIMITED
新彭博通信系統有限公司",2008-09-22,,"Private, ltd by shares"240,1274583,"NEW SPACE-TIME EDUCATION CO., LIMITED
新時空教育有限公司",2008-09-22,2012-12-21,"Private, ltd by shares"241,1274401,"NEW WAY INVESTMENTS CO., LIMITED
新方向有限公司",2008-09-22,2020-06-19,"Private, ltd by shares"242,1274657,"NINGBO FIRSTAR INDUSTRIAL CO., LIMITED
寧波富仕達工貿有限公司",2008-09-22,,"Private, ltd by shares"243,1274348,"NINGBO TEEBOND ART MATERIAL CO., LIMITED
寧波天博工貿進出口有限公司",2008-09-22,2019-02-15,"Private, ltd by shares"244,1274526,"NuGold Company Limited",2008-09-22,,"Private, ltd by shares"245,1274451,"OCEAN TIDE LIMITED
瀛泰有限公司",2008-09-22,,"Private, ltd by shares"246,1274548,"OCI LIMITED (HK)",2008-09-22,,"Private, ltd by shares"247,1274532,"ONEWORLD INT'L INDUSTRY CO., LIMITED
萬和國際實業有限公司",2008-09-22,,"Private, ltd by shares"248,1274577,"OPUSAN ENTERPRISE CO., LIMITED
歐蒲森實業有限公司",2008-09-22,2015-01-30,"Private, ltd by shares"249,1274465,"ORIGIN COMMUNICATION CO., LIMITED",2008-09-22,2012-12-21,"Private, ltd by shares"250,1274420,"ORION ADVISORY LIMITED
瀚林企業顧問有限公司",2008-09-22,,"Private, ltd by shares"251,1274524,"OSKA INT'L LIMITED
奧斯加國際有限公司",2008-09-22,,"Private, ltd by shares"252,1274540,"OVERSEAS INVESTMENT CONSULTANT SERVICES CENTER LIMITED
跨境投資顧問服務中心有限公司",2008-09-22,,"Private, ltd by shares"253,1274442,"PAK KEUNG INDUSTRIAL LIMITED
柏強實業有限公司",2008-09-22,2018-07-20,"Private, ltd by shares"254,1274539,"PEACE LOGISTICS LIMITED (d2011-05-27)
協和物流有限公司",2008-09-22,2011-05-27,"Private, ltd by shares"255,1274418,"PHELPS BATHROOM (HONG KONG) CO., LIMITED
菲爾普斯潔具(香港)有限公司",2008-09-22,2014-01-03,"Private, ltd by shares"256,1274615,"PHOENIX PROPERTY INVESTORS (TAIWAN) LIMITED
豐泰地產投資(台灣)有限公司",2008-09-22,,"Private, ltd by shares"257,1274640,"PIONEER TRADING CO., LIMITED
寶利亞有限公司",2008-09-22,2020-06-05,"Private, ltd by shares"258,1274617,"POWER WEALTH (HONG KONG) COMPANY LIMITED
富盈(香港)實業有限公司",2008-09-22,2014-05-02,"Private, ltd by shares"259,1274498,"PROSPERITY SPORTS GOODS CO., LIMITED
昌鑫運動用品有限公司",2008-09-22,,"Private, ltd by shares"260,1274403,"PYROX INFORMATION TECHNOLOGIES (HK) LIMITED
派洛思資訊科技(香港)有限公司",2008-09-22,2015-01-30,"Private, ltd by shares"261,1274670,"PYROX PRECISION TECHNOLOGIES (CHINA) HOLDINGS LIMITED
派洛思精密科技(中國)控股有限公司",2008-09-22,,"Private, ltd by shares"262,1274393,"PYROX PRECISION TECHNOLOGIES (HK) LIMITED
派洛思精密科技(香港)有限公司",2008-09-22,,"Private, ltd by shares"263,1274584,"QINGCHEN EDUCATION CO., LIMITED
清晨教育有限公司",2008-09-22,2012-12-21,"Private, ltd by shares"264,1274648,"QINGDAO LAUNCHING HARDWARE MANUFACTURE CO., LIMITED",2008-09-22,2014-01-03,"Private, ltd by shares"265,1274652,"QINGYI DEVELOPMENT CO., LIMITED
輕易發展有限公司",2008-09-22,2012-12-21,"Private, ltd by shares"266,1274559,"QUAN WEI INTERNATIONAL (HONG KONG) SCIENCE AND TECHNOLOGY INDUSTRY LIMITED
全威國際(香港)科技實業有限公司",2008-09-22,2014-01-03,"Private, ltd by shares"267,1274344,"R&amp;M INTERNATIONAL (H.K) LIMITED
日曼國際(香港)有限公司",2008-09-22,2020-06-19,"Private, ltd by shares"268,1274394,"RadTech Consulting Limited",2008-09-22,,"Private, ltd by shares"269,1274576,"RAYMOND IMPORT &amp; EXPORT CO., LIMITED
瑞豐得進出口有限公司",2008-09-22,2017-01-20,"Private, ltd by shares"270,1274353,"REAL TIME (YW) INTERNATIONAL LIMITED",2008-09-22,2019-12-06,"Private, ltd by shares"271,1274391,"Red Capital Advisors Limited (The)
紅色資本顧問有限公司",2008-09-22,2017-11-03,"Private, ltd by shares"272,1274429,"REGIONAL OFFICE CENTER LIMITED
亞太辦事處有限公司",2008-09-22,,"Private, ltd by shares"273,1274567,"RIFENG CONDUIT HONGKONG GROUP LIMITED
日豐管業香港集團有限公司",2008-09-22,2012-12-21,"Private, ltd by shares"274,1274521,"RIGHTINT CO., LIMITED
銳廷有限公司",2008-09-22,,"Private, ltd by shares"275,1274425,"ROS LIMITED (d2011-02-25)",2008-09-22,2011-02-25,"Private, ltd by shares"276,1274636,"ROYAL PRECISION TECHNOLOGY (HK) CO., LIMITED
皇旗精密科技(香港)有限公司",2008-09-22,2016-05-13,"Private, ltd by shares"277,1274396,"RUSSELL SCOT LANGHAM ELECTRONICS LIMITED",2008-09-22,2014-06-13,"Private, ltd by shares"278,1274529,"SAKURA FIRST Consulting Limited",2008-09-22,2019-05-31,"Private, ltd by shares"279,1274375,"SAM FONG PRINTING (HONG KONG) LIMITED
三方印刷(香港)有限公司",2008-09-22,,"Private, ltd by shares"280,1274369,"SANPIN HK INDUSTRY LIMITED
三品香港實業有限公司",2008-09-22,2013-05-03,"Private, ltd by shares"281,1274517,"SC CORPORATION LIMITED
新村有限公司",2008-09-22,,"Private, ltd by shares"282,1274656,"SERENDIPITY TRADING &amp; CONSULTING LIMITED
寶隆國際貿易諮詢有限公司",2008-09-22,2016-05-13,"Private, ltd by shares"283,1274619,"SETINO GROUP LIMITED",2008-09-22,2012-01-13,"Private, ltd by shares"284,1274328,"SHANGHAI DONGXING MARINE SERVICE CO., LIMITED
上海東興科技有限公司",2008-09-22,2014-01-03,"Private, ltd by shares"285,1274551,"SHANGHAI POLANG CONDUIT LIMITED
上海破浪管業有限公司",2008-09-22,2017-05-19,"Private, ltd by shares"286,1274629,"Shenzhen Gold Phoenix Second Furniture Company., Limited
深圳市金鳳凰第二傢俱有限公司",2008-09-22,,"Private, ltd by shares"287,1274557,"SHIYA DONGRUN AUTO PARTS LIMITED
十堰東潤汽車零部件有限公司",2008-09-22,2018-06-08,"Private, ltd by shares"288,1274392,"SICHUAN LUZHOU WINE SHARE LIMITED
四川瀘州酒業股份有限公司",2008-09-22,2012-12-21,"Private, ltd by shares"289,1274350,"SIEMENS ELECTRICAL APPLIANCES (HK) LIMITED
西門子家電(香港)有限公司",2008-09-22,2010-06-25,"Private, ltd by shares"290,1274362,"Simcom Holdings HK Limited
晨訊控股香港有限公司",2008-09-22,,"Private, ltd by shares"291,1274674,"SINO-AGROCHEMICAL CO., LIMITED
中農化學有限公司",2008-09-22,,"Private, ltd by shares"292,1274594,"SINO-GLOBAL SHIPPING (HK) LIMITED",2008-09-22,,"Private, ltd by shares"293,1274675,"SKY PROJECTS CHINA LIMITED
法國天成包機運輸(中國)有限公司",2008-09-22,2012-12-21,"Private, ltd by shares"294,1274492,"Sky Tex Trading Co., Limited",2008-09-22,2015-01-30,"Private, ltd by shares"295,1274653,"SOUPIR DE DAME LIMITED",2008-09-22,2015-01-30,"Private, ltd by shares"296,1274359,"Speedcomm Holdings HK Limited
思必得控股香港有限公司",2008-09-22,2011-04-08,"Private, ltd by shares"297,1274528,"SPRY WORLD TRADE CO., LIMITED
斯伯爾國際貿易有限公司",2008-09-22,,"Private, ltd by shares"298,1274404,"STARISCHE GROUP (H.K) LIMITED
富星集團(香港)有限公司",2008-09-22,2012-12-21,"Private, ltd by shares"299,1274530,"STARNEON LIGHT (HK) LIMITED
星宇光電(香港)有限公司",2008-09-22,2017-05-19,"Private, ltd by shares"300,1274650,"STONE (HK) INDUSTRIAL CO., LIMITED
斯頓(香港)實業有限公司",2008-09-22,2012-12-21,"Private, ltd by shares"301,1274523,"STYLE INTERNATIONAL (HK) CO., LIMITED
斯泰邇國際(香港)有限公司",2008-09-22,,"Private, ltd by shares"302,1274438,"Sunny Mountain Paper Product Company Limited",2008-09-22,2018-11-02,"Private, ltd by shares"303,1274497,"SUNNYTOWN HANDBAG INDUSTRIES LIMITED
漢國手袋製品有限公司",2008-09-22,2015-04-30,"Private, ltd by shares"304,1274390,"SUNSHINE GIFT (HONG KONG) INDUSTRIAL LIMITED
盛鑫禮品(香港)實業有限公司",2008-09-22,2014-11-28,"Private, ltd by shares"305,1274669,"SWISS EXPOOL WATCH LIMITED
瑞士依保路鐘表有限公司",2008-09-22,,"Private, ltd by shares"306,1274585,"SZ KETELI HK LIMITED
深圳科特利香港有限公司",2008-09-22,2017-05-19,"Private, ltd by shares"307,1274450,"TAIWAN AUKI SEWING EQUIPMENT COMPANY LIMITED
台灣奧機縫製設備有限公司",2008-09-22,2018-06-08,"Private, ltd by shares"308,1274508,"TAIWAN JZ CONTROL EQUIPMENT LIMITED
臺灣金正縫製數控設備有限公司",2008-09-22,2012-12-21,"Private, ltd by shares"309,1274488,"TAIWAN RISING SUN TYRES MANUFACTURE LIMITED
台灣朝陽輪胎製造有限公司",2008-09-22,2012-12-21,"Private, ltd by shares"310,1274588,"TAIWAN SANLI PNEUMATIC TOOLS LIMITED
臺灣三力氣動工具有限公司",2008-09-22,,"Private, ltd by shares"311,1274311,"TAIWAN SHUNSHI INT'L TRADING LIMITED
臺灣順勢國際貿易有限公司",2008-09-22,,"Private, ltd by shares"312,1274426,"TALENT SEARCH INTERNATIONAL LIMITED
才智國際獵頭有限公司",2008-09-22,2015-04-30,"Private, ltd by shares"313,1274575,"TEAMFE INVESTMENT COMPANY LIMITED
蒂姆菲投資實業有限公司",2008-09-22,2012-12-21,"Private, ltd by shares"314,1274474,"THOUSAND PRAISE LIMITED
思億有限公司",2008-09-22,2012-12-21,"Private, ltd by shares"315,1274493,"TIGHT ENCIRCLEMENT ASIAN-PACIFIC ENTERPRISE DEVELOPMENT LIMITED
天羅地網亞太企業發展有限公司",2008-09-22,2012-12-21,"Private, ltd by shares"316,1274446,"TONGXINHANG CO., LIMITED
同信行有限公司",2008-09-22,2016-03-11,"Private, ltd by shares"317,1274487,"TONGYUAN HOLDING INT'L LIMITED
彤淵控股國際有限公司",2008-09-22,2012-12-21,"Private, ltd by shares"318,1274635,"TOPPING STONE (H.K.) LIMITED
香港上國雲石有限公司",2008-09-22,,"Private, ltd by shares"319,1274489,"TOPREAL INTERNATIONAL GROUP LIMITED
特瑞國際集團有限公司",2008-09-22,2015-01-30,"Private, ltd by shares"320,1274373,"Tourfone Limited (HK)",2008-09-22,,"Private, ltd by shares"321,1274448,"TriWin Education Technology Group (HK) Limited
叁贏教育科技集團(香港)有限公司",2008-09-22,,"Private, ltd by shares"322,1274332,"TROPICAL GROUP LIMITED",2008-09-22,2012-12-21,"Private, ltd by shares"323,1274431,"U.S.A. FUKANG SOLAR INT'L LIMITED
美國福康太陽能國際有限公司",2008-09-22,2015-01-30,"Private, ltd by shares"324,1274441,"UAE-HK CONSULTANTS LIMITED",2008-09-22,2010-03-12,"Private, ltd by shares"325,1274321,"UK COBRA INVESTMENT HOLDING LIMITED
英國眼鏡蛇投資控股有限公司",2008-09-22,2012-12-21,"Private, ltd by shares"326,1274595,"USA JIAJI INT'L NONGZI HOLDING GROUP LIMITED
美國嘉吉國際農資控股集團有限公司",2008-09-22,2012-12-21,"Private, ltd by shares"327,1274371,"VANDERMERWE LIMITED",2008-09-22,2018-06-08,"Private, ltd by shares"328,1274466,"VIEW BASIC INTERNATIONAL LIMITED
景基國際有限公司",2008-09-22,2018-06-08,"Private, ltd by shares"329,1274531,"VINIFERA INTERNATIONAL LIMITED",2008-09-22,,"Private, ltd by shares"330,1274361,"VPRO GROUP LIMITED
帥豪集團有限公司",2008-09-22,2020-05-08,"Private, ltd by shares"331,1274395,"WAI YUAN (HONG KONG) LIMITED
慧源(香港)有限公司",2008-09-22,2011-11-25,"Private, ltd by shares"332,1274314,"WANS Enterprises Design Limited
溫莎企業設計有限公司",2008-09-22,2010-07-02,"Private, ltd by shares"333,1274642,"WATT TECHNOLOGY CO., LIMITED
奧特科技有限公司",2008-09-22,2015-01-30,"Private, ltd by shares"334,1274432,"WEALTHY GRAND INTERNATIONAL LIMITED
豪尚國際有限公司",2008-09-22,,"Private, ltd by shares"335,1274515,"WELLFIT PACKING LIMITED
華發包裝材料有限公司",2008-09-22,2014-01-10,"Private, ltd by shares"336,1274430,"Wellway Motors Limited
好時汽車有限公司",2008-09-22,2015-09-11,"Private, ltd by shares"337,1274654,"WENSHILONG INVESTMENT GROUP (HK) LIMITED
萬仕隆投資集團(香港)有限公司",2008-09-22,2018-06-08,"Private, ltd by shares"338,1274610,"WENZHOU JINNIAOLAI SHOES INDUSTRY LIMITED
溫州金鳥萊鞋業有限公司",2008-09-22,2016-05-13,"Private, ltd by shares"339,1274597,"WENZHOU JINQIANFU SHOES INDUSTRY LIMITED
溫州金錢富鞋業有限公司",2008-09-22,2015-01-30,"Private, ltd by shares"340,1274411,"WG TRADING LIMITED (d2010-05-20)",2008-09-22,2010-05-20,"Private, ltd by shares"341,1274388,"WINDOW'S CLOCK &amp; WATCH CO., LIMITED
鐘錶之窗有限公司",2008-09-22,,"Private, ltd by shares"342,1274417,"WING HING FAT HONG KONG COMPANY LIMITED
永興發香港有限公司",2008-09-22,2014-01-03,"Private, ltd by shares"343,1274541,"WONDERFUL STAR UNION ENERGY LIMITED
美星聯合能源股份有限公司",2008-09-22,2012-12-21,"Private, ltd by shares"344,1274459,"WOODPECKER CLOTHING (FRANCE) LIMITED
啄木鳥服飾(法國)有限公司",2008-09-22,2014-01-03,"Private, ltd by shares"345,1274389,"WORLDWIDE CHINESE FORTUNE GLOBE GENERAL LIMITED (d2015-01-30)",2008-09-22,2015-01-30,"Private, ltd by shares"346,1274501,"XIAMEN FENGHUI LIGHTING &amp; ELECTRONIC LIMITED",2008-09-22,2015-01-30,"Private, ltd by shares"347,1274476,"XIN FA ENTERPRISE (HK) CO., LIMITED
鑫發企業(香港)有限公司",2008-09-22,,"Private, ltd by shares"348,1274443,"Xin Tai Investment Consultancy Holdings Limited
鑫泰投資顧問股份有限公司",2008-09-22,2015-07-31,"Private, ltd by shares"349,1274374,"XINZHIZUN (HONGKONG) ELECTRONICS CO., LIMITED (d2016-04-01)
新至尊(香港)電子有限公司",2008-09-22,2016-04-01,"Private, ltd by shares"350,1274505,"YAM CO., LIMITED
善明勝有限公司",2008-09-22,2012-12-21,"Private, ltd by shares"351,1274410,"YANGDONG EWIN LIGHT INDUSTRIAL PRODUCTS LIMITED
陽東縣伊利達輕工制品有限公司",2008-09-22,,"Private, ltd by shares"352,1274484,"YEAR BOOM LIMITED
贊益有限公司",2008-09-22,,"Private, ltd by shares"353,1274554,"YEETRANS LOGISTICS (HONGKONG) LIMITED
全辰國際物流(香港)有限公司",2008-09-22,2010-02-19,"Private, ltd by shares"354,1274414,"YFC INDUSTRIAL CO., LIMITED",2008-09-22,2017-12-01,"Private, ltd by shares"355,1274319,"YO HAO INTERNATIONAL LIMITED
優豪國際有限公司",2008-09-22,,"Private, ltd by shares"356,1274593,"YONG XIN (HK) INTERNATIONAL TRADE LIMITED
永欣(香港)國際貿易有限公司",2008-09-22,2012-12-21,"Private, ltd by shares"357,1274570,"YONGSHENG INDUSTRY CO., LIMITED
永聖實業有限公司",2008-09-22,2012-12-21,"Private, ltd by shares"358,1274445,"YOU FA PLASTICS &amp; METALS COMPANY LIMITED
友發塑料五金廠有限公司",2008-09-22,,"Private, ltd by shares"359,1274472,"YOUNG GLOBAL LIMITED (d2013-04-19)
銘晟有限公司",2008-09-22,2013-04-19,"Private, ltd by shares"360,1274633,"YOUSHENG PRINTERS CONSUMABLE (HONG KONG) CO., LIMITED
又生印表機耗材(香港)有限公司",2008-09-22,,"Private, ltd by shares"361,1274486,"YOUTH CREATION LIMITED (d2013-02-15)
眾略有限公司",2008-09-22,2013-02-15,"Private, ltd by shares"362,1274658,"YUANHANG EDUCATION CO., LIMITED
遠航教育有限公司",2008-09-22,2012-12-21,"Private, ltd by shares"363,1274398,"YUDA (HK) INDUSTRIAL CO., LIMITED
裕達(香港)實業有限公司",2008-09-22,,"Private, ltd by shares"364,1274325,"YYC TECHNOLOGY (HK) LIMITED
億宇科技(香港)有限公司",2008-09-22,2017-05-19,"Private, ltd by shares"365,1274651,"ZHAOJIN INVESTMENT INTERNATIONAL CO., LIMITED
中國(香港)招金國際投資股份有限公司",2008-09-22,,"Private, ltd by shares"366,1274506,"ZHONGXING INDUSTRIAL CO., LIMITED
眾興實業有限公司",2008-09-22,2017-05-19,"Private, ltd by shares"367,1274571,"ZHONGYING EDUCATION CO., LIMITED
中英教育有限公司",2008-09-22,2012-12-21,"Private, ltd by shares"368,1274574,"Zhunti Buddhism College Co., Limited
准提法佛學院有限公司",2008-09-22,,"Private, ltd by shares"