,Reg no.,Name,Incorp-orated,Dissolved,Type1,1274467,"1CM LIMITED (d2012-12-21)",2008-09-22,2012-12-21,"Private, ltd by shares"2,1274580,"A.J.A.D. Enterprizes Limited",2008-09-22,2015-02-27,"Private, ltd by shares"3,1274661,"ABRARE INT'L TRADING CO., LIMITED
阿巴拉國際貿易有限公司",2008-09-22,2012-12-21,"Private, ltd by shares"4,1274641,"Abui Commerce International Hong Kong Limited",2008-09-22,,"Private, ltd by shares"5,1274363,"Adenpharma Technologies Co., Limited",2008-09-22,2015-01-30,"Private, ltd by shares"6,1274626,"ADVANCE PARADISE LIMITED
新瀛有限公司",2008-09-22,,"Private, ltd by shares"7,1274341,"AGHATA GROUP LIMITED",2008-09-22,2014-01-03,"Private, ltd by shares"8,1274481,"AGRIMORE ENTERPRISE LIMITED",2008-09-22,,"Private, ltd by shares"9,1274668,"AI Creative Technology Limited
創智科技資訊有限公司",2008-09-22,2012-12-21,"Private, ltd by shares"10,1274421,"ALBERT WAI-KIT CHAN INTELLECTUAL PROPERTY LIMITED
陳偉傑知識產權有限公司",2008-09-22,,"Private, ltd by shares"11,1274634,"ALCOM TRADING COMPANY LIMITED",2008-09-22,,"Private, ltd by shares"12,1274377,"ALLIANCE IMPEX LIMITED (d2015-09-11)
同盟進出口有限公司",2008-09-22,2015-09-11,"Private, ltd by shares"13,1274527,"ALLROUND SCAFFOLDING (HONGKONG) CO., LIMITED
香港頤昌盈投資有限公司",2008-09-22,2014-02-07,"Private, ltd by shares"14,1274372,"ALLSONIC (HONGKONG) ELECTRONIC LIMITED
澳威格(香港)電子有限公司",2008-09-22,2014-01-03,"Private, ltd by shares"15,1274555,"AMERICA HOMSING INTERNATIONAL INDUSTRY GROUP DEVELOPMENT (HONG KONG) LIMITED
美國弘鑫國際實業集團發展(香港)有限公司",2008-09-22,2013-01-04,"Private, ltd by shares"16,1274412,"AMERICAN GOLDBABY INTERNATIONAL GROUP LIMITED
美國金寶貝國際集團有限公司",2008-09-22,2012-12-21,"Private, ltd by shares"17,1274558,"AMERICAN WATS VALVE GROUP ASIA LIMITED
美國瓦特斯閥門集團亞洲有限公司",2008-09-22,,"Private, ltd by shares"18,1274400,"Ander Consulting (HK) Limited",2008-09-22,,"Private, ltd by shares"19,1274334,"ANNUOJIA (ITALY) GROUP LIMITED
安諾家(意大利)集團有限公司",2008-09-22,2015-01-30,"Private, ltd by shares"20,1274409,"APJ SLG LAW OFFICES LIMITED",2008-09-22,2018-06-08,"Private, ltd by shares"21,1274473,"ARDFERT LIMITED (d2012-12-21)",2008-09-22,2012-12-21,"Private, ltd by shares"22,1274621,"ASIACOMM (HONGKONG) CO., LIMITED
亞訊通訊(香港)有限公司",2008-09-22,2012-04-13,"Private, ltd by shares"23,1274511,"AULUCKY INTERNATIONAL CO., LIMITED (d2019-07-12)
奧輪國際有限公司",2008-09-22,2019-07-12,"Private, ltd by shares"24,1274463,"AURA INTERNATIONAL (HONG KONG) CO., LIMITED
香港栢翔國際有限公司",2008-09-22,2015-01-30,"Private, ltd by shares"25,1274423,"Auto Parts Asia Limited",2008-09-22,2012-04-20,"Private, ltd by shares"26,1274494,"AUTO-SECURE TECHNOLOGY (H.K.) CO., LIMITED
先進智能(香港)有限公司",2008-09-22,,"Private, ltd by shares"27,1274405,"B S OVERSEAS LIMITED",2008-09-22,,"Private, ltd by shares"28,1274383,"Bago Pictures Limited
博觀映畫有限公司",2008-09-22,,"Private, ltd by shares"29,1274620,"BAI HUI (INTERNATIONAL) INVESTMENT LIMITED
百惠(國際)投資有限公司",2008-09-22,,"Private, ltd by shares"30,1274397,"BAOLONG INTERNATIONAL (HK) CO., LIMITED
寶龍國際(香港)有限公司",2008-09-22,2014-01-03,"Private, ltd by shares"31,1274566,"BAVANT LIMITED
百維特有限公司",2008-09-22,2017-12-08,"Private, ltd by shares"32,1274340,"BENWOOD INTERNATIONAL CO., LIMITED",2008-09-22,2015-01-30,"Private, ltd by shares"33,1274660,"Best Comfort Global Limited
曦樂國際有限公司",2008-09-22,2011-12-23,"Private, ltd by shares"34,1274611,"BINGSHING COMPUTER TECHNOLOGY GROUP (HK) LIMITED
炳盛電腦科技集團(香港)有限公司",2008-09-22,2012-12-21,"Private, ltd by shares"35,1274346,"BINTI LIMITED",2008-09-22,,"Private, ltd by shares"36,1274368,"BLUE SKY IMP. &amp; EXP. TRADING LIMITED
藍天進出口貿易有限公司",2008-09-22,2014-01-03,"Private, ltd by shares"37,1274455,"BOARD ERA LIMITED
博而有限公司",2008-09-22,2016-10-28,"Private, ltd by shares"38,1274464,"BOOM GAIN LIMITED
翌豐有限公司",2008-09-22,,"Private, ltd by shares"39,1274313,"BOTRS ELECTRONICS LIMITED
香港旭昕微電子有限公司",2008-09-22,,"Private, ltd by shares"40,1274479,"BRAINS BILLION LIMITED
億薈有限公司",2008-09-22,,"Private, ltd by shares"41,1274495,"BRIGHT PROFUSE INTERNATIONAL GROUP LIMITED
僑豐國際集團有限公司",2008-09-22,,"Private, ltd by shares"42,1274329,"BSP Consultants Limited (HK)
俊源顧問有限公司",2008-09-22,,"Private, ltd by shares"43,1274475,"BUDDY (ASIA) LIMITED
畢地(亞洲)有限公司",2008-09-22,2011-10-07,"Private, ltd by shares"44,1274663,"Ca-Hen Enterprises Co. Limited
嘉恆企業有限公司",2008-09-22,2015-07-31,"Private, ltd by shares"45,1274613,"Camerata Limited (d2009-09-04)",2008-09-22,2009-09-04,"Private, ltd by shares"46,1274569,"Capture International (HK) Limited
競綽國際(香港)有限公司",2008-09-22,2020-06-19,"Private, ltd by shares"47,1274452,"CAR DOCTOR LIMITED (d2015-07-31)
車師傅有限公司",2008-09-22,2015-07-31,"Private, ltd by shares"48,1274482,"CAS Innovative Technology (Asia) Industrial Limited
卡西創科(亞洲)工業有限公司",2008-09-22,2011-06-03,"Private, ltd by shares"49,1274627,"CFK MEGA DEVELOPMENT LIMITED
振國宏發有限公司",2008-09-22,2011-07-08,"Private, ltd by shares"50,1274424,"CHANG YU INTERNATIONAL TRADING LIMITED
長裕國際貿易有限公司",2008-09-22,,"Private, ltd by shares"51,1274477,"CHERRY FORTUNE LIMITED
荃盛有限公司",2008-09-22,,"Private, ltd by shares"52,1274310,"CHEUNG WAH CHEMICALS COMPANY LIMITED
長華化工有限公司",2008-09-22,2013-06-14,"Private, ltd by shares"53,1274478,"CHI-WAY INTERNATIONAL (HONG KONG) LIMITED
香港啓輝國際有限公司",2008-09-22,2019-02-01,"Private, ltd by shares"54,1274649,"CHINA BUSINESS ENTERPRISE TRADE AND INDUSTRY &amp; LEGAL AFFAIRS CENTER LIMITED
中國工商企業信用與法務中心有限公司",2008-09-22,,"Private, ltd by shares"55,1274562,"China Cinese Hotel Holdings Limited
中國富盈酒店控股有限公司",2008-09-22,,"Private, ltd by shares"56,1274647,"CHINA CREDIT EVALUATION CENTRE LIMITED
中國信用評價中心有限公司",2008-09-22,,"Private, ltd by shares"57,1274550,"China Finance (Worldwide) Limited
中國財務(國際)有限公司",2008-09-22,,"Private, ltd by shares"58,1274676,"CHINA HANFORD HOLDING LIMITED",2008-09-22,2015-12-18,"Private, ltd by shares"59,1274631,"CHINA HONG KONG INDUSTRIAL INVESTMENT LIMITED
中國香港鼎興實業投資有限公司",2008-09-22,,"Private, ltd by shares"60,1274637,"CHINA INTERNATIONAL FILM TELEVISION GROUP LIMITED
中國國際影視集團有限公司",2008-09-22,2012-12-21,"Private, ltd by shares"61,1274564,"CHINA PAGEANT LIMITED
中帕有限公司",2008-09-22,,"Private, ltd by shares"62,1274469,"CHINA WENJUN ZHOUYI LIMITED
中華文俊易學信息有限公司",2008-09-22,2015-09-11,"Private, ltd by shares"63,1274671,"CHITA COMPANY LIMITED",2008-09-22,2010-05-07,"Private, ltd by shares"64,1274349,"CHUNG YOUNG DIGITAL CO., LIMITED
忠永數字(香港)有限公司",2008-09-22,2013-11-08,"Private, ltd by shares"65,1274673,"CLINIC BEAUTY LIMITED (HK)
科技美容有限公司",2008-09-22,,"Private, ltd by shares"66,1274596,"CLOUDPAY HONG KONG LIMITED",2008-09-22,2018-09-07,"Private, ltd by shares"67,1274607,"CO-TALENT TECHNOLOGY LIMITED
群萃科技有限公司",2008-09-22,,"Private, ltd by shares"68,1274519,"COBRA (ASIA) HOLDING INC LIMITED
科博萊(亞洲)控股集團有限公司",2008-09-22,2012-12-21,"Private, ltd by shares"69,1274677,"Cogent Steel Co., Limited",2008-09-22,,"Private, ltd by shares"70,1274513,"COMVAN OVERSEAS CO., LIMITED
康遠海外有限公司",2008-09-22,,"Private, ltd by shares"71,1274618,"COSCO PAPER CO., LIMITED
中遠紙品有限公司",2008-09-22,2014-01-03,"Private, ltd by shares"72,1274415,"CREATIVE DESIGN &amp; DECORATION ENGINEERING CO., LIMITED
創意設計裝飾工程有限公司",2008-09-22,2009-10-30,"Private, ltd by shares"73,1274549,"DALMA (H.K.) SANITARY WARE LIMITED
達爾瑪衛浴(香港)有限公司",2008-09-22,2015-07-31,"Private, ltd by shares"74,1274435,"DE BANG PRINTING COMPANY LIMITED
德邦印刷有限公司",2008-09-22,,"Private, ltd by shares"75,1274317,"DESON INDUSTRY CO., LIMITED
德紳實業有限公司",2008-09-22,2015-01-30,"Private, ltd by shares"76,1274556,"DID HK LIMITED
黑暗中對話(香港)有限公司",2008-09-22,,"Private, ltd by shares"77,1274537,"DON CHEER LIMITED
敦賀有限公司",2008-09-22,2015-01-02,"Private, ltd by shares"78,1274672,"DONGHE SHIPPING SERVICE CO., LIMITED
東和船舶服務有限公司",2008-09-22,2012-08-24,"Private, ltd by shares"79,1274546,"DWELL INTERNATIONAL (ASIA) LIMITED
德智高國際有限公司",2008-09-22,2015-09-11,"Private, ltd by shares"80,1274457,"DYNAMIC DELTA ENTERPRISES LIMITED
叁企業有限公司",2008-09-22,2016-03-04,"Private, ltd by shares"81,1274460,"E-STOCK WORLD CO., LIMITED
香港思沃科技有限公司",2008-09-22,2012-12-14,"Private, ltd by shares"82,1274336,"EASTERN SPECIAL METALS HONG KONG LIMITED
東方特金香港有限公司",2008-09-22,,"Private, ltd by shares"83,1274665,"ELEA INTERNATIONAL LIMITED
埃裏亞國際有限公司",2008-09-22,2016-04-15,"Private, ltd by shares"84,1274543,"ELLINGTON HOLDINGS LIMITED (HK)
依頓控股有限公司",2008-09-22,,"Private, ltd by shares"85,1274352,"ELMEX INTERNATIONAL LIMITED
愛如邁國際有限公司",2008-09-22,2011-04-29,"Private, ltd by shares"86,1274335,"ELSOLO INTERNATIONAL TRADING CO., LIMITED",2008-09-22,,"Private, ltd by shares"87,1274318,"EmBrio Enterprises International Limited",2008-09-22,2012-02-03,"Private, ltd by shares"88,1274616,"EMPEROR GLORY LIMITED (d2010-03-12)",2008-09-22,2010-03-12,"Private, ltd by shares"89,1274365,"ENGLAND INTERNATIONAL (H.K) LIMITED
英格蘭國際(香港)有限公司",2008-09-22,2018-06-08,"Private, ltd by shares"90,1274385,"ETERNITY WINES LIMITED
永恒酒業有限公司",2008-09-22,,"Private, ltd by shares"91,1274339,"FABER INT'L (HK) LAYOUT CONSTRUCTION DESIGN LIMITED
法博國際(香港)規劃建築設計有限公司",2008-09-22,,"Private, ltd by shares"92,1274507,"FAIRTRADE INTERNATIONAL (HK) CO., LIMITED
伊商國際貿易有限公司",2008-09-22,,"Private, ltd by shares"93,1274608,"FAR EAST SHIP MANAGEMENT LIMITED
遠東船舶管理有限公司",2008-09-22,2016-03-18,"Private, ltd by shares"94,1274502,"FAR SAIL LIMITED
遠帆有限公司",2008-09-22,,"Private, ltd by shares"95,1274587,"FEIXIANG INVESTMENT CO., LIMITED
飛翔投資有限公司",2008-09-22,2012-12-21,"Private, ltd by shares"96,1274444,"FENGLONG INTERNATIONAL TRADE CO., LIMITED (d2017-05-19)
香港豐隆國際貿易有限公司",2008-09-22,2017-05-19,"Private, ltd by shares"97,1274483,"FIN STUDIO CO., LIMITED",2008-09-22,2011-05-13,"Private, ltd by shares"98,1274553,"FIVAG LIMITED",2008-09-22,2014-01-03,"Private, ltd by shares"99,1274433,"FORTUNE HUNDRED INTERNATIONAL LIMITED
福佰國際有限公司",2008-09-22,2014-04-11,"Private, ltd by shares"100,1274496,"FOUNTAINHEAD INTERNATIONAL LIMITED",2008-09-22,2012-12-21,"Private, ltd by shares"101,1274643,"FRANCE AEXCELLER (HK) INT'L GROUP DEVELOPMENT LIMITED
法國卡詩曼(香港)國際集團發展有限公司",2008-09-22,2012-12-21,"Private, ltd by shares"102,1274428,"FRANCE GOLDEN APPLE WORLD (HK) FASHION LIMITED
法國金蘋果世界(香港)服飾有限公司",2008-09-22,2012-12-21,"Private, ltd by shares"103,1274351,"FU YU FURNITURE CO., LIMITED
富宇家具有限公司",2008-09-22,,"Private, ltd by shares"104,1274599,"FUGUO EDUCATION CO., LIMITED
富國教育有限公司",2008-09-22,2012-12-21,"Private, ltd by shares"105,1274630,"FUKUDA PARKING LIMITED
福田停車場有限公司",2008-09-22,,"Private, ltd by shares"106,1274480,"FUSION TECHNOLOGIES (HONGKONG) CO., LIMITED
福虹科技(香港)有限公司",2008-09-22,,"Private, ltd by shares"107,1274485,"G'FIVE INTERNATIONAL LIMITED
基伍國際有限公司",2008-09-22,2018-08-17,"Private, ltd by shares"108,1274461,"GAIN SHINE LIMITED
荃耀有限公司",2008-09-22,,"Private, ltd by shares"109,1274422,"GALAXY INDUSTRY INTERNATIONAL LIMITED
銀河實業國際有限公司",2008-09-22,2018-12-07,"Private, ltd by shares"110,1274601,"GATHER BEST HOLDINGS LIMITED
嘉傑集團有限公司",2008-09-22,,"Private, ltd by shares"111,1274639,"GBB INTERNATIONAL TRADING CO., LIMITED",2008-09-22,,"Private, ltd by shares"112,1274579,"GELIN EDUCATION CO., LIMITED
格林教育有限公司",2008-09-22,2012-12-21,"Private, ltd by shares"113,1274589,"GERMANY OUYA TIRE CO., LIMITED
德國歐亞輪胎有限公司",2008-09-22,,"Private, ltd by shares"114,1274491,"GERMANY SOKANY GROUP CO., LIMITED
德國索卡尼集團有限公司",2008-09-22,2015-01-30,"Private, ltd by shares"115,1274535,"GLOBAL MERCHANDISE SOLUTIONS LIMITED (d2014-07-04)",2008-09-22,2014-07-04,"Private, ltd by shares"116,1274512,"Golden Dynasty International SPA Club Limited
金世乾朝國際水療中心有限公司",2008-09-22,2015-09-11,"Private, ltd by shares"117,1274454,"GOLDINFLOW ENERGY LIMITED
金進滙能源有限公司",2008-09-22,,"Private, ltd by shares"118,1274509,"GOLDLING HKG LIMITED",2008-09-22,,"Private, ltd by shares"119,1274503,"GOOD NATURAL INTERNATIONAL LIMITED
好天然國際有限公司",2008-09-22,2012-09-28,"Private, ltd by shares"120,1274598,"GRAND STABLE LIMITED
筠安有限公司",2008-09-22,2012-12-21,"Private, ltd by shares"121,1274434,"GRANDPOP INTERNATIONAL LIMITED
鴻普國際有限公司",2008-09-22,2016-04-01,"Private, ltd by shares"122,1274360,"GREAT WALL MUSICAL INSTRUMENT H.K. LIMITED
長城樂器香港有限公司",2008-09-22,2014-01-03,"Private, ltd by shares"123,1274586,"Griffon Expeditions Limited",2008-09-22,,"Private, ltd by shares"124,1274315,"H.K. CENTURY DREAM GARDEN FURNITURE INT'L LIMITED
香港世紀夢圓家具國際有限公司",2008-09-22,2018-06-08,"Private, ltd by shares"125,1274342,"H.K. INT'L SMOKING AND HEALTH TECHNOLOGY GROUP LIMITED
香港國際吸煙與健康科技集團有限公司",2008-09-22,2015-07-31,"Private, ltd by shares"126,1274358,"H.K. RUIQIANG GROUP HOLDING LIMITED
香港銳強集團股份有限公司",2008-09-22,2012-12-21,"Private, ltd by shares"127,1274447,"H.K. WANBANG CHILD APTITUDE DEVELOP LIMITED
香港萬邦兒童智能開發有限公司",2008-09-22,2014-01-03,"Private, ltd by shares"128,1274379,"HAIGEER GOOD LADY GROUP (HANGZHOU) LIMITED
海格爾好太太集團(杭州)有限公司",2008-09-22,2014-01-03,"Private, ltd by shares"129,1274416,"HAO TIAN LOGISTICS EXPRESS (HK) LIMITED
浩天物流快遞(香港)有限公司",2008-09-22,,"Private, ltd by shares"130,1274544,"Hao Yu Technology (Hong Kong) Co., Limited
好雨科技(香港)有限公司",2008-09-22,,"Private, ltd by shares"131,1274538,"HE YI INDUSTRY CO., LIMITED
和易實業有限公司",2008-09-22,2015-01-30,"Private, ltd by shares"132,1274614,"HENG CHEONG LABELS COMPANY LIMITED
恒昌商標有限公司",2008-09-22,,"Private, ltd by shares"133,1274542,"HENGMEI (HK) ENTERPRISE CO., LIMITED
恒美(香港)實業有限公司",2008-09-22,,"Private, ltd by shares"134,1274324,"HIRAM INVESTMENT LIMITED
晞信投資有限公司",2008-09-22,2017-03-31,"Private, ltd by shares"135,1274545,"HK DONGBAO DRESS GROUP LIMITED
香港冬豹服飾集團有限公司",2008-09-22,2014-01-03,"Private, ltd by shares"136,1274413,"HK FANYA OASIS ECONOMIC TRADE LIMITED
香港泛亞綠洲經貿有限公司",2008-09-22,2019-07-26,"Private, ltd by shares"137,1274578,"HK GUANTANG DECORATIVE DESIGN LIMITED
香港觀唐裝飾設計有限公司",2008-09-22,2014-01-03,"Private, ltd by shares"138,1274384,"HK HANG SHENG COMMERCIAL &amp; TRADING CO., LIMITED
香港航生商業貿易有限公司",2008-09-22,,"Private, ltd by shares"139,1274456,"HK HOI FOOK JEWELLERY INTERNATIONAL GROUP CO., LIMITED
香港凱福珠寶國際集團有限公司",2008-09-22,,"Private, ltd by shares"140,1274462,"HK HUIXIN INTERNATIONAL BIOLOGICAL TECHNOLOGY (GROUP) LIMITED
香港匯鑫國際生物科技(集團)有限公司",2008-09-22,,"Private, ltd by shares"141,1274563,"HK SANXING INDUSTRY LIMITED
香港三興國際有限公司",2008-09-22,2012-12-21,"Private, ltd by shares"142,1274536,"HK U.B FASHION INT'L LIMITED
香港優貝時裝國際有限公司",2008-09-22,,"Private, ltd by shares"143,1274565,"HK YONGCHANGSHUN INT'L LIMITED
香港永昌順國際有限公司",2008-09-22,2012-12-21,"Private, ltd by shares"144,1274568,"HK YONGTONG INDUSTRY LIMITED
香港永通實業有限公司",2008-09-22,2012-12-21,"Private, ltd by shares"145,1274659,"HOME COLLECTION INDUSTRY LIMITED",2008-09-22,2018-02-02,"Private, ltd by shares"146,1274440,"HONG KONG ALLIANCE INTERNATIONAL GROUP LIMITED
香港信聯國際集團有限公司",2008-09-22,,"Private, ltd by shares"147,1274364,"HONG KONG INTERCONNECTION INT'L CO., LIMITED
香港互聯國際有限公司",2008-09-22,2012-12-21,"Private, ltd by shares"148,1274560,"HONG KONG JESON INTERNATIONAL GROUP LIMITED
香港集盛國際集團有限公司",2008-09-22,2012-06-08,"Private, ltd by shares"149,1274382,"HONG KONG KCDU COMPANY LIMITED
香港韓國教會聯合發展有限公司",2008-09-22,2012-12-21,"Private, ltd by shares"150,1274514,"HONG KONG MEI DI LIMITED
香港美的有限公司",2008-09-22,,"Private, ltd by shares"151,1274624,"HONG KONG NEW ENERGY CO., LIMITED
香港新能源責任有限公司",2008-09-22,2010-12-31,"Private, ltd by shares"152,1274606,"HONG KONG ONEDO INVESTMENT GROUP CO., LIMITED
香港萬都投資集團有限公司",2008-09-22,2012-12-21,"Private, ltd by shares"153,1274638,"HONG KONG QINYE HOLDINGS DEVELOPMENT CO., LIMITED
香港秦業集團發展有限公司",2008-09-22,2013-12-13,"Private, ltd by shares"154,1274402,"HONG KONG RUI FENG KNIVES LIMITED
香港銳鋒刀具有限公司",2008-09-22,2013-03-01,"Private, ltd by shares"155,1274561,"HONG KONG SHUWA INTERNATIONAL TRADING LIMITED
香港修和國際貿易有限公司",2008-09-22,2017-02-10,"Private, ltd by shares"156,1274370,"HONG KONG STUDENT LITERATURE PRESS COMPANY LIMITED
香港學生文藝出版社有限公司",2008-09-22,,"Private, ltd by shares"157,1274453,"HONG KONG TIDA INTERNATIONAL LIMITED
香港天德國際有限公司",2008-09-22,2015-01-30,"Private, ltd by shares"158,1274628,"HONG KONG TONG YU NEW ENERGY ELECTRICAL TECHNOLOGY LIMITED
中港通宇智能發電有限公司",2008-09-22,2010-12-31,"Private, ltd by shares"159,1274582,"HONGKONG CHANG YOU TRADE CO., LIMITED
香港昌友貿易有限公司",2008-09-22,2012-10-05,"Private, ltd by shares"160,1274573,"HONGKONG DEIRA INDUSTRIAL LIMITED
香港帝瑞實業有限公司",2008-09-22,,"Private, ltd by shares"161,1274330,"HONGKONG HAIYI TECHNOLOGY LIMITED (d2011-02-11)
香港海易科技有限公司",2008-09-22,2011-02-11,"Private, ltd by shares"162,1274622,"HONGKONG HUAXIA HOLDING GROUP CO., LIMITED
香港華夏控股集團有限公司",2008-09-22,2017-01-06,"Private, ltd by shares"163,1274504,"HONGKONG I-COLOR TECHNOLOGY DEVELOPMENT CO., LIMITED
香港愛色彩科技發展有限公司",2008-09-22,2018-02-15,"Private, ltd by shares"164,1274522,"HONGKONG MERIT LUCK TECHNOLOGY DEVELOPMENT LIMITED
香港名利宏達科技發展有限公司",2008-09-22,2012-12-21,"Private, ltd by shares"165,1274518,"HONGKONG MINGDI ELECTRONIC INDUSTRIAL CO., LIMITED
香港銘迪電子實業有限公司",2008-09-22,,"Private, ltd by shares"166,1274326,"HONGKONG SHENGDA AUTOMATIC CONTROL ENGINEERING LIMITED
香港勝達自控工程有限公司",2008-09-22,,"Private, ltd by shares"167,1274386,"HONGKONG XIEHONG ACRYLIC PRODUCTS CO., LIMITED
香港協宏壓克力製品有限公司",2008-09-22,,"Private, ltd by shares"168,1274623,"Hongkong Youngtop International Trade Co., Limited
香港仰拓國際貿易有限公司",2008-09-22,2018-09-21,"Private, ltd by shares"169,1274534,"HONGKONG YUNCHANG INTERNATIONAL TRADE LIMITED
香港鋆昌國際貿易有限公司",2008-09-22,2015-01-30,"Private, ltd by shares"170,1274345,"HONGKONG ZHENGSHUN ELECTRIC APPLIANCE LIMITED
香港正順電器有限公司",2008-09-22,2012-12-21,"Private, ltd by shares"171,1274510,"HONGKONG ZUNKE MARITIME EQUIPMENT LIMITED
香港尊科海事設備有限公司",2008-09-22,2019-05-24,"Private, ltd by shares"172,1274600,"HONGYI PRECISION (HK) LIMITED
鴻益精密(香港)有限公司",2008-09-22,2016-05-13,"Private, ltd by shares"173,1274354,"HOP YING LOGISTICS LIMITED
合盈集運有限公司",2008-09-22,,"Private, ltd by shares"174,1274468,"HOPE CHINA INDUSTRIAL CO., LIMITED
合譜實業有限公司",2008-09-22,,"Private, ltd by shares"175,1274356,"Hotel Corp (China) Limited
泰美酒店顧問管理有限公司",2008-09-22,,"Private, ltd by shares"176,1274632,"HUA SHI TECHNOLOGY (HK) DEVELOPMENT CO., LIMITED
華氏科技(香港)發展有限公司",2008-09-22,,"Private, ltd by shares"177,1274408,"HUAMEI THREAD COMPANY LIMITED
華玫線業有限公司",2008-09-22,2018-12-21,"Private, ltd by shares"178,1274552,"HUBEI SHISHOU KEDUN AUTO PARTS LIMITED
湖北石首鈳盾汽車零部件有限公司",2008-09-22,,"Private, ltd by shares"179,1274591,"HUITONG EDUCATION CO., LIMITED
匯通教育有限公司",2008-09-22,2012-12-21,"Private, ltd by shares"180,1274376,"Hung Shui Cordial Engineering Company Limited
鴻瑞創誠有限公司",2008-09-22,,"Private, ltd by shares"181,1274323,"IAN INTERNATIONAL CO., LIMITED",2008-09-22,2015-01-30,"Private, ltd by shares"182,1274337,"Ideal Energy &amp; Resources Limited",2008-09-22,2012-12-21,"Private, ltd by shares"183,1274333,"INFOTECH RESOURCES CO., LIMITED
迅科資源有限公司",2008-09-22,,"Private, ltd by shares"184,1274437,"Ingram Partnership Limited (The) (d2014-01-03)",2008-09-22,2014-01-03,"Private, ltd by shares"185,1274399,"INTERNATIONAL KAITAI ECONOMY TRADING CO., LIMITED
國際開泰經貿有限公司",2008-09-22,2012-12-21,"Private, ltd by shares"186,1274592,"ITALY BOSS FASHION INTERNATIONAL GROUP (HONG KONG) SHARE LIMITED
意大利波士服飾國際集團(香港)股份有限公司",2008-09-22,2012-12-21,"Private, ltd by shares"187,1274419,"ITALY UEDA PUMP CO., LIMITED
意大利上田泵有限公司",2008-09-22,2012-12-21,"Private, ltd by shares"188,1274605,"J.R DESIGN (HK) INTERNATIONAL CO., LIMITED
景然設計(香港)國際有限公司",2008-09-22,2015-01-30,"Private, ltd by shares"189,1274655,"JACKSON INVESTMENT GROUP LIMITED",2008-09-22,2014-01-03,"Private, ltd by shares"190,1274533,"JDEFU TECHNOLOGY LIMITED
杰德福科技有限公司",2008-09-22,2016-08-12,"Private, ltd by shares"191,1274343,"JETA BUSINESS LIMITED",2008-09-22,2018-06-22,"Private, ltd by shares"192,1274381,"JIAN CHUAN ENTERPRISE LIMITED
江船企業有限公司",2008-09-22,2017-01-13,"Private, ltd by shares"193,1274407,"JIANGSU ESTECH CHEMICAL COMPANY LIMITED
江蘇易誠化工有限公司",2008-09-22,2012-03-16,"Private, ltd by shares"194,1274572,"JINDIE INVESTMENT CO., LIMITED
金蝶投資有限公司",2008-09-22,2012-12-21,"Private, ltd by shares"195,1274322,"JINLI (H.K) INTERNATIONAL CO., LIMITED (d2015-07-31)
香港駿利國際有限公司",2008-09-22,2015-07-31,"Private, ltd by shares"196,1274387,"JISUN INTERNATIONAL DEVELOPMENT COMPANY LIMITED
吉臣國際發展有限公司",2008-09-22,2018-05-04,"Private, ltd by shares"197,1274357,"John Either International Trading Company Limited
駿羿國際貿易有限公司",2008-09-22,2015-02-27,"Private, ltd by shares"198,1274436,"JOY GREAT INTERNATIONAL LIMITED
悅宏國際有限公司",2008-09-22,,"Private, ltd by shares"199,1274625,"JSITEK TECHNOLOGY CO., LIMITED",2008-09-22,2014-06-13,"Private, ltd by shares"200,1274427,"JT GROUP HOLDINGS LIMITED
傑蒂國際貿易有限公司",2008-09-22,2017-12-08,"Private, ltd by shares"201,1274367,"JUMBO PLUS FURNITURE COMPANY LIMITED",2008-09-22,2012-06-01,"Private, ltd by shares"202,1274604,"JZ ELECTRONICS TECHNOLOGY CO., LIMITED
捷讚電子科技有限公司",2008-09-22,2016-12-23,"Private, ltd by shares"203,1274338,"KAITRUE ELECTRONICS LIMITED",2008-09-22,2015-01-30,"Private, ltd by shares"204,1274612,"KAYUEN TRANSLATION SERVICE LIMITED
加源翻譯服務有限公司",2008-09-22,2010-03-05,"Private, ltd by shares"205,1274609,"KEI CHING CONSTRUCTION (HK) CO. LIMITED
基正工程(香港)有限公司",2008-09-22,2012-03-23,"Private, ltd by shares"206,1274667,"KING KONG CARE CO., LIMITED
金剛實業有限公司",2008-09-22,2019-05-10,"Private, ltd by shares"207,1274666,"King's International Hotel Management Limited
帝豪國際酒店管理有限公司",2008-09-22,,"Private, ltd by shares"208,1274645,"KINGXU TRADING (HONGKONG) CO., LIMITED
金旭貿易(香港)有限公司",2008-09-22,,"Private, ltd by shares"209,1274590,"KONDE TECHNOLOGY (HK) COMPANY LIMITED
眾金盛科技(香港)有限公司",2008-09-22,2018-03-02,"Private, ltd by shares"210,1274378,"KONGWELL DEVELOPMENT LIMITED
廣滿發展有限公司",2008-09-22,2018-02-02,"Private, ltd by shares"211,1274347,"KY MODEL COMPANY LIMITED
高鷹模型有限公司",2008-09-22,2017-03-17,"Private, ltd by shares"212,1274439,"L &amp; Y SHIPPING CO., LIMITED
隆洋船務有限公司",2008-09-22,2015-03-20,"Private, ltd by shares"213,1274520,"L.S. CHAN'S (HK) COMPANY LIMITED
樂施(香港)有限公司",2008-09-22,2014-01-03,"Private, ltd by shares"214,1274366,"LA FORTE LIMITED
利福通有限公司",2008-09-22,2020-06-19,"Private, ltd by shares"215,1274662,"LANTU INVESTMENT CO., LIMITED
藍圖投資有限公司",2008-09-22,2012-12-21,"Private, ltd by shares"216,1274312,"Latin American Agency Limited",2008-09-22,,"Private, ltd by shares"217,1274327,"LAUDA TRADING LIMITED (HK)",2008-09-22,,"Private, ltd by shares"