,Reg no.,Name,Incorp-orated,Dissolved,Type431,1608730,"MOWO (HK) LIMITED
沐禾(香港)有限公司",2011-05-30,,"Private, ltd by shares"432,1608823,"MR WIDE GROUP (HONG KONG) CO., LIMITED
奧廣集團(香港)有限公司",2011-05-30,2015-06-19,"Private, ltd by shares"433,1608734,"MSC Group (Hong Kong) Limited
麥克集團(香港)有限公司",2011-05-30,,"Private, ltd by shares"434,1608991,"MSL STEEL LIMITED",2011-05-30,,"Private, ltd by shares"435,1608719,"MY CHOCOLATE SHOP LIMITED (HK)
香港巧克力專門店有限公司",2011-05-30,,"Private, ltd by shares"436,1609245,"MY LUCKY COMPANY LIMITED",2011-05-30,,"Private, ltd by shares"437,1609157,"NAM LOI COMPANY LIMITED
南來有限公司",2011-05-30,,"Private, ltd by shares"438,1608951,"NATIONAL EXPRESS DISTRIBUTION. LIMITED",2011-05-30,,"Private, ltd by shares"439,1608960,"NAV YASH EXIM LIMITED",2011-05-30,,"Private, ltd by shares"440,1608920,"NBC ELECTRONICS LIMITED",2011-05-30,2015-06-19,"Private, ltd by shares"441,1608714,"NEW ENERGY GLOBAL INVESTMENT CORPORATION LIMITED
新能量國際投資有限公司",2011-05-30,2017-01-27,"Private, ltd by shares"442,1608858,"NEW ENTERPRISES CONSULTANTS LIMITED
新成企業顧問有限公司",2011-05-30,2018-01-05,"Private, ltd by shares"443,1609281,"NEW FAVOUR HOLDINGS LIMITED
嘉惠控股有限公司",2011-05-30,,"Private, ltd by shares"444,1608679,"New Horizon Resort (Macau) Limited
新時空旅遊度假(澳門)有限公司",2011-05-30,2015-06-19,"Private, ltd by shares"445,1609094,"NEW WELL FOOD &amp; BEVERAGE HOLDINGS LIMITED
新興飲食集團有限公司",2011-05-30,,"Private, ltd by shares"446,1609178,"NEWAU INTERNATIONAL (HONGKONG) LIMITED
新澳國際(香港)有限公司",2011-05-30,2019-03-08,"Private, ltd by shares"447,1608854,"NEWAY ASSET MANAGEMENT COMPANY LIMITED
新威基金管理有限公司",2011-05-30,,"Private, ltd by shares"448,1608833,"NEWAY SECURITIES COMPANY LIMITED
新威證券有限公司",2011-05-30,,"Private, ltd by shares"449,1609016,"NEWBASE INDUSTRIAL LIMITED
信基實業有限公司",2011-05-30,,"Private, ltd by shares"450,1609279,"NEWTAITAI (CHINA) BEAUTY GROUP LIMITED
新太太(中國)美容集團有限公司",2011-05-30,,"Private, ltd by shares"451,1609284,"NEXT ORIENT LIMITED
拔群有限公司",2011-05-30,2013-05-03,"Private, ltd by shares"452,1609040,"NHI HA IMPORT EXPORT INVESTMENT GROUP JOINT STOCK COMPANY LIMITED",2011-05-30,2015-06-19,"Private, ltd by shares"453,1608836,"NINGBO EASTERN INTERNATIONAL TRADE CO., LIMITED
寧波東方國際貿易有限公司",2011-05-30,2016-02-19,"Private, ltd by shares"454,1608942,"NINGBO IN-TOPS CO., LIMITED
寧波羿拓貿易有限公司",2011-05-30,2014-09-12,"Private, ltd by shares"455,1608698,"NINGBO XIANGJI INTERNATIONAL LOGISTICS CO., LIMITED
寧波翔驥國際物流有限公司",2011-05-30,2020-11-06,"Private, ltd by shares"456,1609032,"NORTHERN LAND LIMITED (HK)
北地有限公司",2011-05-30,,"Private, ltd by shares"457,1609037,"Nscglobal Limited",2011-05-30,,"Private, ltd by shares"458,1609271,"Number Four Limited",2011-05-30,2018-01-05,"Private, ltd by shares"459,1608986,"O2 WORKSHOP LIMITED
奧義有限公司",2011-05-30,,"Private, ltd by shares"460,1609232,"OKAYAMA INTERNATIONAL LIMITED
岡山國際有限公司",2011-05-30,2017-09-01,"Private, ltd by shares"461,1608831,"Olimpic Industrial Co., Limited
歐霖實業有限公司",2011-05-30,2018-11-23,"Private, ltd by shares"462,1608834,"OML TECH LIGHTING LIMITED",2011-05-30,2020-04-17,"Private, ltd by shares"463,1608970,"OTTO AUTO ACCESSORIES CO., LIMITED
歐拓汽車配件有限公司",2011-05-30,,"Private, ltd by shares"464,1608931,"OUGE HOLDING CO., LIMITED
歐歌股份有限公司",2011-05-30,,"Private, ltd by shares"465,1608841,"OUTBOX COMMUNICATIONS LIMITED
東瑩傳訊有限公司",2011-05-30,2013-04-19,"Private, ltd by shares"466,1609185,"Overtime International Co., Limited
超時國際股份有限公司",2011-05-30,2016-01-22,"Private, ltd by shares"467,1608722,"P &amp; S ELECTRONICS TECHNOLOGY CORPORATION LIMITED
恒誠電子科技有限公司",2011-05-30,,"Private, ltd by shares"468,1609042,"P&amp;G TOYS INDUSTRY LIMITED (THE)",2011-05-30,2017-08-25,"Private, ltd by shares"469,1608675,"PACIFIC RIM CONNECTIONS (HK) LIMITED
亞洲海外聯合(香港)有限公司",2011-05-30,2018-01-05,"Private, ltd by shares"470,1609295,"Parana Hong Kong Limited",2011-05-30,2019-02-01,"Private, ltd by shares"471,1608917,"PARKSON PHARMACEUTICAL (H.K.) COMPANY LIMITED
百盛葯業(香港)有限公司",2011-05-30,,"Private, ltd by shares"472,1608791,"PARROT &amp; PARROT INDUSTRIAL LIMITED
香港派若特實業有限公司",2011-05-30,2015-06-19,"Private, ltd by shares"473,1609285,"Partner Plus Investments Limited
精一投資有限公司",2011-05-30,,"Private, ltd by shares"474,1608725,"PEKING UNIVERSITY HOSPITAL INVESTMENT MANAGEMENT LIMITED
北大醫院投資管理有限公司",2011-05-30,,"Private, ltd by shares"475,1609111,"PERSIAN EMPIRE GROUP CO., LIMITED
波斯帝國集團有限公司",2011-05-30,2017-01-27,"Private, ltd by shares"476,1609003,"PHYSI LIMITED",2011-05-30,2015-08-28,"Private, ltd by shares"477,1609159,"PINORT GROUP (HK) CO., LIMITED
品諾集團(香港)有限公司",2011-05-30,2019-05-03,"Private, ltd by shares"478,1608712,"PLATON GROUP LIMITED",2011-05-30,2020-04-17,"Private, ltd by shares"479,1608801,"PLAZAMAYOR (HONG KONG) LIMITED",2011-05-30,,"Private, ltd by shares"480,1609145,"POOYA (HK) CO., LIMITED",2011-05-30,2015-10-09,"Private, ltd by shares"481,1608877,"POSEIDON OUTDOOR PRODUCTS CO., LIMITED
波賽東戶外有限公司",2011-05-30,,"Private, ltd by shares"482,1608765,"Powever Technology (Shenzhen) Co., Limited
音訊科技(深圳)有限公司",2011-05-30,,"Private, ltd by shares"483,1609256,"PRB Legal Solutions Limited",2011-05-30,,"Private, ltd by shares"484,1608816,"PROPERTY LINK LIMITED
物業網絡有限公司",2011-05-30,,"Private, ltd by shares"485,1609288,"PROSPER BEYOND LIMITED
尤智有限公司",2011-05-30,2015-06-26,"Private, ltd by shares"486,1608689,"PUENDO COMPANY LIMITED
普恩多有限公司",2011-05-30,,"Private, ltd by shares"487,1608900,"QUZHOU SENIO MACHINERY GROUP CO., LIMITED
衢州聖諾機械集團有限公司",2011-05-30,,"Private, ltd by shares"488,1609036,"R&amp;R Design Consultancy Limited
竣威設計顧問有限公司",2011-05-30,2013-10-25,"Private, ltd by shares"489,1609033,"RAYO CREATIVE COMMUNICATIONS LIMITED
傲創意傳訊有限公司",2011-05-30,2015-08-21,"Private, ltd by shares"490,1608852,"RCL LIGHTING LIMITED
興華照明有限公司",2011-05-30,,"Private, ltd by shares"491,1609233,"REALM SHIPPING LIMITED
瑞來船務有限公司",2011-05-30,2013-11-01,"Private, ltd by shares"492,1608721,"RED &amp; WOOD INTERNATIONAL TRADING LIMITED
紅木國際貿易有限公司",2011-05-30,2016-10-28,"Private, ltd by shares"493,1608718,"RED INFINITY LIMITED",2011-05-30,,"Private, ltd by shares"494,1608945,"RED STAR INTERNATIONAL LIGHTING TECHNOLOGY CO., LIMITED
紅星國際照明科技有限公司",2011-05-30,,"Private, ltd by shares"495,1609105,"RESOURCES ZIRCONIUM INDUSTRY (H.K.) LIMITED
萬源鋯業(香港)有限公司",2011-05-30,2013-11-22,"Private, ltd by shares"496,1608914,"REX MOTORS AND TRADING LIMITED
美時汽車及貿易有限公司",2011-05-30,,"Private, ltd by shares"497,1608861,"RIOO TRADING CO., LIMITED
瑞歐貿易有限公司",2011-05-30,2016-08-26,"Private, ltd by shares"498,1609066,"RISHENGZHAI (GROUP)MOSLEM FOOD IMP &amp; EXP TRADING COMPANY LIMITED
日盛齋(集團)清真食品進出口貿易有限公司",2011-05-30,2016-01-22,"Private, ltd by shares"499,1608797,"Risk Engineering Solutions (RES) Limited
銳仕工程有限公司",2011-05-30,2018-02-02,"Private, ltd by shares"500,1608880,"RISKER INDUSTRIAL LIMITED
力卡實業有限公司",2011-05-30,2017-09-22,"Private, ltd by shares"501,1608653,"ROC International Limited (HK)
鎏君國際貿易有限公司",2011-05-30,,"Private, ltd by shares"502,1609065,"RONGLI CAPITAL CO., LIMITED
融利資本有限公司",2011-05-30,,"Private, ltd by shares"503,1609226,"ROSY FRONTIER LIMITED",2011-05-30,,"Private, ltd by shares"504,1609072,"ROYAL DIAMOND INTERNATIONAL LIMITED
皇家鑽石國際有限公司",2011-05-30,,"Private, ltd by shares"505,1608843,"ROYAL REGENT PRODUCTS INDUSTRIES LIMITED
華登製品實業有限公司",2011-05-30,,"Private, ltd by shares"506,1609216,"RUI INTERNATIONAL TRADING LIMITED
瑠偉國際貿易有限公司",2011-05-30,,"Private, ltd by shares"507,1609142,"RUITIAN INTERNATIONAL (HK) INDUSTRIAL CO., LIMITED
瑞天國際(香港)集團實業有限公司",2011-05-30,2015-06-19,"Private, ltd by shares"508,1609035,"S &amp; J Enterprises Limited (d2014-02-28)",2011-05-30,2014-02-28,"Private, ltd by shares"509,1608668,"S.I.R. Alesund Hong Kong Limited
歐樂森香港有限公司",2011-05-30,2018-02-02,"Private, ltd by shares"510,1609028,"SAI CHING COMPANY LIMITED
西青有限公司",2011-05-30,,"Private, ltd by shares"511,1609087,"SAINTECH INDUSTRY CO., LIMITED
信泰康實業有限公司",2011-05-30,2014-03-07,"Private, ltd by shares"512,1608752,"SAM DESIGN AND BUILDING COMPANY LIMITED
森武設計工程有限公司",2011-05-30,,"Private, ltd by shares"513,1608731,"SAM THREE LIMITED",2011-05-30,2017-01-27,"Private, ltd by shares"514,1608790,"SANCAR INTERNATIONAL IMP&amp;EXP LIMITED",2011-05-30,2018-01-05,"Private, ltd by shares"515,1609198,"SAPSAN COMPANY LIMITED
薩普桑有限公司",2011-05-30,,"Private, ltd by shares"516,1609146,"SCOUT SCIENCE AND TECHNOLOGY CO., LIMITED
思科得科技有限公司",2011-05-30,2018-09-21,"Private, ltd by shares"517,1609222,"SERENDIPITYCHAIN INTERNATIONAL CO., LIMITED
賽瑞派德國際(香港)有限公司",2011-05-30,,"Private, ltd by shares"518,1608751,"SG GLOBAL LINK LIMITED",2011-05-30,2015-11-20,"Private, ltd by shares"519,1608933,"SHAMROCK TRADING CO., LIMITED (d2015-06-19)
三葉草貿易有限公司",2011-05-30,2015-06-19,"Private, ltd by shares"520,1609075,"SHANDONG OF YANKUANG GROUP MATERIAL TRADING CO., LIMITED
山東省兗礦集團物資貿易有限公司",2011-05-30,2015-06-19,"Private, ltd by shares"521,1609249,"SHANDONG WEIMENG ENGINEERING MACHINERY CO., LIMITED
山東威猛工程機械有限公司",2011-05-30,,"Private, ltd by shares"522,1608758,"SHANGHAI BESTHA CO., LIMITED
上海百事德企業有限公司",2011-05-30,2020-01-24,"Private, ltd by shares"523,1608686,"SHANGHAI FAR SEALAND TECHNOLOGY CO., LIMITED
上海遠方海陸科技有限公司",2011-05-30,,"Private, ltd by shares"524,1608789,"SHANGHAI XRL DRESS CO., LIMITED
上海雪絨鹿服飾有限公司",2011-05-30,,"Private, ltd by shares"525,1609181,"SHANGJIE INTERNATIOANAL GROUP CO., LIMITED
尚潔國際集團有限公司",2011-05-30,2016-06-10,"Private, ltd by shares"526,1608832,"SHEN SHING LIMITED
深成有限公司",2011-05-30,,"Private, ltd by shares"527,1609248,"SHENZHEN C-TRONICS CO., LIMITED
深圳思創力維科技有限公司",2011-05-30,,"Private, ltd by shares"528,1609107,"Shenzhen CSE Technology Co., Limited
深圳市冠碩電子科技有限公司",2011-05-30,,"Private, ltd by shares"529,1609206,"SHENZHEN SEALINE TECHNOLOGY COMPANY LIMITED
深圳鑫源科技有限公司",2011-05-30,2016-04-22,"Private, ltd by shares"530,1608866,"SHENZHEN XIANSE SOFTSTYLE FURNITURE CO., LIMITED (d2017-01-27)
深圳纖色軟體家具有限公司",2011-05-30,2017-01-27,"Private, ltd by shares"531,1609122,"SHENZHEN YIKANG ZHONGWEI INDUSTRY CO., LIMITED
深圳億康中為實業有限公司",2011-05-30,2015-06-19,"Private, ltd by shares"532,1608784,"SHENZHENSHI ARMANI HONOR EAGLE DRESS LIMITED
深圳市阿瑪尼尊鷹服飾有限公司",2011-05-30,2015-06-19,"Private, ltd by shares"533,1609018,"Shichuang Healthcare Group Co., Limited
時創醫療集團有限公司",2011-05-30,2016-05-13,"Private, ltd by shares"534,1608959,"SHIJIAZHUANG YUANMENG MAKING CLOTHING LIMITED",2011-05-30,2015-06-19,"Private, ltd by shares"535,1609069,"SIGA TECHNOLOGY HOLDINGS CO., LIMITED
斯嘉科技股份有限公司",2011-05-30,2020-04-17,"Private, ltd by shares"536,1609048,"SINO GLORY ENTERPRISE GROUP CO., LIMITED
鴻泰實業集團有限公司",2011-05-30,,"Private, ltd by shares"537,1609009,"SINOSOFT (INTERNATIONAL) CO., LIMITED
中科軟科技(國際)有限公司",2011-05-30,,"Private, ltd by shares"538,1608997,"SINOTIMEX INTERNATIONAL DEVELOPMENT LIMITED
天幕國際發展有限公司",2011-05-30,2015-06-19,"Private, ltd by shares"539,1608996,"SKY SUCCESS DEVELOPMENT LIMITED
佳勝發展有限公司",2011-05-30,,"Private, ltd by shares"540,1608724,"SKY TECH INTERNATIONAL DEVELOPMENT LIMITED
天德國際發展有限公司",2011-05-30,2014-12-24,"Private, ltd by shares"541,1608810,"SL NETWORK LIMITED",2011-05-30,,"Private, ltd by shares"542,1609101,"SLIWAL PARTITION COMPANY LIMITED",2011-05-30,2020-04-03,"Private, ltd by shares"543,1609230,"SMART DEVICE INVESTMENTS LIMITED",2011-05-30,,"Private, ltd by shares"544,1608820,"SOMPA KITCHEN (FRANCE) LIMITED
尚美派廚衛(法國)有限公司",2011-05-30,,"Private, ltd by shares"545,1609189,"SOUTH EAST MOULD CO., LIMITED
東南科技有限公司",2011-05-30,2018-01-05,"Private, ltd by shares"546,1609092,"SOUTHERN MAGNOLIA LIMITED",2011-05-30,2014-12-05,"Private, ltd by shares"547,1609010,"STAR (HK) EXPORT &amp; IMPORT CO., LIMITED",2011-05-30,,"Private, ltd by shares"548,1608821,"STAR (HK) INTERNATIONAL TRADING CO., LIMITED",2011-05-30,2019-03-15,"Private, ltd by shares"549,1609047,"STAR LOGISTICS INTERNATIONAL LIMITED",2011-05-30,2015-06-19,"Private, ltd by shares"550,1608776,"STRAITS GROUP HOLDINGS LIMITED (HK)
海峽集團控股有限公司",2011-05-30,,"Private, ltd by shares"551,1608747,"SUN LONG (HONG KONG) ENTERPRISES LIMITED
新隆(香港)企業有限公司",2011-05-30,2012-09-21,"Private, ltd by shares"552,1608869,"SUNBASE ENTERPRISES LIMITED
信基企業有限公司",2011-05-30,,"Private, ltd by shares"553,1608779,"SUNBERISING (HK) INDUSTRIAL CO., LIMITED
三和興(香港)實業有限公司",2011-05-30,2015-06-19,"Private, ltd by shares"554,1609190,"SUNRISE SHIPPING CO., LIMITED (b2011-05-30)
旭日國際航運有限公司",2011-05-30,,"Private, ltd by shares"555,1609086,"SUNSHINE CORPORATION DEVELOPMENT LIMITED
旭宏興業發展有限公司",2011-05-30,,"Private, ltd by shares"556,1608893,"SUPER FAIR (H.K.) LIMITED
港發(香港)有限公司",2011-05-30,2017-02-24,"Private, ltd by shares"557,1608930,"Synergy Outdoors Asia, Limited",2011-05-30,,"Private, ltd by shares"558,1608762,"SYNLIN PHARMACEUTICALS LIMITED
欣林藥物研發有限公司",2011-05-30,2014-11-21,"Private, ltd by shares"559,1608760,"Szone Group Co., Limited
神州禹業集團有限公司",2011-05-30,,"Private, ltd by shares"560,1608753,"T. C. LI LIMITED",2011-05-30,,"Private, ltd by shares"561,1609296,"TAI CHI (CHINA HONG KONG) INVESTMENT CONSULTANTS LIMITED
太子(粵港) 投資顧問有限公司",2011-05-30,2019-03-08,"Private, ltd by shares"562,1609077,"TAI TON ICE COMPANY LIMITED
大同冰粒有限公司",2011-05-30,2013-08-16,"Private, ltd by shares"563,1609022,"TAMMY INTERNATIONAL LIMITED
覃嵋國際有限公司",2011-05-30,,"Private, ltd by shares"564,1608775,"Tamor Software Limited
達摩爾軟件有限公司",2011-05-30,2018-01-05,"Private, ltd by shares"565,1608710,"TAO YUEN RESTAURANT LIMITED
桃園餐廳有限公司",2011-05-30,,"Private, ltd by shares"566,1609179,"TASTE XUAN DIET (GROUP) CO., LIMITED
品味軒飲食(集團)有限公司",2011-05-30,2018-11-09,"Private, ltd by shares"567,1608723,"Technofinder International Limited
俊豪貿易國際有限公司",2011-05-30,2014-11-07,"Private, ltd by shares"568,1608973,"Telefield India Limited",2011-05-30,,"Private, ltd by shares"569,1608980,"THREE AND HALF LIMITED
叁斤半．瓜菓菜有限公司",2011-05-30,,"Private, ltd by shares"570,1609079,"THRIVE LIMITED (d2011-12-30)
富尚軒有限公司",2011-05-30,2011-12-30,"Private, ltd by shares"571,1608875,"TIAN HUA TRADING (HK) CO., LIMITED
天華貿易(香港)有限公司",2011-05-30,2013-07-05,"Private, ltd by shares"572,1609073,"TIANJIN CHAOYANG ELECTRIC VEHICLE ASSEMBLY CO., LIMITED
天津朝陽電動車組裝責任有限公司",2011-05-30,2015-06-19,"Private, ltd by shares"573,1608772,"TIANZHI TRADING CO., LIMITED
添志貿易有限公司",2011-05-30,2017-01-27,"Private, ltd by shares"574,1609041,"Tick Your Time Limited",2011-05-30,2016-02-12,"Private, ltd by shares"575,1609135,"TOH YUEN (HONG KONG) COMPANY LIMITED
桃園(香港)有限公司",2011-05-30,2013-06-14,"Private, ltd by shares"576,1608837,"TONGLIDA INDUSTRY (HK) LIMITED
同利達實業(香港)有限公司",2011-05-30,2016-03-24,"Private, ltd by shares"577,1608981,"TOP FORTUNE COMPANY LIMITED
足富有限公司",2011-05-30,,"Private, ltd by shares"578,1608878,"TOP IMAGE INVESTMENT LIMITED (d2015-06-19)
彩美投資有限公司",2011-05-30,2015-06-19,"Private, ltd by shares"579,1608903,"TOPFINE (H.K.) LIMITED
瑞發(香港)有限公司",2011-05-30,,"Private, ltd by shares"580,1608871,"TOPPROMO TECHNOLOGY LIMITED",2011-05-30,2015-06-19,"Private, ltd by shares"581,1609289,"TOTAL PERFECT LIMITED
堅巧有限公司",2011-05-30,,"Private, ltd by shares"582,1609014,"TRENDWIN HOLDINGS LIMITED
昌成集團有限公司",2011-05-30,,"Private, ltd by shares"583,1609210,"Triple Golden Industry Limited
香港裕鑫實業有限公司",2011-05-30,2015-06-19,"Private, ltd by shares"584,1608838,"TRIUMPHY TRADE CO., LIMITED",2011-05-30,2017-01-27,"Private, ltd by shares"585,1609004,"TUNG HO ENTERPRISE LIMITED
東浩企業有限公司",2011-05-30,,"Private, ltd by shares"586,1609062,"TWINKI LIMITED",2011-05-30,2018-11-16,"Private, ltd by shares"587,1608856,"ULTRAMAX DEVELOPMENT LIMITED
萬達美發展有限公司",2011-05-30,2014-10-10,"Private, ltd by shares"588,1608884,"ULTRAMAX INVESTMENT LIMITED
萬達美投資有限公司",2011-05-30,,"Private, ltd by shares"589,1609093,"UNILUCK HOLDINGS LIMITED
運好集團有限公司",2011-05-30,,"Private, ltd by shares"590,1608780,"UNITED ANEX STONE LIMITED
華寶石材有限公司",2011-05-30,2019-01-18,"Private, ltd by shares"591,1608901,"UNTER INTERNATIONAL CO., LIMITED",2011-05-30,,"Private, ltd by shares"592,1608743,"US-China International Trade Co., Limited
美中國際貿易有限公司",2011-05-30,2020-04-09,"Private, ltd by shares"593,1608706,"USA APPLE TECHNOLOGY SANITARY WARE LIMITED
美國蘋果科技衛浴有限公司",2011-05-30,2016-01-22,"Private, ltd by shares"594,1609215,"USA PLAYBOY GROUP LUCKY RABBIT HOME TEXTILES LIMITED
美國花花公子集團幸運兔家紡有限公司",2011-05-30,,"Private, ltd by shares"595,1609203,"VALIN STEEL PIPE HONGKONG LIMITED
香港威聯管業有限公司",2011-05-30,2012-06-29,"Private, ltd by shares"596,1608952,"VANSTAR INDUSTRIAL HOLDINGS LIMITED
萬仕達實業控股有限公司",2011-05-30,2017-01-27,"Private, ltd by shares"597,1608663,"VEAYA GLOBAL HK LIMITED
毅昇環球香港有限公司",2011-05-30,2017-01-27,"Private, ltd by shares"598,1608682,"VERITAS MEDICAL CENTRE LIMITED",2011-05-30,,"Private, ltd by shares"599,1609177,"VIBRANT SUCCESS HOLDINGS LIMITED
名業控股有限公司",2011-05-30,2013-09-19,"Private, ltd by shares"600,1609164,"VINPRO CO., LIMITED
萬晟實業發展有限公司",2011-05-30,,"Private, ltd by shares"601,1608728,"VINTAGE INVESTMENTS (HOLDING) COMPANY LIMITED
經典投資(控股)有限公司",2011-05-30,,"Private, ltd by shares"602,1609238,"VIVA CENTURY LIMITED",2011-05-30,2013-02-15,"Private, ltd by shares"603,1608855,"WALONG (HK) PRECISION CO., LIMITED
華隆香港精密有限公司",2011-05-30,2018-06-08,"Private, ltd by shares"604,1608850,"WAN MING LED LIGHTING CO., LIMITED
萬明照明有限公司",2011-05-30,2015-06-19,"Private, ltd by shares"605,1609229,"WANFANG INTERNATIONAL TRADE CO., LIMITED
萬芳國際貿易有限公司",2011-05-30,,"Private, ltd by shares"606,1609161,"WATER CODE MEMBRANE TECHNOLOGY COMPANY LIMITED
海科濾膜科技有限公司",2011-05-30,,"Private, ltd by shares"607,1608922,"WATERFALL TRADING LIMITED (d2012-11-23)
興朝貿易有限公司",2011-05-30,2012-11-23,"Private, ltd by shares"608,1608738,"Wave5 Foundation Limited
伍濤基金會有限公司",2011-05-30,,"Ltd by guarantee"609,1608739,"WAY TACT BUSINESS CO. LIMITED
滙智盈商有限公司",2011-05-30,,"Private, ltd by shares"610,1609085,"WEITENG GROUP (HOLDINGS) LIMITED
偉騰集團(控股)有限公司",2011-05-30,,"Private, ltd by shares"611,1608657,"WELLY OFFICE FURNITURE COMPANY LIMITED
華利辦公室傢俱有限公司",2011-05-30,2017-01-27,"Private, ltd by shares"612,1608819,"Weltech Electronics Limited
威爾泰電子有限公司",2011-05-30,,"Private, ltd by shares"613,1609283,"WENZHOU GED INDUSTRIAL CO., LIMITED
溫州傑德實業有限公司",2011-05-30,,"Private, ltd by shares"614,1609031,"WESTERN AFRICA RESOURCES LIMITED
西非資源有限公司",2011-05-30,,"Private, ltd by shares"615,1609002,"WHITE SAN COMPANY LIMITED
白山有限公司",2011-05-30,,"Private, ltd by shares"616,1608666,"WILBUR D. BLUE HOUSE LIMITED
威柏藍屋(香港)有限公司",2011-05-30,2015-02-27,"Private, ltd by shares"617,1609084,"WILKS CO., LIMITED",2011-05-30,2012-11-16,"Private, ltd by shares"618,1608904,"WILLIAM GROUP (HK) CO., LIMITED
威廉集團(香港)有限公司",2011-05-30,,"Private, ltd by shares"619,1609276,"WINIFRED CLEANROOM &amp; ESD PRODUCTS (HONG KONG) LIMITED
衞利淨化產品(香港)有限公司",2011-05-30,,"Private, ltd by shares"620,1609286,"WISDOM GOLD INTERNATIONAL LIMITED
智濠國際有限公司",2011-05-30,2016-09-02,"Private, ltd by shares"621,1609005,"Wise Care Health Group Limited
頤正健康集團有限公司",2011-05-30,2015-05-29,"Private, ltd by shares"622,1609132,"WISE PINE DEVELOPMENT LIMITED
智柏發展有限公司",2011-05-30,2014-05-30,"Private, ltd by shares"623,1608830,"WONDERFUL SIX LIMITED",2011-05-30,2017-01-27,"Private, ltd by shares"624,1609235,"WONLONG TECHNOLOGY CO., LIMITED
旺龍科技有限公司",2011-05-30,2015-06-19,"Private, ltd by shares"625,1608704,"Wood Flourishing (Holdings) Limited
森烽控股有限公司",2011-05-30,,"Private, ltd by shares"626,1609294,"WORLD BULLION TRADERS LIMITED
五洲黃金交易有限公司",2011-05-30,,"Private, ltd by shares"627,1608963,"WORLD LUCK (HONGKONG) LIMITED
世吉(香港)有限公司",2011-05-30,,"Private, ltd by shares"628,1609160,"WORLD TRADE GROUP SHARE CO., LIMITED
世貿集團股份有限公司",2011-05-30,2020-11-06,"Private, ltd by shares"629,1609064,"WORLD WIDE TRADE GROUP LIMITED
世寬貿易集團有限公司",2011-05-30,2017-01-27,"Private, ltd by shares"630,1609251,"WUHAN SANXIN TRADING CO., LIMITED
三欣商貿進出口有限公司",2011-05-30,2018-07-20,"Private, ltd by shares"631,1608897,"XIANGQI TECHNOLOGY CO., LIMITED
祥祺科技有限公司",2011-05-30,,"Private, ltd by shares"632,1608699,"XIECHENG (HK) INTERNATIONAL LIMITED
協成(香港)國際有限公司",2011-05-30,2019-02-01,"Private, ltd by shares"633,1608678,"XIGUAN CONGEE &amp; NOODLE LIMITED
西關粥麵有限公司",2011-05-30,2020-11-13,"Private, ltd by shares"634,1609166,"XINGRUI TECHNOLOGY INDUSTRIAL CO., LIMITED
星瑞科技實業有限公司",2011-05-30,,"Private, ltd by shares"635,1608759,"XINGTAI ANDA GROUP LIMITED
刑台安達集團有限公司",2011-05-30,2015-06-19,"Private, ltd by shares"636,1608857,"XINXI INTERNATIONAL (HK) LIMITED
鑫喜國際(香港)有限公司",2011-05-30,2012-12-28,"Private, ltd by shares"637,1609278,"YANXIU (SHENZHEN) FASHION CO., LIMITED
琰繡(深圳)時裝有限公司",2011-05-30,,"Private, ltd by shares"638,1608771,"YAODING INTERNATIONAL LOGO (HK) DESIGN CO., LIMITED
堯鼎國際標識(香港)設計有限公司",2011-05-30,,"Private, ltd by shares"639,1608662,"Yellow Magic China Limited
東方神力有限公司",2011-05-30,2016-01-22,"Private, ltd by shares"640,1609187,"YELLOW-GLOBAL PROCUREMENT LIMITED",2011-05-30,2019-02-01,"Private, ltd by shares"641,1609172,"YEXIN CHEMICAL TRADE CO., LIMITED
曄欣化工貿易有限公司",2011-05-30,2012-09-28,"Private, ltd by shares"642,1608876,"YIRAN ENTERPRISE LIMITED
伊然實業有限公司",2011-05-30,2016-01-22,"Private, ltd by shares"643,1608870,"YIWU RUILI IMP&amp;EXP CO., LIMITED
義烏市瑞麗進出口有限公司",2011-05-30,2017-07-07,"Private, ltd by shares"644,1609220,"YONGRUI PRECISION METAL PRODUCTS CO., LIMITED (d2019-03-08)
永睿精密五金製品有限公司",2011-05-30,2019-03-08,"Private, ltd by shares"645,1609109,"YOUNGER CO., LIMITED
楊格爾有限公司",2011-05-30,,"Private, ltd by shares"646,1608939,"YU HUNG (HK) INTERNATIONAL CO., LIMITED
鈺鴻(香港)國際有限公司",2011-05-30,,"Private, ltd by shares"647,1609275,"YUNWEI GROUP HONGKONG LIMITED
運威集團香港有限公司",2011-05-30,2017-01-27,"Private, ltd by shares"648,1608773,"ZHEJIANG HYDA VALVE COMPANY LIMITED
浙江海達閥門有限公司",2011-05-30,,"Private, ltd by shares"649,1608691,"ZHENGJIN INTERNATIONAL TRADING LIMITED
正金國際貿易有限公司",2011-05-30,2015-06-19,"Private, ltd by shares"650,1608707,"ZHENGXIN TIRE (XIAMEN) RUBBER PRODUCTS LIMITED
正新輪胎(廈門)橡膠製品有限公司",2011-05-30,2015-06-19,"Private, ltd by shares"651,1609254,"ZHONG CHEOY LIAN INTERNATIONAL HOLDINGS LIMITED
中財聯國際控股有限公司",2011-05-30,,"Private, ltd by shares"652,1609228,"ZHONGCAI EDUCATION GROUP CO., LIMITED
中財教育集團有限公司",2011-05-30,2015-06-19,"Private, ltd by shares"653,1608913,"ZHONGLIAN INTERNATIONAL TECHNOLOGY CO., LIMITED
綜聯國際科技有限公司",2011-05-30,2015-03-13,"Private, ltd by shares"