,Reg no.,Name,Incorp-orated,Dissolved,Type1,1609116,"3A COATING EQUIPMENT COMPANY LIMITED
三埃塗裝設備有限公司",2011-05-30,2017-01-27,"Private, ltd by shares"2,1608665,"5 NOVEMBER 2009 HONG KONG LIMITED",2011-05-30,,"Private, ltd by shares"3,1608905,"A&amp;J INTERNATIONAL TRADING LIMITED (d2018-10-05)
愛家國際貿易有限公司",2011-05-30,2018-10-05,"Private, ltd by shares"4,1608979,"A-BRANDING (AB) COMPANY LIMITED
愛美嘉有限公司",2011-05-30,2015-03-13,"Private, ltd by shares"5,1608972,"A2 TRADING (HONGKONG) CO., LIMITED",2011-05-30,2018-01-05,"Private, ltd by shares"6,1609243,"ABLE ENERGY HOLDINGS LIMITED
萬貫控股有限公司",2011-05-30,,"Private, ltd by shares"7,1608671,"Absolut Zero Limited",2011-05-30,,"Private, ltd by shares"8,1609218,"AGIANTS TECHNOLOGY ASIA PACIFIC LIMITED
安建慈科技亞太有限公司",2011-05-30,2014-10-24,"Private, ltd by shares"9,1608899,"ALL COUNTRY TONE INDUSTRIAL (ASIA) GROUP LIMITED
全盛通實業(亞洲)集團有限公司",2011-05-30,2016-11-11,"Private, ltd by shares"10,1608817,"ALLIED TOP RESOURCES CO., LIMITED
聯高資源有限公司",2011-05-30,2015-06-19,"Private, ltd by shares"11,1609250,"ALPHA TEAM HOLDINGS LIMITED",2011-05-30,,"Private, ltd by shares"12,1608750,"ALTO RESOURCES COMPANY LIMITED
高拓礦業有限公司",2011-05-30,,"Private, ltd by shares"13,1608715,"AMPLUS BUSINESS SERVICES LIMITED
安博商務有限公司",2011-05-30,,"Private, ltd by shares"14,1609163,"ANA PROPERTY CONSULTANTS LIMITED
安信物業顧問有限公司",2011-05-30,,"Private, ltd by shares"15,1608684,"ANHUA WEALTH INTERNATIONAL HOLDING GROUP LIMITED
安華財富國際控股集團有限公司",2011-05-30,2015-06-19,"Private, ltd by shares"16,1608984,"ANILUMIN LED LIMITED",2011-05-30,2017-01-27,"Private, ltd by shares"17,1609008,"Animus International Limited
安妮瑪詩國際有限公司",2011-05-30,2013-06-21,"Private, ltd by shares"18,1609165,"APPLE SUPPLIES HONG KONG LIMITED
蘋果供應香港有限公司",2011-05-30,2020-04-24,"Private, ltd by shares"19,1609213,"ARCHIBUILD LIMITED
構築有限公司",2011-05-30,,"Private, ltd by shares"20,1609282,"ARDIS HK LIMITED",2011-05-30,,"Private, ltd by shares"21,1609100,"Ascentis Asia Limited",2011-05-30,,"Private, ltd by shares"22,1608795,"ASIA EXPANSION LIMITED
亞洲拓展僱傭有限公司",2011-05-30,,"Private, ltd by shares"23,1608741,"ASIA MINMETALS CO. LIMITED
亞洲五礦有限公司",2011-05-30,,"Private, ltd by shares"24,1608840,"ASMA TRADING CO., LIMITED
阿斯瑪貿易有限公司",2011-05-30,,"Private, ltd by shares"25,1609257,"ASSET DOMAIN LIMITED (HK)",2011-05-30,,"Private, ltd by shares"26,1608709,"ATL MOBILE LIMITED (HK)
匯進電訊有限公司",2011-05-30,2018-09-28,"Private, ltd by shares"27,1609067,"ATPS Limited
安泰物資有限公司",2011-05-30,2014-06-06,"Private, ltd by shares"28,1609260,"AU LUNG DE BUILDING AND BUSINESS GROUP LIMITED",2011-05-30,2015-06-19,"Private, ltd by shares"29,1609171,"AURA DRAGON INDUSTRIAL (HK) CO., LIMITED
香港韻龍實業有限公司",2011-05-30,2018-09-28,"Private, ltd by shares"30,1608651,"AVANT-GARDE ARTS COMPANY LIMITED
頭等藝術有限公司",2011-05-30,2018-03-23,"Private, ltd by shares"31,1609274,"AXNZBB WELLNESS LIMITED",2011-05-30,2017-01-27,"Private, ltd by shares"32,1609302,"a_a&amp;d Limited",2011-05-30,,"Private, ltd by shares"33,1609169,"Bao Ran International Group Company Limited
寶然國際集團有限公司",2011-05-30,2019-03-08,"Private, ltd by shares"34,1609123,"BAOHONG (HK) STOCK CO., LIMITED
寶鴻(香港)股份有限公司",2011-05-30,,"Private, ltd by shares"35,1609270,"BAOSTON (SZ) TECHNOLOGY CO., LIMITED
寶思頓(深圳)科技有限公司",2011-05-30,2015-06-19,"Private, ltd by shares"36,1608976,"BCN ASIA LIMITED",2011-05-30,,"Private, ltd by shares"37,1608851,"BEIJING BAISEN FURNITURE CO., LIMITED
北京百森家具有限公司",2011-05-30,2015-06-26,"Private, ltd by shares"38,1609193,"BEILIMING (HK) LIMITED
倍麗明(香港)有限公司",2011-05-30,2014-09-26,"Private, ltd by shares"39,1608888,"BENERGY CO., LIMITED",2011-05-30,2019-03-08,"Private, ltd by shares"40,1608761,"BEST GENETICS GROUP LIMITED
家育種豬集團有限公司",2011-05-30,,"Private, ltd by shares"41,1609199,"BLUE QUEEN ACCESSORIES CO., LIMITED
藍琪飾品有限公司",2011-05-30,,"Private, ltd by shares"42,1609106,"BLUE SKY INTERNATIONAL TECHNOLOGY CO., LIMITED
藍天國際科技有限公司",2011-05-30,2020-04-09,"Private, ltd by shares"43,1608982,"BOJAN INDUSTRIAL CO., LIMITED
博揚實業有限公司",2011-05-30,2015-06-19,"Private, ltd by shares"44,1609264,"BRIGHT SPRING INVESTMENTS LIMITED
千兆投資有限公司",2011-05-30,2017-01-27,"Private, ltd by shares"45,1608660,"BROADROAD INTERNATIONAL LIMITED
廣略博通國際有限公司",2011-05-30,,"Private, ltd by shares"46,1609162,"Buddy Alliance Consultancy Limited
保達聯合有限公司",2011-05-30,2016-09-02,"Private, ltd by shares"47,1608967,"BWM (HONG KONG) ULTRAVIOLET TECHNOLOGY LIMITED
香港君陽環保科技有限公司",2011-05-30,2015-05-29,"Private, ltd by shares"48,1608659,"Café Indigo Limited",2011-05-30,,"Private, ltd by shares"49,1609208,"CANVISION INTERNATIONAL CO., LIMITED
創安國際實業有限公司",2011-05-30,,"Private, ltd by shares"50,1609131,"CAPITA FINANCIAL ADMINISTRATORS LIMITED (d2015-06-19)
查比特金融管理有限公司",2011-05-30,2015-06-19,"Private, ltd by shares"51,1609117,"CARBELLE CO., LIMITED
家貝貿易有限公司",2011-05-30,2015-06-26,"Private, ltd by shares"52,1608923,"CAREERLINK PROFESSIONAL SERVICES LIMITED",2011-05-30,2020-04-17,"Private, ltd by shares"53,1609174,"CARRIE HONG KONG LIMITED
堯嵋香港有限公司",2011-05-30,,"Private, ltd by shares"54,1608998,"Century Electronics (HK) Co., Limited
凱諾微電子(香港)有限公司",2011-05-30,,"Private, ltd by shares"55,1608701,"CHAK SHING AIR-CONDITIONING ENGINEERING CO., LIMITED
澤成冷氣工程有限公司",2011-05-30,,"Private, ltd by shares"56,1608658,"CHANG YUE (HK) INDUSTRIAL LIMITED
暢悦(香港)實業有限公司",2011-05-30,,"Private, ltd by shares"57,1608732,"CHANGJING TECHNOLOGY (HK) CO., LIMITED
長京科技(香港)有限公司",2011-05-30,2017-01-27,"Private, ltd by shares"58,1608940,"CHANGLE KINGHONG FOODS CO., LIMITED",2011-05-30,,"Private, ltd by shares"59,1608987,"CHARMLAND DEVELOPMENT LIMITED
昌源發展有限公司",2011-05-30,2018-01-05,"Private, ltd by shares"60,1609292,"Cheng &amp; Yan Limited
鄭閻有限公司",2011-05-30,2018-09-21,"Private, ltd by shares"61,1609297,"CHENGDU DUWEI FURNITURE LIMITED
成都度威傢俱有限公司",2011-05-30,2017-01-27,"Private, ltd by shares"62,1609298,"CHENGDU XILAIBAO FURNITURE GROUP LIMITED
成都喜來寶傢私集團有限公司",2011-05-30,2019-03-08,"Private, ltd by shares"63,1609291,"Cheuk See Engineering Company Limited
卓思工程有限公司",2011-05-30,,"Private, ltd by shares"64,1609130,"CHILI LOGISTICS COMPANY LIMITED
智利物流有限公司",2011-05-30,2019-05-17,"Private, ltd by shares"65,1609136,"CHINA (HK) INTERNATIONAL CITRUS MARKETING ALLIANCE LIMITED
中國(香港)國際沙田柚產銷聯盟有限公司",2011-05-30,2015-06-19,"Private, ltd by shares"66,1609255,"CHINA AND BRITAIN JOINT VENTURE HUANGJIAFU (GROUP) LIMITED
中英合資皇家福（集團）有限公司",2011-05-30,,"Private, ltd by shares"67,1608781,"CHINA BEST CHOICE CO., LIMITED",2011-05-30,2016-11-18,"Private, ltd by shares"68,1609287,"CHINA CLOUD DAY GROUP LIMITED
中國雲天集團有限公司",2011-05-30,2017-01-27,"Private, ltd by shares"69,1609237,"CHINA COMPREHENSIVE INVESTMENT HOLDING COMPANY LIMITED
中國綜合投資控股集團有限公司",2011-05-30,,"Private, ltd by shares"70,1608881,"CHINA DONGXU GROUP LIMITED
中國．東旭集團有限公司",2011-05-30,,"Private, ltd by shares"71,1608892,"CHINA ELECTRIC GREEN TECHNOLOGY (HONGKONG) INTERNATIONAL CO., LIMITED
中電緑科(香港)國際有限公司",2011-05-30,2014-08-29,"Private, ltd by shares"72,1609088,"CHINA FUNCTION TEA RESEARCH INSTITUTE COMPANY LIMITED
中國功能茶研究院有限公司",2011-05-30,,"Private, ltd by shares"73,1608937,"CHINA GLOBAL ART CULTURE CO., LIMITED
中國環藝文化有限公司",2011-05-30,2017-01-27,"Private, ltd by shares"74,1609052,"CHINA GLOVE PROFESSIONAL LIMITED
中國手套專家有限公司",2011-05-30,,"Private, ltd by shares"75,1608947,"CHINA GUOLI LIMITED
中國國禮有限公司",2011-05-30,,"Private, ltd by shares"76,1608883,"CHINA INVESTMENT AND FINANCE (HONG KONG) LIMITED
中國投融資(香港)有限公司",2011-05-30,,"Private, ltd by shares"77,1608890,"CHINA SANSU PAINTING &amp; CALLIGRAPHY RESEARCH ACADEMY LIMITED
中國三蘇書畫研究院有限公司",2011-05-30,2015-06-26,"Private, ltd by shares"78,1609127,"CHINA TOP TECHNOLOGY GROUP LIMITED
中國高科集團有限公司",2011-05-30,2020-04-09,"Private, ltd by shares"79,1609057,"CHINA TRIFIMET PRECISION HARDWARE CO., LIMITED
深圳創菲美精密五金有限公司",2011-05-30,,"Private, ltd by shares"80,1608672,"CHINA WINGS LIMITED
香港傲騰有限公司",2011-05-30,,"Private, ltd by shares"81,1608825,"CHINAWIN SHIPPING SERVICE LIMITED
中勝船務有限公司",2011-05-30,,"Private, ltd by shares"82,1608654,"CHING TAI CLOTH INDUSTRIAL COMPANY LIMITED
正大紗布實業有限公司",2011-05-30,,"Private, ltd by shares"83,1609167,"CHUEN SHUN TECHNOLOGY LIMITED
全信科技有限公司",2011-05-30,,"Private, ltd by shares"84,1609001,"CHUNG GENTLE COMPANY LIMITED
中紳有限公司",2011-05-30,,"Private, ltd by shares"85,1608754,"CIHAN NEWS AGENCY ASIA LIMITED",2011-05-30,2019-03-08,"Private, ltd by shares"86,1608735,"CIK TRADING CO. LIMITED",2011-05-30,2014-08-15,"Private, ltd by shares"87,1608726,"CINDY DEVELOPMENT LIMITED",2011-05-30,,"Private, ltd by shares"88,1608961,"CIVILAND LIMITED
木豐行(香港)有限公司",2011-05-30,2016-01-22,"Private, ltd by shares"89,1608805,"CIXI TOWIN INTERNATIONAL TRADE COMPANY LIMITED
慈溪市千文國際貿易有限公司",2011-05-30,2018-06-01,"Private, ltd by shares"90,1608977,"CLENNA (Hong Kong) Co., Limited
卡琳娜(香港)有限公司",2011-05-30,2018-01-26,"Private, ltd by shares"91,1608828,"ClickTong Technology Co., Limited
一點通科技有限公司",2011-05-30,2017-09-15,"Private, ltd by shares"92,1609074,"CLIMBICK LIMITED",2011-05-30,2012-09-28,"Private, ltd by shares"93,1608989,"CLOVER HONG KONG HOLDINGS, LIMITED",2011-05-30,2014-10-31,"Private, ltd by shares"94,1608798,"COMISEN ELECTRONICS CO., LIMITED
科美成電子有限公司",2011-05-30,,"Private, ltd by shares"95,1608978,"Company Registration Number 1608978 Limited
公司註冊編號 1608978 有限公司",2011-05-30,,"Private, ltd by shares"96,1608993,"Company Registration Number 1608993 Limited
公司註冊編號 1608993 有限公司",2011-05-30,2014-07-11,"Private, ltd by shares"97,1609247,"Company Registration Number 1609247 Limited
公司註冊編號 1609247 有限公司",2011-05-30,,"Private, ltd by shares"98,1609224,"CONSTELLATION BRANDS HONG KONG LIMITED
星座品牌香港有限公司",2011-05-30,,"Private, ltd by shares"99,1608764,"COOLWHIST GROUP (HONG KONG) LIMITED
酷衛士特集團(香港)有限公司",2011-05-30,,"Private, ltd by shares"100,1609139,"CROWN CERTIFICATION LIMITED
皇冠認證有限公司",2011-05-30,,"Private, ltd by shares"101,1608990,"CROWN EAST DEVELOPMENT LIMITED
佳怡發展有限公司",2011-05-30,,"Private, ltd by shares"102,1609209,"DADING GROUP LIMITED
大鼎集團有限公司",2011-05-30,,"Private, ltd by shares"103,1609201,"DAKOKO INTERNATIONAL LIMITED",2011-05-30,,"Private, ltd by shares"104,1608803,"DALIN INTERNATIONAL TRADE COMPANY LIMITED
大林國際貿易有限公司",2011-05-30,2018-01-26,"Private, ltd by shares"105,1608864,"DAQI LAOYECHE (CHINA) FINERY CO., LIMITED
大啟老爺車(中國)服飾有限公司",2011-05-30,2015-06-19,"Private, ltd by shares"106,1608827,"DARTONG I &amp; E CO., LIMITED",2011-05-30,2016-01-22,"Private, ltd by shares"107,1609234,"DAZIRAN INTERNATIONAL GROUP (HK) LIMITED
大自然國際集團(香港)有限公司",2011-05-30,,"Private, ltd by shares"108,1608673,"DESIGNING TECHNOLOGY CORPORATION HONG KONG LIMITED
承億發發展有限公司",2011-05-30,,"Private, ltd by shares"109,1608806,"DINGYUAN INTERNATIONAL INDUSTRIAL LIMITED
鼎源國際實業有限公司",2011-05-30,,"Private, ltd by shares"110,1608683,"DNH TRADING CO., LIMITED
鼎恒貿易有限公司",2011-05-30,2019-05-03,"Private, ltd by shares"111,1608740,"DNM LIMITED
弘業電子有限公司",2011-05-30,,"Private, ltd by shares"112,1609173,"DONGGUAN SHEENCHANGE TECH LIMITED
東莞昕晨科技有限公司",2011-05-30,,"Private, ltd by shares"113,1608910,"Dongguan Xinsheng Handbags Crafts Co., Limited
東莞市鑫盛手袋工藝有限公司",2011-05-30,,"Private, ltd by shares"114,1609194,"DREAM MODEL MANAGEMENT LIMITED
星夢模特兒管理有限公司",2011-05-30,2014-07-11,"Private, ltd by shares"115,1609239,"DRIVERLOVER ELECTRONICS LIMITED
裕安科技電子有限公司",2011-05-30,2018-07-06,"Private, ltd by shares"116,1609119,"DUOCAI CLOTHES (CHINA) GROUP CO., LIMITED
朵彩集團(中國)服飾有限公司",2011-05-30,2015-06-19,"Private, ltd by shares"117,1608774,"E &amp; A Supply Limited",2011-05-30,,"Private, ltd by shares"118,1608882,"E&amp;M MANUFACTURING LIMITED
香港五金電器製造有限公司",2011-05-30,2020-10-30,"Private, ltd by shares"119,1608956,"E-BOSS TECHNOLOGY CO., LIMITED
藝博士科技有限公司",2011-05-30,,"Private, ltd by shares"120,1608943,"EAST ASIA WORLDWIDE HOLDING LIMITED
東亞環球控股有限公司",2011-05-30,2016-01-22,"Private, ltd by shares"121,1608769,"Eastern Paradise Hong Kong Limited
怡典香港有限公司",2011-05-30,2015-04-24,"Private, ltd by shares"122,1609138,"EASTM INSULATION LIMITED",2011-05-30,,"Private, ltd by shares"123,1609030,"EASYDOM GROUP HOLDINGS LIMITED",2011-05-30,2013-12-20,"Private, ltd by shares"124,1609207,"Ebic Investment Limited",2011-05-30,,"Private, ltd by shares"125,1608948,"EDCE HOLDINGS CO., LIMITED
浙江伊德笙股份有限公司",2011-05-30,2019-11-22,"Private, ltd by shares"126,1608968,"Ehouse Asia Electric Engineering Limited
亞洲電業工程有限公司",2011-05-30,2012-11-02,"Private, ltd by shares"127,1608865,"EKV (H.K) Electronic Technology Limited
依佳威電子科技(香港)有限公司",2011-05-30,2019-08-02,"Private, ltd by shares"128,1609095,"ELITE VIEW ENTERPRISES LIMITED
賢景企業有限公司",2011-05-30,,"Private, ltd by shares"129,1608824,"ELKINE HOUSEHOLD CO., LIMITED
寧波艾可國際貿易有限公司",2011-05-30,,"Private, ltd by shares"130,1609300,"Endless Blessing Education Limited
恩霖教育有限公司",2011-05-30,,"Private, ltd by shares"131,1608859,"ENGEL (GROUP) INTERNATIONAL CO., LIMITED
恩格爾(集團)國際有限公司",2011-05-30,,"Private, ltd by shares"132,1608656,"EnoAsia Enterprises Limited
諾亞企業股份有限公司",2011-05-30,,"Private, ltd by shares"133,1609223,"EQUITY CAPITAL CHINA LIMITED",2011-05-30,2016-01-22,"Private, ltd by shares"134,1609015,"EVER EAST INDUSTRIAL LIMITED
永怡實業有限公司",2011-05-30,,"Private, ltd by shares"135,1608925,"EVER FINE INT'L TRADING COMPANY LIMITED
永祥國際商貿有限公司",2011-05-30,2016-01-22,"Private, ltd by shares"136,1608696,"EVER RED BIO-ELECTRICAL SUPPLY LIMITED
萬年紅生物質能發電有限公司",2011-05-30,2018-01-05,"Private, ltd by shares"137,1608755,"EVER-LINK (HONG KONG) ELECTRONIC COMPANY LIMITED
維馳(香港)光電有限公司",2011-05-30,2018-09-21,"Private, ltd by shares"138,1609007,"EXCELSECU DATA TECHNOLOGY COMPANY LIMITED
文鼎創數據科技有限公司",2011-05-30,,"Private, ltd by shares"139,1609020,"F&amp;T HANDICRAFT CO., LIMITED
福特工藝品有限公司",2011-05-30,2015-10-23,"Private, ltd by shares"140,1608702,"FACE TECHNOLOGY (HONG KONG) LIMITED
非思科技(香港)有限公司",2011-05-30,2017-01-27,"Private, ltd by shares"141,1609126,"Far Orient Investment Limited",2011-05-30,2015-06-19,"Private, ltd by shares"142,1608994,"FARLING COMPANY LIMITED
發伶有限公司",2011-05-30,,"Private, ltd by shares"143,1609258,"FAST BOOM HOLDINGS LIMITED",2011-05-30,,"Private, ltd by shares"144,1608829,"FAST HORSE TECHNOLOGY CO., LIMITED
雷駿(香港)科技有限公司",2011-05-30,,"Private, ltd by shares"145,1608879,"Federation Of Organic Agriculture China Limited
中國有機農業聯盟股份有限公司",2011-05-30,2018-01-05,"Private, ltd by shares"146,1608655,"Fengyuan Fine Design Limited",2011-05-30,,"Private, ltd by shares"147,1609176,"FIRST FINANCE GROUP LIMITED",2011-05-30,2016-01-22,"Private, ltd by shares"148,1608911,"FIRST SUPREME LIMITED
發瑞有限公司",2011-05-30,,"Private, ltd by shares"149,1608964,"FORADER INTERNATIONAL LIMITED",2011-05-30,,"Private, ltd by shares"150,1608916,"FORTEX INTERNATIONAL GROUP LIMITED
福泰國際集團有限公司",2011-05-30,,"Private, ltd by shares"151,1608845,"FRANCE PECKERWOOD DRESS INT'L GROUP CO., LIMITED
法國啄木鳥服飾國際集團有限公司",2011-05-30,2016-01-22,"Private, ltd by shares"152,1608944,"FUGUANG ELECTRIC (HK) CO., LIMITED
福光電器(香港)有限公司",2011-05-30,2019-03-08,"Private, ltd by shares"153,1608918,"FUHUA GROUP HK INDUSTRY LIMITED
富華集團香港實業有限公司",2011-05-30,,"Private, ltd by shares"154,1608680,"FULINUO CO., LIMITED
富麗諾有限公司",2011-05-30,2016-01-22,"Private, ltd by shares"155,1608974,"FULL REPUTATION GLOBAL TECHNOLOGY CO., LIMITED
譽豐全球科技有限公司",2011-05-30,,"Private, ltd by shares"156,1608975,"FULL TOP FINANCE LIMITED
富道金融有限公司",2011-05-30,,"Private, ltd by shares"157,1608862,"FULLMARKS METAL TECHNOLOGY COMPANY LIMITED
富滔模具有限公司",2011-05-30,,"Private, ltd by shares"158,1608849,"FUNNY TOYS GIFT LIMITED",2011-05-30,,"Private, ltd by shares"159,1608674,"FUTONG TECHNOLOGY LIMITED
富唐科技有限公司",2011-05-30,2020-01-03,"Private, ltd by shares"160,1609188,"FUTURE VENTURES LIMITED (HK)
頌金有限公司",2011-05-30,2019-02-01,"Private, ltd by shares"161,1608727,"G&amp;B TRADING LIMITED (HK)
乾佑貿易有限公司",2011-05-30,2019-11-22,"Private, ltd by shares"162,1608794,"GAO MENG FA LIMITED
高盟發有限公司",2011-05-30,,"Private, ltd by shares"163,1608926,"GC Ventures Limited (HK)
關係投資有限公司",2011-05-30,,"Private, ltd by shares"164,1608839,"GENTON CHINA LIMITED
駿騰中國有限公司",2011-05-30,,"Private, ltd by shares"165,1609259,"GERMANY DERO INTERNATIONAL PETROCHEMICAL GROUP CO. , LIMITED
德國德耳國際石油化工集團有限公司",2011-05-30,2016-01-22,"Private, ltd by shares"166,1609080,"GFC ELECTRONICS LIMITED
金富昌電子有限公司",2011-05-30,2014-08-15,"Private, ltd by shares"167,1609268,"GLARYSUN CO., LIMITED
台淵國際實業有限公司",2011-05-30,2017-10-13,"Private, ltd by shares"168,1609029,"GLOBAL COLLIERIES (MALI) LIMITED",2011-05-30,2019-02-01,"Private, ltd by shares"169,1608748,"GLOBAL INT'L HOTEL &amp; RESTAURANT MANAGEMENT GROUP CO., LIMITED
環球國際酒店餐飲管理集團有限公司",2011-05-30,2017-01-27,"Private, ltd by shares"170,1608809,"GLOBAL NATURAL STONE LIMITED
環球天然石有限公司",2011-05-30,2018-01-05,"Private, ltd by shares"171,1609025,"GLOBAL STANDARD NETWORKS COMPANY LIMITED",2011-05-30,2016-01-22,"Private, ltd by shares"172,1609192,"GLOBAL TRADING EXPORT LIMITED",2011-05-30,2015-06-19,"Private, ltd by shares"173,1608815,"GLOBAL TRAINING CONSULTANCY LIMITED (d2015-06-19)
國際人才培訓顧問有限公司",2011-05-30,2015-06-19,"Private, ltd by shares"174,1608895,"GLOBAL WINE CELLAR LIMITED
高寶酒窖有限公司",2011-05-30,,"Private, ltd by shares"175,1608729,"GoClues Co. Limited",2011-05-30,2020-04-17,"Private, ltd by shares"176,1609110,"GOLD SAND MINING (H.K.) LIMITED
金沙礦業(香港)有限公司",2011-05-30,2013-11-22,"Private, ltd by shares"177,1608915,"GOLD YUKI LIMITED
金雪有限公司",2011-05-30,2016-11-18,"Private, ltd by shares"178,1609156,"GOLDEN BRAND INVESTMENTS LIMITED
越盛投資有限公司",2011-05-30,,"Private, ltd by shares"179,1608812,"Goldenshine PCB Limited
長和線路板科技有限公司",2011-05-30,2012-06-22,"Private, ltd by shares"180,1608995,"GOLDENSUN INVESTMENTS LIMITED",2011-05-30,2013-06-14,"Private, ltd by shares"181,1609272,"GOLDWORTH INVESTMENTS LIMITED
暢裕投資有限公司",2011-05-30,2019-07-23,"Private, ltd by shares"182,1609149,"GOLF HK LIMITED
高爾夫國際有限公司",2011-05-30,,"Private, ltd by shares"183,1608685,"GRACE EDUCATION LIMITED (HK)",2011-05-30,,"Private, ltd by shares"184,1608872,"GRACE OF GOD PUBLISHING CO., LIMITED",2011-05-30,2017-01-27,"Private, ltd by shares"185,1609293,"Grand Global Miracle Limited",2011-05-30,2019-02-01,"Private, ltd by shares"186,1608777,"GREAT WILL HONG KONG INTERNATIONAL LIMITED
宏圖香港國際有限公司",2011-05-30,,"Private, ltd by shares"187,1609273,"GREATER SINO HOLDINGS LIMITED
瑞邦控股有限公司",2011-05-30,2015-06-19,"Private, ltd by shares"188,1609011,"GREATWELL (H.K.) LIMITED
昌威(香港)有限公司",2011-05-30,2019-03-08,"Private, ltd by shares"189,1609129,"Greyhound Inter Trade Limited",2011-05-30,2018-03-02,"Private, ltd by shares"190,1608736,"GUANG BAO ADHESIVE PRODUCTS (HK) LIMITED
廣寶膠粘製品(香港)有限公司",2011-05-30,,"Private, ltd by shares"191,1608919,"GUANGDONG SHENGJUE INDUSTRY CO., LIMITED
廣東聖爵實業有限公司",2011-05-30,2015-06-19,"Private, ltd by shares"192,1608650,"GUANGZHOU KISENY TRADING CO., LIMITED
廣州凱森利商貿有限公司",2011-05-30,2015-06-19,"Private, ltd by shares"193,1608985,"GUANGZHOU LUCKY INTERNATIONAL TRADE LIMITED
廣州好運國際貿易有限公司",2011-05-30,2015-06-19,"Private, ltd by shares"194,1608863,"GUANGZHOU ZHUJIANG WIRE CABLES CO., LIMITED
廣州珠江電線電纜有限公司",2011-05-30,,"Private, ltd by shares"195,1609211,"GUINAN Investment Company Limited
桂南投資有限公司",2011-05-30,,"Private, ltd by shares"196,1609083,"GYMIC CO., LIMITED",2011-05-30,,"Private, ltd by shares"197,1608711,"H.K SHANGMEI INT'L PLASTIC LIMITED
香港上美國際塑膠有限公司",2011-05-30,,"Private, ltd by shares"198,1609078,"H.K XUANWEI GOYO INVESTMENT DEVELOPMENT LIMITED
香港宣威國禦投資發展有限公司",2011-05-30,,"Private, ltd by shares"199,1608778,"H.K. LAN XIN ER (INTERNATIONAL) INDUSTRITAL LIMITED
香港藍欣兒(國際)實業有限公司",2011-05-30,,"Private, ltd by shares"200,1608796,"HAIR KONNECTIONS LIMITED",2011-05-30,2016-01-22,"Private, ltd by shares"201,1609150,"HANA AUTO PARTS CO., LIMITED
恒諾汽車配件有限公司",2011-05-30,2018-09-28,"Private, ltd by shares"202,1608924,"HANDASHAN CATERING INTERNATIONAL CO., LIMITED
漢達山餐飲國際有限公司",2011-05-30,2015-06-19,"Private, ltd by shares"203,1609089,"HANDEA GROUP CO., LIMITED
漢典集團有限公司",2011-05-30,2015-06-26,"Private, ltd by shares"204,1609121,"HANG FU ENTERPRISES LIMITED
恆富兆業有限公司",2011-05-30,2016-10-14,"Private, ltd by shares"205,1609034,"HANG TAI FOOD TRADING COMPANY LIMITED
恒泰食品貿易有限公司",2011-05-30,,"Private, ltd by shares"206,1609244,"HANG WAN FINANCE LIMITED",2011-05-30,2015-02-13,"Private, ltd by shares"207,1608873,"Hangzhou Globe Broadcasting &amp; Sound Co., Limited
杭州環球廣播音響有限公司",2011-05-30,,"Private, ltd by shares"208,1609266,"HANGZHOU HAIFENG BEARING LIMITED
杭州海峰軸承有限公司",2011-05-30,2019-03-08,"Private, ltd by shares"209,1609070,"HAO BO HANDICRAFT CO., LIMITED
昊搏工藝品有限公司",2011-05-30,,"Private, ltd by shares"210,1608941,"HAOTIAN INDUSTRY CO., LIMITED
灝天實業有限公司",2011-05-30,2015-06-19,"Private, ltd by shares"211,1609096,"HAOYUAN BIOTECHNOLOGY CO., LIMITED
昊源生物科技有限公司",2011-05-30,2015-06-19,"Private, ltd by shares"212,1609290,"Happy Tour Hong Kong Macau (Hong Kong) Limited
樂遊港澳(香港)有限公司",2011-05-30,,"Private, ltd by shares"213,1609019,"HARMONY LIGHTING DEVELOPMENT LIMITED
合泊燈飾發展有限公司",2011-05-30,,"Private, ltd by shares"214,1608949,"HC (HK) TECHNOLOGY CO., LIMITED
恒創(香港)科技有限公司",2011-05-30,,"Private, ltd by shares"215,1608783,"HENDRIX GENETICS COMPANY LIMITED",2011-05-30,2015-05-29,"Private, ltd by shares"216,1609125,"HENG SHENG INDUSTRIAL (HONG KONG) LIMITED
恒生實業(香港)有限公司",2011-05-30,2017-01-27,"Private, ltd by shares"217,1608746,"HENG TAI (HONG KONG) INTERNATIONAL INVESTMENT HOLDING LIMITED
恒泰(香港)國際投資集團有限公司",2011-05-30,,"Private, ltd by shares"218,1609027,"HENGYI (HONG KONG) INDUSTRY CO., LIMITED
恒毅(香港)實業有限公司",2011-05-30,,"Private, ltd by shares"219,1608868,"HENRY INVESTMENT CO., LIMITED
恒立投資發展有限公司",2011-05-30,2018-12-07,"Private, ltd by shares"220,1608966,"HI CREATION (HONG KONG) LIMITED
愷瑞星(香港)有限公司",2011-05-30,,"Private, ltd by shares"221,1608938,"HIACHIEVE LIMITED
香港華成有限公司",2011-05-30,,"Private, ltd by shares"222,1609153,"HING LUNG ENGINEERING LIMITED
興龍裝飾工程有限公司",2011-05-30,,"Private, ltd by shares"223,1608757,"HING YIP HONG KONG INTERNATIONAL LIMITED
興業香港國際有限公司",2011-05-30,,"Private, ltd by shares"224,1608692,"HITONE RESOURCES DEVELOPMENT LIMITED
海通資源發展有限公司",2011-05-30,2019-02-01,"Private, ltd by shares"225,1609267,"HK AIMEIFANG INTERNATIONAL GROUP LIMITED
香港愛美坊國際集團有限公司",2011-05-30,2020-04-17,"Private, ltd by shares"226,1609175,"HK AIYOULE CHILDREN AMUSEMENT EQUIPMENT LIMITED
香港愛遊樂兒童娛樂設備有限公司",2011-05-30,,"Private, ltd by shares"