,Reg no.,Name,Incorp-orated,Dissolved,Type1,1600588,"Greenland (Asia) Securities Co., Limited
綠地(亞洲)證券有限公司",2011-05-14,,"Private, ltd by shares"2,1600593,"HANG SANG DEVELOP LIMITED
恆生拓展有限公司",2011-05-14,2017-01-06,"Private, ltd by shares"3,1600594,"HO CHEUNG BUILDING LIMITED
昊長裝修工程有限公司",2011-05-14,2015-09-11,"Private, ltd by shares"4,1600591,"NEW LINK DEVELOP LIMITED
新興拓展有限公司",2011-05-14,2015-06-19,"Private, ltd by shares"5,1600589,"ORWELL LIMITED (d2013-10-04)
歐維有限公司",2011-05-14,2013-10-04,"Private, ltd by shares"6,1600590,"RICHWAY DEVELOP LIMITED
時發拓展有限公司",2011-05-14,2015-06-19,"Private, ltd by shares"7,1600592,"WIN CHANCE DEVELOP LIMITED
永昌拓展有限公司",2011-05-14,2017-01-06,"Private, ltd by shares"