,Reg no.,Name,Incorp-orated,Dissolved,Type227,1609277,"HK ANTAI INVESTMENT CONSULTING LIMITED
香港安泰投資咨詢有限公司",2011-05-30,,"Private, ltd by shares"228,1609113,"HK BAOXI GROUP INDUSTRY CO., LIMITED
香港寶璽集團實業有限公司",2011-05-30,2015-06-19,"Private, ltd by shares"229,1609280,"HK BAOZHENTANG GINSENG MEDICINE GROUP LIMITED
香港寶珍堂參茸藥業集團有限公司",2011-05-30,,"Private, ltd by shares"230,1609242,"HK CITY PEOPLE MEDICINE-INDUSTRY LIMITED
香港都市百姓藥業有限公司",2011-05-30,2018-01-05,"Private, ltd by shares"231,1608962,"HK DINGSHENG HENGTAI GROUP INVESTMENT SHARE LIMITED
香港鼎盛恒泰集團投資股份有限公司",2011-05-30,2017-01-27,"Private, ltd by shares"232,1609061,"HK GEAN TRADING LIMITED
香港格安貿易有限公司",2011-05-30,2015-06-19,"Private, ltd by shares"233,1609180,"HK HEAVENLY KING INT'L TRADE LIMITED
香港天王國際貿易有限公司",2011-05-30,,"Private, ltd by shares"234,1608768,"HK HONG YANG INTERNATIONAL DEVELOPMENT LIMITED
香港泓洋國際發展有限公司",2011-05-30,2017-07-07,"Private, ltd by shares"235,1609225,"HK JIALAISHI INTERNATIONAL BEAUTY CHAIN GROUP LIMITED
香港嘉萊詩國際美容連鎖集團有限公司",2011-05-30,2015-07-10,"Private, ltd by shares"236,1609104,"HK JINMENGYUAN FURNITURE CO., LIMITED
香港金夢緣家具有限公司",2011-05-30,2015-06-19,"Private, ltd by shares"237,1608688,"HK KAISHIDA CHEMICAL (GROUP) CO., LIMITED
香港凱事達化工(集團)有限公司",2011-05-30,2016-01-22,"Private, ltd by shares"238,1608694,"HK MEDICAL FOOD HOMOLOGOUS INDUSTRIAL LIMITED
香港醫食同源實業有限公司",2011-05-30,2015-06-19,"Private, ltd by shares"239,1608785,"HK ORIENT COLORFUL INTERNATIONAL LIGHTING DESIGN CO., LIMITED
香港東方多彩國際照明設計有限公司",2011-05-30,2018-11-16,"Private, ltd by shares"240,1608902,"HK OUMEILONG INT'L TRADE LIMITED
香港歐美龍國際商貿有限公司",2011-05-30,2017-01-27,"Private, ltd by shares"241,1608745,"HK RICH GOOD CULTURE DEVELOPMENT LIMITED
香港樂馳極地文化發展有限公司",2011-05-30,2015-06-19,"Private, ltd by shares"242,1609063,"HK ROMANTIC CLOTH ART TEXTILE CO., LIMITED
香港浪漫布藝紡織有限公司",2011-05-30,2013-11-01,"Private, ltd by shares"243,1609253,"HK SHAXUAN SHIJIA (INT'L) GROUP CLOTHING LIMITED
香港莎萱世家 (國際) 集團服飾有限公司",2011-05-30,,"Private, ltd by shares"244,1608793,"HK TOTORO CHILDREN'S PRODUCTS GROUP LIMITED
香港龍貓兒童用品集團有限公司",2011-05-30,2015-06-19,"Private, ltd by shares"245,1609299,"HK XUJINGHENGFENG INTERNATIONAL INVESTMENT GROUP LIMITED
香港旭景恒豐國際投資集團有限公司",2011-05-30,2014-09-05,"Private, ltd by shares"246,1608927,"HK YILIN INT'L UPHOLSTER CREATIVE ENGINEERING LIMITED
香港易霖國際裝潢設計工程有限公司",2011-05-30,2015-06-19,"Private, ltd by shares"247,1609140,"HK ZABETH INTERNATIONAL CO., LIMITED
信義國際有限公司",2011-05-30,,"Private, ltd by shares"248,1608788,"HK ZHONGSEN DOOR INDUSTRY GROUP LIMITED
香港中森門業集團有限公司",2011-05-30,2015-06-19,"Private, ltd by shares"249,1609240,"HK ZHONGYUAN INDUSTRY STOCK LIMITED
香港中遠實業股份有限公司",2011-05-30,,"Private, ltd by shares"250,1608847,"HK ZHUOMAN (INT'L) INDUSTRY LIMITED
香港卓曼(國際)實業有限公司",2011-05-30,2019-03-08,"Private, ltd by shares"251,1609102,"HK ZILUOSHAN FINERY GROUP CO., LIMITED
香港紫羅衫服飾集團有限公司",2011-05-30,2017-01-27,"Private, ltd by shares"252,1609241,"HKLC Limited",2011-05-30,,"Private, ltd by shares"253,1609219,"HKT Advance Limited",2011-05-30,,"Private, ltd by shares"254,1609053,"HLH INTERNATIONAL LIMITED (d2014-10-24)
華立恒國際有限公司",2011-05-30,2014-10-24,"Private, ltd by shares"255,1608733,"HO WAI COMPANY LIMITED
濠煒有限公司",2011-05-30,,"Private, ltd by shares"256,1609168,"HOMCHING PAINT (GUANGDONG) LIMITED
宏程牌漆業(廣東)有限公司",2011-05-30,2018-01-05,"Private, ltd by shares"257,1608826,"Honest Removal Service Company Limited
誠實搬屋服務有限公司",2011-05-30,,"Private, ltd by shares"258,1609112,"HONG KONG (International) Supercar Club Limited
香港（國際）超跑俱樂部有限公司",2011-05-30,,"Private, ltd by shares"259,1608661,"HONG KONG 717 GROUP LIMITED
香港717集團有限公司",2011-05-30,2018-11-02,"Private, ltd by shares"260,1609202,"HONG KONG BEAUTIFUL DRINKS GROUP CO., LIMITED
香港靚飲集團有限公司",2011-05-30,,"Private, ltd by shares"261,1608802,"Hong Kong Crown Destination Management Co., Limited
香港皇冠國際旅行社有限公司",2011-05-30,2014-12-19,"Private, ltd by shares"262,1609115,"Hong Kong Dong Fang Ji Bai Investment Management Co., Limited
香港東方既白投資管理有限公司",2011-05-30,2015-06-19,"Private, ltd by shares"263,1609252,"HONG KONG EIGHT HORSES GARMENTS CO., LIMITED
香港八匹馬服飾有限公司",2011-05-30,2017-01-27,"Private, ltd by shares"264,1609231,"HONG KONG FAMILIES WITH CHILDREN HEALTH PRODUCTS CO., LIMITED
香港家有兒女衛生用品有限公司",2011-05-30,2015-06-26,"Private, ltd by shares"265,1608756,"HONG KONG FENGRONG ECONOMICS &amp; TRADE LIMITED
香港豐融經貿有限公司",2011-05-30,2015-06-19,"Private, ltd by shares"266,1608697,"HONG KONG GREAT FORD GROUP LIMITED
香港廣天福集團有限公司",2011-05-30,,"Private, ltd by shares"267,1609108,"HONG KONG HEXINMEI INTERNATIONAL INDUSTRIAL CO., LIMITED
香港和鑫美國際實業有限公司",2011-05-30,2014-06-06,"Private, ltd by shares"268,1608928,"Hong Kong Hi-tech Star International Co., Limited
香港海泰國際技術有限公司",2011-05-30,,"Private, ltd by shares"269,1609183,"HONG KONG HUAXIA INTERNATIONAL CO., LIMITED
香港華夏國際有限公司",2011-05-30,2015-06-19,"Private, ltd by shares"270,1608983,"Hong Kong Hui Li Management Corporation Limited
香港滙麗商業管理有限公司",2011-05-30,,"Private, ltd by shares"271,1609147,"HONG KONG JOINT VENTURE COMPANY INVESTMENT COMPANY LIMITED
香港亞泰集團投資有限公司",2011-05-30,2017-01-27,"Private, ltd by shares"272,1608667,"HONG KONG KEGO PRINTING EQUIPMENT LIMITED
香港精工印刷器材有限公司",2011-05-30,2017-01-27,"Private, ltd by shares"273,1609000,"HONG KONG LEFENG INDUSTRY GROUP CO., LIMITED
香港樂豐實業集團有限公司",2011-05-30,,"Private, ltd by shares"274,1608822,"HONG KONG M&amp;B INTERNATIONAL TRADE CO., LIMITED
香港莫爾百特國際貿易有限公司",2011-05-30,2013-11-15,"Private, ltd by shares"275,1608690,"HONG KONG NOBLE GARMENT MANUFACTURE DEVELOPMENT LIMITED
香港名望服飾製造發展有限公司",2011-05-30,2019-03-08,"Private, ltd by shares"276,1609155,"Hong Kong Nutritional Therapy Super Science And Technology Group Limited
香港超能營養療法科技集團有限公司",2011-05-30,2015-06-19,"Private, ltd by shares"277,1609236,"HONG KONG STRATEGY TECHNOLOGY LIMITED
香港方略科技有限公司",2011-05-30,,"Private, ltd by shares"278,1608763,"HONG KONG TIANYI FASHION GROUP CO., LIMITED
香港天奕服飾集團有限公司",2011-05-30,2016-01-22,"Private, ltd by shares"279,1609143,"HONG KONG XIANG RUI NEW ENERGY EQUIPMENT INVESTMENT MANAGEMENT LIMITED
香港祥瑞新能源設備投資管理有限公司",2011-05-30,2015-06-19,"Private, ltd by shares"280,1608818,"HONG KONG ZHONG XIN HOLDINGS LIMITED
香港中新控股有限公司",2011-05-30,2020-04-17,"Private, ltd by shares"281,1609134,"HONG KONG ZHONGHAO REAL ESTATE INVESTMENT CONSULTANT LIMITED
香港中浩房地產投資顧問有限公司",2011-05-30,2015-06-19,"Private, ltd by shares"282,1608906,"HONG SHENG INT'L (INDUSTRIAL) GROUP HOLDINGS LIMITED
鴻盛國際(實業)集團股份有限公司",2011-05-30,2017-01-27,"Private, ltd by shares"283,1608787,"HONGKONG AI BI TE INTERNATIONAL GROUP LIMITED
香港艾比特國際集團有限公司",2011-05-30,,"Private, ltd by shares"284,1609196,"HONGKONG AIBEI BABY SUPPLIES LIMITED
香港愛貝嬰兒用品有限公司",2011-05-30,,"Private, ltd by shares"285,1608811,"HONGKONG AOZHI MOLD CO. LIMITED
香港奧治模具有限公司",2011-05-30,2019-03-08,"Private, ltd by shares"286,1609133,"HONGKONG BAOGE LEATHER TRADING LIMITED
香港寶格皮具貿易有限公司",2011-05-30,2015-06-19,"Private, ltd by shares"287,1608853,"HONGKONG BAOLAISI INTERNATIONAL LIGHTING TECHNOLOGY LIMITED
香港寶來斯國際照明科技有限公司",2011-05-30,2015-06-19,"Private, ltd by shares"288,1609205,"HONGKONG HAIMAMINGJUE SLEEP LIMITED
香港海馬名爵睡眠有限公司",2011-05-30,,"Private, ltd by shares"289,1608988,"HONGKONG HUAYUAN AVIATION PARTS CO., LIMITED
香港華遠航空配件有限公司",2011-05-30,2015-06-19,"Private, ltd by shares"290,1609091,"HONGKONG ILOVE LIMITED
香港伊戀有限公司",2011-05-30,,"Private, ltd by shares"291,1608713,"HONGKONG JIAOYANG INT'L TRADING LIMITED
香港驕陽國際貿易有限公司",2011-05-30,2015-06-19,"Private, ltd by shares"292,1608894,"HONGKONG KEYU TRADE CO., LIMITED
香港可羽貿易有限公司",2011-05-30,2020-04-17,"Private, ltd by shares"293,1608749,"HONGKONG LIBAI INTERNATIONAL GROUP CO., LIMITED
香港立白國際集團有限公司",2011-05-30,2015-06-19,"Private, ltd by shares"294,1608860,"HONGKONG LICHUANG IMPORT AND EXPORT LIMITED
香港力創進出口有限公司",2011-05-30,,"Private, ltd by shares"295,1609265,"HONGKONG LIFENG LIMITED
香港麗豐有限公司",2011-05-30,,"Private, ltd by shares"296,1608695,"HONGKONG MEIJIA FASHION INT'L GROUP LIMITED
香港美佳服裝國際集團有限公司",2011-05-30,2016-01-22,"Private, ltd by shares"297,1608874,"HONGKONG MINFY GROUP COMPANY LIMITED
香港名蜚集團有限公司",2011-05-30,2015-06-26,"Private, ltd by shares"298,1608766,"HONGKONG MINGHUI INFORMATION DATA NALYSIS CO., LIMITED
香港明輝資訊資料分析有限公司",2011-05-30,2015-06-19,"Private, ltd by shares"299,1609124,"HONGKONG NORTH STAR INTERNATIONAL CO., LIMITED
香港北辰國際有限公司",2011-05-30,,"Private, ltd by shares"300,1608867,"HONGKONG OSEMER TECHNOLOGY INDUSTRY LIMITED
香港澳詩瑪科技實業有限公司",2011-05-30,2015-06-26,"Private, ltd by shares"301,1609044,"HONGKONG PANTON INT'L TRADING CO., LIMITED
香港鵬濤國際貿易有限公司",2011-05-30,2017-01-27,"Private, ltd by shares"302,1608835,"HONGKONG POWERYEAR TECHNOLOGY CO., LIMITED
香港新鵬洋科技有限公司",2011-05-30,,"Private, ltd by shares"303,1609128,"HONGKONG PROGRESS TRADE HOLDING CO., LIMITED
香港百高商貿控股有限公司",2011-05-30,2018-01-26,"Private, ltd by shares"304,1608889,"HONGKONG RICHKING ACCOUNTANTS SERVICE LIMITED
香港瑞錦會計事務所有限公司",2011-05-30,2016-10-14,"Private, ltd by shares"305,1608676,"HONGKONG SHENG WANG GROUP HOLDING LIMITED
香港昇旺集團控股有限公司",2011-05-30,2015-06-19,"Private, ltd by shares"306,1609170,"HONGKONG SIQIZHONGTIAN ENTERPRISE DEVELOPMENT CO., LIMITED
香港駟騏中天企業發展有限公司",2011-05-30,2018-01-05,"Private, ltd by shares"307,1609158,"HONGKONG SOTN TECHNOLOGY CO., LIMITED
香港松田科技有限公司",2011-05-30,2018-07-20,"Private, ltd by shares"308,1609059,"HONGKONG TASEN TECHNOLOGY CO., LIMITED
香港泰訊科技有限公司",2011-05-30,,"Private, ltd by shares"309,1609221,"HONGKONG TREASURE INDUSTRY DEVELOPMENT LIMITED
香港寶旺實業發展有限公司",2011-05-30,2016-03-11,"Private, ltd by shares"310,1608717,"HONGKONG XIANGYOU INDUSTRY LIMITED
香港翔友實業有限公司",2011-05-30,,"Private, ltd by shares"311,1609137,"HONGKONG XIN TAI BUSINESS INVESTMENT CO., LIMITED
香港鑫泰商貿投資有限公司",2011-05-30,,"Private, ltd by shares"312,1609024,"HONGKONG YONGYAO INTERNATIONAL DEVELOPMENT CO., LIMITED
香港永耀國際發展有限公司",2011-05-30,,"Private, ltd by shares"313,1608955,"HONGKONG YOUNGMAN INSULATING MATERIALS CO., LIMITED
香港揚民絕緣材料有限公司",2011-05-30,2019-03-08,"Private, ltd by shares"314,1609045,"HONGKONG YUANSHUN WEIYE ESTATE INVESTMENT LIMITED
香港圓順偉業房地產投資有限公司",2011-05-30,2013-11-29,"Private, ltd by shares"315,1609046,"HONGKONG YUEXIN LIGHTING ELECTRIC LIMITED
香港岳鑫照明電器有限公司",2011-05-30,2017-02-03,"Private, ltd by shares"316,1608891,"HONGKONG ZENITH SCIENCE&amp;TECHNOLOGY CO., LIMITED
香港光吉科技有限公司",2011-05-30,2016-01-29,"Private, ltd by shares"317,1608848,"HONGLI VENTURE CAPITAL (HONGKONG) CO., LIMITED
弘利創投(香港)有限公司",2011-05-30,,"Private, ltd by shares"318,1608957,"HONGXI TECHNOLOGY INVESTMENTS (HK) CO., LIMITED
弘熙科技投資(香港)有限公司",2011-05-30,,"Private, ltd by shares"319,1608971,"HooSean Energy (China) Co., Limited
弘祥(中國)能源有限公司",2011-05-30,,"Private, ltd by shares"320,1609017,"Hootech Electronics Co., Limited
宏創電子有限公司",2011-05-30,2017-09-01,"Private, ltd by shares"321,1609148,"HOY TRADING LIMITED
翱毅國際貿易有限公司",2011-05-30,,"Private, ltd by shares"322,1609055,"HUA DONG GROUP STOCK LIMITED
華東集團股份有限公司",2011-05-30,,"Private, ltd by shares"323,1608703,"HUA RONG INVESTMENT LIMITED
香港華榮投資有限公司",2011-05-30,2015-06-19,"Private, ltd by shares"324,1609144,"HUADE COMPANY LIMITED
香港亞洲老區健康事業有限公司",2011-05-30,,"Private, ltd by shares"325,1609090,"HUAHEDE INTERNATIONAL TRADE CO., LIMITED
華和德國際貿易有限公司",2011-05-30,2015-01-23,"Private, ltd by shares"326,1609191,"HUANYA INTERNATIONAL PROPERTY (HK) CORPORATION LIMITED
寰亞國際置業(香港)股份有限公司",2011-05-30,2017-01-27,"Private, ltd by shares"327,1608954,"HUAYU BIOTECHNOLOGY (HK) CO., LIMITED
香港華宇生物技術有限公司",2011-05-30,2017-01-27,"Private, ltd by shares"328,1608767,"HUAYU INVESTMENT HOLDINGS (HK) CO., LIMITED
香港華宇投資控股有限公司",2011-05-30,2017-01-27,"Private, ltd by shares"329,1609114,"HUIJIN CAPITAL (HK) COMPANY LIMITED
滙金資本(香港)有限公司",2011-05-30,2017-01-27,"Private, ltd by shares"330,1608887,"HUISHITONG STONE INDUSTRY CO., LIMITED
匯石通石業有限公司",2011-05-30,2016-01-22,"Private, ltd by shares"331,1609269,"Huixin Marine Engineering Co., Limited
匯鑫船舶工程有限公司",2011-05-30,2019-03-08,"Private, ltd by shares"332,1608969,"HYPROCA NUTRITION (HONGKONG) COMPANY LIMITED
海普諾凱營養品(香港)有限公司",2011-05-30,,"Private, ltd by shares"333,1608807,"I-SOURCE ELECTRONICS COMPANY LIMITED
安源電子有限公司",2011-05-30,2013-12-06,"Private, ltd by shares"334,1608700,"IBER ASIA LIMITED
伊貝亞洲有限公司",2011-05-30,2015-06-19,"Private, ltd by shares"335,1608720,"ICRIS:1608720 (no English name)
世界華商書畫院有限公司",2011-05-30,2016-11-04,"Private, ltd by shares"336,1608804,"IMAGE LOGISTICS (HK) LIMITED",2011-05-30,,"Private, ltd by shares"337,1609099,"INDONESIA NAMORA LIMITED",2011-05-30,2017-03-03,"Private, ltd by shares"338,1609118,"INFINITE PLEDGE DEVELOPMENT HOLDINGS (HK) CO., LIMITED
盈富耐特發展控股(香港)有限公司",2011-05-30,,"Private, ltd by shares"339,1608907,"INKOR (HONGKONG) CO., LIMITED",2011-05-30,2019-08-09,"Private, ltd by shares"340,1609197,"INSIGHTFUL VIEW INTERNATIONAL INFORMATION SERVICE CO., LIMITED
思遠國際信息資訊有限公司",2011-05-30,2016-03-24,"Private, ltd by shares"341,1608693,"Iron &amp; Steel Engineering Solutions Limited",2011-05-30,2019-02-01,"Private, ltd by shares"342,1609261,"ITALY ARMANI APPAREL (INTERNATIONAL) LIMITED
意大利阿曼尼服飾 (國際) 有限公司",2011-05-30,2015-08-07,"Private, ltd by shares"343,1608936,"ITALY MIFANDU INT'L LIMITED
意大利米凡度國際有限公司",2011-05-30,2016-01-22,"Private, ltd by shares"344,1608898,"ITALY VORIA INDUSTRIAL LIMITED
義大利法芮爾實業有限公司",2011-05-30,2014-01-17,"Private, ltd by shares"345,1609184,"IUSBLINK INT'L ELECTRONICS LIMITED
明維電子有限公司",2011-05-30,2013-02-15,"Private, ltd by shares"346,1608664,"IVY PRECISE HARDWARE COMPANY LIMITED
泰業精密工業有限公司",2011-05-30,,"Private, ltd by shares"347,1609054,"JADITEX INVESTMENT LIMITED",2011-05-30,2015-11-13,"Private, ltd by shares"348,1609038,"JCJC International Limited",2011-05-30,,"Private, ltd by shares"349,1608934,"JIALAITE (HONG KONG) BUSINESS SERVICE CO., LIMITED
嘉萊特(香港)商務服務有限公司",2011-05-30,2018-01-26,"Private, ltd by shares"350,1608814,"JIALI TRADING LIMITED
嘉力國際貿易有限公司",2011-05-30,2018-01-05,"Private, ltd by shares"351,1609214,"JIANGMEN LGMOTO IMP&amp;EXP CO., LIMITED
江門艾吉摩托車進出口有限公司",2011-05-30,,"Private, ltd by shares"352,1609227,"JIANLITECH LIMITED
清綠同創科技開發有限公司",2011-05-30,2017-01-27,"Private, ltd by shares"353,1609056,"JINGFENG INTERNATIONAL TRADING (HONG KONG) LIMITED
靖豐國際貿易(香港)有限公司",2011-05-30,,"Private, ltd by shares"354,1608929,"JINLONG INDUSTRY LIMITED",2011-05-30,2015-11-20,"Private, ltd by shares"355,1608932,"JIPU CLOTHING (CHINA) LIMITED
吉普服飾(中國)有限公司",2011-05-30,2015-06-19,"Private, ltd by shares"356,1608965,"JOC CONSULTING LIMITED",2011-05-30,,"Private, ltd by shares"357,1609081,"JOINMAX LIMITED
仲萬有限公司",2011-05-30,,"Private, ltd by shares"358,1608896,"JOY INTERNATIONAL BD CO., LIMITED",2011-05-30,2017-01-27,"Private, ltd by shares"359,1608946,"JT-SUN TECHNOLOGY (HONG KONG) CO., LIMITED
錦天盛科技(香港)有限公司",2011-05-30,2018-01-05,"Private, ltd by shares"360,1608844,"Jun Billion Company Limited
駿億加工批發有限公司",2011-05-30,,"Private, ltd by shares"361,1609263,"JUNXI PURCHASING STOCK LIMITED
峻熙采購股份有限公司",2011-05-30,2015-06-19,"Private, ltd by shares"362,1609204,"K.K.B. INTERNATIONAL CO., LIMITED",2011-05-30,2015-01-30,"Private, ltd by shares"363,1609151,"KAGAWA INTERNATIONAL LIMITED
香川國際有限公司",2011-05-30,2017-02-17,"Private, ltd by shares"364,1609200,"KAICHUANG MEDICAL GROUP (HK) LIMITED
開創醫療集團(香港)有限公司",2011-05-30,2018-01-05,"Private, ltd by shares"365,1609098,"KAM SHAN INTERNATIONAL INVESTMENT HOLDING (HONG KONG) COMPANY LIMITED (d2017-11-24)
錦山國際投資集團(香港)有限公司",2011-05-30,2017-11-24,"Private, ltd by shares"366,1609060,"KE XIN NUO (H.K.) TECHNOLOGY LIMITED
科芯諾(香港)科技有限公司",2011-05-30,2018-11-02,"Private, ltd by shares"367,1609012,"KEEP HOLDINGS GROUP (ITALY) CO., LIMITED
卡朋控股集團(意大利)有限公司",2011-05-30,2020-04-17,"Private, ltd by shares"368,1609023,"KEY LEARNING EDUCATION COMPANY LIMITED",2011-05-30,2018-01-05,"Private, ltd by shares"369,1608842,"KIM YUAN JEWELRY CO., LIMITED
金源工藝品有限公司",2011-05-30,2020-04-17,"Private, ltd by shares"370,1608687,"KING GRAND INTERNATIONAL (GROUP) LIMITED
栢宏國際(集團)有限公司",2011-05-30,2014-10-31,"Private, ltd by shares"371,1608909,"KING WING FLY ENTERPRISE LIMITED
勁域實業有限公司",2011-05-30,,"Private, ltd by shares"372,1608912,"KINGFIR INT'L INDUSTRIAL LIMITED
旗峰國際實業有限公司",2011-05-30,2016-01-22,"Private, ltd by shares"373,1609212,"KINGHOM TRADING LIMITED",2011-05-30,2017-01-27,"Private, ltd by shares"374,1608669,"KINGHONOR INTERNATIONAL INVESTMENTS LIMITED
智信國際投資有限公司",2011-05-30,,"Private, ltd by shares"375,1608958,"KINGLOO INTERNATIONAL TRADING CO., LIMITED
錦路國際貿易有限公司",2011-05-30,2017-10-13,"Private, ltd by shares"376,1608813,"Kingsoft Jingcai Online Game Corporation Limited
金山鯨彩網絡遊戲有限公司",2011-05-30,,"Private, ltd by shares"377,1609039,"Kingsun Foods Co., Limited
青聖食品有限公司",2011-05-30,,"Private, ltd by shares"378,1608782,"KMS (HK) INTERNATIONAL CO., LIMITED
卡瑪斯(香港)國際有限公司",2011-05-30,2018-01-05,"Private, ltd by shares"379,1608786,"KO HANG ENGINEERING COMPANY LIMITED
高衡工程有限公司",2011-05-30,,"Private, ltd by shares"380,1609043,"KONRAY INTERNATIONAL DEVELOPMENT LIMITED
康瑞國際發展有限公司",2011-05-30,,"Private, ltd by shares"381,1608992,"KONWICK DEVELOPMENT LIMITED
港域發展有限公司",2011-05-30,,"Private, ltd by shares"382,1608950,"KOREA RIGHT WAY PETROCHEMICAL CO., LIMITED
韓國正道石油化工有限公司",2011-05-30,2015-06-19,"Private, ltd by shares"383,1609217,"KOREAN MENGLIBEITI INT' L PERFECT FIGURE LIMITED
韓國夢麗貝緹國際美體有限公司",2011-05-30,2018-01-19,"Private, ltd by shares"384,1609186,"KOSTE ELECTRONICS LIMITED
科斯特電子有限公司",2011-05-30,2012-12-14,"Private, ltd by shares"385,1609013,"KWAN HO CHIN FUNG DEVELOPMENT LIMITED
君好錢豐貿易拓展有限公司",2011-05-30,,"Private, ltd by shares"386,1609141,"L.H.B Trading Co. Limited",2011-05-30,2015-06-19,"Private, ltd by shares"387,1608670,"LAAAF Corporation Limited",2011-05-30,,"Private, ltd by shares"388,1608681,"LAI SHUN CLEANING SERVICE LIMITED
禮信清潔有限公司",2011-05-30,2016-01-22,"Private, ltd by shares"389,1609071,"LCHK LIMITED",2011-05-30,2020-04-03,"Private, ltd by shares"390,1609246,"Lede (Hong Kong) Limited",2011-05-30,,"Private, ltd by shares"391,1608744,"LIAN BO GROUP LIMITED
聯博集團有限公司",2011-05-30,,"Private, ltd by shares"392,1608716,"LIAONING YINZHU GROUP (HONG KONG) CO., LIMITED
遼寧銀珠集團(香港)有限公司",2011-05-30,,"Private, ltd by shares"393,1609050,"LIBO ELECTRONIC TECHNOLOGY CO., LIMITED
麗博電子科技有限公司",2011-05-30,2018-11-09,"Private, ltd by shares"394,1608908,"LIFENGXIN INDUSTRIAL COMPANY LIMITED
立豐鑫實業有限公司",2011-05-30,2012-10-26,"Private, ltd by shares"395,1608799,"LiFo International Limited
力夫國際有限公司",2011-05-30,2018-01-05,"Private, ltd by shares"396,1608885,"LightingBoss Optoelectronics Co., Limited
中晶泛宇光電有限公司",2011-05-30,2017-01-27,"Private, ltd by shares"397,1609076,"LINONG CHINA LIMITED
立農(中國)有限公司",2011-05-30,,"Private, ltd by shares"398,1609026,"Lixing Binding Equipment (HK) Co., Limited
利興裝訂器材(香港)有限公司",2011-05-30,2017-01-27,"Private, ltd by shares"399,1608800,"LONG VICTORY (HK) TRADING LIMITED",2011-05-30,2015-06-19,"Private, ltd by shares"400,1609021,"LONG YUAN LIMITED (d2016-04-15)
龍園有限公司",2011-05-30,2016-04-15,"Private, ltd by shares"401,1609152,"LONMMI INT'L HOLDINGS GROUP GERMANY CO., LIMITED
朗米國際控股集團(德國)有限公司",2011-05-30,,"Private, ltd by shares"402,1608999,"LUCKY SUN ENTERPRISES LIMITED
潤新企業有限公司",2011-05-30,2018-10-05,"Private, ltd by shares"403,1609120,"LUCKYLAND GROUP COMPANY LIMITED
樂晴集團有限公司",2011-05-30,,"Private, ltd by shares"404,1608935,"Luminance Electronics Company Limited
駿業電子有限公司",2011-05-30,,"Private, ltd by shares"405,1608708,"LUSHIDA GROUP (HK) LIMITED
呂仕達集團(香港)有限公司",2011-05-30,,"Private, ltd by shares"406,1608808,"LUXURIOUS LIMITED (d2017-01-27)
豪嘉盛有限公司",2011-05-30,2017-01-27,"Private, ltd by shares"407,1608705,"MABLA INT'L INDUSTRY CO., LIMITED
麥比拉國際實業有限公司",2011-05-30,2014-11-07,"Private, ltd by shares"408,1609051,"MAC'S DEVELOPMENT COMPANY LIMITED
萬基工程發展有限公司",2011-05-30,,"Private, ltd by shares"409,1609301,"MAFFAS LIMITED",2011-05-30,,"Private, ltd by shares"410,1608770,"MAK GROUP LIMITED",2011-05-30,,"Private, ltd by shares"411,1608792,"MAKIS LIMITED
馬奇士有限公司",2011-05-30,2014-11-21,"Private, ltd by shares"412,1608846,"Man Kee Catering Group Limited
文記飲食集團有限公司",2011-05-30,2018-11-16,"Private, ltd by shares"413,1609154,"MARCO POLO GROUP (HOLDING) CO., LIMITED
馬可波羅集團(控股)有限公司",2011-05-30,,"Private, ltd by shares"414,1609182,"MASCARA PARIS CO., LIMITED (d2015-06-19)",2011-05-30,2015-06-19,"Private, ltd by shares"415,1609097,"MASS SUCCESS INVESTMENTS LIMITED
統志投資有限公司",2011-05-30,,"Private, ltd by shares"416,1609262,"MASTER DEVELOPMENT INTERNATIONAL LIMITED
萬事達發展國際有限公司",2011-05-30,,"Private, ltd by shares"417,1609006,"MATH MONKEY EDUCATION CENTER (TSUEN WAN) LIMITED
數猴皇醒目兒童教育中心(荃灣)有限公司",2011-05-30,,"Private, ltd by shares"418,1608953,"MAXVIEW (CHINA) CO., LIMITED
宏景(中國)有限公司",2011-05-30,,"Private, ltd by shares"419,1608652,"MAY'S JEWELLERIES LIMITED",2011-05-30,,"Private, ltd by shares"420,1608677,"MC CORPORATION LIMITED (HK)
同豐興業有限公司",2011-05-30,2019-03-08,"Private, ltd by shares"421,1608742,"MEDO FOOD AND BEVERAGE LIMITED
美都餐飲有限公司",2011-05-30,,"Private, ltd by shares"422,1609195,"MEECARE INTERNATIONAL CO., LIMITED
米凱爾國際股份有限公司",2011-05-30,2014-11-14,"Private, ltd by shares"423,1608921,"MEIJUHUI INT'L INVESTMENT HOLDING LIMITED
美居匯國際投資控股有限公司",2011-05-30,2018-11-16,"Private, ltd by shares"424,1609103,"MEIKAI INT'L HONG KONG LIMITED
美凱國際香港有限公司",2011-05-30,2015-06-19,"Private, ltd by shares"425,1609049,"MENGXIANG CORPORATION HK, LIMITED",2011-05-30,,"Private, ltd by shares"426,1608886,"MODERN GLORY TECHNOLOGY (HK) CO., LIMITED
創盛元科技(香港)有限公司",2011-05-30,,"Private, ltd by shares"427,1609058,"MODERN SPANISH LIMITED",2011-05-30,2020-04-03,"Private, ltd by shares"428,1609068,"MOON BLUE TRADING LIMITED",2011-05-30,2019-12-27,"Private, ltd by shares"429,1608737,"MOST RISE INTERNATIONAL DEVELOPMENT CO., LIMITED
浩升國際發展有限公司",2011-05-30,2013-03-08,"Private, ltd by shares"430,1609082,"Mount Tai International Capital Investment Limited
泰山國際資本投資有限公司",2011-05-30,2014-11-14,"Private, ltd by shares"