,Reg no.,Name,Incorp-orated,Dissolved,Type1,2764506,"BEACON HILL TRADING COMPANY LIMITED
天峰行貿易有限公司",2018-11-10,,"Private, ltd by shares"2,2764517,"CHEE ON CARE &amp; ATTENTION HOME COMPANY LIMITED
慈安護老院有限公司",2018-11-10,,"Private, ltd by shares"3,2764515,"Enimex Limited",2018-11-10,,"Private, ltd by shares"4,2764508,"GOLDEN DRAGON NEW ENERGY LIMITED
金龍新能源有限公司",2018-11-10,,"Private, ltd by shares"5,2764516,"Little Baby 123 Limited",2018-11-10,2019-07-05,"Private, ltd by shares"6,2764510,"ON JET TECHNOLOGY (HK) LIMITED
安捷科技(香港)有限公司",2018-11-10,,"Private, ltd by shares"7,2764509,"ON TAI INVESTMENTS (HK) LIMITED
安泰投資(香港)有限公司",2018-11-10,,"Private, ltd by shares"8,2764514,"PHRMASEC LIMITED",2018-11-10,,"Private, ltd by shares"9,2764511,"TOP EAGLE TRADING LIMITED
天鷹行貿易有限公司",2018-11-10,,"Private, ltd by shares"10,2764507,"TOP NET MOTOR LIMITED
天絡汽車有限公司",2018-11-10,,"Private, ltd by shares"11,2764513,"WIN FOREVER TRADING LIMITED
永捷行貿易有限公司",2018-11-10,,"Private, ltd by shares"12,2764512,"WING FLY INVESTMENTS HK LIMITED
永輝投資香港有限公司",2018-11-10,,"Private, ltd by shares"