,Reg no.,Name,Incorp-orated,Dissolved,Type220,1360826,"HK ZHONGSHANOU TAILONG DRESS LIMITED
香港中山歐太龍服飾有限公司",2009-08-10,2014-12-12,"Private, ltd by shares"221,1360642,"HOLLYBOL TECH LIMITED
香港紅利寶科技有限公司",2009-08-10,2018-04-20,"Private, ltd by shares"222,1360714,"HOMETREK IMMIGRATION CONSULTANTS LIMITED
移家移民顧問有限公司",2009-08-10,2014-11-07,"Private, ltd by shares"223,1360673,"HONG KONG ANGELA FURNITURE GROUP LIMITED
香港安傑拉家俬集團有限公司",2009-08-10,2015-07-17,"Private, ltd by shares"224,1360576,"HONG KONG FMC IMPORT &amp; EXPORT CO., LIMITED
香港凡謀成進出口有限公司",2009-08-10,2012-01-27,"Private, ltd by shares"225,1360715,"Hong Kong Gold Million Investment Trading Co., Limited
香港金百萬投資貿易有限公司",2009-08-10,2012-08-10,"Private, ltd by shares"226,1360554,"HONG KONG HOLIDAY ESTATE INTERNATIONAL GROUP CO., LIMITED
香港假日開麥拉國際集團有限公司",2009-08-10,,"Private, ltd by shares"227,1360521,"HONG KONG IMK GIFT ENTERPRISE LIMITED
伊曼科禮品有限公司",2009-08-10,,"Private, ltd by shares"228,1360897,"HONG KONG OFD CO., LIMITED
香港奧芬達技術發展有限公司",2009-08-10,2018-12-21,"Private, ltd by shares"229,1360899,"HONG KONG QIAO XING GROUP LIMITED
香港僑興集團有限公司",2009-08-10,,"Private, ltd by shares"230,1360351,"HONG KONG REAL ESTATE PANGU MARKETING INTERNATIONAL TOURISM COMPANY LIMITED
香港盤古國際旅遊地產營銷管理有限公司",2009-08-10,2014-12-12,"Private, ltd by shares"231,1360684,"HONG KONG RONG ZHUANG INVESTMENT LIMITED
香港融莊投資有限公司",2009-08-10,,"Private, ltd by shares"232,1360331,"HONG KONG SHIDA SHIPPING LIMITED
香港世達海運有限公司",2009-08-10,2017-03-31,"Private, ltd by shares"233,1360371,"HONG KONG SINOBASE INTERNATIONAL LIMITED
香港中基國際事業有限公司",2009-08-10,2020-04-17,"Private, ltd by shares"234,1360842,"HONG KONG SS INTERNATIONAL HOLDING LIMITED
香港天唯國際集團有限公司",2009-08-10,2020-05-29,"Private, ltd by shares"235,1360644,"HONG KONG THUNDERING DIAMONDS (GROUP) LIMITED
香港雷霆鑽石(集團)有限公司",2009-08-10,2013-11-08,"Private, ltd by shares"236,1360815,"HONG KONG WEIDI TECHNOLOGY COMPANY LIMITED
香港緯迪科技有限公司",2009-08-10,2013-11-08,"Private, ltd by shares"237,1360890,"HONG KONG WOTE STATIONERY CO., LIMITED
香港沃特文具有限公司",2009-08-10,,"Private, ltd by shares"238,1360355,"HONG KONG XI FU JEWELRY INTERNATIONAL GROUP LIMITED
香港喜福珠寶國際集團有限公司",2009-08-10,2014-12-12,"Private, ltd by shares"239,1360441,"HONG KONG XIANG CHENG MAHOGANY FURNITURE INDUSTRY LIMITED
香港祥成紅木家具實業有限公司",2009-08-10,2016-04-01,"Private, ltd by shares"240,1360596,"Hong Kong Zhuoer Electric Company Limited
香港卓爾電器有限公司",2009-08-10,,"Private, ltd by shares"241,1360866,"HONGKONG BAOLONG GROUP FINERY LIMITED
香港寶龍集團服飾有限公司",2009-08-10,2015-07-17,"Private, ltd by shares"242,1360795,"HONGKONG BESTCHOICE SUPPLYCHAIN ADMINISTRATION CO., LIMITED
香港嘉澤供應鏈管理有限公司",2009-08-10,,"Private, ltd by shares"243,1360740,"HONGKONG CITY GOLDEN LADY INT'L LIMITED
香港都市金夫人國際有限公司",2009-08-10,2018-04-13,"Private, ltd by shares"244,1360389,"HONGKONG FASHION EDITOR GROUP LIMITED
香港花笙國際集團有限公司",2009-08-10,,"Private, ltd by shares"245,1360587,"HONGKONG FUXING ENTERPRISES LIMITED
香港福興企業有限公司",2009-08-10,,"Private, ltd by shares"246,1360608,"HONGKONG HUIDA CO., LIMITED
輝達國際實業(香港)有限公司",2009-08-10,,"Private, ltd by shares"247,1360689,"HONGKONG JICHUAN SILK RIBBON DECORATION LIMITED
香港吉川絲帶飾品有限公司",2009-08-10,,"Private, ltd by shares"248,1360377,"HONGKONG JINFULIN JEWELRY INT'L GROUP LIMITED
香港金福麟珠寶國際集團有限公司",2009-08-10,2013-11-08,"Private, ltd by shares"249,1360324,"HONGKONG KOODA CHEMICAL TECH. LIMITED
香港科達生化科技有限公司",2009-08-10,2013-11-08,"Private, ltd by shares"250,1360819,"HONGKONG KOWLOON INTERNATIONAL TRADING LIMITED
香港九龍國際貿易有限公司",2009-08-10,,"Private, ltd by shares"251,1360566,"HongKong LianHui Financial Management Group Limited
香港聯匯財務管理集團有限公司",2009-08-10,2014-12-12,"Private, ltd by shares"252,1360493,"HONGKONG LV BANG SPRAY COTTON LIMITED
香港綠邦噴膠棉有限公司",2009-08-10,2016-04-08,"Private, ltd by shares"253,1360801,"HONGKONG VISION PUBLIC SEATING CO., LIMITED
香港威信公共座椅有限公司",2009-08-10,,"Private, ltd by shares"254,1360659,"HONGKONG XING BUSINESS INTERMEDIARY INT'L GROUP LIMITED
香港興商機國際集團有限公司",2009-08-10,2013-11-08,"Private, ltd by shares"255,1360650,"HONGXIANG TRADING (USA) INVESTMENT LIMITED
宏祥貿易(美國)投資有限公司",2009-08-10,2018-04-13,"Private, ltd by shares"256,1360492,"HORSSDEER DRESS (HONG KONG) CO., LIMITED
豪仕鹿服飾(香港)有限公司",2009-08-10,,"Private, ltd by shares"257,1360437,"HOUSE IN A CAN LIMITED",2009-08-10,2014-01-03,"Private, ltd by shares"258,1360628,"HOWATA INTERNATIONAL LIMITED
禾田國際有限公司",2009-08-10,,"Private, ltd by shares"259,1360781,"HUADU INTERNATIONAL HOLDINGS LIMITED
華都國際控股有限公司",2009-08-10,,"Private, ltd by shares"260,1360507,"HUIMING INTERNATIONAL TECH CO., LIMITED
慧明國際科技有限公司",2009-08-10,2014-12-12,"Private, ltd by shares"261,1360613,"HYHBO HAYAHABO ITALY FASHION LIMITED
意大利華洋海豹服飾有限公司",2009-08-10,2014-12-12,"Private, ltd by shares"262,1360372,"ICRIS:1360372 (no English name)
香港協豐裝飾工程有限公司",2009-08-10,2014-12-12,"Private, ltd by shares"263,1360601,"ICRIS:1360601 (no English name)
香港康源電器有限公司",2009-08-10,,"Private, ltd by shares"264,1360655,"IDEA FACTORY OF URBAN POSSIBILITIES LIMITED
都市可能概念工廠有限公司",2009-08-10,2014-12-12,"Private, ltd by shares"265,1360623,"IFUN STUDIO LIMITED
浩文科技有限公司",2009-08-10,2015-01-09,"Private, ltd by shares"266,1360578,"IKINBIN TECHNOLOGY CO., LIMITED
安可必科技有限公司",2009-08-10,2011-11-04,"Private, ltd by shares"267,1360392,"INFINITY INTERNATIONAL LIMITED (d2014-12-12)",2009-08-10,2014-12-12,"Private, ltd by shares"268,1360340,"INNOVATIVE SOURCE CO., LIMITED (HK)
英諾有限公司",2009-08-10,,"Private, ltd by shares"269,1360878,"INSIGHT LIGHTING LIMITED (HK)",2009-08-10,,"Private, ltd by shares"270,1360665,"INSPIRE KIDS WORKSHOP LIMITED
芯思童盟有限公司",2009-08-10,,"Private, ltd by shares"271,1360850,"INT'L INTELLECTUAL PROPERTY REGISTRATION SERVICES LIMITED
中外知識產權註冊登記服務有限公司",2009-08-10,,"Private, ltd by shares"272,1360892,"Integreon Managed Solutions (Hong Kong) Limited",2009-08-10,,"Private, ltd by shares"273,1360393,"Israel-China Science and Technology Development Limited
以中科技發展有限公司",2009-08-10,2018-02-23,"Private, ltd by shares"274,1360814,"ITALIAN VALENTINO INTERNATIONAL DRESS (HONG KONG) DEVELOPMENT LIMITED
意大利華倫天奴國際服飾(香港)發展有限公司",2009-08-10,2014-12-19,"Private, ltd by shares"275,1360323,"ITALY GHP PRIVATE LIMITED",2009-08-10,,"Private, ltd by shares"276,1360500,"ITALY KAIWEI DINUO FASHION LIMITED
意大利凱威蒂諾服飾有限公司",2009-08-10,2013-11-08,"Private, ltd by shares"277,1360813,"ITALY KANON ELECTRIC EQUIPMENT INT'L GROUP (CHINA) LIMITED
意大利凱能電氣設備國際集團(中國)有限公司",2009-08-10,2014-12-12,"Private, ltd by shares"278,1360772,"ITALY TMVPC GARMENTS CO., LIMITED
意大利名寵藏獒服飾有限公司",2009-08-10,2014-12-12,"Private, ltd by shares"279,1360545,"ITALY.KALUOBIYA CERAMICS (CHINA) LIMITED
意大利．卡羅比亞陶瓷(中國)有限公司",2009-08-10,,"Private, ltd by shares"280,1360629,"ITC TOSEI INTERNATIONAL INDUSTRY (HK) LIMITED
愛東國際實業(香港)有限公司",2009-08-10,2016-04-08,"Private, ltd by shares"281,1360847,"IVORIST SCIENTIFIC TECH (HONG KONG) CO LIMITED (d2014-01-30)
頤華科技(香港)有限公司",2009-08-10,2014-01-30,"Private, ltd by shares"282,1360470,"JADE EXPRESS INTERNATIONAL LIMITED
財策國際有限公司",2009-08-10,2012-05-18,"Private, ltd by shares"283,1360399,"JADEWIND LIMITED (d2014-11-14)
玉雲有限公司",2009-08-10,2014-11-14,"Private, ltd by shares"284,1360527,"JADIS IMPORT &amp; EXPORT CO., LIMITED
佳迪斯進出口有限公司",2009-08-10,,"Private, ltd by shares"285,1360784,"JAPAN EMPEROR GROUP LIMITED
日本名皇集團有限公司",2009-08-10,2013-11-08,"Private, ltd by shares"286,1360647,"JAPAN SPEED INTERNATIONAL CO., LIMITED
日本斯必達株式會社國際有限公司",2009-08-10,2013-11-08,"Private, ltd by shares"287,1360830,"JENNYFLOWER INDUSTRY LIMITED
珍妮花實業有限公司",2009-08-10,2014-03-21,"Private, ltd by shares"288,1360425,"JET LUCKY LIMITED (d2014-04-25)",2009-08-10,2014-04-25,"Private, ltd by shares"289,1360428,"JET SPIRIT LIMITED",2009-08-10,,"Private, ltd by shares"290,1360667,"JETSOON INTERNATIONAL TRANSPORTATION LIMITED
傑信貨運有限公司",2009-08-10,,"Private, ltd by shares"291,1360787,"JIAHUA TRADING &amp; CONSULTING LIMITED
嘉華貿易諮詢有限公司",2009-08-10,2014-12-12,"Private, ltd by shares"292,1360840,"JIMEI (HONG KONG) ARTISTIC DESIGN ENGINEERING COMPANY LIMITED
集美(香港)藝術設計工程有限公司",2009-08-10,2019-08-02,"Private, ltd by shares"293,1360865,"JINHAIYI (HONGKONG) INTERNATIONAL CO., LIMITED
金海逸(香港)國際有限公司",2009-08-10,,"Private, ltd by shares"294,1360906,"Johnson Matthey Tracerco Holdings Hong Kong Limited",2009-08-10,,"Private, ltd by shares"295,1360401,"JOY ROCK LIMITED",2009-08-10,,"Private, ltd by shares"296,1360412,"JOY THINK LIMITED (d2012-03-02)
樂樂貿易有限公司",2009-08-10,2012-03-02,"Private, ltd by shares"297,1360584,"JOYEX INTERNATIONAL INDUSTRIAL LIMITED
祺悅科技有限公司",2009-08-10,2020-06-05,"Private, ltd by shares"298,1360417,"JOYSTICK LIMITED (d2020-04-29)",2009-08-10,2020-04-29,"Private, ltd by shares"299,1360738,"JRC Holdings Limited (HK)",2009-08-10,,"Private, ltd by shares"300,1360426,"JUMBO GOAL LIMITED
津高有限公司",2009-08-10,,"Private, ltd by shares"301,1360620,"JUMBO WALK LIMITED
天慈有限公司",2009-08-10,,"Private, ltd by shares"302,1360698,"JUN HAO INTERNATIONAL TRADING (HK) LIMITED
君豪國際貿易(香港)有限公司",2009-08-10,2012-02-03,"Private, ltd by shares"303,1360586,"JWF (HK) TRADING CO., LIMITED
錦文豐(香港)貿易有限公司",2009-08-10,,"Private, ltd by shares"304,1360693,"K and C Juice &amp; Sandwiches Co Limited
金葉果汁店有限公司",2009-08-10,2011-05-20,"Private, ltd by shares"305,1360487,"KAM PO TOURIST BUS COMPANY LIMITED
金寶旅遊巴士有限公司",2009-08-10,,"Private, ltd by shares"306,1360442,"KAYCE MARKETING LIMITED
基策營銷顧問有限公司",2009-08-10,2012-12-07,"Private, ltd by shares"307,1360617,"KEEN EAGLE ENGINEERING LIMITED
建鵬工程有限公司",2009-08-10,,"Private, ltd by shares"308,1360564,"KEENBOW LIMITED
軒保有限公司",2009-08-10,2013-11-08,"Private, ltd by shares"309,1360891,"KEYRICH TEXTILE DYES &amp; CHEMICALS LIMITED
旗泰紡織染化有限公司",2009-08-10,2014-05-02,"Private, ltd by shares"310,1360751,"Khaai Media Enterprise Limited",2009-08-10,2014-12-12,"Private, ltd by shares"311,1360453,"KING SOURCES INTERNATIONAL LIMITED
景浩國際有限公司",2009-08-10,2015-01-30,"Private, ltd by shares"312,1360407,"KING-GOOD GROUP (HONG KONG) LIMITED
金固集團(香港)有限公司",2009-08-10,,"Private, ltd by shares"313,1360449,"KINGBONA INTERNATIONAL INDUSTRIAL LIMITED
品冠國際實業有限公司",2009-08-10,2016-04-29,"Private, ltd by shares"314,1360765,"KINGFAST INTERNATIONAL ELECTRONICS CO., LIMITED
香港金速國際有限公司",2009-08-10,2018-01-26,"Private, ltd by shares"315,1360706,"KINGS GROUP INTERNATIONAL HOLDINGS LIMITED
皇城集團國際控股有限公司",2009-08-10,,"Private, ltd by shares"316,1360341,"Kingview Technologies Co., Limited
景豐科研有限公司",2009-08-10,2015-05-15,"Private, ltd by shares"317,1360598,"KIT INT'L LIMITED
傑國際有限公司",2009-08-10,2013-11-08,"Private, ltd by shares"318,1360832,"KONG LUNG (HONG KONG) OFFICE SUPPLIES COMPANY LIMITED
港隆(香港)商用辦公有限公司",2009-08-10,,"Private, ltd by shares"319,1360816,"KOREA DASUANTOU INTERNATIONAL DRESS LIMITED
韓國大蒜頭國際服飾有限公司",2009-08-10,2015-07-17,"Private, ltd by shares"320,1360523,"KOREAN SIQISI INT'L DRESS LIMITED
韓國斯其斯國際服飾有限公司",2009-08-10,2014-12-19,"Private, ltd by shares"321,1360390,"Kwan Woo Trading Limited
冠宇貿易(香港)有限公司",2009-08-10,2012-09-21,"Private, ltd by shares"322,1360668,"KWELL DIGITAL ELECTRONIC CO., LIMITED
科威數碼電子有限公司",2009-08-10,2016-04-08,"Private, ltd by shares"323,1360409,"L &amp; K Consultants Limited
卓域顧問有限公司",2009-08-10,,"Private, ltd by shares"324,1360342,"LAFITE ROTHSCHILD (FRANCE) WINERY GROUP LIMITED
法國拉菲羅斯柴爾德酒業集團有限公司",2009-08-10,2017-03-31,"Private, ltd by shares"325,1360822,"LasFocus Corporation Limited
朱氏激光設備有限公司",2009-08-10,,"Private, ltd by shares"326,1360777,"LAZARRA GROUP LIMITED",2009-08-10,2013-11-08,"Private, ltd by shares"327,1360430,"LEADER CROWN LIMITED",2009-08-10,,"Private, ltd by shares"328,1360661,"LEJINJI FOOD (HONG KONG) LIMITED
樂錦記食品(香港)有限公司",2009-08-10,2013-11-08,"Private, ltd by shares"329,1360556,"LEMAN (GERMANY) SANITARY WARE INT'L LIMITED
樂曼(德國)衛浴國際有限公司",2009-08-10,2015-07-17,"Private, ltd by shares"330,1360731,"LENA INDUSTRIAL HOLDING LIMITED
力能實業控股有限公司",2009-08-10,2015-12-11,"Private, ltd by shares"331,1360359,"LES.EVA INTERNATIONAL CO., LIMITED
萊絲伊國際有限公司",2009-08-10,2013-02-01,"Private, ltd by shares"332,1360682,"LIANGGE (CHINA) CO., LIMITED
良格(中國)有限公司",2009-08-10,2015-07-17,"Private, ltd by shares"333,1360621,"LICSON LIMITED
利生行有限公司",2009-08-10,,"Private, ltd by shares"334,1360746,"Life House Interior Design Limited
生活家居室內設計有限公司",2009-08-10,2013-11-08,"Private, ltd by shares"335,1360557,"LITTLE SWAN SHARES CO., LIMITED
小天鵝股份有限公司",2009-08-10,2013-11-08,"Private, ltd by shares"336,1360604,"LNG WORLDWIDE SALON FURNITURE LIMITED",2009-08-10,2015-07-17,"Private, ltd by shares"337,1360495,"LONG EASE DEVELOPMENT LIMITED
振順發展有限公司",2009-08-10,,"Private, ltd by shares"338,1360459,"LONG ELITE INTERNATIONAL LIMITED
晴朗國際有限公司",2009-08-10,,"Private, ltd by shares"339,1360498,"LONG SHARP DEVELOPMENT LIMITED
瑞鋒發展有限公司",2009-08-10,2014-12-12,"Private, ltd by shares"340,1360489,"LUCK FORTUNE CHINA LIMITED
濠富中國有限公司",2009-08-10,2014-12-12,"Private, ltd by shares"341,1360477,"LUCK FORTUNE INTERNATIONAL INDUSTRIAL LIMITED
懿德國際實業有限公司",2009-08-10,2018-11-09,"Private, ltd by shares"342,1360421,"LUCKY JET LIMITED",2009-08-10,,"Private, ltd by shares"343,1360750,"LUI HACK INT'L LIMITED
雷克國際有限公司",2009-08-10,2015-09-11,"Private, ltd by shares"344,1360829,"LUWANG DRESS LIMITED
鹿王服飾有限公司",2009-08-10,2013-11-08,"Private, ltd by shares"345,1360369,"M&amp;C TECHNOLOGY CO., LIMITED
金康科技有限公司",2009-08-10,2020-01-10,"Private, ltd by shares"346,1360675,"MAIDONG HEALTH INTERNATIONAL (HONG KONG) LIMITED
邁動健康國際(香港)有限公司",2009-08-10,,"Private, ltd by shares"347,1360525,"MAN HOUSE (CHINA) FASHION LIMITED
男人之家(中國)服飾有限公司",2009-08-10,2014-12-19,"Private, ltd by shares"348,1360585,"MANO INTERNATIONAL CHEMICAL TRADING CO. LIMITED
廣州曼諾國際貿易有限公司",2009-08-10,2013-11-08,"Private, ltd by shares"349,1360720,"MANOFFICE INTERNATIONAL PTY LIMITED
澳力國際有限公司",2009-08-10,,"Private, ltd by shares"350,1360797,"MANTAT INTERNATIONAL (H.K.) LIMITED
萬達國際(經貿)有限公司",2009-08-10,2016-04-08,"Private, ltd by shares"351,1360609,"MARK POWER LIMITED
誌權有限公司",2009-08-10,,"Private, ltd by shares"352,1360828,"MARK SIX DEVELOPMENT LIMITED
六合發展有限公司",2009-08-10,,"Private, ltd by shares"353,1360479,"MAX PRIME INTERNATIONAL LIMITED
聯資國際有限公司",2009-08-10,,"Private, ltd by shares"354,1360433,"MAX PROFIT ENTERPRISES LIMITED
凱睛企業有限公司",2009-08-10,,"Private, ltd by shares"355,1360465,"MAXGROWTH GROUP LIMITED
浩盛集團有限公司",2009-08-10,,"Private, ltd by shares"356,1360424,"MAXI CHAIN LIMITED",2009-08-10,,"Private, ltd by shares"357,1360398,"MCK Capital Co., Limited
邁克投資貿易有限公司",2009-08-10,,"Private, ltd by shares"358,1360454,"MEDICUS HK LIMITED",2009-08-10,,"Private, ltd by shares"359,1360471,"MEGAFOODS (HONG KONG) GROUP CO., LIMITED
明富(香港)食品集團有限公司",2009-08-10,,"Private, ltd by shares"360,1360336,"MERF FOUNDATION LIMITED",2009-08-10,2014-12-19,"Private, ltd by shares"361,1360528,"MERUBEX DISTRIBUTION LIMITED",2009-08-10,2015-12-11,"Private, ltd by shares"362,1360443,"MILKHONEYLAND ECOMMERCE LIMITED
嘉諾電子商務有限公司",2009-08-10,2014-12-12,"Private, ltd by shares"363,1360725,"MING MICRO COMMUNICATION TECHNOLOGY CO., LIMITED
岷微通訊科技有限公司",2009-08-10,2013-04-05,"Private, ltd by shares"364,1360427,"MING TIE LEATHER COMPANY LIMITED
銘泰皮革有限公司",2009-08-10,2011-11-25,"Private, ltd by shares"365,1360868,"MIRADOR HOTEL LIMITED
美麗都酒店有限公司",2009-08-10,,"Private, ltd by shares"366,1360809,"MONGOLIA EDUCY GARMENTS LIMITED
內蒙古鄂督師服飾有限公司",2009-08-10,2013-11-08,"Private, ltd by shares"367,1360881,"MONT CLOUD CO., LIMITED
寧波雲鶴國際貿易有限公司",2009-08-10,2018-05-18,"Private, ltd by shares"368,1360503,"MORAL SOUND LIMITED (d2012-02-03)
聚言有限公司",2009-08-10,2012-02-03,"Private, ltd by shares"369,1360888,"Motorsport Asia Publishing Limited",2009-08-10,2013-11-08,"Private, ltd by shares"370,1360405,"MOUNTAINOUS LIMITED
瀛卓有限公司",2009-08-10,,"Private, ltd by shares"371,1360755,"MR CAMERA COMPANY LIMITED",2009-08-10,2011-10-07,"Private, ltd by shares"372,1360700,"MULTIPLE INDUSTRIAL CENTRE LIMITED
利寶工業有限公司",2009-08-10,2015-02-13,"Private, ltd by shares"373,1360882,"MYAFFECTIONAL.COM LIMITED",2009-08-10,2017-03-31,"Private, ltd by shares"374,1360873,"MYSTIC CORPORATION (HONG KONG) LIMITED",2009-08-10,,"Private, ltd by shares"375,1360494,"NANSHAN DEVELOPMENT (HONG KONG) LIMITED
南山開發(香港)有限公司",2009-08-10,,"Private, ltd by shares"376,1360327,"NEW KINGSWOOD GOLF CLUB DEVELOPMENT LIMITED
新鴻業高爾夫球會發展有限公司",2009-08-10,2011-12-02,"Private, ltd by shares"377,1360690,"NEW SUNLIGHT INTERNATIONAL HOLDINGS LIMITED
新陽光國際控股有限公司",2009-08-10,2014-12-12,"Private, ltd by shares"378,1360326,"NEW WAVE INVESTMENT INTERNATIONAL LIMITED
新濤投資國際有限公司",2009-08-10,2013-11-08,"Private, ltd by shares"379,1360824,"NEWTECH INDUSTRIES TRADE LIMITED",2009-08-10,2020-06-05,"Private, ltd by shares"380,1360710,"NEWTEK POWER LIMITED
新創源有限公司",2009-08-10,2019-02-22,"Private, ltd by shares"381,1360555,"NIBIKE COMPANY LIMITED
耐百克股份有限公司",2009-08-10,2014-12-12,"Private, ltd by shares"382,1360737,"NINGBO QIXING INDUSTRIAL CO., LIMITED
寧波市奇興工貿有限公司",2009-08-10,,"Private, ltd by shares"383,1360724,"Nmosphere Global Creative Product Limited
宇登國際創意產品貿易有限公司",2009-08-10,,"Private, ltd by shares"384,1360788,"NO. 1 FOCUS (HK) ENTERPRISES CO., LIMITED
第一焦點(香港)實業有限公司",2009-08-10,,"Private, ltd by shares"385,1360524,"OCEAN GOAL LIMITED
海協有限公司",2009-08-10,,"Private, ltd by shares"386,1360606,"OCEAN POWER INVESTMENTS LIMITED
越洋投資有限公司",2009-08-10,2013-11-08,"Private, ltd by shares"387,1360679,"On One Engineering Co. Limited
安穩工程有限公司",2009-08-10,2015-03-06,"Private, ltd by shares"388,1360792,"OPPLE ELECTRIC APPLIANCES TECHNOLOGY (CHINA) COMPANY LIMITED
歐普電器科技(中國)股份有限公司",2009-08-10,2013-11-08,"Private, ltd by shares"389,1360436,"OPSIE INTERNATIONAL CO. LIMITED",2009-08-10,,"Private, ltd by shares"390,1360411,"OUTLET GLOBAL LIMITED
奧特萊斯環球有限公司",2009-08-10,,"Private, ltd by shares"391,1360448,"P-TWO INDUSTRIAL COMPANY LIMITED",2009-08-10,2010-11-05,"Private, ltd by shares"392,1360711,"PANDA ADVERTISING AGENCY LIMITED
熊貓廣告制作有限公司",2009-08-10,,"Private, ltd by shares"393,1360440,"PANG KWONG INDUSTRIAL LIMITED
鵬光實業有限公司",2009-08-10,2018-12-07,"Private, ltd by shares"394,1360756,"PAUL INT'L DEVELOP LIMITED
保羅國際拓展有限公司",2009-08-10,2010-12-17,"Private, ltd by shares"395,1360463,"PEARL LINK GROUP LIMITED
睛軒集團有限公司",2009-08-10,2012-03-09,"Private, ltd by shares"396,1360730,"PENG LIMITED",2009-08-10,2011-08-05,"Private, ltd by shares"397,1360723,"PEOPLE'S MEDICARE CENTRE LIMITED
為民醫療中心有限公司",2009-08-10,2013-11-08,"Private, ltd by shares"398,1360508,"PERFECT ACHIEVE INVESTMENTS LIMITED
宏凱投資有限公司",2009-08-10,2013-04-05,"Private, ltd by shares"399,1360806,"PERFECT TIMES INVESTMENT LIMITED
美時投資有限公司",2009-08-10,,"Private, ltd by shares"400,1360353,"POWER SKY ENERGY LIMITED
力天動力有限公司",2009-08-10,,"Private, ltd by shares"401,1360455,"POWER TREASURE DEVELOPMENT LIMITED
富鎰發展有限公司",2009-08-10,2011-11-04,"Private, ltd by shares"402,1360439,"POWER TREASURE INTERNATIONAL ENTERPRISES LIMITED
興溢國際企業有限公司",2009-08-10,2014-12-12,"Private, ltd by shares"403,1360541,"PREMA GROUP LIMITED (d2013-11-08)",2009-08-10,2013-11-08,"Private, ltd by shares"404,1360460,"PREMIER GARDEN DEVELOPMENT LIMITED (d2012-12-07)
帝庭發展有限公司",2009-08-10,2012-12-07,"Private, ltd by shares"405,1360374,"PREMIERE CREATION COMPANY LIMITED
首創環球有限公司",2009-08-10,2018-06-01,"Private, ltd by shares"406,1360410,"PRESTIGE SOURCE ENTERPRISES LIMITED
尚僑企業有限公司",2009-08-10,,"Private, ltd by shares"407,1360414,"PRIME ACCORD ENTERPRISES LIMITED
霆峰企業有限公司",2009-08-10,2020-06-05,"Private, ltd by shares"408,1360476,"PRIME TALENT INDUSTRIAL LIMITED
富鎰實業有限公司",2009-08-10,2015-12-24,"Private, ltd by shares"409,1360838,"PRIMODE INDUSTRIAL LIMITED (d2013-03-22)
鉞昇實業有限公司",2009-08-10,2013-03-22,"Private, ltd by shares"410,1360491,"PROFIT MARK ASIA LIMITED
翰林亞洲有限公司",2009-08-10,,"Private, ltd by shares"411,1360348,"PROJECT-SURVIVAL LIMITED",2009-08-10,2012-09-07,"Private, ltd by shares"412,1360422,"PURE MIND LIMITED
沛然有限公司",2009-08-10,,"Private, ltd by shares"413,1360506,"PURIFIED WATER TECHNOLOGY (HK) LIMITED
淨水科技(香港)有限公司",2009-08-10,,"Private, ltd by shares"414,1360357,"Q LIMITED (d2015-09-25)
連贏有限公司",2009-08-10,2015-09-25,"Private, ltd by shares"415,1360648,"Q SQUARED DESIGN LIMITED
麒騰有限公司",2009-08-10,2015-05-08,"Private, ltd by shares"416,1360381,"QD LUCKY GROUP LIMITED
青島祥瑞橡膠製品有限公司",2009-08-10,,"Private, ltd by shares"417,1360347,"QINGDAO PERPETUAL HOSE CLAMP CO., LIMITED
青島永固緊固件有限公司",2009-08-10,,"Private, ltd by shares"418,1360872,"QINGDAO SHUANGYU TOOL LIMITED
青島雙裕工具有限公司",2009-08-10,,"Private, ltd by shares"419,1360344,"Quality Solutions Limited (d2016-04-01)",2009-08-10,2016-04-01,"Private, ltd by shares"420,1360362,"R.CRANE Technology &amp; Trading Co., Limited
澤風和科技貿易有限公司",2009-08-10,,"Private, ltd by shares"421,1360505,"R3 GROUP HOLDINGS LIMITED",2009-08-10,,"Private, ltd by shares"422,1360876,"RACK IN THE CASES LIMITED
雷克實業有限公司",2009-08-10,,"Private, ltd by shares"423,1360597,"RAINBOW CAPITAL DEVELOPMENT LIMITED
永都發展有限公司",2009-08-10,2011-12-09,"Private, ltd by shares"424,1360488,"RAW BROTHERS CO., LIMITED
勞恩兄弟有限公司",2009-08-10,2015-01-23,"Private, ltd by shares"425,1360358,"REDSTAR CONSULTING LIMITED (d2013-11-08)",2009-08-10,2013-11-08,"Private, ltd by shares"426,1360577,"REGIUS NOBEL COOKROOM SANITATION LIGHTING ELECTRIC LIMITED
皇家諾貝爾廚衛照明電氣有限公司",2009-08-10,2013-11-08,"Private, ltd by shares"427,1360332,"RESOURCE (H.K.) LIMITED",2009-08-10,2015-01-30,"Private, ltd by shares"428,1360466,"RICH ROCK LIMITED",2009-08-10,,"Private, ltd by shares"429,1360652,"Rich Sunrise Holdings Co., Limited
昇陽股份有限公司",2009-08-10,2020-06-05,"Private, ltd by shares"430,1360870,"RICH.M LIMITED
睿志有限公司",2009-08-10,,"Private, ltd by shares"431,1360461,"RICHYORK INTERNATIONAL DEVELOPMENT LIMITED
溢滿國際發展有限公司",2009-08-10,,"Private, ltd by shares"432,1360790,"RIDGELINE LIMITED (d2013-03-15)",2009-08-10,2013-03-15,"Private, ltd by shares"433,1360386,"RIGHT HOPE LIMITED",2009-08-10,,"Private, ltd by shares"434,1360539,"RISE MOUNT INTERNATIONAL LIMITED
振峰國際有限公司",2009-08-10,2013-11-08,"Private, ltd by shares"435,1360636,"RiskPro Consulting Limited
歷高顧問有限公司",2009-08-10,2010-12-10,"Private, ltd by shares"436,1360726,"ROLLS ROYAL NUTRITION (SWISS) CO., LIMITED
瑞皇營養品(瑞士)有限公司",2009-08-10,2011-09-23,"Private, ltd by shares"437,1360333,"RONGHUI ELECTRONICS LIMITED
榮暉電子有限公司",2009-08-10,2019-05-31,"Private, ltd by shares"