,Reg no.,Name,Incorp-orated,Dissolved,Type1,1360384,"2TIGERS GROUP LIMITED",2009-08-10,,"Private, ltd by shares"2,1360595,"3PL-Total Technology (HK) Limited
三元供應鏈科技(香港)有限公司",2009-08-10,,"Private, ltd by shares"3,1360877,"ADKEN GLOBAL LIMITED",2009-08-10,2014-12-12,"Private, ltd by shares"4,1360741,"ADVENTIS ASSESSORS LIMITED",2009-08-10,2017-01-13,"Private, ltd by shares"5,1360886,"AGZ FENHE FACTORY LIMITED
汾河工廠有限公司",2009-08-10,2016-04-22,"Private, ltd by shares"6,1360732,"AK MOULD INDUSTRIAL LIMITED
精鴻源模具實業有限公司",2009-08-10,2015-07-17,"Private, ltd by shares"7,1360457,"ALLIED RESOURCES DEVELOPMENT LIMITED
龍甫發展有限公司",2009-08-10,2016-09-23,"Private, ltd by shares"8,1360464,"ALPON COMMERCIAL LIMITED",2009-08-10,,"Private, ltd by shares"9,1360734,"AMERICA LONGHUA INVESTMENT LIMITED
美利堅龍華投資有限公司",2009-08-10,2018-04-13,"Private, ltd by shares"10,1360793,"AMERICAS BEST FRANCHISING INC. HOTELS AND RESORTS (CHINA) LIMITED
美國最佳酒店與度假村(中國)有限公司",2009-08-10,2017-04-07,"Private, ltd by shares"11,1360786,"AND GROUP LIMITED (d2014-12-12)",2009-08-10,2014-12-12,"Private, ltd by shares"12,1360395,"AORAN INDUSTRY CO., LIMITED
奧朗科技有限公司",2009-08-10,,"Private, ltd by shares"13,1360472,"APGRC (HONG KONG) LIMITED
新預制(香港)有限公司",2009-08-10,2016-06-03,"Private, ltd by shares"14,1360571,"ART LINENS INTERNATIONAL LIMITED
唯一紡織國際有限公司",2009-08-10,,"Private, ltd by shares"15,1360349,"Asia Deuway Marine (HK) Limited
亞洲德為海事(香港)有限公司",2009-08-10,2014-12-12,"Private, ltd by shares"16,1360867,"ASIA DIA TRADING COMPANY LIMITED",2009-08-10,,"Private, ltd by shares"17,1360588,"Asia X-Search Limited",2009-08-10,2013-02-08,"Private, ltd by shares"18,1360778,"ASTIN ASIA LIMITED",2009-08-10,2014-12-12,"Private, ltd by shares"19,1360859,"AU-US EDUCATION (INTERNATIONAL) CHAINS INSTITUTION CO., LIMITED
澳美教育國際連鎖機構有限公司",2009-08-10,,"Private, ltd by shares"20,1360691,"AUVERS (H.K.) INTERNATIONAL LIMITED
奧維(香港)國際有限公司",2009-08-10,2015-03-06,"Private, ltd by shares"21,1360329,"AXISWELL CONTRACTING LIMITED
世灝建設有限公司",2009-08-10,,"Private, ltd by shares"22,1360328,"B &amp; W TEXTILES PRODUCTS ENTERPRISES LIMITED
一帆企業有限公司",2009-08-10,,"Private, ltd by shares"23,1360769,"BAIG Asia Pacific Co. Limited
柏安再保經紀顧問有限公司",2009-08-10,2015-07-17,"Private, ltd by shares"24,1360791,"BAILONGMA MEDIA GROUP CO., LIMITED
白龍馬傳媒集團有限公司",2009-08-10,2020-06-05,"Private, ltd by shares"25,1360767,"BALLUX LIMITED
保力士有限公司",2009-08-10,,"Private, ltd by shares"26,1360898,"BEAIN CNC (HONG KONG) CO., LIMITED
貝英數控(香港)有限公司",2009-08-10,2020-06-05,"Private, ltd by shares"27,1360499,"BELG TECH LIMITED
貝格科技有限公司",2009-08-10,,"Private, ltd by shares"28,1360530,"BEST INT'L ELECTRONICS CO., LIMITED
貝斯特國際電子有限公司",2009-08-10,2011-12-09,"Private, ltd by shares"29,1360367,"BEST THINK LIMITED",2009-08-10,,"Private, ltd by shares"30,1360394,"Betanaut Limited
孔乙己有限公司",2009-08-10,,"Private, ltd by shares"31,1360758,"Beyer Graphics Far East Limited",2009-08-10,,"Private, ltd by shares"32,1360363,"BIEVO GROUP (HK) COMPANY LIMITED
百諾集團(香港)有限公司",2009-08-10,2012-11-30,"Private, ltd by shares"33,1360391,"BIOWORLD INDUSTRIAL LIMITED
百奧企業有限公司",2009-08-10,,"Private, ltd by shares"34,1360805,"BJ DIGITAL GADGETS COMPANY LIMITED
百捷數碼潮代有限公司",2009-08-10,2016-01-29,"Private, ltd by shares"35,1360345,"BNP INDUSTRIAL CO., LIMITED",2009-08-10,,"Private, ltd by shares"36,1360712,"BOBIAO FASHION (CHINA) CO., LIMITED
搏標服飾(中國)有限公司",2009-08-10,2013-11-08,"Private, ltd by shares"37,1360651,"BOOLOME (CHINA) TECHNOLOGY CO., LIMITED
波羅蜜(中國)網絡技術有限公司",2009-08-10,2013-11-08,"Private, ltd by shares"38,1360749,"BOSHENG INDUSTRY COMPANY LIMITED
博盛華實業有限公司",2009-08-10,2020-06-12,"Private, ltd by shares"39,1360807,"Brassco Limited (d2012-12-21)",2009-08-10,2012-12-21,"Private, ltd by shares"40,1360831,"BRITAIN HOLLAND ESHELL INT'L (CHINA) LIMITED
英荷殼國際(中國)有限公司",2009-08-10,2013-11-08,"Private, ltd by shares"41,1360486,"CAPITALEAST INTERNATIONAL INVESTMENT LIMITED
凱睛國際投資有限公司",2009-08-10,2020-06-05,"Private, ltd by shares"42,1360676,"CARBOSS INDUSTRIAL CO., LIMITED
車邦實業有限公司",2009-08-10,,"Private, ltd by shares"43,1360869,"CARESIR INDUSTRY GROUP LIMITED
凱澤實業集團有限公司",2009-08-10,2014-01-03,"Private, ltd by shares"44,1360812,"CENTRAL GRACE INTERNATIONAL LIMITED
華善國際有限公司",2009-08-10,,"Private, ltd by shares"45,1360582,"CENTRAL MARK TRADING COMPANY LIMITED
中名貿易有限公司",2009-08-10,2016-04-22,"Private, ltd by shares"46,1360823,"CENTURY LIGHTING INTERNATIONAL LIMITED
聖特國際有限公司",2009-08-10,,"Private, ltd by shares"47,1360616,"CHAMFUN TOOLS COMPANY LIMITED
金科工具有限公司",2009-08-10,,"Private, ltd by shares"48,1360754,"CHANGE LINK TECHNOLOGY LIMITED
創連科技有限公司",2009-08-10,2012-05-04,"Private, ltd by shares"49,1360560,"CHANGSHU ZHONGJIANG (HK) CO., LIMITED
常熟中江香港有限公司",2009-08-10,2011-04-01,"Private, ltd by shares"50,1360484,"CHANTAL PARK INVESTMENT LIMITED
卓萃投資有限公司",2009-08-10,2011-03-04,"Private, ltd by shares"51,1360645,"CHENGCHIN INTERNATIONAL FREIGHT FORWARDING CO., LIMITED
誠展國際貨運代理有限公司",2009-08-10,,"Private, ltd by shares"52,1360718,"CHINA (HK) CENTER OF INTERNATIONAL ECONOMIC EXCHANGES CO., LIMITED
中國(香港)國際經濟交流中心有限公司",2009-08-10,2013-11-08,"Private, ltd by shares"53,1360702,"CHINA BLESS INTERNATIONAL INVESTMENT LIMITED",2009-08-10,2018-04-27,"Private, ltd by shares"54,1360496,"CHINA CISHAN GROUP INVESTMENT MANAGEMENT LIMITED
中國慈善集團投資管理有限公司",2009-08-10,2016-04-29,"Private, ltd by shares"55,1360789,"CHINA CONSUMPTION NEWS PRESS CO., LIMITED
中國消費新聞報業有限公司",2009-08-10,2015-12-04,"Private, ltd by shares"56,1360444,"China Investment Promotion Company Limited
中國投資促進有限公司",2009-08-10,2012-05-18,"Private, ltd by shares"57,1360561,"CHINA JIANGSU YANGHE GUOBINYAN BREWERY LIMITED
中國江蘇洋河國賓宴酒業有限公司",2009-08-10,2013-11-08,"Private, ltd by shares"58,1360856,"CHINA KONG AUTO BODY BUILDERS (HOLDING) LIMITED",2009-08-10,,"Private, ltd by shares"59,1360602,"CHINA MANUFACTORY GROUP LIMITED",2009-08-10,2014-12-12,"Private, ltd by shares"60,1360896,"CHINA REAL ESTATE SUPERMARKET GROUP HOLDINGS CO., LIMITED
中國房產超市集團控股有限公司",2009-08-10,,"Private, ltd by shares"61,1360799,"CHINA WENSHANG MEDIA HOLDING CO., LIMITED
中國溫商傳媒控股有限公司",2009-08-10,2016-04-08,"Private, ltd by shares"62,1360893,"CHINA2YOU INTERNATIONAL CO., LIMITED",2009-08-10,,"Private, ltd by shares"63,1360802,"CHINESE FOLKS PUBLISHING COMPANY LIMITED
中華鄉親出版社有限公司",2009-08-10,2017-12-15,"Private, ltd by shares"64,1360625,"CHORDWELL CORPORATION LIMITED
佳禾盛有限公司",2009-08-10,2020-06-05,"Private, ltd by shares"65,1360763,"CHUANG XING JIA GROUP (HK) CO., LIMITED
創興佳集團(香港)有限公司",2009-08-10,,"Private, ltd by shares"66,1360365,"CHUANG XING TECHNOLOGY DEVELOPMENT (HK) LIMITED
創興科技發展(香港)有限公司",2009-08-10,2018-07-13,"Private, ltd by shares"67,1360871,"CITYRAY GROUP LIMITED
施特偉集團有限公司",2009-08-10,,"Private, ltd by shares"68,1360771,"CITYRAY TECHNOLOGY (HK) LIMITED
施特偉科技(香港)有限公司",2009-08-10,,"Private, ltd by shares"69,1360330,"CLASSIC PRINTING (HONG KONG) LIMITED
英傑印刷(香港)有限公司",2009-08-10,2016-10-28,"Private, ltd by shares"70,1360861,"CN STONE LIMITED
希恩石材有限公司",2009-08-10,2020-05-29,"Private, ltd by shares"71,1360397,"CNR INTERNATIONAL TRADING LIMITED",2009-08-10,2014-12-12,"Private, ltd by shares"72,1360854,"COAL Copenhagen Limited",2009-08-10,2014-01-10,"Private, ltd by shares"73,1360853,"COLOR PROMOTION GIFT COMPANY LIMITED
卡樂禮品有限公司",2009-08-10,2016-03-24,"Private, ltd by shares"74,1360446,"COLOUR PLUS ENTERPRISES LIMITED
彩添企業有限公司",2009-08-10,2011-05-20,"Private, ltd by shares"75,1360335,"COMAX PROFESSIONAL CONSULTANTS LIMITED
宏信專業顧問有限公司",2009-08-10,2010-11-12,"Private, ltd by shares"76,1360568,"COME RISE (HONG KONG) LIMITED",2009-08-10,,"Private, ltd by shares"77,1360548,"COMFI-HOME LIMITED
心儀家居有限公司",2009-08-10,,"Private, ltd by shares"78,1360519,"Company Registration Number 1360519 Limited
公司註冊編號 1360519 有限公司",2009-08-10,2014-10-03,"Private, ltd by shares"79,1360785,"Company Registration Number 1360785 Limited
公司註冊編號 1360785 有限公司",2009-08-10,,"Private, ltd by shares"80,1360841,"Company Registration Number 1360841 Limited
公司註冊編號 1360841 有限公司",2009-08-10,,"Private, ltd by shares"81,1360569,"CONSENT CONSULTANTS LIMITED
康信顧問有限公司",2009-08-10,,"Private, ltd by shares"82,1360632,"CONTINENTAL BUSINESS GROUP LIMITED
州際商貿集團有限公司",2009-08-10,2020-05-15,"Private, ltd by shares"83,1360403,"CORNUCOPIA LIMITED
中華財富匯萃有限公司",2009-08-10,,"Private, ltd by shares"84,1360338,"COTECH SOLAR GROUP LIMITED
上海合泰太陽能有限公司",2009-08-10,2011-01-21,"Private, ltd by shares"85,1360622,"Creative Global Company Limited
創意環球有限公司",2009-08-10,2014-12-12,"Private, ltd by shares"86,1360445,"CRESCENT SKY TRADING LIMITED
凱睛貿易有限公司",2009-08-10,2011-12-02,"Private, ltd by shares"87,1360431,"CROWN LUCKY ENTERPRISES LIMITED
冠祥企業有限公司",2009-08-10,2016-04-01,"Private, ltd by shares"88,1360562,"CROWN SILVER HOLDINGS LIMITED
嘉銀集團有限公司",2009-08-10,,"Private, ltd by shares"89,1360536,"CROWN YOUNG LIMITED",2009-08-10,2017-06-16,"Private, ltd by shares"90,1360705,"D-STAR INTERNATIONAL TRADE CO., LIMITED
帝王星國際貿易有限公司",2009-08-10,2018-05-04,"Private, ltd by shares"91,1360375,"DALIAN TRANSCEND TECHNOLOGIES CO., LIMITED",2009-08-10,2017-02-03,"Private, ltd by shares"92,1360680,"DELTE INTERNATIONAL TRADING (HONGKONG) LIMITED
欣榕國際貿易(香港)有限公司",2009-08-10,,"Private, ltd by shares"93,1360376,"DIHUAN INTERNATIONAL HOLDING GROUP LIMITED
地環國際控股集團有限公司",2009-08-10,,"Private, ltd by shares"94,1360534,"DISTRIBUTION NETWORK ACCESSORIES LIMITED",2009-08-10,2014-04-04,"Private, ltd by shares"95,1360366,"DITEX TRADING COMPANY LIMITED
迪泰貿易有限公司",2009-08-10,2018-06-01,"Private, ltd by shares"96,1360889,"DOINGEX DRAGON IMPORT AND EXPORT TRADING COMPANY LIMITED
東翼龍祥進出口貿易有限公司",2009-08-10,2013-11-08,"Private, ltd by shares"97,1360574,"DRAGON LABELS (HONGKONG) CO., LIMITED
澤龍標簽(香港)有限公司",2009-08-10,2020-06-05,"Private, ltd by shares"98,1360825,"DRAGONFLY INVESTMENT MANAGEMENT CO., LIMITED
飛龍投資管理有限公司",2009-08-10,,"Private, ltd by shares"99,1360885,"DUBAI STAR TRADE LIMITED
迪拜星光貿易有限公司",2009-08-10,2014-12-12,"Private, ltd by shares"100,1360610,"E CAPITAL LIMITED (d2015-04-17)
伊貝有限公司",2009-08-10,2015-04-17,"Private, ltd by shares"101,1360709,"EAST APEX (HK) LIMITED
東晟集團(香港)有限公司",2009-08-10,2019-11-29,"Private, ltd by shares"102,1360855,"EASTRON INDUSTRY (H.K) COMPANY LIMITED
意川實業(香港)有限公司",2009-08-10,2019-01-11,"Private, ltd by shares"103,1360674,"EASTWOOD NEW MATERIALS (HK) CO., LIMITED (d2017-02-24)
東林新材料(香港)有限公司",2009-08-10,2017-02-24,"Private, ltd by shares"104,1360339,"EASY BUILDING SERVICES COMPANY LIMITED
易達(大廈服務)有限公司",2009-08-10,2011-06-30,"Private, ltd by shares"105,1360761,"Eco Consol Energy Management Corporation Limited
中天環保節能有限公司",2009-08-10,2014-01-03,"Private, ltd by shares"106,1360733,"ELEGANT BRIGHT ENGINEERING LIMITED
欣輝建築工程有限公司",2009-08-10,2018-03-29,"Private, ltd by shares"107,1360352,"ELEMENT SOLUTIONS LIMITED (d2013-11-08)",2009-08-10,2013-11-08,"Private, ltd by shares"108,1360907,"Elim Water Treatment Limited
以琳水質處理有限公司",2009-08-10,2013-11-08,"Private, ltd by shares"109,1360635,"ELLANA Trading Limited",2009-08-10,2020-05-15,"Private, ltd by shares"110,1360735,"ENOCH HEALTH MONGKOK STATION LIMITED
以諾健康旺角站有限公司",2009-08-10,2020-05-15,"Private, ltd by shares"111,1360559,"ENRICH SOLAR CO., LIMITED",2009-08-10,2020-06-05,"Private, ltd by shares"112,1360727,"EPA Holdings Limited (HK)",2009-08-10,,"Private, ltd by shares"113,1360343,"ERAMELA CONSULTANT LIMITED
恩顧問有限公司",2009-08-10,,"Private, ltd by shares"114,1360416,"ETERNAL ELECTRONICS (HK) LIMITED
恒諾電子有限公司",2009-08-10,2011-10-07,"Private, ltd by shares"115,1360836,"EVER MORAL HOLDINGS LIMITED
永賢控股有限公司",2009-08-10,,"Private, ltd by shares"116,1360845,"EVERGREEN FINANCIAL &amp; DEVELOPMENT CO., LIMITED
冬青金融發展有限公司",2009-08-10,,"Private, ltd by shares"117,1360378,"EVERGREEN FURNITURE INDUSTRIAL LIMITED
長青傢具實業有限公司",2009-08-10,2018-01-19,"Private, ltd by shares"118,1360435,"EXPLOTER INTERNATIONAL ELECTRONICS LIMITED
華林(國際)電子有限公司",2009-08-10,,"Private, ltd by shares"119,1360900,"FABULOUS EDUCATION COMPANY LIMITED
至善教育有限公司",2009-08-10,,"Private, ltd by shares"120,1360703,"Fairchild Capital Management Limited
新時代資產管理有限公司",2009-08-10,,"Private, ltd by shares"121,1360615,"FIBERSHOW COMMUNICATION CO., LIMITED
駿進科技有限公司",2009-08-10,2017-10-13,"Private, ltd by shares"122,1360549,"Fibrefab (Hong Kong) Limited",2009-08-10,,"Private, ltd by shares"123,1360447,"FINANCIAL EXPRESS TRADING LIMITED
豐越貿易有限公司",2009-08-10,2012-05-18,"Private, ltd by shares"124,1360346,"Finstrat Consulting Limited",2009-08-10,,"Private, ltd by shares"125,1360862,"FIVE ELEMENTS INTERNATIONAL DEVELOPMENT (HONG KONG) LIMITED
五行國際開發(香港)有限公司",2009-08-10,2011-03-18,"Private, ltd by shares"126,1360768,"FLYFISH WORLD LIMITED",2009-08-10,,"Private, ltd by shares"127,1360406,"Flying-Phoenix Architects &amp; Consulting Limited
飛凰設計諮詢(香港)有限公司",2009-08-10,,"Private, ltd by shares"128,1360360,"FOCUS GREATER CHINA LIMITED
福吉仕大中華有限公司",2009-08-10,,"Private, ltd by shares"129,1360707,"Fook Wing Tong Jade &amp; Treasure Limited
福榮堂翡翠珍寶有限公司",2009-08-10,,"Private, ltd by shares"130,1360717,"FOREVER GOOD INTERNATIONAL DEVELOPMENT LIMITED",2009-08-10,2010-10-22,"Private, ltd by shares"131,1360670,"FORICH INTERNATIONAL INDUSTRY CO., LIMITED
福瑞國際實業有限公司",2009-08-10,2015-04-24,"Private, ltd by shares"132,1360408,"FORTUNA IMPORT&amp;EXPORT CO., LIMITED
福那進出口有限公司",2009-08-10,2017-03-31,"Private, ltd by shares"133,1360456,"FORTUNE PROVIDER HONG KONG LIMITED
庫達香港有限公司",2009-08-10,,"Private, ltd by shares"134,1360776,"FORTUNE TECH SYSTEM LIMITED
潤欣系統有限公司",2009-08-10,,"Private, ltd by shares"135,1360565,"FORWARD RISE HOLDINGS LIMITED
進昇集團有限公司",2009-08-10,2015-07-17,"Private, ltd by shares"136,1360573,"FOSHAN CHEMISTRY IMPORT AND EXPORT CO., LIMITED
佛山市化工進出口有限公司",2009-08-10,,"Private, ltd by shares"137,1360583,"FRANCE DIWEINASI INT'L FASHION LIMITED
法國諦威娜斯國際服裝有限公司",2009-08-10,2018-04-13,"Private, ltd by shares"138,1360529,"FRANCE DOPENT FASHION HOLDING LIMITED
法國都彭服飾控股有限公司",2009-08-10,,"Private, ltd by shares"139,1360834,"FRANCE ENO SANLUIS HOLDING GROUP LIMITED
法國伊諾聖路控股集團有限公司",2009-08-10,2020-06-05,"Private, ltd by shares"140,1360531,"FRANCE KELAIFENGDAN INT'L (HONGKONG) LIMITED
法國柯萊楓丹國際(香港)有限公司",2009-08-10,,"Private, ltd by shares"141,1360575,"FRANCE MDFH INTERNATIONAL LIMITED
法國曼蒂菲赫國際有限公司",2009-08-10,2014-12-19,"Private, ltd by shares"142,1360664,"FRANCHISE TRADING CO., LIMITED
香港卓勳貿易有限公司",2009-08-10,,"Private, ltd by shares"143,1360373,"FTW CORPORATION LIMITED
浩方集團有限公司",2009-08-10,,"Private, ltd by shares"144,1360611,"FUJIAN JINJIANG FUZULI SHOES INDUSTRY LIMITED
福建晉江富足利鞋業有限公司",2009-08-10,2013-11-08,"Private, ltd by shares"145,1360649,"FULL POWER LOGISTICS LIMITED
虎力國際海空運輸有限公司",2009-08-10,,"Private, ltd by shares"146,1360563,"FULLY WELL SERVICES LIMITED
富威服務有限公司",2009-08-10,2010-12-03,"Private, ltd by shares"147,1360501,"FUTONG RS FIBER&amp;CABLE COMMUNICATION CO., LIMITED
富踴通訊技術股份有限公司",2009-08-10,,"Private, ltd by shares"148,1360678,"Future Electronic Technologies Limited",2009-08-10,2016-07-15,"Private, ltd by shares"149,1360383,"FX Master Alliance Limited",2009-08-10,2013-11-08,"Private, ltd by shares"150,1360653,"G-STAR GROUP LIMITED
基星國際集團有限公司",2009-08-10,2013-11-08,"Private, ltd by shares"151,1360696,"GBS INTERNATIONAL BUSINESS LIMITED
駿港商務有限公司",2009-08-10,,"Private, ltd by shares"152,1360874,"GEERI GLASS INDUSTRIAL CO., LIMITED",2009-08-10,2018-01-12,"Private, ltd by shares"153,1360639,"GEESUN TECHNOLOGY GROUP LIMITED
智信科技集團有限公司",2009-08-10,2017-03-31,"Private, ltd by shares"154,1360518,"GERMANY BOLONG.BENCHI (CHINA) FASHION LIMITED
德國柏龍．奔馳(中國)服飾有限公司",2009-08-10,2013-11-08,"Private, ltd by shares"155,1360835,"GERMANY KEBOTE ELECTRICAL GROUP LIMITED
德國克博特機電集團有限公司",2009-08-10,2013-11-08,"Private, ltd by shares"156,1360821,"GERMANY OULITE GROUP LIMITED
德國歐利特集團有限公司",2009-08-10,2017-03-31,"Private, ltd by shares"157,1360757,"GIANTER TECHNOLOGY LIMITED
傑泰科技有限公司",2009-08-10,2020-06-05,"Private, ltd by shares"158,1360511,"GIO-HEIMSOTH GROUP (H.K.) LIMITED
德國鉅久．漢索夫集團(香港)有限公司",2009-08-10,2013-11-08,"Private, ltd by shares"159,1360846,"GLAMOUR SALES CHINA LIMITED
魅惠所中國有限公司",2009-08-10,,"Private, ltd by shares"160,1360641,"Global Demographics Limited",2009-08-10,2013-11-29,"Private, ltd by shares"161,1360396,"GLOBAL DISCOUNT STORE LIMITED (HK)
環球折扣店有限公司",2009-08-10,,"Private, ltd by shares"162,1360400,"GLOBAL DUTY FREE (CHINA) LIMITED
環球免稅店(中國)有限公司",2009-08-10,,"Private, ltd by shares"163,1360483,"GLOBAL THINK LIMITED",2009-08-10,2014-02-07,"Private, ltd by shares"164,1360686,"GO2SERVE FOUNDATION LIMITED
善奉行基金會有限公司",2009-08-10,,"Ltd by guarantee"165,1360798,"GOLD BUTLER INVESTMENT ADVISORY CO., LIMITED
金管家投資顧問有限公司",2009-08-10,2017-03-31,"Private, ltd by shares"166,1360779,"GOLD MEDAL (CHINA) LIMITED (d2013-11-08)
金牌集團(中國)有限公司",2009-08-10,2013-11-08,"Private, ltd by shares"167,1360538,"GOLDEN APPLES LIMITED
金蘋果有限公司",2009-08-10,,"Private, ltd by shares"168,1360558,"GOLDEN CROWN INDUSTRIAL LIMITED
金冠工業有限公司",2009-08-10,,"Private, ltd by shares"169,1360418,"GOLDMASS ENTERPRISES LIMITED
金貿企業有限公司",2009-08-10,,"Private, ltd by shares"170,1360722,"GOLDTEAM DESIGN LIMITED
灝天產品策劃有限公司",2009-08-10,2012-08-03,"Private, ltd by shares"171,1360747,"GOLF GEAR (HK) LIMITED",2009-08-10,2015-04-02,"Private, ltd by shares"172,1360638,"GOODVIEW MANAGEMENT LIMITED (HK)
豪景管理有限公司",2009-08-10,,"Private, ltd by shares"173,1360902,"GRAND CHEMICAL CO., LIMITED",2009-08-10,,"Private, ltd by shares"174,1360567,"GRAND MARK INTERNATIONAL INVESTMENT LIMITED (d2016-04-08)
泓遠國際投資有限公司",2009-08-10,2016-04-08,"Private, ltd by shares"175,1360419,"GRANDE FUND LIMITED",2009-08-10,,"Private, ltd by shares"176,1360497,"GRANDPLUS CO., LIMITED
優佳企業有限公司",2009-08-10,2013-12-20,"Private, ltd by shares"177,1360688,"GRAPE N VINE LIMITED
葡萄藤有限公司",2009-08-10,2017-12-22,"Private, ltd by shares"178,1360716,"Great East Bottles &amp; Drinks Holdings, Limited
偉東飲料包裝製品控股有限公司",2009-08-10,2013-04-12,"Private, ltd by shares"179,1360594,"GREAT LORD INTERNATIONAL LIMITED
安盟國際有限公司",2009-08-10,2012-03-16,"Private, ltd by shares"180,1360904,"GREAT NATION HOLDINGS LIMITED (d2013-11-08)
國立集團有限公司",2009-08-10,2013-11-08,"Private, ltd by shares"181,1360413,"GREAT SAIL LIMITED
澤航有限公司",2009-08-10,,"Private, ltd by shares"182,1360572,"GUANGDONG AVC TECHNOLOGY CO., LIMITED
廣東先導視訊科技有限公司",2009-08-10,2017-01-27,"Private, ltd by shares"183,1360851,"GUANGDONG FOSHAN JINGCHENG CERAMICS TECHNOLOGY CO., LIMITED
廣東佛山京城陶瓷科技有限公司",2009-08-10,,"Private, ltd by shares"184,1360849,"GUANGDONG FOSHAN TANGYUN CONSTRUCTION CERAMICS LIMITED
廣東佛山唐韻建築陶瓷有限公司",2009-08-10,2017-03-31,"Private, ltd by shares"185,1360860,"GUANGDONG KANGMEIWANG FURNITURE LIMITED
廣東康美王家俬有限公司",2009-08-10,2014-12-12,"Private, ltd by shares"186,1360509,"H.C.MEY (DENMARK) INTERNATIONAL GROUP LIMITED
美依(丹麥)國際集團有限公司",2009-08-10,2015-07-17,"Private, ltd by shares"187,1360520,"HABILE CASTLE LIMITED
堡裕有限公司",2009-08-10,,"Private, ltd by shares"188,1360543,"HAN BIN ENTERPRISE COMPANY LIMITED
瀚彬企業有限公司",2009-08-10,2012-11-23,"Private, ltd by shares"189,1360361,"HANGZHOU OCEAN CHEMICAL CO., LIMITED
杭州四海化工有限公司",2009-08-10,,"Private, ltd by shares"190,1360903,"Hao Xin Trading Limited
昊鑫貿易有限公司",2009-08-10,,"Private, ltd by shares"191,1360423,"HAPPYTONE LIMITED (b2009-08-10)",2009-08-10,,"Private, ltd by shares"192,1360852,"HEALTH SERVICES GLOBAL COMPANY LIMITED
康柏健業顧問有限公司",2009-08-10,2013-11-29,"Private, ltd by shares"193,1360368,"HEFEI INTERCHINA INDUSTRY GROUP CO., LIMITED
合肥英華實業集團有限公司",2009-08-10,,"Private, ltd by shares"194,1360591,"HELMRO TECHNOLOGY LIMITED
亨瑞科技有限公司",2009-08-10,2011-01-28,"Private, ltd by shares"195,1360631,"HEYFORD INVESTMENTS LIMITED
喜福國際有限公司",2009-08-10,2010-11-05,"Private, ltd by shares"196,1360774,"HEZHONG TECHNOLOGY (HK) CO., LIMITED (d2014-06-27)
合眾科技(香港)有限公司",2009-08-10,2014-06-27,"Private, ltd by shares"197,1360719,"HK AKS XH ELECTRICAL ENERGY DEVELOPMENT LIMITED
香港阿克蘇興華電業能源開發有限公司",2009-08-10,,"Private, ltd by shares"198,1360672,"HK BENEVOLENT GROUP LIMITED
香港仁慈集團有限公司",2009-08-10,2016-01-22,"Private, ltd by shares"199,1360450,"HK COURT INT'L INVESTMENT GROUP LIMITED
香港宮廷國際投資集團有限公司",2009-08-10,2013-11-08,"Private, ltd by shares"200,1360607,"HK E-PARK INDUSTRY LIMITED
香港一帕克實業有限公司",2009-08-10,2015-07-17,"Private, ltd by shares"201,1360514,"HK ENDEAVOUR INDUSTRY LIMITED
香港奮進實業有限公司",2009-08-10,,"Private, ltd by shares"202,1360858,"HK GOLD PHOENIX (INT'L) LIMITED
香港金鳳凰(國際)有限公司",2009-08-10,2014-12-12,"Private, ltd by shares"203,1360817,"HK GUTI INTERNATIONAL HOLDING CO., LIMITED
香港古提國際控股有限公司",2009-08-10,,"Private, ltd by shares"204,1360627,"HK HIGMEER BRAND R&amp;D INSTITUTION LIMITED
香港海格梅納品牌研發機構有限公司",2009-08-10,,"Private, ltd by shares"205,1360550,"HK JIAYIN (INT'L) DRESS LIMITED
香港伽茵(國際)服飾有限公司",2009-08-10,2017-03-31,"Private, ltd by shares"206,1360438,"HK JSJ TECHNOLOGY CO., LIMITED
香港佳視捷科技有限公司",2009-08-10,2014-04-17,"Private, ltd by shares"207,1360875,"HK JUNSHI LOCK INDUSTRY LIMITED
香港駿士鎖業有限公司",2009-08-10,2013-11-08,"Private, ltd by shares"208,1360637,"HK LEOPARD SAND FASHION LIMITED
香港金沙豹服飾有限公司",2009-08-10,2013-11-08,"Private, ltd by shares"209,1360537,"HK M &amp; LATITUDE ELECTRON TECHNOLOGY LIMITED
香港茗緯電子科技有限公司",2009-08-10,,"Private, ltd by shares"210,1360744,"HK PEOPLE JOY INT'L INVESTMENT GROUP HOLDING LIMITED
香港大家樂國際投資集團控股有限公司",2009-08-10,2013-11-08,"Private, ltd by shares"211,1360633,"HK SPECIAL BLUE WAVE FASHION LIMITED
香港波藍特服飾有限公司",2009-08-10,2013-11-08,"Private, ltd by shares"212,1360708,"HK SRYY GARMENT LIMITED
香港是日服飾有限公司",2009-08-10,2014-12-12,"Private, ltd by shares"213,1360388,"HK SUN INDUSTRIAL COMPANY LIMITED
香港永聖實業有限公司",2009-08-10,2017-01-06,"Private, ltd by shares"214,1360612,"HK SUN-DAY BUSINESS LIMITED
香港日天貿易有限公司",2009-08-10,2013-11-29,"Private, ltd by shares"215,1360887,"HK TRAVELLING AROUND OUTDOOR INTERNATIONAL CO., LIMITED
香港天下遊戶外國際有限公司",2009-08-10,2014-12-19,"Private, ltd by shares"216,1360551,"HK TYSD LIMITED
香港天益聖達有限公司",2009-08-10,2017-03-31,"Private, ltd by shares"217,1360800,"HK XINJIE INTERNATIONAL LIMITED
香港鑫捷國際有限公司",2009-08-10,2013-11-08,"Private, ltd by shares"218,1360748,"HK YONGHE FOOD GROUP CO., LIMITED
香港永和豆漿餐飲連鎖集團有限公司",2009-08-10,2013-11-08,"Private, ltd by shares"219,1360739,"HK ZHAO TONG INTERNATIONAL TRADE CO., LIMITED
香港兆通國際貿易有限公司",2009-08-10,2013-11-08,"Private, ltd by shares"