,Reg no.,Name,Incorp-orated,Dissolved,Type438,1360804,"ROVON TECHNOLOGY CO., LIMITED
榮威科技有限公司",2009-08-10,2014-12-12,"Private, ltd by shares"439,1360905,"RUIZHI INTERNATIONAL LIMITED
睿智國際商務諮詢有限公司",2009-08-10,,"Private, ltd by shares"440,1360783,"S &amp; S (SOAR TO STARDOM) LIMITED",2009-08-10,,"Private, ltd by shares"441,1360736,"S &amp; T International Enterprise Limited
兆天國際企業有限公司",2009-08-10,,"Private, ltd by shares"442,1360337,"S&amp;A RESOURCES (HONGKONG) LIMITED
史蒂安妮物產(香港)有限公司",2009-08-10,2020-07-17,"Private, ltd by shares"443,1360695,"SA JEWELLERY INTERNATIONAL GROUP LIMITED
奢愛珠寶國際集團有限公司",2009-08-10,2012-04-13,"Private, ltd by shares"444,1360475,"SAIKELONG COMPANY LIMITED
賽可龍有限公司",2009-08-10,2010-12-24,"Private, ltd by shares"445,1360387,"SAINT GLOBAL (HK) LIMITED",2009-08-10,2019-10-04,"Private, ltd by shares"446,1360721,"SAINT KI NA INT'L LIMITED
聖琪娜國際有限公司",2009-08-10,2011-01-28,"Private, ltd by shares"447,1360729,"SAMYOUNG INTERNATIONAL HOLDING LIMITED
森洋國際控股有限公司",2009-08-10,2016-10-21,"Private, ltd by shares"448,1360880,"SENO LIGHT (HK) LIMITED
森諾照明(香港)有限公司",2009-08-10,,"Private, ltd by shares"449,1360669,"SENSEWELL CO., LIMITED
天力盛世有限公司",2009-08-10,2015-07-17,"Private, ltd by shares"450,1360760,"SEVENDAYS-E TECHNOLOGY CO., LIMITED
七日電子科技有限公司",2009-08-10,2012-08-10,"Private, ltd by shares"451,1360532,"SEVENSTAR TRADING LIMITED
香港七星國際貿易有限公司",2009-08-10,,"Private, ltd by shares"452,1360848,"SHANGHAI JINDUN AUTO PARTS CO., LIMITED
上海金盾汽配有限公司",2009-08-10,2020-06-05,"Private, ltd by shares"453,1360605,"SHANGHAI JUN AN PARKSON WOOD GROUP CO., LIMITED
上海君安百盛木業集團有限公司",2009-08-10,2013-11-08,"Private, ltd by shares"454,1360490,"SHANGHAI ORIENTAL MACHINE ELECTRICITY LIMITED
上海東方機電有限公司",2009-08-10,2018-04-06,"Private, ltd by shares"455,1360510,"SHANGHAI PEOPLE ELECTRICAL WATER-PUMP LIMITED
上海人民電氣水泵有限公司",2009-08-10,2017-03-31,"Private, ltd by shares"456,1360469,"SHANGHAI PEOPLE INDUSTRY TRADE PUMP INDUSTRY LIMITED
上海人民工貿泵業有限公司",2009-08-10,2020-06-05,"Private, ltd by shares"457,1360474,"SHANGHAI PEOPLE WATER-PUMP ENTERPRISE LIMITED
上海人民水泵企業有限公司",2009-08-10,,"Private, ltd by shares"458,1360770,"Shanghai Skyland International Co. Limited
上海斯凱蘭德國際貿易有限公司",2009-08-10,2018-09-07,"Private, ltd by shares"459,1360485,"SHANGHAI WEILE MACHINE ELECTRICITY PUMP INDUSTRY LIMITED
上海威樂機電泵業有限公司",2009-08-10,2018-04-13,"Private, ltd by shares"460,1360656,"SHANGHAI X &amp; K MEI NENG DA (HK) GROUP LIMITED
上海喜科美能達(香港)集團有限公司",2009-08-10,2014-12-12,"Private, ltd by shares"461,1360547,"SHEN INTERNATIONAL LIMITED
升盛國際貿易有限公司",2009-08-10,2013-11-08,"Private, ltd by shares"462,1360467,"SHEN ZHEN YOU BANG FURNITURE INDUSTRY LIMITED
深圳友邦家具實業有限公司",2009-08-10,2014-12-12,"Private, ltd by shares"463,1360415,"SHENIX INDUSTRY LIMITED
深尼斯實業有限公司",2009-08-10,2018-01-19,"Private, ltd by shares"464,1360811,"SHENZHEN MUDANYUAN FURNITURE LIMITED
深圳牡丹緣家具有限公司",2009-08-10,2014-12-12,"Private, ltd by shares"465,1360701,"ShenZhen Sowin Sourcing Co., Limited
深圳索盈有限公司",2009-08-10,,"Private, ltd by shares"466,1360837,"SHIPPING JAZZ SHENZHEN FINERY LIMITED
船王爵士(深圳)服飾有限公司",2009-08-10,2014-12-12,"Private, ltd by shares"467,1360742,"SHUYE INTERNATIONAL CO., LIMITED
樹業國際股份有限公司",2009-08-10,,"Private, ltd by shares"468,1360468,"SIDEREAL INTERNATIONAL LIMITED
悉龍國際有限公司",2009-08-10,,"Private, ltd by shares"469,1360681,"SINO (HK) BUSINESS TRADING LIMITED
欣力隆香港有限公司",2009-08-10,,"Private, ltd by shares"470,1360863,"SINO HK LINK INT'L LIMITED
通港連城國際有限公司",2009-08-10,2014-12-12,"Private, ltd by shares"471,1360704,"SINOHORSE GROUP LIMITED
仲馬集團有限公司",2009-08-10,2018-01-05,"Private, ltd by shares"472,1360540,"SIU LUN ENTERPRISE LIMITED
兆麟企業有限公司",2009-08-10,,"Private, ltd by shares"473,1360864,"SKIN LASER CLINIC LIMITED
皮膚激光診所有限公司",2009-08-10,,"Private, ltd by shares"474,1360552,"SKY ELEGANT INDUSTRIAL HOLDING LIMITED
天麗實業控股有限公司",2009-08-10,2012-01-20,"Private, ltd by shares"475,1360535,"SKY WELL AGENCY PROPERTY LIMITED
天祥地產有限公司",2009-08-10,,"Private, ltd by shares"476,1360364,"SKYP Investment Limited",2009-08-10,,"Private, ltd by shares"477,1360599,"SLF BLASTING AND PAINTING TECHNOLOGY LIMITED",2009-08-10,,"Private, ltd by shares"478,1360420,"SnowRock Group Limited
雪石集團(香港)控股有限公司",2009-08-10,,"Private, ltd by shares"479,1360654,"SOK RAIN ELECTRONICS TECHNOLOGY CO., LIMITED
索雨電子科技有限公司",2009-08-10,2016-04-08,"Private, ltd by shares"480,1360434,"SOLARIZE ENTERPRISES LIMITED
日澄企業有限公司",2009-08-10,,"Private, ltd by shares"481,1360429,"SOURCE TECH LIMITED
粵湛有限公司",2009-08-10,,"Private, ltd by shares"482,1360512,"SOUTHWAY HOLDINGS LIMITED (d2013-08-23)
大南集團有限公司",2009-08-10,2013-08-23,"Private, ltd by shares"483,1360692,"SPP ENVIRONMENTAL TECHNOLOGY (HONG KONG) LIMITED
古瑞環境科技有限公司",2009-08-10,2017-09-29,"Private, ltd by shares"484,1360764,"SPRING POINT TRADING LIMITED
泉眼貿易有限公司",2009-08-10,2011-01-28,"Private, ltd by shares"485,1360818,"Steelco China Limited",2009-08-10,2019-03-01,"Private, ltd by shares"486,1360753,"Stern Consulting Limited (d2016-07-15)
博學企業顧問有限公司",2009-08-10,2016-07-15,"Private, ltd by shares"487,1360580,"STYLEONME GLOBAL COMPANY LIMITED
昂美國際貿易有限公司",2009-08-10,2014-01-24,"Private, ltd by shares"488,1360542,"SUCCESS SINO CORPORATION LIMITED (d2013-11-08)
登華有限公司",2009-08-10,2013-11-08,"Private, ltd by shares"489,1360593,"SUN &amp; F INTERNATIONAL LIMITED",2009-08-10,2020-05-15,"Private, ltd by shares"490,1360782,"SUPER WINDOW PROJECT LIMITED",2009-08-10,2016-04-08,"Private, ltd by shares"491,1360660,"SUPERCOLOR TECHNOLOGY LIMITED
色普卡樂科技有限公司",2009-08-10,,"Private, ltd by shares"492,1360451,"SWELL ENGINEERING COMPANY LIMITED
星滙工程有限公司",2009-08-10,,"Private, ltd by shares"493,1360677,"TAIRAN DEVELOPMENT INTERNATIONAL INVESTMENT MANAGEMENT LIMITED
泰然發展(國際)投資管理有限公司",2009-08-10,2013-11-08,"Private, ltd by shares"494,1360780,"TAISEA Capital Limited
太石資產管理有限公司",2009-08-10,,"Private, ltd by shares"495,1360640,"TAISI TECHNOLOGY (HK) COMPANY LIMITED
泰斯科技(香港)有限公司",2009-08-10,,"Private, ltd by shares"496,1360894,"TAIWAN DINGSHENG ELECTROMACHINERY INTERNATIONAL LIMITED
台灣鼎盛機電國際有限公司",2009-08-10,2015-06-26,"Ltd by guarantee"497,1360515,"TAIWAN DUOERDUOYA HOLDING LIMITED
台灣多爾多雅股份有限公司",2009-08-10,2013-11-08,"Private, ltd by shares"498,1360382,"TAIWAN QUANYI STAINLESS STEEL WATER TOWER MANUFACTURE GROUP LIMITED
臺灣全一不銹鋼水塔製造集團有限公司",2009-08-10,2018-04-06,"Private, ltd by shares"499,1360844,"TANYUN (CHINA) LIMITED
天元(中國)有限公司",2009-08-10,,"Private, ltd by shares"500,1360743,"TECHNIQUE ENGINEERING SERVICE LIMITED
德雷工程維修有限公司",2009-08-10,,"Private, ltd by shares"501,1360480,"TEKRACER ELECTRONIC LIMITED
得利電子有限公司",2009-08-10,,"Private, ltd by shares"502,1360452,"TELINK INTERNATIONAL TRADING LIMITED
聯訊國際貿易有限公司",2009-08-10,2011-07-22,"Private, ltd by shares"503,1360643,"Tethys Marine Laboratories Limited
中天水產科技研發有限公司",2009-08-10,2019-09-06,"Private, ltd by shares"504,1360579,"Thalia Technology Limited (d2011-04-15)",2009-08-10,2011-04-15,"Private, ltd by shares"505,1360350,"TIANJIN JW INTERNATIONAL TRADING COMPANY LIMITED
天津津偉國際貿易有限公司",2009-08-10,2020-06-19,"Private, ltd by shares"506,1360626,"Tianson Investment Limited
天舜投資有限公司",2009-08-10,2014-12-19,"Private, ltd by shares"507,1360370,"TONG HUI INTERNATIONAL TRADE LIMITED
同輝國際貿易有限公司",2009-08-10,2020-06-05,"Private, ltd by shares"508,1360658,"TOP COLOR (HONG KONG) IMAGE PRODUCTS CO., LIMITED
天硌打印耗材(香港)有限公司",2009-08-10,,"Private, ltd by shares"509,1360895,"TOP LEADING GLOBAL LOGISTICS CO., LIMITED
領譽環球物流有限公司",2009-08-10,2013-11-08,"Private, ltd by shares"510,1360694,"TRANSNOVA PROCESS UNIT (HONGKONG) CO., LIMITED
新遷躍程控設備(香港)有限公司",2009-08-10,,"Private, ltd by shares"511,1360546,"Treasure Food International Limited
寶食街國際食品有限公司",2009-08-10,,"Private, ltd by shares"512,1360354,"TRIDENT INTERNATIONAL CONSULTANTS LIMITED",2009-08-10,2013-11-08,"Private, ltd by shares"513,1360526,"TRUONLY ELECTRONICS (HK) LIMITED
同創利電子(香港)有限公司",2009-08-10,2012-04-13,"Private, ltd by shares"514,1360618,"TSE Holdings (Hong Kong) Limited",2009-08-10,2016-03-24,"Private, ltd by shares"515,1360857,"TSZ CHOR CO LIMITED
子楚有限公司",2009-08-10,,"Private, ltd by shares"516,1360839,"TSZ KIU CO LIMITED
子翹有限公司",2009-08-10,,"Private, ltd by shares"517,1360687,"TURBO SCS LIMITED
德寶供應鏈有限公司",2009-08-10,,"Private, ltd by shares"518,1360570,"TWISTCO DESIGN WORKSHOP LIMITED
卓皓設計有限公司",2009-08-10,,"Private, ltd by shares"519,1360502,"U.S.A JIADX PETROCHEMICAL GROUP HOLDINGS LIMITED
美國加德士石化集團控股有限公司",2009-08-10,2014-12-19,"Private, ltd by shares"520,1360759,"UK RUNJIA GROUP (HONGKONG) TRADING LIMITED
英國潤佳集團(香港)貿易有限公司",2009-08-10,2020-06-05,"Private, ltd by shares"521,1360699,"UMON JEWELLERY INTERNATIONAL (HK) COMPANY, LIMITED
香港玉明龍國際珠寶有限公司",2009-08-10,2016-01-08,"Private, ltd by shares"522,1360581,"UNION BRIGHT CREATION LIMITED
聯熙創建有限公司",2009-08-10,2018-04-13,"Private, ltd by shares"523,1360624,"UNION GREAT INVESTMENTS LIMITED
協宏投資有限公司",2009-08-10,2012-12-21,"Private, ltd by shares"524,1360325,"UNITED EGYPT SAUDIA CO., LIMITED
埃及沙特聯合有限公司",2009-08-10,2014-12-12,"Private, ltd by shares"525,1360600,"UNITED STERLING (PROPERTIES) LIMITED",2009-08-10,,"Private, ltd by shares"526,1360663,"UNIVERSAL AVIATION INDUSTRIAL LIMITED
環宇航空工業有限公司",2009-08-10,2015-07-17,"Private, ltd by shares"527,1360634,"USA CARLLESY GROUP HOLDING LIMITED
美國卡爾雷思集團控股有限公司",2009-08-10,2016-04-29,"Private, ltd by shares"528,1360662,"USA DIRKK (INVEST) LIMITED
美國迪克(投資)有限公司",2009-08-10,2017-03-31,"Private, ltd by shares"529,1360820,"USA PLAYBOY INTERNATIONAL KNITTING LIMITED
美國花花公子國際針織有限公司",2009-08-10,2013-11-08,"Private, ltd by shares"530,1360803,"USA WEIDISI INT'L CHEMICAL LIMITED
美國威迪斯國際化工有限公司",2009-08-10,2013-11-08,"Private, ltd by shares"531,1360685,"USCL LOGISTICS LIMITED
聯迅捷運物流有限公司",2009-08-10,,"Private, ltd by shares"532,1360462,"VAST LINK LIMITED",2009-08-10,,"Private, ltd by shares"533,1360883,"VERTEX CHINA CAPITAL LIMITED",2009-08-10,2020-07-10,"Private, ltd by shares"534,1360794,"VIA VINIS LIMITED",2009-08-10,2014-12-12,"Private, ltd by shares"535,1360808,"VICTORY ORIENTAL INTERNATIONAL LIMITED
冠安國際有限公司",2009-08-10,2014-12-12,"Private, ltd by shares"536,1360683,"VINTAGE INTERNATIONAL EXHIBITION SERVICE (HK) CO., LIMITED
尚維國際展覽服務(香港)有限公司",2009-08-10,,"Private, ltd by shares"537,1360697,"VITAL VOYAGE GROUP LIMITED
力航集團有限公司",2009-08-10,2015-01-30,"Private, ltd by shares"538,1360590,"VITECH ELECTRIC CO., LIMITED",2009-08-10,2014-12-12,"Private, ltd by shares"539,1360603,"WAI POWER AGENCY DEVELOPMENT LIMITED
偉力代理發展有限公司",2009-08-10,2014-01-17,"Private, ltd by shares"540,1360504,"WANSHICHUN GROUP CO., LIMITED
萬世春集團有限公司",2009-08-10,,"Private, ltd by shares"541,1360762,"WANSHING (ASIA) INDUSTRY CO., LIMITED
宏盛(亞洲)實業有限公司",2009-08-10,2014-12-12,"Private, ltd by shares"542,1360458,"WATCHOW WATCH &amp; JEWELLERY COMPANY LIMITED
錶緻鐘錶珠寶有限公司",2009-08-10,,"Private, ltd by shares"543,1360385,"WATERFRONT HOLDINGS LIMITED",2009-08-10,2020-05-15,"Private, ltd by shares"544,1360775,"WAVESPORTS LIMITED
香港滙發有限公司",2009-08-10,2019-07-19,"Private, ltd by shares"545,1360843,"WEALTH SPRING LIMITED",2009-08-10,,"Private, ltd by shares"546,1360478,"WEALTH TRACE LIMITED",2009-08-10,2012-11-30,"Private, ltd by shares"547,1360533,"WEIDA GROUP CO., LIMITED
偉達集團股份有限公司",2009-08-10,2020-05-29,"Private, ltd by shares"548,1360334,"WEIFANG ZHONGLING CHEMICAL CO., LIMITED
濰坊中領化工有限公司",2009-08-10,2013-11-08,"Private, ltd by shares"549,1360901,"WELL FURNIR COMPANY LIMITED
銘家實業有限公司",2009-08-10,2016-04-08,"Private, ltd by shares"550,1360473,"WELL GLOBAL INVESTMENTS (HK) LIMITED",2009-08-10,2014-02-21,"Private, ltd by shares"551,1360380,"Wellmarked (China) Co., Limited
維客(中國)有限公司",2009-08-10,2016-04-01,"Private, ltd by shares"552,1360884,"WENZHOU FOCUS EYEWEAR CO., LIMITED
溫州焦點光學有限公司",2009-08-10,2020-06-05,"Private, ltd by shares"553,1360516,"Western Venture Investment Co., Limited
西部創業投資股份有限公司",2009-08-10,2013-11-08,"Private, ltd by shares"554,1360752,"WINFORD TRANSPORTATION HONG KONG LIMITED",2009-08-10,,"Private, ltd by shares"555,1360522,"WINNER HOUSE HOLDINGS LIMITED
凱軒集團有限公司",2009-08-10,,"Private, ltd by shares"556,1360657,"WINWAY AUTO ACCESSORIES CO., LIMITED
銳威汽車用品有限公司",2009-08-10,,"Private, ltd by shares"557,1360482,"WONDER RIVER LIMITED",2009-08-10,,"Private, ltd by shares"558,1360589,"WORLD CDM INTERNATIONAL TRADING LIMITED
世紀創聯國際貿易有限公司",2009-08-10,2020-06-05,"Private, ltd by shares"559,1360432,"WORLD ENVIRONMENTAL FOUNDATION CO., LIMITED
世界環保基金會有限公司",2009-08-10,2020-06-05,"Private, ltd by shares"560,1360745,"WORLD NATIONAL MUSIC ARTS MEDIA LIMITED
世界民族音樂藝術傳媒有限公司",2009-08-10,2015-07-17,"Private, ltd by shares"561,1360810,"WORLDSOURCES TECHNOLOGY COMPANY LIMITED
世界資源科技有限公司",2009-08-10,,"Private, ltd by shares"562,1360513,"WUI TON HONG INVESTMENT LIMITED
滙通行投資有限公司",2009-08-10,,"Private, ltd by shares"563,1360544,"WYCK PROSPERITY INVESTMENT COMPANY LIMITED
華盈(卓健)投資有限公司",2009-08-10,2012-08-10,"Private, ltd by shares"564,1360592,"XINXIN (HK) TRADING CO., LIMITED
香港新鑫貿易有限公司",2009-08-10,2013-11-08,"Private, ltd by shares"565,1360517,"YAN SENG TANG (SHEUNG SHUI E-STATION) LIMITED
燕參堂(上水充電站)有限公司",2009-08-10,2013-04-19,"Private, ltd by shares"566,1360646,"YANGZHIDING ELECTRONICS LIMITED
洋之町電子有限公司",2009-08-10,,"Private, ltd by shares"567,1360713,"YARDWAY (CHINA) LIMITED
啟帆(中國)有限公司",2009-08-10,,"Private, ltd by shares"568,1360379,"YIFENG INDUSTRIAL CO., LIMITED (d2017-03-31)
藝豐實業有限公司",2009-08-10,2017-03-31,"Private, ltd by shares"569,1360827,"YIMENG LOCAL PEOPLE WINE LIMITED
沂蒙老鄉酒業有限公司",2009-08-10,2013-11-08,"Private, ltd by shares"570,1360671,"YING LI HK LIMITED
贏利香港有限公司",2009-08-10,2019-12-06,"Private, ltd by shares"571,1360404,"YINGKE INVESTMENT GROUP LIMITED
盈科投資集團有限公司",2009-08-10,,"Private, ltd by shares"572,1360481,"YOFONE ELECTRONIC INDUSTRY CO., LIMITED
譽鋒電子實業有限公司",2009-08-10,2020-06-05,"Private, ltd by shares"573,1360614,"YUDAOTANG CHINESE MEDICINE REGULATE TECHNOLOGY LIMITED
禦道堂中醫藥調理技術有限公司",2009-08-10,2014-12-12,"Private, ltd by shares"574,1360766,"Yude International Trade (HongKong) Co., Limited
裕德國際貿易(香港)有限公司",2009-08-10,2019-01-04,"Private, ltd by shares"575,1360666,"Yueshou Management Service Limited
粵首管理服務有限公司",2009-08-10,2015-04-02,"Private, ltd by shares"576,1360773,"YUNG CHUONG PRINTING &amp; PACKAGING CO., LIMITED
翡翠彩印包裝有限公司",2009-08-10,2018-05-25,"Private, ltd by shares"577,1360833,"ZAIN TRADING CO., LIMITED",2009-08-10,,"Private, ltd by shares"578,1360402,"ZEALOUS LIMITED (HK)
樂愉有限公司",2009-08-10,,"Private, ltd by shares"579,1360630,"ZENIT GLOBAL INVESTMENT HOLDINGS (HK) LIMITED",2009-08-10,,"Private, ltd by shares"580,1360879,"ZHEJIANG HANSON LOGISTICS CO., LIMITED
浙江漢森物流有限公司",2009-08-10,,"Private, ltd by shares"581,1360796,"zhejiang tianmake new energy co., Limited
浙江天馬克新能源有限公司",2009-08-10,2018-01-26,"Private, ltd by shares"582,1360356,"ZHEJIANG YIGE SOCKS CO., LIMITED
浙江依格襪業有限公司",2009-08-10,,"Private, ltd by shares"583,1360728,"ZHI HENG ELECTRONIC NEW TECHNOLOGY LIMITED
智恒電子新技術有限公司",2009-08-10,2013-11-08,"Private, ltd by shares"584,1360553,"ZHONGYING DIGITAL TECHNOLOGY CO., LIMITED
眾盈數碼科技有限公司",2009-08-10,2020-06-05,"Private, ltd by shares"585,1360619,"ZHONGZHI GROUP (HK) INVESTMENT CO., LIMITED
中志集團(香港)投資有限公司",2009-08-10,2015-07-17,"Private, ltd by shares"