,Reg no.,Name,Incorp-orated,Dissolved,Type1,0984550,"28 CREATION LIMITED
易發創作有限公司",2005-07-20,,"Private, ltd by shares"2,0984492,"3DLP TECHNOLOGY CO., LIMITED
亞洲顯示數字系統有限公司",2005-07-20,2010-09-24,"Private, ltd by shares"3,0984508,"A PLUS (HOLDING) LIMITED
極致(集團)有限公司",2005-07-20,2011-03-25,"Private, ltd by shares"4,0984519,"ABI FAR EAST LIMITED",2005-07-20,2006-12-15,"Private, ltd by shares"5,0984399,"ACE ACHIEVE GROUP LIMITED
漢銘集團有限公司",2005-07-20,,"Private, ltd by shares"6,0984477,"ADG COMPANY LIMITED",2005-07-20,2010-05-20,"Private, ltd by shares"7,0984531,"ALC TRAINING LIMITED",2005-07-20,,"Private, ltd by shares"8,0984488,"ALEX DESIGN LIMITED (HK)
雅歷設計有限公司",2005-07-20,,"Private, ltd by shares"9,0984342,"AN-GER TECHNOLOGY (HONG KONG) LIMITED
安捷測試機械國際發展(香港)有限公司",2005-07-20,2010-05-07,"Private, ltd by shares"10,0984369,"APEX DRAGON HOLDINGS LIMITED
昌龍集團有限公司",2005-07-20,,"Private, ltd by shares"11,0984378,"APEX REGAL LIMITED
耀浚有限公司",2005-07-20,2009-12-11,"Private, ltd by shares"12,0984344,"APLUS EDUCATION LIMITED",2005-07-20,2020-10-30,"Private, ltd by shares"13,0984357,"ASTRA INTERNATIONAL LIMITED (d2011-03-18)
亞世塔國際有限公司",2005-07-20,2011-03-18,"Private, ltd by shares"14,0984368,"BILLION GOLDEN INTERNATIONAL LIMITED
金億富國際有限公司",2005-07-20,2010-05-14,"Private, ltd by shares"15,0984444,"BIZNET LEARNING COMPANY LIMITED",2005-07-20,2006-12-29,"Private, ltd by shares"16,0984502,"BLACK BULL INTERNATIONAL INVESTMENTS MANAGEMENT LIMITED
滙杰國際投資管理有限公司",2005-07-20,2011-03-18,"Private, ltd by shares"17,0984552,"BRIDGEWAY HYPERSYSTEMS GROUP LIMITED
博巍高性能計算機集團有限公司",2005-07-20,2019-11-22,"Private, ltd by shares"18,0984416,"BRIGHT SMART LIGHT DECORATION (HK) LIMITED
明俊燈飾(香港)有限公司",2005-07-20,2009-12-11,"Private, ltd by shares"19,0984347,"BRIGHT UNION (ASIA) ENTERPRISES LIMITED
滙昇(亞洲)企業有限公司",2005-07-20,2009-08-07,"Private, ltd by shares"20,0984469,"BRIGHT VALLEY TECHNOLOGY CO., LIMITED
明谷科技有限公司",2005-07-20,2011-07-15,"Private, ltd by shares"21,0984542,"CACTUS BAR &amp; GRILL COMPANY LIMITED (THE)
仙人掌餐廳有限公司",2005-07-20,2018-03-02,"Private, ltd by shares"22,0984385,"CAPITAL WISE INVESTMENTS (H.K.) LIMITED
雄威投資(香港)有限公司",2005-07-20,2009-12-11,"Private, ltd by shares"23,0984316,"CENTURY INDUSTRIAL (ASIA) LIMITED
百年實業(亞洲)有限公司",2005-07-20,,"Private, ltd by shares"24,0984549,"CHALLENGE TIMES &amp; GIFTS LIMITED
天仕時計禮品有限公司",2005-07-20,2007-11-09,"Private, ltd by shares"25,0984425,"CHANGZHU METALWORK INTERNATIONAL LIMITED",2005-07-20,2012-05-04,"Private, ltd by shares"26,0984409,"CHIEF INTERNATIONAL TRANSPORTATION CO., LIMITED
高合(香港)國際有限公司",2005-07-20,2013-10-04,"Private, ltd by shares"27,0984381,"CHINA CORPORATE COACHES ASSOCIATION LIMITED
中國企業教練協會有限公司",2005-07-20,2006-12-29,"Private, ltd by shares"28,0984559,"CHINA DAQI ENTERPRISES LIMITED
中國大崎企業有限公司",2005-07-20,2012-12-21,"Private, ltd by shares"29,0984333,"CHINA GROUP (HUAXIA) GREAETWLL WINE COMPANY LIMITED
中糧集團(華夏)長城葡萄酒業有限公司",2005-07-20,2009-12-11,"Private, ltd by shares"30,0984408,"CHINA HOTEL INVESTMENT (HOLDINGS) GROUP LIMITED
中國酒店投資(控股)集團有限公司",2005-07-20,,"Private, ltd by shares"31,0984516,"CHINA KUNRUN INTERNATIONAL GROUP HOLDINGS LIMITED
中國昆潤(國際集團)控股有限公司",2005-07-20,,"Private, ltd by shares"32,0984384,"CHINA PERFORMING ART COLLEGE LIMITED
中國演藝學院有限公司",2005-07-20,2012-11-09,"Private, ltd by shares"33,0984522,"CHINAPLASTIC (HK) LIMITED
華塑(香港)有限公司",2005-07-20,,"Private, ltd by shares"34,0984312,"CHUN HING 2005 DEVELOPMENT LIMITED
振興2005發展有限公司",2005-07-20,,"Private, ltd by shares"35,0984533,"CIG BOX PRINTING ENTERPRISE (HK) LIMITED
嘉誠實業(香港)有限公司",2005-07-20,2008-10-10,"Private, ltd by shares"36,0984319,"CITY GRAND INTERNATIONAL GROUP LIMITED
西葛國際諮詢有限公司",2005-07-20,2009-12-11,"Private, ltd by shares"37,0984410,"COFA INTELLIGENT SYSTEM GROUP LIMITED
科發智能系統集團有限公司",2005-07-20,2006-12-22,"Private, ltd by shares"38,0984547,"CREATIVE WAVE HOLDINGS LIMITED
啟濤集團有限公司",2005-07-20,,"Private, ltd by shares"39,0984379,"CREST INTERNATIONAL (HONG KONG) LIMITED",2005-07-20,2012-12-07,"Private, ltd by shares"40,0984377,"Da Yang Knitting Factory Limited
大洋針織廠有限公司",2005-07-20,,"Private, ltd by shares"41,0984473,"DAY TOGS LIMITED
宏基製衣有限公司",2005-07-20,2013-01-04,"Private, ltd by shares"42,0984554,"DC PlastiX (HK) Limited",2005-07-20,,"Private, ltd by shares"43,0984566,"DEHOO TECHNOLOGY CO., LIMITED
德合科技有限公司",2005-07-20,2017-06-19,"Private, ltd by shares"44,0984396,"DIAZEN ENTERPRISE GROUP CO., LIMITED
大振企業集團有限公司",2005-07-20,2009-12-11,"Private, ltd by shares"45,0984392,"DRAGON BASE (ASIA) LIMITED
龍域(亞洲)有限公司",2005-07-20,2007-11-30,"Private, ltd by shares"46,0984435,"DS4 (ASIA) LIMITED",2005-07-20,2018-01-19,"Private, ltd by shares"47,0984439,"E-FREE PORCELAIN FACTORY (H.K.) LIMITED
鎬山陶瓷廠(香港)有限公司",2005-07-20,2007-11-16,"Private, ltd by shares"48,0984573,"E-TIME TECHNOLOGY LIMITED
億代電子有限公司",2005-07-20,,"Private, ltd by shares"49,0984432,"EAST OCEAN INTERNATIONAL INDUSTRIAL LIMITED
東海國際實業有限公司",2005-07-20,,"Private, ltd by shares"50,0984474,"Easterly Financial Investment Limited
東風金融投資有限公司",2005-07-20,,"Private, ltd by shares"51,0984403,"EASTERN SUNRISE LIMITED (d2016-07-29)",2005-07-20,2016-07-29,"Private, ltd by shares"52,0984386,"Empire Wave Limited
偉濤有限公司",2005-07-20,,"Private, ltd by shares"53,0984450,"ENGLAND PAUL MASTER GROUP LIMITED
英國保羅美仕特集團有限公司",2005-07-20,2009-12-11,"Private, ltd by shares"54,0984448,"EQUITY LOGISTICS (HK) LIMITED
恆達物流(香港)有限公司",2005-07-20,2020-05-29,"Private, ltd by shares"55,0984489,"ERG LIMITED (d2016-03-11)
精澳有限公司",2005-07-20,2016-03-11,"Private, ltd by shares"56,0984419,"Euro Reforestation Limited",2005-07-20,2015-07-10,"Private, ltd by shares"57,0984422,"EVER BILLION INTERNATIONAL INVESTMENT LIMITED
駿億國際投資有限公司",2005-07-20,,"Private, ltd by shares"58,0984311,"EVERGROW ENTERPRISES LIMITED
長興企業有限公司",2005-07-20,,"Private, ltd by shares"59,0984310,"EVERGROW GROUP LIMITED
長興控股有限公司",2005-07-20,,"Private, ltd by shares"60,0984324,"EXPAND (HONG KONG) ELECTRONIC TECHNOLOGY CO., LIMITED
億邦德(香港)電子科技有限公司",2005-07-20,2007-12-28,"Private, ltd by shares"61,0984570,"FACT INTERNATIONAL RESOURCE CO., LIMITED
致誠國際礦業有限公司",2005-07-20,2009-12-11,"Private, ltd by shares"62,0984356,"FAI KEE SEAFOOD RESTAURANT LIMITED
輝記海鮮火鍋有限公司",2005-07-20,2012-11-09,"Private, ltd by shares"63,0984544,"FAR EAST INTERNATIONAL DEVELOPMENT LIMITED
遠東國際拓展有限公司",2005-07-20,2008-07-11,"Private, ltd by shares"64,0984504,"FAR EAST INTERNATIONAL FERTILIZER IMPORT &amp; EXPORT GROUP LIMITED
遠東國際化肥進出口集團有限公司",2005-07-20,2009-12-11,"Private, ltd by shares"65,0984405,"FEI LONG HK INT'L GROUP LIMITED
飛龍香港國際集團有限公司",2005-07-20,2009-12-11,"Private, ltd by shares"66,0984323,"FIGHTEROPTICS CO., LIMITED
環宇光學有限公司",2005-07-20,,"Private, ltd by shares"67,0984338,"FORCE MOTORSPORTS INDUSTRY CO., LIMITED",2005-07-20,2017-12-22,"Private, ltd by shares"68,0984538,"FORCE YIELD INTERNATIONAL LIMITED
強業國際有限公司",2005-07-20,2006-12-08,"Private, ltd by shares"69,0984581,"FRANCE BINSIWANG DRESS (INT'L) LIMITED
法國賓獅王服飾(國際)有限公司",2005-07-20,2011-03-18,"Private, ltd by shares"70,0984580,"FRANCE ROYAL DOPANG GARMENT LIMITED
法國皇家都彭服飾有限公司",2005-07-20,2009-12-11,"Private, ltd by shares"71,0984512,"FU KEE CARGO HANDLING CO. LIMITED
富記起卸運輸有限公司",2005-07-20,,"Private, ltd by shares"72,0984490,"FUNG SHING JEWELLERY LIMITED
豐盛珠寶金行有限公司",2005-07-20,,"Private, ltd by shares"73,0984441,"FUNGEAR INDUSTRIAL LIMITED
奇鋒實業有限公司",2005-07-20,2018-01-26,"Private, ltd by shares"74,0984495,"GAMAX INDUSTRIAL COMPANY LIMITED
雅美萊實業有限公司",2005-07-20,,"Private, ltd by shares"75,0984572,"GEHORIENT INTERNATIONAL (HONG KONG) LIMITED
奇好國際(香港)有限公司",2005-07-20,2019-09-06,"Private, ltd by shares"76,0984541,"GENIUSES INTERNATIONAL LIMITED
譽晉國際有限公司",2005-07-20,2015-08-14,"Private, ltd by shares"77,0984345,"GI-HAI INTERNATIONAL HONG KONG COMPANY LIMITED
技海國際香港有限公司",2005-07-20,2018-03-29,"Private, ltd by shares"78,0984436,"GLOBAL SUCCESS INTERNATIONAL LIMITED (d2009-12-11)
晉升國際有限公司",2005-07-20,2009-12-11,"Private, ltd by shares"79,0984564,"GLOBAL WELL INDUSTRIAL (HK) LIMITED
寶威實業(香港)有限公司",2005-07-20,2011-03-18,"Private, ltd by shares"80,0984537,"GLOBAL WELLNESS RETAIL LIMITED",2005-07-20,,"Private, ltd by shares"81,0984536,"GLOBAL WELLNESS TRADING LIMITED",2005-07-20,2009-12-11,"Private, ltd by shares"82,0984382,"GMCS Capital Limited
資盛環球融資有限公司",2005-07-20,2009-01-30,"Private, ltd by shares"83,0984453,"GOLD SHINY INVESTMENT LIMITED
金億富投資有限公司",2005-07-20,2008-06-20,"Private, ltd by shares"84,0984461,"GOLD WELL ENGINEERING (HK) LIMITED
金豐工程(香港)有限公司",2005-07-20,2019-04-12,"Private, ltd by shares"85,0984427,"GOLDEN TIME INTERNATIONAL DEVELOPMENT LIMITED (d2009-09-18)
金泰國際發展有限公司",2005-07-20,2009-09-18,"Private, ltd by shares"86,0984517,"GRAND HERO MANUFACTURING LIMITED
億豐製造有限公司",2005-07-20,2011-03-18,"Private, ltd by shares"87,0984496,"GRAND PILOT TECHNOLOGY LIMITED
昌駿科技有限公司",2005-07-20,2011-06-10,"Private, ltd by shares"88,0984424,"GREATWALL INVESTMENT DEVELOPMENT LIMITED
長城投資發展有限公司",2005-07-20,,"Private, ltd by shares"89,0984505,"H.K HUJIANG INT'L GROUP LIMITED
香港滬江國際集團有限公司",2005-07-20,2011-06-30,"Private, ltd by shares"90,0984501,"H.K INT'L OPTICS VISION RECTIFIES RESEARCH GROUP LIMITED
香港國際光學視力矯正研究集團有限公司",2005-07-20,2011-03-18,"Private, ltd by shares"91,0984327,"HAN XIN INDUSTRY (HONG KONG) LIMITED
瀚鑫實業(香港)有限公司",2005-07-20,2019-05-24,"Private, ltd by shares"92,0984415,"HANG FAI INTERIOR DESIGN LIMITED
恒輝裝飾工程設計有限公司",2005-07-20,2013-06-21,"Private, ltd by shares"93,0984428,"HARVEST FULL INTERNATIONAL LIMITED
禾興國際有限公司",2005-07-20,,"Private, ltd by shares"94,0984553,"HECO HOLDING GLOBAL JOINT-STOCK CO., LIMITED
海可控股環球股份有限公司",2005-07-20,2013-10-04,"Private, ltd by shares"95,0984498,"HIGH TECH HEALTH CARE USA (ASIA) LIMITED
美國高科保健亞洲有限公司",2005-07-20,2014-11-21,"Private, ltd by shares"96,0984321,"HK (CHINA) ENERGY CO., LIMITED
香港(中國)能源股份有限公司",2005-07-20,2016-01-08,"Private, ltd by shares"97,0984370,"HK CONTIME (INT'L) HEALTH IND. INV. GROUP LIMITED
香港康泰(國際)健康產業投資集團有限公司",2005-07-20,2009-12-11,"Private, ltd by shares"98,0984571,"HK EASY KING INT'L INVESTMENT GROUP LIMITED
香港順威國際投資集團有限公司",2005-07-20,2012-11-09,"Private, ltd by shares"99,0984569,"HK INT'L LONGSHUN INVESTMENT LIMITED
香港國際隆舜投資有限公司",2005-07-20,2018-06-22,"Private, ltd by shares"100,0984329,"HK JIANDA INT'L INVESTMENT GROUP CO., LIMITED
香港建達國際投資集團有限公司",2005-07-20,2009-12-11,"Private, ltd by shares"101,0984363,"HK PHOENIX DRESS GROUP LIMITED
香港鳳凰服飾集團有限公司",2005-07-20,2008-07-11,"Private, ltd by shares"102,0984391,"HONG KONG ASSOCIATION OF PSYCHOLOGICAL MEDICINE LIMITED (THE)
香港心理醫學協會有限公司",2005-07-20,2018-06-08,"Ltd by guarantee"103,0984466,"HONG KONG ESSENCE HOLDING CO. LIMITED
香港溢昇(控股)有限公司",2005-07-20,2009-12-11,"Private, ltd by shares"104,0984575,"HONG KONG JIE RUI INVESTMENT LIMITED
香港傑瑞投資有限公司",2005-07-20,2009-12-11,"Private, ltd by shares"105,0984404,"HONG KONG JINYIDA CO., LIMITED
香港金易達有限公司",2005-07-20,,"Private, ltd by shares"106,0984346,"HONG KONG PACIFIC TV COMPANY LIMITED",2005-07-20,2014-11-21,"Private, ltd by shares"107,0984480,"HONG KONG QIAN HUA CO., LIMITED
香港乾華有限公司",2005-07-20,2011-03-18,"Private, ltd by shares"108,0984579,"HONG KONG XINYUNFENG SHIPPING BUSINESS LIMITED
香港新運豐船務有限公司",2005-07-20,2011-03-18,"Private, ltd by shares"109,0984467,"HONGKONG CREATIVE INTERNATIONAL CO. LIMITED
香港開天國際有限公司",2005-07-20,2009-12-11,"Private, ltd by shares"110,0984328,"HONGKONG GREAT-BRIDGE TRANSPORT LIMITED
香港世橋貨運有限公司",2005-07-20,,"Private, ltd by shares"111,0984395,"HONGKONG HOHUA BIOLOGY TECHNOLOGY CO., LIMITED
香港顥華生物科技有限公司",2005-07-20,2009-12-11,"Private, ltd by shares"112,0984527,"HONGKONG LINGFENG PAINT (INTERNATIONAL) CO., LIMITED
香港凌豐涂料(國際)有限公司",2005-07-20,2011-03-25,"Private, ltd by shares"113,0984387,"HONGKONG MAOFA INTERNATIONAL JEWELRY GROUP LIMITED
香港茂發國際珠寶集團有限公司",2005-07-20,,"Private, ltd by shares"114,0984326,"HONGKONG MAXCO TRADING CO., LIMITED
香港宏企貿易有限公司",2005-07-20,2018-04-27,"Private, ltd by shares"115,0984475,"HONGKONG TANG-AN INTERNATIONAL GROUP CO., LIMITED
香港糖安國際集團有限公司",2005-07-20,2017-02-03,"Private, ltd by shares"116,0984486,"HWAYIH METALS COMPANY LIMITED
華益金屬有限公司",2005-07-20,,"Private, ltd by shares"117,0984339,"INGREDIENTS PLUS (HONG KONG) LIMITED
澳萃(香港)有限公司",2005-07-20,,"Private, ltd by shares"118,0984528,"Innervation Global Product Limited",2005-07-20,,"Private, ltd by shares"119,0984320,"INSPIRATION STUDIO LIMITED",2005-07-20,2015-07-10,"Private, ltd by shares"120,0984334,"INTEGRATED ENGINEERING (HK) LIMITED
匯建工程(香港)有限公司",2005-07-20,,"Private, ltd by shares"121,0984420,"INTERNATIONAL EXHIBITION SERVICE LIMITED (d2009-05-29)
國際展覽服務有限公司",2005-07-20,2009-05-29,"Private, ltd by shares"122,0984562,"IT.PROJECT LIMITED",2005-07-20,2007-11-09,"Private, ltd by shares"123,0984348,"ITALY HANNAH INTERNATIONAL FASHION GROUP LIMITED
意大利漢娜國際服飾集團有限公司",2005-07-20,2009-12-11,"Private, ltd by shares"124,0984397,"JAPAN AO TE MAN INT'L GROUP LIMITED
日本奧特曼國際集團有限公司",2005-07-20,2011-03-18,"Private, ltd by shares"125,0984525,"JIAN FONG INTERNATIONAL INVESTMENTS LIMITED
建豐國際企業投資有限公司",2005-07-20,2009-12-11,"Private, ltd by shares"126,0984340,"JIEXUN ELECTRONICS LIMITED",2005-07-20,2012-11-09,"Private, ltd by shares"127,0984447,"JINHAN DESIGN &amp; CONSTRUCTION CO., LIMITED
金瀚裝飾設計工程有限公司",2005-07-20,,"Private, ltd by shares"128,0984459,"JU CHENG LIMITED
鉅晟有限公司",2005-07-20,2008-08-08,"Private, ltd by shares"129,0984426,"JUSTICE INSURANCE AGENCY LIMITED
正文保險代理有限公司",2005-07-20,2011-03-25,"Private, ltd by shares"130,0984364,"KASAR KNIGHT LIMITED
凱薩騎士國際有限公司",2005-07-20,2015-12-11,"Private, ltd by shares"131,0984360,"KEI SHUN (FAR EAST) LIMITED
基信(遠東)有限公司",2005-07-20,2007-09-07,"Private, ltd by shares"132,0984350,"Kerry Freight International (Europe) Limited",2005-07-20,,"Private, ltd by shares"133,0984548,"KING EXPRESS INTERNATIONAL LOGISTICS LIMITED
邕海國際物流有限公司",2005-07-20,2012-06-04,"Private, ltd by shares"134,0984460,"KING RICHLY LIMITED
璟駿有限公司",2005-07-20,2015-09-11,"Private, ltd by shares"135,0984521,"LA-V INTERNATIONAL LIMITED",2005-07-20,2015-07-10,"Private, ltd by shares"136,0984337,"LCT HONGWAY CORPORATION LIMITED",2005-07-20,,"Private, ltd by shares"137,0984509,"LEADTEC COMMUNICATION CO., LIMITED
力響科技有限公司",2005-07-20,2006-09-01,"Private, ltd by shares"138,0984443,"Legend (Welding) Engineering Company Limited
勵駿焊接工程有限公司",2005-07-20,,"Private, ltd by shares"139,0984411,"LEXWELL LIMITED (HK)",2005-07-20,2018-02-23,"Private, ltd by shares"140,0984534,"LI SEE TRADING LIMITED
麗思貿易有限公司",2005-07-20,2011-03-25,"Private, ltd by shares"141,0984464,"LIAN HAI RESOURCES LIMITED
聯海資源有限公司",2005-07-20,,"Private, ltd by shares"142,0984551,"LOFTIVIEW INTERNATIONAL REAL ESTATE INVESTMENT (HONG KONG) CO., LIMITED
新融達國際地產投資(香港)有限公司",2005-07-20,2015-12-11,"Private, ltd by shares"143,0984365,"LONGER WIN INTERNATIONAL LIMITED
加陞國際有限公司",2005-07-20,2014-04-25,"Private, ltd by shares"144,0984394,"LP FINANCIAL SERVICES LIMITED (d2016-03-11)
美國環球外匯咨詢有限公司",2005-07-20,2016-03-11,"Private, ltd by shares"145,0984433,"LU FA HOTEL (HONG KONG) INVESTMENT MANAGEMENT CO. LIMITED
鷺發餐飲(香港)投資管理有限公司",2005-07-20,2011-01-07,"Private, ltd by shares"146,0984513,"M P Tec Limited
多媒體科技發展有限公司",2005-07-20,2012-11-09,"Private, ltd by shares"147,0984315,"M&amp;W CONSULTING &amp; SYSTEMS LIMITED",2005-07-20,2011-03-18,"Private, ltd by shares"148,0984511,"MANUS LIMITED",2005-07-20,,"Private, ltd by shares"149,0984352,"MAXFUJI EUROPE (HONG KONG) LIMITED
富良物力(香港)有限公司",2005-07-20,,"Private, ltd by shares"150,0984457,"METRO DRAGON DEVELOPMENT LIMITED
龍域發展有限公司",2005-07-20,,"Private, ltd by shares"151,0984499,"MINT TRADING LIMITED (d2008-08-01)
明晉貿易有限公司",2005-07-20,2008-08-01,"Private, ltd by shares"152,0984470,"Mirae Asset Securities (HK) Limited
未來資產證券(香港)有限公司",2005-07-20,,"Public, ltd by shares"153,0984430,"MKONSULT LIMITED
柯信有限公司",2005-07-20,,"Private, ltd by shares"154,0984535,"MODERN EVERLITE PRODUCTS LIMITED
原創產品有限公司",2005-07-20,2016-01-08,"Private, ltd by shares"155,0984576,"MP PACIFIC LIMITED
萬匯(太平洋)有限公司",2005-07-20,2011-03-18,"Private, ltd by shares"156,0984540,"MTL Asia Limited",2005-07-20,,"Private, ltd by shares"157,0984478,"MULTI LINK INDUSTRIAL LIMITED
全能實業有限公司",2005-07-20,2007-06-29,"Private, ltd by shares"158,0984506,"MUSE INTERIORS LIMITED
創思設計顧問有限公司",2005-07-20,,"Private, ltd by shares"159,0984503,"NANJING FOREIGN COOPERATION TRADE LIMITED
南京對外協作貿易有限公司",2005-07-20,2007-11-30,"Private, ltd by shares"160,0984487,"NANJING UNISON (HONGKONG) CO., LIMITED
南京裕成(香港)有限公司",2005-07-20,2008-01-04,"Private, ltd by shares"161,0984330,"NEW BILLION FORWARD FURNITURE COMPANY LIMITED
新萬進傢俱有限公司",2005-07-20,,"Private, ltd by shares"162,0984543,"NEWLY PLUS LIMITED
鎰志有限公司",2005-07-20,2007-04-13,"Private, ltd by shares"163,0984322,"ONE SQUARE LIMITED
壹一有限公司",2005-07-20,2007-04-04,"Private, ltd by shares"164,0984400,"ORIENTAL MEDICAL AND HEALTH CENTRE LIMITED
瀛洲醫學康美中心有限公司",2005-07-20,2010-02-05,"Private, ltd by shares"165,0984314,"OWLONTREE TECHNOLOGY LIMITED
漢源科技有限公司",2005-07-20,2008-10-17,"Private, ltd by shares"166,0984445,"PAN EAST CONSULTANTS COMPANY LIMITED
泛東顧問有限公司",2005-07-20,2010-05-14,"Private, ltd by shares"167,0984500,"PAN-CHINA (HONG KONG) CITY BUILDING AND DEVELOPMENT GROUP LIMITED
泛華(香港)城市建設發展集團有限公司",2005-07-20,2009-12-11,"Private, ltd by shares"168,0984434,"PARK FAITH ENTERPRISE LIMITED
栢信企業有限公司",2005-07-20,2011-10-28,"Private, ltd by shares"169,0984401,"PARS-SHIAN CO., LIMITED
波斯．西洋有限公司",2005-07-20,2014-02-14,"Private, ltd by shares"170,0984463,"POLY EASTERN HEALTHCARE LIMITED
恆生醫療用品有限公司",2005-07-20,2009-12-11,"Private, ltd by shares"171,0984582,"PORT SECURITY INTERNATIONAL (ASIA) TECHNOLOGY LIMITED
港口安全國際集團(亞洲)科技有限公司",2005-07-20,2007-10-05,"Private, ltd by shares"172,0984510,"POWERFUL INTERNATIONAL INDUSTRIAL COMPANY LIMITED
百科國際工業有限公司",2005-07-20,2014-02-21,"Private, ltd by shares"173,0984476,"PRIME OILFIELD SUPPLIES (H.K.) LIMITED
普明油田供應(香港)有限公司",2005-07-20,2014-11-21,"Private, ltd by shares"174,0984493,"PRIOR EDUCATIONAL LIMITED",2005-07-20,2010-01-15,"Private, ltd by shares"175,0984361,"PROFIT RICHEST INVESTMENT LIMITED
潤生投資有限公司",2005-07-20,,"Private, ltd by shares"176,0984483,"PURE INTERNATIONAL CO., LIMITED
中創國際貿易有限公司",2005-07-20,2014-03-21,"Private, ltd by shares"177,0984313,"QIN QIN BAO BEI (HONG KONG) KIDS FASHION CO., LIMITED
親親寶貝(香港)童服有限公司",2005-07-20,,"Private, ltd by shares"178,0984583,"RAINING KNOWLEDGE UNION INTERNATIONAL LIMITED
潤知國際集團有限公司",2005-07-20,2010-05-07,"Private, ltd by shares"179,0984555,"RAISE SINO (HK) LIMITED
加華(香港)有限公司",2005-07-20,2007-12-07,"Private, ltd by shares"180,0984429,"REACH TONE ELECTRONICS CO., LIMITED
致力通電子有限公司",2005-07-20,,"Private, ltd by shares"181,0984332,"RECKY-EASTERN INTERNATIONAL TECHNOLOGY CO., LIMITED
永匯東方國際科技有限公司",2005-07-20,2014-10-17,"Private, ltd by shares"182,0984532,"RED FAST LIMITED
紅騰有限公司",2005-07-20,2007-04-13,"Private, ltd by shares"183,0984456,"REGAL VICTOR DEVELOPMENT LIMITED (d2010-10-22)
英耀發展有限公司",2005-07-20,2010-10-22,"Private, ltd by shares"184,0984454,"REGAL VICTOR INVESTMENT LIMITED
宏豪投資有限公司",2005-07-20,,"Private, ltd by shares"185,0984471,"REGENT GAS (SUZHOU) LIMITED
瑞景天然氣(蘇州)有限公司",2005-07-20,,"Private, ltd by shares"186,0984539,"RICH CHANCES INTERNATIONAL LIMITED
富機國際有限公司",2005-07-20,2007-12-07,"Private, ltd by shares"187,0984452,"RICHPAT (INTERNATIONAL) GROUP LIMITED
裕柏(國際)集團有限公司",2005-07-20,2009-12-11,"Private, ltd by shares"188,0984529,"RISING TRADE LIMITED (d2007-04-13)
倡貿有限公司",2005-07-20,2007-04-13,"Private, ltd by shares"189,0984412,"SABAH MALAYSIAN CUISINE LIMITED
莎巴馬來西亞餐廳有限公司",2005-07-20,,"Private, ltd by shares"190,0984413,"SAMCO H.K. LIMITED",2005-07-20,,"Private, ltd by shares"191,0984440,"SAN FRANCISCO COFFEE LIMITED
三藩市咖啡有限公司",2005-07-20,2013-10-04,"Private, ltd by shares"192,0984417,"SAN JIAO ELECTRIC APPLIANCES (INT'L) IMPORTS &amp; EXPORTS LIMITED
三角電器(國際)進出口有限公司",2005-07-20,2009-12-11,"Private, ltd by shares"193,0984556,"SEASONING LIMITED
美麗點子有限公司",2005-07-20,,"Private, ltd by shares"194,0984373,"SECURED ENVIRONMENT COMPANY LIMITED",2005-07-20,2008-11-21,"Private, ltd by shares"195,0984515,"SERENE ALUMINIUM ENGINEERING LIMITED
世昌鋁業工程有限公司",2005-07-20,2012-11-09,"Private, ltd by shares"196,0984335,"SHANGHAI GATHER GLORY INDUSTRIAL (H.K.) CO., LIMITED
上海聚嶸實業(香港)有限公司",2005-07-20,2010-05-07,"Private, ltd by shares"197,0984472,"SHANGHAI INDUSTRY TEXTILE LIMITED",2005-07-20,2017-12-22,"Private, ltd by shares"198,0984442,"SHENZHEN YESEWIN TECHNOLOGY COMPANY LIMITED
深圳躍盛輝科技有限公司",2005-07-20,2018-05-18,"Private, ltd by shares"199,0984557,"SHINING COMMERCIAL &amp; TRADING LIMITED
信名商貿有限公司",2005-07-20,2008-06-06,"Private, ltd by shares"200,0984481,"SHINTEX (HONG KONG) CO., LIMITED
信特科技(香港)有限公司",2005-07-20,,"Private, ltd by shares"201,0984366,"SHINY TOP ENTERPRISES LIMITED
嘉陞企業有限公司",2005-07-20,,"Private, ltd by shares"202,0984514,"SILVER OCEAN SHIPPING (H.K.) LIMITED
瀛洋海運有限公司",2005-07-20,,"Private, ltd by shares"203,0984359,"SIMTECH INDUSTRIAL LIMITED",2005-07-20,2019-05-31,"Private, ltd by shares"204,0984574,"SINIC IMPACT INT'L CO., LIMITED
華派國際有限公司",2005-07-20,2011-11-11,"Private, ltd by shares"205,0984526,"SKY GLORIES LIMITED
儷陞有限公司",2005-07-20,2007-04-13,"Private, ltd by shares"206,0984389,"SKY REGAL (ASIA) LIMITED
永天(亞洲)有限公司",2005-07-20,2009-12-11,"Private, ltd by shares"207,0984577,"SKYLAND (HONGKONG) TECHNOLOGY CO., LIMITED
雲中田(香港)科技有限公司",2005-07-20,2019-04-12,"Private, ltd by shares"208,0984354,"SKYPINE INDUSTRY CO., LIMITED
天派工業有限公司",2005-07-20,,"Private, ltd by shares"209,0984491,"SMART DISPLAY SOLUTIONS LIMITED
思碼顯示系統有限公司",2005-07-20,2012-11-16,"Private, ltd by shares"210,0984407,"SMASH INTERNATIONAL LIMITED
思裕國際有限公司",2005-07-20,2008-02-29,"Private, ltd by shares"211,0984351,"SONG YI AUDIO DISTRIBUTION (HK) LIMITED
松逸音響有限公司",2005-07-20,2020-01-17,"Private, ltd by shares"212,0984406,"SOUND RIVER GARMENT (HONG KONG) LIMITED
桑瑞服裝(香港)有限公司",2005-07-20,2009-12-31,"Private, ltd by shares"213,0984558,"SOUTH LINK (HK) LIMITED
南聯(香港)有限公司",2005-07-20,,"Private, ltd by shares"214,0984371,"SPEEDY UNION ENTERPRISES LIMITED
迅聯企業有限公司",2005-07-20,2012-04-13,"Private, ltd by shares"215,0984545,"SPZ-GROUP INTERNATIONAL LIMITED",2005-07-20,2013-08-02,"Private, ltd by shares"216,0984560,"STONEGRILL CHINA DEVELOPMENT LIMITED
石頭燒中國發展有限公司",2005-07-20,2009-12-11,"Private, ltd by shares"