,Reg no.,Name,Incorp-orated,Dissolved,Type217,0984530,"STRONG TEAM HOLDINGS LIMITED
強科集團有限公司",2005-07-20,2008-10-17,"Private, ltd by shares"218,0984375,"SUCCESS POWER (ASIA) LIMITED
迅聯(亞洲)有限公司",2005-07-20,,"Private, ltd by shares"219,0984376,"SUCCESS REGAL HOLDINGS LIMITED
富雄集團有限公司",2005-07-20,2014-01-24,"Private, ltd by shares"220,0984367,"SUCCESS REGAL INTERNATIONAL LIMITED
威煌國際有限公司",2005-07-20,2007-10-18,"Private, ltd by shares"221,0984449,"SUCCESSFUL TRADING (HONG KONG) CO., LIMITED
捷成貿易(香港)有限公司",2005-07-20,2008-08-15,"Private, ltd by shares"222,0984317,"SUMMIT TRADING (H. K.) LIMITED
景峰貿易(香港)有限公司",2005-07-20,2009-12-04,"Private, ltd by shares"223,0984383,"SUNNY BASE HOLDINGS LIMITED
英耀集團有限公司",2005-07-20,2011-03-18,"Private, ltd by shares"224,0984455,"SUNNY GOLDEN LIMITED
得淼電子有限公司",2005-07-20,,"Private, ltd by shares"225,0984374,"SUNTEX INTERNATIONAL TRADING CO. LIMITED",2005-07-20,,"Private, ltd by shares"226,0984431,"SUNUP LIMITED
尚日有限公司",2005-07-20,2015-08-07,"Private, ltd by shares"227,0984331,"SUNWILL PLUMBING &amp; DRAINAGE WORKS LIMITED
深匯水喉及渠務工程有限公司",2005-07-20,2008-08-01,"Private, ltd by shares"228,0984518,"SURPASS INTERNATIONAL (HK) LIMITED",2005-07-20,2012-11-09,"Private, ltd by shares"229,0984341,"SWITZERLAND DANXUELI COSMETIC GROUP LIMITED
瑞士丹雪麗化妝品集團有限公司",2005-07-20,2009-12-11,"Private, ltd by shares"230,0984355,"SYNST ELECTRONICS (HONG KONG) LIMITED
星士達電子(香港)有限公司",2005-07-20,,"Private, ltd by shares"231,0984438,"T Smart IoT Co., LIMITED
湯米智能技術控股有限公司",2005-07-20,,"Private, ltd by shares"232,0984349,"TAKE IT TRANSPORTATION COMPANY LIMITED
達益貨運有限公司",2005-07-20,2006-12-22,"Private, ltd by shares"233,0984568,"TALENT LEADER ENTERTAINMENT &amp; PRODUCTIONS LIMITED
灝盈娛樂製作有限公司",2005-07-20,2009-09-01,"Private, ltd by shares"234,0984318,"TANY INTERNATIONAL (HONGKONG) CO., LIMITED
天益國際(香港)有限公司",2005-07-20,2018-02-23,"Private, ltd by shares"235,0984380,"TELECOM SOLUTION (HK) LIMITED",2005-07-20,2010-04-16,"Private, ltd by shares"236,0984402,"TEXEL TRADING COMPANY LIMITED",2005-07-20,2013-10-04,"Private, ltd by shares"237,0984523,"THINKERS PUBLISHING LIMITED
星克爾出版有限公司",2005-07-20,2007-09-21,"Private, ltd by shares"238,0984565,"Tiloja Investment Limited",2005-07-20,2015-07-10,"Private, ltd by shares"239,0984578,"TIM SHING PROPERTY LIMITED
天成物業有限公司",2005-07-20,2008-02-15,"Private, ltd by shares"240,0984372,"TIPTOP TECHNOLOGY PAN ASIA CO., LIMITED
藍鼎科技有限公司",2005-07-20,,"Private, ltd by shares"241,0984479,"TJ-COOPER MARITIME LIMITED",2005-07-20,2015-10-23,"Private, ltd by shares"242,0984524,"TONITEK INTERNATIONAL LIMITED
通洋國際有限公司",2005-07-20,2015-01-23,"Private, ltd by shares"243,0984520,"TOPFIT HOLDINGS LIMITED
冠利通集團有限公司",2005-07-20,2016-03-11,"Private, ltd by shares"244,0984398,"TOURNIQUEEN MEDICAL INSTRUMENT'S CO., LIMITED
泰旎醫療用品有限公司",2005-07-20,2009-09-04,"Private, ltd by shares"245,0984423,"TRANSAMERICA INTERNATIONAL LIMITED
汎美國際有限公司",2005-07-20,,"Private, ltd by shares"246,0984418,"TRIMEX ASIA LIMITED (d2011-03-18)",2005-07-20,2011-03-18,"Private, ltd by shares"247,0984465,"TXD INTERNATIONAL BUSINESS HOLDINGS CO., LIMITED
泰熙達國際商務股份有限公司",2005-07-20,2018-12-21,"Private, ltd by shares"248,0984494,"UNI STONE LIMITED
環美石材有限公司",2005-07-20,2019-04-12,"Private, ltd by shares"249,0984437,"UNION CHOICE TECHNOLOGY DEVELOPMENT LIMITED
聯創科技發展有限公司",2005-07-20,2013-10-04,"Private, ltd by shares"250,0984388,"UNITED PACIFIC COOKWARE LIMITED
國聯廚具有限公司",2005-07-20,,"Private, ltd by shares"251,0984336,"UQUIM INTERNATIONAL TRADING CO., LIMITED
益嘉國際貿易有限公司",2005-07-20,,"Private, ltd by shares"252,0984451,"USA GAOSHENG GROUP INT'L INVESTMENT CO., LIMITED
美國高盛集團國際投資有限公司",2005-07-20,2011-03-18,"Private, ltd by shares"253,0984325,"USA KELISIDUO INT'L GROUP DEV. LIMITED
美國可麗斯朵國際集團發展有限公司",2005-07-20,2009-12-11,"Private, ltd by shares"254,0984458,"V-DOUBLE GROUP FINANCE &amp; ENGINEERING (GLOBAL) CO., LIMITED
得寶集團融資及工程(環球)有限公司",2005-07-20,2009-01-30,"Private, ltd by shares"255,0984563,"VARIATION INDUSTRIAL COMPANY LIMITED
弘傑實業有限公司",2005-07-20,,"Private, ltd by shares"256,0984485,"VERSATECH OFFICE SYSTEMS LIMITED
盈臻辦公系統有限公司",2005-07-20,2009-02-13,"Private, ltd by shares"257,0984343,"VIAOCCI LIMITED",2005-07-20,2011-03-18,"Private, ltd by shares"258,0984421,"WAI YIP DEVELOPMENT CONSTRUCTION LIMITED
瑋業發展建築有限公司",2005-07-20,,"Private, ltd by shares"259,0984393,"WAICO INTERNATIONAL TRADING COMPANY LIMITED
偉高國際貿易有限公司",2005-07-20,,"Private, ltd by shares"260,0984353,"WAN CHENG (H.K.) INDUSTRIAL CO., LIMITED
宛成(香港)實業有限公司",2005-07-20,,"Private, ltd by shares"261,0984414,"WCT PRINTING COMPANY LIMITED
安全印刷有限公司",2005-07-20,2010-01-08,"Private, ltd by shares"262,0984358,"WEALTHIEST PROPERTY DEVELOPMENT LIMITED
至有地產發展有限公司",2005-07-20,,"Private, ltd by shares"263,0984482,"WEI YE LIMITED (d2007-03-30)
煒業貿易有限公司",2005-07-20,2007-03-30,"Private, ltd by shares"264,0984546,"WELL TREASURE INDUSTRIAL CO., LIMITED
富豪玩具有限公司",2005-07-20,,"Private, ltd by shares"265,0984507,"WELLY CHANCES LIMITED
匯錩有限公司",2005-07-20,2007-12-07,"Private, ltd by shares"266,0984362,"WEST CHINA DEVELOPMENT INTERNATIONAL LIMITED
西華開發國際有限公司",2005-07-20,2007-12-21,"Private, ltd by shares"267,0984390,"WORLD SHINE INTERNATIONAL LIMITED
世曜國際有限公司",2005-07-20,2008-05-02,"Private, ltd by shares"268,0984484,"XL CO., LIMITED
曉輪貿易有限公司",2005-07-20,2011-03-18,"Private, ltd by shares"269,0984462,"YAKADIR ENTERPRISES (HONG KONG) LIMITED
凱駿發展有限公司",2005-07-20,2011-11-11,"Private, ltd by shares"270,0984561,"YAZHI (HK) ENGINEERING LIMITED
雅致(香港)工程有限公司",2005-07-20,,"Private, ltd by shares"271,0984468,"YIDA TRADING (HONG KONG) COMPANY LIMITED
依達貿易(香港)有限公司",2005-07-20,2008-01-11,"Private, ltd by shares"272,0984567,"YING FAI HOLDINGS LIMITED
盈暉控股有限公司",2005-07-20,,"Private, ltd by shares"273,0984497,"YUE JI XUAN CATERING ENTERPRISES LIMITED
月季軒飲食集團有限公司",2005-07-20,2016-01-08,"Private, ltd by shares"274,0984446,"ZOTAC TECHNOLOGY LIMITED
索泰科技有限公司",2005-07-20,,"Private, ltd by shares"