,Reg no.,Name,Incorp-orated,Dissolved,Type1,0714624,"2ALL INTERACTIVE LIMITED",2000-05-03,2006-01-06,"Private, ltd by shares"2,0714608,"5'P STRATEGIES LIMITED",2000-05-03,2006-09-15,"Private, ltd by shares"3,0714593,"720 ARMOUR LIMITED",2000-05-03,2005-01-28,"Private, ltd by shares"4,0714509,"A &amp; M TECHNOLOGY LIMITED (d2001-11-16)
亞洲新人類科技有限公司",2000-05-03,2001-11-16,"Private, ltd by shares"5,0714754,"ACTION DEVELOPMENT INTERNATIONAL COMPANY LIMITED
雅信國際發展有限公司",2000-05-03,2007-09-14,"Private, ltd by shares"6,0714672,"ALPHA PRECISION (H.K.) COMPANY LIMITED
阿爾法精密(香港)有限公司",2000-05-03,,"Private, ltd by shares"7,0714738,"AMBER INTERNATIONAL CO LIMITED
嗷珀有限公司",2000-05-03,2013-06-07,"Private, ltd by shares"8,0714536,"APEX JOINT LIMITED
太駿有限公司",2000-05-03,2006-09-15,"Private, ltd by shares"9,0714537,"APEX UNITED LIMITED (d2002-09-13)
太譽有限公司",2000-05-03,2002-09-13,"Private, ltd by shares"10,0714770,"ASIA PUBLISHING GROUP LIMITED",2000-05-03,,"Private, ltd by shares"11,0714510,"ASIAN MART LOGISTICS LIMITED
港亞物流顧問有限公司",2000-05-03,2001-11-16,"Private, ltd by shares"12,0714591,"AYAAYA LIMITED
十人十色有限公司",2000-05-03,2014-07-04,"Private, ltd by shares"13,0714733,"BAI FENG INTERNATIONAL INVESTMENT LIMITED
百豐國際投資有限公司",2000-05-03,2014-08-29,"Private, ltd by shares"14,0714795,"BAXTER INVESTMENTS LIMITED (HK)",2000-05-03,2018-05-25,"Private, ltd by shares"15,0714729,"BEIJING TONG HENG ELECTRONICS COMPANY LIMITED
北京通恆電子有限公司",2000-05-03,,"Private, ltd by shares"16,0714619,"BELLA CASA ASSETS MANAGEMENT &amp; CONSULTANTS LIMITED
麗苑資產管理及顧問有限公司",2000-05-03,2004-07-09,"Private, ltd by shares"17,0714492,"BELLAND GROUPS (HONG KONG) COMPANY LIMITED
貝爾蘭德集團(香港)有限公司",2000-05-03,2006-09-15,"Private, ltd by shares"18,0714539,"BENNY CATERING COMPANY LIMITED
美味飲食有限公司",2000-05-03,2001-09-28,"Private, ltd by shares"19,0714695,"BEST WEALTHY (HONG KONG) LIMITED
佳豐(香港)有限公司",2000-05-03,2019-11-29,"Private, ltd by shares"20,0714675,"BEST YIELD INVESTMENT LIMITED
百溢投資有限公司",2000-05-03,2005-05-06,"Private, ltd by shares"21,0714762,"BESTACK (HK) CO., LIMITED
貝司達(香港)有限公司",2000-05-03,2005-12-16,"Private, ltd by shares"22,0714685,"BILLION TECH HOLDINGS LIMITED
億科集團有限公司",2000-05-03,,"Private, ltd by shares"23,0714648,"BLAZE COMMUNICATION LIMITED (d2005-07-15)",2000-05-03,2005-07-15,"Private, ltd by shares"24,0714674,"C-LINK DYNAMICS LIMITED
中聯動力有限公司",2000-05-03,2002-11-29,"Private, ltd by shares"25,0714554,"CANADA SUN (HK) INTERNATIONAL LIMITED
加拿大太陽(香港)國際有限公司",2000-05-03,2002-09-13,"Private, ltd by shares"26,0714531,"CANDLE HOLDINGS LIMITED
盈都集團有限公司",2000-05-03,,"Private, ltd by shares"27,0714659,"CAPITAL ONLINE LIMITED (d2002-12-20)
資本在線有限公司",2000-05-03,2002-12-20,"Private, ltd by shares"28,0714657,"CARPLUS ONLINE LIMITED
車王在線有限公司",2000-05-03,2002-12-20,"Private, ltd by shares"29,0714614,"CDC SOFTWARE DEVELOPMENT CENTER LIMITED",2000-05-03,2005-05-27,"Private, ltd by shares"30,0714716,"CENTALINE MORTGAGE BROKER LIMITED
中原按揭經紀有限公司",2000-05-03,,"Private, ltd by shares"31,0714538,"CHAIN UNION LIMITED
長銳有限公司",2000-05-03,2019-11-22,"Private, ltd by shares"32,0714677,"CHARTER CAPITAL INTERNATIONAL LIMITED (d2006-09-15)
志嘉國際有限公司",2000-05-03,2006-09-15,"Private, ltd by shares"33,0714534,"CHARTER CHAIN ENTERPRISES LIMITED
卓鏗企業有限公司",2000-05-03,2017-03-24,"Private, ltd by shares"34,0714663,"CHEEZ GIRL ONLINE LIMITED",2000-05-03,2002-12-20,"Private, ltd by shares"35,0714499,"CHI HING DECORATION LIMITED
志興裝修工程有限公司",2000-05-03,,"Private, ltd by shares"36,0714676,"CHIEFTAIN INTERNATIONAL CO. LIMITED
靖隆國際有限公司",2000-05-03,2002-11-08,"Private, ltd by shares"37,0714768,"CHINA (HONG KONG) HUI XIN INTERNATIONAL INVESTMENT LIMITED
中國(香港)匯鑫國際投資有限公司",2000-05-03,2005-05-06,"Private, ltd by shares"38,0714586,"CHINA BRIDGE INVESTMENTS LIMITED",2000-05-03,2002-11-15,"Private, ltd by shares"39,0714626,"CHINA CHEMPHARM HONG KONG LIMITED
康大實業香港有限公司",2000-05-03,2001-11-30,"Private, ltd by shares"40,0714788,"CHINA DIGITAL MOVIE CITY COMPANY LIMITED
中國數碼影城有限公司",2000-05-03,2013-08-30,"Private, ltd by shares"41,0714556,"CHINA NEXT GENERATION GROUPS LIMITED
中國雛鷹集團有限公司",2000-05-03,2006-01-06,"Private, ltd by shares"42,0714763,"CHINAGLORY WHARF TRANSPORTATION COMPANY LIMITED
中榮碼頭運輸有限公司",2000-05-03,2015-12-04,"Private, ltd by shares"43,0714618,"CHONG HUAN ENGINEERING LIMITED
崇煥工程有限公司",2000-05-03,2006-09-15,"Private, ltd by shares"44,0714545,"CHONG SHING MOTOR ELECTRIC AIR-CONDITION REPAIR LIMITED
昌盛汽車電器冷氣維修有限公司",2000-05-03,2002-05-31,"Private, ltd by shares"45,0714512,"CITINET SYSTEMS LIMITED
城大科訊有限公司",2000-05-03,,"Private, ltd by shares"46,0714540,"CMO DYNAMIC COMPANY LIMITED
盛唐動力(香港)有限公司",2000-05-03,2003-10-17,"Private, ltd by shares"47,0714679,"CONCEPT2BIZ.COM LIMITED
新經濟動力有限公司",2000-05-03,2002-02-22,"Private, ltd by shares"48,0714727,"CUSTOMI.COM LIMITED",2000-05-03,2004-10-21,"Private, ltd by shares"49,0714750,"CYBER LEADER INTERNATIONAL (NOMINEE) LIMITED
億科國際(代理人)有限公司",2000-05-03,,"Private, ltd by shares"50,0714689,"CYBER SUCCESS INTERNATIONAL LIMITED
科成國際有限公司",2000-05-03,2014-02-14,"Private, ltd by shares"51,0714696,"CYBER WISE LIMITED (d2002-09-13)
科鉅有限公司",2000-05-03,2002-09-13,"Private, ltd by shares"52,0714615,"CYBER YIELD TECHNOLOGY LIMITED
盈溢科技有限公司",2000-05-03,2002-08-30,"Private, ltd by shares"53,0714515,"CYBER-ALA-KING LIMITED",2000-05-03,2005-11-04,"Private, ltd by shares"54,0714523,"CYBERBASE ISYSTEMS LIMITED
互聯世界科技有限公司",2000-05-03,2010-05-14,"Private, ltd by shares"55,0714516,"CYBRIC LIMITED",2000-05-03,2005-11-04,"Private, ltd by shares"56,0714501,"D &amp; D LIMITED (d2005-05-06)",2000-05-03,2005-05-06,"Private, ltd by shares"57,0714710,"DIGITEX GARMENT ACCESSORIES NET LIMITED
新紡制衣配料網有限公司",2000-05-03,2016-03-24,"Private, ltd by shares"58,0714525,"DIMENSIONAL CONCEPT DESIGN LIMITED
藝丞設計有限公司",2000-05-03,,"Private, ltd by shares"59,0714724,"DONGLION SHIPPING COMPANY LIMITED
東連船務有限公司",2000-05-03,2006-01-06,"Private, ltd by shares"60,0714616,"DONJON DEVELOPMENT LIMITED
主力集團有限公司",2000-05-03,,"Private, ltd by shares"61,0714758,"DOTSWORK LIMITED",2000-05-03,2008-07-18,"Private, ltd by shares"62,0714602,"E-AMAH INTERNATIONAL HOLDINGS LIMITED
現代瑪姐集團有限公司",2000-05-03,2010-12-17,"Private, ltd by shares"63,0714518,"EASTERN GATE CAPITAL LIMITED
東直門融資有限公司",2000-05-03,2013-04-19,"Private, ltd by shares"64,0714612,"EASY GROWN LIMITED
怡利豐有限公司",2000-05-03,2005-05-06,"Private, ltd by shares"65,0714731,"EBROKER SYSTEMS LIMITED
電子交易系統有限公司",2000-05-03,,"Private, ltd by shares"66,0714743,"EDNOLAND (HK) LIMITED
教育小天地有限公司",2000-05-03,2010-10-12,"Private, ltd by shares"67,0714651,"EFEEDMARKET.COM LIMITED",2000-05-03,2006-09-15,"Private, ltd by shares"68,0714741,"EGLASS ASIA LIMITED",2000-05-03,2018-02-13,"Private, ltd by shares"69,0714630,"EGON LIMITED (d2002-05-10)
溢光有限公司",2000-05-03,2002-05-10,"Private, ltd by shares"70,0714598,"ELITE BRILLIANT (HONG KONG) LIMITED
宇輝(香港)有限公司",2000-05-03,2008-10-17,"Private, ltd by shares"71,0714666,"EMANHK ONLINE LIMITED
君子在線有限公司",2000-05-03,2002-12-20,"Private, ltd by shares"72,0714595,"ETERNAL SUPREME INTERNATIONAL LIMITED
永尊國際有限公司",2000-05-03,2016-01-15,"Private, ltd by shares"73,0714505,"EXATECH TECHNOLOGY COMPANY LIMITED
昶益富有限公司",2000-05-03,2002-08-23,"Private, ltd by shares"74,0714693,"EXCEL LEADER (HONG KONG) LIMITED
卓暉(香港)有限公司",2000-05-03,2002-10-04,"Private, ltd by shares"75,0714745,"EXCEL TEAM HOLDINGS LIMITED (d2002-09-27)
卓暉集團有限公司",2000-05-03,2002-09-27,"Private, ltd by shares"76,0714496,"EXCELLENT SUPPLY COMPANY LIMITED
興業電器有限公司",2000-05-03,2007-09-14,"Private, ltd by shares"77,0714660,"EXPRESS WEEKLY ONLINE LIMITED
快周刊在線有限公司",2000-05-03,2002-12-20,"Private, ltd by shares"78,0714653,"EZBUDDY.COM (ASIA) PRIVATE LIMITED",2000-05-03,2006-01-06,"Private, ltd by shares"79,0714794,"EZMOOD.COM LIMITED
意釋貿有限公司",2000-05-03,2004-07-23,"Private, ltd by shares"80,0714722,"FAR EAST DEVELOPMENT LIMITED
遠東創富有限公司",2000-05-03,2002-02-22,"Private, ltd by shares"81,0714582,"FASHION GEAR LIMITED
浩田時裝有限公司",2000-05-03,2008-07-18,"Private, ltd by shares"82,0714503,"FEDERAL FUND HOLDINGS LIMITED
聯邦基金控股有限公司",2000-05-03,,"Private, ltd by shares"83,0714780,"FILKUEN FINANCE LIMITED
照權財務有限公司",2000-05-03,,"Private, ltd by shares"84,0714532,"FINANCIAL CHAIN INVESTMENTS LIMITED
財順投資有限公司",2000-05-03,2011-12-02,"Private, ltd by shares"85,0714683,"FOCUS ONE MEDIA HONG KONG LIMITED",2000-05-03,2006-01-06,"Private, ltd by shares"86,0714500,"FORCEPART ENGINEERING LIMITED
科栢工程有限公司",2000-05-03,2005-02-08,"Private, ltd by shares"87,0714568,"FRANCE SPRINGLAND COSMETICS (HK) LIMITED
法國春浪化妝品(香港)有限公司",2000-05-03,2005-05-06,"Private, ltd by shares"88,0714700,"FRANCE TOPAZ HONG KONG INTERNATIONAL CO., LIMITED
法國都彭香港國際有限公司",2000-05-03,2004-12-31,"Private, ltd by shares"89,0714759,"FRANCE VIOLET HONG KONG INTERNATIONAL CO., LIMITED
法國聖羅蘭香港國際有限公司",2000-05-03,2006-09-15,"Private, ltd by shares"90,0714654,"FRUIT WEEKLY ONLINE LIMITED
生果周刊在線有限公司",2000-05-03,2002-12-20,"Private, ltd by shares"91,0714782,"FULL SPEED TRANS &amp; EXPRESS LIMITED
全通運輸速遞有限公司",2000-05-03,2006-09-15,"Private, ltd by shares"92,0714767,"FUNG TAT ELECTRICAL ENGINEERING COMPANY LIMITED
豐達機電工程有限公司",2000-05-03,,"Private, ltd by shares"93,0714726,"GENERAL MARINE SHIPPING ENTERPRISES CO., LIMITED
通運船務企業有限公司",2000-05-03,2014-09-05,"Private, ltd by shares"94,0714673,"GERMANY OUTLONG GROUP (ASIA) LIMITED
德國奧特龍集團(亞洲)有限公司",2000-05-03,2005-05-06,"Private, ltd by shares"95,0714585,"GLOBAL MIGRATION CONSULTANTS LIMITED
穗文移民顧問有限公司",2000-05-03,,"Private, ltd by shares"96,0714520,"GLOBAL REGAL LIMITED
景遠有限公司",2000-05-03,,"Private, ltd by shares"97,0714526,"GLOBAL UNITED LOGISTIC OCEAN (HK) LIMITED
環球聯運物流船務香港有限公司",2000-05-03,2005-05-06,"Private, ltd by shares"98,0714486,"GLOCAL HONG KONG LIMITED
環球(香港)研究開發有限公司",2000-05-03,,"Private, ltd by shares"99,0714671,"GO-MOBILEDATA LIMITED
中滙動力有限公司",2000-05-03,2003-11-21,"Private, ltd by shares"100,0714488,"GOLD FOREX HOLDINGS LIMITED
金威盈集團有限公司",2000-05-03,2005-05-06,"Private, ltd by shares"101,0714681,"GOLDCOP INT'L GROUP INVESTMENT LIMITED
金業國際集團投資有限公司",2000-05-03,2005-05-06,"Private, ltd by shares"102,0714549,"GOLDEN CASTLE TRANSPORTATION COMPANY LIMITED
金堡貨運有限公司",2000-05-03,,"Private, ltd by shares"103,0714507,"GOLDEN SUN INDUSTRIAL LIMITED
金日實業有限公司",2000-05-03,,"Private, ltd by shares"104,0714690,"GOLDEN VICTORY INVESTMENT LIMITED (d2006-09-15)
金裕豐投資有限公司",2000-05-03,2006-09-15,"Private, ltd by shares"105,0714748,"GOLDEN WEALTHY ENTERPRISES LIMITED
金豐裕企業有限公司",2000-05-03,2017-08-11,"Private, ltd by shares"106,0714746,"GOMAX INTERNATIONAL LIMITED
金豐裕國際有限公司",2000-05-03,2001-10-12,"Private, ltd by shares"107,0714682,"GOODWILL (H.K.) ELECTRONIC LIMITED
香港吉電行電子有限公司",2000-05-03,2005-05-06,"Private, ltd by shares"108,0714527,"GOTHAM CITY MANAGEMENT LIMITED
高合城管理有限公司",2000-05-03,2020-09-21,"Private, ltd by shares"109,0714686,"GRAND LINK INTERNATIONAL LIMITED",2000-05-03,2008-09-19,"Private, ltd by shares"110,0714581,"GUANGZHOU ALUMINIUM FLURO-CARBON COATED LIMITED
廣鋁噴塗專業有限公司",2000-05-03,,"Private, ltd by shares"111,0714719,"GUMP &amp; COMPANY (H.K.) LIMITED",2000-05-03,2005-05-06,"Private, ltd by shares"112,0714643,"H.K. HUAXIA NATION LOCAL CONDITIONS &amp; CUSTOMS MAGAZINE LIMITED
香港華夏民族風情刊雜誌有限公司",2000-05-03,2006-09-15,"Private, ltd by shares"113,0714644,"H.K. WEIDRGON INDUSTRY INT'L GROUP LIMITED
香港威龍實業國際集團有限公司",2000-05-03,2005-05-06,"Private, ltd by shares"114,0714756,"HI-Q FACILITIES CARE LIMITED
雅喬設備維新有限公司",2000-05-03,,"Private, ltd by shares"115,0714572,"HING WOO FOOD COMPANY LIMITED
興和食品有限公司",2000-05-03,2015-12-31,"Private, ltd by shares"116,0714562,"HK CARDINBO (INT'L) GROUP LIMITED
香港卡登堡(國際)集團有限公司",2000-05-03,2017-12-08,"Private, ltd by shares"117,0714567,"HK COMET ELECTRON (GROUP) LIMITED
香港科密電子(集團)有限公司",2000-05-03,2013-06-21,"Private, ltd by shares"118,0714563,"HK DUNO (INT'L) GROUP FASHION LIMITED
香港敦奴(國際)集團時裝有限公司",2000-05-03,2016-11-25,"Private, ltd by shares"119,0714561,"HK GROCODILEKING DRESS INT'L GROUP LIMITED
香港鱷王服飾國際集團有限公司",2000-05-03,2005-05-06,"Private, ltd by shares"120,0714578,"HK HANSEN (INT'L) GROUP DRESS LIMITED
香港漢森(國際)集團服飾有限公司",2000-05-03,2005-05-06,"Private, ltd by shares"121,0714566,"HK JOYS COSMETICS INT'L LIMITED
香港潔麗詩化妝品國際有限公司",2000-05-03,2005-05-06,"Private, ltd by shares"122,0714713,"HK LI'S WINNER (INT'L) GROUP LIMITED
香港李寶贏堂(國際)集團有限公司",2000-05-03,,"Private, ltd by shares"123,0714776,"HK RICHBOSS FURNITURE INT'L GROUP LIMITED
香港裕寶家俬國際集團有限公司",2000-05-03,2006-09-15,"Private, ltd by shares"124,0714715,"HK SHAKESPEARE INT'L DEV. LIMITED
香港莎士比亞國際發展有限公司",2000-05-03,2005-05-06,"Private, ltd by shares"125,0714579,"HK SONY INT'L ELECTRICIAN GROUP LIMITED
香港索尼國際電工集團有限公司",2000-05-03,2003-04-04,"Private, ltd by shares"126,0714656,"HKGAL ONLINE LIMITED
東方美色在線有限公司",2000-05-03,2005-05-06,"Private, ltd by shares"127,0714570,"HONG KONG CHINA SMARTLINK LIMITED
中港聯通有限公司",2000-05-03,2005-04-01,"Private, ltd by shares"128,0714752,"HONG KONG CHINA TTN.COM LIMITED
香港中華旅遊商貿網有限公司",2000-05-03,2003-10-17,"Private, ltd by shares"129,0714646,"HONG KONG HONG KAI ELECTRON INDUSTRIAL LIMITED
香港虹凱電子實業有限公司",2000-05-03,2006-01-06,"Private, ltd by shares"130,0714637,"HONG KONG SANXIN LIMITED
香港三信貿易有限公司",2000-05-03,,"Private, ltd by shares"131,0714697,"HONG KONG STDA OIL CO., LIMITED
香港思達油業有限公司",2000-05-03,2006-09-15,"Private, ltd by shares"132,0714627,"HONG KONG TONGBEI SYSTEM LIMITED
香港通貝系統有限公司",2000-05-03,2002-12-13,"Private, ltd by shares"133,0714502,"HONG KONG WORLD PREDICTABLE ASSOCIATION LIMITED
香港世界預測家協會有限公司",2000-05-03,2012-07-13,"Private, ltd by shares"134,0714645,"HONG KONG YOMEBO INTERNATIONAL INDUSTRY LIMITED
香港伊美堂國際實業有限公司",2000-05-03,2005-05-06,"Private, ltd by shares"135,0714771,"HONG KONG YUCHAI INTERNATIONAL LIMITED
香港玉柴國際有限公司",2000-05-03,2002-03-01,"Private, ltd by shares"136,0714778,"HONLOCKS PHARMACEUTICAL COMPANY LIMITED
香港康樂氏製藥有限公司",2000-05-03,2008-10-03,"Private, ltd by shares"137,0714764,"HUANG'S MEDICINE (H.K.) LIMITED
黃家醫圈(香港)藥業有限公司",2000-05-03,2002-01-11,"Private, ltd by shares"138,0714497,"HUNG CHEONG PLASTIC LIMITED
雄昌膠皮有限公司",2000-05-03,2006-09-08,"Private, ltd by shares"139,0714551,"I T SYSTEMS LIMITED (d2006-01-06)
聯技系統有限公司",2000-05-03,2006-01-06,"Private, ltd by shares"140,0714669,"ICALL CHINA HOLDINGS CO. LIMITED",2000-05-03,2016-09-09,"Private, ltd by shares"141,0714753,"ICING INTERNATIONAL LIMITED",2000-05-03,2005-05-06,"Private, ltd by shares"142,0714650,"ICOMMERCE.COM.HK LIMITED",2000-05-03,,"Private, ltd by shares"143,0714793,"IEMARKET.NET LIMITED
釋貿商聯科技有限公司",2000-05-03,2005-09-09,"Private, ltd by shares"144,0714495,"IMPACT PRINTSHOP LIMITED (THE)
登峰印刷室有限公司",2000-05-03,,"Private, ltd by shares"145,0714706,"INKEL INTERNATIONAL GROUP LIMITED
英傑國際集團有限公司",2000-05-03,2009-07-10,"Private, ltd by shares"146,0714792,"INNOAGE HONG KONG LIMITED",2000-05-03,2008-09-05,"Private, ltd by shares"147,0714529,"INNOVIN LIMITED",2000-05-03,,"Private, ltd by shares"148,0714720,"INTERNATIONAL (HONG KONG) SHEN DA MEDICAL TREATMENT &amp; ELECTRON LIMITED
國際(香港)信達醫療電子有限公司",2000-05-03,2005-05-06,"Private, ltd by shares"149,0714607,"INTERNATIONAL BUILDING TECHNOLOGIES LIMITED
國際建築科技有限公司",2000-05-03,2005-03-18,"Private, ltd by shares"150,0714550,"IPEOPLE CONSULTANTS LIMITED
科賢顧問有限公司",2000-05-03,2005-10-07,"Private, ltd by shares"151,0714543,"ITAL DESIGNS LIMITED
意庭傢具有限公司",2000-05-03,2015-01-02,"Private, ltd by shares"152,0714789,"ITROUTE LIMITED (d2002-11-22)",2000-05-03,2002-11-22,"Private, ltd by shares"153,0714605,"JACKSON DENTAL SUPPLIES LIMITED (d2009-09-25)
正新牙科器材有限公司",2000-05-03,2009-09-25,"Private, ltd by shares"154,0714530,"JC. WATSON TECHNOLOGY COMPANY LIMITED
寶隆科技有限公司",2000-05-03,2017-03-03,"Private, ltd by shares"155,0714661,"JESSICA ONLINE LIMITED",2000-05-03,2002-05-17,"Private, ltd by shares"156,0714571,"JET UNION (HONG KONG) LIMITED
展潤(香港)有限公司",2000-05-03,2002-06-21,"Private, ltd by shares"157,0714610,"JIA INTERNATIONAL LIMITED
智家有限公司",2000-05-03,,"Private, ltd by shares"158,0714687,"JOINT FORTUNE INTERNATIONAL LIMITED (d2011-12-09)
順滙國際有限公司",2000-05-03,2011-12-09,"Private, ltd by shares"159,0714784,"JWE COMPANY LIMITED
崇維企業有限公司",2000-05-03,2019-10-11,"Private, ltd by shares"160,0714786,"KAI TAI JEWELLERY POLISHING LIMITED
啓泰電金有限公司",2000-05-03,,"Private, ltd by shares"161,0714521,"KAI YIP (HONG KONG) INDUSTRIAL COMPANY LIMITED
佳業(香港)實業有限公司",2000-05-03,,"Private, ltd by shares"162,0714765,"KARSON CIRCUITS (HONG KONG) LIMITED
嘉順電路板(香港)有限公司",2000-05-03,2003-11-28,"Private, ltd by shares"163,0714712,"KEHONG INDUSTRY &amp; COMMERCE LIMITED
香港科宏實業有限公司",2000-05-03,,"Private, ltd by shares"164,0714737,"KENTER SHIPPING COMPANY LIMITED
廣達船務(香港)有限公司",2000-05-03,,"Private, ltd by shares"165,0714664,"KICK ONLINE LIMITED",2000-05-03,2003-03-07,"Private, ltd by shares"166,0714575,"KIETEX (HK) LIMITED
凱穎(香港)有限公司",2000-05-03,2002-06-14,"Private, ltd by shares"167,0714773,"KINGTOP INTERNATIONAL GROUP LIMITED
尖峰國際集團有限公司",2000-05-03,,"Private, ltd by shares"168,0714546,"KO FAI TRANSPORTATION COMPANY LIMITED
高輝運輸有限公司",2000-05-03,,"Private, ltd by shares"169,0714732,"KOSMETIK LIMITED
肌麗延有限公司",2000-05-03,2016-04-29,"Private, ltd by shares"170,0714718,"KWONG KEUNG TRANSPORTATION TRADING COMPANY LIMITED
廣強運輸貿易有限公司",2000-05-03,,"Private, ltd by shares"171,0714734,"L. C. BRIDGEWISE COMPANY LIMITED
橋浩有限公司",2000-05-03,,"Private, ltd by shares"172,0714508,"LAMINAR INDUSTRY LIMITED",2000-05-03,2001-05-04,"Private, ltd by shares"173,0714640,"LANQI INTERNATIONAL (H.K.) LIMITED
蘭琦國際(香港)有限公司",2000-05-03,,"Private, ltd by shares"174,0714698,"LAP CHUEN SCAFFOLDING LIMITED
立存棚業有限公司",2000-05-03,2005-09-09,"Private, ltd by shares"175,0714725,"LEAPONT METAL MATERIALS COMPANY LIMITED
聯邦五金材料有限公司",2000-05-03,2009-03-13,"Private, ltd by shares"176,0714504,"LEGEND CENTRE LIMITED
傳奇世界有限公司",2000-05-03,2006-09-15,"Private, ltd by shares"177,0714517,"LEGEND LAND LIMITED (d2005-11-18)
晉立有限公司",2000-05-03,2005-11-18,"Private, ltd by shares"178,0714594,"LEKA LIMITED
利加有限公司",2000-05-03,,"Private, ltd by shares"179,0714552,"LEVIN DEVELOPMENTS LIMITED
力鋒發展有限公司",2000-05-03,2005-05-06,"Private, ltd by shares"180,0714667,"LISA ONLINE LIMITED
味道在線有限公司",2000-05-03,2002-05-17,"Private, ltd by shares"181,0714580,"LITTAUER TECHNOLOGIES (HONG KONG) LIMITED",2000-05-03,,"Private, ltd by shares"182,0714779,"LTG HONG KONG LIMITED",2000-05-03,2008-06-20,"Private, ltd by shares"183,0714621,"LUCKY DEER INDUSTRIAL CO., LIMITED
瑞陸實業有限公司",2000-05-03,2012-07-13,"Private, ltd by shares"184,0714596,"LUCKY TRANSPORTATION COMPANY LIMITED
佳運運輸有限公司",2000-05-03,,"Private, ltd by shares"185,0714636,"LUSA HONG KONG LIMITED",2000-05-03,2005-04-22,"Private, ltd by shares"186,0714635,"MA WAN DRAGONS CONSULTANCY COMPANY LIMITED (THE)
馬灣景龍顧問有限公司",2000-05-03,2009-07-10,"Private, ltd by shares"187,0714617,"MACRO TRADING INTERNATIONAL LIMITED
宏力國際貿易有限公司",2000-05-03,2002-07-19,"Private, ltd by shares"188,0714638,"MAGICALLY (HONG KONG) LIMITED",2000-05-03,2002-01-04,"Private, ltd by shares"189,0714717,"MAP TECHNOLOGIES LIMITED
萬普科技有限公司",2000-05-03,2006-09-15,"Private, ltd by shares"190,0714662,"MARIEHK ONLINE LIMITED",2000-05-03,2002-12-20,"Private, ltd by shares"191,0714702,"MASTER CLEAN SERVICE LIMITED
宏潔服務有限公司",2000-05-03,,"Private, ltd by shares"192,0714703,"MEDIO SYSTEMS ASIA PACIFIC, LIMITED",2000-05-03,2001-06-22,"Private, ltd by shares"193,0714705,"METAL RECYCLERS.COM LIMITED",2000-05-03,2010-12-17,"Private, ltd by shares"194,0714642,"MIDLAND LEASING MANAGEMENT (VI) LIMITED
美聯租務管理(六)有限公司",2000-05-03,,"Private, ltd by shares"195,0714691,"MILLION TECH INVESTMENT LIMITED
億科投資有限公司",2000-05-03,2014-09-27,"Private, ltd by shares"196,0714761,"MING LEE SHIP YARD LIMITED
明利船排廠有限公司",2000-05-03,,"Private, ltd by shares"197,0714634,"MOBIUS INTERNATIONAL LIMITED (d2012-09-07)
翔和國際有限公司",2000-05-03,2012-09-07,"Private, ltd by shares"198,0714747,"MUI MUSIC ENTERTAINMENT LIMITED",2000-05-03,2013-03-01,"Private, ltd by shares"199,0714576,"N &amp; N INTERNATIONAL LIMITED (d2003-09-05)
泓欣國際有限公司",2000-05-03,2003-09-05,"Private, ltd by shares"200,0714573,"NETEZ TECHNOLOGY LIMITED
易聯網有限公司",2000-05-03,,"Private, ltd by shares"201,0714506,"NEW PROSPEROUS ASIA DEVELOPMENT LIMITED
新亞洲鑫源得開發有限公司",2000-05-03,2004-03-05,"Private, ltd by shares"202,0714728,"NEW SILVER DEVELOPMENT (HK) LIMITED
新聲發展(香港)有限公司",2000-05-03,2001-09-14,"Private, ltd by shares"203,0714714,"NEW ZONE ENTERPRISE LIMITED
盈訊拓展企業有限公司",2000-05-03,2011-01-21,"Private, ltd by shares"204,0714708,"NEWERTECH INTERNATIONAL LIMITED
利雅達國際有限公司",2000-05-03,2003-08-29,"Private, ltd by shares"205,0714519,"NEWJOY INDUSTRIAL LIMITED
新樂實業有限公司",2000-05-03,2005-05-06,"Private, ltd by shares"206,0714766,"NEXLAND ASIA LIMITED",2000-05-03,2006-11-10,"Private, ltd by shares"207,0714555,"NIKKOSHI (HONG KONG) CO. LIMITED
尼高希(香港)有限公司",2000-05-03,,"Private, ltd by shares"208,0714670,"NINE-EIGHT ORIGIN NET LABORATORY LIMITED
萊茵特原創網絡實驗室有限公司",2000-05-03,2005-05-06,"Private, ltd by shares"209,0714629,"ONNY LIMITED
安愉有限公司",2000-05-03,,"Private, ltd by shares"210,0714589,"ORIENTAL CAPITAL ADVISORS LIMITED
東方企業資產托管經營(香港)有限公司",2000-05-03,2005-05-06,"Private, ltd by shares"211,0714588,"P &amp; L MANAGEMENT LIMITED
百樂管理有限公司",2000-05-03,,"Private, ltd by shares"212,0714655,"PCXPRESS ONLINE LIMITED
電腦快周在線有限公司",2000-05-03,2002-12-20,"Private, ltd by shares"213,0714739,"PEARL RIVER DELTA LOGISTICS DEVELOPMENT LIMITED
珠江三角洲物流發展有限公司",2000-05-03,,"Private, ltd by shares"214,0714625,"PETRA CAPITAL (HK) LIMITED",2000-05-03,2002-10-04,"Private, ltd by shares"215,0714574,"PHOTO CURE CO., LIMITED
連陸貿易有限公司",2000-05-03,2009-10-23,"Private, ltd by shares"216,0714740,"PIEMONTESE INTERNATIONAL GROUP LIMITED
皮埃蒙特國際集團有限公司",2000-05-03,2003-05-02,"Private, ltd by shares"217,0714559,"PIK WAH SHELL BUTTON FACTORY LIMITED
碧華貝殼鈕廠有限公司",2000-05-03,2014-07-25,"Private, ltd by shares"218,0714622,"PM INTERNATIONAL LIMITED (d2011-04-11)
浩宇國際實業有限公司",2000-05-03,2011-04-11,"Private, ltd by shares"219,0714491,"POINT MARKETING COMMUNICATIONS LIMITED
一點策劃市場推廣有限公司",2000-05-03,2003-08-22,"Private, ltd by shares"220,0714787,"POWERFUL ELECTRICAL ENGINEERING COMPANY LIMITED (d2005-06-30)
力進機電工程有限公司",2000-05-03,2005-06-30,"Private, ltd by shares"221,0714514,"PRINTEC HONG KONG LIMITED
大松香港有限公司",2000-05-03,2006-01-06,"Private, ltd by shares"222,0714524,"PRO-FIRE LIMITED
專業防火有限公司",2000-05-03,,"Private, ltd by shares"223,0714744,"PROFIT WIN HOLDINGS LIMITED (d2003-06-06)
富永集團有限公司",2000-05-03,2003-06-06,"Private, ltd by shares"