,Reg no.,Name,Incorp-orated,Dissolved,Type224,0714790,"PUBLISHINGONLINE.COM (ASIA) LIMITED
博文網上出版(亞洲)有限公司",2000-05-03,2005-05-06,"Private, ltd by shares"225,0714494,"QM AUTOMOBILE COMPANY LIMITED
敏捷電動車有限公司",2000-05-03,2002-03-28,"Private, ltd by shares"226,0714511,"QM TRANSISTOR COMPANY LIMITED
敏捷半導體有限公司",2000-05-03,2002-07-12,"Private, ltd by shares"227,0714699,"RADIONIC HONG KONG LIMITED",2000-05-03,2014-09-26,"Private, ltd by shares"228,0714704,"REGAL PACIFIC TRADING LIMITED
盈高貿易服務有限公司",2000-05-03,2002-05-31,"Private, ltd by shares"229,0714796,"RENEX TECHNOLOGY LIMITED
夏瑞科技股份有限公司",2000-05-03,,"Private, ltd by shares"230,0714760,"RES LIMITED
環卓有限公司",2000-05-03,2009-09-18,"Private, ltd by shares"231,0714544,"RICH SHINE ENGINEERING COMPANY LIMITED
振強工程有限公司",2000-05-03,2002-11-15,"Private, ltd by shares"232,0714547,"RICH WEALTH INTERNATIONAL INDUSTRIAL LIMITED
裕亨國際實業有限公司",2000-05-03,,"Private, ltd by shares"233,0714560,"RIVER TRADING COMPANY LIMITED
麗華貿易有限公司",2000-05-03,,"Private, ltd by shares"234,0714775,"RONSON INDUSTRIAL COMPANY LIMITED
昇龍實業有限公司",2000-05-03,2005-05-06,"Private, ltd by shares"235,0714769,"ROWSUN ENVIRONMENT &amp; ENERGY GROUP CO., LIMITED
榮盛環能科技集團有限公司",2000-05-03,2017-04-28,"Private, ltd by shares"236,0714601,"S. A. R. SYSTEM AND ENGINEERING LIMITED
旭霆專業工程有限公司",2000-05-03,2006-01-13,"Private, ltd by shares"237,0714631,"SANTOS HK LIMITED
宏浚香港有限公司",2000-05-03,2009-12-04,"Private, ltd by shares"238,0714541,"SANWA ENGINEERING LIMITED
三和電訊工程有限公司",2000-05-03,,"Private, ltd by shares"239,0714711,"SCK (CHINA) LIMITED",2000-05-03,2001-10-19,"Private, ltd by shares"240,0714755,"SHING FAI MOTORS COMPANY LIMITED
盛輝汽車有限公司",2000-05-03,2004-06-11,"Private, ltd by shares"241,0714633,"SHUN TAK TECHNOLOGY VENTURES HOLDINGS LIMITED
信德科技投資有限公司",2000-05-03,,"Private, ltd by shares"242,0714597,"SILVER TARGET PROPERTIES LIMITED
兆達置業有限公司",2000-05-03,2004-09-30,"Private, ltd by shares"243,0714736,"SIM FAR EAST LIMITED",2000-05-03,2011-01-28,"Private, ltd by shares"244,0714628,"SINOWIN BAGS FACTORY LIMITED
星威手袋廠有限公司",2000-05-03,2006-09-29,"Private, ltd by shares"245,0714798,"SIPIX GROUP (ASIA PACIFIC) LIMITED
矽峰集團(亞太)有限公司",2000-05-03,2005-08-05,"Private, ltd by shares"246,0714692,"SKY LINK INVESTMENT LIMITED
廣天投資有限公司",2000-05-03,,"Private, ltd by shares"247,0714694,"SKY PACIFIC (HONG KONG) LIMITED (d2001-11-23)
盛天(香港)有限公司",2000-05-03,2001-11-23,"Private, ltd by shares"248,0714583,"SKYSCRAPER DEVELOPMENT COMPANY LIMITED
捷達集團發展有限公司",2000-05-03,2005-07-22,"Private, ltd by shares"249,0714749,"SMART BASE ENTERPRISES LIMITED (d2007-09-14)
英耀企業有限公司",2000-05-03,2007-09-14,"Private, ltd by shares"250,0714577,"SMART KIDS NETWORK LIMITED
卓智網絡有限公司",2000-05-03,2003-10-03,"Private, ltd by shares"251,0714688,"SMART LINK INVESTMENT LIMITED
志宏投資有限公司",2000-05-03,2014-06-06,"Private, ltd by shares"252,0714684,"SMART VICTORY HOLDINGS LIMITED
進豪集團有限公司",2000-05-03,,"Private, ltd by shares"253,0714797,"SOILMEC (H.K.) LIMITED",2000-05-03,,"Private, ltd by shares"254,0714620,"SOLITAIRE LAND LIMITED (d2011-09-16)",2000-05-03,2011-09-16,"Private, ltd by shares"255,0714668,"SOUTH CHINA MEDIA ONLINE MANAGEMENT LIMITED
南華傳媒在線管理有限公司",2000-05-03,2002-12-20,"Private, ltd by shares"256,0714774,"SPORT SOURCES (HK) INT'L NETWORK LIMITED
體育資源(香港)國際網絡有限公司",2000-05-03,2006-09-15,"Private, ltd by shares"257,0714557,"SPORT-TECH INDUSTRIAL COMPANY LIMITED
創興運動用品有限公司",2000-05-03,,"Private, ltd by shares"258,0714632,"STANDARD CONCORD INVESTMENT LIMITED
達和投資有限公司",2000-05-03,2002-02-15,"Private, ltd by shares"259,0714649,"STAR DESIGN LIMITED",2000-05-03,,"Private, ltd by shares"260,0714680,"STAR TARGET (HONG KONG) LIMITED
星達(香港)有限公司",2000-05-03,2001-09-14,"Private, ltd by shares"261,0714652,"STARTOWN HK LIMITED",2000-05-03,,"Private, ltd by shares"262,0714707,"STARWEB INTERNATIONAL LIMITED
星域數碼國際有限公司",2000-05-03,2006-01-06,"Private, ltd by shares"263,0714553,"STYLE4HOUSE.COM LIMITED
形世居有限公司",2000-05-03,2004-06-11,"Private, ltd by shares"264,0714513,"SUM KEE WATER-PIPE DRAINAGE LIMITED
森記水喉渠務有限公司",2000-05-03,2012-07-13,"Private, ltd by shares"265,0714751,"SUN WAH MEDIA HOLDINGS LIMITED
新華傳媒集團有限公司",2000-05-03,,"Private, ltd by shares"266,0714785,"SUNDA SHIPPING COMPANY LIMITED
順達船務有限公司",2000-05-03,2008-10-17,"Private, ltd by shares"267,0714487,"SUNNYVISION LIMITED
新力訊有限公司",2000-05-03,,"Private, ltd by shares"268,0714730,"SUPERCATZ PROMOTIONS (HONG KONG) LIMITED",2000-05-03,2002-04-19,"Private, ltd by shares"269,0714772,"SW ASSET MANAGEMENT LIMITED
新華資產管理有限公司",2000-05-03,2015-12-11,"Private, ltd by shares"270,0714606,"SYNCO TECH COMPANY LIMITED
先高達有限公司",2000-05-03,2006-06-02,"Private, ltd by shares"271,0714522,"TA SHING PAPER PRODUCTS &amp; PRINTING LIMITED
達成紙品印刷有限公司",2000-05-03,2014-09-12,"Private, ltd by shares"272,0714735,"TEBCO PTY LIMITED",2000-05-03,2009-12-18,"Private, ltd by shares"273,0714490,"TECHJET INDUSTRIAL SUPPLIES LIMITED
德捷工貿有限公司",2000-05-03,,"Private, ltd by shares"274,0714783,"TECHWIDE TECHNOLOGY LIMITED
創庫科技有限公司",2000-05-03,2006-09-15,"Private, ltd by shares"275,0714548,"TENRYU INVESTMENT COMPANY LIMITED",2000-05-03,2006-01-06,"Private, ltd by shares"276,0714665,"THREE WEEKLY ONLINE LIMITED
三周刊在線有限公司",2000-05-03,2002-12-20,"Private, ltd by shares"277,0714592,"TIANJIAN INTERNATIONAL LIMITED (d2008-10-17)
天鍵國際有限公司",2000-05-03,2008-10-17,"Private, ltd by shares"278,0714533,"TIME DESTINY LIMITED
時毅有限公司",2000-05-03,,"Private, ltd by shares"279,0714781,"TOWARD INDUSTRIAL CO., LIMITED
拓緯實業有限公司",2000-05-03,,"Private, ltd by shares"280,0714721,"TRADEPOWER ENTERPRISES LIMITED
盈泰企業有限公司",2000-05-03,2003-03-21,"Private, ltd by shares"281,0714799,"TRICOR CORPORATE SECRETARY LIMITED",2000-05-03,,"Private, ltd by shares"282,0714600,"TRUMP POWER (HONG KONG) LIMITED
正力(香港)有限公司",2000-05-03,2005-09-23,"Private, ltd by shares"283,0714701,"TTK CORPORATION LIMITED
盈滙亞洲有限公司",2000-05-03,2006-09-15,"Private, ltd by shares"284,0714757,"TUNG FA INDUSTRIAL (HONG KONG) LIMITED
同發實業(香港)有限公司",2000-05-03,,"Private, ltd by shares"285,0714639,"U.S.A. WAIER HOLDINGS LIMITED
美國威爾集團有限公司",2000-05-03,2015-12-24,"Private, ltd by shares"286,0714609,"UNI-CYBER INTERNATIONAL LIMITED
環球數碼國際有限公司",2000-05-03,2005-05-06,"Private, ltd by shares"287,0714742,"UNIBEAN SYSTEM LIMITED",2000-05-03,2001-12-28,"Private, ltd by shares"288,0714558,"UNICOMMU ADVERTISING LIMITED
尊美廣告有限公司",2000-05-03,2009-06-04,"Private, ltd by shares"289,0714647,"UNION FAVOUR (HONG KONG) LIMITED
和發(香港)有限公司",2000-05-03,2004-10-29,"Private, ltd by shares"290,0714590,"UNIVERSAL CATERING MARKETING AND DEVELOPMENT CONSULTANCY COMPANY LIMITED
環球飲食策略發展有限公司",2000-05-03,2005-05-06,"Private, ltd by shares"291,0714584,"UNIVERSAL PATISSERIE MANAGEMENT CONSULTANCY COMPANY LIMITED
環球飲食烘焙顧問有限公司",2000-05-03,2011-03-16,"Private, ltd by shares"292,0714535,"UP-BUZ INTERNATIONAL HOLDING LIMITED
建業集團國際控股有限公司",2000-05-03,2007-09-21,"Private, ltd by shares"293,0714564,"USA APPLE (HK) INT'L LIMITED
美國蘋果(香港)國際有限公司",2000-05-03,2004-07-30,"Private, ltd by shares"294,0714569,"V-GLOBAL GROUP (HK) INT'L DRESS LIMITED
凱球集團(香港)國際服飾有限公司",2000-05-03,2006-09-15,"Private, ltd by shares"295,0714777,"VESCOM HONG KONG LIMITED
宏歷香港有限公司",2000-05-03,,"Private, ltd by shares"296,0714678,"VICTORY SHEEN PROPERTIES LIMITED
凱順置業有限公司",2000-05-03,2009-09-25,"Private, ltd by shares"297,0714623,"VIGOUR INTERNATIONAL (HK) LIMITED
聯盛國際(香港)有限公司",2000-05-03,2017-09-22,"Private, ltd by shares"298,0714611,"VINDA INTERNATIONAL LIMITED
科達國際有限公司",2000-05-03,2008-10-17,"Private, ltd by shares"299,0714613,"VISION ON-LINE LIMITED
裕科互聯有限公司",2000-05-03,2007-10-26,"Private, ltd by shares"300,0714493,"WAIPOLON INTERNATIONAL LIMITED
慧寶龍國際有限公司",2000-05-03,2018-12-07,"Private, ltd by shares"301,0714498,"WAIS ENGINEERING COMPANY LIMITED
偉斯工程有限公司",2000-05-03,,"Private, ltd by shares"302,0714599,"WATER LOTUS CHINAWARE MADING LIMITED
出水蓮陶瓷製作有限公司",2000-05-03,2005-05-06,"Private, ltd by shares"303,0714723,"WEALTH STRONG ENTERPRISES LIMITED
創成業有限公司",2000-05-03,2002-02-15,"Private, ltd by shares"304,0714658,"WHIZ-KIDS ONLINE LIMITED
兒童快報在線有限公司",2000-05-03,2002-12-20,"Private, ltd by shares"305,0714791,"WINETSU.COM LIMITED",2000-05-03,2005-01-14,"Private, ltd by shares"306,0714542,"WING KEE CONSTRUCTION ENGINEERING LIMITED
永基建築工程有限公司",2000-05-03,2002-04-04,"Private, ltd by shares"307,0714528,"WIRE INTERNATIONAL INFORMATION TECHNOLOGY CORPORATION LIMITED
緯亞國際資訊科技有限公司",2000-05-03,2006-01-06,"Private, ltd by shares"308,0714604,"WORLDNET INTERNATIONAL DEVELOPMENT LIMITED
和昇國際發展有限公司",2000-05-03,2004-07-16,"Private, ltd by shares"309,0714603,"XMATRIX LIMITED (d2001-10-12)
雋藝有限公司",2000-05-03,2001-10-12,"Private, ltd by shares"310,0714709,"Y. T. CENTURY INTERNATIONAL LIMITED
盈天世紀國際有限公司",2000-05-03,2005-05-06,"Private, ltd by shares"311,0714565,"YIPENG INT'L GROUP LIMITED
翊蓬國際集團有限公司",2000-05-03,2005-05-06,"Private, ltd by shares"312,0714641,"YORK ISLAND (CHINA) LIMITED
沃域(中國)有限公司",2000-05-03,2006-09-15,"Private, ltd by shares"313,0714489,"ZAMBRA INTERNATIONAL LIMITED",2000-05-03,,"Private, ltd by shares"314,0714587,"ZHENG YUAN TANG HERBAL MEDICINE LIMITED
正元堂醫藥有限公司",2000-05-03,2008-08-15,"Private, ltd by shares"