,Reg no.,Name,Incorp-orated,Dissolved,Type1,0133006,"838 RECREATION ASSOCIATION LIMITED
838聯誼會有限公司",1984-02-10,1996-10-25,"Ltd by guarantee"2,0133139,"A. V. E. LIMITED
錄音錄影自動設備有限公司",1984-02-10,,"Private, ltd by shares"3,0133032,"ALAMINOS LIMITED",1984-02-10,2003-02-21,"Private, ltd by shares"4,0133049,"ALL FINE COMPANY LIMITED",1984-02-10,1991-11-06,"Private, ltd by shares"5,0133132,"ALLERBY LIMITED",1984-02-10,1990-11-30,"Private, ltd by shares"6,0133121,"ALTEC QUARTZ WATCH INDUSTRY LIMITED
雅達石英錶業有限公司",1984-02-10,2015-05-08,"Private, ltd by shares"7,0133160,"AMTECH COMPUTERS &amp; ELECTRONICS (H.K.) LIMITED
金廸電子有限公司",1984-02-10,1997-08-22,"Private, ltd by shares"8,0133172,"APRGROUP LIMITED",1984-02-10,2008-07-11,"Private, ltd by shares"9,0133159,"ARTI-CREATION DESIGN &amp; PRINTING LIMITED",1984-02-10,1997-04-25,"Private, ltd by shares"10,0133088,"BEAUTY CROWN GARMENT FACTORY COMPANY LIMITED
麗展製衣廠有限公司",1984-02-10,,"Private, ltd by shares"11,0133098,"BEAUTY SHINE COMPANY LIMITED
銀彩有限公司",1984-02-10,2003-08-15,"Private, ltd by shares"12,0133145,"BELLCILLE TRADING LIMITED
格成貿易有限公司",1984-02-10,1997-08-22,"Private, ltd by shares"13,0133072,"BEST BASE DEVELOPMENT LIMITED (d1996-06-28)
冠基發展有限公司",1984-02-10,1996-06-28,"Private, ltd by shares"14,0133074,"BONING INDUSTRIAL LIMITED
邦寧實業有限公司",1984-02-10,1991-09-27,"Private, ltd by shares"15,0133052,"BRIGHT MILD COMPANY LIMITED
明懿有限公司",1984-02-10,2003-05-30,"Private, ltd by shares"16,0133037,"BRONCO FASHION LIMITED
水之金有限公司",1984-02-10,1996-10-18,"Private, ltd by shares"17,0133136,"BSR INTERNATIONAL TRAVEL LIMITED
BSR國際旅遊有限公司",1984-02-10,2006-08-29,"Private, ltd by shares"18,0133013,"CANASIA CHEMICAL &amp; PHARMACEUTICAL CORPORATION LIMITED
加港醫化技術貿易發展有限公司",1984-02-10,2008-01-18,"Private, ltd by shares"19,0133118,"CENTRE FOR EDUCATION IN INFORMATION PROCESSING LIMITED",1984-02-10,1997-08-22,"Private, ltd by shares"20,0133048,"CHEER SKY COMPANY LIMITED",1984-02-10,2001-11-16,"Private, ltd by shares"21,0133069,"CHEERY FULL LIMITED",1984-02-10,,"Private, ltd by shares"22,0133096,"CHIEF FULL COMPANY LIMITED
捷滿有限公司",1984-02-10,2015-10-02,"Private, ltd by shares"23,0133094,"CITIMODE LIMITED
詩慕有限公司",1984-02-10,,"Private, ltd by shares"24,0133042,"CLUB DE ELYSEES LIMITED
典麗榭夜總會有限公司",1984-02-10,1999-09-10,"Private, ltd by shares"25,0133161,"CONJOINT EXPORT SERVICES (CHINA) LIMITED
康莊出口股務(中國)有限公司",1984-02-10,2009-05-15,"Private, ltd by shares"26,0133112,"CONSECTI CENTRUM LIMITED",1984-02-10,1998-12-15,"Private, ltd by shares"27,0133022,"CONSORTON TRADING LIMITED
確先達貿易有限公司",1984-02-10,,"Private, ltd by shares"28,0133155,"Credit Suisse First Boston (Japan) Limited",1984-02-10,2020-03-23,"Private, ltd by shares"29,0133009,"D &amp; B FILMS COMPANY LIMITED
德寶電影有限公司",1984-02-10,2014-01-03,"Private, ltd by shares"30,0133035,"David Chan's Family Holdings Limited
陳偉崇家族控股有限公司",1984-02-10,,"Private, ltd by shares"31,0133023,"DEEPPOWER INVESTMENTS LIMITED
雄威製品(線廠)有限公司",1984-02-10,1997-01-23,"Private, ltd by shares"32,0133073,"DOBO INDUSTRIAL LIMITED (d1993-10-05)
都寶實業有限公司",1984-02-10,1993-10-05,"Private, ltd by shares"33,0133125,"DRAGON WING COMPANY LIMITED
龍奕洋行有限公司",1984-02-10,,"Private, ltd by shares"34,0133053,"DUTA SARANA INTERNATIONAL HOLDINGS LIMITED",1984-02-10,1995-11-17,"Private, ltd by shares"35,0133091,"EASTERN BASE TEXTILES &amp; GARMENTS LIMITED
東基紡織品有限公司",1984-02-10,2001-11-16,"Private, ltd by shares"36,0133051,"ENGBRIGHT COMPANY LIMITED
錦麟有限公司",1984-02-10,2003-03-07,"Private, ltd by shares"37,0133047,"ENGUNION COMPANY LIMITED",1984-02-10,1999-10-14,"Private, ltd by shares"38,0133090,"EVER STAR COMPANY LIMITED
永彩有限公司",1984-02-10,1996-09-27,"Private, ltd by shares"39,0133156,"EVERT (NOMINEES) LIMITED",1984-02-10,,"Private, ltd by shares"40,0133157,"EVERT (SECRETARIES) LIMITED",1984-02-10,,"Private, ltd by shares"41,0133115,"EXPLORATIONS TRAVEL LIMITED
力行旅業有限公司",1984-02-10,1997-08-22,"Private, ltd by shares"42,0133059,"EXTEND RICH COMPANY LIMITED
衍榮有限公司",1984-02-10,,"Private, ltd by shares"43,0133110,"FASHION FRONT LINE HONG KONG LIMITED",1984-02-10,2012-02-24,"Private, ltd by shares"44,0133127,"FU HO KNITTING FACTORY LIMITED
富豪織造廠有限公司",1984-02-10,1997-08-22,"Private, ltd by shares"45,0133122,"FU KA LIN DEVELOPMENT (HOLDINGS) LIMITED
富格林發展(集團)有限公司",1984-02-10,1997-08-22,"Private, ltd by shares"46,0133079,"GERHAM LIMITED",1984-02-10,,"Private, ltd by shares"47,0133036,"GETWICK ENGINEERS LIMITED
佳域工程有限公司",1984-02-10,,"Private, ltd by shares"48,0133143,"GLEN GO COMPANY LIMITED
基高有限公司",1984-02-10,1990-01-30,"Private, ltd by shares"49,0133067,"GOLDEN GOAL LIMITED (d1996-09-27)
金易有限公司",1984-02-10,1996-09-27,"Private, ltd by shares"50,0133038,"GOOD VENTURE COMPANY LIMITED
天祿有限公司",1984-02-10,1996-10-18,"Private, ltd by shares"51,0133065,"GRAND HERO COMPANY LIMITED
驥傑有限公司",1984-02-10,1996-09-27,"Private, ltd by shares"52,0133061,"GREAT ENRICH LIMITED
驥富有限公司",1984-02-10,1996-07-26,"Private, ltd by shares"53,0133126,"GUY FENG TRADING COMPANY LIMITED",1984-02-10,1991-12-02,"Private, ltd by shares"54,0133016,"H.H.K. (HOLDINGS) COMPANY LIMITED
香港濱港(集團)有限公司",1984-02-10,,"Private, ltd by shares"55,0133133,"HANYUAN LIMITED",1984-02-10,1991-12-19,"Private, ltd by shares"56,0133044,"HARVEST BAGS MANUFACTORY LIMITED
華豐手袋廠有限公司",1984-02-10,2003-06-06,"Private, ltd by shares"57,0133142,"HI KO COMPANY LIMITED",1984-02-10,1994-01-21,"Private, ltd by shares"58,0133167,"HILL STREET BLUES LIMITED",1984-02-10,,"Private, ltd by shares"59,0133021,"HKFE CLEARING CORPORATION LIMITED
香港期貨結算有限公司",1984-02-10,,"Private, ltd by shares"60,0133135,"HOPKINSVILLE LIMITED",1984-02-10,1993-03-09,"Private, ltd by shares"61,0133102,"HUNAN TRAVEL AGENCY LIMITED
湖南旅行社有限公司",1984-02-10,1991-04-26,"Private, ltd by shares"62,0133111,"IGEDO LIMITED",1984-02-10,1998-12-09,"Private, ltd by shares"63,0133113,"IMOTEX LIMITED (d1998-12-09)",1984-02-10,1998-12-09,"Private, ltd by shares"64,0133174,"INTSIA INTERNATIONAL LIMITED",1984-02-10,1997-08-22,"Private, ltd by shares"65,0133162,"J &amp; R BOSSINI INTERNATIONAL LIMITED
堡獅龍國際有限公司",1984-02-10,,"Private, ltd by shares"66,0133106,"JENNY MANUFACTURING LIMITED",1984-02-10,,"Private, ltd by shares"67,0133093,"JOIN-BUILD INTERNATIONAL ENGINEERING LIMITED
和立國際工程有限公司",1984-02-10,2012-08-31,"Private, ltd by shares"68,0133024,"JUMBOVIEW INVESTMENTS LIMITED",1984-02-10,1996-10-18,"Private, ltd by shares"69,0133075,"JUNPOINT DEVELOPMENT LIMITED
真邦發展有限公司",1984-02-10,2007-09-14,"Private, ltd by shares"70,0133144,"K FORD STORAGE LIMITED
祈福倉庫有限公司",1984-02-10,,"Private, ltd by shares"71,0133123,"K. T. CONSULTANTS LIMITED
企智顧問有限公司",1984-02-10,,"Private, ltd by shares"72,0133130,"KALANNIE LIMITED (d1988-11-25)",1984-02-10,1988-11-25,"Private, ltd by shares"73,0133011,"KEENFUL LIMITED (d1999-07-23)",1984-02-10,1999-07-23,"Private, ltd by shares"74,0133151,"KIN SHING KNITTING MANUFACTORY (HONG KONG) LIMITED
建勝織造廠(香港)有限公司",1984-02-10,1997-08-22,"Private, ltd by shares"75,0133134,"L'ULTIMA LIMITED (d2001-01-30)",1984-02-10,2001-01-30,"Private, ltd by shares"76,0133146,"LANLUEN INVESTMENTS LIMITED
立聯投資有限公司",1984-02-10,1994-11-08,"Private, ltd by shares"77,0133058,"LONDON KING COMPANY LIMITED
騰雄有限公司",1984-02-10,,"Private, ltd by shares"78,0133055,"LUCKY COME COMPANY LIMITED
滿冠有限公司",1984-02-10,2002-07-19,"Private, ltd by shares"79,0133063,"LUISA LIMITED (d1996-08-09)
露意莎時裝有限公司",1984-02-10,1996-08-09,"Private, ltd by shares"80,0133101,"MAIN BASE COMPANY LIMITED
華基電子有限公司",1984-02-10,1997-08-22,"Private, ltd by shares"81,0133092,"MAIN CENTURY COMPANY LIMITED
銘鵬有限公司",1984-02-10,2015-04-02,"Private, ltd by shares"82,0133077,"MAIN HARVEST GODOWN LIMITED
銘超貨倉有限公司",1984-02-10,1996-09-27,"Private, ltd by shares"83,0133116,"MEI LI LIAN DEVELOPMENT LIMITED
美麗年發展有限公司",1984-02-10,1993-07-13,"Private, ltd by shares"84,0133170,"MELLOY LIMITED (d2014-01-10)",1984-02-10,2014-01-10,"Private, ltd by shares"85,0133171,"MENDEL OILFIELD CONSULTANTS LIMITED",1984-02-10,1997-08-22,"Private, ltd by shares"86,0133173,"MENKOFF LIMITED",1984-02-10,1997-08-22,"Private, ltd by shares"87,0133168,"MERCIER LIMITED (d1988-06-21)",1984-02-10,1988-06-21,"Private, ltd by shares"88,0133169,"MEREDITH LIMITED (d2005-02-04)",1984-02-10,2005-02-04,"Private, ltd by shares"89,0133158,"MEWCO LIMITED (d1989-06-09)",1984-02-10,1989-06-09,"Private, ltd by shares"90,0133165,"MEYHALL LIMITED
美賀有限公司",1984-02-10,1989-01-27,"Private, ltd by shares"91,0133164,"MIDCO LIMITED (d1988-04-14)",1984-02-10,1988-04-14,"Private, ltd by shares"92,0133081,"MIGAY TRADING LIMITED
瑪姬貿易有限公司",1984-02-10,1997-03-07,"Private, ltd by shares"93,0133166,"MILADY LIMITED (d2002-02-15)",1984-02-10,2002-02-15,"Private, ltd by shares"94,0133163,"MOCAMBO LIMITED (d1998-11-03)",1984-02-10,1998-11-03,"Private, ltd by shares"95,0133078,"MORE FAIR COMPANY LIMITED
添耀有限公司",1984-02-10,,"Private, ltd by shares"96,0133085,"MORE PROJECT COMPANY LIMITED
添宏有限公司",1984-02-10,1996-10-18,"Private, ltd by shares"97,0133119,"MOUNTVIEW INVESTMENT LIMITED",1984-02-10,2006-06-23,"Private, ltd by shares"98,0133019,"NEW FORCE GARMENT FACTORY LIMITED",1984-02-10,1992-09-05,"Private, ltd by shares"99,0133128,"NG WONDERFUL OPTICAL LIMITED
伍氏(富視)專業眼鏡有限公司",1984-02-10,1989-06-06,"Private, ltd by shares"100,0133082,"ONWOOD INVESTMENT LIMITED
安活投資有限公司",1984-02-10,1998-10-30,"Private, ltd by shares"101,0133131,"PACIFIC EQUATORIAL COMPANY LIMITED (THE)",1984-02-10,1990-02-23,"Private, ltd by shares"102,0133108,"PACVEST CAPITAL LIMITED",1984-02-10,2004-09-24,"Private, ltd by shares"103,0133087,"PAN-EAGLE COMPANY LIMITED
泛勇有限公司",1984-02-10,1996-10-18,"Private, ltd by shares"104,0133084,"PAN-SOURCE LIMITED
廣泛資源有限公司",1984-02-10,2004-09-24,"Private, ltd by shares"105,0133083,"PANON INVESTMENTS LIMITED
泛安投資有限公司",1984-02-10,2002-04-12,"Private, ltd by shares"106,0133025,"PARRETTO COMPANY LIMITED",1984-02-10,,"Private, ltd by shares"107,0133076,"PEARL COUNTRY JEWELRY LIMITED
珠城珠寶行有限公司",1984-02-10,1997-03-07,"Private, ltd by shares"108,0133129,"PEARSALL LIMITED",1984-02-10,2000-03-14,"Private, ltd by shares"109,0133026,"PELONLY COMPANY LIMITED",1984-02-10,,"Private, ltd by shares"110,0133033,"PHOTOMASK (HK) LIMITED
光膜(香港)有限公司",1984-02-10,,"Private, ltd by shares"111,0133100,"PIE MEDICAL ASIA LIMITED",1984-02-10,1991-02-22,"Private, ltd by shares"112,0133010,"PROMETTI HONG KONG COMPANY LIMITED
寶美廸香港有限公司",1984-02-10,2005-06-04,"Private, ltd by shares"113,0133027,"QUANCE TRADING LIMITED",1984-02-10,1998-02-20,"Private, ltd by shares"114,0133080,"RHYTHM AUDIO VISUAL PRODUCTION COMPANY LIMITED
藝揚視聽製作有限公司",1984-02-10,1996-09-27,"Private, ltd by shares"115,0133099,"RICAL OCEAN FORWARDING COMPANY LIMITED
力高海運有限公司",1984-02-10,2017-02-03,"Private, ltd by shares"116,0133050,"RICH BELL COMPANY LIMITED",1984-02-10,2001-11-16,"Private, ltd by shares"117,0133068,"RICH CIRCUIT LIMITED",1984-02-10,1996-09-27,"Private, ltd by shares"118,0133012,"RITALIN TEMPLIERS LIMITED",1984-02-10,1998-03-20,"Private, ltd by shares"119,0133103,"ROLLER VIDEOTHEQUE (INTERNATIONAL) CLUB LIMITED",1984-02-10,1998-12-18,"Private, ltd by shares"120,0133020,"RORY SERVICES LIMITED",1984-02-10,1998-10-30,"Private, ltd by shares"121,0133060,"ROUND FINE LIMITED
旋佳有限公司",1984-02-10,1996-07-26,"Private, ltd by shares"122,0133149,"RUFFEC LIMITED
日浩有限公司",1984-02-10,1997-08-22,"Private, ltd by shares"123,0133054,"SAI PO COMPANY LIMITED
翔寶貿易有限公司",1984-02-10,2004-09-24,"Private, ltd by shares"124,0133070,"SALO COMPANY LIMITED",1984-02-10,2000-12-08,"Private, ltd by shares"125,0133107,"SAMPLE TOYS MANUFACTURING COMPANY LIMITED
森堡玩具製品有限公司",1984-02-10,2001-06-22,"Private, ltd by shares"126,0133071,"SANKO TECHNOLOGY LIMITED
德萊工程有限公司",1984-02-10,2009-09-20,"Private, ltd by shares"127,0133008,"SANMING ASSOCIATION (HONGKONG) LIMITED
三明旅港聯會有限公司",1984-02-10,1996-07-19,"Ltd by guarantee"128,0133176,"SHALIMAR INDUSTRIES LIMITED",1984-02-10,1988-12-16,"Private, ltd by shares"129,0133062,"SHINNING MIND LIMITED
皓明有限公司",1984-02-10,1996-09-27,"Private, ltd by shares"130,0133147,"SILESTEL LIMITED
典創有限公司",1984-02-10,1997-08-22,"Private, ltd by shares"131,0133045,"SING CHOI STEVEDORING COMPANY LIMITED
星彩起運有限公司",1984-02-10,1995-05-28,"Private, ltd by shares"132,0133017,"SINOIL CO. LIMITED",1984-02-10,1996-09-27,"Private, ltd by shares"133,0133066,"SNATCH GOAL COMPANY LIMITED
奪勝有限公司",1984-02-10,,"Private, ltd by shares"134,0133175,"SPORT GRAPHICS U.S.A. (H.K.) LIMITED
美國勁體(香港)有限公司",1984-02-10,2004-03-05,"Private, ltd by shares"135,0133117,"STEP AHEAD LIMITED
時得國際有限公司",1984-02-10,,"Private, ltd by shares"136,0133028,"STORFIELD ENTERPRISES LIMITED",1984-02-10,1993-04-30,"Private, ltd by shares"137,0133141,"STUDIO EAST LIMITED
東貿(遠東)有限公司",1984-02-10,,"Private, ltd by shares"138,0133154,"SUNORY ENTERPRISES LIMITED",1984-02-10,1997-08-22,"Private, ltd by shares"139,0133114,"SWEETEN JEWELLERY MANUFACTURING (H.K.) LIMITED
順安首飾廠(香港)有限公司",1984-02-10,1997-10-09,"Private, ltd by shares"140,0133138,"SWIRE PACIFIC OFFSHORE MARINE LIMITED",1984-02-10,1992-07-09,"Private, ltd by shares"141,0133137,"SWIRE PACIFIC OFFSHORE MARITIME LIMITED",1984-02-10,2010-10-15,"Private, ltd by shares"142,0133095,"T K DIRECTORS LIMITED",1984-02-10,,"Private, ltd by shares"143,0133109,"T. PARSRAM &amp; CO. (HK) LIMITED",1984-02-10,2008-06-13,"Private, ltd by shares"144,0133153,"TAI WO TRAVEL AGENCY COMPANY LIMITED
泰和旅遊有限公司",1984-02-10,2006-07-14,"Private, ltd by shares"145,0133005,"TAK YAN KINDERGARTEN LIMITED
德恩幼稚園有限公司",1984-02-10,,"Ltd by guarantee"146,0133150,"TANCHI COMPANY LIMITED",1984-02-10,1993-12-24,"Private, ltd by shares"147,0133057,"TANI INDUSTRIES (HK) LIMITED
亭宜實業(香港)有限公司",1984-02-10,2015-07-24,"Private, ltd by shares"148,0133018,"TARRYTON LIMITED (d1996-09-27)",1984-02-10,1996-09-27,"Private, ltd by shares"149,0133043,"TIME MANAGER INTERNATIONAL LIMITED (d1996-07-26)",1984-02-10,1996-07-26,"Private, ltd by shares"150,0133124,"TOPOMEDIA INTERNATIONAL LIMITED",1984-02-10,,"Private, ltd by shares"151,0133046,"TRADEWEALTH LIMITED",1984-02-10,1996-07-26,"Private, ltd by shares"152,0133007,"TRIUMPH AMUSEMENT CLUB LIMITED
三英遊樂會有限公司",1984-02-10,1996-10-25,"Ltd by guarantee"153,0133014,"TRP FOODS (TIANJIN) LIMITED
愛群食品(天津)有限公司",1984-02-10,2002-10-11,"Private, ltd by shares"154,0133031,"TYRIAN GLORIES COMPANY LIMITED
泰瑞實業有限公司",1984-02-10,2001-11-29,"Private, ltd by shares"155,0133089,"VALENDO COMPANY LIMITED",1984-02-10,1998-10-30,"Private, ltd by shares"156,0133104,"VANDERSTEL COMPANY LIMITED",1984-02-10,1997-08-22,"Private, ltd by shares"157,0133152,"W.T. ENGINEERING LIMITED
元亨機械有限公司",1984-02-10,2003-04-25,"Private, ltd by shares"158,0133041,"WANG CHIN METAL MANUFACTORY LIMITED
永全金屬製品廠有限公司",1984-02-10,1987-03-12,"Private, ltd by shares"159,0133105,"WELLGAN INVESTMENT LIMITED
合勤投資有限公司",1984-02-10,,"Private, ltd by shares"160,0133056,"WELLSTONE COMPANY LIMITED
精石有限公司",1984-02-10,1996-07-26,"Private, ltd by shares"161,0133029,"WILLCORD INVESTMENTS LIMITED",1984-02-10,1996-12-20,"Private, ltd by shares"162,0133040,"WILLIE WIN COMPANY LIMITED",1984-02-10,2015-04-21,"Private, ltd by shares"163,0133086,"WO FU RESTAURANT LIMITED
和富海鮮酒家有限公司",1984-02-10,2001-11-16,"Private, ltd by shares"164,0133097,"WORLD CENTURY ESTATE LIMITED
汎基地產有限公司",1984-02-10,2003-03-07,"Private, ltd by shares"165,0133039,"WORLD CHAMPION COMPANY LIMITED",1984-02-10,,"Private, ltd by shares"166,0133034,"WORLD TRADE &amp; TECHNICAL PUBLICATIONS COMPANY LIMITED
世界工商刊物有限公司",1984-02-10,,"Private, ltd by shares"167,0133064,"WORTHY RICH LIMITED
堪富有限公司",1984-02-10,2001-11-16,"Private, ltd by shares"168,0133140,"YEAR FUNG (CHINA) LIMITED
歲豐(中國)有限公司",1984-02-10,1988-01-02,"Private, ltd by shares"169,0133120,"YICK FUNG ENGINEERING COMPANY LIMITED
益豐工程有限公司",1984-02-10,1997-08-22,"Private, ltd by shares"170,0133148,"ZASTRON LIMITED
世成有限公司",1984-02-10,1995-02-09,"Private, ltd by shares"171,0133030,"ZENGSHIN MANUFACTURING CONSULTANTS (H.K.) LIMITED
前進工程(香港)有限公司",1984-02-10,1996-10-18,"Private, ltd by shares"172,0133015,"ZHUHAI JAPAN LAND COMPANY LIMITED
珠海日本遊樂埸有限公司",1984-02-10,2004-07-02,"Private, ltd by shares"