,Reg no.,Name,Incorp-orated,Dissolved,Type1,0881407,"ADVANCE TRADE LIMITED
進貿有限公司",2004-02-02,2017-11-24,"Private, ltd by shares"2,0881362,"AIYA MEDIA LIMITED",2004-02-02,2020-04-17,"Private, ltd by shares"3,0881354,"ALIPES INTERNATIONAL BUSINESS CENTER LIMITED
雅利達國際商務中心有限公司",2004-02-02,2016-10-14,"Private, ltd by shares"4,0881403,"ALL MATE LIMITED
美恒有限公司",2004-02-02,2010-01-29,"Private, ltd by shares"5,0881364,"ASIA POINT LIMITED
遠丰有限公司",2004-02-02,,"Private, ltd by shares"6,0881395,"BAXXAD (HK) LIMITED
倍克思(香港)有限公司",2004-02-02,,"Private, ltd by shares"7,0881408,"BILLION FULL LIMITED
能億有限公司",2004-02-02,,"Private, ltd by shares"8,0881357,"BRIGHTEN CONSULTANTS LIMITED (d2016-03-04)
明輝顧問有限公司",2004-02-02,2016-03-04,"Private, ltd by shares"9,0881350,"BRIGHTEN REGENT LIMITED
耀峻有限公司",2004-02-02,2009-06-26,"Private, ltd by shares"10,0881414,"C&amp;P ARCHITECTURE INTERNATIONAL LIMITED
喜邦(國際)工程設計有限公司",2004-02-02,2012-08-24,"Private, ltd by shares"11,0881388,"CENTURY EATON ELECTRONICS CO. LIMITED
愛芙特電子股份有限公司",2004-02-02,2008-07-04,"Private, ltd by shares"12,0881356,"CHANNEL TECHNOLOGY LIMITED (HK)
通恒科技有限公司",2004-02-02,,"Private, ltd by shares"13,0881423,"CHINA LITERATOR PAINTING &amp; CALLIGRAPHY ACADEME LIMITED
中國文人書畫研究院有限公司",2004-02-02,2018-04-13,"Private, ltd by shares"14,0881382,"CHINA MODERN BUSINESS PUBLISHING LIMITED
中國現代商務出版有限公司",2004-02-02,2007-10-05,"Private, ltd by shares"15,0881363,"CHINA POINT LIMITED
中安興業有限公司",2004-02-02,,"Private, ltd by shares"16,0881365,"CONCORD WAY LIMITED
合詠有限公司",2004-02-02,,"Private, ltd by shares"17,0881377,"CRYSTALEAP COMPANY LIMITED
嘉躍有限公司",2004-02-02,2019-01-11,"Private, ltd by shares"18,0881424,"DENGFENG HEAT EXCHANGER (HONG KONG) COMPANY LIMITED
香港登峰換熱器有限公司",2004-02-02,2008-07-04,"Private, ltd by shares"19,0881415,"DIAMOND LOAN STAR COMPANY LIMITED",2004-02-02,2005-09-23,"Private, ltd by shares"20,0881402,"EVERGLORY GROUP COMPANY LIMITED
雅聯控股有限公司",2004-02-02,2005-08-12,"Private, ltd by shares"21,0881413,"F A T INVESTMENT LIMITED
富飛揚投資有限公司",2004-02-02,,"Private, ltd by shares"22,0881369,"FALCON CITY LIMITED
羚城有限公司",2004-02-02,,"Private, ltd by shares"23,0881368,"FALCON WAY LIMITED
丰偉有限公司",2004-02-02,,"Private, ltd by shares"24,0881387,"FEN INT'L LIMITED",2004-02-02,2009-04-30,"Private, ltd by shares"25,0881411,"FORD LUCK LIMITED
順心有限公司",2004-02-02,,"Private, ltd by shares"26,0881373,"FRANCE PIERE CARDEN (HK) CO., LIMITED
法國皮爾卡丹(香港)有限公司",2004-02-02,2008-07-04,"Private, ltd by shares"27,0881394,"Genvon Industrial Limited
正峰實業有限公司",2004-02-02,2012-04-27,"Private, ltd by shares"28,0881384,"GLOBALTEX GARMENT LIMITED
高寶製衣有限公司",2004-02-02,,"Private, ltd by shares"29,0881416,"HANS SHIPPING CO LIMITED",2004-02-02,2014-02-28,"Private, ltd by shares"30,0881400,"HONG KONG JUNIOR CHAMBER FOUNDATION LIMITED
香港青年商會基金有限公司",2004-02-02,,"Ltd by guarantee"31,0881391,"HONG KONG MARUYAMA METAL COMPANY LIMITED
香港丸山金屬有限公司",2004-02-02,2016-10-07,"Private, ltd by shares"32,0881379,"HONG KONG SAIQI INDUSTRIAL CO., LIMITED
香港賽琪實業有限公司",2004-02-02,2011-08-05,"Private, ltd by shares"33,0881360,"HUNG HONG HOLDINGS LIMITED
鴻康集團有限公司",2004-02-02,,"Private, ltd by shares"34,0881425,"HYDRA TECH HONG KONG, LIMITED",2004-02-02,,"Private, ltd by shares"35,0881372,"ITALY YAGE CERAMICS CO., LIMITED
意大利雅格瓷業有限公司",2004-02-02,2012-01-27,"Private, ltd by shares"36,0881389,"JM&amp;K INTERNATIONAL LIMITED
協伸國際有限公司",2004-02-02,,"Private, ltd by shares"37,0881397,"KATALYST LIMITED (HK)",2004-02-02,,"Private, ltd by shares"38,0881349,"KINGWAY POWER LIMITED
興偉動力有限公司",2004-02-02,,"Private, ltd by shares"39,0881359,"KINGWELL H.K. HOLDINGS LIMITED
興偉香港集團有限公司",2004-02-02,2005-07-15,"Private, ltd by shares"40,0881355,"KINGWORLD NOMINEES LIMITED
興偉代理人有限公司",2004-02-02,2013-12-13,"Private, ltd by shares"41,0881381,"KINWOOD GOURMANDISES CO., LIMITED
健活美食有限公司",2004-02-02,2014-03-07,"Private, ltd by shares"42,0881420,"LEVERAGE LIMITED (d2008-03-14)
利華傳有限公司",2004-02-02,2008-03-14,"Private, ltd by shares"43,0881358,"LIVE INTERNATIONAL HOLDINGS LIMITED
利輝國際集團有限公司",2004-02-02,2007-08-17,"Private, ltd by shares"44,0881399,"LUEN TAI GROUP (H.K.) LIMITED
聯大集團(香港)有限公司",2004-02-02,,"Private, ltd by shares"45,0881393,"MAGICTONE ADVERTISING COMPANY LIMITED
東利廣告有限公司",2004-02-02,,"Private, ltd by shares"46,0881422,"MIKADA PRECISION LIMITED
洪濤精密工業有限公司",2004-02-02,2011-12-23,"Private, ltd by shares"47,0881412,"MIX PRO (E &amp; M) ENGINEERING COMPANY LIMITED
匯寶電機工程有限公司",2004-02-02,2009-05-22,"Private, ltd by shares"48,0881374,"NISHIHARA HONG KONG COMPANY LIMITED
西原香港有限公司",2004-02-02,,"Private, ltd by shares"49,0881417,"OASIS SEMICONDUCTOR (HONG KONG) LIMITED
綠洲半導體(香港)有限公司",2004-02-02,2007-10-18,"Private, ltd by shares"50,0881370,"OCEAN POINT LIMITED
滔安有限公司",2004-02-02,2013-11-01,"Private, ltd by shares"51,0881371,"OCEAN POWER LIMITED (d2008-07-04)
海權有限公司",2004-02-02,2008-07-04,"Private, ltd by shares"52,0881366,"PACIFIC POWER LIMITED (d2007-03-02)
太勇有限公司",2004-02-02,2007-03-02,"Private, ltd by shares"53,0881418,"PHAROS INDUSTRIAL LIMITED
舶來工業有限公司",2004-02-02,2010-04-27,"Private, ltd by shares"54,0881405,"POWER ON LIMITED
力耀有限公司",2004-02-02,,"Private, ltd by shares"55,0881353,"PROKIN INTERNATIONAL LIMITED
寶建國際有限公司",2004-02-02,,"Private, ltd by shares"56,0881351,"PROSPER TRADE LIMITED (d2009-12-31)
樺貿有限公司",2004-02-02,2009-12-31,"Private, ltd by shares"57,0881392,"QINTAR DESIGN LIMITED",2004-02-02,2009-10-23,"Private, ltd by shares"58,0881404,"RICH FLY LIMITED
富發有限公司",2004-02-02,,"Private, ltd by shares"59,0881380,"ROYAL FAMILY TRADING LIMITED
皇家貿易有限公司",2004-02-02,2018-12-28,"Private, ltd by shares"60,0881421,"SAMENTOR TECHNOLOGY SOLUTIONS COMPANY LIMITED
訊達技術顧問有限公司",2004-02-02,,"Private, ltd by shares"61,0881409,"SEA VENTURE LIMITED
海宏有限公司",2004-02-02,,"Private, ltd by shares"62,0881378,"SETHI CORPORATION LIMITED",2004-02-02,2015-09-25,"Private, ltd by shares"63,0881383,"SEVEN LOGIC COMPANY LIMITED
七論科技有限公司",2004-02-02,2016-09-23,"Private, ltd by shares"64,0881390,"SMS GLOBAL TECHNOLOGIES LIMITED",2004-02-02,,"Private, ltd by shares"65,0881348,"SOCIETY FOR THE WELFARE OF THE AUTISTIC PERSONS
自閉症人士福利促進會",2004-02-02,,"Ltd by guarantee"66,0881385,"SPRINGFIELD DESIGN &amp; CONTRACTING COMPANY LIMITED
展基設計工程有限公司",2004-02-02,,"Private, ltd by shares"67,0881419,"STARZ LIMITED (d2010-07-16)
紡星有限公司",2004-02-02,2010-07-16,"Private, ltd by shares"68,0881410,"TARGET RICH LIMITED (d2015-04-30)
文富有限公司",2004-02-02,2015-04-30,"Private, ltd by shares"69,0881406,"TIME LAND LIMITED
時卓有限公司",2004-02-02,,"Private, ltd by shares"70,0881367,"TOP ROUTE LIMITED
上滔有限公司",2004-02-02,2016-11-18,"Private, ltd by shares"71,0881376,"TUNG YIK GLOBAL COMPANY LIMITED
東益環球有限公司",2004-02-02,2013-08-09,"Private, ltd by shares"72,0881375,"TUNG YIK INDUSTRIES COMPANY LIMITED
東益工業有限公司",2004-02-02,2005-10-28,"Private, ltd by shares"73,0881396,"VANGUARD CARRIERS CO. LIMITED
瑞鋒航運有限公司",2004-02-02,2006-03-24,"Private, ltd by shares"74,0881361,"VIEWYET HOLDINGS LIMITED
偉益集團有限公司",2004-02-02,2005-07-08,"Private, ltd by shares"75,0881352,"WELLCOOL LIMITED (d2010-07-16)
偉皓有限公司",2004-02-02,2010-07-16,"Private, ltd by shares"76,0881386,"WISMAX INTERNATIONAL LIMITED
泓貿國際有限公司",2004-02-02,,"Private, ltd by shares"77,0881401,"YOUTH SPORTS NEWS (HONG KONG) ADVERTISING LIMITED
青年體育報(香港)廣告有限公司",2004-02-02,2006-10-06,"Private, ltd by shares"78,0881398,"ZENITH INTERNATIONAL TOBACCO LIMITED
盛世國際煙草有限公司",2004-02-02,2009-07-17,"Private, ltd by shares"