,Reg no.,Name,Incorp-orated,Dissolved,Type1,0760466,"A.L.C. INTERNATIONAL LIMITED
麗思國際有限公司",2001-06-18,,"Private, ltd by shares"2,0760592,"ABIS INTERNATIONAL HK LIMITED
安氏國際信息貿易有限公司",2001-06-18,2013-09-06,"Private, ltd by shares"3,0760509,"ADABIAO (HK) GROUP LIMITED
阿達彪(香港)集團有限公司",2001-06-18,2008-11-28,"Private, ltd by shares"4,0760464,"AGOS TRADING LIMITED",2001-06-18,2004-01-02,"Private, ltd by shares"5,0760561,"ALLIED RESOURCES INDUSTRIES LIMITED
桓鋒實業有限公司",2001-06-18,2009-11-13,"Private, ltd by shares"6,0760612,"ALLOY STAR INTERNATIONAL ENTERPRISE LIMITED
進昇國際企業有限公司",2001-06-18,2003-11-21,"Private, ltd by shares"7,0760622,"ALRIGHT CONSULTANTS LIMITED
普萬顧問有限公司",2001-06-18,2006-10-27,"Private, ltd by shares"8,0760524,"ANSUN &amp; ANDY CONSTRUCTION ENGINEERING LIMITED",2001-06-18,2006-02-17,"Private, ltd by shares"9,0760566,"APEX HORIZON PROPERTY MANAGEMENT LIMITED (THE)",2001-06-18,2015-12-18,"Private, ltd by shares"10,0760496,"ASIA COSMOS LIMITED (d2003-04-25)
利亨有限公司",2001-06-18,2003-04-25,"Private, ltd by shares"11,0760484,"BESTWELL EMPLOYMENT AGENCY (HK) LIMITED
佳威僱傭中心有限公司",2001-06-18,,"Private, ltd by shares"12,0760639,"BIKINICAT LIMITED",2001-06-18,2008-12-19,"Private, ltd by shares"13,0760569,"BONAFIDE COMPANY LIMITED",2001-06-18,,"Private, ltd by shares"14,0760571,"BRAND MANAGEMENT LIMITED (d2009-11-13)
思靈品牌管理有限公司",2001-06-18,2009-11-13,"Private, ltd by shares"15,0760554,"BRILLIANT RICH INTERNATIONAL INVESTMENT HOLDINGS LIMITED
耀富國際投資集團有限公司",2001-06-18,2003-06-06,"Private, ltd by shares"16,0760621,"BRILLIANT STARS TRADING LIMITED
溢星貿易有限公司",2001-06-18,2004-09-24,"Private, ltd by shares"17,0760513,"BUREN STREET FINERY (H.K.) INT'L GROUP LIMITED
布人街服飾(香港)國際集團有限公司",2001-06-18,2006-10-27,"Private, ltd by shares"18,0760530,"CENTURY ASIA GROUP (HOLDINGS) LIMITED
亞洲世紀集團(控股)有限公司",2001-06-18,,"Private, ltd by shares"19,0760475,"CHEUNG SHING ALUMINIUM ENGINEERING LIMITED
祥盛鋁質工程有限公司",2001-06-18,2007-11-02,"Private, ltd by shares"20,0760614,"CHI FUNG PUMPING WORKS COMPANY LIMITED
志豐水泵工程有限公司",2001-06-18,,"Private, ltd by shares"21,0760558,"CHIN CHONG TRANSPORTATION COMPANY LIMITED
展創運輸有限公司",2001-06-18,2002-08-30,"Private, ltd by shares"22,0760560,"CHUEN KEE SEAFOOD HOLDING LIMITED
全記海鮮控股有限公司",2001-06-18,,"Private, ltd by shares"23,0760460,"CIRCLE TRANSPORTATION LIMITED
豪亨運輸有限公司",2001-06-18,2017-06-30,"Private, ltd by shares"24,0760593,"COMORES PETROLEUM (HONG KONG) LIMITED
科摩羅石油(香港)有限公司",2001-06-18,2003-03-21,"Private, ltd by shares"25,0760528,"CONCORD INTERNATIONAL INVESTMENT HOLDINGS LIMITED
康宏國際投資集團有限公司",2001-06-18,2008-09-19,"Private, ltd by shares"26,0760587,"CSPD INTERNATIONAL HOLDINGS (HK) LIMITED
寰中國際控股(香港)有限公司",2001-06-18,2010-11-19,"Private, ltd by shares"27,0760582,"CYBER SCOPE HOLDING LIMITED
網絡特工集團有限公司",2001-06-18,2006-07-14,"Private, ltd by shares"28,0760501,"DARK HORSE TENNIS &amp; GOLF COMPANY LIMITED",2001-06-18,2007-11-02,"Private, ltd by shares"29,0760564,"DG CARD (CHINA) LIMITED",2001-06-18,2002-09-27,"Private, ltd by shares"30,0760604,"DG INTERNATIONAL SILVERWARE COMPANY LIMITED
東俊國際銀器有限公司",2001-06-18,2010-09-17,"Private, ltd by shares"31,0760533,"DHV (HK) LIMITED",2001-06-18,2003-11-21,"Private, ltd by shares"32,0760633,"DINOWORLD GAME EQUIPMENT LIMITED
恐龍娛樂設備有限公司",2001-06-18,2007-07-06,"Private, ltd by shares"33,0760555,"DOINGCOM INTERNATIONAL LIMITED
中坤國際有限公司",2001-06-18,,"Private, ltd by shares"34,0760579,"DONGGUAN WAN JIANG CHUANG XIN TRADING COMPANY LIMITED
東莞市萬江創新貿易有限公司",2001-06-18,2008-04-18,"Private, ltd by shares"35,0760480,"DONGHWA TRADING COMPANY LIMITED
東華貿易有限公司",2001-06-18,2010-08-27,"Private, ltd by shares"36,0760628,"EAST GLORY INTERNATIONAL TRADING LIMITED (d2006-10-27)
東鴻國際貿易有限公司",2001-06-18,2006-10-27,"Private, ltd by shares"37,0760553,"EVER SURPLUS INTERNATIONAL INVESTMENT HOLDINGS LIMITED
盈利國際投資集團有限公司",2001-06-18,2006-10-27,"Private, ltd by shares"38,0760470,"FAIR CHILD (H.K.) LIMITED
飛際(香港)有限公司",2001-06-18,2017-12-15,"Private, ltd by shares"39,0760591,"FASTLION (HONG KONG) COMPANY LIMITED
華麟(香港)有限公司",2001-06-18,2011-02-18,"Private, ltd by shares"40,0760531,"FATCAT INDUSTRY DEVELOPMENT LIMITED
菲凱特實業發展有限公司",2001-06-18,2006-10-27,"Private, ltd by shares"41,0760576,"FLARESYSTEM MARKETING COMPANY LIMITED
盈輝市場拓展有限公司",2001-06-18,2018-02-23,"Private, ltd by shares"42,0760462,"FOOK LEE PROPERTY MANAGEMENT LIMITED
福利物業管理有限公司",2001-06-18,,"Private, ltd by shares"43,0760474,"FOREST INTERNET LIMITED
科域網絡有限公司",2001-06-18,2006-10-27,"Private, ltd by shares"44,0760586,"FOUNDER INFORMATION TECHNOLOGY (H.K.) LIMITED
方正信息技術(香港)有限公司",2001-06-18,2009-04-03,"Private, ltd by shares"45,0760512,"FRANCE DOPENG INT'L INV. (HK) LIMITED
法國都彭國際投資(香港)有限公司",2001-06-18,2006-10-27,"Private, ltd by shares"46,0760563,"Fruitful Value Limited",2001-06-18,2010-08-13,"Private, ltd by shares"47,0760465,"FU SHING AIR-CONDITIONING ENGINEERING LIMITED
富城冷氣工程有限公司",2001-06-18,2008-11-28,"Private, ltd by shares"48,0760521,"FULIE INTERNATIONAL DEVELOPMENT CO. LIMITED
富力國際發展有限公司",2001-06-18,2006-05-19,"Private, ltd by shares"49,0760529,"FULLYTECH SHIPPING LIMITED
富利達船務有限公司",2001-06-18,2012-03-02,"Private, ltd by shares"50,0760627,"FULLYTECH TRANSPORTATION LIMITED
富利達運輸有限公司",2001-06-18,,"Private, ltd by shares"51,0760505,"FUN PACK ASIA LIMITED",2001-06-18,,"Private, ltd by shares"52,0760581,"FUOTTO LABELS WEAVING FACTORY COMPANY LIMITED
富泰電腦織嘜廠有限公司",2001-06-18,,"Private, ltd by shares"53,0760617,"GLACIER RESOURCES LIMITED
冰川資源有限公司",2001-06-18,2012-02-24,"Private, ltd by shares"54,0760631,"GLOBAL IT LIMITED (d2007-11-02)",2001-06-18,2007-11-02,"Private, ltd by shares"55,0760539,"GOLCONDA CONSULTING LIMITED
歐達顧問有限公司",2001-06-18,,"Private, ltd by shares"56,0760540,"GOLDEN SOURCES INTERNATIONAL INVESTMENT LIMITED
鑫順國際投資有限公司",2001-06-18,,"Private, ltd by shares"57,0760488,"GRAND OPTICS LIMITED
昌太眼鏡有限公司",2001-06-18,2006-10-27,"Private, ltd by shares"58,0760620,"GRAND RIGHT ENGINEERING LIMITED
浩正工程有限公司",2001-06-18,2017-04-28,"Private, ltd by shares"59,0760506,"GUANN YINN INTERNATIONAL (HK) LIMITED",2001-06-18,2007-02-09,"Private, ltd by shares"60,0760584,"GUY'S HONG KONG LIMITED",2001-06-18,2013-09-06,"Private, ltd by shares"61,0760634,"H.K. ESSITON GARMENT INT'L GROUP LIMITED
香港艾賽丹服飾國際集團有限公司",2001-06-18,2006-11-03,"Private, ltd by shares"62,0760635,"H.K. GUOYI GARMENT INT'L GROUP LIMITED
香港國一服飾國際集團有限公司",2001-06-18,2006-11-03,"Private, ltd by shares"63,0760632,"H.K. LYWIN SHOES GROUP LIMITED
香港萊文鞋業集團有限公司",2001-06-18,2006-11-03,"Private, ltd by shares"64,0760502,"HALIFAX MANUFACTORY (HONG KONG) LIMITED
喜利發製造廠(香港)有限公司",2001-06-18,,"Private, ltd by shares"65,0760500,"HANA DEVELOPMENT LIMITED",2001-06-18,2018-03-23,"Private, ltd by shares"66,0760575,"HANDSOME RESOURCES LIMITED
隆滙實業有限公司",2001-06-18,2007-04-20,"Private, ltd by shares"67,0760598,"HARMONY ENVIRONMENTAL ENGINEERING COMPANY LIMITED
冠佳環境工程有限公司",2001-06-18,2003-03-28,"Private, ltd by shares"68,0760472,"HARTMAN MUSIC LIMITED
復克音樂有限公司",2001-06-18,2009-05-29,"Private, ltd by shares"69,0760638,"HERBS N SENSES HEALTH PRODUCTS LIMITED
草苓香健康產品有限公司",2001-06-18,2017-06-09,"Private, ltd by shares"70,0760568,"HIGH GOAL - POLO COMPANY LIMITED",2001-06-18,2011-08-05,"Private, ltd by shares"71,0760557,"HIGHWAY TRADING LIMITED (d2006-10-27)
銳升貿易有限公司",2001-06-18,2006-10-27,"Private, ltd by shares"72,0760515,"HK SAINT PHOENIX INT'L TRADING LIMITED
香港聖鳳凰國際貿易有限公司",2001-06-18,2003-03-07,"Private, ltd by shares"73,0760514,"HK YIRAN INT'L DRESS LIMITED
香港伊然國際服飾有限公司",2001-06-18,2006-10-27,"Private, ltd by shares"74,0760523,"HOLYSTAR INDUSTRIAL LIMITED
漢星產業有限公司",2001-06-18,,"Private, ltd by shares"75,0760491,"HONG KONG D K C CREATION LIMITED
香港狄奇仕創建有限公司",2001-06-18,2018-02-23,"Private, ltd by shares"76,0760520,"HONG KONG PUYUAN INTERNATIONAL FINANCE INVESTMENT HOLDINGS LIMITED
香港普源國際金融投資集團有限公司",2001-06-18,2007-11-02,"Private, ltd by shares"77,0760623,"HONG KONG YUAN CHENG INVESTMENT LIMITED
香港愿成投資有限公司",2001-06-18,,"Private, ltd by shares"78,0760498,"HONG YE DEVELOPMENT (GROUP) LIMITED
宏業發展(集團)有限公司",2001-06-18,2014-10-17,"Private, ltd by shares"79,0760606,"HOP YICK COMPANY LIMITED
合益號有限公司",2001-06-18,,"Private, ltd by shares"80,0760574,"HUA SHENG (H.K.) COMPANY LIMITED
華晟(香港)有限公司",2001-06-18,2011-01-07,"Private, ltd by shares"81,0760607,"HUNG KIT TRANSPORTATION LIMITED
鴻傑電召貨運有限公司",2001-06-18,,"Private, ltd by shares"82,0760479,"HUNS (CHINA) COMPANY LIMITED
鏗時(中國)有限公司",2001-06-18,,"Private, ltd by shares"83,0760610,"IMAGINASIA COMPANY LIMITED
現美亞洲有限公司",2001-06-18,2005-08-05,"Private, ltd by shares"84,0760485,"IMAX TECHNICS LIMITED
致律國際有限公司",2001-06-18,2013-08-16,"Private, ltd by shares"85,0760545,"INTERNATIONAL HOLDINGS GROUP (H. K.) CO. LIMITED
國際控股集團(香港)有限公司",2001-06-18,2003-10-31,"Private, ltd by shares"86,0760493,"INTERNATIONAL HOUSE SITTERS ASSOCIATION LIMITED",2001-06-18,2005-12-09,"Private, ltd by shares"87,0760476,"IPPERS MEKO CERAMIC LINE LIMITED",2001-06-18,2006-04-21,"Private, ltd by shares"88,0760577,"ITALIAN OLICE HYGIENIC AND BATH GOODS CO. LIMITED
意大利奧斯麗衛浴股份有限公司",2001-06-18,2007-11-02,"Private, ltd by shares"89,0760510,"ITALY BAOWEI (HK) INT'L LIMITED
意大利寶威(香港)國際有限公司",2001-06-18,2006-10-27,"Private, ltd by shares"90,0760508,"J &amp; C INDUSTRIAL LIMITED
鳴尋有限公司",2001-06-18,2010-10-29,"Private, ltd by shares"91,0760613,"J &amp; J GARMENT LIMITED
連城製衣有限公司",2001-06-18,2019-03-29,"Private, ltd by shares"92,0760608,"J.G.Y.S. STATE DECORATION CONSTRUCTION (HK) CO. LIMITED
晶宮雅舍建築裝飾工程(香港)有限公司",2001-06-18,2007-11-02,"Private, ltd by shares"93,0760481,"JETFRESH FOODS HONG KONG LIMITED
香港鮮味食品有限公司",2001-06-18,,"Private, ltd by shares"94,0760546,"K &amp; P TRADING CO., LIMITED (d2006-10-27)
奧高信有限公司",2001-06-18,2006-10-27,"Private, ltd by shares"95,0760494,"KAM HOI INTERNATIONAL TRAVEL COMPANY LIMITED
金海國際旅遊有限公司",2001-06-18,,"Private, ltd by shares"96,0760537,"KAN'S CREATIVE EXHIBITION SERVICES LIMITED
簡視創意展藝服務有限公司",2001-06-18,2004-02-27,"Private, ltd by shares"97,0760619,"KEENWAYS ENGINEERING LIMITED
佳懋工程有限公司",2001-06-18,2003-09-11,"Private, ltd by shares"98,0760572,"KIN KWOK ELECTRICAL ACCESSORIES MANUFACTORY LIMITED
建國電器製品廠有限公司",2001-06-18,2013-10-26,"Private, ltd by shares"99,0760562,"KINGCITY INDUSTRIES (HONG KONG) LIMITED
華融實業(香港)有限公司",2001-06-18,2004-08-13,"Private, ltd by shares"100,0760534,"KINGMOSING ENTERPRISES CO., LIMITED
金貿興企業股份有限公司",2001-06-18,,"Private, ltd by shares"101,0760596,"KONG KEI ENGINEERING LIMITED (d2008-02-15)
港基營造有限公司",2001-06-18,2008-02-15,"Private, ltd by shares"102,0760519,"KOREA PUDONG RENJIA INTERNATIONAL HOLDING LIMITED
韓國浦東人家國際集團有限公司",2001-06-18,2006-10-27,"Private, ltd by shares"103,0760630,"KUS INTERNATIONAL LIMITED
庫思國際有限公司",2001-06-18,2012-03-09,"Private, ltd by shares"104,0760580,"KWONG FUK ELDERLY CARE (HONG KONG) LIMITED
廣福護老(香港)有限公司",2001-06-18,2007-01-26,"Private, ltd by shares"105,0760489,"LEADER INTERNATIONAL CREDIT CONSULTANTS LIMITED
利達國際信貸顧問有限公司",2001-06-18,2003-07-04,"Private, ltd by shares"106,0760517,"LEE TAT (E&amp;M) ENGINEERING &amp; TRADING LIMITED
利達機電工程貿易有限公司",2001-06-18,2004-10-08,"Private, ltd by shares"107,0760602,"LIGHTTIMES TECHNOLOGY INTERNATIONAL HOLDINGS COMPANY LIMITED
光時代科技國際集團有限公司",2001-06-18,2008-11-28,"Private, ltd by shares"108,0760618,"LITTO ENGINEERING LIMITED
力圖工程有限公司",2001-06-18,,"Private, ltd by shares"109,0760603,"LONGMAY WINNER INT'L ENTERPRISE (HK) INV. LIMITED
朗美‧贏家國際企業(香港)投資有限公司",2001-06-18,,"Private, ltd by shares"110,0760611,"LOUFAS INTERNATIONAL COMPANY LIMITED
彩派創造有限公司",2001-06-18,2015-03-27,"Private, ltd by shares"111,0760595,"MAN HING PACKING MANUFACTURING CO. LIMITED
文興包裝製品有限公司",2001-06-18,,"Private, ltd by shares"112,0760522,"MASTER CROWN INVESTMENTS LIMITED
駿佳投資發展有限公司",2001-06-18,,"Private, ltd by shares"113,0760463,"MASTER FREIGHT SERVICE LIMITED (d2008-11-28)
華威國際貨運有限公司",2001-06-18,2008-11-28,"Private, ltd by shares"114,0760486,"MAU YING PROPERTIES COMPANY LIMITED
茂盈置業有限公司",2001-06-18,,"Private, ltd by shares"115,0760542,"MAXCONNECT LIMITED",2001-06-18,2018-12-14,"Private, ltd by shares"116,0760629,"MEDICAL LINK SYSTEM CO., LIMITED",2001-06-18,2008-12-05,"Private, ltd by shares"117,0760601,"MERITOP CHEMICALS LIMITED
優高化學有限公司",2001-06-18,2011-02-18,"Private, ltd by shares"118,0760490,"MIDSOUTH CODOS TECHNOLOGY (H.K.) LIMITED
密勝科德士(香港)有限公司",2001-06-18,2015-03-13,"Private, ltd by shares"119,0760504,"MUSIC LIMITLESS INTERNATIONAL COMPANY LIMITED
音樂無限國際有限公司",2001-06-18,2008-11-28,"Private, ltd by shares"120,0760541,"NAM WAH SUPPLIES LIMITED
南華物料供應有限公司",2001-06-18,,"Private, ltd by shares"121,0760538,"NANO PHARMACEUTICAL COMPANY LIMITED
納米藥業有限公司",2001-06-18,2015-11-27,"Private, ltd by shares"122,0760471,"NC MINUS LIMITED",2001-06-18,2006-10-27,"Private, ltd by shares"123,0760503,"NEW HUNG KEE LIMITED
新洪記工程有限公司",2001-06-18,2006-10-27,"Private, ltd by shares"124,0760507,"NODA KOGYO (HK) CO., LIMITED
野田工業(香港)有限公司",2001-06-18,,"Private, ltd by shares"125,0760600,"NORTH DISTRICT MOTORS (GROUP) LIMITED
北區車行集團有限公司",2001-06-18,2007-11-02,"Private, ltd by shares"126,0760567,"ORION INTERNATIONAL CONSULTING GROUP LIMITED",2001-06-18,2004-03-12,"Private, ltd by shares"127,0760532,"OUTSMART HONG KONG LIMITED
無限創作有限公司",2001-06-18,,"Private, ltd by shares"128,0760548,"PACOIL HOLDING LIMITED
博高控股有限公司",2001-06-18,2012-06-01,"Private, ltd by shares"129,0760588,"PARA FASHIONS LIMITED
華藝時裝有限公司",2001-06-18,2006-01-20,"Private, ltd by shares"130,0760477,"PERFECT SMART (HONG KONG) COMPANY LIMITED
華昌(香港)建材有限公司",2001-06-18,,"Private, ltd by shares"131,0760559,"PERFETTO COMPANY LIMITED
百年順有限公司",2001-06-18,2019-10-11,"Private, ltd by shares"132,0760478,"PHD ASIA LIMITED
北意迪亞洲有限公司",2001-06-18,2002-08-16,"Private, ltd by shares"133,0760565,"PITTO &amp; PARTNERS LIMITED",2001-06-18,2011-02-18,"Private, ltd by shares"134,0760511,"PRETTY NET INT'L GROUP (HK) LIMITED
靚網國際集團(香港)有限公司",2001-06-18,2006-10-27,"Private, ltd by shares"135,0760525,"PROMASTER ENGINEERING LIMITED (d2003-11-14)
寶馬斯特工程有限公司",2001-06-18,2003-11-14,"Private, ltd by shares"136,0760473,"R.T.ZAN LIMITED",2001-06-18,2012-03-09,"Private, ltd by shares"137,0760547,"RAN'S GROUP - M &amp; S BEAUTY CONSULTANT LIMITED
冉氏集團-美施美容有限公司",2001-06-18,2003-11-07,"Private, ltd by shares"138,0760552,"RICHLY INTERNATIONAL INVESTMENT HOLDINGS LIMITED
裕發國際投資集團有限公司",2001-06-18,2006-10-27,"Private, ltd by shares"139,0760616,"RIGHT PROJECT ENGINEERING LIMITED
益昌工程有限公司",2001-06-18,,"Private, ltd by shares"140,0760626,"RIGHTLINK SHIPPING LIMITED
正聯船務有限公司",2001-06-18,2006-12-26,"Private, ltd by shares"141,0760556,"RIGHTWAY TRANSPORTATION LIMITED
正通運輸有限公司",2001-06-18,2007-11-02,"Private, ltd by shares"142,0760590,"SAI IMPEX INTERNATIONAL LIMITED",2001-06-18,2008-08-22,"Private, ltd by shares"143,0760492,"SAMFINE EPRINT LIMITED
星輝數碼印刷有限公司",2001-06-18,2006-09-29,"Private, ltd by shares"144,0760605,"SCI PANHARD DAM LIMITED",2001-06-18,2007-11-02,"Private, ltd by shares"145,0760469,"SCROP (HK) LIMITED
盈策(香港)有限公司",2001-06-18,2003-10-03,"Private, ltd by shares"146,0760583,"SHARP INT'L (HK) LIMITED
飛銳國際有限公司",2001-06-18,,"Private, ltd by shares"147,0760636,"SHODA HONG KONG COMPANY LIMITED
正田香港有限公司",2001-06-18,2016-12-09,"Private, ltd by shares"148,0760625,"SILVERWAY SHIPPING LIMITED
銀通船務有限公司",2001-06-18,2003-10-24,"Private, ltd by shares"149,0760615,"SINOPOWER MANAGEMENT LIMITED
中力管理有限公司",2001-06-18,2014-12-05,"Private, ltd by shares"150,0760551,"SINOPOWER NETWORK TECHNOLOGY LIMITED
中力網絡科技有限公司",2001-06-18,2003-03-14,"Private, ltd by shares"151,0760573,"SMARTEC INVESTMENT (HONGKONG) COMPANY LIMITED",2001-06-18,2007-11-02,"Private, ltd by shares"152,0760570,"SOLUTE BROADBAND (HONG KONG) COMPANY LIMITED",2001-06-18,2004-01-09,"Private, ltd by shares"153,0760585,"SOUTH &amp; NORTH ENTERPRISES LIMITED
南北企業投資有限公司",2001-06-18,,"Private, ltd by shares"154,0760550,"SPEEDY NETWORK TECHNOLOGY LIMITED
捷能網絡科技有限公司",2001-06-18,2003-11-07,"Private, ltd by shares"155,0760544,"SPORTS CONCEPT LIMITED",2001-06-18,2016-02-12,"Private, ltd by shares"156,0760518,"STARBOARD (INTERNATIONAL) LIMITED
星薈(國際)有限公司",2001-06-18,2005-12-23,"Private, ltd by shares"157,0760536,"STRONG COMPANY LIMITED
瑞翔行有限公司",2001-06-18,,"Private, ltd by shares"158,0760535,"SUN ZHUN MOTOR TRADING CO. LIMITED
新俊汽車有限公司",2001-06-18,2009-06-26,"Private, ltd by shares"159,0760543,"SUNNIC RESEARCH &amp; TESTING LABORATORY LIMITED
實力測試有限公司",2001-06-18,2003-11-14,"Private, ltd by shares"160,0760482,"TEXLINK INTERNATIONAL LIMITED
德力紡織有限公司",2001-06-18,,"Private, ltd by shares"161,0760526,"THOMASON INTERNATIONAL LIMITED
瀚美盛國際有限公司",2001-06-18,2015-07-03,"Private, ltd by shares"162,0760468,"THRIVING TRANSPORTATION CO. LIMITED
昇平運輸有限公司",2001-06-18,,"Private, ltd by shares"163,0760594,"TIN TIN NEWSPAPERS GROUP COMPANY LIMITED
天天報業集團有限公司",2001-06-18,2007-11-02,"Private, ltd by shares"164,0760495,"TIN YAN CHINA LIMITED
天恩中國有限公司",2001-06-18,2011-02-18,"Private, ltd by shares"165,0760487,"TOM. GOSH HONG KONG LIMITED
騰高香港有限公司",2001-06-18,2005-05-13,"Private, ltd by shares"166,0760599,"TRIWORKS (ASIA) LIMITED
通力(亞洲)有限公司",2001-06-18,,"Private, ltd by shares"167,0760499,"TRIWORKS (HONG KONG) LIMITED
通力軟件(香港)有限公司",2001-06-18,,"Private, ltd by shares"168,0760624,"UPBRIGHT TRADING LIMITED
立輝貿易有限公司",2001-06-18,2006-12-08,"Private, ltd by shares"169,0760461,"VLTP CORPORATE FINANCIAL SERVICES LIMITED
嘉安企業融資顧問有限公司",2001-06-18,2019-03-29,"Private, ltd by shares"170,0760578,"WAI HING METAL &amp; PLASTIC MANUFACTURING LIMITED
偉興五金塑膠廠有限公司",2001-06-18,2014-03-28,"Private, ltd by shares"171,0760527,"WANG SING FOODS LIMITED
泓昇食品有限公司",2001-06-18,2005-04-29,"Private, ltd by shares"172,0760549,"WEALTH EXPRESS INTERNATIONAL INVESTMENT LIMITED
富通聯合投資有限公司",2001-06-18,2005-03-11,"Private, ltd by shares"173,0760589,"WEALTH SHIPPING LIMITED
偉仕船務有限公司",2001-06-18,2019-08-23,"Private, ltd by shares"174,0760483,"WHA SHIN COMPUTER CO., LIMITED
和新電腦有限公司",2001-06-18,2015-07-03,"Private, ltd by shares"175,0760597,"WING CHUEN (HONG KONG) COMPANY LIMITED
永川(香港)有限公司",2001-06-18,2009-01-16,"Private, ltd by shares"176,0760467,"WING HING TRANSP-BUS CO. LIMITED
榮興旅運巴士有限公司",2001-06-18,,"Private, ltd by shares"177,0760516,"WINGLI MIRROR INDUSTRIAL (H.K.) LIMITED
永利鏡業(香港)有限公司",2001-06-18,2006-10-27,"Private, ltd by shares"178,0760609,"WORLD ELECTRONIC COMMERCIAL EXPRESS (HK) LIMITED
世界電子商報(香港)有限公司",2001-06-18,2003-02-14,"Private, ltd by shares"179,0760497,"WORLD JUMBO LIMITED
世欣有限公司",2001-06-18,,"Private, ltd by shares"180,0760637,"WORLDTRADE 2020.COM LIMITED",2001-06-18,2006-11-03,"Private, ltd by shares"