,Reg no.,Name,Incorp-orated,Dissolved,Type489,2877726,"Terra Drone Hong Kong Limited
香港大地航空科技有限公司",2019-09-27,,"Private, ltd by shares"490,2877603,"TianAi Education Investment (Holding) Group Co., Limited
天愛教育投資(控股)集團有限公司",2019-09-27,,"Private, ltd by shares"491,2877760,"TIANRAN TRADE CO., LIMITED
天冉貿易有限公司",2019-09-27,,"Private, ltd by shares"492,2877763,"TIANYI HOLDING CO., LIMITED
天益控股有限公司",2019-09-27,,"Private, ltd by shares"493,2877711,"TIME GOOD CHINA HOLDINGS LIMITED
吉祥中國控股有限公司",2019-09-27,,"Private, ltd by shares"494,2877702,"TITOP INDUSTRY CO., LIMITED",2019-09-27,,"Private, ltd by shares"495,2877808,"TOP SCIENCE BIOCHEMICAL TECHNOLOGY COMPANY LIMITED
香港寶奇生化科技有限公司",2019-09-27,,"Private, ltd by shares"496,2877835,"TOT Sports Company Limited
跆峰體育用品有限公司",2019-09-27,,"Private, ltd by shares"497,2878027,"TRADE DEALZ LIMITED",2019-09-27,,"Private, ltd by shares"498,2878075,"Travel Panda Limited",2019-09-27,,"Private, ltd by shares"499,2877615,"TREASURE RICH TRADING DEVELOP LIMITED
寶富貿易拓展有限公司",2019-09-27,,"Private, ltd by shares"500,2877973,"Triple L Secretarial And Consultancy Limited
佳創秘書顧問有限公司",2019-09-27,,"Private, ltd by shares"501,2877699,"TRUE NORTH PIONEER LIMITED",2019-09-27,,"Private, ltd by shares"502,2877953,"TUNG WAN INTERNATIONAL TRADING CORPORATION LIMITED
東雲國際貿易有限公司",2019-09-27,,"Private, ltd by shares"503,2878014,"TWIN FLAMES COMPANY LIMITED
雙生火焰有限公司",2019-09-27,,"Private, ltd by shares"504,2877785,"Two thousand fifteen Advertising Limited
貳零壹伍廣告有限公司",2019-09-27,,"Private, ltd by shares"505,2877722,"ULTRA-POWER TECHNOLOGY CO., LIMITED",2019-09-27,,"Private, ltd by shares"506,2877640,"Unichen Grandway Limited
宇宸凱偉有限公司",2019-09-27,,"Private, ltd by shares"507,2877686,"UNITED HARMONY (HK) LIMITED",2019-09-27,,"Private, ltd by shares"508,2877841,"UPWELL CORPORATION LIMITED
卓升有限公司",2019-09-27,,"Private, ltd by shares"509,2877659,"US Texas Oil Group Co., Limited
美國德克薩斯石油集團有限公司",2019-09-27,,"Private, ltd by shares"510,2877917,"VAPEXCEL HK LIMITED",2019-09-27,,"Private, ltd by shares"511,2877834,"Vertex AI Limited
智峰香港有限公司",2019-09-27,,"Private, ltd by shares"512,2877597,"VICI ELECTRONICS TECHNOLOGY LIMITED
維賽電子科技有限公司",2019-09-27,,"Private, ltd by shares"513,2877986,"Visea Technology (HK) Co., Limited
維詩雅科技(香港)有限公司",2019-09-27,,"Private, ltd by shares"514,2877962,"VISTA CHEN COMPANY LIMITED
唯仕達有限公司",2019-09-27,,"Private, ltd by shares"515,2877697,"VKK Group Limited
薇蔻集團有限公司",2019-09-27,,"Private, ltd by shares"516,2877576,"VOLUME TABLEWARE ASIA LIMITED",2019-09-27,,"Private, ltd by shares"517,2877610,"WAH FU TRADING DEVELOP LIMITED
華富貿易拓展有限公司",2019-09-27,,"Private, ltd by shares"518,2877685,"WAN AN SHENG CO., LIMITED
萬安盛有限公司",2019-09-27,,"Private, ltd by shares"519,2877611,"Wang Ji International Health Industry Group Co., Limited
香港王姬國際健康產業集團有限公司",2019-09-27,,"Private, ltd by shares"520,2877645,"WANG SHINE TRADING DEVELOP LIMITED
泓順貿易拓展有限公司",2019-09-27,,"Private, ltd by shares"521,2877735,"WANG SING TRADING DEVELOP LIMITED
宏星貿易拓展有限公司",2019-09-27,,"Private, ltd by shares"522,2877657,"WANG WAH TRADING DEVELOP LIMITED
泓華貿易拓展有限公司",2019-09-27,,"Private, ltd by shares"523,2877608,"WANRONG FILM AND TELEVISION INVESTMENT MANAGEMENT LIMITED
萬榮影視投資管理有限公司",2019-09-27,,"Private, ltd by shares"524,2877943,"Wave Hair Beauty Limited",2019-09-27,,"Private, ltd by shares"525,2877796,"WAY BLOOM INVESTMENT LIMITED
進旺投資有限公司",2019-09-27,,"Private, ltd by shares"526,2877993,"WEALTH GUARDIAN INVESTMENT LIMITED",2019-09-27,,"Private, ltd by shares"527,2877605,"WeClinic (Kwun Tong) Limited
小麥診所(觀塘)有限公司",2019-09-27,,"Private, ltd by shares"528,2877687,"WEN BO LIMITED
聞博有限公司",2019-09-27,,"Private, ltd by shares"529,2877829,"WG INDUSTRIAL (HK) LIMITED
緯光實業(香港)有限公司",2019-09-27,,"Private, ltd by shares"530,2877825,"Wherefor Group Hong Kong Limited",2019-09-27,,"Private, ltd by shares"531,2877997,"WINFORD HONG INT'L GROUP CO., LIMITED
榮福行國際集團有限公司",2019-09-27,,"Private, ltd by shares"532,2878110,"Winning Property Agency Limited
榮利地產代理有限公司",2019-09-27,,"Private, ltd by shares"533,2877746,"Winuo Technology Co., Limited
慧諾科技有限公司",2019-09-27,,"Private, ltd by shares"534,2877837,"WISDOM POWER LIMITED (b2019-09-27)
邁威有限公司",2019-09-27,,"Private, ltd by shares"535,2877595,"Wong Jacky Limited",2019-09-27,,"Private, ltd by shares"536,2877998,"WORLD CHOICE INVESTMENTS LIMITED
永才投資有限公司",2019-09-27,,"Private, ltd by shares"537,2877599,"XIANGRIKUI INDUSTRY LIMITED
向日葵實業有限公司",2019-09-27,,"Private, ltd by shares"538,2877755,"XIBEI TRADE CO., LIMITED
西貝貿易有限公司",2019-09-27,,"Private, ltd by shares"539,2877658,"Xin Neng Consulting Co., Limited
新能諮詢有限公司",2019-09-27,,"Private, ltd by shares"540,2877733,"XINGYAO INT'L TRADE HK LIMITED
星耀國際貿易香港有限公司",2019-09-27,,"Private, ltd by shares"541,2877802,"Xinkun International (Hong Kong) Limited
信坤國際(香港)有限公司",2019-09-27,,"Private, ltd by shares"542,2877780,"XITUAN (HONG KONG) HOLDINGS LIMITED
喜團控股(香港)有限公司",2019-09-27,,"Private, ltd by shares"543,2878092,"XKD CO., LIMITED
芯科達有限公司",2019-09-27,,"Private, ltd by shares"544,2877766,"XSL (HONG KONG) INDUSTRIAL CO., LIMITED
鑫蜀旅(香港)實業有限公司",2019-09-27,,"Private, ltd by shares"545,2877667,"Yahong Trading Co., Limited
亞弘貿易有限公司",2019-09-27,,"Private, ltd by shares"546,2877813,"YI XUE HONGKONG LIMITED
譯學香港有限公司",2019-09-27,,"Private, ltd by shares"547,2877945,"YINGNGAI COMPANY LIMITED
映毅有限公司",2019-09-27,,"Private, ltd by shares"548,2877948,"YISHENGHONG CO., LIMITED
益升宏有限公司",2019-09-27,,"Private, ltd by shares"549,2877574,"YLok Limited
樂怡發展服務有限公司",2019-09-27,,"Private, ltd by shares"550,2878065,"YONGZUAN PAPER (HONG KONG) INTERNATIONAL CO., LIMITED
永鑽紙品(香港)國際有限公司",2019-09-27,,"Private, ltd by shares"551,2877656,"You Sheng Lighting Limited
友昇燈飾有限公司",2019-09-27,,"Private, ltd by shares"552,2877606,"YOUBANG TECHNOLOGY LIMITED
有邦科技有限公司",2019-09-27,,"Private, ltd by shares"553,2878084,"YOUGU TECHNOLOGY LIMITED
優穀科技有限公司",2019-09-27,,"Private, ltd by shares"554,2878082,"Youmei Live Supplies Limited
優美生活用品有限公司",2019-09-27,,"Private, ltd by shares"555,2877970,"YUANQI APPLIED MATERIALS LIMITED
香港元啟應用材料有限公司",2019-09-27,,"Private, ltd by shares"556,2877954,"Yueshang Trading Co., Limited
悅尚貿易有限公司",2019-09-27,,"Private, ltd by shares"557,2878080,"Yuhai Technology (China) Co., Limited
玉海科技有限公司",2019-09-27,,"Private, ltd by shares"558,2877601,"YUJIANGNAN CHAIN LIMITED
禦江南連鎖有限公司",2019-09-27,,"Private, ltd by shares"559,2877751,"YUNMEI TRADE CO., LIMITED
雲美貿易有限公司",2019-09-27,,"Private, ltd by shares"560,2877984,"YUNYI TECHNOLOGY (INTERNATIONAL) LIMITED
云翼科技(香港)國際有限公司",2019-09-27,,"Private, ltd by shares"561,2877644,"YUSSON TRADING CO., LIMITED
裕晟貿易有限公司",2019-09-27,,"Private, ltd by shares"562,2878052,"Z&amp;S GROUP CO., LIMITED
藏神集團有限公司",2019-09-27,,"Private, ltd by shares"563,2877789,"ZF Oriental 10 Limited",2019-09-27,,"Private, ltd by shares"564,2877797,"ZF Oriental 11 Limited",2019-09-27,,"Private, ltd by shares"565,2877769,"ZF Oriental 7 Limited",2019-09-27,,"Private, ltd by shares"566,2877777,"ZF Oriental 8 Limited",2019-09-27,,"Private, ltd by shares"567,2877784,"ZF Oriental 9 Limited",2019-09-27,,"Private, ltd by shares"568,2877570,"ZHE QIS LIMITED
哲齊有限公司",2019-09-27,,"Private, ltd by shares"569,2877848,"ZHIPING TECHNOLOGY CO., LIMITED
智坪科技有限公司",2019-09-27,,"Private, ltd by shares"570,2878005,"ZHONGQUAN INTERNATIONAL HOLDING GROUP CO., LIMITED
中全國際控股集團有限公司",2019-09-27,,"Private, ltd by shares"571,2877902,"ZHONGXU TRADING LIMITED",2019-09-27,,"Private, ltd by shares"572,2877692,"ZI DAI INDUSTRY LIMITED
紫黛實業有限公司",2019-09-27,,"Private, ltd by shares"573,2877940,"Zijin (America) Gold Mining Company Limited
紫金（美洲）黃金礦業有限公司",2019-09-27,,"Private, ltd by shares"574,2878078,"Zizai Live Limited
自在生活有限公司",2019-09-27,,"Private, ltd by shares"