,Reg no.,Name,Incorp-orated,Dissolved,Type242,2877698,"HONGKONG HERUI INTERNATIONAL TRADE CO., LIMITED
香港合瑞國際貿易有限公司",2019-09-27,,"Private, ltd by shares"243,2877653,"Hongkong Kuai Huo International Group Limited
香港快火國際集團有限公司",2019-09-27,,"Private, ltd by shares"244,2877712,"HONGKONG LEDSHOW TECHNOLOGY CO., LIMITED
香港天宇動力科技有限公司",2019-09-27,,"Private, ltd by shares"245,2877804,"HONGKONG LUHONG TRADING LIMITED
香港祿宏貿易有限公司",2019-09-27,,"Private, ltd by shares"246,2878106,"HONGKONG MIMA TRADE LIMITED
香港蜜馬貿易有限公司",2019-09-27,,"Private, ltd by shares"247,2877925,"HONGKONG MINXINYO TECHNOLOGY CO., LIMITED
香港銘芯源科技有限公司",2019-09-27,,"Private, ltd by shares"248,2877690,"HongKong OJQ Trading Limited",2019-09-27,,"Private, ltd by shares"249,2877700,"Hongkong Qianzong Technology Co., Limited
香港千宗科技有限公司",2019-09-27,,"Private, ltd by shares"250,2877721,"HONGKONG SMART GIFTS CO., LIMITED
香港智慧禮品實業有限公司",2019-09-27,,"Private, ltd by shares"251,2878099,"HONGKONG VIEWTRIX TECHNOLOGY LIMITED
香港精優電子科技有限公司",2019-09-27,,"Private, ltd by shares"252,2877924,"HONGKONG XINGHUA TRADE LIMITED
香港興華貿易有限公司",2019-09-27,,"Private, ltd by shares"253,2878022,"Honglicheng Life Services (Hong Kong) Company Limited
宏立城生活服務(香港)有限公司",2019-09-27,,"Private, ltd by shares"254,2877626,"HONGMI TECHNOLOGY LIMITED
鴻米科技有限公司",2019-09-27,,"Private, ltd by shares"255,2877887,"HONGSHAN ELECTRONICS LIMITED
紅山電子有限公司",2019-09-27,,"Private, ltd by shares"256,2877949,"Hongyaosheng Trading Co., Limited
弘耀升貿易有限公司",2019-09-27,,"Private, ltd by shares"257,2878104,"HOOGA Company Limited",2019-09-27,,"Private, ltd by shares"258,2878001,"HOPE STAR INVESTMENTS LIMITED
合成投資有限公司",2019-09-27,,"Private, ltd by shares"259,2877627,"HUAJING ELECTRONICS (STOCK) LIMITED
華晶電子(股份)有限公司",2019-09-27,,"Private, ltd by shares"260,2877761,"HuaXiao Technology Company Limited
華梟科技有限公司",2019-09-27,,"Private, ltd by shares"261,2877946,"Huaye Trading Co., Limited
華業貿易有限公司",2019-09-27,,"Private, ltd by shares"262,2877553,"ICRIS:2877553 (no English name)
艷顏一有限公司",2019-09-27,,"Private, ltd by shares"263,2877554,"ICRIS:2877554 (no English name)
艷顏二有限公司",2019-09-27,,"Private, ltd by shares"264,2877555,"ICRIS:2877555 (no English name)
艷顏三有限公司",2019-09-27,,"Private, ltd by shares"265,2877556,"ICRIS:2877556 (no English name)
艷顏四有限公司",2019-09-27,,"Private, ltd by shares"266,2877557,"ICRIS:2877557 (no English name)
艷顏五有限公司",2019-09-27,,"Private, ltd by shares"267,2877558,"ICRIS:2877558 (no English name)
艷顏六有限公司",2019-09-27,,"Private, ltd by shares"268,2877559,"ICRIS:2877559 (no English name)
翡翠一有限公司",2019-09-27,,"Private, ltd by shares"269,2877560,"ICRIS:2877560 (no English name)
翡翠二有限公司",2019-09-27,,"Private, ltd by shares"270,2877561,"ICRIS:2877561 (no English name)
翡翠三有限公司",2019-09-27,,"Private, ltd by shares"271,2877562,"ICRIS:2877562 (no English name)
翡翠四有限公司",2019-09-27,,"Private, ltd by shares"272,2877563,"ICRIS:2877563 (no English name)
翡翠五有限公司",2019-09-27,,"Private, ltd by shares"273,2877564,"ICRIS:2877564 (no English name)
山風一有限公司",2019-09-27,,"Private, ltd by shares"274,2877565,"ICRIS:2877565 (no English name)
山風二有限公司",2019-09-27,,"Private, ltd by shares"275,2877566,"ICRIS:2877566 (no English name)
山風三有限公司",2019-09-27,,"Private, ltd by shares"276,2877567,"ICRIS:2877567 (no English name)
山風四有限公司",2019-09-27,,"Private, ltd by shares"277,2877568,"ICRIS:2877568 (no English name)
山風五有限公司",2019-09-27,,"Private, ltd by shares"278,2877801,"ICRIS:2877801 (no English name)
香港東恒投資有限公司",2019-09-27,,"Private, ltd by shares"279,2878070,"ICRIS:2878070 (no English name)
鴻享國際貿易(香港)有限公司",2019-09-27,,"Private, ltd by shares"280,2878038,"Illuminatio Medical Technology Limited
明鑒醫療科技有限公司",2019-09-27,,"Private, ltd by shares"281,2877828,"In On Int'l (HK) Trading Limited
易互國際(香港)貿易有限公司",2019-09-27,,"Private, ltd by shares"282,2877632,"INANNA TRADING LIMITED
伊南娜貿易有限公司",2019-09-27,,"Private, ltd by shares"283,2877675,"Incomparable(HK)Network Co., Limited
無比雲(香港)網絡科技有限公司",2019-09-27,,"Private, ltd by shares"284,2877664,"INKSMARK TECHNOLOGY LIMITED",2019-09-27,,"Private, ltd by shares"285,2877868,"InnoPeakPartners Company Limited
智傲發展有限公司",2019-09-27,,"Private, ltd by shares"286,2877579,"INTERCON GROUP (HK) CO., LIMITED
寰中貿易有限公司",2019-09-27,,"Private, ltd by shares"287,2878008,"International Beverage Master Club Co., Limited
國際調飲師俱樂部有限公司",2019-09-27,,"Private, ltd by shares"288,2877779,"INTERNATIONAL HUA SHENG ROBOT INVESTMENT GROUP CO., LIMITED
國際華盛機器人投資集團有限公司",2019-09-27,,"Private, ltd by shares"289,2877870,"INTERNATIONAL STANDARDS CERTIFICATION LIMITED
國際標準認證有限公司",2019-09-27,,"Private, ltd by shares"290,2877901,"International Taiyi Medical Quan Group Co., Limited
國際太乙醫拳集團有限公司",2019-09-27,,"Private, ltd by shares"291,2877683,"Intric Limited (HK)",2019-09-27,,"Private, ltd by shares"292,2878074,"ISO Builder Limited (The)
國際標準認證顧問有限公司",2019-09-27,,"Private, ltd by shares"293,2877710,"ITALY KAIBECA INDUSTRIAL LIMITED
意大利凱貝卡實業有限公司",2019-09-27,,"Private, ltd by shares"294,2877756,"J&amp;S New Materials Trade Co., Limited",2019-09-27,,"Private, ltd by shares"295,2877975,"JADELINK ENTERPRISES LIMITED
進領企業有限公司",2019-09-27,,"Private, ltd by shares"296,2877648,"JET RISE TRADING DEVELOP LIMITED
捷陞貿易拓展有限公司",2019-09-27,,"Private, ltd by shares"297,2877731,"JIAHONGFA DEVELOPMENT CO., LIMITED
佳宏發發展有限公司",2019-09-27,,"Private, ltd by shares"298,2877919,"Jibulai Investment Holdings Limited",2019-09-27,,"Private, ltd by shares"299,2877593,"JING LUN TRADING CO., LIMITED
京倫貿易有限公司",2019-09-27,,"Private, ltd by shares"300,2877830,"JINYINBI MOLD (CHINA) LIMITED
金銀幣鑄造(中國)有限公司",2019-09-27,,"Private, ltd by shares"301,2877956,"JJBOOM LIMITED
錢來發發科技有限公司",2019-09-27,,"Private, ltd by shares"302,2878026,"JOY JET (HONGKONG) LIMITED
藝希香港有限公司",2019-09-27,,"Private, ltd by shares"303,2877853,"JOYFUL FUTURE LIMITED
長悅有限公司",2019-09-27,,"Private, ltd by shares"304,2877941,"Joywin Investment (Hong Kong) Limited",2019-09-27,,"Private, ltd by shares"305,2877625,"JSD HANDICRAFTS LIMITED",2019-09-27,,"Private, ltd by shares"306,2877995,"Jumpy Education Limited
跳豆教室有限公司",2019-09-27,,"Private, ltd by shares"307,2877571,"JUNS LIMITED (HK)
峻煦有限公司",2019-09-27,,"Private, ltd by shares"308,2877816,"Just Right Int'l Edu. Consulting Co. (HK) Limited
香港頂好國際教育咨詢有限公司",2019-09-27,,"Private, ltd by shares"309,2878040,"K&amp;Y HERMIN CO., LIMITED
歐凱悅有限公司",2019-09-27,,"Private, ltd by shares"310,2877928,"K.Y. Estate Limited",2019-09-27,,"Private, ltd by shares"311,2877586,"KA HOP INVESTMENT LIMITED
嘉合投資有限公司",2019-09-27,,"Private, ltd by shares"312,2877952,"KA ON GLOBAL LIMITED
嘉安環球有限公司",2019-09-27,,"Private, ltd by shares"313,2877633,"KAM FULL TRADING DEVELOP LIMITED
金孚貿易拓展有限公司",2019-09-27,,"Private, ltd by shares"314,2877641,"KAM FUNG TRADING DEVELOP LIMITED
金澧貿易拓展有限公司",2019-09-27,,"Private, ltd by shares"315,2877976,"Kangjie Trading Co., Limited
康捷貿易有限公司",2019-09-27,,"Private, ltd by shares"316,2877786,"KEDA PEN MAKING CO., LIMITED
科達制筆有限公司",2019-09-27,,"Private, ltd by shares"317,2877810,"KERRY INTERNATIONAL PROPERTY LIMITED
佳利國際置業有限公司",2019-09-27,,"Private, ltd by shares"318,2877612,"KINETIC COACHING LIMITED
動能教室有限公司",2019-09-27,,"Private, ltd by shares"319,2877867,"KINGDOM VIEW CORPORATION LIMITED
皇景有限公司",2019-09-27,,"Private, ltd by shares"320,2877628,"KNL ENTERPRISE LIMITED",2019-09-27,,"Private, ltd by shares"321,2877839,"Koho Development Company Limited
高嵐發展有限公司",2019-09-27,,"Private, ltd by shares"322,2877642,"KONG CHARM TRADING DEVELOP LIMITED
港湛貿易拓展有限公司",2019-09-27,,"Private, ltd by shares"323,2877869,"KONG DEVELOP LIMITED
港拓有限公司",2019-09-27,,"Private, ltd by shares"324,2878077,"Korestar Limited
可師達有限公司",2019-09-27,,"Private, ltd by shares"325,2877598,"KS Worldwide Holdings Limited",2019-09-27,,"Private, ltd by shares"326,2877638,"KWUN BO TRADING DEVELOP LIMITED
群博貿易拓展有限公司",2019-09-27,,"Private, ltd by shares"327,2877781,"Langtai Wines and Spirits Limited
郎台酒業有限公司",2019-09-27,,"Private, ltd by shares"328,2877927,"LANMENG INTERNATIONAL (AMERICA) EDUCATION GROUP LIMITED
藍夢國際(美國)教育集團有限公司",2019-09-27,,"Private, ltd by shares"329,2878033,"LANX (HK) LIMITED
蘭馨(香港)有限公司",2019-09-27,,"Private, ltd by shares"330,2878120,"Lanxiong Trading Co., Limited
藍雄貿易有限公司",2019-09-27,,"Private, ltd by shares"331,2877936,"LANYI CO., LIMITED
覽益有限公司",2019-09-27,,"Private, ltd by shares"332,2877643,"Le Seong International Limited
樂承國際有限公司",2019-09-27,,"Private, ltd by shares"333,2877719,"LeapFive Technology Limited
躍昉科技有限公司",2019-09-27,,"Private, ltd by shares"334,2877913,"LEE YUEN INTERNATIONAL INVESTMENT LIMITED
利源國際投資有限公司",2019-09-27,,"Private, ltd by shares"335,2877742,"LEMAY HEALTH INTERNATIONAL LIMITED
力美健國際有限公司",2019-09-27,,"Private, ltd by shares"336,2878057,"LEOU TECHNOLOGY LIMITED
樂歐科技有限公司",2019-09-27,,"Private, ltd by shares"337,2878125,"Levanzo Limited",2019-09-27,,"Private, ltd by shares"338,2877748,"LHG TRADING COMPANY LIMITED
良鴻實業有限公司",2019-09-27,,"Private, ltd by shares"339,2877725,"LIANGYOU NEW MATERIALS GROUP LIMITED
良友新材料集團有限公司",2019-09-27,,"Private, ltd by shares"340,2878030,"LIANMEI PETROCHEMICAL INT'L TRADE (HK) CO., LIMITED
聯美石油化工國際貿易(香港)有限公司",2019-09-27,,"Private, ltd by shares"341,2877920,"LianQiao Media HongKong Limited
香港聯橋傳媒有限公司",2019-09-27,,"Private, ltd by shares"342,2878063,"Lidahua Trading Co., Limited
利達華貿易有限公司",2019-09-27,,"Private, ltd by shares"343,2877905,"LING CHAI (HONG KONG) LIMITED
靈齊(香港)有限公司",2019-09-27,,"Private, ltd by shares"344,2877734,"Lingtu Technology (Hong Kong) Group Limited
靈圖科技(香港)集團有限公司",2019-09-27,,"Private, ltd by shares"345,2877824,"LINN GROUP LIMITED
立恩集團有限公司",2019-09-27,,"Private, ltd by shares"346,2877745,"Listrong Limited
立碩有限公司",2019-09-27,,"Private, ltd by shares"347,2877800,"LIU XIN YI TRADING COMPANY LIMITED
欣怡貿易有限公司",2019-09-27,,"Private, ltd by shares"348,2877691,"Livinyl Co., Limited
豐瑞利實業有限公司",2019-09-27,,"Private, ltd by shares"349,2878024,"Lockwood Executive Search Limited (HK)",2019-09-27,,"Private, ltd by shares"350,2878068,"LONGYU INTERNATIONAL INDUSTRIAL LIMITED
隆裕國際實業發展有限公司",2019-09-27,,"Private, ltd by shares"351,2877811,"Lost Junior Production Limited",2019-09-27,,"Private, ltd by shares"352,2877877,"LUCKY HONEST LIMITED
祥鼎有限公司",2019-09-27,2020-11-06,"Private, ltd by shares"353,2878126,"Lucky Star HK Limited",2019-09-27,,"Private, ltd by shares"354,2877744,"Luen Yik Service Company Limited
聯益服務有限公司",2019-09-27,,"Private, ltd by shares"355,2877894,"Luxury Princess Limited
堂煌貿易有限公司",2019-09-27,,"Private, ltd by shares"356,2877977,"LYC TRADING LIMITED
淩雲茶貿易有限公司",2019-09-27,,"Private, ltd by shares"357,2878054,"LYN SHAN INTERNATIONAL INDUSTRIAL CO LIMITED",2019-09-27,,"Private, ltd by shares"358,2877582,"Man Wah Communications Co., Limited
萬華通訊有限公司",2019-09-27,,"Private, ltd by shares"359,2877724,"MARGINLONG TEXTILE LIMITED
裕豐隆紡織有限公司",2019-09-27,,"Private, ltd by shares"360,2877906,"Marine Success Shipping Limited
海成航運有限公司",2019-09-27,,"Private, ltd by shares"361,2878105,"Marquess Group Limited",2019-09-27,,"Private, ltd by shares"362,2877851,"MAXIMUM BEST LIMITED
溢佳有限公司",2019-09-27,,"Private, ltd by shares"363,2877671,"Mayto Limited",2019-09-27,,"Private, ltd by shares"364,2877908,"MEGA LINK INTERNATIONAL LIMITED
宏聯國際有限公司",2019-09-27,,"Private, ltd by shares"365,2877624,"MEIDIAN TECHNOLOGY LIMITED
美典科技有限公司",2019-09-27,,"Private, ltd by shares"366,2877672,"MEMTECH TECHNOLOGY (H.K.) CO., LIMITED
萬德科技(香港)有限公司",2019-09-27,,"Private, ltd by shares"367,2878111,"Mesico LIMITED
曼思柯有限公司",2019-09-27,,"Private, ltd by shares"368,2877852,"METASPEC TECHNOLOGY (HONG KONG) COMPANY LIMITED
美朗科技(香港)有限公司",2019-09-27,,"Private, ltd by shares"369,2877912,"MEXFORD INVESTMENTS LIMITED
萬福投資有限公司",2019-09-27,,"Private, ltd by shares"370,2877740,"MG Invest Limited",2019-09-27,,"Private, ltd by shares"371,2877772,"MIANYANG AOKEM TECHNOLOGY CO., LIMITED
綿陽市奧科科技有限公司",2019-09-27,,"Private, ltd by shares"372,2877693,"Milano Trade Limited
米蘭洛商貿有限公司",2019-09-27,,"Private, ltd by shares"373,2877921,"MILLION WORLD INTERNATIONAL LIMITED
萬偉國際有限公司",2019-09-27,,"Private, ltd by shares"374,2877764,"Ming Xi Display &amp; Design Company Limited
茗兮展示設計有限公司",2019-09-27,,"Private, ltd by shares"375,2877858,"MIYUA COMPANY LIMITED
旂達心有限公司",2019-09-27,,"Private, ltd by shares"376,2877987,"MONEY GOD LIMITED
財神爺有限公司",2019-09-27,,"Private, ltd by shares"377,2878090,"Mstyle Limited
美時代國際有限公司",2019-09-27,,"Private, ltd by shares"378,2877799,"MULSECO CO., LIMITED
美雪科有限公司",2019-09-27,,"Private, ltd by shares"379,2878098,"MULTI-INTELLIGENT INTERNATIONAL PUBLISH GROUP (HK) LIMITED
智能國際出版集團香港有限公司",2019-09-27,,"Private, ltd by shares"380,2877591,"NAIMI TECHNOLOGY LIMITED
耐米科技有限公司",2019-09-27,,"Private, ltd by shares"381,2877932,"Neos Property Holding Company Limited",2019-09-27,,"Private, ltd by shares"382,2877931,"Nexus Property Holding Company Limited",2019-09-27,,"Private, ltd by shares"383,2877939,"NICE FUTURE INVESTMENTS LIMITED
恆遠投資有限公司",2019-09-27,,"Private, ltd by shares"384,2877652,"NIX Concepts HK Limited",2019-09-27,,"Private, ltd by shares"385,2877729,"NVPARTS (HK) ELECTRIC TECHNOLOGY LIMITED
新界光科技有限公司",2019-09-27,,"Private, ltd by shares"386,2877635,"OK Rent Limited
租霸點團有限公司",2019-09-27,,"Private, ltd by shares"387,2878010,"OLENC HOLDING GROUP CO., LIMITED
奧蘭康控股集團有限公司",2019-09-27,,"Private, ltd by shares"388,2878091,"ONE ABOVE CREATION LIMITED",2019-09-27,,"Private, ltd by shares"389,2877854,"OnePrice Limited",2019-09-27,,"Private, ltd by shares"390,2877634,"ORIENTAL MARVEL FILM INDUSTRY GROUP LIMITED
東漫影業集團有限公司",2019-09-27,,"Private, ltd by shares"391,2878094,"P.L INDUSTRIAL LIMITED",2019-09-27,,"Private, ltd by shares"392,2877985,"PALACE BALLROOM LIMITED
皇宮舞廳有限公司",2019-09-27,,"Private, ltd by shares"393,2877842,"PARADISE WISDOM LIMITED
天學有限公司",2019-09-27,,"Private, ltd by shares"394,2878007,"Peer Quality Assurance Limited
貝爾質量保證有限公司",2019-09-27,,"Private, ltd by shares"395,2877706,"PEJU Business Co., Limited
未瀾商貿有限公司",2019-09-27,,"Private, ltd by shares"396,2877630,"PENG QI (HK) TRADING LIMITED
香港鵬琦貿易有限公司",2019-09-27,,"Private, ltd by shares"397,2877794,"Photoretouchonline Limited",2019-09-27,,"Private, ltd by shares"398,2878055,"PIDEGREE CO., LIMITED
派度有限公司",2019-09-27,,"Private, ltd by shares"399,2877807,"Pigsy Technology Co., Limited
豬八戒科技有限公司",2019-09-27,,"Private, ltd by shares"400,2877646,"PIN RUI LIMITED
品瑞有限公司",2019-09-27,,"Private, ltd by shares"401,2877872,"PINE WISDOM LIMITED
福嘉有限公司",2019-09-27,,"Private, ltd by shares"402,2878123,"Pinfam Limited",2019-09-27,,"Private, ltd by shares"403,2877812,"PINGTING BEAUTY CENTRE LIMITED
娉婷美研中心有限公司",2019-09-27,,"Private, ltd by shares"404,2878103,"PNP Markets Limited (HK)",2019-09-27,,"Private, ltd by shares"405,2877753,"POLYMER WEALTH MANAGEMENT COMPANY LIMITED
傲盛財富管理有限公司",2019-09-27,,"Private, ltd by shares"406,2878000,"POWER LINK E-COMMERCE LIMITED
力匯電子商務有限公司",2019-09-27,,"Private, ltd by shares"407,2877965,"POWER TECH LIMITED
科權有限公司",2019-09-27,,"Private, ltd by shares"408,2877765,"PRAX (HK) LIMITED
普瑞克斯(香港)有限公司",2019-09-27,,"Private, ltd by shares"409,2877892,"PREMIER F&amp;B LIMITED
卓越蔘茸海味有限公司",2019-09-27,,"Private, ltd by shares"410,2877844,"PRIDE WELL LIMITED (b2019-09-27)
安拓有限公司",2019-09-27,,"Private, ltd by shares"411,2877890,"PRIME SMART INTERNATIONAL LIMITED
鴻俊國際有限公司",2019-09-27,,"Private, ltd by shares"412,2877827,"PROFIT WAVES GROUP LIMITED
溢浩集團有限公司",2019-09-27,,"Private, ltd by shares"413,2877849,"PROSPECT BRIDGE LIMITED
高傑有限公司",2019-09-27,,"Private, ltd by shares"414,2877569,"PTC Businesses Limited",2019-09-27,,"Private, ltd by shares"415,2877899,"QIAN FU (HONG KONG) LIMITED
仟富(香港)有限公司",2019-09-27,,"Private, ltd by shares"416,2877988,"Qiu Rui Trading Co., Limited
秋瑞貿易有限公司",2019-09-27,,"Private, ltd by shares"417,2877861,"Quooker Hong Kong Limited",2019-09-27,,"Private, ltd by shares"418,2877805,"Quooker Services Limited",2019-09-27,,"Private, ltd by shares"419,2877815,"Rada Limited (HK)
睿德集團有限公司",2019-09-27,,"Private, ltd by shares"420,2877873,"RED VENTURE TRADING LIMITED
鴻富貿易有限公司",2019-09-27,,"Private, ltd by shares"421,2877895,"Reeve Trading Company Limited
堅石貿易有限公司",2019-09-27,,"Private, ltd by shares"422,2877900,"Reko Limited",2019-09-27,,"Private, ltd by shares"423,2877754,"REMOTEC HOLDINGS (HONG KONG) LIMITED
威的控股(香港)有限公司",2019-09-27,,"Private, ltd by shares"424,2878037,"RESTAURANTS EQUIPMENT INTERNATIONAL COMPANY LIMITED",2019-09-27,,"Private, ltd by shares"425,2877857,"RIGHT EASTERN TRADING LIMITED
正東貿易有限公司",2019-09-27,,"Private, ltd by shares"426,2877871,"Rilin GoldSand International Co., Limited
瑞林金沙(國際)有限公司",2019-09-27,,"Private, ltd by shares"427,2877926,"Rises Intelligent Equipment (HongKong) Co., Limited
睿盛斯裝備(香港)有限公司",2019-09-27,,"Private, ltd by shares"428,2878003,"RISING UNION INVESTMENTS LIMITED
陞聯投資有限公司",2019-09-27,,"Private, ltd by shares"429,2878047,"Runda Industrial International Limited
潤達實業國際有限公司",2019-09-27,,"Private, ltd by shares"430,2878032,"Runsheng Industrial Co., Limited
潤升實業有限公司",2019-09-27,,"Private, ltd by shares"431,2877619,"SAISHUN (HONG KONG) LIMITED
賽順(香港)有限公司",2019-09-27,,"Private, ltd by shares"432,2877838,"SHANDONG SANYOUNG INDUSTRY CO., LIMITED
山東三陽化工有限公司",2019-09-27,,"Private, ltd by shares"433,2877705,"SHANGHAI JIXIANG GOLD COMPOSITE MATERIAL LIMITED
上海吉祥金屬複合材料有限公司",2019-09-27,,"Private, ltd by shares"434,2877832,"SHEN HUA JING (HONG KONG) LIMITED
深華晶(香港)有限公司",2019-09-27,,"Private, ltd by shares"435,2878036,"SHENG INDUSTRIAL CO., LIMITED
思行實業有限公司",2019-09-27,,"Private, ltd by shares"436,2877814,"SHENGXIN TOPO GROUP CO., LIMITED",2019-09-27,,"Private, ltd by shares"437,2877947,"Sheyuan Whale Trading Co., Limited
步遠鯨貿易有限公司",2019-09-27,,"Private, ltd by shares"438,2877662,"Shing Yip Engineering Company Limited
成業工程設備有限公司",2019-09-27,,"Private, ltd by shares"439,2877629,"SHUM TUNG TRADING DEVELOP LIMITED
深東貿易拓展有限公司",2019-09-27,,"Private, ltd by shares"440,2877990,"SHUN CHEONG HONG KONG LIMITED
順昌(香港)有限公司",2019-09-27,,"Private, ltd by shares"441,2877989,"SHUN FOOK PROPERTY DEVELOPMENT LIMITED
順福物業發展有限公司",2019-09-27,,"Private, ltd by shares"442,2877994,"SHUN YING HONG KONG LIMITED",2019-09-27,,"Private, ltd by shares"443,2878035,"Shuwei International (Hong Kong) Decoration Design Engineering Limited
墅唯國際(香港)裝飾設計工程有限公司",2019-09-27,,"Private, ltd by shares"444,2877847,"Silly Savvy Limited",2019-09-27,,"Private, ltd by shares"445,2877768,"SILVER MEDIA CATERING COMPANY LIMITED
銀治餐飲有限公司",2019-09-27,,"Private, ltd by shares"446,2878051,"Simplicity Four Limited
從簡有限公司",2019-09-27,,"Private, ltd by shares"447,2877718,"Singapore Starsha Management Group Co., Limited
新加坡星莎管理集團有限公司",2019-09-27,,"Private, ltd by shares"448,2877636,"SINO FULLRICH TRADING DEVELOP LIMITED
華灃貿易拓展有限公司",2019-09-27,,"Private, ltd by shares"449,2877914,"SinoMedCare HongKong Trading Limited (b2019-09-27)
斯邁康香港貿易有限公司",2019-09-27,,"Private, ltd by shares"450,2877961,"Six Points Industrial Co., Limited
六點實業有限公司",2019-09-27,,"Private, ltd by shares"451,2877942,"Siyi Trade Co., Limited
思逸貿易有限公司",2019-09-27,,"Private, ltd by shares"452,2878121,"SJ Trading (Hong Kong) Co., Limited
紹傑貿易（香港）有限公司",2019-09-27,,"Private, ltd by shares"453,2878029,"SK CONSULTANCY LIMITED",2019-09-27,,"Private, ltd by shares"454,2877703,"SKF (Hong Kong) Investment Co., Limited
斯凱孚(香港)投資有限公司",2019-09-27,,"Private, ltd by shares"455,2877938,"SKRYTEKA LIMITED",2019-09-27,,"Private, ltd by shares"456,2877891,"SKY CROWN INTERNATIONAL LIMITED
天君國際有限公司",2019-09-27,,"Private, ltd by shares"457,2877767,"SKY NEON LIMITED
天霓有限公司",2019-09-27,,"Private, ltd by shares"458,2877909,"SKY PERFECT INTERNATIONAL LIMITED
天麗國際有限公司",2019-09-27,,"Private, ltd by shares"459,2877863,"SKY RICH LIMITED
良豐有限公司",2019-09-27,,"Private, ltd by shares"460,2878059,"Sky Venture (HK) Holdings Limited",2019-09-27,,"Private, ltd by shares"461,2877617,"Smart Health Technology International Limited
國際智慧健康科技有限公司",2019-09-27,,"Private, ltd by shares"462,2877581,"Smartconda Co., Limited",2019-09-27,,"Private, ltd by shares"463,2877588,"Solfege Land Piano School Limited",2019-09-27,,"Private, ltd by shares"464,2877916,"SOOWISE INT'L (HK) LIMITED
世瑞國際(香港)有限公司",2019-09-27,,"Private, ltd by shares"465,2877743,"Spring Sun International Group Co., Limited
春筍國際集團有限公司",2019-09-27,,"Private, ltd by shares"466,2877876,"SPWC Hong Kong Limited",2019-09-27,,"Private, ltd by shares"467,2878112,"STAR BRIGHT GROUP LIMITED
香港星瑞飾品有限公司",2019-09-27,,"Private, ltd by shares"468,2877886,"STAR SUCCESS LIMITED
確成有限公司",2019-09-27,,"Private, ltd by shares"469,2877622,"STAR TRADING DEVELOP LIMITED
大星貿易拓展有限公司",2019-09-27,,"Private, ltd by shares"470,2877583,"STARTUP PROJECT VENTURES LIMITED",2019-09-27,,"Private, ltd by shares"471,2877840,"STEP DRAGON DEVELOPMENT LIMITED
龍達發展有限公司",2019-09-27,,"Private, ltd by shares"472,2877678,"StormEye Asia Limited",2019-09-27,,"Private, ltd by shares"473,2877682,"StormEye Cybersecurity Limited",2019-09-27,,"Private, ltd by shares"474,2877979,"Strategic Healthcare Holding Limited",2019-09-27,,"Private, ltd by shares"475,2877864,"SUN GOAL LIMITED
凱志有限公司",2019-09-27,,"Private, ltd by shares"476,2877752,"SUN ORIGIN LIMITED
源日有限公司",2019-09-27,,"Private, ltd by shares"477,2877713,"SUNMORE INTERNATIONAL HOLDINGS LIMITED
三木國際控股有限公司",2019-09-27,,"Private, ltd by shares"478,2877951,"SUNNY AIR CONDITIONING ENGINEERING CO., LIMITED
實力冷氣工程有限公司",2019-09-27,,"Private, ltd by shares"479,2877651,"SUNNY HOUSE FURNITURE CO. LIMITED
桑妮家居有限公司",2019-09-27,,"Private, ltd by shares"480,2877637,"SWIFT RICH TRADING DEVELOP LIMITED
敏丰貿易拓展有限公司",2019-09-27,,"Private, ltd by shares"481,2877865,"Tahlems Trading Limited
泰樂姆貿易有限公司",2019-09-27,,"Private, ltd by shares"482,2878042,"Taihai International Co., Limited
泰海國際有限公司",2019-09-27,,"Private, ltd by shares"483,2877616,"TAIZIGE BRAND LIMITED
太子哥品牌有限公司",2019-09-27,,"Private, ltd by shares"484,2877883,"TALENT GAIN LIMITED
訊溢有限公司",2019-09-27,,"Private, ltd by shares"485,2877836,"TAT TREASURE TRADING DEVELOP LIMITED
達庫貿易拓展有限公司",2019-09-27,,"Private, ltd by shares"486,2877999,"Teacher Seeker Services of Asia Limited",2019-09-27,,"Private, ltd by shares"487,2877602,"TECHLIN INVESTMENT (HK) LIMITED
德林投資(香港)有限公司",2019-09-27,,"Private, ltd by shares"488,2877971,"TED Service Limited",2019-09-27,,"Private, ltd by shares"