,Reg no.,Name,Incorp-orated,Dissolved,Type1,2877771,"3T6B Limited
三頭六臂有限公司",2019-09-27,,"Private, ltd by shares"2,2877694,"A. Louis International Limited",2019-09-27,,"Private, ltd by shares"3,2878048,"ABNAV LIMITED",2019-09-27,,"Private, ltd by shares"4,2877915,"ACEFW LIMITED",2019-09-27,,"Private, ltd by shares"5,2877896,"Add Oil Entertainment Limited
加油娛樂有限公司",2019-09-27,,"Private, ltd by shares"6,2878101,"ADGITA TECHNOLOGY CO., LIMITED
艾迪集科技有限公司",2019-09-27,,"Private, ltd by shares"7,2877650,"AIRudder Technologies HK Limited",2019-09-27,,"Private, ltd by shares"8,2878012,"Albedo Corp Limited",2019-09-27,,"Private, ltd by shares"9,2878041,"Alidan Technology Co., Limited
阿利單科技有限公司",2019-09-27,,"Private, ltd by shares"10,2877855,"Allied Health Elements Company Limited
圓方醫療科技有限公司",2019-09-27,,"Private, ltd by shares"11,2877862,"Allied Services Hong Kong Limited",2019-09-27,,"Private, ltd by shares"12,2877806,"ALPHA ONE SAN MARINO LIMITED",2019-09-27,,"Private, ltd by shares"13,2878119,"AMPLE FIVE TRADING LIMITED",2019-09-27,,"Private, ltd by shares"14,2878118,"AMPLE FOUR TRADING LIMITED",2019-09-27,,"Private, ltd by shares"15,2878114,"AMPLE ONE TRADING LIMITED",2019-09-27,,"Private, ltd by shares"16,2878116,"AMPLE THREE TRADING LIMITED",2019-09-27,,"Private, ltd by shares"17,2878115,"AMPLE TWO TRADING LIMITED",2019-09-27,,"Private, ltd by shares"18,2878044,"AMYCA (HONGKONG) LIMITED
艾美悅誠（香港）有限公司",2019-09-27,,"Private, ltd by shares"19,2877609,"AN JIE SAI LIMITED
安傑賽有限公司",2019-09-27,,"Private, ltd by shares"20,2877749,"Angus Genius Investment Limited
正永投資有限公司",2019-09-27,,"Private, ltd by shares"21,2877741,"ANYUN INT'L LOGISTICS LIMITED
安運國際物流有限公司",2019-09-27,,"Private, ltd by shares"22,2877594,"AOLONG INDUSTRIAL DEVELOPMENT LIMITED
奧龍實業發展有限公司",2019-09-27,,"Private, ltd by shares"23,2878043,"AQUA VENTURE LIMITED
海譽有限公司",2019-09-27,,"Private, ltd by shares"24,2877663,"ART ON TRADING DEVELOP LIMITED
雅安貿易拓展有限公司",2019-09-27,,"Private, ltd by shares"25,2877660,"ART SUCCESS TRADING DEVELOP LIMITED
雅成貿易拓展有限公司",2019-09-27,,"Private, ltd by shares"26,2877679,"ART YORK TRADING DEVELOP LIMITED
藝沃貿易拓展有限公司",2019-09-27,,"Private, ltd by shares"27,2877639,"ASFM Holdings HK Limited",2019-09-27,,"Private, ltd by shares"28,2877666,"Autin Technology Co., Limited
奧鼎科技有限公司",2019-09-27,,"Private, ltd by shares"29,2877668,"Avance Leather &amp; Accessories Co., Limited",2019-09-27,,"Private, ltd by shares"30,2877819,"AVANT SOLUTIONS LIMITED (HK)",2019-09-27,,"Private, ltd by shares"31,2877937,"Award Prospect Limited
澳華發展有限公司",2019-09-27,,"Private, ltd by shares"32,2877720,"AZGEO LIMITED",2019-09-27,,"Private, ltd by shares"33,2878060,"Babudou Sports Goods (HK) Limited
巴布豆體育用品(香港)有限公司",2019-09-27,,"Private, ltd by shares"34,2878088,"BAI LONG INTERNATIONAL (HONG KONG) LIMITED
百隆國際(香港)有限公司",2019-09-27,,"Private, ltd by shares"35,2877960,"Baowangda Trading Co., Limited
寶旺大貿易有限公司",2019-09-27,,"Private, ltd by shares"36,2877649,"BE STILL MEDIA LIMITED",2019-09-27,,"Private, ltd by shares"37,2877795,"BEAUTI-GLORY TRADING LIMITED
麗鴻貿易有限公司",2019-09-27,,"Private, ltd by shares"38,2877738,"BENTAI ELECTRONICS CO., LIMITED
犇泰電子有限公司",2019-09-27,,"Private, ltd by shares"39,2877727,"BEST HOME INTERNATIONAL CONSULTING LIMITED
佰佳諮詢有限公司",2019-09-27,,"Private, ltd by shares"40,2877878,"BEST SEA LIMITED
洋佳有限公司",2019-09-27,,"Private, ltd by shares"41,2877929,"Best Trader Limited",2019-09-27,,"Private, ltd by shares"42,2877783,"BEST WAYS LIMITED
焯越有限公司",2019-09-27,,"Private, ltd by shares"43,2878062,"BESTHAI INTERNATIONAL HOLDINGS LIMITED
碧海國際控股有限公司",2019-09-27,,"Private, ltd by shares"44,2877714,"BESTOO INVESTMENT GROUP LIMITED
百通投資集團有限公司",2019-09-27,,"Private, ltd by shares"45,2877759,"BESTWIN TRADING LIMITED
百熒貿易有限公司",2019-09-27,,"Private, ltd by shares"46,2877573,"BEYONDCONSULT LIMITED",2019-09-27,,"Private, ltd by shares"47,2877715,"BEYONDIGY HONG KONG LIMITED
海普瑞康香港有限公司",2019-09-27,,"Private, ltd by shares"48,2877955,"BG Group (HongKong) Limited
博觀集團(香港)有限公司",2019-09-27,,"Private, ltd by shares"49,2877889,"BIG HAPPINESS LIMITED (b2019-09-27)
泰喜有限公司",2019-09-27,,"Private, ltd by shares"50,2877974,"BIJIN WORLD(HK) LIMITED
素肌美體有限公司",2019-09-27,,"Private, ltd by shares"51,2878019,"BILLION GLOBAL DEVELOPMENT LIMITED
億世發展有限公司",2019-09-27,,"Private, ltd by shares"52,2877680,"BITMORE TECHNOLOGY LIMITED
畢莫科技有限公司",2019-09-27,,"Private, ltd by shares"53,2877859,"BJ International Institute of Youth Studies Limited
北京國際青年研修學院有限公司",2019-09-27,,"Private, ltd by shares"54,2878015,"Blue Mountain Electronics Co., Limited
藍山電子有限公司",2019-09-27,,"Private, ltd by shares"55,2878050,"BMC HOLDINGS (HK) LIMITED",2019-09-27,,"Private, ltd by shares"56,2877762,"BO KIT (HONG KONG) CO. LIMITED
博杰(香港)有限公司",2019-09-27,,"Private, ltd by shares"57,2877875,"BOX STUDIO LIMITED (THE)
盒作點有限公司",2019-09-27,,"Private, ltd by shares"58,2878064,"BRIGHT STEP LIMITED
百升有限公司",2019-09-27,,"Private, ltd by shares"59,2877898,"BRIGHT TECH (HONG KONG) LIMITED
啟昭科技(香港)有限公司",2019-09-27,,"Private, ltd by shares"60,2877922,"Brownsmiss Global Holding Limited
布詩國際控股有限公司",2019-09-27,,"Private, ltd by shares"61,2878025,"Bull's Valley Group Limited
純牛谷集團有限公司",2019-09-27,,"Private, ltd by shares"62,2877670,"Business Pulse Limited",2019-09-27,,"Private, ltd by shares"63,2877846,"C&amp;J Exchange Centre Limited
中日青年交流中心有限公司",2019-09-27,,"Private, ltd by shares"64,2878018,"Cahore Limited",2019-09-27,,"Private, ltd by shares"65,2877604,"CAPITAL SEA LIMITED",2019-09-27,,"Private, ltd by shares"66,2877881,"CARVITECH TRADE CO., LIMITED
卡威科技商貿有限公司",2019-09-27,,"Private, ltd by shares"67,2877903,"Celia Make-up Group Limited",2019-09-27,,"Private, ltd by shares"68,2878020,"CENTRAL LINK DEVELOPMENT LIMITED
中領發展有限公司",2019-09-27,,"Private, ltd by shares"69,2877584,"CF ENVIRONMENTAL ENGINEERING LIMITED
卓峰環保工程有限公司",2019-09-27,,"Private, ltd by shares"70,2877688,"Cha Thai Restaurant Limited
茶泰餐廳有限公司",2019-09-27,,"Private, ltd by shares"71,2877918,"CHAIN STAR DEVELOPMENT LIMITED
卓成發展有限公司",2019-09-27,,"Private, ltd by shares"72,2877930,"CHANCE FILL TRADING DEVELOP LIMITED
展灃貿易拓展有限公司",2019-09-27,,"Private, ltd by shares"73,2877747,"Changzi Co., Limited
暢子有限公司",2019-09-27,,"Private, ltd by shares"74,2877958,"CHAOYIN INVESTMENT MANAGEMENT LIMITED
超銀投資管理有限公司",2019-09-27,,"Private, ltd by shares"75,2877963,"Chapter One Pop Music Institute Limited
第一流行音樂教室有限公司",2019-09-27,,"Private, ltd by shares"76,2877910,"CHASE ON PLASTIC HOUSEWARE LIMITED
潮安塑膠家庭用品有限公司",2019-09-27,,"Private, ltd by shares"77,2877850,"CHEERFUL ASCENT LIMITED
旭怡有限公司",2019-09-27,,"Private, ltd by shares"78,2877981,"CHEUNG SUN TRADING DEVELOP LIMITED
翔新貿易拓展有限公司",2019-09-27,,"Private, ltd by shares"79,2877677,"CHIEF (CHINA) CULTURAL MEDIA LIMITED
中國眾富文化傳媒集團有限公司",2019-09-27,,"Private, ltd by shares"80,2877613,"China Anhua Holdings Limited
中國安華控股有限公司",2019-09-27,,"Private, ltd by shares"81,2877707,"China Art Dance Association Co., Limited
中國藝術舞蹈協會有限公司",2019-09-27,,"Private, ltd by shares"82,2877758,"CHINA BEIDOU SATELLITE GLOBAL MOBILE TOP-UP CARD SECURITY PAYMENT LIMITED
中國北斗衛星全球移動充值卡安全支付有限公司",2019-09-27,,"Private, ltd by shares"83,2878045,"China Digital Economy Development Co., Limited
中國數字經濟發展有限公司",2019-09-27,,"Private, ltd by shares"84,2877708,"China Jinghua Co., Limited
中國京化有限公司",2019-09-27,,"Private, ltd by shares"85,2877880,"China SME Risk Management Center Co., Limited
中國中小企業風險管理中心有限公司",2019-09-27,,"Private, ltd by shares"86,2877897,"CHINA TOURISM PLANNING AND DESIGN INSTITUTE LIMITED
中國旅遊規劃設計院有限公司",2019-09-27,,"Private, ltd by shares"87,2877737,"CHINESE NATIONAL GUANGCAI AIHUA ENTREPRENEURS FEDERATION CO., LIMITED (THE)
中華民族光彩愛華企業家聯合會有限公司",2019-09-27,,"Private, ltd by shares"88,2878083,"Chu Sheung Chu (Hong Kong) Company Limited
珠尚珠(香港)有限公司",2019-09-27,,"Private, ltd by shares"89,2877614,"CHUN CHEUK TRADING DEVELOP LIMITED
雋綽貿易拓展有限公司",2019-09-27,,"Private, ltd by shares"90,2877620,"CIMO Consultant &amp; Agency Limited",2019-09-27,,"Private, ltd by shares"91,2877607,"City Hall Dining (Group) Limited
大會堂餐飲(集團)有限公司",2019-09-27,,"Private, ltd by shares"92,2877996,"CIXI JEWELRY LIMITED
慈禧珠寶有限公司",2019-09-27,,"Private, ltd by shares"93,2877957,"CM Stone International Limited
中民石材國際有限公司",2019-09-27,,"Private, ltd by shares"94,2877821,"CoBinla Tech Limited",2019-09-27,,"Private, ltd by shares"95,2877590,"COMTECH ELECTRONICS LIMITED
科通電子有限公司",2019-09-27,,"Private, ltd by shares"96,2877684,"CONCEPT CELL BIO-TECH LIMITED
康賽生物科技有限公司",2019-09-27,,"Private, ltd by shares"97,2877621,"CREATION ADVANCE TRADING DEVELOP LIMITED
創研貿易拓展有限公司",2019-09-27,,"Private, ltd by shares"98,2877788,"CREATIVE CITY CORPORATION LIMITED
創都有限公司",2019-09-27,,"Private, ltd by shares"99,2878081,"Crezeal Limited (HK)",2019-09-27,,"Private, ltd by shares"100,2877911,"CROWN LEADER HOLDINGS LIMITED
廣達集團有限公司",2019-09-27,,"Private, ltd by shares"101,2878002,"CUISINIER ANGELO COMPANY LIMITED",2019-09-27,,"Private, ltd by shares"102,2877933,"DACHEN INTERNATIONAL LIMITED
大臣國際有限公司",2019-09-27,,"Private, ltd by shares"103,2877580,"DataMesh HK Limited",2019-09-27,,"Private, ltd by shares"104,2877732,"Dating Matrix Co., Limited",2019-09-27,,"Private, ltd by shares"105,2877757,"DAYU (HONG KONG) LIMITED
大禹(香港)有限公司",2019-09-27,,"Private, ltd by shares"106,2878072,"DC Construction (Int'l) Engineering Management Co., Limited
鼎城建設(國際)工程管理有限公司",2019-09-27,,"Private, ltd by shares"107,2877978,"DEMETER DEVELOPMENT LIMITED",2019-09-27,,"Private, ltd by shares"108,2877775,"Ding Yue International Group Limited
鼎悅國際集團有限公司",2019-09-27,,"Private, ltd by shares"109,2878058,"DONGFANG JINYU INTERNATIONAL HOLDING GROUP LIMITED
東方金玉國際控股集團有限公司",2019-09-27,,"Private, ltd by shares"110,2878117,"Dongwei Trading Co., Limited
東衛貿易有限公司",2019-09-27,,"Private, ltd by shares"111,2877701,"DREAMLUX LIGHTING CO., LIMITED
西亞曆照明科技有限公司",2019-09-27,,"Private, ltd by shares"112,2877618,"DSL HANDICRAFTS LIMITED
德仕隆手工藝品有限公司",2019-09-27,,"Private, ltd by shares"113,2877739,"Duncan Contracting Limited
登勤專業工程有限公司",2019-09-27,,"Private, ltd by shares"114,2877885,"DYNAMIC LEADER LIMITED
奔騰有限公司",2019-09-27,,"Private, ltd by shares"115,2877791,"EAGLE SHINE LIMITED (b2019-09-27)
滙鵬有限公司",2019-09-27,,"Private, ltd by shares"116,2877980,"EAGLE TEAM LIMITED
鵬添有限公司",2019-09-27,,"Private, ltd by shares"117,2878122,"EASING ENGINEERING LIMITED
悅盛工程有限公司",2019-09-27,,"Private, ltd by shares"118,2877572,"Easy Shopping Limited
購物易有限公司",2019-09-27,,"Private, ltd by shares"119,2878073,"Ecopromos Line Co., Limited
廣州易可產品有限公司",2019-09-27,,"Private, ltd by shares"120,2877631,"Education in Field Limited
禾場教育有限公司",2019-09-27,,"Private, ltd by shares"121,2877575,"Ekologic Limited",2019-09-27,,"Private, ltd by shares"122,2877874,"Enchi Asia Limited
恩馳亞洲有限公司",2019-09-27,,"Private, ltd by shares"123,2878085,"Evolve Trade Limited",2019-09-27,,"Private, ltd by shares"124,2877879,"EWORK ENTERPRISE LIMITED
威龍達網絡技術有限公司",2019-09-27,,"Private, ltd by shares"125,2877798,"EXCEL PLUS LIMITED
高和有限公司",2019-09-27,,"Private, ltd by shares"126,2877968,"EXCEL SOURCE LIMITED
雋源有限公司",2019-09-27,,"Private, ltd by shares"127,2877893,"FAITHFUL CHINA DEVELOPMENT LIMITED
誠華發展有限公司",2019-09-27,,"Private, ltd by shares"128,2877689,"FANG ZHONG SPORT ACCESSORIES CO., LIMITED
方中運動配件有限公司",2019-09-27,,"Private, ltd by shares"129,2878053,"FASTLANE JSK COMPANY LIMITED",2019-09-27,,"Private, ltd by shares"130,2877787,"FDBRO LIMITED
香港廣世貿易有限公司",2019-09-27,,"Private, ltd by shares"131,2877907,"FETEWAY TRADING LIMITED
發特貿易有限公司",2019-09-27,,"Private, ltd by shares"132,2877669,"FIRST REAGENT CHINA LIMITED",2019-09-27,,"Private, ltd by shares"133,2877709,"FITI (HK) TESTING &amp; INSPECTION LIMITED",2019-09-27,,"Private, ltd by shares"134,2877589,"Flash Hobby Technology Co., Limited",2019-09-27,,"Private, ltd by shares"135,2877577,"Flipped Mobility (HK) Services Limited",2019-09-27,,"Private, ltd by shares"136,2878016,"Flower Message Life Research Institute Limited
花信生活研究所有限公司",2019-09-27,,"Private, ltd by shares"137,2878006,"Fly First For Less Limited",2019-09-27,,"Private, ltd by shares"138,2877578,"FLY Healthtech Limited
大天鵝科技有限公司",2019-09-27,,"Private, ltd by shares"139,2878009,"FLYING GLOBAL (HK) LIMITED
飛天環球(香港)有限公司",2019-09-27,,"Private, ltd by shares"140,2877661,"FOREVER ENTERPRISES HONG KONG LIMITED
申弘實業有限公司",2019-09-27,,"Private, ltd by shares"141,2878109,"FRANCE BUBEURRY INTERNATIONAL GROUP LIMITED",2019-09-27,,"Private, ltd by shares"142,2878093,"Fu Ju De (Group) Limited
福聚德(集團)有限公司",2019-09-27,,"Private, ltd by shares"143,2878017,"FULL PROFIT INDUSTRIES LIMITED
富億實業有限公司",2019-09-27,,"Private, ltd by shares"144,2877655,"FULLXIN SHOES MATERIALS CO., LIMITED",2019-09-27,,"Private, ltd by shares"145,2877992,"Future Fusion Company Limited",2019-09-27,,"Private, ltd by shares"146,2878086,"G-HOPE TRADING LIMITED
希聯金貿易有限公司",2019-09-27,,"Private, ltd by shares"147,2877882,"G.STONE LIMITED",2019-09-27,,"Private, ltd by shares"148,2877884,"GAIN ART LIMITED
盛雅有限公司",2019-09-27,,"Private, ltd by shares"149,2877935,"Gallium Yi Trading Co., Limited
鎵億貿易有限公司",2019-09-27,,"Private, ltd by shares"150,2877809,"Genesis Creation (Hong Kong) Company Limited
晨創天地(香港)有限公司",2019-09-27,,"Private, ltd by shares"151,2878004,"GENSUN TECHNOLOGY LIMITED",2019-09-27,,"Private, ltd by shares"152,2877600,"GERMANY ENLAIS CO., LIMITED
德國恩萊斯有限公司",2019-09-27,,"Private, ltd by shares"153,2878066,"GLENNY SPECIALIST CONTRACTORS LIMITED
建利專科營造有限公司",2019-09-27,,"Private, ltd by shares"154,2878079,"GLOBAL ARTS AND CULTURE ALLIANCE LIMITED
全球藝術文化聯盟有限公司",2019-09-27,,"Private, ltd by shares"155,2878049,"Global Catering Association Limited
全球餐飲協會有限公司",2019-09-27,,"Private, ltd by shares"156,2877969,"Global Digital Economy Research Institute Holdings Limited
全球數字經濟研究院控股有限公司",2019-09-27,,"Private, ltd by shares"157,2877823,"Global Ferry Limited
全球渡口有限公司",2019-09-27,,"Private, ltd by shares"158,2877866,"Global Trade Exhibitions Limited
環球貿易展覽有限公司",2019-09-27,,"Private, ltd by shares"159,2877792,"Global Trading Works Limited",2019-09-27,,"Private, ltd by shares"160,2878087,"GOLD STAR FASHION GROUP LIMITED
香港星燦飾品有限公司",2019-09-27,,"Private, ltd by shares"161,2877856,"GOLDEN JOYFUL LIMITED
穎金有限公司",2019-09-27,,"Private, ltd by shares"162,2877888,"GOLDEN PLUS LIMITED
鼎金有限公司",2019-09-27,,"Private, ltd by shares"163,2878071,"GOLDEN SEAL (HK) DEVELOPMENT CO., LIMITED
金璽（香港）開發有限公司",2019-09-27,,"Private, ltd by shares"164,2877944,"Goldswin Enterprise Limited
金泓潤實業有限公司",2019-09-27,,"Private, ltd by shares"165,2877623,"GONGWUI CAPITAL INVESTMENT CO. LIMITED
港匯資本投資有限公司",2019-09-27,,"Private, ltd by shares"166,2878046,"GOOD FORTUNE (ASIA) LIMITED
廣福(亞洲)有限公司",2019-09-27,,"Private, ltd by shares"167,2878124,"GRAND EMBRO TRADING LIMITED
繡彩貿易有限公司",2019-09-27,,"Private, ltd by shares"168,2878011,"Grand Prospect Construction Co., Limited
宏希工程有限公司",2019-09-27,,"Private, ltd by shares"169,2877904,"Grand River Hong Kong Limited
集江河有限公司",2019-09-27,,"Private, ltd by shares"170,2877654,"Green Lands Develop Limited",2019-09-27,,"Private, ltd by shares"171,2877820,"GUANGZHOU ECE CHEMICAL PRODUCT CO., LIMITED
廣州藝格化工產品有限公司",2019-09-27,,"Private, ltd by shares"172,2877728,"Hai Bei International Music Art Academy Co., Limited
海貝國際音樂藝術學院有限公司",2019-09-27,,"Private, ltd by shares"173,2877964,"HAI YU TELECOM LIMITED
海宇電訊有限公司",2019-09-27,,"Private, ltd by shares"174,2877647,"HANACREEK DEVELOPMENT HK PTY LIMITED",2019-09-27,,"Private, ltd by shares"175,2877991,"Hanfung Industrial (HK) CO., Limited
香港恒峰實業有限公司",2019-09-27,,"Private, ltd by shares"176,2877674,"Hang Hing Design Decoration &amp; Engineering Company Limited
恒興設計裝飾工程有限公司",2019-09-27,,"Private, ltd by shares"177,2877776,"Hang Shing Lighting System Limited
恆盛照明系統有限公司",2019-09-27,,"Private, ltd by shares"178,2878028,"Hangda Trade Development Co., Limited
航達貿易拓展有限公司",2019-09-27,,"Private, ltd by shares"179,2877750,"HANGXING HOLDING CO., LIMITED
杭星控股有限公司",2019-09-27,,"Private, ltd by shares"180,2877673,"HANVIEW INTELLIGENT COMPANY LIMITED
漢為智能有限公司",2019-09-27,,"Private, ltd by shares"181,2877967,"Hanyang Industrial (HongKong) Co., Limited
翰洋實業(香港)有限公司",2019-09-27,,"Private, ltd by shares"182,2878089,"Hao Su International Limited
好速國際有限公司",2019-09-27,,"Private, ltd by shares"183,2877860,"HAPPY EARNER LIMITED
得穎有限公司",2019-09-27,,"Private, ltd by shares"184,2877966,"HARBOUR LINK LIMITED (HK)
港勁有限公司",2019-09-27,,"Private, ltd by shares"185,2877585,"HashKey Brokerage Services Limited",2019-09-27,,"Private, ltd by shares"186,2877596,"HEITUDI AGRICULTURAL DEVELOPMENT LIMITED
黑土地農業發展有限公司",2019-09-27,,"Private, ltd by shares"187,2877774,"Hengyi International Group Limited
恆禕國際集團有限公司",2019-09-27,,"Private, ltd by shares"188,2877717,"HENGYU SCIENCE AND TECHNOLOGY GROUP LIMITED
衡宇科技集團有限公司",2019-09-27,,"Private, ltd by shares"189,2877778,"HIRO'S WEALTH COMPANY LIMITED",2019-09-27,,"Private, ltd by shares"190,2877676,"HITOO DEVELOPMENT TRADING LIMITED
希圖發展貿易有限公司",2019-09-27,,"Private, ltd by shares"191,2877716,"HK DODJOY LIMITED
香港大夢龍途有限公司",2019-09-27,,"Private, ltd by shares"192,2877923,"HK K.X LIMITED
香港科翔生物科技有限公司",2019-09-27,,"Private, ltd by shares"193,2877782,"HK KAFEIYA TRADING LIMITED
香港卡菲婭貿易有限公司",2019-09-27,,"Private, ltd by shares"194,2877773,"HK MEIRUIDA TRADING LIMITED
香港美瑞達貿易有限公司",2019-09-27,,"Private, ltd by shares"195,2877982,"HK SILVER PLUS INDUSTRIAL CO., LIMITED
香港百利滙實業有限公司",2019-09-27,,"Private, ltd by shares"196,2878031,"HK SIWEI TRADING LIMITED
香港思偉貿易有限公司",2019-09-27,,"Private, ltd by shares"197,2877950,"HK Super Baby Industrial Co., Limited
香港舒貝實業有限公司",2019-09-27,,"Private, ltd by shares"198,2877845,"HK XUN YE INT'L TRADING LIMITED
香港勛業國際貿易有限公司",2019-09-27,,"Private, ltd by shares"199,2877934,"HK ZHENHAN LIMITED
香港鎮瀚有限公司",2019-09-27,,"Private, ltd by shares"200,2877959,"HK ZMAO TRADING LIMITED
香港澤茂有限公司",2019-09-27,,"Private, ltd by shares"201,2877723,"HOLY PRESS CO., LIMITED
天路出版社有限公司",2019-09-27,,"Private, ltd by shares"202,2877833,"HOLY SNOW MOUNTAIN INTERNATIONAL INVESTMENT MANAGEMENT LIMITED
聖雪山國際投資管理有限公司",2019-09-27,,"Private, ltd by shares"203,2877587,"HOMYECHO INDUSTRIAL GROUP LIMITED",2019-09-27,,"Private, ltd by shares"204,2878034,"Hong Hao Trad (Hong Kong) Limited
弘浩貿易（香港）有限公司",2019-09-27,,"Private, ltd by shares"205,2877972,"HONG KIM CORPORATE ADVISORY LIMITED
康鑫投資咨詢有限公司",2019-09-27,,"Private, ltd by shares"206,2878061,"Hong Kiu Consulting Co., Limited
康橋顧問有限公司",2019-09-27,,"Private, ltd by shares"207,2878095,"Hong Kong Baike Trading Co., Limited
香港佰克貿易有限公司",2019-09-27,,"Private, ltd by shares"208,2878013,"Hong Kong Ching Fai Company Limited
香港清輝有限公司",2019-09-27,,"Private, ltd by shares"209,2878107,"HONG KONG EVERBRIGHT PRINTING CO., LIMITED",2019-09-27,,"Private, ltd by shares"210,2877818,"Hong Kong Fu Wan Chen Trading Co., Limited
香港福灣辰貿易有限公司",2019-09-27,,"Private, ltd by shares"211,2878069,"Hong Kong Golden Crown International Trade Co., Limited
香港金冠門國際貿易有限公司",2019-09-27,,"Private, ltd by shares"212,2877704,"HONG KONG HENG AU DEVELOPMENT CO., LIMITED
香港恒歐發展有限公司",2019-09-27,,"Private, ltd by shares"213,2877831,"HONG KONG HP HOLDINGS LIMITED
香港華鵬控股有限公司",2019-09-27,,"Private, ltd by shares"214,2878067,"HONG KONG HUIMEI TRADING CO., LIMITED
香港匯美貿易有限公司",2019-09-27,,"Private, ltd by shares"215,2878108,"HONG KONG JIANHENG INDUSTRIAL CO., LIMITED
香港建宏實業有限公司",2019-09-27,,"Private, ltd by shares"216,2877983,"Hong Kong JW Technology Trading Co., Limited
香港經偉科技貿易有限公司",2019-09-27,,"Private, ltd by shares"217,2877696,"Hong Kong Maono Technology Co., Limited
香港摩羅志遠科技有限公司",2019-09-27,,"Private, ltd by shares"218,2877770,"HONG KONG MEDTIMES MEDICAL GENE LABORATORY LIMITED
香港時代醫療基因化驗所有限公司",2019-09-27,,"Private, ltd by shares"219,2877826,"Hong Kong Metalmins Alloys Co., Limited
香港金升合金有限公司",2019-09-27,,"Private, ltd by shares"220,2878096,"Hong Kong Mingyuan International Clothing Co., Limited
香港茗媛國際服飾有限公司",2019-09-27,,"Private, ltd by shares"221,2877695,"Hong Kong Parlung Technology Company Limited
香港帕隆科技有限公司",2019-09-27,,"Private, ltd by shares"222,2878113,"Hong Kong PinYi Co., Limited
香港品藝貿易有限公司",2019-09-27,,"Private, ltd by shares"223,2877803,"Hong Kong Qipi Wolves Limited
香港七匹狼有限公司",2019-09-27,,"Private, ltd by shares"224,2878100,"HONG KONG SILK ROAD TECHNOLOGY CO., LIMITED
香港絲綢之道科技有限公司",2019-09-27,,"Private, ltd by shares"225,2877730,"Hong Kong Stellar Consulting Co., Limited
香港恒子星諮詢有限公司",2019-09-27,,"Private, ltd by shares"226,2877681,"HONG KONG SUNHO MEDICINE INTERNATIONAL TRADE LIMITED
香港星昊醫藥國際貿易有限公司",2019-09-27,,"Private, ltd by shares"227,2878039,"HONG KONG SUNSANXIN ELECTRONICS TRADING CO., LIMITED",2019-09-27,,"Private, ltd by shares"228,2877736,"HONG KONG TIANJIAN INTERNATIONAL CATERING MANAGEMENT CO., LIMITED
香港天健國際餐飲管理有限公司",2019-09-27,,"Private, ltd by shares"229,2878021,"Hong Kong Unique Express International Trade Co., Limited
香港唯一國際貿易有限公司",2019-09-27,,"Private, ltd by shares"230,2877843,"HONG KONG XINYAN BIOTECHNOLOGY LIMITED
香港欣妍生物科技有限公司",2019-09-27,,"Private, ltd by shares"231,2878076,"HONG KONG XUANZHEN INVESTMENT CO., LIMITED
香港玄真投資有限公司",2019-09-27,,"Private, ltd by shares"232,2877822,"Hong Kong Zhanda Technology Trade Limited
香港展達科技貿易有限公司",2019-09-27,,"Private, ltd by shares"233,2877665,"Hong Kong Zteng Technology Limited
香港紫騰科技有限公司",2019-09-27,,"Private, ltd by shares"234,2878056,"HongKong ADE Electronic Commerce Co., Limited",2019-09-27,,"Private, ltd by shares"235,2878097,"Hongkong Bright Home Decoration Design Project Co., Limited
香港亮家裝飾設計工程有限公司",2019-09-27,,"Private, ltd by shares"236,2877790,"HONGKONG CHAOYANG INTERNATIONAL TRADE CO., LIMITED
香港潮洋國際貿易有限公司",2019-09-27,,"Private, ltd by shares"237,2877592,"HONGKONG DACHRYU COSMETICS CO., LIMITED
香港戀淚姣化妝品有限公司",2019-09-27,,"Private, ltd by shares"238,2877793,"HONGKONG DAPENG HOLDINGS CO., LIMITED
香港大澎控股有限公司",2019-09-27,,"Private, ltd by shares"239,2877817,"HONGKONG DING XIN FENG DE PRIVATE EQUITY FUND MANAGEMENT CO., LIMITED
香港鼎鑫豐德股權投資基金管理有限公司",2019-09-27,,"Private, ltd by shares"240,2878102,"HONGKONG FENGLI TRADING CO., LIMITED
香港豐翰貿易有限公司",2019-09-27,,"Private, ltd by shares"241,2878023,"HONGKONG GILSENG Trading Co., LIMITED
香港吉成貿易有限公司",2019-09-27,,"Private, ltd by shares"