,Reg no.,Name,Incorp-orated,Dissolved,Type1,0859078,"A-GRADE TECHNOLOGY COMPUTER COMPANY LIMITED
盈峰科技電腦有限公司",2003-08-27,2009-08-07,"Private, ltd by shares"2,0859145,"ACTI HOLDING LIMITED",2003-08-27,2009-09-25,"Private, ltd by shares"3,0859206,"ADVANCE TREASURE HOLDINGS LIMITED
進富集團有限公司",2003-08-27,2007-02-02,"Private, ltd by shares"4,0859189,"AEON DRAGON COMPANY LIMITED
捷高國際發展有限公司",2003-08-27,2009-01-23,"Private, ltd by shares"5,0859235,"ALIZ COFFEE DREAM LIMITED",2003-08-27,2012-12-14,"Private, ltd by shares"6,0859269,"ALLIED PALM LIMITED
匯棕有限公司",2003-08-27,,"Private, ltd by shares"7,0859124,"ALLIONIC TECHNOLOGY COMPANY LIMITED
亞利安科技有限公司",2003-08-27,2020-09-30,"Private, ltd by shares"8,0859246,"AMPORT HOLDINGS LIMITED
安堡控股有限公司",2003-08-27,2018-05-04,"Private, ltd by shares"9,0859093,"AMTEC LIMITED
雅盛有限公司",2003-08-27,2015-10-23,"Private, ltd by shares"10,0859258,"ARGE &amp; INOXIHP INTERNATIONAL TRADING (CHINA) LIMITED
雅格國際(中國)有限公司",2003-08-27,,"Private, ltd by shares"11,0859122,"ASIA PACIFIC HEALTH LIMITED (d2009-02-06)
亞太健康有限公司",2003-08-27,2009-02-06,"Private, ltd by shares"12,0859018,"ASIA REGAL INTERNATIONAL LIMITED
永亞國際有限公司",2003-08-27,,"Private, ltd by shares"13,0859152,"ASIAN BRIGHTER LIMITED
創亞有限公司",2003-08-27,,"Private, ltd by shares"14,0859133,"ASIAN FASHION INVESTMENTS LIMITED",2003-08-27,2010-07-09,"Private, ltd by shares"15,0859241,"AUK SEMICONDUCTOR (H.K.) COMPANY LIMITED
愛有開半導體(香港)有限公司",2003-08-27,,"Private, ltd by shares"16,0859234,"AUREUMAEX INDUSTRIES (HK) COMPANY LIMITED
鋆潼精密工業(香港)有限公司",2003-08-27,,"Private, ltd by shares"17,0859062,"AURORA GROUP LIMITED
曉暉集團有限公司",2003-08-27,2017-04-21,"Private, ltd by shares"18,0859236,"AUTOFULL (FAREAST) INT'L COMPANY LIMITED
沃特富(遠東)國際有限公司",2003-08-27,,"Private, ltd by shares"19,0859079,"AVANT-GARDE OPTICAL INTERNATIONAL LIMITED
雅佳國際眼鏡有限公司",2003-08-27,2008-01-11,"Private, ltd by shares"20,0858954,"BACK TO BASICS LIMITED (d2006-01-20)",2003-08-27,2006-01-20,"Private, ltd by shares"21,0858948,"BEAUTYSHOW ENTERPRISE (HONG KONG) LIMITED
麗人行(香港)實業發展有限公司",2003-08-27,2010-01-22,"Private, ltd by shares"22,0859248,"BERICO TWINS INDUSTRIAL LIMITED
逸燊實業有限公司",2003-08-27,,"Private, ltd by shares"23,0859217,"BEST LOYAL HOLDINGS LIMITED (d2008-01-11)
百來集團有限公司",2003-08-27,2008-01-11,"Private, ltd by shares"24,0859183,"BESTTEAM LOGISTICS LIMITED
駿銘物流有限公司",2003-08-27,,"Private, ltd by shares"25,0859237,"Beta Group Limited (d2016-01-22)",2003-08-27,2016-01-22,"Private, ltd by shares"26,0859060,"BILLION RESTAURANT LIMITED
六益園茶餐廳有限公司",2003-08-27,2009-07-10,"Private, ltd by shares"27,0859046,"BLUE-STAR ELECTRONICS &amp; COMPUTERS LIMITED
藍星電子電腦有限公司",2003-08-27,2005-10-21,"Private, ltd by shares"28,0859088,"BRAVO CATERING CONSULTANT MANAGEMENT LIMITED
巴富餐飲顧問管理有限公司",2003-08-27,2006-02-17,"Private, ltd by shares"29,0859059,"BRIGHT EMERALD LIMITED",2003-08-27,2009-03-13,"Private, ltd by shares"30,0859039,"C &amp; D PRECISION TOOLS COMPANY LIMITED
先達精密工具有限公司",2003-08-27,2014-12-12,"Private, ltd by shares"31,0859047,"C &amp; F INTERNATIONAL ENTERPRISE LIMITED
駿科國際企業有限公司",2003-08-27,2008-11-07,"Private, ltd by shares"32,0859058,"C &amp; S MANUFACTORY LIMITED
昌星製品有限公司",2003-08-27,2016-04-15,"Private, ltd by shares"33,0859035,"CAAM DESIGN &amp; DECORATION COMPANY LIMITED
加美設計工程有限公司",2003-08-27,,"Private, ltd by shares"34,0858978,"CANTERBURY PRIVATE HOLDINGS LIMITED",2003-08-27,2006-05-26,"Private, ltd by shares"35,0859118,"CAPITAL PROMOTION LIMITED (d2008-01-25)
盈富推廣有限公司",2003-08-27,2008-01-25,"Private, ltd by shares"36,0859197,"CARRIEON LIMITED
嘉利安有限公司",2003-08-27,2016-07-21,"Private, ltd by shares"37,0859284,"CELEBRATION OF LIFE HUMANITARIAN SOCIETY LIMITED
尊重生命慈善協會有限公司",2003-08-27,2011-05-13,"Ltd by guarantee"38,0859210,"CENTENNIAL DRAGON ENTERPRISES LIMITED
森龍企業有限公司",2003-08-27,2008-07-18,"Private, ltd by shares"39,0859249,"CEO CRUISE INTERNATIONAL LIMITED
首席執行官郵輪國際有限公司",2003-08-27,2005-06-03,"Private, ltd by shares"40,0859267,"CHAMP WIN INTERNATIONAL LIMITED
卓勝國際有限公司",2003-08-27,,"Private, ltd by shares"41,0859285,"CHAN SHU KUI MEMORIAL SCHOOL SCHOOL MANAGEMENT COMMITTEE LIMITED
陳樹渠紀念中學校董會有限公司",2003-08-27,,"Ltd by guarantee"42,0858991,"CHANGLU INDUSTRIAL (HONG KONG) COMPANY LIMITED
長路實業(香港)有限公司",2003-08-27,,"Private, ltd by shares"43,0859086,"CHEUNG WONG CONSTRUCTION MECHANIC CO., LIMITED
長旺機械有限公司",2003-08-27,,"Private, ltd by shares"44,0859266,"CHIKKU INT'L (HK) LIMITED",2003-08-27,2009-01-23,"Private, ltd by shares"45,0859141,"CHINA BUSINESS &amp; ENTERPRISE MANAGEMENT ASSOCIATION (HK) LIMITED
中國商貿及企業管理協會(香港)有限公司",2003-08-27,2018-01-26,"Ltd by guarantee"46,0859254,"CHINA GUO HUAN CONSTRUCTION INVESTMENT DEVELOPMENT GROUP LIMITED
中國國環建設投資開發集團有限公司",2003-08-27,2008-01-11,"Private, ltd by shares"47,0859013,"CHINA INSURANCE SERVICE GROUP HOLDINGS LIMITED
中國保險服務集團控股有限公司",2003-08-27,,"Private, ltd by shares"48,0859255,"CHINA SENSE INTERNATIONAL DEVELOPMENT LIMITED
中誠國際開發有限公司",2003-08-27,,"Private, ltd by shares"49,0859228,"CHINESE RESOURCE PROPERTY MANAGEMENT LIMITED
華創物業管理有限公司",2003-08-27,2007-11-02,"Private, ltd by shares"50,0859138,"CHUNG POB KNITTING COMPANY LIMITED
中博毛紡有限公司",2003-08-27,2010-02-05,"Private, ltd by shares"51,0859216,"CITIBILLION DEVELOPMENT LIMITED
億城發展有限公司",2003-08-27,,"Private, ltd by shares"52,0859188,"COLORMATE LIMITED
佳色美有限公司",2003-08-27,2004-10-08,"Private, ltd by shares"53,0859076,"COMET ELECTRONICS HOLDING LIMITED
康明電子控股有限公司",2003-08-27,2019-06-21,"Private, ltd by shares"54,0859081,"CONCORD CATERING CONSULTANCY LIMITED
康宏飲食顧問有限公司",2003-08-27,,"Private, ltd by shares"55,0859151,"CONTINENTAL CRANE LIMITED
海陸起重機有限公司",2003-08-27,,"Private, ltd by shares"56,0859282,"CORNERRUBY INTERNATIONAL LIMITED
基石商社有限公司",2003-08-27,2015-11-20,"Private, ltd by shares"57,0859109,"CORPORATE SHIPPING CO., LIMITED
協合航運有限公司",2003-08-27,2013-11-29,"Private, ltd by shares"58,0859208,"CORUS INTERNATIONAL HOTELS LIMITED",2003-08-27,2016-01-29,"Private, ltd by shares"59,0859280,"COSMOS REGION LIMITED
堡誠有限公司",2003-08-27,,"Private, ltd by shares"60,0859050,"CYBERTEK INTERNATIONAL COMPANY LIMITED
新八達有限公司",2003-08-27,2015-01-02,"Private, ltd by shares"61,0858966,"D&amp;F (HK) CO. LIMITED
香港瑞時實業有限公司",2003-08-27,2008-05-23,"Private, ltd by shares"62,0859259,"D&amp;Y MACHINERY CO., LIMITED
大有機械有限公司",2003-08-27,2017-10-27,"Private, ltd by shares"63,0859185,"DALTON INTERNATIONAL TRADING CO., LIMITED
島通國際貿易有限公司",2003-08-27,2013-11-29,"Private, ltd by shares"64,0859074,"DAXINGLONG INDUSTRIAL COMPANY LIMITED
大興隆實業有限公司",2003-08-27,,"Private, ltd by shares"65,0858955,"DAYU INTERNATIONAL GROUP (HONG KONG) LIMITED
大禹國際集團(香港)有限公司",2003-08-27,,"Private, ltd by shares"66,0858992,"DLQ DESIGN (HONG KONG) LIMITED
帝樂求設計(香港)有限公司",2003-08-27,,"Private, ltd by shares"67,0859168,"DOKYA (HONG KONG) LIMITED",2003-08-27,2008-01-11,"Private, ltd by shares"68,0859110,"DONIX LIMITED (d2016-02-19)
博士力有限公司",2003-08-27,2016-02-19,"Private, ltd by shares"69,0859202,"DRAGON CHOICE LIMITED (d2016-04-01)
龍彩有限公司",2003-08-27,2016-04-01,"Private, ltd by shares"70,0858993,"DRAGON LINKER INTERNATIONAL INVESTMENT LIMITED
龍聯國際投資有限公司",2003-08-27,2012-08-24,"Private, ltd by shares"71,0859096,"DRAGON REGAL INVESTMENT LIMITED
龍佳投資有限公司",2003-08-27,2013-04-05,"Private, ltd by shares"72,0859052,"DRAGONLITE LIGHTING LIMITED
天龍照明有限公司",2003-08-27,,"Private, ltd by shares"73,0858958,"DYNAMICS HONG KONG LIMITED
德美香港有限公司",2003-08-27,,"Private, ltd by shares"74,0859104,"DYNASTY MEDIA &amp; ADVERTISING (HK) COMPANY LIMITED
漢唐廣告傳播(香港)有限公司",2003-08-27,2006-02-10,"Private, ltd by shares"75,0859007,"EAST AV LIMITED
東成影音有限公司",2003-08-27,2006-11-10,"Private, ltd by shares"76,0858957,"EAST ESTATE GROUP HOLDINGS LIMITED
東方置業集團股份有限公司",2003-08-27,2008-07-18,"Private, ltd by shares"77,0859055,"EASTWOOD ENTERPRISES LIMITED (d2013-01-25)
東浚企業有限公司",2003-08-27,2013-01-25,"Private, ltd by shares"78,0858961,"ELITE INNOVATIONS CHINA LIMITED
明智創意中國有限公司",2003-08-27,2005-12-30,"Private, ltd by shares"79,0859264,"EMPIRE PROFIT INTERNATIONAL LIMITED
帝盈國際有限公司",2003-08-27,,"Private, ltd by shares"80,0859222,"EVANGEL GRACE CHURCH LIMITED
基督教傳恩堂有限公司",2003-08-27,,"Ltd by guarantee"81,0858964,"EVER-BROAD GROUP LIMITED
恒廣集團有限公司",2003-08-27,2010-10-22,"Private, ltd by shares"82,0859212,"EVERSAFE HOLDINGS LIMITED
恒安集團有限公司",2003-08-27,,"Private, ltd by shares"83,0859195,"EVERSHARP CORPORATION LIMITED
恒盛有限公司",2003-08-27,,"Private, ltd by shares"84,0859139,"EWA LIMITED (d2009-01-23)",2003-08-27,2009-01-23,"Private, ltd by shares"85,0859011,"EXANET LIMITED",2003-08-27,,"Private, ltd by shares"86,0858960,"EXCEL CENTURY (HK) LIMITED
卓越世紀(香港)有限公司",2003-08-27,2009-08-14,"Private, ltd by shares"87,0859017,"EXCEL LINKER INVESTMENT LIMITED
佳卓投資有限公司",2003-08-27,2016-05-20,"Private, ltd by shares"88,0859169,"FAR EAST KNITTING LIMITED
遠東針織有限公司",2003-08-27,2004-12-31,"Private, ltd by shares"89,0859040,"FIBERLOGIC INTERNATIONAL LIMITED",2003-08-27,,"Private, ltd by shares"90,0859148,"FOCE (ASIA) LIMITED",2003-08-27,,"Private, ltd by shares"91,0858962,"FOOTMAX (H.K.) LIMITED",2003-08-27,,"Private, ltd by shares"92,0859070,"FOREX CARGO (HONG KONG) COMPANY LIMITED",2003-08-27,2010-01-22,"Private, ltd by shares"93,0859214,"FORTUNE GEM INTERNATIONAL LIMITED
鑽福國際有限公司",2003-08-27,2005-12-09,"Private, ltd by shares"94,0859240,"FOUNDATION FORUM OF CHINA LIMITED
中國基金論壇有限公司",2003-08-27,2011-04-21,"Private, ltd by shares"95,0858969,"FRANCE APPLE GROUP (HK) LIMITED
法國蘋果集團(香港)有限公司",2003-08-27,2008-01-11,"Private, ltd by shares"96,0859128,"FRANCE LEONARDO INT'L GROUP DRESS LIMITED
法國老人頭國際集團服飾有限公司",2003-08-27,,"Private, ltd by shares"97,0859179,"FRANCE MENGTEJIAO INT'L CLOTHING STOCK LIMITED
法國夢特嬌國際服飾股份有限公司",2003-08-27,2008-01-11,"Private, ltd by shares"98,0859243,"FREIGHT LIAISON INTERNATIONAL (HK) LIMITED
立信國際貨運(香港)有限公司",2003-08-27,,"Private, ltd by shares"99,0859257,"FULL POWER INTERNATIONAL CORP. LIMITED
琥珀兒國際有限公司",2003-08-27,2019-03-15,"Private, ltd by shares"100,0859159,"FUNMOBILE LIMITED
激紛堂有限公司",2003-08-27,,"Private, ltd by shares"101,0859143,"GAGNER (H.K.) LIMITED
佳納(香港)有限公司",2003-08-27,,"Private, ltd by shares"102,0858982,"GALAXMIAL TELECOM LIMITED",2003-08-27,2011-01-21,"Private, ltd by shares"103,0859162,"GARDENIA ASIA LIMITED",2003-08-27,,"Private, ltd by shares"104,0859227,"GERMAN AMERICAN LION GROUP (HONG KONG) LIMITED
德國美洲獅集團(香港)有限公司",2003-08-27,2008-01-11,"Private, ltd by shares"105,0859027,"GET (HONG KONG) ENTERPRISE CO. LIMITED
佳易達(香港)企業有限公司",2003-08-27,,"Private, ltd by shares"106,0859253,"GLOBAL RISE INDUSTRIES LIMITED
晉宏實業有限公司",2003-08-27,2008-01-11,"Private, ltd by shares"107,0859136,"GLOBALWAY TECHNOLOGY LIMITED
浩威科技有限公司",2003-08-27,,"Private, ltd by shares"108,0859213,"GLOBELINK ENTERPRISE LIMITED
環聯企業有限公司",2003-08-27,2007-04-13,"Private, ltd by shares"109,0859049,"GLOBO TRAVEL AGENCY LIMITED",2003-08-27,,"Private, ltd by shares"110,0859002,"GOLDEN FULL PIECE GOODS COMPANY LIMITED
嘉福布業行有限公司",2003-08-27,,"Private, ltd by shares"111,0859120,"GOLDEN RICH ENTERPRISE INTERNATIONAL LIMITED
金峰企業國際有限公司",2003-08-27,,"Private, ltd by shares"112,0859073,"GOLDENTEK ELECTRONICS LIMITED
鑫銀海電子有限公司",2003-08-27,2007-03-16,"Private, ltd by shares"113,0859174,"GOOD PLACE RESTAURANT LIMITED
好地方食館有限公司",2003-08-27,2018-05-21,"Private, ltd by shares"114,0859192,"GRAND DRAGON ENGINEERING LIMITED (d2009-01-30)
廣龍工程有限公司",2003-08-27,2009-01-30,"Private, ltd by shares"115,0859170,"GRAND UNICORN MINING LIMITED
浩瑞礦產有限公司",2003-08-27,2007-03-02,"Private, ltd by shares"116,0858971,"GREAT HARVEST INT'L HOLDINGS LIMITED
中盛國際控股有限公司",2003-08-27,2009-06-26,"Private, ltd by shares"117,0859196,"GREAT LOYAL DEVELOPMENT LIMITED
偉恩發展有限公司",2003-08-27,,"Private, ltd by shares"118,0859008,"GREEN LEAF INVESTMENTS LIMITED (HK)
綠葉投資有限公司",2003-08-27,,"Private, ltd by shares"119,0859181,"H.K. BUSINESS ADMINISTRATION LIMITED
香港工商管理有限公司",2003-08-27,2007-03-09,"Private, ltd by shares"120,0859068,"H.K. DENSEN SEALING ELEMENT LIMITED
香港鼎昇密封件有限公司",2003-08-27,2011-04-21,"Private, ltd by shares"121,0859164,"H.K. EAST ASIA PRINTING CO., LIMITED
香港東亞印刷有限公司",2003-08-27,2019-11-29,"Private, ltd by shares"122,0858995,"H.K. NUOCHENGJIN AGRICULTURAL CHEMICALS LIMITED
香港諾誠金農用化學品有限公司",2003-08-27,2009-01-23,"Private, ltd by shares"123,0859276,"HARVEST UNITED HOLDINGS LIMITED
浩和集團有限公司",2003-08-27,,"Private, ltd by shares"124,0859232,"HIN TAT BUILDING MATERIALS (MEI ZHOU) LIMITED
顯達建材(梅州)有限公司",2003-08-27,2017-12-29,"Private, ltd by shares"125,0859274,"HIN ZE JEWELLERY (INTERNATIONAL) CO., LIMITED
鑫澤珠寶(國際)有限公司",2003-08-27,2010-01-22,"Private, ltd by shares"126,0858996,"HONG KONG ANBA INT'L FINANCE HOLDINGS INVESTMENT LIMITED
香港安霸國際金融集團投資有限公司",2003-08-27,2009-01-23,"Private, ltd by shares"127,0859140,"HONG KONG ASSOCIATION OF HAIR DESIGN CHARITY FOUNDATION LIMITED (THE)
香港髮型協會慈善基金有限公司",2003-08-27,,"Ltd by guarantee"128,0859130,"HONG KONG DDD LOCKSMITH INT'L GROUP LIMITED
香港三迪鎖業國際集團有限公司",2003-08-27,2010-01-22,"Private, ltd by shares"129,0859032,"HONG KONG ENVIRONMENTAL SERVICES LIMITED
香港環境服務有限公司",2003-08-27,,"Private, ltd by shares"130,0858990,"HONG KONG HAI XI INVESTMENT MANAGEMENT COMPANY LIMITED
香港凱希投資管理有限公司",2003-08-27,2012-12-14,"Private, ltd by shares"131,0859069,"HONG KONG HOP KEE HONG INTERNATIONAL TRADING LIMITED
香港合稷行國際貿易有限公司",2003-08-27,2017-04-21,"Private, ltd by shares"132,0859063,"HONG KONG HUA XING INDUSTRIAL LIMITED
香港華興實業有限公司",2003-08-27,2016-08-26,"Private, ltd by shares"133,0858956,"HONG KONG HUA YANG INVESTMENT TRADING COMPANY LIMITED
香港華洋投資貿易有限公司",2003-08-27,2012-12-14,"Private, ltd by shares"134,0859223,"HONG KONG JIASHENG TRADE LIMITED
香港嘉晟貿易有限公司",2003-08-27,,"Private, ltd by shares"135,0859230,"HONG KONG LVBAO OIL &amp; CHEMICALS INVESTMENT LIMITED
香港綠保石化投資有限公司",2003-08-27,2009-02-20,"Private, ltd by shares"136,0858985,"HONG KONG MARBALY COSMETICS INTERNATIONAL LIMITED
香港瑪丹麗國際化妝品有限公司",2003-08-27,2006-01-20,"Private, ltd by shares"137,0858987,"HONG KONG ORGANIC AGRICULTURE &amp; ECOLOGICAL RESEARCH ASSOCIATION LIMITED
香港有機農業生態研究協會有限公司",2003-08-27,,"Ltd by guarantee"138,0859163,"HONG KONG SILVER HILL DEVELOPMENT LIMITED
香港銀山發展有限公司",2003-08-27,2005-11-25,"Private, ltd by shares"139,0859186,"HONG KONG TACTFUL COMPANY LIMITED
香港德豐實業有限公司",2003-08-27,,"Private, ltd by shares"140,0858989,"HONG KONG VELITES FURNITURE INTERNATIONAL GROUP LIMITED
香港威力帝斯家居國際集團有限公司",2003-08-27,2010-01-22,"Private, ltd by shares"141,0859000,"HONG KONG WING SING LIMITED
榮星貿易投資有限公司",2003-08-27,,"Private, ltd by shares"142,0859286,"HONG KONG WU HUA GENERAL ASSOCIATION LIMITED
香港五華同鄉總會有限公司",2003-08-27,,"Ltd by guarantee"143,0859135,"HONG KONG XINMEILUN INTERNATIONAL FASHION LIMITED
香港新美倫國際服飾有限公司",2003-08-27,2008-01-11,"Private, ltd by shares"144,0859221,"HONG KONG YOU OI EDUCATION FOUNDATION LIMITED
香港友愛教育基金有限公司",2003-08-27,,"Ltd by guarantee"145,0859165,"HONG KONG YUE ER COMPANY LIMITED
香港悅而有限公司",2003-08-27,2010-10-15,"Private, ltd by shares"146,0859203,"HONG KONG ZHENG DE INVESTMENT GROUP LIMITED
香港正得投資集團有限公司",2003-08-27,,"Private, ltd by shares"147,0859113,"HONGKONG BAI XIAO JING BIOLOGIC TECHNOLOGY LIMITED
香港百消淨生物科技有限公司",2003-08-27,2009-07-17,"Private, ltd by shares"148,0858950,"HONGKONG BIOSUFOR LIMITED
香港百士富有限公司",2003-08-27,,"Private, ltd by shares"149,0859261,"HONGKONG FILM AND TELEVISION CULTURE AMUSEMENTS MAKE (CENTRE) LIMITED
香港影視文化娛樂制作(中心)有限公司",2003-08-27,2008-01-11,"Private, ltd by shares"150,0859029,"HONGKONG HAIBO INVESTMENT LIMITED
香港海博投資有限公司",2003-08-27,,"Private, ltd by shares"151,0859125,"HONGKONG HUGEDRAGON CLOTHING CO., LIMITED
香港大龍製衣有限公司",2003-08-27,2008-01-11,"Private, ltd by shares"152,0859043,"HONGKONG KINGRAY GROUP CO., LIMITED
香港精銳集團有限公司",2003-08-27,2012-12-14,"Private, ltd by shares"153,0859180,"HONGKONG LINDE ELECTRONICS COMPANY LIMITED
香港林德電子有限公司",2003-08-27,,"Private, ltd by shares"154,0859239,"HONGKONG QIANSHU FURNITURE INT'L GROUP LIMITED
香港千樹家私國際集團有限公司",2003-08-27,2008-01-11,"Private, ltd by shares"155,0859026,"HONGKONG QOO INTERNATIONAL INVESTMENT COMPANY LIMITED
香港酷兒國際投資有限公司",2003-08-27,2008-07-18,"Private, ltd by shares"156,0859123,"HONGKONG YAMI INTERNATIONAL CO., LIMITED
香港亞米國際有限公司",2003-08-27,2019-05-31,"Private, ltd by shares"157,0858967,"HSIN BI GOLDEN CO., LIMITED
欣幣金屬有限公司",2003-08-27,2014-06-27,"Private, ltd by shares"158,0859001,"HUANGMING ELECTRICAL APPLIANCES HONG KONG IMPORT &amp; EXPORT LIMITED
皇明電氣香港進出口有限公司",2003-08-27,2008-07-18,"Private, ltd by shares"159,0859272,"HUGE LUXURY DEVELOPMENT LIMITED
鉅濠發展有限公司",2003-08-27,2011-04-21,"Private, ltd by shares"160,0859161,"HWA LIN ENTERPRISE CO., LIMITED
驊林興業有限公司",2003-08-27,2008-08-22,"Private, ltd by shares"161,0859134,"HYPAC PACKAGING (HK) LIMITED",2003-08-27,2010-01-08,"Private, ltd by shares"162,0859085,"ICTI CARE Asia Limited",2003-08-27,2009-04-07,"Private, ltd by shares"163,0859275,"IDEAL ELECTRICAL APPLIANCE LIMITED
理想電器有限公司",2003-08-27,2005-02-04,"Private, ltd by shares"164,0858946,"IKI COMPANY LIMITED
凝萃有限公司",2003-08-27,2015-01-02,"Private, ltd by shares"165,0859038,"INDUS RESTAURANTS LIMITED",2003-08-27,,"Private, ltd by shares"166,0858980,"INNONYMIC LIMITED
昇研科技有限公司",2003-08-27,2006-09-15,"Private, ltd by shares"167,0859177,"INTER-STATES CONSTRUCTION RISKS MANAGEMENT LIMITED
集泰工程保險顧問有限公司",2003-08-27,,"Private, ltd by shares"168,0858949,"INTERNATIONAL EDUCATION CONSULTANCY LIMITED",2003-08-27,,"Private, ltd by shares"169,0859281,"iQstor Hong Kong Limited",2003-08-27,2010-04-23,"Private, ltd by shares"170,0859184,"ITALY BUBBLE CAR INT'L DRESS LIMITED
意大利老爺車國際服飾有限公司",2003-08-27,2011-04-21,"Private, ltd by shares"171,0859126,"ITALY HUALUNSHIDAI INT'L GROUP LIMITED
意大利華倫時黛國際集團有限公司",2003-08-27,2008-01-11,"Private, ltd by shares"172,0859099,"ITALY PIERKADAN INT'L CLOTHING DEVELOPMENT LIMITED
意大利皮爾卡丹國際服飾發展有限公司",2003-08-27,2015-01-02,"Private, ltd by shares"173,0859077,"ITALY RAIDY BOER HONG KONG (FAR EAST) DEVELOPMENT LIMITED
意大利雷迪波爾香港(遠東)發展有限公司",2003-08-27,2009-01-09,"Private, ltd by shares"174,0859041,"ITALY WOODPECKER GROUP INT'L DEVELOPMENT LIMITED
意大利啄木鳥集團國際發展有限公司",2003-08-27,2008-01-11,"Private, ltd by shares"175,0859075,"JAGUAR PRIVATE EQUITY LIMITED",2003-08-27,2012-04-27,"Private, ltd by shares"176,0858984,"JAPAN AMANDO (HONG KONG) INT'L COSMETICS LIMITED
日本正美堂(香港)國際化妝品有限公司",2003-08-27,2018-02-02,"Private, ltd by shares"177,0859190,"JINTONG TECHNOLOGIES (HK) LIMITED
津通科技(香港)有限公司",2003-08-27,2008-01-11,"Private, ltd by shares"178,0858999,"JMC GROUP (HONG KONG) CO., LIMITED
杰美誠集團(香港)有限公司",2003-08-27,,"Private, ltd by shares"179,0858975,"JOHN PORTER &amp; ASSOCIATES LIMITED",2003-08-27,2006-12-15,"Private, ltd by shares"180,0859101,"JOLY ELECTRONIC (H.K.) LIMITED
卓立電子(香港)有限公司",2003-08-27,2009-04-30,"Private, ltd by shares"181,0859012,"JOPETER PERCY LIMITED
稻珀斯有限公司",2003-08-27,2008-05-09,"Private, ltd by shares"182,0858979,"JUST WINE &amp; LEISURE LIMITED
駿仕會有限公司",2003-08-27,2008-08-22,"Private, ltd by shares"183,0859194,"KAMYIELD INDUSTRIAL LIMITED
金盈實業有限公司",2003-08-27,2005-05-06,"Private, ltd by shares"184,0858965,"KFIC (HK) CO., LIMITED
金楓國際(香港)有限公司",2003-08-27,,"Private, ltd by shares"185,0859033,"KIN SI ENTERPRISE (H.K.) LIMITED
建時企業(香港)有限公司",2003-08-27,,"Private, ltd by shares"186,0859014,"KIN WANG TIMEPIECE LIMITED
建宏錶業有限公司",2003-08-27,2004-03-26,"Private, ltd by shares"187,0858947,"KINETIC GLOBAL LIMITED (HK)
滙創環球有限公司",2003-08-27,2020-04-03,"Private, ltd by shares"188,0859129,"KONHWA INT'L GROUP (H.K.) LIMITED
康華國際集團(香港)有限公司",2003-08-27,2009-01-23,"Private, ltd by shares"189,0859191,"LEISURE APPLIANCES LIMITED",2003-08-27,2009-06-26,"Private, ltd by shares"190,0859067,"LIAOCHENG LONGWIN CHEMICAL COMPANY LIMITED
香港蔚藍化學工業有限公司",2003-08-27,2010-01-22,"Private, ltd by shares"191,0859270,"LINK MAPLE INTERNATIONAL LIMITED
聯楓國際有限公司",2003-08-27,2013-07-19,"Private, ltd by shares"192,0859146,"LINK WIDE INTERNATIONAL INVESTMENT (HONG KONG) LIMITED
廣通國際投資(香港)有限公司",2003-08-27,,"Private, ltd by shares"193,0859204,"LINKWIN LIMITED (d2006-04-13)
年威有限公司",2003-08-27,2006-04-13,"Private, ltd by shares"194,0859256,"LION REGENT ENGINEERING LIMITED
卓雋工程有限公司",2003-08-27,2005-06-30,"Private, ltd by shares"195,0859144,"LITTLE ANGEL INTERNATIONAL COMPANY LIMITED
小天使國際有限公司",2003-08-27,2015-01-30,"Private, ltd by shares"196,0859247,"LOK WAY LIMITED
六煒有限公司",2003-08-27,,"Private, ltd by shares"197,0859010,"LONG LOYAL FAR EAST LIMITED
長康遠東有限公司",2003-08-27,2011-07-08,"Private, ltd by shares"198,0859211,"LOYAL SOUND INVESTMENT LIMITED (d2006-01-27)
信生投資有限公司",2003-08-27,2006-01-27,"Private, ltd by shares"199,0859022,"LOYALTY FORGIVENESS AND MORALITY ASSOCIATION COMPANY LIMITED
忠恕道德會有限公司",2003-08-27,,"Ltd by guarantee"200,0859229,"LUCKY SERVICE APARTMENT LIMITED
好彩酒店服務有限公司",2003-08-27,,"Private, ltd by shares"201,0859205,"LUCKY TEAM PROPERTIES LIMITED
祥添置業有限公司",2003-08-27,,"Private, ltd by shares"202,0858974,"Luen Fat Access &amp; Scaffolding Limited
聯發棚架設備有限公司",2003-08-27,,"Private, ltd by shares"203,0859019,"LUNG KONG LOGISTICS COMPANY LIMITED
龍港物流有限公司",2003-08-27,2012-05-03,"Private, ltd by shares"204,0859263,"LUXURY GRAND LIMITED
豪盛有限公司",2003-08-27,2012-12-14,"Private, ltd by shares"205,0859108,"MAK KEE DEEP BLUE PUMP LIMITED
麥記深藍泵業有限公司",2003-08-27,2010-02-20,"Private, ltd by shares"206,0859036,"MATCH GLOBAL CORPORATION LIMITED
友隆社環球有限公司",2003-08-27,,"Private, ltd by shares"207,0859064,"MEI TING LIMITED
美亭有限公司",2003-08-27,,"Private, ltd by shares"208,0859154,"MENTEC INVESTMENT LIMITED
宏達投資有限公司",2003-08-27,,"Private, ltd by shares"209,0859224,"MIC (HK) LIMITED (d2015-09-11)
管理資訊顧問(香港)有限公司",2003-08-27,2015-09-11,"Private, ltd by shares"210,0859173,"MODULE INTERIOR DESIGN COMPANY LIMITED
積木設計有限公司",2003-08-27,,"Private, ltd by shares"211,0859051,"MOWCO INSULATION &amp; SEALING PRODUCTS LIMITED
美柯絕緣密封製品有限公司",2003-08-27,2011-11-11,"Private, ltd by shares"212,0859102,"NAM TONG GROUP COMPANY LIMITED
南通集團股份有限公司",2003-08-27,2015-01-02,"Private, ltd by shares"213,0859080,"NANO COMPOSITE MATERIALS TECHNOLOGY LIMITED
納斯科技有限公司",2003-08-27,2010-04-22,"Private, ltd by shares"214,0859121,"NEW AVIATION TECHNOLOGY INTERNATIONAL CO., LIMITED
新天下航空國際有限公司",2003-08-27,,"Private, ltd by shares"