,Reg no.,Name,Incorp-orated,Dissolved,Type215,0859072,"NEW CONCEPT INTERIOR DESIGN &amp; ENGINEERING LIMITED
新概念室內設計工程有限公司",2003-08-27,,"Private, ltd by shares"216,0859279,"NEW HONOUR GROUP LIMITED
強泰集團有限公司",2003-08-27,2008-01-11,"Private, ltd by shares"217,0859207,"NEW LEADER TECHNOLOGIES LIMITED
領新科技有限公司",2003-08-27,,"Private, ltd by shares"218,0859233,"NEW SILVER BIRD LIMITED
新銀雀會有限公司",2003-08-27,,"Private, ltd by shares"219,0859198,"NEW SOURCE INVESTMENTS LIMITED
新源投資有限公司",2003-08-27,,"Private, ltd by shares"220,0859218,"NEW TARGET FINANCIAL SOLUTIONS LIMITED
新泰理財有限公司",2003-08-27,2010-03-12,"Private, ltd by shares"221,0859115,"NEW UNION INTERNATIONAL (CHINA) LIMITED
新昌力國際(中國)有限公司",2003-08-27,2012-10-05,"Private, ltd by shares"222,0859160,"NG HE COMPANY LIMITED
吳熙有限公司",2003-08-27,2019-02-08,"Private, ltd by shares"223,0859265,"NODIC (HONG KONG) LIMITED
腦力(香港)有限公司",2003-08-27,2009-01-23,"Private, ltd by shares"224,0858973,"NUOVA-TECH MACHINE TOOL CORPORATION LIMITED (d2010-05-14)
諾瓦泰克機床有限公司",2003-08-27,2010-05-14,"Private, ltd by shares"225,0859042,"OCEAN METAL &amp; PLASTIC LIMITED
海洋五金塑膠有限公司",2003-08-27,,"Private, ltd by shares"226,0859025,"OLDIES INTERNATIONAL LIMITED
舊冶國際有限公司",2003-08-27,2005-10-07,"Private, ltd by shares"227,0859030,"ONWARD BUSINESS SOLUTIONS LIMITED
安域顧問有限公司",2003-08-27,,"Private, ltd by shares"228,0858994,"ORIENTAL INTERIOR DESIGN LIMITED
東方設計樓有限公司",2003-08-27,,"Private, ltd by shares"229,0859031,"ORIENTONE SYSTEM LIMITED
東立系統有限公司",2003-08-27,,"Private, ltd by shares"230,0859006,"ORIGIN OF TASTE COMPANY LIMITED
味之源有限公司",2003-08-27,2008-01-11,"Private, ltd by shares"231,0859251,"P BY P LIMITED",2003-08-27,2011-04-21,"Private, ltd by shares"232,0859098,"PANTEC (HONG KONG) LIMITED
寶裕(香港)有限公司",2003-08-27,2007-05-25,"Private, ltd by shares"233,0859156,"PANTEC HOLDINGS LIMITED
寶明集團有限公司",2003-08-27,2007-02-02,"Private, ltd by shares"234,0859048,"PATEN WIRELESS TECHNOLOGY LIMITED",2003-08-27,2006-08-18,"Private, ltd by shares"235,0859015,"PEARL BRIGHT LIMITED
寶俊有限公司",2003-08-27,,"Private, ltd by shares"236,0859106,"PHOENIX WEDDING PLANNER LIMITED
浪喬有限公司",2003-08-27,2009-03-20,"Private, ltd by shares"237,0859105,"PINE WISE DEVELOPMENT LIMITED
栢惠發展有限公司",2003-08-27,,"Private, ltd by shares"238,0859100,"PLM SYSTEM LIMITED
產品生命週期管理系統(顧問)有限公司",2003-08-27,,"Private, ltd by shares"239,0859009,"PRECIOUS LAND ENTERTAINMENT LIMITED
寸金娛樂有限公司",2003-08-27,,"Private, ltd by shares"240,0859252,"PROFIFORM ENGINEERING COMPANY LIMITED
寶方工程有限公司",2003-08-27,2007-03-02,"Private, ltd by shares"241,0859034,"PS GROUP LIMITED
卓越亞洲集團有限公司",2003-08-27,,"Private, ltd by shares"242,0858976,"Q HOLDINGS LIMITED (d2005-11-25)
翠緣閣集團有限公司",2003-08-27,2005-11-25,"Private, ltd by shares"243,0859091,"RACE ART MOTORS LIMITED
駿藝汽車有限公司",2003-08-27,,"Private, ltd by shares"244,0859003,"RAINBOW NUTRACEUTICALS LIMITED",2003-08-27,2011-01-28,"Private, ltd by shares"245,0858986,"RC ENTERTAINMENT LIMITED",2003-08-27,2018-12-21,"Private, ltd by shares"246,0859172,"RD ADVERTISING AND PR AGENCY LIMITED
赤龍廣告策劃有限公司",2003-08-27,2006-08-18,"Private, ltd by shares"247,0859155,"REGAL FORCE INVESTMENT LIMITED
興偉投資有限公司",2003-08-27,2009-01-23,"Private, ltd by shares"248,0859178,"RHYTHM PIANO COMPANY LIMITED
威德琴行有限公司",2003-08-27,,"Private, ltd by shares"249,0859158,"RICHER INDUSTRIAL DEVELOPMENT LIMITED
瑞成實業發展有限公司",2003-08-27,,"Private, ltd by shares"250,0859094,"RICHLY GROUP LIMITED
恒富行有限公司",2003-08-27,,"Private, ltd by shares"251,0859153,"RICHLY WIN LIMITED
榮通有限公司",2003-08-27,2009-03-13,"Private, ltd by shares"252,0859260,"ROLL ROCK GROUP (H.K.) CO., LIMITED
滾石集團(香港)有限公司",2003-08-27,,"Private, ltd by shares"253,0859082,"RUNS TECHNOLOGY LIMITED
宏峰科技(香港)有限公司",2003-08-27,,"Private, ltd by shares"254,0859045,"RUSSIA WORITE CHEMICAL INDUSTRY GROUP LIMITED
俄羅斯沃瑞特化工集團有限公司",2003-08-27,2011-04-21,"Private, ltd by shares"255,0859142,"S.F. LOGISTICS (HONG KONG) LIMITED
順豐物流(香港)有限公司",2003-08-27,,"Private, ltd by shares"256,0858959,"S.J. HEALTH LINE COMPANY LIMITED
健康前線有限公司",2003-08-27,2008-01-11,"Private, ltd by shares"257,0859149,"SABRE FUND SERVICES LIMITED",2003-08-27,2009-01-30,"Private, ltd by shares"258,0859061,"SAM POWER ENGINEERING COMPANY LIMITED
三有工程有限公司",2003-08-27,,"Private, ltd by shares"259,0858952,"SANTAL (HK) COMPANY LIMITED
聖島(香港)有限公司",2003-08-27,,"Private, ltd by shares"260,0859283,"SCG FINANCIAL SERVICES LIMITED
首長四方金融服務有限公司",2003-08-27,2006-10-13,"Private, ltd by shares"261,0859137,"SEAL CONSULTING HK LIMITED",2003-08-27,2016-02-19,"Private, ltd by shares"262,0859193,"Sealord Development Limited
海隆投資發展有限公司",2003-08-27,,"Private, ltd by shares"263,0858968,"SEEDEAR (CHINA) CO., LIMITED
德國西電(中國)有限公司",2003-08-27,2009-01-23,"Private, ltd by shares"264,0859187,"SEF TELECOMMUNICATION COMPANY LIMITED
賽福通信技術有限公司",2003-08-27,2012-05-11,"Private, ltd by shares"265,0859083,"SEQ AVIATION SERVICES COMPANY LIMITED
新達航空服務有限公司",2003-08-27,2007-11-15,"Private, ltd by shares"266,0859226,"SF TECHNOLOGY DEVELOPMENT (HK) LIMITED
世豐科技發展(香港)有限公司",2003-08-27,2013-11-29,"Private, ltd by shares"267,0859167,"SHANGHAI GENERAL MACHINERY (GROUP) HONG KONG COMPANY LIMITED
上海通用機械(集團)香港有限公司",2003-08-27,2020-01-24,"Private, ltd by shares"268,0859268,"SHARP RISEN DEVELOPMENT LIMITED
銳陞發展有限公司",2003-08-27,2020-05-29,"Private, ltd by shares"269,0859262,"SHEEN PALM DEVELOPMENT LIMITED
耀棕發展有限公司",2003-08-27,,"Private, ltd by shares"270,0859024,"SHEK-O YOUTH SPORTS ASSOCIATION LIMITED
石澳青年體育會有限公司",2003-08-27,2011-06-24,"Ltd by guarantee"271,0859150,"SHIBUYA CO. LIMITED
洋寶有限公司",2003-08-27,2015-06-05,"Private, ltd by shares"272,0859107,"SHISEIMI INTERNATIONAL LIMITED
資生美國際有限公司",2003-08-27,,"Private, ltd by shares"273,0859028,"SIGNATURE PROMOTIONS LIMITED",2003-08-27,,"Private, ltd by shares"274,0859117,"SILKROAD AGENCIES (H.K.) LIMITED
思露代理(香港)有限公司",2003-08-27,,"Private, ltd by shares"275,0859209,"SILVER KEY LIMITED (d2013-01-11)
銀鎖匙有限公司",2003-08-27,2013-01-11,"Private, ltd by shares"276,0859089,"SINCERE FRIENDSHIP COMPANY LIMITED
諍友有限公司",2003-08-27,2007-04-04,"Private, ltd by shares"277,0859119,"SINO-BRITISH CULTURAL EXCHANGE &amp; DEVELOPMENT ASSOCIATION LIMITED
港英文化交流與發展協會有限公司",2003-08-27,2006-05-04,"Private, ltd by shares"278,0859278,"SINO-TELECOM INTERNATIONAL HOLDINGS LIMITED
華通國際股份有限公司",2003-08-27,,"Private, ltd by shares"279,0859090,"SISBRO PROPERTY MANAGEMENT LIMITED
善保物業管理有限公司",2003-08-27,,"Private, ltd by shares"280,0858983,"SISHIELD TECHNOLOGIES (HONG KONG) LIMITED
西爾斯科技(香港)有限公司",2003-08-27,2007-02-09,"Private, ltd by shares"281,0859116,"SK NATURAL HERB (CHINA &amp; HK) LIMITED",2003-08-27,2006-04-28,"Private, ltd by shares"282,0859065,"SK-II (JAPAN) FASHION LIMITED",2003-08-27,2006-02-03,"Private, ltd by shares"283,0859084,"SKY CLOTHINGS LIMITED
時佳創作有限公司",2003-08-27,2005-10-07,"Private, ltd by shares"284,0859273,"SKY DELIGHT LIMITED (d2008-10-17)
天殷有限公司",2003-08-27,2008-10-17,"Private, ltd by shares"285,0859112,"SKYBLUE TRADING COMPANY LIMITED (d2006-01-06)
天空藍有限公司",2003-08-27,2006-01-06,"Private, ltd by shares"286,0859201,"SMART POWER LIMITED (d2010-01-22)
駿能有限公司",2003-08-27,2010-01-22,"Private, ltd by shares"287,0859020,"SMART REGENT CONSULTANTS LIMITED
盛信顧問有限公司",2003-08-27,2005-12-30,"Private, ltd by shares"288,0859199,"SMART RICH DEVELOPMENT LIMITED (d2017-04-21)
偉裕發展有限公司",2003-08-27,2017-04-21,"Private, ltd by shares"289,0859044,"SND OPTIC ELECTRONICS (HK) LIMITED
聖諾達光電(香港)有限公司",2003-08-27,2011-09-23,"Private, ltd by shares"290,0859132,"SQUINA COSMETICS INTERNATIONAL COMPANY LIMITED
雪肌蘭天然護膚品國際有限公司",2003-08-27,2017-02-03,"Private, ltd by shares"291,0859016,"STAR REGAL LIMITED (d2015-01-30)
寶星有限公司",2003-08-27,2015-01-30,"Private, ltd by shares"292,0859054,"STRONG FAIR INDUSTRIAL (HK) LIMITED
進輝實業(香港)有限公司",2003-08-27,,"Private, ltd by shares"293,0859095,"SUCCESS RICHLY FINANCE LIMITED
成業財務有限公司",2003-08-27,2017-09-29,"Private, ltd by shares"294,0859103,"SUI TAT FURNITURE (HK) INT'L GROUP LIMITED
香港瑞達家俬國際集團有限公司",2003-08-27,2008-01-11,"Private, ltd by shares"295,0859004,"SUN WIN DRAGON ENGINEERING LIMITED
新威龍工程有限公司",2003-08-27,,"Private, ltd by shares"296,0859057,"SUNJET INDUSTRIES GROUP (HONGKONG) COMPANY, LIMITED
聖捷特工業集團(香港)有限公司",2003-08-27,2016-01-29,"Private, ltd by shares"297,0859166,"SUNKAI PRINTING EQUIPMENT LIMITED
新佳印刷器材有限公司",2003-08-27,2008-06-13,"Private, ltd by shares"298,0859200,"SUNNY CHINA LIMITED
華日有限公司",2003-08-27,,"Private, ltd by shares"299,0858972,"SUNNY WATCH MANUFACTORY LIMITED
陽光錶廠有限公司",2003-08-27,,"Private, ltd by shares"300,0859244,"SYNERGY RESOURCES (HONG KONG) ENTERPRISE LIMITED
東潤灝源(香港)實業有限公司",2003-08-27,2006-04-07,"Private, ltd by shares"301,0859147,"Taiwan Pak Sing Shares Limited
台灣珀誠股份有限公司",2003-08-27,,"Private, ltd by shares"302,0859250,"TAK SHING LI INTERNATIONAL HOLDINGS LIMITED
德誠利國際集團有限公司",2003-08-27,,"Private, ltd by shares"303,0859215,"TARSEN TRADING LIMITED
達誠貿易有限公司",2003-08-27,2016-08-19,"Private, ltd by shares"304,0858951,"TARZAN INDUSTRIAL LIMITED
泰山實業(香港)有限公司",2003-08-27,,"Private, ltd by shares"305,0859219,"Thameford Investment Co. Limited
晉煒香港投資有限公司",2003-08-27,2014-03-28,"Private, ltd by shares"306,0859131,"TOYO GROUP LIMITED
東洋集團有限公司",2003-08-27,2017-04-13,"Private, ltd by shares"307,0858970,"TRIYIA INTERNATIONAL ENTERPRISE LIMITED
三億國際企業有限公司",2003-08-27,2019-03-22,"Private, ltd by shares"308,0859245,"TRUE FAITH INDUSTRIAL DEVELOPMENT LIMITED
真誠實業發展有限公司",2003-08-27,2010-06-25,"Private, ltd by shares"309,0859071,"TRUE LIGHT CIVIL CONTRACTORS LIMITED
真輝土木建築有限公司",2003-08-27,,"Private, ltd by shares"310,0859176,"TUNGFORM INTERNATIONAL CO., LIMITED
彤楓國際有限公司",2003-08-27,,"Private, ltd by shares"311,0859231,"TWINFLIES COMPANY LIMITED
天輝首飾有限公司",2003-08-27,,"Private, ltd by shares"312,0859127,"UK XSLS (H.K.) DOMESTIC TEXTILE DECORATION LIMITED
英國仙絲雷紗(香港)家紡裝飾有限公司",2003-08-27,,"Private, ltd by shares"313,0858997,"UMAC FORWARDERS EXPRESS LIMITED",2003-08-27,2011-04-21,"Private, ltd by shares"314,0859157,"UNION GAIN (ASIA) LIMITED
聯興(亞洲)有限公司",2003-08-27,,"Private, ltd by shares"315,0859171,"UNION METAL (CHINA) BUSINESS LIMITED
聯合金屬(中國)商業有限公司",2003-08-27,2008-01-11,"Private, ltd by shares"316,0859097,"UNITED CITY INTERNATIONAL LIMITED
港昌國際有限公司",2003-08-27,,"Private, ltd by shares"317,0859021,"UNITED MAX PRODUCTS LIMITED
聯美製品有限公司",2003-08-27,,"Private, ltd by shares"318,0859182,"VISION DYNAMICS LIMITED (HK)
理動有限公司",2003-08-27,2019-04-26,"Private, ltd by shares"319,0859277,"VISON ENGINEERING LIMITED
偉成工程有限公司",2003-08-27,2008-01-11,"Private, ltd by shares"320,0859005,"WAAGESTAM TRADING (HK) LIMITED",2003-08-27,2008-01-11,"Private, ltd by shares"321,0859037,"WAH BO GLOBAL INDUSTRIAL COMPANY LIMITED
華寶環球實業有限公司",2003-08-27,,"Private, ltd by shares"322,0859238,"WAI KIN TRADING LIMITED (d2010-01-22)
偉健貿易有限公司",2003-08-27,2010-01-22,"Private, ltd by shares"323,0859220,"WAI YANG TONG MEI CHU'S PROMOTION LIMITED
惠陽塘尾朱氏促進會有限公司",2003-08-27,,"Ltd by guarantee"324,0858963,"WALEX INTERNATIONAL COMPANY LIMITED
威利士國際有限公司",2003-08-27,2011-01-14,"Private, ltd by shares"325,0858977,"WEALTH ENGINEERING &amp; TRADING LIMITED
潤豐工程貿易有限公司",2003-08-27,2009-11-27,"Private, ltd by shares"326,0859056,"WEI SHENG RESOURCES LIMITED",2003-08-27,,"Private, ltd by shares"327,0858998,"WEILI GARMENT HONG KONG COMPANY LIMITED
偉力製衣香港有限公司",2003-08-27,,"Private, ltd by shares"328,0859287,"WELL FULL LAND CO., LIMITED
匯富控股有限公司",2003-08-27,,"Private, ltd by shares"329,0859271,"WIDER NEWS INTERNATIONAL LIMITED
弘訊國際有限公司",2003-08-27,2006-01-27,"Private, ltd by shares"330,0859087,"WIN'S AUTO COMPANY LIMITED
威發汽車有限公司",2003-08-27,,"Private, ltd by shares"331,0859092,"WING FAT COMMERCE &amp; INDUSTRIAL LIMITED (d2005-02-04)
永發商貿實業有限公司",2003-08-27,2005-02-04,"Private, ltd by shares"332,0859225,"WINGS LOGISTICS (HK) LIMITED
華美物流有限公司",2003-08-27,2014-12-23,"Private, ltd by shares"333,0859175,"WINNERS COMPUTER COMPANY LIMITED (d2007-05-25)
宏業電腦有限公司",2003-08-27,2007-05-25,"Private, ltd by shares"334,0858981,"WISE GUIDE LIMITED",2003-08-27,,"Private, ltd by shares"335,0858988,"WORLD TRUMP GARMENT (HONG KONG) LIMITED
世昌製衣(香港)有限公司",2003-08-27,2008-05-23,"Private, ltd by shares"336,0859111,"XING ZHOU (H.K.) INVESTMENT CONSULTANCY LIMITED
星洲(香港)投資咨詢有限公司",2003-08-27,2006-11-03,"Private, ltd by shares"337,0859242,"YAT DA H.K. LIMITED
溢達香港貿易有限公司",2003-08-27,2013-09-06,"Private, ltd by shares"338,0859053,"YEE FUNG LOGISTICS TECHNOLOGY LIMITED
怡豐自動化科技有限公司",2003-08-27,,"Private, ltd by shares"339,0858953,"YERON INTERNATIONAL COMPANY LIMITED
日朗國際發展有限公司",2003-08-27,2013-09-19,"Private, ltd by shares"340,0859023,"YMCA OF HONG KONG CHRISTIAN COLLEGE MANAGEMENT COMMITTEE LIMITED
港青基信書院校董會有限公司",2003-08-27,,"Ltd by guarantee"341,0859114,"ZHAO LI TECHNOLOGY LIMITED
兆力科技有限公司",2003-08-27,2007-04-20,"Private, ltd by shares"342,0859066,"ZHEJIANG FUCHUN CORPORATION LIMITED
浙江富春有限公司",2003-08-27,2013-02-22,"Private, ltd by shares"