,Reg no.,Name,Incorp-orated,Dissolved,Type228,2183739,"HK WEIXI SANITARY WARE CO., LIMITED
香港維西潔具有限公司",2014-12-22,2017-08-11,"Private, ltd by shares"229,2183745,"HK XIAOTU TECHNOLOGY INDUSTRIAL LIMITED
香港小土科技實業有限公司",2014-12-22,2018-08-24,"Private, ltd by shares"230,2183981,"HK YINYUAN TRADE CO LIMITED
香港鑫源行貿易有限公司",2014-12-22,2018-08-24,"Private, ltd by shares"231,2183622,"HO FAT ENGINEERING LIMITED
昊發工程有限公司",2014-12-22,,"Private, ltd by shares"232,2184010,"HO MING TAXI MANAGEMENT LIMITED
灝明的士管理有限公司",2014-12-22,,"Private, ltd by shares"233,2183558,"HONG KONG ALPHA BABY TOYS LIMITED
香港奧飛嬰童玩具有限公司",2014-12-22,,"Private, ltd by shares"234,2183637,"HONG KONG ASSOCIATION OF HOSTELS LIMITED
香港旅舍業商會有限公司",2014-12-22,,"Ltd by guarantee"235,2183872,"HONG KONG BAIYANG ENTERPRISE CO., LIMITED
香港百洋實業有限公司",2014-12-22,,"Private, ltd by shares"236,2183911,"HONG KONG CITY LOVE INTERNATIONAL ECOLOGICAL INDUSTRY LIMITED
香港城市有愛國際生態產業有限公司",2014-12-22,,"Private, ltd by shares"237,2183873,"HONG KONG CTS TECHNICAL SERVICE LIMITED
香港華德技術服務有限公司",2014-12-22,,"Private, ltd by shares"238,2183939,"Hong Kong Cultural Heritage Appraisal Institute Co., Limited
香港佳中煌食品有限公司",2014-12-22,2018-08-24,"Private, ltd by shares"239,2183688,"HONG KONG FOREVER BEAUTY (INTERNATIONAL) CO., LIMITED
香港雋永(國際)有限公司",2014-12-22,,"Private, ltd by shares"240,2183560,"HONG KONG GACI INTERNATIONAL TRADING LIMITED
香港伽慈國際貿易有限公司",2014-12-22,2016-05-13,"Private, ltd by shares"241,2183611,"Hong Kong Heyi Adhesive Products Limited
香港合易佳膠粘製品有限公司",2014-12-22,2018-04-13,"Private, ltd by shares"242,2184012,"HONG KONG INTERIOR DESIGN ARCHITECTURE LIMITED
香港室內設計建築有限公司",2014-12-22,,"Private, ltd by shares"243,2184054,"HONG KONG LINGNAN TECHNOLOGY LIMITED
香港嶺南科技有限公司",2014-12-22,,"Private, ltd by shares"244,2183744,"Hong Kong Missun Industry Co., Limited
香港彌生實業股份有限公司",2014-12-22,,"Private, ltd by shares"245,2183592,"Hong Kong NPK Horizon Limited",2014-12-22,,"Private, ltd by shares"246,2183805,"Hong Kong Parkface Limited
香港博賽有限公司",2014-12-22,,"Private, ltd by shares"247,2184031,"Hong Kong Tongrui Trading Company Limited
香港同瑞商貿有限公司",2014-12-22,2019-05-24,"Private, ltd by shares"248,2183817,"Hong Kong Tree Group Co., Limited
香港嘉樹集團有限公司",2014-12-22,2018-05-04,"Private, ltd by shares"249,2183820,"HONG KONG TSM CO., LIMITED
香港泰旭工貿有限公司",2014-12-22,,"Private, ltd by shares"250,2183999,"Hong Kong Yuen Fung Footwear Limited
香港源鋒鞋業有限公司",2014-12-22,,"Private, ltd by shares"251,2184050,"Hong Kong YuHua Investment Management Co., Limited
香港玉華投資管理有限公司",2014-12-22,2020-06-05,"Private, ltd by shares"252,2183632,"HONG KONG ZHAO DA ENVIRONMENTAL PROTECTION LIMITED
香港兆大環保有限公司",2014-12-22,,"Private, ltd by shares"253,2183559,"Hong Kong Zhi Da Leather Fan Bu Company Limited
香港志達皮革帆布有限公司",2014-12-22,,"Private, ltd by shares"254,2184045,"HONGDACHENG ELECTRONIC CO., LIMITED
鴻達誠電子有限公司",2014-12-22,,"Private, ltd by shares"255,2183765,"HONGKONG ASHE CULTURE CO., LIMITED
香港阿釋易文化有限公司",2014-12-22,,"Private, ltd by shares"256,2183700,"HONGKONG BPFED INTERNATIONAL GROUP CO., LIMITED
香港百平百太國際集團有限公司",2014-12-22,2018-02-23,"Private, ltd by shares"257,2183770,"HongKong Century Investment Development Limited
香港世紀投資發展有限公司",2014-12-22,,"Private, ltd by shares"258,2183797,"Hongkong Dora Group Limited
香港朵拉集團有限公司",2014-12-22,2016-08-19,"Private, ltd by shares"259,2183748,"HONGKONG EER HONGDOU DRESS LIMITED
香港鄂爾虹豆服飾有限公司",2014-12-22,2018-08-31,"Private, ltd by shares"260,2183891,"HONGKONG FUBON SHENGSHI INTERNATIONAL TRADE CO., LIMITED
香港富邦盛世國際貿易有限公司",2014-12-22,,"Private, ltd by shares"261,2183930,"HONGKONG FUYINGKAI INTERNATIONAL GROUP LIMITED
香港富盈凱國際集團有限公司",2014-12-22,,"Private, ltd by shares"262,2183830,"HONGKONG GUANCHENG INFORMATION TECHNOLOGY LIMITED
香港冠誠信息科技有限公司",2014-12-22,2018-08-24,"Private, ltd by shares"263,2183860,"HONGKONG GUANGDA INVESTMENT LIMITED
香港廣達投資有限公司",2014-12-22,2018-08-24,"Private, ltd by shares"264,2183903,"HongKong JiaDe International Holdings Limited
香港嘉德國際控股有限公司",2014-12-22,,"Private, ltd by shares"265,2183787,"HONGKONG JIANKANG INDUSTRY CO., LIMITED
香港健康產業有限公司",2014-12-22,,"Private, ltd by shares"266,2183960,"HONGKONG KERIDA INVESTMENT CO., LIMITED
香港凱瑞達投資有限公司",2014-12-22,2016-03-11,"Private, ltd by shares"267,2183775,"HONGKONG LUSA UA INT'L GROUP LIMITED
香港露莎國際集團有限公司",2014-12-22,,"Private, ltd by shares"268,2184072,"HongKong Master Diaper Limited
香港尿布師貿易有限公司",2014-12-22,2019-02-15,"Private, ltd by shares"269,2184063,"HONGKONG MEIDA INTERNATIONAL TRADE LIMITED
香港美達國際貿易有限公司",2014-12-22,2018-08-24,"Private, ltd by shares"270,2183839,"HONGKONG PUMEI DECORATIVE ENGINEERING LIMITED
香港菩美裝飾工程股份有限公司",2014-12-22,2019-10-25,"Private, ltd by shares"271,2184057,"Hongkong Shenglixing Electronic Technology Co., Limited
香港盛利興電子科技有限公司",2014-12-22,,"Private, ltd by shares"272,2183746,"HONGKONG SMES LISTED INCUBATION LIMITED
香港中小企業上市孵化股份有限公司",2014-12-22,,"Private, ltd by shares"273,2183654,"HongKong X-ray Photoelectric Co., Limited
香港愛克斯光電有限公司",2014-12-22,,"Private, ltd by shares"274,2183657,"HONGKONG XUAN LONG INTERNATIONAL LIMITED
香港炫龍國際有限公司",2014-12-22,,"Private, ltd by shares"275,2183761,"HONGKONG YA SI TE (INTERNATIONAL) GROUP CO., LIMITED
香港雅斯特(國際)集團有限公司",2014-12-22,,"Private, ltd by shares"276,2183647,"HONGKONG YI CI HONG NATURAL MEDICINE TREATING CHRONIC DISEASE RESEARCH LIMITED
香港億濨鴻自然醫學中醫治慢病研究有限公司",2014-12-22,,"Private, ltd by shares"277,2183774,"HongKong Yuguan Trade Limited
香港御冠貿易有限公司",2014-12-22,2018-06-22,"Private, ltd by shares"278,2183717,"Hongkong Zhenghe International Exhibition Co., Limited
香港鄭和國際展覽有限公司",2014-12-22,2018-08-24,"Private, ltd by shares"279,2183673,"HONGKONG ZHONGAN TRADING CO., LIMITED
香港中安貿易有限公司",2014-12-22,2018-07-13,"Private, ltd by shares"280,2183798,"Hongkong Ziging Industrial Co., Limited
香港紫荊實業有限公司",2014-12-22,,"Private, ltd by shares"281,2183725,"HONGKONG ZOND TRADE LIMITED
香港仲德貿易有限公司",2014-12-22,2017-06-30,"Private, ltd by shares"282,2184058,"HONKONG WISDOM COMMITMENT EDUCATION LIMITED
香港中投國智國際教育有限公司",2014-12-22,2018-08-24,"Private, ltd by shares"283,2184076,"HOUSE OF HELLO FASHION LIMITED
哈囉屋時裝有限公司",2014-12-22,,"Private, ltd by shares"284,2183927,"HPM HOLDINGS LIMITED",2014-12-22,2018-08-24,"Private, ltd by shares"285,2183669,"HUAFU (HONGKONG) INTERNATIONAL TRADING LIMITED
華福(香港)國際貿易有限公司",2014-12-22,2018-08-31,"Private, ltd by shares"286,2183795,"Hudson Piron Limited
哈德森博龍有限公司",2014-12-22,2017-10-27,"Private, ltd by shares"287,2183792,"Hudson Rhodes Limited
哈德森羅斯有限公司",2014-12-22,2018-02-23,"Private, ltd by shares"288,2184047,"Hzone Holdings Limited
滙眾控股有限公司",2014-12-22,,"Private, ltd by shares"289,2183634,"ICRIS:2183634 (no English name)
北大博雅集團投資發展有限公司",2014-12-22,2017-04-07,"Private, ltd by shares"290,2183866,"IEP EXP SUBAKI LTDA COMPANY LIMITED",2014-12-22,2020-09-11,"Private, ltd by shares"291,2183811,"IL MILIONE LIMITED (d2017-01-06)",2014-12-22,2017-01-06,"Private, ltd by shares"292,2183846,"Imperial Restaurant Limited
御品餐廳有限公司",2014-12-22,,"Private, ltd by shares"293,2183973,"IN FORTUNE TRADING DEVELOP LIMITED (d2018-08-24)
金進貿易拓展有限公司",2014-12-22,2018-08-24,"Private, ltd by shares"294,2184043,"Infiniti Marine Limited
無極限海航有限公司",2014-12-22,,"Private, ltd by shares"295,2183773,"Innovative Development Limited",2014-12-22,,"Private, ltd by shares"296,2184056,"International Oilfield Services Limited",2014-12-22,,"Private, ltd by shares"297,2183653,"INTRACOM ASIA CO., LIMITED",2014-12-22,2017-08-11,"Private, ltd by shares"298,2183623,"IT PUNCH LIMITED",2014-12-22,,"Private, ltd by shares"299,2183671,"ITALY REVELLO INT'L PETRIFACTION GROUP LIMITED
意大利雷韋洛國際石化集團有限公司",2014-12-22,2017-10-27,"Private, ltd by shares"300,2183904,"JIAMING METAL TRADE CO., LIMITED
佳明金屬貿易有限公司",2014-12-22,,"Private, ltd by shares"301,2183566,"JIAN LAI INDUSTRIAL DEVELOPMENT LIMITED
建萊實業發展有限公司",2014-12-22,,"Private, ltd by shares"302,2183727,"JIANGSU BRIGHT (HK) LIMITED
江蘇百銳特(香港)有限公司",2014-12-22,2020-05-29,"Private, ltd by shares"303,2183951,"JILI INDUSTRIAL CO., LIMITED
吉利實業有限公司",2014-12-22,,"Private, ltd by shares"304,2184073,"JINTEK INTERNATIONAL GROUP LIMITED",2014-12-22,,"Private, ltd by shares"305,2183910,"Jinyuan Asian Investment Limited
金圓亞洲投資有限公司",2014-12-22,,"Private, ltd by shares"306,2183936,"JITAI INDUSTRIAL (HK) DEVELOPMENT CO., LIMITED
吉泰實業(香港)發展有限公司",2014-12-22,2018-08-24,"Private, ltd by shares"307,2183852,"JOINT BRUSH CO., LIMITED",2014-12-22,,"Private, ltd by shares"308,2183713,"Jungle Trade Co., Limited
從林商貿有限公司",2014-12-22,2017-12-01,"Private, ltd by shares"309,2183578,"JUSTAKE INDUSTRIAL DEVELOPMENT LIMITED",2014-12-22,2015-12-24,"Private, ltd by shares"310,2183627,"KAI SHENG HOTEL MANAGEMENT (HK) LIMITED
凱晟酒店管理 (香港) 有限公司",2014-12-22,,"Private, ltd by shares"311,2183771,"Kakalico LIMITED",2014-12-22,,"Private, ltd by shares"312,2183845,"Kalerm (China) Coffee Machines Limited
咖樂美(中國)咖啡機有限公司",2014-12-22,,"Private, ltd by shares"313,2184079,"KAM HUNG INTERNATIONAL BUSINESS LIMITED
金鴻國際商貿有限公司",2014-12-22,2018-08-24,"Private, ltd by shares"314,2183990,"Kam Kong Trading (Int'l) Co Limited
金港貿易(國際)有限公司",2014-12-22,2015-10-02,"Private, ltd by shares"315,2184028,"KARA TECHNOLOGY LIMITED",2014-12-22,,"Private, ltd by shares"316,2183549,"KARTENS FASHION ACCESSORIES LIMITED
嘉騰輔料有限公司",2014-12-22,2018-06-29,"Private, ltd by shares"317,2184066,"KASON INDUSTRIAL INTERNATIONAL LIMITED
凱勝實業國際有限公司",2014-12-22,2020-07-17,"Private, ltd by shares"318,2183917,"KETONGLY HONGKONG PTY LIMITED
香港金通力有限公司",2014-12-22,2019-09-20,"Private, ltd by shares"319,2183563,"KINGDIAM INDUSTRIAL (HONGKONG) CO., LIMITED
金點實業(香港)有限公司",2014-12-22,2019-10-25,"Private, ltd by shares"320,2183607,"KOREA MINGJI CORPORATION INTERNATIONAL GROUP LIMITED
韓國明基株式會社國際集團有限公司",2014-12-22,,"Private, ltd by shares"321,2183979,"KOREA YA JI ORGANISMS TECHNOLOGY LIMITED
韓國婭姬生物科技有限公司",2014-12-22,,"Private, ltd by shares"322,2183905,"KUGARD CO., LIMITED
庫嘉有限公司",2014-12-22,2018-02-23,"Private, ltd by shares"323,2183723,"Kun Kong Wing Limited
權廣榮有限公司",2014-12-22,,"Private, ltd by shares"324,2183883,"KWIK WAY GLOBAL LIMITED
君薈環球有限公司",2014-12-22,,"Private, ltd by shares"325,2183684,"LAI LAI TRADING CO., LIMITED
來來貿易有限公司",2014-12-22,2019-04-04,"Private, ltd by shares"326,2183660,"LATURE BIO-TECHNOLOGY CO., LIMITED
穀萃生技有限公司",2014-12-22,2017-08-18,"Private, ltd by shares"327,2184040,"Le Health Holdings Co., Limited
易品控股有限公司",2014-12-22,2020-07-03,"Private, ltd by shares"328,2184032,"LEA NATURE ASIA LIMITED",2014-12-22,,"Private, ltd by shares"329,2183901,"LEEWAH GLOBAL TRADING LIMITED
利華環球商貿有限公司",2014-12-22,2018-08-24,"Private, ltd by shares"330,2184014,"Lemonade Hong Kong Limited",2014-12-22,2017-11-17,"Private, ltd by shares"331,2183899,"Lezi Entertainment Limited
了子娛樂有限公司",2014-12-22,,"Private, ltd by shares"332,2184062,"LFM Global Investment (Asia) Company Limited
諾安國際資產管理（亞洲）有限公司",2014-12-22,,"Private, ltd by shares"333,2183915,"Li Fo Di Company Limited
唎佛帝有限公司",2014-12-22,,"Private, ltd by shares"334,2183925,"LIANTOU (HONGKONG) INVESTMENTS MANAGEMENT LIMITED
聯投(香港)投資管理有限公司",2014-12-22,,"Private, ltd by shares"335,2183554,"LIFE-STYLE HEALTH CENTRE LIMITED
時尚堡有限公司",2014-12-22,,"Private, ltd by shares"336,2183721,"Lihui Trading Limited
利輝商貿有限公司",2014-12-22,2018-08-24,"Private, ltd by shares"337,2184019,"LINEAR CORPORATION LIMITED",2014-12-22,2018-09-14,"Private, ltd by shares"338,2183912,"LINGFENG PRECISION (HK) LIMITED
菱豐精密(香港)有限公司",2014-12-22,2015-10-23,"Private, ltd by shares"339,2183825,"LINK PARK HOLDINGS LIMITED
皇品霖園實業股份有限公司",2014-12-22,,"Private, ltd by shares"340,2184007,"Linked International Trading Limited
麗琦國際貿易有限公司",2014-12-22,2019-02-22,"Private, ltd by shares"341,2183583,"LONG SHUO GROUP (HONG KONG) LIMITED
龍朔集團(香港)有限公司",2014-12-22,,"Private, ltd by shares"342,2183586,"LONGFU INTERNATIONAL GROUP LIMITED
龍福國際集團有限公司",2014-12-22,2018-08-24,"Private, ltd by shares"343,2184020,"LONGGOOD TRADING LIMITED
長鴻貿易有限公司",2014-12-22,2018-08-24,"Private, ltd by shares"344,2183690,"Lordline Technology Development Company Limited",2014-12-22,,"Private, ltd by shares"345,2183909,"Lovely Baby Int'l Beauty Chain Organizations (HK) Limited
香港伊萊蓓美國際美容連鎖機構有限公司",2014-12-22,,"Private, ltd by shares"346,2183710,"Luster LightTech International Co., Limited
凌雲光技術國際有限公司",2014-12-22,,"Private, ltd by shares"347,2183829,"LYZ ENTERPRISE CO., LIMITED
立仕實業有限公司",2014-12-22,2019-07-12,"Private, ltd by shares"348,2183824,"MACAU VALUABLE LIFE GROUP LIMITED
澳門金典集團有限公司",2014-12-22,2018-08-24,"Private, ltd by shares"349,2183709,"Manface (HongKong) International Biotechnology Co., Limited
曼斐斯(香港)國際生物科技有限公司",2014-12-22,,"Private, ltd by shares"350,2183986,"Marike van Beurden Consulting Limited",2014-12-22,,"Private, ltd by shares"351,2183553,"MAX PRO TELECOM LIMITED
一站通電訊有限公司",2014-12-22,2019-08-02,"Private, ltd by shares"352,2183631,"Maxcity International Holdings Limited
萬象都會國際控股有限公司",2014-12-22,,"Private, ltd by shares"353,2183604,"MCELASER LIMITED",2014-12-22,,"Private, ltd by shares"354,2183850,"MEDICALEXPORT LIMITED",2014-12-22,2018-08-24,"Private, ltd by shares"355,2183832,"MEGA MANDIRI TRADING LIMITED
美加貿易有限公司",2014-12-22,,"Private, ltd by shares"356,2184024,"MIA INTERNATIONAL TRADE COMPANY LIMITED
米婭國際貿易有限公司",2014-12-22,2018-07-13,"Private, ltd by shares"357,2183831,"MIDEAST ENERGY CO., LIMITED
中東能源有限公司",2014-12-22,2020-06-19,"Private, ltd by shares"358,2183581,"Ming Sheng Investment Group Company Limited
銘盛投資集團有限公司",2014-12-22,,"Private, ltd by shares"359,2183617,"MIRIM FASHION FOREIGN TRADING LIMITED
美林時裝外貿有限公司",2014-12-22,2018-08-24,"Private, ltd by shares"360,2183661,"MORALI LEON LIMITED",2014-12-22,2020-11-06,"Private, ltd by shares"361,2184002,"Morley Development Limited
文力發展有限公司",2014-12-22,,"Private, ltd by shares"362,2183596,"MULTICULTURAL CONSULTING LIMITED
多元文化諮詢有限公司",2014-12-22,2017-09-15,"Private, ltd by shares"363,2184016,"MYPTS TECHNOLOGY LIMITED",2014-12-22,2018-07-06,"Private, ltd by shares"364,2183600,"N-TONGJI ELECTRONIC CO., LIMITED
同濟新電子有限公司",2014-12-22,,"Private, ltd by shares"365,2184082,"NAMSAM RESOURCES CO., LIMITED",2014-12-22,2019-01-25,"Private, ltd by shares"366,2183598,"NANHAI INTERNATIONAL STRATEGY INNOVATION INVESTMENT LIMITED
藍海國際戰略創新投資股份有限公司",2014-12-22,2018-08-24,"Private, ltd by shares"367,2183546,"Natural (China) Holding Limited
天然(中國)控股有限公司",2014-12-22,,"Private, ltd by shares"368,2183736,"Neft Energy International Limited",2014-12-22,2018-08-24,"Private, ltd by shares"369,2183735,"NEW LUCK ENTERTAINMENT LIMITED
新瑞娛樂有限公司",2014-12-22,,"Private, ltd by shares"370,2183955,"NEW SHINE TRADING DEVELOP LIMITED
新盛貿易拓展有限公司",2014-12-22,,"Private, ltd by shares"371,2183785,"NINGBO GOODSGOOD IMP&amp;EXP CO., LIMITED
寧波好好進出口有限公司",2014-12-22,2019-10-25,"Private, ltd by shares"372,2183555,"NonDee Limited",2014-12-22,,"Private, ltd by shares"373,2183989,"Nordic Holdings Limited (HK)",2014-12-22,,"Private, ltd by shares"374,2183838,"NSRS HONG KONG, LIMITED",2014-12-22,,"Private, ltd by shares"375,2183619,"Nutrimax Feed Limited",2014-12-22,2016-05-27,"Private, ltd by shares"376,2184027,"o'Naomi Global Cosmetic Limited
梨奧美環球化粧品有限公司",2014-12-22,,"Private, ltd by shares"377,2183615,"O2 INTERNATIONAL ENERGY CONSULTANCY LIMITED",2014-12-22,2016-08-26,"Private, ltd by shares"378,2183756,"OAWELL (HK) CO., LIMITED
歐好(香港)有限公司",2014-12-22,,"Private, ltd by shares"379,2183977,"OBAOR Equity Investment and Fund Management China Limited
一帶一路股權投資基金管理中國有限公司",2014-12-22,,"Private, ltd by shares"380,2183809,"OCEAN SKY TECHNOLOGY INVESTMENT LIMITED",2014-12-22,,"Private, ltd by shares"381,2183589,"OFFICE KIT LIMITED (HK)",2014-12-22,2017-07-07,"Private, ltd by shares"382,2183676,"OK BANG (HONGKONG) TECHNOLOGY COMPANY LIMITED
歐科邦(香港)科技有限公司",2014-12-22,2018-08-24,"Private, ltd by shares"383,2183994,"ON TAT TRADING CO., LIMITED
安達進出口貿易有限公司",2014-12-22,,"Private, ltd by shares"384,2183902,"OPO INTERNATIONAL CO., LIMITED
賽涵嘉國際有限公司",2014-12-22,,"Private, ltd by shares"385,2183638,"ORCHID TREE CAPITAL MANAGEMENT LIMITED",2014-12-22,,"Private, ltd by shares"386,2183823,"Oulihua Shengwu Limited
歐莉花生物有限公司",2014-12-22,,"Private, ltd by shares"387,2183608,"Overturn Hong Kong Limited
推倒香港科技有限公司",2014-12-22,,"Private, ltd by shares"388,2183715,"PACIFIC (HK) INTERNATIONAL TRADING LIMITED
太平洋(香港)國際貿易有限公司",2014-12-22,2018-08-24,"Private, ltd by shares"389,2183968,"Pacific Capital Corp. Limited",2014-12-22,2017-12-15,"Private, ltd by shares"390,2183964,"PALAU PACIFIC AIRWAYS (HK) LIMITED
帛琉太平洋航空(香港)有限公司",2014-12-22,,"Private, ltd by shares"391,2183796,"PAN-ASIA FINE CHEMICALS INTERNATIONAL LIMITED",2014-12-22,2018-08-24,"Private, ltd by shares"392,2183577,"PARIS CARLA BEAUTY INTERNATIONAL CO., LIMITED
巴黎卡啦美妝國際有限公司",2014-12-22,2018-08-24,"Private, ltd by shares"393,2183880,"PEARL CONSULTANCY SERVICES LIMITED
明珠諮詢服務有限公司",2014-12-22,,"Private, ltd by shares"394,2183682,"People Group (International) Investment Limited
萬眾集團(國際)投資有限公司",2014-12-22,,"Private, ltd by shares"395,2183579,"PHOENIX FUND LIMITED
鳳凰基金有限公司",2014-12-22,2020-11-13,"Private, ltd by shares"396,2183870,"Po Hau Holdings Limited
樸厚控股有限公司",2014-12-22,,"Private, ltd by shares"397,2183681,"POAICAIZHI BUSINESS COLLEGE LIMITED
泊愛財智商學院有限公司",2014-12-22,2018-08-24,"Private, ltd by shares"398,2183974,"PRIME DYNAPOLIS INVESTMENT LIMITED
品尊投資有限公司",2014-12-22,2016-05-20,"Private, ltd by shares"399,2183881,"PROMISES INTERNATIONAL TRADE (HONGKONG) LIMITED
浦米森國際貿易(香港)有限公司",2014-12-22,2018-07-27,"Private, ltd by shares"400,2183658,"PUGUANG TRADING LIMITED
普光貿易有限公司",2014-12-22,2017-12-08,"Private, ltd by shares"401,2183574,"Pure Asia Biotech Limited
普亞生物科技有限公司",2014-12-22,,"Private, ltd by shares"402,2183567,"PURPLE PEAKS DEVELOPMENT (HONG KONG) LIMITED
紫峰發展(香港)有限公司",2014-12-22,,"Private, ltd by shares"403,2184046,"QIAN LI GROUP (HONG KONG) LIMITED
千里集團(香港)有限公司",2014-12-22,,"Private, ltd by shares"404,2183924,"QING AND SEN TRADING LIMITED
清森貿易有限公司",2014-12-22,2018-04-27,"Private, ltd by shares"405,2183772,"Quality Foods (HK) Limited",2014-12-22,,"Private, ltd by shares"406,2183726,"Rich Funding (Holdings) Limited (The)
樺溢資本(控股)有限公司",2014-12-22,,"Private, ltd by shares"407,2183759,"RICH SOIL DEVELOPMENT LIMITED
佳沃發展有限公司",2014-12-22,,"Private, ltd by shares"408,2183967,"RIGHTEOUS COMPANY CO., LIMITED
忠義貿易有限公司",2014-12-22,,"Private, ltd by shares"409,2183958,"RISE BEST TRADING DEVELOP LIMITED
佳豐貿易拓展有限公司",2014-12-22,,"Private, ltd by shares"410,2184064,"RISING DRAGON INTERNATIONAL TRADING (HK) LIMITED
騰龍國際貿易(香港)有限公司",2014-12-22,,"Private, ltd by shares"411,2184077,"RONGCHAO CHENG IMPORT&amp;EXPORT LIMITED
榮超城進出口有限公司",2014-12-22,,"Private, ltd by shares"412,2183804,"Rooftop Productions Limited
天台製作有限公司",2014-12-22,,"Private, ltd by shares"413,2183628,"ROSEDALE HOTEL CORPORATION LIMITED
珀麗酒店企業有限公司",2014-12-22,,"Private, ltd by shares"414,2183969,"RW SHINE MEDIA CO., LIMITED
香港聯創傳播有限公司",2014-12-22,2017-07-07,"Private, ltd by shares"415,2183923,"SAM CONTINENTAL GENERAL TRADING CO., LIMITED",2014-12-22,,"Private, ltd by shares"416,2183865,"SANTA LIGHTS CO., LIMITED
聖達燈飾有限公司",2014-12-22,,"Private, ltd by shares"417,2183956,"SANXING LIGHTING (HK) CO., LIMITED
三興燈飾(香港)有限公司",2014-12-22,,"Private, ltd by shares"418,2183722,"SAP GROUP LIMITED (HK)",2014-12-22,,"Private, ltd by shares"419,2183666,"SCANTRUST LIMITED",2014-12-22,,"Private, ltd by shares"420,2183702,"SCHOOL OF POSITIVE PSYCHOLOGY LIMITED (THE)",2014-12-22,,"Private, ltd by shares"421,2183854,"SEA HORSE SHIPPING (HK) LIMITED",2014-12-22,2020-09-30,"Private, ltd by shares"422,2184037,"Sewha International Co., Limited
世話國際有限公司",2014-12-22,2019-10-25,"Private, ltd by shares"423,2183996,"SHANGHAI PEILUOWEI COSTUME CO., LIMITED
上海培羅威服飾有限公司",2014-12-22,,"Private, ltd by shares"424,2183848,"SHANGHAI XIN HUA PERFUME CO., LIMITED (d2018-06-01)",2014-12-22,2018-06-01,"Private, ltd by shares"425,2183703,"SHANGHAI YAT INDUSTRY CO., LIMITED
上海亞特實業有限公司",2014-12-22,2019-03-08,"Private, ltd by shares"426,2183557,"SHEN International Company Limited",2014-12-22,2019-07-19,"Private, ltd by shares"427,2183842,"SHING HING TRADING (HONG KONG) LIMITED
成興貿易(香港)有限公司",2014-12-22,,"Private, ltd by shares"428,2183672,"SHITIAN ART (HK) LIMITED
世天藝術(香港)有限公司",2014-12-22,,"Private, ltd by shares"429,2183934,"SHUN LAI LOGISTICS LIMITED
順萊物流有限公司",2014-12-22,,"Private, ltd by shares"430,2183683,"SHUNXIANG HK EXPAND LIMITED
順祥香港拓展有限公司",2014-12-22,,"Private, ltd by shares"431,2183864,"SHUNZHUANG INTERNATIONAL GROUP (HK) LIMITED
順妝國際集團(香港)有限公司",2014-12-22,2020-11-06,"Private, ltd by shares"432,2183573,"Silk-Road Venture Group Limited",2014-12-22,,"Private, ltd by shares"433,2183706,"SILWALL INTERNATIONAL HOLDINGS (SHANGHAI) LIMITED
星沃國際集團有限公司",2014-12-22,,"Private, ltd by shares"434,2183847,"SIM Studio Limited",2014-12-22,,"Private, ltd by shares"435,2183650,"Simple(Hong Kong)Biotechnology Co., Limited
森普(香港)生物科技有限公司",2014-12-22,,"Private, ltd by shares"436,2183940,"Simplex Trade Limited (HK)",2014-12-22,2018-07-27,"Private, ltd by shares"437,2183826,"Simply Trade Limited",2014-12-22,2018-07-27,"Private, ltd by shares"438,2183922,"SINOMACHINERY ELECTRIC (HONG KONG) LIMITED
中工電氣股份有限公司",2014-12-22,2019-10-18,"Private, ltd by shares"439,2183895,"Sinothane Tech Counsulting Co., Limited
新諾森技術諮詢有限公司",2014-12-22,2018-08-10,"Private, ltd by shares"440,2184008,"Slum Allies Limited
朋盟窟有限公司",2014-12-22,2018-08-24,"Private, ltd by shares"441,2184006,"SOL Technology Limited (HK)",2014-12-22,,"Private, ltd by shares"442,2184034,"SolarPulse Asia Limited",2014-12-22,,"Private, ltd by shares"443,2184004,"SOVARNO INTERNATIONAL LIMITED",2014-12-22,,"Private, ltd by shares"444,2183886,"SPAIN NATURAL BEAUTY (HK) LIMITED
西班牙自然美(香港)有限公司",2014-12-22,2018-03-29,"Private, ltd by shares"445,2183613,"Splash Waterpark Management Consulting Limited",2014-12-22,,"Private, ltd by shares"446,2183840,"STAR DRAGON HOLDINGS LIMITED
星龍控股有限公司",2014-12-22,2018-08-24,"Private, ltd by shares"447,2184051,"Starch Limited (HK)",2014-12-22,,"Private, ltd by shares"448,2183556,"Stars Capital Limited
星資本有限公司",2014-12-22,2019-09-06,"Private, ltd by shares"449,2183890,"Starwood Entertainment Limited (d2017-10-20)
星目娛樂有限公司",2014-12-22,2017-10-20,"Private, ltd by shares"450,2183790,"STURMAN INTERNATIONAL CO., LIMITED
力實國際有限公司",2014-12-22,,"Private, ltd by shares"