,Reg no.,Name,Incorp-orated,Dissolved,Type451,2183758,"Sumir Home Textiles And Furnishings Limited
蘇米兒家飾用品有限公司",2014-12-22,2020-05-29,"Private, ltd by shares"452,2183851,"SUN TUNG YIK LIMITED
新同益有限公司",2014-12-22,,"Private, ltd by shares"453,2183885,"SUNFLOWER LADY GARMENT CO., LIMITED
香港聖弗蘭服飾有限公司",2014-12-22,2018-05-25,"Private, ltd by shares"454,2183641,"SUNJOY CULTURE AND ENTERTAINMENT CO., LIMITED
三棵竹文化娛樂有限公司",2014-12-22,,"Private, ltd by shares"455,2183687,"SUPER-MALE MACHANICAL EQUIPMENT CO., LIMITED
超雄機械設備有限公司",2014-12-22,,"Private, ltd by shares"456,2183692,"SUPREME HARVEST INTERNATIONAL FOOD LIMITED
巨豐國際食品有限公司",2014-12-22,2018-04-20,"Private, ltd by shares"457,2184039,"SURPLUS LUCK TRADING DEVELOP LIMITED
利運貿易拓展有限公司",2014-12-22,2018-08-24,"Private, ltd by shares"458,2183629,"SWITZERLAND LAIOU INTERNATIONAL CO., LIMITED
瑞士萊歐國際有限公司",2014-12-22,,"Private, ltd by shares"459,2183728,"SWITZERLAND SENLU (INTERNATIONAL) COSMETICS CO., LIMITED
瑞士森鹿(國際)化妝品有限公司",2014-12-22,2018-08-24,"Private, ltd by shares"460,2183928,"Synergy Success Consultant Limited
協成顧問(香港)有限公司",2014-12-22,,"Private, ltd by shares"461,2183849,"SZ GOLDEN CONSTRUCTION GROUP CO., LIMITED",2014-12-22,,"Private, ltd by shares"462,2183918,"SZZIL LIMITED",2014-12-22,2018-07-27,"Private, ltd by shares"463,2184074,"Tanza Limited (HK)",2014-12-22,,"Private, ltd by shares"464,2183862,"Targeted Microwave Solutions Hong Kong Limited",2014-12-22,2019-09-20,"Private, ltd by shares"465,2183603,"TATSU ELECTRONIC TECHNOLOGY (HK) CO., LIMITED
田津電子科技(香港)有限公司",2014-12-22,,"Private, ltd by shares"466,2183668,"TCA GROUP LIMITED (HK)",2014-12-22,,"Private, ltd by shares"467,2183642,"TeloGo Technologies Co., Limited
泰洛克科技有限公司",2014-12-22,2018-09-21,"Private, ltd by shares"468,2183938,"TEMPO INTERNATIONAL HOLDING GROUP LIMITED
天寶國際控股集團有限公司",2014-12-22,2019-05-31,"Private, ltd by shares"469,2183639,"TEND SONG TRADING LIMITED
騰信貿易有限公司",2014-12-22,,"Private, ltd by shares"470,2183662,"TIAN YU TRADING GROUP LIMITED
天宇貿易集團有限公司",2014-12-22,,"Private, ltd by shares"471,2183704,"Tianhong Trading Limited
天弘商貿有限公司",2014-12-22,2018-08-24,"Private, ltd by shares"472,2183648,"TIANMAO INTERNATIONAL (HK) DEVELOPMENT LIMITED
天貓國際(香港)發展有限公司",2014-12-22,2018-08-24,"Private, ltd by shares"473,2184013,"Tien-Jii International Investment (Group) Company Limited
天機開發國際投資(集團)有限公司",2014-12-22,2018-08-24,"Private, ltd by shares"474,2183971,"TIEWAY INTERNATIONAL (HK) LIMITED
泰威國際(香港)有限公司",2014-12-22,,"Private, ltd by shares"475,2184060,"Timberim inc. Limited",2014-12-22,,"Private, ltd by shares"476,2183835,"TIMMY QUARRY LIMITED
霆軒石業有限公司",2014-12-22,,"Private, ltd by shares"477,2183697,"TONGGONG XIECHENG SCIENCE AND TECHNOLOGY CO., LIMITED
同工協成科技有限公司",2014-12-22,,"Private, ltd by shares"478,2183786,"TONGQING LIMITED
通擎有限公司",2014-12-22,2019-06-14,"Private, ltd by shares"479,2183630,"TOP BEAUTY PACKAGING LIMITED
至高日化包裝有限公司",2014-12-22,,"Private, ltd by shares"480,2183599,"TRIANGLE CONNECTION LIMITED",2014-12-22,,"Private, ltd by shares"481,2183858,"TUNG LAW FIRM LIMITED",2014-12-22,2019-10-25,"Private, ltd by shares"482,2183591,"TWLASER LIMITED",2014-12-22,2019-03-15,"Private, ltd by shares"483,2183612,"U-SUN INTERNATIONAL TRADING CO., LIMITED
優晟國際貿易有限公司",2014-12-22,,"Private, ltd by shares"484,2183678,"UDNA GROUP LIMITED",2014-12-22,,"Private, ltd by shares"485,2183959,"UE Beauty Industry Limited
展美實業有限公司",2014-12-22,,"Private, ltd by shares"486,2183867,"Ugene International Holdings Limited
優因國際控股有限公司",2014-12-22,2018-03-16,"Private, ltd by shares"487,2183976,"UN EMERGENCY RELIEF CENTER LIMITED
聯合國緊急救援救助中心有限公司",2014-12-22,,"Private, ltd by shares"488,2184044,"UNIKI GROUP LIMITED
優立祺集團有限公司",2014-12-22,,"Private, ltd by shares"489,2184070,"Unique Electronic Smarter Technology &amp; Trade Corporation Limited",2014-12-22,2016-04-15,"Private, ltd by shares"490,2183844,"UNIVERSALITY LIMITED",2014-12-22,2018-07-27,"Private, ltd by shares"491,2183718,"USA DINGFENG OUTDOOR SUPPLIES LIMITED
美國鼎峰戶外用品有限公司",2014-12-22,,"Private, ltd by shares"492,2183992,"V FITNESS COMPANY LIMITED",2014-12-22,,"Private, ltd by shares"493,2183913,"V-Joy Enterprise Co., Limited
樂澄實業有限公司",2014-12-22,,"Private, ltd by shares"494,2183680,"V11 Limited (d2019-06-06)",2014-12-22,2019-06-06,"Private, ltd by shares"495,2183900,"Vimwoods Technology Co., Limited
微盛科技有限公司",2014-12-22,,"Private, ltd by shares"496,2183874,"VIRTUE GLOBAL DEVELOPMENT LIMITED
信德創富亞洲有限公司",2014-12-22,,"Private, ltd by shares"497,2183569,"Vision Share Limited
遠見股份有限公司",2014-12-22,,"Private, ltd by shares"498,2183937,"VOICE OF THE HARP LIMITED
豎琴雅樂有限公司",2014-12-22,,"Private, ltd by shares"499,2183766,"Vosun Co., Limited
唯尚股份有限公司",2014-12-22,,"Private, ltd by shares"500,2183626,"WEI, WEI &amp; CO., HOLDINGS LIMITED",2014-12-22,,"Private, ltd by shares"501,2183947,"WELL RISE ENERGY SAVING TECHNOLOGY LIMITED
展裕節能科技有限公司",2014-12-22,2017-02-17,"Private, ltd by shares"502,2183565,"WELMA CO., LIMITED
維爾瑪有限公司",2014-12-22,,"Private, ltd by shares"503,2183742,"WIN FORT INTERNATIONAL TRADING CO., LIMITED
香港盈福國際貿易有限公司",2014-12-22,2016-08-26,"Private, ltd by shares"504,2183822,"WINCOMM INTELLIGENT TECHNOLOGY (HONG KONG) LIMITED
萬康智能科技(香港)有限公司",2014-12-22,,"Private, ltd by shares"505,2183921,"Wind Group (Hong Kong) Global Communication Co., Limited
與德集團(香港)國際通訊有限公司",2014-12-22,,"Private, ltd by shares"506,2183861,"Windsong Equities Limited",2014-12-22,,"Private, ltd by shares"507,2183548,"Wing Lee Crane Limited
榮利重運有限公司",2014-12-22,,"Private, ltd by shares"508,2183636,"WINNER LIGHTING TECHNOLOGY CO., LIMITED
冠軍照明科技有限公司",2014-12-22,,"Private, ltd by shares"509,2183949,"Winson Photonics Technology Limited
永盛光電科技有限公司",2014-12-22,,"Private, ltd by shares"510,2183897,"WISDOM COMMITMENT GROUP LIMITED
中投國智國際集團有限公司",2014-12-22,2018-07-27,"Private, ltd by shares"511,2184061,"WISE INTELLIGENCE INTERNATIONAL GROUP CO., LIMITED
智英國際集團股份有限公司",2014-12-22,2019-10-25,"Private, ltd by shares"512,2183965,"World Caring Limited
環球凱爾瑞有限公司",2014-12-22,2017-05-19,"Private, ltd by shares"513,2184035,"WORLD INSTITUTE OF EYES PROTECTION AND OPTICS (HONG KONG) COMPANY LIMITED
世界視力與光學研究院(香港)有限公司",2014-12-22,,"Private, ltd by shares"514,2183810,"World Organization Health Industrial Development Group Co., Limited
世界衛生健康組織產業開發集團有限公司",2014-12-22,2018-08-24,"Private, ltd by shares"515,2183933,"XIAN DRAGON COMPANY LIMITED",2014-12-22,2019-10-25,"Private, ltd by shares"516,2183691,"XIN DA AUTOMOBILE TRADE CO., LIMITED
鑫達汽車貿易有限公司",2014-12-22,,"Private, ltd by shares"517,2183679,"Xin Dau Ji Limited
新斗記有限公司",2014-12-22,,"Private, ltd by shares"518,2183887,"YAYI TRADING LIMITED
雅伊貿易有限公司",2014-12-22,2017-12-01,"Private, ltd by shares"519,2183738,"YAYING LIGHTING CO., LIMITED
亞縈燈飾有限公司",2014-12-22,,"Private, ltd by shares"520,2183982,"YEEYE UNION CHINA INTERNATIONAL TRADING GROUP LIMITED
異業聯盟中國國際貿易集團有限公司",2014-12-22,2018-08-24,"Private, ltd by shares"521,2183562,"YESLAB (HK) EDUCATION CENTRE LIMITED
香港鼎智傳承科技有限公司",2014-12-22,,"Private, ltd by shares"522,2183855,"YH TRADE CO., LIMITED (d2018-07-27)
焱華貿易有限公司",2014-12-22,2018-07-27,"Private, ltd by shares"523,2183878,"YIDEA (HK) TRADE CO., LIMITED
翊德(香港)貿易有限公司",2014-12-22,,"Private, ltd by shares"524,2183815,"Yiwu Rilong IMP.&amp; EXP. Co., Limited
義烏日隆進出口有限公司",2014-12-22,,"Private, ltd by shares"525,2183696,"YMC ELECTRON TECHNOLOGY CO., LIMITED
外延世電子科技有限公司",2014-12-22,2018-05-25,"Private, ltd by shares"526,2183625,"YU LAI LOGISTICS LIMITED
裕萊物流有限公司",2014-12-22,,"Private, ltd by shares"527,2184003,"YUEDA TECHNOLOGY LIMITED
悅達科技有限公司",2014-12-22,2018-08-24,"Private, ltd by shares"528,2184081,"YUMMY DIM SUM PRODUCTION LIMITED
一品點心製作有限公司",2014-12-22,2018-03-09,"Private, ltd by shares"529,2183644,"YUNDEBANG LOGISTICS CO., LIMITED
運德邦物流有限公司",2014-12-22,2018-08-24,"Private, ltd by shares"530,2183953,"ZHEJIANG SUNMOO PIPE (GROUP) LIMITED
浙江雙牧管業(集團)有限公司",2014-12-22,2018-08-24,"Private, ltd by shares"531,2183919,"ZHEJIANG ZHENGTAI PIPE INDUSTRY LIMITED
浙江正泰管業有限公司",2014-12-22,2018-08-24,"Private, ltd by shares"532,2183806,"Zhiye Color Printing Co., Limited
志業彩色印刷有限公司",2014-12-22,,"Private, ltd by shares"533,2183571,"ZHONG FU LOGISTICS LIMITED
中福物流有限公司",2014-12-22,,"Private, ltd by shares"534,2183568,"ZHONG HONG INDUSTRIAL DEVELOPMENT (CHINA) LIMITED
中宏實業發展(中國)有限公司",2014-12-22,,"Private, ltd by shares"535,2183892,"ZILAN PHARMA VET CO., LIMITED
紫藍藥業有限公司",2014-12-22,2019-07-12,"Private, ltd by shares"536,2183614,"ZKS IOT GROUP LIMITED
洲斯物聯集團有限公司",2014-12-22,,"Private, ltd by shares"537,2183743,"Zunze Trading Limited
尊澤商貿有限公司",2014-12-22,2018-08-24,"Private, ltd by shares"