,Reg no.,Name,Incorp-orated,Dissolved,Type1,2184068,"288 Exhibition Planning Limited
288展覽設計有限公司",2014-12-22,,"Private, ltd by shares"2,2183932,"3db Technology Limited
三第畢技術有限公司",2014-12-22,2019-04-04,"Private, ltd by shares"3,2183664,"A Simple Bag Co., Limited
深圳市致簡手袋有限公司",2014-12-22,2017-12-01,"Private, ltd by shares"4,2184033,"ABSOLUTELY FANTASTIC LIMITED
泰恒豐國際有限公司",2014-12-22,,"Private, ltd by shares"5,2183882,"AC ELECTRIC CO., LIMITED
愛賽電器有限公司",2014-12-22,2018-04-27,"Private, ltd by shares"6,2183643,"ACE MEDIA GROUP LIMITED (HK)",2014-12-22,2020-01-17,"Private, ltd by shares"7,2184075,"AEEX (HK) International Financial Services Limited
亞交所(香港)國際金融服務有限公司",2014-12-22,,"Private, ltd by shares"8,2183995,"AGC DESIGN (INTERNATIONAL) LIMITED
創智建築師(國際)有限公司",2014-12-22,,"Private, ltd by shares"9,2184041,"AIERMA (HONG KONG) TECHNOLOGY COMPANY LIMITED
艾爾瑪（香港）科技有限公司",2014-12-22,2019-08-09,"Private, ltd by shares"10,2183570,"ALGO ASSOCIATION LIMITED",2014-12-22,2016-06-10,"Private, ltd by shares"11,2183863,"ALL TRADE INTERNATIONAL CO., LIMITED
隆貿國際有限公司",2014-12-22,2019-05-31,"Private, ltd by shares"12,2183957,"ALLES ASIA COMPANY LIMITED",2014-12-22,2020-11-06,"Private, ltd by shares"13,2183966,"ALLGANICWORLD LIMITED
然美有限公司",2014-12-22,2018-05-04,"Private, ltd by shares"14,2183716,"ALLROUND HOLDINGS LIMITED (d2018-08-24)
全方控股有限公司",2014-12-22,2018-08-24,"Private, ltd by shares"15,2183597,"ALPHA PHARMCHEM (HK) LIMITED",2014-12-22,,"Private, ltd by shares"16,2183799,"AMATI International Limited
愛瑪蒂國際有限公司",2014-12-22,2020-04-03,"Private, ltd by shares"17,2183572,"AMAX CHARTERING LIMITED",2014-12-22,2018-07-20,"Private, ltd by shares"18,2183879,"Amazing Grace Asiawide Company Limited
榮恩環亞有限公司",2014-12-22,,"Private, ltd by shares"19,2183812,"Amy International Industry Co., Limited
艾米國際實業有限公司",2014-12-22,2019-10-25,"Private, ltd by shares"20,2183588,"Anka Alliance Limited",2014-12-22,,"Private, ltd by shares"21,2183593,"AODELAI CO., LIMITED
奧得萊有限公司",2014-12-22,,"Private, ltd by shares"22,2183896,"Apex Pacific Health Limited",2014-12-22,,"Private, ltd by shares"23,2183816,"APR SOUTH EAST ASIA LIMITED",2014-12-22,,"Private, ltd by shares"24,2183871,"Arthouse Limited (HK)",2014-12-22,,"Private, ltd by shares"25,2183778,"ASIA-EXPORT-SCOUT CORPORATION LIMITED (THE)
亞巡國際有限公司",2014-12-22,,"Private, ltd by shares"26,2183987,"ASIANTEX INTERNATIONAL CO., LIMITED
亞汛國際有限公司",2014-12-22,2018-09-14,"Private, ltd by shares"27,2183689,"ATMPS INTERNATIONAL LIMITED",2014-12-22,,"Private, ltd by shares"28,2183916,"Auchia Pty Limited
澳奇有限公司",2014-12-22,,"Private, ltd by shares"29,2183714,"Augment Holdings Limited (HK)",2014-12-22,,"Private, ltd by shares"30,2183888,"AUSCOW INTERNATIONAL HOLDINGS LIMITED
澳牛國際控股有限公司",2014-12-22,,"Private, ltd by shares"31,2183963,"B GRAVITY LIMITED",2014-12-22,,"Private, ltd by shares"32,2183877,"Bad Boy Bangers Foods Limited",2014-12-22,,"Private, ltd by shares"33,2183659,"BANGNI INTERNATIONAL TRADE LIMITED
邦伲國際貿易有限公司",2014-12-22,2018-08-24,"Private, ltd by shares"34,2183752,"Bao Sheng Yuan Ganoderma Spores Powder Limited
寶生源靈芝孢子粉有限公司",2014-12-22,,"Private, ltd by shares"35,2183547,"BATNA C.P.A. LIMITED
卓越會計師事務所有限公司",2014-12-22,,"Private, ltd by shares"36,2184023,"Beetles5 Limited
甲製作有限公司",2014-12-22,2017-06-02,"Private, ltd by shares"37,2183740,"BEGINS STUDIO LIMITED
香港貝易有限公司",2014-12-22,,"Private, ltd by shares"38,2183768,"BEIJING RED REVOLUTION XIAOJIU WINE INDUSTRY LIMITED
北京紅色革命小酒酒業有限公司",2014-12-22,2018-08-24,"Private, ltd by shares"39,2183803,"BEL FUSE INC. LIMITED",2014-12-22,2018-08-24,"Private, ltd by shares"40,2184080,"BIG WEALTHY INDUSTRIAL LIMITED
鉅富實業有限公司",2014-12-22,2015-12-11,"Private, ltd by shares"41,2184052,"BIOSLED TECHNOLOGY (HONGKONG) CO., LIMITED
研色科技(香港)有限公司",2014-12-22,,"Private, ltd by shares"42,2183837,"BLESSED JEWELRY LIMITED
天佑珠寶有限公司",2014-12-22,2017-07-14,"Private, ltd by shares"43,2183732,"Bonnie Int'l (HK) Trading Limited
邦妮國際(香港)貿易有限公司",2014-12-22,2016-07-29,"Private, ltd by shares"44,2183828,"Boom Industrial Group Limited
興邦實業集團有限公司",2014-12-22,,"Private, ltd by shares"45,2183776,"Boss Shoes Limited
波斯鞋業有限公司",2014-12-22,,"Private, ltd by shares"46,2183561,"BoXXX Entertainment Limited",2014-12-22,2018-10-19,"Private, ltd by shares"47,2183857,"BRANDS CLUB HK CO., LIMITED (THE)
香港布蘭博服裝有限公司",2014-12-22,,"Private, ltd by shares"48,2183751,"Bright Honest International Trading Limited
耀誠國際貿易有限公司",2014-12-22,,"Private, ltd by shares"49,2183985,"Bright mold technology Co., Limited",2014-12-22,,"Private, ltd by shares"50,2183601,"BRILLIANT LIGHT (HK) CO., LIMITED
比利恩照明(香港)有限公司",2014-12-22,,"Private, ltd by shares"51,2183731,"C12C13 Consultant Limited
十二十三顧問有限公司",2014-12-22,,"Private, ltd by shares"52,2183869,"CAGIRE LIMITED",2014-12-22,,"Private, ltd by shares"53,2183834,"CAPELLA HOLDING PTE LIMITED
嘉倍樂控股有限公司",2014-12-22,,"Private, ltd by shares"54,2183609,"CarLink International (Hong Kong) Limited
車輪互聯(香港)有限公司",2014-12-22,2020-04-03,"Private, ltd by shares"55,2183699,"CELESTE LIGHTING CO., LIMITED
志麒燈飾有限公司",2014-12-22,,"Private, ltd by shares"56,2183708,"CENTRAL ELEMENT LIMITED (HK)
中子有限公司",2014-12-22,,"Private, ltd by shares"57,2183946,"CHANG HONG INDUSTRY (HK) LIMITED
長宏工業(香港)有限公司",2014-12-22,2017-08-18,"Private, ltd by shares"58,2183856,"CHAP YAU DEVELOPMENT LIMITED
集有發展有限公司",2014-12-22,,"Private, ltd by shares"59,2183665,"CHENG FENG LIMITED (d2018-07-06)
誠丰有限公司",2014-12-22,2018-07-06,"Private, ltd by shares"60,2184015,"ChengXin Trading (Hong Kong) Co. Limited
誠信(香港)貿易有限公司",2014-12-22,2018-08-24,"Private, ltd by shares"61,2183794,"CHI DAY REFINEMENT CO., LIMITED
日熾精化股份有限公司",2014-12-22,2018-07-13,"Private, ltd by shares"62,2184067,"China Agricultural Electronic Commerce Center Limited
中國農業電子商務中心有限公司",2014-12-22,,"Private, ltd by shares"63,2183618,"CHINA BOSEN NEW ENERGY INVESTMENT HOLDING LIMITED
中國博森新能源投資控股有限公司",2014-12-22,,"Private, ltd by shares"64,2183594,"CHINA FARM DEVELOPMENT HOLDINGS LIMITED
中國農莊發展控股有限公司",2014-12-22,,"Private, ltd by shares"65,2183624,"China Future Technology Academy Group Limited
中國未來科技研究院集團有限公司",2014-12-22,,"Private, ltd by shares"66,2184069,"China Green Dining-Table Mutual Union Group Limited
中華綠色餐桌互助聯盟集團有限公司",2014-12-22,,"Private, ltd by shares"67,2184005,"CHINA HONG KONG ZHONGXIANG GROUP CO., LIMITED
中國(香港)眾享集團有限公司",2014-12-22,,"Private, ltd by shares"68,2184009,"CHINA HUAJIE GROUP LIMITED
中國華傑集團有限公司",2014-12-22,2020-04-03,"Private, ltd by shares"69,2183889,"China International Media Culture Group Limited
中國國際影視傳媒集團有限公司",2014-12-22,2020-03-27,"Private, ltd by shares"70,2183584,"China Jiang Tai Insurance Brokers Limited
中國江泰保險經紀有限公司",2014-12-22,,"Private, ltd by shares"71,2184011,"CHINA JING JIA VALVE GROUP CO., LIMITED
中國．精嘉閥門集團有限公司",2014-12-22,2018-08-24,"Private, ltd by shares"72,2184053,"CHINA SEIKI GROUP CO., LIMITED
中國精機集團有限公司",2014-12-22,2016-06-03,"Private, ltd by shares"73,2183640,"China Skin Barrier Research Center Co., Limited
中國皮膚屏障研究中心有限公司",2014-12-22,,"Private, ltd by shares"74,2183833,"CHINA SUNRUN TECH INDUSTRY HOLDINGS LIMITED
中國鑫源高科技產業控股有限公司",2014-12-22,2016-06-24,"Private, ltd by shares"75,2183876,"China Tell Qi Bearing Co., Limited
中國泰爾祺軸承有限公司",2014-12-22,2018-06-22,"Private, ltd by shares"76,2184018,"China Tsinghua Student Association Limited
中國清華同學大商聯合會有限公司",2014-12-22,,"Private, ltd by shares"77,2183747,"CHINA WOMAN INSTITUTE CO., LIMITED
中國女子學院有限公司",2014-12-22,,"Private, ltd by shares"78,2183755,"CHINA YATONGXING FINANCIAL TRANSACTIONS LIMITED
中國亞通行金融交易有限公司",2014-12-22,,"Private, ltd by shares"79,2184021,"CHINA YOUTH MATHS CONTEST CO., LIMITED
中華青少年數學競賽有限公司",2014-12-22,2018-08-24,"Private, ltd by shares"80,2183590,"CHINESE TEENAGERS VISUAL ACUITY REHABILITATION PROMOTION ASSOCIATION LIMITED
中國青少年視力康復促進會有限公司",2014-12-22,2016-08-26,"Private, ltd by shares"81,2183926,"CHINESE TRADITIONAL CHINESE MEDICINE ASSOCIATION LIMITED
中華傳統中醫藥學會有限公司",2014-12-22,,"Private, ltd by shares"82,2183698,"Chinese Xulong Business College Co., Limited
中國旭龍商學院有限公司",2014-12-22,2018-08-24,"Private, ltd by shares"83,2183694,"Choseal Trading Limited
香港秋葉原貿易有限公司",2014-12-22,,"Private, ltd by shares"84,2183693,"CHRISTIANITY YOUNG SHEPHERD EDUCATION LIMITED
基督教牧童教育有限公司",2014-12-22,2020-09-25,"Ltd by guarantee"85,2183602,"CHUN TO LOGISTICS SERVICE COMPANY LIMITED
進濤物流服務有限公司",2014-12-22,2017-07-28,"Private, ltd by shares"86,2183791,"Church of Living Faith Limited
基督教活信堂有限公司",2014-12-22,,"Ltd by guarantee"87,2184029,"City State International Limited",2014-12-22,2018-02-15,"Private, ltd by shares"88,2183961,"CLANNAD TRADING CO., LIMITED
家寧貿易有限公司",2014-12-22,2018-03-09,"Private, ltd by shares"89,2183762,"CLKS Development Limited",2014-12-22,,"Private, ltd by shares"90,2183763,"CMHD International Limited",2014-12-22,,"Private, ltd by shares"91,2183764,"Cmx HongKong Manufacturing Services Co., Limited",2014-12-22,,"Private, ltd by shares"92,2183800,"Combat Film Investment Co., Limited
凱佰赫影視投資有限公司",2014-12-22,,"Private, ltd by shares"93,2183813,"COMET TRADING LIMITED
彗星貿易有限公司",2014-12-22,,"Private, ltd by shares"94,2184042,"COMLLI TECHNOLIGY CO., LIMITED
科力技術有限公司",2014-12-22,2018-06-01,"Private, ltd by shares"95,2183808,"Company Registration Number 2183808 Limited",2014-12-22,2016-07-22,"Private, ltd by shares"96,2183782,"Comtex Technology Limited
康泰斯科技有限公司",2014-12-22,,"Private, ltd by shares"97,2183789,"CONLIGUS HONG KONG LIMITED",2014-12-22,2015-11-27,"Private, ltd by shares"98,2183674,"COSTA CORREIA LIMITED",2014-12-22,2018-08-24,"Private, ltd by shares"99,2183734,"Cox Limited (d2018-07-20)",2014-12-22,2018-07-20,"Private, ltd by shares"100,2183552,"CR INTERNATIONAL MEDIA GROUP LIMITED
中俄國際傳媒集團有限公司",2014-12-22,2020-01-10,"Private, ltd by shares"101,2183701,"D &amp; C DEVELOPMENT (H.K.) CO., LIMITED
東辰發展(香港)有限公司",2014-12-22,,"Private, ltd by shares"102,2184049,"Dairy Fortune Limited
牧業財富有限公司",2014-12-22,,"Private, ltd by shares"103,2183950,"DALIAN SAN GAO TECHNOLOGY DEVELOPMENT CO., LIMITED",2014-12-22,2020-09-04,"Private, ltd by shares"104,2183656,"DAVIE TRADING LIMITED
達偉商貿有限公司",2014-12-22,2017-12-08,"Private, ltd by shares"105,2183941,"Daxing Accessory Co., Limited
達興飾品有限公司",2014-12-22,,"Private, ltd by shares"106,2183943,"Deliace Food Co., Limited
迪麗斯食品有限公司",2014-12-22,2019-01-04,"Private, ltd by shares"107,2184071,"DEYU KOREAN FAST FOOD LIMITED
德輿韓國餐飲有限公司",2014-12-22,2018-08-24,"Private, ltd by shares"108,2183784,"DIDO (HONGKONG) TRADING LIMITED
帝朵(香港)貿易有限公司",2014-12-22,,"Private, ltd by shares"109,2183741,"DIEJING INTERNATIONAL (HK) FAMOUS GROUP LIMITED
疊景國際香港名人集團有限公司",2014-12-22,2018-08-24,"Private, ltd by shares"110,2183686,"DIRECT SALE INNOVATION LIMITED
直賣革新有限公司",2014-12-22,,"Private, ltd by shares"111,2183970,"DONG RONG ELECTRONICS MATERIAL LIMITED
東榮電子材料有限公司",2014-12-22,,"Private, ltd by shares"112,2183767,"DONGGUAN FULI LEATHER CO., LIMITED
東莞市富勵皮具有限公司",2014-12-22,2018-08-24,"Private, ltd by shares"113,2184048,"Draken Trading Limited",2014-12-22,,"Private, ltd by shares"114,2183841,"DREAMS TRANSPORTATION LIMITED (d2017-09-01)
理想搬運有限公司",2014-12-22,2017-09-01,"Private, ltd by shares"115,2183550,"DULCES FRUTAS LIMITED",2014-12-22,2017-07-21,"Private, ltd by shares"116,2183705,"DYNAMIC GOLD LIMITED
金電有限公司",2014-12-22,,"Private, ltd by shares"117,2183595,"DYNASTY CASTLE INVESTMENTS LIMITED",2014-12-22,,"Private, ltd by shares"118,2183720,"EAST WORLD WEALTH MANAGEMENT CO., LIMITED
東方天地財富管理有限公司",2014-12-22,2019-02-08,"Private, ltd by shares"119,2184026,"EASYGO TECHNOLOGY CO., LIMITED
香港易捷信通科技有限公司",2014-12-22,2018-08-24,"Private, ltd by shares"120,2183906,"EASYJANE LIMITED",2014-12-22,2019-02-01,"Private, ltd by shares"121,2183929,"Echo Entertainment International Limited
迴音國際娛樂有限公司",2014-12-22,,"Private, ltd by shares"122,2183788,"Ecoideas Limited (HK)",2014-12-22,,"Private, ltd by shares"123,2183993,"Eight 13 Consultants Limited",2014-12-22,,"Private, ltd by shares"124,2184030,"Elite Consulting Services Limited (d2016-06-10)
艾利諮詢服務有限公司",2014-12-22,2016-06-10,"Private, ltd by shares"125,2183620,"Eos Technology Limited (HK)",2014-12-22,,"Private, ltd by shares"126,2183945,"EURO-ASIA ELECTRIC CAR INVESTMENT CO., LIMITED
歐亞電動車投資有限公司",2014-12-22,2018-07-27,"Private, ltd by shares"127,2183954,"EXCELLENT TRADING DEVELOP LIMITED (d2019-10-25)
卓威貿易拓展有限公司",2014-12-22,2019-10-25,"Private, ltd by shares"128,2183663,"EXPOLATINO LIMITED
拉美出口有限公司",2014-12-22,,"Private, ltd by shares"129,2183793,"FADEL CO., LIMITED",2014-12-22,2018-12-07,"Private, ltd by shares"130,2183769,"FAMILY INDUSTRY (HK) LIMITED
香港盛隆實業有限公司",2014-12-22,2019-10-25,"Private, ltd by shares"131,2183582,"Famistry xin LIMITED",2014-12-22,,"Private, ltd by shares"132,2183998,"FASHION MAX (HONG KONG) CO. LIMITED
尚麥(香港)有限公司",2014-12-22,,"Private, ltd by shares"133,2183576,"FAST FURIOUS HONG KONG LIMITED
拾貳樂章香港有限公司",2014-12-22,2018-08-24,"Private, ltd by shares"134,2183670,"FAT CAT SKILLS LIMITED
肥貓英語有限公司",2014-12-22,,"Private, ltd by shares"135,2183920,"FEDERAL &amp; WEYLES CONSULTANT LIMITED
法大衛理士律師集團有限公司",2014-12-22,,"Private, ltd by shares"136,2183983,"FENG WEI (HONG KONG) TRADING LIMITED
豊偉(香港)貿易有限公司",2014-12-22,,"Private, ltd by shares"137,2183884,"FengYuan Technology (HongKong) Limited
豐源科技 (香港) 有限公司",2014-12-22,,"Private, ltd by shares"138,2183827,"FENGZE INTERNATIONAL TECHNOLOGY(HONGKONG) CO., LIMITED
公司註冊編號 2183827 有限公司",2014-12-22,2017-06-30,"Private, ltd by shares"139,2183606,"FINE CONTINENT ENTERPRISES COMPANY LIMITED
佳洲企業有限公司",2014-12-22,2016-07-08,"Private, ltd by shares"140,2183853,"Fittex Limited
菲拓實業有限公司",2014-12-22,,"Private, ltd by shares"141,2184078,"FLAMMA WORKS DESIGN LIMITED",2014-12-22,,"Private, ltd by shares"142,2183719,"FMS OVERSEAS (HK) LIMITED",2014-12-22,,"Private, ltd by shares"143,2183843,"Fontasticon Electronics (HK) Co., Limited
富昱鑫電子(香港)有限公司",2014-12-22,,"Private, ltd by shares"144,2183859,"FOOD AND FUN CATERING HOLDINGS LIMITED
食加紛餐飲控股有限公司",2014-12-22,,"Private, ltd by shares"145,2183635,"FORTUNE PORT ASSET PLANNING CONSULTANCY COMPANY LIMITED
財富港資產規劃顧問有限公司",2014-12-22,,"Private, ltd by shares"146,2183779,"Fortune Rise Wealth Management (HK) Limited
運昇財富管理(香港)有限公司",2014-12-22,,"Private, ltd by shares"147,2183675,"FOSHAN DONGPENG BATHROOM LIMITED
佛山東鵬衛浴有限公司",2014-12-22,,"Private, ltd by shares"148,2184036,"FOUR SEASONS BEVERAGE COMPANY LIMITED
四季飲料有限公司",2014-12-22,,"Private, ltd by shares"149,2183564,"FRANCE BONA INT'L LIMITED
法國博納國際有限公司",2014-12-22,2018-08-24,"Private, ltd by shares"150,2183655,"FRANCE XIZE INTERNATIONAL GROUP LIMITED
法國熙澤國際集團有限公司",2014-12-22,2019-01-04,"Private, ltd by shares"151,2183802,"FRENCH BLUE COLOR COSMETICS (HONGKONG) INTERNATIONAL LIMITED
法國藍彩妮化妝品(香港)國際有限公司",2014-12-22,2018-08-24,"Private, ltd by shares"152,2183818,"FRENCH RUNLIN INTERNATIONAL ORGANISMS TECHNOLOGY LIMITED
法國潤琳國際生物科技有限公司",2014-12-22,2018-08-24,"Private, ltd by shares"153,2183948,"FUJIMOTO COMPANY LIMITED",2014-12-22,2017-06-23,"Private, ltd by shares"154,2183952,"FULL CREATION TRADING DEVELOP LIMITED
金創貿易拓展有限公司",2014-12-22,2020-05-15,"Private, ltd by shares"155,2183975,"G365HK LIMITED",2014-12-22,2018-07-27,"Private, ltd by shares"156,2183587,"GCM CONSULTING SERVICES LIMITED",2014-12-22,,"Private, ltd by shares"157,2183754,"General Sensing (Hong Kong) Limited
通用測控技術(香港)有限公司",2014-12-22,,"Private, ltd by shares"158,2183814,"GENUINE MARKETING GROUP HONG KONG LIMITED",2014-12-22,2018-08-24,"Private, ltd by shares"159,2183914,"GERMAN DEFORD LUBRICANT CO., LIMITED
德國德孚潤滑油有限公司",2014-12-22,,"Private, ltd by shares"160,2183621,"GERMANY BEIJIA GROUP LIMITED
德國貝佳集團有限公司",2014-12-22,2016-09-30,"Private, ltd by shares"161,2183585,"GERMANY DEWIN COMPANY LIMITED
德國德威有限公司",2014-12-22,,"Private, ltd by shares"162,2183733,"GERMANY OYTYO TECHNOLOGY (CHINA) LIMITED
德國歐駝技研(中國)有限公司",2014-12-22,,"Private, ltd by shares"163,2183801,"Gliston Company Limited",2014-12-22,,"Private, ltd by shares"164,2183908,"GLOBAL ASSET INVESTMENT AND MANAGEMENT COMPANY LIMITED
保誠環球資產投資有限公司",2014-12-22,,"Private, ltd by shares"165,2183783,"GLOBAL GUARANTEE SERVICES LIMITED",2014-12-22,,"Private, ltd by shares"166,2183984,"GLOBAL TRADING DEVELOP LIMITED
全球貿易拓展有限公司",2014-12-22,,"Private, ltd by shares"167,2183695,"GLOBAL TRANSIT SUPPLYCHAIN LIMITED
跨境通國際供應鏈有限公司",2014-12-22,,"Private, ltd by shares"168,2183907,"GOGROW TOYS COMPANY LIMITED
祥長玩具有限公司",2014-12-22,,"Private, ltd by shares"169,2183836,"GOLDEN AUTUMN SMILE INTERNATIONAL TRADING CO., LIMITED
金秋笑顏國際貿易有限公司",2014-12-22,2018-11-09,"Private, ltd by shares"170,2183749,"GOLDEN RIVER HOLDING CO., LIMITED
金河控股有限公司",2014-12-22,,"Private, ltd by shares"171,2183750,"GOLDEN SUCCESS GROUP LIMITED
高登工貿有限公司",2014-12-22,,"Private, ltd by shares"172,2183988,"Goldyard Commercial Enterprise Limited
金營商務企業有限公司",2014-12-22,,"Private, ltd by shares"173,2183997,"GOODMANN MCKNIGHT LIMITED",2014-12-22,,"Private, ltd by shares"174,2183972,"GRAND FORTUNE TRADING DEVELOP LIMITED
裕泰貿易拓展有限公司",2014-12-22,2018-08-24,"Private, ltd by shares"175,2183667,"GRASTRON GROUP CO., LIMITED
廣世創集團有限公司",2014-12-22,,"Private, ltd by shares"176,2183821,"Great Power Construction Limited
宏力建設工程有限公司",2014-12-22,,"Private, ltd by shares"177,2183677,"GRISIN TECHNOLOGY COMPANY LIMITED
高瑞鑫科技有限公司",2014-12-22,2016-02-12,"Private, ltd by shares"178,2183781,"GSF Fresh (HK) Limited",2014-12-22,,"Private, ltd by shares"179,2183753,"GSF Hong Kong Limited",2014-12-22,,"Private, ltd by shares"180,2184059,"GTG International Co., Limited
榮馨國際有限公司",2014-12-22,2018-08-24,"Private, ltd by shares"181,2183711,"GUANGDONG HANDSOME DEVELOPMENT LIMITED
廣東漢祥貿易發展有限公司",2014-12-22,2018-08-24,"Private, ltd by shares"182,2183777,"GUANGZHOU GUANGSU ENGINEERING MACHINERY CO., LIMITED
廣州市廣速工程機械有限公司",2014-12-22,2018-08-24,"Private, ltd by shares"183,2183724,"GUYINBANG (FAN'OU) INTERNATIONAL GROUP CO., LIMITED
古印邦(泛歐)國際集團有限公司",2014-12-22,,"Private, ltd by shares"184,2183935,"GViN Technology (HK) Trade Co., Limited
凱盛達科技(香港)貿易有限公司",2014-12-22,,"Private, ltd by shares"185,2183868,"H HOLDINGS LIMITED (HK)",2014-12-22,2018-09-28,"Private, ltd by shares"186,2183580,"HA CHIU LOGISTICS LIMITED
夏超物流有限公司",2014-12-22,,"Private, ltd by shares"187,2184001,"HAI YU TEXTILE (COLORS &amp; PRINTS) LIMITED",2014-12-22,2016-08-12,"Private, ltd by shares"188,2183942,"HAIKU RESTAURANT CO. LIMITED",2014-12-22,,"Private, ltd by shares"189,2183651,"HANDYTECH INFORMATICA E ELETRONICA LIMITED",2014-12-22,2018-08-24,"Private, ltd by shares"190,2183712,"Hang Cheong Factory 3B Limited",2014-12-22,,"Private, ltd by shares"191,2184017,"HANG FU MOTORS LIMITED
恆富汽車有限公司",2014-12-22,2015-12-11,"Private, ltd by shares"192,2183898,"HANG WING HONG PETROLEUM COMPANY LIMITED
鏗榮行石油有限公司",2014-12-22,,"Private, ltd by shares"193,2183616,"HAO JUN INDUSTRIAL DEVELOPMENT (CHINA) LIMITED
皓俊實業發展(中國)有限公司",2014-12-22,,"Private, ltd by shares"194,2184022,"Haotuanyuan Packaging Co., Limited
好團圓包裝有限公司",2014-12-22,,"Private, ltd by shares"195,2183633,"HARBOUR RESOURCES DEVELOPMENT COMPANY LIMITED
港源發展有限公司",2014-12-22,2016-07-29,"Private, ltd by shares"196,2183807,"Harris Equipment Incorporation Limited",2014-12-22,2018-11-23,"Private, ltd by shares"197,2183931,"HATSUNE RESTAURANT CO. LIMITED",2014-12-22,,"Private, ltd by shares"198,2184025,"Hayzen International Limited
輝正國際有限公司",2014-12-22,,"Private, ltd by shares"199,2183757,"HE AI INTERNATIONAL GROUP SHARE CO., LIMITED
和愛國際集團股份有限公司",2014-12-22,,"Private, ltd by shares"200,2183819,"Health &amp; Young Trading Company Limited
康美行有限公司",2014-12-22,,"Private, ltd by shares"201,2183575,"HEALTH EXPERT (HK) LIMITED
康溢(香港)有限公司",2014-12-22,,"Private, ltd by shares"202,2183737,"Hengda International Logistics Co., Limited
恒達國際貨運代理有限公司",2014-12-22,2016-01-15,"Private, ltd by shares"203,2183605,"HENGJIAN (CHINA) LIMITED
恆堅(中國)有限公司",2014-12-22,,"Private, ltd by shares"204,2183875,"HENGRUN INDUSTRIES COMPANY LIMITED
恒潤企業有限公司",2014-12-22,2018-06-01,"Private, ltd by shares"205,2183551,"HIBERMATE LIMITED",2014-12-22,,"Private, ltd by shares"206,2183991,"HILLER CPA LIMITED
禧利會計師事務所有限公司",2014-12-22,,"Private, ltd by shares"207,2184055,"HK Anlian Pack LIMITED
香港安聯包裝有限公司",2014-12-22,,"Private, ltd by shares"208,2183646,"HK BARDY COSMETICS LIMITED
香港巴町化妝品有限公司",2014-12-22,2016-08-12,"Private, ltd by shares"209,2183780,"HK BEIERJIA BABY PRODUCTS HOLDING LIMITED
香港貝兒佳嬰童用品股份有限公司",2014-12-22,,"Private, ltd by shares"210,2184000,"HK BOLIYA GROUP CO., LIMITED
香港博麗雅集團有限公司",2014-12-22,,"Private, ltd by shares"211,2184038,"HK CAI HONG INVESTMENT MANAGEMENT LIMITED
香港彩虹投資管理有限公司",2014-12-22,2020-05-22,"Private, ltd by shares"212,2183707,"HK COMPASS INTERIOR DESIGN LIMITED
香港指南針室內設計有限公司",2014-12-22,2018-08-24,"Private, ltd by shares"213,2183645,"HK CROWN BIRDS INT'L INDUSTRIAL CO., LIMITED
香港皇冠鳥國際實業有限公司",2014-12-22,2017-08-11,"Private, ltd by shares"214,2183980,"HK Excite Tech Co., Limited
香港億賽科技有限公司",2014-12-22,2018-08-24,"Private, ltd by shares"215,2184065,"HK FAN JIE DA TRADING LIMITED
香港凡捷達貿易有限公司",2014-12-22,2016-04-01,"Private, ltd by shares"216,2183729,"HK FENGSHANG LEISURE INTERNATIONAL HOLDINGS LIMITED
香港風尚休閒國際控股有限公司",2014-12-22,2019-01-04,"Private, ltd by shares"217,2183760,"HK Flare Building Materials International Limited
香港富來爾建材國際有限公司",2014-12-22,2020-05-29,"Private, ltd by shares"218,2183894,"HK HDPARTS CO., LIMITED
香港厚多機械配件有限公司",2014-12-22,,"Private, ltd by shares"219,2183649,"HK Huipinmei Trade Co., Limited
香港匯品美貿易有限公司",2014-12-22,,"Private, ltd by shares"220,2183962,"HK LINTAIFENGHANG GINSENG CO., LIMITED
香港林泰豐行參茸有限公司",2014-12-22,2020-10-09,"Private, ltd by shares"221,2183730,"HK LoveBaby Int'l Services Limited
香港愛嬰國際服務有限公司",2014-12-22,,"Private, ltd by shares"222,2183685,"HK LUCKY TOYS &amp; GIFTS CO., LIMITED
香港祺達玩具禮品有限公司",2014-12-22,,"Private, ltd by shares"223,2183944,"HK NEW SUNSHINE ELECTRIC HOLDING LIMITED
香港新光耀電力控股有限公司",2014-12-22,2017-10-06,"Private, ltd by shares"224,2183893,"HK QIANZHIHE CO., LIMITED
香港芊之禾有限公司",2014-12-22,,"Private, ltd by shares"225,2183978,"HK QIJIAYI DRESS CO., LIMITED
香港柒嘉伊服飾有限公司",2014-12-22,,"Private, ltd by shares"226,2183610,"HK TCFH INTERNATIONAL CHAIN MANAGEMENT LIMITED
香港天賜福華國際集團連鎖管理有限公司",2014-12-22,,"Private, ltd by shares"227,2183652,"HK TIANCHENG INT'L LIMITED
香港天呈國際有限公司",2014-12-22,,"Private, ltd by shares"