,Reg no.,Name,Incorp-orated,Dissolved,Type1,2100858,"CONGO RED GOLD SPR LIMITED",2014-05-24,2016-11-25,"Private, ltd by shares"2,2100860,"EXCEL POWER RECRUITMENT LIMITED
卓威人才策略有限公司",2014-05-24,,"Private, ltd by shares"3,2100862,"JIN DIANE LIMITED",2014-05-24,,"Private, ltd by shares"4,2100859,"RAINLAND DESIGN LIMITED",2014-05-24,2019-02-22,"Private, ltd by shares"5,2100861,"RAM Investment Advisors Limited
澳洲皇家投資顧問有限公司",2014-05-24,,"Private, ltd by shares"6,2100857,"Slimtech Corporation Limited",2014-05-24,2018-01-05,"Private, ltd by shares"