,Reg no.,Name,Incorp-orated,Dissolved,Type224,0650637,"STRONG COSMOS LIMITED
昌利發有限公司",1998-07-22,2005-07-22,"Private, ltd by shares"225,0650467,"STRONG LIFE MOTORS COMPANY LIMITED
強生汽車有限公司",1998-07-22,,"Private, ltd by shares"226,0650427,"SUNNY CREATION DEVELOPMENT LIMITED (d2010-07-09)
藝盈發展有限公司",1998-07-22,2010-07-09,"Private, ltd by shares"227,0650591,"SUNTEK TRADING LIMITED
聖泰貿易有限公司",1998-07-22,,"Private, ltd by shares"228,0650632,"SUPREME GLORY LIMITED (d2002-09-13)
豐寶有限公司",1998-07-22,2002-09-13,"Private, ltd by shares"229,0650468,"SURE WIN WORLD LIMITED
全通(香港)有限公司",1998-07-22,2005-07-22,"Private, ltd by shares"230,0650571,"SYSTEM-LINK TECHNOLOGY (INT'L) LIMITED
科域科技(國際)有限公司",1998-07-22,2011-03-25,"Private, ltd by shares"231,0650491,"TAI CHANG TRADING CO., LIMITED
台昌貿易有限公司",1998-07-22,2002-06-28,"Private, ltd by shares"232,0650518,"TAI SANG ELECTRICAL &amp; PLUMBING COMPANY LIMITED
大生水電渠務工程有限公司",1998-07-22,,"Private, ltd by shares"233,0650601,"TALENT COMMENCE LIMITED
太貿有限公司",1998-07-22,2005-07-22,"Private, ltd by shares"234,0650555,"TALENT JOINT LIMITED
太晉有限公司",1998-07-22,,"Private, ltd by shares"235,0650380,"TALENT WISDOM INVESTMENT LIMITED
才智投資有限公司",1998-07-22,2006-12-08,"Private, ltd by shares"236,0650423,"TALENTOP DEVELOPMENT LIMITED
才鴻發展有限公司",1998-07-22,,"Private, ltd by shares"237,0650381,"TALENTOP INVESTMENT LIMITED
才鴻投資有限公司",1998-07-22,2008-08-22,"Private, ltd by shares"238,0650554,"TARGET EARN LIMITED (d2006-12-29)
太盈有限公司",1998-07-22,2006-12-29,"Private, ltd by shares"239,0650552,"TECHNET TELECOM INTERNATIONAL (HK) LIMITED
德科電訊(香港)有限公司",1998-07-22,2005-07-22,"Private, ltd by shares"240,0650509,"Techtronic Product Development Limited
創科研發有限公司",1998-07-22,,"Private, ltd by shares"241,0650581,"TELEWAY COMMUNICATIONS INVESTMENT LIMITED
通訊城投資有限公司",1998-07-22,2001-02-09,"Private, ltd by shares"242,0650568,"TELLY INVESTMENTS LIMITED
上利投資有限公司",1998-07-22,,"Private, ltd by shares"243,0650532,"TINY ONLINE LIMITED
泰來資訊網絡有限公司",1998-07-22,,"Private, ltd by shares"244,0650470,"TOP BRIGHT CONSULTANTS LIMITED
才鴻顧問有限公司",1998-07-22,,"Private, ltd by shares"245,0650384,"TOP BRIGHT MANAGEMENT LIMITED (d2009-12-18)
才智管理有限公司",1998-07-22,2009-12-18,"Private, ltd by shares"246,0650471,"TOP TALENT CONSULTANTS LIMITED (d2003-12-12)
通才顧問有限公司",1998-07-22,2003-12-12,"Private, ltd by shares"247,0650469,"TOP TALENT MANAGEMENT LIMITED
通才管理有限公司",1998-07-22,2005-08-26,"Private, ltd by shares"248,0650563,"TOP VANTAGE INVESTMENTS LIMITED (d2003-01-30)
上盛投資有限公司",1998-07-22,2003-01-30,"Private, ltd by shares"249,0650477,"TRADE ONE LIMITED (HK)
展一有限公司",1998-07-22,,"Private, ltd by shares"250,0650503,"TRENDEX LIMITED (HK)",1998-07-22,2017-04-07,"Private, ltd by shares"251,0650642,"TRISTAR (PACIFIC) LIMITED
三星(太平洋)有限公司",1998-07-22,2002-08-23,"Private, ltd by shares"252,0650492,"TRUTHFUL DEVELOPMENT COMPANY LIMITED
騰峰(香港)有限公司",1998-07-22,,"Private, ltd by shares"253,0650586,"TSINGHUA INFORMATION ELECTRONIC COMPANY LIMITED
清華資訊電子有限公司",1998-07-22,2011-09-09,"Private, ltd by shares"254,0650529,"U-TECH ENGINEERING COMPANY LIMITED
卓裕工程有限公司",1998-07-22,,"Private, ltd by shares"255,0650573,"ULTRA GOLD LIMITED (d2005-07-22)",1998-07-22,2005-07-22,"Private, ltd by shares"256,0650495,"UNDERSTOOD FAST TIME FINANCIAL ICP LIMITED
明利快訊財經資訊有限公司",1998-07-22,2002-01-04,"Private, ltd by shares"257,0650549,"UNIQUE HARBOUR INTERNATIONAL LIMITED
均港國際有限公司",1998-07-22,2008-12-24,"Private, ltd by shares"258,0650553,"UNIQUE HARBOUR LIMITED
鈞港有限公司",1998-07-22,2003-07-11,"Private, ltd by shares"259,0650604,"UNIQUE KENT INVESTMENTS LIMITED
均晉投資有限公司",1998-07-22,2006-05-06,"Private, ltd by shares"260,0650550,"UNIQUE OCEAN INVESTMENTS LIMITED
均洋投資有限公司",1998-07-22,2006-05-06,"Private, ltd by shares"261,0650597,"UNIQUE SCHEME LIMITED
均策有限公司",1998-07-22,,"Private, ltd by shares"262,0650600,"UNIQUE YORK LIMITED (HK)
均遠有限公司",1998-07-22,2019-11-08,"Private, ltd by shares"263,0650579,"UNISEM INTERNATIONAL (HONG KONG) LIMITED",1998-07-22,,"Private, ltd by shares"264,0650430,"UNITED LEADER DEVELOPMENT LIMITED
統領發展有限公司",1998-07-22,2002-09-20,"Private, ltd by shares"265,0650599,"UTOPIA MALL LIMITED
順庫有限公司",1998-07-22,,"Private, ltd by shares"266,0650485,"VASTBO INDUSTRIES LIMITED
宏堡實業有限公司",1998-07-22,2016-03-18,"Private, ltd by shares"267,0650598,"VICTORY HALL LIMITED (d2000-12-15)
勝庫有限公司",1998-07-22,2000-12-15,"Private, ltd by shares"268,0650463,"WAH YUEN INTERNATIONAL INVESTMENT LIMITED
華源國際投資有限公司",1998-07-22,2003-05-09,"Private, ltd by shares"269,0650557,"WAYSON (CHINA) LIMITED
威勝(中國)有限公司",1998-07-22,,"Private, ltd by shares"270,0650641,"WELLING LINK LIMITED
華利聯有限公司",1998-07-22,,"Private, ltd by shares"271,0650434,"WILFRED MARBLE FACTORY LIMITED
維美雲石廠有限公司",1998-07-22,2004-12-10,"Private, ltd by shares"272,0650524,"WILICON LIMITED",1998-07-22,2007-02-09,"Private, ltd by shares"273,0650401,"Win-Win International Education Group Limited
凱翔國際教育集團有限公司",1998-07-22,,"Private, ltd by shares"274,0650462,"WINRISE ENGINEERING LIMITED
偉昇工程有限公司",1998-07-22,2010-06-18,"Private, ltd by shares"275,0650433,"WIRELESS TECHNOLOGY LIMITED (d2001-06-15)",1998-07-22,2001-06-15,"Private, ltd by shares"276,0650419,"WISEFIELD (HK) LIMITED
智業(香港)有限公司",1998-07-22,2001-08-31,"Private, ltd by shares"277,0650501,"WORLD ASSOCIATION OF JIANGMEN WU YAP OVERSEAS CHINESE (HK) LIMITED (THE)
世界江門五邑鄉親總會(香港)有限公司",1998-07-22,2009-11-13,"Ltd by guarantee"278,0650395,"WORLD CHAMPION TECHNOLOGY LIMITED
世駿科技有限公司",1998-07-22,2001-09-21,"Private, ltd by shares"279,0650398,"WORLD KING ENGINEERING LIMITED
世建工程有限公司",1998-07-22,2006-02-10,"Private, ltd by shares"280,0650393,"WORLD OF GOURMET LIMITED
美味無國界有限公司",1998-07-22,2012-03-30,"Private, ltd by shares"281,0650365,"XINTIAN NEW ENERGY LIMITED
新天新能源有限公司",1998-07-22,2019-04-26,"Private, ltd by shares"282,0650447,"XINWAN CORPORATION LIMITED
鑫旺有限公司",1998-07-22,2003-11-21,"Private, ltd by shares"283,0650567,"XO WORLD (HONG KONG) LIMITED
尊爵網(香港)有限公司",1998-07-22,2007-11-30,"Private, ltd by shares"284,0650624,"YAT KIN COMPANY LIMITED
逸健有限公司",1998-07-22,2011-08-03,"Private, ltd by shares"285,0650593,"YAT WA INDUSTRIAL COMPANY LIMITED
溢華實業發展有限公司",1998-07-22,,"Private, ltd by shares"286,0650489,"YUAN FENG (HK) TRADING COMPANY LIMITED
源豐(香港)貿易有限公司",1998-07-22,2003-12-05,"Private, ltd by shares"287,0650431,"ZION INDUSTRIAL DEVELOPMENT LIMITED
聖山實業發展有限公司",1998-07-22,,"Private, ltd by shares"