,Reg no.,Name,Incorp-orated,Dissolved,Type1,0650499,"(H.K.) ENGLAND BAIMA CHEMICALS CO., LIMITED
香港英國白馬化工有限公司",1998-07-22,2006-02-10,"Private, ltd by shares"2,0650461,"3D LENTICULAR LIMITED
幻影立體有限公司",1998-07-22,2005-07-22,"Private, ltd by shares"3,0650385,"A-ONE PLUSH TOYS CO LIMITED
三星毛絨玩具廠有限公司",1998-07-22,,"Private, ltd by shares"4,0650513,"A.S.K. ENGINEERING LIMITED (d2013-10-04)",1998-07-22,2013-10-04,"Private, ltd by shares"5,0650589,"A1 CHINESE FOOD COMPANY LIMITED
第一南北美食有限公司",1998-07-22,2005-07-22,"Private, ltd by shares"6,0650508,"ACCELERATED MORTGAGE REDUCERS (FAR EAST) LIMITED",1998-07-22,2001-08-24,"Private, ltd by shares"7,0650569,"ACCESS VANTAGE INVESTMENTS LIMITED
進毅投資有限公司",1998-07-22,2008-10-17,"Private, ltd by shares"8,0650566,"ADVANCED HAIR STUDIO (HONG KONG) LIMITED
創髮中心(香港)有限公司",1998-07-22,,"Private, ltd by shares"9,0650407,"ALBANIA LIMITED (d2004-01-30)",1998-07-22,2004-01-30,"Private, ltd by shares"10,0650405,"ANCHI (CHINA) MOTOR CAR COMPANY LIMITED
安馳(中國)汽車有限公司",1998-07-22,2005-07-22,"Private, ltd by shares"11,0650647,"ANSON GODOWN COMPANY LIMITED
安順貨倉有限公司",1998-07-22,,"Private, ltd by shares"12,0650584,"ART &amp; PRODUCT LIMITED",1998-07-22,,"Private, ltd by shares"13,0650610,"ARTISTRY CO-OP LIMITED
演藝事務所有限公司",1998-07-22,,"Private, ltd by shares"14,0650541,"AXLINE COMMERCIAL SERVICES LIMITED",1998-07-22,,"Private, ltd by shares"15,0650444,"BAYANIHAN SERVICES LIMITED",1998-07-22,2005-07-22,"Private, ltd by shares"16,0650386,"BESTCO ENGINEERING LIMITED
保富工程有限公司",1998-07-22,2006-02-10,"Private, ltd by shares"17,0650631,"BIG FORTUNE INVESTMENT LIMITED
大運投資有限公司",1998-07-22,,"Private, ltd by shares"18,0650526,"BILLION TOWN DEVELOPMENT LIMITED
城億發展有限公司",1998-07-22,2005-07-22,"Private, ltd by shares"19,0650458,"C. R. D. INTERNATIONAL FOUNDATION LIMITED
中華正氣龍國際基金有限公司",1998-07-22,2014-11-28,"Private, ltd by shares"20,0650406,"CARMORRA LIMITED",1998-07-22,2007-01-05,"Private, ltd by shares"21,0650621,"CASTCO (NDT) LIMITED
佳力高驗焊有限公司",1998-07-22,2008-05-16,"Private, ltd by shares"22,0650449,"CCIF CPA LIMITED
陳葉馮會計師事務所有限公司",1998-07-22,,"Private, ltd by shares"23,0650556,"CEDAR TELECOM TECHNOLOGY (HK) LIMITED
易訊科技(香港)有限公司",1998-07-22,2016-03-18,"Private, ltd by shares"24,0650425,"CENTURY ASSETS MANAGEMENT LIMITED (THE)
世紀資產管理有限公司",1998-07-22,,"Private, ltd by shares"25,0650514,"CHINA SHIPPING BULK CARRIER (HONG KONG) CO., LIMITED
中海散貨運輸(香港)有限公司",1998-07-22,,"Private, ltd by shares"26,0650455,"CHINA STAR TRADING COMPANY (HONG KONG) LIMITED
華星貿易(香港)有限公司",1998-07-22,2003-06-13,"Private, ltd by shares"27,0650546,"CHINESE HONGKONG INTERNATIONAL TOBACCO GROUP CO., LIMITED
中華香港國際煙草集團有限公司",1998-07-22,,"Private, ltd by shares"28,0650426,"CHING MING PRECISION COMPANY LIMITED
精明精密有限公司",1998-07-22,2019-04-18,"Private, ltd by shares"29,0650622,"CHOUSHEN ELECTRONICS CO., LIMITED
祥森電子有限公司",1998-07-22,,"Private, ltd by shares"30,0650493,"CHUNG FOO KNITTING GARMENTS LIMITED
中富針織製衣有限公司",1998-07-22,,"Private, ltd by shares"31,0650525,"CITY BILLION INTERNATIONAL LIMITED (d2002-02-15)
城億國際有限公司",1998-07-22,2002-02-15,"Private, ltd by shares"32,0650473,"CITY GOOD INDUSTRIES LIMITED
城佳實業有限公司",1998-07-22,2001-12-07,"Private, ltd by shares"33,0650643,"CITY INDUSTRIAL CO. LIMITED",1998-07-22,2007-11-30,"Private, ltd by shares"34,0650474,"CITY SMART DEVELOPMENT LIMITED
城俊發展有限公司",1998-07-22,,"Private, ltd by shares"35,0650475,"CITY SMART INTERNATIONAL LIMITED
城俊國際有限公司",1998-07-22,,"Private, ltd by shares"36,0650506,"Cochran (Hong Kong) Limited
考克蘭(香港)有限公司",1998-07-22,,"Private, ltd by shares"37,0650626,"COMHOPE GROUP LIMITED
康合集團有限公司",1998-07-22,2005-07-22,"Private, ltd by shares"38,0650438,"CONSUMER SEARCH CONSULTANTS LIMITED",1998-07-22,,"Private, ltd by shares"39,0650582,"CONTINENTAL TRADING LIMITED (d2003-01-03)
大陸貿易有限公司",1998-07-22,2003-01-03,"Private, ltd by shares"40,0650451,"COTHERM CHINA LIMITED",1998-07-22,2014-03-28,"Private, ltd by shares"41,0650445,"CREATION LINK LIMITED
生興有限公司",1998-07-22,,"Private, ltd by shares"42,0650442,"CRESTON LIMITED
傑天有限公司",1998-07-22,2005-07-22,"Private, ltd by shares"43,0650618,"DIAMED CHINA LIMITED
達亞美中國有限公司",1998-07-22,,"Private, ltd by shares"44,0650441,"DOUBLE GOLD PROPERTIES LIMITED",1998-07-22,2002-08-23,"Private, ltd by shares"45,0650648,"DYNAMIC GEAR TRADING LIMITED
得利佳貿易有限公司",1998-07-22,2002-03-15,"Private, ltd by shares"46,0650422,"DYNAPEAK DEVELOPMENT LIMITED
帝峰發展有限公司",1998-07-22,2005-07-22,"Private, ltd by shares"47,0650382,"DYNAPEAK TECHNOLOGY CONSULTANTS LIMITED
帝峰科技顧問有限公司",1998-07-22,2006-12-29,"Private, ltd by shares"48,0650497,"E T (HONG KONG) INDUSTRIAL LIMITED
雅基(香港)實業有限公司",1998-07-22,,"Private, ltd by shares"49,0650638,"EASE DAY LIMITED (d2002-03-22)
怡日有限公司",1998-07-22,2002-03-22,"Private, ltd by shares"50,0650539,"EASECA TRADING COMPANY LIMITED
怡雅貿易有限公司",1998-07-22,,"Private, ltd by shares"51,0650387,"EAST LEGEND INTERNATIONAL LIMITED (d2005-07-22)
萬勝國際有限公司",1998-07-22,2005-07-22,"Private, ltd by shares"52,0650607,"ELITE FINANCE LIMITED (d2002-08-16)
利富財務有限公司",1998-07-22,2002-08-16,"Private, ltd by shares"53,0650542,"ETERNAL AIRCONDITION ENGINEERING LIMITED
加恒工程有限公司",1998-07-22,,"Private, ltd by shares"54,0650644,"EXCEL ASIA ENTERPRISES LIMITED",1998-07-22,2005-12-30,"Private, ltd by shares"55,0650479,"EXCEL PATH DEVELOPMENT LIMITED
越展發展有限公司",1998-07-22,2005-07-22,"Private, ltd by shares"56,0650478,"EXCEL PATH INVESTMENT LIMITED
越展投資有限公司",1998-07-22,2020-07-17,"Private, ltd by shares"57,0650512,"EXCHANGE GOLD CONSULTANTS LIMITED",1998-07-22,2005-07-22,"Private, ltd by shares"58,0650551,"EXPRESS PROSPER ENTERPRISES LIMITED
捷旺企業有限公司",1998-07-22,2006-05-06,"Private, ltd by shares"59,0650435,"EXTREME GOOD CONSTRUCTION COMPANY LIMITED
拔萃建築有限公司",1998-07-22,2013-04-05,"Private, ltd by shares"60,0650614,"FABRICTEX INDUSTRIAL (HK) COMPANY LIMITED",1998-07-22,,"Private, ltd by shares"61,0650371,"FAMOUS CAPITAL ENTERPRISES LIMITED
城譽企業有限公司",1998-07-22,2004-01-30,"Private, ltd by shares"62,0650374,"FANS TRANS INTERNATIONAL LIMITED
友航國際有限公司",1998-07-22,,"Private, ltd by shares"63,0650646,"FAR EAST LUNG WAH METAL FACTORY LIMITED
遠東龍華五金廠有限公司",1998-07-22,2007-11-30,"Private, ltd by shares"64,0650482,"FAST GROUP ENTERPRISES LIMITED
捷群企業有限公司",1998-07-22,2003-01-10,"Private, ltd by shares"65,0650481,"FAST GROUP INDUSTRIES LIMITED
捷群實業有限公司",1998-07-22,2002-09-13,"Private, ltd by shares"66,0650548,"FINANCIAL CITY LIMITED
經港有限公司",1998-07-22,,"Private, ltd by shares"67,0650432,"FLASH TRAVEL CO. LIMITED
中美旅業有限公司",1998-07-22,,"Private, ltd by shares"68,0650588,"FOREVER EYELET PRODUCTION COMPANY LIMITED
永恆雞眼製品有限公司",1998-07-22,2003-03-07,"Private, ltd by shares"69,0650580,"FORTUNE OIL PRC HOLDINGS LIMITED
富地中國投資有限公司",1998-07-22,,"Private, ltd by shares"70,0650620,"FOUNDATION HARDWARE AND ELECTRICAL SUPPLIES LIMITED
創基五金電工有限公司",1998-07-22,2018-04-06,"Private, ltd by shares"71,0650388,"FULWIN INDUSTRIAL LIMITED
富運實業有限公司",1998-07-22,,"Private, ltd by shares"72,0650535,"G.I LIMITED
至愛有限公司",1998-07-22,,"Private, ltd by shares"73,0650570,"GENTLE FORTUNE LIMITED (d2006-02-10)
展庫有限公司",1998-07-22,2006-02-10,"Private, ltd by shares"74,0650602,"GENTLE FORUM LIMITED
崇晉有限公司",1998-07-22,2006-05-06,"Private, ltd by shares"75,0650565,"GLOBAL SPACE INVESTMENT LIMITED",1998-07-22,,"Private, ltd by shares"76,0650409,"GLOBAL STAR (ASIA) HOLDINGS LIMITED
高士達(亞洲)控股有限公司",1998-07-22,2005-02-08,"Private, ltd by shares"77,0650488,"GLOBAL STAR (ASIA) INVESTMENTS LIMITED
高士達(亞洲)投資有限公司",1998-07-22,2003-02-14,"Private, ltd by shares"78,0650408,"GLOBAL STAR (ASIA) TRADING LIMITED
高士達(亞洲)貿易有限公司",1998-07-22,2003-04-25,"Private, ltd by shares"79,0650428,"GLORY JOY ENTERPRISES LIMITED (d2014-11-28)
愉榮企業有限公司",1998-07-22,2014-11-28,"Private, ltd by shares"80,0650510,"GOLD JOSS INVESTMENTS LIMITED",1998-07-22,2005-07-22,"Private, ltd by shares"81,0650437,"GOLD RIVER ELECTRONIC COMPANY LIMITED
金河電子元件有限公司",1998-07-22,,"Private, ltd by shares"82,0650562,"GOLDEN SENSE INDUSTRIAL LIMITED
金升實業有限公司",1998-07-22,2007-10-26,"Private, ltd by shares"83,0650366,"GOOD CHANCE WORLDTRADE LIMITED
鴻國世貿有限公司",1998-07-22,2003-02-07,"Private, ltd by shares"84,0650630,"GOOD EURO LIMITED
恒歐有限公司",1998-07-22,2005-03-24,"Private, ltd by shares"85,0650490,"GOOD PROSPECT INT'L TRANSPORTATION COMPANY LIMITED
好達國際貨運有限公司",1998-07-22,2011-03-25,"Private, ltd by shares"86,0650373,"GRACE MELODY ENTERPRISES LIMITED
彩韻企業有限公司",1998-07-22,2006-12-22,"Private, ltd by shares"87,0650635,"GRACE POINT LIMITED (d2002-08-16)
悅發有限公司",1998-07-22,2002-08-16,"Private, ltd by shares"88,0650504,"GRANDNEWS INTERNATIONAL (HOLDINGS) LIMITED
浩訊國際(集團)有限公司",1998-07-22,2011-03-25,"Private, ltd by shares"89,0650577,"GRANDVIEW GROUP LIMITED
宏觀集團有限公司",1998-07-22,2006-12-08,"Private, ltd by shares"90,0650389,"GRANT PROFIT INTERNATIONAL LIMITED
富來國際有限公司",1998-07-22,,"Private, ltd by shares"91,0650390,"GRANT PROFIT INVESTMENT LIMITED
保富投資有限公司",1998-07-22,2006-02-10,"Private, ltd by shares"92,0650369,"GREAT CONCORD HOLDINGS LIMITED
捷盟集團有限公司",1998-07-22,2018-08-31,"Private, ltd by shares"93,0650578,"GREEN DAY PROPERTIES LIMITED
和平物業有限公司",1998-07-22,,"Private, ltd by shares"94,0650617,"H &amp; Y INTERIOR DESIGN (H.K.) LIMITED
浩然室內設計(香港)有限公司",1998-07-22,,"Private, ltd by shares"95,0650459,"HAN CHING INTERNATIONAL MARKETING CO., LIMITED
漢京國際行銷有限公司",1998-07-22,2005-07-22,"Private, ltd by shares"96,0650368,"HARBIN LINEN (HONG KONG) LIMITED
哈爾濱亞麻(香港)有限公司",1998-07-22,2015-12-04,"Private, ltd by shares"97,0650650,"HARVESTER INTERNATIONAL DEVELOPMENTS LIMITED
禾潤國際發展有限公司",1998-07-22,2005-07-22,"Private, ltd by shares"98,0650443,"HILCON LIMITED (d2009-12-18)
曉光有限公司",1998-07-22,2009-12-18,"Private, ltd by shares"99,0650404,"HILSUN HONG KONG LIMITED
軒宣香港有限公司",1998-07-22,2003-04-25,"Private, ltd by shares"100,0650615,"HOI CHEUNG TRADING COMPANY LIMITED (d2002-10-25)
海翔貿易有限公司",1998-07-22,2002-10-25,"Private, ltd by shares"101,0650522,"HONG KONG HUA LI INTERNATIONAL HOLDING LIMITED
香港華立國際集團有限公司",1998-07-22,2014-11-28,"Private, ltd by shares"102,0650486,"HONG KONG INCEL COMPONENTS GROUP LIMITED
香港英賽爾器件集團有限公司",1998-07-22,2002-07-12,"Private, ltd by shares"103,0650590,"HONG KONG KAM LUNG INTERNATIONAL TRADING COMPANY LIMITED
香港金隆國際貿易有限公司",1998-07-22,2002-12-13,"Private, ltd by shares"104,0650454,"HONG KONG PERFECTWAY LIMITED
煒縉貿易有限公司",1998-07-22,2002-12-20,"Private, ltd by shares"105,0650410,"HONG KONG SUNSHINE TRADING COMPANY LIMITED (d2006-02-10)
香港京天貿易有限公司",1998-07-22,2006-02-10,"Private, ltd by shares"106,0650595,"HONG KONG WEN WEI PO DAILY INTERNATIONAL PUBLIC RELATIONS CONSULTANT CO. LIMITED
香港文匯報國際公關顧問有限公司",1998-07-22,,"Private, ltd by shares"107,0650457,"HONG KONG ZHIJINHUA PUBLISHING HOUSE LIMITED
香港紫荊花出版書局有限公司",1998-07-22,2005-07-22,"Private, ltd by shares"108,0650402,"HONICA HOLDINGS LIMITED
康佳集團有限公司",1998-07-22,2005-07-22,"Private, ltd by shares"109,0650560,"HONORICH (ASIA) LIMITED
鴻裕(亞洲)有限公司",1998-07-22,2004-06-11,"Private, ltd by shares"110,0650613,"HUA HAN (CHINA) LIMITED
華漢興業(中國)有限公司",1998-07-22,2011-04-21,"Private, ltd by shares"111,0650417,"HUITONG (H.K.) INTERNATIONAL INVESTMENT CO., LIMITED
匯通(香港)國際投資有限公司",1998-07-22,2005-07-22,"Private, ltd by shares"112,0650452,"HUNG WAH (HONG KONG) COMPANY LIMITED
雄華(香港)有限公司",1998-07-22,2004-12-10,"Private, ltd by shares"113,0650429,"HYROSS INTERNATIONAL LIMITED",1998-07-22,2004-07-09,"Private, ltd by shares"114,0650440,"INSOLVENCY MANAGEMENT FUND LIMITED",1998-07-22,2000-09-15,"Private, ltd by shares"115,0650391,"INTERNATIONAL COMMERCIAL LEASING COMPANY LIMITED
國際租賃有限公司",1998-07-22,2003-06-20,"Private, ltd by shares"116,0650608,"INTERNATIONAL FEDERATION OF THE PHONOGRAPHIC INDUSTRY (HONG KONG GROUP) LIMITED
國際唱片業協會(香港會)有限公司",1998-07-22,,"Ltd by guarantee"117,0650460,"ITALY A SIGN GROUP (H.K.) LIMITED
意大利雅林集團(香港)有限公司",1998-07-22,2005-07-22,"Private, ltd by shares"118,0650507,"J &amp; ANDRE CONSULTANTS COMPANY LIMITED
緯群顧問有限公司",1998-07-22,2014-03-07,"Private, ltd by shares"119,0650466,"JADE AIR LIMITED
翠航有限公司",1998-07-22,2002-02-01,"Private, ltd by shares"120,0650606,"JENNY (ASIA) LIMITED
展利(亞洲)有限公司",1998-07-22,2005-07-22,"Private, ltd by shares"121,0650521,"JERRY JEWELLERY TRADING LIMITED
凱超珠寶貿易有限公司",1998-07-22,2000-12-15,"Private, ltd by shares"122,0650585,"JETLAND CONSULTANTS (INTERNATIONAL) LIMITED
捷利顧問(國際)有限公司",1998-07-22,2005-07-22,"Private, ltd by shares"123,0650605,"JETSO COMPANY LIMITED (d2006-02-24)
着數有限公司",1998-07-22,2006-02-24,"Private, ltd by shares"124,0650494,"JI SHING INTERNATIONAL DEVELOPMENT COMPANY LIMITED
捷勝國際發展有限公司",1998-07-22,2005-07-22,"Private, ltd by shares"125,0650627,"JING YUE INTERNATIONAL HOLDINGS COMPANY LIMITED
京粵國際集團有限公司",1998-07-22,2003-04-04,"Private, ltd by shares"126,0650487,"JOINT NET TELECOMMUNICATIONS INTERNATIONAL LIMITED
聯合網絡通訊國際有限公司",1998-07-22,2001-10-19,"Private, ltd by shares"127,0650496,"JONESKY (H.K.) LIMITED
天下出版(香港)有限公司",1998-07-22,2017-05-26,"Private, ltd by shares"128,0650456,"JOT AUTOMATION ASIA PACIFIC LIMITED",1998-07-22,2006-11-24,"Private, ltd by shares"129,0650559,"JOURNEY (ASIA) LIMITED
長利(亞洲)有限公司",1998-07-22,,"Private, ltd by shares"130,0650413,"JOYFUL HARMONY LIMITED (d2009-01-16)",1998-07-22,2009-01-16,"Private, ltd by shares"131,0650594,"KA WING HANDBAGS FACTORY LIMITED
嘉榮手袋廠有限公司",1998-07-22,2015-08-14,"Private, ltd by shares"132,0650543,"KARE PROFESSIONAL BEAUTY SALON LIMITED
卡爾美顏瘦身中心有限公司",1998-07-22,,"Private, ltd by shares"133,0650519,"KARKIU INVESTMENT HOLDINGS LIMITED
嘉僑投資集團有限公司",1998-07-22,,"Private, ltd by shares"134,0650396,"KARWAY TECHNOLOGY LIMITED
加偉科技有限公司",1998-07-22,2001-10-12,"Private, ltd by shares"135,0650564,"KING JOINT INDUSTRIAL LIMITED
晉亨實業有限公司",1998-07-22,,"Private, ltd by shares"136,0650612,"KING TAI (INTERNATIONAL) ELECTRONIC MANUFACTURING LIMITED
金泰(國際)電業製品有限公司",1998-07-22,,"Private, ltd by shares"137,0650533,"KING'S ELECTRIC WORKS LIMITED
傾仕電器有限公司",1998-07-22,2002-07-05,"Private, ltd by shares"138,0650545,"KING'S TECHNOLOGY LIMITED",1998-07-22,2005-07-22,"Private, ltd by shares"139,0650414,"KONG HUNG CONSTRUCTION (HK) LIMITED
港雄工程(香港)有限公司",1998-07-22,2009-01-14,"Private, ltd by shares"140,0650465,"KONSGREAT INDUSTRIAL LIMITED
豐益實業有限公司",1998-07-22,2017-09-15,"Private, ltd by shares"141,0650547,"KYKA COMPANY LIMITED
凱喬有限公司",1998-07-22,2004-08-20,"Private, ltd by shares"142,0650453,"LCC CHINA ENTERPRISES LIMITED
浩華中國有限公司",1998-07-22,,"Private, ltd by shares"143,0650450,"LEDAFU HOLDINGS LIMITED
樂達富控股有限公司",1998-07-22,,"Private, ltd by shares"144,0650480,"LEDDER GROUP INTERNATIONAL LIMITED
致群國際有限公司",1998-07-22,2012-12-07,"Private, ltd by shares"145,0650376,"LEE'S PATISSERIE LIMITED
列提頓坊有限公司",1998-07-22,2014-02-14,"Private, ltd by shares"146,0650561,"LEGEND FINANCE LIMITED (HK)
利盛財務有限公司",1998-07-22,,"Private, ltd by shares"147,0650394,"LEXIN LIMITED (d2011-03-18)
立上有限公司",1998-07-22,2011-03-18,"Private, ltd by shares"148,0650411,"LI YANG COMPANY LIMITED (d2004-02-13)
里陽汽車有限公司",1998-07-22,2004-02-13,"Private, ltd by shares"149,0650634,"LINK UNION INTERNATIONAL LIMITED (d2003-07-11)
祥聯國際有限公司",1998-07-22,2003-07-11,"Private, ltd by shares"150,0650530,"LIVITO AGENCY LIMITED
利華達僱傭有限公司",1998-07-22,2007-09-28,"Private, ltd by shares"151,0650536,"LONG VACATION TRAVEL LIMITED
悠長假期有限公司",1998-07-22,2011-09-20,"Private, ltd by shares"152,0650583,"MAILING MALL LIMITED
新栢莉有限公司",1998-07-22,2003-04-04,"Private, ltd by shares"153,0650576,"MANSION FIRE SERVICES COMPANY LIMITED
民信消防服務有限公司",1998-07-22,,"Private, ltd by shares"154,0650484,"MASS BO INTERNATIONAL LIMITED
得宏國際有限公司",1998-07-22,2005-07-29,"Private, ltd by shares"155,0650483,"MASS BO INVESTMENT LIMITED
得宏投資有限公司",1998-07-22,2005-07-22,"Private, ltd by shares"156,0650527,"MASS CITY ENTERPRISES LIMITED
城偉企業有限公司",1998-07-22,2005-07-22,"Private, ltd by shares"157,0650528,"MASS CITY TRADING LIMITED
城偉貿易有限公司",1998-07-22,,"Private, ltd by shares"158,0650633,"MAX CAPITAL INVESTMENT LIMITED (d2005-07-22)
富本投資有限公司",1998-07-22,2005-07-22,"Private, ltd by shares"159,0650629,"MEDIA EDUCATION INFO-TECH COMPANY LIMITED
國際高等教育資訊有限公司",1998-07-22,,"Private, ltd by shares"160,0650537,"MELODY SYSTEMS LIMITED
樂訊系統有限公司",1998-07-22,,"Private, ltd by shares"161,0650575,"MERIDIAN ASSETS LIMITED (HK)
經緯資產有限公司",1998-07-22,,"Private, ltd by shares"162,0650623,"MIN HWA PAPER INDUSTRIAL H.K. LIMITED
民華紙品工業有限公司",1998-07-22,,"Private, ltd by shares"163,0650448,"MULTI - TECH (CHINA) TELECOM SYSTEM LIMITED
宏訊(中國)電訊系統有限公司",1998-07-22,,"Private, ltd by shares"164,0650392,"MUTUAL MERIT FINE CHEMICAL COMPANY LIMITED
創益精細化工有限公司",1998-07-22,,"Private, ltd by shares"165,0650544,"NETVISION SYSTEMS LIMITED (d2008-02-15)
盈科系統有限公司",1998-07-22,2008-02-15,"Private, ltd by shares"166,0650367,"NEW CHOICE (HK) LIMITED
六采(香港)有限公司",1998-07-22,,"Private, ltd by shares"167,0650436,"NEW TREND LIMITED (d2005-07-22)
新時尚有限公司",1998-07-22,2005-07-22,"Private, ltd by shares"168,0650511,"NV MANUFACTURING (SRI LANKA) LIMITED",1998-07-22,2004-10-29,"Private, ltd by shares"169,0650574,"OLD KENT TRADE SERVICES LIMITED",1998-07-22,2003-03-07,"Private, ltd by shares"170,0650616,"OVERLAND HOLDING LIMITED",1998-07-22,2004-07-02,"Private, ltd by shares"171,0650558,"PAKSON (ASIA) LIMITED (d2003-02-21)
百勝(亞洲)有限公司",1998-07-22,2003-02-21,"Private, ltd by shares"172,0650628,"PANORAMIC HOLDINGS LIMITED (d2003-05-09)
大地集團有限公司",1998-07-22,2003-05-09,"Private, ltd by shares"173,0650415,"PANYU HOSTMOST COMMUNICATION &amp; NAVIGATION LIMITED
番禺浩駿通信有限公司",1998-07-22,2005-04-08,"Private, ltd by shares"174,0650400,"PARAKON INTERNATIONAL LIMITED
百康國際有限公司",1998-07-22,2015-12-18,"Private, ltd by shares"175,0650640,"PATERSON SHIPPING LIMITED
百得船務有限公司",1998-07-22,2020-01-03,"Private, ltd by shares"176,0650505,"PERFECT ENGINEERING (H.K.) LIMITED (d2004-07-09)
富迅工程(香港)有限公司",1998-07-22,2004-07-09,"Private, ltd by shares"177,0650611,"PETER YUEN &amp; ASSOCIATES LIMITED
袁漢勳工料測量師有限公司",1998-07-22,2018-11-02,"Private, ltd by shares"178,0650572,"PICASSOS LIMITED (d2005-07-22)
長琼有限公司",1998-07-22,2005-07-22,"Private, ltd by shares"179,0650500,"PIONEER GLOBAL INVESTMENTS (HK) LIMITED",1998-07-22,2011-10-18,"Private, ltd by shares"180,0650639,"POLY CORPORATION LIMITED (d2006-02-10)
百利行南方有限公司",1998-07-22,2006-02-10,"Private, ltd by shares"181,0650498,"PORT-LINK (PACIFIC) LIMITED
港聯(亞太)有限公司",1998-07-22,2001-06-15,"Private, ltd by shares"182,0650523,"PRD TECHNOLOGIES LIMITED (d2001-05-18)
駿嶺科技有限公司",1998-07-22,2001-05-18,"Private, ltd by shares"183,0650472,"PREMIER DRAGON (HK) LIMITED
御龍(香港)有限公司",1998-07-22,2004-01-02,"Private, ltd by shares"184,0650420,"PREMIER DRAGON DEVELOPMENT LIMITED",1998-07-22,,"Private, ltd by shares"185,0650375,"PREMIER DRAGON LIMITED
御宏有限公司",1998-07-22,2015-09-01,"Private, ltd by shares"186,0650625,"PREMIERS CRUS LIMITED
名釀有限公司",1998-07-22,2006-02-10,"Private, ltd by shares"187,0650421,"PREMIERWAY DEVELOPMENT LIMITED
御宏發展有限公司",1998-07-22,2003-04-04,"Private, ltd by shares"188,0650383,"PREMIERWAY INVESTMENT LIMITED
御宏投資有限公司",1998-07-22,,"Private, ltd by shares"189,0650416,"PRO-TECS FABRICS INTERNATIONAL LIMITED
博迪思紡織國際有限公司",1998-07-22,2006-06-03,"Private, ltd by shares"190,0650538,"PROFIT ZONE HOLDINGS LIMITED (d2000-12-22)
寶信控股有限公司",1998-07-22,2000-12-22,"Private, ltd by shares"191,0650603,"PROSPER TOGETHER CO., LIMITED
一齊發發展有限公司",1998-07-22,2008-07-04,"Private, ltd by shares"192,0650424,"PROTOP INVESTMENT LIMITED
通才投資有限公司",1998-07-22,,"Private, ltd by shares"193,0650592,"RAIS COMPANY LIMITED
葦斯有限公司",1998-07-22,2005-09-09,"Private, ltd by shares"194,0650596,"RDK INTERNATIONAL MERCHANDISING (CHINA) LIMITED
三帝國際有限公司",1998-07-22,2015-11-20,"Private, ltd by shares"195,0650515,"REXON INTERNATIONAL LIMITED
立順國際有限公司",1998-07-22,2014-11-28,"Private, ltd by shares"196,0650520,"RHEA INTERNATIONAL (ASIA PACIFIC) LIMITED",1998-07-22,2005-07-22,"Private, ltd by shares"197,0650372,"RICH TREND HOLDINGS LIMITED
富宇集團有限公司",1998-07-22,,"Private, ltd by shares"198,0650531,"RICH YEAR INTERNATIONAL LIMITED (d2003-12-24)",1998-07-22,2003-12-24,"Private, ltd by shares"199,0650587,"RICHMAN PERSONNEL SERVICES LIMITED
協盛僱傭服務中心有限公司",1998-07-22,2001-08-10,"Private, ltd by shares"200,0650399,"RONWAY INTERNATIONAL LIMITED
隆威國際有限公司",1998-07-22,2008-07-04,"Private, ltd by shares"201,0650649,"ROSEBERG INTERNATIONAL LIMITED
紅山國際有限公司",1998-07-22,2006-02-10,"Private, ltd by shares"202,0650502,"ROYAL BEST TRADING LIMITED (d2011-07-15)
永威貿易有限公司",1998-07-22,2011-07-15,"Private, ltd by shares"203,0650412,"ROYAL EAGLE COMPANY LIMITED
皇鷹蔬果有限公司",1998-07-22,2003-04-25,"Private, ltd by shares"204,0650464,"ROYAL SMART INTERNATIONAL LIMITED (d2001-02-23)
裕豪國際有限公司",1998-07-22,2001-02-23,"Private, ltd by shares"205,0650619,"SAI YEE OVERSEAS LIMITED
世怡海外有限公司",1998-07-22,2002-02-01,"Private, ltd by shares"206,0650403,"SAM LAP SHUN HOLDINGS (HK) INVESTMENT LIMITED
三立信集團 (香港) 投資有限公司",1998-07-22,2019-03-29,"Private, ltd by shares"207,0650609,"SAMFORD GARMENT FACTORY LIMITED
星福製衣廠有限公司",1998-07-22,2001-12-28,"Private, ltd by shares"208,0650377,"SHANGHAI CENTRE LIMITED
浦中有限公司",1998-07-22,2003-09-19,"Private, ltd by shares"209,0650378,"SHANGHAI POWER LIMITED
浦傑有限公司",1998-07-22,2001-03-09,"Private, ltd by shares"210,0650379,"SHANGHAI REGENT LIMITED
浦俊有限公司",1998-07-22,,"Private, ltd by shares"211,0650446,"SHEEN ELEMENT LIMITED
軒萬有限公司",1998-07-22,,"Private, ltd by shares"212,0650636,"SHUN HING DEVELOPMENT LIMITED
信興發展有限公司",1998-07-22,2002-07-12,"Private, ltd by shares"213,0650397,"SILVER ASIA ENGINEERING LIMITED
兆亞工程有限公司",1998-07-22,2005-07-22,"Private, ltd by shares"214,0650540,"SIMPLE STUDIO LIMITED
簡單影廠有限公司",1998-07-22,2003-12-05,"Private, ltd by shares"215,0650516,"SKY LUCK (HONG KONG) LIMITED
天立(香港)有限公司",1998-07-22,2017-07-14,"Private, ltd by shares"216,0650517,"SMARTEX (HONG KONG) LIMITED
明泰(香港)有限公司",1998-07-22,,"Private, ltd by shares"217,0650439,"SOLAR GROUP H.K. LIMITED
明宙廣告有限公司",1998-07-22,,"Private, ltd by shares"218,0650370,"SOLAR TECH INVESTMENTS LIMITED (d2005-07-22)
暉綽投資有限公司",1998-07-22,2005-07-22,"Private, ltd by shares"219,0650534,"SPECIAL METAL CEILING LIMITED
專業金屬天花有限公司",1998-07-22,2004-10-21,"Private, ltd by shares"220,0650476,"SPRITE MASS ENTERPRISES LIMITED
昇宏企業有限公司",1998-07-22,2016-12-02,"Private, ltd by shares"221,0650645,"STAR UNION DEVELOPMENT LIMITED (d2007-11-30)
星聯發展有限公司",1998-07-22,2007-11-30,"Private, ltd by shares"222,0650364,"STEADFAST METAL FINISHING ENGINEERS LIMITED
穩健金屬處理工程有限公司",1998-07-22,,"Private, ltd by shares"223,0650418,"STRATEGIC SPORTS LIMITED",1998-07-22,,"Private, ltd by shares"