,Reg no.,Name,Incorp-orated,Dissolved,Type671,2056282,"HONGKONG SHIJI TIANCHENG TRADE LIMITED
香港世紀天成貿易有限公司",2014-03-18,,"Private, ltd by shares"672,2056372,"HONGKONG SHINE-WIN TRADE CO., LIMITED",2014-03-18,2019-03-15,"Private, ltd by shares"673,2056437,"HongKong ShunXinDa Technology Limited
香港順信達科技有限公司",2014-03-18,,"Private, ltd by shares"674,2056224,"HONGKONG SONGBIAN ELECTRICAL LIMITED
香港松卞電氣有限公司",2014-03-18,2017-11-10,"Private, ltd by shares"675,2057295,"HONGKONG SPLENDID TEAM TRADING LIMITED
香港曄輝貿易有限公司",2014-03-18,2018-05-25,"Private, ltd by shares"676,2056977,"HONGKONG SUNSTAR SUPERTECH CO., LIMITED
香港日之星科技有限公司",2014-03-18,2017-07-28,"Private, ltd by shares"677,2056381,"HONGKONG TAILI GROUP HOLDINGS LIMITED
香港泰利集團股份有限公司",2014-03-18,2017-10-27,"Private, ltd by shares"678,2056589,"HONGKONG TEITO COMPANY LIMITED",2014-03-18,2019-11-15,"Private, ltd by shares"679,2057048,"HONGKONG TIAN YU HOLDING CO., LIMITED
香港天宇控股有限公司",2014-03-18,,"Private, ltd by shares"680,2056693,"HONGKONG TIMES ENTERPRISE MANAGEMENT LIMITED
香港時代遇見企業管理有限公司",2014-03-18,,"Private, ltd by shares"681,2056092,"HONGKONG VERTU DECORATION ENGINEERING CO., LIMITED
香港威圖裝飾工程有限公司",2014-03-18,2016-09-15,"Private, ltd by shares"682,2056108,"HongKong Vivetron Technology Co., Limited
香港偉互創科技有限公司",2014-03-18,,"Private, ltd by shares"683,2056794,"Hongkong WuFu Cci Capital Limited
香港五福投資管理有限公司",2014-03-18,,"Private, ltd by shares"684,2057005,"HongKong XinYiQing Slimming International Chain Group Limited
香港鑫熠晴瘦身國際連鎖集團有限公司",2014-03-18,,"Private, ltd by shares"685,2056218,"Hongkong XLD Technology Co., Limited
香港信立德科技有限公司",2014-03-18,2019-03-15,"Private, ltd by shares"686,2056942,"HongKong Zhongdian Capital Co., Limited
香港中滇資本有限公司",2014-03-18,,"Private, ltd by shares"687,2056299,"HONGZHAN INDUSTRIES LIMITED
鴻展實業有限公司",2014-03-18,,"Private, ltd by shares"688,2056112,"HOOLIGAN INDUSTRIES LIMITED (HK)",2014-03-18,2019-01-11,"Private, ltd by shares"689,2057333,"Horizon Will Group Co., Limited
禾潤偉業集團有限公司",2014-03-18,2017-11-10,"Private, ltd by shares"690,2056629,"HOTEK TEXTILE CO., LIMITED
宏泰紡織有限公司",2014-03-18,2019-09-06,"Private, ltd by shares"691,2057085,"Hotwheel International Company Limited
昊為國際有限公司",2014-03-18,2016-10-21,"Private, ltd by shares"692,2057314,"HTB Technology Co., Limited
好特比科技有限公司",2014-03-18,,"Private, ltd by shares"693,2056859,"Hua Dian International Co., Limited
華電國際有限公司",2014-03-18,2018-09-07,"Private, ltd by shares"694,2056972,"HUA RE TECH CO., LIMITED
華再科技有限公司",2014-03-18,2015-06-12,"Private, ltd by shares"695,2056660,"HUA TIAN INTERNATIONAL TRADE CO., LIMITED
華天國際經貿有限公司",2014-03-18,,"Private, ltd by shares"696,2056352,"HUA XING LINGERIE CO., LIMITED
華興內衣有限公司",2014-03-18,,"Private, ltd by shares"697,2056396,"HUA ZHI TECHNOLOGY (CHINA) COMPANY LIMITED
驊志科技(中國)有限公司",2014-03-18,2016-09-23,"Private, ltd by shares"698,2056360,"HUACHENGXIN INDUSTRIES LIMITED
華辰興實業有限公司",2014-03-18,,"Private, ltd by shares"699,2057065,"Huali China Limited
花里中國有限公司",2014-03-18,,"Private, ltd by shares"700,2057103,"HUANG YANG PROFESSIONAL SPORTS LIMITED
黃洋運動用品專門店有限公司",2014-03-18,2019-06-21,"Private, ltd by shares"701,2056454,"HUASHI ELECTRONICS TECHNOLOGY CO., LIMITED
華實電子科技有限公司",2014-03-18,,"Private, ltd by shares"702,2056690,"Huazhuo International Capital System Co., Limited
華卓國際資本系統有限公司",2014-03-18,,"Private, ltd by shares"703,2056275,"HUGEWAY LIMITED",2014-03-18,,"Private, ltd by shares"704,2057067,"HUIXIAN EQUIPMENT TENANCY HOLDING LIMITED
慧先設備租賃股份有限公司",2014-03-18,,"Private, ltd by shares"705,2057302,"HUNG JUN FURNITURE TRADING LIMITED
雄進家具貿易有限公司",2014-03-18,,"Private, ltd by shares"706,2057119,"Hungyim city Street furniture Limited
洪炎城市街道傢具有限公司",2014-03-18,,"Private, ltd by shares"707,2056122,"HUSHFLOORS INTERNATIONAL LIMITED
噓地板國際有限公司",2014-03-18,,"Private, ltd by shares"708,2057150,"HY INVESTMENT GROUP (HONGKONG) CO., LIMITED
弘域海外集團(香港)有限公司",2014-03-18,,"Private, ltd by shares"709,2057428,"HYDE ENTERPRISES LIMITED
可德企業有限公司",2014-03-18,,"Private, ltd by shares"710,2057016,"HYUNDAI INDUSTRIAL CO., LIMITED
現代重工(中國)電氣有限公司",2014-03-18,,"Private, ltd by shares"711,2057199,"I-NEW COMPUTER SHOP (RECYCLE) LIMITED",2014-03-18,,"Private, ltd by shares"712,2056000,"IceBreaker Limited (d2016-09-30)
品泉有限公司",2014-03-18,2016-09-30,"Private, ltd by shares"713,2056434,"ICOOL AUTO ACCESSORIES AND PARTS TRADING LIMITED",2014-03-18,2019-05-17,"Private, ltd by shares"714,2056001,"ICRIS:2056001 (no English name)
香港琳樂欣文貿易有限公司",2014-03-18,2017-06-30,"Private, ltd by shares"715,2056315,"ICRIS:2056315 (no English name)
國際易學風水研究院有限公司",2014-03-18,2019-03-15,"Private, ltd by shares"716,2056536,"ICRIS:2056536 (no English name)
百果園有限公司",2014-03-18,2019-03-15,"Private, ltd by shares"717,2056886,"ICRIS:2056886 (no English name)
中華鋸琴文化產業發展有限公司",2014-03-18,2019-03-15,"Private, ltd by shares"718,2056435,"IDEAL PLUS INTERNATIONAL LIMITED
迪趣國際貿易有限公司",2014-03-18,,"Private, ltd by shares"719,2056364,"IDEAL VIEW INTERNATIONAL LIMITED
意景國際有限公司",2014-03-18,2019-03-15,"Private, ltd by shares"720,2056936,"iiapp Limited",2014-03-18,2018-03-16,"Private, ltd by shares"721,2056905,"ILIKE DIGITAL LIMITED
麗科數碼(香港)有限公司",2014-03-18,2020-06-19,"Private, ltd by shares"722,2057098,"IMEDA INDUSTRY LIMITED
印美達實業有限公司",2014-03-18,,"Private, ltd by shares"723,2056844,"IMOK TECHNOLOGY (HK) LIMITED
香港艾漠技術有限公司",2014-03-18,2019-07-12,"Private, ltd by shares"724,2056221,"InfinTa Limited
富豊國際科技有限公司",2014-03-18,2017-03-17,"Private, ltd by shares"725,2056363,"INFLUENCE INTERNATIONAL CO., LIMITED
因福恩施國際有限公司",2014-03-18,2019-03-15,"Private, ltd by shares"726,2056899,"INFOROY TRADING LIMITED
中利來貿易有限公司",2014-03-18,2019-02-15,"Private, ltd by shares"727,2057117,"Innovative Product Brands Asia Limited",2014-03-18,,"Private, ltd by shares"728,2056935,"INSIDEOUT STARTUPS LIMITED",2014-03-18,2017-09-15,"Private, ltd by shares"729,2057390,"INSPIRED LIFE LIMITED",2014-03-18,2017-11-10,"Private, ltd by shares"730,2056673,"INTECH HOLDINGS (HK) LIMITED",2014-03-18,,"Private, ltd by shares"731,2056727,"INTER TOBACCO CO., LIMITED",2014-03-18,2016-12-02,"Private, ltd by shares"732,2057372,"Irit Art Limited",2014-03-18,2019-03-22,"Private, ltd by shares"733,2057391,"ISLAND DYNAMIC LIMITED
港島動力有限公司",2014-03-18,,"Private, ltd by shares"734,2056311,"ITALY KADAN GIANT INTERNATIONAL GROUP LIMITED
意大利卡丹巨人國際集團有限公司",2014-03-18,2017-11-10,"Private, ltd by shares"735,2056077,"IVP ALPHA INVESTMENT HOLDINGS LIMITED",2014-03-18,,"Private, ltd by shares"736,2056809,"J&amp;C WATCH CO., LIMITED
捷時鐘表有限公司",2014-03-18,2019-03-15,"Private, ltd by shares"737,2056447,"J.K.ARMY Limited
積奇軍品有限公司",2014-03-18,,"Private, ltd by shares"738,2056806,"JANSUN LIGHTING LIMITED
香港健勝科技有限公司",2014-03-18,2018-12-21,"Private, ltd by shares"739,2056019,"JANTON LIMITED (HK)
朝豐有限公司",2014-03-18,,"Private, ltd by shares"740,2057274,"JERRITECH TECHNOLOGY LIMITED
傑瑞特科技有限公司",2014-03-18,2017-11-10,"Private, ltd by shares"741,2056403,"JES Gold Limited",2014-03-18,2020-07-03,"Private, ltd by shares"742,2057249,"JESSE INDUSTRIAL LIMITED",2014-03-18,,"Private, ltd by shares"743,2056356,"Jetsurf Asia Pacific Limited",2014-03-18,,"Private, ltd by shares"744,2056837,"JF HOUSEHOLD FURNISHINGS (ASIA) LIMITED
捷豐家居用品(亞洲)有限公司",2014-03-18,,"Private, ltd by shares"745,2057393,"JFL INVESTMENT LIMITED",2014-03-18,,"Private, ltd by shares"746,2057154,"JHC TRADE IMPORT &amp; EXPORT CO., LIMITED
金恒誠貿易進出口有限公司",2014-03-18,2017-09-01,"Private, ltd by shares"747,2056551,"Jia Bo Source Group Co., Limited
佳泊源集團有限公司",2014-03-18,2016-11-25,"Private, ltd by shares"748,2056575,"Jia Cargo Express Co., Limited
加航國際貨運代理有限公司",2014-03-18,2019-03-15,"Private, ltd by shares"749,2056581,"JIA CHENG HK INT'L INDUSTRIAL LIMITED
嘉誠香港國際實業有限公司",2014-03-18,2017-06-30,"Private, ltd by shares"750,2057325,"JIANGXI HOOKUP GLOBAL CO., LIMITED
江西福客國際有限公司",2014-03-18,2019-03-22,"Private, ltd by shares"751,2056377,"JIANGYOU (HK) INDUSTRY LIMITED
江友(香港)實業有限公司",2014-03-18,,"Private, ltd by shares"752,2056149,"JIN YUAN CABLE LIMITED
金源(香港)科技有限公司",2014-03-18,2018-08-24,"Private, ltd by shares"753,2056227,"JINAN HOWO TRUCK (HONGKONG) CO., LIMITED
濟南豪沃卡車(香港)有限公司",2014-03-18,,"Private, ltd by shares"754,2056689,"JINCHENG MEDTECH INDUSTRY CO., LIMITED
江蘇錦程天星實業有限公司",2014-03-18,,"Private, ltd by shares"755,2056166,"Jingwholesale Trading Co., Limited
競和賽貿易有限公司",2014-03-18,,"Private, ltd by shares"756,2056402,"JINJIANG UFINE INDUSTRIAL CO., LIMITED
晉江市耀發進出口貿易有限公司",2014-03-18,,"Private, ltd by shares"757,2057013,"JINLIHE PHARMACY LIMITED
金利合藥業有限公司",2014-03-18,2017-11-10,"Private, ltd by shares"758,2057036,"JINLONG TECHNOLOGY DEVELOPMENT CO., LIMITED",2014-03-18,,"Private, ltd by shares"759,2056431,"JINTAN DINGSHENG (HK) LIMITED
金檀鼎盛(香港)有限公司",2014-03-18,2015-10-23,"Private, ltd by shares"760,2056100,"JOINT APEX LIMITED",2014-03-18,,"Private, ltd by shares"761,2056675,"JOINT VOICE LIMITED
軍星有限公司",2014-03-18,2017-11-10,"Private, ltd by shares"762,2057060,"JOLLY DRAGON INTERNATIONAL LIMITED
鎰龍國際有限公司",2014-03-18,,"Private, ltd by shares"763,2057020,"JOLLY DRAGON LIMITED
鎰龍有限公司",2014-03-18,2017-11-10,"Private, ltd by shares"764,2057189,"JOLLY DRAGON TRADING LIMITED
鎰龍貿易有限公司",2014-03-18,2017-03-24,"Private, ltd by shares"765,2056715,"JOY AND VITALITY EDUCATION COMPANY LIMITED
樂殷教育有限公司",2014-03-18,,"Private, ltd by shares"766,2057392,"Joy Mega Taste Food Limited
百樂軒美食有限公司",2014-03-18,,"Private, ltd by shares"767,2056283,"JOY PRIDE LIMITED",2014-03-18,2016-01-15,"Private, ltd by shares"768,2056106,"JOY VAST LIMITED (d2018-06-15)",2014-03-18,2018-06-15,"Private, ltd by shares"769,2057011,"JRY TRADE IMPORT &amp; EXPORT CO., LIMITED
金潤益貿易進出口有限公司",2014-03-18,2017-09-01,"Private, ltd by shares"770,2056209,"JST IT Consultants Limited
爾頓科技顧問有限公司",2014-03-18,,"Private, ltd by shares"771,2056814,"JT SINGH LIMITED",2014-03-18,2016-11-18,"Private, ltd by shares"772,2056091,"Ju Yuan Da Company Limited
聚源達有限公司",2014-03-18,2017-11-10,"Private, ltd by shares"773,2056505,"JUBILEE BLUE LIMITED
友藍有限公司",2014-03-18,,"Private, ltd by shares"774,2056284,"JUMBO BEAUTY LIMITED",2014-03-18,,"Private, ltd by shares"775,2056699,"JUMBO BLUE LIMITED
藍康有限公司",2014-03-18,2017-11-10,"Private, ltd by shares"776,2056711,"Jun Ying Toys Co. Limited
俊盈玩具有限公司",2014-03-18,,"Private, ltd by shares"777,2057402,"Just Finance Limited
即時融資有限公司",2014-03-18,,"Private, ltd by shares"778,2056276,"JXL Technology (Hong Kong) Limited
金信聯科技(香港)有限公司",2014-03-18,,"Private, ltd by shares"779,2057126,"JZD INT'L TRADING LIMITED
嘉振達國際貿易有限公司",2014-03-18,2019-02-22,"Private, ltd by shares"780,2056641,"K &amp; S ASIA CORPORATION LIMITED
廣海亞洲商貿有限公司",2014-03-18,,"Private, ltd by shares"781,2056190,"K&amp;R Precision Metal Co., Limited
凱瑞奇精密五金有限公司",2014-03-18,,"Private, ltd by shares"782,2056694,"Kabway (HK) Technology Co., Limited
香港凱博偉業科技有限公司",2014-03-18,,"Private, ltd by shares"783,2056793,"KAI CAI PACKING INDUSTRIAL CO., LIMITED
開彩包裝實業有限公司",2014-03-18,,"Private, ltd by shares"784,2056982,"KAIDI GIFT CO., LIMITED
凱迪工藝禮品有限公司",2014-03-18,,"Private, ltd by shares"785,2056156,"Kaikaixin International Holding Group Co., Limited
開開鑫國際控股集團有限公司",2014-03-18,,"Private, ltd by shares"786,2056928,"KALEKA DIET MANAGEMENT (INT'L) LIMITED
卡樂卡飲食管理(國際)有限公司",2014-03-18,2017-11-10,"Private, ltd by shares"787,2056900,"KANGJU CO., LIMITED
康巨有限公司",2014-03-18,2015-01-09,"Private, ltd by shares"788,2057413,"Kapital Oasis Management Limited
博達策劃管理有限公司",2014-03-18,,"Private, ltd by shares"789,2056564,"KATOUR INDUSTRIAL LIMITED
珈圖實業有限公司",2014-03-18,2019-03-15,"Private, ltd by shares"790,2057206,"KEE AND ASSOCIATES PROFESSIONAL CONSULTING SERVICES LIMITED
其利科技顧問有限公司",2014-03-18,,"Private, ltd by shares"791,2056568,"Keen Fine Shipping Limited
利景船務有限公司",2014-03-18,,"Private, ltd by shares"792,2056291,"KEY VIEW LIMITED (HK)",2014-03-18,2019-03-15,"Private, ltd by shares"793,2056236,"KING LAND INTERNATIONAL SHARES LIMITED
金蘭國際股份有限公司",2014-03-18,2015-07-24,"Private, ltd by shares"794,2056151,"KING LUCK INC LIMITED
璟立有限公司",2014-03-18,,"Private, ltd by shares"795,2056181,"KING MAJESTY INDUSTRY LIMITED
皇權實業有限公司",2014-03-18,2020-10-23,"Private, ltd by shares"796,2057284,"KING OFFSHORE SERVICES CO., LIMITED
香港通途船務有限公司",2014-03-18,,"Private, ltd by shares"797,2057051,"KINGDOM DRAGON HK GROUP LIMITED
香港豫隆集團有限公司",2014-03-18,,"Private, ltd by shares"798,2056144,"KINGFULL CORPORATION LIMITED (d2017-11-10)
翹灃有限公司",2014-03-18,2017-11-10,"Private, ltd by shares"799,2056475,"KINGHONG ELECTRONICS TRADING LIMITED
精鴻電子貿易有限公司",2014-03-18,2017-05-26,"Private, ltd by shares"800,2056460,"Kingruiya (Hongkong) Technology Co., Limited
金瑞雅(香港)科技有限公司",2014-03-18,,"Private, ltd by shares"801,2057229,"KJohn Consulting Limited",2014-03-18,,"Private, ltd by shares"802,2056754,"KLASS DIAMONDS LIMITED",2014-03-18,,"Private, ltd by shares"803,2056566,"KLNGSUN FINANCIAL SERVICE GROUP LIMITED
天山財富金融服務集團有限公司",2014-03-18,,"Private, ltd by shares"804,2056637,"KOMMA CONCEPTS LIMITED",2014-03-18,2019-03-15,"Private, ltd by shares"805,2056626,"KONG KEE FU LOI RESTAURANT LIMITED
江記富來餐廳有限公司",2014-03-18,2019-11-15,"Private, ltd by shares"806,2057399,"KONIKA TECHNOLOGIES CO., LIMITED
康力佳電子科技有限公司",2014-03-18,,"Private, ltd by shares"807,2057257,"KOOPER WIRELESS ELECTRONICS LIMITED
酷伯無線電子有限公司",2014-03-18,2018-12-21,"Private, ltd by shares"808,2057281,"KOREA XIMEIER GROUP CO., LIMITED
韓國襲美爾集團有限公司",2014-03-18,2017-11-10,"Private, ltd by shares"809,2056889,"KOSAR INTERNATIONAL TRADING CO., LIMITED
考賽勒國際貿易有限公司",2014-03-18,2019-03-15,"Private, ltd by shares"810,2056851,"KS NETWORK CO., LIMITED
琴和實業有限公司",2014-03-18,2017-11-10,"Private, ltd by shares"811,2056819,"KUANTECH ELECTRONICS CO., LIMITED
寬德電子有限公司",2014-03-18,2019-03-15,"Private, ltd by shares"812,2057247,"L&amp;L TECHNOLOGY COMPANY LIMITED",2014-03-18,,"Private, ltd by shares"813,2057231,"L&amp;M POWER CO., LIMITED
雷曼電力有限公司",2014-03-18,,"Private, ltd by shares"814,2056266,"L'amour Dating HK Co., Limited",2014-03-18,2016-08-12,"Private, ltd by shares"815,2056840,"LA MEJOR IMPORT AND EXPORT CO., LIMITED
美浩進出口有限公司",2014-03-18,,"Private, ltd by shares"816,2057270,"LAB MADE (CHINA) LIMITED
分子雪糕(中國)有限公司",2014-03-18,2018-09-07,"Private, ltd by shares"817,2057277,"LAB MADE (NORTH POINT) LIMITED
分子雪糕(北角)有限公司",2014-03-18,2016-07-29,"Private, ltd by shares"818,2056297,"labSpaceX Limited",2014-03-18,,"Private, ltd by shares"819,2057202,"LAC CREATIVE LIMITED",2014-03-18,,"Private, ltd by shares"820,2056938,"LAFOLIE INTERNATIONAL GROUP LIMITED
老佛爺國際集團有限公司",2014-03-18,2019-12-20,"Private, ltd by shares"821,2056486,"Lai Sun QSR (Taiwan) Company Limited
麗新餐飲(台灣)有限公司",2014-03-18,,"Private, ltd by shares"822,2056558,"LAN FANG GIFTS CO., LIMITED
蘭芳禮品有限公司",2014-03-18,2019-05-10,"Private, ltd by shares"823,2056842,"Lanqing Wire Mesh Products Co., Limited
藍慶絲網製品有限公司",2014-03-18,2017-11-10,"Private, ltd by shares"824,2057113,"LAOZI INTERNATIONAL COLLEGE LIMITED
老子國際學院有限公司",2014-03-18,,"Private, ltd by shares"825,2056067,"Larix Capital Limited",2014-03-18,2014-12-24,"Private, ltd by shares"826,2056506,"LEADING JET LIMITED
御熙有限公司",2014-03-18,2017-11-10,"Private, ltd by shares"827,2056668,"LEADING PRIME LIMITED
利珀有限公司",2014-03-18,2017-11-10,"Private, ltd by shares"828,2057052,"Lengend HK International Co., Limited",2014-03-18,2016-12-02,"Private, ltd by shares"829,2057027,"LENWO HOTEL DESIGN (HK) CONSULTANT LIMITED
香港聯和酒店設計顧問有限公司",2014-03-18,,"Private, ltd by shares"830,2057096,"LEO SEA FOOD PVT LIMITED",2014-03-18,2019-03-15,"Private, ltd by shares"831,2057253,"Leopad Trading (HK) Co., Limited
立歐派德貿易有限公司",2014-03-18,,"Private, ltd by shares"832,2056084,"LESTERLIGHTING TECHNOLOGY CO., LIMITED
萊斯特光電科技有限公司",2014-03-18,,"Private, ltd by shares"833,2056060,"Lewis Technology Co., Limited
路易斯科技有限公司",2014-03-18,2015-07-10,"Private, ltd by shares"834,2056682,"LI YUAN INTERNATIONAL TRADING LIMITED
立源國際貿易有限公司",2014-03-18,,"Private, ltd by shares"835,2056789,"LIANCHUANG ELECTRONICS LIMITED
聯創電子有限公司",2014-03-18,,"Private, ltd by shares"836,2056200,"LIBANG TRADING CO., LIMITED
利邦商貿有限公司",2014-03-18,2017-11-10,"Private, ltd by shares"837,2056658,"LICPER-MSP GROUP LIMITED
利博集團有限公司",2014-03-18,2018-08-31,"Private, ltd by shares"838,2056126,"LIGHT CHAMPION LIMITED
鋒光有限公司",2014-03-18,,"Private, ltd by shares"839,2056184,"LIGHWORLD (HK) OPTOELECTRONIC TECHNOLOGIES CO., LIMITED",2014-03-18,2020-04-03,"Private, ltd by shares"840,2056349,"LINFENG INDUSTRIES LIMITED
霖峰實業有限公司",2014-03-18,,"Private, ltd by shares"841,2056154,"LINK MEGA INC LIMITED
旭航有限公司",2014-03-18,2017-11-10,"Private, ltd by shares"842,2057053,"Little Little Island Catering Limited
小小島飲食有限公司",2014-03-18,2016-08-26,"Private, ltd by shares"843,2056791,"LIU LIU SHUN (HONG KONG) INTERNATIONAL INVESTMENT MANAGEMENT GROUP LIMITED
六六順(香港)國際投資管理集團有限公司",2014-03-18,,"Private, ltd by shares"844,2056781,"LIVING STAR LIMITED
生活之星有限公司",2014-03-18,2017-06-02,"Private, ltd by shares"845,2057023,"LOK WAH TRADING COMPANY LIMITED
爍鏵貿易有限公司",2014-03-18,,"Private, ltd by shares"846,2057267,"LONG FORD INTERNATIONAL CO., LIMITED
龍福特國際有限公司",2014-03-18,,"Private, ltd by shares"847,2057380,"LONGAIN POWER LIMITED",2014-03-18,2019-02-15,"Private, ltd by shares"848,2056974,"LONGREEN TECHNOLOGY LIMITED
玖盛有限公司",2014-03-18,2017-08-25,"Private, ltd by shares"849,2056554,"Loop Global Media Limited",2014-03-18,2019-03-15,"Private, ltd by shares"850,2056913,"Lovebright Optoelectronic (HK) Limited
愛明亮光電(香港)有限公司",2014-03-18,2017-12-15,"Private, ltd by shares"851,2056298,"LOYAL MERGE HOLDINGS LIMITED
忠合集團有限公司",2014-03-18,2015-08-28,"Private, ltd by shares"852,2056738,"LSMI TECHNOLOGY CO., LIMITED
深圳市魯順銘科技有限公司",2014-03-18,2017-11-10,"Private, ltd by shares"853,2056829,"LUAN'S CULTURAL DEVELOPMENT CORPORATION LIMITED
欒氏文化發展有限公司",2014-03-18,2017-11-10,"Private, ltd by shares"854,2057205,"LUC D'ARVILLERS CHINA LIMITED",2014-03-18,2019-12-20,"Private, ltd by shares"855,2056578,"LUCKLY LOGISTICS LIMITED
興洋(香港)物流有限公司",2014-03-18,,"Private, ltd by shares"856,2056130,"LUCKY STEP LIMITED",2014-03-18,,"Private, ltd by shares"857,2056737,"LUGU RESOURCES LIMITED",2014-03-18,,"Private, ltd by shares"858,2057043,"Lumiere du Monde Limited
香港天池八德有限公司",2014-03-18,2019-03-15,"Private, ltd by shares"859,2057405,"LUNGBERG WORLDWIDE LIMITED
龍堡環球有限公司",2014-03-18,,"Private, ltd by shares"860,2056464,"LUO FEIER HOUSEHOLD ARTICLES INDUSTRIAL CO., LIMITED
洛菲爾家居實業有限公司",2014-03-18,,"Private, ltd by shares"861,2056500,"LUXE TOP LIMITED
運拓有限公司",2014-03-18,2019-03-15,"Private, ltd by shares"862,2056507,"LUXURY VANTAGE LIMITED
熙業有限公司",2014-03-18,2017-11-10,"Private, ltd by shares"863,2056186,"M&amp;E GENERAL TRADING CO., LIMITED
美熠貿易有限公司",2014-03-18,2020-10-16,"Private, ltd by shares"864,2057415,"M.Odyssey Limited",2014-03-18,,"Private, ltd by shares"865,2056020,"MACRO LEADER INVESTMENT LIMITED
君華投資有限公司",2014-03-18,2020-01-17,"Private, ltd by shares"866,2056147,"MAIDA SANITARY WARE CO., LIMITED
美達衛浴有限公司",2014-03-18,2018-07-13,"Private, ltd by shares"867,2057311,"MAIN LIFE LIMITED
夢迪萊斯有限公司",2014-03-18,,"Private, ltd by shares"868,2056175,"MAJESTIC STAR INVESTMENT (HONG KONG) LIMITED
權星投資(香港)有限公司",2014-03-18,2017-02-10,"Private, ltd by shares"869,2057244,"Make Sense (Hong Kong) Limited
明心(香港)有限公司",2014-03-18,,"Private, ltd by shares"870,2056917,"MAKKED LIMITED",2014-03-18,,"Private, ltd by shares"871,2056877,"MANNATECH (HK) INDUSTRY CO., LIMITED
馬利來(香港)實業有限公司",2014-03-18,2017-11-10,"Private, ltd by shares"872,2057040,"Marffels Tea Tech Co., Limited
瑪菲爾絲茶科技有限公司",2014-03-18,2019-04-12,"Private, ltd by shares"873,2057398,"MARSHALL ENGINEERING LIMITED (HK)
萬濠工程有限公司",2014-03-18,,"Private, ltd by shares"874,2056523,"MART INDUSTRY LIMITED
馬特實業有限公司",2014-03-18,2016-11-25,"Private, ltd by shares"875,2056300,"MASS ACCESS LIMITED",2014-03-18,2015-11-06,"Private, ltd by shares"876,2056617,"MASTER CREST GROUP LIMITED
兆田集團有限公司",2014-03-18,2019-12-20,"Private, ltd by shares"877,2056410,"MASTER GOLD WORLDWIDE LIMITED
金俊環球有限公司",2014-03-18,,"Private, ltd by shares"878,2056161,"Maurice (HongKong) Technology Company Limited
莫瑞斯(香港)科技有限公司",2014-03-18,,"Private, ltd by shares"879,2056385,"MAVERICKS LIMITED",2014-03-18,,"Private, ltd by shares"880,2056510,"MAXLAND PRIME LIMITED
盈珀有限公司",2014-03-18,,"Private, ltd by shares"881,2056712,"MAXON RICH INTERNATIONAL LIMITED
美熙國際有限公司",2014-03-18,,"Private, ltd by shares"882,2057361,"MAXRANGE INTERNATIONAL INVESTMENT LIMITED
豐越國際投資有限公司",2014-03-18,2019-11-29,"Private, ltd by shares"883,2056296,"Maxwell (HK) Industry &amp; Trade Co., Limited
高首(香港)工貿有限公司",2014-03-18,2018-08-24,"Private, ltd by shares"884,2056759,"MAYO GAI KI CO., LIMITED
美奧佳祺有限公司",2014-03-18,2019-03-15,"Private, ltd by shares"885,2056085,"Maza Solutions Limited",2014-03-18,2018-09-14,"Private, ltd by shares"886,2056958,"Media Asia TV Program Production (HK) Limited
寰亞電視節目製作(香港)有限公司",2014-03-18,,"Private, ltd by shares"887,2057041,"Mega Rich Development Group Limited
駿富發展集團有限公司",2014-03-18,2017-02-03,"Private, ltd by shares"888,2057355,"MEGAPORT INVESTMENT LIMITED
匯材投資有限公司",2014-03-18,2017-07-14,"Private, ltd by shares"889,2056482,"MEIBANG CAMEL INTERNATIONAL GROUP SHARE CO., LIMITED
美邦駱駝國際集團股份有限公司",2014-03-18,2017-11-10,"Private, ltd by shares"890,2056902,"MEIDA FASHION CO., LIMITED
美達服飾有限公司",2014-03-18,,"Private, ltd by shares"891,2056573,"MEIJUE (HONG KONG) INTERNATIONAL CULTURE COMMUNICATION CO., LIMITED
美覺(香港)國際文化傳播有限公司",2014-03-18,,"Private, ltd by shares"892,2057235,"Meiya International Daalia Biotechnology Limited
美亞國際達麗生物有限公司",2014-03-18,2019-12-20,"Private, ltd by shares"893,2056803,"MENTRUE ELECTRONIC TECHNOLOGY CO., LIMITED
銘途偉創電子科技有限公司",2014-03-18,2020-10-09,"Private, ltd by shares"894,2056099,"MERBAO HOLDINGS LIMITED
墨爾寶集團有限公司",2014-03-18,2015-03-20,"Private, ltd by shares"895,2056301,"METRO PERFECT LIMITED (d2019-02-01)",2014-03-18,2019-02-01,"Private, ltd by shares"896,2056950,"Mezzanine Capital Group Limited (The)",2014-03-18,,"Private, ltd by shares"897,2057219,"MICROMEGA TECHNOLOGIES (HONGKONG) CO., LIMITED
微眾動力科技(香港)有限公司",2014-03-18,,"Private, ltd by shares"898,2057236,"MICROWELL TECHNOLOGY HK LIMITED
眾唯科技香港有限公司",2014-03-18,,"Private, ltd by shares"899,2057357,"MILLION CREST INTERNATIONAL INVESTMENT LIMITED
譽港國際投資有限公司",2014-03-18,2019-03-22,"Private, ltd by shares"900,2057400,"MILLION DEVELOP LIMITED
萬龍拓展有限公司",2014-03-18,,"Private, ltd by shares"