,Reg no.,Name,Incorp-orated,Dissolved,Type1,2056873,"(HONG KONG) EAST BOOKCOM LIMITED
東方博康(香港)貿易有限公司",2014-03-18,2016-02-05,"Private, ltd by shares"2,2056341,"1 BELT &amp; 1 ROAD FOUNDATION LIMITED",2014-03-18,,"Private, ltd by shares"3,2056271,"1st Connect Limited (HK)",2014-03-18,2019-03-15,"Private, ltd by shares"4,2056422,"5 STAR CO., LIMITED",2014-03-18,2019-03-15,"Private, ltd by shares"5,2056955,"A plus printing &amp; packagings Co., Limited
愛普瑞斯印刷包裝有限公司",2014-03-18,,"Private, ltd by shares"6,2056709,"A&amp;G TRADE AND SERVICE CO., LIMITED
立恩商貿有限公司",2014-03-18,,"Private, ltd by shares"7,2056702,"Abmi Limited (d2017-02-24)",2014-03-18,2017-02-24,"Private, ltd by shares"8,2056032,"ABnote CardPro China (Hong Kong) Limited",2014-03-18,,"Private, ltd by shares"9,2056133,"ABYSSINIA INTERNATIONAL BUSINESS AND TRADE CO., LIMITED
賓旗國際商貿有限公司",2014-03-18,2017-11-10,"Private, ltd by shares"10,2056054,"ACCESS HUGE LIMITED",2014-03-18,2019-08-02,"Private, ltd by shares"11,2056343,"ACE EAST ASIA TRADE COMPANY LIMITED",2014-03-18,,"Private, ltd by shares"12,2056407,"Ace Pad Technology Co., Limited
愛思派科技發展有限公司",2014-03-18,2016-11-11,"Private, ltd by shares"13,2056201,"ACE SPREAD LIMITED",2014-03-18,,"Private, ltd by shares"14,2056056,"ACE WILL LIMITED",2014-03-18,,"Private, ltd by shares"15,2056563,"ADBBL LOGISTICS COMPANY LIMITED
亞設物流(香港)有限公司",2014-03-18,,"Private, ltd by shares"16,2056220,"ADMIRAL INDUSTRY CO., LIMITED
艾多米瑞實業有限公司",2014-03-18,,"Private, ltd by shares"17,2056910,"Ahead Construction Limited
駿越工程有限公司",2014-03-18,,"Private, ltd by shares"18,2056203,"AIM SPREAD LIMITED",2014-03-18,,"Private, ltd by shares"19,2056208,"AIWELL TEK (HK) LIMITED
香港榮寶電子科技有限公司",2014-03-18,2016-11-11,"Private, ltd by shares"20,2056165,"AL-BAYAN TRADING COMPANY LIMITED
北洋貿易有限公司",2014-03-18,,"Private, ltd by shares"21,2057146,"ALBATRON INTERNATIONAL CULTURE COMMUNICATION CO., LIMITED
青雲國際文化傳播有限公司",2014-03-18,2019-03-15,"Private, ltd by shares"22,2056373,"All Best Arts And Crafts Decoration Limited",2014-03-18,,"Private, ltd by shares"23,2057387,"All Profit (Asia) Trading Limited
全利(亞洲)貿易有限公司",2014-03-18,,"Private, ltd by shares"24,2056832,"ALL-BEST ELECTRONIC TECHNOLOGY CO., LIMITED
時佳電子科技有限公司",2014-03-18,2018-08-10,"Private, ltd by shares"25,2056961,"ALLIANCE TELECOMMUNICATIONS LIMITED",2014-03-18,,"Private, ltd by shares"26,2056059,"ALLIED JUMBO LIMITED",2014-03-18,,"Private, ltd by shares"27,2056258,"ALLYBEST CO., LIMITED",2014-03-18,2018-03-02,"Private, ltd by shares"28,2056891,"ALNAKHEEL TRADING CO., LIMITED",2014-03-18,2017-11-10,"Private, ltd by shares"29,2056813,"ALOMRAN TRADING CO., LIMITED",2014-03-18,2017-11-10,"Private, ltd by shares"30,2057335,"ALSOS REAL ESTATE ADVISORS LIMITED",2014-03-18,,"Private, ltd by shares"31,2056093,"Alva Business Limited",2014-03-18,2020-11-06,"Private, ltd by shares"32,2056205,"ALWANZOO LIMITED",2014-03-18,2018-10-19,"Private, ltd by shares"33,2057414,"AMark Media Solution Limited
卓能媒體有限公司",2014-03-18,2019-03-22,"Private, ltd by shares"34,2057367,"AMB INTERNATIONAL FREIGHT FORWARDER LIMITED
中進國際貨運代理有限公司",2014-03-18,2017-11-10,"Private, ltd by shares"35,2057373,"AMEGA FORTUNE INTERNATIONAL LIMITED
顥材國際有限公司",2014-03-18,,"Private, ltd by shares"36,2056002,"AMFORD INTERNATIONAL LIMITED
安聯國際有限公司",2014-03-18,2019-11-15,"Private, ltd by shares"37,2056173,"Amidas Hong Kong Limited",2014-03-18,,"Private, ltd by shares"38,2057285,"Amigos Group Limited
艾迪仕實業有限公司",2014-03-18,,"Private, ltd by shares"39,2056004,"AMPLE UNITED INVESTMENT LIMITED
進聯投資有限公司",2014-03-18,,"Private, ltd by shares"40,2056856,"Anco Medical Device Limited
安科醫療器械有限公司",2014-03-18,2016-05-20,"Private, ltd by shares"41,2056361,"Angel 1010 Investment Limited
中盟實業發展有限公司",2014-03-18,2019-11-15,"Private, ltd by shares"42,2056071,"Angel Gems (HK) Limited",2014-03-18,,"Private, ltd by shares"43,2057347,"ANGELSTAR LIMITED (HK)",2014-03-18,2018-06-22,"Private, ltd by shares"44,2056115,"ANIAPRO INDUSTRY AND TRADING CO., LIMITED
愛尼亞工貿有限公司",2014-03-18,,"Private, ltd by shares"45,2056635,"ANIMOTION LIMITED (HK)",2014-03-18,2017-06-23,"Private, ltd by shares"46,2056351,"ANKALA TRADING LIMITED
安卡拉貿易有限公司",2014-03-18,2020-07-03,"Private, ltd by shares"47,2057081,"Ankom Limited",2014-03-18,2019-01-18,"Private, ltd by shares"48,2056918,"ANTEA CHINA FINANCIAL GROUP CO., LIMITED
中國安泰金融集團有限公司",2014-03-18,,"Private, ltd by shares"49,2056731,"AOKE INTERNATIONAL CO., LIMITED
奧客國際有限公司",2014-03-18,,"Private, ltd by shares"50,2056923,"APT TECH (HONGKONG) LIMITED
來恩科技(香港)有限公司",2014-03-18,,"Private, ltd by shares"51,2057167,"AQUARIUS ELECTRONIC INDUSTRY LIMITED",2014-03-18,,"Private, ltd by shares"52,2057287,"Arrowleaf Search Limited
薦業人仕顧問有限公司",2014-03-18,,"Private, ltd by shares"53,2056207,"ART GREEN LIMITED",2014-03-18,,"Private, ltd by shares"54,2056061,"ARTWORK LIMITED (d2017-05-05)",2014-03-18,2017-05-05,"Private, ltd by shares"55,2056968,"AS Lean Limited",2014-03-18,2017-11-10,"Private, ltd by shares"56,2057220,"ASANA ASIA LIMITED",2014-03-18,2017-11-10,"Private, ltd by shares"57,2056369,"ASIA COMMERCIAL ENTERPRISE CO. LIMITED
南洋實業海外有限公司",2014-03-18,2017-01-27,"Private, ltd by shares"58,2056140,"ASIA METRO INC LIMITED
巨卓有限公司",2014-03-18,2019-12-20,"Private, ltd by shares"59,2056951,"ASIA STATE TRADING DEVELOP LIMITED
邦亞貿易拓展有限公司",2014-03-18,2015-10-30,"Private, ltd by shares"60,2056110,"Asia Wooden Co. Limited
環亞木業有限公司",2014-03-18,2019-03-15,"Private, ltd by shares"61,2056624,"ASTRA GLOBAL CORPORATION LIMITED",2014-03-18,2019-03-15,"Private, ltd by shares"62,2056404,"ATILES LIMITED
亞太建材有限公司",2014-03-18,,"Private, ltd by shares"63,2056502,"Auforon International Co., Limited
天邦國際(上海)有限公司",2014-03-18,2019-03-15,"Private, ltd by shares"64,2056999,"Augeo Strategies Company Limited",2014-03-18,2016-03-11,"Private, ltd by shares"65,2056830,"AUGS PRECISION CERAMICS CO., LIMITED
奧格斯精密陶瓷有限公司",2014-03-18,2016-12-02,"Private, ltd by shares"66,2056657,"AURAM UNIVERSAL LIMITED",2014-03-18,,"Private, ltd by shares"67,2056229,"Autosafe Technology Co., Limited",2014-03-18,,"Private, ltd by shares"68,2057180,"AUTOVISTA INTERNATIONAL LIMITED",2014-03-18,,"Private, ltd by shares"69,2057423,"AVANTGARDE HK LIMITED",2014-03-18,2019-09-06,"Private, ltd by shares"70,2057289,"AVIC Joy Air (HK) Group Limited
中航幸福航空(香港)集團有限公司",2014-03-18,,"Private, ltd by shares"71,2057292,"AW JINLONG TRADING CO., LIMITED",2014-03-18,2017-11-10,"Private, ltd by shares"72,2056446,"AYAA CO ., LIMITED",2014-03-18,,"Private, ltd by shares"73,2056483,"AYSPING INTERNATIONAL TRADE CO., LIMITED",2014-03-18,,"Private, ltd by shares"74,2056742,"AYY INTERNATIONAL TRADING CO., LIMITED
恩崴崴國際貿易有限公司",2014-03-18,2017-11-10,"Private, ltd by shares"75,2056295,"B MILAN LIMITED",2014-03-18,,"Private, ltd by shares"76,2056569,"B&amp;F INTERNATIONAL LIMITED (d2019-06-14)
友朋國際有限公司",2014-03-18,2019-06-14,"Private, ltd by shares"77,2056914,"BABYFACE COMPANY LIMITED
娃娃美顏有限公司",2014-03-18,,"Private, ltd by shares"78,2057170,"BAI JI TANG PHARMACEUTICAL COMPANY LIMITED
百濟堂(香港)醫藥有限公司",2014-03-18,,"Private, ltd by shares"79,2056337,"BAIFU INTERNATIONAL TRADING LIMITED
柏富國際貿易有限公司",2014-03-18,2019-02-15,"Private, ltd by shares"80,2057101,"BAIYOUDA INDUSTRY LIMITED
百優達實業有限公司",2014-03-18,2018-05-18,"Private, ltd by shares"81,2056479,"Balaji International Import And Export Co., Limited",2014-03-18,,"Private, ltd by shares"82,2057252,"BALGUERIE HONG KONG LIMITED",2014-03-18,,"Private, ltd by shares"83,2056946,"BAOLIHUA INT'L GROUP LIMITED
保利華國際集團有限公司",2014-03-18,2019-03-15,"Private, ltd by shares"84,2056937,"BAOLIHUA INT'L HOLDING LIMITED
保利華國際控股有限公司",2014-03-18,2017-11-10,"Private, ltd by shares"85,2057218,"BAOSHIYUAN DRESS (HONGKONG) LIMITED
寶石源服飾(香港)有限公司",2014-03-18,2017-11-10,"Private, ltd by shares"86,2057352,"BAOTON ENTERPRISE LISTED AND SECURITIES DEVELOPMENT LIMITED
寶通企業上市證券發展有限公司",2014-03-18,2019-12-20,"Private, ltd by shares"87,2057149,"BAOTON GLOBAL ASSET MANAGEMENT GROUP LIMITED
寶通環球資產管理集團有限公司",2014-03-18,,"Private, ltd by shares"88,2056113,"BARTON INC LIMITED
巴登有限公司",2014-03-18,,"Private, ltd by shares"89,2057039,"Basic Venture Limited (d2019-02-15)",2014-03-18,2019-02-15,"Private, ltd by shares"90,2056847,"BBL PHOTOELECTRIC TECHNOLOGY LIMITED
澤鑫光電科技有限公司",2014-03-18,2015-07-24,"Private, ltd by shares"91,2057385,"Be Unique Design and Production Limited",2014-03-18,,"Private, ltd by shares"92,2056064,"BEAUHOME LIMITED",2014-03-18,,"Private, ltd by shares"93,2056310,"BEAUTY INFINITE LIMITED",2014-03-18,,"Private, ltd by shares"94,2056457,"Beautylight International Co., Limited
美萊美國際有限公司",2014-03-18,2018-12-21,"Private, ltd by shares"95,2057029,"BEEKING HONGKONG LIMITED
貝金香港有限公司",2014-03-18,2016-07-15,"Private, ltd by shares"96,2056571,"BEIJING EAST IVY (HONG KONG) LIMITED
北京東方愛維(香港)有限公司",2014-03-18,2020-11-13,"Private, ltd by shares"97,2057408,"BEIJING HOME CUISINES LIMITED
北京老家飲食有限公司",2014-03-18,,"Private, ltd by shares"98,2056559,"BEIJING TEXWARM CO., LIMITED
北京特斯沃姆有限公司",2014-03-18,,"Private, ltd by shares"99,2057181,"BEST DESIGN (HK) CONSULTANTS LIMITED
貝思特(香港)設計顧問有限公司",2014-03-18,,"Private, ltd by shares"100,2057299,"BEST WEALTH HOLDING CO., LIMITED
康裕控股有限公司",2014-03-18,2015-07-31,"Private, ltd by shares"101,2057177,"Bestkid Children's Physical Training (Shanghai) Co., Limited
優兒健兒童體能訓練(上海)有限公司",2014-03-18,,"Private, ltd by shares"102,2056548,"BESTURN INTERNATIONAL LIMITED",2014-03-18,2017-11-10,"Private, ltd by shares"103,2056850,"Bestway Trading &amp; Logistics Company Limited
佰佳貿易物流有限公司",2014-03-18,2017-10-20,"Private, ltd by shares"104,2057164,"BESTWOOD INTERNATIONAL ENTERPRISE LIMITED",2014-03-18,,"Private, ltd by shares"105,2057121,"BESYBUY LIMITED
思嘉貿易有限公司",2014-03-18,2016-04-08,"Private, ltd by shares"106,2057332,"BETTER GUARD LIMITED
香港佰特佳有限公司",2014-03-18,,"Private, ltd by shares"107,2056904,"BETTER INTERNATIONAL INDUSTRIAL CO., LIMITED
佰特國際實業有限公司",2014-03-18,2020-03-27,"Private, ltd by shares"108,2056934,"BGA Investment &amp; Immigration Consultancy Limited
卓越環球投資移民顧問有限公司",2014-03-18,2015-01-30,"Private, ltd by shares"109,2057003,"BIG STEP YINDU LIMITED",2014-03-18,2019-03-15,"Private, ltd by shares"110,2056062,"BIG TRADER LIMITED (HK)",2014-03-18,,"Private, ltd by shares"111,2056213,"BILLION AMPLE LIMITED",2014-03-18,,"Private, ltd by shares"112,2056005,"BILLION POINTER LIMITED
億瑪有限公司",2014-03-18,,"Private, ltd by shares"113,2056079,"BINDITEK (HONGKONG) CO., LIMITED",2014-03-18,2019-10-11,"Private, ltd by shares"114,2057179,"BJM TECHNOLOGY (HK) LIMITED",2014-03-18,,"Private, ltd by shares"115,2056425,"BLACKSTONE GROUP (HK) INVESTMENT LIMITED (THE)
香港黑石投資集團有限公司",2014-03-18,,"Private, ltd by shares"116,2056088,"BLAH 226 LIMITED",2014-03-18,,"Private, ltd by shares"117,2056595,"Bloom Trading Co., Limited
晟源貿易有限公司",2014-03-18,2018-11-02,"Private, ltd by shares"118,2056455,"BLOSSOM LEAD LIMITED
輝鼎有限公司",2014-03-18,,"Private, ltd by shares"119,2056102,"BlueFish Services Limited
藍魚服務有限公司",2014-03-18,,"Private, ltd by shares"120,2056462,"BLUEWAY FINE LIMITED
藍偉有限公司",2014-03-18,,"Private, ltd by shares"121,2057166,"Boranta (HK) Technology Limited
博蘭泰(香港)科技有限公司",2014-03-18,,"Private, ltd by shares"122,2056388,"BORN TO BE LIMITED",2014-03-18,2016-10-28,"Private, ltd by shares"123,2057286,"BORUN TRADE IMPORT &amp; EXPORT CO., LIMITED
博潤貿易進出口有限公司",2014-03-18,2017-09-01,"Private, ltd by shares"124,2057045,"BOSHI GROUP DRESS LIMITED
波士集團服飾有限公司",2014-03-18,2017-11-10,"Private, ltd by shares"125,2057328,"BOSUN (HONG KONG) INTERNATIONAL GROUP CO., LIMITED
博誠(香港)國際集團有限公司",2014-03-18,,"Private, ltd by shares"126,2057009,"Bouddy Technology Co., Limited
深圳市博迪科技有限公司",2014-03-18,,"Private, ltd by shares"127,2056293,"BRADFORD INTERNATIONAL LIMITED (d2015-05-15)
百福特國際有限公司",2014-03-18,2015-05-15,"Private, ltd by shares"128,2056324,"BRADFORD INVESTMENT LIMITED
百福特投資有限公司",2014-03-18,2015-04-02,"Private, ltd by shares"129,2057200,"BRAND ONILNE MANAGEMENT LIMITED
品牌在線管理有限公司",2014-03-18,,"Private, ltd by shares"130,2056347,"BRANTFORD (HONG KONG) LIMITED
班佛(香港)有限公司",2014-03-18,,"Private, ltd by shares"131,2056365,"BRANTFORD HOLDING LIMITED
班佛集團有限公司",2014-03-18,,"Private, ltd by shares"132,2056376,"BRANTFORD INVESTMENT LIMITED
班佛投資有限公司",2014-03-18,,"Private, ltd by shares"133,2056469,"BRAVE THRONE LIMITED
拓堅有限公司",2014-03-18,,"Private, ltd by shares"134,2056599,"BRAVO LEAD LIMITED
越思有限公司",2014-03-18,2019-03-15,"Private, ltd by shares"135,2057426,"BRIGHT LEAD ENTERPRISES LIMITED
輝導有限公司",2014-03-18,,"Private, ltd by shares"136,2056584,"BRIGHT PACKAGE LIMITED
金洋包裝製品有限公司",2014-03-18,2017-04-13,"Private, ltd by shares"137,2056930,"BRIGHT RAY GLOBAL LIMITED
光利環球有限公司",2014-03-18,2017-11-10,"Private, ltd by shares"138,2056676,"BRIGHT SOLUTIONS INTERNATIONAL COMPANY LIMITED
晉暉國際有限公司",2014-03-18,,"Private, ltd by shares"139,2056316,"BRILLIANT SPRING ASIA LIMITED
明陞亞洲有限公司",2014-03-18,2019-08-23,"Private, ltd by shares"140,2056080,"BRILLIANT VIEW INVESTMENT LIMITED
卓見投資有限公司",2014-03-18,,"Private, ltd by shares"141,2057122,"BRITISH TEXTILE (HONG KONG) COMPANY LIMITED
英倫洋服(香港)有限公司",2014-03-18,,"Private, ltd by shares"142,2056740,"BRIVER OPTOELECTRONICS TECHNOLOGY CO., LIMITED
永熠光電科技有限公司",2014-03-18,,"Private, ltd by shares"143,2056353,"BROCADE (HK) LIMITED
寶奇(香港)有限公司",2014-03-18,,"Private, ltd by shares"144,2056395,"BROOKWOOD (HONG KONG) LIMITED
品惠(香港)有限公司",2014-03-18,,"Private, ltd by shares"145,2056423,"BROOKWOOD HOLDING LIMITED
品惠集團有限公司",2014-03-18,,"Private, ltd by shares"146,2056433,"BROOKWOOD INTERNATIONAL LIMITED (HK)
品惠國際有限公司",2014-03-18,,"Private, ltd by shares"147,2056445,"BROOKWOOD INVESTMENT LIMITED
品惠投資有限公司",2014-03-18,,"Private, ltd by shares"148,2056929,"BROTHER TOYS TRADE CO., LIMITED
兄弟玩具貿易有限公司",2014-03-18,,"Private, ltd by shares"149,2057080,"BSMH HONG KONG LIMITED
背山面海有限公司",2014-03-18,,"Private, ltd by shares"150,2056235,"Bsxter Trading Co., Limited
佰特貿易有限公司",2014-03-18,2017-11-10,"Private, ltd by shares"151,2056219,"C&amp;D TECHNOLOGY LIMITED
中南科技有限公司",2014-03-18,,"Private, ltd by shares"152,2056591,"C&amp;H FOREVER INDUSTRY CO., LIMITED",2014-03-18,,"Private, ltd by shares"153,2057312,"C-Touch Technology Co., Limited",2014-03-18,2016-09-02,"Private, ltd by shares"154,2057187,"CADENE INTERNATIONAL LIMITED
啟典國際餐飲管理(香港)有限公司",2014-03-18,2018-12-14,"Private, ltd by shares"155,2056176,"CALCFUSION LIMITED",2014-03-18,2020-01-24,"Private, ltd by shares"156,2056517,"CALLAWAY (HONG KONG) LIMITED
金拉威(香港)有限公司",2014-03-18,,"Private, ltd by shares"157,2056561,"CALLAWAY INTERNATIONAL LIMITED
金拉威國際有限公司",2014-03-18,,"Private, ltd by shares"158,2056362,"CARE ROUTE INTERNATIONAL LIMITED
嘉路國際有限公司",2014-03-18,2020-04-17,"Private, ltd by shares"159,2056006,"CARWAY INVESTMENT LIMITED
嘉暉投資有限公司",2014-03-18,,"Private, ltd by shares"160,2056687,"CASTLE BLAZE LIMITED
堡鍵有限公司",2014-03-18,,"Private, ltd by shares"161,2056683,"CASTLE FAME LIMITED
包羅萬有有限公司",2014-03-18,,"Private, ltd by shares"162,2056713,"CASTLE LEAP LIMITED
堡特有限公司",2014-03-18,2019-12-20,"Private, ltd by shares"163,2056685,"CASTLE LEGACY LIMITED
堡新有限公司",2014-03-18,,"Private, ltd by shares"164,2056753,"CASTLE TREASURE LIMITED (d2017-02-10)
堡菱有限公司",2014-03-18,2017-02-10,"Private, ltd by shares"165,2056766,"Cedar Tree Healthcare &amp; Medical Advisors Limited
柏康體檢及醫務顧問有限公司",2014-03-18,,"Private, ltd by shares"166,2056632,"CENTA PRAISE GROUP LIMITED
中勝集團有限公司",2014-03-18,,"Private, ltd by shares"167,2056607,"CENTER LEAD CONSULTANTS LIMITED
中亞顧問有限公司",2014-03-18,,"Private, ltd by shares"168,2056114,"CENTER POINT CORPORATION LIMITED
禮中有限公司",2014-03-18,2017-11-10,"Private, ltd by shares"169,2057420,"Centitech (Hong Kong) Limited",2014-03-18,,"Private, ltd by shares"170,2056667,"CENTRAL TONE LIMITED
正月有限公司",2014-03-18,2017-11-10,"Private, ltd by shares"171,2056442,"CENTRY MOISTEN GROUP LIMITED
和潤世貿集團有限公司",2014-03-18,2019-03-15,"Private, ltd by shares"172,2056011,"CENTURY EFFORT LIMITED
世倡有限公司",2014-03-18,,"Private, ltd by shares"173,2056008,"CENTURY TRENDY LIMITED
溢時有限公司",2014-03-18,,"Private, ltd by shares"174,2056697,"CERTAIN CHARM LIMITED
瑞藝有限公司",2014-03-18,2019-03-15,"Private, ltd by shares"175,2056600,"CERTAIN MAX LIMITED
瑞美有限公司",2014-03-18,2019-03-15,"Private, ltd by shares"176,2056222,"CHAMPION MAX LIMITED",2014-03-18,,"Private, ltd by shares"177,2056953,"CHAMPION-FU GROUP LIMITED",2014-03-18,,"Private, ltd by shares"178,2056066,"CHANCE PROGRESS LIMITED",2014-03-18,,"Private, ltd by shares"179,2056896,"CHANGHUNG TECHNOLOGY CO., LIMITED
長恒科技有限公司",2014-03-18,,"Private, ltd by shares"180,2056633,"Changshu Top-long Imp.&amp;Exp. Co., Limited",2014-03-18,2017-06-02,"Private, ltd by shares"181,2056357,"CHANGWANG TRADING (HK) LIMITED
昌旺貿易 (香港) 有限公司",2014-03-18,,"Private, ltd by shares"182,2056976,"CHAOZHOU GENERAL SANITARY WARE LIMITED
潮州市大將軍衛浴有限公司",2014-03-18,2017-11-10,"Private, ltd by shares"183,2056378,"CHARIOT TROIKA TECHNOLOGY LIMITED
駿生科技有限公司",2014-03-18,2019-10-25,"Private, ltd by shares"184,2056750,"CHARLENE HOUSE LIMITED",2014-03-18,2015-09-11,"Private, ltd by shares"185,2056308,"CHAUSSETTE LIMITED
娃娃襪有限公司",2014-03-18,,"Private, ltd by shares"186,2056323,"Chechi Tianxia (Hong Kong) Industry Co., Limited
車馳天下(香港)實業有限公司",2014-03-18,2017-11-10,"Private, ltd by shares"187,2056470,"CHEER COAST LIMITED
輝好有限公司",2014-03-18,,"Private, ltd by shares"188,2057389,"CHEN LIN JIN RONG LIMITED
陳林金融有限公司",2014-03-18,,"Private, ltd by shares"189,2056535,"CHENG FENG YONG SHENG PLASTIC&amp;METAL CO., LIMITED
承峰永升塑膠五金有限公司",2014-03-18,2020-04-09,"Private, ltd by shares"190,2056989,"CHENG SHUANG (HK) TRADING LIMITED
成雙(香港)貿易有限公司",2014-03-18,,"Private, ltd by shares"191,2057383,"CHERISH HOPE LIMITED",2014-03-18,,"Private, ltd by shares"192,2056785,"CHI Sport Limited
智欖亞洲體育文化有限公司",2014-03-18,,"Private, ltd by shares"193,2057317,"China 4Fabs Technologies Limited",2014-03-18,,"Private, ltd by shares"194,2057334,"CHINA AGRI-PRODUCTS (ZIBO) LIMITED
中國農產品(淄博)有限公司",2014-03-18,,"Private, ltd by shares"195,2057348,"China Assistance &amp; Security Group Limited
中國救援保障集團有限公司",2014-03-18,,"Private, ltd by shares"196,2057262,"CHINA BIG ART HOLDING GROUP CO., LIMITED
中國大藝術控股集團有限公司",2014-03-18,,"Private, ltd by shares"197,2056416,"CHINA CAISHEN CULTURE ACADEMY LIMITED
中華財神文化學院有限公司",2014-03-18,,"Private, ltd by shares"198,2056251,"CHINA CAISHENG CULTURE EXCHANGE ASSOCIATION LIMITED
中國財神文化交流協會有限公司",2014-03-18,2017-11-10,"Private, ltd by shares"199,2056821,"CHINA CLAN ECONOMY RESEARCH INSTITUTE CO., LIMITED
中國家族經濟研究院有限公司",2014-03-18,,"Private, ltd by shares"200,2056264,"CHINA CLOCKS &amp; WATCHES HOLDING LIMITED
中國鐘錶交易所股份有限公司",2014-03-18,2017-11-10,"Private, ltd by shares"201,2057256,"China Credit Rating Co., Limited (d2017-11-10)
中國信用評級中心有限公司",2014-03-18,2017-11-10,"Private, ltd by shares"202,2056780,"CHINA CULTURE INDUSTRY INVESTMENT SHARE CO., LIMITED
中國文化產業投資股份有限公司",2014-03-18,,"Private, ltd by shares"203,2057026,"China Energy (Anhui) Limited
中華能源(安徽)有限公司",2014-03-18,,"Private, ltd by shares"204,2057279,"China Energy (Enterprise) Limited
中華能源(實業)有限公司",2014-03-18,,"Private, ltd by shares"205,2057047,"China Energy (Jiang Han) Limited
中華能源(江漢)有限公司",2014-03-18,2016-10-28,"Private, ltd by shares"206,2057258,"China Energy (Yellow River) Limited
中華能源(黃河)有限公司",2014-03-18,2016-10-28,"Private, ltd by shares"207,2057280,"CHINA ETERNITY INVESTMENTS LIMITED
中久投資有限公司",2014-03-18,,"Private, ltd by shares"208,2056228,"CHINA FAMOUS CORPORATION LIMITED",2014-03-18,,"Private, ltd by shares"209,2057268,"CHINA FENGCAI GROUP CO., LIMITED
中華風采集團有限公司",2014-03-18,,"Private, ltd by shares"210,2056970,"China Fengshui Architecture Planning and Design Institute Limited
中國建築風水規劃設計研究院有限公司",2014-03-18,,"Private, ltd by shares"211,2056111,"China Great Wall Investment Group Asia Co., Limited
中國長城投資集團亞洲有限公司",2014-03-18,,"Private, ltd by shares"212,2056945,"CHINA HEALTH INDUSTRIAL INVESTMENT MANAGEMENT LIMITED
中國健康產業投資管理有限公司",2014-03-18,2017-11-10,"Private, ltd by shares"213,2057351,"CHINA HUATAI INVESTMENT TRADE CO., LIMITED
中國華泰投資貿易有限公司",2014-03-18,,"Private, ltd by shares"214,2056997,"CHINA INTERNATIONAL YI SHANG ALLIANCE CO., LIMITED
中國國際藝商聯盟有限公司",2014-03-18,,"Private, ltd by shares"215,2057265,"CHINA MEDICAL CELL VALLEY GROUP LIMITED
中國醫學細胞谷集團有限公司",2014-03-18,2015-07-17,"Private, ltd by shares"216,2056142,"CHINA MEI DI STAR CO., LIMITED
中國美的之星有限公司",2014-03-18,,"Private, ltd by shares"217,2056257,"CHINA NEW CHANCE TRADING CO., LIMITED
新中國長賽貿易有限公司",2014-03-18,2017-11-10,"Private, ltd by shares"218,2056370,"China New Town Holding Company Limited
中國新城鎮控股有限公司",2014-03-18,,"Private, ltd by shares"219,2057155,"CHINA NONFERROUS METALS GROUP HOLDING LIMITED
中國有色金屬集團股份有限公司",2014-03-18,2016-12-02,"Private, ltd by shares"220,2057346,"China People's Livelihood Sos Group Limited
中國民生救援集團有限公司",2014-03-18,,"Private, ltd by shares"221,2057077,"China Pulse Media Group Limited
中國華脈傳媒集團有限公司",2014-03-18,2019-09-06,"Private, ltd by shares"222,2056526,"CHINA QINGHUA GOLD ELEVEN INVESTMENT HOLDINGS LIMITED
中國清華金十一投資控股有限公司",2014-03-18,2015-04-17,"Private, ltd by shares"223,2057174,"China Redforest Holding Group Limited",2014-03-18,2017-11-10,"Private, ltd by shares"224,2056346,"CHINA SHENCHUANG BIOLOGICAL INDUSTRY GROUP CO., LIMITED
中國神創生物實業集團有限公司",2014-03-18,,"Private, ltd by shares"225,2056314,"CHINA SILVER INDUSTRIAL DEVELOPMENT MANAGEMENT LIMITED
中國老年產業發展管理有限公司",2014-03-18,2017-11-10,"Private, ltd by shares"226,2057337,"CHINA SKY DREAM FOR IMPORT AND EXPORT TRADING CO., LIMITED
浙江圓夢進出口有限公司",2014-03-18,2019-06-28,"Private, ltd by shares"227,2057350,"China Social Security &amp; Assistance Group Limited
中國社保救援集團有限公司",2014-03-18,,"Private, ltd by shares"228,2057266,"China Venture Capital Alliance Group Limited
中國創業投資聯盟集團有限公司",2014-03-18,2017-11-10,"Private, ltd by shares"229,2056597,"CHINA WATER QUALITY AND HEALTHY RESEAECH CENTER LIMITED
中國水質與健康研究中心有限公司",2014-03-18,2016-11-11,"Private, ltd by shares"230,2056461,"CHINA YONG WEI GROUP CO., LIMITED
中國湧緯集團有限公司",2014-03-18,,"Private, ltd by shares"231,2056882,"CHINATOWN ENTERPRISE LIMITED
邦博實業有限公司",2014-03-18,2019-09-13,"Private, ltd by shares"232,2057128,"CHINESE CULTURE AND ART DEVELOPMENT GROUP LIMITED
中華文化藝術發展集團有限公司",2014-03-18,2019-03-15,"Private, ltd by shares"233,2056692,"CHINESE SHANDAO MERCY ASSOCIATION LIMITED
中華善道慈愛協會有限公司",2014-03-18,2017-11-10,"Private, ltd by shares"234,2056246,"Chinese ShuShu I Ching Scientific Research Limited (b2014-03-18)
中國數術易經科學研究院有限公司",2014-03-18,,"Private, ltd by shares"235,2056139,"CHUN FUNG ELECTRONICS INDUSTRIAL LIMITED
駿豐電子實業有限公司",2014-03-18,2018-08-10,"Private, ltd by shares"