,Reg no.,Name,Incorp-orated,Dissolved,Type470,2056412,"GT PROSPER INDUSTRY CO., LIMITED",2014-03-18,,"Private, ltd by shares"471,2056429,"GUANGDONG BOMINUO CERAMIC LIMITED
廣東波米諾陶瓷有限公司",2014-03-18,2019-12-20,"Private, ltd by shares"472,2056342,"GUANGDONG FOSHAN DESITE CERAMIC LIMITED
廣東佛山德思特陶瓷有限公司",2014-03-18,2019-12-20,"Private, ltd by shares"473,2056185,"GUANGDONG FOSHAN HESHI CERAMICS INDUSTRIAL LIMITED
廣東佛山賀氏瓷業有限公司",2014-03-18,2019-12-20,"Private, ltd by shares"474,2057224,"GUANGDONG FOSHAN JINDEYI CERAMIC LIMITED
廣東佛山金德易陶瓷有限公司",2014-03-18,2017-11-10,"Private, ltd by shares"475,2056706,"GUANGDONG FOSHAN JUNSHENG POTTERY AND PORCELAIN LIMITED
廣東佛山軍勝陶瓷有限公司",2014-03-18,2019-12-20,"Private, ltd by shares"476,2056174,"GUANGDONG FOSHAN XILA SHENHUA CERAMICS LIMITED
廣東佛山西腊神畫陶瓷有限公司",2014-03-18,2019-12-20,"Private, ltd by shares"477,2056309,"GUANGHONG INDUSTRIES LIMITED
廣鴻實業有限公司",2014-03-18,,"Private, ltd by shares"478,2057358,"GUANGMING BUSINESS LIMITED
廣銘商貿有限公司",2014-03-18,,"Private, ltd by shares"479,2057157,"GUANGYULONG LIGHTING (HONGKONG) CO., LIMITED
香港廣裕隆照明有限公司",2014-03-18,2020-10-30,"Private, ltd by shares"480,2057327,"GUANGZHOU JIEDENG GEEZER SHOES LIMITED
廣州捷登老頭鞋業有限公司",2014-03-18,2017-11-10,"Private, ltd by shares"481,2056576,"Guangzhou Kevin Fashion Industry Co., Limited
廣州凱文時尚實業有限公司",2014-03-18,,"Private, ltd by shares"482,2057130,"GUIHONG INDUSTRY HONG KONG COMPANY LIMITED
貴紅實業香港有限公司",2014-03-18,2019-03-15,"Private, ltd by shares"483,2056319,"GUIXIN CO., LIMITED
貴新有限公司",2014-03-18,2015-01-09,"Private, ltd by shares"484,2056582,"GUN CHENG FURNITURE INTERNATIONAL CO., LIMITED",2014-03-18,,"Private, ltd by shares"485,2056135,"GUTSY STUDIO LIMITED
有種掣作有限公司",2014-03-18,,"Private, ltd by shares"486,2056736,"GUXIANDAO INDUSTRIAL FIBRE CO., LIMITED",2014-03-18,2018-01-12,"Private, ltd by shares"487,2056871,"GWCASE CO., LIMITED",2014-03-18,,"Private, ltd by shares"488,2056985,"H &amp; D Engineering Limited",2014-03-18,2019-03-15,"Private, ltd by shares"489,2057362,"H.K. XIANGLETAI TECHNOLOGY LIMITED
香港祥樂泰科技有限公司",2014-03-18,2017-11-10,"Private, ltd by shares"490,2057165,"H.O.M.E. (Asia Pacific) Limited
醫優有限公司",2014-03-18,,"Private, ltd by shares"491,2056389,"HAIFENG STEEL COMPANY LIMITED
海豐鋼鐵有限公司",2014-03-18,2015-09-04,"Private, ltd by shares"492,2057227,"HAIMO (HK) INDUSTRY CO., LIMITED
海模(香港)實業有限公司",2014-03-18,2019-03-22,"Private, ltd by shares"493,2056645,"HALOU TRADE LIMITED
哈嘍貿易有限公司",2014-03-18,2017-11-10,"Private, ltd by shares"494,2057298,"Hancheng Technologies (International) Company Limited
瀚鋮科技(國際)有限公司",2014-03-18,,"Private, ltd by shares"495,2057137,"Hanlite (Hong Kong) Limited
漢光(香港)有限公司",2014-03-18,,"Private, ltd by shares"496,2056386,"HANXUN TECHNOLOGY (HK) CO., LIMITED
瀚訊科技(香港)有限公司",2014-03-18,,"Private, ltd by shares"497,2056939,"HAOSUN TRADING LIMITED
昊昌貿易有限公司",2014-03-18,,"Private, ltd by shares"498,2056254,"HAOYIJIA INDUSTRY CO., LIMITED
豪億嘉實業有限公司",2014-03-18,2018-11-09,"Private, ltd by shares"499,2056354,"HAOYUN INDUSTRIES LIMITED
浩運實業有限公司",2014-03-18,,"Private, ltd by shares"500,2056094,"HAPPY TREASURE CORPORATION LIMITED (d2015-11-27)",2014-03-18,2015-11-27,"Private, ltd by shares"501,2056123,"HARVEST FIELD INC LIMITED
丰禾有限公司",2014-03-18,,"Private, ltd by shares"502,2056799,"HC COSMETICS TRADE LIMITED
煥彩化妝品貿易有限公司",2014-03-18,2017-01-06,"Private, ltd by shares"503,2057135,"HCW INDUSTRIAL COMPANY LIMITED
田易實業有限公司",2014-03-18,2015-07-10,"Private, ltd by shares"504,2056516,"HD Service Electronics Pty Limited",2014-03-18,2019-12-20,"Private, ltd by shares"505,2056839,"HEAD MASTER INTERNATIONAL LIMITED
首專國際有限公司",2014-03-18,2019-03-15,"Private, ltd by shares"506,2056671,"HEALTH-LEE INT'L TRADE LIMITED
海爾希國際貿易有限公司",2014-03-18,,"Private, ltd by shares"507,2056355,"HEART&amp;ARROW JEWELLERY WATCH HK CO., LIMITED
八心八箭珠寶鐘錶香港有限公司",2014-03-18,,"Private, ltd by shares"508,2056820,"HEBEI FUTURE INDUSTRIAL LIMITED
河北乾誠實業有限公司",2014-03-18,2019-02-15,"Private, ltd by shares"509,2056885,"Hebei ZiJin Import And Export Co., Limited
河北紫金進出口有限公司",2014-03-18,2017-11-10,"Private, ltd by shares"510,2056223,"HEJIN CHEMICAL INDUSTRIES LIMITED
合晉化工有限公司",2014-03-18,2015-09-04,"Private, ltd by shares"511,2056286,"HENGLU CO., LIMITED
恒祿有限公司",2014-03-18,2015-01-09,"Private, ltd by shares"512,2057102,"HENGWEI INTERNATIONAL GROUP SHARE LIMITED
恒緯國際集團股份有限公司",2014-03-18,2017-11-10,"Private, ltd by shares"513,2056427,"Hengyuan Freight Agency Co., Limited
恒遠貨運代理有限公司",2014-03-18,2018-07-27,"Private, ltd by shares"514,2056344,"HERZ PHOTOGRAPHY LIMITED",2014-03-18,2018-11-02,"Private, ltd by shares"515,2056586,"HESUN TECHNOLOGY HONG KONG LIMITED
泓晟科技香港有限公司",2014-03-18,2019-03-15,"Private, ltd by shares"516,2057038,"HET INTERNATIONAL CO., LIMITED
海易通國際有限公司",2014-03-18,,"Private, ltd by shares"517,2056644,"HINZ GROUP LIMITED
敬軒集團有限公司",2014-03-18,,"Private, ltd by shares"518,2057062,"HIP YUNG INT'L DEVELOPMENT LIMITED
協榮國際發展有限公司",2014-03-18,,"Private, ltd by shares"519,2056696,"HITEC ELECTRONIC TECHNOLOGY CO., LIMITED
華圖電子科技有限公司",2014-03-18,,"Private, ltd by shares"520,2056313,"HK A TOP TRADING CO., LIMITED
香港頂尖貿易有限公司",2014-03-18,2017-11-10,"Private, ltd by shares"521,2056588,"HK ANYA INT'L LIMITED
香港安雅國際有限公司",2014-03-18,2017-11-10,"Private, ltd by shares"522,2057243,"HK AYS INTERNATIONAL COSMETICS CO., LIMITED
香港愛胭思國際化妝品有限公司",2014-03-18,,"Private, ltd by shares"523,2057192,"HK BAOHUA INTERNATIONAL ART AUCTION CO., LIMITED
香港寶華國際藝術品拍賣有限公司",2014-03-18,2017-05-19,"Private, ltd by shares"524,2057086,"HK BOESE LIMITED
香港波希有限公司",2014-03-18,,"Private, ltd by shares"525,2056924,"HK CHENGDA INDUSTRIAL LIMITED
香港誠達實業有限公司",2014-03-18,2018-06-08,"Private, ltd by shares"526,2057140,"HK CHENGTONG ELECTRIC LIMITED
香港城通電器有限公司",2014-03-18,,"Private, ltd by shares"527,2057025,"HK CHOICE INTERNATIONAL GROUP LIMITED
香港萱澤國際集團有限公司",2014-03-18,2019-03-15,"Private, ltd by shares"528,2056270,"HK Cobber Industrial Co., Limited
香港嘉柏實業有限公司",2014-03-18,2019-03-15,"Private, ltd by shares"529,2057145,"HK DAMUZHI TRADE COMPANY LIMITED
香港大拇指貿易有限公司",2014-03-18,2019-04-12,"Private, ltd by shares"530,2056874,"HK DAY LIGHTING CO., LIMITED
香港天天照明有限公司",2014-03-18,,"Private, ltd by shares"531,2056467,"HK DEDONG PRECISION MOULD CO., LIMITED
香港德東精密模具有限公司",2014-03-18,,"Private, ltd by shares"532,2056193,"HK GLOBAL HEYDAY GROUP LIMITED
香港環球盛世集團有限公司",2014-03-18,2019-03-15,"Private, ltd by shares"533,2057075,"HK GUANGMIN INDUSTRY LIMITED
香港光明實業有限公司",2014-03-18,2019-03-08,"Private, ltd by shares"534,2056367,"HK HAIHUILIANHANG REAL ESTATE CONSULTANT LIMITED
香港海匯聯行地產顧問有限公司",2014-03-18,2019-03-15,"Private, ltd by shares"535,2056206,"HK HANTOU TRANSPORT CO., LIMITED
香港漢投運輸有限公司",2014-03-18,2019-03-15,"Private, ltd by shares"536,2056322,"HK Haotian Industrial Limited
香港皓天實業有限公司",2014-03-18,2019-12-20,"Private, ltd by shares"537,2056724,"HK HELP BRADY INT'L ARTICLES FOR USE LIMITED
香港幫貝迪國際用品有限公司",2014-03-18,2019-12-20,"Private, ltd by shares"538,2057278,"HK HENSHENG INT'L GROUP CO., LIMITED
香港恒晟國際集團有限公司",2014-03-18,,"Private, ltd by shares"539,2056524,"HK HONGYILI ATTRACT INVESTMENT OPERATION BUSINESS MANAGEMENT LIMITED
香港宏億利招運商業管理有限公司",2014-03-18,2017-11-10,"Private, ltd by shares"540,2056436,"HK HONGYU INTERNATIONAL GROUP LIMITED
香港宏宇國際集團有限公司",2014-03-18,2019-08-23,"Private, ltd by shares"541,2056101,"HK HUANSEN TRADING LIMITED
香港環森貿易有限公司",2014-03-18,2020-10-16,"Private, ltd by shares"542,2057017,"HK HUASHANG INVESTMENT GROUP CO., LIMITED
香港華商投資集團有限公司",2014-03-18,2017-11-10,"Private, ltd by shares"543,2056602,"HK HUATAI TRADING CO., LIMITED
香港華泰貿易有限公司",2014-03-18,2015-09-11,"Private, ltd by shares"544,2056716,"HK INTERNATIONAL DUTY-FREE SHOPPING CENTER COMPANY LIMITED
香港國際免稅購物中心有限公司",2014-03-18,,"Private, ltd by shares"545,2057293,"HK JIEXIN INT'L TRADE HOLDINGS LIMITED
香港捷欣國際貿易控股有限公司",2014-03-18,2019-03-22,"Private, ltd by shares"546,2056593,"HK LIDE SEEDLINGS CO., LIMITED
香港利德種苗有限公司",2014-03-18,2017-11-10,"Private, ltd by shares"547,2056730,"HK LIKASAM GROUP CO., LIMITED
香港力嘉誠集團有限公司",2014-03-18,2019-03-15,"Private, ltd by shares"548,2056522,"HK LONGYANG WORKERS GAUGE INTERNATIONAL HOLDING GROUP CO., LIMITED
香港龍陽工量具國際控股集團有限公司",2014-03-18,2017-11-10,"Private, ltd by shares"549,2057296,"HK MEIYI CAMEL (INT'L) INVESTMENT CO., LIMITED
香港美意駱駝(國際)投資有限公司",2014-03-18,2018-08-31,"Private, ltd by shares"550,2056493,"HK MITION TECH CO., LIMITED
香港美承科技有限公司",2014-03-18,,"Private, ltd by shares"551,2056420,"HK MOST GREAT TRADING CO., LIMITED
香港極致貿易有限公司",2014-03-18,2017-11-10,"Private, ltd by shares"552,2056825,"HK NEW TRIUMPH LIMITED
香港新華凱有限公司",2014-03-18,2017-11-10,"Private, ltd by shares"553,2056468,"HK OULUNBAO SPORTS GOODS CO., LIMITED
香港歐倫堡體育用品有限公司",2014-03-18,2017-11-10,"Private, ltd by shares"554,2056723,"HK OUSHI GROUP LIMITED
香港歐世集團有限公司",2014-03-18,2019-12-20,"Private, ltd by shares"555,2056890,"HK PGX CATERING MANAGEMENT LIMITED
香港平鍋秀餐飲管理有限公司",2014-03-18,2017-11-10,"Private, ltd by shares"556,2057198,"HK POLO INTERNATIONAL TRADING LIMITED
香港寶路國際貿易有限公司",2014-03-18,2019-03-22,"Private, ltd by shares"557,2056098,"HK QINHANTANG DESIGN LIMITED
香港秦漢唐設計有限公司",2014-03-18,2017-11-10,"Private, ltd by shares"558,2057282,"HK QIYING (GROUP) MATERNAL AND CHILD SUPPLIES LIMITED
香港啟嬰(集團)婦幼用品有限公司",2014-03-18,2019-03-22,"Private, ltd by shares"559,2056230,"HK RUIDI CO., LIMITED
香港瑞迪有限公司",2014-03-18,,"Private, ltd by shares"560,2057105,"HK SHENGLI INTERNATIONAL LIMITED
香港昇麗國際有限公司",2014-03-18,2017-03-03,"Private, ltd by shares"561,2056496,"HK SHEYA CO., LIMITED
香港熹雅有限公司",2014-03-18,2017-11-10,"Private, ltd by shares"562,2057057,"HK SHIMEI SHARES GROUP LIMITED
香港時美股份集團有限公司",2014-03-18,,"Private, ltd by shares"563,2056452,"HK SUNGDOT INDUSTRIAL CO., LIMITED
香港森拓實業有限公司",2014-03-18,,"Private, ltd by shares"564,2056375,"HK TONGBU FAMILY DRESS LIMITED
香港童布家人服飾有限公司",2014-03-18,2017-11-10,"Private, ltd by shares"565,2056379,"HK UNIVERSAL INDUSTRY &amp; TRADE LIMITED
香港環宇工貿有限公司",2014-03-18,2017-11-10,"Private, ltd by shares"566,2056848,"HK WinLead Electronic Technology Co., Limited
香港維利達電子科技有限公司",2014-03-18,2019-03-15,"Private, ltd by shares"567,2057178,"HK WINTIME SAFETY TECHNOLOGY LIMITED
香港永泰安全技術有限公司",2014-03-18,2017-01-06,"Private, ltd by shares"568,2056495,"HK wiser trading Limited",2014-03-18,,"Private, ltd by shares"569,2056069,"HK WOSIMAN TECHNOLOGY LIMITED
香港沃斯漫科技有限公司",2014-03-18,2017-11-10,"Private, ltd by shares"570,2057116,"HK XINKE DEVELOPMENT LIMITED
香港信科發展有限公司",2014-03-18,2019-03-15,"Private, ltd by shares"571,2057303,"HK XINYANG INDUSTRY DEVELOPMENT LIMITED
香港鑫陽實業發展有限公司",2014-03-18,,"Private, ltd by shares"572,2057139,"HK YADEAR TECHNOLOGY LIMITED
香港雅迪奧科技有限公司",2014-03-18,,"Private, ltd by shares"573,2057068,"HK YAHUA TRADE CO., LIMITED
香港雅華貿易有限公司",2014-03-18,2019-03-15,"Private, ltd by shares"574,2056532,"HK YILE IMPORT &amp; EXPORT LIMITED
香港以勒進出口有限公司",2014-03-18,2019-09-27,"Private, ltd by shares"575,2056752,"HK YIMAIKOKI LIMITED
香港億邁康祺有限公司",2014-03-18,,"Private, ltd by shares"576,2056459,"HK YOUHUI CO., LIMITED
香港友卉有限公司",2014-03-18,,"Private, ltd by shares"577,2057069,"HK ZHIGAO TOOL INTERNATIONAL GROUP LIMITED
香港致高工具國際集團有限公司",2014-03-18,2018-10-26,"Private, ltd by shares"578,2057110,"HO PANG TRADING LIMITED
浩鵬貿易(香港)有限公司",2014-03-18,,"Private, ltd by shares"579,2057310,"HOK MAN SECURITY &amp; MANAGEMENT LIMITED
學文保安及管理有限公司",2014-03-18,,"Private, ltd by shares"580,2057427,"HOLLY LAND ENTERPRISES LIMITED
豪領企業有限公司",2014-03-18,,"Private, ltd by shares"581,2057163,"HOLLY MACHINERY (HK) LIMITED
浩力機械(香港)有限公司",2014-03-18,2019-03-15,"Private, ltd by shares"582,2056855,"HOME SHINE (CHINA) CO., LIMITED
鴻生(中國)有限公司",2014-03-18,2017-11-10,"Private, ltd by shares"583,2056188,"HONEST GAIN CONSULTING AND MANAGEMENT SERVICES LIMITED
誠豐顧問及管理服務有限公司",2014-03-18,2020-01-03,"Private, ltd by shares"584,2056272,"HONEST SEA LIMITED (d2018-07-06)",2014-03-18,2018-07-06,"Private, ltd by shares"585,2056237,"HONG KONG ADVENTURE TOURS LIMITED
香港歷險遊有限公司",2014-03-18,2016-09-02,"Private, ltd by shares"586,2056707,"Hong Kong Ai Fu Yi International Group Co., Limited
香港愛膚宜國際集團有限公司",2014-03-18,2019-09-27,"Private, ltd by shares"587,2057035,"Hong Kong Bailing International Special Animal Breeding Investment Management Co., Limited
香港柏靈國際特種動物養殖投資管理有限公司",2014-03-18,2017-11-10,"Private, ltd by shares"588,2057188,"Hong Kong Chuanmei Sunshine Group Co., Limited
香港傳美陽光集團有限公司",2014-03-18,2017-11-10,"Private, ltd by shares"589,2057079,"Hong Kong Chunwang IMP. &amp; EXP. Trade Co., Limited
香港春旺進出口貿易有限公司",2014-03-18,2017-09-22,"Private, ltd by shares"590,2056533,"Hong Kong Daoyisi Economic And Trading Company Limited
香港道亦思經貿有限公司",2014-03-18,,"Private, ltd by shares"591,2057114,"Hong Kong Dilaige International Industry Co., Limited
香港蒂萊格國際實業有限公司",2014-03-18,2018-10-19,"Private, ltd by shares"592,2056574,"HONG KONG DORA INTERNATIONAL LIMITED
香港朵拉國際貿易有限公司",2014-03-18,,"Private, ltd by shares"593,2056708,"Hong Kong E-Mei Sun Import and Export Trading Co., Limited
香港宜美尚貿易有限公司",2014-03-18,,"Private, ltd by shares"594,2057356,"HONG KONG GUANGSHENG BUSINESS LIMITED
香港廣升商貿有限公司",2014-03-18,2019-12-20,"Private, ltd by shares"595,2057363,"HONG KONG H.G.T COMMERCIAL SECRETARY LIMITED
香港匯港通商務秘書有限公司",2014-03-18,,"Private, ltd by shares"596,2056565,"HONG KONG HAIFENG TECHNOLOGY LIMITED
(香港)海峰科技有限公司",2014-03-18,,"Private, ltd by shares"597,2057032,"HONG KONG HONEST INDUSTRY CO., LIMITED
香港諾誠實業有限公司",2014-03-18,,"Private, ltd by shares"598,2056413,"Hong Kong Hong Kang Technology Co., Limited
香港鴻康科技有限公司",2014-03-18,,"Private, ltd by shares"599,2056888,"Hong Kong Hong Xiang International Financial Holding Group Co., Limited
香港鴻翔國際金融控股集團有限公司",2014-03-18,2017-11-10,"Private, ltd by shares"600,2056127,"HONG KONG INTERNATIONAL CULTURAL INDUSTRY TRADE CENTER CO., LIMITED
香港國際文化產業交易中心有限公司",2014-03-18,2017-11-10,"Private, ltd by shares"601,2057112,"HONG KONG INVISIBLE TECHNOLOGY CO., LIMITED
香港隱形科技有限公司",2014-03-18,,"Private, ltd by shares"602,2057151,"Hong Kong Jiachen International Group Co., Limited
香港嘉宸國際集團有限公司",2014-03-18,,"Private, ltd by shares"603,2057353,"HONG KONG JIEYING BUSINESS LIMITED
香港捷盈商貿有限公司",2014-03-18,2017-11-03,"Private, ltd by shares"604,2056912,"Hong Kong Ke Tong Industries Limited
香港科同實業有限公司",2014-03-18,2019-02-08,"Private, ltd by shares"605,2057301,"HONG KONG KINLOON CO., LIMITED
香港大世紀股份有限公司",2014-03-18,,"Private, ltd by shares"606,2057374,"HONG KONG LEKANGJIAN CO., LIMITED
香港樂康健有限公司",2014-03-18,,"Private, ltd by shares"607,2057370,"HONG KONG LIANCHENG TECHNOLOGY LIMITED
香港聯城科技有限公司",2014-03-18,,"Private, ltd by shares"608,2057319,"Hong Kong Lovre Trading Co., Limited
香港樂福貿易有限公司",2014-03-18,,"Private, ltd by shares"609,2056331,"Hong Kong Ouji Shangwu Technology Co., Limited
香港歐記商務科技有限公司",2014-03-18,,"Private, ltd by shares"610,2057291,"HONG KONG PYS INDUSTRIAL CO., LIMITED
香港普粵斯實業有限公司",2014-03-18,2018-09-21,"Private, ltd by shares"611,2056876,"Hong Kong Qi Hui International Trading Limited
香港啟暉國際貿易有限公司",2014-03-18,2016-10-28,"Private, ltd by shares"612,2056383,"Hong Kong Reborn International Technology Co., Limited
香港瑞博國際科技有限公司",2014-03-18,2017-11-10,"Private, ltd by shares"613,2057169,"HONG KONG RULUO INTERNATIONAL FRUIT DRINK GROUP LIMITED
香港茹蘿國際果汁飲料集團有限公司",2014-03-18,2017-11-10,"Private, ltd by shares"614,2057321,"Hong Kong Sovereign Trade Corporation Limited",2014-03-18,2019-08-02,"Private, ltd by shares"615,2057186,"HONG KONG TIANHEYUAN ASSENTMENT MANAGEMENT CO., LIMITED
香港天合源資產管理有限公司",2014-03-18,,"Private, ltd by shares"616,2056872,"HONG KONG TSING HUA INDUSTRIAL CO., LIMITED
香港青華實業有限公司",2014-03-18,2016-08-12,"Private, ltd by shares"617,2056494,"HONG KONG VANTSON GROUP CO., LIMITED
香港萬成集團有限公司",2014-03-18,2017-11-10,"Private, ltd by shares"618,2057377,"HONG KONG WANCHANGLONG TRADING LIMITED
香港萬昌隆貿易有限公司",2014-03-18,2019-12-20,"Private, ltd by shares"619,2056993,"HONG KONG WARMAR DEVELOPMENT COMPANY LIMITED
香港沃瑪發展有限公司",2014-03-18,,"Private, ltd by shares"620,2056816,"HONG KONG XIAN TONG DA PRINTING AND PACKAGING CO., LIMITED
香港賢通達印刷包裝有限公司",2014-03-18,,"Private, ltd by shares"621,2057215,"Hong Kong XiangFa Holding Group Co., Limited
香港祥發控股集團有限公司",2014-03-18,2017-11-10,"Private, ltd by shares"622,2056846,"HONG KONG XIZE CHEMICAL CO., LIMITED
香港熙澤化工有限公司",2014-03-18,,"Private, ltd by shares"623,2057366,"HONG KONG Y.T.S BUSINESS LIMITED
香港粵通順商貿有限公司",2014-03-18,,"Private, ltd by shares"624,2057131,"HONG KONG YIJIU INTERNATIONAL HOLDING GROUP CO., LIMITED
香港懿玖國際控股集團有限公司",2014-03-18,2017-11-10,"Private, ltd by shares"625,2056834,"Hong Kong Yuan Yu Industrial Limited
香港源譽實業有限公司",2014-03-18,2017-11-10,"Private, ltd by shares"626,2056596,"Hong Kong Yves Saint Lauren Home Decoration Co., Limited
香港伊夫聖洛國際家居裝飾設計有限公司",2014-03-18,2017-11-10,"Private, ltd by shares"627,2056594,"HONGCHEN INDUSTRIAL (HK) LIMITED
宏晨實業(香港)有限公司",2014-03-18,,"Private, ltd by shares"628,2056444,"HONGFU GROUP (CHINA) LIMITED
宏福集團(中國)有限公司",2014-03-18,2018-11-30,"Private, ltd by shares"629,2056191,"HONGKONG A.J TRADING CO., LIMITED
香港優匯貿易有限公司",2014-03-18,2020-09-04,"Private, ltd by shares"630,2056503,"HONGKONG BAYNE GROUP LIMITED
香港貝恩集團有限公司",2014-03-18,2019-03-15,"Private, ltd by shares"631,2056661,"HONGKONG BIZOE TECHNOLOGY LIMITED
香港佰卓科技有限公司",2014-03-18,,"Private, ltd by shares"632,2057263,"HONGKONG CESTON TRADING CO., LIMITED
香港晟通貿易有限公司",2014-03-18,2019-10-18,"Private, ltd by shares"633,2056941,"HONGKONG CHAOXIANG FAMILY FOOD CO., LIMITED
香港潮香世家食品有限公司",2014-03-18,2019-03-15,"Private, ltd by shares"634,2056292,"HONGKONG CJ INT'L TRADING CO., LIMITED
香港晨潔國際貿易股份有限公司",2014-03-18,,"Private, ltd by shares"635,2056211,"HONGKONG DEMON INTERNATIONAL CO., LIMITED
香港得牧國際有限公司",2014-03-18,,"Private, ltd by shares"636,2057336,"HONGKONG DN TRANSMISSION TECHNOLOGY CO., LIMITED
香港德恩傳動科技有限公司",2014-03-18,2020-11-13,"Private, ltd by shares"637,2057329,"Hongkong Dormatch Hardware And Decoration Group Limited
香港德邁五金裝飾集團有限公司",2014-03-18,,"Private, ltd by shares"638,2056189,"HONGKONG FEIFEI INTERNATIONAL TRADING LIMITED
香港非非國際貿易有限公司",2014-03-18,2017-11-10,"Private, ltd by shares"639,2056988,"HONGKONG FLC LIGHTING IMP&amp;EXP LIMITED
香港四葉草照明進出口有限公司",2014-03-18,2019-12-06,"Private, ltd by shares"640,2056485,"HongKong Fusion Biotechnology Holding Corporation Limited
港通生物科技控股有限公司",2014-03-18,,"Private, ltd by shares"641,2056199,"HONGKONG GANGFU FURNITURE CO., LIMITED
香港港福家具有限公司",2014-03-18,,"Private, ltd by shares"642,2057261,"Hongkong Gelitech Co., Limited
香港格裏威堡科技有限公司",2014-03-18,2017-11-10,"Private, ltd by shares"643,2056440,"HONGKONG GOOD TECHNOLOGY INDUSTRIAL CO., LIMITED
香港好用科技實業有限公司",2014-03-18,,"Private, ltd by shares"644,2056638,"Hongkong Gujin underwear Abc International Holdings Limited
香港古今內衣國際控股有限公司",2014-03-18,2015-10-16,"Private, ltd by shares"645,2056833,"HongKong GuoSheng Electric Wire&amp;Cable Group Co., Limited
香港國盛集團有限公司",2014-03-18,2018-10-26,"Private, ltd by shares"646,2056096,"Hongkong HaBei Cci Capital Limited
香港哈貝投資管理有限公司",2014-03-18,,"Private, ltd by shares"647,2056835,"Hongkong HaiGang Cci Capital Limited
香港海剛投資管理有限公司",2014-03-18,,"Private, ltd by shares"648,2056545,"HONGKONG HENGTUO COMPANY LIMITED
香港恒拓實業有限公司",2014-03-18,,"Private, ltd by shares"649,2056748,"HONGKONG HENGXIANGYUAN ELECTRONIC COMMUNICATIONS LIMITED
香港恒祥源電子通訊有限公司",2014-03-18,,"Private, ltd by shares"650,2056884,"Hongkong Hongming Trade Co., Limited
香港宏明貿易有限公司",2014-03-18,,"Private, ltd by shares"651,2056807,"HONGKONG HONGYAN INTERNATIONAL BUSINESS CO., LIMITED
香港紅岩國際商貿有限公司",2014-03-18,2017-11-10,"Private, ltd by shares"652,2056984,"HONGKONG HUGO BIOTECHNOLOGY CO., LIMITED
香港匯農生物科技有限公司",2014-03-18,2017-11-10,"Private, ltd by shares"653,2056288,"HONGKONG HUIDA PACKING CO., LIMITED
香港匯達包裝有限公司",2014-03-18,,"Private, ltd by shares"654,2056909,"HONGKONG ISABELLA INT'L BIOTECHNOLOGY LIMITED
香港伊莎國際生物科技有限公司",2014-03-18,2017-11-10,"Private, ltd by shares"655,2057083,"HONGKONG JIANJIAN TRADING LIMITED
香港健健貿易有限公司",2014-03-18,2019-01-18,"Private, ltd by shares"656,2056387,"HONGKONG JINGZHE EVENT MANAGEMENT LIMITED
香港驚蟄賽事管理有限公司",2014-03-18,2016-10-14,"Private, ltd by shares"657,2057250,"Hongkong Jinokn Electronics Co., Limited
金諾坤科技有限公司",2014-03-18,2019-02-15,"Private, ltd by shares"658,2056862,"HONGKONG KAIMEI HOLDING GROUP CO., LIMITED
香港開美控股集團有限公司",2014-03-18,2019-12-20,"Private, ltd by shares"659,2056650,"HONGKONG KISEN HOME LIMITED
香港啓森家居有限公司",2014-03-18,2020-04-29,"Private, ltd by shares"660,2057091,"HONGKONG KONGQUELIN PAINT GROUP LIMITED
香港孔雀林漆業集團有限公司",2014-03-18,2017-11-10,"Private, ltd by shares"661,2056204,"HONGKONG LINGDI FASHION LIMITED
香港領弟服飾有限公司",2014-03-18,2017-06-16,"Private, ltd by shares"662,2057260,"HONGKONG NAZUN GROUP CO., LIMITED
香港納尊集團有限公司",2014-03-18,,"Private, ltd by shares"663,2056450,"Hongkong Panida Industrial Co., Limited
香港攀益達實業有限公司",2014-03-18,,"Private, ltd by shares"664,2056925,"HONGKONG PHOENIX INTERNATIONAL CULTURE COMMUNICATION LIMITED
香港鳳凰國際文化交流有限公司",2014-03-18,2017-10-06,"Private, ltd by shares"665,2056417,"HONGKONG RICH DAD RICH MOM INVESTMENT MANAGEMENT LIMITED
香港富爸富媽投資管理有限公司",2014-03-18,2019-03-15,"Private, ltd by shares"666,2056242,"HONGKONG RUIDIAN INTERNATIONAL CO., LIMITED
香港銳典國際有限公司",2014-03-18,,"Private, ltd by shares"667,2056303,"HONGKONG SARABELLE APPAREL TRADE CO., LIMITED",2014-03-18,2019-03-15,"Private, ltd by shares"668,2057028,"HONGKONG SCANDINAVIAN MARINE CONSULTING CO., LIMITED
香港納維亞船舶諮詢有限公司",2014-03-18,,"Private, ltd by shares"669,2057255,"HONGKONG SERVICE INDUSTRIAL DEVELOPMENT LIMITED
香港服務實業發展有限公司",2014-03-18,2019-03-22,"Private, ltd by shares"670,2057226,"Hongkong Shensin Trading Co., Limited
香港深鑫貿易有限公司",2014-03-18,2019-03-22,"Private, ltd by shares"