,Reg no.,Name,Incorp-orated,Dissolved,Type901,2057382,"MILLION HEALTH LIMITED (d2016-07-15)
健妙有限公司",2014-03-18,2016-07-15,"Private, ltd by shares"902,2057369,"MILLION PORT INTERNATIONAL LIMITED
滙灃國際有限公司",2014-03-18,2020-05-22,"Private, ltd by shares"903,2056034,"MILLION RISING INTERNATIONAL LIMITED
百昇國際有限公司",2014-03-18,2016-12-02,"Private, ltd by shares"904,2057171,"MINDRUI BIOTECHNOLOGY PROPRIETARY HONGKONG COMPANY LIMITED
香港邁瑞迪生物技術控股有限公司",2014-03-18,2019-04-18,"Private, ltd by shares"905,2057381,"Ming Fai Computer Embroidery Co., Limited
銘輝電腦機繡有限公司",2014-03-18,,"Private, ltd by shares"906,2056555,"MING ZE (HONG KONG) LIMITED
明澤(香港)有限公司",2014-03-18,,"Private, ltd by shares"907,2057144,"MINGSHIDA FUNITURE CO., LIMITED
銘士達家具有限公司",2014-03-18,,"Private, ltd by shares"908,2056063,"MIRACL BIOCHEMICAL CO., LIMITED
邁瑞朗生物有限公司",2014-03-18,2017-11-10,"Private, ltd by shares"909,2056747,"Mobile Trading Limited",2014-03-18,,"Private, ltd by shares"910,2057156,"MODATEX INTERNATIONAL LIMITED
吉紡國際有限公司",2014-03-18,,"Private, ltd by shares"911,2056169,"Mody Fine Arts Limited",2014-03-18,,"Private, ltd by shares"912,2057158,"MOGREAT MATERIALS LIMITED
宏泰新材料股份有限公司",2014-03-18,2017-03-10,"Private, ltd by shares"913,2056350,"MOLUOGE (HK) INTERNATIONAL GROUP SHARES LIMITED
磨洛哥(香港)國際集團股份有限公司",2014-03-18,2017-11-10,"Private, ltd by shares"914,2057401,"MONASH VENTURE LIMITED
萬龍創業有限公司",2014-03-18,,"Private, ltd by shares"915,2056652,"MOON PRAISE GROUP LIMITED
滿盈集團有限公司",2014-03-18,2019-03-15,"Private, ltd by shares"916,2057124,"MOON TAKI YARN LIMITED
月瀧紗有限公司",2014-03-18,,"Private, ltd by shares"917,2057203,"MORGAN COCO INVESTMENT LIMITED
摩根可可投資有限公司",2014-03-18,2018-11-02,"Private, ltd by shares"918,2056426,"MORNACH (ASIA) LIMITED
帝星(亞洲)有限公司",2014-03-18,,"Private, ltd by shares"919,2056287,"Mornwin Industry (HK) Co., Limited
摩威實業(香港)有限公司",2014-03-18,,"Private, ltd by shares"920,2057115,"MORRISTON TECHNOLOGY LIMITED
莫里斯頓科技有限公司",2014-03-18,2019-03-15,"Private, ltd by shares"921,2056618,"MOUNTAIN PRIME WORLDWIDE LIMITED
貿盈環球有限公司",2014-03-18,,"Private, ltd by shares"922,2057397,"MULTI PROFIT INDUSTRIES LIMITED
倍盈實業有限公司",2014-03-18,2017-11-10,"Private, ltd by shares"923,2056743,"MUSE AUDIO TECHNOLOGY CO., LIMITED
繆斯音響科技有限公司",2014-03-18,2017-11-10,"Private, ltd by shares"924,2056152,"MUTUAL BRIGHT INC LIMITED
互譽有限公司",2014-03-18,2016-01-22,"Private, ltd by shares"925,2056302,"MUTUAL HAPPY LIMITED",2014-03-18,,"Private, ltd by shares"926,2057055,"MW METAL INDUSTRY LIMITED
曼華金屬實業有限公司",2014-03-18,,"Private, ltd by shares"927,2056393,"MY LEARNING AND EDUCATION SERVICES LIMITED",2014-03-18,,"Private, ltd by shares"928,2057318,"MY-HOME PROPERTY AGENCY LIMITED
置家物業代理有限公司",2014-03-18,,"Private, ltd by shares"929,2056875,"NAMELESS CO., LIMITED",2014-03-18,,"Private, ltd by shares"930,2057404,"NASH CORP LIMITED
納什有限公司",2014-03-18,,"Private, ltd by shares"931,2056256,"NATURAL INSULATION PRODUCTS INCORPORATION (NIPI) LIMITED",2014-03-18,,"Private, ltd by shares"932,2057341,"NATURLICH INTERNATIONAL HOLDINGS LIMITED
瑞爾仕國際控股有限公司",2014-03-18,2017-12-15,"Private, ltd by shares"933,2057193,"NEW BESTONE TECHNOLOGY CO., LIMITED
紐貝斯通科技有限公司",2014-03-18,,"Private, ltd by shares"934,2056074,"NEW DORBO INSURANCE MANAGEMENT LIMITED
新多寶保險管理有限公司",2014-03-18,,"Private, ltd by shares"935,2056828,"NEW HARMONY HOLDINGS LIMITED
新致集團有限公司",2014-03-18,2018-08-31,"Private, ltd by shares"936,2057160,"NEW LIGHT HK LIMITED
新光源(香港)有限公司",2014-03-18,2019-03-15,"Private, ltd by shares"937,2056430,"NEW OCEANIC HK LIMITED
新海洋香港有限公司",2014-03-18,2019-03-15,"Private, ltd by shares"938,2056701,"New River Engineering (HK) Company Limited
新河工程有限公司",2014-03-18,,"Private, ltd by shares"939,2056145,"NEW SILVER LIMITED",2014-03-18,,"Private, ltd by shares"940,2057207,"New Skyline Technology Limited
新天際技術有限公司",2014-03-18,,"Private, ltd by shares"941,2056118,"NEW YIELD INC LIMITED
南溢有限公司",2014-03-18,,"Private, ltd by shares"942,2057176,"NEWBELL ELECTRONIC CO., LIMITED
紐匯爾電子有限公司",2014-03-18,2019-06-14,"Private, ltd by shares"943,2056538,"NEWDAY (HONGKONG) INDUSTRIAL CO., LIMITED
新日(香港)實業有限公司",2014-03-18,,"Private, ltd by shares"944,2056278,"NICE VIEW INTERNATIONAL TRADING LIMITED
佳璟國際貿易有限公司",2014-03-18,,"Private, ltd by shares"945,2057349,"NICWICK INVESTMENT LIMITED
歷域投資有限公司",2014-03-18,,"Private, ltd by shares"946,2056677,"NINGBO AIYIMEI INTERNATIONAL TRADING CO., LIMITED",2014-03-18,2019-07-26,"Private, ltd by shares"947,2057241,"NINGBO ECO SUN CO., LIMITED
寧波伊可頌能源有限公司",2014-03-18,2019-03-22,"Private, ltd by shares"948,2056408,"Ningbo Winfull Import &amp; Export Co., Limited
寧波市文福進出口有限公司",2014-03-18,2019-12-20,"Private, ltd by shares"949,2056659,"NINO STAR ENGINEERING LIMITED
星華工程有限公司",2014-03-18,,"Private, ltd by shares"950,2056911,"Nobel Industrial Group (China) Co., Limited
諾貝爾工業集團(中國)有限公司",2014-03-18,2019-03-15,"Private, ltd by shares"951,2056817,"NOBLE TEAM HOLDINGS LIMITED
尚群集團有限公司",2014-03-18,2019-12-20,"Private, ltd by shares"952,2057376,"NOXETECH LIMITED
諾士德有限公司",2014-03-18,2016-11-04,"Private, ltd by shares"953,2056162,"NSPP COMPANY LIMITED",2014-03-18,2018-10-05,"Private, ltd by shares"954,2056305,"OCEAN BEST LIMITED (b2014-03-18)",2014-03-18,2015-10-09,"Private, ltd by shares"955,2057076,"ON YOUR MARK TRANSPORT LIMITED",2014-03-18,,"Private, ltd by shares"956,2056215,"One Creation Studio Limited
一創意有限公司",2014-03-18,,"Private, ltd by shares"957,2056979,"ONE DRAGON TECHNOLOGY LIMITED
一龍科技有限公司",2014-03-18,,"Private, ltd by shares"958,2056729,"ONE TWENTY AVIATION LIMITED",2014-03-18,,"Private, ltd by shares"959,2057050,"ONESTEPS LIMITED
達眾實業有限公司",2014-03-18,2019-03-15,"Private, ltd by shares"960,2057396,"Opal Footwear Co., Limited
東莞市歐鉑鞋業有限公司",2014-03-18,,"Private, ltd by shares"961,2057406,"OPG CORPORATION LIMITED",2014-03-18,,"Private, ltd by shares"962,2056519,"OPTIMUS RICH LIMITED
鴻沃有限公司",2014-03-18,,"Private, ltd by shares"963,2056075,"Opus One Creative Limited
銳鑄設計有限公司",2014-03-18,,"Private, ltd by shares"964,2056932,"ORANGE INTERNATIONAL GROUP CO., LIMITED",2014-03-18,2019-12-20,"Private, ltd by shares"965,2056915,"ORIENT AVIATION MEDIA GROUP LIMITED",2014-03-18,,"Private, ltd by shares"966,2056458,"ORIENTAL GREAT JADE LIMITED
東方翡翠有限公司",2014-03-18,,"Private, ltd by shares"967,2056306,"ORIENTAL MIND LIMITED",2014-03-18,2019-12-20,"Private, ltd by shares"968,2056964,"Original Gourmet Company Limited
原味食品有限公司",2014-03-18,,"Private, ltd by shares"969,2056572,"OS ASIA LIMITED",2014-03-18,2016-12-23,"Private, ltd by shares"970,2056053,"OSCAR INTERNATIONAL JEWELRY (HONGKONG) CO., LIMITED
奧斯卡國際珠寶(香港)有限公司",2014-03-18,2019-12-20,"Private, ltd by shares"971,2056583,"OUJIA TRADING LIMITED (d2017-11-10)
歐嘉貿易有限公司",2014-03-18,2017-11-10,"Private, ltd by shares"972,2056734,"P AND T EXPORTS LIMITED",2014-03-18,,"Private, ltd by shares"973,2057104,"P&amp;P TRADING LIMITED (HK)",2014-03-18,,"Private, ltd by shares"974,2057173,"PachinTech Manufacture Co., Limited
柏青技術製造有限公司",2014-03-18,,"Private, ltd by shares"975,2056216,"PAK YIU ENGINEERING COMPANY LIMITED
柏耀工程有限公司",2014-03-18,,"Private, ltd by shares"976,2056022,"PAKER LIMITED
百加有限公司",2014-03-18,,"Private, ltd by shares"977,2056023,"PAKSEN LIMITED
百尚有限公司",2014-03-18,2016-01-15,"Private, ltd by shares"978,2056171,"PAN COMMERCE ENTERPRISE (HONG KONG) CO., LIMITED",2014-03-18,,"Private, ltd by shares"979,2057208,"PANDA SOURCING LIMITED (HK)
熊貓採購有限公司",2014-03-18,2019-07-12,"Private, ltd by shares"980,2057134,"PANKE INDUSTRY (HK) LIMITED
攀科實業(香港)有限公司",2014-03-18,2017-03-31,"Private, ltd by shares"981,2056623,"PARTNER PRIME ENGINEERING LIMITED
柏基工程有限公司",2014-03-18,,"Private, ltd by shares"982,2057254,"PDM Asia Limited",2014-03-18,,"Private, ltd by shares"983,2056511,"PEAL AINO INTERNATIONAL LIMITED
皮艾諾國際有限公司",2014-03-18,2018-09-14,"Private, ltd by shares"984,2057049,"PEARL BEAUTY LIMITED (HK)
貝斯美容纖體有限公司",2014-03-18,,"Private, ltd by shares"985,2056948,"PEARL ERA HK LIMITED
香港歐麗實業有限公司",2014-03-18,,"Private, ltd by shares"986,2057127,"PENGHAO ELECTRONICS CO., LIMITED
鵬昊電子有限公司",2014-03-18,2018-03-16,"Private, ltd by shares"987,2056234,"PERFECT APLE OPTICAL (HONGKONG) CO., LIMITED
鴻升眼鏡(香港)有限公司",2014-03-18,,"Private, ltd by shares"988,2056704,"PERFECT GROVE LIMITED
鵬采有限公司",2014-03-18,,"Private, ltd by shares"989,2057054,"Perfect Maxim Limited",2014-03-18,,"Private, ltd by shares"990,2056024,"PERFECT ROYAL LIMITED
卓尚有限公司",2014-03-18,,"Private, ltd by shares"991,2056678,"PERFECT STRIKE LIMITED
仁友有限公司",2014-03-18,2017-11-10,"Private, ltd by shares"992,2056792,"PETER AND CHIHIRO COMPANY LIMITED
彼德與千尋國際貿易有限公司",2014-03-18,,"Private, ltd by shares"993,2056808,"PI POWER LIMITED (HK)
派能集團有限公司",2014-03-18,,"Private, ltd by shares"994,2056665,"PINEWOOD FINE LIMITED
栢峻有限公司",2014-03-18,2017-11-10,"Private, ltd by shares"995,2056520,"PLAXTON RICH LIMITED
珀富有限公司",2014-03-18,2017-11-10,"Private, ltd by shares"996,2056590,"Pobo Information Company Limited
鵬博資訊有限公司",2014-03-18,,"Private, ltd by shares"997,2056259,"POINT'S CREATIVE LIMITED
雋陽有限公司",2014-03-18,,"Private, ltd by shares"998,2056944,"POLO-STANDARD LIMITED
保羅標準有限公司",2014-03-18,,"Private, ltd by shares"999,2056679,"POLY PRORICH LIMITED
熙智有限公司",2014-03-18,2017-11-10,"Private, ltd by shares"1000,2057225,"POS OIL SEAL CO., LIMITED",2014-03-18,,"Private, ltd by shares"1001,2056592,"Positive Energy Entertainment (HK) Co. Limited
正能量娛樂(香港)有限公司",2014-03-18,,"Private, ltd by shares"1002,2056164,"POWER ON CORPORATION LIMITED",2014-03-18,2018-07-13,"Private, ltd by shares"1003,2056217,"POWERCON TECHNOLOGY CO., LIMITED
恒宏偉業科技(香港)有限公司",2014-03-18,2015-05-22,"Private, ltd by shares"1004,2056279,"PPF INTERNATIONAL LIMITED (HK)
甫方國際有限公司",2014-03-18,,"Private, ltd by shares"1005,2056615,"PREMIUM CHARM LIMITED
鼎思有限公司",2014-03-18,2019-12-20,"Private, ltd by shares"1006,2056986,"PREMIUM GLORY TECHNOLOGY LIMITED
騰躍科技集團有限公司",2014-03-18,,"Private, ltd by shares"1007,2057168,"PricewaterhouseCoopers Consulting China Investment No. 2 Limited",2014-03-18,,"Private, ltd by shares"1008,2057138,"PricewaterhouseCoopers Strategy China Investment No. 2 Limited",2014-03-18,,"Private, ltd by shares"1009,2057240,"Priemere Trading Co., Limited",2014-03-18,2016-05-20,"Private, ltd by shares"1010,2056992,"PRIME APEX DEVELOPMENT LIMITED
譽濠發展有限公司",2014-03-18,,"Private, ltd by shares"1011,2056990,"PRIME APEX GROUP LIMITED
譽濠集團有限公司",2014-03-18,2019-03-15,"Private, ltd by shares"1012,2056980,"PRIME APEX INTERNATIONAL LIMITED
譽濠國際有限公司",2014-03-18,,"Private, ltd by shares"1013,2057046,"PRIME APEX TRADING LIMITED
譽濠貿易有限公司",2014-03-18,,"Private, ltd by shares"1014,2056312,"PRIME MILLION LIMITED",2014-03-18,,"Private, ltd by shares"1015,2056774,"Prime Solution Technology Investment Limited
寰昊科技投資有限公司",2014-03-18,2017-09-08,"Private, ltd by shares"1016,2056046,"Primera Investment Limited
陞耀投資有限公司",2014-03-18,2020-10-23,"Private, ltd by shares"1017,2057306,"PRISTINE GEMS LIMITED
真鑽有限公司",2014-03-18,,"Private, ltd by shares"1018,2056359,"PRODUCT SMART LIMITED (HK)
香港綺維貿易有限公司",2014-03-18,,"Private, ltd by shares"1019,2056025,"PROFIT GATHER LIMITED
瑋益有限公司",2014-03-18,,"Private, ltd by shares"1020,2056528,"PROMAX FINE LIMITED
鵬好有限公司",2014-03-18,2019-03-15,"Private, ltd by shares"1021,2056397,"PUJIN ELECTRONIC TECHNOLOGY (HONG KONG) CO., LIMITED
普金電子科技(香港)有限公司",2014-03-18,,"Private, ltd by shares"1022,2056073,"PULEST (CHINA) CO., LIMITED
普萊斯特(中國)有限公司",2014-03-18,,"Private, ltd by shares"1023,2057364,"PURE DRAGON INTERNATIONAL INVESTMENT LIMITED
臻龍國際投資有限公司",2014-03-18,,"Private, ltd by shares"1024,2056121,"Pyramids Technology Limited",2014-03-18,,"Private, ltd by shares"1025,2056335,"QB Enterprises Limited",2014-03-18,,"Private, ltd by shares"1026,2056411,"Qianfine Fashion (HK) Limited
乾峰(香港)服飾有限公司",2014-03-18,,"Private, ltd by shares"1027,2056719,"QIME ELECTRONICS CO., LIMITED
啟明電子有限公司",2014-03-18,2016-04-08,"Private, ltd by shares"1028,2056721,"Qin Tour Multivariate Limited
沁遊多元有限公司",2014-03-18,2018-08-10,"Private, ltd by shares"1029,2056695,"QINGDAO DONG BO CHAIN CO., LIMITED
青島東寶鏈條有限公司",2014-03-18,,"Private, ltd by shares"1030,2057070,"QL Asset Management Company Limited",2014-03-18,,"Private, ltd by shares"1031,2056653,"QUALITY RICH CAPITAL HOLDINGS GROUP LIMITED
僑富資本控股集團有限公司",2014-03-18,2019-03-15,"Private, ltd by shares"1032,2056587,"Quanruide Technology (HK) Co., Limited
全瑞德科技(香港)有限公司",2014-03-18,,"Private, ltd by shares"1033,2057275,"QUANTUM RESOURCE ASIA LIMITED
量子資源亞洲有限公司",2014-03-18,,"Private, ltd by shares"1034,2056669,"QUEEN LEGEND LIMITED
君言有限公司",2014-03-18,2017-11-10,"Private, ltd by shares"1035,2057092,"QUEEN PLAYING CARD (HK) LIMITED
皇后撲克(香港)有限公司",2014-03-18,2018-08-24,"Private, ltd by shares"1036,2056148,"RAINBOW CULTURE CREATION LIMITED
虹文化創意有限公司",2014-03-18,,"Private, ltd by shares"1037,2056957,"Rainbow Learning Company Limited
雨天晴有限公司",2014-03-18,,"Private, ltd by shares"1038,2057272,"RaYoung Technology Co., Limited
銳洋科技有限公司",2014-03-18,2017-11-10,"Private, ltd by shares"1039,2056981,"Rayway Mold Technologies (HongKong) Company Limited
瑞維模具科技(香港)有限公司",2014-03-18,,"Private, ltd by shares"1040,2056041,"RCUBE DESIGN LIMITED
華方設計有限公司",2014-03-18,2017-01-27,"Private, ltd by shares"1041,2056543,"REALUX SOLUTION LIMITED
瑞諾香港有限公司",2014-03-18,,"Private, ltd by shares"1042,2056253,"RED DAZZLE WORKS LIMITED
紅閃爍有限公司",2014-03-18,,"Private, ltd by shares"1043,2056070,"Regent Lane Asia Limited
禮運大同有限公司",2014-03-18,,"Private, ltd by shares"1044,2056026,"REGENT PLANNER LIMITED
駿倍有限公司",2014-03-18,,"Private, ltd by shares"1045,2056035,"REGENT SINO INVESTMENT LIMITED
慶華投資有限公司",2014-03-18,,"Private, ltd by shares"1046,2056010,"REINART EXOTICS COMPANY LIMITED
凝藝名車有限公司",2014-03-18,,"Private, ltd by shares"1047,2056241,"RELINK TECHNOLOGY (HK) CO., LIMITED
睿聯科技香港有限公司",2014-03-18,,"Private, ltd by shares"1048,2056610,"Renhai Trading Co., Limited
仁海貿易有限公司",2014-03-18,2019-03-15,"Private, ltd by shares"1049,2057411,"RHWELT GLOBAL INVESTMENT CONSULTANTS LIMITED
禧盛環球投資顧問有限公司",2014-03-18,,"Private, ltd by shares"1050,2057259,"Rich Forest International Energy Industrial Limited
裕豐泰達國際能源實業有限公司",2014-03-18,,"Private, ltd by shares"1051,2056621,"RICH HARVEST FREIGHT CO., LIMITED
先益貨運有限公司",2014-03-18,,"Private, ltd by shares"1052,2056959,"RICH MAN LIMITED
富萬(中港)有限公司",2014-03-18,,"Private, ltd by shares"1053,2056756,"RICH NICE HOLDINGS LIMITED (d2017-02-24)
富佳控股有限公司",2014-03-18,2017-02-24,"Private, ltd by shares"1054,2056881,"RICHER FOOD INDUSTRY CO., LIMITED
瑞巧食品實業有限公司",2014-03-18,2017-11-10,"Private, ltd by shares"1055,2056119,"RICHGROW INC LIMITED
沃盛有限公司",2014-03-18,2019-03-15,"Private, ltd by shares"1056,2056438,"RICHLUK GROUP CO., LIMITED",2014-03-18,,"Private, ltd by shares"1057,2056027,"RICHLY POINTER LIMITED
富豐有限公司",2014-03-18,,"Private, ltd by shares"1058,2056952,"RICHTON TRADING DEVELOP LIMITED
富權貿易拓展有限公司",2014-03-18,2019-03-15,"Private, ltd by shares"1059,2056398,"RICKEN INDUSTRIAL CO., LIMITED
裏肯實業有限公司",2014-03-18,2017-07-28,"Private, ltd by shares"1060,2057008,"RIGER MACHINERY CO., LIMITED
瑞格機械有限公司",2014-03-18,2017-11-17,"Private, ltd by shares"1061,2056158,"RIGHT STYLE LIMITED (b2014-03-18)
威際有限公司",2014-03-18,2015-03-27,"Private, ltd by shares"1062,2056786,"RIKON OIL INDUSTRY LIMITED",2014-03-18,2017-08-11,"Private, ltd by shares"1063,2057234,"RISE (HK) TECHNOLOGY CO., LIMITED
香港鴻昇科技有限公司",2014-03-18,2019-07-19,"Private, ltd by shares"1064,2056172,"RISE MOST LIMITED",2014-03-18,2020-10-16,"Private, ltd by shares"1065,2056317,"RISE SURE LIMITED (d2018-03-29)",2014-03-18,2018-03-29,"Private, ltd by shares"1066,2057422,"RISING EAGLE DEVELOPMENT LIMITED
鷹飛發展有限公司",2014-03-18,,"Private, ltd by shares"1067,2057417,"Rising Planet Limited
昇行有限公司",2014-03-18,,"Private, ltd by shares"1068,2057421,"Rising Planet Trading Limited
昇行貿易有限公司",2014-03-18,2018-07-06,"Private, ltd by shares"1069,2056544,"RISURE INTERNATIONAL TRADING COMPANY LIMITED",2014-03-18,2017-10-13,"Private, ltd by shares"1070,2056920,"RK VENTURES LIMITED",2014-03-18,,"Private, ltd by shares"1071,2056758,"ROCAIR CARGO SOLUTION LIMITED
榮禾物流諮詢有限公司",2014-03-18,2015-08-14,"Private, ltd by shares"1072,2056778,"Rockbare International Co. Limited
香港樂寶莊國際有限公司",2014-03-18,,"Private, ltd by shares"1073,2056534,"ROLLING GLOBE LIMITED
津球有限公司",2014-03-18,,"Private, ltd by shares"1074,2056508,"RONGDA INTERNATIONAL DEVELOPMENT LIMITED
榮達國際發展有限公司",2014-03-18,2019-03-15,"Private, ltd by shares"1075,2057007,"ROSE CASA TRADING COMPANY LIMITED
洛斯家居貿易有限公司",2014-03-18,2015-07-17,"Private, ltd by shares"1076,2057394,"Royal Athletic Association Limited
皇家體育會有限公司",2014-03-18,,"Private, ltd by shares"1077,2057194,"ROYAL CRAFTSMAN DECORATION ENGINEERING LIMITED
御品名匠裝飾工程有限公司",2014-03-18,2019-03-15,"Private, ltd by shares"1078,2056795,"ROYAL GOLD HOLDINGS LIMITED
皇家黃金集團有限公司",2014-03-18,,"Private, ltd by shares"1079,2056768,"RUIHUA INT'L TRADE (HK) LIMITED
瑞華國際貿易(香港)有限公司",2014-03-18,,"Private, ltd by shares"1080,2057403,"RULA INTERIORS LIMITED
露華設計有限公司",2014-03-18,2015-12-04,"Private, ltd by shares"1081,2056406,"RULIEN TECHNOLOGY CO., LIMITED
瑞萊恩科技有限公司",2014-03-18,,"Private, ltd by shares"1082,2057082,"Rundle (Hong Kong) Education Exchange And Consulting Corporation Limited
朗道(香港)教育交流諮詢有限公司",2014-03-18,2018-04-27,"Private, ltd by shares"1083,2056767,"RUNHONG INTERNATIONAL INDUSTRIAL LIMITED
潤鴻國際實業有限公司",2014-03-18,2019-03-15,"Private, ltd by shares"1084,2057120,"Rykeda Electronics Co., Limited
瑞凱達電子有限公司",2014-03-18,2019-03-15,"Private, ltd by shares"1085,2057033,"S&amp;K INDUSTRY CO., LIMITED",2014-03-18,,"Private, ltd by shares"1086,2057191,"Sage EHS International, Limited",2014-03-18,,"Private, ltd by shares"1087,2056371,"SAGLOBAL EMPLOYEES LIMITED",2014-03-18,,"Private, ltd by shares"1088,2057251,"SAI ER LONG LIMITED
賽爾隆有限公司",2014-03-18,2019-03-22,"Private, ltd by shares"1089,2057042,"SAIHU INTERNATIONAL CO., LIMITED
賽虎國際有限公司",2014-03-18,2017-09-29,"Private, ltd by shares"1090,2057419,"SAMA CORPORATION LIMITED",2014-03-18,2017-02-03,"Private, ltd by shares"1091,2056857,"SANDA INTERNATIONAL LIMITED",2014-03-18,2019-12-20,"Private, ltd by shares"1092,2056036,"SANTECH INVESTMENT LIMITED
盛科投資有限公司",2014-03-18,,"Private, ltd by shares"1093,2057095,"SARA INDUSTRY LIMITED
香港聖亞實業有限公司",2014-03-18,,"Private, ltd by shares"1094,2056960,"SARIK TECHNOLOGY CO., LIMITED
賽瑞克科技有限公司",2014-03-18,2019-03-15,"Private, ltd by shares"1095,2057034,"SAROKING HOUSEHOLD PRODUCTS CO., LIMITED
聖羅帝王家居用品有限公司",2014-03-18,,"Private, ltd by shares"1096,2056202,"SAYI TRADE LIMITED
灑義貿易有限公司",2014-03-18,2017-11-10,"Private, ltd by shares"1097,2057304,"SBA Trade Holdings Limited",2014-03-18,2017-08-18,"Private, ltd by shares"1098,2057338,"Scientist Home Chinese Medicine and Health Centre Limited
科學家中醫保健中心有限公司",2014-03-18,2017-11-24,"Private, ltd by shares"1099,2057133,"SEA MOON (HONG KONG) LIMITED
海月實業(香港)有限公司",2014-03-18,,"Private, ltd by shares"1100,2057111,"SEAKEE INTERNATIONAL LIMITED
希奇投資有限公司",2014-03-18,,"Private, ltd by shares"1101,2056995,"SEASON DEVELOPMENT LIMITED (d2015-12-31)
海文實業發展有限公司",2014-03-18,2015-12-31,"Private, ltd by shares"1102,2056390,"SENGRY INTERNATIONAL (HK) CO., LIMITED
晟瑞國際(香港)有限公司",2014-03-18,2018-08-10,"Private, ltd by shares"1103,2056557,"Serron Packaging Limited
賽潤專業包裝有限公司",2014-03-18,,"Private, ltd by shares"1104,2056770,"Shandong SunXESS Chemical Group Co., Limited
山東日晟化工集團有限公司",2014-03-18,,"Private, ltd by shares"1105,2056504,"SHANGHAI BEIJINGYUAN ELECTRONIC TECHNOLOGY CO., LIMITED
上海北勁源電子科技有限公司",2014-03-18,2017-11-10,"Private, ltd by shares"1106,2056136,"Shanghai Eastern Cabinetry Service Co., Limited
上海遠東櫥櫃服務有限公司",2014-03-18,2017-11-10,"Private, ltd by shares"1107,2056797,"SHANGHAI HONGBIN INTERNATIONAL CO., LIMITED
上海宏斌國際貿易有限公司",2014-03-18,,"Private, ltd by shares"1108,2056613,"SHANGHAI LUMON ELECTROMECHANICAL FACILITIES HOLDING LIMITED
上海運發機電設備股份有限公司",2014-03-18,,"Private, ltd by shares"1109,2056577,"Shanghai MT Packaging Co., Limited
上海麥可婷包裝有限公司",2014-03-18,,"Private, ltd by shares"1110,2056805,"Shanghai Prestige Aluminum Products Co., Limited
上海忠信鋁業有限公司",2014-03-18,2017-09-08,"Private, ltd by shares"1111,2057210,"SHANGHAI XUYANG SMART HOME TECHNOLOGY CO., LIMITED
上海旭揚智能家居科技有限公司",2014-03-18,2019-03-22,"Private, ltd by shares"1112,2056453,"SHANGHAI YAMAHA (JOINT VENTURE) CO., LIMITED
上海雅馬哈(合資)有限公司",2014-03-18,,"Private, ltd by shares"1113,2057339,"SHANSHUI INDUSTRIAL CO., LIMITED
山水實業有限公司",2014-03-18,2016-06-30,"Private, ltd by shares"1114,2056366,"SHEEN GIANT LIMITED",2014-03-18,,"Private, ltd by shares"1115,2056490,"SHENGBAO TECHNOLOGY CO., LIMITED
勝寶科技有限公司",2014-03-18,2016-09-15,"Private, ltd by shares"1116,2056339,"Shenghang Company Limited
升航商業有限公司",2014-03-18,2015-08-28,"Private, ltd by shares"1117,2057375,"SHENGLONGCHANG TRADING CO., LIMITED
盛龍昌貿易有限公司",2014-03-18,2018-08-03,"Private, ltd by shares"1118,2056187,"Shenzhen Aike Century Electronics Co., Limited
深圳艾科世紀電子有限公司",2014-03-18,2019-07-19,"Private, ltd by shares"1119,2056863,"Shenzhen Cozy Hut Co., Limited",2014-03-18,,"Private, ltd by shares"1120,2056131,"SHENZHEN CTE TECHNOLOGY COMPANY LIMITED (d2017-11-10)",2014-03-18,2017-11-10,"Private, ltd by shares"1121,2056391,"SHENZHEN ENCOM ELECTRIC TECHNOLOGIES CO., LIMITED
深圳市易能電氣技術有限公司",2014-03-18,2015-11-20,"Private, ltd by shares"1122,2056514,"SHENZHEN FORESIGHT TRUSS TECHNOLOGY COMPANY LIMITED",2014-03-18,,"Private, ltd by shares"1123,2056392,"SHENZHEN HONGYUNYUAN ELECTRONIC CO., LIMITED
深圳市鴻運沅電子有限公司",2014-03-18,,"Private, ltd by shares"1124,2057245,"SHENZHEN HUOWANG TECHNOLOGY LIMITED
深圳火王科技有限公司",2014-03-18,2019-03-22,"Private, ltd by shares"1125,2056428,"SHENZHEN LONGSTAR TECHNOLOGY CO., LIMITED
深圳朗士達科技有限公司",2014-03-18,,"Private, ltd by shares"1126,2056501,"SHENZHEN NOVAS TECHNOLOGY CO., LIMITED
深圳納沃斯科技有限公司",2014-03-18,,"Private, ltd by shares"1127,2056725,"SHENZHEN PENGAPOWER CO., LIMITED",2014-03-18,2019-03-15,"Private, ltd by shares"1128,2056580,"Shenzhen Prime Technology Limited
深圳正茂科技有限公司",2014-03-18,,"Private, ltd by shares"1129,2056841,"SHENZHEN RGX ELECTRONIC CO., LIMITED
深圳市瑞廣興電子有限公司",2014-03-18,,"Private, ltd by shares"1130,2056037,"SHINY BILLION INTERNATIONAL LIMITED
億亮國際有限公司",2014-03-18,,"Private, ltd by shares"1131,2056038,"SHINY BILLION INVESTMENT LIMITED
億亮投資有限公司",2014-03-18,,"Private, ltd by shares"1132,2056141,"Ship &amp; Johnston Limited
船莊士敦有限公司",2014-03-18,2019-03-15,"Private, ltd by shares"1133,2056714,"SHOULDER INTERNATIONAL GROUP LIMITED",2014-03-18,2019-03-15,"Private, ltd by shares"