,Reg no.,Name,Incorp-orated,Dissolved,Type242,3162793,"More Infor Co., Limited",2022-06-15,,"Private, ltd by shares"243,3162649,"MUQ DE COMPANY LIMITED",2022-06-15,,"Private, ltd by shares"244,3162889,"MY ELECTRON TECHNOLOGY (HK) CO., LIMITED
滿奕電子科技(香港)有限公司",2022-06-15,,"Private, ltd by shares"245,3162610,"Net-Saber Solutions Limited",2022-06-15,,"Private, ltd by shares"246,3162870,"NEWEN CO., LIMITED",2022-06-15,,"Private, ltd by shares"247,3162901,"Newsen Technical Services Limited",2022-06-15,,"Private, ltd by shares"248,3162795,"NMC Brands Limited",2022-06-15,,"Private, ltd by shares"249,3162731,"Noodle Legacy Investment Limited
傳麵世家企業有限公司",2022-06-15,,"Private, ltd by shares"250,3162925,"NOVA LIMITED (HK)",2022-06-15,,"Private, ltd by shares"251,3162914,"NSG Engenharia Limited",2022-06-15,,"Private, ltd by shares"252,3162616,"NUMA LIMITED (HK)",2022-06-15,,"Private, ltd by shares"253,3162804,"ODO CO., LIMITED",2022-06-15,,"Private, ltd by shares"254,3162756,"Oneland Media Hong Kong Limited
壹為諮詢有限公司",2022-06-15,,"Private, ltd by shares"255,3162888,"ONG CORPORATION LIMITED",2022-06-15,,"Private, ltd by shares"256,3162832,"Only Money Co., Limited",2022-06-15,,"Private, ltd by shares"257,3162700,"OrthoDent Technology Co., Limited
奧索登特科技有限公司",2022-06-15,,"Private, ltd by shares"258,3162956,"P Automotive Solution Group Limited",2022-06-15,,"Private, ltd by shares"259,3162765,"PEACE SHIPPING LIMITED (b2022-06-15)
平安海運有限公司",2022-06-15,,"Private, ltd by shares"260,3162644,"Perfect Bulk (HK) Limited",2022-06-15,,"Private, ltd by shares"261,3162691,"Pictus Medical Limited
恩信醫療發展有限公司",2022-06-15,,"Private, ltd by shares"262,3162613,"Pilates and Conditioning Hong Kong Limited",2022-06-15,,"Private, ltd by shares"263,3162722,"Podcast Media Company Limited
播客媒體有限公司",2022-06-15,,"Private, ltd by shares"264,3162766,"Pre-Qin Investment (HK) Co., Limited
先秦投資(香港)有限公司",2022-06-15,,"Private, ltd by shares"265,3162635,"PTA Technology Co., Limited
聚泰科技有限公司",2022-06-15,,"Private, ltd by shares"266,3162922,"Qiangqiandan Trading Co., Limited
搶錢蛋貿易有限公司",2022-06-15,,"Private, ltd by shares"267,3162830,"QINGRAN INTERNATIONAL TRADING LIMITED
清然國際貿易有限公司",2022-06-15,,"Private, ltd by shares"268,3162866,"Qxing Trade Co., Limited
啟行貿易有限公司",2022-06-15,,"Private, ltd by shares"269,3162873,"R Win Limited
小露寶有限公司",2022-06-15,,"Private, ltd by shares"270,3162621,"Raystar International Trade Limited
瑞斯達國際貿易有限公司",2022-06-15,,"Private, ltd by shares"271,3162764,"Red Sun Financial Holdings Limited
紅日金融控股有限公司",2022-06-15,,"Private, ltd by shares"272,3162880,"ReelSights Limited",2022-06-15,,"Private, ltd by shares"273,3162810,"Relevant Audience Digital Marketing Agency Limited",2022-06-15,,"Private, ltd by shares"274,3162869,"Renzhi Medical Technology (Hong Kong) Co., Limited
仁治醫藥科技(香港)有限公司",2022-06-15,,"Private, ltd by shares"275,3162842,"Return Youth Design (HK) Co., Limited
退回青年(香港)設計有限公司",2022-06-15,,"Private, ltd by shares"276,3162730,"RICHFORD INTERNATIONAL CONSULTING LIMITED
淶富國際顧問有限公司",2022-06-15,,"Private, ltd by shares"277,3162777,"Roemer &amp; Bechtel (HK) Company Limited
羅馬柏特(香港)有限公司",2022-06-15,,"Private, ltd by shares"278,3162962,"RONGLION HK LIMITED
榮萊昂香港有限公司",2022-06-15,,"Private, ltd by shares"279,3162897,"RUME TECHNOLOGY LIMITED
濡美科技有限公司",2022-06-15,,"Private, ltd by shares"280,3162678,"S. &amp; W. Property Limited
舜宏物業代理有限公司",2022-06-15,,"Private, ltd by shares"281,3162817,"SALAM UNIVERSAL TRADING COMPANY LIMITED
薩拉姆環球貿易有限公司",2022-06-15,,"Private, ltd by shares"282,3162934,"Sam Kwok Logistics Limited
三國物流有限公司",2022-06-15,,"Private, ltd by shares"283,3162884,"Samheli Precision Manufacture Limited
森合利精密製造有限公司",2022-06-15,,"Private, ltd by shares"284,3162792,"Samphanie (HK) Limited",2022-06-15,,"Private, ltd by shares"285,3162618,"SanWui Consultants Limited
新匯諮詢服務有限公司",2022-06-15,,"Private, ltd by shares"286,3162811,"SCMC &amp; CO Limited",2022-06-15,,"Private, ltd by shares"287,3162831,"SEEMORE TECHNOLOGIES CO., LIMITED
芯旺科技有限公司",2022-06-15,,"Private, ltd by shares"288,3162746,"SHANE STAR HK LIMITED
新星耀香港有限公司",2022-06-15,,"Private, ltd by shares"289,3162636,"Shenzhen Ceyuan Electronic Instrument Co., Limited",2022-06-15,,"Private, ltd by shares"290,3162966,"Sheung Tsuen Trading Limited
上川貿易有限公司",2022-06-15,,"Private, ltd by shares"291,3162693,"Shiamas Delicatessen Limited
崇盟精饌有限公司",2022-06-15,,"Private, ltd by shares"292,3162824,"SHINING POINT DEVELOPMENT LIMITED
良耀發展有限公司",2022-06-15,,"Private, ltd by shares"293,3162761,"SHIPPER (HK) LIMITED
迅朋(香港)有限公司",2022-06-15,,"Private, ltd by shares"294,3162821,"Shirly International Trading Co., Limited
雪莉爾國際貿易有限公司",2022-06-15,,"Private, ltd by shares"295,3162849,"Signal Action Limited
信路啟程有限公司",2022-06-15,,"Private, ltd by shares"296,3162879,"SIKA ACTION CO., LIMITED
錫達實業有限公司",2022-06-15,,"Private, ltd by shares"297,3162916,"SilverFox Studios Limited
銀狐設計工程有限公司",2022-06-15,,"Private, ltd by shares"298,3162732,"SIMERDA TECHNOLOGY (HK) CO., LIMITED
芯而達(香港)科技有限公司",2022-06-15,,"Private, ltd by shares"299,3162751,"SINMAYER PTE LIMITED
新美亞(香港)集團有限公司",2022-06-15,,"Private, ltd by shares"300,3162958,"Sinolasting Trading Company Limited
中閱貿易有限公司",2022-06-15,,"Private, ltd by shares"301,3162662,"SOLUTIONS MARITIME LIMITED",2022-06-15,,"Private, ltd by shares"302,3162905,"Soulergy Hong Kong Development Company Limited
御心殿香港發展有限公司",2022-06-15,,"Private, ltd by shares"303,3162776,"ST HONORAT INVESTMENTS COMPANY LIMITED",2022-06-15,,"Private, ltd by shares"304,3162701,"Standard Strategy &amp; Solution Limited",2022-06-15,,"Private, ltd by shares"305,3162917,"Star Finance Fintech Limited
星環金融科技有限公司",2022-06-15,,"Private, ltd by shares"306,3162708,"Star Sun Trade Limited
星辰跨境貿易有限公司",2022-06-15,,"Private, ltd by shares"307,3162797,"Sun Luen Hing Trading Limited
新聯興糧食貿易有限公司",2022-06-15,,"Private, ltd by shares"308,3162921,"SUN OCEAN SHIPPING CO., LIMITED
聖洋海運有限公司",2022-06-15,,"Private, ltd by shares"309,3162798,"Superior Technology Trading Co., Limited",2022-06-15,,"Private, ltd by shares"310,3162643,"Tak Hong Kin Trading Limited
德康健貿易有限公司",2022-06-15,,"Private, ltd by shares"311,3162853,"Tameel Limited
覃有限公司",2022-06-15,,"Private, ltd by shares"312,3162770,"TANK TECHNOLOGY (HONG KONG) LIMITED
坦克科技(香港)有限公司",2022-06-15,,"Private, ltd by shares"313,3162904,"Tao Da Da Yang Shan Juicy Peach Trade Limited
桃大大陽山水蜜桃商貿有限公司",2022-06-15,,"Private, ltd by shares"314,3162829,"Teckon Precision Limited
方源精密元件有限公司",2022-06-15,,"Private, ltd by shares"315,3162611,"TENGDA FOOD LIMITED
騰達食品有限公司",2022-06-15,,"Private, ltd by shares"316,3162927,"THEIR. STUDIO LIMITED",2022-06-15,,"Private, ltd by shares"317,3162632,"Thinkplus Expo Group Limited",2022-06-15,,"Private, ltd by shares"318,3162743,"Tin Kei Engineering Co., Limited
天璣工程有限公司",2022-06-15,,"Private, ltd by shares"319,3162910,"TINSHING DOJANG HOLDING COMPANY LIMITED
天盛道場控股有限公司",2022-06-15,,"Private, ltd by shares"320,3162707,"TMH Investment Limited
宇捷控股有限公司",2022-06-15,,"Private, ltd by shares"321,3162671,"ToMetal Industrial Co., Limited",2022-06-15,,"Private, ltd by shares"322,3162625,"TOYOSU TECHNOLOGY (HK) CO., LIMITED
豊洲科技(香港)有限公司",2022-06-15,,"Private, ltd by shares"323,3162747,"TRUE BANQUET SQUARE (HK) HOLDINGS LIMITED
真宴坊(香港)控股有限公司",2022-06-15,,"Private, ltd by shares"324,3162755,"Unibridge Enterprise Co., Limited
競滿實業有限公司",2022-06-15,,"Private, ltd by shares"325,3162968,"United Fortune International Logistics Limited
合盈國際物流有限公司",2022-06-15,,"Private, ltd by shares"326,3162852,"V &amp; S PROMOTIONS LIMITED",2022-06-15,,"Private, ltd by shares"327,3162948,"Vana Jewelry Limited",2022-06-15,,"Private, ltd by shares"328,3162893,"Vantage View Limited",2022-06-15,,"Private, ltd by shares"329,3162867,"VEILITONI TRADING CO., LIMITED
維利東尼貿易有限公司",2022-06-15,,"Private, ltd by shares"330,3162975,"Venture Digital Limited (HK)",2022-06-15,,"Private, ltd by shares"331,3162741,"Vladi R&amp;D Limited",2022-06-15,,"Private, ltd by shares"332,3162865,"VN Medical Beauty Company Limited
美凱醫學美容有限公司",2022-06-15,,"Private, ltd by shares"333,3162942,"Vr Vision Limited",2022-06-15,,"Private, ltd by shares"334,3162843,"Waldorf Tobacco Group Co., Limited
華爾道夫煙草集團有限公司",2022-06-15,,"Private, ltd by shares"335,3162688,"Weiweigang Electronic Commerce Co., Limited
偉維港中電子商務有限公司",2022-06-15,,"Private, ltd by shares"336,3162709,"WELLNESS QI LIMITED",2022-06-15,,"Private, ltd by shares"337,3162733,"WELMETAL INVESTMENT HOLDING LIMITED
華美投資控股有限公司",2022-06-15,,"Private, ltd by shares"338,3162863,"Weme Creative Design (HK) Limited
微米創意（香港）有限公司",2022-06-15,,"Private, ltd by shares"339,3162704,"WM Starry Holdings Limited",2022-06-15,,"Private, ltd by shares"340,3162703,"WOFL EMPEROR MEDIA LIMITED
狼帝傳媒有限公司",2022-06-15,,"Private, ltd by shares"341,3162822,"Wonderful Dispensary (Hong Kong) Limited
威峯大藥房(香港)有限公司",2022-06-15,,"Private, ltd by shares"342,3162808,"Xiaodexinxizixun Limited",2022-06-15,,"Private, ltd by shares"343,3162967,"XIEHE (SHANGHAI) BIOLOGY TECHNOLOGY LIMITED
協和(上海)生物科技有限公司",2022-06-15,,"Private, ltd by shares"344,3162687,"XINGHE CENTURY ELECTRONICS CO., LIMITED
星河世紀電子有限公司",2022-06-15,,"Private, ltd by shares"345,3162915,"XINTEL GROUP INDUSTRY DEVELOPMENT CO., LIMITED
鑫泰集團實業發展有限公司",2022-06-15,,"Private, ltd by shares"346,3162845,"XINYUAN LIMITED",2022-06-15,,"Private, ltd by shares"347,3162815,"XOXO Limited",2022-06-15,,"Private, ltd by shares"348,3162894,"XUSHENG RONGCHUANG TECHNOLOGY LIMITED
栩生融創科技有限公司",2022-06-15,,"Private, ltd by shares"349,3162758,"Yaguara Commerce &amp; Trade Limited",2022-06-15,,"Private, ltd by shares"350,3162768,"Yifeixinyue Co., Limited",2022-06-15,,"Private, ltd by shares"351,3162814,"Ying Wah Dispensary (Hong Kong) Limited
英華藥房(香港)有限公司",2022-06-15,,"Private, ltd by shares"352,3162902,"YINGTIAN MINING CO. LIMITED
應天礦業有限公司",2022-06-15,,"Private, ltd by shares"353,3162676,"YingTong International Trading Limited
盈通國際貿易有限公司",2022-06-15,,"Private, ltd by shares"354,3162772,"YIYUN INTERNATIONAL MEDICAL CO., LIMITED
易運國際醫療有限公司",2022-06-15,,"Private, ltd by shares"355,3162954,"Your CMP Limited
汝醫中醫診所有限公司",2022-06-15,,"Private, ltd by shares"356,3162775,"YOUWEI TRADING LIMITED
友維貿易有限公司",2022-06-15,,"Private, ltd by shares"357,3162848,"YUAN CHANG ENGINEERING LIMITED
元昌工程有限公司",2022-06-15,,"Private, ltd by shares"358,3162841,"Yuekangmei International Limited
玥康美國際股份有限公司",2022-06-15,,"Private, ltd by shares"359,3162907,"ZG GROUP LIMITED
宏鑫集團有限公司",2022-06-15,,"Private, ltd by shares"360,3162912,"ZHEJIANG RAYCHEM STEEL INDUSTRY CO., LIMITED
浙江瑞誠鋼業有限公司",2022-06-15,,"Private, ltd by shares"361,3162874,"Zhitong Investment Co., Limited
芷桐投資有限公司",2022-06-15,,"Private, ltd by shares"362,3162658,"ZHONG LIANG CAPITAL HOLDING LIMITED
中良資本控股有限公司",2022-06-15,,"Private, ltd by shares"363,3162791,"Zhonghui International Co., Limited
中徽國際有限公司",2022-06-15,,"Private, ltd by shares"364,3162749,"ZHONGNENG XINJI (CHINA) PETROCHEMICAL CO., LIMITED
中能新稷(中國)石油化工有限公司",2022-06-15,,"Private, ltd by shares"365,3162724,"ZHONGTIAN CHUANGYING GROUP CO., LIMITED
中天創贏集團有限公司",2022-06-15,,"Private, ltd by shares"366,3162745,"Zhu Nuo Nuo Investment Group (Hong Kong) Co., Limited
豬糯糯投資集團(香港)有限公司",2022-06-15,,"Private, ltd by shares"367,3162713,"Zi Ben Jie Financial Holding Group Co., Limited
資本界金控集團股份有限公司",2022-06-15,,"Private, ltd by shares"368,3162872,"ZOOMLAND INDUSTRIES LIMITED
鉅聯實業(香港)有限公司",2022-06-15,,"Private, ltd by shares"369,3162706,"Zoomxm Holding Group Limited",2022-06-15,,"Private, ltd by shares"370,3162699,"ZQF (HK) Trading Co., Limited
正青鋒（香港）貿易有限公司",2022-06-15,,"Private, ltd by shares"371,3162682,"ZX TRADING LIMITED
正信貿易有限公司",2022-06-15,,"Private, ltd by shares"