,Reg no.,Name,Incorp-orated,Dissolved,Type236,3162407,"JKD Apparel Solution Limited",2022-06-14,,"Private, ltd by shares"237,3162526,"JLS SHIP NO.8 COMPANY LIMITED",2022-06-14,,"Private, ltd by shares"238,3162571,"Journey of life Company Limited
拉闊人生之旅有限公司",2022-06-14,,"Private, ltd by shares"239,3162308,"JOYWELL INT'L CO., LIMITED",2022-06-14,,"Private, ltd by shares"240,3162435,"Ju Fu Sheng Hong Kong Trading Co., Limited
聚福盛香港貿易有限公司",2022-06-14,,"Private, ltd by shares"241,3162266,"Jurui International Trade Co., Limited
聚瑞國際貿易有限公司",2022-06-14,,"Private, ltd by shares"242,3162285,"JUST ENERGY TRADING LIMITED",2022-06-14,,"Private, ltd by shares"243,3162217,"KA WING PROPERTY AGENCY LIMITED
家榮地產代理有限公司",2022-06-14,,"Private, ltd by shares"244,3162331,"KangChen HK International Trade Co., Limited
康宸香港國際貿易有限公司",2022-06-14,,"Private, ltd by shares"245,3162369,"Kegrid Co., Limited
凱格有限公司",2022-06-14,,"Private, ltd by shares"246,3162470,"KOOYUAN LIMITED
珂緣有限公司",2022-06-14,,"Private, ltd by shares"247,LF7266494,"KR 2022 China Growth Limited Partnership Fund",2022-06-14,,"Limited Partnership Fund"248,LF7266493,"KR 2022 New Infrastructure Limited Partnership Fund",2022-06-14,,"Limited Partnership Fund"249,3162456,"Kuchiyo Co., Limited
庫趣游有限公司",2022-06-14,,"Private, ltd by shares"250,3162496,"Kuga E-commerce Company Limited
廣州古迦電子商務有限公司",2022-06-14,,"Private, ltd by shares"251,3162505,"KY Capital Hong Kong Limited
啟裕資本有限公司",2022-06-14,,"Private, ltd by shares"252,3162529,"KYLED LIMITED",2022-06-14,,"Private, ltd by shares"253,3162185,"LAM FAT RICE LIMITED",2022-06-14,,"Private, ltd by shares"254,3162306,"LCM Solution Limited",2022-06-14,,"Private, ltd by shares"255,3162231,"LEEKA INTERNATIONAL LIMITED
力珈國際有限公司",2022-06-14,,"Private, ltd by shares"256,3162594,"Liang Ji Hui Digital Limited
靚機匯數碼有限公司",2022-06-14,,"Private, ltd by shares"257,3162393,"LILIN INDUSTRIAL HONGKONG LIMITED
利林實業香港有限公司",2022-06-14,,"Private, ltd by shares"258,3162490,"Lilliput Electronic Co., Limited",2022-06-14,,"Private, ltd by shares"259,3162515,"Limao Sports Electric Import Limited",2022-06-14,,"Private, ltd by shares"260,3162392,"LINGYU TRADING LIMITED
凌宇貿易有限公司",2022-06-14,,"Private, ltd by shares"261,3162354,"Lion Rock Sporting Goods Limited
獅子山體育有限公司",2022-06-14,,"Private, ltd by shares"262,3162240,"Lotcos Limited",2022-06-14,,"Private, ltd by shares"263,3162487,"LOUKASIAN GROUP LIMITED",2022-06-14,,"Private, ltd by shares"264,3162423,"Love Play Technology Co., Limited
好玩科技有限公司",2022-06-14,,"Private, ltd by shares"265,3162421,"Luck Fairy Trade Limited",2022-06-14,,"Private, ltd by shares"266,3162287,"M&amp;S Biosciences Co., Limited",2022-06-14,,"Private, ltd by shares"267,3162564,"M-Smart Technology (HK) Limited",2022-06-14,,"Private, ltd by shares"268,3162377,"Man Success (Southern) Industry Limited
聞昇(南區)實業有限公司",2022-06-14,,"Private, ltd by shares"269,3162296,"Man Success (Tsuen Wan) Industry Limited
聞昇(荃灣)實業有限公司",2022-06-14,,"Private, ltd by shares"270,3162299,"Man Success (Yau Tsim Mong) Industry Limited
聞昇(油尖旺)實業有限公司",2022-06-14,,"Private, ltd by shares"271,3162319,"Manyo Company Limited
譽貿易有限公司",2022-06-14,,"Private, ltd by shares"272,3162335,"Maple Finance Limited",2022-06-14,,"Private, ltd by shares"273,3162452,"Maystar Media Entertainment Limited
星美傳媒娛樂有限公司",2022-06-14,,"Private, ltd by shares"274,3162317,"MCA CULTURE LIMITED",2022-06-14,,"Private, ltd by shares"275,3162195,"Meiyuda Instrument Co., Limited
美譽達儀器有限公司",2022-06-14,,"Private, ltd by shares"276,3162325,"Merrygrowround Children's Workshop Limited
由樂圓兒童社有限公司",2022-06-14,,"Private, ltd by shares"277,3162316,"Midshine Metalwork Co., Limited
銘尚五金科技有限公司",2022-06-14,,"Private, ltd by shares"278,3162549,"MING WAH TECHNOLOGY CO., LIMITED
明華科技有限公司",2022-06-14,,"Private, ltd by shares"279,3162479,"Minhaj-ul-Quran Association Limited",2022-06-14,,"Ltd by guarantee"280,3162484,"MINTMETA TECHNOLOGY LIMITED
諸元億數科技有限公司",2022-06-14,,"Private, ltd by shares"281,3162314,"MM Star Materials Trading And Investment Limited
星越貿易投資有限公司",2022-06-14,,"Private, ltd by shares"282,3162577,"MOOM TOWN TEXTILE LIMITED",2022-06-14,,"Private, ltd by shares"283,3162558,"MOVING FAST LIMITED (HK)
搬屋快有限公司",2022-06-14,,"Private, ltd by shares"284,3162221,"MS Industry Group Limited",2022-06-14,,"Private, ltd by shares"285,3162269,"Nanyang Cosmeceutical Limited
南洋藥妝貿易有限公司",2022-06-14,,"Private, ltd by shares"286,3162381,"NAV SERVICE CO., LIMITED",2022-06-14,,"Private, ltd by shares"287,3162552,"Ninety One Food Limited
晉達食品有限公司",2022-06-14,,"Private, ltd by shares"288,3162246,"Niseko Q Fox Property Management Limited
二世古雪狐物業管理有限公司",2022-06-14,,"Private, ltd by shares"289,3162550,"NORRIS TECHNOLOGY LIMITED
諾睿斯科技有限公司",2022-06-14,,"Private, ltd by shares"290,3162328,"North China Huanuo Pharmaceutical Co., Limited
華北華諾藥業有限公司",2022-06-14,,"Private, ltd by shares"291,3162213,"Nova IT Consulting Global Limited",2022-06-14,,"Private, ltd by shares"292,3162540,"Nsono Limited",2022-06-14,,"Private, ltd by shares"293,3162278,"OCEAN OIL BUNKERING (HK) LIMITED
海洋石油供應（香港）有限公司",2022-06-14,,"Private, ltd by shares"294,3162311,"OCEAN PARTNERS HOLDINGS COMPANY LIMITED",2022-06-14,,"Private, ltd by shares"295,3162263,"Offer World Education Consulting Co., Limited
奧弗海外教育咨詢有限公司",2022-06-14,,"Private, ltd by shares"296,3162365,"One Fabrics Limited (The)
香港萬邦綢緞有限公司",2022-06-14,,"Private, ltd by shares"297,3162304,"OPHI Studio Limited
奧帆設計有限公司",2022-06-14,,"Private, ltd by shares"298,3162451,"Orange Overseas E-Commerce Limited
橙果海外電商有限公司",2022-06-14,,"Private, ltd by shares"299,3162593,"ORIG ELECTRONICS TECHNOLOGY LIMITED
瑞吉電子科技有限公司",2022-06-14,,"Private, ltd by shares"300,3162458,"OUKAIYA TRADING CO., LIMITED
歐凱亞貿易有限公司",2022-06-14,,"Private, ltd by shares"301,3162562,"OUSANG INDUSTRIAL CO., LIMITED
澳升實業有限公司",2022-06-14,,"Private, ltd by shares"302,3162233,"Parcel Fever Limited
活力快遞有限公司",2022-06-14,,"Private, ltd by shares"303,3162537,"Patient Care Limited
病有所依有限公司",2022-06-14,,"Ltd by guarantee"304,3162449,"Pearl Crypto Limited
珍珠加密有限公司",2022-06-14,,"Private, ltd by shares"305,3162605,"Perfect Angel Limited",2022-06-14,,"Private, ltd by shares"306,3162507,"Perfect Computer and Electronic Trading Company Limited
完美電腦電子貿易有限公司",2022-06-14,,"Private, ltd by shares"307,3162597,"Phantom Express Limited
灝添速運有限公司",2022-06-14,,"Private, ltd by shares"308,3162501,"PIONEER SPORTS DEVELOPMENT LIMITED
先鋒體育發展有限公司",2022-06-14,,"Private, ltd by shares"309,3162199,"Plentiful Logistics Limited
萬象物流有限公司",2022-06-14,,"Private, ltd by shares"310,3162259,"Plutus Organization Limited
普路托斯業務有限公司",2022-06-14,,"Private, ltd by shares"311,3162527,"PMC ASSET MANAGEMENT CORP LIMITED",2022-06-14,,"Private, ltd by shares"312,3162226,"PO FONG ENGINEERING HONG KONG COMPANY LIMITED
保峰工程香港有限公司",2022-06-14,,"Private, ltd by shares"313,3162545,"Premium Production HK Limited
香港優越製作有限公司",2022-06-14,,"Private, ltd by shares"314,3162232,"PRESTIGE CAPITAL MANAGEMENTS LIMITED",2022-06-14,,"Private, ltd by shares"315,3162397,"PU WAI TRADING LIMITED
浦匯貿易有限公司",2022-06-14,,"Private, ltd by shares"316,3162446,"PUHUI INTERNATIONAL PRECISION MEDICAL CENTER LIMITED
普暉國際精準醫學中心有限公司",2022-06-14,,"Private, ltd by shares"317,3162414,"PURE PURE COMPANY LIMITED
清清有限公司",2022-06-14,,"Private, ltd by shares"318,3162200,"QCidea Limited
喬思廣告製作有限公司",2022-06-14,,"Private, ltd by shares"319,3162573,"Qilun Group Limited",2022-06-14,,"Private, ltd by shares"320,3162538,"Qin And Jin Dynasty Limited
秦晉有限公司",2022-06-14,,"Private, ltd by shares"321,3162281,"Rancher Global Limited",2022-06-14,,"Private, ltd by shares"322,3162298,"RAW HEALTH RPODUCTS LIMITED
原生健康食品有限公司",2022-06-14,,"Private, ltd by shares"323,3162295,"REDSTAR INTERNATIONAL SHIPPING CO., LIMITED",2022-06-14,,"Private, ltd by shares"324,3162608,"Refined Motor Company Limited",2022-06-14,,"Private, ltd by shares"325,3162498,"Reitar Asset Management Limited
域塔資產管理有限公司",2022-06-14,,"Private, ltd by shares"326,3162561,"RIMBOT INTERNATIONAL TRADE LIMITED
易博國際貿易有限公司",2022-06-14,,"Private, ltd by shares"327,3162520,"Ring my bell Limited",2022-06-14,,"Private, ltd by shares"328,3162286,"Riverside Estate Limited",2022-06-14,,"Private, ltd by shares"329,3162220,"RONGTAI TECHNOLOGY HK LIMITED
融泰科技香港有限公司",2022-06-14,,"Private, ltd by shares"330,3162448,"Roundtable Production Limited
圓桌製作有限公司",2022-06-14,,"Private, ltd by shares"331,3162264,"RUICHENG ELECTRONICS HK LIMITED
香港瑞成電子有限公司",2022-06-14,,"Private, ltd by shares"332,3162437,"Running Luffa (Hong Kong) Limited (The)",2022-06-14,,"Private, ltd by shares"333,3162372,"Russia Luk Limited",2022-06-14,,"Private, ltd by shares"334,3162431,"RUSSIAN JINGNIANG BEER CO., LIMITED
俄羅斯精釀啤酒有限公司",2022-06-14,,"Private, ltd by shares"335,3162512,"RZ INFORMATION TECHNOLOGY (HONG KONG) CO., LIMITED",2022-06-14,,"Private, ltd by shares"336,3162358,"S &amp; R SHOKEN LIMITED",2022-06-14,,"Private, ltd by shares"337,3162530,"Saish International Co., Limited",2022-06-14,,"Private, ltd by shares"338,3162382,"SanLik Drainage Engineering Limited
新力渠務工程有限公司",2022-06-14,,"Private, ltd by shares"339,3162361,"Santon Gold Forex Limited",2022-06-14,,"Private, ltd by shares"340,3162474,"SAt Trading Co., Limited
賽特貿易有限公司",2022-06-14,,"Private, ltd by shares"341,3162508,"SATNAV LOGISTICS LIMITED",2022-06-14,,"Private, ltd by shares"342,3162219,"SCHOLASTIC GO CLUB WEIQI EDUCATION COMPANY LIMITED (THE)
文奕社教育有限公司",2022-06-14,,"Private, ltd by shares"343,3162187,"Seven Trees Limited",2022-06-14,,"Private, ltd by shares"344,3162394,"Shaft Innovations HK Limited",2022-06-14,,"Private, ltd by shares"345,3162514,"Shanghai People's Intelligent Control Technology Company Limited
上海人民智控科技有限公司",2022-06-14,,"Private, ltd by shares"346,3162432,"Share the Love Foundation Limited
傳晴慈善基金有限公司",2022-06-14,,"Ltd by guarantee"347,3162525,"Shenzhen EONE Co., Limited
深圳益沃有限公司",2022-06-14,,"Private, ltd by shares"348,3162256,"Shodor HK Limited
象多香港有限公司",2022-06-14,,"Private, ltd by shares"349,3162584,"Shui Chun Limited
瑞浚有限公司",2022-06-14,,"Private, ltd by shares"350,3162412,"SHUN FAI DECORATION ENGINEERING LIMITED
迅輝裝飾工程有限公司",2022-06-14,,"Private, ltd by shares"351,3162480,"Shunda Zhonggang Logistics Co., Limited
順達(中港)物流有限公司",2022-06-14,,"Private, ltd by shares"352,3162403,"Shunlong Trade Limited
舜隆貿易有限公司",2022-06-14,,"Private, ltd by shares"353,3162184,"SICHUAN PIANO ASSOCIATION CO., LIMITED
四川省鋼琴協會有限公司",2022-06-14,,"Private, ltd by shares"354,3162327,"Silian Network Technology Co., Limited
斯莉安網絡科技有限公司",2022-06-14,,"Private, ltd by shares"355,3162483,"SIMPO ERA INTERNATIONAL GROUP LIMITED
樸實國際控股集團有限公司",2022-06-14,,"Private, ltd by shares"356,3162302,"Singron International (HK) Co., Limited
承潤國際(香港)有限公司",2022-06-14,,"Private, ltd by shares"357,3162491,"Sino African Trade Development Limited
中非貿易拓展有限公司",2022-06-14,,"Private, ltd by shares"358,3162425,"Sky Star Global Limited",2022-06-14,,"Private, ltd by shares"359,3162348,"SKY-U INTERNATIONAL TRADING CO., LIMITED
天予國際貿易有限公司",2022-06-14,,"Private, ltd by shares"360,3162478,"Smart Kids Association Limited
育苗協會有限公司",2022-06-14,,"Ltd by guarantee"361,3162592,"SNAP CHARGE TECHNOLOGY (HK) LIMITED
閃充科技（香港）有限公司",2022-06-14,,"Private, ltd by shares"362,3162243,"SO I SING LIMITED",2022-06-14,,"Private, ltd by shares"363,3162294,"Sofia Star Limited",2022-06-14,,"Private, ltd by shares"364,3162536,"Song_Taxi Island Limited
爽的香港外島有限公司",2022-06-14,,"Private, ltd by shares"365,3162509,"Soyciety Company Limited
豆舍有限公司",2022-06-14,,"Private, ltd by shares"366,3162368,"Springboard Wellness Limited",2022-06-14,,"Private, ltd by shares"367,3162248,"Sugary Art Limited",2022-06-14,,"Private, ltd by shares"368,3162241,"Sun Galaxy Enterprise Limited
旭億企業有限公司",2022-06-14,,"Private, ltd by shares"369,3162547,"SUNHEAD MAIL LIMITED
光綈有限公司",2022-06-14,,"Private, ltd by shares"370,3162351,"Sunview International Co., Limited
香港升威實業有限公司",2022-06-14,,"Private, ltd by shares"371,3162208,"Sustainable Business Advisory Limited
永續企業咨詢有限公司",2022-06-14,,"Private, ltd by shares"372,3162280,"Sustainable Energy Trading Limited",2022-06-14,,"Private, ltd by shares"373,3162229,"SWINDS TECHNOLOGY COMPANY LIMITED
影風科技有限公司",2022-06-14,,"Private, ltd by shares"374,3162194,"Taktak Discrete Industry Limited
搭客離散式工業有限公司",2022-06-14,,"Private, ltd by shares"375,3162439,"Taste Kiosk Limited
一品料理有限公司",2022-06-14,,"Private, ltd by shares"376,3162406,"TBED HK Limited",2022-06-14,,"Private, ltd by shares"377,3162211,"Teamfy Labs Limited",2022-06-14,,"Private, ltd by shares"378,3162320,"TechLogis Company Limited
科運科技有限公司",2022-06-14,,"Private, ltd by shares"379,3162391,"Tengyu Clothing Trading Co., Limited
騰宇商貿有限公司",2022-06-14,,"Private, ltd by shares"380,3162214,"Theraxco Limited",2022-06-14,,"Private, ltd by shares"381,3162473,"Think Tank International Trade Co., Limited",2022-06-14,,"Private, ltd by shares"382,3162267,"Thunder Cheese Limited",2022-06-14,,"Private, ltd by shares"383,3162236,"TIDAL LIMITED
盈汐有限公司",2022-06-14,,"Private, ltd by shares"384,3162249,"TIM MAY SERVICES CONSULTANT LIMITED
天美服務顧問有限公司",2022-06-14,,"Private, ltd by shares"385,3162408,"TOGIK Limited",2022-06-14,,"Private, ltd by shares"386,3162572,"TOTAL CHRONO LIMITED (HK)",2022-06-14,,"Private, ltd by shares"387,3162271,"Total Solution Tech PTE Limited",2022-06-14,,"Private, ltd by shares"388,3162356,"Tourbillion Associates Limited
旋風聯合有限公司",2022-06-14,,"Private, ltd by shares"389,3162362,"Tristar Catering Limited (HK)
叁星餐飲有限公司",2022-06-14,,"Private, ltd by shares"390,3162557,"Tuce International Limited
途測國際有限公司",2022-06-14,,"Private, ltd by shares"391,3162222,"TutorABC Global Limited",2022-06-14,,"Private, ltd by shares"392,3162415,"TWO THREE COMPANY LIMITED
貳叄有限公司",2022-06-14,,"Private, ltd by shares"393,3162262,"United Technology (HK) Development Co., Limited
聯合科技(香港)發展有限公司",2022-06-14,,"Private, ltd by shares"394,3162398,"W.K. 2022 LIMITED
弘健2022有限公司",2022-06-14,,"Private, ltd by shares"395,3162275,"WAI SHUN (HONG KONG) ENGINEERING LIMITED
威信(香港)工程有限公司",2022-06-14,,"Private, ltd by shares"396,3162282,"WALLET PRO HOLDINGS COMPANY LIMITED
專業錢包控股有限公司",2022-06-14,,"Private, ltd by shares"397,3162189,"Waste Tyre Recycling Hong Kong Limited
香港廢輪胎回收有限公司",2022-06-14,,"Private, ltd by shares"398,3162341,"WAWO Creative Technology Limited",2022-06-14,,"Private, ltd by shares"399,3162443,"We Stylio Limited",2022-06-14,,"Private, ltd by shares"400,3162416,"WEGORE INT LIMITED
維戈國際有限公司",2022-06-14,,"Private, ltd by shares"401,3162502,"WENZHOU LIANHE VALVE FITTING CO., LIMITED
溫州聯和閥門管件有限公司",2022-06-14,,"Private, ltd by shares"402,3162583,"WIN GRAND INTERNATIONAL LIMITED
普勝國際有限公司",2022-06-14,,"Private, ltd by shares"403,3162606,"Winning Japso Company Limited",2022-06-14,,"Private, ltd by shares"404,3162428,"WOW Talent Management Limited",2022-06-14,,"Private, ltd by shares"405,3162460,"Wu Man Trading Limited
烏汶貿易有限公司",2022-06-14,,"Private, ltd by shares"406,3162440,"WU YI LIMITED
武夷有限公司",2022-06-14,,"Private, ltd by shares"407,3162230,"WUJI (THAILAND) BRAND MANAGEMENT INTERNATIONAL CO., LIMITED
物及（泰國）品牌管理國際有限公司",2022-06-14,,"Private, ltd by shares"408,3162315,"WUYOU NETWORK TECHNOLOGY HK LIMITED
吾遊網絡技術(香港)有限公司",2022-06-14,,"Private, ltd by shares"409,3162438,"XIANGRONG INTERNATIONAL TRADING LIMITED
祥融國際貿易有限公司",2022-06-14,,"Private, ltd by shares"410,3162413,"XIANGXIN INTERNATIONAL CO., LIMITED
祥鑫國際有限公司",2022-06-14,,"Private, ltd by shares"411,3162503,"XINFENGDA INDUSTRY (HK) LIMITED
新豐達實業(香港)有限公司",2022-06-14,,"Private, ltd by shares"412,3162204,"XINHAI Advisory Service Limited
鑫海諮詢服務有限公司",2022-06-14,,"Private, ltd by shares"413,3162373,"Xinyi Tech Limited
芯益科技有限公司",2022-06-14,,"Private, ltd by shares"414,3162292,"XUN WEI TRADING DEVELOP LIMITED
訊威貿易拓展有限公司",2022-06-14,,"Private, ltd by shares"415,3162301,"Yat Choi Logistics Company Limited
溢財物流有限公司",2022-06-14,,"Private, ltd by shares"416,3162209,"YIN GANG TRADING DEVELOP LIMITED
銀港貿易拓展有限公司",2022-06-14,,"Private, ltd by shares"417,3162340,"Yin Hei Tong TCM Co., Limited
然熙堂醫療有限公司",2022-06-14,,"Private, ltd by shares"418,3162600,"Yixin Culture Media Limited
億鑫文化傳媒有限公司",2022-06-14,,"Private, ltd by shares"419,3162424,"Youyaku Electric Technology Co., Limited",2022-06-14,,"Private, ltd by shares"420,3162497,"Yu Sau Trading Limited
裕秀貿易有限公司",2022-06-14,,"Private, ltd by shares"421,3162531,"Yuankai International Trading Co., Limited
源楷國際貿易有限公司",2022-06-14,,"Private, ltd by shares"422,3162411,"Yuen Yin Jewellery Limited
炫湮珠寶有限公司",2022-06-14,,"Private, ltd by shares"423,3162310,"YUNSHANGZHI Microelectronics HK CO., LIMITED
雲尚智微電子香港有限公司",2022-06-14,,"Private, ltd by shares"424,3162291,"YXH Tool&amp;Die Co., Limited",2022-06-14,,"Private, ltd by shares"425,3162307,"ZEHAO Trading (HK) Co., Limited
香港澤豪貿易有限公司",2022-06-14,,"Private, ltd by shares"426,3162575,"Zensboutique Limited",2022-06-14,,"Private, ltd by shares"427,3162378,"ZHEJIANG HOMI FLOOR CO., LIMITED",2022-06-14,,"Private, ltd by shares"428,3162197,"Zhonghui S&amp;T Technology Group Co., Limited
中匯盛通科技集團有限公司",2022-06-14,,"Private, ltd by shares"429,3162227,"ZW SLP Limited",2022-06-14,,"Private, ltd by shares"430,3162405,"ZYD TECHNOLOGY (HONG KONG) LIMITED
兆煜達科技(香港)有限公司",2022-06-14,,"Private, ltd by shares"