,Reg no.,Name,Incorp-orated,Dissolved,Type1,3162444,"1 Man Co., Limited
一人行有限公司",2022-06-14,,"Private, ltd by shares"2,3162215,"14th Juin Limited",2022-06-14,,"Private, ltd by shares"3,3162385,"24H GLOBAL CO., LIMITED
天天發國際有限公司",2022-06-14,,"Private, ltd by shares"4,3162374,"ABMT Property Limited
豐盛海外物業有限公司",2022-06-14,,"Private, ltd by shares"5,3162250,"Acetop Information Consultants Limited
領峰信息顧問有限公司",2022-06-14,,"Private, ltd by shares"6,3162191,"ACTYON TYRE RESOURCES CO., LIMITED",2022-06-14,,"Private, ltd by shares"7,3162203,"Aiduoduo Technology Limited
愛多多科技有限公司",2022-06-14,,"Private, ltd by shares"8,3162401,"AISEN TRADING LIMITED
艾森商貿有限公司",2022-06-14,,"Private, ltd by shares"9,3162360,"AKI TEAM LIMITED",2022-06-14,,"Private, ltd by shares"10,3162426,"ALEX INTERNATIONAL HOLDINGS LIMITED
艾歷斯國際控股有限公司",2022-06-14,,"Private, ltd by shares"11,3162459,"All Blue Trading Hong Kong Limited",2022-06-14,,"Private, ltd by shares"12,3162506,"ALLIANCE COMMUNICATIONS MINISTRY LIMITED
宣道傳意及出版事工有限公司",2022-06-14,,"Ltd by guarantee"13,3162410,"Alltex International Company Limited
全滙國際有限公司",2022-06-14,,"Private, ltd by shares"14,3162255,"AlphaCentari Co., Limited
敢二星際有限公司",2022-06-14,,"Private, ltd by shares"15,3162284,"An-Ocean Shipping Co., Limited
壹洋航運有限公司",2022-06-14,,"Private, ltd by shares"16,3162510,"ANETLY MEDICAL CO., LIMITED
安泰利醫療器械有限公司",2022-06-14,,"Private, ltd by shares"17,3162578,"AnRun Trading Company Limited
安潤商貿有限公司",2022-06-14,,"Private, ltd by shares"18,3162603,"Anthea Trading Co., Limited",2022-06-14,,"Private, ltd by shares"19,3162465,"APHELION SPHERE COMPANY LIMITED
黑目 有限公司",2022-06-14,,"Private, ltd by shares"20,3162499,"Apricus International Limited
冠珥國際有限公司",2022-06-14,,"Private, ltd by shares"21,3162357,"ARCHGO LIMITED",2022-06-14,,"Private, ltd by shares"22,3162182,"ARISCITO COSMETICS INTERNATIONAL COMPANY LIMITED
貴族獅辰國際美容有限公司",2022-06-14,,"Private, ltd by shares"23,3162188,"ARMSTRONG MEDICAL LIMITED",2022-06-14,,"Private, ltd by shares"24,3162464,"AROMA UNIQUE LIMITED
唯一芳療有限公司",2022-06-14,,"Private, ltd by shares"25,3162350,"Arpian Limited",2022-06-14,,"Private, ltd by shares"26,3162543,"Arun Stone (Hk) Holding Limited
安潤中石(香港)控股有限公司",2022-06-14,,"Private, ltd by shares"27,3162609,"Arura Wellness International Limited",2022-06-14,,"Private, ltd by shares"28,3162344,"Asia Aero Solutions Limited",2022-06-14,,"Private, ltd by shares"29,3162343,"Asia Aero Technik Limited",2022-06-14,,"Private, ltd by shares"30,3162461,"ASIA FOOD INTERNATIONAL LIMITED
亞洲食品國際有限公司",2022-06-14,,"Private, ltd by shares"31,3162582,"Asia Mingchen Industrial Co., Limited
亞洲名臣實業有限公司",2022-06-14,,"Private, ltd by shares"32,3162334,"Aston Capital Management Limited
裕泰資本管理有限公司",2022-06-14,,"Private, ltd by shares"33,3162279,"ATOM ELECTRONIC TECHNOLOGY LIMITED
微電子科技有限公司",2022-06-14,,"Private, ltd by shares"34,3162274,"Averta Limited (HK)",2022-06-14,,"Private, ltd by shares"35,3162260,"Axioms Research Company Limited",2022-06-14,,"Private, ltd by shares"36,3162595,"AZ Holdings Limited",2022-06-14,,"Private, ltd by shares"37,3162251,"BACK TO BACK INTERNATIONAL (ITALY) LIMITED
背靠背國際（義大利）有限公司",2022-06-14,,"Private, ltd by shares"38,3162544,"BAH Group Limited
眾心集團有限公司",2022-06-14,,"Private, ltd by shares"39,3162346,"Beaumont Projects Limited",2022-06-14,,"Private, ltd by shares"40,3162342,"Bella Technology Co., Limited",2022-06-14,,"Private, ltd by shares"41,3162523,"BEYOND BAP Limited",2022-06-14,,"Private, ltd by shares"42,3162477,"Bing (Hong Kong) Supply Chain Management Co., Limited
香港必應供應鏈管理有限公司",2022-06-14,,"Private, ltd by shares"43,3162332,"Bio New Material Innovation Limited
香港百傲新材料研發有限公司",2022-06-14,,"Private, ltd by shares"44,3162380,"BMZC international trade Limited",2022-06-14,,"Private, ltd by shares"45,3162563,"BOWEN CAPITAL (HK) LIMITED
寶雲資本(香港)有限公司",2022-06-14,,"Private, ltd by shares"46,3162212,"BOWER TECH COMPANY LIMITED
寶華科技股份有限公司",2022-06-14,,"Private, ltd by shares"47,3162223,"BP DIGITAL LIMITED",2022-06-14,,"Private, ltd by shares"48,3162205,"Breeze Maritime Service Co., Limited
和風商船有限公司",2022-06-14,,"Private, ltd by shares"49,3162576,"Bresa Limited",2022-06-14,,"Private, ltd by shares"50,3162347,"BULGARIAN CHAMBER OF COMMERCE HONG KONG LIMITED (THE)
香港保加利亞商會有限公司",2022-06-14,,"Ltd by guarantee"51,3162586,"BY88 LIMITED",2022-06-14,,"Private, ltd by shares"52,3162447,"Cardy Tech Limited",2022-06-14,,"Private, ltd by shares"53,3162581,"CG Asset Management Limited (HK)",2022-06-14,,"Private, ltd by shares"54,3162579,"CG Securities Limited",2022-06-14,,"Private, ltd by shares"55,3162237,"CHARM CONSTRUCTION LIMITED
浚賢營造有限公司",2022-06-14,,"Private, ltd by shares"56,3162418,"Check Chun Warehouse Limited
卓晉倉地有限公司",2022-06-14,,"Private, ltd by shares"57,3162312,"CHEUNG'S INDUSTRIAL CO., LIMITED
南源實業有限公司",2022-06-14,,"Private, ltd by shares"58,3162258,"Chew Chow Limited",2022-06-14,,"Private, ltd by shares"59,3162235,"CHINA HAIGE GROUP LIMITED
中國海格集團有限公司",2022-06-14,,"Private, ltd by shares"60,3162535,"China Hong Kong And Mainland Integration Development Association Limited
中國香港與內地融合發展促進會有限公司",2022-06-14,,"Ltd by guarantee"61,3162469,"CHINA LIWU CO., LIMITED
中國禮物有限公司",2022-06-14,,"Private, ltd by shares"62,3162445,"China National Science &amp; Technology Industry Development (HK) Co., Limited
中民科技產業開發（香港）有限公司",2022-06-14,,"Private, ltd by shares"63,3162367,"CHINA POWER EV LIMITED
中能電車有限公司",2022-06-14,,"Private, ltd by shares"64,3162218,"China Xiaoshengyi Cultural Property Auction Co., Limited
中國小生藝文化產權拍賣有限公司",2022-06-14,,"Private, ltd by shares"65,3162323,"Chinese non-heritage Cultural Federation Limited
中華非遺文化聯合會有限公司",2022-06-14,,"Private, ltd by shares"66,3162276,"Chong Tin Solutions Limited
創天物流管理有限公司",2022-06-14,,"Private, ltd by shares"67,3162551,"Choujiang Intelligent International Limited
稠江智能國際有限公司",2022-06-14,,"Private, ltd by shares"68,3162504,"CHUANG JIUZHOU SHOES CO., LIMITED
創九洲鞋業有限公司",2022-06-14,,"Private, ltd by shares"69,3162338,"Chuangmei Industrial Investment Limited
創美實業投資有限公司",2022-06-14,,"Private, ltd by shares"70,3162244,"CITIFAIR INVESTMENT LIMITED
和豐投資有限公司",2022-06-14,,"Private, ltd by shares"71,3162238,"Commodity Trading Company (CTC) Limited",2022-06-14,,"Private, ltd by shares"72,3162254,"Credible E&amp;M Engineering Limited
行信機電工程有限公司",2022-06-14,,"Private, ltd by shares"73,3162511,"Dai Lun Yau Trading Limited
大輪遊貿易有限公司",2022-06-14,,"Private, ltd by shares"74,3162422,"DAMA TRADING LIMITED
達茂貿易有限公司",2022-06-14,,"Private, ltd by shares"75,3162429,"DEEDS TRADING LIMITED",2022-06-14,,"Private, ltd by shares"76,3162521,"Deep Sight Travel (Hong Kong) Limited
深度遊（香港）有限公司",2022-06-14,,"Private, ltd by shares"77,3162355,"Deline Manufacturing Company Limited
德林製造有限公司",2022-06-14,,"Private, ltd by shares"78,3162541,"DESTINED FOR KINDNESS LIMITED
香港緣善會有限公司",2022-06-14,,"Ltd by guarantee"79,3162419,"DIAIWEI BIOLOGICAL TECHNOLOGY LIMITED
蒂艾葳生物科技有限公司",2022-06-14,,"Private, ltd by shares"80,3162186,"Digital Speed Printing Workshop Limited
數碼速印工作坊有限公司",2022-06-14,,"Private, ltd by shares"81,3162442,"Direct Capital Limited",2022-06-14,,"Private, ltd by shares"82,3162434,"Doersrule Limited",2022-06-14,,"Private, ltd by shares"83,3162313,"Dongchen Import &amp; Export Co., Limited
東晨進出口有限公司",2022-06-14,,"Private, ltd by shares"84,3162556,"DONGGUAN YOU CHENG HARDWARE CO., LIMITED
東莞市佑澄五金有限公司",2022-06-14,,"Private, ltd by shares"85,3162206,"Doris Chui School of Ballet (Holding) Company Limited
崔藹璇芭蕾舞學校(控股)有限公司",2022-06-14,,"Private, ltd by shares"86,3162353,"DSW INTERNATIONAL PVT LIMITED",2022-06-14,,"Private, ltd by shares"87,3162283,"E-Qi (Hong Kong) Trading Company Limited
壹起(香港)貿易有限公司",2022-06-14,,"Private, ltd by shares"88,3162349,"EAGLE WELL INVESTMENT LIMITED
鷹偉投資有限公司",2022-06-14,,"Private, ltd by shares"89,3162591,"Ecom Machines Limited",2022-06-14,,"Private, ltd by shares"90,3162196,"EDP GROUP LIMITED",2022-06-14,,"Private, ltd by shares"91,3162277,"Elon Holding Group Limited",2022-06-14,,"Private, ltd by shares"92,3162371,"ELYXWORK ELECTRONICS COMPANY LIMITED
億萊電子有限公司",2022-06-14,,"Private, ltd by shares"93,3162602,"Extreme Rebate Limited",2022-06-14,,"Private, ltd by shares"94,3162585,"FASHION MANHATTAN LIMITED
時尚曼哈頓有限公司",2022-06-14,,"Private, ltd by shares"95,3162352,"fatchoi Limited",2022-06-14,,"Private, ltd by shares"96,3162599,"Faylink Electronic (HK) Limited
飛凌電子(香港)有限公司",2022-06-14,,"Private, ltd by shares"97,3162239,"Fen Yi Technology (HK) Co., Limited
芬宜科技(香港)有限公司",2022-06-14,,"Private, ltd by shares"98,3162193,"FnArt Limited
安藝創造有限公司",2022-06-14,,"Private, ltd by shares"99,3162457,"FOREVER PIPE INDUSTRY CO., LIMITED
永恆管業有限公司",2022-06-14,,"Private, ltd by shares"100,3162441,"Fortune Milestone Supply Chain Management (Hong Kong) Limited
明福供應鏈管理（香港）有限公司",2022-06-14,,"Private, ltd by shares"101,3162210,"FOSHAN AZAL TRADING COMPANY LIMITED",2022-06-14,,"Private, ltd by shares"102,3162517,"Foshan Yongxing Aluminum Co., Limited
佛山勇行鋁業有限公司",2022-06-14,,"Private, ltd by shares"103,3162492,"Fount Development Limited
大源發展有限公司",2022-06-14,,"Private, ltd by shares"104,3162568,"FUNG WAH MATERIAL CO LIMITED
灃樺建材有限公司",2022-06-14,,"Private, ltd by shares"105,3162247,"FUYUAN INTERNATIONAL LOGISTICS LIMITED
福源國際物流有限公司",2022-06-14,,"Private, ltd by shares"106,3162270,"Galaxy Solutions Limited (HK)",2022-06-14,,"Private, ltd by shares"107,3162569,"GD EMP CO., LIMITED
廣東正皇有限公司",2022-06-14,,"Private, ltd by shares"108,3162453,"GF INTERNATIONAL HOLDING LIMITED",2022-06-14,,"Private, ltd by shares"109,3162604,"GGFN Limited",2022-06-14,,"Private, ltd by shares"110,3162384,"Glory Ark (Hong Kong) Industrial Investment Co., Limited
榮耀方舟(香港)實業投資有限公司",2022-06-14,,"Private, ltd by shares"111,3162300,"Golding Properties Company Limited
金廷物業有限公司",2022-06-14,,"Private, ltd by shares"112,3162463,"Gone Coding Limited",2022-06-14,,"Private, ltd by shares"113,3162450,"Gratu Mould Co., Limited
格拉圖模具有限公司",2022-06-14,,"Private, ltd by shares"114,3162245,"GREAT SINO (H.K.) LIMITED
中建(香港)有限公司",2022-06-14,,"Private, ltd by shares"115,3162481,"Greenery Games Technology Co., Limited
綠茵互娛科技有限公司",2022-06-14,,"Private, ltd by shares"116,3162363,"Guangdong Hong Kong Macao Greater Bay Area Enterprise Association Limited
粵港澳大灣區企業總會有限公司",2022-06-14,,"Private, ltd by shares"117,3162370,"Guli Guli Culture Media Limited
咕哩咕哩文化傳媒有限公司",2022-06-14,,"Private, ltd by shares"118,3162468,"Gum Fung Tak Trading Limited
金豐德貿易有限公司",2022-06-14,,"Private, ltd by shares"119,3162183,"Guoxin Beat (Hong Kong) International Trading Limited
國芯跳動(香港)國際貿易有限公司",2022-06-14,,"Private, ltd by shares"120,3162395,"HANGXI JEWELRY CO., LIMITED
航錫飾品有限公司",2022-06-14,,"Private, ltd by shares"121,3162475,"HANGZOE INTERNATIONAL TRADE LIMITED
恒澤國際貿易有限公司",2022-06-14,,"Private, ltd by shares"122,3162252,"HANZHONG INTERNATIONAL HOLDING (HK) GROUP CO., LIMITED
瀚中國際控股(香港)集團有限公司",2022-06-14,,"Private, ltd by shares"123,3162359,"HARU TEAM LIMITED",2022-06-14,,"Private, ltd by shares"124,3162485,"He Nan Miaoyao Culture Media Limited
河南妙耀文化傳媒有限公司",2022-06-14,,"Private, ltd by shares"125,3162466,"Health&amp;Beyond International (HK) Co., Limited",2022-06-14,,"Private, ltd by shares"126,3162482,"HeartBeat Media (HK) Limited
心跳傳媒（香港）有限公司",2022-06-14,,"Private, ltd by shares"127,3162253,"Hebense International Trade Limited
赫本色國際貿易有限公司",2022-06-14,,"Private, ltd by shares"128,3162379,"HEDAFA TRADEING LIMITED
合達發貿易有限公司",2022-06-14,,"Private, ltd by shares"129,3162289,"Heisei Catering Limited
平成飲食有限公司",2022-06-14,,"Private, ltd by shares"130,3162396,"HENGSHENG COMMERCE LIMITED
恆晟商貿有限公司",2022-06-14,,"Private, ltd by shares"131,3162555,"Hengyun International Trade Co., Limited
恆運國際貿易有限公司",2022-06-14,,"Private, ltd by shares"132,3162293,"HEYIN INDUSTRIAL COMPANY LIMITED
香港荷吟實業有限公司",2022-06-14,,"Private, ltd by shares"133,3162202,"Hiersun Biotech Company Limited",2022-06-14,,"Private, ltd by shares"134,3162488,"HING HING LIMITED
興興有限公司",2022-06-14,,"Private, ltd by shares"135,3162522,"HK E-LITE SEMICONDUCTOR CO., LIMITED
香港易立特集團有限公司",2022-06-14,,"Private, ltd by shares"136,3162326,"HK Ever Health Limited
永健堂有限公司",2022-06-14,,"Private, ltd by shares"137,3162303,"HK GANG EN INTERNATIONAL TRADINGS CO., LIMITED
香港港恩國際貿易有限公司",2022-06-14,,"Private, ltd by shares"138,3162494,"HK GJY TRADING LIMITED
香港廣進源貿易有限公司",2022-06-14,,"Private, ltd by shares"139,3162345,"HK HARVEST GENERAL TRADING LIMITED",2022-06-14,,"Private, ltd by shares"140,3162234,"HK HF Industry Development Co., Limited
香港恒豐實業發展有限公司",2022-06-14,,"Private, ltd by shares"141,3162607,"HK LON TRADE LIMITED
立揚貿易有限公司",2022-06-14,,"Private, ltd by shares"142,3162216,"HK Midas Trading Limited
香港明朵貿易有限公司",2022-06-14,,"Private, ltd by shares"143,3162389,"HK PUHONG ELECTRICAL EQUIPMENT CO., LIMITED
香港譜鴻電器有限公司",2022-06-14,,"Private, ltd by shares"144,3162329,"HK RUNZETIANXIA TRADE CO., LIMITED
香港潤澤天下貿易有限公司",2022-06-14,,"Private, ltd by shares"145,3162539,"HK Shanshui Home Trading Co., Limited
香港山水家居貿易有限公司",2022-06-14,,"Private, ltd by shares"146,3162587,"HK SPREAD ELECTRONIC TECHNOLOGY CO., LIMITED
香港展訊電子科技有限公司",2022-06-14,,"Private, ltd by shares"147,3162570,"HK Xiang Yu Asset Management Limited
香港象嶼資產管理有限公司",2022-06-14,,"Private, ltd by shares"148,3162467,"HK XINGSHUNFA INTERNATIONAL LIMITED
香港興順發國際貿易有限公司",2022-06-14,,"Private, ltd by shares"149,3162228,"HK YAOXIANG TRADE LIMITED
香港曜響貿易有限公司",2022-06-14,,"Private, ltd by shares"150,3162534,"HK YIWANG ELECTRONIC TECHNOLOGY CO., LIMITED
香港億旺電子科技有限公司",2022-06-14,,"Private, ltd by shares"151,3162513,"HK Zhuoli International Lighting Co., Limited
香港卓立國際照明有限公司",2022-06-14,,"Private, ltd by shares"152,3162476,"HK Zhuoran International Lighting Co., Limited
香港卓然國際照明有限公司",2022-06-14,,"Private, ltd by shares"153,3162366,"HKHL TRADING LIMITED
香港華霖貿易有限公司",2022-06-14,,"Private, ltd by shares"154,3162553,"HKSC ALUMNI ASSOCIATION LIMITED (THE)
香港兆基創意書院舊生會有限公司",2022-06-14,,"Ltd by guarantee"155,3162242,"Ho Fai Crane Rental &amp; Building Materials Limited
浩輝吊機租賃及建材有限公司",2022-06-14,,"Private, ltd by shares"156,3162546,"HOL Electronic Limited
浩麗電子有限公司",2022-06-14,,"Private, ltd by shares"157,3162387,"HOLIX Trading (HK) Co., Limited
香港豪利來商貿有限公司",2022-06-14,,"Private, ltd by shares"158,3162224,"HONG KONG AFRIDRAGON INTERNATIONAL LIMITED
香港龍騰非國際有限公司",2022-06-14,,"Private, ltd by shares"159,3162533,"Hong Kong Aviation Support and Development Association Limited
香港航空業促進會有限公司",2022-06-14,,"Private, ltd by shares"160,3162500,"Hong Kong Biological Pharmacy Limited
香港生物製藥有限公司",2022-06-14,,"Private, ltd by shares"161,3162383,"Hong Kong Dashanhai Vacuum Technology Co., Limited
香港大山海真空技術有限公司",2022-06-14,,"Private, ltd by shares"162,3162337,"HONG KONG DOLPHIN INTERNATIONAL LIMITED
香港海豚國際有限公司",2022-06-14,,"Private, ltd by shares"163,3162519,"Hong Kong Dongguan Fraternity Limited
港莞聯誼促進會有限公司",2022-06-14,,"Ltd by guarantee"164,3162528,"Hong Kong Dongyu Hardware Co., Limited
香港東羽五金有限公司",2022-06-14,,"Private, ltd by shares"165,3162454,"HONG KONG ENTROPY POOL INFORMATION TECHNOLOGY LIMITED
香港熵池信息技術有限公司",2022-06-14,,"Private, ltd by shares"166,3162588,"Hong Kong Extreme Fresh Food Co., Limited
香港極專鮮食品有限公司",2022-06-14,,"Private, ltd by shares"167,3162420,"Hong Kong Green Environmental Technology Company Limited
香港格潤環境科技有限公司",2022-06-14,,"Private, ltd by shares"168,3162590,"Hong Kong Haoneng Group Co., Limited
香港昊能集團有限公司",2022-06-14,,"Private, ltd by shares"169,3162273,"Hong Kong Hong Cheng Song Technology Co., Limited
香港弘承松科技有限公司",2022-06-14,,"Private, ltd by shares"170,3162321,"Hong Kong Hong Zhouyuan Technology Co., Limited
香港弘周遠科技有限公司",2022-06-14,,"Private, ltd by shares"171,3162471,"Hong Kong Hongchangsheng Trading Co., Limited
香港鴻昌盛貿易有限公司",2022-06-14,,"Private, ltd by shares"172,3162559,"Hong Kong International Yoga Alliance Limited
香港國際瑜伽同盟有限公司",2022-06-14,,"Ltd by guarantee"173,3162601,"Hong Kong Jin Yi Food Co., Limited
香港錦益食品有限公司",2022-06-14,,"Private, ltd by shares"174,3162364,"HONG KONG KIMI TECHNOLOGY LIMITED",2022-06-14,,"Private, ltd by shares"175,3162493,"Hong Kong King Tai (International) Limited
香港景泰(國際)有限公司",2022-06-14,,"Private, ltd by shares"176,3162330,"HONG KONG LINEAR TECHNOLOGY LIMITED
香港線性科技有限公司",2022-06-14,,"Private, ltd by shares"177,3162272,"HONG KONG LINGYOU GROUP CO., LIMITED
香港翎佑集團有限公司",2022-06-14,,"Private, ltd by shares"178,3162305,"Hong Kong Lvxinyuan Technology Co., Limited
香港綠欣源科技有限公司",2022-06-14,,"Private, ltd by shares"179,3162532,"Hong Kong Maiqiansong Golf Custom Shoes Co., Limited
香港邁輕鬆高爾夫定制鞋業股份有限公司",2022-06-14,,"Private, ltd by shares"180,3162462,"Hong Kong Ouna Electronics Co., Limited
香港歐那電子有限公司",2022-06-14,,"Private, ltd by shares"181,3162554,"HONG KONG RAYLAN SHOES TRADING CO., LIMITED",2022-06-14,,"Private, ltd by shares"182,3162257,"Hong Kong RuiXing Trading Co., Limited
香港瑞星貿易有限公司",2022-06-14,,"Private, ltd by shares"183,3162336,"HONG KONG SEA LION INTERNATIONAL LIMITED
香港海獅國際有限公司",2022-06-14,,"Private, ltd by shares"184,3162516,"Hong Kong Shengbaolai Industrial Co., Limited
香港盛寶萊實業有限公司",2022-06-14,,"Private, ltd by shares"185,3162309,"Hong Kong Shengfengping Technology Co., Limited
香港晟鋒品科技有限公司",2022-06-14,,"Private, ltd by shares"186,3162542,"Hong Kong Shuohui International Lighting Co., Limited
香港爍輝國際照明有限公司",2022-06-14,,"Private, ltd by shares"187,3162288,"Hong Kong Su Min Yue Technology Co., Limited
香港蘇敏悅科技有限公司",2022-06-14,,"Private, ltd by shares"188,3162567,"Hong Kong Sun Young International Trading Co., Limited
香港圣楊國際貿易有限公司",2022-06-14,,"Private, ltd by shares"189,3162192,"HONG KONG TAIXIN CO., LIMITED
香港泰欣集團有限公司",2022-06-14,,"Private, ltd by shares"190,3162409,"Hong Kong Telink Holding Limited
香港通盈控股有限公司",2022-06-14,,"Private, ltd by shares"191,3162548,"Hong Kong THY Electronic Technology Co., Limited
香港三歲半電子科技有限公司",2022-06-14,,"Private, ltd by shares"192,3162322,"Hong Kong Xingyutong Trading Co., Limited
香港興羽通貿易有限公司",2022-06-14,,"Private, ltd by shares"193,3162560,"Hong Kong XinYouMei Co., Limited
香港欣尤美有限公司",2022-06-14,,"Private, ltd by shares"194,3162388,"HONG KONG XIONG'S GROUP LIMITED
香港熊氏集團有限公司",2022-06-14,,"Private, ltd by shares"195,3162318,"Hong Kong Ziyunjie Technology Co., Limited
香港子運捷科技有限公司",2022-06-14,,"Private, ltd by shares"196,3162207,"HONGKONG BREEZY POINT HOLDINGS LIMITED
香港華成控股有限公司",2022-06-14,,"Private, ltd by shares"197,3162436,"Hongkong Charmy Limited
香港帢米有限公司",2022-06-14,,"Private, ltd by shares"198,3162404,"HongKong Henfar Trade Company Limited
香港恆昌宏貿易有限公司",2022-06-14,,"Private, ltd by shares"199,3162333,"HONGKONG HUATAI SUPPLYCHAIN CO., LIMITED
香港華太供應鏈有限公司",2022-06-14,,"Private, ltd by shares"200,3162489,"HONGKONG JASELLER TRADE CO., LIMITED
香港嘉思樂貿易有限公司",2022-06-14,,"Private, ltd by shares"201,3162339,"HONGKONG MAYSA TRADING LIMITED
香港美莎貿易有限公司",2022-06-14,,"Private, ltd by shares"202,3162402,"HongKong PengHeng International Trade Co., Limited
香港澎恒國際貿易有限公司",2022-06-14,,"Private, ltd by shares"203,3162261,"HongKong Starlight Trade Company Limited
星光貿易香港有限公司",2022-06-14,,"Private, ltd by shares"204,3162399,"Hongkong Swot Investment Management Co., Limited
香港斯沃特投資管理有限公司",2022-06-14,,"Private, ltd by shares"205,3162375,"Hongkong Vision Power Culture Limited
香港視覺動力文化有限公司",2022-06-14,,"Private, ltd by shares"206,3162472,"HONGKONG YIHU TRADING CO., LIMITED
香港億斛貿易有限公司",2022-06-14,,"Private, ltd by shares"207,3162201,"Hongkong Zhipin International Co., Limited
香港至品國際有限公司",2022-06-14,,"Private, ltd by shares"208,3162386,"HONGLONG TRADING LIMITED
宏隆商貿有限公司",2022-06-14,,"Private, ltd by shares"209,3162390,"Huaming International Investment Limited",2022-06-14,,"Private, ltd by shares"210,3162455,"HUANGLI INTERNATIONAL (H.K.) CO., LIMITED
煌力國際(香港)有限公司",2022-06-14,,"Private, ltd by shares"211,3162427,"HUANGY LIMITED
環越有限公司",2022-06-14,,"Private, ltd by shares"212,3162486,"HUAYANG SHIPMANAGEMENT CO., LIMITED
華洋國際船舶管理有限公司",2022-06-14,,"Private, ltd by shares"213,3162297,"HUGO (M&amp;E) ENGINEERING LIMITED
耀高機電工程有限公司",2022-06-14,,"Private, ltd by shares"214,3162430,"Huifeng International Limited
匯豐國際有限公司",2022-06-14,,"Private, ltd by shares"215,3162400,"Hungsung Holdings Limited
恒盛控股有限公司",2022-06-14,,"Private, ltd by shares"216,3162596,"Huntoon Technology Limited
亨通科技有限公司",2022-06-14,,"Private, ltd by shares"217,3162268,"HZB INTERNATIONAL JEWELLERY LIMITED
黃金珠寶國際有限公司",2022-06-14,,"Private, ltd by shares"218,3162524,"Ichu Club Limited
藝傳誌飲食薈有限公司",2022-06-14,,"Private, ltd by shares"219,3162198,"ICRIS:3162198 (no English name)
國標實業集團有限公司",2022-06-14,,"Private, ltd by shares"220,3162574,"ICRIS:3162574 (no English name)
拉法基淨態(中國)科技建材有限公司",2022-06-14,,"Private, ltd by shares"221,3162589,"ICRIS:3162589 (no English name)
銘基消防工程有限公司",2022-06-14,,"Private, ltd by shares"222,3162598,"Infinite Journey Limited
無限之旅有限公司",2022-06-14,,"Private, ltd by shares"223,3162190,"InnoCloud Technology Company Limited
傲翔科技有限公司",2022-06-14,,"Private, ltd by shares"224,3162566,"Insight Overseas Limited
華人留學教育諮詢有限公司",2022-06-14,,"Private, ltd by shares"225,3162376,"IONOS INTERNATIONAL PRECISION MEDICINE CENTER LIMITED
艾歐諾裏斯國際精准醫學中心有限公司",2022-06-14,,"Private, ltd by shares"226,3162265,"Iper Casa Limited
意鉑國際貿易有限公司",2022-06-14,,"Private, ltd by shares"227,3162417,"ITCHIGO CORPORATION LIMITED",2022-06-14,,"Private, ltd by shares"228,3162433,"JA International Capital Limited
金奧國際資本有限公司",2022-06-14,,"Private, ltd by shares"229,3162580,"Japan Biomedical Research Institute Limited
日本生物醫學研究院有限公司",2022-06-14,,"Private, ltd by shares"230,3162290,"JC Vehicle Engineering Consultant Limited
駿朗汽車工程顧問有限公司",2022-06-14,,"Private, ltd by shares"231,3162565,"JCZ Trading Co., Limited
筠琛卓貿易有限公司",2022-06-14,,"Private, ltd by shares"232,3162518,"JIAN BAO LAI HONG KONG LIMITED
建寶來香港有限公司",2022-06-14,,"Private, ltd by shares"233,3162324,"Jianlang Doors and Windows Technology Co., Limited
堅朗門窗科技有限公司",2022-06-14,,"Private, ltd by shares"234,3162495,"Jin Heng Yi Limited
進亨益有限公司",2022-06-14,,"Private, ltd by shares"235,3162225,"Jinhuan International Limited
槿桓國際有限公司",2022-06-14,,"Private, ltd by shares"