,Reg no.,Name,Incorp-orated,Dissolved,Type1,3162784,"3 E International Hongkong Co., Limited
善翼國際香港有限公司",2022-06-15,,"Private, ltd by shares"2,3162771,"66 Contemporary Limited",2022-06-15,,"Private, ltd by shares"3,3162661,"852 Moto Sport Club Limited",2022-06-15,,"Private, ltd by shares"4,3162877,"Addtop Group Limited
艾拓博集團有限公司",2022-06-15,,"Private, ltd by shares"5,3162919,"AEP (H.K.) International Trading Limited
阿爾派（香港）國際貿易有限公司",2022-06-15,,"Private, ltd by shares"6,3162710,"Aesthete Beauty Limited
唯．美容有限公司",2022-06-15,,"Private, ltd by shares"7,3162615,"AIR-PLUS COMPANY LIMITED",2022-06-15,,"Private, ltd by shares"8,3162819,"AISG GROUP LIMITED",2022-06-15,,"Private, ltd by shares"9,3162935,"Aisha Princess (Hong Kong) Children's Products Co., Limited
愛莎公主(香港)兒童用品有限公司",2022-06-15,,"Private, ltd by shares"10,3162614,"ALL FOR ONE INTERNATIONAL EDUCATION LIMITED
壹心國際教育有限公司",2022-06-15,,"Private, ltd by shares"11,3162774,"AML SUPPLY CHAIN CO., LIMITED
香港知能達供應鏈有限公司",2022-06-15,,"Private, ltd by shares"12,3162858,"AN XIN CHU CHENG LIMITED
安心出城有限公司",2022-06-15,,"Private, ltd by shares"13,3162702,"ANCHOR PREMIER MARKETING LIMITED",2022-06-15,,"Private, ltd by shares"14,3162871,"Anso (Hong Kong) Company Limited
安索(香港)有限公司",2022-06-15,,"Private, ltd by shares"15,3162834,"Anton Limited
安得廣有限公司",2022-06-15,,"Private, ltd by shares"16,3162637,"AO LANG (HK) COMPANY LIMITED
奧朗（香港）有限公司",2022-06-15,,"Private, ltd by shares"17,3162799,"AOKE ELECTRON (HK) TECHNOLOGY CO., LIMITED
奧科電子（香港）科技有限公司",2022-06-15,,"Private, ltd by shares"18,3162695,"Apix Capital Limited
捷凱資本有限公司",2022-06-15,,"Private, ltd by shares"19,3162748,"App Laud Network Limited
友贊網絡有限公司",2022-06-15,,"Private, ltd by shares"20,3162859,"AR Telecom Limited",2022-06-15,,"Private, ltd by shares"21,3162659,"Araka FinTech Limited",2022-06-15,,"Private, ltd by shares"22,3162796,"ArBo Fitness Limited",2022-06-15,,"Private, ltd by shares"23,3162974,"ATLAS WEALTH LIMITED
輿圖有限公司",2022-06-15,,"Private, ltd by shares"24,3162923,"autokeyschipsupply Co., Limited",2022-06-15,,"Private, ltd by shares"25,3162895,"AWEI (HK) HEALTH INDUSTRY GROUP CO., LIMITED
奧維(香港)健康產業集團有限公司",2022-06-15,,"Private, ltd by shares"26,3162638,"Beety Limited
織田實業有限公司",2022-06-15,,"Private, ltd by shares"27,3162711,"BELL AND DRUM TOWER FOOD CO., LIMITED
鐘鼓樓食品有限公司",2022-06-15,,"Private, ltd by shares"28,3162665,"BEST OF BEST DEVELOPMENT LIMITED
卓顯發展有限公司",2022-06-15,,"Private, ltd by shares"29,3162924,"BETTINO TRADING CO., LIMITED
貝蒂諾貿易有限公司",2022-06-15,,"Private, ltd by shares"30,3162655,"BILIBALA INTERNATIONAL LIMITED
嗶哩吧啦有限公司",2022-06-15,,"Private, ltd by shares"31,3162660,"Billion Health Technology Limited",2022-06-15,,"Private, ltd by shares"32,3162862,"Billion Innovation Group Limited
億都創新集團有限公司",2022-06-15,,"Private, ltd by shares"33,3162785,"Billion International (Hong Kong) Limited
駿億國際(香港)有限公司",2022-06-15,,"Private, ltd by shares"34,3162945,"BL (HONGKONG) TECHNOLOGY CO., LIMITED
博聯(香港)科技有限公司",2022-06-15,,"Private, ltd by shares"35,3162736,"Blue Vision Limited",2022-06-15,,"Private, ltd by shares"36,3162645,"BOOFOR GROUP LIMITED",2022-06-15,,"Private, ltd by shares"37,3162855,"BoomBoom Technology Company Limited
碰碰科技有限公司",2022-06-15,,"Private, ltd by shares"38,3162718,"Bowl Bowl Co., Limited
碗碗有限公司",2022-06-15,,"Private, ltd by shares"39,LF7266495,"Brainwin Entertainment Fixed Income Fund LPF
惠盈影視固定收益有限合夥基金",2022-06-15,,"Limited Partnership Fund"40,3162640,"Branford Technology Co., Limited",2022-06-15,,"Private, ltd by shares"41,3162627,"Brightness Training &amp; Human Resources Limited
智源培訓及人力資源有限公司",2022-06-15,,"Private, ltd by shares"42,3162716,"Buy Like International Holdings Limited
便利客國際控股有限公司",2022-06-15,,"Private, ltd by shares"43,3162685,"BUY-UP INVESTMENT LIMITED
皓昇投資有限公司",2022-06-15,,"Private, ltd by shares"44,3162970,"Carys Studio Limited
城堡工作室有限公司",2022-06-15,,"Private, ltd by shares"45,3162623,"Catie Limited
洛嗞茶柑有限公司",2022-06-15,,"Private, ltd by shares"46,3162762,"CHAMBERLAIN FAMILY OFFICE (HK) PTE LIMITED",2022-06-15,,"Private, ltd by shares"47,3162825,"Chanfuluser Limited",2022-06-15,,"Private, ltd by shares"48,3162628,"CHANG TONG TRADING CO., LIMITED
暢通貿易有限公司",2022-06-15,,"Private, ltd by shares"49,3162827,"Charmant Jewellery Limited
金望珠寶有限公司",2022-06-15,,"Private, ltd by shares"50,3162896,"Chen Hugong Family Fund Management Co. Limited
陳胡公家族基金管理有限公司",2022-06-15,,"Private, ltd by shares"51,3162675,"Chief Well Company Limited
致薈有限公司",2022-06-15,,"Private, ltd by shares"52,3162677,"Chill By The Sea Company Limited",2022-06-15,,"Private, ltd by shares"53,3162653,"China Financial Industry Association Co., Limited
中國金融行業協會有限公司",2022-06-15,,"Private, ltd by shares"54,3162737,"China Hongbao Holdings Limited
中國紅包控股有限公司",2022-06-15,,"Private, ltd by shares"55,3162651,"China Human Resources Education And Training Center Co., Limited
中國人力資源人才教育培訓中心有限公司",2022-06-15,,"Private, ltd by shares"56,3162739,"China Marriage Industry Alliance Limited
中華婚戀產業聯盟有限公司",2022-06-15,,"Private, ltd by shares"57,3162705,"China Renaissance Creative Industrial Park Investment Group Co., Limited
中華復興創意產業園投資集團有限公司",2022-06-15,,"Private, ltd by shares"58,3162723,"China Tea Selected Group Limited
中茶優選集團有限公司",2022-06-15,,"Private, ltd by shares"59,3162913,"China Zhongshen International Development Group Limited
中國中申國際發展集團有限公司",2022-06-15,,"Private, ltd by shares"60,3162937,"CHINOE (HK) CO., LIMITED
中諾(香港)有限公司",2022-06-15,,"Private, ltd by shares"61,3162729,"Chiu Kart Company Limited
超格有限公司",2022-06-15,,"Private, ltd by shares"62,3162883,"Chok Station Limited
林作站有限公司",2022-06-15,,"Private, ltd by shares"63,3162683,"Chuk Yuen Private Kitchen Limited
竹園私房菜有限公司",2022-06-15,,"Private, ltd by shares"64,3162961,"CHUNG KIT SURVEY ENGINEERING LIMITED
忠傑工程有限公司",2022-06-15,,"Private, ltd by shares"65,3162875,"CHUXUAN VENTURE CAPITAL TECHNOLOGY (HK) INDUSTRY CO., LIMITED
楚暄創投科技（香港）實業有限公司",2022-06-15,,"Private, ltd by shares"66,3162617,"CK Pro Engineering Company Limited",2022-06-15,,"Private, ltd by shares"67,3162664,"COMET MALL INTERNATIONAL TRADING LIMITED
華陞國際貿易有限公司",2022-06-15,,"Private, ltd by shares"68,3162864,"Confidence Leap Consulting (Asia) Limited",2022-06-15,,"Private, ltd by shares"69,3162633,"Creativ Limited (HK)
點紙有限公司",2022-06-15,,"Ltd by guarantee"70,3162666,"CREDIT AUTO SPARE PARTS CO., LIMITED",2022-06-15,,"Private, ltd by shares"71,3162946,"CRG Energy Limited",2022-06-15,,"Private, ltd by shares"72,3162696,"Cu Trade Limited",2022-06-15,,"Private, ltd by shares"73,3162949,"CX Invert Limited",2022-06-15,,"Private, ltd by shares"74,3162868,"Dachang Vegetables Limited
大昌蔬菜有限公司",2022-06-15,,"Private, ltd by shares"75,3162681,"Daimaru Grocery Company Limited
大丸食品(香港)有限公司",2022-06-15,,"Private, ltd by shares"76,3162802,"Darunfeng Limited
大潤豐有限公司",2022-06-15,,"Private, ltd by shares"77,3162672,"Delivereasy Company Limited
送料易有限公司",2022-06-15,,"Private, ltd by shares"78,3162892,"Dongdong Trading Co., Limited (b2022-06-15)
東東貿易有限公司",2022-06-15,,"Private, ltd by shares"79,3162933,"DONGXINGZHAO SIHAI TRADING LIMITED
東興照四海貿易有限公司",2022-06-15,,"Private, ltd by shares"80,3162844,"Drunk Piu Limited
醉標有限公司",2022-06-15,,"Private, ltd by shares"81,3162630,"DV-DW Group Limited
丈量世界課程顧問有限公司",2022-06-15,,"Private, ltd by shares"82,3162680,"Dynamic Workshop Limited
動力教室有限公司",2022-06-15,,"Private, ltd by shares"83,3162918,"E-Orange International Co., Limited
互橙國際有限公司",2022-06-15,,"Private, ltd by shares"84,3162719,"EARN ALLIANCE HONG KONG LIMITED",2022-06-15,,"Private, ltd by shares"85,3162911,"East Zing Shipping Limited",2022-06-15,,"Private, ltd by shares"86,3162951,"EASUN INTERNATIONAL HOLDINGS LIMITED
駿燊國際控股有限公司",2022-06-15,,"Private, ltd by shares"87,3162779,"Edit Academy Limited",2022-06-15,,"Private, ltd by shares"88,3162692,"Element Equity Limited",2022-06-15,,"Private, ltd by shares"89,3162712,"EMIT UNION ENTERPRISE COMPANY LIMITED
環維企業有限公司",2022-06-15,,"Private, ltd by shares"90,3162721,"EN YOUNG INTERNATIONAL LIMITED",2022-06-15,,"Private, ltd by shares"91,3162646,"Epsilon M Company Limited",2022-06-15,,"Private, ltd by shares"92,3162648,"Ermofy International Trade Limited
鴻世達國際貿易有限公司",2022-06-15,,"Private, ltd by shares"93,3162932,"Escalasinlimite. Co., Limited",2022-06-15,,"Private, ltd by shares"94,3162972,"EssaData Limited",2022-06-15,,"Private, ltd by shares"95,3162689,"ETA (Hong Kong) Technology Co., Limited
易禾軒(香港)科技有限公司",2022-06-15,,"Private, ltd by shares"96,3162876,"Eternity Dream Limited
彩顏有限公司",2022-06-15,,"Private, ltd by shares"97,3162959,"Ever Sharp (Hong Kong) Limited
永鋒（香港）有限公司",2022-06-15,,"Private, ltd by shares"98,3162783,"Ever Win Catering Group Limited
永勝飲食集團有限公司",2022-06-15,,"Private, ltd by shares"99,3162908,"Excellent Medical International (Hong Kong) Biological Co., Limited
優醫國際(香港)生物有限公司",2022-06-15,,"Private, ltd by shares"100,3162837,"FABULOUS DREAMS CATERING LIMITED
權莉夢寐餐飲有限公司",2022-06-15,,"Private, ltd by shares"101,3162860,"FANS INTERNATIONAL LOGISTICS LIMITED
泛思國際物流有限公司",2022-06-15,,"Private, ltd by shares"102,3162669,"Fast Connection Electronics Co., Limited",2022-06-15,,"Private, ltd by shares"103,3162835,"Fate Vision Group HK Limited",2022-06-15,,"Private, ltd by shares"104,3162805,"Feibei International Company Limited
飛貝國際有限公司",2022-06-15,,"Private, ltd by shares"105,3162878,"FLAWLESS FACTORY LIMITED",2022-06-15,,"Private, ltd by shares"106,3162940,"Fortune Milestone Logistics (Hong Kong) Limited
明福物流（香港）有限公司",2022-06-15,,"Private, ltd by shares"107,3162977,"Framehouse Limited (The)",2022-06-15,,"Private, ltd by shares"108,3162694,"FU ZHONG RONG TRADING LIMITED
福中榮貿易有限公司",2022-06-15,,"Private, ltd by shares"109,3162944,"Galaxy Air-Conditioning Engineering Limited
銀河冷氣工程有限公司",2022-06-15,,"Private, ltd by shares"110,3162973,"Game Life Studio Limited
純遊社有限公司",2022-06-15,,"Private, ltd by shares"111,3162971,"Gang Zhuan Group Limited
港專集團有限公司",2022-06-15,,"Private, ltd by shares"112,3162769,"Gbond Industrial Development Co., Limited
邦德實業發展有限公司",2022-06-15,,"Private, ltd by shares"113,3162920,"Global Alliance Against The Epidemic (GAAE) Limited (The)
全球抗疫聯盟有限公司",2022-06-15,,"Private, ltd by shares"114,3162624,"Global Vision Management Limited
宏暉管理有限公司",2022-06-15,,"Private, ltd by shares"115,3162807,"Glorycheck Shipping (HK) Limited",2022-06-15,,"Private, ltd by shares"116,3162903,"Gold Pinyang International Co., Limited
金品揚國際有限公司",2022-06-15,,"Private, ltd by shares"117,3162781,"Grance Limited (HK)",2022-06-15,,"Private, ltd by shares"118,3162964,"Grand Forest Engineering Limited
豐林工程有限公司",2022-06-15,,"Private, ltd by shares"119,3162790,"Great Times Global Trading Co., Limited",2022-06-15,,"Private, ltd by shares"120,3162818,"GREENFOOD GLOBAL SUPPLY INDUSTRY LIMITED",2022-06-15,,"Private, ltd by shares"121,3162789,"Greroyalt Co. Limited",2022-06-15,,"Private, ltd by shares"122,3162890,"GUANGZHOU YIDU TECHNOLOGY LIMITED
廣州一嘟科技有限公司",2022-06-15,,"Private, ltd by shares"123,3162782,"Haitao Global Trade Group Limited
海淘全球貿易集團有限公司",2022-06-15,,"Private, ltd by shares"124,3162928,"HAIXIANG INTERNATIONAL CO., LIMITED
海翔國際有限公司",2022-06-15,,"Private, ltd by shares"125,3162679,"Han's Chinese Medicine Dispensing Centre Limited
漢立方配藥中心有限公司",2022-06-15,,"Private, ltd by shares"126,3162697,"HANGJIA TRADING LIMITED
航佳貿易有限公司",2022-06-15,,"Private, ltd by shares"127,3162926,"HANOI BOARDS LIMITED",2022-06-15,,"Private, ltd by shares"128,3162885,"HANSUN INTERNATIONAL TRADING LIMITED
晗忻國際貿易有限公司",2022-06-15,,"Private, ltd by shares"129,3162898,"HAUSlN ENTERPR I SES CO., LIMITED
浩新企業股份有限公司",2022-06-15,,"Private, ltd by shares"130,3162639,"HIGH FIVE INDUSTRIAL LIMITED
雙贏實業有限公司",2022-06-15,,"Private, ltd by shares"131,3162684,"HK Change Group Limited",2022-06-15,,"Private, ltd by shares"132,3162726,"HK Hengxinjiahe Trade Limited
香港恒信嘉和貿易有限公司",2022-06-15,,"Private, ltd by shares"133,3162950,"HK LIDE TECHNOLOGY CO., LIMITED
香港立德科技有限公司",2022-06-15,,"Private, ltd by shares"134,3162881,"HK LINGJIAN BUSINESS SERVICES LIMITED
香港領見商務服務有限公司",2022-06-15,,"Private, ltd by shares"135,3162900,"Hmdd International Trade Co., Limited
韓美多多國際貿易有限公司",2022-06-15,,"Private, ltd by shares"136,3162760,"Hong Kong Bondheuser Technology Co., Limited
香港柏德赫斯科技有限公司",2022-06-15,,"Private, ltd by shares"137,3162828,"Hong Kong Cancer Support Foundation Limited
香港癌症支援基金會有限公司",2022-06-15,,"Ltd by guarantee"138,3162955,"Hong Kong Chikhong International Logistics Co., Limited
香港千航國際物流有限公司",2022-06-15,,"Private, ltd by shares"139,3162720,"HONG KONG DEYAO CONSULTING LIMITED
香港德堯諮詢有限公司",2022-06-15,,"Private, ltd by shares"140,3162740,"Hong Kong Dongkai Toys Limited
香港東凱玩具有限公司",2022-06-15,,"Private, ltd by shares"141,3162840,"Hong Kong Gift Store Limited
香港禮品有限公司",2022-06-15,,"Private, ltd by shares"142,3162936,"Hong Kong Green Development Trading Company Limited
香港綠發貿易有限公司",2022-06-15,,"Private, ltd by shares"143,3162906,"Hong Kong Haooyun Technology Co., Limited
香港浩雲科技有限公司",2022-06-15,,"Private, ltd by shares"144,3162656,"Hong Kong Huaxing Holdings Limited
香港華興控股有限公司",2022-06-15,,"Private, ltd by shares"145,3162735,"Hong Kong Huikang Holding Asset Management Limited
香港匯康控股資產管理有限公司",2022-06-15,,"Private, ltd by shares"146,3162943,"HONG KONG JETEK GROUP CO., LIMITED
香港捷德集團有限公司",2022-06-15,,"Private, ltd by shares"147,3162887,"Hong Kong Jianmasson Trading Co., Limited
香港建瑪遜貿易有限公司",2022-06-15,,"Private, ltd by shares"148,3162939,"Hong Kong Lefan Electronics Limited
香港樂凡電子有限公司",2022-06-15,,"Private, ltd by shares"149,3162960,"Hong Kong Magnificent Trading Co., Limited
香港美輪美奐貿易有限公司",2022-06-15,,"Private, ltd by shares"150,3162833,"Hong Kong Port Zhongyuan Pharmaceutical Co., Limited
香港港中源醫藥有限公司",2022-06-15,,"Private, ltd by shares"151,3162667,"HONG KONG PROYA CONSULTING SERVICE LIMITED
香港普樂雅咨詢服務有限公司",2022-06-15,,"Private, ltd by shares"152,3162839,"HONG KONG QIAN MO ENTERPRISES LIMITED
香港阡陌有限公司",2022-06-15,,"Private, ltd by shares"153,3162803,"Hong Kong QiSheng Electronic Technology Co., Limited
香港啟昇電子科技有限公司",2022-06-15,,"Private, ltd by shares"154,3162931,"Hong Kong Right Brain Creative Technology Limited",2022-06-15,,"Private, ltd by shares"155,3162788,"Hong Kong Slayer Investment Group COMPANY LIMITED
香港斯萊爾投資集團有限公司",2022-06-15,,"Private, ltd by shares"156,3162778,"HONG KONG SWIRL WIND CO. LIMITED
香港黑旋風有限公司",2022-06-15,,"Private, ltd by shares"157,3162952,"Hong Kong Wins International Logistics Co., Limited
香港千翼國際物流有限公司",2022-06-15,,"Private, ltd by shares"158,3162647,"Hong Kong XinQi Information Technology Limited",2022-06-15,,"Private, ltd by shares"159,3162787,"Hong Kong Yikailite Trading Co., Limited
香港宜凱利特貿易有限公司",2022-06-15,,"Private, ltd by shares"160,3162654,"HONG KONG YINGGE TRADING CO., LIMITED
香港盈格貿易有限公司",2022-06-15,,"Private, ltd by shares"161,3162826,"Hong Kong Youth Enterpreneurs Service Centre Limited
香港青年(內地)創業服務中心有限公司",2022-06-15,,"Ltd by guarantee"162,3162899,"Hong Kong Zhuocheng Puhui Technology Limited
香港卓成普慧科技有限公司",2022-06-15,,"Private, ltd by shares"163,3162763,"Hongkong Genius Investment Consultants Limited
香港吉利行投資顧問有限公司",2022-06-15,,"Private, ltd by shares"164,3162816,"HongKong KATOP Automation Co., Limited",2022-06-15,,"Private, ltd by shares"165,3162856,"HONGKONG LEOPARD GROUP CO., LIMITED
香港萊帕德集團有限公司",2022-06-15,,"Private, ltd by shares"166,3162813,"HongKong Ming Li Wei Technology Co., Limited
香港明利威科技有限公司",2022-06-15,,"Private, ltd by shares"167,3162753,"HONGKONG OLUOKE TRADE LIMITED
香港歐洛克貿易有限公司",2022-06-15,,"Private, ltd by shares"168,3162750,"HongKong Shuoer Trading Co., Limited
香港碩爾貿易有限公司",2022-06-15,,"Private, ltd by shares"169,3162626,"Hongkong Skypower Architecture and Technology Limited
香港天力建築科技有限公司",2022-06-15,,"Private, ltd by shares"170,3162663,"HONGKONG XIANGLING INTERNATIONAL TRADE LIMITED
香港湘菱國際貿易有限公司",2022-06-15,,"Private, ltd by shares"171,3162930,"HongKong ZhaoPing Trading Co., Limited
香港兆平貿易有限公司",2022-06-15,,"Private, ltd by shares"172,3162886,"HONGYI INVESTMENT CORPORATION LIMITED
泓毅投資有限公司",2022-06-15,,"Private, ltd by shares"173,3162652,"HONGYU GRAIN LIMITED
宏裕食品有限公司",2022-06-15,,"Private, ltd by shares"174,3162634,"Horseman Vehicle Co., Limited
華盛重型汽車有限公司",2022-06-15,,"Private, ltd by shares"175,3162752,"How Nice Packaging Technology Co., Limited
豪耐斯包裝科技有限公司",2022-06-15,,"Private, ltd by shares"176,3162641,"HOYI CO., LIMITED
宏毅創芯(香港)科技有限公司",2022-06-15,,"Private, ltd by shares"177,3162725,"HUA XIN HANG ELECTRONICS CO., LIMITED
華芯行電子有限公司",2022-06-15,,"Private, ltd by shares"178,OF0000074,"HuaAn Investment Fund II OFC
華安投資基金（二）開放式基金型公司",2022-06-15,,"Open-ended Fund Company"179,3162891,"HUAJIA JEWELRY GROUP LIMITED
華佳飾品集團有限公司",2022-06-15,,"Private, ltd by shares"180,3162969,"HUATAI (HONG KONG) TECHNOLOGY CO., LIMITED
華泰(香港)科技有限公司",2022-06-15,,"Private, ltd by shares"181,3162767,"Huimin Medicine (HK) Trading Limited
惠民醫藥(香港)貿易有限公司",2022-06-15,,"Private, ltd by shares"182,3162965,"Hung Bon International Com Limited
亨邦國際有限公司",2022-06-15,,"Private, ltd by shares"183,3162823,"Hxit Limited
匯迅國際科技有限公司",2022-06-15,,"Private, ltd by shares"184,3162820,"Hypothesis Limited",2022-06-15,,"Private, ltd by shares"185,3162622,"Hyundai Energy Asia Pacific Holdings Limited
現代能源亞太控股有限公司",2022-06-15,,"Private, ltd by shares"186,3162812,"ICRIS:3162812 (no English name)
香港教聯會媞春基金有限公司",2022-06-15,,"Ltd by guarantee"187,3162650,"INFINITY INTERNATIONAL EDUCATION &amp; INNOVATION LIMITED
思翰國際教育創科集團有限公司",2022-06-15,,"Private, ltd by shares"188,3162780,"INFO STORM CO., LIMITED",2022-06-15,,"Private, ltd by shares"189,3162846,"Ingenious Creative Design Co., Limited
天創設計有限公司",2022-06-15,,"Private, ltd by shares"190,3162941,"International Pet Nutrition &amp; Health Association (China) Limited
國際寵物營養及健康協會(中國)有限公司",2022-06-15,,"Private, ltd by shares"191,3162620,"INTERNATIONAL WANXIN GROUP COMPANY LIMITED
國際萬心集團有限公司",2022-06-15,,"Private, ltd by shares"192,3162754,"ITALY GUIRENNIAO SHOES &amp; APPARELS INT'L GROUP LIMITED
意大利貴人鳥鞋服國際集團有限公司",2022-06-15,,"Private, ltd by shares"193,3162728,"JBL METAL LIMITED",2022-06-15,,"Private, ltd by shares"194,3162800,"JET GLOBAL DEVELOPMENT LIMITED
俊嘉發展有限公司",2022-06-15,,"Private, ltd by shares"195,3162727,"Jiashengyu International Trade Co., Limited
嘉盛宇國際貿易有限公司",2022-06-15,,"Private, ltd by shares"196,3162976,"Jin Qia Guo Ji Limited
津洽國際有限公司",2022-06-15,,"Private, ltd by shares"197,3162806,"JINWEIHAO TRADING LIMITED
金偉豪貿易有限公司",2022-06-15,,"Private, ltd by shares"198,3162742,"JK Cleaning Services Limited
進杰清潔服務有限公司",2022-06-15,,"Private, ltd by shares"199,3162698,"JLT Healthcare (HK) Pharmaceutical Group Limited
九樂堂康養(香港)醫藥集團有限公司",2022-06-15,,"Private, ltd by shares"200,3162801,"Jordaneng Co., Limited",2022-06-15,,"Private, ltd by shares"201,3162957,"JOY BEST HOLDING LIMITED
億樂(控股)有限公司",2022-06-15,,"Private, ltd by shares"202,3162857,"Joyful Music Limited
弘樂音樂有限公司",2022-06-15,,"Private, ltd by shares"203,3162715,"JUSTAR OVERSEAS LIMITED
香港吉士達國際咨詢有限公司",2022-06-15,,"Private, ltd by shares"204,3162947,"KAICHENG HONG KONG CO., LIMITED
凱成香港有限公司",2022-06-15,,"Private, ltd by shares"205,3162851,"Kaililamei Limited
開利拉美國際有限公司",2022-06-15,,"Private, ltd by shares"206,3162850,"Kam Ming Water Works Company Limited
金鳴水務工程有限公司",2022-06-15,,"Private, ltd by shares"207,3162657,"Kanga Trading Limited
康加貿易有限公司",2022-06-15,,"Private, ltd by shares"208,3162861,"KC (GBA) Surveyors Limited
高致(大灣區)測量師行有限公司",2022-06-15,,"Private, ltd by shares"209,3162734,"KEBIN HOLDINGS LIMITED",2022-06-15,,"Private, ltd by shares"210,3162717,"KICKMOBI LIMITED
科捷網絡科技有限公司",2022-06-15,,"Private, ltd by shares"211,3162786,"Kind Hearted Co., Limited",2022-06-15,,"Private, ltd by shares"212,3162668,"KP Engineering International Limited",2022-06-15,,"Private, ltd by shares"213,3162909,"Kwong Fuk Carpark Limited
廣福停車場有限公司",2022-06-15,,"Private, ltd by shares"214,3162836,"Kyra Beauty Company Limited",2022-06-15,,"Private, ltd by shares"215,3162619,"L.Y. Decoration Limited
雷鈺有限公司",2022-06-15,,"Private, ltd by shares"216,3162686,"Lanlasaki Holding Group Limited",2022-06-15,,"Private, ltd by shares"217,3162794,"LATIN EXPRESS (HONGKONG) CO., LIMITED
拉丁速運(香港)有限公司",2022-06-15,,"Private, ltd by shares"218,3162838,"Leetide Co., Limited",2022-06-15,,"Private, ltd by shares"219,3162963,"Legacy Family Wealth Office Limited
家族財富傳承辦公室有限公司",2022-06-15,,"Private, ltd by shares"220,3162674,"LEMONNG42 LIMITED",2022-06-15,,"Private, ltd by shares"221,3162642,"LHE Dixon Limited",2022-06-15,,"Private, ltd by shares"222,3162673,"Li Jing Trade Co., Limited
立錦貿易有限公司",2022-06-15,,"Private, ltd by shares"223,3162978,"Link Silver Scaffolding Limited
祿怡棚業工程有限公司",2022-06-15,,"Private, ltd by shares"224,3162882,"LIVING LIGHT ART COMPANY LIMITED (THE)",2022-06-15,,"Private, ltd by shares"225,3162759,"LIXUE INTERNATIONAL TRADING LIMITED
立雪國際貿易有限公司",2022-06-15,,"Private, ltd by shares"226,3162738,"LJ Lifestyle Limited",2022-06-15,,"Private, ltd by shares"227,3162690,"Luck Star HK Limited
幸運星香港有限公司",2022-06-15,,"Private, ltd by shares"228,3162612,"Lung Hei Environmental Recycling Limited
龍希環保回收有限公司",2022-06-15,,"Private, ltd by shares"229,3162757,"Mailin Equipment And Accessories Co., Limited",2022-06-15,,"Private, ltd by shares"230,3162809,"Mattaworks Limited
明域科技有限公司",2022-06-15,,"Private, ltd by shares"231,3162953,"MCHI TRADING LIMITED
香港明志貿易有限公司",2022-06-15,,"Private, ltd by shares"232,3162773,"Meta Entertainment Co., Limited
元點娛樂有限公司",2022-06-15,,"Private, ltd by shares"233,3162847,"Metalabs Company Limited",2022-06-15,,"Private, ltd by shares"234,3162938,"MICROBITS TECHNOLOGY (HK) CO., LIMITED
微粒科技(香港)有限公司",2022-06-15,,"Private, ltd by shares"235,3162670,"MicroCoherent Limited
香港微潼有限公司",2022-06-15,,"Private, ltd by shares"236,3162744,"MIKAH (China) Investment Co., Limited
米咖(中國)投資有限公司",2022-06-15,,"Private, ltd by shares"237,3162714,"Mindswide Limited",2022-06-15,,"Private, ltd by shares"238,3162629,"Mintage M&amp;C Limited",2022-06-15,,"Private, ltd by shares"239,3162929,"Mivolis Prime Limited",2022-06-15,,"Private, ltd by shares"240,3162854,"MKX TECHNOLOGY INDUSTRIAL CO., LIMITED
牧凱新科技實業有限公司",2022-06-15,,"Private, ltd by shares"241,3162631,"Moon Infinity Development Group Limited
越永發展集團有限公司",2022-06-15,,"Private, ltd by shares"