,Reg no.,Name,Incorp-orated,Dissolved,Type245,1810600,"HK LANMENGZI INT'L DRESS Co., LIMITED
香港蘭夢姿國際服飾有限公司",2012-10-11,,"Private, ltd by shares"246,1810883,"HK RUIDA INVESTMENT MANAGEMENT LIMITED
香港睿達投資管理有限公司",2012-10-11,2016-06-03,"Private, ltd by shares"247,1811073,"HL Riches Capital Group Limited
洪利資本集團有限公司",2012-10-11,,"Private, ltd by shares"248,1810684,"HNL ENTERPRISES LIMITED
康營樂社有限公司",2012-10-11,,"Private, ltd by shares"249,1810928,"Ho Chi Air Conditioning &amp; Engineering Company Limited
浩志冷氣工程有限公司",2012-10-11,2014-11-07,"Private, ltd by shares"250,1810985,"HONFORD ENTERPRISES LIMITED
海豐企業有限公司",2012-10-11,,"Private, ltd by shares"251,1810903,"HONG HAE TRADING CO., LIMITED
弘惠貿易有限公司",2012-10-11,2020-07-03,"Private, ltd by shares"252,1810606,"HONG KONG MAX GROUP HOLDINGS CO., LIMITED
香港迅成集團控股有限公司",2012-10-11,2018-06-22,"Private, ltd by shares"253,1810964,"HONG KONG PREEMINENCE FASHION LIMITED
香港卓越服裝有限公司",2012-10-11,2015-07-24,"Private, ltd by shares"254,1811056,"HONG KONG PRODUCTIVITY EQUIPMENT LIMITED
香港生產力設備有限公司",2012-10-11,2020-10-16,"Private, ltd by shares"255,1810850,"Hong Kong Rim Commerce Limited",2012-10-11,2020-05-29,"Private, ltd by shares"256,1810782,"HONG KONG SINOCHAMP ENERGY HOLDINGS LIMITED
香港冠華能源集團有限公司",2012-10-11,2016-06-10,"Private, ltd by shares"257,1810855,"HONG KONG UNIVERSE ENTERTAINMENT MANAGEMENT LIMITED
香港寰宇娛樂管理有限公司",2012-10-11,2016-06-03,"Private, ltd by shares"258,1811026,"HONG KONG WANBAOLONG INVESTMENT LIMITED
香港萬寶隆投資有限公司",2012-10-11,2016-06-03,"Private, ltd by shares"259,1811000,"HONG TENG INDUSTRY LIMITED
鴻騰實業有限公司",2012-10-11,2019-07-05,"Private, ltd by shares"260,1810773,"HONG XIN FOUNDATION LIMITED (d2018-05-18)
洪薪基金有限公司",2012-10-11,2018-05-18,"Private, ltd by shares"261,1810613,"HONG-KAI CHINESE MEDICINE CLINIC (FANLING) LIMITED
康楷中醫診所(粉嶺)有限公司",2012-10-11,2016-06-30,"Private, ltd by shares"262,1810948,"HONGKONG BAINIAN HUIYING TRADING LIMITED
香港百年匯盈貿易有限公司",2012-10-11,2017-06-23,"Private, ltd by shares"263,1810846,"HONGKONG BAOSTEEL TRADE CO., LIMITED
香港寶鐵貿易有限公司",2012-10-11,,"Private, ltd by shares"264,1810813,"HONGKONG GRANDLONG TEXTILE CO., LIMITED
香港廣德隆紡織有限公司",2012-10-11,,"Private, ltd by shares"265,1810780,"HONGKONG HAICHANG GLOBAL LIMITED
香港海昌環球有限公司",2012-10-11,2019-10-11,"Private, ltd by shares"266,1811016,"HONGKONG HUANGLONG INVESTMENT GROUP CO., LIMITED
香港皇隆投資集團有限公司",2012-10-11,2017-06-23,"Private, ltd by shares"267,1810588,"HONGKONG KABIJIA INT'L LIMITED
香港卡碧嘉國際有限公司",2012-10-11,2020-06-05,"Private, ltd by shares"268,1810664,"HONGKONG YASUDA INDUSTRY CO., LIMITED
香港安田工業有限公司",2012-10-11,2016-08-12,"Private, ltd by shares"269,1810881,"HONGKONG YUEYING ELECTRONIC TECHNOLOGY CO., LIMITED
香港躍穎電子科技有限公司",2012-10-11,2017-12-01,"Private, ltd by shares"270,1810598,"HONOUR MEGA LIMITED
亨培有限公司",2012-10-11,,"Private, ltd by shares"271,1810900,"HOPE LANG INTERNATIONAL COMPANY LIMITED
豪岱國際發展有限公司",2012-10-11,2014-03-21,"Private, ltd by shares"272,1810567,"Huawo (Tianjin) International Dredging Engineering Co., Limited
華沃(天津)國際疏浚工程有限公司",2012-10-11,2015-10-23,"Private, ltd by shares"273,1810840,"HUGE BLOOM DEVELOPMENT LIMITED (d2020-04-17)
浩興發展有限公司",2012-10-11,2020-04-17,"Private, ltd by shares"274,1810575,"HUGE KATE INTERNATIONAL (HONG KONG) LIMITED
凱鴻國際(香港)有限公司",2012-10-11,2017-08-25,"Private, ltd by shares"275,1810715,"HUIJINLI (HK) CO., LIMITED
匯金利(香港)有限公司",2012-10-11,2016-02-05,"Private, ltd by shares"276,1810778,"i3Beauty Limited",2012-10-11,2013-11-22,"Private, ltd by shares"277,1810867,"ICD Investment (TC) Limited
理城投資(達之)有限公司",2012-10-11,2019-01-18,"Private, ltd by shares"278,1810755,"IMAGINE RESEARCH LIMITED
奇想科研有限公司",2012-10-11,2019-04-26,"Private, ltd by shares"279,1810893,"IN TEL LIMITED",2012-10-11,2015-05-15,"Private, ltd by shares"280,1810624,"INCOME GLORY LIMITED
財贊有限公司",2012-10-11,,"Private, ltd by shares"281,1810622,"Inno Consultancy Limited
展弘服務有限公司",2012-10-11,,"Private, ltd by shares"282,1810910,"Innovative System of Investment (ISI) Limited",2012-10-11,2016-06-03,"Private, ltd by shares"283,1810831,"INTELLIGENT SOURCE GREEN ENERGY LIMITED
智源綠色能源有限公司",2012-10-11,,"Private, ltd by shares"284,1810889,"INTERNATIONAL AMBER ASSOCIATION CO., LIMITED
國際琥珀協會有限公司",2012-10-11,,"Private, ltd by shares"285,1810932,"International Flower Company Limited",2012-10-11,,"Private, ltd by shares"286,1810552,"INTERNATIONALTRAVEL SERVICE (HONG KONG) CO., LIMITED
國旅(香港)國際旅行社有限公司",2012-10-11,2017-06-23,"Private, ltd by shares"287,1810682,"Internet Online Housing Service Co. Limited
互聯網服務有限公司",2012-10-11,,"Private, ltd by shares"288,1810847,"JAIRUIS &amp; AUDIFAX'S IMAGINE SERVICES CO., LIMITED
贏得家服務有限公司",2012-10-11,2016-06-03,"Private, ltd by shares"289,1810576,"JEWELLERY AND GEMSTONES LIMITED",2012-10-11,2018-06-22,"Private, ltd by shares"290,1810821,"JOHNSON (HK) GROUP LIMITED
強森(香港)集團有限公司",2012-10-11,2014-04-17,"Private, ltd by shares"291,1811013,"JOINT DYNAMICS LIMITED (HK)",2012-10-11,,"Private, ltd by shares"292,1811072,"Joint-Effort Holdings Co., Limited
錦雅明品控股股份有限公司",2012-10-11,,"Private, ltd by shares"293,1810722,"JONSUN INC. LIMITED
卓晟投資有限公司",2012-10-11,2014-01-17,"Private, ltd by shares"294,1810640,"JOY LUCKY DEVELOPMENT LIMITED
瑞欣發展有限公司",2012-10-11,,"Private, ltd by shares"295,1811066,"JOYFUL HILL INTERNATIONAL LIMITED
峰悅國際有限公司",2012-10-11,2016-06-03,"Private, ltd by shares"296,1810873,"JT CAPITAL ASSET MANAGEMENT LIMITED
凱庫資產管理有限公司",2012-10-11,,"Private, ltd by shares"297,1810738,"JUNQI METAL BED (HONG KONG) LIMITED
君起金屬床(香港)有限公司",2012-10-11,2016-12-30,"Private, ltd by shares"298,1810899,"K-GOLD INTERNATIONAL HONGKONG LIMITED
香港慶金國際有限公司",2012-10-11,,"Private, ltd by shares"299,1810652,"KEEN DRAGON INTERNATIONAL LIMITED (d2020-06-12)
銳龍國際有限公司",2012-10-11,2020-06-12,"Private, ltd by shares"300,1810647,"KEEN EAGLE TRADING LIMITED
銳鷹貿易有限公司",2012-10-11,2014-06-20,"Private, ltd by shares"301,1811033,"KEY GRACE LIMITED",2012-10-11,2016-02-12,"Private, ltd by shares"302,1811038,"Keyway Innovations Limited
基慧創華有限公司",2012-10-11,,"Private, ltd by shares"303,1810639,"KF Innovatus Limited",2012-10-11,2018-04-06,"Private, ltd by shares"304,1810905,"KIARA GROUP CORPORATION LIMITED",2012-10-11,2018-06-22,"Private, ltd by shares"305,1811017,"KIND HILL LIMITED
良峰有限公司",2012-10-11,2016-09-23,"Private, ltd by shares"306,1810968,"KING'S WAY BUSINESS SERVICES LIMITED
王道商業服務有限公司",2012-10-11,,"Private, ltd by shares"307,1810745,"KINGDOM OF FURNISHINGS CO., LIMITED
金頓家居有限公司",2012-10-11,,"Private, ltd by shares"308,1810604,"KINGER DIAMOND TOOLS FACTORY LIMITED
金戈金剛石製品有限公司",2012-10-11,,"Private, ltd by shares"309,1811051,"KLT Corporate Services Limited
盈信服務有限公司",2012-10-11,,"Private, ltd by shares"310,1810856,"KoMo Optical And Technology (HK) Co., Limited
科茂光電技術(香港)有限公司",2012-10-11,,"Private, ltd by shares"311,1810811,"Kompany Trading (Hong Kong) Limited
高珀利貿易(香港)有限公司",2012-10-11,,"Private, ltd by shares"312,1810814,"Kyobi Hong Kong Co., Limited
京美香港有限公司",2012-10-11,2018-05-18,"Private, ltd by shares"313,1810797,"LABAL ASIA INTERNATIONAL LIMITED
萊普洛亞洲國際有限公司",2012-10-11,2014-01-10,"Private, ltd by shares"314,1810858,"LC MOTOR (HONG KONG) INDUSTRIAL CO., LIMITED
雷昌電機(香港)實業有限公司",2012-10-11,2018-06-22,"Private, ltd by shares"315,1810646,"LEADING HERO INTERNATIONAL LIMITED
領雄國際有限公司",2012-10-11,,"Private, ltd by shares"316,1810673,"LEADING LORD (HONG KONG) LIMITED
領君(香港)有限公司",2012-10-11,2018-06-22,"Private, ltd by shares"317,1810772,"Levanda Limited",2012-10-11,2019-08-02,"Private, ltd by shares"318,1810577,"LGF HONG KONG CO., LIMITED",2012-10-11,2017-06-23,"Private, ltd by shares"319,1810612,"LI CHENG INTERNATIONAL TRADING LIMITED
利成國際貿易有限公司",2012-10-11,2016-06-03,"Private, ltd by shares"320,1810616,"Li-Schmidt Consulting Limited
李－施密特諮詢有限公司",2012-10-11,2017-06-23,"Private, ltd by shares"321,1810583,"LIKAI ENTERPRISE CO., LIMITED
利鎧企業有限公司",2012-10-11,,"Private, ltd by shares"322,1810791,"LINKXIN ZAOQING (H-K) INTERNATIONAL TRADE COMPANY LIMITED",2012-10-11,2020-06-26,"Private, ltd by shares"323,1810720,"LINQING CLEAN CHEMICAL CO., LIMITED",2012-10-11,,"Private, ltd by shares"324,1810578,"LINTHROPE LIMITED",2012-10-11,,"Private, ltd by shares"325,1810798,"Longsmile (HK) Co., Limited
郎思邁(香港)實業有限公司",2012-10-11,2016-06-03,"Private, ltd by shares"326,1810875,"LOVE ANCIENT CULTURE INTERNATIONAL GROUP CO., LIMITED
愛古文化國際集團有限公司",2012-10-11,,"Private, ltd by shares"327,1811019,"LOYAL BENEFIT LIMITED (d2015-09-11)
誼潤有限公司",2012-10-11,2015-09-11,"Private, ltd by shares"328,1810807,"LST Operating Limited",2012-10-11,,"Private, ltd by shares"329,1810572,"Luck Technology (HongKong) Co., Limited
香港利凱科技有限公司",2012-10-11,2018-05-25,"Private, ltd by shares"330,1810671,"LUCKY EXPRESS (HONG KONG) LIMITED
祥達(香港)有限公司",2012-10-11,,"Private, ltd by shares"331,1811021,"LULUTONG CIRCUIT TECHNOLOGY CO., LIMITED
路路通電路科技有限公司",2012-10-11,2014-04-04,"Private, ltd by shares"332,1810762,"MADELEINE THOMPSON LIMITED",2012-10-11,,"Private, ltd by shares"333,1810934,"MAGIC PROFIT LIMITED
奇財有限公司",2012-10-11,2015-08-28,"Private, ltd by shares"334,1810818,"MAIN CENTURY INVESTMENT LIMITED
明宇投資有限公司",2012-10-11,,"Private, ltd by shares"335,1810743,"MAKEE GROUP (HK) LIMITED
馬記集團(香港)有限公司",2012-10-11,2016-06-03,"Private, ltd by shares"336,1810585,"MARSTAR TECHNOLOGY LIMITED
瑪斯特科技有限公司",2012-10-11,2019-08-30,"Private, ltd by shares"337,1811053,"MAX-LAND AUDIO COMPANY LIMITED
創聯音響有限公司",2012-10-11,2018-06-22,"Private, ltd by shares"338,1811024,"MEGA EARN CORPORATION LIMITED
佰得有限公司",2012-10-11,,"Private, ltd by shares"339,1810625,"MEGA FIELD CORPORATION LIMITED (d2014-10-10)
灃培有限公司",2012-10-11,2014-10-10,"Private, ltd by shares"340,1810659,"MEGA ZONE PROPERTIES LIMITED (d2018-05-18)
萬維置業有限公司",2012-10-11,2018-05-18,"Private, ltd by shares"341,1810746,"METRO LUCK DEVELOPMENT LIMITED (d2016-03-24)
城裕發展有限公司",2012-10-11,2016-03-24,"Private, ltd by shares"342,1810799,"MGB Resources Limited",2012-10-11,2016-06-03,"Private, ltd by shares"343,1810792,"Microart International Limited
典藝國際有限公司",2012-10-11,,"Private, ltd by shares"344,1810741,"Mika Investment Limited",2012-10-11,2015-03-06,"Private, ltd by shares"345,1810976,"MILLION MASTER DEVELOPMENT LIMITED
萬茂發展有限公司",2012-10-11,2016-02-19,"Private, ltd by shares"346,1811001,"MILLION TOP INTERNATIONAL ENTERPRISES LIMITED
萬得國際企業有限公司",2012-10-11,2019-08-30,"Private, ltd by shares"347,1810866,"MING HIGH INTERNATIONAL COMPANY LIMITED
洺海國際有限公司",2012-10-11,2014-02-28,"Private, ltd by shares"348,1810790,"MING ZHI CEILING ENGINEERING COMPANY LIMITED
明智天花工程有限公司",2012-10-11,,"Private, ltd by shares"349,1810864,"MORAL TECHNOLOGY AND SCIENCE CO., LIMITED
德賽科技有限公司",2012-10-11,,"Private, ltd by shares"350,1810628,"MULTI INCOME CORPORATION LIMITED
茂百有限公司",2012-10-11,,"Private, ltd by shares"351,1810945,"MUR NOMADE LIMITED",2012-10-11,2020-05-15,"Private, ltd by shares"352,1810579,"MWT Global Limited
邁五泰有限公司",2012-10-11,2015-09-25,"Private, ltd by shares"353,1810939,"NESCOM Limited (d2016-02-26)",2012-10-11,2016-02-26,"Private, ltd by shares"354,1811062,"NEW CREATION (HK) LIMITED
全新概念有限公司",2012-10-11,,"Private, ltd by shares"355,1810750,"NEW HARVEST (CHINA) LIMITED (d2017-06-23)
新盛(中國)有限公司",2012-10-11,2017-06-23,"Private, ltd by shares"356,1810769,"NEW HONEST PROPERTIES LIMITED
新誠置業有限公司",2012-10-11,,"Private, ltd by shares"357,1810775,"NEW SHARP DEVELOPMENT LIMITED
新勁發展有限公司",2012-10-11,2017-06-23,"Private, ltd by shares"358,1810590,"NEW WING TAI MANAGEMENT LIMITED
新永泰管理有限公司",2012-10-11,,"Private, ltd by shares"359,1810768,"NGAI CHING FURNITURE INTERNATIONAL GROUP (HONG KONG) CO., LIMITED
藝精傢俱國際集團(香港)有限公司",2012-10-11,,"Private, ltd by shares"360,1810806,"NICE BILLION PROPERTIES LIMITED
佳億置業有限公司",2012-10-11,,"Private, ltd by shares"361,1810810,"NICE CHINA TRADING LIMITED (d2015-04-02)
漢益貿易有限公司",2012-10-11,2015-04-02,"Private, ltd by shares"362,1810686,"NICE HILL PROPERTIES LIMITED
美峰置業有限公司",2012-10-11,2019-07-19,"Private, ltd by shares"363,1810843,"NICE SMART DEVELOPMENT LIMITED
傑麗發展有限公司",2012-10-11,,"Private, ltd by shares"364,1810713,"NINGBO BETTERRISE INTERNATIONAL TRADING CO., LIMITED
寧波百升國際貿易有限公司",2012-10-11,2018-04-20,"Private, ltd by shares"365,1810645,"NINOMIYA SHOJI COMPANY LIMITED",2012-10-11,2018-05-18,"Private, ltd by shares"366,1810601,"NOBLE BRAND CORPORATION LIMITED
品栢有限公司",2012-10-11,,"Private, ltd by shares"367,1810849,"NOBLE CHIP HOLDINGS LIMITED
華芯控股有限公司",2012-10-11,2020-03-27,"Private, ltd by shares"368,1810676,"NOBLE LORD (HONG KONG) LIMITED
尚君(香港)有限公司",2012-10-11,,"Private, ltd by shares"369,1810902,"NOBLE NATIONS LIMITED
慧國有限公司",2012-10-11,,"Private, ltd by shares"370,1810568,"NORTHCREEK RESEARCH AND DATA LIMITED",2012-10-11,2015-07-03,"Private, ltd by shares"371,1810660,"NORTHSTAR DIAMONDS LIMITED",2012-10-11,2018-06-22,"Private, ltd by shares"372,1811083,"NOVA SOLUTION HOLDINGS LIMITED",2012-10-11,,"Private, ltd by shares"373,1810907,"OFFSHORE CONSTRUCTION COMPANY LIMITED",2012-10-11,2020-10-30,"Private, ltd by shares"374,1810938,"OPPO (HK) LIMITED
歐堡有限公司",2012-10-11,,"Private, ltd by shares"375,1810765,"Oreanda Limited (d2014-09-26)",2012-10-11,2014-09-26,"Private, ltd by shares"376,1810580,"ORGANIC HEALTH GROUP LIMITED",2012-10-11,2017-04-13,"Private, ltd by shares"377,1811039,"ORIENTAL CHAMP LIMITED",2012-10-11,,"Private, ltd by shares"378,1810927,"P &amp; J MEDICAL LIMITED
昌健醫療中心有限公司",2012-10-11,2017-06-02,"Private, ltd by shares"379,1810962,"P &amp; M DEVELOPMENT LIMITED
必貿有限公司",2012-10-11,,"Private, ltd by shares"380,1810977,"PACIFIC LEADER DEVELOPMENT LIMITED
恒立發展有限公司",2012-10-11,2015-12-11,"Private, ltd by shares"381,1811093,"PARTNER LEGEND LIMITED
勤君有限公司",2012-10-11,,"Private, ltd by shares"382,1810603,"PATRICK SPORTSWEAR LIMITED",2012-10-11,2019-08-02,"Private, ltd by shares"383,1810877,"PEARL GOLDEN GLOBE TRADING COMPANY LIMITED
柏爾金環球貿易有限公司",2012-10-11,2020-04-03,"Private, ltd by shares"384,1810726,"PEMA CONSTRUCTION MATERIAL TECHNOLOGY COMPANY LIMITED
白瑪建材科技有限公司",2012-10-11,,"Private, ltd by shares"385,1810933,"Photobook Project Limited",2012-10-11,2014-05-23,"Private, ltd by shares"386,1810851,"Pitec Group Company Limited",2012-10-11,2016-06-30,"Private, ltd by shares"387,1810565,"POINTERIN DEVELOPMENT (INTERNATIONAL) COMPANY LIMITED
駿新發展(國際)有限公司",2012-10-11,,"Private, ltd by shares"388,1810564,"POWER DESTINY INTERNATIONAL LIMITED
權運國際有限公司",2012-10-11,,"Private, ltd by shares"389,1810593,"POWER GLOBAL CORPORATION LIMITED
力球有限公司",2012-10-11,,"Private, ltd by shares"390,1810848,"PREMIER MEDICAL PARTNERS LIMITED",2012-10-11,,"Private, ltd by shares"391,1810574,"print-finishing-experts hong kong Limited",2012-10-11,2018-04-06,"Private, ltd by shares"392,1810695,"PROFIT EMPIRE INTERNATIONAL LIMITED
皇利國際有限公司",2012-10-11,2018-06-22,"Private, ltd by shares"393,1810629,"PROFIT FORTRESS CORPORATION LIMITED
御澳有限公司",2012-10-11,2017-06-23,"Private, ltd by shares"394,1810691,"PROFIT KINGDOM DEVELOPMENT LIMITED
皇利發展有限公司",2012-10-11,2016-03-24,"Private, ltd by shares"395,1810929,"PROFIT TOP LIMITED (b2012-10-11)
鼎利有限公司",2012-10-11,,"Private, ltd by shares"396,1810566,"PROFITEAM HOLDINGS LIMITED
盈達控股有限公司",2012-10-11,,"Private, ltd by shares"397,1811047,"PROLIGHT (HK) LIMITED
寶光(香港)有限公司",2012-10-11,,"Private, ltd by shares"398,1810777,"Propioneer Engineering (HK) Company Limited
領鋒工程(香港)有限公司",2012-10-11,,"Private, ltd by shares"399,1810942,"PROSPER LEADER LIMITED
興領有限公司",2012-10-11,2016-06-03,"Private, ltd by shares"400,1810874,"PT ENERGY MANAGEMENT SERVICES LIMITED
保泰能源管理服務有限公司",2012-10-11,2014-05-09,"Private, ltd by shares"401,1810802,"PV WORLDWIDE CO., LIMITED",2012-10-11,,"Private, ltd by shares"402,1810861,"QILU GROUP CO., LIMITED
齊魯集團有限公司",2012-10-11,2019-12-27,"Private, ltd by shares"403,1811027,"Raymond Finance Limited (HK)
惠民財務有限公司",2012-10-11,,"Private, ltd by shares"404,1810737,"RAYSUN TECHNOLOGY (HK) CO., LIMITED
雷迅科技(香港)有限公司",2012-10-11,2017-12-01,"Private, ltd by shares"405,1810837,"RCMART LIMITED
電波模型有限公司",2012-10-11,,"Private, ltd by shares"406,1810793,"RED FISH PRODUCTS LIMITED",2012-10-11,2014-12-12,"Private, ltd by shares"407,1811040,"RICH PROGRESS LIMITED (d2017-05-19)",2012-10-11,2017-05-19,"Private, ltd by shares"408,1810967,"RICH SOUND ENTERTAINMENT LIMITED
潤聲娛樂有限公司",2012-10-11,,"Private, ltd by shares"409,1811042,"RISE AIM LIMITED (d2019-02-01)",2012-10-11,2019-02-01,"Private, ltd by shares"410,1810825,"RONGJUN PRINTING CO., LIMITED",2012-10-11,2018-03-09,"Private, ltd by shares"411,1810890,"Rose Rock Capital III, Limited",2012-10-11,,"Private, ltd by shares"412,1810924,"S &amp; C LEATHER GOODS LIMITED
恆運皮製集團有限公司",2012-10-11,2013-06-28,"Private, ltd by shares"413,1810975,"SAIF (H.K.) CO., LIMITED
賽富（香港）有限公司",2012-10-11,2016-06-03,"Private, ltd by shares"414,1811061,"SAMWO (China &amp; HK) CO., LIMITED
三和(中港)有限公司",2012-10-11,,"Private, ltd by shares"415,1810703,"SANLUX LIGHTING CO., LIMITED
聖萊克斯照明有限公司",2012-10-11,,"Private, ltd by shares"416,1810827,"Shanghai Homburger Technologies Limited
上海漢博科技有限公司",2012-10-11,,"Private, ltd by shares"417,1810730,"SHANGHAI WORLDYANG CHEMICAL CO., LIMITED
上海石洋化工有限公司",2012-10-11,,"Private, ltd by shares"418,1811022,"SHARE MACHINE COMPANY LIMITED
愛博馳國際貿易有限公司",2012-10-11,2015-11-27,"Private, ltd by shares"419,1811029,"SHARP LINKAGE LIMITED
銳顯有限公司",2012-10-11,,"Private, ltd by shares"420,1810602,"SHARP POOL LIMITED
正保有限公司",2012-10-11,,"Private, ltd by shares"421,1810725,"SHENGJUYUAN INTERNATIONAL GROUP (HK) LIMITED
盛巨源國際集團(香港)有限公司",2012-10-11,2018-04-20,"Private, ltd by shares"422,1810854,"SHENZHEN JUXIANG OPTOELECTRONICS CO., LIMITED
深圳市聚想光電有限公司",2012-10-11,,"Private, ltd by shares"423,1810816,"SHIN KONG SME INVESTMENT VI CO., LIMITED
新光中小企業投資陸有限公司",2012-10-11,,"Private, ltd by shares"424,1811044,"SHINE FAST LIMITED (d2015-10-16)",2012-10-11,2015-10-16,"Private, ltd by shares"425,1810642,"SHINY BRAVE INTERNATIONAL LIMITED
明勇國際有限公司",2012-10-11,2015-11-06,"Private, ltd by shares"426,1811075,"SHREWD DEVELOPMENT LIMITED
醇活發展有限公司",2012-10-11,,"Private, ltd by shares"427,1810718,"SILK ROAD CHAMBERS LIMITED",2012-10-11,,"Private, ltd by shares"428,1810594,"SILVER PLUS CORPORATION LIMITED
加銀有限公司",2012-10-11,,"Private, ltd by shares"429,1811008,"SINO FAIR DEVELOPMENT LIMITED
兆輝發展有限公司",2012-10-11,,"Private, ltd by shares"430,1810804,"SINOTEX CONSULTANTS LIMITED
順達顧問有限公司",2012-10-11,2015-05-22,"Private, ltd by shares"431,1810605,"SKY BUDDY LIMITED",2012-10-11,2016-01-29,"Private, ltd by shares"432,1810845,"SKY CHAMP (CHINA) LIMITED
天隆(中國)有限公司",2012-10-11,,"Private, ltd by shares"433,1811015,"SKY CHAMPION DEVELOPMENT LIMITED (d2015-05-22)
天才發展有限公司",2012-10-11,2015-05-22,"Private, ltd by shares"434,1810696,"SKY GREAT PROPERTIES LIMITED
天安置業有限公司",2012-10-11,2020-07-03,"Private, ltd by shares"435,1810704,"SKY KEEN TRADING LIMITED
正天貿易有限公司",2012-10-11,2015-05-08,"Private, ltd by shares"436,1810644,"SLIM MEDIC LIMITED",2012-10-11,2017-02-02,"Private, ltd by shares"437,1810950,"SMART PROSPER ENTERPRISES LIMITED
駿盛企業有限公司",2012-10-11,,"Private, ltd by shares"438,1810609,"SME CREDIT COMPANY LIMITED
中小企財務有限公司",2012-10-11,,"Private, ltd by shares"439,1810820,"SOACH CAPITAL (HONG KONG) LIMITED",2012-10-11,,"Private, ltd by shares"440,1810803,"Solstice Consulting Limited (HK)",2012-10-11,,"Private, ltd by shares"441,1810885,"SONGYI INTERNATIONAL TRADE CO., LIMITED
向一國際貿易有限公司",2012-10-11,,"Private, ltd by shares"442,1810669,"SOUTHERN JOY (HONG KONG) LIMITED
南悅(香港)有限公司",2012-10-11,,"Private, ltd by shares"443,1810785,"SPACE Development (China) Co., Limited
思彼思發展(中國)有限公司",2012-10-11,2016-06-03,"Private, ltd by shares"444,1810751,"ST COMMUNICATION LIMITED
尚騰傳播有限公司",2012-10-11,,"Private, ltd by shares"445,1810698,"STAR LUCKY (HONG KONG) LIMITED
星福(香港)有限公司",2012-10-11,2014-01-30,"Private, ltd by shares"446,1810947,"STAR UNION HOLDINGS LIMITED
合星集團有限公司",2012-10-11,,"Private, ltd by shares"447,1810981,"STAR UNITED ENTERPRISES LIMITED
星宇企業有限公司",2012-10-11,,"Private, ltd by shares"448,1810857,"STAR ZONE (HONG KONG) LIMITED
星域(香港)有限公司",2012-10-11,,"Private, ltd by shares"449,1810692,"STK Hong Kong Investment Consultant Co., Limited",2012-10-11,,"Private, ltd by shares"450,1811020,"Studio Gravitation Limited",2012-10-11,,"Private, ltd by shares"451,1811032,"SUCCESS ZONE LIMITED (d2017-03-03)
康際有限公司",2012-10-11,2017-03-03,"Private, ltd by shares"452,1811085,"SUMMER HARVEST LIMITED (HK)",2012-10-11,,"Private, ltd by shares"453,1810709,"SUN FAME (HONG KONG) LIMITED
朗榮(香港)有限公司",2012-10-11,2017-06-23,"Private, ltd by shares"454,1810912,"SUNHITS FOOD COMPANY LIMITED
晨曦食品有限公司",2012-10-11,,"Private, ltd by shares"455,1810595,"SUNLITE LIMITED
招麗有限公司",2012-10-11,,"Private, ltd by shares"456,1810862,"SUNNY TEAM (CHINA) LIMITED
輝聯(中國)有限公司",2012-10-11,,"Private, ltd by shares"457,1810556,"SUNRISE ENTERPRISE CORPORATION LIMITED",2012-10-11,,"Private, ltd by shares"458,1810710,"SUNWAY NETWORK COMPANY LIMITED
新維網絡有限公司",2012-10-11,,"Private, ltd by shares"459,1810951,"SUPER ALLIANCE HOLDINGS LIMITED
超滙集團有限公司",2012-10-11,,"Private, ltd by shares"460,1811082,"Super Bullet Pictures Limited
超級子彈影業有限公司",2012-10-11,,"Private, ltd by shares"461,1810925,"SUPER SERVICE LIMITED
心怡薰蒸社有限公司",2012-10-11,,"Private, ltd by shares"462,1810614,"SUPREME GOOD GRASS PLANTING (HONG KONG) LIMITED
香港星高草業有限公司",2012-10-11,2015-03-20,"Private, ltd by shares"463,1811034,"SURE STRONG CORPORATION LIMITED
確堅有限公司",2012-10-11,,"Private, ltd by shares"464,1810707,"SURE WINNER INTERNATIONAL LIMITED
致凱國際有限公司",2012-10-11,,"Private, ltd by shares"465,1810955,"SUREWIN SHOES CO., LIMITED
穩盈鞋業有限公司",2012-10-11,2018-06-22,"Private, ltd by shares"466,1811094,"TALENT ACE LIMITED
亮慧有限公司",2012-10-11,,"Private, ltd by shares"467,1811046,"TALENT LONG LIMITED",2012-10-11,,"Private, ltd by shares"468,1811048,"TEAM CHARM LIMITED (d2019-01-18)",2012-10-11,2019-01-18,"Private, ltd by shares"469,1810558,"TechDynamic System Limited",2012-10-11,,"Private, ltd by shares"470,1810753,"Tesha Group Co Limited",2012-10-11,,"Private, ltd by shares"471,1810724,"TEZUKA INTERNATIONAL LIMITED
手束國際有限公司",2012-10-11,2020-11-06,"Private, ltd by shares"472,1810754,"THAMES GLOBAL PROPERTIES (H.K.) LIMITED
泰晤士環球地產(香港)有限公司",2012-10-11,2016-12-09,"Private, ltd by shares"473,1810562,"TIANHE (HONG KONG) LIMITED
添和(香港)有限公司",2012-10-11,,"Private, ltd by shares"474,1810573,"TIDYUP SERVICES LIMITED",2012-10-11,2017-07-14,"Private, ltd by shares"475,1810954,"TOP CENTURY INTERNATIONAL TRADING (HK) LIMITED
新世紀國際貿易(香港)有限公司",2012-10-11,,"Private, ltd by shares"476,1810990,"TOP FORTUNE ENTERPRISES LIMITED (d2015-03-06)
德富企業有限公司",2012-10-11,2015-03-06,"Private, ltd by shares"477,1810835,"TOP VIGOR GLOBAL FORWARDING LIMITED
高澤全球貨運有限公司",2012-10-11,,"Private, ltd by shares"