,Reg no.,Name,Incorp-orated,Dissolved,Type478,1810865,"TOTAL PROFIT TRADING LIMITED (d2016-05-13)
利多貿易有限公司",2012-10-11,2016-05-13,"Private, ltd by shares"479,1811049,"TREASURE ACT LIMITED",2012-10-11,,"Private, ltd by shares"480,1810702,"TREASURE TEAM (HONG KONG) LIMITED (d2018-06-22)
寶盟(香港)有限公司",2012-10-11,2018-06-22,"Private, ltd by shares"481,1810860,"TREASURE WEALTH LIMITED",2012-10-11,,"Private, ltd by shares"482,1810630,"TRILLION RICH CORPORATION LIMITED
萬沃有限公司",2012-10-11,,"Private, ltd by shares"483,1810626,"TRIPLE Z LIMITED",2012-10-11,,"Private, ltd by shares"484,1810809,"True Partner International Limited
國際伙伴有限公司",2012-10-11,,"Private, ltd by shares"485,1810913,"TRUSTY ESTATE AGENCY LIMITED
專誠物業代理有限公司",2012-10-11,,"Private, ltd by shares"486,1810941,"TRUSTY MEDICAL CENTRE LIMITED
信賢醫學中心有限公司",2012-10-11,,"Private, ltd by shares"487,1810957,"Tsang's Management Company Limited
曾氏管理有限公司",2012-10-11,,"Private, ltd by shares"488,1810978,"TWINLIGHT TECHNOLOGY LIMITED",2012-10-11,2016-01-15,"Private, ltd by shares"489,1810953,"U.S.A SMITH (GROUP) INDUSTRY LIMITED
美國史密斯(集團)實業有限公司",2012-10-11,2016-06-03,"Private, ltd by shares"490,1810706,"U2 DIGITAL TECHNOLOGY CO., LIMITED
陶氏寰球電子科技有限公司",2012-10-11,2018-04-13,"Private, ltd by shares"491,1811050,"ULTRA TRADE LIMITED (d2018-05-18)",2012-10-11,2018-05-18,"Private, ltd by shares"492,1810632,"UNION GOLD CORPORATION LIMITED
耀集有限公司",2012-10-11,,"Private, ltd by shares"493,1810991,"UNION LAND ENTERPRISES LIMITED
裕源企業有限公司",2012-10-11,,"Private, ltd by shares"494,1811037,"UNIQUE RISE LIMITED
尊騰有限公司",2012-10-11,,"Private, ltd by shares"495,1810832,"Unisoft Limited (HK)
寰宇科技顧問有限公司",2012-10-11,,"Private, ltd by shares"496,1810796,"UNITED GLOBAL SIM LIMITED",2012-10-11,,"Private, ltd by shares"497,1811052,"UP FULL LIMITED",2012-10-11,,"Private, ltd by shares"498,1811055,"UPPER CHAMP LIMITED",2012-10-11,,"Private, ltd by shares"499,1810844,"URBAN ELITE ASIA LIMITED",2012-10-11,2015-10-02,"Private, ltd by shares"500,1811059,"VAST BLESS LIMITED",2012-10-11,2019-09-13,"Private, ltd by shares"501,1810868,"VAST GROUP TRADING LIMITED (d2018-06-22)
鵬滙貿易有限公司",2012-10-11,2018-06-22,"Private, ltd by shares"502,1810699,"VAST TEAM DEVELOPMENT LIMITED (d2016-09-02)
鵬滙發展有限公司",2012-10-11,2016-09-02,"Private, ltd by shares"503,1810559,"VEA MODELS LIMITED",2012-10-11,2014-04-04,"Private, ltd by shares"504,1810872,"W Investment Limited (d2014-09-26)
大情投資有限公司",2012-10-11,2014-09-26,"Private, ltd by shares"505,1810896,"Wah Yat Holdings Limited (d2013-06-14)
華逸控股有限公司",2012-10-11,2013-06-14,"Private, ltd by shares"506,1810554,"WAI HO ENGINEERING LIMITED
煒浩工程有限公司",2012-10-11,,"Private, ltd by shares"507,1810635,"WAYTOP CORPORATION LIMITED
唯拓有限公司",2012-10-11,,"Private, ltd by shares"508,1811060,"WEALTHY COUNTRY LIMITED (d2016-11-11)",2012-10-11,2016-11-11,"Private, ltd by shares"509,1811041,"WIDE BIG LIMITED
鉅顯有限公司",2012-10-11,,"Private, ltd by shares"510,1811043,"WIDE CHAMP CORPORATION LIMITED
顯懋有限公司",2012-10-11,,"Private, ltd by shares"511,1810870,"WIDE PROFIT INTERNATIONAL LIMITED (d2019-08-30)
博利國際有限公司",2012-10-11,2019-08-30,"Private, ltd by shares"512,1810727,"WINCHANG PLUSH FACTORY CO., LIMITED
榮昌毛絨廠有限公司",2012-10-11,,"Private, ltd by shares"513,1810895,"WING KIU (HONG KONG) LIMITED
榮橋(香港)有限公司",2012-10-11,,"Private, ltd by shares"514,1810619,"WINPORT CORPORATION LIMITED
煌盈有限公司",2012-10-11,2018-06-22,"Private, ltd by shares"515,1811068,"WISE EAGLE INVESTMENTS LIMITED (b2012-10-11)
智鵬投資有限公司",2012-10-11,2015-07-17,"Private, ltd by shares"516,1810940,"WISE LEGEND DEVELOPMENT LIMITED (d2016-06-03)
華晉發展有限公司",2012-10-11,2016-06-03,"Private, ltd by shares"517,1810871,"WISE SUCCESS (CHINA) LIMITED
智興(中國)有限公司",2012-10-11,,"Private, ltd by shares"518,1810829,"WLAT GENERAL TRADING CO., LIMITED",2012-10-11,2019-05-17,"Private, ltd by shares"519,1811030,"WO XING PRECIOUS STONE LIMITED
和星寶石有限公司",2012-10-11,,"Private, ltd by shares"520,1810943,"WORLD BILLION LIMITED
球益有限公司",2012-10-11,,"Private, ltd by shares"521,1810822,"WORLD SMART (H.K.) LIMITED
華英(香港)有限公司",2012-10-11,,"Private, ltd by shares"522,1810876,"WORLDMAX CONSULTANTS LIMITED
世盛顧問有限公司",2012-10-11,2017-06-23,"Private, ltd by shares"523,1810591,"WORLDSAPP LIMITED
旺實有限公司",2012-10-11,2018-06-22,"Private, ltd by shares"524,1810553,"WORLDWAY GLOBAL INVESTMENTS LIMITED
匯韡環球投資有限公司",2012-10-11,2018-06-22,"Private, ltd by shares"525,1810774,"WP LOGISTICS LIMITED",2012-10-11,2018-06-29,"Private, ltd by shares"526,1810582,"WUNDERKIND (C&amp;H) CONSTRUCTION LIMITED
匯盈(中港)建築工程有限公司",2012-10-11,,"Private, ltd by shares"527,1811023,"XIN JU CATERING INTERNATIONAL LIMITED
馨居國際有限公司",2012-10-11,,"Private, ltd by shares"528,1810569,"Xin Yuan Footwear Co., Limited",2012-10-11,2019-03-29,"Private, ltd by shares"529,1810878,"Y.M.L. TRADING LIMITED
燕玲貿易有限公司",2012-10-11,2016-06-03,"Private, ltd by shares"530,1810834,"Yangzi Development Corporation Limited
揚子發展有限公司",2012-10-11,,"Private, ltd by shares"531,1811012,"YAO HUI CLOTHING LIMITED
耀輝服飾有限公司",2012-10-11,2018-11-30,"Private, ltd by shares"532,1810887,"YESS RAK LIMITED (HK)",2012-10-11,2017-12-01,"Private, ltd by shares"533,1811058,"YINTAI INVESTMENT COMPANY LIMITED
銀泰資本有限公司",2012-10-11,,"Private, ltd by shares"534,1810689,"YIPIN TRADING CO., LIMITED
益品貿易有限公司",2012-10-11,2017-06-23,"Private, ltd by shares"535,1810911,"YIPSHING (HONGKONG) INTERNATIONAL TRADING LIMITED
業成(香港)國際貿易有限公司",2012-10-11,,"Private, ltd by shares"536,1810719,"YK ORIENTAL ELECTRONICS LIMITED
柔坤光電有限公司",2012-10-11,,"Private, ltd by shares"537,1810736,"YOGAMAYA INTERNATIONAL LIMITED
瑪雅瑜伽國際會所有限公司",2012-10-11,,"Private, ltd by shares"538,1810549,"Yoko Temple Limited",2012-10-11,,"Private, ltd by shares"539,1810786,"YOU FASHION COMPANY LIMITED
友福飾品有限公司",2012-10-11,2018-05-18,"Private, ltd by shares"540,1810808,"YU TIN CO., LIMITED
羽天有限公司",2012-10-11,2014-04-17,"Private, ltd by shares"541,1810891,"YUEN SANG (HONG KONG) LIMITED
源生興業(香港)有限公司",2012-10-11,,"Private, ltd by shares"542,1810965,"YUI WAH GLASS WORKS LIMITED
銳華玻璃製品有限公司",2012-10-11,2014-05-30,"Private, ltd by shares"543,1810853,"YUN CHANG YUN (HONG KONG) TRADE CO., LIMITED
運長運(香港)貿易有限公司",2012-10-11,2014-02-28,"Private, ltd by shares"544,1810826,"Zagyosoh Holding Limited
坐漁莊控股有限公司",2012-10-11,2013-08-16,"Private, ltd by shares"545,1810550,"ZENG'S INTERNATIONAL INVESTMENT (HONG KONG) LIMITED
曾氏國際投資(香港)有限公司",2012-10-11,2018-12-07,"Private, ltd by shares"546,1810839,"ZHENGMAOTAIDA INT'L LIMITED
正茂泰達國際貿易有限公司",2012-10-11,2019-11-29,"Private, ltd by shares"547,1810581,"ZOOM RICH INTERNATIONAL INVESTMENT (ASIA PACIFIC) GROUP LIMITED
亞太中融國際投資集團有限公司",2012-10-11,,"Private, ltd by shares"