,Reg no.,Name,Incorp-orated,Dissolved,Type1,1810828,"3 RICES LIMITED
三番有限公司",2012-10-11,,"Private, ltd by shares"2,1810956,"A-PLUS BEAUTY MEDICAL CENTER LIMITED",2012-10-11,,"Private, ltd by shares"3,1810634,"ABLE CHAMP DEVELOPMENT LIMITED
興福發展有限公司",2012-10-11,2015-04-10,"Private, ltd by shares"4,1810679,"ABLE EMPIRE TRADING LIMITED
帝裕貿易有限公司",2012-10-11,,"Private, ltd by shares"5,1810681,"ABLE GREAT (HONG KONG) LIMITED
偉浩(香港)有限公司",2012-10-11,,"Private, ltd by shares"6,1810980,"ABLE HIGH LIMITED",2012-10-11,,"Private, ltd by shares"7,1810685,"ABLE LUCKY TRADING LIMITED
興福貿易有限公司",2012-10-11,2018-05-25,"Private, ltd by shares"8,1810983,"ABLE MOST LIMITED",2012-10-11,,"Private, ltd by shares"9,1810687,"ABLE SUN INTERNATIONAL LIMITED
曉福國際有限公司",2012-10-11,,"Private, ltd by shares"10,1810693,"ABLE TALENT INTERNATIONAL LIMITED
傑駿國際有限公司",2012-10-11,,"Private, ltd by shares"11,1810694,"ABLE TREASURE (CHINA) LIMITED
添寶(中國)有限公司",2012-10-11,,"Private, ltd by shares"12,1810708,"ABLE TREASURE PROPERTIES LIMITED
寶興置業有限公司",2012-10-11,,"Private, ltd by shares"13,1810714,"ABLE WIN CONSULTANTS LIMITED
凱昌顧問有限公司",2012-10-11,,"Private, ltd by shares"14,1810716,"ABLE WISE PROPERTIES LIMITED
惠佳置業有限公司",2012-10-11,2019-07-05,"Private, ltd by shares"15,1810721,"ABLE WORLD DEVELOPMENT LIMITED
環駿發展有限公司",2012-10-11,2017-01-20,"Private, ltd by shares"16,1811086,"ABSOLUTE CHAMP LIMITED
煌鑫有限公司",2012-10-11,,"Private, ltd by shares"17,1810988,"ACCESS BILLION LIMITED",2012-10-11,,"Private, ltd by shares"18,1810992,"ACCESS KEY LIMITED",2012-10-11,,"Private, ltd by shares"19,1810916,"ACE FORCE LIMITED
科毅有限公司",2012-10-11,,"Private, ltd by shares"20,1810648,"Addpharm Scientific Co., Limited
艾德醫藥科技有限公司",2012-10-11,,"Private, ltd by shares"21,1810909,"ADMA Limited (d2016-06-03)",2012-10-11,2016-06-03,"Private, ltd by shares"22,1810917,"ADVANCE BEST LIMITED
衛佳有限公司",2012-10-11,,"Private, ltd by shares"23,1810680,"Advanced Laser Micromachining Limited
先進激光微加工有限公司",2012-10-11,,"Private, ltd by shares"24,1810805,"AIAIAI ASIA LIMITED",2012-10-11,2016-07-29,"Private, ltd by shares"25,1810788,"Ailee Partners Limited",2012-10-11,,"Private, ltd by shares"26,1810966,"ALATAU GROUP LIMITED
阿拉道集團有限公司",2012-10-11,,"Private, ltd by shares"27,1810586,"ALBERTA INTERNATIONAL LIMITED",2012-10-11,2017-10-13,"Private, ltd by shares"28,1810781,"ALL SPORTS INDUSTRY LIMITED
全運實業有限公司",2012-10-11,,"Private, ltd by shares"29,1810723,"ALLIED MAX INTERNATIONAL LIMITED (d2018-09-14)
協盛國際有限公司",2012-10-11,2018-09-14,"Private, ltd by shares"30,1810935,"ALPHA INVESTMENTS GLOBAL LIMITED
瀛豐投資環球有限公司",2012-10-11,,"Private, ltd by shares"31,1810731,"Andromeda Investments Limited",2012-10-11,2017-09-29,"Private, ltd by shares"32,1811070,"ANSON SEMICONDUCTOR (HK) LIMITED
安盛半導體(香港)有限公司",2012-10-11,,"Private, ltd by shares"33,1810972,"AppRoyale Limited",2012-10-11,2016-06-03,"Private, ltd by shares"34,1810728,"ART GRACE DEVELOPMENT LIMITED (d2016-01-29)
藝彩發展有限公司",2012-10-11,2016-01-29,"Private, ltd by shares"35,1810982,"ART KINGDOM CORPORATION LIMITED
御藝有限公司",2012-10-11,,"Private, ltd by shares"36,1810920,"ART PEAK LIMITED
藝峰有限公司",2012-10-11,,"Private, ltd by shares"37,1810833,"ARTIS PHARMACEUTICAL INTERNATIONAL LIMITED
天一制藥國際有限公司",2012-10-11,2017-06-23,"Private, ltd by shares"38,1810735,"Ascend International Industrial &amp; Development Limited",2012-10-11,2020-05-22,"Private, ltd by shares"39,1810970,"ASG ASSETS LIMITED
澳盛集團物業有限公司",2012-10-11,,"Private, ltd by shares"40,1810823,"Ashley's Beauty Limited",2012-10-11,2013-11-08,"Private, ltd by shares"41,1810733,"ASIA PACIFIC TRAVEL MANAGEMENT INSTITUTE LIMITED
亞太旅遊管理學院有限公司",2012-10-11,2016-02-26,"Private, ltd by shares"42,1810610,"ASIAN BUSINESS TECHNOLOGY LIMITED",2012-10-11,2016-06-03,"Private, ltd by shares"43,1810620,"ASIAN GOOD LIMITED
創亞洲有限公司",2012-10-11,,"Private, ltd by shares"44,1810795,"ASIAWS LIMITED",2012-10-11,2018-01-26,"Private, ltd by shares"45,1810783,"AUSTRALIAN GOLD LIMITED
澳金有限公司",2012-10-11,,"Private, ltd by shares"46,1810959,"AUTO START COMPANY LIMITED
車始進口汽車貿易有限公司",2012-10-11,2015-06-19,"Private, ltd by shares"47,1810672,"AUX QUATRE COULEURS LIMITED
四個顏色有限公司",2012-10-11,,"Private, ltd by shares"48,1810897,"AZANJIA JEWELRIES COMPANY LIMITED
阿贊佳珠寶集團有限公司",2012-10-11,2018-11-23,"Private, ltd by shares"49,1810994,"BEAUTY CHAMP LIMITED",2012-10-11,,"Private, ltd by shares"50,1811087,"BEST GLOBE INVESTMENTS LIMITED
銘俊投資有限公司",2012-10-11,,"Private, ltd by shares"51,1810779,"BEST GRAND CENTURY GROUP INDUSTRIAL LIMITED
盛世集團實業有限公司",2012-10-11,2016-06-03,"Private, ltd by shares"52,1811045,"BEST HOME CORPORATION LIMITED
冠庭有限公司",2012-10-11,,"Private, ltd by shares"53,1810946,"BEST JOY INDUSTRIES LIMITED
佳怡實業有限公司",2012-10-11,,"Private, ltd by shares"54,1811067,"BEST MARK INVESTMENTS LIMITED
明輝投資有限公司",2012-10-11,,"Private, ltd by shares"55,1810700,"Bestselling Commercial Company Limited
百銷靈商貿有限公司",2012-10-11,2016-06-03,"Private, ltd by shares"56,1810729,"BILLION FAITH (CHINA) LIMITED
億信(中國)有限公司",2012-10-11,2017-08-25,"Private, ltd by shares"57,1810819,"BILLION RICH (H.K.) LIMITED
盈裕(香港)有限公司",2012-10-11,,"Private, ltd by shares"58,1810734,"BILLION SILVER (CHINA) LIMITED
兆銀(中國)有限公司",2012-10-11,,"Private, ltd by shares"59,1810555,"BIM Solutions Limited (HK)",2012-10-11,,"Private, ltd by shares"60,1810908,"BINERGICS CO., LIMITED
倍力能有限公司",2012-10-11,2016-07-22,"Private, ltd by shares"61,1810952,"Bizcuit Solutions Limited
藍海策略有限公司",2012-10-11,,"Private, ltd by shares"62,1810621,"BLUE FIT LIMITED
益藍有限公司",2012-10-11,,"Private, ltd by shares"63,1810852,"BOWIN MOULD (HK) LIMITED
博贏模具(香港)有限公司",2012-10-11,2016-05-06,"Private, ltd by shares"64,1810880,"BOYER NC EQUIPMENT MANUFACTURING CO., LIMITED
博業數控設備製造(香港)有限公司",2012-10-11,2016-06-03,"Private, ltd by shares"65,1811074,"BRAINY DEVELOPMENT LIMITED
秉巒發展有限公司",2012-10-11,,"Private, ltd by shares"66,1810615,"Brantingham International Limited",2012-10-11,,"Private, ltd by shares"67,1810841,"Brazilian Depot Limited (The)",2012-10-11,2015-06-19,"Private, ltd by shares"68,1810998,"BRILLIANT ACHIEVE LIMITED",2012-10-11,2016-03-24,"Private, ltd by shares"69,1811088,"BRILLIANT ADVANCE HOLDINGS LIMITED
誌譽控股有限公司",2012-10-11,,"Private, ltd by shares"70,1810898,"BRUCKENKOPF (HONG KONG) LIMITED
橋頭堡香港有限公司",2012-10-11,2014-09-05,"Private, ltd by shares"71,1810560,"Buhana Garments Limited",2012-10-11,,"Private, ltd by shares"72,1810571,"BUILDING &amp; CONSTRUCTION GROUP LIMITED",2012-10-11,2016-06-03,"Private, ltd by shares"73,1810869,"CENTER OF COSMETICS CORPORATION LIMITED (THE)",2012-10-11,2016-04-15,"Private, ltd by shares"74,1810701,"CHAKOSH LIMITED",2012-10-11,2016-04-08,"Private, ltd by shares"75,1810739,"CHAMP BILLION (CHINA) LIMITED
駿兆(中國)有限公司",2012-10-11,2020-10-23,"Private, ltd by shares"76,1810742,"CHAMP BILLION INTERNATIONAL LIMITED (d2014-03-28)
創兆國際有限公司",2012-10-11,2014-03-28,"Private, ltd by shares"77,1810651,"CHAMP FAME PROPERTIES LIMITED
昌榮置業有限公司",2012-10-11,,"Private, ltd by shares"78,1811003,"CHAMP TRADER LIMITED",2012-10-11,,"Private, ltd by shares"79,1811011,"CHAMPION FIELD INDUSTRIES LIMITED
駿輝實業有限公司",2012-10-11,2014-09-26,"Private, ltd by shares"80,1810923,"CHARM CREATION LIMITED (b2012-10-11)
佳創見有限公司",2012-10-11,2016-04-22,"Private, ltd by shares"81,1810915,"CHARM PACIFIC LIMITED
光太有限公司",2012-10-11,,"Private, ltd by shares"82,1810986,"CHARM STEP CORPORATION LIMITED
懋臨有限公司",2012-10-11,,"Private, ltd by shares"83,1810744,"CHARM VIEW DEVELOPMENT LIMITED
景明發展有限公司",2012-10-11,,"Private, ltd by shares"84,1810971,"CHEER LAND DEVELOPMENT LIMITED
祥隆發展有限公司",2012-10-11,2018-06-22,"Private, ltd by shares"85,1810944,"CHEERFUL TIME DEVELOPMENT LIMITED
悅泰發展有限公司",2012-10-11,,"Private, ltd by shares"86,1810960,"CHEN XI INTERNATIONAL LIMITED
晨希國際有限公司",2012-10-11,2017-06-23,"Private, ltd by shares"87,1810662,"CHI WAI MECHANICAL ENGINEERING CO LIMITED
志偉機械工程有限公司",2012-10-11,,"Private, ltd by shares"88,1810921,"CHINA AO-BANG BIOTECH LIMITED
中國澳邦生物技術有限公司",2012-10-11,2017-03-31,"Private, ltd by shares"89,1810607,"China Calligraphy And Painting History Research Institute Co., Limited
中國書畫歷史研究院有限公司",2012-10-11,2018-05-18,"Private, ltd by shares"90,1810936,"CHINA EDUCATION TECHNOLOGY GROUP CO., LIMITED (d2018-06-22)
中國教育科技集團有限公司",2012-10-11,2018-06-22,"Private, ltd by shares"91,1810705,"CHINA ENERGY INTERNATIONAL LIMITED",2012-10-11,2018-09-21,"Private, ltd by shares"92,1810926,"CHINA GENERAL AVIATION INVESTMENTS HOLDING LIMITED
中國通用航空投資集團有限公司",2012-10-11,,"Private, ltd by shares"93,1811057,"CHINA JOINT DEVELOPMENT LIMITED
華中發展有限公司",2012-10-11,2015-04-17,"Private, ltd by shares"94,1810759,"China Mobile Games and Entertainment Group (HK) Limited",2012-10-11,,"Private, ltd by shares"95,1810683,"China Moly Investment Company Limited
中華鉬投資有限公司",2012-10-11,2013-11-29,"Private, ltd by shares"96,1810711,"CHINA NEW ENERGY SHARES GROUP LIMITED
中國新能源實業集團有限公司",2012-10-11,2016-06-03,"Private, ltd by shares"97,1810863,"CHINA PEOPLE INVESTMENT HOLDINGS CO., LIMITED
中國人民投資股份有限公司",2012-10-11,2017-06-23,"Private, ltd by shares"98,1810589,"CHINA RI FENG TECHNOLOGY GROUP (HK) LIMITED
中國日豐科技集團(香港)有限公司",2012-10-11,2017-06-23,"Private, ltd by shares"99,1811084,"CHINA ROAD NEW MATERIAL RESEARCH INSTITUTE LIMITED
中國道路新材料研究院有限公司",2012-10-11,,"Private, ltd by shares"100,1810918,"CHINA TEXTILE TRADERS LIMITED",2012-10-11,,"Private, ltd by shares"101,1810747,"CHINA TOP TECHNOLOGY LIMITED
華領科技有限公司",2012-10-11,2016-12-23,"Private, ltd by shares"102,1811035,"CHINA TRAVEL CULTURE &amp; SPORT CONSULTANT COMPANY LIMITED
中國旅遊文體咨詢有限公司",2012-10-11,2019-07-26,"Private, ltd by shares"103,1811005,"CHINA VANTAGE LIMITED",2012-10-11,,"Private, ltd by shares"104,1810749,"CHINA VIEW CONSULTANTS LIMITED
中望顧問有限公司",2012-10-11,2018-06-22,"Private, ltd by shares"105,1810611,"CHINESE YOUTH LEADER CULTURE BBS CO., LIMITED
中國青年僑領文化論壇有限公司",2012-10-11,2017-06-23,"Private, ltd by shares"106,1810740,"CHUN WONG (HK) INVESTMENT LIMITED
駿旺(香港)投資有限公司",2012-10-11,2019-02-08,"Private, ltd by shares"107,1810752,"CITI-BILLION (HONG KONG) LIMITED
億城(香港)有限公司",2012-10-11,,"Private, ltd by shares"108,1811089,"CITY PATH INVESTMENTS LIMITED
權拓投資有限公司",2012-10-11,,"Private, ltd by shares"109,1810787,"CITY PROPERTY AGENCY COMPANY LIMITED
城旺地產有限公司",2012-10-11,2016-06-03,"Private, ltd by shares"110,1810643,"City-Network Limited",2012-10-11,2018-06-22,"Private, ltd by shares"111,1811076,"CLEAR STREAM INVESTMENTS LIMITED",2012-10-11,2018-05-11,"Private, ltd by shares"112,1810919,"CLOUD NEXT TECHNOLOGY LIMITED
雲科動力科技有限公司",2012-10-11,,"Private, ltd by shares"113,1810557,"Connection Technology Systems (H.K.) Limited",2012-10-11,2015-04-17,"Private, ltd by shares"114,1810654,"CONVERGENT LORD INTERNATIONAL LIMITED
聚君國際有限公司",2012-10-11,2019-08-30,"Private, ltd by shares"115,1810658,"Coriant (HK) Limited",2012-10-11,,"Private, ltd by shares"116,1810670,"COSMIC GEAR LIMITED
宇洋製衣有限公司",2012-10-11,,"Private, ltd by shares"117,1810668,"Covey Leadership Limited",2012-10-11,2018-05-18,"Private, ltd by shares"118,1811009,"CREATIVE EXPRESS LIMITED (HK)",2012-10-11,2018-06-22,"Private, ltd by shares"119,1810930,"CREATIVE OCEAN LIMITED (d2015-10-16)
海意有限公司",2012-10-11,2015-10-16,"Private, ltd by shares"120,1810596,"CROMIA ASIA LIMITED
克羅米亞亞洲有限公司",2012-10-11,,"Private, ltd by shares"121,1811077,"CROSSWISE LIMITED (HK)",2012-10-11,,"Private, ltd by shares"122,1811090,"CROWN CASTLE LIMITED (HK)
尊正有限公司",2012-10-11,,"Private, ltd by shares"123,1811014,"CROWN FAST LIMITED",2012-10-11,2017-04-28,"Private, ltd by shares"124,1810949,"CROWN GAIN ENTERPRISES LIMITED (d2014-11-07)
冠盈企業有限公司",2012-10-11,2014-11-07,"Private, ltd by shares"125,1810815,"CROWN LINK HOLDINGS LIMITED
冠業集團有限公司",2012-10-11,2020-09-04,"Private, ltd by shares"126,1810748,"CT GROUP HONG KONG HOLDING LIMITED",2012-10-11,,"Private, ltd by shares"127,1810892,"CYBER E-BUSINESS CO., LIMITED
賽博電子商務有限公司",2012-10-11,,"Private, ltd by shares"128,1810757,"DAILY SUCCESS TECHNOLOGY LIMITED
日進科技有限公司",2012-10-11,,"Private, ltd by shares"129,1810760,"DAILY WISE INTERNATIONAL LIMITED",2012-10-11,,"Private, ltd by shares"130,1810688,"Decency International Industry Group Limited
達成國際實業集團有限公司",2012-10-11,,"Private, ltd by shares"131,1810879,"DENO INDUSTRIAL CO., LIMITED
大諾實業有限公司",2012-10-11,,"Private, ltd by shares"132,1810608,"DESHINE IMPORT &amp; EXPORT CO., LIMITED",2012-10-11,2017-06-23,"Private, ltd by shares"133,1810859,"DH FASHION LIMITED (d2018-05-18)",2012-10-11,2018-05-18,"Private, ltd by shares"134,1811078,"DIGITAL EPOCH LIMITED",2012-10-11,,"Private, ltd by shares"135,1810563,"DIVINE FEAST LIMITED",2012-10-11,2015-11-27,"Private, ltd by shares"136,1810636,"DONGCHENG INTERNATIONAL TRADING DEVELOP LIMITED
東成國際貿易拓展有限公司",2012-10-11,2016-06-03,"Private, ltd by shares"137,1810548,"DOSIRAK LIMITED",2012-10-11,2020-10-30,"Private, ltd by shares"138,1810761,"DRAGON TREND TRADING LIMITED
銳龍貿易有限公司",2012-10-11,2014-11-07,"Private, ltd by shares"139,1810650,"DREAM CASTLE LIMITED (d2019-12-06)",2012-10-11,2019-12-06,"Private, ltd by shares"140,1810969,"DRIFT POWER INTERNATIONAL CO., LIMITED
漂移力量國際有限公司",2012-10-11,2018-06-22,"Private, ltd by shares"141,1810776,"E-Commerce HKG Limited
香港電子商貿有限公司",2012-10-11,,"Private, ltd by shares"142,1811018,"EAGLE AIM LIMITED",2012-10-11,,"Private, ltd by shares"143,1810763,"EARN BRIGHT (CHINA) LIMITED
得明(中國)有限公司",2012-10-11,,"Private, ltd by shares"144,1810989,"EASE NOBLE LIMITED
貴誼有限公司",2012-10-11,,"Private, ltd by shares"145,1811025,"EASEFUL LIMITED",2012-10-11,,"Private, ltd by shares"146,1810764,"EAST BLOOM INTERNATIONAL LIMITED
成東國際有限公司",2012-10-11,,"Private, ltd by shares"147,1810961,"EASTERN HARBOUR CHAMBERS LIMITED
芮安仲裁有限公司",2012-10-11,,"Private, ltd by shares"148,1810732,"Ecomfin Asia Limited",2012-10-11,2019-11-22,"Private, ltd by shares"149,1810690,"El Dorado Metals and Logistics Limited",2012-10-11,,"Private, ltd by shares"150,1810958,"ELCHE COMMERCIAL (HONGKONG) COMPANY LIMITED
易趣(香港)貿易有限公司",2012-10-11,,"Private, ltd by shares"151,1810649,"ELEGANT FORCE INTERNATIONAL LIMITED
緻力國際有限公司",2012-10-11,2017-02-24,"Private, ltd by shares"152,1810663,"ELEGANT MILE DEVELOPMENT LIMITED
緻程發展有限公司",2012-10-11,2020-08-28,"Private, ltd by shares"153,1810631,"ELEGANT SUN (HONG KONG) LIMITED
緻日(香港)有限公司",2012-10-11,,"Private, ltd by shares"154,1810766,"ELITE GRACE PROPERTIES LIMITED
盈彩置業有限公司",2012-10-11,,"Private, ltd by shares"155,1810667,"EMERALD HERO (HONG KONG) LIMITED
翠雄(香港)有限公司",2012-10-11,,"Private, ltd by shares"156,1810770,"EMERALD MIND INTERNATIONAL LIMITED
翠思國際有限公司",2012-10-11,,"Private, ltd by shares"157,1811079,"EMINENT PARTNER INVESTMENTS LIMITED",2012-10-11,,"Private, ltd by shares"158,1810993,"EMPIRE WILL LIMITED
御圖有限公司",2012-10-11,,"Private, ltd by shares"159,1810618,"ePartner Digital Holdings Limited",2012-10-11,,"Private, ltd by shares"160,1810656,"Esky Consultancy Limited
億佳人事顧問有限公司",2012-10-11,,"Private, ltd by shares"161,1810800,"EURO CHATEAU LIMITED",2012-10-11,2015-05-08,"Private, ltd by shares"162,1810587,"EURO VICTOR ELECTRONICS (HONG KONG) LIMITED
歐偉特電子(香港)有限公司",2012-10-11,2017-08-25,"Private, ltd by shares"163,1810979,"EUROPE PR LIMITED",2012-10-11,2020-11-13,"Private, ltd by shares"164,1810717,"EVER HUGE INTERNATIONAL LIMITED
永廣國際有限公司",2012-10-11,,"Private, ltd by shares"165,1810712,"EVER LINKAGE TRADING LIMITED
恒永貿易有限公司",2012-10-11,,"Private, ltd by shares"166,1810592,"EVER MASS CORPORATION LIMITED
禧廣有限公司",2012-10-11,,"Private, ltd by shares"167,1811063,"EVER SEA TRADING LIMITED
海恆貿易有限公司",2012-10-11,2019-05-31,"Private, ltd by shares"168,1810623,"EVER TREND TECHNOLOGY LIMITED
達恒科技有限公司",2012-10-11,2018-06-22,"Private, ltd by shares"169,1810914,"EVERYBODY'S TV (HONG KONG) LIMITED",2012-10-11,2020-06-26,"Private, ltd by shares"170,1810937,"ex-Brand Company Limited",2012-10-11,2014-11-07,"Private, ltd by shares"171,1810637,"EXCEL FAME (HONG KONG) LIMITED
卓譽(香港)有限公司",2012-10-11,,"Private, ltd by shares"172,1811080,"EXPERT CENTURY LIMITED",2012-10-11,,"Private, ltd by shares"173,1810789,"EXPRESS ASIA LOGISTICS LIMITED",2012-10-11,,"Private, ltd by shares"174,1810655,"EXTENDED LORD INTERNATIONAL LIMITED
展君國際有限公司",2012-10-11,,"Private, ltd by shares"175,1810995,"FAITH WILL LIMITED (b2012-10-11)
信圖有限公司",2012-10-11,2019-08-30,"Private, ltd by shares"176,1810627,"FAME ABLE INTERNATIONAL LIMITED
譽榮國際有限公司",2012-10-11,,"Private, ltd by shares"177,1810842,"FAME EXCEL (HONG KONG) LIMITED
威名(香港)有限公司",2012-10-11,2018-06-22,"Private, ltd by shares"178,1810901,"Far East Consulting &amp; Negotiating Limited",2012-10-11,2019-08-30,"Private, ltd by shares"179,1811028,"FAST ACCESS LIMITED (d2017-06-23)",2012-10-11,2017-06-23,"Private, ltd by shares"180,1811031,"FAST FINE LIMITED",2012-10-11,,"Private, ltd by shares"181,1810838,"FAST OVERSEAS INTERNATIONAL TRADING COMPANY LIMITED
匯創國際貿易有限公司",2012-10-11,,"Private, ltd by shares"182,1810633,"FAST SKY DEVELOPMENT LIMITED
天迅發展有限公司",2012-10-11,,"Private, ltd by shares"183,1810906,"FCCE HONG KONG LIMITED",2012-10-11,2018-06-22,"Private, ltd by shares"184,1810931,"FINANCIAL PAYMENT HOUSE LIMITED",2012-10-11,,"Private, ltd by shares"185,1810999,"FIRST LUCKY CORPORATION LIMITED
首福有限公司",2012-10-11,,"Private, ltd by shares"186,1810801,"FIRST RICH CONSULTANTS LIMITED
豐裕顧問有限公司",2012-10-11,2017-02-24,"Private, ltd by shares"187,1810894,"FIVE ELEMENTS DIETARY THERAPY INSTRUMENT INT'L TECHNOLOGY CO., LIMITED
五行元素食療醫器國際科技有限公司",2012-10-11,,"Private, ltd by shares"188,1810771,"Foldene Limited",2012-10-11,2018-05-18,"Private, ltd by shares"189,1810882,"FOREVER GOLD HARVEST INTERNATIONAL LIMITED",2012-10-11,2014-03-21,"Private, ltd by shares"190,1810756,"Fresh Ice Limited",2012-10-11,,"Private, ltd by shares"191,1810824,"Fruitfulness Resources Management Limited
豐碩資源管理有限公司",2012-10-11,,"Private, ltd by shares"192,1810599,"FUAN AIDI ELECTRIC CO., LIMITED
福安愛的電器有限公司",2012-10-11,2016-12-30,"Private, ltd by shares"193,1810561,"FUGUILIN GOLD JEWELRY (HONG KONG) GROUP CO., LIMITED
富貴林黃金珠寶(香港)集團有限公司",2012-10-11,2017-06-23,"Private, ltd by shares"194,1810836,"FULL CHINA TECHNOLOGY LIMITED
中沛科技有限公司",2012-10-11,2018-12-21,"Private, ltd by shares"195,1810886,"Full Field Sis Company Limited
盈里有限公司",2012-10-11,2017-04-07,"Private, ltd by shares"196,1810922,"Fulla, Hong Kong Limited
富拿香港有限公司",2012-10-11,2016-02-05,"Private, ltd by shares"197,1810812,"FULLCA ENTERPRISES LIMITED
富嘉企業有限公司",2012-10-11,,"Private, ltd by shares"198,1810963,"Fusion Engineering (HK) Co., Limited",2012-10-11,2015-03-20,"Private, ltd by shares"199,1811036,"G. FIELDING STUDIO LIMITED",2012-10-11,,"Private, ltd by shares"200,1811081,"GALVANI HOLDINGS LIMITED",2012-10-11,,"Private, ltd by shares"201,1810697,"GANGTONG NETWORK TECHNOLOGY CO., LIMITED
港通網絡科技有限公司",2012-10-11,2016-06-03,"Private, ltd by shares"202,1811091,"GENIUS CHOICE HOLDINGS LIMITED
協旺控股有限公司",2012-10-11,,"Private, ltd by shares"203,1810784,"GENSYU (HK) LIMITED
源銖(香港)有限公司",2012-10-11,,"Private, ltd by shares"204,1811007,"GIANT CENTURY INDUSTRIES LIMITED
嘉成實業有限公司",2012-10-11,2019-04-04,"Private, ltd by shares"205,1811004,"GIANT CHARM LIMITED
巨懋有限公司",2012-10-11,,"Private, ltd by shares"206,1811092,"GIANT EMPIRE HOLDINGS LIMITED
逸龍控股有限公司",2012-10-11,,"Private, ltd by shares"207,1811054,"GIANTARGET TECHNOLOGY CO., LIMITED
積加科技(香港)有限公司",2012-10-11,2016-06-03,"Private, ltd by shares"208,1811010,"GLOBAL CAPITAL CORPORATION LIMITED (HK)
寰京有限公司",2012-10-11,,"Private, ltd by shares"209,1811069,"GLOBAL SKY INVESTMENTS LIMITED
世天投資有限公司",2012-10-11,,"Private, ltd by shares"210,1810674,"GLOBAL SKY TRAVEL LIMITED (HK)
環球彩虹旅遊有限公司",2012-10-11,,"Private, ltd by shares"211,1810617,"GLORIOUS ONE INTERNATIONAL LIMITED
鉅一國際有限公司",2012-10-11,2016-06-03,"Private, ltd by shares"212,1811006,"GLORY CHAMP LIMITED (d2016-11-25)
興臨有限公司",2012-10-11,2016-11-25,"Private, ltd by shares"213,1810638,"GOLD HAPPY PROPERTIES LIMITED
金禧置業有限公司",2012-10-11,,"Private, ltd by shares"214,1811064,"GOLD LEADER INTERNATIONAL LIMITED
高鋒國際有限公司",2012-10-11,,"Private, ltd by shares"215,1810973,"GOLD PROMISE DEVELOPMENT LIMITED
金諾發展有限公司",2012-10-11,2016-05-06,"Private, ltd by shares"216,1810997,"GOLDEN SENSE INTERNATIONAL ENTERPRISES LIMITED
金勝國際企業有限公司",2012-10-11,,"Private, ltd by shares"217,1810641,"GOOD POINT DEVELOPMENT LIMITED
向好發展有限公司",2012-10-11,,"Private, ltd by shares"218,1810653,"GOOD POINT INTERNATIONAL LIMITED
向好國際有限公司",2012-10-11,,"Private, ltd by shares"219,1810794,"GOODWILL DENTAL LABORATORY LIMITED
佳譽牙科器材有限公司",2012-10-11,,"Private, ltd by shares"220,1811071,"GP TECHNOLOGIES LIMITED",2012-10-11,,"Private, ltd by shares"221,1810657,"GRAND EASY INTERNATIONAL LIMITED
浩順國際有限公司",2012-10-11,,"Private, ltd by shares"222,1810974,"GRAND OCEAN DEVELOPMENT LIMITED (d2016-05-27)
港嘉發展有限公司",2012-10-11,2016-05-27,"Private, ltd by shares"223,1810665,"GREAT CREATION PROPERTIES LIMITED
建宏置業有限公司",2012-10-11,,"Private, ltd by shares"224,1810675,"GREAT EXPRESS DEVELOPMENT LIMITED
浩順發展有限公司",2012-10-11,2015-03-20,"Private, ltd by shares"225,1811065,"GREAT MARK INTERNATIONAL LIMITED
兆榮國際有限公司",2012-10-11,,"Private, ltd by shares"226,1810597,"GREAT TIME CORPORATION LIMITED (d2016-06-03)
好時光有限公司",2012-10-11,2016-06-03,"Private, ltd by shares"227,1810677,"GREAT WISE CONSULTANTS LIMITED
惠佳顧問有限公司",2012-10-11,,"Private, ltd by shares"228,1810904,"GREENWICH PANORAMA LIMITED",2012-10-11,2019-05-03,"Private, ltd by shares"229,1810551,"Group First International Limited",2012-10-11,2016-01-15,"Private, ltd by shares"230,1810767,"GT Financial Services Limited (HK)",2012-10-11,,"Private, ltd by shares"231,1810584,"GUANGSHENG TRADING DEVELOPMENT LIMITED
廣盛貿易發展有限公司",2012-10-11,2016-06-03,"Private, ltd by shares"232,1810758,"H&amp;D SPECIAL LIMITED
赫拉迪有限公司",2012-10-11,,"Private, ltd by shares"233,1810996,"HANHUA HONGKONG HOLDINGS LIMITED
瀚華香港控股有限公司",2012-10-11,,"Private, ltd by shares"234,1811002,"HANHUA HONGKONG INFORMATION SERVICE LIMITED
瀚華信息服務香港有限公司",2012-10-11,,"Private, ltd by shares"235,1810984,"Hanhua Prive Asset Management Limited
瀚華磐維資產管理有限公司",2012-10-11,,"Private, ltd by shares"236,1810570,"HAOTAITAI ELECTRICAL APPLIANCES GROUP LIMITED
好太太電器集團有限公司",2012-10-11,,"Private, ltd by shares"237,1810987,"HDRS DATA STORAGE TECHNOLOGY (HK) CO., LIMITED
香港中蘭存儲技術有限公司",2012-10-11,2015-07-24,"Private, ltd by shares"238,1810661,"HEALTHY ONE DEVELOPMENT LIMITED
健一發展有限公司",2012-10-11,,"Private, ltd by shares"239,1810830,"Hei Ar Consultancy Limited
希雅顧問有限公司",2012-10-11,,"Private, ltd by shares"240,1810888,"HENGYANG (HONGKONG) TECHNOLOGY CO., LIMITED
恒陽(香港)科技有限公司",2012-10-11,,"Private, ltd by shares"241,1810817,"HEROMAX INVESTMENT LIMITED
亨明投資有限公司",2012-10-11,,"Private, ltd by shares"242,1810666,"HESHUN TRADING HONGKONG LIMITED
和順貿易香港有限公司",2012-10-11,2020-03-27,"Private, ltd by shares"243,1810678,"HI WORLD TRADING LIMITED
翰宇貿易有限公司",2012-10-11,,"Private, ltd by shares"244,1810884,"HI-SUPERSKY TECHNOLOGY CO., LIMITED
騰錦科技有限公司",2012-10-11,2017-06-23,"Private, ltd by shares"