,Reg no.,Name,Incorp-orated,Dissolved,Type1,3059521,"FIRST FEX (CHINA) FINANCIAL HOLDING CO., LIMITED (b2021-06-19)
一金所（中國）控股集團有限公司",2021-06-19,,"Private, ltd by shares"2,3059522,"HONG KONG YIGANGTONG INTERNATIONAL TRADE CO., LIMITED
香港易港通國際貿易有限公司",2021-06-19,,"Private, ltd by shares"3,3059523,"Jianhui E-Commerce Co., Limited
劍輝電子商務有限公司",2021-06-19,,"Private, ltd by shares"4,3059525,"Lung Shing Hong Kong Limited
隆城香港有限公司",2021-06-19,,"Private, ltd by shares"5,3059524,"SKY DRAGON CREATION LIMITED",2021-06-19,,"Private, ltd by shares"6,3059526,"VICO CONSULTING LIMITED
域高管理顧問有限公司",2021-06-19,,"Private, ltd by shares"7,3059520,"VMPay Asia Limited",2021-06-19,,"Private, ltd by shares"8,3059527,"YIN LEONG ENGINEERING COMPANY LIMITED
燃亮工程有限公司",2021-06-19,,"Private, ltd by shares"