,Reg no.,Name,Incorp-orated,Dissolved,Type1,0036750,"ANGLO COMMODITIES (H.K.) LIMITED",1974-01-02,2000-02-22,"Private, ltd by shares"2,0036757,"ARGUS COMPANY LIMITED",1974-01-02,1984-12-18,"Private, ltd by shares"3,0036758,"BRAVADO ENTERPRISES LIMITED",1974-01-02,1980-04-25,"Private, ltd by shares"4,0036751,"COURTIER LIMITED (d2003-02-28)",1974-01-02,2003-02-28,"Private, ltd by shares"5,0036761,"CYBERNETIC RESEARCH (ASIA) LIMITED",1974-01-02,1995-04-28,"Private, ltd by shares"6,0036752,"DICCA COMPANY LIMITED",1974-01-02,1995-07-28,"Private, ltd by shares"7,0036775,"DORLEY INVESTMENT COMPANY LIMITED",1974-01-02,1999-06-06,"Private, ltd by shares"8,0036766,"EDWARD CHAN ENGINEERING COMPANY LIMITED",1974-01-02,1989-10-06,"Private, ltd by shares"9,0036744,"ENGLIM TIMBER COMPANY LIMITED
印林木業有限公司",1974-01-02,1995-04-28,"Private, ltd by shares"10,0036767,"EXWIN (HONGKONG) LIMITED
益永(香港)有限公司",1974-01-02,2002-07-19,"Private, ltd by shares"11,0036753,"FLAMINGO COMPANY LIMITED (d1978-04-28)",1974-01-02,1978-04-28,"Private, ltd by shares"12,0036773,"FOSTER INDUSTRIES COMPANY LIMITED
富達工業有限公司",1974-01-02,,"Private, ltd by shares"13,0036770,"GALLANT WOOLEN COMPANY LIMITED
格蘭呢絨有限公司",1974-01-02,1995-07-19,"Private, ltd by shares"14,0036762,"IMAGE PRODUCTIONS LIMITED (d1984-03-29)",1974-01-02,1984-03-29,"Private, ltd by shares"15,0036755,"INTERNATIONAL MINERALS AND CHEMICAL (ASIA) LIMITED",1974-01-02,1983-10-12,"Private, ltd by shares"16,0036774,"JAQUES (INTERNATIONAL) LIMITED
即時(國際)有限公司",1974-01-02,2014-05-02,"Private, ltd by shares"17,0036763,"KILDARE COMPANY LIMITED",1974-01-02,1995-04-28,"Private, ltd by shares"18,0036743,"KNAPP SANDELSON AND COMPANY (HONG KONG) LIMITED
納信(香港)有限公司",1974-01-02,2000-06-16,"Private, ltd by shares"19,0036772,"KWOK'S INVESTMENT COMPANY, LIMITED",1974-01-02,1976-01-20,"Private, ltd by shares"20,0036759,"LDL INVESTMENT LIMITED",1974-01-02,1995-04-28,"Private, ltd by shares"21,0036754,"LIBERTAS LIMITED",1974-01-02,,"Private, ltd by shares"22,0036760,"MAHON INVESTMENTS LIMITED",1974-01-02,1980-12-13,"Private, ltd by shares"23,0036748,"MERCHANDISE WORLDWIDE LIMITED
寰宇商務有限公司",1974-01-02,,"Private, ltd by shares"24,0036771,"NG CHANG WEAVING &amp; DYEING COMPANY LIMITED
五章機織染廠有限公司",1974-01-02,1991-05-06,"Private, ltd by shares"25,0036765,"PETER BRINDISI PUBLIC RELATIONS LIMITED",1974-01-02,2002-05-24,"Private, ltd by shares"26,0036764,"QUICK-RETURN HOLDINGS LIMITED",1974-01-02,1997-01-31,"Private, ltd by shares"27,0036745,"SUN HUNG FAT (HONG KONG) COMPANY LIMITED
新鴻發(香港)有限公司",1974-01-02,1995-04-28,"Private, ltd by shares"28,0036749,"THEATRE LANE COMPANY LIMITED
喜達利有限公司",1974-01-02,,"Private, ltd by shares"29,0036746,"TIMETRON LIMITED (d2017-03-03)
時電有限公司",1974-01-02,2017-03-03,"Private, ltd by shares"30,0036769,"UNION WATCH CASE FACTORY LIMITED
聯邦錶廠有限公司",1974-01-02,1993-01-30,"Private, ltd by shares"31,0036756,"WILBUR ENTERPRISES LIMITED",1974-01-02,1994-07-11,"Private, ltd by shares"32,0036742,"WRANGLER (HONG KONG) LIMITED
威格(香港)有限公司",1974-01-02,,"Private, ltd by shares"33,0036747,"YANFOONG FINANCE &amp; INVESTMENT COMPANY, LIMITED
寅豐財務投資有限公司",1974-01-02,1996-05-10,"Private, ltd by shares"34,0036768,"YOUNG AND GAY GLOVE WORKS LIMITED
陽基手套廠有限公司",1974-01-02,2003-11-14,"Private, ltd by shares"