,Reg no.,Name,Incorp-orated,Dissolved,Type1,0523620,"ACCESS LUCK LIMITED
誌運有限公司",1995-08-22,,"Private, ltd by shares"2,0523764,"ACORN ENTERPRISE LIMITED (d2002-02-15)
毅信實業有限公司",1995-08-22,2002-02-15,"Private, ltd by shares"3,0523724,"ADCO LIMITED (HK)",1995-08-22,,"Private, ltd by shares"4,0523741,"AERODYNAMIC MACHINERY &amp; ENGINEERING CO. LIMITED
氣動力機械工程有限公司",1995-08-22,,"Private, ltd by shares"5,0523524,"ALPHA ADVERTISING &amp; PRINTING COMPANY LIMITED
雅圖廣告印刷有限公司",1995-08-22,2003-12-12,"Private, ltd by shares"6,0523752,"ALPHA STANDARD TESTING &amp; ENVIRONMENTAL CONSULTANTS LIMITED
毅達環保顧問有限公司",1995-08-22,2004-03-05,"Private, ltd by shares"7,0523455,"AMBER FORTUNE INVESTMENTS LIMITED
殷樺投資有限公司",1995-08-22,,"Private, ltd by shares"8,0523454,"AMBER LIGHT INVESTMENTS LIMITED
利藤投資有限公司",1995-08-22,,"Private, ltd by shares"9,0523557,"Ao Long Industrial Supply Limited",1995-08-22,2011-04-15,"Private, ltd by shares"10,0523516,"ARTWRIGHT INTERIORS (CHINA) DEVELOPMENT LIMITED
雅藝(中國)發展有限公司",1995-08-22,,"Private, ltd by shares"11,0523765,"ASECO LIMITED
置高有限公司",1995-08-22,,"Private, ltd by shares"12,0523737,"ASIA-HK INTERNATIONAL LIMITED
駿城國際有限公司",1995-08-22,2005-01-07,"Private, ltd by shares"13,0523729,"ASOSIASI PPTKI HONG KONG LIMITED
香港職業介紹所印尼協會有限公司",1995-08-22,,"Ltd by guarantee"14,0523605,"BAI CHENG INDUSTRIES (HONG KONG) LIMITED
拜裕工業(香港)有限公司",1995-08-22,,"Private, ltd by shares"15,0523585,"BLOCKBUSTER HONG KONG LIMITED
百視達香港有限公司",1995-08-22,2005-06-30,"Private, ltd by shares"16,0523731,"BONAVENTURE NOMINEES LIMITED
寶宏代理人有限公司",1995-08-22,2006-02-03,"Private, ltd by shares"17,0523648,"BOND'S TRAVEL LIMITED
立邦旅運有限公司",1995-08-22,,"Private, ltd by shares"18,0523761,"BRIGHT HARBOUR LIMITED (b1995-08-22)
運洋有限公司",1995-08-22,,"Private, ltd by shares"19,0523461,"BUDDHA FOUNDATION INTERNATIONAL PAPER INDUSTRY HOLDING LIMITED
佛根國際紙業集團有限公司",1995-08-22,2004-03-05,"Private, ltd by shares"20,0523685,"BUNDABERG FINANCIAL LIMITED",1995-08-22,2004-07-02,"Private, ltd by shares"21,0523526,"CANROY LIMITED",1995-08-22,2009-05-15,"Private, ltd by shares"22,0523521,"CATHAY PROPERTY LIMITED
龍厦置業有限公司",1995-08-22,2001-10-19,"Private, ltd by shares"23,0523676,"CENTURY SHIPPING (HONG KONG) COMPANY LIMITED
世紀船務(香港)有限公司",1995-08-22,,"Private, ltd by shares"24,0523604,"CHE WAH MOTOR SERVICE COMPANY LIMITED
車華汽車服務有限公司",1995-08-22,,"Private, ltd by shares"25,0523689,"CHEUNG FONG (HONG KONG) LIMITED
長豐(香港)有限公司",1995-08-22,2009-08-07,"Private, ltd by shares"26,0523755,"CHEUNG FUNG HONG INTERNATIONAL LIMITED
祥豐行國際有限公司",1995-08-22,2001-01-19,"Private, ltd by shares"27,0523528,"Chevalier Property Development Limited
其士物業發展有限公司",1995-08-22,,"Private, ltd by shares"28,0523631,"CHINA FIELD CREATIONS LIMITED
華輝創業有限公司",1995-08-22,2006-04-28,"Private, ltd by shares"29,0523665,"CHINA LAW (HONG KONG) PROFESSIONAL ASSOCIATION LIMITED
中國法律(香港)專業協會有限公司",1995-08-22,2005-01-07,"Private, ltd by shares"30,0523629,"CHINA LINK CREATIONS LIMITED
華聯創建有限公司",1995-08-22,2004-03-05,"Private, ltd by shares"31,0523571,"CHINA PETROLEUM (PNG) HONG KONG LIMITED
中國石油(PNG)香港有限公司",1995-08-22,2000-12-08,"Private, ltd by shares"32,0523767,"CHINA PROSPEROUS LIMITED (d2004-03-05)
華興泰有限公司",1995-08-22,2004-03-05,"Private, ltd by shares"33,0523707,"CHINA RECONSTRUCT COMPANY LIMITED
中國營造有限公司",1995-08-22,,"Private, ltd by shares"34,0523616,"CHINA WINNER INTERNATIONAL INVESTMENT COMPANY, LIMITED
中鵬國際投資有限公司",1995-08-22,2002-10-11,"Private, ltd by shares"35,0523643,"CHINA YUAN DA INTERNATIONAL GROUP LIMITED
中國遠大國際集團有限公司",1995-08-22,2005-08-19,"Private, ltd by shares"36,0523660,"CHUN TAT SHIPPING LIMITED
駿達船務有限公司",1995-08-22,,"Private, ltd by shares"37,0523754,"CITYSTAR CORPORATION LIMITED
國星行有限公司",1995-08-22,,"Private, ltd by shares"38,0523736,"COMDRIVE (HONG KONG) LIMITED
策略企業(香港)有限公司",1995-08-22,2000-08-04,"Private, ltd by shares"39,0523706,"CONCREST LIMITED",1995-08-22,2008-06-13,"Private, ltd by shares"40,0523704,"COUNTRY GLASS BALL &amp; DECORATION MAKER LIMITED",1995-08-22,1998-10-09,"Private, ltd by shares"41,0523514,"COZY INVESTMENT (H.K.) LIMITED
鵬程國際股份有限公司",1995-08-22,2002-05-17,"Private, ltd by shares"42,0523560,"CSE HOLDINGS LIMITED (d2004-03-05)",1995-08-22,2004-03-05,"Private, ltd by shares"43,0523656,"DAIICHI ELECTRIC CO., LIMITED
第一部品電器有限公司",1995-08-22,,"Private, ltd by shares"44,0523644,"DAJING VIDEO COMPANY LIMITED
大井錄影有限公司",1995-08-22,2018-06-22,"Private, ltd by shares"45,0523584,"DANN-RITMEE (CHINA) LIMITED
丹納曼中國有限公司",1995-08-22,2004-03-05,"Private, ltd by shares"46,0523599,"DAVIES INVESTMENT CORPORATION LIMITED",1995-08-22,2003-06-20,"Private, ltd by shares"47,0523705,"DELTACOM INTERNATIONAL LIMITED (d2005-01-07)",1995-08-22,2005-01-07,"Private, ltd by shares"48,0523464,"EAGLE CITY INTERNATIONAL LIMITED
勇邦國際有限公司",1995-08-22,2001-01-19,"Private, ltd by shares"49,0523476,"EAGLE LEADER INTERNATIONAL LIMITED (d2001-05-18)
英領國際有限公司",1995-08-22,2001-05-18,"Private, ltd by shares"50,0523477,"EAGLE SUCCESS (H.K.) LIMITED
勇勝(香港)有限公司",1995-08-22,2000-07-14,"Private, ltd by shares"51,0523590,"EASTRON ELECTRONIC COMPANY LIMITED
日興科電有限公司",1995-08-22,,"Private, ltd by shares"52,0523687,"EQUATOR LIMITED (HK)",1995-08-22,,"Private, ltd by shares"53,0523749,"EXCEL INTERNATIONAL MERCHANDISING LIMITED",1995-08-22,2001-08-24,"Private, ltd by shares"54,0523688,"EXPLORE LIMITED (d2002-03-15)",1995-08-22,2002-03-15,"Private, ltd by shares"55,0523732,"EXPRESS INFORMATION SERVICES LIMITED (d2007-03-09)
速達資訊服務有限公司",1995-08-22,2007-03-09,"Private, ltd by shares"56,0523751,"FELIX ENTERPRISES LIMITED
菲力士企業有限公司",1995-08-22,,"Private, ltd by shares"57,0523488,"FINE GROWTH LIMITED
捷德有限公司",1995-08-22,,"Private, ltd by shares"58,0523493,"FINE HAU INDUSTRY (HONG KONG) CO., LIMITED
方皓工業(香港)有限公司",1995-08-22,2009-10-16,"Private, ltd by shares"59,0523494,"FINE RICH INVESTMENT LIMITED
捷峰投資有限公司",1995-08-22,2003-09-28,"Private, ltd by shares"60,0523594,"FIRETECH ENGINEERING LIMITED
耐燃工程有限公司",1995-08-22,,"Private, ltd by shares"61,0523763,"FIRST CROWN LIMITED
球達有限公司",1995-08-22,,"Private, ltd by shares"62,0523615,"FOLIE BEDDING LIMITED
富利床上用品有限公司",1995-08-22,1999-06-11,"Private, ltd by shares"63,0523534,"FOOK LONG INVESTMENTS LIMITED",1995-08-22,2000-06-16,"Private, ltd by shares"64,0523679,"FOREVER FAITH INTERNATIONAL LIMITED (d2001-09-28)
永烽國際有限公司",1995-08-22,2001-09-28,"Private, ltd by shares"65,0523573,"FORTUNE PLUMBING &amp; ELECTRICAL ENGINEERING LIMITED
富田水電工程有限公司",1995-08-22,2017-09-22,"Private, ltd by shares"66,0523498,"FRANCESCA TRADING LIMITED
廣聯百業洋行有限公司",1995-08-22,2011-04-15,"Private, ltd by shares"67,0523465,"FRANJANS FAR EAST PRODUCTS LIMITED
華誠遠東商品貿易發展有限公司",1995-08-22,2001-01-19,"Private, ltd by shares"68,0523668,"FREE CHOICE PROJECTS COMPANY LIMITED
中港輝祥工程有限公司",1995-08-22,2001-10-05,"Private, ltd by shares"69,0523501,"FRUITFUL TECHNOLOGIES LIMITED",1995-08-22,2003-04-16,"Private, ltd by shares"70,0523683,"FU WAH COMPANY LIMITED (d2007-12-21)
富華製造廠有限公司",1995-08-22,2007-12-21,"Private, ltd by shares"71,0523727,"FUIJI NAM AN HUNG MUI CLANSMEN ASSOCIATION (HONG KONG) LIMITED
福建南安洪梅同鄉會(香港)有限公司",1995-08-22,2002-08-09,"Ltd by guarantee"72,0523710,"FUJIAN ENTERPRISES INSURANCE MANAGEMENT &amp; AGENTS COMPANY LIMITED
華閩保險代理有限公司",1995-08-22,2015-04-02,"Private, ltd by shares"73,0523550,"FULL HING FASHION GARMENT FACTORY LIMITED
富興時裝製衣廠有限公司",1995-08-22,2004-01-30,"Private, ltd by shares"74,0523712,"G &amp; S (ASIA) COMPANY LIMITED
偉成(亞洲)貿易有限公司",1995-08-22,1999-01-22,"Private, ltd by shares"75,0523479,"GAIN CENTURY INTERNATIONAL LIMITED
世年國際有限公司",1995-08-22,,"Private, ltd by shares"76,0523481,"GAIN MAKER INTERNATIONAL LIMITED
堅裕國際有限公司",1995-08-22,2004-07-02,"Private, ltd by shares"77,0523484,"GAY FORTUNE DEVELOPMENT LIMITED
基財發展有限公司",1995-08-22,2001-11-02,"Private, ltd by shares"78,0523466,"GAY LUCK DEVELOPMENT LIMITED
欣運發展有限公司",1995-08-22,,"Private, ltd by shares"79,0523635,"GENERAL RICH LIMITED (d1999-06-11)
華德豐有限公司",1995-08-22,1999-06-11,"Private, ltd by shares"80,0523570,"GLOBAL METALLURGICAL RESOURCES LIMITED",1995-08-22,2004-03-05,"Private, ltd by shares"81,0523622,"GLOBAL TRIUMPH LIMITED (d1998-09-04)
暉冠有限公司",1995-08-22,1998-09-04,"Private, ltd by shares"82,0523698,"GO EAST MUSIC PUBLISHING COMPANY LIMITED
正東音樂版權有限公司",1995-08-22,2008-11-21,"Private, ltd by shares"83,0523639,"GOLD EAGLE INTERNATIONAL INVESTMENT LIMITED
金鷹國際投資有限公司",1995-08-22,1999-04-16,"Private, ltd by shares"84,0523539,"GOLDEN APPLE HOLDINGS LIMITED
金藝寶集團有限公司",1995-08-22,1998-08-13,"Private, ltd by shares"85,0523497,"GOLDEN HEAD INVESTMENT LIMITED (d2001-01-05)
順鋒投資有限公司",1995-08-22,2001-01-05,"Private, ltd by shares"86,0523684,"GOLDEN NEO-LIFE DIAMITE INTERNATIONAL OF TAIWAN, LIMITED",1995-08-22,2000-10-27,"Private, ltd by shares"87,0523554,"GOLDEN TEXTILES IMPORT &amp; EXPORT LIMITED
金紡入出口有限公司",1995-08-22,2003-03-21,"Private, ltd by shares"88,0523641,"GOLDTEN HOLDINGS LIMITED
高登集團有限公司",1995-08-22,2000-06-16,"Private, ltd by shares"89,0523662,"GOOD HERO TRADING LIMITED
振雄貿易有限公司",1995-08-22,,"Private, ltd by shares"90,0523709,"GOOD HOPE CULTURAL CENTRE LIMITED
華菁文教中心有限公司",1995-08-22,2003-03-21,"Private, ltd by shares"91,0523638,"GOODBUSY INTERNATIONAL INVESTMENT LIMITED
卓裕國際投資有限公司",1995-08-22,,"Private, ltd by shares"92,0523543,"GOODWARD DEVELOPMENT LIMITED
進偉發展有限公司",1995-08-22,2003-06-13,"Private, ltd by shares"93,0523513,"GOODWELL INDUSTRIAL (HK) LIMITED
百惠實業(香港)有限公司",1995-08-22,,"Private, ltd by shares"94,0523452,"GORETI &amp; ASSOCIATES LIMITED",1995-08-22,2002-02-22,"Private, ltd by shares"95,0523553,"GRACEFUL OVERSEAS LIMITED
仲貿有限公司",1995-08-22,,"Private, ltd by shares"96,0523637,"GRACEWAY INTERNATIONAL LIMITED (d2003-11-21)
卓偉國際有限公司",1995-08-22,2003-11-21,"Private, ltd by shares"97,0523548,"GRANTWAY COMPANY LIMITED
鈞偉有限公司",1995-08-22,2001-09-26,"Private, ltd by shares"98,0523646,"GREAT OCEAN INTERNATIONAL TRADING LIMITED (d2001-02-23)
大洋洲國際貿易有限公司",1995-08-22,2001-02-23,"Private, ltd by shares"99,0523467,"GREEN LINE DEVELOPMENT LIMITED
碧宜發展有限公司",1995-08-22,,"Private, ltd by shares"100,0523475,"GREEN ROUTE INVESTMENT LIMITED",1995-08-22,,"Private, ltd by shares"101,0523499,"GREENLAND LANDSCAPING AND DESIGN COMPANY LIMITED
雅琳園藝設計工程有限公司",1995-08-22,2003-08-21,"Private, ltd by shares"102,0523473,"GROSVENOR PERFUMERIES LIMITED",1995-08-22,2005-11-01,"Private, ltd by shares"103,0523597,"GUANN LIN TEXTILE (HONG KONG) LIMITED
冠霖紡織(香港)有限公司",1995-08-22,2004-03-05,"Private, ltd by shares"104,0523711,"HANOVER INTERNATIONAL INVESTMENTS LIMITED
漢諾威國際投資有限公司",1995-08-22,2004-03-05,"Private, ltd by shares"105,0523489,"HEAD WORLD LIMITED
德君有限公司",1995-08-22,2002-08-09,"Private, ltd by shares"106,0523657,"HEALTHY KING FOOD INTERNATIONAL LIMITED
康健食品國際有限公司",1995-08-22,1997-02-27,"Private, ltd by shares"107,0523653,"HENG JIANG TOBACCO LIMITED
恒江煙草有限公司",1995-08-22,2006-02-17,"Private, ltd by shares"108,0523720,"HINTCO INDUSTRIAL LIMITED
顯豪實業有限公司",1995-08-22,2005-08-12,"Private, ltd by shares"109,0523663,"HOLTEC SHIPPING LIMITED
浩德船務有限公司",1995-08-22,2000-04-07,"Private, ltd by shares"110,0523610,"HONG KONG ALLIANCE MISSION
香港宣道差會",1995-08-22,,"Ltd by guarantee"111,0523701,"HONG KONG FRANCK SIU DESIGN &amp; CONCEPT COMPANY LIMITED
香港蕭鴻生設計概念有限公司",1995-08-22,2005-08-12,"Private, ltd by shares"112,0523593,"HONG KONG HUA FENG LIMITED
香港華峰有限公司",1995-08-22,2014-12-24,"Private, ltd by shares"113,0523519,"HONG KONG LIDIAN INVESTMENTS LIMITED
香港利電投資有限公司",1995-08-22,2004-07-02,"Private, ltd by shares"114,0523692,"HONGDA OCEAN SHIPPING (HK) COMPANY LIMITED
鴻達海運(香港)有限公司",1995-08-22,2004-07-02,"Private, ltd by shares"115,0523556,"HOP SHING ENGINEERING COMPANY LIMITED
合成工程(香港)有限公司",1995-08-22,,"Private, ltd by shares"116,0523672,"HOWARD ROSENBERG HK LIMITED",1995-08-22,2018-10-10,"Private, ltd by shares"117,0523588,"HUNG TAI INTERNATIONAL (HONG KONG) COMPANY LIMITED
鴻泰國際(香港)有限公司",1995-08-22,2004-03-05,"Private, ltd by shares"118,0523734,"HWA-YUAN INTERNATIONAL EXPRESS GROUP COMPANY LIMITED
華遠國際運通集團有限公司",1995-08-22,2004-03-05,"Private, ltd by shares"119,0523607,"ICON PROMOTIONS LIMITED (d2004-03-05)",1995-08-22,2004-03-05,"Private, ltd by shares"120,0523562,"INTERNATIONAL SECURITY GROUP LIMITED (d2000-02-18)",1995-08-22,2000-02-18,"Private, ltd by shares"121,0523750,"INTERSALE EXHIBITION SERVICES LIMITED
藍籌國際展覽服務有限公司",1995-08-22,1999-06-11,"Private, ltd by shares"122,0523530,"JET OCEAN LIMITED
捷洋有限公司",1995-08-22,,"Private, ltd by shares"123,0523719,"JETFUND DEVELOPMENT LIMITED
萃豐發展有限公司",1995-08-22,2005-04-22,"Private, ltd by shares"124,0523708,"JINDIE TECHNOLOGY DEVELOPMENT CO. LIMITED
金叠科技發展有限公司",1995-08-22,1999-03-12,"Private, ltd by shares"125,0523463,"JOY LIGHTING COMPANY LIMITED
格瑞特國際有限公司",1995-08-22,2005-08-12,"Private, ltd by shares"126,0523552,"JUNG SAN (H.K.) LIMITED",1995-08-22,1998-10-09,"Private, ltd by shares"127,0523578,"JUST CHINA HOLDINGS (HK) LIMITED
嘉士德有限公司",1995-08-22,2017-04-21,"Private, ltd by shares"128,0523718,"KENHIL (HONG KONG) INTERNATIONAL LIMITED
建山(香港)國際有限公司",1995-08-22,2004-03-05,"Private, ltd by shares"129,0523723,"KENSTIC LIMITED",1995-08-22,2014-03-21,"Private, ltd by shares"130,0523606,"KEY WEALTH LIMITED (d2018-01-19)
濠運有限公司",1995-08-22,2018-01-19,"Private, ltd by shares"131,0523623,"KINETIC ENTERPRISE COMPANY LIMITED
金利達企業香港有限公司",1995-08-22,2005-01-07,"Private, ltd by shares"132,0523471,"KING'S GALLERY LIMITED
皇室畫廊有限公司",1995-08-22,,"Private, ltd by shares"133,0523691,"KINGSLINE CLOTHING MFG. CO., LIMITED
景泰服裝有限公司",1995-08-22,2013-04-05,"Private, ltd by shares"134,0523608,"KINGSLUCK INVESTMENTS LIMITED
皇運投資有限公司",1995-08-22,2005-06-10,"Private, ltd by shares"135,0523558,"KOCHI CHEMICAL COMPANY LIMITED
高兆化工有限公司",1995-08-22,2007-07-20,"Private, ltd by shares"136,0523577,"KONG TAI CEMENT LIMITED
港泰水泥有限公司",1995-08-22,2003-07-11,"Private, ltd by shares"137,0523549,"KOO &amp; KAO PRODUCTS ENTERPRISE CO., LIMITED
古葉(香港)有限公司",1995-08-22,2010-01-15,"Private, ltd by shares"138,0523743,"KOVEL LIMITED",1995-08-22,2004-07-02,"Private, ltd by shares"139,0523693,"KOWA TRADING LIMITED
高華貿易有限公司",1995-08-22,,"Private, ltd by shares"140,0523735,"KOYO SANEI COMPANY LIMITED
向陽三榮有限公司",1995-08-22,2005-08-12,"Private, ltd by shares"141,0523545,"KWAN CHEONG TRADING LIMITED
鈞昌貿易有限公司",1995-08-22,2002-02-15,"Private, ltd by shares"142,0523601,"KYOSEI C. &amp; E. (H.K.) COMPANY LIMITED
共成通信電子(香港)有限公司",1995-08-22,2005-04-22,"Private, ltd by shares"143,0523502,"LAMMA TRADING COMPANY LIMITED",1995-08-22,2002-05-10,"Private, ltd by shares"144,0523742,"LAP SHING ENT. INT'L LIMITED
立成企業國際有限公司",1995-08-22,2003-02-21,"Private, ltd by shares"145,0523748,"LEADER HYPERMARKET LIMITED
建達超霸市場有限公司",1995-08-22,1999-01-22,"Private, ltd by shares"146,0523579,"LEE SANG MEAT WHOLESALER AND RETAILER LIMITED
利生肉枱有限公司",1995-08-22,2004-10-15,"Private, ltd by shares"147,0523696,"LEGEND WORLDWIDE TRADING COMPANY LIMITED
勵精國際貿易有限公司",1995-08-22,2011-12-02,"Private, ltd by shares"148,0523669,"LES MANDELBAUM HK LIMITED",1995-08-22,,"Private, ltd by shares"149,0523766,"LIDEX TRANSPORTATION LIMITED
利達運輸有限公司",1995-08-22,2001-03-16,"Private, ltd by shares"150,0523551,"LINKERWAY (TIANJIN) DEVELOPMENT LIMITED
聯滙豐(天津)發展有限公司",1995-08-22,2006-02-17,"Private, ltd by shares"151,0523640,"LINKSINO INTERNATIONAL INVESTMENT LIMITED
華聯國際投資有限公司",1995-08-22,2002-06-14,"Private, ltd by shares"152,0523661,"LINKTEC INVESTMENT LIMITED
聯科投資有限公司",1995-08-22,2003-10-03,"Private, ltd by shares"153,0523511,"LIONHEART MUSIC AND FILM PRODUCTIONS LIMITED",1995-08-22,2007-01-05,"Private, ltd by shares"154,0523667,"LONGWING SHIPPING LIMITED
瑞榮船務有限公司",1995-08-22,2005-08-12,"Private, ltd by shares"155,0523714,"LUCKWELL INVESTMENTS LIMITED
祥懋投資有限公司",1995-08-22,1998-10-09,"Private, ltd by shares"156,0523700,"LUCKY TACT LIMITED
金利富有限公司",1995-08-22,2004-03-05,"Private, ltd by shares"157,0523504,"MANDARIN TECHNOLOGIES LIMITED (d2003-02-07)",1995-08-22,2003-02-07,"Private, ltd by shares"158,0523503,"MANDOLAY TRADING LIMITED",1995-08-22,2001-01-19,"Private, ltd by shares"159,0523459,"MANHATTAN CURTAIN WALL COMPANY LIMITED
曼克頓玻璃幕牆有限公司",1995-08-22,,"Private, ltd by shares"160,0523666,"MANWICK SHIPPING LIMITED
萬益船務有限公司",1995-08-22,2001-07-20,"Private, ltd by shares"161,0523745,"MEGA-TECH MACHINERIES &amp; SUPPLIES LIMITED
美加德機械有限公司",1995-08-22,1999-06-18,"Private, ltd by shares"162,0523670,"METRO-FAME LIMITED
煒譽有限公司",1995-08-22,,"Private, ltd by shares"163,0523694,"METRO-GOLD TRADING LIMITED
達億貿易有限公司",1995-08-22,2006-02-17,"Private, ltd by shares"164,0523505,"MID-WEST INTERNATIONAL LIMITED",1995-08-22,2004-03-05,"Private, ltd by shares"165,0523725,"MING LAP INDUSTRIES LIMITED
銘立實業有限公司",1995-08-22,2000-08-04,"Private, ltd by shares"166,0523460,"MONTAGNA INDUSTRIAL COMPANY LIMITED
錡璟實業有限公司",1995-08-22,2004-03-05,"Private, ltd by shares"167,0523760,"MTT INTERNATIONAL (HOLDINGS) LIMITED
新時科技國際(集團)有限公司",1995-08-22,2004-03-12,"Private, ltd by shares"168,0523483,"MULTI-BEST (H.K.) LIMITED
倍佳(香港)有限公司",1995-08-22,,"Private, ltd by shares"169,0523482,"MULTI-FAST INTERNATIONAL LIMITED
冠飛國際有限公司",1995-08-22,2006-01-27,"Private, ltd by shares"170,0523542,"N.E. INVESTMENTS LIMITED
鈞威投資有限公司",1995-08-22,2003-03-21,"Private, ltd by shares"171,0523544,"N.V. DEVELOPMENT LIMITED
鈞威發展有限公司",1995-08-22,2003-04-04,"Private, ltd by shares"172,0523457,"NAN ZHONG GUO GROUP INVESTMENTS LIMITED
南中國集團投資有限公司",1995-08-22,2004-06-11,"Private, ltd by shares"173,0523617,"NANYANG INTERNATIONAL GROUP LIMITED
南洋國際集團有限公司",1995-08-22,,"Private, ltd by shares"174,0523518,"NOBLE HOUSE FURNITURE LIMITED
大夫第傢俬有限公司",1995-08-22,2003-12-12,"Private, ltd by shares"175,0523627,"NORTHERN STAR AUTOMOBILE (HONG KONG) LIMITED
北星汽車(香港)有限公司",1995-08-22,,"Private, ltd by shares"176,0523697,"NOVA LIMITED (d2017-02-17)",1995-08-22,2017-02-17,"Private, ltd by shares"177,0523583,"NTP (CHINA) INVESTMENT CO., LIMITED
泰凌(中國)投資有限公司",1995-08-22,,"Private, ltd by shares"178,0523568,"NUMBER TWENTY ONE LIMITED",1995-08-22,,"Private, ltd by shares"179,0523576,"OBJECT SYSTEMS COMPANY LIMITED
合成系統有限公司",1995-08-22,2007-03-23,"Private, ltd by shares"180,0523768,"OCEANIC CAPITAL LIMITED",1995-08-22,2004-03-05,"Private, ltd by shares"181,0523574,"OPAC DEVELOPMENT COMPANY LIMITED",1995-08-22,2005-01-07,"Private, ltd by shares"182,0523480,"ORIENTAL EARNING INTERNATIONAL LIMITED
漢財國際有限公司",1995-08-22,2001-06-22,"Private, ltd by shares"183,0523506,"ORIENTAL VENTURES LIMITED (d2007-11-16)",1995-08-22,2007-11-16,"Private, ltd by shares"184,0523744,"P D S COMPANY LIMITED
必達服務有限公司",1995-08-22,,"Private, ltd by shares"185,0523469,"PACIFIC CANAL INVESTMENT LIMITED
太運投資有限公司",1995-08-22,2000-05-26,"Private, ltd by shares"186,0523569,"PACIFIC TURBO LIMITED (d2004-07-02)
百力寶有限公司",1995-08-22,2004-07-02,"Private, ltd by shares"187,0523650,"PAUL ROWAN HK LIMITED",1995-08-22,,"Private, ltd by shares"188,0523472,"PEARL SHINE HOLDINGS LIMITED
耀明集團有限公司",1995-08-22,2009-01-16,"Private, ltd by shares"189,0523582,"PEARLYSHELL LIMITED",1995-08-22,1998-05-28,"Private, ltd by shares"190,0523680,"PERIFIELD COMPANY LIMITED",1995-08-22,2001-09-14,"Private, ltd by shares"191,0523738,"POLYPOWER INTERNATIONAL LIMITED
富谷國際有限公司",1995-08-22,,"Private, ltd by shares"192,0523602,"PORTIA JEWELLERY DESIGN LIMITED
寶詩雅首飾設計有限公司",1995-08-22,2006-07-07,"Private, ltd by shares"193,0523531,"POSON ENGINEERING LIMITED
寶新工程有限公司",1995-08-22,,"Private, ltd by shares"194,0523628,"POWER FIRST TRANSPORTATION CO., LIMITED
冠力運輸有限公司",1995-08-22,2008-01-04,"Private, ltd by shares"195,0523619,"PRO-TECH RESOURCES LIMITED
保達科技有限公司",1995-08-22,2004-07-02,"Private, ltd by shares"196,0523492,"PROFIT TOP INTERNATIONAL LIMITED
嘉鷹國際有限公司",1995-08-22,,"Private, ltd by shares"197,0523586,"RAINBOW PUZZLES (HK) LIMITED
彩虹拼圖(香港)有限公司",1995-08-22,2002-05-24,"Private, ltd by shares"198,0523567,"RAINBOW TOP LIMITED
虹興有限公司",1995-08-22,,"Private, ltd by shares"199,0523572,"REATON LIMITED (d1999-12-03)",1995-08-22,1999-12-03,"Private, ltd by shares"200,0523512,"RED LINE INTERNATIONAL (HK) LIMITED
成聯通運(香港)有限公司",1995-08-22,,"Private, ltd by shares"201,0523508,"REX FASTENING SYSTEMS LIMITED
力士緊固系統有限公司",1995-08-22,2005-07-08,"Private, ltd by shares"202,0523681,"RI MEI DEVELOPMENT LIMITED
香港日美發展有限公司",1995-08-22,2003-03-21,"Private, ltd by shares"203,0523678,"RICH DRAGON TRADING LIMITED
冠龍貿易有限公司",1995-08-22,,"Private, ltd by shares"204,0523491,"RISE RICH ESTATES LIMITED
發富物業有限公司",1995-08-22,2003-03-21,"Private, ltd by shares"205,0523490,"RISE RICH PROPERTIES LIMITED
發富置業有限公司",1995-08-22,2010-01-15,"Private, ltd by shares"206,0523595,"RIXIN (HONG KONG) COMPANY LIMITED
日新(香港)商業有限公司",1995-08-22,2001-07-06,"Private, ltd by shares"207,0523624,"ROKO ASIA LIMITED
龍港亞洲有限公司",1995-08-22,,"Private, ltd by shares"208,0523649,"SANYO-IK COLOR (H.K.) LIMITED
山陽稻田複合塑料(香港)有限公司",1995-08-22,,"Private, ltd by shares"209,0523507,"SCARLET VENTURES LIMITED",1995-08-22,2000-08-04,"Private, ltd by shares"210,0523478,"Schunk Carbon Technology Limited (HK)
崇德碳技術有限公司",1995-08-22,,"Private, ltd by shares"211,0523468,"SEG. MAGCARD INVESTMENT HOLDINGS LIMITED
賽格麥柯投資集團有限公司",1995-08-22,2014-12-24,"Private, ltd by shares"212,0523740,"SEYO INDUSTRIAL (H.K.) COMPANY LIMITED
世洋實業(香港)有限公司",1995-08-22,2002-01-18,"Private, ltd by shares"213,0523739,"SHAN DA TRADING COMPANY LIMITED
善達洋行有限公司",1995-08-22,2001-08-24,"Private, ltd by shares"214,0523642,"SHARP TECH HOLDINGS LIMITED
崇富發展投資有限公司",1995-08-22,2011-11-04,"Private, ltd by shares"215,0523746,"Shoucheng Services Limited
首程服務有限公司",1995-08-22,,"Private, ltd by shares"216,0523517,"SHUN HING (CHINA H.K.) LIMITED
順興(中港)有限公司",1995-08-22,2017-04-21,"Private, ltd by shares"217,0523726,"SIN FAI (CHUNG KONG) COMPANY LIMITED
新輝(中港)有限公司",1995-08-22,,"Private, ltd by shares"218,0523536,"SIN FAT (CHINA) LIMITED
勝發(中國)有限公司",1995-08-22,1998-12-18,"Private, ltd by shares"219,0523626,"SIN YUN CONSTRUCTION COMPANY LIMITED
新遠工程有限公司",1995-08-22,2000-06-16,"Private, ltd by shares"220,0523630,"SINO DRAGON ASIA LIMITED
華龍亞洲有限公司",1995-08-22,2004-03-05,"Private, ltd by shares"221,0523702,"SINO SENIOR FINANCE LIMITED
中隆金融財務有限公司",1995-08-22,,"Private, ltd by shares"222,0523652,"SINO SWISS ENGINEERING LIMITED
亞洲瑞士工程有限公司",1995-08-22,,"Private, ltd by shares"223,0523632,"SINOEURO INTERNATIONAL INVESTMENT LIMITED
華歐國際投資有限公司",1995-08-22,2003-03-21,"Private, ltd by shares"224,0523636,"SINOEURO INTERNATIONAL LIMITED
華歐國際有限公司",1995-08-22,2001-09-21,"Private, ltd by shares"225,0523633,"SINORICH SHIPPING LIMITED
華裕船務有限公司",1995-08-22,2019-08-09,"Private, ltd by shares"226,0523713,"SIU CHEONG INTERNATIONAL LIMITED
紹昌國際有限公司",1995-08-22,2003-03-21,"Private, ltd by shares"