,Reg no.,Name,Incorp-orated,Dissolved,Type227,0523658,"SKY RISE TRADING LIMITED
天昇貿易有限公司",1995-08-22,2004-11-11,"Private, ltd by shares"228,0523598,"SMITH &amp; GRANT (OPAL) HONG KONG LIMITED
亨卓(澳寶)香港有限公司",1995-08-22,2001-03-16,"Private, ltd by shares"229,0523559,"SOUTH CHINA SHIPPING (HK) LIMITED
中南船務(香港)有限公司",1995-08-22,,"Private, ltd by shares"230,0523613,"SOUTH CHINA YAN FONG (H.K.) DEVELOPMENT LIMITED
中南人防(香港)發展有限公司",1995-08-22,2000-02-18,"Private, ltd by shares"231,0523538,"SOUTHCHINA INFORMATION LIMITED
華南資訊有限公司",1995-08-22,2002-11-08,"Private, ltd by shares"232,0523496,"STAR JOIN INDUSTRIES (HONG KONG) LIMITED
香港展鋒實業有限公司",1995-08-22,2013-05-10,"Private, ltd by shares"233,0523495,"STAR PACIFIC INDUSTRIES LIMITED
捷海實業有限公司",1995-08-22,2000-09-20,"Private, ltd by shares"234,0523673,"STATE BENEFIT LIMITED
煒益有限公司",1995-08-22,,"Private, ltd by shares"235,0523525,"SUCCESS FIRST DEVELOPMENT LIMITED
駿永發展有限公司",1995-08-22,2020-04-09,"Private, ltd by shares"236,0523612,"SUMIDEN SHOJI (H.K.) CO., LIMITED
住電商事(香港)有限公司",1995-08-22,2009-03-13,"Private, ltd by shares"237,0523591,"SUMMIT HOLDINGS COMPANY LIMITED",1995-08-22,2001-09-27,"Private, ltd by shares"238,0523589,"SUN LI BUILDING MATERIALS COMPANY LIMITED
新利建材有限公司",1995-08-22,1999-01-22,"Private, ltd by shares"239,0523540,"SUN WING HOLDINGS LIMITED
新榮集團有限公司",1995-08-22,2003-08-01,"Private, ltd by shares"240,0523575,"SUN YUEN TRADING LIMITED
新苑貿易有限公司",1995-08-22,2004-03-05,"Private, ltd by shares"241,0523677,"SUN'S TRAVEL LIMITED
太陽旅遊有限公司",1995-08-22,,"Private, ltd by shares"242,0523520,"SUNCOOK INTERNATIONAL (H.K.) LIMITED
雋采國際有限公司",1995-08-22,2003-11-14,"Private, ltd by shares"243,0523757,"SUNFLOWER OVERSEAS LIMITED
新華海外有限公司",1995-08-22,2004-03-05,"Private, ltd by shares"244,0523753,"SUNNY CHAIN INTERNATIONAL CORPORATION LIMITED
軒成歐亞國際有限公司",1995-08-22,2002-02-15,"Private, ltd by shares"245,0523762,"SUNRISE TRANSPORTATION LIMITED
高威運輸有限公司",1995-08-22,2002-07-26,"Private, ltd by shares"246,0523600,"SUNTECH CORPORATION LIMITED (d2004-03-05)",1995-08-22,2004-03-05,"Private, ltd by shares"247,0523592,"SUNTECH INVESTMENTS COMPANY LIMITED",1995-08-22,2002-10-11,"Private, ltd by shares"248,0523546,"SUNWISE TRADING LIMITED (d2007-01-05)
陽泰貿易有限公司",1995-08-22,2007-01-05,"Private, ltd by shares"249,0523458,"SUPER EASY HOLDINGS LIMITED
怡展集團有限公司",1995-08-22,2005-08-12,"Private, ltd by shares"250,0523510,"SUZUKI PACKAGING CO. LIMITED
鈴木包裝有限公司",1995-08-22,2001-03-23,"Private, ltd by shares"251,0523535,"TAK SHING TRADING DEVELOPMENT COMPANY LIMITED
德成貿易發展有限公司",1995-08-22,2002-02-15,"Private, ltd by shares"252,0523686,"TAMWORTH INVESTMENT LIMITED (d2005-08-12)",1995-08-22,2005-08-12,"Private, ltd by shares"253,0523587,"TASTY CONGEE &amp; NOODLE WANTUN SHOP LIMITED
正斗粥麵專家有限公司",1995-08-22,,"Private, ltd by shares"254,0523715,"TCI (HK) LIMITED",1995-08-22,2008-05-26,"Private, ltd by shares"255,0523603,"TIM FAI INTERNATIONAL HOLDINGS LIMITED (d1999-06-11)
添輝國際集團有限公司",1995-08-22,1999-06-11,"Private, ltd by shares"256,0523566,"TIME TREND LIMITED (d2002-01-18)
祥展有限公司",1995-08-22,2002-01-18,"Private, ltd by shares"257,0523756,"TIMES DESIGN LIMITED
時代設計有限公司",1995-08-22,,"Private, ltd by shares"258,0523456,"TITAN WEALTH INVESTMENTS LIMITED
兆濤投資有限公司",1995-08-22,2005-02-08,"Private, ltd by shares"259,0523634,"TOKEN-TOTAL NETWORK STRATEGIES CORPORATION LIMITED
達奧勤滔滔網絡策略有限公司",1995-08-22,2003-01-24,"Private, ltd by shares"260,0523671,"TOP ELEGANCE LIMITED (d2002-02-15)
煒俊有限公司",1995-08-22,2002-02-15,"Private, ltd by shares"261,0523564,"TOP STANDARD ENGINEERING LIMITED (d2004-03-05)
順成工程有限公司",1995-08-22,2004-03-05,"Private, ltd by shares"262,0523500,"TOYOO INVESTMENTS (HK) LIMITED",1995-08-22,2000-06-16,"Private, ltd by shares"263,0523675,"TRADE BRAND LIMITED",1995-08-22,2019-05-31,"Private, ltd by shares"264,0523541,"TRADEWELL HOLDINGS LIMITED
貿威集團有限公司",1995-08-22,2004-03-05,"Private, ltd by shares"265,0523547,"TRADING CHANNEL LIMITED
貿通有限公司",1995-08-22,2001-08-31,"Private, ltd by shares"266,0523515,"TRANS WORLD CONCEPTS LIMITED
世念有限公司",1995-08-22,2000-09-29,"Private, ltd by shares"267,0523703,"TRANS-AERO COMPONENTS &amp; SUPPLIES (FAR EAST) LIMITED
璨士亞路(遠東)有限公司",1995-08-22,2005-01-07,"Private, ltd by shares"268,0523716,"TRANSMART COMPANY LIMITED
祥浚有限公司",1995-08-22,,"Private, ltd by shares"269,0523609,"TRANSTECH-WMI LIMITED",1995-08-22,2018-01-19,"Private, ltd by shares"270,0523721,"TRILAND INVESTMENT LIMITED
置宏投資有限公司",1995-08-22,,"Private, ltd by shares"271,0523561,"UNILAND ENTERPRISES LIMITED
順隆企業有限公司",1995-08-22,2002-10-30,"Private, ltd by shares"272,0523527,"UNILAND INVESTMENT LIMITED (HK)
宏隆投資有限公司",1995-08-22,,"Private, ltd by shares"273,0523532,"UNISON (H.K.) LIMITED
聯新(香港)有限公司",1995-08-22,2003-02-21,"Private, ltd by shares"274,0523555,"UNITED CROSS INDUSTRIAL LIMITED
合通實業發展有限公司",1995-08-22,2008-10-03,"Private, ltd by shares"275,0523563,"UNIVERSAL TEAM INDUSTRIAL LIMITED
宇添實業有限公司",1995-08-22,2014-05-09,"Private, ltd by shares"276,0523596,"UPDATE FASHION LIMITED
金基光速有限公司",1995-08-22,2020-05-22,"Private, ltd by shares"277,0523625,"VANUATU FREIGHT FORWARDING (H.K.) LIMITED
美圖航空貨運(香港)有限公司",1995-08-22,,"Private, ltd by shares"278,0523654,"VC REGISTRATION LIMITED
維斯註冊有限公司",1995-08-22,1998-10-09,"Private, ltd by shares"279,0523647,"VC SECRETARIAL LIMITED
維斯秘書有限公司",1995-08-22,2019-10-11,"Private, ltd by shares"280,0523487,"VENTIS HONG KONG LIMITED",1995-08-22,2004-03-05,"Private, ltd by shares"281,0523733,"VENTURE ASIA (HK) LIMITED",1995-08-22,2005-08-12,"Private, ltd by shares"282,0523655,"VENUS TIME LIMITED",1995-08-22,2004-12-17,"Private, ltd by shares"283,0523682,"VICARAGE COMPANY LIMITED",1995-08-22,2001-10-19,"Private, ltd by shares"284,0523730,"VICTORIA NOMINEES LIMITED (d2006-02-03)
域多利代理人有限公司",1995-08-22,2006-02-03,"Private, ltd by shares"285,0523759,"WAI MING ENGINEERING COMPANY LIMITED (d2016-04-08)
偉明維修工程有限公司",1995-08-22,2016-04-08,"Private, ltd by shares"286,0523529,"WAYCHEER LIMITED
偉志有限公司",1995-08-22,2006-12-22,"Private, ltd by shares"287,0523462,"WEALTH GALORE INVESTMENTS LIMITED
霞明投資有限公司",1995-08-22,2011-11-04,"Private, ltd by shares"288,0523453,"WEALTHGATE INVESTMENTS LIMITED
豫盛投資有限公司",1995-08-22,2011-05-20,"Private, ltd by shares"289,0523645,"WELL CANAL INVESTMENTS LIMITED
嘉泉投資有限公司",1995-08-22,2000-08-04,"Private, ltd by shares"290,0523695,"WELL-FOUND (YING FAI) ENGINEERING COMPANY LIMITED
滙基(英輝)工程有限公司",1995-08-22,,"Private, ltd by shares"291,0523614,"WELLINGFORD INVESTMENTS COMPANY LIMITED",1995-08-22,2004-03-05,"Private, ltd by shares"292,0523722,"WELLNICO LIMITED
偉力高有限公司",1995-08-22,2003-01-10,"Private, ltd by shares"293,0523758,"WELLTECH KINGDOM LIMITED
偉力興業有限公司",1995-08-22,2008-09-05,"Private, ltd by shares"294,0523674,"WIDE FOND LIMITED
煒豐有限公司",1995-08-22,,"Private, ltd by shares"295,0523621,"WIN HARBOUR HOLDINGS LIMITED
港賢集團有限公司",1995-08-22,2005-03-24,"Private, ltd by shares"296,0523664,"WIN HARVEST ENGINEERING LIMITED (d2001-06-22)
運豐工程有限公司",1995-08-22,2001-06-22,"Private, ltd by shares"297,0523565,"WING FAT ENGINEERING COMPANY LIMITED (d2000-11-24)
榮發工程國際有限公司",1995-08-22,2000-11-24,"Private, ltd by shares"298,0523522,"WING KO FASHION LIMITED
永高男女服裝有限公司",1995-08-22,2006-02-17,"Private, ltd by shares"299,0523485,"WING LUNG SCAFFOLDING DECORATION ENGINEERING LIMITED
永隆棚業裝修工程有限公司",1995-08-22,2001-11-02,"Private, ltd by shares"300,0523580,"WING WAI SERVICES LIMITED
永維服務有限公司",1995-08-22,2006-12-22,"Private, ltd by shares"301,0523699,"WINNER HERO LIMITED (d2000-10-27)
日豪有限公司",1995-08-22,2000-10-27,"Private, ltd by shares"302,0523747,"WINSIDE LIMITED (HK)
永勝達有限公司",1995-08-22,,"Private, ltd by shares"303,0523581,"WISE CHANCE ENTERPRISE LIMITED (d2006-02-17)
智機企業有限公司",1995-08-22,2006-02-17,"Private, ltd by shares"304,0523651,"WISER HANDBAGS &amp; ACCESSORIES LIMITED
偉德手袋有限公司",1995-08-22,2006-08-04,"Private, ltd by shares"305,0523470,"WONDERFUL PROFIT HOLDINGS LIMITED
皇利集團有限公司",1995-08-22,2000-09-29,"Private, ltd by shares"306,0523474,"WORLD FORTUNE INDUSTRIAL LIMITED
鵬浩實業有限公司",1995-08-22,2002-08-09,"Private, ltd by shares"307,0523618,"WORLDWIDE CHAMPION LIMITED
宜勝有限公司",1995-08-22,2002-12-20,"Private, ltd by shares"308,0523717,"WUYI HONPO CONSTRUCTION COMPANY LIMITED
武夷華寶建設有限公司",1995-08-22,,"Private, ltd by shares"309,0523537,"XIN DA ENTERPRISES DEVELOPMENT LIMITED
信達企業發展有限公司",1995-08-22,,"Private, ltd by shares"310,0523486,"XIN GUANG INVESTMENTS GROUP LIMITED
鑫光投資集團有限公司",1995-08-22,2004-07-02,"Private, ltd by shares"311,0523611,"YATA GLASS LABWARE (HONG KONG) LIMITED
亞太玻璃儀器(香港)有限公司",1995-08-22,2005-08-12,"Private, ltd by shares"312,0523533,"YING LEI GARMENT FACTORY LIMITED
凝利製衣廠有限公司",1995-08-22,2006-02-17,"Private, ltd by shares"313,0523523,"YO YO GIFTIE PROMOTE COMPANY LIMITED
又勻禮品專業股份有限公司",1995-08-22,2003-01-24,"Private, ltd by shares"314,0523509,"YOKOHAMA PROPERTY COMPANY LIMITED
橫浜不動產有限公司",1995-08-22,,"Private, ltd by shares"315,0523690,"YUAN RONG ENTERPRISES LIMITED
源龍實業有限公司",1995-08-22,2017-09-22,"Private, ltd by shares"316,0523728,"ZANG CHUAN FO JIAO NING MA PAI (XIANG GANG) HONG FA LI SHENG HUI LIMITED
藏傳佛教寧瑪派(香港)弘法利生會有限公司",1995-08-22,2010-02-19,"Ltd by guarantee"317,0523659,"ZERO DESIGN COMPANY LIMITED
思路創建有限公司",1995-08-22,2003-06-20,"Private, ltd by shares"