,Reg no.,Name,Incorp-orated,Dissolved,Type1,0744976,"ACODANGO DEVELOPMENT LIMITED
盈亨祥發開拓有限公司",2001-01-19,2006-06-02,"Private, ltd by shares"2,0744989,"ALAN COMPANY LIMITED
雅年手袋有限公司",2001-01-19,,"Private, ltd by shares"3,0745019,"ALL-IN TECHNOLOGY (H.K.) CO., LIMITED
歐盈科技股份有限公司",2001-01-19,2007-06-01,"Private, ltd by shares"4,0745088,"AMADOR INVESTMENTS LIMITED",2001-01-19,2006-06-02,"Private, ltd by shares"5,0745000,"ARCULLI AND ASSOCIATES LIMITED",2001-01-19,,"Private, ltd by shares"6,0745092,"ARTORIA ROAD AND TUNNEL LIGHTING LIMITED
萬家工程有限公司",2001-01-19,2006-06-02,"Private, ltd by shares"7,0745071,"ASIA-LINK TRADING (H.K.) LIMITED
聯亞(香港)貿易有限公司",2001-01-19,,"Private, ltd by shares"8,0745126,"ASK INFORMATION TECHNOLOGY LIMITED",2001-01-19,,"Private, ltd by shares"9,0745121,"ASSURED BRILLIANT CREDIT MANAGEMENT LIMITED
仲怡信用管理有限公司",2001-01-19,2002-11-01,"Private, ltd by shares"10,0745106,"ATLANTIC COAST OF AMERICA CORPORATION LIMITED",2001-01-19,2009-06-12,"Private, ltd by shares"11,0745041,"AV PROMOTIONS (CHINA) LIMITED
策劃推廣(中國)有限公司",2001-01-19,2017-08-25,"Private, ltd by shares"12,0744947,"BEST EARN INDUSTRIAL LIMITED
順安實業有限公司",2001-01-19,2003-04-17,"Private, ltd by shares"13,0745127,"BEST PACE INVESTMENT LIMITED (d2006-06-02)
宜駿(香港)投資有限公司",2001-01-19,2006-06-02,"Private, ltd by shares"14,0744954,"BESTER CORPORATION LIMITED (d2012-01-13)
逸亨有限公司",2001-01-19,2012-01-13,"Private, ltd by shares"15,0744952,"BESTWAY ENTERPRISES LIMITED (d2002-04-19)
萬聯企業有限公司",2001-01-19,2002-04-19,"Private, ltd by shares"16,0744946,"BILLION CHANCES INVESTMENT LIMITED
億彩投資有限公司",2001-01-19,2009-07-03,"Private, ltd by shares"17,0745050,"C T Y (H.K.) HOLDINGS LIMITED
中天盈(香港)集團有限公司",2001-01-19,2018-09-28,"Private, ltd by shares"18,0745104,"CAREER DEVELOPMENT CONSULTANCY LIMITED",2001-01-19,2002-06-14,"Private, ltd by shares"19,0745015,"CHINA LINK TRANSPORTATION COMPANY LIMITED
正揚通運有限公司",2001-01-19,,"Private, ltd by shares"20,0745130,"CHINA MERCHANTS FUTURES (HK) CO., LIMITED
招商期貨(香港)有限公司",2001-01-19,,"Private, ltd by shares"21,0744919,"CHINA SUPREME HOLDINGS LIMITED
中旋集團有限公司",2001-01-19,2005-04-29,"Private, ltd by shares"22,0744963,"CHINA YIELD INTERNATIONAL LIMITED
漢益國際有限公司",2001-01-19,2012-08-17,"Private, ltd by shares"23,0745084,"CHINESEWORKS CYBER CONCEPTS LIMITED
中華創庫動力有限公司",2001-01-19,2011-12-09,"Private, ltd by shares"24,0745102,"CHOIR INTERNATIONAL (H.K.) LIMITED
康晟貿易(香港)有限公司",2001-01-19,2020-08-28,"Private, ltd by shares"25,0745070,"CHONG NGAI DECORATION &amp; CONSTRUCTION LIMITED
創藝裝修工程有限公司",2001-01-19,2008-05-25,"Private, ltd by shares"26,0745099,"CONTEMPORARY LIVING LIMITED",2001-01-19,,"Private, ltd by shares"27,0744928,"CREATIVE PIVOT TECH AND CONSULTANTS LIMITED",2001-01-19,2002-08-30,"Private, ltd by shares"28,0744943,"CROWN FURNITURE FACTORY LIMITED
皇冠傢俬廠有限公司",2001-01-19,,"Private, ltd by shares"29,0745067,"CROWN PROSPER INTERNATIONAL LIMITED
金朝國際有限公司",2001-01-19,,"Private, ltd by shares"30,0744985,"D &amp; L INDUSTRIES CO., LIMITED
都利(香港)實業有限公司",2001-01-19,,"Private, ltd by shares"31,0745123,"D.A.D. SPORTSWEAR INTERNATIONAL LIMITED",2001-01-19,,"Private, ltd by shares"32,0744961,"DIGITAL MATRIX (ASIA) LIMITED
數位鑄型(亞洲)有限公司",2001-01-19,2014-12-19,"Private, ltd by shares"33,0744996,"DR. JOHN H. BOEY LIMITED",2001-01-19,,"Private, ltd by shares"34,0744912,"DRAGON CHANCE LIMITED (d2006-06-02)
龍鈞有限公司",2001-01-19,2006-06-02,"Private, ltd by shares"35,0744925,"DRAGON LEGEND DEVELOPMENT LIMITED
龍祥發展有限公司",2001-01-19,2015-09-11,"Private, ltd by shares"36,0744938,"DREAM HOUSE PRODUCTION LIMITED
夢想屋電影制作有限公司",2001-01-19,2002-06-14,"Private, ltd by shares"37,0745001,"E-COMSERVICE.NET LIMITED
商業服務網有限公司",2001-01-19,2006-07-21,"Private, ltd by shares"38,0745058,"EAST GATE SHIPPING LIMITED (d2013-01-25)",2001-01-19,2013-01-25,"Private, ltd by shares"39,0745075,"EASTM THERMAL INSULATING MATERIALS COMPANY LIMITED
佳興保溫材料有限公司",2001-01-19,,"Private, ltd by shares"40,0745003,"ECHROMA TECHNOLOGY LIMITED
興圖科技有限公司",2001-01-19,2003-06-06,"Private, ltd by shares"41,0744965,"ELEGANT WELL DEVELOPMENT LIMITED (d2008-06-06)
美好發展有限公司",2001-01-19,2008-06-06,"Private, ltd by shares"42,0745006,"ELITE PLACE LIMITED (HK)
文昌坊有限公司",2001-01-19,,"Private, ltd by shares"43,0745112,"ELLINGTON PRINTED CIRCUIT BOARD LIMITED
依頓線路版有限公司",2001-01-19,2015-06-12,"Private, ltd by shares"44,0745089,"EMPEROR GRAND (H.K.) INTERNATIONAL GROUP LIMITED
皇盛(香港)國際集團有限公司",2001-01-19,2006-06-02,"Private, ltd by shares"45,0744975,"ENLINK (INTERNATIONAL) ENGINEERING COMPANY LIMITED
盈萊科(國際)工程有限公司",2001-01-19,2011-06-10,"Private, ltd by shares"46,0745027,"ENVOCIS TECHNOLOGY LIMITED
安富科技有限公司",2001-01-19,2011-01-18,"Private, ltd by shares"47,0744920,"EUPOASIA ENTERPRISES LIMITED
歐亞企業有限公司",2001-01-19,2013-03-15,"Private, ltd by shares"48,0744950,"EVERYIELD INTERNATIONAL LIMITED
恒英國際有限公司",2001-01-19,2007-06-01,"Private, ltd by shares"49,0744911,"EXCELBEST CORPORATION LIMITED
維美有限公司",2001-01-19,2004-07-23,"Private, ltd by shares"50,0744913,"EXCELWIN CORPORATION LIMITED
宜穎有限公司",2001-01-19,,"Private, ltd by shares"51,0745105,"EXPRESS GARDEN (CHINA) LIMITED
勝通億源有限公司",2001-01-19,2014-06-13,"Private, ltd by shares"52,0744955,"EXPRESS WINNER LIMITED
文勝有限公司",2001-01-19,,"Private, ltd by shares"53,0745091,"F &amp; F INVESTMENT LIMITED
順安物業有限公司",2001-01-19,,"Private, ltd by shares"54,0744921,"FAITHCHOICE LIMITED
誠彩有限公司",2001-01-19,2014-01-24,"Private, ltd by shares"55,0744914,"FAITHTOP LIMITED
豐德有限公司",2001-01-19,2006-06-02,"Private, ltd by shares"56,0744949,"FORBO ENGINEERING LIMITED
科宝工程有限公司",2001-01-19,2008-12-05,"Private, ltd by shares"57,0745117,"FOREVER CLOTHING (HK) PARTY LIMITED
富樂服飾(香港)國際有限公司",2001-01-19,2016-10-28,"Private, ltd by shares"58,0744917,"FORTUNE BILLION TRADING LIMITED
金豪貿易有限公司",2001-01-19,2018-10-26,"Private, ltd by shares"59,0744983,"FORTUNE COMMUNICATIONS INTERNATIONAL LIMITED",2001-01-19,2005-08-19,"Private, ltd by shares"60,0745030,"FORTUNE INTERNATIONAL TECHNOLOGY LIMITED (d2006-06-02)
祥德國際科技有限公司",2001-01-19,2006-06-02,"Private, ltd by shares"61,0745036,"FRENCH HONG JIA (HONG KONG) INTERNATIONAL FASHION LIMITED
法國鴻嘉(香港)國際服裝有限公司",2001-01-19,2006-06-02,"Private, ltd by shares"62,0744960,"GENRX HEALTHCARE LIMITED
健力醫療保健有限公司",2001-01-19,,"Private, ltd by shares"63,0744945,"GLORY DAYS LIMITED (d2007-02-16)
金朝有限公司",2001-01-19,2007-02-16,"Private, ltd by shares"64,0744958,"GLORY DELIGHT LIMITED
濠莉有限公司",2001-01-19,,"Private, ltd by shares"65,0744935,"GOLD SUMMIT ENTERTAINMENT &amp; PRODUCTIONS LIMITED
鋆岳娛樂製作有限公司",2001-01-19,,"Private, ltd by shares"66,0744979,"GOLDLINK FASHION KNITTERS LIMITED
金鋒針織有限公司",2001-01-19,2018-09-21,"Private, ltd by shares"67,0745080,"GOOD HEALTH MARKETING INTERNATIONAL LIMITED
富健康國際營銷有限公司",2001-01-19,2007-06-01,"Private, ltd by shares"68,0745059,"GOOD SOUTH INTERNATIONAL LIMITED",2001-01-19,2013-11-01,"Private, ltd by shares"69,0744916,"GOODFAME INVESTMENT LIMITED
安恩投資有限公司",2001-01-19,,"Private, ltd by shares"70,0744910,"GOODRATE LIMITED (d2006-06-02)
潤利有限公司",2001-01-19,2006-06-02,"Private, ltd by shares"71,0745031,"GRAND FORUM LIMITED (d2007-07-06)
宏濠有限公司",2001-01-19,2007-07-06,"Private, ltd by shares"72,0745028,"GRAND GLISTER INVESTMENTS LIMITED
宏灝投資有限公司",2001-01-19,2013-03-15,"Private, ltd by shares"73,0745011,"GRAND MALL LIMITED
宏祐有限公司",2001-01-19,,"Private, ltd by shares"74,0744944,"GRANDEAST CORPORATION LIMITED
敬怡有限公司",2001-01-19,2005-08-19,"Private, ltd by shares"75,0745010,"GRANDFIT TECHNOLOGY LIMITED
宏懋科技有限公司",2001-01-19,,"Private, ltd by shares"76,0744923,"GREAT GENTLE LIMITED
風範有限公司",2001-01-19,,"Private, ltd by shares"77,0745048,"GREATLY ADVANCED COMPUTER TECHNOLOGIES CO. LIMITED
超越電腦科技有限公司",2001-01-19,2003-06-20,"Private, ltd by shares"78,0745118,"GREEN BOAT GROUP LIMITED
綠舟集團有限公司",2001-01-19,2006-06-02,"Private, ltd by shares"79,0745022,"GTECH SERVICES (HONG KONG) LIMITED
英國通用工程(香港)有限公司",2001-01-19,,"Private, ltd by shares"80,0745081,"GTT TRAVEL LIMITED
智達旅遊有限公司",2001-01-19,,"Private, ltd by shares"81,0744918,"GUARD BEST TRADING LIMITED
嘉昇貿易有限公司",2001-01-19,2006-06-02,"Private, ltd by shares"82,0744997,"H.K. FLOYEEB GARMENT LIMITED
香港弗羅依佈製衣有限公司",2001-01-19,2006-06-16,"Private, ltd by shares"83,0744998,"H.K. ZAOBANCHE GROUP GARMENT LIMITED
香港早班車集團服飾有限公司",2001-01-19,2006-06-02,"Private, ltd by shares"84,0745034,"HANG CHEONG MOTORS LIMITED
恒昌汽車有限公司",2001-01-19,,"Private, ltd by shares"85,0744922,"HARBOUR BRIGHT LIMITED (d2009-06-12)
港耀有限公司",2001-01-19,2009-06-12,"Private, ltd by shares"86,0744957,"HARBOUR CROWN LIMITED
加豐有限公司",2001-01-19,,"Private, ltd by shares"87,0744926,"HARVEST WAY ENTERPRISES LIMITED (d2008-12-24)
潤威企業有限公司",2001-01-19,2008-12-24,"Private, ltd by shares"88,0744968,"HEAD2TOE SPORTS LIMITED",2001-01-19,2010-05-28,"Private, ltd by shares"89,0744986,"HEALTH GUARD PHYSIOTHERAPY GROUP LIMITED
康衛物理治療有限公司",2001-01-19,2005-02-18,"Private, ltd by shares"90,0745103,"HEPHASE PVD COATING TECHNOLOGY CO., LIMITED
赫菲斯真空鍍膜技術有限公司",2001-01-19,2010-08-27,"Private, ltd by shares"91,0745078,"HIGH-TECH AJ HOLDING LIMITED",2001-01-19,,"Private, ltd by shares"92,0745115,"HK AOKANG LIGHTING GROUP LIMITED
香港澳康燈飾集團有限公司",2001-01-19,2006-06-02,"Private, ltd by shares"93,0744909,"HK AUS-CROCODILE DRESS (INT'L) GROUP LIMITED
香港澳洲鱷魚服飾(國際)集團有限公司",2001-01-19,2006-06-02,"Private, ltd by shares"94,0745113,"HK BAISEN GROUP LIMITED
香港百森集團有限公司",2001-01-19,2013-03-15,"Private, ltd by shares"95,0745114,"HK S. HUALIN INT'L INV. GROUP LIMITED
香港南華林國際投資集團有限公司",2001-01-19,2006-06-02,"Private, ltd by shares"96,0745116,"HK YINGMAIJIE LEATHER DRESS LIMITED
香港英邁杰皮具服飾有限公司",2001-01-19,2008-06-06,"Private, ltd by shares"97,0745072,"HKSTC MET (HONG KONG) LIMITED
美國產品認證(香港)有限公司",2001-01-19,2010-02-05,"Private, ltd by shares"98,0744934,"HOLYLAND FINANCE LIMITED",2001-01-19,2006-06-02,"Private, ltd by shares"99,0744953,"HOMFAIR ENTERPRISES LIMITED
豪暉企業有限公司",2001-01-19,2003-12-19,"Private, ltd by shares"100,0744915,"HONEST FAITH CORPORATION LIMITED
浩威行有限公司",2001-01-19,2014-01-24,"Private, ltd by shares"101,0744967,"HONG JI GROUP (H.K.) INDUSTRIAL DEVELOPMENT COMPANY LIMITED
宏基集團(香港)實業發展有限公司",2001-01-19,,"Private, ltd by shares"102,0744969,"HONG KONG AODIN FOOD INTERNATIONAL LIMITED
香港奧登食品國際有限公司",2001-01-19,2013-03-15,"Private, ltd by shares"103,0744940,"HONG KONG INTERNATIONAL GOLD HEAD WESTERN DRESS LIMITED
香港國際金選洋服有限公司",2001-01-19,2006-06-02,"Private, ltd by shares"104,0745074,"HONG KONG OVERSEAS (INTERNATIONAL) GROUP, LIMITED (THE)
香港僑資(國際)集團有限公司",2001-01-19,,"Private, ltd by shares"105,0745066,"HONG KONG PHOENIX SATELLITE TELEVISION LIMITED
香港鳳凰衛視有限公司",2001-01-19,,"Private, ltd by shares"106,0745097,"HONG KONG SAI SHING FASHION LIMITED
香港世盛服飾有限公司",2001-01-19,2006-06-02,"Private, ltd by shares"107,0745093,"HONG KONG STAGE PRODUCTION LIMITED
香港舞臺製作有限公司",2001-01-19,2006-06-02,"Private, ltd by shares"108,0744993,"HONGKONG HANNER TECH-TRADE LIMITED
香港華諾技術貿易有限公司",2001-01-19,,"Private, ltd by shares"109,0745023,"HUNG FAI TRANSPORTATION &amp; TRADING LIMITED
雄輝中港貨運貿易有限公司",2001-01-19,2009-01-02,"Private, ltd by shares"110,0744974,"HYGIENE AND APPEARANCE SERVICES LIMITED
環衛系統服務有限公司",2001-01-19,2003-11-14,"Private, ltd by shares"111,0744971,"I-CHING DHARMA TRANSLATION CENTRE LIMITED
義淨譯經中心有限公司",2001-01-19,2015-05-08,"Ltd by guarantee"112,0744927,"IBES (NORTH ASIA) LIMITED",2001-01-19,2002-07-12,"Private, ltd by shares"113,0744939,"INTERNATIONAL JOURNAL OF ENGINEERING EDUCATION THEORY AND PRACTICE EDITORIAL AND PUBLISHING CO., LIMITED
國際工程教育理論與實踐雜志編輯出版有限公司",2001-01-19,2007-06-01,"Private, ltd by shares"114,0745063,"INTERTAINER HONG KONG LIMITED",2001-01-19,2006-09-29,"Private, ltd by shares"115,0745119,"ITALY SAINT ROLAND (HK) DRESS LIMITED
意大利聖羅蘭(香港)服飾有限公司",2001-01-19,2006-06-02,"Private, ltd by shares"116,0745040,"J-SPARATO COMPANY LIMITED",2001-01-19,2012-12-21,"Private, ltd by shares"117,0745047,"JB CENTURY RESOURCES LIMITED
卓智世紀資源有限公司",2001-01-19,,"Private, ltd by shares"118,0745024,"JET FENG ENTERPRISES LIMITED
捷特豐企業有限公司",2001-01-19,2005-04-08,"Private, ltd by shares"119,0745085,"JOLLY KING BAR AND KARAOKE LIMITED",2001-01-19,2010-06-11,"Private, ltd by shares"120,0745018,"KA BO (LAI YIU) RESTAURANT COMPANY LIMITED
嘉寶(麗瑤)酒家有限公司",2001-01-19,2016-08-01,"Private, ltd by shares"121,0745068,"KENNETH TO &amp; ASSOCIATES LIMITED
杜立基規劃顧問有限公司",2001-01-19,,"Private, ltd by shares"122,0745095,"KENSON SECRETARIAL SERVICES LIMITED",2001-01-19,,"Private, ltd by shares"123,0745077,"KINGSAN CONSTRUCTION AND ENGINEERING COMPANY LIMITED
景新創建工程有限公司",2001-01-19,,"Private, ltd by shares"124,0744984,"KNOWLEDGE PARTNERS ASIA LIMITED
艾力亞洲有限公司",2001-01-19,2003-05-16,"Private, ltd by shares"125,0745021,"KOLARA INDUSTRIAL LIMITED
高能工業有限公司",2001-01-19,,"Private, ltd by shares"126,0744929,"KWONG FAT CONSTRUCTION &amp; ENGINEERING LIMITED
廣發建設工程有限公司",2001-01-19,2002-08-02,"Private, ltd by shares"127,0745096,"LALIQUE ASIA LIMITED
萊儷亞洲有限公司",2001-01-19,,"Private, ltd by shares"128,0745039,"LANDSYNC PACIFIC DEVELOPMENT LIMITED
聯星房地產開發有限公司",2001-01-19,2003-11-14,"Private, ltd by shares"129,0744959,"LEO LIGHTING LIMITED",2001-01-19,,"Private, ltd by shares"130,0744980,"LEUNG KAI ENGINEERING COMPANY LIMITED
梁佳工程有限公司",2001-01-19,,"Private, ltd by shares"131,0745110,"LIFE ENHANCEMENT GROUP LIMITED
生命拓展集團有限公司",2001-01-19,2004-08-27,"Private, ltd by shares"132,0745032,"LOVE DIAMOND COMPANY LIMITED (THE)",2001-01-19,2016-07-29,"Private, ltd by shares"133,0745035,"LUCKY STAR BUILDING MATERIAL LIMITED
天祐建材有限公司",2001-01-19,,"Private, ltd by shares"134,0744908,"LUEN WAH MACHINE WELDING &amp; IRON WORKS COMPANY LIMITED
聯華機器風電釬鉄工廠有限公司",2001-01-19,,"Private, ltd by shares"135,0745101,"MAGNA LIMITED (d2002-07-05)
墨航有限公司",2001-01-19,2002-07-05,"Private, ltd by shares"136,0745124,"MAIN SUPER ENTERPRISES CO., LIMITED
華寶電子科技有限公司",2001-01-19,2014-05-09,"Private, ltd by shares"137,0744924,"MAISON CORPORATION LIMITED
美新行有限公司",2001-01-19,,"Private, ltd by shares"138,0744972,"MAITEBAO INT'L GROUP (H K) LIMITED
麥特寶國際集團(香港)有限公司",2001-01-19,2006-06-02,"Private, ltd by shares"139,0745060,"Marlow Limited (HK)",2001-01-19,,"Private, ltd by shares"140,0745005,"MATCH MAKER.COM LIMITED
網情諮詢服務有限公司",2001-01-19,2007-06-01,"Private, ltd by shares"141,0744988,"MEI-XIN (INTERNATIONAL) LIMITED
美心(國際)有限公司",2001-01-19,,"Private, ltd by shares"142,0745038,"MING WAI STEEL ENGINEERING LIMITED
明偉鋼鐵工程有限公司",2001-01-19,2015-12-24,"Private, ltd by shares"143,0745100,"MINI-MEDICA TECHNOLOGY LIMITED
微創醫療科技有限公司",2001-01-19,2004-06-25,"Private, ltd by shares"144,0745079,"MITRON (HONG KONG) LIMITED
微創(香港)有限公司",2001-01-19,,"Private, ltd by shares"145,0744931,"MORISAN CONSULTANCY LIMITED",2001-01-19,2002-07-05,"Private, ltd by shares"146,0745073,"MYOUTPUTBOX GRAPHIC ARTS LIMITED
合壹彩色輸出有限公司",2001-01-19,2015-09-25,"Private, ltd by shares"147,0744995,"NEW IDEA (H.K.) INTERNATIONAL DRESS LIMITED
新思路(香港)國際時裝有限公司",2001-01-19,2008-06-06,"Private, ltd by shares"148,0745051,"NEW TECH MOTOR ENGINEERING LIMITED
新力機械有限公司",2001-01-19,,"Private, ltd by shares"149,0745087,"NEWS CLEANING SERVICES COMPANY LIMITED
新生清潔服務有限公司",2001-01-19,,"Private, ltd by shares"150,0745111,"NIXETY TECHNOLOGY (HK) DEVELOPMENT LIMITED
樂思科技(香港)發展有限公司",2001-01-19,2003-12-12,"Private, ltd by shares"151,0745064,"NY APPLE LIMITED",2001-01-19,,"Private, ltd by shares"152,0744932,"OP-TECH PHOENIX COMPANY LIMITED
光電鳳凰有限公司",2001-01-19,2002-08-30,"Private, ltd by shares"153,0744936,"ORIENT POWER SERVICES LIMITED",2001-01-19,,"Private, ltd by shares"154,0745069,"ORIENTAL RESOURCES (H. K.) LIMITED
東方資源(香港)有限公司",2001-01-19,2009-05-22,"Private, ltd by shares"155,0745076,"ORIGIN MULTIMEDIA COMMUNICATION COMPANY LIMITED
長安源多媒體傳播有限公司",2001-01-19,2008-08-01,"Private, ltd by shares"156,0745125,"PACIFIC INTELLIGENCE CONSULTANCY LIMITED
鋒域顧問有限公司",2001-01-19,2004-06-25,"Private, ltd by shares"157,0745131,"PEAKTOP TECHNOLOGIES (USA) HONG KONG LIMITED",2001-01-19,2009-07-17,"Private, ltd by shares"158,0745053,"PEOPLE (OFFICE SUPPLIES) LIMITED",2001-01-19,2009-08-14,"Private, ltd by shares"159,0744933,"PEPHARM R &amp; D LIMITED
百泰醫藥科技開發有限公司",2001-01-19,,"Private, ltd by shares"160,0745109,"PO TAI LUNG BUILDING SUPPLIES COMPANY LIMITED
寶泰隆建築材料有限公司",2001-01-19,,"Private, ltd by shares"161,0745017,"PORTOLA (ASIA PACIFIC) HOLDING COMPANY LIMITED",2001-01-19,,"Private, ltd by shares"162,0744992,"POWELL TECHNOLOGY ENGINEERING CO., LIMITED (d2005-09-23)
華電技術工程有限公司",2001-01-19,2005-09-23,"Private, ltd by shares"163,0745026,"POWER MEMORY TECHNOLOGY LIMITED
祥登科技股份有限公司",2001-01-19,2010-08-13,"Private, ltd by shares"164,0745098,"POWER PROJECT CONSTRUCTION MATERIAL COMPANY LIMITED
動力工程建築材料有限公司",2001-01-19,,"Private, ltd by shares"165,0745049,"PSI CONSULTING PTY LIMITED",2001-01-19,2011-01-07,"Private, ltd by shares"166,0745122,"PST WORLDWIDE LIMITED",2001-01-19,,"Private, ltd by shares"167,0745025,"QCOM LIMITED (d2003-06-27)",2001-01-19,2003-06-27,"Private, ltd by shares"168,0745029,"QX MOTOR CO., LIMITED
全新機電馬達有限公司",2001-01-19,,"Private, ltd by shares"169,0745090,"RAMTEC SEMICONDUCTOR LIMITED
安捷科技(香港)有限公司",2001-01-19,2002-10-11,"Private, ltd by shares"170,0745082,"RED CASTLE INDUSTRIES LIMITED
紅城堡工業有限公司",2001-01-19,,"Private, ltd by shares"171,0745129,"REGTIME.NET LIMITED",2001-01-19,2006-06-02,"Private, ltd by shares"172,0744970,"RESTAURATEUR LIMITED
利豐堂管理顧問有限公司",2001-01-19,2016-09-09,"Private, ltd by shares"173,0745016,"RICHLAND BAGS &amp; ACCESSORIES COMPANY LIMITED
裕基手袋禮品有限公司",2001-01-19,,"Private, ltd by shares"174,0745045,"RIKOU (HK) PTE. LIMITED
銳峰國際商業顧問有限公司",2001-01-19,2006-02-03,"Private, ltd by shares"175,0745004,"ROCKFORD INVESTMENT LIMITED",2001-01-19,2005-06-30,"Private, ltd by shares"176,0745062,"RSM SALUSTRO H.K. COMPANY LIMITED",2001-01-19,2008-03-14,"Private, ltd by shares"177,0745007,"S. D. SERVICES LIMITED
三得服務有限公司",2001-01-19,,"Private, ltd by shares"178,0744987,"SAGITTARIUS LIFE SCIENCE CORP., LIMITED
育驊堂生化科技有限公司",2001-01-19,2005-11-16,"Private, ltd by shares"179,0745002,"SCIENTIFIC &amp; EDUCATIONAL PRESS LIMITED
科教出版有限公司",2001-01-19,2008-06-20,"Private, ltd by shares"180,0745008,"SHARP SKY ENGINEERING CO., LIMITED
盛天機電有限公司",2001-01-19,,"Private, ltd by shares"181,0745128,"SHENZHEN ETERNAL EAST TOURIST COACH SERVICE CO. LIMITED
深圳永東旅游汽車服務有限公司",2001-01-19,,"Private, ltd by shares"182,0745037,"SHING HING METAL WARE (HK) COMPANY LIMITED
誠興五金製品(香港)有限公司",2001-01-19,2009-03-20,"Private, ltd by shares"183,0745054,"SILENTNIGHT (HK) LIMITED
平安夜(香港)有限公司",2001-01-19,,"Private, ltd by shares"184,0745055,"SILVER LINING APPAREL LIMITED",2001-01-19,2007-06-01,"Private, ltd by shares"185,0744942,"SINO SKY SUN INTERNATIONAL CO., LIMITED
華天陽國際有限公司",2001-01-19,,"Private, ltd by shares"186,0744966,"SMART FORTUNE ENGINEERING COMPANY LIMITED
盈進工程有限公司",2001-01-19,2003-08-22,"Private, ltd by shares"187,0745056,"SMARTGAS ENVIRONMENTAL AUTOMOBILE COMPANY LIMITED
思馬燃氣環保汽車有限公司",2001-01-19,2003-11-28,"Private, ltd by shares"188,0745014,"SONG YING (H.K.) INTERNATIONAL FASHION CO., LIMITED
松鷹(香港)國際服裝服飾有限公司",2001-01-19,2006-06-02,"Private, ltd by shares"189,0744937,"SUN MAU ELECTRONIC TECHNOLOGY CO., LIMITED
薪茂電子科技有限公司",2001-01-19,2006-06-02,"Private, ltd by shares"190,0745094,"SUNSHINE JEWELLERY HOLDINGS LIMITED
陽光珠寶集團有限公司",2001-01-19,2009-08-28,"Private, ltd by shares"191,0745046,"SUPER FORCE INDUSTRIAL COMPANY LIMITED
超毅實業有限公司",2001-01-19,2012-03-09,"Private, ltd by shares"192,0744964,"SUPER TREASURE INTERNATIONAL LIMITED
寶陞國際有限公司",2001-01-19,2015-09-25,"Private, ltd by shares"193,0745013,"T.K.K. (H.K.) CO., LIMITED",2001-01-19,,"Private, ltd by shares"194,0745086,"TAI FUNG INTERNATIONAL LIMITED
泰豐國際貿易有限公司",2001-01-19,,"Private, ltd by shares"195,0745009,"TECHMOTOR LIMITED",2001-01-19,2003-01-03,"Private, ltd by shares"196,0745061,"TIGER POOLS ASIA, LIMITED",2001-01-19,2006-06-02,"Private, ltd by shares"197,0745012,"TLMC LIMITED",2001-01-19,2005-01-14,"Private, ltd by shares"198,0745065,"TOPCAT NETWORKS LIMITED
傑思系統有限公司",2001-01-19,,"Private, ltd by shares"199,0744956,"TOPRICE LIMITED
德升有限公司",2001-01-19,,"Private, ltd by shares"200,0744977,"TOPTEAM CORPORATION LIMITED
高聯有限公司",2001-01-19,2006-10-27,"Private, ltd by shares"201,0745120,"TOYOSHIMA TECHNOLOGY LIMITED
東島科技有限公司",2001-01-19,2005-01-14,"Private, ltd by shares"202,0745042,"TRACY ENTERPRISES LIMITED
卓絲企業有限公司",2001-01-19,2014-10-03,"Private, ltd by shares"203,0744981,"TRANSWAYS LOGISTICS INTERNATIONAL (HK) LIMITED
捷威聯運國際有限公司",2001-01-19,,"Private, ltd by shares"204,0745052,"TRUSTFUL SAFETY CONSULTANCY LIMITED
聯通顧問有限公司",2001-01-19,,"Private, ltd by shares"205,0745057,"ULTIMATE BEST LIMITED (d2006-06-02)",2001-01-19,2006-06-02,"Private, ltd by shares"206,0744948,"VANTAGE PROFIT HONG KONG LIMITED
匯利香港有限公司",2001-01-19,2007-06-01,"Private, ltd by shares"207,0744978,"VERYFUN NOVELTY LIMITED
華趣實業有限公司",2001-01-19,,"Private, ltd by shares"208,0744982,"VINCENT INDUSTRIAL (HONG KONG) LIMITED
宏信實業(香港)有限公司",2001-01-19,2012-01-13,"Private, ltd by shares"209,0744941,"WAI KIT ENGINEERING COMPANY LIMITED
偉傑工程有限公司",2001-01-19,,"Private, ltd by shares"210,0745033,"WAI SHING FIRE SERVICES ENGINEERING LIMITED
偉誠消防工程有限公司",2001-01-19,,"Private, ltd by shares"211,0745044,"WAIDY INDUSTRIAL ENGINEERING COMPANY LIMITED
偉迪實業工程有限公司",2001-01-19,2006-06-02,"Private, ltd by shares"212,0745043,"WAKASA OVERSEAS LIMITED
駿業海外有限公司",2001-01-19,2009-06-12,"Private, ltd by shares"213,0744962,"WEALTHY JADE LIMITED
裕晉有限公司",2001-01-19,,"Private, ltd by shares"214,0744999,"WELL SCENE TRADING &amp; CONSULTANCY CO., LIMITED
榮欣貿易顧問有限公司",2001-01-19,2009-10-09,"Private, ltd by shares"215,0744990,"WINNING CHEMICALS COMPANY LIMITED
滙興化工有限公司",2001-01-19,2003-06-27,"Private, ltd by shares"216,0744951,"WORLD EXPO DEVELOPMENT LIMITED
匯展發展有限公司",2001-01-19,,"Private, ltd by shares"217,0744930,"XIN HONG (HONG KONG) LIMITED (d2006-05-19)
欣宏(香港)有限公司",2001-01-19,2006-05-19,"Private, ltd by shares"218,0744991,"XINGLONG CORPORATION LIMITED
興隆股份有限公司",2001-01-19,2002-05-31,"Private, ltd by shares"219,0744994,"YING SHING FASHION JEWELRY COMPANY LIMITED
盈欣企業有限公司",2001-01-19,,"Private, ltd by shares"220,0745083,"YIU &amp; FONG COMPANY LIMITED
如鏡坊有限公司",2001-01-19,,"Private, ltd by shares"221,0745108,"YU CHEONG KNITTING (OVERSEAS) LIMITED
裕昌織造(海外)有限公司",2001-01-19,2019-01-11,"Private, ltd by shares"222,0745020,"ZHONG YOU (CHINA) DESIGN COMPANY LIMITED
中游(中國)設計工程有限公司",2001-01-19,2004-06-25,"Private, ltd by shares"223,0745107,"ZMIE SUNRISE COMPANY LIMITED
瑞明工業有限公司",2001-01-19,2007-07-13,"Private, ltd by shares"