,Reg no.,Name,Incorp-orated,Dissolved,Type1,0122248,"A-TRON ELECTRONICS COMPANY LIMITED
益昌電子有限公司",1983-03-08,2004-04-08,"Private, ltd by shares"2,0122267,"AANDATTA (H.K.) LIMITED
允恒有限公司",1983-03-08,1996-08-09,"Private, ltd by shares"3,0122283,"AIR LINKS TRAVEL AGENCY LIMITED",1983-03-08,1989-09-13,"Private, ltd by shares"4,0122241,"ALKEMAL HOLDINGS LIMITED",1983-03-08,1993-02-26,"Private, ltd by shares"5,0122253,"ALSEAN (PACIFIC) LIMITED
亞細安(太平洋)有限公司",1983-03-08,1996-06-28,"Private, ltd by shares"6,0122260,"ANSTEY INVESTMENTS LIMITED",1983-03-08,1987-09-25,"Private, ltd by shares"7,0122199,"ART FIELD DESIGNING &amp; PRINTING COMPANY LIMITED
雅富設計印務有限公司",1983-03-08,1998-09-25,"Private, ltd by shares"8,0122216,"ASIAN DRAGON LIMITED (d1992-11-21)
東亞龍騰有限公司",1983-03-08,1992-11-21,"Private, ltd by shares"9,0122218,"ASIAN STEP COMPANY LIMITED
東亞先驅有限公司",1983-03-08,1996-08-02,"Private, ltd by shares"10,0122251,"BELMONT TRAVEL SERVICE LIMITED",1983-03-08,1996-07-05,"Private, ltd by shares"11,0122247,"BEST LION COMPANY LIMITED
百事靈有限公司",1983-03-08,1998-09-25,"Private, ltd by shares"12,0122245,"BEST WARM COMPANY LIMITED
保盛運有限公司",1983-03-08,1996-07-05,"Private, ltd by shares"13,0122255,"BILLION SURPLUS LIMITED
憶富有限公司",1983-03-08,,"Private, ltd by shares"14,0122290,"BOLSENA LIMITED (d1992-02-28)",1983-03-08,1992-02-28,"Private, ltd by shares"15,0122262,"BONAFIT COMPANY LIMITED
敦富企業有限公司",1983-03-08,1997-03-21,"Private, ltd by shares"16,0122239,"BRANDWAG LIMITED (d1998-09-25)",1983-03-08,1998-09-25,"Private, ltd by shares"17,0122243,"BROOKS BROTHERS FAR EAST LIMITED",1983-03-08,,"Private, ltd by shares"18,0122270,"C-FIN LIMITED",1983-03-08,1993-11-03,"Private, ltd by shares"19,0122291,"CALDY LIMITED (d1996-07-19)",1983-03-08,1996-07-19,"Private, ltd by shares"20,0122215,"CASUI INDUSTRIAL COMPANY LIMITED
啟瑞實業有限公司",1983-03-08,2002-12-20,"Private, ltd by shares"21,0122292,"CATFORD LIMITED (d2007-07-20)",1983-03-08,2007-07-20,"Private, ltd by shares"22,0122265,"CENTRAY RESOURCES LIMITED
中景外貿有限公司",1983-03-08,2005-09-23,"Private, ltd by shares"23,0122273,"CHAMP FAIR MANUFACTORY COMPANY LIMITED
祥輝製品有限公司",1983-03-08,,"Private, ltd by shares"24,0122258,"CHATSFORD TRADING LIMITED",1983-03-08,1987-11-06,"Private, ltd by shares"25,0122229,"CHINEDEN MACHINERY AND EQUIPMENT COMPANY LIMITED",1983-03-08,2002-02-01,"Private, ltd by shares"26,0122257,"CHO YANG (HONG KONG) COMPANY LIMITED
朝陽(香港)有限公司",1983-03-08,2012-05-03,"Private, ltd by shares"27,0122219,"CHOI'S SECRETARIES LIMITED
蔡氏秘書事務有限公司",1983-03-08,,"Private, ltd by shares"28,0122272,"COMFIN CONSULTANTS LIMITED",1983-03-08,1988-12-24,"Private, ltd by shares"29,0122286,"COMMERCIAL FOUNDERS COMPANY LIMITED
泛達商業有限公司",1983-03-08,1996-07-19,"Private, ltd by shares"30,0122289,"CORBY LIMITED (d1999-02-12)",1983-03-08,1999-02-12,"Private, ltd by shares"31,0122288,"CORNBRIDGE LIMITED (d1993-06-25)",1983-03-08,1993-06-25,"Private, ltd by shares"32,0122228,"COSMOTEC PRECISION INDUSTRIAL LIMITED
寰宇精準工業有限公司",1983-03-08,2014-11-14,"Private, ltd by shares"33,0122220,"CUSTODIAN NOMINEES LIMITED (HK)
保管代理有限公司",1983-03-08,,"Private, ltd by shares"34,0122203,"DADICO INTERNATIONAL PRODUCTION TECHNOLOGY LIMITED",1983-03-08,1996-09-27,"Private, ltd by shares"35,0122256,"DEEMO INTERNATIONAL LIMITED",1983-03-08,2004-08-04,"Private, ltd by shares"36,0122208,"DIGITAL IMAGE CONVERSION COMPANY LIMITED",1983-03-08,1997-10-09,"Private, ltd by shares"37,0122205,"DIGITAL IMAGE TRANSFORM COMPANY LIMITED",1983-03-08,,"Private, ltd by shares"38,0122209,"DIGITAL VIDEO (ACE) COMPANY LIMITED",1983-03-08,1997-10-24,"Private, ltd by shares"39,0122214,"EIGHT-THREE COMPANY LIMITED
捌叁有限公司",1983-03-08,2018-07-06,"Private, ltd by shares"40,0122200,"FENWAY LIMITED (d1998-12-22)",1983-03-08,1998-12-22,"Private, ltd by shares"41,0122281,"FORE TARGET LIMITED
京邦有限公司",1983-03-08,2004-01-02,"Private, ltd by shares"42,0122206,"FULL ENTERTAINMENT COMPANY LIMITED",1983-03-08,,"Private, ltd by shares"43,0122279,"GEOMANAGEMENT LIMITED",1983-03-08,1996-07-19,"Private, ltd by shares"44,0122246,"GOOD TASTE RESTAURANT LIMITED (d1996-07-19)
豐味小厨有限公司",1983-03-08,1996-07-19,"Private, ltd by shares"45,0122196,"HAPIGUYS RENDEZVOUS LIMITED
佳仕廊有限公司",1983-03-08,1993-01-18,"Private, ltd by shares"46,0122274,"HIDY ELECTRONICS LIMITED",1983-03-08,1998-09-25,"Private, ltd by shares"47,0122264,"HIGGINS INVESTMENT LIMITED",1983-03-08,1994-06-22,"Private, ltd by shares"48,0122284,"HIMMAH INTERNATIONAL LIMITED",1983-03-08,1996-07-19,"Private, ltd by shares"49,0122233,"HMA SECURITY LIMITED
傑高護衛有限公司",1983-03-08,2007-10-05,"Private, ltd by shares"50,0122295,"HONDA INTERNATIONAL LIMITED (d1996-05-12)
漢達國際有限公司",1983-03-08,1996-05-12,"Private, ltd by shares"51,0122193,"HONG KONG PACKAGING INSTITUTE LIMITED (THE)
香港包裝專業協會有限公司",1983-03-08,2009-12-11,"Ltd by guarantee"52,0122250,"HONG KONG TONG KEE ENTERPRISES LIMITED
香港棠記企業有限公司",1983-03-08,1996-07-19,"Private, ltd by shares"53,0122240,"HONGKEW TRADE EXCHANGE LIMITED
公和祥相對貿易有限公司",1983-03-08,1995-11-17,"Private, ltd by shares"54,0122232,"HOUSING INTERNATIONAL LIMITED (d1996-08-02)
屋宇國際有限公司",1983-03-08,1996-08-02,"Private, ltd by shares"55,0122238,"HUME GAS CYLINDERS LIMITED",1983-03-08,1995-11-17,"Private, ltd by shares"56,0122207,"IMAGE CONVERSION COMPANY LIMITED",1983-03-08,1997-11-21,"Private, ltd by shares"57,0122210,"IMAGE TRANSFORM COMPANY LIMITED",1983-03-08,1997-10-09,"Private, ltd by shares"58,0122221,"JOHN WARD &amp; SONS (FAR EAST) LIMITED",1983-03-08,1996-07-19,"Private, ltd by shares"59,0122212,"JOHNSON MATTHEY HONG KONG LIMITED
莊信萬豐貴金屬香港有限公司",1983-03-08,,"Private, ltd by shares"60,0122213,"JOHNSON MATTHEY PACIFIC LIMITED
莊信萬豐太平洋有限公司",1983-03-08,,"Private, ltd by shares"61,0122211,"JONESFORD LIMITED
中福有限公司",1983-03-08,1984-11-24,"Private, ltd by shares"62,0122244,"JOY YARD COMPANY LIMITED
聚億有限公司",1983-03-08,1989-03-16,"Private, ltd by shares"63,0122226,"KAI SHING CHEMICALS LIMITED
啟成工業原料有限公司",1983-03-08,2007-09-18,"Private, ltd by shares"64,0122285,"KATHOON COMPANY LIMITED",1983-03-08,2000-10-27,"Private, ltd by shares"65,0122282,"KEENMARK COMPANY LIMITED
活發有限公司",1983-03-08,1996-07-19,"Private, ltd by shares"66,0122223,"KESTRONICS (HONG KONG) LIMITED
科創立(香港)有限公司",1983-03-08,2009-08-07,"Private, ltd by shares"67,0122294,"KWAN CHI KINDERGARTEN LIMITED
坤慈幼稚園有限公司",1983-03-08,,"Private, ltd by shares"68,0122224,"LAP MING INTERNATIONAL TRAVEL SERVICE LIMITED
立明國際旅行社有限公司",1983-03-08,,"Private, ltd by shares"69,0122235,"LYMTON LIMITED (d1989-09-03)",1983-03-08,1989-09-03,"Private, ltd by shares"70,0122278,"LYRICA TRADING LIMITED",1983-03-08,1995-12-22,"Private, ltd by shares"71,0122269,"MANSON CHAN &amp; COMPANY LIMITED
文信貿易行有限公司",1983-03-08,,"Private, ltd by shares"72,0122254,"MARKTRADE INTERNATIONAL LIMITED",1983-03-08,1996-07-05,"Private, ltd by shares"73,0122261,"MAYWOOD TIMBER COMPANY LIMITED
美屋木業有限公司",1983-03-08,,"Private, ltd by shares"74,0122287,"MEDIAN INTERNATIONAL LIMITED",1983-03-08,1987-12-23,"Private, ltd by shares"75,0122234,"MEDITRADE S.E.A. LIMITED",1983-03-08,1996-08-02,"Private, ltd by shares"76,0122236,"Ming De International Holding Group Co., Limited
明德國際控股集團有限公司",1983-03-08,,"Private, ltd by shares"77,0122201,"NASTASSIA INVESTMENT LIMITED",1983-03-08,1996-10-25,"Private, ltd by shares"78,0122225,"NBE INDUSTRIAL COMPANY LIMITED (d2005-12-16)
北大電機工業有限公司",1983-03-08,2005-12-16,"Private, ltd by shares"79,0122242,"PERFECT SEAFREIGHT (HONG KONG) LIMITED
寶發海運有限公司",1983-03-08,1998-09-25,"Private, ltd by shares"80,0122230,"PHAIK CHING COMPANY LIMITED
碧澄有限公司",1983-03-08,2018-09-07,"Private, ltd by shares"81,0122249,"PING KONG TRADING COMPANY LIMITED
炳光貿易有限公司",1983-03-08,2010-07-23,"Private, ltd by shares"82,0122252,"PRINCE CLADDING FAR EAST LIMITED",1983-03-08,1997-09-19,"Private, ltd by shares"83,0122192,"QUEEN MARY COLLEGE HONG KONG GRADUATES ASSOCIATION LIMITED",1983-03-08,1996-09-27,"Ltd by guarantee"84,0122280,"QUEEN SMART LIMITED
冠域有限公司",1983-03-08,1996-07-19,"Private, ltd by shares"85,0122227,"RITA RIGHT (H.K.) LIMITED
新美栢實業有限公司",1983-03-08,1996-07-19,"Private, ltd by shares"86,0122293,"ROBAR SERVICES LIMITED",1983-03-08,1998-09-25,"Private, ltd by shares"87,0122276,"RODINGS LIMITED",1983-03-08,1996-10-23,"Private, ltd by shares"88,0122237,"RONDEHOF LIMITED",1983-03-08,1998-06-05,"Private, ltd by shares"89,0122263,"SILVER DON ENTERPRISES LIMITED
銀敦企業有限公司",1983-03-08,1996-07-05,"Private, ltd by shares"90,0122266,"SPARKEEN LIMITED
栢堅食品貿易有限公司",1983-03-08,1996-07-05,"Private, ltd by shares"91,0122275,"ST. LOUIS STUDENTS' SERVICING CENTRE LIMITED
聖類斯學生輔導中心有限公司",1983-03-08,1991-10-31,"Private, ltd by shares"92,0122198,"TAT FUNG ELECTRICAL COMPANY LIMITED
達峰電業有限公司",1983-03-08,1996-07-26,"Private, ltd by shares"93,0122259,"TECHNORIENT LIMITED
勵安有限公司",1983-03-08,,"Private, ltd by shares"94,0122231,"TELE TOP COMPANY LIMITED",1983-03-08,2004-01-02,"Private, ltd by shares"95,0122204,"TO-DAY'S VIDEO COMPANY LIMITED",1983-03-08,,"Private, ltd by shares"96,0122277,"TORA INDUSTRIES LIMITED",1983-03-08,1996-07-05,"Private, ltd by shares"97,0122197,"U-TECH LIMITED (d1996-11-22)
友德企業有限公司",1983-03-08,1996-11-22,"Private, ltd by shares"98,0122222,"WAYCOTT ENTERPRISE LIMITED",1983-03-08,1997-10-26,"Private, ltd by shares"99,0122268,"WELLOT LIMITED
允沛有限公司",1983-03-08,2002-02-08,"Private, ltd by shares"100,0122195,"WENCE ENTERPRISE LIMITED (d1987-06-26)
永樹企業有限公司",1983-03-08,1987-06-26,"Private, ltd by shares"101,0122271,"WINDHOVER LIMITED (d1996-07-05)
雲賀有限公司",1983-03-08,1996-07-05,"Private, ltd by shares"102,0122194,"WORLD OF THE CAROLINER ROOTERS, LIMITED (THE)
香港少林寺球迷天地有限公司",1983-03-08,1996-11-01,"Ltd by guarantee"103,0122217,"YAU FOOK FOOD PRODUCTS LIMITED
友福食品有限公司",1983-03-08,1999-03-16,"Private, ltd by shares"104,0122202,"ZAVADA LIMITED",1983-03-08,1996-10-25,"Private, ltd by shares"