,Reg no.,Name,Incorp-orated,Dissolved,Type434,0941441,"POON CHEUNG GEI SOUTH-PACIFIC FOOD (HONG KONG) LIMITED
潘祥記南洋食品(香港)有限公司",2004-12-22,2009-05-22,"Private, ltd by shares"435,0941555,"PORTA-BOTE ASIA LIMITED
波特寶亞洲有限公司",2004-12-22,,"Private, ltd by shares"436,0941585,"POSH ELECTRONIC TECHNOLOGY COMPANY LIMITED
寶仕電子科技有限公司",2004-12-22,2017-06-30,"Private, ltd by shares"437,0941436,"POWER CONSTRUCTION &amp; ENGINEERING LIMITED
強力建築工程有限公司",2004-12-22,,"Private, ltd by shares"438,0941742,"POWER ETERNAL LIMITED
力恒有限公司",2004-12-22,,"Private, ltd by shares"439,0941771,"POWER FAMOUS INTERNATIONAL LIMITED (d2006-11-24)
威名國際有限公司",2004-12-22,2006-11-24,"Private, ltd by shares"440,0941442,"PRO GENERATION ENGINEERING CO LIMITED
創發建工程有限公司",2004-12-22,2009-06-05,"Private, ltd by shares"441,0941469,"PROACTIVE MEDICARE (XIAMEN) COMPANY LIMITED
香港保康動力(廈門)有限公司",2004-12-22,2012-10-19,"Private, ltd by shares"442,0941354,"PROFILE GROUP (HK) LIMITED (THE)",2004-12-22,,"Private, ltd by shares"443,0941772,"PROFIT WISDOM INTERNATIONAL LIMITED
惠利國際有限公司",2004-12-22,,"Private, ltd by shares"444,0941357,"PROFUSE INVESTMENTS LIMITED",2004-12-22,2011-04-08,"Private, ltd by shares"445,0941411,"PRONTERA INTERNATIONAL LIMITED",2004-12-22,2018-08-24,"Private, ltd by shares"446,0941567,"PW HOLDING (HK) LIMITED",2004-12-22,2008-04-11,"Private, ltd by shares"447,0941612,"QUEBEC INTERNATIONAL LIMITED",2004-12-22,2020-10-23,"Private, ltd by shares"448,0941617,"RACING CHAMP EXHIBITIONS (HK) LIMITED
偉加展覽(香港)有限公司",2004-12-22,,"Private, ltd by shares"449,0941413,"RADIATION (CHINA) LIMITED
輻照(中國)集團有限公司",2004-12-22,2010-05-20,"Private, ltd by shares"450,0941620,"RAFFLES TRADING LIMITED (d2014-01-24)
萊佛士貿易有限公司",2004-12-22,2014-01-24,"Private, ltd by shares"451,0941635,"REDSUN INTERNATIONAL GROUP LIMITED
睿帝森國際集團有限公司",2004-12-22,2013-02-08,"Private, ltd by shares"452,0941419,"REE VOGUE DESIGN (HONG KONG) LIMITED
嘉祺時裝(香港)有限公司",2004-12-22,,"Private, ltd by shares"453,0941485,"REGAL LEADER INDUSTRIAL LIMITED
佳豪實業有限公司",2004-12-22,,"Private, ltd by shares"454,0941382,"REGAL MANUFACTORY LIMITED",2004-12-22,2010-03-12,"Private, ltd by shares"455,0941296,"RFID TECHNOLOGY LIMITED
射頻識別科技有限公司",2004-12-22,,"Private, ltd by shares"456,0941693,"RICH &amp; WEALTH HOLDINGS LIMITED
意發集團有限公司",2004-12-22,2018-06-22,"Private, ltd by shares"457,0941741,"RICH ASSET CORPORATION LIMITED (d2009-03-27)
財置有限公司",2004-12-22,2009-03-27,"Private, ltd by shares"458,0941467,"RICHLY WINNING LIMITED
雄萬有限公司",2004-12-22,,"Private, ltd by shares"459,0941358,"RIGHT CENTURY INVESTMENTS LIMITED",2004-12-22,,"Private, ltd by shares"460,0941273,"RIO BENICIA TRADING COMPANY LIMITED
里約、班尼西亞有限公司",2004-12-22,2010-05-20,"Private, ltd by shares"461,0941307,"ROCKS FEATURES LIMITED
四季圖片庫有限公司",2004-12-22,2007-07-27,"Private, ltd by shares"462,0941684,"RONGCHANG CHEMICAL SCIENCE &amp; TECHNOLOGY CO., LIMITED
榮昌化工科技有限公司",2004-12-22,,"Private, ltd by shares"463,0941717,"ROSY COMPANY LIMITED (d2009-05-15)
榮稷股份有限公司",2004-12-22,2009-05-15,"Private, ltd by shares"464,0941345,"RSVP COMPANY LIMITED (d2008-03-07)
美路仕科技有限公司",2004-12-22,2008-03-07,"Private, ltd by shares"465,0941496,"RUI FENG MEDICAL TECHNOLOGY HOLDINGS LIMITED
瑞丰醫療科技集團有限公司",2004-12-22,2007-03-09,"Private, ltd by shares"466,0941654,"RUSSIA PETERSBURG CHEMICAL INTERNATIONAL GROUP LIMITED",2004-12-22,2009-05-15,"Private, ltd by shares"467,0941350,"SAM MEDIA LIMITED",2004-12-22,,"Private, ltd by shares"468,0941292,"SAM TAT (ASIA) COMPANY LIMITED
森達亞洲有限公司",2004-12-22,2007-07-20,"Private, ltd by shares"469,0941642,"SAN HUA INTERNATIONAL TECHNOLOGY DEVELOPMENT COMPANY LIMITED
新華國際科技發展有限公司",2004-12-22,2012-06-15,"Private, ltd by shares"470,0941806,"SANG KEE RESTAURANT LIMITED
生記飯店有限公司",2004-12-22,,"Private, ltd by shares"471,0941361,"SANYANG ELECTRIC LIMITED
三洋電器有限公司",2004-12-22,2008-06-20,"Private, ltd by shares"472,0941490,"SECURITY ASSOCIATES LIMITED (HK)
駿日顧問有限公司",2004-12-22,,"Private, ltd by shares"473,0941421,"SEE WON PROPERTIES LIMITED
思宏地產有限公司",2004-12-22,2013-04-19,"Private, ltd by shares"474,0941444,"SHANGHAI DONGSHUN TEXTILES &amp; GARMENTS LIMITED
上海東順紡織服裝有限公司",2004-12-22,2010-05-20,"Private, ltd by shares"475,0941504,"SHANGHAI HAIXIN (HONG KONG) INTERNATIONAL TRADING COMPANY LIMITED
上海海欣(香港)國際貿易有限公司",2004-12-22,,"Private, ltd by shares"476,0941483,"SHANGHAI WINSON PRINTING LIMITED
上海宏盛印務有限公司",2004-12-22,2009-11-20,"Private, ltd by shares"477,0941330,"SHEEN PLUS INTERNATIONAL LIMITED
耀和國際有限公司",2004-12-22,2006-05-12,"Private, ltd by shares"478,0941530,"SHENZHEN A&amp;K DEVELOPMENT CO., LIMITED
深圳艾爾凱發展有限公司",2004-12-22,2010-05-20,"Private, ltd by shares"479,0941603,"SHENZHEN SHI AN JI ER LIVING KITCHEN LIMITED
深圳市安吉爾生活衛厨有限公司",2004-12-22,2009-05-15,"Private, ltd by shares"480,0941656,"SHINYO MARINER LIMITED",2004-12-22,2012-06-15,"Private, ltd by shares"481,0941262,"SHL TOOLING LIMITED
香港商瑞鴻模具有限公司",2004-12-22,2020-08-28,"Private, ltd by shares"482,0941587,"SINOCROSS LOGISTICS LIMITED
華基物流有限公司",2004-12-22,2007-06-15,"Private, ltd by shares"483,0941480,"SKY GAINER INVESTMENT LIMITED
天智投資有限公司",2004-12-22,2007-04-20,"Private, ltd by shares"484,0941338,"SKY MARK HOLDINGS LIMITED
天誌集團有限公司",2004-12-22,2007-05-25,"Private, ltd by shares"485,0941479,"SKY ROYAL DEVELOPMENT LIMITED (d2010-08-20)
天智發展有限公司",2004-12-22,2010-08-20,"Private, ltd by shares"486,0941695,"SKYLINE TRADING HK LIMITED",2004-12-22,2019-01-04,"Private, ltd by shares"487,0941284,"SKYTRACK TECHNOLOGIES ASIA LIMITED
天運通科技有限公司",2004-12-22,2012-04-05,"Private, ltd by shares"488,0941518,"SKYWORLD INDUSTRY LIMITED
天緯實業(香港)有限公司",2004-12-22,2015-05-08,"Private, ltd by shares"489,0941773,"SMART PINE DEVELOPMENT LIMITED
川銘蒲發展有限公司",2004-12-22,2015-03-06,"Private, ltd by shares"490,0941707,"SMART PROPERTY AGENCY LIMITED (d2010-03-26)
卓匯物業代理有限公司",2004-12-22,2010-03-26,"Private, ltd by shares"491,0941468,"SMART SHINY LIMITED (d2009-05-15)
駿煒有限公司",2004-12-22,2009-05-15,"Private, ltd by shares"492,0941827,"SOL PLUS CO. LIMITED
素溢有限公司",2004-12-22,2008-09-05,"Private, ltd by shares"493,0941410,"SONIA RYKIEL (HONG KONG) LIMITED",2004-12-22,2020-04-17,"Private, ltd by shares"494,0941487,"SOURCE UNION DEVELOPMENT LIMITED
滙博發展有限公司",2004-12-22,2011-10-28,"Private, ltd by shares"495,0941844,"SPI WEST PORT LIMITED
敬洋貿易有限公司",2004-12-22,,"Private, ltd by shares"496,0941821,"STAND NEW LIMITED
立新有限公司",2004-12-22,,"Private, ltd by shares"497,0941819,"STAR CHOICE LIMITED (d2010-04-16)
順采有限公司",2004-12-22,2010-04-16,"Private, ltd by shares"498,0941706,"STAR POWER TRADING LIMITED (d2007-09-07)
星力貿易有限公司",2004-12-22,2007-09-07,"Private, ltd by shares"499,0941812,"StarBlu HK Limited",2004-12-22,2019-09-20,"Private, ltd by shares"500,0941332,"START CHAMP INTERNATIONAL LIMITED
啓卓國際有限公司",2004-12-22,2014-04-11,"Private, ltd by shares"501,0941774,"STATE BRIGHT INTERNATIONAL LIMITED
邦輝國際有限公司",2004-12-22,2010-05-20,"Private, ltd by shares"502,0941776,"STEP WIDE DEVELOPMENT LIMITED
毅宏發展有限公司",2004-12-22,2020-11-13,"Private, ltd by shares"503,0941682,"STERLINGER TRADE LIMITED",2004-12-22,2010-05-20,"Private, ltd by shares"504,0941761,"SUCCESS FANCY LIMITED
興悅有限公司",2004-12-22,,"Private, ltd by shares"505,0941596,"SUMMITSYS TECHNOLOGIES LIMITED",2004-12-22,,"Private, ltd by shares"506,0941698,"SUN AND MOON GROUP LIMITED",2004-12-22,2009-05-15,"Private, ltd by shares"507,0941536,"SUN POWER ENTERPRISE (H.K.) LIMITED
聲威實業(香港)有限公司",2004-12-22,2020-06-12,"Private, ltd by shares"508,0941777,"SUNNY TREASURE INTERNATIONAL LIMITED (d2009-01-30)
旭寶國際有限公司",2004-12-22,2009-01-30,"Private, ltd by shares"509,0941304,"SUPREME FASHION INTERNATIONAL LIMITED
高尚國際有限公司",2004-12-22,2016-05-27,"Private, ltd by shares"510,0941778,"SURE DRAGON DEVELOPMENT LIMITED
龍保發展有限公司",2004-12-22,,"Private, ltd by shares"511,0941820,"SURE VANTAGE LIMITED (d2015-07-31)
必益有限公司",2004-12-22,2015-07-31,"Private, ltd by shares"512,0941676,"SUTL CORPORATION (HONG KONG) LIMITED
新連(香港)有限公司",2004-12-22,,"Private, ltd by shares"513,0941366,"SYNDEO-A&amp;A LIMITED",2004-12-22,2011-12-30,"Private, ltd by shares"514,0941720,"TAHER INTERNATIONAL INDUSTRIAL CO., LIMITED
泰和國際實業有限公司",2004-12-22,2010-05-28,"Private, ltd by shares"515,0941631,"TAIWAN FUMINCHENG ENTERPRISES COMPANY LIMITED
台灣富敏城企業股份有限公司",2004-12-22,,"Private, ltd by shares"516,0941823,"TAIWAN SIME GARMENT GROUP COMPANY LIMITED
臺灣示美鞋服集團有限公司",2004-12-22,2010-05-20,"Private, ltd by shares"517,0941627,"TAIYUAN AUTOMATIC AUTOMOBILE COLLISION AVOIDANCE SYSTEM INTERNATIONAL DEVELOPMENT CO., LIMITED
泰遠汽車自動防撞器國際發展有限公司",2004-12-22,2009-05-15,"Private, ltd by shares"518,0941779,"TALENT CHANCE INTERNATIONAL LIMITED
俊運國際有限公司",2004-12-22,2007-04-13,"Private, ltd by shares"519,0941780,"TALENT DRAGON DEVELOPMENT LIMITED
惠龍發展有限公司",2004-12-22,2013-01-25,"Private, ltd by shares"520,0941781,"TALENT PALACE INTERNATIONAL LIMITED
俊軒國際有限公司",2004-12-22,2007-03-30,"Private, ltd by shares"521,0941705,"TEAM CAPITAL TRADING LIMITED
合柏貿易有限公司",2004-12-22,2010-05-20,"Private, ltd by shares"522,0941604,"TEAM SUCCESS GLOBAL LIMITED
勤鶴國際有限公司",2004-12-22,2008-03-14,"Private, ltd by shares"523,0941666,"TEAMATE LIMITED (d2015-09-04)
添盟有限公司",2004-12-22,2015-09-04,"Private, ltd by shares"524,0941544,"TETFORD SERVICES LIMITED
德福顧問有限公司",2004-12-22,,"Private, ltd by shares"525,0941590,"THEODOMA HONG KONG LIMITED
西奧多瑪香港有限公司",2004-12-22,2010-05-20,"Private, ltd by shares"526,0941775,"TIDETIME LIBERTY INTERNATIONAL LIMITED
泰德利保帝國際有限公司",2004-12-22,,"Private, ltd by shares"527,0941367,"TIM KEE CIVIL ENGINEERING CO. LIMITED
添記土木工程有限公司",2004-12-22,2008-09-19,"Private, ltd by shares"528,0941325,"TIME RAINBOW (HONG KONG) LIMITED
時彩(香港)有限公司",2004-12-22,2010-10-15,"Private, ltd by shares"529,0941497,"TL Consulting Limited",2004-12-22,,"Private, ltd by shares"530,0941559,"TLG CHINA COMPANY LIMITED",2004-12-22,2015-09-11,"Private, ltd by shares"531,0941308,"TOGRAN (HONG KONG) ELECTRONICS CO., LIMITED
銘志(香港)實業有限公司",2004-12-22,2018-12-21,"Private, ltd by shares"532,0941482,"TOP GAINER DEVELOPMENT LIMITED
進昇發展有限公司",2004-12-22,,"Private, ltd by shares"533,0941477,"TOP GAINER HOLDINGS LIMITED
進昇集團有限公司",2004-12-22,2009-05-15,"Private, ltd by shares"534,0941542,"TOP JOY INTERNATIONAL DEVELOPMENT GROUP LIMITED
天驕國際發展集團有限公司",2004-12-22,,"Private, ltd by shares"535,0941665,"TOP SEA LIMITED (d2013-02-08)
泰洋有限公司",2004-12-22,2013-02-08,"Private, ltd by shares"536,0941674,"TOPFAR INDUSTRIAL (HONG KONG) CO., LIMITED
高遠實業(香港)有限公司",2004-12-22,2020-07-03,"Private, ltd by shares"537,0941511,"TOSHINDA INDUSTRY DEVELOPMENT CO., LIMITED
拓興達實業發展有限公司",2004-12-22,2010-09-17,"Private, ltd by shares"538,0941394,"Trans Asia Shoes Co., Limited
瑞商振永鞋業有限公司",2004-12-22,,"Private, ltd by shares"539,0941782,"TREASURE FAME DEVELOPMENT LIMITED
寶銘發展有限公司",2004-12-22,,"Private, ltd by shares"540,0941260,"TREND PRODUCTS LIMITED",2004-12-22,,"Private, ltd by shares"541,0941783,"TRIUMPH FAMOUS DEVELOPMENT LIMITED
凱興發展有限公司",2004-12-22,,"Private, ltd by shares"542,0941784,"TRIUMPH VAST DEVELOPMENT LIMITED
勝昌發展有限公司",2004-12-22,2008-08-15,"Private, ltd by shares"543,0941340,"TSANG FOOK AUDIO AND LIGHTING CONSULTANT LIMITED
曾福音像燈光工程技術有限公司",2004-12-22,2019-04-26,"Private, ltd by shares"544,0941339,"TVEASE TECHNOLOGY LIMITED
視易科技有限公司",2004-12-22,2006-03-24,"Private, ltd by shares"545,0941404,"TY INTERNATIONAL CO., LIMITED
泰淵實業有限公司",2004-12-22,,"Private, ltd by shares"546,0941569,"U.S.A MEITESIBANGWEI GROUP LIMITED
美國美特斯邦威集團有限公司",2004-12-22,2009-05-15,"Private, ltd by shares"547,0941455,"UK LIBANG AGRICULTURAL CHEMICAL MEDICINES LIMITED
英國利邦農用化學品有限公司",2004-12-22,2011-12-30,"Private, ltd by shares"548,0941796,"UNIHYPER RESOURCES (INTERNATIONAL) LIMITED",2004-12-22,2009-05-15,"Private, ltd by shares"549,0941299,"USA PLAYBOY (HK) DEVELOPMENT GROUP LIMITED
美國花花公子(香港)發展集團有限公司",2004-12-22,2008-08-01,"Private, ltd by shares"550,0941427,"USA PLAYBOY BRAND INDUSTRY DEVELOPMENT LIMITED
美國花花公子品牌實業發展有限公司",2004-12-22,2009-05-15,"Private, ltd by shares"551,0941457,"UTILITRAN HONG KONG LIMITED",2004-12-22,2010-05-20,"Private, ltd by shares"552,0941329,"VANTAGE FINE ENGINEERING LIMITED
優秀工程有限公司",2004-12-22,2018-08-24,"Private, ltd by shares"553,0941785,"VAST ASCENT INTERNATIONAL LIMITED (d2013-04-12)
溢升國際有限公司",2004-12-22,2013-04-12,"Private, ltd by shares"554,0941786,"VAST GRAIN INTERNATIONAL LIMITED
豐禾國際有限公司",2004-12-22,2007-03-30,"Private, ltd by shares"555,0941787,"VAST JOY INTERNATIONAL LIMITED
豐欣國際有限公司",2004-12-22,,"Private, ltd by shares"556,0941788,"VAST KING INTERNATIONAL LIMITED
泰威國際有限公司",2004-12-22,,"Private, ltd by shares"557,0941658,"VERANDA LIMITED (HK)
富倫國際有限公司",2004-12-22,,"Private, ltd by shares"558,0941628,"VICTORY POINT HOLDINGS LIMITED
啓博控股有限公司",2004-12-22,,"Private, ltd by shares"559,0941271,"VISDANFO (ASIA) LIMITED
威斯丹弗(亞洲)有限公司",2004-12-22,,"Private, ltd by shares"560,0941817,"VISI MEDIA ASIA LIMITED
創意亞洲媒體有限公司",2004-12-22,2006-03-17,"Private, ltd by shares"561,0941293,"VISION MONTHLY JOURNAL PUBLISHING LIMITED
視界月刊出版有限公司",2004-12-22,2009-05-15,"Private, ltd by shares"562,0941523,"WAHBO (H.K) INT'L INVESTMENT LIMITED
華普(香港)國際投資有限公司",2004-12-22,2009-05-15,"Private, ltd by shares"563,0941655,"WAI KEI CHUEN COMPANY LIMITED
煒基銓有限公司",2004-12-22,2009-09-04,"Private, ltd by shares"564,0941636,"WANG YIU METAL LIMITED
宏耀五金有限公司",2004-12-22,,"Private, ltd by shares"565,0941368,"WAYTECH ELECTRONICS (H.K.) CO., LIMITED
偉科電子(香港)有限公司",2004-12-22,2015-08-28,"Private, ltd by shares"566,0941447,"WEALTH THAI LIMITED
妍泰有限公司",2004-12-22,2008-06-13,"Private, ltd by shares"567,0941789,"WEALTHY HERO DEVELOPMENT LIMITED
瑞雄發展有限公司",2004-12-22,,"Private, ltd by shares"568,0941790,"WEALTHY WAVE INTERNATIONAL LIMITED (d2007-04-13)
富濤國際有限公司",2004-12-22,2007-04-13,"Private, ltd by shares"569,0941342,"WEBSOURCING LIMITED",2004-12-22,,"Private, ltd by shares"570,0941791,"WELL BUSINESS DEVELOPMENT LIMITED (d2008-04-03)
美業發展有限公司",2004-12-22,2008-04-03,"Private, ltd by shares"571,0941305,"WENLLYS ENTERPRISE LIMITED
藝家國際有限公司",2004-12-22,,"Private, ltd by shares"572,0941320,"WHITE CRYSTAL TRADING LIMITED
白晶貿易有限公司",2004-12-22,,"Private, ltd by shares"573,0941740,"WIDE MORE LIMITED (d2006-07-21)
宏加有限公司",2004-12-22,2006-07-21,"Private, ltd by shares"574,0941792,"WIDER POWER DEVELOPMENT LIMITED (d2009-05-15)
博威發展有限公司",2004-12-22,2009-05-15,"Private, ltd by shares"575,0941699,"WIND PROSPECT (HK) LIMITED",2004-12-22,2016-01-08,"Private, ltd by shares"576,0941633,"WINDMILL INTERNATIONAL LIMITED (d2013-02-15)
風車國際有限公司",2004-12-22,2013-02-15,"Private, ltd by shares"577,0941624,"WINTOP SCIENTIFIC INSTRUMENT CO., LIMITED
永通科儀有限公司",2004-12-22,2009-12-24,"Private, ltd by shares"578,0941433,"WIRESTAR TECHNOLOGY (H.K.) LIMITED
華旭達科技(香港)有限公司",2004-12-22,,"Private, ltd by shares"579,0941692,"WISE PROFIT ENTERPRISES LIMITED (d2006-03-24)
盈智企業有限公司",2004-12-22,2006-03-24,"Private, ltd by shares"580,0941563,"WITEM GROUP CO., LIMITED
香港威登集團有限公司",2004-12-22,2020-07-03,"Private, ltd by shares"581,0941605,"WL DESIGN INTERNATIONAL LIMITED
築坊國際有限公司",2004-12-22,2008-08-22,"Private, ltd by shares"582,0941446,"WX INTERNATIONAL LIMITED
榮昌實業發展有限公司",2004-12-22,2012-11-16,"Private, ltd by shares"583,0941638,"XING KE (H.K.) CO., LIMITED
星科(香港)實業有限公司",2004-12-22,,"Private, ltd by shares"584,0941375,"XING YUAN (FAR EAST) LIMITED
新源(遠東)有限公司",2004-12-22,2008-08-22,"Private, ltd by shares"585,0941832,"Y H GLOBAL LOGISTICS LIMITED
越海全球物流有限公司",2004-12-22,,"Private, ltd by shares"586,0941438,"YAT LUNG GROUP LIMITED
溢隆集團有限公司",2004-12-22,2010-05-20,"Private, ltd by shares"587,0941663,"YI CHENG METAL AND PLASTIC (HK) COMPANY LIMITED
藝成五金塑膠(香港)有限公司",2004-12-22,2009-05-15,"Private, ltd by shares"588,0941650,"YIHAO DEVELOPMENT (HONG KONG) CO., LIMITED
益濠發展(香港)有限公司",2004-12-22,2013-02-15,"Private, ltd by shares"589,0941528,"YILI RESTAURANT M&amp;C (HK) LIMITED
意力餐飲管理咨詢(香港)有限公司",2004-12-22,2008-06-06,"Private, ltd by shares"590,0941493,"YING KEE STEEL AND IRON ENGINEERING LIMITED
英記鋼鐵工程有限公司",2004-12-22,,"Private, ltd by shares"591,0941257,"YINZHONG INVESTMENT (HONG KONG) COMPANY LIMITED
銀眾投資(香港)有限公司",2004-12-22,2011-12-30,"Private, ltd by shares"592,0941630,"YOU AND ME CULTURE COMMUNICATION LIMITED
合和文化傳播有限公司",2004-12-22,2007-03-02,"Private, ltd by shares"593,0941677,"YUEN KONG PRECISION PLASTIC (HK) LIMITED
香港源江精密注塑有限公司",2004-12-22,2006-06-09,"Private, ltd by shares"594,0941376,"ZEITGEIST HOLDINGS LIMITED",2004-12-22,2014-12-12,"Private, ltd by shares"595,0941492,"ZENITH WEALTH MANAGEMENT LIMITED (d2008-01-25)
名峰財富策劃有限公司",2004-12-22,2008-01-25,"Private, ltd by shares"596,0941348,"ZENOSAN CO., LIMITED",2004-12-22,,"Private, ltd by shares"597,0941278,"ZHONGYING PRECIOUS METALS HOLDINGS LIMITED
中盈貴金屬集團有限公司",2004-12-22,,"Private, ltd by shares"598,0941675,"ZIPPY HONG KONG GROUP LIMITED
飛龍香港集團有限公司",2004-12-22,2010-05-20,"Private, ltd by shares"599,0941351,"ZOOM UP HOLDINGS LIMITED",2004-12-22,,"Private, ltd by shares"