,Reg no.,Name,Incorp-orated,Dissolved,Type1,0941403,"A&amp;B DESIGN LIMITED
恒藝設計有限公司",2004-12-22,2011-12-30,"Private, ltd by shares"2,0941392,"ABOVE CHINA BALLOONS LIMITED",2004-12-22,2007-06-02,"Private, ltd by shares"3,0941323,"AC LINK EXHIBITION SERVICES LIMITED
艾思靈展覽服務有限公司",2004-12-22,2008-05-16,"Private, ltd by shares"4,0941291,"ACCOM INTERNATIONAL LIMITED
匯居國際有限公司",2004-12-22,2009-06-12,"Private, ltd by shares"5,0941760,"ADD WEALTHY LIMITED (d2018-02-15)
富添有限公司",2004-12-22,2018-02-15,"Private, ltd by shares"6,0941608,"AIHUA (HK) INDUSTRY CO., LIMITED
香港愛華實業有限公司",2004-12-22,2009-05-15,"Private, ltd by shares"7,0941379,"AIKO BEVERAGE (HK) LIMITED
巧口爽飲品(香港)有限公司",2004-12-22,2009-05-15,"Private, ltd by shares"8,0941834,"AIP TELECOM (HONG KONG) LIMITED
栢匯網絡通訊有限公司",2004-12-22,2009-07-31,"Private, ltd by shares"9,0941759,"ALL GREAT LIMITED (d2011-10-28)
偉全有限公司",2004-12-22,2011-10-28,"Private, ltd by shares"10,0941405,"ALLWIN ASIA LIMITED",2004-12-22,2016-03-24,"Private, ltd by shares"11,0941810,"AMI POWER LIMITED
雅美來有限公司",2004-12-22,,"Private, ltd by shares"12,0941294,"ANDO INTERNATIONAL (HK) COMPANY LIMITED
安藤國際(香港)有限公司",2004-12-22,2010-08-06,"Private, ltd by shares"13,0941719,"ANYWAY GIFTS CO., LIMITED (d2011-06-24)
恒通禮品有限公司",2004-12-22,2011-06-24,"Private, ltd by shares"14,0941435,"AOMEILAN (HK) LIMITED
澳美蘭(香港)有限公司",2004-12-22,,"Private, ltd by shares"15,0941793,"ASCENT CAPITAL DEVELOPMENT LIMITED
騰都發展有限公司",2004-12-22,,"Private, ltd by shares"16,0941794,"ASCENT HILL INTERNATIONAL LIMITED
振峰國際有限公司",2004-12-22,2009-05-15,"Private, ltd by shares"17,0941758,"ASCENT HILL LIMITED (d2010-02-12)
晉峰有限公司",2004-12-22,2010-02-12,"Private, ltd by shares"18,0941671,"ASHLEY F&amp;B GROUP LIMITED
天濠飲食集團有限公司",2004-12-22,2011-12-30,"Private, ltd by shares"19,0941840,"ASIA BUILDING MATERIALS LIMITED
亞洲材料有限公司",2004-12-22,,"Private, ltd by shares"20,0941454,"ASIA INTERNATIONAL MEDICAL ASSOCIATION LIMITED
亞太國際醫學會有限公司",2004-12-22,2009-05-15,"Private, ltd by shares"21,0941402,"ASIA LINK GLOBAL LIMITED (d2007-05-04)
環球聯亞有限公司",2004-12-22,2007-05-04,"Private, ltd by shares"22,0941277,"ASIA PROJECT LINK LIMITED",2004-12-22,2011-12-23,"Private, ltd by shares"23,0941486,"ASIA SHINY TRADING LIMITED
萬亞貿易有限公司",2004-12-22,,"Private, ltd by shares"24,0941833,"ASIA STEEL INTERNATIONAL COMPANY LIMITED
亞洲鋼鐵國際交易中心有限公司",2004-12-22,2006-10-20,"Private, ltd by shares"25,0941667,"ASIA-PACIFIC INTERNATIONAL PROFESSIONAL CO., LIMITED
亞太地區國際人才有限公司",2004-12-22,2016-06-17,"Private, ltd by shares"26,0941377,"ASP HOLDINGS CORPORATION LIMITED",2004-12-22,2017-11-03,"Private, ltd by shares"27,0941831,"ASVA TRADING COMPANY LIMITED",2004-12-22,2010-05-20,"Private, ltd by shares"28,0941387,"BABSIKEA CORPORATION LIMITED
柏美思有限公司",2004-12-22,2009-09-11,"Private, ltd by shares"29,0941315,"BABYLON INTERNATIONAL ENTERTAINMENT LIMITED
巴比倫國際娛樂有限公司",2004-12-22,2009-05-15,"Private, ltd by shares"30,0941616,"BACKUP LIMITED (d2007-01-19)
備份有限公司",2004-12-22,2007-01-19,"Private, ltd by shares"31,0941554,"BADEN POWELL (HK) COMPANY LIMITED
貝登堡(香港)有限公司",2004-12-22,,"Private, ltd by shares"32,0941825,"BALFOUR HONG KONG LIMITED",2004-12-22,,"Private, ltd by shares"33,0941550,"BANGWEI INVESTMENT (HK) LIMITED
邦威投資(香港)有限公司",2004-12-22,,"Private, ltd by shares"34,0941501,"BARON GROUP (HK) INT'L HOLDING LIMITED
百潤集團(香港)國際控股有限公司",2004-12-22,,"Private, ltd by shares"35,0941489,"BEANTY ENTERPRISE DEVELOPMENT (HONG KONG) LIMITED
美華實業發展(香港)有限公司",2004-12-22,2009-07-10,"Private, ltd by shares"36,0941512,"BENEFIT COSMETICS HONG KONG LIMITED",2004-12-22,,"Private, ltd by shares"37,0941843,"BEST &amp; BRIGHT OCEAN INTERNATIONAL LIMITED
海明興國際有限公司",2004-12-22,,"Private, ltd by shares"38,0941372,"BEST COLOUR (HONG KONG) PRINTING COMPANY LIMITED
香港捷迅佳彩印刷有限公司",2004-12-22,,"Private, ltd by shares"39,0941657,"BEST KEY MOTORS &amp; COMPANY LIMITED
八駿車行有限公司",2004-12-22,2011-04-15,"Private, ltd by shares"40,0941333,"BEST MATCH INTERNATIONAL LIMITED
佳適國際有限公司",2004-12-22,2018-09-28,"Private, ltd by shares"41,0941327,"BEST TRADE (HONG KONG) LIMITED (d2010-02-26)
佳貿(香港)有限公司",2004-12-22,2010-02-26,"Private, ltd by shares"42,0941599,"BETTER CHOICE LIMITED (HK)
銳加有限公司",2004-12-22,,"Private, ltd by shares"43,0941472,"BETTER HERO INTERNATIONAL LIMITED
雄億國際有限公司",2004-12-22,2015-08-07,"Private, ltd by shares"44,0941464,"BETTER WINNING LIMITED
遠嘉有限公司",2004-12-22,2009-05-15,"Private, ltd by shares"45,0941795,"BILLION CHAMP DEVELOPMENT LIMITED (d2012-05-18)
億倡發展有限公司",2004-12-22,2012-05-18,"Private, ltd by shares"46,0941797,"BILLION EXCEL DEVELOPMENT LIMITED
億卓發展有限公司",2004-12-22,2016-08-19,"Private, ltd by shares"47,0941798,"BILLION SPREAD INTERNATIONAL LIMITED
億揚國際有限公司",2004-12-22,,"Private, ltd by shares"48,0941799,"BILLION SUCCESS INTERNATIONAL LIMITED (d2007-05-11)
億倡國際有限公司",2004-12-22,2007-05-11,"Private, ltd by shares"49,0941708,"BILLION TRINITY DEVELOPMENT LIMITED
千億發展有限公司",2004-12-22,,"Private, ltd by shares"50,0941716,"BILLION TRINITY LIMITED
千億有限公司",2004-12-22,2014-07-25,"Private, ltd by shares"51,0941811,"BIZWIZ PARTNERSHIP LIMITED",2004-12-22,,"Private, ltd by shares"52,0941643,"BLAZING STAR CO., LIMITED
帝亭有限公司",2004-12-22,2005-10-28,"Private, ltd by shares"53,0941359,"BOARDROOM CORPORATE SERVICES (HK) LIMITED
寶德隆企業服務(香港)有限公司",2004-12-22,,"Private, ltd by shares"54,0941543,"BOYUAN (HOLDINGS) LIMITED
博元(集團)有限公司",2004-12-22,2013-02-08,"Private, ltd by shares"55,0941588,"BRAND DEVELOPMENT HOLDINGS LIMITED
商標發展集團有限公司",2004-12-22,2009-05-15,"Private, ltd by shares"56,0941336,"BRIGHT SINCERE HOLDINGS LIMITED
朗誠集團有限公司",2004-12-22,2007-01-19,"Private, ltd by shares"57,0941800,"BRILLIANT CROWN DEVELOPMENT LIMITED
耀冠發展有限公司",2004-12-22,2020-03-27,"Private, ltd by shares"58,0941715,"BRILLIANT KING LIMITED (d2011-12-30)
光強有限公司",2004-12-22,2011-12-30,"Private, ltd by shares"59,0941757,"BRILLIANT PEACE LIMITED
曉和有限公司",2004-12-22,2017-05-16,"Private, ltd by shares"60,0941412,"BRITISH ROYAL BUMA (INT'L) SPORTS LIMITED
英國皇家彪馬(國際)體育用品有限公司",2004-12-22,2009-07-10,"Private, ltd by shares"61,0941678,"BRITTANY LIMITED (d2007-07-06)",2004-12-22,2007-07-06,"Private, ltd by shares"62,0941540,"BRUNET INTERNATIONAL LIMITED",2004-12-22,,"Private, ltd by shares"63,0941337,"BUILD UP HOLDINGS LIMITED
立建集團有限公司",2004-12-22,2011-12-30,"Private, ltd by shares"64,0941668,"BUSINESS PROPERTY (CHINA) TRADE CENTER LIMITED
商業地產(中國)交易中心有限公司",2004-12-22,2010-05-20,"Private, ltd by shares"65,0941606,"CALVARY CONSULTANT LIMITED
加維爾顧問有限公司",2004-12-22,,"Private, ltd by shares"66,0941562,"CAMPMAN (HK) LIMITED",2004-12-22,,"Private, ltd by shares"67,0941694,"CANADA CROWN GRAND INTERNATIONAL (HONG KONG) LIMITED
加拿大冠超國際(香港)有限公司",2004-12-22,2007-05-18,"Private, ltd by shares"68,0941267,"CARLARIS REAL ESTATE FUND LIMITED",2004-12-22,2011-12-30,"Private, ltd by shares"69,0941539,"CARMATER INTERNATIONAL LIMITED
卡美特國際有限公司",2004-12-22,2010-05-20,"Private, ltd by shares"70,0941535,"CB INTEGRATED MARKETING INTERNATIONAL LIMITED
全創策略資源國際有限公司",2004-12-22,,"Private, ltd by shares"71,0941570,"CHAO LI INTERNATIONAL (HONGKONG) LIMITED
超力國際(香港)有限公司",2004-12-22,2010-05-20,"Private, ltd by shares"72,0941673,"CHARMING RAYS INTERNATIONAL COMPANY LIMITED
神采國際有限公司",2004-12-22,,"Private, ltd by shares"73,0941828,"CHARTER PROFIT LIMITED
鏗潤有限公司",2004-12-22,,"Private, ltd by shares"74,0941371,"CHEONG HING INTERNATIONAL TRADING COMPANY LIMITED
昌興國際貿易有限公司",2004-12-22,,"Private, ltd by shares"75,0941439,"CHEUK NGA INVESTMENT GROUP LIMITED
卓雅投資集團有限公司",2004-12-22,2018-08-24,"Private, ltd by shares"76,0941431,"CHI WO ENTERPRISE (HONG KONG) COMPANY LIMITED
志和投資(香港)有限公司",2004-12-22,,"Private, ltd by shares"77,0941253,"CHIFORD INTERNATIONAL LIMITED",2004-12-22,,"Private, ltd by shares"78,0941700,"CHIMS SHOPPING LIMITED
尖端購物有限公司",2004-12-22,2006-06-23,"Private, ltd by shares"79,0941424,"CHINA CITY ECONOMICS RESEARCH PUBLISHING LIMITED
中國城市經濟研究出版社有限公司",2004-12-22,2009-05-15,"Private, ltd by shares"80,0941565,"CHINA EASTERN AIRLINE JIANGSU ADVERTISING (HONG KONG) LIMITED
東航江蘇廣告(香港)有限公司",2004-12-22,2009-02-06,"Private, ltd by shares"81,0941564,"CHINA EASTERN AIRLINE JIANGSU ADVERTISING LIMITED
東航江蘇廣告有限公司",2004-12-22,2009-02-06,"Private, ltd by shares"82,0941584,"CHINA GUO JU HOLDINGS LIMITED
中國國巨集團有限公司",2004-12-22,2008-06-13,"Private, ltd by shares"83,0941697,"CHINA HOSPITAL CEO CLUB LIMITED
中國醫院院長俱樂部有限公司",2004-12-22,2009-05-15,"Private, ltd by shares"84,0941409,"CHINA HOTEL LEAGUE LIMITED
中國酒店聯合會有限公司",2004-12-22,2019-10-25,"Private, ltd by shares"85,0941646,"CHINA INTERNATIONAL EXCHANGE ASSOCIATION LIMITED
中國國際交流協會有限公司",2004-12-22,,"Ltd by guarantee"86,0941577,"CHINA INTERNATIONAL FILM AND TELEVISION LIMITED
中華國際電影電視有限公司",2004-12-22,2010-05-20,"Private, ltd by shares"87,0941576,"CHINA INTERNATIONAL MOVIES &amp; TELEVISION HOLDINGS LIMITED
中國國際電影電視集團有限公司",2004-12-22,2008-06-13,"Private, ltd by shares"88,0941452,"CHINA INTERNATIONAL SCIENCE HOLDING CO., LIMITED
中華國際科技集團有限公司",2004-12-22,2017-10-06,"Private, ltd by shares"89,0941801,"CHINA RIVER DEVELOPMENT LIMITED (d2009-05-15)
江華發展有限公司",2004-12-22,2009-05-15,"Private, ltd by shares"90,0941670,"CHINA TIBETAN CHILDREN HEALTH &amp; EDUCATION FUND LIMITED
中國西藏兒童健康教育基金有限公司",2004-12-22,2020-06-05,"Ltd by guarantee"91,0941602,"CHINA ZHOUYI ASSOCIATION LIMITED (d2010-05-20)
中華周易協會有限公司",2004-12-22,2010-05-20,"Private, ltd by shares"92,0941509,"CHIT SHING INTERNATIONAL HOLDINGS LIMITED
捷盛國際集團有限公司",2004-12-22,2012-06-15,"Private, ltd by shares"93,0941370,"CHONGYI INTERNATIONAL TRADE CO., LIMITED
崇義國際貿易有限公司",2004-12-22,2011-03-18,"Private, ltd by shares"94,0941346,"CHUANG XING (HK) INTERNATIONAL TRADING LIMITED
創鑫(香港)國際貿易有限公司",2004-12-22,2012-04-13,"Private, ltd by shares"95,0941557,"CHUN SING ENVIRONMENTAL CONTRACTOR LIMITED
晉昇環境資源工程有限公司",2004-12-22,,"Private, ltd by shares"96,0941756,"CITI-FOREST LIMITED
城林有限公司",2004-12-22,2016-08-19,"Private, ltd by shares"97,0941461,"CITY GAINER LIMITED
建城有限公司",2004-12-22,2013-01-04,"Private, ltd by shares"98,0941286,"CITY SHM FILM ARTS ENTERTAINMENT LIMITED
城市星港澳影視演藝娛樂有限公司",2004-12-22,2009-05-15,"Private, ltd by shares"99,0941287,"CLK INVESTMENT LIMITED
蔡林記有限公司",2004-12-22,2008-03-07,"Private, ltd by shares"100,0941644,"CMA PACIFIC PARTNERS (HK) LIMITED (d2008-11-28)",2004-12-22,2008-11-28,"Private, ltd by shares"101,0941549,"CMAS EDUCATION DEVELOPMENT LIMITED
正統心算(香港總代理)有限公司",2004-12-22,,"Private, ltd by shares"102,0941269,"CNSTAR-IC ELECTRONICS CO., LIMITED
森時達電子有限公司",2004-12-22,2009-05-15,"Private, ltd by shares"103,0941686,"CO-DRAGON INTERNATIONAL CO., LIMITED
港龍國際有限公司",2004-12-22,,"Private, ltd by shares"104,0941406,"COME-IN-FIT INWEAR (ASIA) LIMITED
金名妃(亞洲)貿易有限公司",2004-12-22,2008-05-02,"Private, ltd by shares"105,0941516,"COMMERCIAL CHINA INT'L MEDIA LIMITED
商業中國國際傳媒有限公司",2004-12-22,2009-05-15,"Private, ltd by shares"106,0941566,"CONCORD MANUFACTURING INTERNATIONAL (HK) LIMITED
香港康蔻國際工貿有限公司",2004-12-22,2011-12-30,"Private, ltd by shares"107,0941623,"CONSULTANCY INTERNATIONAL LIMITED (HK)
顧問國際有限公司",2004-12-22,,"Private, ltd by shares"108,0941326,"CROWN FAST (HONG KONG) LIMITED
冠捷(香港)有限公司",2004-12-22,2007-03-09,"Private, ltd by shares"109,0941463,"CROWN LEADING LIMITED
冠熙有限公司",2004-12-22,2006-11-03,"Private, ltd by shares"110,0941460,"CYBER PACIFIC LIMITED
海科有限公司",2004-12-22,2015-05-29,"Private, ltd by shares"111,0941426,"D&amp;L TIMBER PRODUCTS &amp; SERVICES CORPORATION LIMITED",2004-12-22,,"Private, ltd by shares"112,0941669,"DAGANG TRADING INTERNATIONAL (NIG) LIMITED
尼日利亞大港國際貿易有限公司",2004-12-22,,"Private, ltd by shares"113,0941578,"DAI-I-CHI GEM &amp; JEWELRY (H.K.) CO., LIMITED
泰基珠寶(香港)有限公司",2004-12-22,2009-05-15,"Private, ltd by shares"114,0941679,"DB (China) Consulting Limited",2004-12-22,2014-09-12,"Private, ltd by shares"115,0941508,"DEEPWELL INT'L CO., LIMITED
德偉國際控股有限公司",2004-12-22,2014-10-31,"Private, ltd by shares"116,0941389,"DELHUM TECHNOLOGY &amp; SERVICE (HONG KONG) LIMITED
德鴻科技(香港)有限公司",2004-12-22,2014-04-25,"Private, ltd by shares"117,0941418,"DIGIMAGE INTERNATIONAL (HK) LIMITED
數影國際(香港)有限公司",2004-12-22,2009-05-15,"Private, ltd by shares"118,0941696,"DIGITAL CHINA TECHNOLOGY (HONG KONG) CO., LIMITED
中華數碼科技(香港)有限公司",2004-12-22,2011-12-30,"Private, ltd by shares"119,0941324,"DIONYSOS LIMITED (HK)",2004-12-22,,"Private, ltd by shares"120,0941581,"DONGLIDA INTERNATIONAL GROUP (HK) LIMITED
東利達國際集團(香港)有限公司",2004-12-22,2018-08-24,"Private, ltd by shares"121,0941331,"DRAGON MAGIC INTERNATIONAL LIMITED
龍懋國際有限公司",2004-12-22,2019-08-09,"Private, ltd by shares"122,0941838,"DRAGON UNION CORP. LIMITED",2004-12-22,2015-04-17,"Private, ltd by shares"123,0941714,"DYNAMIC KING LIMITED (d2009-10-09)",2004-12-22,2009-10-09,"Private, ltd by shares"124,0941551,"EAJ JEWELRY LIMITED",2004-12-22,,"Private, ltd by shares"125,0941703,"EASE PIONEER LIMITED
啟易有限公司",2004-12-22,2006-11-03,"Private, ltd by shares"126,0941470,"EASTERN SHINY LIMITED
遠東行有限公司",2004-12-22,,"Private, ltd by shares"127,0941809,"ECOFRESH COMPANY LIMITED
而高有限公司",2004-12-22,2011-11-25,"Private, ltd by shares"128,0941713,"ELEGANT NOBLE LIMITED
雅妍有限公司",2004-12-22,,"Private, ltd by shares"129,0941802,"ELEGANT WIDE INTERNATIONAL LIMITED
彩宏國際有限公司",2004-12-22,,"Private, ltd by shares"130,0941803,"ELITE BUSINESS DEVELOPMENT LIMITED (HK)
麗業發展有限公司",2004-12-22,,"Private, ltd by shares"131,0941755,"ELITE SMART CORPORATION LIMITED (d2009-07-17)
采俊有限公司",2004-12-22,2009-07-17,"Private, ltd by shares"132,0941804,"ELITE WIDE DEVELOPMENT LIMITED
彩宏發展有限公司",2004-12-22,,"Private, ltd by shares"133,0941652,"ENERGY CONSULTANT LIMITED",2004-12-22,2014-04-11,"Private, ltd by shares"134,0941754,"ERA TRADER LIMITED
晨貿有限公司",2004-12-22,2015-04-17,"Private, ltd by shares"135,0941632,"ERFUL CHEMICAL (H.K.) CO., LIMITED
德國埃富爾化學(香港)有限公司",2004-12-22,2010-11-19,"Private, ltd by shares"136,0941712,"ETERNAL MASTER LIMITED
常順有限公司",2004-12-22,,"Private, ltd by shares"137,0941272,"ETERNAL WELL MANUFACTURING LIMITED
弘盛企業有限公司",2004-12-22,2014-03-14,"Private, ltd by shares"138,0941491,"EUROASIA LIMITED (HK)
歐亞服裝有限公司",2004-12-22,,"Private, ltd by shares"139,0941384,"EVER LEGEND CORPORATION LIMITED
宏駿達企業有限公司",2004-12-22,,"Private, ltd by shares"140,0941266,"EVERBRIGHT INDUSTRIAL &amp; TRADING COMPANY LIMITED
永明工貿有限公司",2004-12-22,2013-02-08,"Private, ltd by shares"141,0941598,"EXCEL SHINY LIMITED (d2010-05-20)
太暉有限公司",2004-12-22,2010-05-20,"Private, ltd by shares"142,0941255,"EXCELLENT KNOWLEDGE DEVELOPMENT LIMITED
優穎知識教育發展有限公司",2004-12-22,,"Private, ltd by shares"143,0941753,"FAITH WAVE LIMITED
信灝有限公司",2004-12-22,2019-06-14,"Private, ltd by shares"144,0941560,"FALLING WEALTH TECHNOLOGY (HK) CO., LIMITED
福凌科技(香港)有限公司",2004-12-22,2016-12-23,"Private, ltd by shares"145,0941752,"FAME MAX CORPORATION LIMITED (d2013-01-04)
譽豪有限公司",2004-12-22,2013-01-04,"Private, ltd by shares"146,0941805,"FAME VAST INTERNATIONAL LIMITED
榮溢國際有限公司",2004-12-22,2009-07-24,"Private, ltd by shares"147,0941751,"FAME VAST LIMITED
名盛有限公司",2004-12-22,,"Private, ltd by shares"148,0941769,"FAMOUS FAITH LIMITED
銘信有限公司",2004-12-22,,"Private, ltd by shares"149,0941625,"FARMASI HONG KONG LIMITED",2004-12-22,2010-07-23,"Private, ltd by shares"150,0941248,"FENG DA PLASTICS &amp; MOULDING (HK) LIMITED
豐達模具塑膠(香港)有限公司",2004-12-22,,"Private, ltd by shares"151,0941768,"FIELD CONCEPT LIMITED
創田有限公司",2004-12-22,,"Private, ltd by shares"152,0941807,"FINE VAST INTERNATIONAL LIMITED
朗溢國際有限公司",2004-12-22,2014-05-23,"Private, ltd by shares"153,0941356,"FIRST PACIFIC INVESTMENTS LIMITED
第一太平投資有限公司",2004-12-22,,"Private, ltd by shares"154,0941311,"FLUCOLD CHEMISTRY INDUSTRY LIMITED
亞潤化學工業有限公司",2004-12-22,2007-11-16,"Private, ltd by shares"155,0941701,"FORTUNE CHAIN ENTERPRISES LIMITED
科盟企業有限公司",2004-12-22,2017-02-17,"Private, ltd by shares"156,0941495,"FORTUNE INSURANCE AGENCIES LIMITED
科駿保險代理有限公司",2004-12-22,2016-05-13,"Private, ltd by shares"157,0941689,"FORTUNE RICH HK INVESTMENT LIMITED
富盛香港投資有限公司",2004-12-22,,"Private, ltd by shares"158,0941265,"FORTUNE WELL ENTERPRISE (HK) LIMITED
富堡企業(香港)有限公司",2004-12-22,,"Private, ltd by shares"159,0941649,"FORUM TECHNOLOGY LIMITED (d2009-05-15)
科能技術有限公司",2004-12-22,2009-05-15,"Private, ltd by shares"160,0941297,"FRANCE LIANHUANMA FASHION LIMITED
法國連環馬服飾有限公司",2004-12-22,2016-08-19,"Private, ltd by shares"161,0941526,"FRANCE WOODPECKER GROUP SHOES &amp; CLOTHES LIMITED
法國啄木鳥集團鞋服有限公司",2004-12-22,2007-11-16,"Private, ltd by shares"162,0941422,"FRANCE Y. Z. F BABY PRODUCTS INTERNATIONAL LIMITED
法國嬰姿坊嬰童用品國際有限公司",2004-12-22,,"Private, ltd by shares"163,0941672,"FRESH SOURCE INTERNATIONAL COMPANY LIMITED
菁源國際有限公司",2004-12-22,,"Private, ltd by shares"164,0941545,"FULETANG INTERNATIONAL LIMITED
福樂堂國際有限公司",2004-12-22,2011-12-30,"Private, ltd by shares"165,0941466,"FULL GAINER LIMITED
建皇有限公司",2004-12-22,,"Private, ltd by shares"166,0941465,"FULLY RICHEST LIMITED
富鎭有限公司",2004-12-22,2017-09-01,"Private, ltd by shares"167,0941595,"FURUKAWA PRECISION HONG KONG COMPANY LIMITED
古河精密(香港)有限公司",2004-12-22,2013-10-25,"Private, ltd by shares"168,0941502,"FUYUAN HUAXIN MOLD PLASTIC (HK) LIMITED
富源華鑫模具塑膠(香港)有限公司",2004-12-22,2018-05-18,"Private, ltd by shares"169,0941519,"G-LINK (HONG KONG) TRADING COMPANY LIMITED
香港金霖國際貿易有限公司",2004-12-22,,"Private, ltd by shares"170,0941537,"GAIN CREDIT METALS (HK) LIMITED
潤信五金(香港)有限公司",2004-12-22,2009-05-15,"Private, ltd by shares"171,0941839,"GAIN RESOURCES (HK) LIMITED (d2011-12-30)
正源(香港)有限公司",2004-12-22,2011-12-30,"Private, ltd by shares"172,0941383,"GAINMASS ELECTRONICS COMPANY LIMITED
經碼電子有限公司",2004-12-22,2006-06-02,"Private, ltd by shares"173,0941513,"GALLEON (HONG KONG) LIMITED",2004-12-22,2019-02-01,"Private, ltd by shares"174,0941247,"GEMZONE COMPANY LIMITED
寶光珠寶有限公司",2004-12-22,2007-05-11,"Private, ltd by shares"175,0941829,"GENIUS MIND LIMITED (d2006-06-02)
慧心有限公司",2004-12-22,2006-06-02,"Private, ltd by shares"176,0941822,"GENUINE BUSINESS INVESTMENT DEVELOPMENT (HK) LIMITED
香港名實偉業投資發展有限公司",2004-12-22,2009-05-15,"Private, ltd by shares"177,0941312,"GERMANY ZREOM INTERNATIONAL BUSINESS LIMITED
德國正蓉國際事業有限公司",2004-12-22,2010-05-20,"Private, ltd by shares"178,0941335,"GET PROFIT HOLDINGS LIMITED (HK)
迎豐集團有限公司",2004-12-22,,"Private, ltd by shares"179,0941808,"GIANT GAIN DEVELOPMENT LIMITED
泰得發展有限公司",2004-12-22,2009-05-15,"Private, ltd by shares"180,0941750,"GIANT GATE LIMITED
豪門有限公司",2004-12-22,,"Private, ltd by shares"181,0941711,"GIANT WAY INTERNATIONAL LIMITED (d2009-04-03)
宏逸國際有限公司",2004-12-22,2009-04-03,"Private, ltd by shares"182,0941510,"GLOBAL BRIDGE INDUSTRY CO., LIMITED
世橋實業有限公司",2004-12-22,,"Private, ltd by shares"183,0941451,"GLOBAL PROCUREMENT CENTER CO. LIMITED
環球採購中心有限公司",2004-12-22,2006-06-09,"Private, ltd by shares"184,0941401,"GLOBALTEX INDUSTRIAL LIMITED
高寶得實業有限公司",2004-12-22,,"Private, ltd by shares"185,0941254,"Glory Corporation Services Limited
金怡服務有限公司",2004-12-22,,"Private, ltd by shares"186,0941279,"GOLD BULLION SECURITIES LIMITED (d2016-11-18)",2004-12-22,2016-11-18,"Private, ltd by shares"187,0941473,"GOLD GAINER INTERNATIONAL LIMITED
金豐利國際有限公司",2004-12-22,2010-01-08,"Private, ltd by shares"188,0941276,"GOLDEN BEES PROPERTY HOLDINGS (CHINA) LIMITED
金蜂地產集團(中國)有限公司",2004-12-22,2006-05-04,"Private, ltd by shares"189,0941723,"GOLDEN CENTURY INTERNATIONAL ENTERTAINMENT LIMITED
黃金世紀國際娛樂有限公司",2004-12-22,2017-06-30,"Private, ltd by shares"190,0941250,"GOLDEN CHINA RESTAURANT LIMITED
金華燒臘大王有限公司",2004-12-22,,"Private, ltd by shares"191,0941500,"GOLDEN GATE TRADING LIMITED (d2006-09-08)
金門貿易有限公司",2004-12-22,2006-09-08,"Private, ltd by shares"192,0941478,"GOLDEN SHINY DEVELOPMENT LIMITED
金藝發展有限公司",2004-12-22,,"Private, ltd by shares"193,0941474,"GOLDTEX (ASIA) LIMITED (d2007-06-15)
佳輝(亞洲)有限公司",2004-12-22,2007-06-15,"Private, ltd by shares"194,0941275,"GR CORPORATE SERVICES LIMITED
黃金集團企業服務有限公司",2004-12-22,,"Private, ltd by shares"195,0941702,"GRACE SUN INVESTMENTS LIMITED
喜日投資有限公司",2004-12-22,2006-05-04,"Private, ltd by shares"196,0941818,"GRAND CREATION LIMITED (d2010-09-17)
廣創有限公司",2004-12-22,2010-09-17,"Private, ltd by shares"197,0941664,"GRAND KEEN LIMITED (d2008-01-04)
嘉健有限公司",2004-12-22,2008-01-04,"Private, ltd by shares"198,0941484,"GRAND MING REAL ESTATE COMPANY LIMITED
佳明地產有限公司",2004-12-22,2018-05-11,"Private, ltd by shares"199,0941724,"GRAND ON INTERNATIONAL LIMITED (d2010-05-20)
大萊國際有限公司",2004-12-22,2010-05-20,"Private, ltd by shares"200,0941749,"GRAND SUCCESS CORPORATION LIMITED (d2007-06-01)
成宏有限公司",2004-12-22,2007-06-01,"Private, ltd by shares"201,0941450,"GREAT CHINA BRANDS LIMITED
中華大品牌有限公司",2004-12-22,2007-02-16,"Private, ltd by shares"202,0941476,"GREAT SINO (ASIA) LIMITED
華港(亞洲)有限公司",2004-12-22,2007-06-08,"Private, ltd by shares"203,0941475,"GREAT WINNER (ASIA) LIMITED
創運(亞洲)有限公司",2004-12-22,2009-05-15,"Private, ltd by shares"204,0941748,"GREEN JOY LIMITED (d2007-04-27)
碧欣有限公司",2004-12-22,2007-04-27,"Private, ltd by shares"205,0941683,"GREGORIAN LIMITED (d2015-09-25)",2004-12-22,2015-09-25,"Private, ltd by shares"206,0941349,"GTS ASIA LIMITED",2004-12-22,2010-05-20,"Private, ltd by shares"207,0941391,"GUANGZHOU LANDSCAPE (HONGKONG) LIMITED
廣州市園林(香港)有限公司",2004-12-22,,"Private, ltd by shares"208,0941456,"GUOHAO GLOBAL GROUP (H.K.) LIMITED
全球國豪集團(香港)有限公司",2004-12-22,2018-05-25,"Private, ltd by shares"209,0941541,"GURKHAS EKTA INTERNATIONAL (HK) LIMITED
廓爾喀一統國際(香港)有限公司",2004-12-22,,"Private, ltd by shares"210,0941514,"H.K (JIAJIESHI) INT'L GROUP LIMITED
香港(佳潔士)國際集團有限公司",2004-12-22,2013-02-08,"Private, ltd by shares"211,0941660,"H.K AITESI HYGIENE ROOM LIMITED
香港艾特斯衛浴有限公司",2004-12-22,2009-05-15,"Private, ltd by shares"212,0941522,"H.K DENGCLOUD GROUP (INT'L) LIMITED
香港登雲集團(國際)有限公司",2004-12-22,2009-05-15,"Private, ltd by shares"213,0941524,"H.K JUNCHENG AIR CONDITIONER EQUIPMENT LIMITED
香港俊成空調設備有限公司",2004-12-22,,"Private, ltd by shares"214,0941521,"H.K WABANLE SHOES INDUSTRY (INT'L) LIMITED
香港華丹妮鞋業(國際)有限公司",2004-12-22,2007-11-16,"Private, ltd by shares"215,0941813,"HAINAN WENCHANG SHI CHANGSA OVERSEAS CHINESE SCHOOL EDUCATION FUND LIMITED
海南文昌市昌洒華僑學校教育基金有限公司",2004-12-22,2013-05-18,"Ltd by guarantee"216,0941360,"HANG HING ELECTRONICS TECHNOLOGY (H.K.) LIMITED
恆興電子科技(香港)有限公司",2004-12-22,2016-08-19,"Private, ltd by shares"217,0941416,"HANSON PRODUCTS MANUFACTURING LIMITED
漢斯電器製品有限公司",2004-12-22,,"Private, ltd by shares"