,Reg no.,Name,Incorp-orated,Dissolved,Type218,0941270,"HARBOUR STERLING INDUSTRIES LIMITED
港銀實業有限公司",2004-12-22,2015-07-10,"Private, ltd by shares"219,0941691,"HARVEST BASE LIMITED (d2010-07-23)
德智有限公司",2004-12-22,2010-07-23,"Private, ltd by shares"220,0941381,"HAVERSBRIDGE LIMITED",2004-12-22,2018-08-03,"Private, ltd by shares"221,0941583,"HBC IMPEX CO., LIMITED
港英進出口有限公司",2004-12-22,2011-12-30,"Private, ltd by shares"222,0941641,"HCR TECHNOLOGY (HK) LIMITED
東澤科技(香港)有限公司",2004-12-22,,"Private, ltd by shares"223,0941341,"HEALTH DEVOTION COMPANY LIMITED
宗健行有限公司",2004-12-22,,"Private, ltd by shares"224,0941725,"HERO ALLIANCE DEVELOPMENT LIMITED
滙英發展有限公司",2004-12-22,2016-06-03,"Private, ltd by shares"225,0941726,"HERO TOP INTERNATIONAL LIMITED
雄高國際有限公司",2004-12-22,2019-12-27,"Private, ltd by shares"226,0941727,"HIGH ON INTERNATIONAL LIMITED
安高國際有限公司",2004-12-22,2006-06-09,"Private, ltd by shares"227,0941445,"HIGH RUN HOLDING GROUP LIMITED
海潤股份集團有限公司",2004-12-22,2009-05-22,"Private, ltd by shares"228,0941651,"HIGH STRATEGY INTERNATIONAL INVESTMENT LIMITED
高策國際投資實業有限公司",2004-12-22,2006-12-08,"Private, ltd by shares"229,0941458,"HILLAM INVESTMENT LIMITED
曉林投資有限公司",2004-12-22,2007-05-04,"Private, ltd by shares"230,0941629,"HK CCT INVESTMENT GROUP LIMITED
香港國信明天投資集團有限公司",2004-12-22,2017-09-01,"Private, ltd by shares"231,0941503,"HK HENGGAN INT'L GROUP FASHION LIMITED
香港亨乾國際集團服裝有限公司",2004-12-22,2009-05-15,"Private, ltd by shares"232,0941313,"HK HENGXING JINGHUA FURNITURE GROUP CO., LIMITED
香港恒興京華家具集團有限公司",2004-12-22,2009-05-15,"Private, ltd by shares"233,0941841,"HK JONELOME INT'L DEV. LIMITED
香港九牧王國際發展有限公司",2004-12-22,2010-10-22,"Private, ltd by shares"234,0941314,"HK RUIYASI FURNITURE GROUP CO., LIMITED
香港瑞雅斯家具集團有限公司",2004-12-22,2009-05-15,"Private, ltd by shares"235,0941310,"HK SHAOHE INT'L YOU YE GROUP LIMITED
香港昭和國際油業集團有限公司",2004-12-22,2015-04-17,"Private, ltd by shares"236,0941309,"HK XIAOCAI DISHFUL MERCHANT LIMITED
香港小菜一碟商貿有限公司",2004-12-22,2015-08-28,"Private, ltd by shares"237,0941428,"HK XING HONG REGISTRATIONS LIMITED
香港興鴻註冊有限公司",2004-12-22,,"Private, ltd by shares"238,0941574,"HKC QINGDAO INVESTMENTS LIMITED
香港建設青島投資有限公司",2004-12-22,2018-05-18,"Private, ltd by shares"239,0941815,"HKC SHENYANG HUNAN INVESTMENTS LIMITED
香港建設瀋陽渾南投資有限公司",2004-12-22,,"Private, ltd by shares"240,0941575,"HKE (DANJINGHE) WIND POWER LIMITED
香港新能源(單晶河)風能有限公司",2004-12-22,,"Private, ltd by shares"241,0941429,"HO WAN DEVELOPMENT (HONG KONG) CO., LIMITED
皓雲發展(香港)有限公司",2004-12-22,,"Private, ltd by shares"242,0941561,"HOI WANG ENGINEERING LIMITED
凱宏工程有限公司",2004-12-22,2008-04-03,"Private, ltd by shares"243,0941399,"HOMA INTERNATIONAL LIMITED
奧馬國際有限公司",2004-12-22,2011-09-20,"Private, ltd by shares"244,0941380,"HONEARTS INTERNATIONAL COMPANY LIMITED
華麓國際有限公司",2004-12-22,2010-05-20,"Private, ltd by shares"245,0941680,"HONG KONG CHENYI INDUSTRY LIMITED
香港晨怡實業有限公司",2004-12-22,2017-12-22,"Private, ltd by shares"246,0941580,"HONG KONG DA CHEN TRADE LIMITED
香港達成貿易有限公司",2004-12-22,2006-12-15,"Private, ltd by shares"247,0941318,"HONG KONG EXCELLENT FOOD SOCIETY LIMITED
香港美食家協會有限公司",2004-12-22,2009-05-15,"Private, ltd by shares"248,0941610,"HONG KONG GOLD-QC ELECTRONIC CO., LIMITED
香港金奇成電子有限公司",2004-12-22,2009-05-15,"Private, ltd by shares"249,0941301,"HONG KONG GOLDENDOOR VETERAN CAR GARMENT LIMITED
香港金門老爺車服飾有限公司",2004-12-22,2010-05-20,"Private, ltd by shares"250,0941592,"HONG KONG INTERNATIONAL INDUSTRY DEVELOPMENT LIMITED
香港國際產業發展有限公司",2004-12-22,2011-12-30,"Private, ltd by shares"251,0941609,"HONG KONG KAI YUAN PRECISE TOOLING LIMITED
香港開元精密模具有限公司",2004-12-22,,"Private, ltd by shares"252,0941582,"HONG KONG KAISER GROUP DECORATION &amp; ENGINEERING COMPANY LIMITED
香港佳源集團裝飾工程有限公司",2004-12-22,2010-10-22,"Private, ltd by shares"253,0941300,"HONG KONG KINGBO (INTERNATIONAL) SPORTS ACCESSORIES LIMITED
香港競博(國際)體育用品有限公司",2004-12-22,2009-05-15,"Private, ltd by shares"254,0941303,"HONG KONG LAN MEI BIOLOGY LIMITED
香港藍美生物有限公司",2004-12-22,2010-05-20,"Private, ltd by shares"255,0941721,"HONG KONG LI SI PAK SHING ENGINEERING LIMITED
香港利事百晟工程有限公司",2004-12-22,2019-10-25,"Private, ltd by shares"256,0941453,"HONG KONG PANIST INTERNATIONAL FASHION LIMITED
香港帕尼斯特國際服飾有限公司",2004-12-22,2009-05-15,"Private, ltd by shares"257,0941488,"HONG KONG RFID LIMITED
香港射頻有限公司",2004-12-22,,"Private, ltd by shares"258,0941586,"HONG KONG RU ZI NIU CONSTRUCTION ENGINEERING LIMITED
香港孺子牛建設工程有限公司",2004-12-22,2011-12-30,"Private, ltd by shares"259,0941591,"HONG KONG SHUN NGAI TRADING LIMITED
香港信藝貿易有限公司",2004-12-22,2017-04-13,"Private, ltd by shares"260,0941621,"HONG KONG WU DANG INTERNATIONAL TRAVEL &amp; HEALTH CARE LIMITED
香港武當國際旅遊保健有限公司",2004-12-22,2008-01-25,"Private, ltd by shares"261,0941515,"HONG KONG YAFEILA (INT'L) COSMETIC CO., LIMITED
香港雅菲拉(國際)化妝品有限公司",2004-12-22,2009-05-15,"Private, ltd by shares"262,0941302,"HONG KONG ZHI XIN NIAO INT'L GROUP LIMITED
香港知心鳥國際集團有限公司",2004-12-22,2011-12-30,"Private, ltd by shares"263,0941532,"HONGKONG CHINA CAPITAL HOLDINGS LIMITED
中聯國際投資管理集團有限公司",2004-12-22,2010-11-05,"Private, ltd by shares"264,0941531,"HONGKONG GUANGLIN INVESTMENT LIMITED
香港廣林投資有限公司",2004-12-22,2009-05-15,"Private, ltd by shares"265,0941601,"HONGKONG HENG CHUN TANG MEDICAL INTERNATIONAL HOLDINGS LIMITED
香港恒春堂醫藥國際集團有限公司",2004-12-22,2015-04-17,"Private, ltd by shares"266,0941573,"HONGKONG LANTEK ELECTRONIC LIMITED
香港聯坤電子有限公司",2004-12-22,2013-07-05,"Private, ltd by shares"267,0941547,"HONGKONG POWER RESOURCE GROUP CO., LIMITED
香港力之源集團有限公司",2004-12-22,2007-05-11,"Private, ltd by shares"268,0941600,"HONGKONG SHENG YUAN GARMENT (TAIWAN) INTERNATIONAL LIMITED
香港盛源服飾(台灣)國際有限公司",2004-12-22,2010-05-20,"Private, ltd by shares"269,0941648,"HOUSE OF SENIOR CARING YOUTH LIMITED
老人照顧兒童院有限公司",2004-12-22,,"Ltd by guarantee"270,0941505,"HUA TAI INTERNATIONAL TRADING LIMITED (d2019-05-24)
華泰國際貿易有限公司",2004-12-22,2019-05-24,"Private, ltd by shares"271,0941322,"HUADINI FASHION (HK) LIMITED
花迪妮服飾(香港)國際有限公司",2004-12-22,2020-07-17,"Private, ltd by shares"272,0941728,"HUGE ASCENT DEVELOPMENT LIMITED (d2009-08-28)
升宏發展有限公司",2004-12-22,2009-08-28,"Private, ltd by shares"273,0941448,"HUMAX HONG KONG LIMITED
數碼士香港有限公司",2004-12-22,,"Private, ltd by shares"274,0941690,"HUNG FOOK GROUP LIMITED
鴻福集團有限公司",2004-12-22,2006-01-13,"Private, ltd by shares"275,0941261,"HUNG TAT PLASTIC MANUFACTORY LIMITED
鴻達塑膠制品有限公司",2004-12-22,,"Private, ltd by shares"276,0941319,"IBS EXPRESS LIMITED
訊科速遞有限公司",2004-12-22,2012-07-20,"Private, ltd by shares"277,0941282,"IMMENSITY ENTERTAINMENT LIMITED
浩瀚天祥娛樂有限公司",2004-12-22,2009-12-18,"Private, ltd by shares"278,0941589,"IMPERIAL PRODUCTION LIMITED
御用製作有限公司",2004-12-22,,"Private, ltd by shares"279,0941365,"INCO METALWARE LIMITED
盈佳五金有限公司",2004-12-22,,"Private, ltd by shares"280,0941396,"INDOCHINA SHIPPING COMPANY LIMITED",2004-12-22,2006-09-29,"Private, ltd by shares"281,0941420,"INNOVA TRADE LIMITED",2004-12-22,2012-09-14,"Private, ltd by shares"282,0941659,"INSPIRE DESIGN LIMITED (d2010-05-20)
意皓設計有限公司",2004-12-22,2010-05-20,"Private, ltd by shares"283,0941364,"INTECH LAMPS COLLECTION LIMITED
盈得光源電業有限公司",2004-12-22,2014-12-24,"Private, ltd by shares"284,0941709,"INTELLIGENT INVESTMENTS LIMITED (HK)
聰慧投資有限公司",2004-12-22,,"Private, ltd by shares"285,0941622,"INTERCONTINENTAL LACE INDUSTRY LIMITED",2004-12-22,,"Private, ltd by shares"286,0941289,"INTERNATIONAL EEE (HONG KONG) PROPERTY INVESTMENT LIMITED
國際乙乙乙(香港)置業投資有限公司",2004-12-22,2009-05-15,"Private, ltd by shares"287,0941414,"ISM INTERNATIONAL LIMITED (HK)",2004-12-22,,"Private, ltd by shares"288,0941687,"ITALY AUROLA DIAMOND GROUP LIMITED
意大利奧羅拉鑽石集團有限公司",2004-12-22,,"Private, ltd by shares"289,0941534,"ITALY GADOLLA GARMENT GROUP LIMITED
意大利格多萊服飾集團有限公司",2004-12-22,2011-06-30,"Private, ltd by shares"290,0941525,"ITALY KAMCITAM (H.K) INT'L GROUP LIMITED
意大利金仕登(香港)國際集團有限公司",2004-12-22,2009-05-15,"Private, ltd by shares"291,0941288,"ITALY KANGAROO CLOTHING &amp; ACCESSORIES (HONG KONG) INTERNATIONAL LIMITED
意大利袋鼠服飾(香港)國際有限公司",2004-12-22,2009-05-15,"Private, ltd by shares"292,0941494,"ITALY MCYECASUM INT'L GROUP LIMITED
意大利麥爾卡森國際集團有限公司",2004-12-22,2010-04-30,"Private, ltd by shares"293,0941568,"ITALY RED DRAGONFLY SHOES &amp; CLOTHES INVESTMENT LIMITED
意大利紅蜻蜓鞋服投資有限公司",2004-12-22,2010-05-20,"Private, ltd by shares"294,0941681,"ITALY SAI HU INTERNATIONAL GROUP SHOES LIMITED
意大利賽狐國際集團鞋業有限公司",2004-12-22,2009-05-15,"Private, ltd by shares"295,0941246,"ITALY SENIOR HEADING (H.K) INT'L INDUSTRIAL LIMITED
意大利老人頭(香港)國際實業有限公司",2004-12-22,2007-11-16,"Private, ltd by shares"296,0941661,"ITALY WOODPECKER ASIA PACIFIC HOLDING GROUP LIMITED
意大利啄木鳥亞太控股集團有限公司",2004-12-22,2015-04-24,"Private, ltd by shares"297,0941386,"J&amp;J INFORMATIONS TECHNOLOGY CO., LIMITED",2004-12-22,2014-05-09,"Private, ltd by shares"298,0941613,"JACA INTERNATIONAL LIMITED",2004-12-22,2011-12-30,"Private, ltd by shares"299,0941685,"JAKE TECH (H.K.) LIMITED
傑克科技(香港)有限公司",2004-12-22,2013-02-08,"Private, ltd by shares"300,0941520,"JAPAN DUOTIAN ELECTRIC H.K IMPERIAL CROWN LIMITED
日本多田電器香港皇冠有限公司",2004-12-22,2010-10-15,"Private, ltd by shares"301,0941408,"JAPAN LEWA (H.K.) ELECTRON LIMITED
日本愛娃(香港)電子有限公司",2004-12-22,2009-05-15,"Private, ltd by shares"302,0941527,"JAPAN SAMOYO INTERNATIONAL ELECTRIC LIMITED
日本三木國際電氣有限公司",2004-12-22,2011-10-07,"Private, ltd by shares"303,0941556,"JAYTEX DIRECT LIMITED",2004-12-22,2020-04-24,"Private, ltd by shares"304,0941400,"JC COMMUNICATIONS LIMITED (HK)
捷思資訊有限公司",2004-12-22,,"Private, ltd by shares"305,0941548,"JD Cloud Warehouse Supply Chain Holding Group Limited
京東雲倉供應鏈控股集團有限公司",2004-12-22,,"Private, ltd by shares"306,0941618,"JECTA MOTORS COMPANY LIMITED
捷達汽車有限公司",2004-12-22,,"Private, ltd by shares"307,0941378,"JI ZHI RONG (HK) HOLDING LIMITED
吉之榮(香港)股份有限公司",2004-12-22,2018-08-10,"Private, ltd by shares"308,0941317,"JIA FENG SPORTING GOODS LIMITED
佳峰運動用品有限公司",2004-12-22,2006-07-14,"Private, ltd by shares"309,0941363,"JIALI GROUP INVESTMENT LIMITED
嘉利(集團)投資有限公司",2004-12-22,,"Private, ltd by shares"310,0941517,"JIN RONG INT'L INVESTMENT LIMITED
晉榮國際投資有限公司",2004-12-22,2009-05-15,"Private, ltd by shares"311,0941572,"JIN XI HUAN QIU MANUFACTURING LIMITED
金璽寰球製造有限公司",2004-12-22,,"Private, ltd by shares"312,0941729,"JOINT BILLION DEVELOPMENT LIMITED
兆盟發展有限公司",2004-12-22,,"Private, ltd by shares"313,0941747,"JOINT CHARM LIMITED
滙倡有限公司",2004-12-22,2011-07-14,"Private, ltd by shares"314,0941730,"JOINT FANCY INTERNATIONAL LIMITED
滙享國際有限公司",2004-12-22,2009-05-15,"Private, ltd by shares"315,0941746,"JOINT GRAND LIMITED
滙泰有限公司",2004-12-22,,"Private, ltd by shares"316,0941731,"JOINT GROUP DEVELOPMENT LIMITED
協滙發展有限公司",2004-12-22,2020-11-06,"Private, ltd by shares"317,0941710,"JOINT MASTER HOLDINGS LIMITED
匯聚集團有限公司",2004-12-22,,"Private, ltd by shares"318,0941767,"JOINT NEW LIMITED
集新有限公司",2004-12-22,,"Private, ltd by shares"319,0941732,"JOINT PINE INTERNATIONAL LIMITED
栢滙國際有限公司",2004-12-22,2006-07-28,"Private, ltd by shares"320,0941733,"JOINT TRIUMPH INTERNATIONAL LIMITED
滙凱國際有限公司",2004-12-22,2015-08-14,"Private, ltd by shares"321,0941766,"JOINT WEALTH CORPORATION LIMITED
匡聯有限公司",2004-12-22,,"Private, ltd by shares"322,0941395,"JOY STAR ALUMINIUM &amp; GLASS ENGINEERING LIMITED
穎星鋁質玻璃工程有限公司",2004-12-22,,"Private, ltd by shares"323,0941295,"K. POINTER INDUSTRIAL (TEXTILES) LIMITED
佑進實業(紡織品)有限公司",2004-12-22,2011-12-30,"Private, ltd by shares"324,0941264,"K.C. &amp; MARK'S LIMITED
姬絲瑪赫有限公司",2004-12-22,2011-12-30,"Private, ltd by shares"325,0941816,"KANABEACH HK LIMITED",2004-12-22,2011-11-25,"Private, ltd by shares"326,0941280,"KATTERWALL LIMITED",2004-12-22,2019-04-12,"Private, ltd by shares"327,0941745,"KEEN CENTRE LIMITED
建中有限公司",2004-12-22,,"Private, ltd by shares"328,0941824,"KEI FOOK INTERNATIONAL JEWELLERY (HK) LIMITED
祺福國際珠寶(香港)有限公司",2004-12-22,2010-05-20,"Private, ltd by shares"329,0941362,"KHC LIMITED (HK)
華昌隆有限公司",2004-12-22,,"Private, ltd by shares"330,0941443,"KI SHUN INDUSTRIAL LIMITED
奇順實業有限公司",2004-12-22,,"Private, ltd by shares"331,0941594,"KINDA PRODUCTS LIMITED",2004-12-22,,"Private, ltd by shares"332,0941459,"KING SHINY LIMITED
君毅有限公司",2004-12-22,,"Private, ltd by shares"333,0941462,"KING SMARTLY LIMITED
君鋒有限公司",2004-12-22,2010-07-02,"Private, ltd by shares"334,0941734,"KING WEALTHY INTERNATIONAL LIMITED (d2016-06-17)
帝寶國際有限公司",2004-12-22,2016-06-17,"Private, ltd by shares"335,0941640,"KINGBOX INVESTMENT LIMITED
金盒投資有限公司",2004-12-22,2008-03-20,"Private, ltd by shares"336,0941653,"KINGBOX PRODUCTION LIMITED
金盒(中國)製品有限公司",2004-12-22,2008-03-20,"Private, ltd by shares"337,0941688,"KINGDOM INTERNATIONAL (HONG KONG) CO., LIMITED
金樂國際(香港)有限公司",2004-12-22,2007-04-04,"Private, ltd by shares"338,0941352,"KINGPIN LIMITED (d2013-07-26)",2004-12-22,2013-07-26,"Private, ltd by shares"339,0941423,"KOKMAY INVESTMENT (HK) INT'L GROUP LIMITED
香港國美投資國際集團有限公司",2004-12-22,2011-12-30,"Private, ltd by shares"340,0941298,"KOREA GOLD FOX FASHION HOLDING LIMITED
韓國金狐狸服飾控股有限公司",2004-12-22,2011-10-07,"Private, ltd by shares"341,0941499,"KOUGIBO (HONG KONG) LIMITED
高資堡(香港)有限公司",2004-12-22,2010-04-21,"Private, ltd by shares"342,0941369,"KUM SHING GROUP LIMITED
金城營造集團有限公司",2004-12-22,,"Private, ltd by shares"343,0941432,"KWONG YUEN LOGISTICS COMPANY LIMITED
廣源物流有限公司",2004-12-22,,"Private, ltd by shares"344,0941836,"L &amp; C CROSSOVER LIMITED
展圖跨越有限公司",2004-12-22,2012-06-29,"Private, ltd by shares"345,0941498,"L &amp; J TRANSPORTATION LIMITED",2004-12-22,,"Private, ltd by shares"346,0941538,"LAH KAH WEI HOLDINGS LIMITED
利嘉慧控股有限公司",2004-12-22,,"Private, ltd by shares"347,0941434,"LAI CHUN INTERNATIONAL DEVELOPMENT (HONGKONG) LIMITED
勵駿國際發展(香港)有限公司",2004-12-22,2010-11-19,"Private, ltd by shares"348,0941842,"LANE DESIGN JEWELLERY CO. LIMITED
名門珠寶設計有限公司",2004-12-22,,"Private, ltd by shares"349,0941283,"LAPUTA ENGINEERING (HONG KONG) LIMITED
天空科技有限公司",2004-12-22,2011-12-30,"Private, ltd by shares"350,0941837,"LAYOUT URBAN DEVELOPMENT CONSULTANTS LIMITED
雷奧城市發展顧問有限公司",2004-12-22,2010-05-28,"Private, ltd by shares"351,0941597,"LECCAN TECHNOLOGY COMPANY LIMITED
綠創科技有限公司",2004-12-22,,"Private, ltd by shares"352,0941344,"LEUNG CHUK SUN COMPANY LIMITED
梁祝新有限公司",2004-12-22,2013-02-22,"Private, ltd by shares"353,0941347,"LGA LIMITED (d2009-04-24)",2004-12-22,2009-04-24,"Private, ltd by shares"354,0941626,"LI &amp; CRYSTAL INTERNATIONAL INVESTMENT LIMITED
集韞國際投資有限公司",2004-12-22,2011-07-08,"Private, ltd by shares"355,0941355,"Li &amp; Fung Retailing (Taiwan) Limited
利豐零售(台灣)有限公司",2004-12-22,2011-11-23,"Private, ltd by shares"356,0941553,"LIGHTSUN CHENCO ASSOCIATES CO., LIMITED
香港萊德盛經貿有限公司",2004-12-22,2011-08-05,"Private, ltd by shares"357,0941615,"LIK KWAN ENGINEERING COMPANY LIMITED
力群工程有限公司",2004-12-22,,"Private, ltd by shares"358,0941328,"LINK AIM INDUSTRIAL LIMITED
聯標實業有限公司",2004-12-22,2013-05-24,"Private, ltd by shares"359,0941614,"LIVING HOME LIMITED (THE)",2004-12-22,2013-02-08,"Private, ltd by shares"360,0941385,"LIWEI (INT'L) TRADING LIMITED
力威企業國際有限公司",2004-12-22,2017-09-01,"Private, ltd by shares"361,0941343,"LOGLOGIC HK (CHINA) LIMITED",2004-12-22,,"Private, ltd by shares"362,0941256,"LONG DRIVERS OF CHINA, LIMITED
中國高爾夫球擊遠協會有限公司",2004-12-22,2007-06-08,"Private, ltd by shares"363,0941437,"LONG HIN INT'L INVESTMENT LIMITED
朗軒國際投資有限公司",2004-12-22,2010-05-20,"Private, ltd by shares"364,0941252,"LSPG LIMITED",2004-12-22,,"Private, ltd by shares"365,0941735,"LUCK CASTLE INTERNATIONAL LIMITED
福堡國際有限公司",2004-12-22,,"Private, ltd by shares"366,0941765,"LUCK CHARM LIMITED (d2016-05-27)
瑞昌有限公司",2004-12-22,2016-05-27,"Private, ltd by shares"367,0941736,"LUCK FINE INTERNATIONAL LIMITED
福明國際有限公司",2004-12-22,2018-08-24,"Private, ltd by shares"368,0941263,"LUCKY DOG PRODUCTIONS LIMITED",2004-12-22,2018-08-24,"Private, ltd by shares"369,0941398,"LUNG CHEUNG (HONG KONG) INTERNATIONAL INVESTMENT COMPANY LIMITED
龍翔(香港)國際投資有限公司",2004-12-22,2010-05-20,"Private, ltd by shares"370,0941407,"M &amp; A ASSOCIATES LIMITED (d2012-02-03)",2004-12-22,2012-02-03,"Private, ltd by shares"371,0941393,"MADRIGAL RESOURCES LIMITED",2004-12-22,2017-07-28,"Private, ltd by shares"372,0941634,"MAI JI KE ELECTRONIC DEVELOPMENT LIMITED
邁吉科電子發展有限公司",2004-12-22,2016-04-01,"Private, ltd by shares"373,0941251,"MAN FUNG DEPARTMENT STORE LIMITED
萬豐百貨有限公司",2004-12-22,2009-05-15,"Private, ltd by shares"374,0941506,"MAN LUEN (CHEUK YUET) LOGISTICS COMPANY LIMITED
文聯(卓越)物流有限公司",2004-12-22,,"Private, ltd by shares"375,0941662,"MANJAYE INT'L (ASIA) ELECTRONICS CO., LIMITED
萬家國際(亞洲)電子有限公司",2004-12-22,2017-06-02,"Private, ltd by shares"376,0941764,"MASTER BILLION CORPORATION LIMITED
萬兆有限公司",2004-12-22,2008-06-27,"Private, ltd by shares"377,0941353,"MASTERLY LIMITED (HK)",2004-12-22,,"Private, ltd by shares"378,0941763,"MAX THOUSAND LIMITED (d2007-11-23)
千豐有限公司",2004-12-22,2007-11-23,"Private, ltd by shares"379,0941321,"MAXIS LEGAL TRANSLATION SERVICE LIMITED
敏思法律翻譯服務有限公司",2004-12-22,,"Private, ltd by shares"380,0941388,"MECCA HOLDINGS COMPANY LIMITED
錦輝控股有限公司",2004-12-22,2007-11-09,"Private, ltd by shares"381,0941415,"MEDICENTRE (HK) LIMITED
萬治(香港)有限公司",2004-12-22,,"Private, ltd by shares"382,0941737,"MEGA BRILLIANT DEVELOPMENT LIMITED
百明發展有限公司",2004-12-22,,"Private, ltd by shares"383,0941738,"MEGA FINE DEVELOPMENT LIMITED
百輝發展有限公司",2004-12-22,2019-01-18,"Private, ltd by shares"384,0941390,"MEGAVIEW (HK) COMPANY LIMITED
威科視迅(香港)有限公司",2004-12-22,2012-06-01,"Private, ltd by shares"385,0941306,"MEILI CENTURY GROUP DEVELOPMENT LIMITED
美力世紀集團發展有限公司",2004-12-22,2013-02-08,"Private, ltd by shares"386,0941481,"MENTIC INVESTMENT LIMITED
新雄投資有限公司",2004-12-22,,"Private, ltd by shares"387,0941830,"MERIT FIELD HOLDINGS LIMITED
麗暉集團有限公司",2004-12-22,2011-12-30,"Private, ltd by shares"388,0941471,"MEYTIC LIMITED
君時有限公司",2004-12-22,2013-07-17,"Private, ltd by shares"389,0941373,"MF Global Holdings HK Limited
明富環球控股香港有限公司",2004-12-22,2019-08-07,"Private, ltd by shares"390,0941558,"MGT LIMITED",2004-12-22,2018-11-16,"Private, ltd by shares"391,0941249,"MILE CONTRACTING LIMITED",2004-12-22,2008-01-11,"Private, ltd by shares"392,0941704,"Millicom International (U.A.E.) Limited",2004-12-22,2010-06-11,"Private, ltd by shares"393,0941397,"MINT PROJECT COMPANY LIMITED",2004-12-22,2010-05-20,"Private, ltd by shares"394,0941607,"MIRORCLE (HONG KONG) PTE LIMITED
脒瑞科(香港)有限公司",2004-12-22,2010-10-15,"Private, ltd by shares"395,0941722,"MITSUKUCHI GROUP LIMITED
三口集團有限公司",2004-12-22,,"Private, ltd by shares"396,0941744,"MORAL MAX LIMITED (d2007-03-16)
德沛有限公司",2004-12-22,2007-03-16,"Private, ltd by shares"397,0941762,"MORAL OCEAN LIMITED (d2008-01-18)
德洋有限公司",2004-12-22,2008-01-18,"Private, ltd by shares"398,0941743,"MORAL SUCCESS LIMITED
德隆有限公司",2004-12-22,,"Private, ltd by shares"399,0941739,"MORE WISE INTERNATIONAL LIMITED (d2010-05-20)
智添國際有限公司",2004-12-22,2010-05-20,"Private, ltd by shares"400,0941285,"MORGAN SANDA INVESTMENTS LIMITED
摩根盛代投資有限公司",2004-12-22,2011-12-30,"Private, ltd by shares"401,0941637,"MULTI PRECISION IND. LIMITED
榮高精密實業有限公司",2004-12-22,,"Private, ltd by shares"402,0941274,"MULTI-WORK FASHION ACCESSORIES LIMITED
嘉仁服飾輔料有限公司",2004-12-22,,"Private, ltd by shares"403,0941770,"MUTUAL GROUP DEVELOPMENT LIMITED
聯眾發展有限公司",2004-12-22,2006-07-14,"Private, ltd by shares"404,0941826,"NATIONS INTERNATIONAL INVESTMENT COMPANY LIMITED
萬國國際投資有限公司",2004-12-22,2010-05-20,"Private, ltd by shares"405,0941529,"NATURE BRITE INTERNATIONAL CO., LIMITED
勵卓國際有限公司",2004-12-22,2010-05-20,"Private, ltd by shares"406,0941571,"NEW ASIA (HONGKONG) TECHNOLOGY LIMITED
新亞(香港)科技有限公司",2004-12-22,,"Private, ltd by shares"407,0941374,"NEW POINT WORLD TRADE (ASIA) LIMITED
新豐世貿(亞洲)有限公司",2004-12-22,2014-04-11,"Private, ltd by shares"408,0941645,"NEWSTAR TECHNOLOGY (ASIA) CO., LIMITED
鑫仕達技術(亞洲)有限公司",2004-12-22,2014-04-11,"Private, ltd by shares"409,0941259,"NOUVEAU CONTINENT HOTEL, PROPERTY &amp; INVESTMENT MANAGEMENT LIMITED
新洲酒店、物業及投資管理有限公司",2004-12-22,2016-08-19,"Private, ltd by shares"410,0941258,"NOUVEAU CONTINENT TRADING LIMITED
新洲貿易有限公司",2004-12-22,2016-08-19,"Private, ltd by shares"411,0941334,"OCEAN HIP HOLDINGS LIMITED
海軒集團有限公司",2004-12-22,2010-05-20,"Private, ltd by shares"412,0941814,"OGAWA HEALTH CARE (HK) LIMITED",2004-12-22,2010-05-20,"Private, ltd by shares"413,0941430,"ON KEUNG DEVELOPMENT CO., LIMITED
安強發展有限公司",2004-12-22,,"Private, ltd by shares"414,0941290,"ONER LIMITED
柏芯有限公司",2004-12-22,,"Private, ltd by shares"415,0941639,"OPAL PARTS MANUFACTURING COMPANY LIMITED
奧普塑膠五金制造有限公司",2004-12-22,,"Private, ltd by shares"416,0941835,"ORIENT TECHNOLOGY LIMITED
新東方科技有限公司",2004-12-22,,"Private, ltd by shares"417,0941533,"OUR PHARMACY LIMITED",2004-12-22,2009-04-24,"Private, ltd by shares"418,0941718,"OUTMAN (HK) LIMITED",2004-12-22,,"Private, ltd by shares"419,0941579,"OUTSMARTING SIGMA (H.K.) LIMITED
奧騰思格瑪(香港)有限公司",2004-12-22,,"Private, ltd by shares"420,0941417,"OVER OCEANS FOREIGN TRADING CO., LIMITED
遠洋對外貿易有限公司",2004-12-22,,"Private, ltd by shares"421,0941611,"OXXEN (HONG KONG) CO., LIMITED
澳克森(香港)有限公司",2004-12-22,,"Private, ltd by shares"422,0941440,"PAK TO INT'L GROUP LIMITED
柏濤國際集團有限公司",2004-12-22,2018-01-19,"Private, ltd by shares"423,0941425,"PANASIA TRAVEL COMPANY LIMITED
泛亞旅運有限公司",2004-12-22,2015-08-28,"Private, ltd by shares"424,0941552,"PANG TAT FOODS LIMITED
鵬達食品有限公司",2004-12-22,,"Private, ltd by shares"425,0941449,"PATHAN TRADING AND AUTO DISMANTLING LIMITED",2004-12-22,,"Private, ltd by shares"426,0941647,"PEOPLE'S HEALTH ACTIONS LIMITED
全民健康動力有限公司",2004-12-22,2015-04-24,"Ltd by guarantee"427,0941281,"PHARMA EIGHT LIMITED
泛馬八製藥有限公司",2004-12-22,2010-09-03,"Private, ltd by shares"428,0941546,"PHC DENTAL SERVICES LIMITED
基健牙科服務有限公司",2004-12-22,2010-06-18,"Private, ltd by shares"429,0941593,"PICS LIMITED
太平洋投資諮問有限公司",2004-12-22,2011-12-30,"Private, ltd by shares"430,0941268,"PIT HOUSE LIMITED",2004-12-22,2015-04-17,"Private, ltd by shares"431,0941316,"PLAYMATES TOYS INTERNATIONAL LIMITED",2004-12-22,2012-07-06,"Private, ltd by shares"432,0941507,"PLEASURE LIMITED (HK)
諾意有限公司",2004-12-22,,"Private, ltd by shares"433,0941619,"POISE JEWELLERY COMPANY LIMITED
禮裕珠寶有限公司",2004-12-22,,"Private, ltd by shares"