,Reg no.,Name,Incorp-orated,Dissolved,Type220,0778282,"MESON TECHNOLOGY (H.K.) LIMITED
鳴盛科技(香港)股份有限公司",2001-12-05,2008-11-28,"Private, ltd by shares"221,0778514,"MILLION LINKAGE CORPORATION LIMITED
宏碩八通有限公司",2001-12-05,2015-04-02,"Private, ltd by shares"222,0778355,"MIN SOO PRECISION INDUSTRIES (HONG KONG) CO. LIMITED
明塑精密工業(香港)有限公司",2001-12-05,2008-04-18,"Private, ltd by shares"223,0778271,"MIND CONCEPT LIMITED
啟思有限公司",2001-12-05,,"Private, ltd by shares"224,0778519,"MINDBRANCH ASIA PACIFIC (HK) LIMITED",2001-12-05,2004-09-17,"Private, ltd by shares"225,0778450,"MODERN DENTAL CLINIC LIMITED
現代牙科醫務所有限公司",2001-12-05,,"Private, ltd by shares"226,0778413,"MODERN GLOBAL LIMITED
現代環球有限公司",2001-12-05,,"Private, ltd by shares"227,0778231,"MONTEGLE PRODUCTION LIMITED
金鷹製作有限公司",2001-12-05,,"Private, ltd by shares"228,0778391,"MULTI FORWARD INTERNATIONAL LIMITED
三聯國際貨運有限公司",2001-12-05,2004-10-08,"Private, ltd by shares"229,0778411,"MULTI LINK CORPORATION LIMITED (d2003-08-22)
駿能有限公司",2001-12-05,2003-08-22,"Private, ltd by shares"230,0778206,"MULTI STAR DEVELOPMENT LIMITED
盛嘉發展有限公司",2001-12-05,2015-04-02,"Private, ltd by shares"231,0778210,"MULTI WELL CONSULTANTS LIMITED
萬威顧問有限公司",2001-12-05,,"Private, ltd by shares"232,0778204,"MULTI WIN TRADING LIMITED
萬盈貿易有限公司",2001-12-05,,"Private, ltd by shares"233,0778415,"MUTUAL TREND HOLDINGS LIMITED
民昌集團有限公司",2001-12-05,2008-04-18,"Private, ltd by shares"234,0778274,"NATURAL INTERNATIONAL DEVELOPMENT LIMITED
天然國際發展有限公司",2001-12-05,2008-04-18,"Private, ltd by shares"235,0778476,"NATURAL RESOURCES LIMITED (HK)",2001-12-05,,"Private, ltd by shares"236,0778388,"NAVIGATOR BIOMETRIC FAR EAST LIMITED",2001-12-05,2002-10-04,"Private, ltd by shares"237,0778347,"NESSEN ENTERPRISES LIMITED
力盛企業有限公司",2001-12-05,2005-10-30,"Private, ltd by shares"238,0778522,"NEW AGE DIAMOND LIMITED
新紀元鑽石有限公司",2001-12-05,2007-11-16,"Private, ltd by shares"239,0778472,"NEW GOLD MOUNTAIN INTERNATIONAL COMPANY LIMITED
新金山國際有限公司",2001-12-05,2007-08-10,"Private, ltd by shares"240,0778513,"NEW GOLDEN SHIPPING LIMITED
新金航運有限公司",2001-12-05,2014-04-17,"Private, ltd by shares"241,0778383,"NEW HENRY OPTICAL MANUFACTORY LIMITED
新恒利眼鏡製造有限公司",2001-12-05,,"Private, ltd by shares"242,0778447,"NEW HONG KONG STELTEL COMPANY LIMITED
新香港星際傳播有限公司",2001-12-05,2003-12-24,"Private, ltd by shares"243,0778272,"NEW LOYAL LIMITED (d2016-11-18)
鴻新有限公司",2001-12-05,2016-11-18,"Private, ltd by shares"244,0778433,"NEW SILVER SHIPPING LIMITED
新銀航運有限公司",2001-12-05,2012-08-10,"Private, ltd by shares"245,0778508,"NEW UNION TECHNOLOGY LIMITED
新科香港有限公司",2001-12-05,,"Private, ltd by shares"246,0778280,"NEW WORLD ENVIRONMENTAL CONSTRUCTION &amp; DECORATION COMPANY LIMITED
新世界環保建材裝飾工程有限公司",2001-12-05,,"Private, ltd by shares"247,0778381,"NEWBEST DEVELOPMENT LIMITED
佳新發展有限公司",2001-12-05,2014-05-23,"Private, ltd by shares"248,0778171,"NOODLEWEB LIMITED",2001-12-05,2014-03-21,"Private, ltd by shares"249,0778304,"ORIENTAL TOP INTERNATIONAL LIMITED (d2007-04-13)
僑達國際有限公司",2001-12-05,2007-04-13,"Private, ltd by shares"250,0778510,"ORIGINAL VIDEO (HONG KONG) LIMITED
正影音(香港)有限公司",2001-12-05,2015-08-21,"Private, ltd by shares"251,0778352,"ORSO TRADING &amp; DEVELOPMENT LIMITED
澳索貿易發展有限公司",2001-12-05,2007-04-13,"Private, ltd by shares"252,0778445,"OVERSEAS COMMERCE TRADING LIMITED
僑商貿易有限公司",2001-12-05,2014-03-21,"Private, ltd by shares"253,0778255,"PACIFIC KNITTERS COMPANY LIMITED
太平洋針織有限公司",2001-12-05,2010-04-16,"Private, ltd by shares"254,0778301,"PAITE PRECIOUS METAL (H.K.) LIMITED
香港派特貴金屬有限公司",2001-12-05,2009-07-10,"Private, ltd by shares"255,0778344,"PAKCO LIMITED
栢合有限公司",2001-12-05,2011-12-16,"Private, ltd by shares"256,0778192,"PINE BASE LIMITED (d2016-01-27)
栢怡有限公司",2001-12-05,2016-01-27,"Private, ltd by shares"257,0778453,"POLSO AIR CARGO CO. LIMITED",2001-12-05,,"Private, ltd by shares"258,0778528,"POMAX LIMITED (d2008-03-31)
寶永有限公司",2001-12-05,2008-03-31,"Private, ltd by shares"259,0778307,"POSS TRADING INTERNATIONAL LIMITED
保昇貿易國際有限公司",2001-12-05,,"Private, ltd by shares"260,0778336,"POWER RANK LIMITED
力宜有限公司",2001-12-05,2008-06-20,"Private, ltd by shares"261,0778430,"POWERBAT ELECTRONICS LIMITED
電龍電子有限公司",2001-12-05,2005-03-11,"Private, ltd by shares"262,0778186,"POWERFUL MIGHT INVESTMENTS LIMITED
逸智投資有限公司",2001-12-05,2004-05-14,"Private, ltd by shares"263,0778438,"PQ CHINA (HONG KONG) LIMITED",2001-12-05,,"Private, ltd by shares"264,0778194,"PRINT UP COMPANY LIMITED
神采印刷有限公司",2001-12-05,2019-04-26,"Private, ltd by shares"265,0778205,"PROFIT MADE INVESTMENTS LIMITED
鉅盈投資有限公司",2001-12-05,2007-11-09,"Private, ltd by shares"266,0778499,"PROSPEROUS FIELD LIMITED (d2007-04-20)
田心有限公司",2001-12-05,2007-04-20,"Private, ltd by shares"267,0778516,"PUBLIC COMMUNICATION STRATEGIC CONSULTANCY LIMITED
公共傳理顧問有限公司",2001-12-05,,"Private, ltd by shares"268,0778279,"RAPAPORT HONG KONG LIMITED",2001-12-05,,"Private, ltd by shares"269,0778346,"RB SERIES LIMITED
埃比斯有限公司",2001-12-05,2013-11-08,"Private, ltd by shares"270,0778232,"RCI WINVAST INDUSTRIES LIMITED
中擴永威實業有限公司",2001-12-05,,"Private, ltd by shares"271,0778291,"REAL GOOD LIMITED (d2005-03-24)
真佳有限公司",2001-12-05,2005-03-24,"Private, ltd by shares"272,0778292,"RICH ASCENT LIMITED (d2007-02-16)
騰駿有限公司",2001-12-05,2007-02-16,"Private, ltd by shares"273,0778229,"RICHLAND INDUSTRIES LIMITED
富億實業有限公司",2001-12-05,2019-09-20,"Private, ltd by shares"274,0778532,"RISE TEAM LIMITED (d2017-07-14)
升聯有限公司",2001-12-05,2017-07-14,"Private, ltd by shares"275,0778238,"RUIHAO DEVELOPMENT COMPANY LIMITED
瑞豪發展(香港)有限公司",2001-12-05,2003-08-08,"Private, ltd by shares"276,0778485,"S &amp; S BUSINESS CONSULTANTS LIMITED (HK)
瑞威商務顧問有限公司",2001-12-05,,"Private, ltd by shares"277,0778191,"SAM HING MANUFACTURING COMPANY LIMITED
三興製造有限公司",2001-12-05,,"Private, ltd by shares"278,0778299,"SENAO INTERNATIONAL COMPANY LIMITED
神腦國際有限公司",2001-12-05,2015-05-08,"Private, ltd by shares"279,0778414,"SENTECH INTERNATIONAL LIMITED (d2005-09-09)
顯達國際有限公司",2001-12-05,2005-09-09,"Private, ltd by shares"280,0778505,"SHEEN INTERNATIONAL LIMITED (d2009-07-10)
順欣國際有限公司",2001-12-05,2009-07-10,"Private, ltd by shares"281,0778480,"SHEEN RICH DEVELOPMENT LIMITED
盛益發展有限公司",2001-12-05,,"Private, ltd by shares"282,0778343,"SHELLIN LIMITED (d2005-08-05)
信臨有限公司",2001-12-05,2005-08-05,"Private, ltd by shares"283,0778351,"SIN-I HI-TECH LIMITED
信愛科技有限公司",2001-12-05,,"Private, ltd by shares"284,0778174,"SINOPOWER INTERNATIONAL INVESTMENT HOLDINGS LIMITED
中威國際投資集團有限公司",2001-12-05,2007-02-23,"Private, ltd by shares"285,0778373,"SKINSATIONAL LIMITED
靚膚堂有限公司",2001-12-05,2007-04-13,"Private, ltd by shares"286,0778412,"SKY CONSTRUCTION MATERIALS LIMITED
世佳建材有限公司",2001-12-05,2005-09-09,"Private, ltd by shares"287,0778502,"SKY SHEEN LIMITED
天原有限公司",2001-12-05,,"Private, ltd by shares"288,0778530,"SMART CREATOR DEVELOPMENT LIMITED
創思發展有限公司",2001-12-05,2005-09-02,"Private, ltd by shares"289,0778364,"SPARKS 21 LIMITED",2001-12-05,,"Private, ltd by shares"290,0778526,"SPEED TEAM LIMITED
迅昇有限公司",2001-12-05,2007-04-20,"Private, ltd by shares"291,0778379,"SPM (HONG KONG) LIMITED",2001-12-05,2004-04-30,"Private, ltd by shares"292,0778293,"STAND CONCEPT LIMITED (d2003-05-16)
展立有限公司",2001-12-05,2003-05-16,"Private, ltd by shares"293,0778458,"STRONG DYNAMIC LIMITED
昌瑞有限公司",2001-12-05,,"Private, ltd by shares"294,0778233,"SUGAR 3 INTERNATIONAL LIMITED",2001-12-05,,"Private, ltd by shares"295,0778409,"SUN GLOBAL LIMITED (d2007-04-13)
新恒有限公司",2001-12-05,2007-04-13,"Private, ltd by shares"296,0778466,"SUN TAT COMPUTER KNITTING FACTORY LIMITED
新達電腦針織廠有限公司",2001-12-05,2010-04-30,"Private, ltd by shares"297,0778467,"SUNUP INTERNATIONAL LIMITED (d2005-02-18)
辰陽國際有限公司",2001-12-05,2005-02-18,"Private, ltd by shares"298,0778294,"SUNWEALTH CORPORATION LIMITED
日裕有限公司",2001-12-05,,"Private, ltd by shares"299,0778471,"SUPER STRONG INTERNATIONAL COMPANY LIMITED
榮雄國際有限公司",2001-12-05,2004-07-09,"Private, ltd by shares"300,0778198,"SURE BRIGHT (CHINA) LIMITED (d2006-04-13)
新輝(中國)有限公司",2001-12-05,2006-04-13,"Private, ltd by shares"301,0778184,"SWAL CHINA LIMITED",2001-12-05,2007-07-20,"Private, ltd by shares"302,0778529,"SYNERGY MEDICAL SUPPLY CO. LIMITED
力俊醫療設備有限公司",2001-12-05,,"Private, ltd by shares"303,0778457,"SYUSEI DEVELOPMENTS CO., LIMITED
眾盛發展有限公司",2001-12-05,,"Private, ltd by shares"304,0778463,"TANDY HOLDINGS LIMITED
天地控股有限公司",2001-12-05,2005-01-28,"Private, ltd by shares"305,0778424,"TANG TAT EXPRESS LIMITED
騰達速運有限公司",2001-12-05,2005-07-08,"Private, ltd by shares"306,0778208,"TARGET WIN ENTERPRISE LIMITED
榮建企業有限公司",2001-12-05,2008-06-20,"Private, ltd by shares"307,0778178,"TAT KEUNG ENVIRONMENTAL ENGINEERING LIMITED
達強環保工程有限公司",2001-12-05,,"Private, ltd by shares"308,0778236,"TECHLAND INVESTMENTS LIMITED (d2003-06-20)
達力投資有限公司",2001-12-05,2003-06-20,"Private, ltd by shares"309,0778354,"TENSON TECHNOLOGIES CO LIMITED
天聲科技有限公司",2001-12-05,2010-08-06,"Private, ltd by shares"310,0778247,"THUNDER TECH ELECTRONIC CO., LIMITED
迅雷科技有限公司",2001-12-05,2007-05-04,"Private, ltd by shares"311,0778244,"TIGER GROUP LIMITED (THE)
老虎集團有限公司",2001-12-05,,"Private, ltd by shares"312,0778446,"TIN WO INDUSTRIAL COMPANY LIMITED
天和實業有限公司",2001-12-05,2007-10-12,"Private, ltd by shares"313,0778253,"TODAY'S HOME LIMITED
今日家居專門店有限公司",2001-12-05,2007-11-23,"Private, ltd by shares"314,0778203,"TONTEX INTERNATIONAL LIMITED
同昇國際有限公司",2001-12-05,2010-09-24,"Private, ltd by shares"315,0778175,"TOP CHINA INTERNATIONAL INDUSTRIAL LIMITED
冠華國際實業有限公司",2001-12-05,2018-10-12,"Private, ltd by shares"316,0778361,"TOYO BUILDING MANAGEMENT COMPANY LIMITED
東洋物業管理有限公司",2001-12-05,2012-12-14,"Private, ltd by shares"317,0778461,"TRANSPACIFIC GATEWAY LIMITED (d2009-07-24)",2001-12-05,2009-07-24,"Private, ltd by shares"318,0778331,"Trendy Furniture (HK) Limited
金泉家具(香港)有限公司",2001-12-05,,"Private, ltd by shares"319,0778242,"TWO'S COMPANY LIMITED",2001-12-05,,"Private, ltd by shares"320,0778295,"UNI-CREATION LIMITED
創宇有限公司",2001-12-05,,"Private, ltd by shares"321,0778329,"UNION INTERNATIONAL INVESTMENT (HK) CO., LIMITED
香港聯手國際投資有限公司",2001-12-05,2019-10-25,"Private, ltd by shares"322,0778368,"UNION OF GARMENT MANUFACTURER COMPANY LIMITED (THE)
製衣同業聯盟有限公司",2001-12-05,2005-09-23,"Private, ltd by shares"323,0778431,"UNION REHAB-TECH LIMITED
環宇復康科技有限公司",2001-12-05,2005-03-11,"Private, ltd by shares"324,0778363,"UNITED HEALTH SERVICES MANAGEMENT LIMITED
匯德健康護理有限公司",2001-12-05,,"Private, ltd by shares"325,0778365,"UNIVISION INTELLIGENT TECHNOLOGY LIMITED
華視智能科技有限公司",2001-12-05,2008-01-11,"Private, ltd by shares"326,0778403,"US HELMET INT'L GROUP (HK) LIMITED
美國海瑪特國際集團(香港)有限公司",2001-12-05,2007-04-13,"Private, ltd by shares"327,0778211,"USINO HUMAN RESOURCES DEVELOPMENT LIMITED
美國海外人力資源發展集團有限公司",2001-12-05,2005-08-19,"Private, ltd by shares"328,0778525,"VENEXX LIMITED",2001-12-05,,"Private, ltd by shares"329,0778488,"VERTEX INTERNATIONAL TRADE LIMITED
威鼎國際貿易有限公司",2001-12-05,,"Private, ltd by shares"330,0778507,"VICTOR TRADING INTERNATIONAL LIMITED
群拓國際貿易有限公司",2001-12-05,2019-05-31,"Private, ltd by shares"331,0778273,"VICTORY BASE ENTERPRISE LIMITED
凱允企業有限公司",2001-12-05,2018-08-10,"Private, ltd by shares"332,0778259,"WAI HANG HANDBAG LIMITED
偉恒手袋有限公司",2001-12-05,2007-04-13,"Private, ltd by shares"333,0778305,"WAI HO ELECTRICAL DECORATION WORK LIMITED
偉豪電器裝飾設計有限公司",2001-12-05,2012-03-16,"Private, ltd by shares"334,0778378,"WE POLYMER SYSTEM CO., LIMITED
偉聚實業有限公司",2001-12-05,2004-06-25,"Private, ltd by shares"335,0778387,"WEI DIAN HANG (HK) COMPANY LIMITED
威電行(香港)有限公司",2001-12-05,2010-04-30,"Private, ltd by shares"336,0778221,"WELL LINK HOLDINGS LIMITED (d2006-02-28)
永恒集團有限公司",2001-12-05,2006-02-28,"Private, ltd by shares"337,0778384,"WELL UNION (H.K.) LIMITED
天威(香港)有限公司",2001-12-05,,"Private, ltd by shares"338,0778212,"WHY B.AND LIMITED",2001-12-05,2008-04-18,"Private, ltd by shares"339,0778249,"WILINSON INVESTMENT COMPANY LIMITED
威利新投資有限公司",2001-12-05,,"Private, ltd by shares"340,0778484,"WIN SUCCESS HOLDINGS LIMITED (d2008-06-20)
永成集團有限公司",2001-12-05,2008-06-20,"Private, ltd by shares"341,0778225,"WINBLE (HONG KONG) LIMITED
滙邦(香港)有限公司",2001-12-05,2017-11-03,"Private, ltd by shares"342,0778275,"WING BOUNCE LIMITED
永霸產品有限公司",2001-12-05,,"Private, ltd by shares"343,0778456,"WING KEE (BROTHERS) ENGINEERING COMPANY LIMITED
榮記(兄弟)建築工程有限公司",2001-12-05,2007-04-13,"Private, ltd by shares"344,0778460,"Wintec Enterprises International Limited
昇毅企業國際有限公司",2001-12-05,2015-11-06,"Private, ltd by shares"345,0778222,"WISETON HOLDINGS LIMITED
偉駿集團有限公司",2001-12-05,2013-03-01,"Private, ltd by shares"346,0778393,"WOLVES DEVELOPMENT CO., LIMITED
沃而普發展有限公司",2001-12-05,2008-04-18,"Private, ltd by shares"347,0778486,"WONGHAI GROUP COMPANY LIMITED
旺海集團有限公司",2001-12-05,2011-12-16,"Private, ltd by shares"348,0778263,"WORKSHOP COMPANY LIMITED (THE)",2001-12-05,,"Private, ltd by shares"349,0778454,"WORLD OF OUTDOORS (H.K.) LIMITED (THE)",2001-12-05,2015-04-02,"Private, ltd by shares"350,0778310,"WORLD-WIDE DIVING CONTRACTOR COMPANY LIMITED (THE)
世界潛水工程有限公司",2001-12-05,,"Private, ltd by shares"351,0778216,"WTO LOGISTICS (HONG KONG) LIMITED
通全球物流(香港)有限公司",2001-12-05,2017-06-23,"Private, ltd by shares"352,0778257,"WUI PO INDUSTRIAL LIMITED
滙寶實業有限公司",2001-12-05,2009-11-06,"Private, ltd by shares"353,0778268,"YANDE LIMITED
恩德慈善有限公司",2001-12-05,2009-04-24,"Private, ltd by shares"354,0778359,"YI TUNG TRADING LIMITED
億樋貿易有限公司",2001-12-05,2009-12-18,"Private, ltd by shares"355,0778442,"YIELDSON INTERNATIONAL HOLDINGS LIMITED
盈信國際集團有限公司",2001-12-05,2004-02-13,"Private, ltd by shares"356,0778428,"YING YICK ENTERPRISES LIMITED
盈益企業有限公司",2001-12-05,2005-06-10,"Private, ltd by shares"357,0778183,"YING YU CONSTRUCTION LIMITED
盈裕工程有限公司",2001-12-05,2009-01-23,"Private, ltd by shares"358,0778356,"YIUTECH INTERNATIONAL LIMITED
國際盈達有限公司",2001-12-05,,"Private, ltd by shares"359,0778479,"YONG'S INTERNATIONAL HOLDINGS LIMITED
榮氏國際集團有限公司",2001-12-05,2004-06-11,"Private, ltd by shares"360,0778235,"YU HING TEXTILE PRINTING FACTORY LIMITED
裕興印花廠有限公司",2001-12-05,,"Private, ltd by shares"361,0778367,"YUE FUNG HONG (INT'L) LIMITED
裕豐行(國際)有限公司",2001-12-05,2008-06-20,"Private, ltd by shares"362,0778402,"YUKOS OIL CHINA LIMITED
尤科斯石油中國有限公司",2001-12-05,2009-05-22,"Private, ltd by shares"363,0778360,"YUZILU AVIATION SERVICE (HONG KONG) COMPANY LIMITED
宇之路航空服務(香港)有限公司",2001-12-05,2003-05-02,"Private, ltd by shares"364,0778398,"ZE ZHENG INTERNATIONAL PATENT &amp; TRADEMARK AGENT LIMITED
澤正國際專利商標代理有限公司",2001-12-05,,"Private, ltd by shares"365,0778353,"ZENITH SAFETY CONSULTANT LIMITED
天力安全顧問有限公司",2001-12-05,2010-06-25,"Private, ltd by shares"366,0778417,"ZHONG HUA CONSULTANTS LIMITED
中華顧問有限公司",2001-12-05,,"Private, ltd by shares"367,0778399,"ZHU HUI PROPERTIES HOLDINGS LIMITED
竹輝置業控股有限公司",2001-12-05,2009-03-20,"Private, ltd by shares"