,Reg no.,Name,Incorp-orated,Dissolved,Type1,0778322,"3-BIT PRODUCTIONS LIMITED
三元製作有限公司",2001-12-05,,"Private, ltd by shares"2,0778215,"A ONE EDUCATIONAL LIMITED",2001-12-05,2004-06-11,"Private, ltd by shares"3,0778264,"AC PROMOTION LIMITED
浩鏵策劃推廣有限公司",2001-12-05,,"Private, ltd by shares"4,0778459,"ACTON BUSINESS CONSULTING LIMITED
安德企業管理顧問有限公司",2001-12-05,2015-07-10,"Private, ltd by shares"5,0778309,"ADOVE TRADING LIMITED",2001-12-05,2008-04-18,"Private, ltd by shares"6,0778188,"ADVANCE BIZ LIMITED
嵩業國際有限公司",2001-12-05,2014-04-11,"Private, ltd by shares"7,0778190,"ADVANCE FORTH TECHNOLOGY LIMITED
瑋雋科技有限公司",2001-12-05,2008-06-20,"Private, ltd by shares"8,0778290,"AIR CUBE LIMITED",2001-12-05,2011-12-30,"Private, ltd by shares"9,0778493,"AIR SUPPLY AROMA INTERNATIONAL LIMITED
香薰國際有限公司",2001-12-05,2007-04-13,"Private, ltd by shares"10,0778473,"ALLIANCE PACIFIC CORPORATION LIMITED
凱亞太平洋有限公司",2001-12-05,2013-05-31,"Private, ltd by shares"11,0778303,"ALLIED PERFECT LIMITED (d2007-04-13)
協世有限公司",2001-12-05,2007-04-13,"Private, ltd by shares"12,0778527,"ANBO GLOBAL COMPANY LIMITED
安博環球有限公司",2001-12-05,2009-09-18,"Private, ltd by shares"13,0778317,"ART-DECO CERAMIC LIMITED
佳德達有限公司",2001-12-05,2004-05-07,"Private, ltd by shares"14,0778444,"ARTCO TRADING LIMITED
藝豪貿易有限公司",2001-12-05,2013-12-20,"Private, ltd by shares"15,0778286,"ASIA PACIFIC INFRASTRUCTURE INVESTORS LIMITED",2001-12-05,,"Private, ltd by shares"16,0778173,"AUSTAR REAL PROJECT CONSULTING (HK) LIMITED
奧星瑞爾工程咨詢(香港)有限公司",2001-12-05,,"Private, ltd by shares"17,0778395,"B&amp;W SUPREME LIMITED",2001-12-05,2004-01-30,"Private, ltd by shares"18,0778437,"BAGI Laboratories Limited",2001-12-05,,"Private, ltd by shares"19,0778504,"Baleno Hong Kong Limited
班尼路香港有限公司",2001-12-05,,"Private, ltd by shares"20,0778251,"BEAUTY TOYS &amp; GARMENT FACTORY LIMITED
成美玩具製衣廠有限公司",2001-12-05,2009-04-24,"Private, ltd by shares"21,0778265,"BEST HARMONY LIMITED (d2010-03-19)
藝韻有限公司",2001-12-05,2010-03-19,"Private, ltd by shares"22,0778288,"BICCI (INTERNATIONAL) LIMITED
彼詩(國際)有限公司",2001-12-05,2003-10-24,"Private, ltd by shares"23,0778348,"BYD (CHINA) COMPANY LIMITED
比亞迪(中國)有限公司",2001-12-05,2003-02-07,"Private, ltd by shares"24,0778323,"Cai's Industrial Company Limited
蔡氏實業有限公司",2001-12-05,2018-08-10,"Private, ltd by shares"25,0778237,"CAPITAL SENSE INVESTMENTS LIMITED (d2007-04-13)
加勝投資有限公司",2001-12-05,2007-04-13,"Private, ltd by shares"26,0778435,"CCC RESOURCES LIMITED
三思資源有限公司",2001-12-05,2004-04-30,"Private, ltd by shares"27,0778517,"CEDAR HOLDINGS LIMITED (HK)
賽達有限公司",2001-12-05,2018-04-20,"Private, ltd by shares"28,0778201,"CEDAR PINE INTERNATIONAL LIMITED
松栢國際有限公司",2001-12-05,,"Private, ltd by shares"29,0778200,"CHANCE BRIGHT (HK) LIMITED
時創(香港)有限公司",2001-12-05,2005-05-13,"Private, ltd by shares"30,0778179,"CHANCE EXPLORER DEVELOPMENT LIMITED
才智發展有限公司",2001-12-05,2009-04-24,"Private, ltd by shares"31,0778224,"CHARTER BASE HOLDINGS LIMITED
正邦集團有限公司",2001-12-05,,"Private, ltd by shares"32,0778306,"CHEMATUR ENGINEERING INTERNATIONAL LIMITED",2001-12-05,2017-06-30,"Private, ltd by shares"33,0778176,"CHENG KUN INTERNATIONAL ENTERPRISE GROUP LIMITED
成坤國際企業集團有限公司",2001-12-05,2009-10-16,"Private, ltd by shares"34,0778357,"CHEUNG SHUN BUILDING MATERIALS COMPANY LIMITED
長順建築材料有限公司",2001-12-05,2005-01-21,"Private, ltd by shares"35,0778234,"CHIN HUNG IRON ENGINEERING COMPANY LIMITED
展鴻鐵器工程有限公司",2001-12-05,,"Private, ltd by shares"36,0778536,"CHINA ART &amp; CRAFTS GROUP CO LIMITED
中國工藝集團有限公司",2001-12-05,2007-04-20,"Private, ltd by shares"37,0778492,"CHINA BRAND STRATAGEM SOCIETY LIMITED
中國品牌戰略學會有限公司",2001-12-05,2007-04-13,"Private, ltd by shares"38,0778489,"CHINA EDUCATIONAL CULTURE MEDIA LIMITED
中國教育文化傳媒有限公司",2001-12-05,2007-04-13,"Private, ltd by shares"39,0778180,"CHINA ERA GROUP LIMITED (d2016-07-29)
中國年代集團有限公司",2001-12-05,2016-07-29,"Private, ltd by shares"40,0778469,"CHINA SUCCESS PUBLISH GROUP CO., LIMITED
中國成功出版集團有限公司",2001-12-05,2007-04-13,"Private, ltd by shares"41,0778339,"CHOICE HONOUR LIMITED
財誠有限公司",2001-12-05,2010-02-12,"Private, ltd by shares"42,0778324,"CHONG TIN AV COMPANY LIMITED
創天影音有限公司",2001-12-05,2006-02-17,"Private, ltd by shares"43,0778441,"CHUNG KEE (C.HK.) LOGISTICS LIMITED
忠記(中港)物流有限公司",2001-12-05,,"Private, ltd by shares"44,0778500,"CITY ACE LIMITED (d2009-03-13)
都市有限公司",2001-12-05,2009-03-13,"Private, ltd by shares"45,0778199,"CITY STAR (HK) LIMITED
同得(香港)有限公司",2001-12-05,,"Private, ltd by shares"46,0778193,"CLIFF LIMITED (HK)
奇富有限公司",2001-12-05,,"Private, ltd by shares"47,0778372,"CN MOULD &amp; PLASTIC LIMITED
師英模具塑膠有限公司",2001-12-05,,"Private, ltd by shares"48,0778223,"COMPASS HOLDINGS LIMITED (d2009-04-24)
加益集團有限公司",2001-12-05,2009-04-24,"Private, ltd by shares"49,0778341,"CONCEPT CHOICE LIMITED
財萊有限公司",2001-12-05,,"Private, ltd by shares"50,0778226,"CONSTANT (HONG KONG) LIMITED
嘉誠(香港)有限公司",2001-12-05,2014-01-30,"Private, ltd by shares"51,0778392,"COPPERSMITH HARDWARE (HK) LIMITED
香港老銅匠五金有限公司",2001-12-05,,"Private, ltd by shares"52,0778189,"COSMOS GREAT ENTERPRISES LIMITED
懋竣企業有限公司",2001-12-05,2009-04-24,"Private, ltd by shares"53,0778382,"CROWN ACE DEVELOPMENT LIMITED
冠嘉發展有限公司",2001-12-05,,"Private, ltd by shares"54,0778495,"CRYSTALTECH ELECTRONICS LIMITED
基士達電子有限公司",2001-12-05,2010-07-19,"Private, ltd by shares"55,0778266,"CYBER LEAD LIMITED
維略有限公司",2001-12-05,2008-11-21,"Private, ltd by shares"56,0778267,"CYBERMIND CORPORATION LIMITED
思維有限公司",2001-12-05,,"Private, ltd by shares"57,0778240,"CYBERVISIONS (CHINA) LIMITED
賽伯威信(中國)有限公司",2001-12-05,2003-08-08,"Private, ltd by shares"58,0778220,"DASLAND INDUSTRY (HK) CO., LIMITED
德蘭實業(香港)有限公司",2001-12-05,2005-06-17,"Private, ltd by shares"59,0778426,"DATA EXPRESS INTERNATIONAL LIMITED
訊通國際有限公司",2001-12-05,,"Private, ltd by shares"60,0778455,"DE SPRING (HONG KONG) LIMITED",2001-12-05,2006-11-03,"Private, ltd by shares"61,0778521,"DELUXE KING LIMITED (d2008-04-18)
銳利有限公司",2001-12-05,2008-04-18,"Private, ltd by shares"62,0778427,"DEXTERITY TECHNOLOGIES LIMITED
迪思軟件技術有限公司",2001-12-05,,"Private, ltd by shares"63,0778297,"DIRECT FORCE TECHNOLOGY LIMITED
向強科技有限公司",2001-12-05,2016-07-22,"Private, ltd by shares"64,0778498,"DOUBLE HAPPY LIMITED (d2012-03-16)
雙喜有限公司",2001-12-05,2012-03-16,"Private, ltd by shares"65,0778335,"DW BUSINESS LIMITED",2001-12-05,2013-07-05,"Private, ltd by shares"66,0778468,"EAGLE COMPANY LIMITED
伊高有限公司",2001-12-05,2018-06-29,"Private, ltd by shares"67,0778421,"EASEFINE (CHINA) ENGINEERING LIMITED
怡輝(中國)工程有限公司",2001-12-05,2003-12-24,"Private, ltd by shares"68,0778451,"EASTSEA ENTERPRISES LIMITED
海東實業有限公司",2001-12-05,2008-12-05,"Private, ltd by shares"69,0778313,"ECOM PUBLIC RELATIONS COMPANY LIMITED
智達公關顧問股份有限公司",2001-12-05,2004-07-23,"Private, ltd by shares"70,0778345,"EDO INTERNATIONAL LIMITED (d2004-05-28)
大都國際有限公司",2001-12-05,2004-05-28,"Private, ltd by shares"71,0778370,"EE ZHOU INTERNATIONAL GROUP COMPANY LIMITED
一洲國際集團有限公司",2001-12-05,2007-04-13,"Private, ltd by shares"72,0778366,"ELECTRA LIMITED (d2011-09-09)",2001-12-05,2011-09-09,"Private, ltd by shares"73,0778327,"ELEGANT CREATION ENGINEERING LIMITED
創逸工程有限公司",2001-12-05,2007-04-20,"Private, ltd by shares"74,0778462,"EMPEROR FOOD AND BEVERAGE GROUP LIMITED
明皇飲食集團有限公司",2001-12-05,,"Private, ltd by shares"75,0778422,"EN-TRANZ ENTERTAINMENT (HK) LIMITED
創思數碼科技(香港)有限公司",2001-12-05,,"Private, ltd by shares"76,0778386,"ENABLE INVESTMENT LIMITED
致恒投資有限公司",2001-12-05,,"Private, ltd by shares"77,0778503,"ETERNAL VICEROY LIMITED",2001-12-05,2016-06-30,"Private, ltd by shares"78,0778436,"EUROASIA EDITION LIMITED
歐亞商貿有限公司",2001-12-05,2014-12-05,"Private, ltd by shares"79,0778506,"EVER EAGLE ENTERPRISES LIMITED
永鵬企業有限公司",2001-12-05,2004-10-15,"Private, ltd by shares"80,0778340,"EVER PINE LIMITED
能栢有限公司",2001-12-05,,"Private, ltd by shares"81,0778185,"EVERBEST DESIGN AND ENGINEERING COMPANY LIMITED
宏基裝飾設計工程有限公司",2001-12-05,2005-05-27,"Private, ltd by shares"82,0778515,"EVEREST MEDIA LIMITED",2001-12-05,,"Private, ltd by shares"83,0778261,"EXTRA LIGHTING MANUFACTURING LIMITED",2001-12-05,,"Private, ltd by shares"84,0778227,"FABRICS SOURCING AND AGENCIES LIMITED
布藝代理有限公司",2001-12-05,,"Private, ltd by shares"85,0778214,"FAIRCAPE LIMITED",2001-12-05,2010-05-20,"Private, ltd by shares"86,0778296,"FIXLAND COMPANY LIMITED
法能特有限公司",2001-12-05,2014-03-21,"Private, ltd by shares"87,0778218,"FLORA BEAUTY LIMITED (d2009-05-08)
儷軒美容有限公司",2001-12-05,2009-05-08,"Private, ltd by shares"88,0778410,"FLY &amp; BRIGHT LIMITED
快力有限公司",2001-12-05,2012-03-16,"Private, ltd by shares"89,0778396,"FORTRESS GLORY ENGINEERING LIMITED
富旭工程有限公司",2001-12-05,2018-09-04,"Private, ltd by shares"90,0778470,"FORTRESS KING LIMITED (d2007-04-13)
富太有限公司",2001-12-05,2007-04-13,"Private, ltd by shares"91,0778196,"FORTUNE ACCESS LIMITED (d2003-09-05)
至福有限公司",2001-12-05,2003-09-05,"Private, ltd by shares"92,0778326,"FORTUNE HONOUR FAR EAST LIMITED
富安遠東有限公司",2001-12-05,2007-04-13,"Private, ltd by shares"93,0778535,"FORTUNE MARINE WHOLESALE LIMITED",2001-12-05,,"Private, ltd by shares"94,0778308,"FRANCE CROCODILE (HK) INTERNATIONAL LIMITED
法國鱷魚(香港)國際有限公司",2001-12-05,2012-06-01,"Private, ltd by shares"95,0778349,"FRANCE GIVENCHI INTERNATIONAL GROUP CO., LIMITED
法國紀梵希國際集團有限公司",2001-12-05,2007-04-13,"Private, ltd by shares"96,0778219,"FRANCE PIER KADAN INTERNATIONAL CLOTHING HOLDINGS LIMITED
法國皮爾卡丹國際服飾股份有限公司",2001-12-05,2007-04-13,"Private, ltd by shares"97,0778371,"FRENCH SPIRIT LIMITED",2001-12-05,2015-08-21,"Private, ltd by shares"98,0778477,"FUJI INTERNATIONAL TRADING LIMITED
福技國際貿易有限公司",2001-12-05,2017-12-01,"Private, ltd by shares"99,0778448,"FUJIAN ELECTRIC POWER ENGINEERING COMPANY LIMITED
富健電力工程有限公司",2001-12-05,2008-04-18,"Private, ltd by shares"100,0778518,"FUJIBO (H.K.) CO., LIMITED
富士紡(香港)有限公司",2001-12-05,2013-11-15,"Private, ltd by shares"101,0778269,"FULLY FAME LIMITED (d2007-04-13)
溢榮有限公司",2001-12-05,2007-04-13,"Private, ltd by shares"102,0778289,"GAGIER (HONG KONG) LIMITED
嘉吉(香港)有限公司",2001-12-05,2009-10-09,"Private, ltd by shares"103,0778213,"GARIMAN LIMITED
嘉里運有限公司",2001-12-05,,"Private, ltd by shares"104,0778512,"GAVEL WISE LIMITED
嘉信華有限公司",2001-12-05,2007-12-07,"Private, ltd by shares"105,0778332,"GERMANY FREE.BILLIONARE APPLIANCES INT'L GROUP (CHINA) LIMITED
德國富逸‧寶萊納電器國際集團(中國)有限公司",2001-12-05,2007-04-13,"Private, ltd by shares"106,0778197,"GLOBAL TOUCH LIMITED
致高有限公司",2001-12-05,,"Private, ltd by shares"107,0778406,"GLORY INFO LIMITED
銘賢有限公司",2001-12-05,2017-12-15,"Private, ltd by shares"108,0778182,"GOLD EXPRESS LOGISTICS LIMITED
高達物流中心有限公司",2001-12-05,,"Private, ltd by shares"109,0778482,"GOLDEN CHANCES INTERNATIONAL LIMITED (d2007-04-13)
金祥國際有限公司",2001-12-05,2007-04-13,"Private, ltd by shares"110,0778416,"GOLDEN VICTORY CORPORATION LIMITED (d2012-04-20)
金旋有限公司",2001-12-05,2012-04-20,"Private, ltd by shares"111,0778425,"GOLDMAX TRADING LIMITED (d2007-04-13)
佳明貿易有限公司",2001-12-05,2007-04-13,"Private, ltd by shares"112,0778270,"GOOD LOYAL CORPORATION LIMITED (d2009-11-06)
佳旺有限公司",2001-12-05,2009-11-06,"Private, ltd by shares"113,0778420,"GORICH ASIA LIMITED
盈富亞洲有限公司",2001-12-05,2009-10-02,"Private, ltd by shares"114,0778501,"GRADE CONCORD LIMITED
巨康有限公司",2001-12-05,2007-04-20,"Private, ltd by shares"115,0778389,"Grand Court Limited (d2006-12-01)",2001-12-05,2006-12-01,"Private, ltd by shares"116,0778300,"GRAND IMPERIAL HOLDINGS LIMITED
君裕控股有限公司",2001-12-05,,"Private, ltd by shares"117,0778497,"GRAND RIVERA LIMITED
江鴻有限公司",2001-12-05,,"Private, ltd by shares"118,0778254,"GRANDTAG BUSINESS CONSULTANTS LIMITED
廣達商業資訊有限公司",2001-12-05,,"Private, ltd by shares"119,0778534,"GREAT ASCENT LIMITED (d2007-04-20)
偉晉有限公司",2001-12-05,2007-04-20,"Private, ltd by shares"120,0778376,"GREAT TANG (H.K.) INVESTMENT LIMITED
大唐(香港)投資有限公司",2001-12-05,2007-04-13,"Private, ltd by shares"121,0778320,"Green Champ Technology and Consulting Engineers Limited
創翹科技顧問工程師有限公司",2001-12-05,,"Private, ltd by shares"122,0778328,"GUANGZHOU QIMENGJIAO INDUSTRIAL (HK) LIMITED
廣州奇夢嬌實業(香港)有限公司",2001-12-05,2008-12-05,"Private, ltd by shares"123,0778483,"GUARDFAITH ENGINEERING LIMITED
嘉暉工程有限公司",2001-12-05,2011-10-14,"Private, ltd by shares"124,0778432,"H.K. ZEN ELEGANT CO., LIMITED
香港全國際有限公司",2001-12-05,2015-10-23,"Private, ltd by shares"125,0778276,"HANFORD WORLDWIDE TRADING LIMITED
洪發國際貿易有限公司",2001-12-05,2002-11-08,"Private, ltd by shares"126,0778172,"HANNING INDUSTRIAL LIMITED
軒瑋實業有限公司",2001-12-05,2004-05-28,"Private, ltd by shares"127,0778362,"HANSON MANAGEMENT SERVICES LIMITED (d2002-09-27)
洪盛管理有限公司",2001-12-05,2002-09-27,"Private, ltd by shares"128,0778408,"HAPPY JOY LIMITED (d2003-03-21)
同志有限公司",2001-12-05,2003-03-21,"Private, ltd by shares"129,0778302,"HASTON LIMITED",2001-12-05,,"Private, ltd by shares"130,0778418,"HEALTH CONCEPT INTERNATIONAL LIMITED
健皓國際有限公司",2001-12-05,2005-11-11,"Private, ltd by shares"131,0778181,"HIGH ABLE LIMITED (d2013-01-25)
高能有限公司",2001-12-05,2013-01-25,"Private, ltd by shares"132,0778487,"HIGH SPEED (INTERNATIONAL) EXPRESS LOGISTICS LIMITED
超高速國際物流有限公司",2001-12-05,2003-12-19,"Private, ltd by shares"133,0778490,"HK EVERGOLD INT'L TRADING LIMITED
香港永鑫國際貿易有限公司",2001-12-05,2008-06-20,"Private, ltd by shares"134,0778401,"HK FONDTIDY APPLIANCES GROUP LIMITED
香港方太電器集團有限公司",2001-12-05,2009-07-17,"Private, ltd by shares"135,0778404,"HK HEALTH-JOY INT'L FOOD GROUP LIMITED
香港康樂佳國際食品集團有限公司",2001-12-05,2007-04-13,"Private, ltd by shares"136,0778491,"HK HOLY EAGLE LEATHER LIMITED
香港神鷹皮具有限公司",2001-12-05,2007-04-13,"Private, ltd by shares"137,0778333,"HK JEWELLYSTONE TRADING LIMITED
香港經緯通貿易有限公司",2001-12-05,2007-04-13,"Private, ltd by shares"138,0778311,"HOI HUNG (CHINA) LIMITED
海虹(中國)有限公司",2001-12-05,,"Private, ltd by shares"139,0778256,"HOLLY (H.K.) COMPANY LIMITED
弘業(香港)有限公司",2001-12-05,2012-02-10,"Private, ltd by shares"140,0778465,"HOMETEX &amp; APPARELS LIMITED
潤豐紡織有限公司",2001-12-05,2019-11-22,"Private, ltd by shares"141,0778177,"HONG KONG ASANO COMPANY LIMITED
香港淺野有限公司",2001-12-05,,"Private, ltd by shares"142,0778315,"HONG KONG CARTEFU CLOTHING COMPANY LIMITED
香港嘉德富服裝有限公司",2001-12-05,2007-04-13,"Private, ltd by shares"143,0778397,"HONG KONG CHANGXIN INTERNATIONAL SHIPPING HOLDINGS LIMITED
香港長鑫國際航運集團有限公司",2001-12-05,2010-11-12,"Private, ltd by shares"144,0778319,"HONG KONG CHANGYUAN TRADING CO., LIMITED (d2005-07-08)
香港長源經貿有限公司",2001-12-05,2005-07-08,"Private, ltd by shares"145,0778377,"HONG KONG DIERDANDUN INTERNATIONAL FASHION GROUP CO., LIMITED
香港迪爾丹敦國際服裝集團有限公司",2001-12-05,2007-04-13,"Private, ltd by shares"146,0778260,"HONG KONG DU SEN CLOTHES AND ORNAMENTS INTERNATIONAL LIMITED
香港渡森服飾(國際)有限公司",2001-12-05,2005-08-26,"Private, ltd by shares"147,0778239,"HONG KONG EUROPASIA BIOMEDICAL COMPANY LIMITED
香港歐亞生物醫葯有限公司",2001-12-05,2005-06-03,"Private, ltd by shares"148,0778312,"HONG KONG INTERNATIONAL DRIVING SERVICES LIMITED
香港國際駕駛服務有限公司",2001-12-05,2005-08-12,"Private, ltd by shares"149,0778524,"HONG KONG LIN TIEN BROTHER RUBBER LIMITED
香港林田兄弟橡膠有限公司",2001-12-05,2004-05-21,"Private, ltd by shares"150,0778337,"HONG KONG NEWSTAR HOME APPLIANCES HOLDING LIMITED
香港新士達家具集團有限公司",2001-12-05,2006-10-06,"Private, ltd by shares"151,0778314,"HONG KONG ORDER-FRIDAY ELECTRONIC CO., LIMITED
香港奧德富電子有限公司",2001-12-05,2009-04-24,"Private, ltd by shares"152,0778374,"HONG KONG SHI'S LUBRICANT LIMITED
香港石氏潤滑油有限公司",2001-12-05,2007-04-13,"Private, ltd by shares"153,0778241,"HONG KONG SPECIALTY GASES COMPANY LIMITED
香港特種氣體有限公司",2001-12-05,,"Private, ltd by shares"154,0778298,"HONG KONG STAR LIGHTING GROUP COMPANY LIMITED (d2008-04-18)
香港星輝燈飾集團有限公司",2001-12-05,2008-04-18,"Private, ltd by shares"155,0778358,"HONG KONG TRF INTERNATIONAL ARCHITECT DIGITAL DEVELOPMENT LIMITED
香港三川田國際建築數碼發展有限公司",2001-12-05,2006-03-31,"Private, ltd by shares"156,0778246,"HONG KONG YUN NING ELECTRONICS CO. LIMITED
香港雲寧電子有限公司",2001-12-05,2014-03-21,"Private, ltd by shares"157,0778258,"HONG PU XUAN GROUP LIMITED
鴻普軒集團有限公司",2001-12-05,,"Private, ltd by shares"158,0778285,"HONGKONG GOLD CENTURY LIMITED
香港金世紀有限公司",2001-12-05,2020-01-10,"Private, ltd by shares"159,0778277,"HONGKONG HARVEST-YEAR MARINE SERVICE LIMITED
香港豐年海商有限公司",2001-12-05,2007-04-13,"Private, ltd by shares"160,0778284,"HONGKONG NEW CENTURY REAL ESTATE LIMITED
香港新世紀房地產開發有限公司",2001-12-05,,"Private, ltd by shares"161,0778400,"HONGKONG VICEROY LIMITED
香港華爾絲露有限公司",2001-12-05,2007-04-13,"Private, ltd by shares"162,0778248,"HONGXING TEXTILES (HONG KONG) LIMITED (d2004-10-08)
宏興紡織(香港)有限公司",2001-12-05,2004-10-08,"Private, ltd by shares"163,0778407,"HONOUR FAME LIMITED (d2007-05-18)
名升有限公司",2001-12-05,2007-05-18,"Private, ltd by shares"164,0778202,"HONOUR SKY INTERNATIONAL LIMITED (d2007-04-13)
基誠國際有限公司",2001-12-05,2007-04-13,"Private, ltd by shares"165,0778439,"HUALONGDE INVESTMENT GROUP (HONG KONG) LIMITED
華隆德投資集團(香港)股份有限公司",2001-12-05,,"Private, ltd by shares"166,0778423,"HUGELAND CORPORATION LIMITED
巧麗有限公司",2001-12-05,2005-12-09,"Private, ltd by shares"167,0778394,"HUNG FAT TRADING LIMITED",2001-12-05,2015-10-23,"Private, ltd by shares"168,0778385,"HURRICANE TOYS LIMITED
恒域創意有限公司",2001-12-05,,"Private, ltd by shares"169,0778170,"ICRIS:0778170 (no English name)
深港地產研究院有限公司",2001-12-05,2017-11-03,"Private, ltd by shares"170,0778350,"INTERCULTURAL COMMUNICATION CONSULTANTS LIMITED
文化傳意顧問有限公司",2001-12-05,2007-04-13,"Private, ltd by shares"171,0778262,"INTERFACE GLOBAL HONG KONG CO., LIMITED
環訊國際股份有限公司",2001-12-05,2011-12-16,"Private, ltd by shares"172,0778475,"ITALY OISSI (HONGKONG) INDUSTRY COMPANY LIMITED
意大利歐意詩(香港)實業有限公司",2001-12-05,2007-04-13,"Private, ltd by shares"173,0778334,"ITALY SAINTROLAND DRESS FEATHER (HK) INT'L LIMITED
意大利聖羅蘭服飾皮具(香港)國際有限公司",2001-12-05,2009-04-24,"Private, ltd by shares"174,0778369,"ITALY ST LO LANE CLOTHING GROUP COMPANY LIMITED
意大利聖羅蘭服裝集團有限公司",2001-12-05,2007-04-13,"Private, ltd by shares"175,0778243,"ITALY TISDENY (FAR EAST) COMPANY LIMITED
意大利鐵絲丹尼(遠東)有限公司",2001-12-05,2006-12-15,"Private, ltd by shares"176,0778496,"J W S &amp; COMPANY LIMITED",2001-12-05,2007-01-19,"Private, ltd by shares"177,0778245,"JAMSA LIMITED
占莎有限公司",2001-12-05,2011-07-15,"Private, ltd by shares"178,0778228,"JET ASIA INVESTMENTS LIMITED (d2007-04-13)
捷亞投資有限公司",2001-12-05,2007-04-13,"Private, ltd by shares"179,0778230,"JET BASE INDUSTRIES LIMITED
捷邦實業有限公司",2001-12-05,2007-04-13,"Private, ltd by shares"180,0778494,"JOINT &amp; JOY LIMITED
潤和院有限公司",2001-12-05,,"Private, ltd by shares"181,0778531,"JOINT WORLD DEVELOPMENT LIMITED
滙卓發展有限公司",2001-12-05,2004-03-19,"Private, ltd by shares"182,0778443,"JUBILEE OCEAN LIMITED
俊洋有限公司",2001-12-05,2016-05-13,"Private, ltd by shares"183,0778434,"JUST100 LIMITED",2001-12-05,2017-07-21,"Private, ltd by shares"184,0778325,"KA WANG INTERNATIONAL DEVELOPMENT COMPANY LIMITED
嘉宏國際發展有限公司",2001-12-05,2013-02-22,"Private, ltd by shares"185,0778283,"KEE FUNG METAL &amp; PLASTIC MANUFACTORY LIMITED
奇峰五金塑膠製品廠有限公司",2001-12-05,,"Private, ltd by shares"186,0778449,"KEWANG COMMUNICATION (HONG KONG) COMPANY LIMITED
渴望通訊設備(香港)有限公司",2001-12-05,,"Private, ltd by shares"187,0778405,"KEY BEST LIMITED
時采有限公司",2001-12-05,,"Private, ltd by shares"188,0778195,"KINDEX LIMITED
堅生有限公司",2001-12-05,,"Private, ltd by shares"189,0778533,"KING FANCY LIMITED (d2007-04-20)
裕帝有限公司",2001-12-05,2007-04-20,"Private, ltd by shares"190,0778511,"KING FUK NURSING HOME LIMITED
敬福護理院有限公司",2001-12-05,2014-02-21,"Private, ltd by shares"191,0778287,"KWOK NGAI (H.K.) LIMITED
國藝(香港)有限公司",2001-12-05,2011-08-05,"Private, ltd by shares"192,0778520,"KWONG FAT CORPORATION LIMITED
廣發興業有限公司",2001-12-05,2010-02-05,"Private, ltd by shares"193,0778452,"KWONG YICK (HOME FOR THE AGED) LIMITED
廣億護老中心有限公司",2001-12-05,2003-09-11,"Private, ltd by shares"194,0778278,"L &amp; C SOLAR INTERNATIONAL (H.K.) LIMITED",2001-12-05,2002-10-04,"Private, ltd by shares"195,0778209,"LAMEX HOLDINGS LIMITED
美時集團有限公司",2001-12-05,2011-07-04,"Private, ltd by shares"196,0778478,"LAN TIEN MOTION PICTURES CO., LIMITED
藍天影業制作有限公司",2001-12-05,,"Private, ltd by shares"197,0778440,"LAND HERO INVESTMENT LIMITED
利豪投資有限公司",2001-12-05,,"Private, ltd by shares"198,0778390,"LEAD DATA (H.K.) LIMITED
利碟(香港)股份有限公司",2001-12-05,2009-02-14,"Private, ltd by shares"199,0778419,"LEADING VANTAGE HOLDINGS LIMITED
利陞集團有限公司",2001-12-05,2006-03-07,"Private, ltd by shares"200,0778252,"LEROY KNITWEARS LIMITED
利來針織有限公司",2001-12-05,,"Private, ltd by shares"201,0778342,"LINK ACCESS LIMITED (d2007-04-13)
能駿有限公司",2001-12-05,2007-04-13,"Private, ltd by shares"202,0778207,"LINK SUCCESS DEVELOPMENT LIMITED
德成發展有限公司",2001-12-05,2008-03-07,"Private, ltd by shares"203,0778250,"LION LASER CREATION (ASIA) COMPANY LIMITED
裕達千里激光創意(亞洲)有限公司",2001-12-05,2004-06-18,"Private, ltd by shares"204,0778281,"LUEN HOP BAMBOO FRAME WORKS LIMITED
聯合棚廠有限公司",2001-12-05,2014-06-20,"Private, ltd by shares"205,0778217,"LUEN TUNG FAT PAPER PRODUCTS COMPANY LIMITED
聯通發紙品廠有限公司",2001-12-05,,"Private, ltd by shares"206,0778481,"LUXVIEW CORPORATION LIMITED
利境有限公司",2001-12-05,2014-06-27,"Private, ltd by shares"207,0778429,"LUYINONG COSMETICS LIMITED
露伊濃化粧品有限公司",2001-12-05,2003-05-16,"Private, ltd by shares"208,0778316,"MACMART DEVELOPMENT COMPANY LIMITED
群焌(國際)物業有限公司",2001-12-05,2007-03-30,"Private, ltd by shares"209,0778187,"MAJESTIC CREW TRADING LIMITED
佳瑞貿易有限公司",2001-12-05,2010-07-23,"Private, ltd by shares"210,0778330,"MAN LEE TAK INDUSTRIAL COMPANY LIMITED
萬利得製品實業有限公司",2001-12-05,2018-08-10,"Private, ltd by shares"211,0778464,"MARCO POLO CONSULTING LIMITED (d2005-08-19)
馬可波羅諮詢有限公司",2001-12-05,2005-08-19,"Private, ltd by shares"212,0778474,"MASTER ELEGANT ENGINEERING LIMITED
博雅工程有限公司",2001-12-05,2003-03-07,"Private, ltd by shares"213,0778509,"MASTER ENGINEERING DEVELOPMENT LIMITED
萬事達工程發展有限公司",2001-12-05,2007-04-20,"Private, ltd by shares"214,0778375,"MASTER ONE LIMITED (d2014-11-21)",2001-12-05,2014-11-21,"Private, ltd by shares"215,0778380,"MAXWELL NETWORKS LIMITED (d2004-12-24)",2001-12-05,2004-12-24,"Private, ltd by shares"216,0778338,"MAY SOLUTION LIMITED
美越有限公司",2001-12-05,,"Private, ltd by shares"217,0778318,"MB TOY LIMITED
旭能玩具有限公司",2001-12-05,2011-12-30,"Private, ltd by shares"218,0778523,"MCA LIMITED (d2014-01-17)",2001-12-05,2014-01-17,"Private, ltd by shares"219,0778321,"MEI SANG TONG ENTERPRISE LIMITED
美生堂企業有限公司",2001-12-05,2008-04-18,"Private, ltd by shares"