,Reg no.,Name,Incorp-orated,Dissolved,Type257,3000958,"TRIPLE JOY HOLDINGS LIMITED
三禧控股有限公司",2020-12-09,,"Private, ltd by shares"258,3000858,"TSING WAI LIMITED
菁慧有限公司",2020-12-09,,"Private, ltd by shares"259,3000955,"Ultimate Prosper Limited",2020-12-09,,"Private, ltd by shares"260,3000804,"UNA Group Limited",2020-12-09,,"Private, ltd by shares"261,3000904,"Unicorn Whale Technology Limited
獨角鯨科技有限公司",2020-12-09,,"Private, ltd by shares"262,3001075,"VINSTAR TECHNOLOGY LIMITED
文曲星科技有限公司",2020-12-09,,"Private, ltd by shares"263,3000812,"VKK ENERGY HK LIMITED",2020-12-09,,"Private, ltd by shares"264,3001056,"WAH KOON DESIGN LIMITED
華冠裝飾有限公司",2020-12-09,,"Private, ltd by shares"265,3000846,"WAN SHUI LIMITED
雲瑞有限公司",2020-12-09,,"Private, ltd by shares"266,3001035,"WANXIN HOLDINGS LIMITED",2020-12-09,,"Private, ltd by shares"267,3000791,"Wealthy Success Technology Limited",2020-12-09,,"Private, ltd by shares"268,3000932,"WELL ARTS OPTICAL INTERNATIONAL LIMITED
威雅國際眼鏡有限公司",2020-12-09,,"Private, ltd by shares"269,3000967,"Well Connected Internet Services Development Limited
萬家通互聯網科技發展有限公司",2020-12-09,,"Private, ltd by shares"270,3000898,"Where Go Limited
全民去哪兒有限公司",2020-12-09,,"Private, ltd by shares"271,3001023,"Wing Wo Development (HK) Limited
永和發展(香港)有限公司",2020-12-09,,"Private, ltd by shares"272,3001005,"WING ZHI LIMITED
永織有限公司",2020-12-09,,"Private, ltd by shares"273,3000841,"Wolford Investment Company Limited",2020-12-09,,"Private, ltd by shares"274,3000941,"Wonderful Bloom Limited",2020-12-09,,"Private, ltd by shares"275,3000906,"Woodz Limited",2020-12-09,,"Private, ltd by shares"276,3001000,"WORLD INTELLECTUAL PROPERTY ASSOCIATION LIMITED (THE)
世界知識產權保護協會有限公司",2020-12-09,,"Private, ltd by shares"277,3001018,"WUI SING TRADING DEVELOP LIMITED
滙星貿易拓展有限公司",2020-12-09,,"Private, ltd by shares"278,3001090,"Xili HK Trading Limited
希黎香港貿易有限公司",2020-12-09,,"Private, ltd by shares"279,3000884,"XINGHONG WEIYE LIMITED
興鴻偉業有限公司",2020-12-09,,"Private, ltd by shares"280,3001042,"XINGWANGDA TRADING LIMITED
興旺達貿易有限公司",2020-12-09,,"Private, ltd by shares"281,3000822,"Xinshizhan Precision Limited
鑫世展精密有限公司",2020-12-09,,"Private, ltd by shares"282,3000917,"Xinxiangyun International Trade Co., Limited
新享雲國際貿易有限公司",2020-12-09,,"Private, ltd by shares"283,3000837,"XINYUJIE TECHNOLOGY (HK) LIMITED
新宇傑科技有限公司",2020-12-09,,"Private, ltd by shares"284,3000830,"XIUZITANG BEAUTY COSMETICS LIMITED
秀資堂美容化妝品有限公司",2020-12-09,,"Private, ltd by shares"285,3001066,"Xizang Investment (China) Co., Limited
西藏投資(中國)有限公司",2020-12-09,,"Private, ltd by shares"286,3000965,"XTRADE LIMITED
祥貿有限公司",2020-12-09,,"Private, ltd by shares"287,3000993,"XWIN LIMITED
旭贏有限公司",2020-12-09,,"Private, ltd by shares"288,3000842,"YANJING HOLDINGS LIMITED
燕京控股有限公司",2020-12-09,,"Private, ltd by shares"289,3000847,"YANNIE'S TRADING LIMITED",2020-12-09,,"Private, ltd by shares"290,3000919,"YI HONG ELECTRONICS LIMITED
億鴻電子有限公司",2020-12-09,,"Private, ltd by shares"291,3000997,"Yinglong Furniture Limited
英隆傢俱有限公司",2020-12-09,,"Private, ltd by shares"292,3000823,"YIWU SAIHAN TRADING CO., LIMITED",2020-12-09,,"Private, ltd by shares"293,3000914,"YOREN TRADING LIMITED
怡晟貿易有限公司",2020-12-09,,"Private, ltd by shares"294,3000987,"YOUNG SHINE LIMITED (HK)",2020-12-09,,"Private, ltd by shares"295,3000861,"YUET YUNG LIMITED
悅融有限公司",2020-12-09,,"Private, ltd by shares"296,3000831,"Yueyi (Hong Kong) International Trading Co., Limited
悅怡（香港）國際貿易有限公司",2020-12-09,,"Private, ltd by shares"297,3000937,"Yunhui (HK) Supply Chain Service Co., Limited
雲惠供應鏈服務有限公司",2020-12-09,,"Private, ltd by shares"298,3001012,"ZFAN LIMITED
芝繁有限公司",2020-12-09,,"Private, ltd by shares"299,3000915,"Zhichen International Consulting Management Co., Limited
至宸國際諮詢管理有限公司",2020-12-09,,"Private, ltd by shares"300,3001008,"ZHONGYUN OIL LIMITED
中囩石油有限公司",2020-12-09,,"Private, ltd by shares"301,3001047,"Zuoshanhu Electronic Technology Co., Limited
坐山虎電子科技有限公司",2020-12-09,,"Private, ltd by shares"302,3000989,"ZX (TCSP) LIMITED",2020-12-09,,"Private, ltd by shares"