,Reg no.,Name,Incorp-orated,Dissolved,Type1,3000901,"100 Forward Limited",2020-12-09,,"Private, ltd by shares"2,3000908,"18 Salisbury Capital Limited
18賽利資本有限公司",2020-12-09,,"Private, ltd by shares"3,3000882,"2S 3XLH Company Limited",2020-12-09,,"Private, ltd by shares"4,3001007,"A-ZHU MA FOOD CREATION LIMITED
亞豬媽食品製作有限公司",2020-12-09,,"Private, ltd by shares"5,3001050,"Aine International Trading Co., Limited
愛妮國際貿易有限公司",2020-12-09,,"Private, ltd by shares"6,3000893,"Airsohoo Global Co., Limited
空間環球有限公司",2020-12-09,,"Private, ltd by shares"7,3001087,"Alfa Romeo Limited",2020-12-09,,"Private, ltd by shares"8,3001011,"All Winwin Company Limited
共贏金榮有限公司",2020-12-09,,"Private, ltd by shares"9,3001069,"Alpha Optical Limited (HK)
阿爾法(珠海)光學有限公司",2020-12-09,,"Private, ltd by shares"10,3000883,"ALPHILA COMPANY LIMITED",2020-12-09,,"Private, ltd by shares"11,3000992,"Alpine Motors Limited",2020-12-09,,"Private, ltd by shares"12,3000875,"ALSAYO COMPANY LIMITED",2020-12-09,,"Private, ltd by shares"13,3001039,"Angkor Rainbow (Hong Kong) Company Limited",2020-12-09,,"Private, ltd by shares"14,3000978,"Anlex Realty Limited
灝鏘置業有限公司",2020-12-09,,"Private, ltd by shares"15,3000817,"Arceus Digital Solution Limited",2020-12-09,,"Private, ltd by shares"16,3000809,"Aries 2020 (HK) Limited",2020-12-09,,"Private, ltd by shares"17,3000790,"ARKK LIMITED",2020-12-09,,"Private, ltd by shares"18,3000889,"AShop Plus Limited
佳利生活館有限公司",2020-12-09,,"Private, ltd by shares"19,3000953,"ASPIRITE INDUSTRY LIMITED",2020-12-09,,"Private, ltd by shares"20,3001068,"AYRY Company Limited
琪俊(香港)有限公司",2020-12-09,,"Private, ltd by shares"21,3000960,"BASF Petrochemical Group Holdings (Asia Pacific) Co., Limited
德國巴斯夫石化集團控股（亞太）有限公司",2020-12-09,,"Private, ltd by shares"22,3000952,"Beauty magic Co., LIMITED
美麗魔法股份有限公司",2020-12-09,,"Private, ltd by shares"23,3000899,"Bee Services Limited",2020-12-09,,"Private, ltd by shares"24,3000934,"Bellatrix Energy Limited",2020-12-09,,"Private, ltd by shares"25,3001036,"BENEVOLENCE TRADING CO., LIMITED
仁合貿易有限公司",2020-12-09,,"Private, ltd by shares"26,3000851,"Betatron Ventures Limited",2020-12-09,,"Private, ltd by shares"27,3000951,"Beyond Star Limited",2020-12-09,,"Private, ltd by shares"28,3000865,"Billion Profit Capital Limited
億利資產有限公司",2020-12-09,,"Private, ltd by shares"29,3001046,"Bizibuz International Limited",2020-12-09,,"Private, ltd by shares"30,3000897,"BLING BLING BLANC BEAUTY LIMITED",2020-12-09,,"Private, ltd by shares"31,3000885,"BLING BLOOM BEAUTY COMPANY LIMITED",2020-12-09,,"Private, ltd by shares"32,3000876,"BLING BLOOM COMPANY LIMITED",2020-12-09,,"Private, ltd by shares"33,3000886,"BLING BLOOM STAR COMPANY LIMITED",2020-12-09,,"Private, ltd by shares"34,3000877,"BLOSSOM BOX COMPANY LIMITED",2020-12-09,,"Private, ltd by shares"35,3001016,"Blue Lagoon Marketing Limited",2020-12-09,,"Private, ltd by shares"36,3001033,"Blue River Corporation Limited (HK)
藍河集團有限公司",2020-12-09,,"Private, ltd by shares"37,3000824,"BNTT TRADING LIMITED",2020-12-09,,"Private, ltd by shares"38,3000894,"Boxymes Limited",2020-12-09,,"Private, ltd by shares"39,3000933,"Brilliant Award Limited",2020-12-09,,"Private, ltd by shares"40,3000907,"Buy Interior Materials Easy Limited
家居買料易工程有限公司",2020-12-09,,"Private, ltd by shares"41,3000805,"Cheese Gallery Limited
芝士廊有限公司",2020-12-09,,"Private, ltd by shares"42,3001009,"Chi Ken Engineering Limited
志勤工程有限公司",2020-12-09,,"Private, ltd by shares"43,3000920,"Chief Business Services Limited
致富企業服務有限公司",2020-12-09,,"Private, ltd by shares"44,3000835,"China Cities Investment Group Limited
中國城投資控股集團有限公司",2020-12-09,,"Private, ltd by shares"45,3000966,"China Cultural Tourism Industry Group Co., Limited
中國文創產業集團股份有限公司",2020-12-09,,"Private, ltd by shares"46,3000848,"China Zhonghua Group Co., Limited
中國中華集團有限公司",2020-12-09,,"Private, ltd by shares"47,3001074,"CHONG SHEUNG GROUP (INTERNATIONAL) LIMITED
中商集團(國際)有限公司",2020-12-09,,"Private, ltd by shares"48,3001032,"CHUANGYI LAB TECHNOLOGY CO., LIMITED
創儀實驗技術有限公司",2020-12-09,,"Private, ltd by shares"49,3000944,"Chun Wang International Limited
駿泓國際有限公司",2020-12-09,,"Private, ltd by shares"50,3001001,"Circle Block Technologies Limited
圓通科技有限公司",2020-12-09,,"Private, ltd by shares"51,3001078,"CPS Group Co., Limited
華策集團有限公司",2020-12-09,,"Private, ltd by shares"52,3001041,"CREATE PROFIT LIMITED
創利國際行銷有限公司",2020-12-09,,"Private, ltd by shares"53,3001028,"CYPRESS PEAK ADVISORS LIMITED",2020-12-09,,"Private, ltd by shares"54,3001029,"DANX HONGKONG TRADING CO. LIMITED
香港丹克斯貿易有限公司",2020-12-09,,"Private, ltd by shares"55,3000912,"DE LUXE-PRO COMPANY LIMITED",2020-12-09,,"Private, ltd by shares"56,3000973,"Decent Innovation Limited",2020-12-09,,"Private, ltd by shares"57,3000892,"DELTA TRADE &amp; SERVICES LIMITED",2020-12-09,,"Private, ltd by shares"58,3001073,"DFDM MARITIME LIMITED",2020-12-09,,"Private, ltd by shares"59,3000945,"DIALOG HK LIMITED
香港太亞有限公司",2020-12-09,,"Private, ltd by shares"60,3000834,"Ding Hsung Conservation Company Limited
鼎新保育有限公司",2020-12-09,,"Private, ltd by shares"61,3001034,"Ding Hsung Construction Company Limited
鼎新建築有限公司",2020-12-09,,"Private, ltd by shares"62,3000949,"Ding's Kitchen Management Limited
鼎爺私房菜管理有限公司",2020-12-09,,"Private, ltd by shares"63,3000815,"Don N Rose Limited
黑玫瑰理髮店有限公司",2020-12-09,,"Private, ltd by shares"64,3000991,"Dragon lighting technology CO., Limited
熠龍光電科技有限公司",2020-12-09,,"Private, ltd by shares"65,3000918,"DSM INTERIOR DESIGN CONSULTANT LIMITED
雅思設計工程顧問有限公司",2020-12-09,,"Private, ltd by shares"66,3000816,"E.NOIRE LIMITED",2020-12-09,,"Private, ltd by shares"67,3001019,"ELAD TRADING LIMITED
伊利亞有限公司",2020-12-09,,"Private, ltd by shares"68,3001048,"Empire Source International Trading Limited
御源國際貿易有限公司",2020-12-09,,"Private, ltd by shares"69,3000888,"Epic Memory Limited",2020-12-09,,"Private, ltd by shares"70,3000843,"Eqlogix Limited",2020-12-09,,"Private, ltd by shares"71,3000950,"EYE OF HORUS COMPANY LIMITED
荷魯斯有限公司",2020-12-09,,"Private, ltd by shares"72,3000887,"F&amp;G Holdings Limited
殷譽控股有限公司",2020-12-09,,"Private, ltd by shares"73,3001085,"FANXIYA TECHNOLOGY LIMITED (HK)
梵西雅科技有限公司",2020-12-09,,"Private, ltd by shares"74,3001067,"Fenghuang News Network Television Group Limited
鳳凰新聞網絡電視台集團有限公司",2020-12-09,,"Private, ltd by shares"75,3001024,"FFEI LIMITED (HK)
菲菲有限公司",2020-12-09,,"Private, ltd by shares"76,3001064,"FINEPRINT FOUR LIMITED",2020-12-09,,"Private, ltd by shares"77,3001091,"Fitness Foundry Limited",2020-12-09,,"Private, ltd by shares"78,3000800,"For Yogi Limited
瑜點有限公司",2020-12-09,,"Private, ltd by shares"79,3001058,"FOREST RIDGE INTERNATIONAL TRADE CO., LIMITED",2020-12-09,,"Private, ltd by shares"80,3000970,"Frontier Health Service Limited
香港創先醫療有限公司",2020-12-09,,"Private, ltd by shares"81,3000869,"Fu Tat Motors Company Limited
富達汽車有限公司",2020-12-09,,"Private, ltd by shares"82,3000957,"FULLXINDA SPORTS GOODS CO., LIMITED
福鑫達運動用品有限公司",2020-12-09,,"Private, ltd by shares"83,3000977,"Gaia Australia (International) Institute Of Anti-aging Biology Limited
澳洲蓋亞(國際)抗衰老生物研究所有限公司",2020-12-09,,"Private, ltd by shares"84,3001026,"GB MULTIMEDIA LIMITED
好兄弟多媒體有限公司",2020-12-09,,"Private, ltd by shares"85,3000802,"GERMAN AUTO ALLIANCE PETROCHEMICAL INTERNATIONAL GROUP LIMITED
德國愛車之盟石油化工國際集團有限公司",2020-12-09,,"Private, ltd by shares"86,3001052,"GERMAN GUPIN GROUP LIMITED
德國古品集團有限公司",2020-12-09,,"Private, ltd by shares"87,3000964,"GLOBAL VISION (TCSP) LIMITED",2020-12-09,,"Private, ltd by shares"88,3001017,"Gmocon Technology Co., Limited
冠貿強科技有限公司",2020-12-09,,"Private, ltd by shares"89,3000806,"Golden Strands Real Estate Investment Limited",2020-12-09,,""90,3000807,"Golden Strands Trade Limited",2020-12-09,,""91,3000928,"Gpower Technology Limited
吉力科技有限公司",2020-12-09,,"Private, ltd by shares"92,3000902,"Guizhou Qintai Prince Liquor Co., Limited
貴州秦臺王子酒業有限公司",2020-12-09,,"Private, ltd by shares"93,3000980,"Guokang Pharmaceutical (Hong Kong) Group Holdings Limited
國康藥業(香港)集團控股有限公司",2020-12-09,,"Private, ltd by shares"94,3001053,"Haichen Trade Co., Limited
海辰國際貿易有限公司",2020-12-09,,"Private, ltd by shares"95,3001013,"HANGHE DEVELOP LIMITED
航合發展有限公司",2020-12-09,,"Private, ltd by shares"96,3000832,"Happyhome Toys &amp; Gifts Co., Limited
樂家玩具禮品有限公司",2020-12-09,,"Private, ltd by shares"97,3001049,"Hattrick Technology Limited
大三源科技有限公司",2020-12-09,,"Private, ltd by shares"98,3000813,"HEI CHEUK LIMITED
俙焯有限公司",2020-12-09,,"Private, ltd by shares"99,3000828,"HENGZHONG TRADING CO., LIMITED
恆眾貿易有限公司",2020-12-09,,"Private, ltd by shares"100,3000988,"HK AOLISEN TRADING LIMITED
香港奧麗森貿易有限公司",2020-12-09,,"Private, ltd by shares"101,3000862,"HK Diligence Company Limited",2020-12-09,,"Private, ltd by shares"102,3001055,"HK Hengji Commercial Real Estate Co., Limited
香港恒記商業地產有限公司",2020-12-09,,"Private, ltd by shares"103,3000996,"HK Spider Web Technology Limited
香港蜘蛛網絡技術有限公司",2020-12-09,,"Private, ltd by shares"104,3001059,"HK TuFai International Trade Limited
香港東輝國際商貿有限公司",2020-12-09,,"Private, ltd by shares"105,3001061,"HK XUNRUN INDUSTRY CO., LIMITED
香港巽潤實業有限公司",2020-12-09,,"Private, ltd by shares"106,3001038,"Ho Chan Group (Hong Kong) Holdings Limited
和成集團(香港)控股有限公司",2020-12-09,,"Private, ltd by shares"107,3001076,"HONG KONG 3D MAESTRO LIMITED",2020-12-09,,"Private, ltd by shares"108,3001083,"Hong Kong AirBadminton Association Limited
香港戶外羽毛球總會有限公司",2020-12-09,,"Ltd by guarantee"109,3001044,"HONG KONG BAI NIAN LIAN FA TRADING LIMITED
香港百年聯發貿易有限公司",2020-12-09,,"Private, ltd by shares"110,3001088,"Hong Kong Focus Training Limited
香港培訓中心有限公司",2020-12-09,,"Private, ltd by shares"111,3000954,"Hong Kong Helens Technology Limited
香港海倫斯科技有限公司",2020-12-09,,"Private, ltd by shares"112,3000930,"HONG KONG HUANGPAI FOOD COMPANY CO., LIMITED
香港皇牌食品株式會社有限公司",2020-12-09,,"Private, ltd by shares"113,3000983,"Hong Kong Jingdeli Biology Science And Technology Limited
香港精德立生物科技有限公司",2020-12-09,,"Private, ltd by shares"114,3000922,"Hong Kong Jinyi Network Technology Co., Limited
香港金益網絡科技有限公司",2020-12-09,,"Private, ltd by shares"115,3001070,"Hong Kong Juyimei Trading Co., Limited
香港居亦美貿易有限公司",2020-12-09,,"Private, ltd by shares"116,3000911,"Hong Kong Overseas Shopping Limited
香港海購有限公司",2020-12-09,,"Private, ltd by shares"117,3000872,"HONG KONG PARK ON ELECTRONIC TECHNOLOGY LIMITED",2020-12-09,,"Private, ltd by shares"118,3000840,"Hong Kong Qiaofuling International Biological Co., Limited
香港俏膚齡國際生物有限公司",2020-12-09,,"Private, ltd by shares"119,3000903,"Hong Kong Semiland Limited
香港森邁蘭電子科技有限公司",2020-12-09,,"Private, ltd by shares"120,3000820,"Hong Kong Western Options Trading Co., Limited
香港西選貿易有限公司",2020-12-09,,"Private, ltd by shares"121,3000798,"Hong Kong Yuezi Trading Co., Limited
香港悅姿商貿有限公司",2020-12-09,,"Private, ltd by shares"122,3000825,"HONGKONG EVERFOUNT TRADING CO., LIMITED
香港廣源貿易有限公司",2020-12-09,,"Private, ltd by shares"123,3000925,"HONGKONG GAOYE TRADING LIMITED
香港皋燁貿易有限公司",2020-12-09,,"Private, ltd by shares"124,3001060,"HONGKONG JUNYI COMMERCIAL LIMITED
香港君頤商業有限公司",2020-12-09,,"Private, ltd by shares"125,3000818,"HongKong Keen Technology Limited
香港中科瑞達科技有限公司",2020-12-09,,"Private, ltd by shares"126,3000938,"HONGKONG LIWA INTERNATIONAL INVESTMENT GROUP LIMITED
香港麗娃國際投資集團有限公司",2020-12-09,,"Private, ltd by shares"127,3000836,"HONGKONG LUCKYFINE LIMITED
香港小幸運有限公司",2020-12-09,,"Private, ltd by shares"128,3000870,"HONGKONG MITCHA TRADING CO., LIMITED
香港覓嘉貿易有限公司",2020-12-09,,"Private, ltd by shares"129,3001079,"HONGKONG TENGXIN TECHNOLOGY LIMITED",2020-12-09,,"Private, ltd by shares"130,3000968,"HongKong WisdomX Co., Limited
香港慧行跨境商服有限公司",2020-12-09,,"Private, ltd by shares"131,3000946,"Hongkong Xinfengfan Battery Limited
香港鑫風帆蓄電池有限公司",2020-12-09,,"Private, ltd by shares"132,3001082,"HONGKONG XINYI-WENWAI TRADE CO., LIMITED
香港鑫裔貿易有限公司",2020-12-09,,"Private, ltd by shares"133,3000867,"Hongyou Information Technology Co., Limited",2020-12-09,,"Private, ltd by shares"134,3000982,"HSING LIMITED
含盛有限公司",2020-12-09,,"Private, ltd by shares"135,3001037,"Hua Yun (International) Universal Health Management Limited
華韵(國際)大健康管理有限公司",2020-12-09,,"Private, ltd by shares"136,3001072,"Huadian Garment Trading Co., Limited
華典服裝商貿有限公司",2020-12-09,,"Private, ltd by shares"137,3000896,"Huatai Xin Group Co., Limited
華泰鑫集團有限公司",2020-12-09,,"Private, ltd by shares"138,3000845,"HZ FASHIONABLE LIMITED",2020-12-09,,"Private, ltd by shares"139,3000793,"I Connect Technology Limited",2020-12-09,,"Private, ltd by shares"140,3001057,"Iao Hian Shing Investment Development Limited
柔香成投資發展有限公司",2020-12-09,,"Private, ltd by shares"141,3000956,"Innovative Victory Limited",2020-12-09,,"Private, ltd by shares"142,3000794,"IT-DW INTERNATIONAL CO., LIMITED
丹尼爾國際有限公司",2020-12-09,,"Private, ltd by shares"143,3001084,"J.Loong Cha Limited
龍茶有限公司",2020-12-09,,"Private, ltd by shares"144,3000859,"JD Aries Development XXXIII (HK) Limited",2020-12-09,,"Private, ltd by shares"145,3000866,"JD Aries Development XXXIV (HK) Limited",2020-12-09,,"Private, ltd by shares"146,3000972,"JD Aries Development XXXIX (HK) Limited",2020-12-09,,"Private, ltd by shares"147,3000873,"JD Aries Development XXXV (HK) Limited",2020-12-09,,"Private, ltd by shares"148,3000890,"JD Aries Development XXXVI (HK) Limited",2020-12-09,,"Private, ltd by shares"149,3000895,"JD Aries Development XXXVII (HK) Limited",2020-12-09,,"Private, ltd by shares"150,3000921,"JD Aries Development XXXVIII (HK) Limited",2020-12-09,,"Private, ltd by shares"151,3000981,"JD Aries Development XXXX (HK) Limited",2020-12-09,,"Private, ltd by shares"152,3000860,"JIUNUO TRADING LIMITED
九諾貿易有限公司",2020-12-09,,"Private, ltd by shares"153,3000963,"JOKER STAST GROUP LIMITED
創意寶集團有限公司",2020-12-09,,"Private, ltd by shares"154,3000852,"Jotunheim (HK) Electronic Technology Co., Limited
佳田恒源(香港)電子科技有限公司",2020-12-09,,"Private, ltd by shares"155,3000910,"Joy Happiness Trading Limited",2020-12-09,,""156,3000810,"JOYOUS DEVELOPMENT (H.K.) LIMITED
嘗樂發展有限公司",2020-12-09,,"Private, ltd by shares"157,3000871,"Juliang Import And Export Trade Co., Limited
聚量進出口貿易有限公司",2020-12-09,,"Private, ltd by shares"158,3000994,"JUN JING DEVELOPMENT LIMITED
峻景發展有限公司",2020-12-09,,"Private, ltd by shares"159,3001031,"K-RONG TRADE LIMITED
楷榮貿易有限公司",2020-12-09,,"Private, ltd by shares"160,3000814,"Kangmei International (Hong Kong) Holdings Limited
康美國際（香港）控股有限公司",2020-12-09,,"Private, ltd by shares"161,3000839,"Kanstill Holding (Hong Kong) Limited
群志控股(香港)有限公司",2020-12-09,,"Private, ltd by shares"162,3000868,"KeeReal Consulting Limited",2020-12-09,,"Private, ltd by shares"163,3000913,"Kim Diep Production Trade Plastics (HongKong) Co., Limited
香港金葉塑膠責任有限公司",2020-12-09,,"Private, ltd by shares"164,3000797,"Kin Choi Workshop Limited
建材坊有限公司",2020-12-09,,"Private, ltd by shares"165,3001086,"Kingdomcity Hong Kong Limited",2020-12-09,,"Ltd by guarantee"166,3000916,"KJM Organic Foods Limited",2020-12-09,,"Private, ltd by shares"167,3001006,"KK COFFEE HERE LIMITED",2020-12-09,,"Private, ltd by shares"168,3000926,"Kong Spirit Limited
港陞實業有限公司",2020-12-09,,"Private, ltd by shares"169,3000863,"KOOMOOLOO Limited",2020-12-09,,"Private, ltd by shares"170,3000878,"KTEX GROUP CO., LIMITED",2020-12-09,,"Private, ltd by shares"171,3000799,"Ku Space Limited
酷空間有限公司",2020-12-09,,"Private, ltd by shares"172,3000961,"LEE KEE CONSTRUCTION LIMITED
李記建築有限公司",2020-12-09,,""173,3000821,"LEGALSQUARE BUSINESS ADVISING LIMITED",2020-12-09,,"Private, ltd by shares"174,3001025,"Lin Ying Trading Co., Limited
凌盈貿易有限公司",2020-12-09,,"Private, ltd by shares"175,3000792,"Linkup Technologies Limited",2020-12-09,,"Private, ltd by shares"176,3001054,"LIREN INTERNATIONAL DEVELOPMENT CO., LIMITED
里仁國際發展有限公司",2020-12-09,,"Private, ltd by shares"177,3000923,"LIVE CHAT INC LIMITED",2020-12-09,,"Private, ltd by shares"178,3001051,"Locks Investment Limited
樂士投資有限公司",2020-12-09,,"Private, ltd by shares"179,3000853,"LOK OI LIMITED
諾愛有限公司",2020-12-09,,"Private, ltd by shares"180,3001040,"LOKDIM INTERNATIONAL LIMITED
樂點國際有限公司",2020-12-09,,"Private, ltd by shares"181,3000905,"Longteng (China) barter Yipai Group Co., Limited
龍騰(中國)易貨易拍集團股份有限公司",2020-12-09,,"Private, ltd by shares"182,3000979,"Luk Yau Limited
綠遊有限公司",2020-12-09,,"Private, ltd by shares"183,3000990,"LULU INTERNATIONAL FREIGHT FORWARDER CO., LIMITED
陸陸國際貨運代理有限公司",2020-12-09,,"Private, ltd by shares"184,3000854,"LUMIERE &amp; L INTERNATIONAL LIMITED",2020-12-09,,"Private, ltd by shares"185,3001081,"MACKUB LIMITED",2020-12-09,,"Private, ltd by shares"186,3000947,"Magic Smart Limited",2020-12-09,,"Private, ltd by shares"187,3001015,"MAKEUP HK LIMITED",2020-12-09,,"Private, ltd by shares"188,3000948,"Mari Company Limited
埋嚟有限公司",2020-12-09,,"Private, ltd by shares"189,3000819,"Mars Bakery Limited",2020-12-09,,"Private, ltd by shares"190,3001089,"Masis Limited",2020-12-09,,"Private, ltd by shares"191,3000855,"MEATEE LIMITED",2020-12-09,,"Private, ltd by shares"192,3001003,"MILK IT BABY LIMITED",2020-12-09,,"Private, ltd by shares"193,3001077,"Million Rivers Limited
百川國際有限公司",2020-12-09,,"Private, ltd by shares"194,3000881,"MINGYUNGONGTONGTI DEVEIOPMENT LIMITED
命運共同體發展有限公司",2020-12-09,,"Private, ltd by shares"195,3000864,"MNANJING TRADING CO., LIMITED",2020-12-09,,"Private, ltd by shares"196,3000962,"MONTELI1 LIMITED",2020-12-09,,"Private, ltd by shares"197,3000969,"MONTELI2 LIMITED",2020-12-09,,"Private, ltd by shares"198,3000971,"MONTELI3 LIMITED",2020-12-09,,"Private, ltd by shares"199,3000974,"MONTELI4 LIMITED",2020-12-09,,"Private, ltd by shares"200,3000976,"MONTELI5 LIMITED",2020-12-09,,"Private, ltd by shares"201,3001063,"MORE THAN MALL LIMITED
買定賣有限公司",2020-12-09,,"Private, ltd by shares"202,3000803,"Mounting Textile Co., Limited
檬廷紡織品有限公司",2020-12-09,,"Private, ltd by shares"203,3001002,"MSJ E-COMMERCE TECHNOLOGY LIMITED
香港明斯基電子商務有限公司",2020-12-09,,"Private, ltd by shares"204,3000975,"NAILS BEAUTY LIFE LIMITED",2020-12-09,,"Private, ltd by shares"205,3000939,"Nakama Limited (HK)
一夥有限公司",2020-12-09,,"Private, ltd by shares"206,3001065,"Netten Corporate Advisory Limited",2020-12-09,,"Private, ltd by shares"207,3000924,"New DianDian Technology Company Limited
新點點科技有限公司",2020-12-09,,"Private, ltd by shares"208,3001080,"New Ecological Technology Limited",2020-12-09,,"Private, ltd by shares"209,3000879,"New Practice Limited (HK)
躬行有限公司",2020-12-09,,"Private, ltd by shares"210,3001021,"New Toyar Trading Limited
新拓源貿易有限公司",2020-12-09,,"Private, ltd by shares"211,3000931,"Nikel Investment Limited",2020-12-09,,"Private, ltd by shares"212,3001045,"NOLAI Technology (HK) Co., Limited
諾錸科技香港有限公司",2020-12-09,,"Private, ltd by shares"213,3000929,"Novecel Industrial Trading Limited
諾維賽實業貿易有限公司",2020-12-09,,"Private, ltd by shares"214,3000995,"OBCHAIN LIMITED",2020-12-09,,"Private, ltd by shares"215,3000986,"OCEAN FORTUNE TRADING DEVELOP LIMITED
海升貿易拓展有限公司",2020-12-09,,"Private, ltd by shares"216,3000849,"On Hing Capital Hong Kong Limited
香港安興資本有限公司",2020-12-09,,"Private, ltd by shares"217,3000811,"ONE GLOBAL PARTNERS LIMITED",2020-12-09,,"Private, ltd by shares"218,3001020,"One Mile Group Limited
零一谷有限公司",2020-12-09,,"Private, ltd by shares"219,3001022,"ONE MORE PRODUCTION LIMITED
加一製作有限公司",2020-12-09,,"Private, ltd by shares"220,3000829,"Orso Asia Co., Limited
奧索亞洲有限公司",2020-12-09,,"Private, ltd by shares"221,3000942,"Panda Friendly International Brand Promotion Center Co., Limited
大熊貓友好型國際品牌推廣中心有限公司",2020-12-09,,"Private, ltd by shares"222,3000935,"Pavilion Development Limited (The)",2020-12-09,,"Private, ltd by shares"223,3001027,"Pinkyo Leather Co., Limited
品優皮具有限公司",2020-12-09,,"Private, ltd by shares"224,3001071,"PRAISE SUNRISE LIMITED
讚曉有限公司",2020-12-09,,"Private, ltd by shares"225,3000838,"Quantum Semiconductor HK Limited
昆騰技術有限公司",2020-12-09,,"Private, ltd by shares"226,3001010,"R&amp;A Furniture (HK) Co., Limited
艾莉家具(香港)有限公司",2020-12-09,,"Private, ltd by shares"227,3000827,"Raymond International Co., Limited
千盈國際有限公司",2020-12-09,,"Private, ltd by shares"228,3000900,"READY IN INDUSTRIAL CO., LIMITED
瑞鼎有限公司",2020-12-09,,"Private, ltd by shares"229,3001014,"Relaxity Limited",2020-12-09,,"Private, ltd by shares"230,3000943,"Roromax Trading Development Co. Limited
豐道貿易發展有限公司",2020-12-09,,"Private, ltd by shares"231,3000891,"Rpro HK Limited
艾博專業服務有限公司",2020-12-09,,"Private, ltd by shares"232,3000959,"RYAN YANCHAO (INTERNATIONAL) FUND INVESTMENT GROUP LIMITED
萊恩彥超(國際)投資集團有限公司",2020-12-09,,"Private, ltd by shares"233,3001004,"S.H Technical Limited
日基科技有限公司",2020-12-09,,"Private, ltd by shares"234,3000927,"SA System Solution Limited
傑盈系統方案有限公司",2020-12-09,,"Private, ltd by shares"235,3001043,"San Chuan Engineering (HK) Limited
三川工程(香港)有限公司",2020-12-09,,"Private, ltd by shares"236,3000795,"SAVOUR HOLDINGS LIMITED",2020-12-09,,"Private, ltd by shares"237,3000940,"SHENGJIA SUPPLY CHAIN MANAGEMENT CO., LIMITED
晟嘉供應鏈管理有限公司",2020-12-09,,"Private, ltd by shares"238,3000909,"SILVLIS DESIGN LIMITED",2020-12-09,,"Private, ltd by shares"239,3000850,"SIU WAH LIMITED
少華有限公司",2020-12-09,,"Private, ltd by shares"240,3000874,"Skyway Innovation Limited
嘉運創科有限公司",2020-12-09,,"Private, ltd by shares"241,3000998,"SmallRig Technology (HK) Limited
斯莫格科技（香港）有限公司",2020-12-09,,"Private, ltd by shares"242,3000936,"Smart Plus A Engineering Company Limited
智盈工程服務有限公司",2020-12-09,,"Private, ltd by shares"243,3000985,"SMART RISE TRADING DEVELOP LIMITED
雋陞貿易拓展有限公司",2020-12-09,,"Private, ltd by shares"244,3000880,"SMJ Wood Trading Limited
珊美久有限公司",2020-12-09,,"Private, ltd by shares"245,3000984,"So Hak Limited
蘇克有限公司",2020-12-09,,"Private, ltd by shares"246,3000844,"SPACEFLIGHT POWER SUPPLY COMPANY LIMITED
航天電源科技有限公司",2020-12-09,,"Private, ltd by shares"247,3000808,"SUEKIN TRADING LIMITED
盛新貿易有限公司",2020-12-09,,"Private, ltd by shares"248,3000826,"SUILISU CO., LIMITED
水力速有限公司",2020-12-09,,"Private, ltd by shares"249,3000857,"SUPERMAMA COMPANY LIMITED",2020-12-09,,"Private, ltd by shares"250,3000856,"Swift Trading Co., Limited",2020-12-09,,"Private, ltd by shares"251,3000999,"Tak Fung Wing Trading Co., Limited
德豐榮貿易有限公司",2020-12-09,,"Private, ltd by shares"252,3000796,"Team Tigers Technology Limited",2020-12-09,,"Private, ltd by shares"253,3000801,"TEJIALU NEW MATERIAL (HK) CO., LIMITED
特加魯新材料(香港)有限公司",2020-12-09,,"Private, ltd by shares"254,3001030,"TIMSEON HEALTHCARE LIMITED
泰瑞添順健康(香港)有限公司",2020-12-09,,"Private, ltd by shares"255,3001062,"TORO OPTOELECTRONICS CO., LIMITED
公司註冊編號 3001062 有限公司",2020-12-09,,"Private, ltd by shares"256,3000833,"trainer-ifa (hk) group Limited
群爾獨立顧問(香港)有限公司",2020-12-09,,"Private, ltd by shares"