,Reg no.,Name,Incorp-orated,Dissolved,Type1,0787009,"ALL CHANCE INDUSTRIAL LIMITED
盛卓實業有限公司",2002-02-25,2013-09-19,"Private, ltd by shares"2,0786998,"ARTS POINT LIMITED (d2010-02-26)
藝術據點有限公司",2002-02-25,2010-02-26,"Ltd by guarantee"3,0787032,"BEAUT UP COMPANY LIMITED
美研化粧有限公司",2002-02-25,,"Private, ltd by shares"4,0787013,"BEST CYBER TECHNOLOGY LIMITED
威盈科技有限公司",2002-02-25,,"Private, ltd by shares"5,0787006,"BEST WISDOM ENTERPRISE LIMITED
智盈企業有限公司",2002-02-25,,"Private, ltd by shares"6,0787063,"BUSY PEACE LOGISTICS LIMITED
旺泰物流有限公司",2002-02-25,,"Private, ltd by shares"7,0787073,"C S CORP. CONSULTANCY LIMITED
香江顧問有限公司",2002-02-25,,"Private, ltd by shares"8,0787039,"CALLISTAR INTERNATIONAL TRADE &amp; ECONOMIC CO., LIMITED
凱勒斯特國際經貿發展有限公司",2002-02-25,2007-07-06,"Private, ltd by shares"9,0787086,"CARPE DIEM CONSULTING LIMITED (d2008-08-01)",2002-02-25,2008-08-01,"Private, ltd by shares"10,0787077,"CARRY THAI LIMITED
啟通泰有限公司",2002-02-25,2007-06-22,"Private, ltd by shares"11,0787093,"CERAGEM (HONG KONG) LIMITED
喜樂健(香港)有限公司",2002-02-25,,"Private, ltd by shares"12,0787097,"CHILDREN EDUCATION FUND LIMITED
培幼行動有限公司",2002-02-25,,"Ltd by guarantee"13,0787088,"CHINA HONG KONG CORPORATE SERVICES LIMITED
中港企業代理服務有限公司",2002-02-25,,"Private, ltd by shares"14,0787025,"CITILINE LOGISTICS LIMITED
富城物流有限公司",2002-02-25,2007-03-23,"Private, ltd by shares"15,0787080,"CLIPPER INTERNATIONAL LIMITED (HK)",2002-02-25,,"Private, ltd by shares"16,0787087,"CRESOL CONSULTANTS LIMITED",2002-02-25,2009-08-21,"Private, ltd by shares"17,0787060,"CSW GROUP LIMITED (HK)",2002-02-25,,"Private, ltd by shares"18,0787114,"DAWNSUN TRAVEL SERVICES LIMITED
晨彩旅遊有限公司",2002-02-25,2005-07-29,"Private, ltd by shares"19,0787023,"DONG NAM TRANS LIMITED",2002-02-25,2005-03-04,"Private, ltd by shares"20,0787096,"DOUBLE BETTER LIMITED",2002-02-25,2013-10-04,"Ltd by guarantee"21,0787095,"EAC CONSULTANTS LIMITED
新東亞顧問有限公司",2002-02-25,2005-09-09,"Private, ltd by shares"22,0787038,"EASTERN TOURS (CHINA) LIMITED
億順旅行社(中國)有限公司",2002-02-25,2009-07-17,"Private, ltd by shares"23,0787057,"ELECTROFLOW HONG KONG LIMITED",2002-02-25,2018-08-31,"Private, ltd by shares"24,0787082,"ENERGY GROUP LIMITED (d2003-05-16)
節能有限公司",2002-02-25,2003-05-16,"Private, ltd by shares"25,0787011,"EVER CHANCE HOLDINGS LIMITED (d2009-07-17)
捷昌集團有限公司",2002-02-25,2009-07-17,"Private, ltd by shares"26,0787019,"EVER LINK GARMENT LIMITED
永滙製衣有限公司",2002-02-25,2010-06-04,"Private, ltd by shares"27,0787010,"FASHION LINKS LIMITED",2002-02-25,,"Private, ltd by shares"28,0787027,"FORTUNE BIO-ENGINEERING GROUP LIMITED
祥爾生物工程集團有限公司",2002-02-25,2012-03-30,"Private, ltd by shares"29,0787107,"FRANCE JACK WALK (H.K.) INT'L LIMITED
法國傑克走路(香港)國際有限公司",2002-02-25,2006-03-17,"Private, ltd by shares"30,0787015,"FRIENDLY ENGINEERING LIMITED (d2007-07-13)
友豐工程有限公司",2002-02-25,2007-07-13,"Private, ltd by shares"31,0787072,"GREEN BOX PACKAGING LIMITED
傑麗達環保包裝有限公司",2002-02-25,2009-12-04,"Private, ltd by shares"32,0787081,"H.K. SCAFFORM LIMITED
加豐工程有限公司",2002-02-25,2010-08-20,"Private, ltd by shares"33,0787040,"HANG TOH CONTRACTING COMPANY LIMITED
恆都工程有限公司",2002-02-25,2007-11-28,"Private, ltd by shares"34,0787008,"HARVEST ENTERPRISE LIMITED (d2013-01-11)
友豐企業有限公司",2002-02-25,2013-01-11,"Private, ltd by shares"35,0787061,"HING AH AGENCY COMPANY LIMITED
興亞代理有限公司",2002-02-25,,"Private, ltd by shares"36,0787053,"HK EATENZON DRESS LIMITED
香港伊藤中服飾有限公司",2002-02-25,2007-07-06,"Private, ltd by shares"37,0787029,"HK MONZSA INT'L GROUP LIMITED
香港蒙姿莎國際集團有限公司",2002-02-25,2010-10-29,"Private, ltd by shares"38,0787052,"HKAA FINANCE LIMITED
香港汽車會財務有限公司",2002-02-25,2004-09-17,"Private, ltd by shares"39,0787041,"HO WAN ENGINEERING &amp; TRANSPORTATION LIMITED
皓雲工程運輸有限公司",2002-02-25,,"Private, ltd by shares"40,0787113,"HONG KONG CUILU DESIGN LIMITED
香港翠綠形象設計有限公司",2002-02-25,2010-10-29,"Private, ltd by shares"41,0787002,"HONG KONG INTERNATIONAL AIRPORT FERRY TERMINAL SERVICES LIMITED
香港國際機場碼頭服務有限公司",2002-02-25,,"Private, ltd by shares"42,0787062,"HONLINK INTERNATIONAL FREIGHT LIMITED
漢興國際貨運有限公司",2002-02-25,,"Private, ltd by shares"43,0787123,"HORUS INVESTMENT LIMITED",2002-02-25,2016-10-14,"Private, ltd by shares"44,0787084,"HYLEVEL ELECTRONIC INDUSTRIES (H.K.) LIMITED
海來福電子實業(香港)有限公司",2002-02-25,,"Private, ltd by shares"45,0787110,"I-TRADE (HK) LIMITED (d2007-07-06)",2002-02-25,2007-07-06,"Private, ltd by shares"46,0787111,"IBTRANCO LIMITED",2002-02-25,2007-07-06,"Private, ltd by shares"47,0787037,"ICE PROFESSIONAL SKIN CARE COMPANY LIMITED
晴專業美容有限公司",2002-02-25,,"Private, ltd by shares"48,0787004,"INCOFOOD HONG KONG INTERNATIONAL LIMITED",2002-02-25,,"Private, ltd by shares"49,0787103,"INVESTOR EXPERIENCE, LIMITED (THE)",2002-02-25,2004-08-06,"Private, ltd by shares"50,0787090,"ITALY CROCODILE INT'L GROUP (H.K.) INDUSTRY SHARES LIMITED
意大利鱷魚國際集團(香港)實業股份有限公司",2002-02-25,2007-07-06,"Private, ltd by shares"51,0787076,"ITALY VALENTINO (HONG KONG) INTERNATIONAL FASHION LIMITED
意大利華迪聖奴(香港)國際服飾有限公司",2002-02-25,2013-04-05,"Private, ltd by shares"52,0787044,"ITS ENTERPRISES LIMITED
鷹眼企業有限公司",2002-02-25,2009-07-17,"Private, ltd by shares"53,0787014,"JAS SOLUTIONS CO., LIMITED",2002-02-25,2006-10-27,"Private, ltd by shares"54,0787122,"JENNA MARKETING (HKG) LIMITED",2002-02-25,2018-01-26,"Private, ltd by shares"55,0787116,"JINFAXIN INDUSTRIAL LIMITED
錦發興實業有限公司",2002-02-25,2013-04-05,"Private, ltd by shares"56,0787074,"KAI NICHI DEVELOPMENT CO. LIMITED
海日發展有限公司",2002-02-25,,"Private, ltd by shares"57,0787109,"KING TAK HONG PORCELAIN COMPANY LIMITED
景德行瓷業有限公司",2002-02-25,,"Private, ltd by shares"58,0787101,"LAKE (HONG KONG) TECHNOLOGY LIMITED
雷克(香港)科技有限公司",2002-02-25,,"Private, ltd by shares"59,0787117,"LEADING CAPITAL LIMITED (HK)
財捷有限公司",2002-02-25,,"Private, ltd by shares"60,0787120,"LEUNG KEI INDUSTRIAL (HONG KONG) CO., LIMITED
良基實業(香港)有限公司",2002-02-25,,"Private, ltd by shares"61,0787121,"LIMESTARS LIMITED",2002-02-25,2018-11-02,"Private, ltd by shares"62,0787007,"LINK WELL ENTERPRISE LIMITED
能威企業有限公司",2002-02-25,,"Private, ltd by shares"63,0787067,"LION INT'L FORWARDING (HK) COMPANY LIMITED
理安海空運承攬運送(香港)有限公司",2002-02-25,2011-01-14,"Private, ltd by shares"64,0787118,"LOCAL PROCESSING SERVICES LIMITED",2002-02-25,2004-04-08,"Private, ltd by shares"65,0787056,"LUCKY WALTER (HONG KONG) LIGHTING EQUIPMENT CO., LIMITED
瑞華達(香港)照明電器有限公司",2002-02-25,2004-01-02,"Private, ltd by shares"66,0787075,"LUNG CANCER RESEARCH GROUP LIMITED",2002-02-25,2011-10-14,"Private, ltd by shares"67,0787100,"LYGO (CHINA) INDUSTRIAL LIMITED
利高(中國)實業有限公司",2002-02-25,2008-08-01,"Private, ltd by shares"68,0787003,"MAESTRO CAFE BAR LIMITED",2002-02-25,,"Private, ltd by shares"69,0787108,"MANSION INSURANCE SERVICES LIMITED
民信保險服務有限公司",2002-02-25,,"Private, ltd by shares"70,0787024,"MASTER GLASS LIMITED",2002-02-25,2009-07-10,"Private, ltd by shares"71,0787001,"MASTER HERO HOLDINGS LIMITED (d2010-10-29)
萬浩集團有限公司",2002-02-25,2010-10-29,"Private, ltd by shares"72,0787125,"MAVEN LIMITED (d2008-08-01)",2002-02-25,2008-08-01,"Private, ltd by shares"73,0787036,"MEGASTEK TECHNOLOGIES LIMITED
明達科研有限公司",2002-02-25,,"Private, ltd by shares"74,0787066,"MELAYWAY GLASS CORPORATION LIMITED
美麗威玻璃工程有限公司",2002-02-25,2009-07-17,"Private, ltd by shares"75,0787000,"MELBOURNE HOLDINGS LIMITED (d2011-11-18)",2002-02-25,2011-11-18,"Private, ltd by shares"76,0787034,"MINATO SEIKO (H.K.) COMPANY LIMITED
港精工(香港)有限公司",2002-02-25,2016-02-26,"Private, ltd by shares"77,0787099,"MOBILE APPLICATION LIMITED",2002-02-25,,"Private, ltd by shares"78,0787048,"MONSTER EGG LIMITED
怪獸蛋有限公司",2002-02-25,2008-02-22,"Private, ltd by shares"79,0787071,"NATURE EDUCATION KINDERGARTEN LIMITED
自然教育幼稚園有限公司",2002-02-25,,"Private, ltd by shares"80,0787127,"OFS BRIGHTWAVE ASIA PACIFIC, LIMITED",2002-02-25,2006-06-29,"Private, ltd by shares"81,0787064,"ON TEK ENTERPRISE LIMITED
震龍企業有限公司",2002-02-25,2010-01-22,"Private, ltd by shares"82,0787043,"PAK SHUN TRANSPORTATION LIMITED
百順運輸有限公司",2002-02-25,,"Private, ltd by shares"83,0787068,"PAN ASIA HEALTHCARE LIMITED
宏健醫療保健有限公司",2002-02-25,,"Private, ltd by shares"84,0787059,"PANG TAT INTERNATIONAL (HONG KONG) COMPANY LIMITED
鵬達國際(香港)有限公司",2002-02-25,,"Private, ltd by shares"85,0787094,"PETROLUB HONG KONG COMPANY LIMITED",2002-02-25,,"Private, ltd by shares"86,0787078,"PLENTY ISLAND LIMITED",2002-02-25,2007-03-23,"Private, ltd by shares"87,0787016,"POWER LEGEND ENGINEERING LIMITED
力駿工程有限公司",2002-02-25,2003-12-12,"Private, ltd by shares"88,0787012,"PRIME GOLDEN HOLDINGS LIMITED
栢金集團有限公司",2002-02-25,,"Private, ltd by shares"89,0787098,"PUI YUEN SEAFOOD COMPANY LIMITED
沛源海鮮有限公司",2002-02-25,,"Private, ltd by shares"90,0787049,"R &amp; D LIMITED",2002-02-25,,"Private, ltd by shares"91,0787104,"RE-DEUTSCHE PRECISION INDUSTRIAL (H.K.) LIMITED
瑞德精密工業(香港)有限公司",2002-02-25,,"Private, ltd by shares"92,0787079,"REPUBLIC (HK) PRESS LIMITED
共和(香港)出版有限公司",2002-02-25,2013-04-12,"Private, ltd by shares"93,0787102,"RONGSHENG UNION INVESTMENT (HONG KONG) LIMITED
榮盛聯合投資(香港)有限公司",2002-02-25,2010-10-29,"Private, ltd by shares"94,0787028,"RUN DE INT'L GROUP (H.K.) LIMITED
潤德國際集團(香港)有限公司",2002-02-25,2007-07-06,"Private, ltd by shares"95,0787033,"S. J. HONG KONG LIMITED",2002-02-25,2005-06-30,"Private, ltd by shares"96,0787022,"SHOEMAP LIMITED
鞋遍天下有限公司",2002-02-25,2013-01-04,"Private, ltd by shares"97,0787018,"SINO BRIGHT GARMENT LIMITED
益輝製衣有限公司",2002-02-25,2007-07-06,"Private, ltd by shares"98,0787026,"SINO-CYBER WORLD LIMITED
華移互動傳媒有限公司",2002-02-25,2020-07-17,"Private, ltd by shares"99,0787112,"SINOGY LIMITED
中海能源有限公司",2002-02-25,2015-08-07,"Private, ltd by shares"100,0787005,"SIR HUDSON CORPORATION LIMITED",2002-02-25,,"Private, ltd by shares"101,0786999,"SKYE CONSULTANTS LIMITED (d2007-04-27)",2002-02-25,2007-04-27,"Private, ltd by shares"102,0787126,"SOFTBRANDS (HK) LIMITED",2002-02-25,,"Private, ltd by shares"103,0787070,"SPECIAL PROJECTS INTERNATIONAL LIMITED",2002-02-25,2004-07-09,"Private, ltd by shares"104,0787083,"SPIKER LIMITED (HK)",2002-02-25,,"Private, ltd by shares"105,0787017,"SUN CONCEPT CONSULTANTS LIMITED
新豐顧問有限公司",2002-02-25,,"Private, ltd by shares"106,0787047,"SUN KAM SHING ENGINEERING LIMITED
新錦成工程有限公司",2002-02-25,2006-12-22,"Private, ltd by shares"107,0787085,"SUN LOGISTICS CONSULTANTS LIMITED
燊輝物流顧問有限公司",2002-02-25,,"Private, ltd by shares"108,0787124,"TEAMEPRIZES.COM LIMITED",2002-02-25,2004-09-30,"Private, ltd by shares"109,0787045,"TECHMOTION CONSULTING LIMITED
亞洲華商領峰顧問有限公司",2002-02-25,2006-10-13,"Private, ltd by shares"110,0787031,"TERRATEX GROUP (INTERNATIONAL) LIMITED
大地集團(國際)有限公司",2002-02-25,,"Private, ltd by shares"111,0787092,"TOP PROFIT INTERNATIONAL LIMITED (d2007-07-06)
高盈國際有限公司",2002-02-25,2007-07-06,"Private, ltd by shares"112,0787051,"TOTEX INTERNATIONAL LIMITED",2002-02-25,,"Private, ltd by shares"113,0787050,"TOTEX TECHNOLOGY LIMITED",2002-02-25,2010-06-11,"Private, ltd by shares"114,0787115,"TRI-M PARTNER'S INTERNATIONAL LIMITED
鑫浩國際有限公司",2002-02-25,2007-07-06,"Private, ltd by shares"115,0787091,"U ON ENGINEERING LIMITED
穗安工程有限公司",2002-02-25,2017-10-13,"Private, ltd by shares"116,0787055,"UPI (HONG KONG) LIMITED
新華商品國際有限公司",2002-02-25,,"Private, ltd by shares"117,0787030,"VENTURE STRATEGIC ADVISORY LIMITED
先機策略顧問有限公司",2002-02-25,,"Private, ltd by shares"118,0787105,"VISIONAIRE CONCEPTS (HONG KONG) LIMITED",2002-02-25,2008-12-05,"Private, ltd by shares"119,0787035,"WAI TAT GEO-ENGINEERING LIMITED
維達地質工程有限公司",2002-02-25,2004-06-11,"Private, ltd by shares"120,0787069,"WEBTECH SYSTEMS LIMITED (d2015-11-20)",2002-02-25,2015-11-20,"Private, ltd by shares"121,0787119,"WELLMAX INTERNATIONAL COMPANY LIMITED
緯貿國際有限公司",2002-02-25,,"Private, ltd by shares"122,0787046,"WELLY INVESTMENT (ASIA) CO., LIMITED
匯銀投資(亞洲)有限公司",2002-02-25,2007-07-06,"Private, ltd by shares"123,0787020,"WIN ALL LIMITED (d2003-08-01)
萬威有限公司",2002-02-25,2003-08-01,"Private, ltd by shares"124,0787054,"WORD CHAIN COMPANY LIMITED (THE)
彙川有限公司",2002-02-25,2004-03-19,"Private, ltd by shares"125,0787089,"WORLDSUN INTERNATIONAL ENTERPRISE LIMITED
裕達順國際實業有限公司",2002-02-25,2007-05-25,"Private, ltd by shares"126,0787042,"X-TUNER ELECTRONICS TRADING CO., LIMITED
艾克特國際有限公司",2002-02-25,2007-04-13,"Private, ltd by shares"127,0787065,"YAMATO TRADE LINE NETWORK LIMITED",2002-02-25,2008-08-01,"Private, ltd by shares"128,0787021,"YIELD HONOUR LIMITED (d2005-02-18)
行發有限公司",2002-02-25,2005-02-18,"Private, ltd by shares"129,0787058,"YORKSON INDUSTRIAL LIMITED (d2011-02-02)
日升實業有限公司",2002-02-25,2011-02-02,"Private, ltd by shares"130,0787106,"YOUNG (HK) INT'L FASHION LIMITED
婭格(香港)國際時裝有限公司",2002-02-25,2009-07-17,"Private, ltd by shares"