,Reg no.,Name,Incorp-orated,Dissolved,Type1,2468905,"DecentChunk (Hong Kong) Trading Co., Limited
德盛江柯(香港)貿易有限公司",2016-12-24,,"Private, ltd by shares"2,2468906,"FEDORA VIELGLUCK CO., LIMITED",2016-12-24,,"Private, ltd by shares"3,2468902,"Guangzhou Missy Biological Technology Co., Limited",2016-12-24,,"Private, ltd by shares"4,2468901,"Hong Kong Women's Institute Of Oriental Culture Limited
香港東方女子書院有限公司",2016-12-24,,"Private, ltd by shares"5,2468903,"Hong kong Zhou Zi Ji Industrial Co., Limited
香港周仔記實業有限公司",2016-12-24,,"Private, ltd by shares"6,2468907,"JSG Global Immigration Consultancy Limited
御海移民顧問有限公司",2016-12-24,,"Private, ltd by shares"7,2468904,"Seastar hundred Limited
星海一百有限公司",2016-12-24,,"Private, ltd by shares"8,2468900,"Sunshine Pharma Co., Limited",2016-12-24,,"Private, ltd by shares"