,Reg no.,Name,Incorp-orated,Dissolved,Type1,2462816,"BO CHENG (MARBLE) ENGINEERING LIMITED
寶誠(雲石)工程有限公司",2016-12-10,2018-05-25,"Private, ltd by shares"2,2462818,"GAOFENG NETWORK LIMITED
香港高峰網絡有限公司",2016-12-10,,"Private, ltd by shares"3,2462817,"JAUNTY RESTAURANT LIMITED
象泰飲食有限公司",2016-12-10,,"Private, ltd by shares"4,2462814,"JTF Technology Industry Limited
聚天富科技產業有限公司",2016-12-10,,"Private, ltd by shares"5,2462815,"Oriental Resources (Asia) Limited
東方資源(亞洲)有限公司",2016-12-10,,"Private, ltd by shares"6,2462813,"VENICO RESTAURANT PLANNING MANAGEMENT LIMITED
威利高餐飲策劃管理有限公司",2016-12-10,2019-11-22,"Private, ltd by shares"7,2462812,"Zhongye Group Holdings Limited
中冶控股集團有限公司",2016-12-10,,"Private, ltd by shares"