,Reg no.,Name,Incorp-orated,Dissolved,Type229,2253529,"GOOD BRIGHT INTERNATIONAL INVESTMENT LIMITED
明益國際投資有限公司",2015-06-19,,"Private, ltd by shares"230,2253527,"GOOD FRIEND INTERNATIONAL LIMITED
好友國際有限公司",2015-06-19,2018-08-03,"Private, ltd by shares"231,2253644,"Good Link Food Trading Limited
佳霖食品貿易有限公司",2015-06-19,2018-01-12,"Private, ltd by shares"232,2253298,"GOOD RISING DEVELOPMENT LIMITED (d2018-11-02)
俊升發展有限公司",2015-06-19,2018-11-02,"Private, ltd by shares"233,2253531,"GOOD TALENT CONSULTANTS LIMITED
卓廸顧問有限公司",2015-06-19,,"Private, ltd by shares"234,2253297,"Goodconn Industrial Co., Limited
美德工業股份有限公司",2015-06-19,2019-06-21,"Private, ltd by shares"235,2253346,"GOODS TRADE CO., LIMITED (THE)
國品貿易有限公司",2015-06-19,,"Private, ltd by shares"236,2253375,"Grand America (China) Co., Limited
豪美(中國)股份有限公司",2015-06-19,2017-12-29,"Private, ltd by shares"237,2253512,"GRAND EAGLE TRADING (HK) LIMITED",2015-06-19,2019-06-14,"Private, ltd by shares"238,2253325,"Grand Harvest Precision Mold (Hong Kong) Limited
鉅豐精密模具有限公司",2015-06-19,,"Private, ltd by shares"239,2253534,"GRAND MAX INTERNATIONAL INDUSTRIAL LIMITED
盛鵬國際實業有限公司",2015-06-19,2019-03-01,"Private, ltd by shares"240,2253152,"GRAND NAME CORPORATION LIMITED
博名有限公司",2015-06-19,,"Private, ltd by shares"241,2253174,"Grand Oriental Education Development Co., Limited
東川教育發展有限公司",2015-06-19,2019-12-13,"Private, ltd by shares"242,2253449,"Grand Pacific Property (Hong Kong) Limited
泛太地產(香港)有限公司",2015-06-19,,"Private, ltd by shares"243,2253623,"GRAND PROFIT INTERNATIONAL (HK) LIMITED
利偉國際(香港)有限公司",2015-06-19,2020-05-08,"Private, ltd by shares"244,2253548,"GRAND RISE (CHINA) LIMITED
廣昇(中國)有限公司",2015-06-19,,"Private, ltd by shares"245,2253184,"GRAND SET LIMITED
巨啟有限公司",2015-06-19,,"Private, ltd by shares"246,2252976,"GREAT FORTUNE INTERNATIONAL LIMITED (d2019-01-25)",2015-06-19,2019-01-25,"Private, ltd by shares"247,2253048,"GREAT HILL LIMITED (HK)
峰昇有限公司",2015-06-19,2019-03-29,"Private, ltd by shares"248,2253028,"GREAT VIRTUE TRADING DEVELOP LIMITED
峰德貿易拓展有限公司",2015-06-19,2019-03-29,"Private, ltd by shares"249,2253038,"GREATEST SKY INVESTMENT LIMITED
宏天投資有限公司",2015-06-19,,"Private, ltd by shares"250,2253253,"GROUP MILLION LIMITED (d2019-03-01)
佰聯有限公司",2015-06-19,2019-03-01,"Private, ltd by shares"251,2253263,"GROUP SHINE INTERNATIONAL LIMITED
耀滙國際有限公司",2015-06-19,,"Private, ltd by shares"252,2253247,"GROWTH PLUS ENTERPRISE LIMITED
金富企業有限公司",2015-06-19,2019-03-29,"Private, ltd by shares"253,2253110,"Growwings Company Limited",2015-06-19,2018-12-14,"Private, ltd by shares"254,2253401,"GUANGZHOU SHINCO LIGHTING CO., LIMITED
廣州新科電子科技有限公司",2015-06-19,,"Private, ltd by shares"255,2253205,"H&amp;S GLOBAL SOURCING LIMITED",2015-06-19,,"Private, ltd by shares"256,2253316,"H-Portal Company Limited",2015-06-19,,"Private, ltd by shares"257,2253642,"HAN GUO AI LIN LU HONGKONG AXIN HOLDINGS LIMITED
韓國艾琳露香港艾欣控股有限公司",2015-06-19,2019-03-29,"Private, ltd by shares"258,2253181,"Hang Chun Building Materials Engineering Limited
恒俊建材工程有限公司",2015-06-19,,"Private, ltd by shares"259,2252982,"HANLIN IMPORT &amp; EXPORT CO., LIMITED
瀚林進出口有限公司",2015-06-19,,"Private, ltd by shares"260,2253487,"HanSang Union (China) Limited
漢裳會中國有限公司",2015-06-19,,"Private, ltd by shares"261,2253360,"HANSON DA CO., LIMITED
恆信達有限公司",2015-06-19,2018-12-07,"Private, ltd by shares"262,2253357,"HAOLING TRADE CO., LIMITED
浩林貿易有限公司",2015-06-19,2019-03-29,"Private, ltd by shares"263,2253551,"HAPPY EXPRESS (CHINA) LIMITED
運來(中國)有限公司",2015-06-19,,"Private, ltd by shares"264,2252938,"Happy Metal Parts Limited",2015-06-19,,"Private, ltd by shares"265,2253553,"HARBOUR JOY HOLDINGS LIMITED
怡港集團有限公司",2015-06-19,,"Private, ltd by shares"266,2253621,"HARMONIC (HONG KONG) LIMITED",2015-06-19,,"Private, ltd by shares"267,2253328,"Harper Holding &amp; Finance Limited",2015-06-19,,"Private, ltd by shares"268,2253163,"HARVEST BRIGHT WORLDWIDE LIMITED
豐明環球有限公司",2015-06-19,2019-03-29,"Private, ltd by shares"269,2253203,"HDL PRECISION MACHINERY MANUFACTURING LIMITED
海德力精密機械製造有限公司",2015-06-19,2016-12-30,"Private, ltd by shares"270,2253306,"HENAN HC INSPECTION CO., LIMITED",2015-06-19,,"Private, ltd by shares"271,2253406,"Hense Prosperous International Limited
興越國際有限公司",2015-06-19,,"Private, ltd by shares"272,2252973,"HERUN WORLD (HK) DEVELOPMENT LIMITED
和潤沃德(香港)發展有限公司",2015-06-19,,"Private, ltd by shares"273,2253137,"HIGH GLORY CORPORATION LIMITED
君軒有限公司",2015-06-19,2020-10-16,"Private, ltd by shares"274,2253189,"HIGH GREAT CORPORATION LIMITED
軒偉有限公司",2015-06-19,2019-01-25,"Private, ltd by shares"275,2253199,"High Tech Equipment Industry (HK) Limited",2015-06-19,,"Private, ltd by shares"276,2252931,"HIGH YOUNG INTERNATIONAL CO., LIMITED
海洋國際股份有限公司",2015-06-19,2016-12-16,"Private, ltd by shares"277,2253442,"Hipstore Hong Kong Trading Limited
協多香港貿易有限公司",2015-06-19,,"Private, ltd by shares"278,2253088,"HK CHENMING INVESTMENT CO., LIMITED
香港宸銘投資有限公司",2015-06-19,,"Private, ltd by shares"279,2253336,"HK CHINA HEALTH THIN BODY ASSOCIATION LIMITED
香港中華健康瘦體協會有限公司",2015-06-19,2019-03-29,"Private, ltd by shares"280,2253362,"HK Chuangjia International Co., Limited
香港創佳國際股份有限公司",2015-06-19,2016-09-30,"Private, ltd by shares"281,2253108,"HK HAIRONG BABA ELECTRONICS LIMITED
香港海融巴巴電子有限公司",2015-06-19,2019-03-29,"Private, ltd by shares"282,2253358,"HK HANNUO COSMETIC INTERNATIONAL GROUP CO., LIMITED
香港漢諾化妝品國際集團有限公司",2015-06-19,2020-05-08,"Private, ltd by shares"283,2252994,"HK HONGWEI DRESS LIMITED
香港鴻偉服飾有限公司",2015-06-19,,"Private, ltd by shares"284,2253421,"HK JinkeMulti-Media Teaching Supplies Limited
香港金科多媒體教具有限公司",2015-06-19,2017-01-06,"Private, ltd by shares"285,2253430,"HK Microvision Technology Limited
香港邁科威視科技有限公司",2015-06-19,,"Private, ltd by shares"286,2253410,"HK OUXI INTERNATIONAL TRADE LIMITED
香港歐西國際貿易有限公司",2015-06-19,,"Private, ltd by shares"287,2253365,"HK QIAOZHI LAOYECHE (INTERNATIONAL) DRESS LIMITED
香港喬治老爺車(國際)服飾有限公司",2015-06-19,,"Private, ltd by shares"288,2253570,"HK RICHES INTERNATIONAL TRADE CO., LIMITED
香港睿姿國際貿易有限公司",2015-06-19,,"Private, ltd by shares"289,2252913,"HK STARS SHINING INT'L CULTURE MEDIA LIMITED
香港星光燦爛國際文化傳媒有限公司",2015-06-19,2019-03-29,"Private, ltd by shares"290,2253006,"HK UK OXFORD ARTWORK EVALUATION INSPECTION&amp;TESTING CENTER LIMITED
香港英國牛津藝術品評估檢測中心有限公司",2015-06-19,2019-03-01,"Private, ltd by shares"291,2253240,"HK WFFI INT'L INVESTMENT HOLDING GROUP CO., LIMITED
香港智融聯創國際投資控股集團有限公司",2015-06-19,,"Private, ltd by shares"292,2253083,"HK XUNHENG SHOES INDUSTRY LIMITED
香港迅恒鞋業有限公司",2015-06-19,,"Private, ltd by shares"293,2253052,"HK YIFAN COMPANY LIMITED
香港壹凡有限公司",2015-06-19,,"Private, ltd by shares"294,2253009,"HK YJ GROUP CO., LIMITED
香港頤家集團有限公司",2015-06-19,2019-03-29,"Private, ltd by shares"295,2253301,"HKH Holding Limited",2015-06-19,2019-03-01,"Private, ltd by shares"296,2253626,"HNCTech International Group (HongKong) Co., Limited
永程國際集團（香港）有限公司",2015-06-19,,"Private, ltd by shares"297,2253538,"HOLISTIC PHYSIOTHERAPY LIMITED",2015-06-19,,"Private, ltd by shares"298,2253094,"HOMEY INTERNATIONAL CO., LIMITED
浩邁國際有限公司",2015-06-19,,"Private, ltd by shares"299,2253339,"Hong Kong (International) Renew Time Health Management Consulting Group Co., Limited
香港(國際)瑞泰健康管理諮詢集團有限公司",2015-06-19,2019-03-29,"Private, ltd by shares"300,2253395,"Hong Kong Changhong International Auction Co., Limited
香港長虹國際拍賣有限公司",2015-06-19,2019-03-29,"Private, ltd by shares"301,2253363,"HONG KONG CHINA GOLDEN INVESTMENT LIMITED
香港中金投資有限公司",2015-06-19,,"Private, ltd by shares"302,2252899,"HONG KONG COUNTY SUCCESS INTERNATIONAL TRADING COMPANY LIMITED
香港郡成國際貿易有限公司",2015-06-19,,"Private, ltd by shares"303,2253573,"Hong Kong DeMing Joy Living Trading Limited
香港德銘樂居貿易有限公司",2015-06-19,,"Private, ltd by shares"304,2253451,"HONG KONG DONGBOGUAN TRADE LIMITED
香港東博冠貿易有限公司",2015-06-19,,"Private, ltd by shares"305,2253641,"HONG KONG FORWARD INDUSTRY CO., LIMITED
香港福旺德實業有限公司",2015-06-19,2019-03-29,"Private, ltd by shares"306,2253409,"HONG KONG HELIAN TECHNOLOGY DEVELOPMENT CO., LIMITED
香港合連技術發展有限公司",2015-06-19,,"Private, ltd by shares"307,2253436,"HONG KONG HENGZHENG INTERNATIONAL TRADE LIMITED
香港恒正國際貿易有限公司",2015-06-19,,"Private, ltd by shares"308,2253172,"Hong Kong Huan Yu Electronics Co., Limited
香港環宇電子貿易有限公司",2015-06-19,,"Private, ltd by shares"309,2252948,"Hong Kong ICYINN Information &amp; Technology Limited",2015-06-19,,"Private, ltd by shares"310,2253015,"HONG KONG J&amp;L INDUSTRY CO., LIMITED
香港峻嶺實業有限公司",2015-06-19,,"Private, ltd by shares"311,2253444,"HONG KONG JINSITAI TRADE LIMITED
香港金思泰貿易有限公司",2015-06-19,2020-05-08,"Private, ltd by shares"312,2253392,"HONG KONG LIAN TAI SHENG TRADE CO., LIMITED
香港聯泰升貿易有限公司",2015-06-19,2019-03-29,"Private, ltd by shares"313,2253073,"HONG KONG RUISHENG DEVELOPMENT LIMITED
香港瑞盛發展有限公司",2015-06-19,,"Private, ltd by shares"314,2253501,"HONG KONG SKY BILLION HOLDING TRADING LIMITED
香港天億控股貿易有限公司",2015-06-19,2019-03-29,"Private, ltd by shares"315,2253618,"Hong Kong Tianxiang International Limited
香港天翔國際有限公司",2015-06-19,2020-07-24,"Private, ltd by shares"316,2253107,"Hong Kong Wanhui Industry Trade Co., Limited
香港萬輝實業貿易有限公司",2015-06-19,,"Private, ltd by shares"317,2253330,"HONG KONG WEN SHANG INSURANCE AGENCY LIMITED
香港文尚保險代理有限公司",2015-06-19,2020-01-10,"Private, ltd by shares"318,2253355,"Hong Kong Xenon Energy Electric Co., Limited
香港氙能電氣有限公司",2015-06-19,2019-03-29,"Private, ltd by shares"319,2253540,"Hong Kong Xin Ya Limited
香港信亞股份有限公司",2015-06-19,2019-03-01,"Private, ltd by shares"320,2252958,"Hong Kong Xinyumei Building Materials Technology Co., Limited
香港馨譽美(建材)科技有限公司",2015-06-19,2019-03-29,"Private, ltd by shares"321,2252986,"HONG KONG XISHENG DEVELOPMENT LIMITED
香港禧盛發展有限公司",2015-06-19,,"Private, ltd by shares"322,2253441,"Hong Kong YoPo Health Co., Limited
香港優普康有限公司",2015-06-19,,"Private, ltd by shares"323,2252943,"HONG KONG YUAN MAU MACHINERY TRADE CO., LIMITED
香港元茂機械設備貿易有限公司",2015-06-19,2020-04-09,"Private, ltd by shares"324,2253003,"HONG KONG ZESHENG DEVELOPMENT LIMITED
香港澤盛發展有限公司",2015-06-19,,"Private, ltd by shares"325,2253314,"Hong Kong Zhongnan Sunshine Technology Limited
香港中南陽光科技有限公司",2015-06-19,2018-12-07,"Private, ltd by shares"326,2253407,"HONG TONG IMPORT &amp; EXPORT CO., LIMITED
鴻通進出口有限公司",2015-06-19,,"Private, ltd by shares"327,2253016,"Hongfeng (HongKong) Skill Co., Limited
宏豐(香港)技術有限公司",2015-06-19,2020-05-08,"Private, ltd by shares"328,2253373,"HONGKONG ABESTSHOW INTERNATIONAL LIMITED
香港愛百秀國際有限公司",2015-06-19,2020-07-03,"Private, ltd by shares"329,2253405,"HONGKONG ARCHERYESKY OUTDOOR SUPPLIES CO., LIMITED
香港問箭戶外用品有限公司",2015-06-19,2019-03-01,"Private, ltd by shares"330,2253066,"HONGKONG BO PIN CANG GROUP CO., LIMITED
香港泊品倉集團有限公司",2015-06-19,2017-12-15,"Private, ltd by shares"331,2253366,"HONGKONG BRILLIENTCY INT'L EDUCATION GROUP INVESTMENT CO., LIMITED
香港貝瑞林國際教育集團投資有限公司",2015-06-19,2017-09-29,"Private, ltd by shares"332,2253514,"HONGKONG CARSKY AUTO PARTS CO., LIMITED
香港車時代汽車配件有限公司",2015-06-19,2016-11-25,"Private, ltd by shares"333,2253370,"HONGKONG CHEUNGHING TECHNOLOGY CO., LIMITED
香港長興科技有限公司",2015-06-19,2020-04-03,"Private, ltd by shares"334,2252920,"HONGKONG CLOUD RIVER DECORATION DESIGN LIMITED
香港雲禾裝飾設計有限公司",2015-06-19,2019-03-29,"Private, ltd by shares"335,2253652,"Hongkong Deyuantang Food Co., Limited
香港德元堂食品有限公司",2015-06-19,,"Private, ltd by shares"336,2253429,"HONGKONG DONGSHEN HOLDING CO., LIMITED
香港東燊控股有限公司",2015-06-19,,"Private, ltd by shares"337,2253650,"HongKong Dream Fashion Designs Co., Limited
香港夢時尚設計有限公司",2015-06-19,2020-05-08,"Private, ltd by shares"338,2253129,"HongKong Dreamtown Architecture Design And Consultant Co., Limited
香港中棠建築設計顧問有限公司",2015-06-19,2020-04-09,"Private, ltd by shares"339,2252923,"HongKong Elite Personal Care Products Co., Limited
香港艾利特日用品有限公司",2015-06-19,2019-03-29,"Private, ltd by shares"340,2253294,"Hongkong Enkang International Holdings Group Limited
香港恩康美國際控股集團有限公司",2015-06-19,2018-08-10,"Private, ltd by shares"341,2253302,"HONGKONG FENG MO INDUSTRIAL CO., LIMITED
香港鋒摹實業有限公司",2015-06-19,,"Private, ltd by shares"342,2253464,"HONGKONG GUANGXINYUAN TRADING LIMITED
香港廣欣源貿易有限公司",2015-06-19,2019-03-29,"Private, ltd by shares"343,2253264,"HONGKONG HENGSHENGYI TRADE CO., LIMITED
香港恆盛易貿易有限公司",2015-06-19,2020-04-24,"Private, ltd by shares"344,2253475,"HONGKONG HUAXINCHUANGDA INTERNATIONAL INVESTMENT MANAGEMENT LIMITED
香港華信創達國際投資管理有限公司",2015-06-19,,"Private, ltd by shares"345,2253305,"HONGKONG PET PLUS INTERNATIONAL TRADING CO., LIMITED
香港寵佳國際商貿有限公司",2015-06-19,,"Private, ltd by shares"346,2253288,"HONGKONG PHOENIX LIVE LIMITED
香港鳳凰棲旅遊管理有限公司",2015-06-19,2017-09-22,"Private, ltd by shares"347,2253248,"HONGKONG QIANZIHONG CLOTHING LIMITED
香港千姿宏服裝有限公司",2015-06-19,2018-06-15,"Private, ltd by shares"348,2253010,"HongKong QingPeng Industrial Co., Limited
香港慶鵬實業有限公司",2015-06-19,,"Private, ltd by shares"349,2253368,"HONGKONG RONGYI INTERNATIONAL GROUP CO., LIMITED
香港榕藝國際集團有限公司",2015-06-19,2019-03-29,"Private, ltd by shares"350,2252946,"HONGKONG SHEUNGYU CO., LIMITED
香港熵域有限公司",2015-06-19,,"Private, ltd by shares"351,2253290,"Hongkong Sunshine Fashion Shoes Co., Limited
香港陽光時尚鞋業有限公司",2015-06-19,,"Private, ltd by shares"352,2253039,"HONGKONG WANLONG INTERNATIONAL (GROUP) CO., LIMITED
香港萬隆國際（集團）有限公司",2015-06-19,,"Private, ltd by shares"353,2252966,"HONGKONG WEIDI GROUP HOLDING LIMITED
香港味帝集團股份有限公司",2015-06-19,,"Private, ltd by shares"354,2253076,"HONGKONG XIANGYUNSHUN LIMITED
香港祥運順物流有限公司",2015-06-19,,"Private, ltd by shares"355,2253353,"Hongkong Yerou Personal Nursing Cosmetics Limited
香港葉柔個人護理化妝品有限公司",2015-06-19,,"Private, ltd by shares"356,2252961,"HONGKONG YICHENG TREEGOO TECHNOLOGY LIMITED",2015-06-19,2018-08-31,"Private, ltd by shares"357,2253555,"HUGE BENEFIT HOLDINGS LIMITED
利鵬集團有限公司",2015-06-19,2017-11-24,"Private, ltd by shares"358,2253075,"HUI NGAI LAN CONSTRUCTION ENGINEERING LIMITED
匯毅枏建築工程有限公司",2015-06-19,,"Private, ltd by shares"359,2253371,"HYPER LEADING CO., LIMITED
香港恒領有限公司",2015-06-19,2019-03-29,"Private, ltd by shares"360,2253284,"ICRIS:2253284 (no English name)
世界拜克拉愛好者協會有限公司",2015-06-19,2019-04-04,"Private, ltd by shares"361,2253276,"Ifirst Powder Metallurgy Co., Limited
盈鋒粉末有限公司",2015-06-19,,"Private, ltd by shares"362,2253525,"IIAM Limited",2015-06-19,2019-03-01,"Private, ltd by shares"363,2253012,"IMPACT Food Systems Asia Limited",2015-06-19,,"Private, ltd by shares"364,2253018,"IN TREASURE ISLAND FASHION CO., LIMITED
金銀島服飾有限公司",2015-06-19,2019-03-29,"Private, ltd by shares"365,2252908,"INTELLIGENCE TRADING LIMITED (HK)
慧之寶貿易有限公司",2015-06-19,2017-10-13,"Private, ltd by shares"366,2253466,"INTERNATIONAL ENTREPRENEURSHIP SOCIETY LIMITED
國際創業學會有限公司",2015-06-19,2018-02-09,"Private, ltd by shares"367,2253105,"International Gaia (HK) Investment Management Limited
國際素緣(香港)投資管理有限公司",2015-06-19,2018-05-25,"Private, ltd by shares"368,2253202,"INTERNATIONAL STEEL STRUCTURE R&amp;D GROUP CO., LIMITED
國際鋼結構硏發集團有限公司",2015-06-19,,"Private, ltd by shares"369,2253617,"Interweave Holdings Limited",2015-06-19,,"Private, ltd by shares"370,2252912,"ITALY ELEGANT EARL INTERNATIONAL CLOTHING CO., LIMITED
意大利貴人伯爵國際服飾有限公司",2015-06-19,2019-03-29,"Private, ltd by shares"371,2252974,"JACKY ASSET MANAGEMENT LIMITED
翊翀資產管理有限公司",2015-06-19,,"Private, ltd by shares"372,2253474,"JACOB COMPANY HK LIMITED",2015-06-19,,"Private, ltd by shares"373,2253144,"JADE PROSPER LIMITED
翠盛有限公司",2015-06-19,,"Private, ltd by shares"374,2253140,"JD Concepts Limited",2015-06-19,2019-03-29,"Private, ltd by shares"375,2253331,"JINMIANZI INT'L BIOLOGY SCIENCE AND TECHNOLOGY LIMITED
金面子國際生物科技有限公司",2015-06-19,2018-10-05,"Private, ltd by shares"376,2252921,"JINTAI HARDWARE GROUP LIMITED
金泰五金集團有限公司",2015-06-19,2019-03-29,"Private, ltd by shares"377,2253111,"JITS TECHNOLOGY CO., LIMITED
杰思科技股份有限公司",2015-06-19,,"Private, ltd by shares"378,2252916,"JK Anti-Ageing Skincare Limited
儀婷抗衰老護膚品有限公司",2015-06-19,,"Private, ltd by shares"379,2253473,"JM Weshop (HK) Limited",2015-06-19,,"Private, ltd by shares"380,2253528,"Jokula Limited (HK)",2015-06-19,,"Private, ltd by shares"381,2253558,"JOY BILLION INTERNATIONAL INVESTMENT LIMITED
喜億國際投資有限公司",2015-06-19,,"Private, ltd by shares"382,2253562,"JOYNICE INTERNATIONAL TRADING LIMITED
怡益國際貿易有限公司",2015-06-19,2018-12-07,"Private, ltd by shares"383,2253568,"JOYWAY EXPRESS INTERNATIONAL LIMITED
怡晉國際有限公司",2015-06-19,,"Private, ltd by shares"384,2253569,"JOYWAY INTERNATIONAL (HK) LIMITED
達悅國際(香港)有限公司",2015-06-19,,"Private, ltd by shares"385,2253364,"JPGC Hospitality Group Limited",2015-06-19,,"Private, ltd by shares"386,2252998,"JUMBO SCM LIMITED
重磅供應鏈管理有限公司",2015-06-19,2016-10-14,"Private, ltd by shares"387,2252907,"K2 BN Partners Limited",2015-06-19,,"Private, ltd by shares"388,2252906,"K2 Z Partners Limited",2015-06-19,,"Private, ltd by shares"389,2253311,"KACHON HOLDING LIMITED
嘉創控股有限公司",2015-06-19,,"Private, ltd by shares"390,2252937,"KAISER (CHINA) SHIPPING CO., LIMITED
凱澤(中國)航運有限公司",2015-06-19,,"Private, ltd by shares"391,2253377,"KAPOOR CO., LIMITED
卡普爾有限公司",2015-06-19,,"Private, ltd by shares"392,2253151,"KARSEN (HONG KONG) LIMITED
嘉信(香港)有限公司",2015-06-19,,"Private, ltd by shares"393,2253031,"KEEN MARVELOUS LIMITED
兆丰有限公司",2015-06-19,,"Private, ltd by shares"394,2253572,"KEEN MAX TECHNOLOGY DEVELOPMENT LIMITED
盛銳科技發展有限公司",2015-06-19,2018-01-05,"Private, ltd by shares"395,2253578,"KEYMAX (HK) TRADING LIMITED
建盛(香港)貿易有限公司",2015-06-19,2019-03-29,"Private, ltd by shares"396,2253484,"KIM SIK JEWELLERY COMPANY LIMITED",2015-06-19,,"Private, ltd by shares"397,2253097,"KIND JOY CORPORATION LIMITED
高恩有限公司",2015-06-19,,"Private, ltd by shares"398,2253584,"KIND TREND INTERNATIONAL LIMITED
良達國際有限公司",2015-06-19,,"Private, ltd by shares"399,2253072,"KINRIC PAPER (HONG KONG) LIMITED
建和紙業(香港)有限公司",2015-06-19,2020-05-08,"Private, ltd by shares"400,2252950,"Klyk Group Limited",2015-06-19,,"Private, ltd by shares"401,2252959,"KM INTERIOR DESIGN &amp; ENGINEERING COMPANY LIMITED
健明室內設計工程有限公司",2015-06-19,,"Private, ltd by shares"402,2253332,"KNOW YUN TRADE (HK) CO., LIMITED
知昀貿易香港有限公司",2015-06-19,2019-03-29,"Private, ltd by shares"403,2253379,"KWOK WAI ELECTRONIC LIMITED
國偉電子有限公司",2015-06-19,2018-06-22,"Private, ltd by shares"404,2253414,"L.S. Touch Technologies Limited
凌尚觸控技術有限公司",2015-06-19,2020-03-27,"Private, ltd by shares"405,2253350,"La Thea Limited",2015-06-19,,"Private, ltd by shares"406,2253432,"LAND SIGN TRADING DEVELOP LIMITED
置紅貿易拓展有限公司",2015-06-19,,"Private, ltd by shares"407,2253068,"Laniford Holdings Limited",2015-06-19,,"Private, ltd by shares"408,2253121,"LANNISTER HONGKONG INTERNATIONAL CO., LIMITED
藍妮斯特香港國際貿易有限公司",2015-06-19,,"Private, ltd by shares"409,2253127,"Lantern International (HongKong) Co., Limited
量日國際(香港)有限公司",2015-06-19,2017-12-22,"Private, ltd by shares"410,2253635,"Latin America Custpm Clearace Limited
阿根廷新亞清關有限公司",2015-06-19,,"Private, ltd by shares"411,2253515,"LBG ENTERPRISES LIMITED",2015-06-19,,"Private, ltd by shares"412,2252983,"Le Parkson International Limited
樂百盛國際有限公司",2015-06-19,,"Private, ltd by shares"413,2253398,"Le Po Wine International Company Limited
利寶酒業國際有限公司",2015-06-19,,"Private, ltd by shares"414,2253032,"LEADERFULL DEVELOPMENT INTERNATIONAL LIMITED
萬豐發展國際有限公司",2015-06-19,2019-03-29,"Private, ltd by shares"415,2253488,"Leef Direct Limited",2015-06-19,2018-02-09,"Private, ltd by shares"416,2253486,"Leef Limited (HK)",2015-06-19,2017-09-29,"Private, ltd by shares"417,2253489,"LEEPO INTERNATIONAL GROUP LIMITED
利保國際集團有限公司",2015-06-19,,"Private, ltd by shares"418,2253114,"LEGEND FAMOUS LIMITED
灝佳有限公司",2015-06-19,2018-03-23,"Private, ltd by shares"419,2253583,"LILLA ACCESSORIES CO., LIMITED
利拉配飾有限公司",2015-06-19,,"Private, ltd by shares"420,2253627,"Linatex Wear Resistant Technology Development (HongKong) Company Limited
耐納特耐磨技術開發(香港)有限公司",2015-06-19,2020-05-08,"Private, ltd by shares"421,2253462,"LINDA IMPORT AND EXPORT CO., LIMITED
淩特電子有限公司",2015-06-19,,"Private, ltd by shares"422,2253285,"Link Design Group Limited",2015-06-19,,"Private, ltd by shares"423,2253347,"LINKUP STORE EQUIPMENT CO., LIMITED
領拓商業設施有限公司",2015-06-19,,"Private, ltd by shares"424,2252901,"Lion Rock Brewery Limited
獅子山啤有限公司",2015-06-19,,"Private, ltd by shares"425,2253481,"LITON SEA DEVELOPMENT LIMITED
利通海拓展有限公司",2015-06-19,2019-03-29,"Private, ltd by shares"426,2253026,"LIV MARKETING &amp; TRADING CO., LIMITED
麗芙市場推廣有限公司",2015-06-19,,"Private, ltd by shares"427,2253390,"Live-Right Limited
利韋萊特有限公司",2015-06-19,,"Private, ltd by shares"428,2253033,"LIVETECH DEVELOPMENT LIMITED
萬達發展有限公司",2015-06-19,2017-01-06,"Private, ltd by shares"429,2252903,"LM Partners Limited",2015-06-19,,"Private, ltd by shares"430,2253639,"Lock &amp; Key Technology Limited
諾安達科技有限公司",2015-06-19,2019-03-29,"Private, ltd by shares"431,2253196,"Logrus IT Limited",2015-06-19,,"Private, ltd by shares"432,2253587,"LONG GREAT SHIPPING LIMITED
遠達船務有限公司",2015-06-19,2018-11-16,"Private, ltd by shares"433,2253201,"LONGFAITH (HK) INTERNATIONAL LIMITED
達富(香港)國際有限公司",2015-06-19,,"Private, ltd by shares"434,2253589,"LOYAL SUCCESS INTERNATIONAL LIMITED
眾旺國際有限公司",2015-06-19,2019-01-04,"Private, ltd by shares"435,2253603,"LTG Solution Limited",2015-06-19,,"Private, ltd by shares"436,2253258,"LUCK LEADER LIMITED
祥領有限公司",2015-06-19,,"Private, ltd by shares"437,2253592,"LUCKY (HK) TRADING LIMITED
祥佳(香港)貿易有限公司",2015-06-19,,"Private, ltd by shares"438,2253022,"LUCKY BLOOM TRADING LIMITED
駿昇貿易有限公司",2015-06-19,,"Private, ltd by shares"439,2253209,"LUCKY FULL ENTERPRISES LIMITED
豐運企業有限公司",2015-06-19,,"Private, ltd by shares"440,2253596,"LUCKY GROUP INTERNATIONAL INVESTMENT LIMITED
福盟國際投資有限公司",2015-06-19,2017-12-01,"Private, ltd by shares"441,2253598,"LUCKY TEAM INTERNATIONAL INDUSTRIAL LIMITED
福盟國際實業有限公司",2015-06-19,,"Private, ltd by shares"442,2253452,"Luision culture development Limited
鎏雲軒文化發展有限公司",2015-06-19,,"Private, ltd by shares"443,2253001,"LUXURIANT AWARD LIMITED",2015-06-19,,"Private, ltd by shares"444,2253159,"MAIN DYNASTY (ASIA) LIMITED
萬福(亞洲)有限公司",2015-06-19,,"Private, ltd by shares"445,2253600,"MAKE WEALTH HOLDINGS LIMITED
可富集團有限公司",2015-06-19,2016-12-02,"Private, ltd by shares"