,Reg no.,Name,Incorp-orated,Dissolved,Type677,2253293,"UNION ONE LOGISTICS LIMITED
統一物流有限公司",2015-06-19,,"Private, ltd by shares"678,2253034,"UNIQUE WELL CORPORATION LIMITED (d2018-05-04)
唯潤有限公司",2015-06-19,2018-05-04,"Private, ltd by shares"679,2252992,"United Biotech Development Company Limited",2015-06-19,,"Private, ltd by shares"680,2253229,"UNITED BRIGHT DEVELOP LIMITED
聯輝拓展有限公司",2015-06-19,,"Private, ltd by shares"681,2253193,"UNITED ELECTRONIC WELDING FACTORY LIMITED
聯合風電釬廠有限公司",2015-06-19,,"Private, ltd by shares"682,2253176,"UNIVERSAL TECH GROUP LIMITED
環球科技集團有限公司",2015-06-19,,"Private, ltd by shares"683,2253087,"UPCHAIN LIMITED
昇進有限公司",2015-06-19,2020-05-08,"Private, ltd by shares"684,2253268,"UPPER LUCK DEVELOPMENT LIMITED
尚福發展有限公司",2015-06-19,,"Private, ltd by shares"685,2253091,"Upstream Application Limited
逆流應用程式有限公司",2015-06-19,2018-11-16,"Private, ltd by shares"686,2253249,"Valentino Dress (China) Limited
華倫天奴服飾(中國)有限公司",2015-06-19,,"Private, ltd by shares"687,2253092,"VAST DESIROUS LIMITED
美創有限公司",2015-06-19,,"Private, ltd by shares"688,2253492,"Vast Fortune Capital Investment Co. Limited
瑞宏創富投資有限公司",2015-06-19,,"Private, ltd by shares"689,2253524,"VAST HUGE INTERNATIONAL LIMITED
泰軒國際有限公司",2015-06-19,,"Private, ltd by shares"690,2253029,"VERSE COMFORT LIMITED
華協有限公司",2015-06-19,,"Private, ltd by shares"691,2252962,"VICTOR PACKAGING CO., LIMITED
維克多包裝有限公司",2015-06-19,,"Private, ltd by shares"692,2253104,"WA LUNG TRADING COMPANY LIMITED
樺瓏貿易有限公司",2015-06-19,,"Private, ltd by shares"693,2253082,"WAKING DEVELOPMENT LIMITED
力景發展有限公司",2015-06-19,2018-11-30,"Private, ltd by shares"694,2253396,"Wan Chen Technology Co., Limited
萬臣科技有限公司",2015-06-19,,"Private, ltd by shares"695,2253472,"WAN LI INTERNATIONAL GLOBAL TRADING LIMITED
萬利國際環球貿易有限公司",2015-06-19,2018-06-22,"Private, ltd by shares"696,2253118,"WAYBEST INVESTMENT LIMITED
威成投資有限公司",2015-06-19,2016-06-30,"Private, ltd by shares"697,2253520,"WEALTH EXPRESS (HK) TRADING LIMITED
景通(香港)貿易有限公司",2015-06-19,,"Private, ltd by shares"698,2253518,"WEALTH TREND HOLDINGS LIMITED
進康集團有限公司",2015-06-19,2019-05-31,"Private, ltd by shares"699,2253318,"WEALTHY BASE LIMITED (d2018-12-14)
錦基有限公司",2015-06-19,2018-12-14,"Private, ltd by shares"700,2253499,"WeCover Stretch Tents and Canopies Company Limited",2015-06-19,2017-12-01,"Private, ltd by shares"701,2253453,"WEDA TRADING CO., LIMITED
威達商貿有限公司",2015-06-19,2019-03-29,"Private, ltd by shares"702,2253079,"WEI XI INDUSTRIAL CO., LIMITED
維熙實業有限公司",2015-06-19,,"Private, ltd by shares"703,2253313,"Weihai Wan Wei Co., Limited",2015-06-19,2017-10-27,"Private, ltd by shares"704,2253024,"WEILING INVESTMENT LIMITED
維靈投資有限公司",2015-06-19,,"Private, ltd by shares"705,2253513,"WELL BLOOM (HK) TRADING LIMITED
興卓(香港)貿易有限公司",2015-06-19,,"Private, ltd by shares"706,2253321,"WELL CHEER LIMITED (b2015-06-19)
威怡有限公司",2015-06-19,,"Private, ltd by shares"707,2253506,"WELL FAITH (HK) TRADING LIMITED
啓信(香港)貿易有限公司",2015-06-19,2020-05-08,"Private, ltd by shares"708,2253502,"WELL HONEST INTERNATIONAL TRADING LIMITED
誠佳國際貿易有限公司",2015-06-19,,"Private, ltd by shares"709,2253295,"WELL STEP TRADING LIMITED
威陞貿易有限公司",2015-06-19,,"Private, ltd by shares"710,2252909,"Well Worths Company Limited
來富德有限公司",2015-06-19,,"Private, ltd by shares"711,2253496,"WELLY SUCCESS (CHINA) LIMITED
佳隆(中國)有限公司",2015-06-19,2019-03-29,"Private, ltd by shares"712,2252960,"WEST FINANCE GROUP HOLDINGS LIMITED
西政投資集團有限公司",2015-06-19,,"Private, ltd by shares"713,2253479,"WESTAR GLOBAL LIMITED
三眾有限公司",2015-06-19,,"Private, ltd by shares"714,2253322,"WIN REGION HOLDINGS LIMITED
榮俊集團有限公司",2015-06-19,,"Private, ltd by shares"715,2252954,"WING TAKE INTERNATIONAL INDUSTRIAL COMPANY LIMITED
耀希國際實業有限公司",2015-06-19,,"Private, ltd by shares"716,2252915,"WING WAH HONG LIMITED
榮華行有限公司",2015-06-19,,"Private, ltd by shares"717,2253061,"WISDOM LEARNING EDUCATIONAL CENTER LIMITED
薈頌教育中心有限公司",2015-06-19,,"Private, ltd by shares"718,2253191,"WISDOM STATE DEVELOPMENT LIMITED
智邦發展有限公司",2015-06-19,2018-11-16,"Private, ltd by shares"719,2253424,"Wishful Bright Enterprise Consultancy Limited
希晴業務顧問有限公司",2015-06-19,2019-03-29,"Private, ltd by shares"720,2253245,"Wong's Hua Wei Limited
王氏華維有限公司",2015-06-19,,"Private, ltd by shares"721,2253198,"WOO HOLDINGS LIMITED (d2016-12-02)
琥股份有限公司",2015-06-19,2016-12-02,"Private, ltd by shares"722,2252898,"Woody Star Industry Limited
伽豐實業有限公司",2015-06-19,,"Private, ltd by shares"723,2253541,"World Chinese I-Ching Federation Limited
世界華人易經總會有限公司",2015-06-19,,"Private, ltd by shares"724,2253161,"WORLD FORUM OF EDUCATION COOPERATION LIMITED
世界教育合作論壇有限公司",2015-06-19,,"Private, ltd by shares"725,2252905,"WWYG Partners Limited",2015-06-19,,"Private, ltd by shares"726,2253275,"XIN TONG LOGISTIC SERVICE CO., LIMITED
信通物流服務有限公司",2015-06-19,2017-08-11,"Private, ltd by shares"727,2253482,"XIN YUAN KNITTING CLOTH COMPANY LIMITED
鑫源針織布料有限公司",2015-06-19,2018-02-09,"Private, ltd by shares"728,2253412,"XINDEYOU LIMITED
信德優有限公司",2015-06-19,2018-11-30,"Private, ltd by shares"729,2253416,"XINGNENGDA AUTOMATION TECHNOLOGY (HK) CO., LIMITED
心能達自動化科技(香港)有限公司",2015-06-19,2020-01-24,"Private, ltd by shares"730,2252996,"XINQIHUA INTERNATIONAL TRADING LIMITED
新琪華國際貿易有限公司",2015-06-19,,"Private, ltd by shares"731,2252932,"Xinshougang Investment Group Limited
新首鋼投資集團有限公司",2015-06-19,2020-09-18,"Private, ltd by shares"732,2253103,"Xping Investment (HK) Limited",2015-06-19,2020-05-08,"Private, ltd by shares"733,2253180,"Y &amp; T SUPPLIES LIMITED",2015-06-19,,"Private, ltd by shares"734,2252993,"Y's Impact Trading Limited",2015-06-19,2018-01-26,"Private, ltd by shares"735,2253380,"Yangjiang Qianpin Hardware Products Co., Limited
陽江千品五金製品有限公司",2015-06-19,,"Private, ltd by shares"736,2252945,"YDD Company Limited
壹點點有限公司",2015-06-19,2016-12-16,"Private, ltd by shares"737,2253408,"YIBU TRADING CO., LIMITED
一步商貿有限公司",2015-06-19,,"Private, ltd by shares"738,2253145,"YIELD KEEN INTERNATIONAL LIMITED
盈旺國際有限公司",2015-06-19,,"Private, ltd by shares"739,2253323,"YIHUI SHIPPING HONGKONG CO., LIMITED
億輝海運香港有限公司",2015-06-19,,"Private, ltd by shares"740,2253157,"YIMART Limited
藝馬有限公司",2015-06-19,2017-02-10,"Private, ltd by shares"741,2252930,"YIU HO ENVIRONMENTAL PROTECTION COMPANY LIMITED
耀皓環保貿易有限公司",2015-06-19,,"Private, ltd by shares"742,2252904,"YJX Partners Limited",2015-06-19,,"Private, ltd by shares"743,2252926,"YK BRIDGE CAPITAL LIMITED",2015-06-19,,"Private, ltd by shares"744,2253168,"YM STUDIO LIMITED",2015-06-19,,"Private, ltd by shares"745,2253539,"Yong Xin Electronic Technology Co., Limited
勇鑫電子科技有限公司",2015-06-19,,"Private, ltd by shares"746,2252929,"YONGKANG EASY&amp;JOY CO., LIMITED
永康易捷有限公司",2015-06-19,,"Private, ltd by shares"747,2253422,"YONGQIAN HOLDING CO., LIMITED
永乾控股有限公司",2015-06-19,,"Private, ltd by shares"748,2253437,"Yu Shang Creative Technology Co., Limited
禺尚創意科技有限公司",2015-06-19,2016-09-23,"Private, ltd by shares"749,2253106,"Yuku Holdings (Hong Kong) Limited
魚酷控股(香港)有限公司",2015-06-19,,"Private, ltd by shares"750,2253035,"YUNNAN JING HUI HYDROELECTRIC DEVELOPMENT CO., LIMITED
雲南晶輝水電開發有限公司",2015-06-19,2017-05-19,"Private, ltd by shares"751,2253334,"ZaiHaiWai Information Technology co., Limited
在海外資訊科技有限公司",2015-06-19,2019-05-17,"Private, ltd by shares"752,2253208,"Zhejiang Chun-An Foreign Trade Co., Limited
浙江淳安對外貿易(香港)有限公司",2015-06-19,2020-05-22,"Private, ltd by shares"753,2253400,"ZHONGCHUANG UNITED INVESTMENT HOLDING CO., LIMITED
中創聯合投資控股有限公司",2015-06-19,2018-12-21,"Private, ltd by shares"754,2252980,"ZHONGHUA HEALTH ASSOCIATION CO., LIMITED
中華健康協會有限公司",2015-06-19,2018-07-27,"Private, ltd by shares"755,2253000,"ZHONGJIHENGZHAO (HK) GROUP LIMITED
中基恒兆(香港)集團有限公司",2015-06-19,,"Private, ltd by shares"756,2253352,"ZHONGKUACU INTERNATIONAL INVESTMENT LIMITED
香港中跨促國際投資有限公司",2015-06-19,2020-01-10,"Private, ltd by shares"757,2252972,"Zhongren Precision Hong Kong Co., Limited
中任精密香港有限公司",2015-06-19,,"Private, ltd by shares"758,2253455,"ZOHAR TECHNOLOGIES COMPANY LIMITED
眾合智造技術有限公司",2015-06-19,,"Private, ltd by shares"759,2252927,"Zurco Limited",2015-06-19,2019-03-29,"Private, ltd by shares"