,Reg no.,Name,Incorp-orated,Dissolved,Type1,2253438,"ABLE CASTLE INTERNATIONAL INVESTMENT LIMITED
福堡國際投資有限公司",2015-06-19,2019-03-29,"Private, ltd by shares"2,2253243,"Access Advance Limited",2015-06-19,2016-10-14,"Private, ltd by shares"3,2253069,"ACME CLUB (HK) COMPANY LIMITED
沅睿精密材料(香港)有限公司",2015-06-19,2020-05-08,"Private, ltd by shares"4,2253292,"AcTek Corporation Limited",2015-06-19,,"Private, ltd by shares"5,2253096,"ACTIVE IDEAL LIMITED (d2018-10-19)
永澳有限公司",2015-06-19,2018-10-19,"Private, ltd by shares"6,2253116,"ACTIVE LEADER LIMITED
華達有限公司",2015-06-19,,"Private, ltd by shares"7,2253252,"Adams Business (Hongkong) Co., Limited",2015-06-19,2017-12-15,"Private, ltd by shares"8,2253119,"ADVANCE ASIA INTERNATIONAL LIMITED
寰亞國際有限公司",2015-06-19,2020-09-04,"Private, ltd by shares"9,2253307,"AILEMEI TRADING LIMITED
愛樂美有限公司",2015-06-19,,"Private, ltd by shares"10,2253340,"AISAI CHEMICAL FIBER LIMITED",2015-06-19,2019-03-29,"Private, ltd by shares"11,2253549,"Alex Connector Company Limited",2015-06-19,,"Private, ltd by shares"12,2253230,"ALIBABA GROUP (CHINA) Co., Limited
阿里巴巴集團(中國)有限公司",2015-06-19,2019-04-04,"Private, ltd by shares"13,2253447,"ALLIED BLOOM (CHINA) LIMITED
滙興(中國)有限公司",2015-06-19,,"Private, ltd by shares"14,2253100,"ALLIED EAST DEVELOPMENT LIMITED
滙東發展有限公司",2015-06-19,,"Private, ltd by shares"15,2252997,"AMERZEN INTERNATIONAL TRADING LIMITED
美升國際貿易有限公司",2015-06-19,,"Private, ltd by shares"16,2253533,"Amphion International Limited",2015-06-19,,"Private, ltd by shares"17,2252902,"ANAN ASSETS MANAGEMENT &amp; EQUITY INVESTMENT (HONG KONG) CO., LIMITED
安安資產股權投資(香港)有限公司",2015-06-19,,"Private, ltd by shares"18,2253372,"ANDAMAN ADVENTURER LIMITED",2015-06-19,,"Private, ltd by shares"19,2253634,"AO YUAN ELECTRONICS TECHNOLOGY (HONG KONG) LIMITED
奧源電子科技(香港)有限公司",2015-06-19,,"Private, ltd by shares"20,2253173,"Appware Technologies Limited",2015-06-19,2018-04-20,"Private, ltd by shares"21,2253465,"Aquaways Sanitary Co., Limited",2015-06-19,,"Private, ltd by shares"22,2252991,"ARIZO INTERNATIONAL LIMITED
艾瑞國際有限公司",2015-06-19,,"Private, ltd by shares"23,2253128,"Arts King International Limited
藝皇國際有限公司",2015-06-19,2019-03-29,"Private, ltd by shares"24,2253629,"ASIA AXA METAL LIMITED",2015-06-19,2019-03-01,"Private, ltd by shares"25,2253169,"ASIA HORIZON HOLDING LIMITED
環亞控股有限公司",2015-06-19,,"Private, ltd by shares"26,2252995,"ASIA PACIFIC HEALTHCARE SUPPLY LIMITED
亞太健康保健品有限公司",2015-06-19,,"Private, ltd by shares"27,2253019,"ASIA ROCK ENERGY LIMITED
亞洲岩石能源有限公司",2015-06-19,2019-03-29,"Private, ltd by shares"28,2252981,"ASIA SIS TRADING CO., LIMITED
賽斯貿易有限公司",2015-06-19,,"Private, ltd by shares"29,2253349,"Asia Society Of Exhibition Studies Limited
亞洲展示學會有限公司",2015-06-19,2020-03-27,"Private, ltd by shares"30,2253074,"Asia-Pacific Economics and Trade Consultancy Limited
亞太經貿顧問有限公司",2015-06-19,,"Private, ltd by shares"31,2253125,"ASIAN CENTURY ENGINEERING LIMITED
環亞工程有限公司",2015-06-19,,"Private, ltd by shares"32,2253649,"ASIAN RAIL HIGHWAY LIMITED",2015-06-19,,"Private, ltd by shares"33,2252988,"ASKUP International Limited
宸言國際有限公司",2015-06-19,2016-10-14,"Private, ltd by shares"34,2252977,"ASPOR ELECTRONICS CO., LIMITED
愛仕珀科技控股有限公司",2015-06-19,2019-08-09,"Private, ltd by shares"35,2253310,"ASTRODIVINA COMPANY LIMITED",2015-06-19,2020-05-08,"Private, ltd by shares"36,2253420,"ASTUTE MEDICAL SERVICES LIMITED
遠明醫務有限公司",2015-06-19,,"Private, ltd by shares"37,2253456,"Attitude Exhibition Co. Limited
安特展覽有限公司",2015-06-19,,"Private, ltd by shares"38,2253304,"AUDEMMAJER LIMITED",2015-06-19,2019-03-29,"Private, ltd by shares"39,2252970,"AUGE International Group (Asia) Limited
奧格國際集團(亞洲)有限公司",2015-06-19,,"Private, ltd by shares"40,2253077,"AURA TRADING MACAU LIMITED",2015-06-19,2020-04-03,"Private, ltd by shares"41,2253342,"AYMAN ZAMAN CORPORATION LIMITED",2015-06-19,,"Private, ltd by shares"42,2253637,"B-SMART INTERNATIONAL TRADING CO., LIMITED
畢斯馬特國際貿易有限公司",2015-06-19,,"Private, ltd by shares"43,2253207,"BABYLON FINANCE CONSULTANT COMPANY LIMITED
巴比倫信貸顧問有限公司",2015-06-19,2020-04-03,"Private, ltd by shares"44,2252919,"Bangshi Holding (HK) Limited
邦仕控股(香港)有限公司",2015-06-19,,"Private, ltd by shares"45,2253376,"Bao Run Chuang Xin Development Limited
寶潤創新發展有限公司",2015-06-19,,"Private, ltd by shares"46,2253135,"BAOZHI TRADING COMPANY LIMITED
寶智貿易有限公司",2015-06-19,,"Private, ltd by shares"47,2253560,"Beijing New Era Science-Tech. Co., Limited
北京創今世紀科技有限公司",2015-06-19,,"Private, ltd by shares"48,2253476,"Bellezza (HK) Limited",2015-06-19,,"Private, ltd by shares"49,2253256,"BELT &amp; ROAD (HK) PROJECT INVESTMENT INT'L HOLDINGS LIMITED
一帶一路(香港)項目投資國際控股有限公司",2015-06-19,2018-12-07,"Private, ltd by shares"50,2252925,"BES ENTERPRISE DEVELOPING (HK) LIMITED
貝適實業發展(香港)有限公司",2015-06-19,,"Private, ltd by shares"51,2253348,"BEYINE LIMITED
倍億能(香港)有限公司",2015-06-19,,"Private, ltd by shares"52,2253250,"BIG ASCENT CORPORATION LIMITED
大晉有限公司",2015-06-19,,"Private, ltd by shares"53,2253450,"BIG RISE INTERNATIONAL INVESTMENT LIMITED
太昇國際投資有限公司",2015-06-19,2017-02-17,"Private, ltd by shares"54,2253232,"BIG SHINE INTERNATIONAL LIMITED
宏耀國際有限公司",2015-06-19,,"Private, ltd by shares"55,2253192,"Bighand Partners Limited",2015-06-19,,"Private, ltd by shares"56,2253046,"BILLION BRIGHT INTERNATIONAL LIMITED
億朗國際有限公司",2015-06-19,,"Private, ltd by shares"57,2253045,"BILLION CHAIN INTERNATIONAL LIMITED
晉億國際有限公司",2015-06-19,,"Private, ltd by shares"58,2253013,"BIRK WEB ASSETS LIMITED
龍城兄弟網絡資產有限公司",2015-06-19,2017-01-20,"Private, ltd by shares"59,2253300,"BLOOM BASE LIMITED
隆基有限公司",2015-06-19,,"Private, ltd by shares"60,2252928,"Blossom (HongKong) Health-Tech Co., Limited
眾昌(香港)健康科技股份有限公司",2015-06-19,2019-04-04,"Private, ltd by shares"61,2253537,"Blue Orange Electronics Limited",2015-06-19,,"Private, ltd by shares"62,2253309,"Blue Rice International (HK) Limited
藍米國際(香港)有限公司",2015-06-19,2019-03-29,"Private, ltd by shares"63,2253027,"BOF INTERNATIONAL TRADE LIMITED",2015-06-19,,"Private, ltd by shares"64,2253237,"Bolong Plastic Masterbatch (HK) CO., Limited
博隆塑膠色母(香港)有限公司",2015-06-19,2019-03-29,"Private, ltd by shares"65,2252924,"BOYING TECHNOLOGY LIMITED (d2019-03-29)
博盈科技有限公司",2015-06-19,2019-03-29,"Private, ltd by shares"66,2253324,"BRIGHT MILLION HOLDINGS LIMITED (HK)
駿萬集團有限公司",2015-06-19,,"Private, ltd by shares"67,2253021,"BRIGHT OMEN LIMITED (d2017-10-06)
達運有限公司",2015-06-19,2017-10-06,"Private, ltd by shares"68,2253222,"BRIGHT TANGIBLE LIMITED
陞兆有限公司",2015-06-19,2019-03-29,"Private, ltd by shares"69,2253586,"British ETO International Group Co., Limited",2015-06-19,2019-03-29,"Private, ltd by shares"70,2253166,"Business Integrated Management and Availability Development (BIMAD) Limited",2015-06-19,2020-01-10,"Private, ltd by shares"71,2253563,"CAAP Limited
中國阿富汗國際投融資促進會有限公司",2015-06-19,2020-01-10,"Private, ltd by shares"72,2253130,"Cake Media Limited (HK)",2015-06-19,,"Private, ltd by shares"73,2253084,"CALVIN &amp; KANE HOLDINGS LIMITED",2015-06-19,2020-01-31,"Private, ltd by shares"74,2253042,"Campus Americas Limited",2015-06-19,2019-03-29,"Private, ltd by shares"75,2253008,"CARAT FRIEND INDUSTRIAL CO., LIMITED
克拉朋實業有限公司",2015-06-19,2020-05-08,"Private, ltd by shares"76,2253281,"CAROLINE TRADE CO., LIMITED
卡羅琳貿易有限公司",2015-06-19,,"Private, ltd by shares"77,2252979,"CARTER PRECISION (HK) MANUFACTURE LIMITED
香港卡特精密製造有限公司",2015-06-19,,"Private, ltd by shares"78,2253497,"CARZE DANIELLE INTERNATIONAL LIMITED
卡姿丹妮國際有限公司",2015-06-19,2019-03-29,"Private, ltd by shares"79,2253165,"Cathdy Co., Limited
香港凱蒂服飾有限公司",2015-06-19,2017-12-08,"Private, ltd by shares"80,2252990,"CB DEVELOPMENT GLOBAL (HK) CO., LIMITED
匯美發展國際香港有限公司",2015-06-19,,"Private, ltd by shares"81,2253216,"CENTURY MILAN INDUSTRY DEVELOPMENT CO., LIMITED
世紀米蘭實業發展有限公司",2015-06-19,,"Private, ltd by shares"82,2253272,"CHAIN DRAGON CORPORATION LIMITED
登龍有限公司",2015-06-19,2019-03-29,"Private, ltd by shares"83,2253177,"CHAMP ASCENT CORPORATION LIMITED
騰英有限公司",2015-06-19,,"Private, ltd by shares"84,2253101,"CHAMP HONEST INVESTMENT LIMITED
誠偉投資有限公司",2015-06-19,,"Private, ltd by shares"85,2253055,"CHAMP TIME INVESTMENT LIMITED
時威投資有限公司",2015-06-19,,"Private, ltd by shares"86,2252968,"CHAMPION E TRANSPORTATION LIMITED
創億運輸有限公司",2015-06-19,,"Private, ltd by shares"87,2253218,"Chance Metalware Co., Limited
強士金屬製品有限公司",2015-06-19,,"Private, ltd by shares"88,2253413,"CHAO HUI ENTERPRISE LIMITED
潮匯實業有限公司",2015-06-19,,"Private, ltd by shares"89,2253054,"CHARM MAX INTERNATIONAL LIMITED
懋豐國際有限公司",2015-06-19,,"Private, ltd by shares"90,2253461,"CHARTER LINK LOGISTICS (HK) LIMITED
嘉林國際物流(香港)有限公司",2015-06-19,,"Private, ltd by shares"91,2253433,"CHENGFU TECHNOLOGY COMPANY LIMITED
誠服科技有限公司",2015-06-19,,"Private, ltd by shares"92,2253282,"CHEONG KING AIR-CONDITION ENGINEERING CO., LIMITED
昌景冷氣工程有限公司",2015-06-19,,"Private, ltd by shares"93,2253556,"CHIBRIDGE INTERNATIONAL (HK) LIMITED
環御國際(香港)有限公司",2015-06-19,,"Private, ltd by shares"94,2252944,"China &amp; South Korea Free Line Co., Limited
中韓自由行有限公司",2015-06-19,2018-02-23,"Private, ltd by shares"95,2253170,"China AF Finance Limited
中國農信財務有限公司",2015-06-19,,"Private, ltd by shares"96,2253523,"CHINA BASIC EDUCATION INSTITUTE CO., LIMITED
中國基礎教育硏究院有限公司",2015-06-19,,"Private, ltd by shares"97,2253224,"China Big Data Co., Limited
中國大數據股份有限公司",2015-06-19,,"Private, ltd by shares"98,2253223,"CHINA CULTURAL RELIC DETECTION INSTITUTE LIMITED
中國文物檢測研究院有限公司",2015-06-19,2019-03-29,"Private, ltd by shares"99,2253399,"CHINA DRUM CIRCLE ASSOCIATION CO., LIMITED
中國鼓圈協會有限公司",2015-06-19,,"Private, ltd by shares"100,2253590,"CHINA INCENSE ASSOCIATION CO., LIMITED
中國香學會有限公司",2015-06-19,2019-03-29,"Private, ltd by shares"101,2253546,"China Inclusive Finance Institution Association Company Limited
中國小微金融機構聯席會有限公司",2015-06-19,,"Private, ltd by shares"102,2253594,"CHINA INTERNATIONAL ART PROPERTY EXCHANGE LIMITED
中國國際藝術品產權交易所有限公司",2015-06-19,2020-01-10,"Private, ltd by shares"103,2253604,"China International Medical Management Group Limited
中國國際醫療管理集團有限公司",2015-06-19,2018-02-09,"Private, ltd by shares"104,2253580,"China International Taiji Culture Communication Limited
中國國際太極文化傳播有限公司",2015-06-19,2018-10-26,"Private, ltd by shares"105,2253374,"CHINA KUN TRADE CO., LIMITED",2015-06-19,,"Private, ltd by shares"106,2253565,"CHINA LARGE EVENT MANAGEMENT LIMITED
中國大型活動管理有限公司",2015-06-19,2017-12-15,"Private, ltd by shares"107,2253611,"CHINA MORAL CONSTRUCTION PROMOTION ASSOCIATION LIMITED
中華全國道德建設促進會有限公司",2015-06-19,2019-03-29,"Private, ltd by shares"108,2253386,"CHINA SILVER FINANCIAL GROUP LIMITED
中國白銀金融集團有限公司",2015-06-19,,"Private, ltd by shares"109,2253007,"CHINA WIN WAY IMPORT &amp; EXPORT CO., LIMITED
贏途貿易有限公司",2015-06-19,2019-03-29,"Private, ltd by shares"110,2253280,"China Wit Media Co., Limited
香港中匯影視文化傳播有限公司",2015-06-19,2016-04-08,"Private, ltd by shares"111,2253625,"CHINA YILIAN FINANCE GROUP LIMITED
中國益連金融集團有限公司",2015-06-19,2019-03-29,"Private, ltd by shares"112,2253636,"China Young Star Federation Limited
中國青年創業聯合會有限公司",2015-06-19,,"Ltd by guarantee"113,2253261,"CHINESE MAX LIMITED
華成有限公司",2015-06-19,,"Private, ltd by shares"114,2253561,"CHINESE TRACE ELEMENTS GROUP CO., LIMITED
中國微量元素集團有限公司",2015-06-19,2016-06-30,"Private, ltd by shares"115,2253067,"CHIYIN TRADING LIMITED
集賢貿易有限公司",2015-06-19,2018-07-20,"Private, ltd by shares"116,2253633,"Chong Fuk Ching Foundation Limited
莊福清基金會有限公司",2015-06-19,,"Ltd by guarantee"117,2253630,"CHRISTIAN PERFECT CHURCH LIMITED
基督教全備教會有限公司",2015-06-19,,"Ltd by guarantee"118,2253387,"CIB Solutions International Limited",2015-06-19,,"Private, ltd by shares"119,2253345,"CICADA (HK) COMPANY LIMITED
知了(香港)有限公司",2015-06-19,2019-10-11,"Private, ltd by shares"120,2253204,"CITI-CHINA INTERNATIONAL LIMITED
華都國際有限公司",2015-06-19,,"Private, ltd by shares"121,2253080,"CITY FINANCE LIMITED (HK)
斯特財務有限公司",2015-06-19,,"Private, ltd by shares"122,2253117,"CITY GAINING LIMITED
致華有限公司",2015-06-19,2019-06-06,"Private, ltd by shares"123,2253265,"CITY VICTOR LIMITED
港德有限公司",2015-06-19,,"Private, ltd by shares"124,2253262,"CLASSIC WINNER LIMITED
勝典有限公司",2015-06-19,,"Private, ltd by shares"125,2253154,"CLOUD-LED LIGHTING TECHNOLOGY LIMITED
整合科技有限公司",2015-06-19,,"Private, ltd by shares"126,2253122,"CNTECH HONGKONG LIMITED
中仿香港有限公司",2015-06-19,,"Private, ltd by shares"127,2253148,"Cohesion Plastic Products Co., Limited
聚力塑膠製品有限公司",2015-06-19,2019-03-29,"Private, ltd by shares"128,2253175,"COMASIA LIMITED
康亞有限公司",2015-06-19,,"Private, ltd by shares"129,2253286,"Contigo Electronic Technology Co., Limited
康迪哥電子科技有限公司",2015-06-19,2020-10-16,"Private, ltd by shares"130,2253062,"CRAFT RACING GROUP LIMITED",2015-06-19,,"Private, ltd by shares"131,2253615,"Cream Soda Milk Company Limited
仨一製品有限公司",2015-06-19,2017-02-24,"Private, ltd by shares"132,2253183,"CREATIVE GLORY (HK) LIMITED
寶榮(香港)有限公司",2015-06-19,,"Private, ltd by shares"133,2253274,"CROWN TALENT DEVELOPMENT LIMITED
冠駿發展有限公司",2015-06-19,2018-08-24,"Private, ltd by shares"134,2253367,"CS INTERNATIONAL (HK) INDUSTRY LIMITED
晨時國際(香港)實業有限公司",2015-06-19,,"Private, ltd by shares"135,2253509,"CYBER ERA (INTERNATIONAL) LIMITED
網絡時代國際有限公司",2015-06-19,,"Private, ltd by shares"136,2252999,"D &amp; G FINANCIAL SERVICES LIMITED",2015-06-19,,"Private, ltd by shares"137,2253576,"D.ADD FILM CAUSE CO., LIMITED
香港迪加影業集團有限公司",2015-06-19,2019-03-29,"Private, ltd by shares"138,2253467,"DAI CHOU INTERNATIONAL TRADING LIMITED
大洲國際貿易有限公司",2015-06-19,,"Private, ltd by shares"139,2253124,"DAILY FAMOUS LIMITED
榮日發展有限公司",2015-06-19,,"Private, ltd by shares"140,2253233,"Dailysmart Technology Limited
麥普智能科技有限公司",2015-06-19,2020-05-15,"Private, ltd by shares"141,2253404,"DANSN MEDICAL INTERNATIONAL LIMITED
德安盛國際醫療用品有限公司",2015-06-19,,"Private, ltd by shares"142,2253469,"Danu Advisory Limited",2015-06-19,,"Private, ltd by shares"143,2252941,"DAY INTERNATIONAL INVESTMENT GROUP CO., LIMITED
大衍國際投資集團有限公司",2015-06-19,,"Private, ltd by shares"144,2253040,"De Monchy Global Purchasing Limited",2015-06-19,,"Private, ltd by shares"145,2253403,"Digivisual Display Technology Co., Limited
德積屏顯科技有限公司",2015-06-19,2018-01-19,"Private, ltd by shares"146,2252953,"DINGXIN INTERNATIONAL TRADING LIMITED
鼎鑫國際實業管理有限公司",2015-06-19,2018-11-30,"Private, ltd by shares"147,2253638,"Dion Trading Limited
醇薈貿易有限公司",2015-06-19,,"Private, ltd by shares"148,2253215,"DISCREET FAIR LIMITED
聯藝有限公司",2015-06-19,2017-04-07,"Private, ltd by shares"149,2253646,"DMZ CREATIVE LIMITED
東門子文創投資有限公司",2015-06-19,,"Private, ltd by shares"150,2253543,"DOUBLE D LIMITED
壹點甜點心甜品專門店有限公司",2015-06-19,2019-03-29,"Private, ltd by shares"151,2253628,"DOUBLE WINGS TRADING LIMITED
德寶盈貿易有限公司",2015-06-19,2020-04-03,"Private, ltd by shares"152,2253049,"DRAGON FORTUNE HOLDINGS LIMITED
龍運集團有限公司",2015-06-19,,"Private, ltd by shares"153,2253504,"DRAGON KING INTERNATIONAL INDUSTRIAL LIMITED
京龍國際實業有限公司",2015-06-19,,"Private, ltd by shares"154,2253185,"DRAGON TOWN TRADING LIMITED
龍邦貿易有限公司",2015-06-19,,"Private, ltd by shares"155,2253457,"DRAGON WAY HOLDINGS LIMITED (b2015-06-19)
龍正集團有限公司",2015-06-19,,"Private, ltd by shares"156,2253624,"Dreamland Winery International Limited
佰夢酒業國際有限公司",2015-06-19,,"Private, ltd by shares"157,2253078,"DREAMS UNIVERSAL LIMITED
夢想環球有限公司",2015-06-19,,"Private, ltd by shares"158,2253614,"DTB GLOBAL TRADING CO., LIMITED",2015-06-19,2016-11-18,"Private, ltd by shares"159,2253602,"DUNN-EDWARDS INTERNATIONAL GROUP (HONG KONG) LIMITED
鄧恩國際集團(香港)有限公司",2015-06-19,,"Private, ltd by shares"160,2253186,"DYNAMIC HILL HOLDINGS LIMITED
力峰集團有限公司",2015-06-19,,"Private, ltd by shares"161,2253053,"EARN SKY CORPORATION LIMITED
翹天有限公司",2015-06-19,,"Private, ltd by shares"162,2253460,"EARNWILL (HK) TRADING LIMITED
志得(香港)貿易有限公司",2015-06-19,2019-03-29,"Private, ltd by shares"163,2253519,"EASISHARE LIMITED
易智行有限公司",2015-06-19,,"Private, ltd by shares"164,2253071,"EastCome Technology (HongKong) Co., Limited
東臨科技香港有限公司",2015-06-19,2020-05-08,"Private, ltd by shares"165,2253141,"EASYTECH CONSTRUCTION &amp; ENGINEERING LIMITED
盈豐建築工程有限公司",2015-06-19,,"Private, ltd by shares"166,2253113,"ECHO TOYS ASIA LIMITED
力圖玩具亞洲有限公司",2015-06-19,,"Private, ltd by shares"167,2253593,"Ecocept Creation Limited
億科創建有限公司",2015-06-19,2020-05-29,"Private, ltd by shares"168,2253607,"EKORNES HONG KONG CO., LIMITED",2015-06-19,,"Private, ltd by shares"169,2253287,"Elephant International (Hong Kong) Architectural Design Co., Limited
大象國際(香港)建築設計事務所有限公司",2015-06-19,,"Private, ltd by shares"170,2253132,"ELITE POWER ENGINEERING LIMITED
威宇工程有限公司",2015-06-19,,"Private, ltd by shares"171,2253423,"Elpis Oncology Centre Limited
安盼腫瘤中心有限公司",2015-06-19,2020-11-13,"Private, ltd by shares"172,2253167,"EM INTERNATIONAL TRADE CO., LIMITED
壹妙國際貿易有限公司",2015-06-19,2017-07-14,"Private, ltd by shares"173,2253064,"Enraytek International Trading Co., Limited",2015-06-19,2019-07-19,"Private, ltd by shares"174,2253259,"ERA GRAND LIMITED
偉元有限公司",2015-06-19,,"Private, ltd by shares"175,2253030,"ESSENCIAL OIL &amp; E-CIGARETTE TRADING LIMITED
精品電子煙植物精油貿易有限公司",2015-06-19,2016-11-25,"Private, ltd by shares"176,2253511,"ETERNAL NICE HOLDINGS LIMITED
恒賢集團有限公司",2015-06-19,,"Private, ltd by shares"177,2253043,"ETERNAL SKY HOLDINGS LIMITED
永天集團有限公司",2015-06-19,2019-07-26,"Private, ltd by shares"178,2253468,"EVER TEAM INTERNATIONAL INDUSTRIAL LIMITED
永協國際實業有限公司",2015-06-19,2019-03-29,"Private, ltd by shares"179,2253211,"Evertech Building Engineering Limited
俊達樓宇工程有限公司",2015-06-19,,"Private, ltd by shares"180,2253397,"Ewin Industrial Co., Limited",2015-06-19,,"Private, ltd by shares"181,2253060,"Eye World IT Solutions Limited",2015-06-19,,"Private, ltd by shares"182,2253567,"Ezmymy HongKong Limited
壹鍵買賣香港有限公司",2015-06-19,,"Private, ltd by shares"183,2253335,"FACE &amp; PERFECT (HONGKONG) COSMETICS CO., LIMITED
嘉皓國際(香港)化妝品有限公司",2015-06-19,2017-02-10,"Private, ltd by shares"184,2253470,"FAME GROUP INTERNATIONAL LIMITED
銘聯國際有限公司",2015-06-19,2019-03-29,"Private, ltd by shares"185,2253493,"FAMEWAY INTERNATIONAL TRADING LIMITED
進名國際貿易有限公司",2015-06-19,2019-03-29,"Private, ltd by shares"186,2253115,"FAMOUS ATTEMPT LIMITED
賢得有限公司",2015-06-19,,"Private, ltd by shares"187,2253494,"FAMOUS TEAM (HK) TRADING LIMITED
銘聯(香港)貿易有限公司",2015-06-19,,"Private, ltd by shares"188,2253057,"FAST PRETTY LIMITED
美迅有限公司",2015-06-19,2019-11-29,"Private, ltd by shares"189,2253495,"FAST STAR MANAGEMENT LIMITED
捷星管理有限公司",2015-06-19,,"Private, ltd by shares"190,2253260,"FAST WISH LIMITED
快志有限公司",2015-06-19,,"Private, ltd by shares"191,2252949,"FERMAX (HK) ELECTRONIC TECHNOLOGY CO., LIMITED",2015-06-19,,"Private, ltd by shares"192,2253014,"Fine Equipment Hong Kong Limited",2015-06-19,,"Private, ltd by shares"193,2253606,"FINESTAR (HK) PRINTING CO., LIMITED
佳星 (香港) 印刷包裝有限公司",2015-06-19,,"Private, ltd by shares"194,2253098,"FLJ. JPA LIMITED
富利傑(香港)集團有限公司",2015-06-19,2019-03-29,"Private, ltd by shares"195,2253384,"flowerPOWer Company Limited",2015-06-19,,"Private, ltd by shares"196,2253393,"FOCUS HOLDINGS (ASIA) LIMITED",2015-06-19,2019-08-16,"Private, ltd by shares"197,2253516,"FOREVER MERIT INTERNATIONAL LIMITED
恒賢國際有限公司",2015-06-19,2019-04-04,"Private, ltd by shares"198,2253164,"FOREVER PEACE (CHINA) LIMITED
恆豐(中國)有限公司",2015-06-19,,"Private, ltd by shares"199,2253147,"FORTUNE PATH LIMITED (HK)
祥栢有限公司",2015-06-19,,"Private, ltd by shares"200,2253411,"Fortunes Industrial Limited
富多實業香港有限公司",2015-06-19,,"Private, ltd by shares"201,2253552,"Forward Industry Trading Co., Limited
中國福沃德工貿有限公司",2015-06-19,,"Private, ltd by shares"202,2253235,"FOSHAN FOSON TILES CO., LIMITED
佛山市科森建材有限公司",2015-06-19,2020-06-05,"Private, ltd by shares"203,2253270,"FRANCE HUASHI APPLE INT'L FASHION LIMITED
法國華仕蘋果國際服飾有限公司",2015-06-19,,"Private, ltd by shares"204,2253312,"FRANCE YOUPINHUI (CHINA) LIMITED
法國優品匯(中國)有限公司",2015-06-19,,"Private, ltd by shares"205,2253440,"FRENCH BRAHMAN NINO (HONG KONG) CLOTHING CO., LIMITED
法國梵尼諾(香港)服飾有限公司",2015-06-19,2019-03-29,"Private, ltd by shares"206,2253507,"FUENT REGENERATIVE MEDICINE LIMITED
复恩特再生醫學有限公司",2015-06-19,,"Private, ltd by shares"207,2253044,"FULLMARK CORPORATION LIMITED
誌豐有限公司",2015-06-19,,"Private, ltd by shares"208,2253149,"FUN KIDZ THERAPY &amp; CHILD DEVELOPMENT CENTRE LIMITED
童樂治療及兒童發展中心有限公司",2015-06-19,,"Private, ltd by shares"209,2252897,"FUWAI HUMAN RESOURCES LIMITED
富威人力資源有限公司",2015-06-19,2019-03-29,"Private, ltd by shares"210,2253255,"GAIN RICHEST LIMITED
盈昌有限公司",2015-06-19,,"Private, ltd by shares"211,2253356,"Gentle Breeze Technologies Limited
惠風科技有限公司",2015-06-19,2020-01-03,"Private, ltd by shares"212,2253093,"GENUINE AMAZING LIMITED
沃升有限公司",2015-06-19,,"Private, ltd by shares"213,2253425,"GERMANY ANNCC INVESTMENT MANAGEMENT LIMITED
德國權際投資管理有限公司",2015-06-19,,"Private, ltd by shares"214,2253446,"GL Equity Partners Limited",2015-06-19,,"Private, ltd by shares"215,2253445,"GLOBAL DYNAMICS (TECHNOLOGIES) CO., LIMITED
香港益友隆(科技)有限公司",2015-06-19,,"Private, ltd by shares"216,2253463,"Global Fortune Auto Trading Limited
鑫世界汽車貿易有限公司",2015-06-19,,"Private, ltd by shares"217,2253521,"GLOBAL WAY (CHINA) LIMITED
寰達(中國)有限公司",2015-06-19,2019-03-08,"Private, ltd by shares"218,2253536,"GLOBE BEAUTY LIMITED
環球風尚有限公司",2015-06-19,2019-03-29,"Private, ltd by shares"219,2253142,"GLORY CHAMPION TECHNOLOGY LIMITED
榮耀科技有限公司",2015-06-19,,"Private, ltd by shares"220,2253155,"GLORY LEGEND INTERNATIONAL LIMITED
榮駿國際有限公司",2015-06-19,2017-09-29,"Private, ltd by shares"221,2253226,"GLORY WISDOM HOLDINGS LIMITED
榮智集團有限公司",2015-06-19,,"Private, ltd by shares"222,2253162,"GOLD HARVEST WORLDWIDE LIMITED
金豐環球有限公司",2015-06-19,,"Private, ltd by shares"223,2253123,"GOLD SHINER DEVELOPMENT LIMITED
金俊發展有限公司",2015-06-19,,"Private, ltd by shares"224,2253269,"GOLD TEAM INDUSTRIAL LIMITED
金盟實業有限公司",2015-06-19,2018-02-02,"Private, ltd by shares"225,2253228,"GOLDEN POINT INC. LIMITED
金海興業有限公司",2015-06-19,2019-03-29,"Private, ltd by shares"226,2253210,"GOLDMATE INDUSTRIES LIMITED
金美實業有限公司",2015-06-19,,"Private, ltd by shares"227,2253458,"Goldstone Prime (Hong Kong) Investment Management Co., Limited
金石中睿(香港)投資管理有限公司",2015-06-19,,"Private, ltd by shares"228,2253605,"Goldway Power International Trading Limited
金偉聚能國際貿易有限公司",2015-06-19,,"Private, ltd by shares"