,Reg no.,Name,Incorp-orated,Dissolved,Type446,2253017,"MANGO TREE CONSTRUCTION COMPANY LIMITED
芒果樹建築工程有限公司",2015-06-19,,"Private, ltd by shares"447,2253478,"MARINE SHIPPING COMPANY LIMITED
航海船務有限公司",2015-06-19,2019-03-29,"Private, ltd by shares"448,2253303,"MARITIME SILK ROAD INT'L CULTURAL EQUITY TRADE CENTER LIMITED
海絲國際文化產權交易中心有限公司",2015-06-19,2020-05-29,"Private, ltd by shares"449,2253354,"MARMARA GLOBAL TEXSTIL TIC SAN HONGKONG LIMITED
瑪爾馬拉全球香港有限公司",2015-06-19,2019-03-29,"Private, ltd by shares"450,2253212,"Mars Brothers Network Technology Co., Limited
火星兄弟網絡科技有限公司",2015-06-19,,"Private, ltd by shares"451,2253545,"MASTERTEX GROUP LIMITED",2015-06-19,2018-11-23,"Private, ltd by shares"452,2253566,"MAT TECHNOLOGY ASIA CO., LIMITED",2015-06-19,,"Private, ltd by shares"453,2253608,"MAX EAGLE INTERNATIONAL INVESTMENT LIMITED
盛鵬國際投資有限公司",2015-06-19,,"Private, ltd by shares"454,2253182,"MAX GAINING LIMITED
宏健有限公司",2015-06-19,2018-01-19,"Private, ltd by shares"455,2253143,"MAX GOLDEN INTERNATIONAL LIMITED
金溢國際有限公司",2015-06-19,2018-03-23,"Private, ltd by shares"456,2253610,"MAX MIND CONSULTANTS LIMITED
志盛顧問有限公司",2015-06-19,,"Private, ltd by shares"457,2253160,"MAX TRADE TECHNOLOGY LIMITED
萬高科技有限公司",2015-06-19,2020-10-16,"Private, ltd by shares"458,2253136,"MAX TREND INVESTMENT LIMITED
盛勢投資有限公司",2015-06-19,,"Private, ltd by shares"459,2253051,"MAXI GREEN FOOD HOLDING COMPANY LIMITED
麥系綠色食品控股有限公司",2015-06-19,2016-08-26,"Private, ltd by shares"460,2252985,"Maxsky International Group Limited
沛天國際有限公司",2015-06-19,,"Private, ltd by shares"461,2253150,"MAXSTONE TRADING LIMITED
寶石貿易有限公司",2015-06-19,,"Private, ltd by shares"462,2253448,"MEDITERRANEAN FOUNDATION LIMITED",2015-06-19,,"Private, ltd by shares"463,2253146,"MEGA RIGHT INVESTMENT LIMITED
德天投資有限公司",2015-06-19,,"Private, ltd by shares"464,2253613,"MEGA SMART TECHNOLOGY DEVELOPMENT LIMITED
百駿科技發展有限公司",2015-06-19,2019-03-29,"Private, ltd by shares"465,2253158,"MEGA ZONE CORPORATION LIMITED
萬域有限公司",2015-06-19,,"Private, ltd by shares"466,2253279,"MEIPAI GLOBAL LIMITED
美拍網絡有限公司",2015-06-19,,"Private, ltd by shares"467,2253251,"MERGE COMFORT LIMITED
高日有限公司",2015-06-19,2019-03-29,"Private, ltd by shares"468,2253002,"MicroPro Group Limited
米銳集團有限公司",2015-06-19,,"Private, ltd by shares"469,2253058,"MILLION BENEFIT ENTERPRISE LIMITED
萬益企業有限公司",2015-06-19,2017-10-13,"Private, ltd by shares"470,2253326,"MILLION LITERS TRADE CO., LIMITED
億升貿易有限公司",2015-06-19,,"Private, ltd by shares"471,2253120,"MILLION LUCKY INTERNATIONAL LIMITED
佰福國際有限公司",2015-06-19,2017-06-02,"Private, ltd by shares"472,2253648,"Minor Works Construction Services Limited",2015-06-19,,"Private, ltd by shares"473,2252987,"MOBOMASTERS CO., LIMITED
移動衛仕有限公司",2015-06-19,2020-06-05,"Private, ltd by shares"474,2253206,"Moon Development Limited
明月發展有限公司",2015-06-19,,"Private, ltd by shares"475,2253619,"MORAL FAME INTERNATIONAL (HK) LIMITED
德榮國際(香港)有限公司",2015-06-19,,"Private, ltd by shares"476,2253620,"MORAL RICH INTERNATIONAL (HK) LIMITED
富德國際(香港)有限公司",2015-06-19,2018-02-23,"Private, ltd by shares"477,2252896,"MOTE LIMITED (HK)
無二有限公司",2015-06-19,,"Private, ltd by shares"478,2253090,"MOUNT AMBITIOUS LIMITED
萬鑽有限公司",2015-06-19,,"Private, ltd by shares"479,2253085,"Mount Sinai International Limited",2015-06-19,,"Private, ltd by shares"480,2253389,"MOYOU HK LIMITED",2015-06-19,,"Private, ltd by shares"481,2253454,"MULATE LIMITED",2015-06-19,2018-05-11,"Private, ltd by shares"482,2253344,"Multiplication Investment Management Limited
乘法投資管理有限公司",2015-06-19,,"Private, ltd by shares"483,2253427,"MW Productions Limited
龢龤制作有限公司",2015-06-19,,"Private, ltd by shares"484,2253065,"NA Sing Sing Entertainment Limited
藝星娛樂有限公司",2015-06-19,,"Private, ltd by shares"485,2253338,"NALA COMMERCIAL AND TRADING CO., LIMITED
新元商貿有限公司",2015-06-19,,"Private, ltd by shares"486,2252965,"NANOUK LIMITED",2015-06-19,2020-01-10,"Private, ltd by shares"487,2253418,"NATU FINANCE GROUP LIMITED
瑞眾金融集團有限公司",2015-06-19,,"Private, ltd by shares"488,2253361,"NDB MOBI LIMITED
畢墾科技有限公司",2015-06-19,,"Private, ltd by shares"489,2253178,"NEW CHEER CORPORATION LIMITED
新展有限公司",2015-06-19,,"Private, ltd by shares"490,2253190,"NEW CIRCLE INVESTMENT LIMITED
新環球投資有限公司",2015-06-19,,"Private, ltd by shares"491,2253612,"NEW EXCEL INTERNATIONAL INDUSTRIAL LIMITED
卓新國際實業有限公司",2015-06-19,2017-12-29,"Private, ltd by shares"492,2253609,"NEW GRAND INTERNATIONAL INDUSTRIAL LIMITED
新浩國際實業有限公司",2015-06-19,,"Private, ltd by shares"493,2253343,"New Rise Import &amp; Export Limited
新立新進出口有限公司",2015-06-19,,"Private, ltd by shares"494,2253426,"NEWVISION PRODUCTS LIMITED",2015-06-19,2019-03-29,"Private, ltd by shares"495,2253585,"Nezu Asia Capital Limited
根津亞洲資本有限公司",2015-06-19,,"Private, ltd by shares"496,2252984,"NI PACKAGING CO., LIMITED
新為達包裝有限公司",2015-06-19,2018-09-14,"Private, ltd by shares"497,2253102,"NICE GROUP DEVELOPMENT LIMITED
佳滙發展有限公司",2015-06-19,2019-03-29,"Private, ltd by shares"498,2253246,"NINGBO FTZ ANKEY INTERNATIONAL TRADE CO., LIMITED
寧波保稅區安客宜國際貿易有限公司",2015-06-19,,"Private, ltd by shares"499,2253213,"NINGBO SKY IMPORT AND EXPORT CO., LIMITED
寧波天空進出口有限公司",2015-06-19,2017-12-08,"Private, ltd by shares"500,2253283,"NORTHERN PINE GROUP LIMITED",2015-06-19,2016-12-02,"Private, ltd by shares"501,2252940,"Nortis Solutions (Hong Kong) Limited",2015-06-19,,"Private, ltd by shares"502,2253477,"Norwich Holding &amp; Finance Limited",2015-06-19,,"Private, ltd by shares"503,2252922,"NOUVEAU STAR COMPANY LIMITED
新昌星有限公司",2015-06-19,,"Private, ltd by shares"504,2252964,"Oakridge Global Energy Solutions (Hong Kong) Limited",2015-06-19,2020-05-08,"Private, ltd by shares"505,2253601,"OCEAN BILLION SHIPPING LIMITED
億海船務有限公司",2015-06-19,2019-03-29,"Private, ltd by shares"506,2253099,"OCEAN CHAIN DEVELOPMENT LIMITED
海昇發展有限公司",2015-06-19,,"Private, ltd by shares"507,2253651,"Official Trading Limited (HK)
歐飛貿易有限公司",2015-06-19,,"Private, ltd by shares"508,2252917,"ONETIME TRADING LIMITED",2015-06-19,2019-03-01,"Private, ltd by shares"509,2253471,"ORCHIS TECHNOLOGY HK CO., LIMITED
歐奇香港科技有限公司",2015-06-19,,"Private, ltd by shares"510,2253041,"ORIENT BUSINESS MANAGEMENT LIMITED
東方管理有限公司",2015-06-19,,"Private, ltd by shares"511,2253109,"ORIENT EQUAL INTERNATIONAL GROUP LIMITED
東方國際集團有限公司",2015-06-19,,"Private, ltd by shares"512,2253197,"ORIENTAL ENTERPRISE MANAGEMENT LIMITED
東方企業管理有限公司",2015-06-19,,"Private, ltd by shares"513,2253571,"Oxford Partners Limited",2015-06-19,,"Private, ltd by shares"514,2253417,"PAN PEI TRADING (HONG KONG) LIMITED
磐沛商貿(香港)有限公司",2015-06-19,2019-03-01,"Private, ltd by shares"515,2253187,"Parkner Limited
泊檔有限公司",2015-06-19,2019-03-29,"Private, ltd by shares"516,2253428,"PARKTIC CONSULTANTS LIMITED
珀荻顧問有限公司",2015-06-19,2018-09-28,"Private, ltd by shares"517,2253308,"PARON INDUSTRIES LIMITED
派龍實業有限公司",2015-06-19,,"Private, ltd by shares"518,2252936,"PEARL J. LIMITED",2015-06-19,,"Private, ltd by shares"519,2252989,"PENGLAI GROUP LIMITED
朋來集團有限公司",2015-06-19,,"Private, ltd by shares"520,2253036,"PEPGOAL INVESTMENT LIMITED",2015-06-19,,"Private, ltd by shares"521,2253547,"PH5 LIMITED",2015-06-19,,"Private, ltd by shares"522,2253505,"PINESTREAM TECHNOLOGY LIMITED
松流科技有限公司",2015-06-19,,"Private, ltd by shares"523,2253653,"PINSHINE INTERNATIONAL INDUSTRIAL LIMITED
品盛國際實業有限公司",2015-06-19,,"Private, ltd by shares"524,2253341,"PLAIT TRADE CO., LIMITED
普雷貿易有限公司",2015-06-19,,"Private, ltd by shares"525,2253654,"Play With Des Limited",2015-06-19,,"Private, ltd by shares"526,2253095,"PM Synergy Investment Consulting Company Limited
正方投資諮詢有限公司",2015-06-19,2019-05-10,"Private, ltd by shares"527,2253050,"PNEUFORM-ASIA Limited",2015-06-19,2019-03-29,"Private, ltd by shares"528,2253599,"POWER TEAM INTERNATIONAL TRADING LIMITED
滙力國際貿易有限公司",2015-06-19,,"Private, ltd by shares"529,2253171,"PRESTIGE INTERNATIONAL HOLDINGS LIMITED
永達國際控股有限公司",2015-06-19,2019-03-29,"Private, ltd by shares"530,2252952,"PRIME FINANCIAL GROUP CO., LIMITED
金融盛世集團發展有限公司",2015-06-19,,"Private, ltd by shares"531,2253382,"Primrose Invest &amp; Finance Limited",2015-06-19,,"Private, ltd by shares"532,2253381,"Prince Ali Group Co., Limited
阿裏皇子集團有限公司",2015-06-19,,"Private, ltd by shares"533,2253315,"PROFIT LUCK DEVELOPMENT LIMITED
運億發展有限公司",2015-06-19,,"Private, ltd by shares"534,2253059,"Profits Ongoing International Company Limited
盈續國際有限公司",2015-06-19,,"Private, ltd by shares"535,2253319,"PROGRESS LEADER LIMITED
陞領有限公司",2015-06-19,2020-10-30,"Private, ltd by shares"536,2253522,"Purely Triton Limited",2015-06-19,,"Private, ltd by shares"537,2253378,"Qing Su Trading Limited
清甦貿易有限公司",2015-06-19,,"Private, ltd by shares"538,2253402,"QIYUE INDUSTRIAL DEVELOPMENT CO., LIMITED
啓悅實業發展有限公司",2015-06-19,,"Private, ltd by shares"539,2253112,"QUALITY FIRST GROUP CORPORATION LIMITED
香港一號倉集團有限公司",2015-06-19,,"Private, ltd by shares"540,2253320,"Quantum Global Trade Limited (d2017-05-26)",2015-06-19,2017-05-26,"Private, ltd by shares"541,2253351,"QUANZHOU RZ WOLF CO., LIMITED
泉州睿之狼有限公司",2015-06-19,2017-09-29,"Private, ltd by shares"542,2252939,"Qunscom international Limited
香港泉訊國際有限公司",2015-06-19,2019-03-22,"Private, ltd by shares"543,2253056,"QY JEWELRY COMPANY LIMITED
秋盈首飾有限公司",2015-06-19,2019-03-29,"Private, ltd by shares"544,2253194,"RADHA PRODUCTIONS LIMITED",2015-06-19,2017-01-13,"Private, ltd by shares"545,2253219,"RAINBOW TOP HOLDINGS LIMITED
彩高集團有限公司",2015-06-19,,"Private, ltd by shares"546,2253622,"Real Finance Consultancy Limited
真理財顧問有限公司",2015-06-19,,"Private, ltd by shares"547,2253195,"REAL INTENTION (HK) LIMITED
本意(香港)有限公司",2015-06-19,2018-01-05,"Private, ltd by shares"548,2253459,"REBORN INTERNATIONAL GROUP LIMITED
麗柏國際集團有限公司",2015-06-19,2018-02-02,"Private, ltd by shares"549,2253490,"Ren's International Group Co., Limited
任氏國際集團有限公司",2015-06-19,,"Private, ltd by shares"550,2253217,"RICH ACE CORPORATION LIMITED
御富有限公司",2015-06-19,,"Private, ltd by shares"551,2253023,"RICH HILL ASIA FOUNDATION LIMITED
盈峰亞洲基金有限公司",2015-06-19,,"Private, ltd by shares"552,2253434,"RICH JUBILEE TRADING DEVELOP LIMITED (d2018-07-13)
達禧貿易拓展有限公司",2015-06-19,2018-07-13,"Private, ltd by shares"553,2252910,"RICH MORE International Corporation Limited
盈富集團國際有限公司",2015-06-19,,"Private, ltd by shares"554,2253517,"RICH PEAK TRADING DEVELOP LIMITED (d2018-12-14)
東嶺貿易拓展有限公司",2015-06-19,2018-12-14,"Private, ltd by shares"555,2253278,"RICH-DO INTERNATIONAL TRADING CO., LIMITED
瑞多國際貿易有限公司",2015-06-19,,"Private, ltd by shares"556,2253510,"Richrice International Energy Co., Limited
富米國際能源有限公司",2015-06-19,,"Private, ltd by shares"557,2253483,"Ricoo Medical (China) Limited
利科醫療(中國)股份有限公司",2015-06-19,,"Private, ltd by shares"558,2253597,"RIGHT NICE INTERNATIONAL LIMITED
麗正國際有限公司",2015-06-19,,"Private, ltd by shares"559,2253595,"RISE GROUP INTERNATIONAL (HK) LIMITED
晉滙國際(香港)有限公司",2015-06-19,,"Private, ltd by shares"560,2253244,"Rita T. Liu Charitable Foundation Limited
廖湯慧靄慈善基金有限公司",2015-06-19,,"Ltd by guarantee"561,2253647,"RIVERFLOW (GB) LIMITED (HK)",2015-06-19,,"Private, ltd by shares"562,2253081,"RJRDA TRADING LIMITED
瑞佳榮達貿易有限公司",2015-06-19,2020-05-08,"Private, ltd by shares"563,2253485,"RNB International Limited",2015-06-19,2017-09-15,"Private, ltd by shares"564,2252934,"Roasted City Baking Agency (HongKong) Co., Limited
焙樂城烘焙機構(香港)有限公司",2015-06-19,,"Private, ltd by shares"565,2253011,"RONGHAI INTERNATIONAL (H.K) CO., LIMITED
榮海國際(香港)有限公司",2015-06-19,2019-03-29,"Private, ltd by shares"566,2253037,"ROYAL SUNNY LIMITED
偉耀有限公司",2015-06-19,,"Private, ltd by shares"567,2253385,"RUIXUAN HK TRADE LIMITED
瑞軒香港貿易有限公司",2015-06-19,2018-11-16,"Private, ltd by shares"568,2252957,"RUIZHI AOLONGBAO TRADING LIMITED
銳智商貿有限公司",2015-06-19,2019-02-15,"Private, ltd by shares"569,2252933,"Ruyi Kitchen Tools Company Limited
如意櫥具有限公司",2015-06-19,2018-03-29,"Private, ltd by shares"570,2253383,"S.K.T. CORPORATION LIMITED",2015-06-19,,"Private, ltd by shares"571,2252967,"SALAAM IMP &amp; EXP CO., LIMITED
順真進出口有限公司",2015-06-19,,"Private, ltd by shares"572,2253508,"SatLab Geosolution (HK) Limited
賽博科技(香港)有限公司",2015-06-19,,"Private, ltd by shares"573,2253291,"Secure Future Limited (HK)",2015-06-19,2020-05-08,"Private, ltd by shares"574,2253289,"Sedra International Trading Co., Limited",2015-06-19,2016-05-27,"Private, ltd by shares"575,2253271,"SEMWAY LIMITED
升溢有限公司",2015-06-19,,"Private, ltd by shares"576,2253329,"SERVATOR ENERGY GROUP (UK) LIMITED
森維特能源集團(英國)有限公司",2015-06-19,2019-03-29,"Private, ltd by shares"577,2253254,"SHANGHAI JINNONG PUMP INDUSTRY STOCK LIMITED
上海金農泵業股份有限公司",2015-06-19,,"Private, ltd by shares"578,2253047,"SHANGHAI PEOPLE INDUSTRIAL ELECTRICAL EQUIPMENT HONGKONG CO., LIMITED
上海人民工業電器香港有限公司",2015-06-19,2020-04-03,"Private, ltd by shares"579,2253643,"SHANGHAI RENMIN DIANJI LIMITED
上海人民電機有限公司",2015-06-19,,"Private, ltd by shares"580,2252955,"Shen Yu International Trading Limited
紳瑜國際貿易有限公司",2015-06-19,,"Private, ltd by shares"581,2252956,"SHENHONG LOGISTICS (INTERNATIONAL) CO., LIMITED
深港國際物流實業有限公司",2015-06-19,,"Private, ltd by shares"582,2252951,"Shenzhen Cando Technology Co., Limited
深圳格銳度科技有限公司",2015-06-19,2018-11-30,"Private, ltd by shares"583,2253327,"Shine Prosperous Limited
耀茲有限公司",2015-06-19,2019-02-15,"Private, ltd by shares"584,2253498,"Shing Kee HK Kun Rong Wing Trading Company Limited
成記香港坤蓉酒業貿易有限公司",2015-06-19,2019-03-29,"Private, ltd by shares"585,2252918,"SHOPRO LIMITED",2015-06-19,,"Private, ltd by shares"586,2253156,"SILVER ALLIED INVESTMENT LIMITED
銀利投資有限公司",2015-06-19,2019-03-29,"Private, ltd by shares"587,2253491,"SINO - AUSTRALIA INDUSTRIES GROUP LIMITED
中澳實業集團有限公司",2015-06-19,,"Private, ltd by shares"588,2253257,"SINTECH INTERNATIONAL (HK) LIMITED
新德昌國際(香港)有限公司",2015-06-19,,"Private, ltd by shares"589,2253179,"SINYO INDUSTRIAL (HK) LIMITED
鑫圓實業(香港)有限公司",2015-06-19,,"Private, ltd by shares"590,2253388,"SKY GREAT (HK) LIMITED
天幃(香港)有限公司",2015-06-19,,"Private, ltd by shares"591,2253591,"SKY LUCK HOLDINGS LIMITED
運天集團有限公司",2015-06-19,,"Private, ltd by shares"592,2253221,"SKY MENTOR LIMITED
裕天有限公司",2015-06-19,,"Private, ltd by shares"593,2253640,"SKY VALUE TRADING DEVELOP LIMITED
天嘉貿易拓展有限公司",2015-06-19,,"Private, ltd by shares"594,2253443,"SKYNET BUSINESS INFORMATION CONSULTING COMPANY LIMITED
天網商務信息諮詢有限公司",2015-06-19,,"Private, ltd by shares"595,2253133,"SMART ENTERPRISE LIMITED
俊企有限公司",2015-06-19,,"Private, ltd by shares"596,2253236,"SMART GATE INVESTMENTS LIMITED
兆基投資有限公司",2015-06-19,,"Private, ltd by shares"597,2253299,"SMART REGION HOLDINGS LIMITED
明駿集團有限公司",2015-06-19,,"Private, ltd by shares"598,2253266,"SMART WISH CORPORATION LIMITED
傑志有限公司",2015-06-19,,"Private, ltd by shares"599,2253631,"SOCIETE ANONYME LANTAO LIMITED",2015-06-19,,"Private, ltd by shares"600,2253239,"SOLID ROCK TECHNOLOGY INDUSTRIAL LIMITED
巨石科技實業有限公司",2015-06-19,,"Private, ltd by shares"601,2252900,"South-North Connection Company Limited
海朋國際有限公司",2015-06-19,,"Private, ltd by shares"602,2253394,"Spain Import and Export Trading Co., Limited
西雅進出口貿易有限公司",2015-06-19,2016-12-02,"Private, ltd by shares"603,2253063,"SPEEDY TOPPING LIMITED
迅高有限公司",2015-06-19,,"Private, ltd by shares"604,2253225,"SpongeBob (China) Limited
海綿寶寶(中國)有限公司",2015-06-19,,"Private, ltd by shares"605,2253588,"STAND GREAT INTERNATIONAL INVESTMENT LIMITED
聯鴻國際投資有限公司",2015-06-19,,"Private, ltd by shares"606,2253582,"STAR DRAGON SHIPPING LIMITED
龍星船務有限公司",2015-06-19,,"Private, ltd by shares"607,2253296,"STAR VICTORY TRADING LIMITED
星凱貿易有限公司",2015-06-19,2018-12-07,"Private, ltd by shares"608,2253579,"STARWAY INTERNATIONAL (HK) LIMITED
順星國際(香港)有限公司",2015-06-19,,"Private, ltd by shares"609,2253126,"STEP GRAND INTERNATIONAL LIMITED
博達國際有限公司",2015-06-19,,"Private, ltd by shares"610,2253480,"Strong International Business (Hongkong) Co., Limited
思卓國際貿易(香港)有限公司",2015-06-19,,"Private, ltd by shares"611,2253575,"STRONG KING INTERNATIONAL LIMITED
威堅國際有限公司",2015-06-19,,"Private, ltd by shares"612,2253138,"SUCCESS CHAMPION DEVELOPMENT LIMITED
瑞成發展有限公司",2015-06-19,,"Private, ltd by shares"613,2253025,"SUDA EDUCATION GROUP (HK) CO., LIMITED
蘇大教育集團(香港)有限公司",2015-06-19,,"Private, ltd by shares"614,2252935,"SUMWIN INTERNATIONAL LIMITED
順承國際有限公司",2015-06-19,,"Private, ltd by shares"615,2253267,"SUN BLESS LIMITED
至朗有限公司",2015-06-19,,"Private, ltd by shares"616,2253188,"SUN YAN INTERNATIONAL TRADING LIMITED
訊揚國際貿易有限公司",2015-06-19,,"Private, ltd by shares"617,2253435,"Suning Real Estate Purchasing Co., Limited
香港蘇寧建材有限公司",2015-06-19,,"Private, ltd by shares"618,2253273,"SUNNY GATE LIMITED
啟熙有限公司",2015-06-19,,"Private, ltd by shares"619,2253574,"SUNNY GIANT INTERNATIONAL LIMITED
巨朗國際有限公司",2015-06-19,,"Private, ltd by shares"620,2252969,"SUNPLUS LED TECHNOLOGY CO., LIMITED",2015-06-19,,"Private, ltd by shares"621,2253086,"Suntex Medicines&amp;Health Products Co., Limited",2015-06-19,2020-04-17,"Private, ltd by shares"622,2252963,"SUNWAY FINANCIAL MANAGEMENT LIMITED
新威金融管理有限公司",2015-06-19,,"Private, ltd by shares"623,2253234,"SUPER FUTURE (HK) LIMITED
勝景(香港)有限公司",2015-06-19,,"Private, ltd by shares"624,2253369,"SUPER PROMO CO., LIMITED",2015-06-19,,"Private, ltd by shares"625,2253070,"Supreme Bright Development Company Limited
浚盈發展有限公司",2015-06-19,2016-11-25,"Private, ltd by shares"626,2253577,"SURE HONEST HOLDINGS LIMITED
致誠集團有限公司",2015-06-19,,"Private, ltd by shares"627,2253564,"SURE RICH MANAGEMENT LIMITED
致富管理有限公司",2015-06-19,,"Private, ltd by shares"628,2253559,"SURE SKY INTERNATIONAL INDUSTRIAL LIMITED
天致國際實業有限公司",2015-06-19,2019-03-01,"Private, ltd by shares"629,2253557,"SURE WEALTH HOLDINGS LIMITED
裕保集團有限公司",2015-06-19,2019-03-29,"Private, ltd by shares"630,2253554,"SURE WEALTH INTERNATIONAL INDUSTRIAL LIMITED
保康國際實業有限公司",2015-06-19,,"Private, ltd by shares"631,2252978,"SUYI TRADING CO., LIMITED",2015-06-19,2019-02-08,"Private, ltd by shares"632,2252914,"SWISS BASEL FASHION ART CO., LIMITED
瑞士巴塞爾時尙藝術有限公司",2015-06-19,,"Private, ltd by shares"633,2253439,"SWISS RHINE INTERNATIONAL HOLDINGS (HONGKONG) LIMITED
瑞士萊茵國際控股(香港)有限公司",2015-06-19,,"Private, ltd by shares"634,2253020,"SWITZERLAND BAOKOU INTERNATIONAL GROUP CO., LIMITED
瑞士葆蔻國際集團有限公司",2015-06-19,2019-07-19,"Private, ltd by shares"635,2253337,"TAIWAN OUCHONG PET PRODUCTS LIMITED
臺灣歐寵寵物用品有限公司",2015-06-19,2019-03-29,"Private, ltd by shares"636,2253500,"TAL (H.K.) INTERNATIONAL TRADING CO., LIMITED
泰達(香港)國際貿易有限公司",2015-06-19,2017-12-29,"Private, ltd by shares"637,2253550,"TALENT WAY MANAGEMENT LIMITED
廸威管理有限公司",2015-06-19,,"Private, ltd by shares"638,2253581,"TalentPRO Strategy Limited
得力策劃有限公司",2015-06-19,,"Private, ltd by shares"639,2253317,"TCX DEVELOPMENT COMPANY LIMITED
金松江發展有限公司",2015-06-19,2020-06-12,"Private, ltd by shares"640,2253542,"TEAM STAR CONSULTANTS LIMITED
聯星顧問有限公司",2015-06-19,,"Private, ltd by shares"641,2253153,"TENG HUI TECHNOLOGY (HONG KONG) CO., LIMITED
騰輝科技(香港)有限公司",2015-06-19,2019-03-29,"Private, ltd by shares"642,2253419,"TETH JF Limited",2015-06-19,2017-12-29,"Private, ltd by shares"643,2252947,"THIKK OUTDOORS CO., LIMITED
詩客戶外有限公司",2015-06-19,,"Private, ltd by shares"644,2253089,"TIAN QI GROUP WELL COMFORT INTERNATIONAL COMPANY LIMITED
田七集團惠康國際有限公司",2015-06-19,,"Private, ltd by shares"645,2253645,"TIANDE FUZHIYIYANG (HK) INVEST MANAGEMENT LIMITED
天德福祉頤養(香港)投資管理有限公司",2015-06-19,2019-03-29,"Private, ltd by shares"646,2253415,"TIANJIAO EDUCATION CO., LIMITED
天驕教育有限公司",2015-06-19,2019-03-29,"Private, ltd by shares"647,2253238,"Tiffen Communication Technology Co., Limited
天賦通訊科技有限公司",2015-06-19,2020-10-09,"Private, ltd by shares"648,2253131,"TIME PROFIT INTERNATIONAL LIMITED
潤時國際有限公司",2015-06-19,,"Private, ltd by shares"649,2253431,"TIMELY RAIN INVESTMENT CO., LIMITED",2015-06-19,2019-03-29,"Private, ltd by shares"650,2253241,"Titan Combat Limited
武當龍玄館有限公司",2015-06-19,,"Private, ltd by shares"651,2252942,"TONGXIANG YOUNGSHINE IMP. &amp; EXP. CO., LIMITED",2015-06-19,2019-12-06,"Private, ltd by shares"652,2253535,"TOP EASE ELECTRONICS TECHNOLOGY LIMITED
高宜電子科技有限公司",2015-06-19,2018-09-21,"Private, ltd by shares"653,2253134,"TOP EXPRESS INSURANCE AGENCY LIMITED
萬匯保險代理有限公司",2015-06-19,,"Private, ltd by shares"654,2253004,"TOP FIBER SOURCE CO., LIMITED
頂拓化工實業有限公司",2015-06-19,,"Private, ltd by shares"655,2253503,"TOP HEALTH TRADING LIMITED
鼎健貿易有限公司",2015-06-19,,"Private, ltd by shares"656,2253532,"TOP NICE INTERNATIONAL (HK) LIMITED
美高國際(香港)有限公司",2015-06-19,2019-03-29,"Private, ltd by shares"657,2253530,"TOP SPREAD INTERNATIONAL INVESTMENT LIMITED
顯高國際投資有限公司",2015-06-19,,"Private, ltd by shares"658,2253526,"TOP WEALTHY CONSULTANTS LIMITED
高康顧問有限公司",2015-06-19,2019-11-01,"Private, ltd by shares"659,2253277,"TOPPING RICH DEVELOPMENT LIMITED
盛裕發展有限公司",2015-06-19,,"Private, ltd by shares"660,2253231,"TOTAL SKY DEVELOPMENT LIMITED
天保發展有限公司",2015-06-19,,"Private, ltd by shares"661,2252971,"TOTALVIEW HK LIMITED",2015-06-19,,"Private, ltd by shares"662,2253214,"TRAINING ROOM ONLINE GLOBAL LIMITED (THE)",2015-06-19,,"Private, ltd by shares"663,2253200,"Tree-Roots Testing Technology (HongKong) Engineering Co., Limited
樹根測試技術(香港)工程有限公司",2015-06-19,2020-01-31,"Private, ltd by shares"664,2253359,"True Technology (HongKong) Company Limited
香港本真科技有限公司",2015-06-19,2016-12-23,"Private, ltd by shares"665,2253333,"TRUE TREASURE (2015) LIMITED
新豐年(2015)有限公司",2015-06-19,,"Private, ltd by shares"666,2252911,"Tuan Culture (HK) Limited
圖安文化香港有限公司",2015-06-19,,"Private, ltd by shares"667,2253227,"TURBO SKY HOLDINGS LIMITED
盛天集團有限公司",2015-06-19,2017-01-27,"Private, ltd by shares"668,2253616,"TURKEY PILSACH (SHANGHAI) LIMITED
土耳其皮爾薩(上海)有限公司",2015-06-19,,"Private, ltd by shares"669,2253139,"Tweety International Limited
翠兒國際有限公司",2015-06-19,2019-03-29,"Private, ltd by shares"670,2252975,"Tycoon Asia Holdings Limited
太上康控股有限公司",2015-06-19,2019-03-29,"Private, ltd by shares"671,2253632,"Tyloo Ocean Transportation (Hong Kong) Limited
天祿海運(香港)有限公司",2015-06-19,2018-01-19,"Private, ltd by shares"672,2253544,"U&amp;V TRADING SERVICE (HK) LIMITED
優昂威貿易服務有限公司",2015-06-19,,"Private, ltd by shares"673,2253220,"ULTRA CREATION LIMITED
建優有限公司",2015-06-19,,"Private, ltd by shares"674,2253005,"UMEHIM LIMITED",2015-06-19,2016-10-21,"Private, ltd by shares"675,2253242,"UMEI LIMITED
尤美科技有限公司",2015-06-19,2018-02-09,"Private, ltd by shares"676,2253391,"UNI-LEADER SHIPPING CO., LIMITED
利德船務有限公司",2015-06-19,,"Private, ltd by shares"