,Reg no.,Name,Incorp-orated,Dissolved,Type1,0811734,"AASPERON (HONG KONG) INVESTMENT LIMITED
億豐(香港)投資有限公司",2002-08-26,2014-06-27,"Private, ltd by shares"2,0811732,"AFRITRAMP ASIA LIMITED",2002-08-26,2004-01-30,"Private, ltd by shares"3,0811668,"AH SAY (HOLDINGS) LIMITED
阿四(集團)有限公司",2002-08-26,,"Private, ltd by shares"4,0811681,"ALDI ENTERPRISES LIMITED
歐迪實業有限公司",2002-08-26,2008-01-04,"Private, ltd by shares"5,0811615,"ALL WIN INTERNATIONAL GROUP LIMITED
同勝國際集團有限公司",2002-08-26,,"Private, ltd by shares"6,0811649,"AOW TECHNOLOGY CONSULTANCY LIMITED
亞諾科技咨詢有限公司",2002-08-26,2012-12-07,"Private, ltd by shares"7,0811754,"ASIA CORPS COMPANY LIMITED
亞洲宏略有限公司",2002-08-26,2006-03-03,"Private, ltd by shares"8,0811639,"ASIA OPTICAL INDUSTRIES (HK) LIMITED
亞洲光學(香港)有限公司",2002-08-26,,"Private, ltd by shares"9,0811745,"BELLPOWER TECHNOLOGY LIMITED
貝爾電源科技有限公司",2002-08-26,2006-01-13,"Private, ltd by shares"10,0811691,"BRIGHT CHINA INTERNATIONAL GROUP CO., LIMITED
揚華國際集團有限公司",2002-08-26,2008-01-04,"Private, ltd by shares"11,0811628,"BROWN (HK) TRADING CO., LIMITED
伯良香港貿易有限公司",2002-08-26,,"Private, ltd by shares"12,0811693,"CAMG STRATEGIC COMPANY LIMITED
時捷策劃有限公司",2002-08-26,2008-01-04,"Private, ltd by shares"13,0811774,"CATCHIE MINERS (HONG KONG) LIMITED
奇智創庫(香港)有限公司",2002-08-26,2008-03-28,"Private, ltd by shares"14,0811757,"CENTURYEAR TECHNOLOGY LIMITED
世紀建業科技有限公司",2002-08-26,2008-01-04,"Private, ltd by shares"15,0811763,"CHANCE MEDIA LIMITED (d2008-01-04)
領先策劃有限公司",2002-08-26,2008-01-04,"Private, ltd by shares"16,0811770,"CHANCE PROMOTIONS LIMITED
創思策劃有限公司",2002-08-26,2008-01-04,"Private, ltd by shares"17,0811637,"CHAR MEI (H.K.) COMPANY LIMITED
尚美堂(香港)有限公司",2002-08-26,2008-01-04,"Private, ltd by shares"18,0811687,"CHARTER LINK LOGISTICS LIMITED
嘉林國際物流有限公司",2002-08-26,,"Private, ltd by shares"19,0811663,"CHINA CARE FUND LIMITED
培苗行動有限公司",2002-08-26,,"Ltd by guarantee"20,0811620,"CHINA SCIENCE PARK DEVELOPMENT COMPANY LIMITED
中華海外科技園開發有限公司",2002-08-26,2011-10-07,"Private, ltd by shares"21,0811760,"CHINABIOTECH GROUP LIMITED
中生科集團有限公司",2002-08-26,2012-02-10,"Private, ltd by shares"22,0811638,"CONSTANT TIMBER LIMITED
港順木業有限公司",2002-08-26,,"Private, ltd by shares"23,0811648,"CUIHAI INTERNATIONAL INDUSTRIAL LIMITED
翠海國際實業有限公司",2002-08-26,2013-02-08,"Private, ltd by shares"24,0811653,"DAILY DRAGON RESOURCES LIMITED
日龍資源有限公司",2002-08-26,2013-08-31,"Private, ltd by shares"25,0811787,"DAILY FULL DEVELOPMENT TRADING LIMITED
日富發展貿易有限公司",2002-08-26,2011-08-19,"Private, ltd by shares"26,0811703,"EAST HARBOUR GROUP LIMITED (d2012-11-23)",2002-08-26,2012-11-23,"Private, ltd by shares"27,0811634,"EASTRIN MACHINE (HK) CO., LIMITED
東霖機械(香港)有限公司",2002-08-26,2015-09-04,"Private, ltd by shares"28,0811646,"Edvance Technology (Hong Kong) Limited
安領科技(香港)有限公司",2002-08-26,,"Private, ltd by shares"29,0811719,"ES ALLIANCE INTERNATIONAL CONSULTING LIMITED
怡新國際人事顧問有限公司",2002-08-26,2003-12-05,"Private, ltd by shares"30,0811709,"EURO TEX ZIPPER COMPANY LIMITED
歐紡服飾拉鍊有限公司",2002-08-26,2009-04-03,"Private, ltd by shares"31,0811739,"EUROLITE INTERNATIONAL COMPANY LIMITED
華美達國際有限公司",2002-08-26,2018-05-11,"Private, ltd by shares"32,0811736,"EVERCHANCE INDUSTRIES LIMITED
德時實業有限公司",2002-08-26,2008-01-04,"Private, ltd by shares"33,0811742,"EXCHANNEL TRADE LIMITED",2002-08-26,2020-05-29,"Private, ltd by shares"34,0811765,"EYUANTONG HERBAL COMPANY LIMITED
一元堂本草有限公司",2002-08-26,2005-01-14,"Private, ltd by shares"35,0811647,"FAITH MARK INDUSTRIAL (H.K.) LIMITED
時信實業(香港)有限公司",2002-08-26,,"Private, ltd by shares"36,0811694,"FASHION &amp; FRAGRANCE COMPANY LIMITED",2002-08-26,2012-07-06,"Private, ltd by shares"37,0811651,"FIRST CHAMPION INVESTMENT LIMITED (d2006-08-04)
上冠投資有限公司",2002-08-26,2006-08-04,"Private, ltd by shares"38,0811675,"FIRST FIELD INVESTMENT LIMITED",2002-08-26,2004-05-21,"Private, ltd by shares"39,0811731,"FOH LOONG INDUSTRIAL AND TRADING (HONG KONG) LIMITED
科農實業(香港)貿易有限公司",2002-08-26,2008-01-04,"Private, ltd by shares"40,0811785,"FOOK KONG CONSTRUCTION LIMITED
福港建材有限公司",2002-08-26,2008-01-11,"Private, ltd by shares"41,0811716,"FORTUNE DELTA LIMITED
盈川國際有限公司",2002-08-26,2010-01-29,"Private, ltd by shares"42,0811697,"FORTUNE THERMO ENGINEERING LIMITED
恒譽汽車冷氣設備有限公司",2002-08-26,2004-12-24,"Private, ltd by shares"43,0811684,"FRANCE DEGLAND (HK) INT'L DRESS LIMITED
法國卡迪格蘭(香港)國際服飾有限公司",2002-08-26,2008-01-04,"Private, ltd by shares"44,0811759,"FULL HANG CATERING HOLDINGS LIMITED
富恆飲食集團有限公司",2002-08-26,2008-01-04,"Private, ltd by shares"45,0811613,"G-TIME CO., LIMITED",2002-08-26,2008-01-04,"Private, ltd by shares"46,0811672,"G3 INTERNATIONAL ARCHITECTS &amp; ENGINEERS LIMITED",2002-08-26,2017-04-28,"Private, ltd by shares"47,0811652,"GAIN MILLION RESOURCES LIMITED
益貿資源有限公司",2002-08-26,2016-04-22,"Private, ltd by shares"48,0811622,"GENERAL MERCHANDISE (HK) COMPANY LIMITED (d2005-02-04)
通用洋行(香港)有限公司",2002-08-26,2005-02-04,"Private, ltd by shares"49,0811671,"GERMANY SOFT NIP CALENDER TECHNOLOGY (FAR EAST) INTERNATIONAL LIMITED
德國軟壓技術(遠東)國際有限公司",2002-08-26,2008-01-04,"Private, ltd by shares"50,0811755,"GIBSON (ASIA) LIMITED
吉遜(亞洲)有限公司",2002-08-26,,"Private, ltd by shares"51,0811767,"GLOBAL FINANCIAL PARTNERS (ASIA) LIMITED
環球金融(亞洲)有限公司",2002-08-26,,"Private, ltd by shares"52,0811690,"GLOBEX BIOTECH LIMITED",2002-08-26,,"Private, ltd by shares"53,0811657,"GLOSSY SUN (HK) PUBLIC-SPIRITED BUSINESS GROUP LIMITED
潤澤陽光(香港)公益事業集團有限公司",2002-08-26,2008-01-04,"Private, ltd by shares"54,0811665,"GLUMAC INTERNATIONAL ASIA LIMITED",2002-08-26,2008-01-04,"Private, ltd by shares"55,0811706,"GOLDEN SEA RESOURCES LIMITED
金海宏業能源有限公司",2002-08-26,2009-03-20,"Private, ltd by shares"56,0811619,"GOLDEN TIME RESTAURANT LIMITED
金年華酒家有限公司",2002-08-26,2009-07-03,"Private, ltd by shares"57,0811779,"GOLDEN WEALTH MOTORS TRADING LIMITED
金匯汽車貿易有限公司",2002-08-26,2020-06-12,"Private, ltd by shares"58,0811712,"GST GROUP (HK) CO., LIMITED
萬碁集團(香港)有限公司",2002-08-26,2008-07-18,"Private, ltd by shares"59,0811656,"GUANGZHOU ZHOUTOUZUI DEVELOPMENT LIMITED
廣州洲頭咀發展有限公司",2002-08-26,,"Private, ltd by shares"60,0811669,"H. K. HOUSETUP FURNITURE GROUP LIMITED
香港好事達傢俬集團有限公司",2002-08-26,2008-01-04,"Private, ltd by shares"61,0811650,"H.K. XINGYUAN INT'L INVESTMENT GROUP LIMITED
香港興遠國際投資集團有限公司",2002-08-26,2016-04-15,"Private, ltd by shares"62,0811683,"HANG TUNG JEWELLERY COMPANY LIMITED
恒通珠寶有限公司",2002-08-26,2011-03-18,"Private, ltd by shares"63,0811748,"HANTA COMMUNICATION GROUP LIMITED
恆達網絡實業有限公司",2002-08-26,2006-02-03,"Private, ltd by shares"64,0811699,"HARIOM ENTERPRISES LIMITED",2002-08-26,2010-01-22,"Private, ltd by shares"65,0811696,"HARVEST STRATEGIC INVESTMENT COMPANY LIMITED
成功策略投資有限公司",2002-08-26,2004-06-11,"Private, ltd by shares"66,0811769,"HEAVEN TRADING CO., LIMITED
曦雲貿易有限公司",2002-08-26,2009-11-13,"Private, ltd by shares"67,0811626,"HIGH INTELLIGENCE TRADING HONG KONG COMPANY LIMITED
香港瑞杰有限公司",2002-08-26,2008-12-19,"Private, ltd by shares"68,0811764,"HK GRANDLAND INT'L EXHIBITION GROUP LIMITED
香港神州行國際展覽集團有限公司",2002-08-26,2008-01-11,"Private, ltd by shares"69,0811750,"HK JINO DRESS DEV. LIMITED
香港基諾服飾發展有限公司",2002-08-26,2008-01-04,"Private, ltd by shares"70,0811629,"HO CHEUNG ELECTRICAL ENGINEERING COMPANY LIMITED
浩昌電機工程有限公司",2002-08-26,,"Private, ltd by shares"71,0811746,"HONG KONG BUDDHA TAOISM ASSOCIATION LIMITED
香港釋道教協會有限公司",2002-08-26,2015-10-30,"Private, ltd by shares"72,0811775,"HONG KONG GOLDTIDE INDUSTRIAL (INTERNATIONAL) GARMENT LIMITED
香港金潮來實業(國際)製衣有限公司",2002-08-26,2008-01-04,"Private, ltd by shares"73,0811766,"HONG KONG JEWELLERY ALLIANCE GROUP COMPANY LIMITED
香港珠寶聯盟集團有限公司",2002-08-26,,"Private, ltd by shares"74,0811616,"HONG KONG SUNNY GOLD INTERNATIONAL GROUP LIMITED
香港金晟國際集團有限公司",2002-08-26,2017-04-21,"Private, ltd by shares"75,0811776,"HONG KONG WAVE BIRD FASHION HOLDINGS INTERNATIONAL LIMITED
香港浪花鳥服飾集團國際有限公司",2002-08-26,2008-01-04,"Private, ltd by shares"76,0811727,"HONGKONG EXCELLENT HOLDINGS (ASIA) COMPANY LIMITED
香港卓越集團(亞洲)有限公司",2002-08-26,2016-01-29,"Private, ltd by shares"77,0811667,"HONGKONG ZHONGTIAN INTERNATIONAL GROUP LIMITED
香港中天國際集團有限公司",2002-08-26,2008-01-11,"Private, ltd by shares"78,0811704,"HUA SHUN TRANSPORTATION COMPANY LIMITED
華順運輸有限公司",2002-08-26,2018-03-09,"Private, ltd by shares"79,0811674,"HUANG'S (HONG KONG) CO., LIMITED
黃記和埔(香港)有限公司",2002-08-26,2007-04-04,"Private, ltd by shares"80,0811778,"HUNDRED MILLION DRAGON INDUSTRY DEVELOPMENT CO. LIMITED
香港億龍實業發展有限公司",2002-08-26,2008-01-04,"Private, ltd by shares"81,0811786,"ICRIS:0811786 (no English name)
中國風(國際)服裝品牌形象顧問有限公司",2002-08-26,2008-01-04,"Private, ltd by shares"82,0811715,"IDEOLOGY ADVERTISING AGENCY LIMITED
意識形態廣告有限公司",2002-08-26,,"Private, ltd by shares"83,0811705,"Imaginarium Incorporated Limited",2002-08-26,2010-11-05,"Private, ltd by shares"84,0811725,"IMMAC TECHNOLOGY COMPANY LIMITED
庚泰科技有限公司",2002-08-26,2005-03-24,"Private, ltd by shares"85,0811659,"INSTITUTE OF LEARNING &amp; DEVELOPMENT LIMITED",2002-08-26,,"Private, ltd by shares"86,0811783,"INTER-LOGISTIC HK LIMITED
泓達國際貨運有限公司",2002-08-26,2004-09-24,"Private, ltd by shares"87,0811711,"ITALY DUNHAIRON BRAND MAKING COMPANY LIMITED
義大利登喜路‧品牌整營有限公司",2002-08-26,2007-02-16,"Private, ltd by shares"88,0811685,"ITALY PILOT INT'L GROUP (HK) LIMITED
意大利派立特國際集團(香港)有限公司",2002-08-26,2009-01-23,"Private, ltd by shares"89,0811707,"ITALY PLAYBOY INT'L GROUP LIMITED (d2003-09-26)
意大利花花公子國際集團有限公司",2002-08-26,2003-09-26,"Private, ltd by shares"90,0811631,"ITALY SINDELONG GARMENT GROUP (H.K.) LIMITED
意大利聖德隆服飾集團(香港)有限公司",2002-08-26,2008-01-04,"Private, ltd by shares"91,0811733,"JADE UNIVERSE ENTERPRISES LIMITED
高馬企業有限公司",2002-08-26,2006-06-09,"Private, ltd by shares"92,0811682,"JOINHANDS INTERNATIONAL DEVELOPMENT LIMITED
中瀚國際發展有限公司",2002-08-26,2015-01-02,"Private, ltd by shares"93,0811753,"JORTINO DRESS (HK) LIMITED
佐天奴服飾(香港)有限公司",2002-08-26,2008-01-04,"Private, ltd by shares"94,0811743,"JOSGOOD (H.K.) LIMITED
怡和佳(香港)有限公司",2002-08-26,,"Private, ltd by shares"95,0811781,"JUMANJI GROUP LIMITED
豬馬雞集團有限公司",2002-08-26,2019-07-05,"Private, ltd by shares"96,0811718,"KA TAT ASIA COMPANY LIMITED
加達亞洲有限公司",2002-08-26,2003-05-16,"Private, ltd by shares"97,0811782,"KAIDE DRESS (HONGKONG) CO., LIMITED
凱德服飾(香港)有限公司",2002-08-26,2008-01-04,"Private, ltd by shares"98,0811654,"KAM KEE PAINTING ENGINEERING COMPANY LIMITED
金記油漆工程有限公司",2002-08-26,,"Private, ltd by shares"99,0811625,"KANG TAI HYGIENE KITCHEN (H.K.) INTERNATIONAL LIMITED
康太衛廚(香港)國際有限公司",2002-08-26,2011-04-21,"Private, ltd by shares"100,0811670,"KATOWORLD INDUSTRY DEVELOPMENT COMPANY LIMITED
世展實業發展有限公司",2002-08-26,2008-01-04,"Private, ltd by shares"101,0811679,"KEIO CHINA COMPANY LIMITED (d2010-05-20)
京王中國有限公司",2002-08-26,2010-05-20,"Private, ltd by shares"102,0811728,"KID KID LIMITED",2002-08-26,2008-01-04,"Private, ltd by shares"103,0811721,"KML LOGISTICS SERVICES COMPANY LIMITED
新航貨運有限公司",2002-08-26,2007-05-18,"Private, ltd by shares"104,0811658,"KOF (GLOBAL) HOLDINGS LIMITED
國富(環球)控股有限公司",2002-08-26,2013-04-12,"Private, ltd by shares"105,0811777,"KORMAN INTERNATIONAL (XIAMEN) LIMITED
和明國際貨運(廈門)有限公司",2002-08-26,,"Private, ltd by shares"106,0811680,"LA FORME BEAUTY CENTRE LIMITED
樂飛國際美體雕塑院有限公司",2002-08-26,,"Private, ltd by shares"107,0811692,"LIK SANG CONTAINER COMPANY LIMITED
力生貨櫃有限公司",2002-08-26,,"Private, ltd by shares"108,0811780,"LINTAS MULTI MEDIA ADVERTISING PRODUCTIONS LIMITED
凌思多媒體廣告製作有限公司",2002-08-26,2003-11-07,"Private, ltd by shares"109,0811702,"LONGSELL INTERNATIONAL LIMITED
隆新國際有限公司",2002-08-26,,"Private, ltd by shares"110,0811630,"LUCUI GROUP INTERNATIONAL HOLDINGS (H.K.) COMPANY LIMITED
魯翠集團國際控股(香港)有限公司",2002-08-26,2010-01-22,"Private, ltd by shares"111,0811664,"LUEN BONG ASSOCIATION LIMITED
聯邦會有限公司",2002-08-26,2008-11-12,"Ltd by guarantee"112,0811623,"Mao Ye Furniture Limited
茂葉傢具有限公司",2002-08-26,,"Private, ltd by shares"113,0811708,"MEGA INT'L GROUP (HK) LIMITED
麥格國際集團(香港)有限公司",2002-08-26,2008-01-04,"Private, ltd by shares"114,0811632,"MINDWALK LIMITED (d2006-02-10)
睿行有限公司",2002-08-26,2006-02-10,"Private, ltd by shares"115,0811772,"MING FUNG COMPANY LIMITED
明豐粉麵廠有限公司",2002-08-26,,"Private, ltd by shares"116,0811661,"MINI AUDIO EQUIPMENT LIMITED
永卓音響器材有限公司",2002-08-26,2004-05-14,"Private, ltd by shares"117,0811738,"NERITES LIMITED",2002-08-26,2009-01-09,"Private, ltd by shares"118,0811773,"NEW EAST CATERING INVESTMENT &amp; MANAGEMENT LIMITED
新東方飲食投資管理有限公司",2002-08-26,2004-01-09,"Private, ltd by shares"119,0811673,"NEW SUNHOPE INTERNATIONAL LIMITED
新森和國際有限公司",2002-08-26,2016-01-15,"Private, ltd by shares"120,0811744,"NUOPO INDUSTRIES COMPANY LIMITED
百業通國際實業有限公司",2002-08-26,2011-11-04,"Private, ltd by shares"121,0811792,"NX SCIENTIFIC LIMITED
寧暄科技有限公司",2002-08-26,2019-03-22,"Private, ltd by shares"122,0811617,"O'DINA FASHION LIMITED
安蒂娜服裝有限公司",2002-08-26,2016-12-02,"Private, ltd by shares"123,0811724,"OASIS INTERNATIONAL COMPANY LIMITED
國瑞國際有限公司",2002-08-26,,"Private, ltd by shares"124,0811722,"ORIENT HOLIDAY LIMITED
東名假期有限公司",2002-08-26,2017-04-13,"Private, ltd by shares"125,0811762,"P. I. A. LIMITED
派雅工程有限公司",2002-08-26,2005-06-17,"Private, ltd by shares"126,0811612,"PCF CONSULTING LIMITED
柏斯富專業諮詢有限公司",2002-08-26,,"Private, ltd by shares"127,0811756,"PERFECT 2000 (ASIA) LIMITED
佰法2000(亞洲)有限公司",2002-08-26,2008-01-04,"Private, ltd by shares"128,0811641,"PERFECT CARE INDUSTRIAL LIMITED
南海市億亨塑膠製品有限公司",2002-08-26,2011-04-21,"Private, ltd by shares"129,0811642,"POP YOUNGER INTERNATIONAL COMPANY LIMITED
柏悅國際有限公司",2002-08-26,2004-05-28,"Private, ltd by shares"130,0811729,"PROPERTIES ENTERPRISE LIMITED (HK)
置業企業有限公司",2002-08-26,,"Private, ltd by shares"131,0811688,"QING FENG INTERNATIONAL INVESTMENT GROUP (HONG KONG) LIMITED (d2006-05-12)
慶豐國際投資集團(香港)有限公司",2002-08-26,2006-05-12,"Private, ltd by shares"132,0811761,"QUALIFIER E SERVICES LIMITED",2002-08-26,,"Private, ltd by shares"133,0811677,"RAILNET ENGINEERING COMPANY LIMITED (d2009-01-23)
鐵路網工程有限公司",2002-08-26,2009-01-23,"Private, ltd by shares"134,0811621,"REGALINK LOGISTICS DEVELOPMENT LIMITED
經緯物流發展有限公司",2002-08-26,2011-04-21,"Private, ltd by shares"135,0811741,"RENGO H.K. SHIPPING COMPANY LIMITED
連興香港船務有限公司",2002-08-26,2003-03-28,"Private, ltd by shares"136,0811698,"RICH &amp; FAMOUS FILM &amp; TV PRODUCTION LIMITED
紅館製造有限公司",2002-08-26,,"Private, ltd by shares"137,0811723,"RICH &amp; FAMOUS TALENT MANAGEMENT GROUP LIMITED
紅館藝人管理集團有限公司",2002-08-26,,"Private, ltd by shares"138,0811689,"RICH GIRL INDUSTRIAL LIMITED
雅豐時裳實業有限公司",2002-08-26,2010-01-22,"Private, ltd by shares"139,0811740,"RICHES GREEN LIMITED",2002-08-26,2018-02-15,"Private, ltd by shares"140,0811747,"RIVIERA INTERNATIONAL LIMITED (d2012-12-28)
香江有限公司",2002-08-26,2012-12-28,"Private, ltd by shares"141,0811726,"RONGPENG (CHINA) INDUSTRY COMPANY LIMITED
香港榮鵬(中國)實業有限公司",2002-08-26,2008-01-04,"Private, ltd by shares"142,0811737,"ROYAL BEST INDUSTRIES LIMITED
威盈實業有限公司",2002-08-26,,"Private, ltd by shares"143,0811752,"RUNYU INT'L GROUP LIMITED
潤宇國際集團有限公司",2002-08-26,2012-11-23,"Private, ltd by shares"144,0811720,"RXL INTERNATIONAL LIMITED (HK)
瑞和盛國際有限公司",2002-08-26,,"Private, ltd by shares"145,0811730,"SAN TEAMWORK LIMITED
三聯科技工作室有限公司",2002-08-26,2012-11-23,"Private, ltd by shares"146,0811768,"SENG FOOK JEWELLERY (HOLDINGS) COMPANY LIMITED
生福珠寶(控股)有限公司",2002-08-26,,"Private, ltd by shares"147,0811791,"SET INFORMATION TECHNOLOGY COMPANY LIMITED
成衣通資訊技術有限公司",2002-08-26,2010-02-19,"Private, ltd by shares"148,0811633,"SHINEWELL TECHNOLOGY (HONG KONG) COMPANY LIMITED
展耀科技(香港)有限公司",2002-08-26,,"Private, ltd by shares"149,0811714,"SINO ERA GROUP LIMITED
中華紀元集團有限公司",2002-08-26,,"Private, ltd by shares"150,0811627,"SKYLINE TECHNOLOGY ELECTRONICS CO. LIMITED
凱林科技電子有限公司",2002-08-26,2009-01-23,"Private, ltd by shares"151,0811758,"SMARTCOMM LIMITED
數碼通訊有限公司",2002-08-26,2004-01-09,"Private, ltd by shares"152,0811788,"SOFT TECHNOLOGY (HONG KONG) LIMITED
索菲特科技(香港)有限公司",2002-08-26,2005-05-13,"Private, ltd by shares"153,0811636,"SPACE SERVICES LIMITED",2002-08-26,,"Private, ltd by shares"154,0811790,"STAR ELEGANCE LIMITED
星仁有限公司",2002-08-26,2011-04-21,"Private, ltd by shares"155,0811789,"STARCO ENGINEERING LIMITED (d2008-01-04)
星港工程有限公司",2002-08-26,2008-01-04,"Private, ltd by shares"156,0811771,"STARTRON GROUP LIMITED",2002-08-26,2010-01-22,"Private, ltd by shares"157,0811751,"SUPER LEADING INTERNATIONAL LIMITED
超峰國際貿易有限公司",2002-08-26,,"Private, ltd by shares"158,0811695,"SUPER ONE INTERNATIONAL COMPANY LIMITED
速發旺有限公司",2002-08-26,2014-11-21,"Private, ltd by shares"159,0811618,"T.TEX (ENTERPRISES) LIMITED
東時(企業)有限公司",2002-08-26,2018-02-02,"Private, ltd by shares"160,0811635,"TACTER (CHINA) MANAGEMENT CONSULTING CO., LIMITED
天強(中國)管理顧問有限公司",2002-08-26,,"Private, ltd by shares"161,0811645,"TAI PING RIGID-FLEX CIRCUITS TECHNOLOGY COMPANY LIMITED
太平軟性電路科技有限公司",2002-08-26,2011-10-28,"Private, ltd by shares"162,0811686,"TAIWAN SNOW-RESOURCE INT'L BEAUTY GROUP (HK) LIMITED
臺灣雪源國際美容集團(香港)有限公司",2002-08-26,2008-01-04,"Private, ltd by shares"163,0811701,"TIMBER TRADING &amp; DEVELOPMENT LIMITED
木材貿易發展有限公司",2002-08-26,2019-09-13,"Private, ltd by shares"164,0811735,"TIME ORIENT INTERNATIONAL LIMITED
康逸國際有限公司",2002-08-26,2004-01-21,"Private, ltd by shares"165,0811655,"TIZIANO HONG KONG LIMITED
華意貿易有限公司",2002-08-26,2009-08-14,"Private, ltd by shares"166,0811643,"TML International Limited
利明國際有限公司",2002-08-26,,"Private, ltd by shares"167,0811713,"TONI ASIA COMPANY LIMITED
東研亞洲有限公司",2002-08-26,2005-09-30,"Private, ltd by shares"168,0811614,"TRIUMPH INTERNATIONAL GROUP CO., LIMITED
荃鋒國際集團有限公司",2002-08-26,,"Private, ltd by shares"169,0811644,"TRIUMPOW SHIPPING (H K) CO., LIMITED
天寶船務(香港)有限公司",2002-08-26,,"Private, ltd by shares"170,0811640,"UNCLE SAM'S RESTAURANT LIMITED
深仔記有限公司",2002-08-26,2008-01-04,"Private, ltd by shares"171,0811749,"UNION LEVELING COMPANY LIMITED
友聯平水有限公司",2002-08-26,,"Private, ltd by shares"172,0811717,"UNITED SINO INVESTMENT GROUPS (HONG KONG) LIMITED
中聯投資集團(香港)有限公司",2002-08-26,2010-01-22,"Private, ltd by shares"173,0811678,"VIDEOFONE COMPANY LIMITED",2002-08-26,,"Private, ltd by shares"174,0811624,"WEALTHY LEADING LIMITED
發聯有限公司",2002-08-26,2015-07-24,"Private, ltd by shares"175,0811784,"WELL START GROUP LIMITED
維斯達集團有限公司",2002-08-26,2006-12-08,"Private, ltd by shares"176,0811666,"WIMG POOL INTERNATIONAL (HONG KONG) INVESTMENT COMPANY LIMITED
榮泉國際(香港)投資有限公司",2002-08-26,2008-01-04,"Private, ltd by shares"177,0811710,"WORLD CHINESE WORSHIP TO THE EMPERORS YEN &amp; HUANG FUND ASSOCIATION LIMITED (THE)
世界華人朝拜聖祖炎黃二帝基金會有限公司",2002-08-26,2008-01-04,"Private, ltd by shares"178,0811676,"YAMA LIMITED (HK)",2002-08-26,,"Private, ltd by shares"179,0811662,"YOUTH CARE FOUNDATION LIMITED
青牧基金有限公司",2002-08-26,,"Ltd by guarantee"180,0811660,"YUE HUA COMPANY LIMITED",2002-08-26,2008-01-04,"Private, ltd by shares"181,0811700,"YUON KEE MARINE PRODUCTS LIMITED
鎔記水產有限公司",2002-08-26,,"Private, ltd by shares"