,Reg no.,Name,Incorp-orated,Dissolved,Type1,0040245,"AGRO-BIOCHEMICAL LABORATORIES LIMITED",1974-09-20,1991-08-30,"Private, ltd by shares"2,0040233,"CHANTING ENTERPRISES (H.K.) LIMITED",1974-09-20,2003-08-29,"Private, ltd by shares"3,0040229,"DON HELM LIMITED",1974-09-20,1990-04-27,"Private, ltd by shares"4,0040234,"EASTERN UNION SHIPPING FINANCE AND MANAGEMENT (HK) LIMITED",1974-09-20,1986-02-28,"Private, ltd by shares"5,0040211,"EMMANUEL APOSTOLIC CHURCH LIMITED
以馬內利使徒會有限公司",1974-09-20,,"Ltd by guarantee"6,0040251,"FAIRMONT CHINA DEVELOPMENT LIMITED
輝懋中國發展有限公司",1974-09-20,2001-07-27,"Private, ltd by shares"7,0040239,"FAR EAST CAMPHOR MANUFACTURING COMPANY LIMITED
遠東樟腦製品有限公司",1974-09-20,2007-03-30,"Private, ltd by shares"8,0040252,"FAVOR GARMENT FACTORY LIMITED
偉華製衣廠有限公司",1974-09-20,1980-11-07,"Private, ltd by shares"9,0040218,"FEN HIN CHON ENTERPRISE LIMITED
宏興庄企業有限公司",1974-09-20,2006-03-10,"Private, ltd by shares"10,0040209,"FIRSTON LIMITED",1974-09-20,1995-07-28,"Private, ltd by shares"11,0040236,"FOOD FAIR OVERSEAS LIMITED",1974-09-20,1995-07-28,"Private, ltd by shares"12,0040241,"FUFUNG ENTERPRISE COMPANY LIMITED
富豐企業有限公司",1974-09-20,1997-01-24,"Private, ltd by shares"13,0040235,"HIMSON CONSTRUCTION COMPANY LIMITED
謙順建築有限公司",1974-09-20,,"Private, ltd by shares"14,0040249,"INTERIOR FURNITURE COMPANY LIMITED (d1995-07-28)
室內傢俬有限公司",1974-09-20,1995-07-28,"Private, ltd by shares"15,0040223,"JAMBALA LIMITED",1974-09-20,1980-01-07,"Private, ltd by shares"16,0040243,"JURONG ENGINEERING WORKS (HK) LIMITED",1974-09-20,1981-03-27,"Private, ltd by shares"17,0040230,"KAM TAT SHING LIMITED",1974-09-20,1987-07-13,"Private, ltd by shares"18,0040250,"KIU KIN INVESTMENT COMPANY LIMITED
僑建置業有限公司",1974-09-20,1985-06-16,"Private, ltd by shares"19,0040226,"KONGSUNLAU HOLDINGS LIMITED (d1999-04-12)
港新(劉氏)集團有限公司",1974-09-20,1999-04-12,"Private, ltd by shares"20,0040217,"KOTAN SHIPPING &amp; INVESTMENT COMPANY, LIMITED
高登航業投資有限公司",1974-09-20,1995-07-28,"Private, ltd by shares"21,0040215,"KOWLOON BRANCH OF WORLDWIDE TSANG CLANSMEN ASSOCIATION LIMITED (THE)
世界曾氏宗親總會九龍分會有限公司",1974-09-20,,"Ltd by guarantee"22,0040220,"KWOK CHAI LIMITED",1974-09-20,1978-02-24,"Private, ltd by shares"23,0040248,"KYOSEI INTERNATIONAL (HONG KONG) LIMITED",1974-09-20,1982-02-17,"Private, ltd by shares"24,0040213,"LIPPO FINANCE LIMITED",1974-09-20,,"Private, ltd by shares"25,0040238,"LUNG CHU RESTAURANT LIMITED
龍珠酒樓有限公司",1974-09-20,2003-05-30,"Private, ltd by shares"26,0040228,"LUNG LING (H.K.) COMPANY LIMITED
龍嶺(香港)有限公司",1974-09-20,2001-10-19,"Private, ltd by shares"27,0040231,"M. H. K. TRADINY COMPANY LIMITED",1974-09-20,1982-10-29,"Private, ltd by shares"28,0040232,"METRO UNIT FURNITURE LIMITED
美羅組合傢具有限公司",1974-09-20,2003-08-15,"Private, ltd by shares"29,0040222,"METROPOLITAN WAREHOUSE LIMITED
京華貨倉有限公司",1974-09-20,1991-02-28,"Private, ltd by shares"30,0040240,"MID-EAST NOMINEES LIMITED",1974-09-20,2003-08-15,"Private, ltd by shares"31,0040219,"NEW OLYMPIA INTERNATIONAL COMPANY LIMITED",1974-09-20,1988-05-23,"Private, ltd by shares"32,0040214,"OPCO LIMITED (d2012-06-22)",1974-09-20,2012-06-22,"Private, ltd by shares"33,0040210,"PUN'S TRADING COMPANY (HONG KONG) LIMITED
潘氏貿易(香港)有限公司",1974-09-20,1997-10-22,"Private, ltd by shares"34,0040247,"SAMAG INTERNATIONAL LIMITED",1974-09-20,1978-04-28,"Private, ltd by shares"35,0040244,"SANKO KISEN (ASIA) LIMITED",1974-09-20,1991-12-04,"Private, ltd by shares"36,0040208,"SIGMA HOLDINGS LIMITED (d1995-12-29)",1974-09-20,1995-12-29,"Private, ltd by shares"37,0040227,"SUPREME IMPORT LIMITED
拔萃入口有限公司",1974-09-20,1991-08-09,"Private, ltd by shares"38,0040237,"TAN TAT CONSTRUCTION COMPANY LIMITED
騰達建築工程有限公司",1974-09-20,1982-11-26,"Private, ltd by shares"39,0040221,"TUNG HOI FINANCE COMPANY LIMITED
東海財務有限公司",1974-09-20,1996-01-26,"Private, ltd by shares"40,0040242,"W. &amp; T. - HK INTERNATIONAL DESIGN LIMITED",1974-09-20,,"Private, ltd by shares"41,0040212,"WELLGLOW ASSOCIATE COMPANY LIMITED",1974-09-20,2007-08-09,"Private, ltd by shares"42,0040225,"WING CHEONG TOYS INDUSTRIAL COMPANY LIMITED
永祥玩具實業有限公司",1974-09-20,1987-04-16,"Private, ltd by shares"43,0040253,"WINTER STORE LIMITED",1974-09-20,2002-08-11,"Private, ltd by shares"44,0040224,"WISEMAN SECRETARIAL AND MANAGEMENT SERVICES LIMITED
維敏秘書管理服務有限公司",1974-09-20,2019-10-12,"Private, ltd by shares"45,0040246,"WUN CHUNG COMPANY LIMITED
雲松有限公司",1974-09-20,1995-07-28,"Private, ltd by shares"46,0040216,"YUK HA BENEVOLENT SOCIETY LIMITED
玉霞善社有限公司",1974-09-20,,"Ltd by guarantee"