,Reg no.,Name,Incorp-orated,Dissolved,Type1,0667145,"A-BEAUTY HONG KONG LIMITED
欣美香港有限公司",1999-02-08,,"Private, ltd by shares"2,0667171,"A. TEAM TECHNOLOGY LIMITED",1999-02-08,2018-05-07,"Private, ltd by shares"3,0667099,"ALL GREEN (FAR EAST) ENTERPRISES LIMITED
全綠(遠東)實業有限公司",1999-02-08,2002-02-22,"Private, ltd by shares"4,0667110,"AMAZING PROJECT LIMITED",1999-02-08,,"Private, ltd by shares"5,0667103,"ASIA EXCELLENT LIMITED (d2003-12-24)
永順有限公司",1999-02-08,2003-12-24,"Private, ltd by shares"6,0667164,"ASIA SOLUTION CORPORATION LIMITED
亞洲科龍有限公司",1999-02-08,,"Private, ltd by shares"7,0667155,"BERYTOS INTERNATIONAL TRADING (HONG KONG) LIMITED
世爲國際貿易(香港)有限公司",1999-02-08,,"Private, ltd by shares"8,0667157,"BEST TIME ELECTRONICS (HK) LIMITED
時富電子(香港)有限公司",1999-02-08,2008-01-25,"Private, ltd by shares"9,0667132,"BILLION DRAGON ASIA LIMITED
億華亞洲有限公司",1999-02-08,2010-05-07,"Private, ltd by shares"10,0667133,"BILLION WINNER INDUSTRIAL LIMITED
億創實業有限公司",1999-02-08,,"Private, ltd by shares"11,0667094,"BODY TREASURE INTERNATIONAL LIMITED
寶健美國際有限公司",1999-02-08,2001-04-12,"Private, ltd by shares"12,0667167,"BRAVO TOYS LIMITED
栢宝玩具有限公司",1999-02-08,,"Private, ltd by shares"13,0667109,"CANYON CREST (H.K.) LIMITED
卓成商事有限公司",1999-02-08,2019-06-06,"Private, ltd by shares"14,0667148,"CASSIA OXYGEN HEALTH DEVELOPMENT LIMITED
卡斯亞氧健發展有限公司",1999-02-08,2001-01-12,"Private, ltd by shares"15,0667150,"CETAPHILL INTERNATIONAL LIMITED",1999-02-08,,"Private, ltd by shares"16,0667120,"CHAN TONG KEE ENGINEERING COMPANY LIMITED
陳棠記土木工程有限公司",1999-02-08,,"Private, ltd by shares"17,0667127,"CHINESE FASHION CULTURE SPEECH HOLDINGS CO. LIMITED
中華服飾文化傳播集團有限公司",1999-02-08,2005-02-04,"Private, ltd by shares"18,0667097,"DAILY FORTUNE TRANSPORTATION CO. LIMITED
溢運吊車服務有限公司",1999-02-08,2003-06-20,"Private, ltd by shares"19,0667162,"DATONG DEVELOPMENT (H.K.) LIMITED
達通發展(香港)有限公司",1999-02-08,2010-11-05,"Private, ltd by shares"20,0667115,"DOHOPE ARCHITECTURE DESIGN &amp; ENGINEERING LIMITED
香港德和建築設計事務所有限公司",1999-02-08,,"Private, ltd by shares"21,0667122,"DR. KONG FOOTCARE LIMITED",1999-02-08,,"Private, ltd by shares"22,0667139,"E2000 COMPUTER ASSOCIATES LIMITED
世紀電腦科技有限公司",1999-02-08,2003-12-05,"Private, ltd by shares"23,0667118,"EVERGREEN PHARMACEUTICAL HONG KONG LIMITED
香港青春制葯廠有限公司",1999-02-08,2005-12-09,"Private, ltd by shares"24,0667119,"EXPO ENTERPRISES LIMITED (d2008-08-01)
億寶貿易(香港)有限公司",1999-02-08,2008-08-01,"Private, ltd by shares"25,0667158,"GLOBETRADE LIMITED (d2015-10-09)
盈康科技有限公司",1999-02-08,2015-10-09,"Private, ltd by shares"26,0667134,"GLORY TREASURE LIMITED (b1999-02-08)
億至有限公司",1999-02-08,2018-07-20,"Private, ltd by shares"27,0667117,"GOLD SMART LIMITED (d2010-02-12)
駿新有限公司",1999-02-08,2010-02-12,"Private, ltd by shares"28,0667112,"GOLD VALLEY SYSTEM CO., LIMITED
金谷系統有限公司",1999-02-08,2005-02-08,"Private, ltd by shares"29,0667116,"GOODWILL CORPORATION LIMITED (d2000-12-15)
志昇有限公司",1999-02-08,2000-12-15,"Private, ltd by shares"30,0667163,"GOODWILL INTERNATIONAL APPAREL LIMITED
譽豐(國際)有限公司",1999-02-08,2002-12-27,"Private, ltd by shares"31,0667135,"GRAND HILL WORKS LIMITED
峰泰工程有限公司",1999-02-08,2005-07-08,"Private, ltd by shares"32,0667096,"HON HANG INTERNATIONAL DEVELOPMENT COMPANY LIMITED
漢恒國際發展有限公司",1999-02-08,2007-06-22,"Private, ltd by shares"33,0667144,"HONG KONG &amp; KOWLOON WELFARE OF THE ELDERS CENTRE LIMITED
港九老人福利中心有限公司",1999-02-08,2004-03-23,"Ltd by guarantee"34,0667147,"HONG KONG INSTITUTE OF MANAGEMENT ACCOUNTANTS LIMITED
香港管理會計師協會有限公司",1999-02-08,2000-12-08,"Private, ltd by shares"35,0667143,"HONG KONG REGISTERED VENTILATION CONTRACTORS ASSOCIATION LIMITED
香港註冊通風系統承建商協會有限公司",1999-02-08,,"Ltd by guarantee"36,0667113,"INVESTIA ENTERPRISES LIMITED",1999-02-08,2012-11-16,"Private, ltd by shares"37,0667098,"JHONAN (HONG KONG) ELECTRONIC COMPANY LIMITED
城南(香港)電子有限公司",1999-02-08,2003-01-24,"Private, ltd by shares"38,0667159,"KAISER INTERNATIONAL HOLDINGS HK LIMITED
凱撒國際集團香港有限公司",1999-02-08,,"Private, ltd by shares"39,0667154,"KEUNG KEE CHICKEN &amp; DUCK WHOLESALE COMPANY LIMITED
強記鷄鴨批發有限公司",1999-02-08,,"Private, ltd by shares"40,0667153,"LANMARK LIMITED (HK)
利致有限公司",1999-02-08,,"Private, ltd by shares"41,0667136,"LEADER FORTUNE INDUSTRIAL LIMITED
立福實業有限公司",1999-02-08,2005-02-04,"Private, ltd by shares"42,0667107,"LEE HONG DISPENSARY SUPERSTORE COMPANY LIMITED
利康中西藥房有限公司",1999-02-08,,"Private, ltd by shares"43,0667142,"MAN YEE WAN RECREATIONAL CENTRE LIMITED
萬宜灣村文娛康樂中心有限公司",1999-02-08,,"Ltd by guarantee"44,0667114,"MAXIM INTEGRATED PRODUCTS ASIA LIMITED
美信集成產品亞洲有限公司",1999-02-08,,"Private, ltd by shares"45,0667161,"NCSI (HK) LIMITED",1999-02-08,,"Private, ltd by shares"46,0667140,"OXWICH TRADING (HONG KONG) COMPANY LIMITED
豪軒貿易(香港)有限公司",1999-02-08,2012-02-03,"Private, ltd by shares"47,0667092,"OZTEL LIMITED
澳訊通有限公司",1999-02-08,,"Private, ltd by shares"48,0667106,"PACIFIC RISE HOLDINGS LIMITED
粵高集團有限公司",1999-02-08,,"Private, ltd by shares"49,0667137,"PROFIT MADE HOLDINGS LIMITED
進億集團有限公司",1999-02-08,2002-01-11,"Private, ltd by shares"50,0667160,"REGAL FAITH ENTERPRISES LIMITED
譽卓企業有限公司",1999-02-08,,"Private, ltd by shares"51,0667156,"S A I HONG KONG LIMITED",1999-02-08,2015-09-04,"Private, ltd by shares"52,0667095,"SEJIN INTERNATIONAL LIMITED
世進洋行有限公司",1999-02-08,2015-08-07,"Private, ltd by shares"53,0667123,"SHARP CAPITAL INVESTMENTS LIMITED
銳城投資有限公司",1999-02-08,,"Private, ltd by shares"54,0667126,"SHUN TAK (COMPREHENSIVE) ADVERTISING LIMITED
迅德(綜合)廣告有限公司",1999-02-08,,"Private, ltd by shares"55,0667172,"SIGMA-CHINA (H.K.) LIMITED
熙瑪-中國(香港)有限公司",1999-02-08,2006-06-16,"Private, ltd by shares"56,0667168,"SINOMARK ENGINEERING LIMITED
輝寶工程有限公司",1999-02-08,2010-11-05,"Private, ltd by shares"57,0667169,"SINOWILL INTERNATIONAL ENTERPRISE LIMITED
華鴻國際企業有限公司",1999-02-08,2001-12-28,"Private, ltd by shares"58,0667166,"SKYLINK INVESTMENT HOLDINGS INTERNATIONAL CO. LIMITED
天爵投資集團國際有限公司",1999-02-08,2005-02-04,"Private, ltd by shares"59,0667128,"SMART WEALTH INTERNATIONAL DEVELOPMENT LIMITED (d2018-02-02)
兆富國際發展有限公司",1999-02-08,2018-02-02,"Private, ltd by shares"60,0667129,"SMART WEALTH INTERNATIONAL ENTERPRISE LIMITED (d2005-08-12)
兆富國際企業有限公司",1999-02-08,2005-08-12,"Private, ltd by shares"61,0667152,"SMART YEAR LIMITED
晉年有限公司",1999-02-08,,"Private, ltd by shares"62,0667100,"SPEED ASIA LIMITED
豪駿有限公司",1999-02-08,2009-10-29,"Private, ltd by shares"63,0667141,"STRUCTURAL TRAINING LIMITED
棟樑培訓有限公司",1999-02-08,,"Private, ltd by shares"64,0667121,"SUPERIOR PULP MOULD LIMITED
長城環保包裝有限公司",1999-02-08,,"Private, ltd by shares"65,0667111,"TEAMPOWER (H.K.) LIMITED
天力(香港)有限公司",1999-02-08,,"Private, ltd by shares"66,0667165,"TIANDIH (HONG KONG) GARMENT COMPANY LIMITED
天地和(香港)製衣有限公司",1999-02-08,2001-07-13,"Private, ltd by shares"67,0667151,"TONG'S INDUSTRIAL (H.K.) LIMITED
湯氏實業(香港)有限公司",1999-02-08,2002-10-25,"Private, ltd by shares"68,0667104,"TOP BILLION (H.K.) LIMITED
隆萬(香港)有限公司",1999-02-08,2005-02-04,"Private, ltd by shares"69,0667101,"TOP PIONEER LIMITED
順港有限公司",1999-02-08,,"Private, ltd by shares"70,0667093,"TRANSASIA CORPORATION LIMITED
昶威企業有限公司",1999-02-08,2002-12-27,"Private, ltd by shares"71,0667124,"UNI-PAC PROPERTY CONSULTANTS (INV.) LIMITED
華置行物業顧問(投資)有限公司",1999-02-08,2010-07-02,"Private, ltd by shares"72,0667125,"UNI-PAC PROPERTY MANAGEMENT LIMITED
華置行物業管理有限公司",1999-02-08,2010-07-02,"Private, ltd by shares"73,0667105,"UNION CAPITAL (H.K.) LIMITED
萬宇(香港)有限公司",1999-02-08,,"Private, ltd by shares"74,0667146,"VICTORIA TRADING (HONG KONG) LIMITED",1999-02-08,2008-06-20,"Private, ltd by shares"75,0667108,"VRNET (HK) LIMITED
維亞科技有限公司",1999-02-08,2002-09-27,"Private, ltd by shares"76,0667130,"WEALTH HOPE INTERNATIONAL DEVELOPMENT LIMITED
華鴻國際發展有限公司",1999-02-08,2002-07-05,"Private, ltd by shares"77,0667102,"WORLD PIONEER LIMITED
國際鵬亞有限公司",1999-02-08,,"Private, ltd by shares"78,0667170,"XING YUN INTERNATIONAL LIMITED
星韵國際有限公司",1999-02-08,2004-02-27,"Private, ltd by shares"79,0667149,"YAU LUEN HONG KONG LIMITED
友聯香港有限公司",1999-02-08,2018-04-13,"Private, ltd by shares"80,0667138,"YUE XIANG FREIGHT AGENCY COMPANY LIMITED
粵翔貨運代理有限公司",1999-02-08,2006-11-20,"Private, ltd by shares"81,0667131,"ZILLION PROFIT INDUSTRIAL LIMITED
進億實業有限公司",1999-02-08,,"Private, ltd by shares"