,Reg no.,Name,Incorp-orated,Dissolved,Type1,1037426,"1S INTERNATIONAL LIMITED
奕思國際有限公司",2006-04-11,2009-02-20,"Private, ltd by shares"2,1037404,"332 LIMITED
332有限公司",2006-04-11,,"Private, ltd by shares"3,1037580,"A &amp; S TRADING (HONG KONG) LIMITED",2006-04-11,,"Private, ltd by shares"4,1037634,"AA SOLAR CO., LIMITED",2006-04-11,2013-06-21,"Private, ltd by shares"5,1037615,"ABALONE TRADING LIMITED
鮑魚貿易有限公司",2006-04-11,2016-12-02,"Private, ltd by shares"6,1037604,"AC GLORY MARKETING COMPANY LIMITED",2006-04-11,,"Private, ltd by shares"7,1037573,"ACCURATE MACHINERY COMPANY LIMITED
精準機械有限公司",2006-04-11,,"Private, ltd by shares"8,1037369,"ADD TONE HOLDINGS LIMITED
加通集團有限公司",2006-04-11,,"Private, ltd by shares"9,1037422,"ALL TEAM INVESTMENT (GROUP) LIMITED
恒天投資(集團)有限公司",2006-04-11,2015-06-05,"Private, ltd by shares"10,1037543,"ALLFAVOR CIRCUITS (HONGKONG) LIMITED
艾飛彥電路(香港)有限公司",2006-04-11,2017-06-09,"Private, ltd by shares"11,1037665,"Alliance Moulds (HK) Limited
聯進模具(香港)有限公司",2006-04-11,,"Private, ltd by shares"12,1037485,"ALPHA BEST HONG KONG GROUP LIMITED
順佳香港集團有限公司",2006-04-11,2017-09-22,"Private, ltd by shares"13,1037581,"AMGIN LIMITED
亞夢仁有限公司",2006-04-11,,"Private, ltd by shares"14,1037569,"ANRUI ELECTRONICS TECHNOLOGY CO., LIMITED
安瑞電子科技有限公司",2006-04-11,,"Private, ltd by shares"15,1037617,"AREA-REVO H.K. LIMITED",2006-04-11,2010-10-15,"Private, ltd by shares"16,1037646,"ARTOO (ASIA) CO., LIMITED
歐圖(亞洲)有限公司",2006-04-11,2015-12-24,"Private, ltd by shares"17,1037578,"ASIA CONNECTION TRADE LIMITED",2006-04-11,,"Private, ltd by shares"18,1037475,"ASIA RECYCLING LIMITED
亞洲原料回收有限公司",2006-04-11,2012-05-11,"Private, ltd by shares"19,1037574,"ASIA SUNRAI FOODS (HK) LIMITED
山亞食品(香港)有限公司",2006-04-11,2018-10-05,"Private, ltd by shares"20,1037546,"Atlas Hong Kong Limited",2006-04-11,,"Private, ltd by shares"21,1037547,"BBTEX LIMITED",2006-04-11,2012-05-11,"Private, ltd by shares"22,1037372,"BEAUTY CONCEPT HOLDINGS LIMITED
美建集團有限公司",2006-04-11,2008-07-18,"Private, ltd by shares"23,1037397,"BEDFORD INTERNATIONAL FINANCE GROUP (CHINA) LIMITED (d2010-12-03)
百福國際金融集團(中國)有限公司",2006-04-11,2010-12-03,"Private, ltd by shares"24,1037409,"BEST HONOR INVESTMENT DEVELOPMENT LIMITED
佳信投資發展有限公司",2006-04-11,2007-06-15,"Private, ltd by shares"25,1037417,"BESTWIN INVESTMENT (GROUP) LIMITED
佳達投資(集團)有限公司",2006-04-11,2010-12-03,"Private, ltd by shares"26,1037596,"BOLINA ITALIANA INTERNATIONAL HOLDINGS LIMITED
意大利航標國際控股有限公司",2006-04-11,2011-10-07,"Private, ltd by shares"27,1037521,"BOYER ALLAN INVESTMENT MANAGEMENT (HONG KONG) LIMITED",2006-04-11,2013-12-09,"Private, ltd by shares"28,1037464,"BRITAIN JOYKING PIPE INT'L GROUP LIMITED
英國爵鼎煙斗國際集團有限公司",2006-04-11,2010-10-08,"Private, ltd by shares"29,1037593,"BROMAR MARITIME CO., LIMITED
博馬航運有限公司",2006-04-11,2009-01-16,"Private, ltd by shares"30,1037411,"CHAMPION INTERNATIONAL INDUSTRIAL LIMITED
長盛國際實業有限公司",2006-04-11,2012-01-13,"Private, ltd by shares"31,1037364,"CHARMING HARVEST LIMITED
盈豐順有限公司",2006-04-11,2012-05-11,"Private, ltd by shares"32,1037585,"CHEERWIN (HONG KONG) INTERNATIONAL CO., LIMITED
旗雲(香港)國際有限公司",2006-04-11,2013-09-06,"Private, ltd by shares"33,1037583,"CHEMCORP INTERNATIONAL LIMITED",2006-04-11,,"Private, ltd by shares"34,1037433,"CHILINK HK CORPORATION LIMITED
采靈香港有限公司",2006-04-11,2008-12-24,"Private, ltd by shares"35,1037465,"CHINA GANGTONG AVIATION GROUP STOCK LIMITED
中國港通航空集團股份有限公司",2006-04-11,2010-12-03,"Private, ltd by shares"36,1037468,"CHINA GANGTONG AVIATION HUMAN RESOURCE SERVICE LIMITED
中國港通航空人力資源服務有限公司",2006-04-11,2010-12-03,"Private, ltd by shares"37,1037386,"China Resources &amp; Investment Vehicle Limited
鼎元(中國)投資有限公司",2006-04-11,,"Private, ltd by shares"38,1037471,"CHINA-EUROPE COOPERATION DEVELOPMENT CO. LIMITED
中歐發展有限公司",2006-04-11,,"Private, ltd by shares"39,1037384,"CHINESE CULTURE AND ART DEVELOPMENT CENTRE LIMITED
中國文化藝術發展中心有限公司",2006-04-11,,"Private, ltd by shares"40,1037676,"CHUN ON SCAFFOLDING COMPANY LIMITED
駿安棚業有限公司",2006-04-11,,"Private, ltd by shares"41,1037645,"CINKIN INTERNATIONAL CO., LIMITED
創想國際有限公司",2006-04-11,,"Private, ltd by shares"42,1037611,"COOL BRIGHT LIMITED
皓輝有限公司",2006-04-11,2017-11-10,"Private, ltd by shares"43,1037495,"COOTAG LIMITED
滙標科技有限公司",2006-04-11,2011-04-15,"Private, ltd by shares"44,1037549,"CREATIVE FURNITURE SOURCING LIMITED",2006-04-11,,"Private, ltd by shares"45,1037380,"Crossroads Education Group Limited",2006-04-11,,"Private, ltd by shares"46,1037414,"CST CO., LIMITED
香港拓邁科技有限公司",2006-04-11,,"Private, ltd by shares"47,1037668,"DAILY WILLING TRADING DEVELOPMENT LIMITED
德立威林貿易發展有限公司",2006-04-11,2011-11-25,"Private, ltd by shares"48,1037660,"DAWN SUN INTERNATIONAL LIMITED (d2008-11-07)
迪聖國際貿易有限公司",2006-04-11,2008-11-07,"Private, ltd by shares"49,1037681,"DESIGNTECH INDUSTRIAL CO., LIMITED
偉德工業有限公司",2006-04-11,,"Private, ltd by shares"50,1037570,"E.SION ELECTRONICS S&amp;T (H.K.) COMPANY LIMITED
盈信電子科技(香港)有限公司",2006-04-11,,"Private, ltd by shares"51,1037667,"EAST WIND PRODUCTS LIMITED
東榮產品有限公司",2006-04-11,,"Private, ltd by shares"52,1037477,"EASTWAY HONG KONG INVESTMENT LIMITED
東威香港投資有限公司",2006-04-11,2014-08-15,"Private, ltd by shares"53,1037554,"ELECTRONICS TECHNOLOGY LIMITED
嘉潤達科技有限公司",2006-04-11,2016-10-07,"Private, ltd by shares"54,1037630,"ENTERPRISES (INTERNATIONAL) LIMITED
企業(國際)有限公司",2006-04-11,,"Private, ltd by shares"55,1037616,"EOCM International Enterprise Limited
美泰國際企業有限公司",2006-04-11,2018-06-26,"Private, ltd by shares"56,1037467,"EURO CHINA LEGAL LIMITED",2006-04-11,2012-09-21,"Private, ltd by shares"57,1037517,"EUYOMA INTERNATIONAL CO., LIMITED
蘊攸國際有限公司",2006-04-11,,"Private, ltd by shares"58,1037557,"EVEREST INTERNATIONAL INC. LIMITED
立鼎企業有限公司",2006-04-11,2016-12-02,"Private, ltd by shares"59,1037482,"EVERTECH HONG KONG GROUP LIMITED (d2009-03-06)
恒達香港集團有限公司",2006-04-11,2009-03-06,"Private, ltd by shares"60,1037480,"EVERWIN HONG KONG GROUP LIMITED (d2007-10-12)
永滙香港集團有限公司",2006-04-11,2007-10-12,"Private, ltd by shares"61,1037421,"EXCELLENT INVESTMENT (GROUP) LIMITED
卓悅投資(集團)有限公司",2006-04-11,,"Private, ltd by shares"62,1037550,"EXIM RAJATHI (HONGKONG) LIMITED",2006-04-11,2009-09-11,"Private, ltd by shares"63,1037368,"FAITH WIDE INVESTMENT GROUP (HK) LIMITED
誠新投資集團有限公司",2006-04-11,2010-12-03,"Private, ltd by shares"64,1037496,"FAST TAT INDUSTRIAL LIMITED
快達實業有限公司",2006-04-11,2011-06-17,"Private, ltd by shares"65,1037656,"FEFANS INTERNATIONAL (GREATER CHINA) LIMITED
斐梵國際(大中華)有限公司",2006-04-11,2015-12-04,"Private, ltd by shares"66,1037626,"FEMINA LACE INTERNATIONAL (HONG KONG) CO. LIMITED
菲美娜蕾絲國際股份有限公司",2006-04-11,2018-02-02,"Private, ltd by shares"67,1037653,"FHL INVESTMENTS LIMITED
豐熙隆投資有限公司",2006-04-11,,"Private, ltd by shares"68,1037406,"FIDELITY INVESTMENT (GROUP) LIMITED
順利投資(集團)有限公司",2006-04-11,,"Private, ltd by shares"69,1037507,"FORM GLASS ENGINEERING LIMITED
方格玻璃工程有限公司",2006-04-11,2012-05-11,"Private, ltd by shares"70,1037478,"FORTUNE HONG KONG INVESTMENT LIMITED
萬利香港投資有限公司",2006-04-11,,"Private, ltd by shares"71,1037598,"FOU YOU (HONG KONG) REAL ESTATE CONSULTING COMPANY LIMITED
富鈺(香港)置業咨詢策劃有限公司",2006-04-11,2010-01-22,"Private, ltd by shares"72,1037556,"FRANCE LONWAY TECHNOLOGY DEVELOPMENT LIMITED
法國朗萬科技發展有限公司",2006-04-11,2010-07-23,"Private, ltd by shares"73,1037390,"FRANCE REGGIE KADI (HK) FASHION INTERNATIONAL INVEST LIMITED
法國雷吉凱帝(香港)服飾國際投資有限公司",2006-04-11,,"Private, ltd by shares"74,1037591,"FUDA STONE CO., LIMITED (d2009-08-07)
福達石材有限公司",2006-04-11,2009-08-07,"Private, ltd by shares"75,1037540,"FUQUAN OLYMPIC SCHOOL LIMITED
福泉奧林匹克學校有限公司",2006-04-11,,"Private, ltd by shares"76,1037456,"FURAMA LIMITED (d2007-09-21)
富臨門有限公司",2006-04-11,2007-09-21,"Private, ltd by shares"77,1037566,"FUTURE ELECTRONICS INTERNATIONAL (HONGKONG) CO., LIMITED
富邦電子國際(香港)有限公司",2006-04-11,2019-11-29,"Private, ltd by shares"78,1037666,"GEI LIMITED (d2011-09-23)
環球英杰(國際)有限公司",2006-04-11,2011-09-23,"Private, ltd by shares"79,1037407,"GERMANY XBW ELECTRIC LIMITED
德國小霸王電氣有限公司",2006-04-11,2014-08-15,"Private, ltd by shares"80,1037649,"GLAK LIMITED (d2010-10-29)
陞暉中國有限公司",2006-04-11,2010-10-29,"Private, ltd by shares"81,1037379,"GLOBAL HEDGE TRADING (HK) LIMITED
高和金融集團(香港)有限公司",2006-04-11,2010-10-08,"Private, ltd by shares"82,1037466,"GLOBUS WINE COMPANY LIMITED",2006-04-11,,"Private, ltd by shares"83,1037613,"GOLDEN FAMILY LIMITED (HK)
金威望有限公司",2006-04-11,,"Private, ltd by shares"84,1037544,"GOLDEN GULF RESOURCES DEVELOPMENT CO., LIMITED
金海灣能源開發有限公司",2006-04-11,2007-06-22,"Private, ltd by shares"85,1037632,"GOLDEN HAWK INDUSTRIAL LIMITED (d2008-06-06)
金鷹實業有限公司",2006-04-11,2008-06-06,"Private, ltd by shares"86,1037423,"GOOD WISHES LIMITED
好望有限公司",2006-04-11,,"Private, ltd by shares"87,1037518,"GOWIN IMAGING EQUIPMENT LIMITED
高勝影像器材有限公司",2006-04-11,2014-08-15,"Private, ltd by shares"88,1037381,"GREENLINK (HK) LIMITED
茂成(香港)有限公司",2006-04-11,2012-05-11,"Private, ltd by shares"89,1037487,"H.K HAICHENG TRADE INDUSTRY CO., LIMITED
香港海誠貿易實業有限公司",2006-04-11,2013-06-21,"Private, ltd by shares"90,1037671,"H.K HUAGE INT'L GROUP FOOD LIMITED
香港華哥國際集團食品有限公司",2006-04-11,2010-12-03,"Private, ltd by shares"91,1037401,"H.K MADAWEI INT'L BREWING RESEARCH CENTER LIMITED
香港馬大味國際釀造研究中心有限公司",2006-04-11,2010-12-03,"Private, ltd by shares"92,1037394,"H.K SONGXIA GROUP SOLAR ENERGY TECHNOLOGY LIMITED
1037394香港集團太陽能科技有限公司",2006-04-11,2011-08-12,"Private, ltd by shares"93,1037438,"H.K. YILISHA FURNITURE GROUP LIMITED
香港伊麗莎家具集團有限公司",2006-04-11,2010-12-03,"Private, ltd by shares"94,1037439,"HALLELUJAH EMILLY CHARITIES (HONG KONG) LIMITED
哈利路亞愛美麗福祉會(香港)有限公司",2006-04-11,2013-09-06,"Ltd by guarantee"95,1037526,"HAMCO GROUP HONG KONG LIMITED
漢高集團香港有限公司",2006-04-11,2015-12-04,"Private, ltd by shares"96,1037490,"HAMDANI GROUP CO., LIMITED",2006-04-11,2012-05-11,"Private, ltd by shares"97,1037391,"HENDERSON HONG KONG INVESTMENT LIMITED
恒發香港投資有限公司",2006-04-11,,"Private, ltd by shares"98,1037633,"HENGSENWEI INTERNATIONAL (HK) LIMITED
恒森微國際(香港)有限公司",2006-04-11,2018-08-31,"Private, ltd by shares"99,1037506,"HIGHLAND BEE FARM (HONG KONG) COMPANY LIMITED
金三角蜂園(香港)有限公司",2006-04-11,,"Private, ltd by shares"100,1037662,"HING YIP TRADING DEVELOPMENT LIMITED
興業貿易發展有限公司",2006-04-11,,"Private, ltd by shares"101,1037664,"HINTCO HOLDING LIMITED
顯豪控股有限公司",2006-04-11,2020-10-16,"Private, ltd by shares"102,1037675,"HK DAPENG ELECTRON INT'L INDUSTRY LIMITED
香港大鵬電子國際實業有限公司",2006-04-11,,"Private, ltd by shares"103,1037600,"HK HOUSEWARE SUPPLY LIMITED",2006-04-11,,"Private, ltd by shares"104,1037592,"HK KD ELECTRONICS CO., LIMITED
香港凱達電子有限公司",2006-04-11,2015-11-13,"Private, ltd by shares"105,1037636,"HK LIANG JIA JIA INT'L SHOES DRESS LIMITED
香港靚家佳國際鞋服有限公司",2006-04-11,2010-12-03,"Private, ltd by shares"106,1037532,"HK MYDOO INT'L FASHION CULTURAL COMMUNICATION LIMITED
香港麥多國際時尚文化傳播有限公司",2006-04-11,2010-12-03,"Private, ltd by shares"107,1037387,"HK SHUANGTONG INDUSTRY (GROUP) LIMITED
香港雙同實業(集團)有限公司",2006-04-11,2013-06-21,"Private, ltd by shares"108,1037382,"HOI YAN DEVELOPMENT COMPANY LIMITED
凱茵發展有限公司",2006-04-11,2009-09-04,"Private, ltd by shares"109,1037488,"HOME STYLE - PRODUCTS LIMITED",2006-04-11,,"Private, ltd by shares"110,1037385,"HOMELAND FURNITURE INTERNATIONAL LIMITED
華夏國際股份有限公司",2006-04-11,2012-05-11,"Private, ltd by shares"111,1037443,"Homey Trading Limited
幸明貿易有限公司",2006-04-11,2009-10-02,"Private, ltd by shares"112,1037444,"HONG KONG AUTOSTRONG TECHNOLOGY CO., LIMITED
香港奧德賽創科技有限公司",2006-04-11,,"Private, ltd by shares"113,1037678,"HONG KONG BOREN ENTERPRISE COMPANY LIMITED
香港帛人企業有限公司",2006-04-11,,"Private, ltd by shares"114,1037652,"Hong Kong Business Gain Company Limited
香港商務拓展有限公司",2006-04-11,,"Private, ltd by shares"115,1037663,"HONG KONG CHANG XIANG GROUP (INTERNATIONAL) HOLDINGS LIMITED
香港暢想集團(國際)控股有限公司",2006-04-11,,"Private, ltd by shares"116,1037515,"HONG KONG DATIAN W LOGISTICS COMPANY LIMITED
香港大田物流有限公司",2006-04-11,,"Private, ltd by shares"117,1037463,"HONG KONG ELITE INT'L HOLDINGS LIMITED
香港愛立特國際股份有限公司",2006-04-11,2010-12-03,"Private, ltd by shares"118,1037371,"HONG KONG ELTON TECHNOLOGY LIMITED
香港歐德龍科技有限公司",2006-04-11,2017-05-19,"Private, ltd by shares"119,1037473,"HONG KONG GOLDEN-WORLD FURNITURE LIMITED
香港沃爾金德家具有限公司",2006-04-11,2010-12-03,"Private, ltd by shares"120,1037625,"HONG KONG GRACE TEAM INT'L INDUSTRIAL LIMITED
香港嘉聯國際實業有限公司",2006-04-11,2010-11-19,"Private, ltd by shares"121,1037575,"HONG KONG HAPPY CULTURE HOLDING LIMITED
香港喜文化控股有限公司",2006-04-11,2010-12-03,"Private, ltd by shares"122,1037548,"HONG KONG HARB INTERNATIONAL COLLEGE OF COMMERCE LIMITED
香港哈博國際商學院有限公司",2006-04-11,2007-11-02,"Private, ltd by shares"123,1037516,"HONG KONG HOI NANG INTERNATIONAL GROUP LIMITED
香港海能國際集團有限公司",2006-04-11,2016-04-01,"Private, ltd by shares"124,1037452,"HONG KONG KAIL INVESTMENT LIMITED
香港凱爾投資有限公司",2006-04-11,,"Private, ltd by shares"125,1037530,"HONG KONG LIDA ELECTRONICS LIMITED
香港利達電子有限公司",2006-04-11,2012-05-11,"Private, ltd by shares"126,1037648,"HONG KONG SHANGSHAN SAKURA ELECTRONIC TECHNOLOGY LIMITED
香港上山櫻花電子科技有限公司",2006-04-11,2010-12-03,"Private, ltd by shares"127,1037479,"HONG KONG SHENGYALO (INT'L) FASHION LIMITED
香港聖雅露(國際)時裝有限公司",2006-04-11,2010-12-03,"Private, ltd by shares"128,1037541,"HONG KONG STAR CHANNEL DEVELOPMENT LIMITED
香港星祥發展有限公司",2006-04-11,,"Private, ltd by shares"129,1037374,"HONG KONG XINCHENG TRADING CO., LIMITED
香港鑫成貿易有限公司",2006-04-11,2015-12-04,"Private, ltd by shares"130,1037472,"HONG KONG YIFEI AUTOMATION CONTROLLING SYSTEM CO., LIMITED
香港易飛自動化控制系統有限公司",2006-04-11,2012-09-28,"Private, ltd by shares"131,1037551,"HONG KONG YUNDE AUTO TRANSPORT GROUP COMPANY LIMITED
香港運德汽車運輸集團有限公司",2006-04-11,,"Private, ltd by shares"132,1037647,"HONG KONG ZHONG FU PETROLEUM EQUIPMENT LIMITED
香港中孚石油設備有限公司",2006-04-11,2011-07-29,"Private, ltd by shares"133,1037534,"HONGKONG (INTERNATIONAL) BAICAOTING MEDICINE CO., LIMITED
香港(國際)百草廳藥業有限公司",2006-04-11,2012-05-11,"Private, ltd by shares"134,1037588,"HONGKONG ALFA MANUFACTURING CO., LIMITED
香港阿爾法制造有限公司",2006-04-11,,"Private, ltd by shares"135,1037655,"HONGKONG FERRARI INTERNATIONAL GROUP CO., LIMITED
香港法拉利國際集團有限公司",2006-04-11,2012-05-11,"Private, ltd by shares"136,1037672,"HONGKONG HAORUI INT'L TRADING COMPANY LIMITED
香港浩瑞國際貿易有限公司",2006-04-11,,"Private, ltd by shares"137,1037388,"HONGKONG HENGMAO YISHI INDUSTRY LIMITED
香港恒茂藝飾實業有限公司",2006-04-11,,"Private, ltd by shares"138,1037563,"HONGKONG HOME FASHION CORP. LIMITED
香港錦藝家國際貿易有限公司",2006-04-11,2011-07-08,"Private, ltd by shares"139,1037469,"HONGKONG HUAFENG (INTERNATIONAL) ELECTRICAL CO., LIMITED
香港華峰(國際)照明電器有限公司",2006-04-11,2015-06-05,"Private, ltd by shares"140,1037658,"HONGKONG HUANXING INDUSTRIAL CO., LIMITED
香港環興實業有限公司",2006-04-11,2018-09-14,"Private, ltd by shares"141,1037628,"HONGKONG JUNLONG INTERNATIONAL LIMITED
香港君隆國際有限公司",2006-04-11,2016-12-02,"Private, ltd by shares"142,1037631,"HONGKONG KAIER TECHNOLOGY CO., LIMITED
香港凱爾科技有限公司",2006-04-11,,"Private, ltd by shares"143,1037524,"HONGKONG SHENGTANG INFORMATION SERVICE CO., LIMITED
香港盛唐信息服務有限公司",2006-04-11,2008-11-28,"Private, ltd by shares"144,1037429,"HONGKONG SHRINKTECH CO., LIMITED",2006-04-11,2017-11-17,"Private, ltd by shares"145,1037641,"HONGKONG YISHENGDA INTERNATIONAL UNDERWEAR LIMITED
香港益盛達國際內衣有限公司",2006-04-11,2019-04-04,"Private, ltd by shares"146,1037619,"HUAKE ELECTRONIC TECHNOLOGY LIMITED
華科電子科技有限公司",2006-04-11,,"Private, ltd by shares"147,1037436,"HUIDA (HK) BOXES DEVELOP LIMITED
滙達(香港)箱包發展有限公司",2006-04-11,2010-10-08,"Private, ltd by shares"148,1037673,"HUNG KEI LIMITED
鴻其有限公司",2006-04-11,2010-12-03,"Private, ltd by shares"149,1037494,"HWADA INTERNATIONAL COMPANY LIMITED
華大興業有限公司",2006-04-11,,"Private, ltd by shares"150,1037679,"IATOPIA GROUP LIMITED
科貫全球集團有限公司",2006-04-11,2010-08-10,"Private, ltd by shares"151,1037586,"ICRIS:1037586 (no English name)
韓尚秀國際集團(香港)有限公司",2006-04-11,2012-05-11,"Private, ltd by shares"152,1037503,"IMAGION PRODUCT LIMITED
想起有限公司",2006-04-11,,"Private, ltd by shares"153,1037431,"INTERNATIONAL ASSOCIATION OF CFOs AND CORPORATE TREASURERS (CHINA) LIMITED
國際企業財資(中國)協會有限公司",2006-04-11,,"Ltd by guarantee"154,1037558,"INTERNATIONAL RESOURCES DEVELOPMENT CO., LIMITED
國際能源開發節能有限公司",2006-04-11,2007-06-22,"Private, ltd by shares"155,1037420,"ISM LINK LIMITED",2006-04-11,,"Private, ltd by shares"156,1037432,"ITALY AUDENG INT'L TRADING GROUP LIMITED
意大利澳登國際貿易集團有限公司",2006-04-11,,"Private, ltd by shares"157,1037643,"ITALY LUOLONG DRESS INT'L GROUP LIMITED
意大利羅龍服飾國際集團有限公司",2006-04-11,2020-01-03,"Private, ltd by shares"158,1037527,"J-SMILES COMPANY LIMITED
津美有限公司",2006-04-11,2016-12-16,"Private, ltd by shares"159,1037497,"Jaco Global Products Limited",2006-04-11,,"Private, ltd by shares"160,1037461,"JAPAN SOTOP INT'L CHAIN ENTERPRISE (CHINA) LIMITED
日本索田國際連鎖企業(中國)有限公司",2006-04-11,2012-05-11,"Private, ltd by shares"161,1037562,"JAT TECHNOLOGY CO., LIMITED (d2015-09-25)
傑安特科技(香港)有限公司",2006-04-11,2015-09-25,"Private, ltd by shares"162,1037513,"JB NATIONAL LIMITED",2006-04-11,2012-05-11,"Private, ltd by shares"163,1037523,"JL INTERNATIONAL CHEMICAL LIMITED
佳利國際化學品有限公司",2006-04-11,,"Private, ltd by shares"164,1037362,"JUFENG INTERNATIONAL (HK) LIMITED
聚豐國際(香港)有限公司",2006-04-11,,"Private, ltd by shares"165,1037402,"JUMBO PROCESS LIMITED (d2019-05-31)
恒億拓展有限公司",2006-04-11,2019-05-31,"Private, ltd by shares"166,1037623,"JXD Graphic Printing Limited
美泰圖文印刷有限公司",2006-04-11,,"Private, ltd by shares"167,1037435,"KAI SEN INDUSTRIAL DEVELOPMENT LIMITED
凱信發展國際有限公司",2006-04-11,2012-05-11,"Private, ltd by shares"168,1037492,"KAISER CONSTRUCTION LIMITED (HK)
基碩建築有限公司",2006-04-11,,"Private, ltd by shares"169,1037366,"KEEN SCORE INTERNATIONAL LIMITED
越盈國際有限公司",2006-04-11,2014-08-15,"Private, ltd by shares"170,1037448,"KEEP ON LIMITED (d2008-11-21)
其安有限公司",2006-04-11,2008-11-21,"Private, ltd by shares"171,1037572,"KELANG SCIENCE AND TECHNOLOGY (HONG KONG) CO., LIMITED
科朗科技 (香港) 有限公司",2006-04-11,2010-07-16,"Private, ltd by shares"172,1037618,"KIMSION GROUP LIMITED
堅成集團有限公司",2006-04-11,,"Private, ltd by shares"173,1037416,"KING GLORY INVESTMENT (GROUP) LIMITED
旭日投資(集團)有限公司",2006-04-11,2008-12-19,"Private, ltd by shares"174,1037412,"KING PROFIT HOLDINGS LIMITED (d2010-12-03)
港盈集團有限公司",2006-04-11,2010-12-03,"Private, ltd by shares"175,1037603,"KING REGENT GARMENT LIMITED
興信製衣有限公司",2006-04-11,2012-05-11,"Private, ltd by shares"176,1037505,"KINGTEC PACIFIC LIMITED
景鉦實業有限公司",2006-04-11,2012-05-11,"Private, ltd by shares"177,1037378,"Kwok Kin Electrical &amp; Plumping Co. Limited
國健五金水電工程有限公司",2006-04-11,2018-07-06,"Private, ltd by shares"178,1037500,"L.T. INVEST LIMITED",2006-04-11,2011-11-04,"Private, ltd by shares"179,1037539,"LEAD-ON INTERNATIONAL DEVELOPMENT LIMITED
利安國際發展有限公司",2006-04-11,2010-12-03,"Private, ltd by shares"180,1037450,"LEADER LOGISTICS LIMITED (d2007-09-28)
佳利物流有限公司",2006-04-11,2007-09-28,"Private, ltd by shares"181,1037419,"LEADER WAY HOLDINGS LIMITED (b2006-04-11)
領威集團有限公司",2006-04-11,2015-06-05,"Private, ltd by shares"182,1037449,"Lenacore Technology Company Limited
智核科技有限公司",2006-04-11,,"Private, ltd by shares"183,1037398,"LONG FAITH INTERNATIONAL INVESTMENT LIMITED
卓信國際投資有限公司",2006-04-11,,"Private, ltd by shares"184,1037605,"LONG MENG TECHNOLOGIES (HOLDINGS) LIMITED
龍盟科技(控股)有限公司",2006-04-11,2009-09-04,"Private, ltd by shares"185,1037669,"LOTUS HILL GOLF RESORT (H.K.) LIMITED
蓮花山高爾夫俱樂部(香港)有限公司",2006-04-11,2019-01-25,"Private, ltd by shares"186,1037502,"Louder Media International Limited",2006-04-11,2010-10-15,"Private, ltd by shares"187,1037610,"LU2 VENTURES LIMITED",2006-04-11,2012-11-23,"Private, ltd by shares"188,1037674,"LUEN HING PRECISION PART MANUFACTURING LIMITED
聯興精密五金有限公司",2006-04-11,2015-09-25,"Private, ltd by shares"189,1037670,"Macau Properties Holdings Limited
澳門地產集團有限公司",2006-04-11,,"Private, ltd by shares"190,1037373,"MAGIC RAISE HOLDINGS LIMITED
懋揚集團有限公司",2006-04-11,2010-12-03,"Private, ltd by shares"191,1037481,"MAN FUNG ENGINEERING TRADING LIMITED
文鋒工程貿易有限公司",2006-04-11,2009-06-05,"Private, ltd by shares"192,1037650,"Mandarin Touch Collections Limited
華韻閣精品有限公司",2006-04-11,2009-02-27,"Private, ltd by shares"193,1037400,"MAPLE (INTERNATIONAL) INVESTMENTS LIMITED
美寶(國際)投資有限公司",2006-04-11,2011-06-30,"Private, ltd by shares"194,1037510,"MAXTRO INDUSTRY CO., LIMITED
同鑫實業有限公司",2006-04-11,,"Private, ltd by shares"195,1037559,"MEGA BRILLIANCE (H.K.) CO., LIMITED
巨晟(香港)有限公司",2006-04-11,2009-09-11,"Private, ltd by shares"196,1037375,"MEI YI HANDBAGS (H.K.) LIMITED
美怡實業(香港)有限公司",2006-04-11,2017-06-30,"Private, ltd by shares"197,1037501,"MENTFIELD (CHINA) LIMITED",2006-04-11,2014-11-07,"Private, ltd by shares"198,1037491,"MERIDIAN ENTERTAINMENT LIMITED",2006-04-11,,"Private, ltd by shares"199,1037457,"MIIOW INT'L (H.K.) SHARE LIMITED
美敖國際(香港)股份有限公司",2006-04-11,2013-04-19,"Private, ltd by shares"200,1037639,"MINSINIAO INT'L BRAND (H.K) LIMITED
閩斯鳥國際品牌(香港)有限公司",2006-04-11,2010-09-30,"Private, ltd by shares"201,1037644,"MJH LINK INDUSTRY CO., LIMITED
滿江紅實業(深圳)有限公司",2006-04-11,2017-09-15,"Private, ltd by shares"202,1037612,"MM INTERNATIONAL COMPANY LIMITED",2006-04-11,,"Private, ltd by shares"203,1037599,"MODUS DESIGN LIMITED (d2016-04-29)",2006-04-11,2016-04-29,"Private, ltd by shares"204,1037529,"Molto Carino Limited",2006-04-11,2010-12-03,"Private, ltd by shares"205,1037595,"MULTI RECKONS LIMITED",2006-04-11,,"Private, ltd by shares"206,1037509,"MULTIPIPE RENOVATION (HK) LIMITED
貿發工程(香港)有限公司",2006-04-11,,"Private, ltd by shares"207,1037584,"Mutual Works International Limited
向榮集團國際有限公司",2006-04-11,,"Private, ltd by shares"208,1037470,"MYHOME JOURNAL SOCIETY LIMITED
家居之友雜志社有限公司",2006-04-11,2008-03-28,"Private, ltd by shares"209,1037640,"MYRA &amp; COMPANY LIMITED",2006-04-11,2013-12-13,"Private, ltd by shares"210,1037484,"NATURAL TEXTILES LIMITED
麗然紡織有限公司",2006-04-11,2008-03-20,"Private, ltd by shares"211,1037589,"NESTOR DISTRIBUTORS LIMITED (d2010-12-03)",2006-04-11,2010-12-03,"Private, ltd by shares"212,1037622,"New Dynasty Conglomerate Limited
嘉銓集團有限公司",2006-04-11,,"Private, ltd by shares"213,1037545,"NEW ERA GROUP (CHINA) INTERNATIONAL ENGINEERING LIMITED
新時代集團(中國)國際工程有限公司",2006-04-11,2009-09-18,"Private, ltd by shares"