,Reg no.,Name,Incorp-orated,Dissolved,Type215,1037808,"MASTER OF FARMER ENTERPRISES LIMITED
神農氏企業有限公司",2006-04-12,2012-05-11,"Private, ltd by shares"216,1037940,"MASTER-KEY TECHNOLOGY COMPANY LIMITED
恒利電子科技有限公司",2006-04-12,,"Private, ltd by shares"217,1037870,"MAXWIM INTERNATIONAL CO., LIMITED
超域國際物流有限公司",2006-04-12,2010-12-03,"Private, ltd by shares"218,1037733,"MAYBELLINE GROUP (FRANCE) COSMETIC LIMITED
美寶蓮集團(法國)化妝品有限公司",2006-04-12,2010-07-30,"Private, ltd by shares"219,1037896,"Mechatronics Controls Industries Limited",2006-04-12,,"Private, ltd by shares"220,1037879,"MEGACOLOR INTERNATIONAL LIMITED
麥格國際貿易有限公司",2006-04-12,2014-10-03,"Private, ltd by shares"221,1037713,"MGT ASIA LIMITED",2006-04-12,,"Private, ltd by shares"222,1037966,"MIN HONG INTERNATIONAL (HONG KONG) LIMITED
閩宏國際(香港)有限公司",2006-04-12,,"Private, ltd by shares"223,1037819,"MIRO SPORTS CO., LIMITED
米歐運動用品有限公司",2006-04-12,2010-02-05,"Private, ltd by shares"224,1037773,"MPL TRADING (HK) LIMITED
達豪貿易(香港)有限公司",2006-04-12,2015-06-05,"Private, ltd by shares"225,1037953,"MUNICH URBAN DESIGN INT'L (ASIA) LIMITED
慕迪國際規劃設計咨詢有限公司",2006-04-12,,"Private, ltd by shares"226,1037965,"MYCARE CO., LIMITED
麥凱亞有限公司",2006-04-12,,"Private, ltd by shares"227,1037709,"NATIONAL STUDIES PRESS LIMITED
國學出版社有限公司",2006-04-12,2012-03-16,"Private, ltd by shares"228,1037738,"NEW GENERATION TECHNOLOGY LIMITED (d2010-09-30)
新世代電子科技有限公司",2006-04-12,2010-09-30,"Private, ltd by shares"229,1037766,"New Standard China Limited
新標準中國有限公司",2006-04-12,,"Private, ltd by shares"230,1037887,"NEW TRADING DEVELOPMENT LIMITED
新南方實業有限公司",2006-04-12,2018-09-28,"Private, ltd by shares"231,1037835,"NEW VISION INTERNATIONAL HOLDINGS LIMITED
新視界國際集團有限公司",2006-04-12,2014-12-12,"Private, ltd by shares"232,1037873,"NORTH-WEST RESOURCES LIMITED
西部開發有限公司",2006-04-12,2012-05-11,"Private, ltd by shares"233,1037789,"NOVA PARTNERSHIP ASSOCIATIONS COMPANY LIMITED",2006-04-12,2010-11-19,"Private, ltd by shares"234,1037843,"NOW WEAR COMPANY LIMITED",2006-04-12,2011-04-15,"Private, ltd by shares"235,1037688,"ON SHUN KAI COMPANY LIMITED
安信佳有限公司",2006-04-12,2008-01-18,"Private, ltd by shares"236,1037869,"ONLINK INDUSTRIAL LIMITED
安興實業有限公司",2006-04-12,2009-10-30,"Private, ltd by shares"237,1037737,"ORIENTAL SOURCING INTERNATIONAL CO., LIMITED
東方貨源(國際)有限公司",2006-04-12,2010-08-20,"Private, ltd by shares"238,1037714,"P.C.T.T. INT'L GROUP (H.K.) LIMITED
中和堂國際集團(香港)有限公司",2006-04-12,2013-06-21,"Private, ltd by shares"239,1037874,"PACIFIC DRAGON INTERNATIONAL LIMITED
超龍國際有限公司",2006-04-12,,"Private, ltd by shares"240,1037872,"PACIFIC GRAND INDUSTRIAL LIMITED
順光實業有限公司",2006-04-12,2009-01-23,"Private, ltd by shares"241,1037915,"PALMY LOGISTICS LIMITED
隆祥物流有限公司",2006-04-12,2018-12-14,"Private, ltd by shares"242,1037952,"PARA INTERNATIONAL COMPANY LIMITED
博樂國際有限公司",2006-04-12,2010-07-09,"Private, ltd by shares"243,1037939,"PARAGON MEDICAL CENTRE LIMITED
翹采醫務中心有限公司",2006-04-12,,"Private, ltd by shares"244,1037828,"PAYMAN GARMENT GROUP CO., LIMITED
培蒙服飾集團有限公司",2006-04-12,2019-01-18,"Private, ltd by shares"245,1037996,"Piclatso Trading Limited
比柏實業有限公司",2006-04-12,,"Private, ltd by shares"246,1038002,"PINE INTERNATIONAL MANAGEMENT LIMITED
松記國際管理有限公司",2006-04-12,2010-12-03,"Private, ltd by shares"247,1037847,"POWER CREATION (HK) GROUP LIMITED
力創(香港)集團有限公司",2006-04-12,2016-04-22,"Private, ltd by shares"248,1037862,"PRIMO COMPANY LIMITED",2006-04-12,2010-12-03,"Private, ltd by shares"249,1037889,"Princess Corporate Services Limited",2006-04-12,2007-06-29,"Private, ltd by shares"250,1037994,"PRO-TECH ENGINEERING DEVELOPMENT COMPANY LIMITED
保德工程發展有限公司",2006-04-12,2008-12-19,"Private, ltd by shares"251,1037725,"PROGLORY (H.K.) LIMITED
恆暉實業(香港)有限公司",2006-04-12,2015-11-27,"Private, ltd by shares"252,1037914,"PROSPECT STAR TRADING LIMITED (d2012-02-24)
馬星貿易有限公司",2006-04-12,2012-02-24,"Private, ltd by shares"253,1037746,"PROSPERITY INDUSTRIAL DEVELOPMENT CO. LIMITED
興隆鈕扣有限公司",2006-04-12,,"Private, ltd by shares"254,1037935,"QIAOWEI INVESTMENT DEVELOPMENT LIMITED
僑威投資發展有限公司",2006-04-12,2013-11-22,"Private, ltd by shares"255,1037900,"QUERY LIMITED (d2015-12-04)",2006-04-12,2015-12-04,"Private, ltd by shares"256,1038019,"RDS HOLDINGS LIMITED",2006-04-12,2013-02-01,"Private, ltd by shares"257,1037844,"RENCA DEVELOPMENT LIMITED
偉加發展有限公司",2006-04-12,2011-09-23,"Private, ltd by shares"258,1037860,"RENCA ENTERPRISES LIMITED
偉加企業有限公司",2006-04-12,,"Private, ltd by shares"259,1037759,"RENOVAG HOLDINGS H.K. LIMITED",2006-04-12,2011-01-07,"Private, ltd by shares"260,1037790,"ROBERT MARK FAR EAST CO., LIMITED",2006-04-12,,"Private, ltd by shares"261,1037764,"RUSSIA TRONDHEIM CHEMICAL FERTILIZER ENTRANCE LIMITED
俄羅斯特隆赫姆化肥進出口有限公司",2006-04-12,2010-12-03,"Private, ltd by shares"262,1037902,"S2 DESIGN &amp; CONTRACTING COMPANY LIMITED
雅仕圖室內設計及工程有限公司",2006-04-12,,"Private, ltd by shares"263,1037722,"SAIJIN INT'L HEALTHY INDUSTRY (H.K) LIMITED
賽金國際健康產業(香港)有限公司",2006-04-12,2010-09-30,"Private, ltd by shares"264,1037861,"SAMWAY HOLDINGS LIMITED
順威集團有限公司",2006-04-12,,"Private, ltd by shares"265,1037865,"SANWELL HOLDINGS LIMITED
成偉集團有限公司",2006-04-12,2016-05-20,"Private, ltd by shares"266,1037932,"SART FUSE CO., LIMITED
薩特保險絲有限公司",2006-04-12,2019-12-13,"Private, ltd by shares"267,1037917,"SHANGHAI INTERNATIONAL TRADING CO., LIMITED
上海國際實業有限公司",2006-04-12,2012-05-11,"Private, ltd by shares"268,1037750,"SHANXI SECURITIES INTERNATIONAL FINANCIAL HOLDINGS LIMITED
山證國際金融控股有限公司",2006-04-12,,"Private, ltd by shares"269,1037687,"SHEN MEI GROUP (HONG KONG) INT'L ENTERPRISE LIMITED
審美集團(香港)國際企業有限公司",2006-04-12,2010-11-26,"Private, ltd by shares"270,1038010,"SINDA TECHNOLOGY COMPANY LIMITED
鑫利達科技有限公司",2006-04-12,2010-05-20,"Private, ltd by shares"271,1037698,"SINO STAR PLASTIC RECYCLING LIMITED
華星塑料有限公司",2006-04-12,,"Private, ltd by shares"272,1037929,"SMART STEREO ENTERPRISE LIMITED
森太企業有限公司",2006-04-12,,"Private, ltd by shares"273,1037871,"SOCIETY OF ROYAL ETIQUETTE LIMITED (THE)
英國皇家禮儀協會有限公司",2006-04-12,2008-12-24,"Private, ltd by shares"274,1037787,"SOFT SOLUTION LIMITED (d2011-12-16)
軟方案有限公司",2006-04-12,2011-12-16,"Private, ltd by shares"275,1037867,"Soft-R Production Limited",2006-04-12,2018-12-14,"Private, ltd by shares"276,1037754,"SOL CONCEPT LIMITED
赤能概念有限公司",2006-04-12,,"Private, ltd by shares"277,1037942,"SOUTH KE MAO (HONGKONG) TECHNOLOGY CO., LIMITED
南方科貿(香港)科技有限公司",2006-04-12,2012-05-04,"Private, ltd by shares"278,1037895,"SPARKLE TOUR LIMITED
華星旅遊有限公司",2006-04-12,2009-12-11,"Private, ltd by shares"279,1037705,"SPRING INVESTMENT (HK) LIMITED
思富寧投資香港有限公司",2006-04-12,2012-09-21,"Private, ltd by shares"280,1037718,"SPUNKY INDUSTRIAL LIMITED
思創實業有限公司",2006-04-12,2017-12-01,"Private, ltd by shares"281,1037768,"STANDARD FOODS COMPANY LIMITED
全力食品有限公司",2006-04-12,,"Private, ltd by shares"282,1037982,"SUN NGAI SHING INTERNATIONAL LIMITED
新藝城國際有限公司",2006-04-12,2010-12-03,"Private, ltd by shares"283,1038025,"SUNDA OFFICE SUPPLIES LIMITED
信達洋行有限公司",2006-04-12,,"Private, ltd by shares"284,1037798,"SUNSHINE TRADING LIMITED (d2010-12-03)
信耀貿易有限公司",2006-04-12,2010-12-03,"Private, ltd by shares"285,1037846,"SUPERWAY DEVELOPMENT LIMITED
超偉發展有限公司",2006-04-12,,"Private, ltd by shares"286,1037877,"SUPERWAY INTERNATIONAL LIMITED
超偉國際有限公司",2006-04-12,,"Private, ltd by shares"287,1037795,"SUPERWAY INVESTMENT LIMITED
超偉投資有限公司",2006-04-12,,"Private, ltd by shares"288,1037850,"SYGAMA TECHNOLOGY (HK) CO., LIMITED
信格科技(香港)有限公司",2006-04-12,2017-10-27,"Private, ltd by shares"289,1038021,"T &amp; Y FOOD LIMITED
太元食品有限公司",2006-04-12,2017-12-01,"Private, ltd by shares"290,1037971,"Tai Hua International Hong Kong Limited
泰華國際香港有限公司",2006-04-12,2015-03-20,"Private, ltd by shares"291,1037858,"TAK THAI (H.K.) HOLDINGS LIMITED
德泰(香港)集團有限公司",2006-04-12,2017-01-20,"Private, ltd by shares"292,1037976,"TAK TIN INVESTMENT LIMITED",2006-04-12,2007-09-28,"Private, ltd by shares"293,1037717,"TALENT SPORTS TRAINING CENTRE LIMITED
龍騰體操訓練中心有限公司",2006-04-12,2019-08-16,"Private, ltd by shares"294,1037692,"TANGO PRODUCTION AND MANAGEMENT LIMITED
天高製作管理有限公司",2006-04-12,2010-03-26,"Private, ltd by shares"295,1037813,"TECHNOCREW CHINA COMPANY LIMITED
特諾高端技術有限公司",2006-04-12,2014-08-15,"Private, ltd by shares"296,1037955,"TEE VEE BRANDS MANUFACTURING (CHINA) LIMITED",2006-04-12,,"Private, ltd by shares"297,1037784,"TEXWIDE INTERNATIONAL COMPANY LIMITED (d2011-12-30)
雄昇紡織有限公司",2006-04-12,2011-12-30,"Private, ltd by shares"298,1037684,"Tianming Electronics Technology Company Limited
天明電子科技有限公司",2006-04-12,2019-01-18,"Private, ltd by shares"299,1038014,"TMC MEDIA LIMITED (d2015-06-12)",2006-04-12,2015-06-12,"Private, ltd by shares"300,1037890,"TOMKEY INTERNATIONAL (HONG KONG) CO., LIMITED
東機國際(香港)有限公司",2006-04-12,2016-09-30,"Private, ltd by shares"301,1037958,"TOP WEALTHY (ASIA) LIMITED (d2010-12-03)
利冠(亞洲)有限公司",2006-04-12,2010-12-03,"Private, ltd by shares"302,1037998,"TRADE AND MANAGEMENT H.K. COMPANY LIMITED",2006-04-12,2017-12-01,"Private, ltd by shares"303,1037695,"TREND SYSTEM ENGINEERING LIMITED
時代系統工程有限公司",2006-04-12,2011-02-11,"Private, ltd by shares"304,1037911,"TRUE FAITH CARE LIMITED
真誠信心有限公司",2006-04-12,2018-06-29,"Private, ltd by shares"305,1037899,"Tsinlien Garments Development Co., Limited (d2015-03-06)
津聯服裝發展有限公司",2006-04-12,2015-03-06,"Private, ltd by shares"306,1037995,"TWINKLE INTERNATIONAL LIMITED (d2007-10-26)
富炤國際有限公司",2006-04-12,2007-10-26,"Private, ltd by shares"307,1037739,"U.S.A. JIAJI (H.K.) INT'L CHEMICAL INDUSTRY GROUP LIMITED
美國嘉吉(香港)國際化工集團有限公司",2006-04-12,2017-12-01,"Private, ltd by shares"308,1037912,"UKT HOLDING LIMITED",2006-04-12,2010-12-03,"Private, ltd by shares"309,1037794,"Ulead Solutions Limited
環球(香港)科技有限公司",2006-04-12,2010-03-26,"Private, ltd by shares"310,1037716,"UNION WIN (HONG KONG) ENTERPRISES LIMITED
聯成(香港)企業有限公司",2006-04-12,,"Private, ltd by shares"311,1037824,"VANCO TRADING LIMITED (d2012-05-11)
偉豪貿易有限公司",2006-04-12,2012-05-11,"Private, ltd by shares"312,1037888,"VANQUISH (HK) LIMITED",2006-04-12,,"Private, ltd by shares"313,1038004,"VICTORIOUS KNITTING COMPANY LIMITED
源昌針織有限公司",2006-04-12,2007-08-24,"Private, ltd by shares"314,1037848,"VINCO ENGINEERING LIMITED
榮高工程有限公司",2006-04-12,,"Private, ltd by shares"315,1037891,"WAH TONG ENGINEERING SURVEY COMPANY LIMITED (d2007-05-25)
華棠工程測量有限公司",2006-04-12,2007-05-25,"Private, ltd by shares"316,1037885,"WAI WAH ENGINEERING SURVEY CO., LIMITED (d2007-05-25)
偉華工程測量有限公司",2006-04-12,2007-05-25,"Private, ltd by shares"317,1037805,"WELLTEX MANAGEMENT LIMITED
偉達管理有限公司",2006-04-12,2009-03-06,"Private, ltd by shares"318,1037898,"WIN MIGHT SHIPPING (H. K.) LIMITED
盛威船務(香港)有限公司",2006-04-12,2014-12-12,"Private, ltd by shares"319,1037690,"WINDEX LOGISTICS (H.K) CO., LIMITED
冠宇運通(香港)有限公司",2006-04-12,,"Private, ltd by shares"320,1037814,"WING SING (HONG KONG) ELECTRONIC COMPANY LIMITED
永升(香港)電子有限公司",2006-04-12,2011-11-25,"Private, ltd by shares"321,1037863,"WINGS INDUSTRIES LIMITED
永時(中國香港)有限公司",2006-04-12,2015-05-08,"Private, ltd by shares"322,1037946,"WINSTAR ELECTRONICS (H.K.) LIMITED
萬悅電子有限公司",2006-04-12,2008-07-04,"Private, ltd by shares"323,1037721,"WOMAN FAMILY INTERNATIONAL FASHION LIMITED
女人世家國際服飾有限公司",2006-04-12,2010-12-03,"Private, ltd by shares"324,1038023,"WORLD BOXING COUNCIL (HK) LIMITED
世界拳擊理事會 (香港) 有限公司",2006-04-12,2015-12-31,"Private, ltd by shares"325,1037827,"WORLDWAY INTERNATIONAL (HK) LIMITED
世路國際(香港)有限公司",2006-04-12,2008-12-19,"Private, ltd by shares"326,1037715,"WORLDWIDETECH COMPONENTS CO., LIMITED
環球科技元件有限公司",2006-04-12,2014-09-26,"Private, ltd by shares"327,1037732,"WSCCO TECHNOLOGY (HONG KONG) LIMITED
建能科技(香港)有限公司",2006-04-12,2012-05-11,"Private, ltd by shares"328,1037973,"XIANGYUE INTERNATIONAL (H.K.) LIMITED
祥粵國際(香港)有限公司",2006-04-12,2014-08-15,"Private, ltd by shares"329,1037937,"XING HAI INTERNATIONAL (HK) CO., LIMITED
星海國際(香港)有限公司",2006-04-12,2010-09-30,"Private, ltd by shares"330,1037783,"YA LIEN ENTERPRISE, LIMITED",2006-04-12,,"Private, ltd by shares"331,1037961,"YA SING CONSTRUCTION COMPANY LIMITED
日勝工程有限公司",2006-04-12,,"Private, ltd by shares"332,1037967,"YAHKEY INTERNATIONAL LIMITED
雅麒國際有限公司",2006-04-12,2014-08-15,"Private, ltd by shares"333,1037864,"YAT KA ENGINEERING COMPANY LIMITED
溢珈工程有限公司",2006-04-12,,"Private, ltd by shares"334,1037921,"YI JING LIMITED",2006-04-12,2009-09-18,"Private, ltd by shares"335,1037836,"YINDI TECHNOLOGIES (HOLDINGS) PTE LIMITED
銀笛科技(控股)集團有限公司",2006-04-12,2012-05-11,"Private, ltd by shares"336,1037723,"YMK INVESTMENT LIMITED",2006-04-12,,"Private, ltd by shares"337,1037779,"YUNG LIEN ENTERPRISE, LIMITED",2006-04-12,,"Private, ltd by shares"338,1037981,"Yung Tai Industrial Development Limited
榕泰實業發展有限公司",2006-04-12,2010-01-29,"Private, ltd by shares"339,1037988,"YUSU FIGHT TROOP JAPAN CARTOON ANIMATION LIMITED
宇速戰隊日本卡通動畫有限公司",2006-04-12,2010-12-03,"Private, ltd by shares"340,1037909,"ZENITH INTERNATIONAL GROUP CO., LIMITED
瑞利斯國際有限公司",2006-04-12,,"Private, ltd by shares"341,1037770,"ZHEJIANG APPDY INDUSTRY CO., LIMITED
浙江艾普達工業有限公司",2006-04-12,2019-10-18,"Private, ltd by shares"342,1038008,"ZHI CONSULTANTS LIMITED
智顧問有限公司",2006-04-12,2011-10-28,"Private, ltd by shares"343,1037883,"ZZX INTERNATIONAL INVESTMENT MANAGEMENT LIMITED
中展信國際投資管理有限公司",2006-04-12,,"Private, ltd by shares"