,Reg no.,Name,Incorp-orated,Dissolved,Type1,1037811,"10/40 TRADING COMPANY LIMITED",2006-04-12,2017-12-01,"Private, ltd by shares"2,1037757,"3A TRADING COMPANY LIMITED",2006-04-12,2019-02-15,"Private, ltd by shares"3,1037799,"ACE FAITH LIMITED
永利信有限公司",2006-04-12,,"Private, ltd by shares"4,1037880,"ACEWICK INVESTMENT LIMITED
雅域投資有限公司",2006-04-12,,"Private, ltd by shares"5,1037803,"ACEWICK LIMITED",2006-04-12,2017-12-01,"Private, ltd by shares"6,1037901,"ACQUATIS CORPORATION LIMITED",2006-04-12,,"Private, ltd by shares"7,1037772,"AFT INDUSTRIAL LIMITED",2006-04-12,,"Private, ltd by shares"8,1037810,"AMERICAN DESIGN ASSOCIATES (HONG KONG) LIMITED
美國建築設計(香港)有限公司",2006-04-12,2015-10-23,"Private, ltd by shares"9,1037791,"AMPERIA LIMITED (d2012-12-14)
智賢有限公司",2006-04-12,2012-12-14,"Private, ltd by shares"10,1037736,"AN'S INT'L (H.K) COSMETICS GROUP COMPANY LIMITED
安氏國際(香港)化妝品集團有限公司",2006-04-12,2014-08-15,"Private, ltd by shares"11,1037792,"ANDERSON ENTERPRISE CO., LIMITED
香港力新企業有限公司",2006-04-12,2016-08-12,"Private, ltd by shares"12,1037775,"Angel's Investments Limited",2006-04-12,2007-02-02,"Private, ltd by shares"13,1037782,"Anson Nanotechnology (HK) Co. Limited
安信納米科技(香港)有限公司",2006-04-12,,"Private, ltd by shares"14,1037734,"ARTICLE8 LIMITED (HK)",2006-04-12,,"Private, ltd by shares"15,1037913,"ASHLEY INTERNATIONAL LIMITED (d2014-05-09)",2006-04-12,2014-05-09,"Private, ltd by shares"16,1037904,"AXIOMA (HK) LIMITED",2006-04-12,,"Private, ltd by shares"17,1037962,"Best Act Limited
上上策有限公司",2006-04-12,,"Private, ltd by shares"18,1037849,"BEST ERA INTERNATIONAL DEVELOPMENT (HK) LIMITED
好時代國際發展(香港)有限公司",2006-04-12,2010-12-03,"Private, ltd by shares"19,1037868,"BESTEX ENTERPRISE LIMITED
淩致企業發展有限公司",2006-04-12,2009-06-19,"Private, ltd by shares"20,1037972,"BIT INDUSTRIAL CO., LIMITED (d2014-06-13)
百世盈科實業有限公司",2006-04-12,2014-06-13,"Private, ltd by shares"21,1037893,"BLUE OCEAN DEVELOPMENT COMPANY LIMITED
藍海發展有限公司",2006-04-12,,"Private, ltd by shares"22,1037708,"BLUEPRINT BUSINESS SOLUTIONS LIMITED (d2011-09-16)",2006-04-12,2011-09-16,"Private, ltd by shares"23,1037702,"BONA COMPUTECH COMPANY LIMITED
聲聲科技有限公司",2006-04-12,2017-10-13,"Private, ltd by shares"24,1037960,"Bonway Gifts Manufacturing Limited
耀威制品有限公司",2006-04-12,2012-01-13,"Private, ltd by shares"25,1037945,"BRILLIANT TREND INTERNATIONAL LIMITED
駿晴國際有限公司",2006-04-12,2010-09-10,"Private, ltd by shares"26,1037726,"BRITAIN DEWEI LIBONT PLANT PROTECTION LIMITED
英國德威植物保護有限公司",2006-04-12,2012-05-11,"Private, ltd by shares"27,1037748,"BU BU GAO ELECTRICAL EQUIPMENT (CHINA) HOLDING LIMITED
步步高電器(中國)集團有限公司",2006-04-12,2010-07-30,"Private, ltd by shares"28,1037747,"BWG LIMITED (d2011-02-25)",2006-04-12,2011-02-25,"Private, ltd by shares"29,1038007,"C.B.S. ASIA Limited",2006-04-12,2008-07-11,"Private, ltd by shares"30,1037807,"Caiyue International Group Limited
彩悅國際集團有限公司",2006-04-12,2010-05-20,"Private, ltd by shares"31,1037831,"CALICHI LIMITED",2006-04-12,,"Private, ltd by shares"32,1037840,"CARDINAL ACCOUNTING &amp; TAXATION LIMITED
政安會計稅務有限公司",2006-04-12,,"Private, ltd by shares"33,1037712,"CASTLE ROCK ENERGY (HK) LIMITED",2006-04-12,2014-10-17,"Private, ltd by shares"34,1037920,"CHEN AN TANG (CHINA) COMPANY LIMITED
誠安堂(中國)有限公司",2006-04-12,2015-07-10,"Private, ltd by shares"35,1037825,"China City Railway Transportation Technology Investment Company Limited
中國城市軌道交通科技投資有限公司",2006-04-12,,"Private, ltd by shares"36,1037797,"CHINA EAST TRADING LIMITED
東業貿易有限公司",2006-04-12,2012-05-11,"Private, ltd by shares"37,1037894,"China Fertilizer (Holdings) Company Limited (d2012-05-11)
中國肥業(控股)有限公司",2006-04-12,2012-05-11,"Private, ltd by shares"38,1037719,"CHINA FINANCIAL (HK) COMPANY LIMITED",2006-04-12,,"Private, ltd by shares"39,1037704,"CHINA INTANGIBLE CULTURAL HERITAGE ALLIANCE LIMITED
中國非遺聯盟有限公司",2006-04-12,,"Private, ltd by shares"40,1037812,"CHINA PETROLEUM AVIA-TECH HOLDING GROUP LIMITED
中石油航技控股集團有限公司",2006-04-12,2010-12-03,"Private, ltd by shares"41,1037696,"CHINA STONE MATERIAL STOCK LIMITED
中國石材股份有限公司",2006-04-12,,"Private, ltd by shares"42,1037985,"CHINA TIANDI RENMEI EDUCATION DEV. CENTER LIMITED
中國天地人美教育發展中心有限公司",2006-04-12,2010-12-03,"Private, ltd by shares"43,1038024,"CHINA YANHUANG INT'L FINANCIAL INVESTMENT GROUP LIMITED
中國炎黃國際金融投資集團有限公司",2006-04-12,2009-02-27,"Private, ltd by shares"44,1037852,"CHING TAT ENGINEERING COMPANY LIMITED (d2012-05-11)
政達工程有限公司",2006-04-12,2012-05-11,"Private, ltd by shares"45,1038000,"CHONGTAI INTERNATIONAL LIMITED
昶泰國際有限公司",2006-04-12,2009-03-06,"Private, ltd by shares"46,1037989,"CHONGTAI LIMITED
昶泰有限公司",2006-04-12,2009-03-06,"Private, ltd by shares"47,1037752,"Chun Kwong Engineering Limited (d2008-10-17)
振光工程有限公司",2006-04-12,2008-10-17,"Private, ltd by shares"48,1037990,"CHUNG HO ENGINEERING LIMITED
俊灝工程有限公司",2006-04-12,,"Private, ltd by shares"49,1037969,"CO-FLUTTER INTERNATIONAL (H.K.) LIMITED
翔馳國際(香港)有限公司",2006-04-12,2012-05-11,"Private, ltd by shares"50,1038006,"CO-WIN LOGISTICS LIMITED
錦榮物流有限公司",2006-04-12,,"Private, ltd by shares"51,1037816,"CONCEPT ELECTRONICS TECHNOLOGY LIMITED
創新電子科技有限公司",2006-04-12,2008-05-16,"Private, ltd by shares"52,1037903,"CONTECH HK LIMITED
康達香港有限公司",2006-04-12,,"Private, ltd by shares"53,1037908,"CROSSOVER HAIR SALON LIMITED (d2014-05-02)",2006-04-12,2014-05-02,"Private, ltd by shares"54,1037800,"CURACAO ASIA (HONG KONG) LIMITED",2006-04-12,,"Private, ltd by shares"55,1037924,"D&amp;A OUTWEAR INTERNATIONAL LIMITED
航致國際有限公司",2006-04-12,,"Private, ltd by shares"56,1037922,"DACO INTERNATIONAL JAPAN CARS LIMITED",2006-04-12,2011-08-05,"Private, ltd by shares"57,1037837,"DAYU ELECTRONIC TECHNOLOGY COMPANY LIMITED
大宇電子科技有限公司",2006-04-12,,"Private, ltd by shares"58,1037804,"DENOVO HOTEL MANAGEMENT COMPANY LIMITED
登路華酒店管理有限公司",2006-04-12,2008-03-28,"Private, ltd by shares"59,1037756,"DENTAL ART LABORATORY COMPANY LIMITED
藝齒牙科技術有限公司",2006-04-12,,"Private, ltd by shares"60,1037820,"DIADE ASIA LIMITED",2006-04-12,2012-05-11,"Private, ltd by shares"61,1037683,"DJR LOGISTICS CHINA LIMITED
達速聯動中國有限公司",2006-04-12,,"Private, ltd by shares"62,1037767,"DOXXON INTERNATIONAL LIMITED
東奕國際有限公司",2006-04-12,2009-12-31,"Private, ltd by shares"63,1037881,"DRAGON GOOD INVESTMENT LIMITED
龍高投資有限公司",2006-04-12,,"Private, ltd by shares"64,1037685,"DYNAMITE SOLUTIONS LIMITED (HK)",2006-04-12,,"Private, ltd by shares"65,1037829,"EASTERN CULTURE COMMUNICATION LIMITED (d2009-06-19)
華域文化傳播有限公司",2006-04-12,2009-06-19,"Private, ltd by shares"66,1037841,"EASTWIN CONSULTANTS LIMITED
東榮顧問有限公司",2006-04-12,,"Private, ltd by shares"67,1037907,"ELMO LEATHER LIMITED
傲美有限公司",2006-04-12,,"Private, ltd by shares"68,1037854,"EMP TECHNOLOGY (HONG KONG) CO., LIMITED
訊通科技(香港)有限公司",2006-04-12,2010-07-09,"Private, ltd by shares"69,1037938,"EMW PRO LIMITED",2006-04-12,,"Private, ltd by shares"70,1037691,"eSuntang Company Limited
煜燊堂有限公司",2006-04-12,,"Private, ltd by shares"71,1037999,"EVER PROFIT (HONG KONG) ENTERPRISES LIMITED
永富(香港)企業有限公司",2006-04-12,,"Private, ltd by shares"72,1037701,"EVERSOUND INTERNATIONAL GROUP LIMITED
華鳴國際集團有限公司",2006-04-12,2012-05-11,"Private, ltd by shares"73,1037753,"Eyeball Limited (d2014-03-07)",2006-04-12,2014-03-07,"Private, ltd by shares"74,1037842,"FALCON ELECTRONICS LIMITED (d2007-11-30)
鷹江電子有限公司",2006-04-12,2007-11-30,"Private, ltd by shares"75,1037751,"FEN LONG LIMITED
帆龍有限公司",2006-04-12,,"Private, ltd by shares"76,1037892,"FIGAME FURNITURE LIMITED
惠佳美家私有限公司",2006-04-12,2010-07-23,"Private, ltd by shares"77,1037884,"FLY HIGHLY INTERNATIONAL LIMITED
天齊國際有限公司",2006-04-12,2008-12-24,"Private, ltd by shares"78,1037762,"FOUR SEASONS GARMENT ACCESSORIES LIMITED",2006-04-12,2018-07-06,"Private, ltd by shares"79,1037839,"FRANCE LIKELONG INTERNATIONAL GROUP LIMITED
法國利客隆國際集團有限公司",2006-04-12,2010-12-03,"Private, ltd by shares"80,1038018,"FRANCE LUYI LAOTOUWANG INT'L SHOES &amp; CLOTHES LIMITED
法國路易老頭王國際鞋服有限公司",2006-04-12,2012-05-11,"Private, ltd by shares"81,1037769,"FRANCE PIERKADAN.DINU INTERNATIONAL CO., LIMITED
法國皮爾卡丹．帝奴國際有限公司",2006-04-12,,"Private, ltd by shares"82,1037857,"FUKUDEN TECHNOLOGY CO., LIMITED
福電科技有限公司",2006-04-12,,"Private, ltd by shares"83,1037936,"FULLWELL ENTERPRISE LIMITED
益新企業有限公司",2006-04-12,2009-12-24,"Private, ltd by shares"84,1037744,"FUNWAY GROUP HOLDING LIMITED
方位集團控股有限公司",2006-04-12,,"Private, ltd by shares"85,1037986,"GALLONTON TRADING LIMITED",2006-04-12,2012-05-11,"Private, ltd by shares"86,1037856,"GANGFENG GROUP (HK) LIMITED
港豐集團(香港)有限公司",2006-04-12,,"Private, ltd by shares"87,1037987,"GAWOO GREEN (H.K) CO., LIMITED
嘉友格林(香港)有限公司",2006-04-12,2008-01-04,"Private, ltd by shares"88,1037821,"GD FOSHAN TANGSAI CERAMICS (HK) LIMITED
廣東佛山瑭賽陶瓷(香港)有限公司",2006-04-12,2010-10-08,"Private, ltd by shares"89,1037997,"GENERAL ECONOMIC CONSULTING LIMITED",2006-04-12,2010-02-12,"Private, ltd by shares"90,1038015,"GOBERY TRADING CO., LIMITED
高佰麗貿易有限公司",2006-04-12,2012-06-22,"Private, ltd by shares"91,1037806,"GOLDEN SPARKLE INTERNATIONAL LIMITED
金勁龍國際有限公司",2006-04-12,2010-01-22,"Private, ltd by shares"92,1037956,"GOLISON (HK) INDUSTRIAL LIMITED
金利順(香港)實業有限公司",2006-04-12,,"Private, ltd by shares"93,1037851,"GOOD HARBOUR ENTERPRISES LIMITED
富港企業有限公司",2006-04-12,2013-06-21,"Private, ltd by shares"94,1037992,"GOODCOME INTERNATIONAL LIMITED (d2007-10-26)
佳雋國際有限公司",2006-04-12,2007-10-26,"Private, ltd by shares"95,1037781,"GOODWILL RECYCLE COMPANY LIMITED",2006-04-12,2007-03-23,"Private, ltd by shares"96,1037802,"GRAND ATLANTIC LIMITED (d2017-12-01)
嘉海有限公司",2006-04-12,2017-12-01,"Private, ltd by shares"97,1037991,"GRAND HILL TRADING CONSULTANT LIMITED
宏峰貿易諮詢有限公司",2006-04-12,2017-08-11,"Private, ltd by shares"98,1037707,"GRANDLEY TECHNOLOGY INTERNATIONAL LIMITED
光利科技國際有限公司",2006-04-12,2008-06-13,"Private, ltd by shares"99,1037853,"GRANDSHINE ENTERPRISES LIMITED
利耀企業有限公司",2006-04-12,2018-10-05,"Private, ltd by shares"100,1037968,"GREATON MARINE (HOLDINGS) LIMITED
浩天航運集團有限公司",2006-04-12,2017-08-11,"Private, ltd by shares"101,1038001,"GreenScape Hua Hin OV Limited",2006-04-12,2012-05-11,"Private, ltd by shares"102,1037897,"GUANDA PRINTING PAPER PRODUCT COMPANY LIMITED
冠達印刷集團有限公司",2006-04-12,,"Private, ltd by shares"103,1037983,"H.K LIUYANGHE GROUP LIMITED
香港瀏陽河集團有限公司",2006-04-12,2010-07-23,"Private, ltd by shares"104,1038016,"H.K ZHENHUI TRADING LIMITED
香港振輝貿易有限公司",2006-04-12,,"Private, ltd by shares"105,1038012,"H.K ZHONGYI FURNITURE INT'L LIMITED
香港中意家居國際有限公司",2006-04-12,2010-12-03,"Private, ltd by shares"106,1037689,"H.K. (CHINA) Z.K. NEW ENERGY SOURCES INT'L HOLDING LIMITED
香港(中國)衆科新能源國際控股有限公司",2006-04-12,2010-08-13,"Private, ltd by shares"107,1037765,"H.K. C&amp;T GUINIAN TECH DEV. INT'L LIMITED
香港斯恩特桂念科技發展國際有限公司",2006-04-12,2012-05-11,"Private, ltd by shares"108,1037876,"H.K. GELE ELECTRIC (INT'L) GROUP CO., LIMITED
香港格力電器(國際)集團有限公司",2006-04-12,2010-12-03,"Private, ltd by shares"109,1037699,"H.K. HONGGUANG GREAT CAUSE FURNITURE GROUP LIMITED
香港鴻光偉業家具集團有限公司",2006-04-12,2010-12-03,"Private, ltd by shares"110,1037793,"Hail Aftereffect Limited",2006-04-12,2011-07-22,"Private, ltd by shares"111,1037760,"HANSCENT (CHINA) CO., LIMITED
漢哲實業(中國)有限公司",2006-04-12,2009-12-24,"Private, ltd by shares"112,1038013,"Hardware Technology Solutions Limited",2006-04-12,2018-11-16,"Private, ltd by shares"113,1038011,"HAWIN DEVELOPMENT LIMITED
樺建發展有限公司",2006-04-12,2011-09-09,"Private, ltd by shares"114,1037918,"HEXING ELECTRICAL CO., LIMITED",2006-04-12,2010-12-03,"Private, ltd by shares"115,1037926,"HING YIP ASIA DEVELOPMENT LIMITED
興業亞力發展有限公司",2006-04-12,2013-06-21,"Private, ltd by shares"116,1037975,"HK BROTHER HOLDING GROUP LIMITED
香港兄弟控股集團有限公司",2006-04-12,2019-09-06,"Private, ltd by shares"117,1037906,"HK DH INTERNATIONAL ARCHITECTURAL DESIGN CONSULTING CO., LIMITED
香港鼎煌國際建築規劃諮詢有限公司",2006-04-12,2012-05-11,"Private, ltd by shares"118,1037979,"HK DIAOHUANG FUR INT'L LIMITED
香港貂皇皮草國際有限公司",2006-04-12,2010-12-03,"Private, ltd by shares"119,1037950,"HK HONG YUAN CONSULTANTS LIMITED
香港鴻源企業管理諮詢有限公司",2006-04-12,2014-08-15,"Private, ltd by shares"120,1037711,"HK JISI FURNITURE GROUP LIMITED
香港吉思家具集團有限公司",2006-04-12,2012-05-11,"Private, ltd by shares"121,1037742,"HK KAIHONG INT'L LIGHTING LIMITED
香港凱鴻國際照明有限公司",2006-04-12,2010-09-30,"Private, ltd by shares"122,1037826,"HK REEL COLOR (GROUP) COSMETIC CO. LIMITED
香港真姿彩(集團)化妝品有限公司",2006-04-12,2012-05-11,"Private, ltd by shares"123,1037728,"HK ULTIMATE TECHNOLOGY CO., LIMITED
香港誇克科技有限公司",2006-04-12,2012-05-11,"Private, ltd by shares"124,1037916,"Honfield (China-HK) Limited
康耀(中港)有限公司",2006-04-12,2010-02-05,"Private, ltd by shares"125,1037970,"Hong Kong 1872 Golf Products Trading Limited
香港1872高爾夫用品貿易有限公司",2006-04-12,2010-12-03,"Private, ltd by shares"126,1037720,"HONG KONG BROWN FOREIGERS (INT'L) CHAIN JOB LIMITED
香港啡客(國際)連鎖事業有限公司",2006-04-12,2014-08-15,"Private, ltd by shares"127,1037778,"HONG KONG CHAO YU BIOTECHNOLOGY INTERNATIONAL LIMITED
香港超宇生物科技國際有限公司",2006-04-12,2010-12-03,"Private, ltd by shares"128,1037729,"HONG KONG CHINA&amp;FRANCE GRAPE WINE LIMITED
香港中法王朝葡萄釀酒有限公司",2006-04-12,2009-02-27,"Private, ltd by shares"129,1037905,"HONG KONG CISA FOOD INTERNATIONAL CO., LIMITED
香港西薩食品國際有限公司",2006-04-12,2017-12-01,"Private, ltd by shares"130,1037951,"HONG KONG DYS ELECTRONICS LIMITED
香港長齊電子有限公司",2006-04-12,2018-11-30,"Private, ltd by shares"131,1037832,"HONG KONG ENERGY INVESTMENT HOLDING LIMITED
香港能源投資控股有限公司",2006-04-12,,"Private, ltd by shares"132,1037731,"HONG KONG FIRST INTERNATIONAL DEVELOPMENT LIMITED
香港福斯特國際發展有限公司",2006-04-12,2015-04-02,"Private, ltd by shares"133,1037693,"HONG KONG HAO HAI CARBON HOLDINGS LIMITED
香港皓海碳素控股有限公司",2006-04-12,2009-11-06,"Private, ltd by shares"134,1037963,"HONG KONG HAO QIANG DEVELOPMENT LIMITED
香港浩強發展有限公司",2006-04-12,2014-08-15,"Private, ltd by shares"135,1037780,"HONG KONG HUA CUI FURNITURE GROUP LIMITED
香港華翠家具集團有限公司",2006-04-12,2019-01-18,"Private, ltd by shares"136,1037859,"HONG KONG HUITONG INVESTMENT GROUP CO., LIMITED
香港匯通投資集團有限公司",2006-04-12,2015-06-05,"Private, ltd by shares"137,1037974,"HONG KONG INTERNATIONAL YOGA INSTITUTE COMPANY LIMITED
香港國際瑜伽學院有限公司",2006-04-12,2013-06-21,"Private, ltd by shares"138,1037866,"HONG KONG JUSHENG INTERNATIONAL ENTERPRISE LIMITED
香港炬聖國際企業有限公司",2006-04-12,2012-05-11,"Private, ltd by shares"139,1037686,"HONG KONG POWER-WORTH INT'L TRADING DEV. LIMITED
香港騰發國際貿易發展有限公司",2006-04-12,2010-12-03,"Private, ltd by shares"140,1037777,"HONG KONG QUAN MEI FURNITURE GROUP LIMITED
香港全美家具集團有限公司",2006-04-12,2010-12-03,"Private, ltd by shares"141,1037949,"HONG KONG YIDA INT'L GROUP TRADE LIMITED
香港益達國際集團貿易有限公司",2006-04-12,2010-12-03,"Private, ltd by shares"142,1037730,"HONG KONG ZHANGYU GRAPE WINE HOLDING LIMITED
香港張裕葡萄釀酒股份有限公司",2006-04-12,2010-07-23,"Private, ltd by shares"143,1037817,"HONGKONG CONNECT FORTUNE TRADING COMPANY LIMITED
香港匯美貿易有限公司",2006-04-12,2009-03-20,"Private, ltd by shares"144,1037774,"HONGKONG EXHIBITION INTERNATIONAL GROUP LIMITED
香港會展國際集團有限公司",2006-04-12,2011-10-07,"Private, ltd by shares"145,1037977,"HONGKONG HEALTHY JADE INVESTMENT GROUP LIMITED
香港康翠投資集團有限公司",2006-04-12,2015-12-04,"Private, ltd by shares"146,1037930,"HONGKONG HOYOSUN INTERNATIONAL CULTURE TRANSMISSION CO., LIMITED
香港泓洋得美國際文化傳播有限公司",2006-04-12,2010-09-30,"Private, ltd by shares"147,1037786,"HONGKONG OCEAN ENTERPRISES CO., LIMITED",2006-04-12,2019-03-01,"Private, ltd by shares"148,1037925,"HONGKONG SHOU &amp; FU CO., LIMITED
香港壽爾福有限公司",2006-04-12,2016-02-19,"Private, ltd by shares"149,1038009,"HONGKONG TRANHOUSE TRADING LIMITED
香港千世好貿易有限公司",2006-04-12,2012-05-11,"Private, ltd by shares"150,1037727,"HONGKONG XIANGSILU ELECTROMOTION SCIENCE&amp;TECHNOLOGY CO., LIMITED
香港相思鹿電動科技有限公司",2006-04-12,2010-07-23,"Private, ltd by shares"151,1037931,"HONGKONG XIN CHANG INDUSTRIAL CO., LIMITED
香港鑫昌實業有限公司",2006-04-12,2010-09-24,"Private, ltd by shares"152,1037741,"HONGKONG XINSHENGDA INDUSTRY LIMITED
香港新勝達實業有限公司",2006-04-12,2010-12-03,"Private, ltd by shares"153,1037928,"HONGKONG XSYS FASHION INT'L CO., LIMITED
香港瀟灑依身服飾國際有限公司",2006-04-12,2010-09-30,"Private, ltd by shares"154,1037882,"HONGKONG ZONYI ELECTRONICS CO., LIMITED
香港增毅電子有限公司",2006-04-12,2007-09-21,"Private, ltd by shares"155,1037815,"HOP HING WAH WEI CONSTRUCTION LIMITED
合興華威工程有限公司",2006-04-12,,"Private, ltd by shares"156,1037694,"HOT SHOT MANAGER LIMITED
新人館經理人有限公司",2006-04-12,2013-06-21,"Private, ltd by shares"157,1037745,"HUA DI ELECTRICAL EQUIPMENT HOLDING (GUANG ZHOU) LIMITED
華帝電器集團(廣州)有限公司",2006-04-12,2010-07-30,"Private, ltd by shares"158,1037740,"HUI CHANG TEXTILES (HONG KONG) LIMITED
惠昌紡織(香港)有限公司",2006-04-12,2017-12-01,"Private, ltd by shares"159,1037706,"IAS Asia Limited",2006-04-12,,"Private, ltd by shares"160,1037834,"Ichitech Property Agency Limited
日昇地產代理有限公司",2006-04-12,,"Private, ltd by shares"161,1037796,"imoshion Limited",2006-04-12,2017-09-29,"Private, ltd by shares"162,1037822,"INT'L CULTURE &amp; HEALTH INDUSTRY INVESTMENT GROUP LIMITED
國際文化健康產業投資集團有限公司",2006-04-12,2010-12-03,"Private, ltd by shares"163,1037776,"INTERNATIONAL KEYBRIDGE TECHNOLOGIES COMPANY LIMITED
國際鍵橋技術有限公司",2006-04-12,2008-02-22,"Private, ltd by shares"164,1037878,"INVENTION COMPANY LIMITED",2006-04-12,2007-07-20,"Private, ltd by shares"165,1037959,"ITAL GASTRO LIMITED",2006-04-12,2014-08-22,"Private, ltd by shares"166,1037980,"ITALY JINJULAI CAR INDUSTRY TECHNOLOGY DEVELOPMENT LIMITED
意大利金聚來車業科技發展有限公司",2006-04-12,2010-12-03,"Private, ltd by shares"167,1037984,"ITALY PIERCADAN FAMOUS FASHION LIMITED
意大利皮爾卡丹名品服飾有限公司",2006-04-12,2010-12-03,"Private, ltd by shares"168,1037919,"IXT SYSTEMS INTERNATIONAL LIMITED",2006-04-12,,"Private, ltd by shares"169,1037954,"J.R.FUR TRADING LIMITED
加亞毛皮貿易有限公司",2006-04-12,,"Private, ltd by shares"170,1037944,"JALARAM ENTERPRISES LIMITED",2006-04-12,,"Private, ltd by shares"171,1037934,"JAPAN SWEETEN INT'L GROUP LIMITED
日本秀身堂國際集團有限公司",2006-04-12,2011-08-12,"Private, ltd by shares"172,1037957,"JEN DOW COMPANY LIMITED
展圖實業有限公司",2006-04-12,2010-12-03,"Private, ltd by shares"173,1037838,"JFL &amp; PARTNERS LIMITED",2006-04-12,2008-06-06,"Private, ltd by shares"174,1037749,"JIACHENG PEARL (HONG KONG) LIMITED
嘉成珍珠(香港)有限公司",2006-04-12,2007-11-16,"Private, ltd by shares"175,1037941,"JIAMINGDA ELECTRONICS (HONGKONG) CO., LIMITED
佳銘達電子(香港)有限公司",2006-04-12,2013-03-08,"Private, ltd by shares"176,1038022,"JIANSHE MOTORCYCLE CO., LIMITED
建設摩托有限公司",2006-04-12,,"Private, ltd by shares"177,1037933,"JIEMEI (HONGKONG) ELECTRONICS CO., LIMITED
捷美(香港)電子有限公司",2006-04-12,2010-09-30,"Private, ltd by shares"178,1037809,"JQGE (HK) CO. LIMITED",2006-04-12,,"Private, ltd by shares"179,1037763,"JTS COMPANY LIMITED
駿達利有限公司",2006-04-12,,"Private, ltd by shares"180,1037947,"JUN LONG MARKETING LIMITED
俊朗營銷策劃有限公司",2006-04-12,2016-04-22,"Private, ltd by shares"181,1037943,"JYC INDUSTRIAL (H.K) LIMITED
龐玻實業集團有限公司",2006-04-12,,"Private, ltd by shares"182,1037761,"K LI &amp; PARTNERS CERTIFIED PUBLIC ACCOUNTANTS LIMITED",2006-04-12,2006-11-17,"Private, ltd by shares"183,1037910,"KA OPTICAL CO., LIMITED",2006-04-12,,"Private, ltd by shares"184,1037743,"KAI WEI (HONG KONG) ELECTRONIC COMPANY LIMITED
凱威(香港)電子有限公司",2006-04-12,2012-05-11,"Private, ltd by shares"185,1037801,"KALIWELL LIMITED
嘉利華有限公司",2006-04-12,2007-07-27,"Private, ltd by shares"186,1037785,"KAM LEE SHING PLASTIC LIMITED
金利成塑膠有限公司",2006-04-12,,"Private, ltd by shares"187,1037724,"KEANOS INTL LIMITED
昕諾國際有限公司",2006-04-12,,"Private, ltd by shares"188,1037758,"KEI CHEONG TRADING COMPANY LIMITED (d2019-01-18)
騏昌貿易有限公司",2006-04-12,2019-01-18,"Private, ltd by shares"189,1037923,"KEKE PET'S SUPPLIES (HK) INDUSTRIAL LIMITED
可可寵物用品(香港)實業有限公司",2006-04-12,2010-12-03,"Private, ltd by shares"190,1038020,"KEMKLEN TECHNICAL SERVICES (ZS) LIMITED
劍橋機械修理(舟山)有限公司",2006-04-12,,"Private, ltd by shares"191,1037771,"KINGBOSS INTERNATIONAL (HK) LIMITED
金博國際(香港)有限公司",2006-04-12,2017-12-01,"Private, ltd by shares"192,1037927,"KINGNEA INDUSTRIAL (HK) CO., LIMITED
凱甯實業(香港)有限公司",2006-04-12,2010-09-30,"Private, ltd by shares"193,1037755,"KINGSWOOD DECORATION ENG. LIMITED
金滙裝飾工程有限公司",2006-04-12,,"Private, ltd by shares"194,1037845,"KO SHING GLOBAL LIMITED
高成實業(集團)有限公司",2006-04-12,,"Private, ltd by shares"195,1037735,"KOREA AN'S COSMETICS COMPANY LIMITED
韓國安氏化妝品株式會社有限公司",2006-04-12,2014-08-15,"Private, ltd by shares"196,1037978,"KOREAN HANYOU (INT'L) GROUP LIMITED
韓國韓友(國際)集團有限公司",2006-04-12,,"Private, ltd by shares"197,1037830,"KRAKERS MARKETING &amp; MEDIA CONSULTANCY LIMITED",2006-04-12,,"Private, ltd by shares"198,1037703,"KUDOS ENTERPRISES LIMITED (d2007-09-21)
冠濤企業有限公司",2006-04-12,2007-09-21,"Private, ltd by shares"199,1037875,"KWONG YUEN TECHNOLOGIES INDUSTRIAL LIMITED
廣源科技實業有限公司",2006-04-12,2013-06-21,"Private, ltd by shares"200,1037700,"LANNING INTERNATIONAL INVESTMENT GROUP (HK) LIMITED
香港蘭菱國際集團投資有限公司",2006-04-12,2014-08-15,"Private, ltd by shares"201,1037855,"LANWIN ENTERPRISES LIMITED
利和企業有限公司",2006-04-12,,"Private, ltd by shares"202,1038003,"LEADER HONOR INTERNATIONAL LIMITED
領譽國際有限公司",2006-04-12,2009-03-06,"Private, ltd by shares"203,1037948,"LEADERS RIBBONS (HONG KONG) LIMITED
領先絲帶(香港)有限公司",2006-04-12,2008-02-01,"Private, ltd by shares"204,1037788,"LEE TUNG DECORATION AND FITTINGS LIMITED
利東裝修工程有限公司",2006-04-12,2008-09-12,"Private, ltd by shares"205,1037697,"LEX COMPUTECH COMPANY LIMITED
博來科技有限公司",2006-04-12,2019-06-21,"Private, ltd by shares"206,1038005,"LI YAO INTERNATIONAL TRADING (HONG KONG) DEVELOPING COMPANY LIMITED
利瑤國際貿易(香港)發展有限公司",2006-04-12,,"Private, ltd by shares"207,1037833,"LIAM ENTERPRISES LIMITED",2006-04-12,2015-09-04,"Private, ltd by shares"208,1037823,"LILONG INTERNATIONAL GROUP LIMITED
利隆國際集團有限公司",2006-04-12,2010-12-03,"Private, ltd by shares"209,1037993,"LINDA &amp; COMPANY HOLDINGS LIMITED
欣和洋行有限公司",2006-04-12,2012-05-11,"Private, ltd by shares"210,1037710,"LONGEVITY TIMES (CHINA) GROUP LIMITED
長壽時代(中國)集團有限公司",2006-04-12,2010-12-03,"Private, ltd by shares"211,1038017,"MABO INTERNATIONAL LIMITED
美波國際有限公司",2006-04-12,,"Private, ltd by shares"212,1037886,"MAGELLANO LIMITED",2006-04-12,2017-12-01,"Private, ltd by shares"213,1037964,"MAGNIFICENT PROFITS LIMITED
盈利宏有限公司",2006-04-12,,"Private, ltd by shares"214,1037818,"MASCOT STORY INTERNATIONAL GROUP CO., LIMITED
吉祥物語國際集團有限公司",2006-04-12,,"Private, ltd by shares"