,Reg no.,Name,Incorp-orated,Dissolved,Type214,1037538,"NEW ERA GROUP (CHINA) INVESTMENT LIMITED
新時代集團(中國)投資有限公司",2006-04-11,2009-09-18,"Private, ltd by shares"215,1037601,"NEW GLOBAL CONCEPT COMPANY LIMITED
寰宇創念有限公司",2006-04-11,,"Private, ltd by shares"216,1037567,"NEW VIEW INTERNATIONAL (HONGKONG) CO., LIMITED
新視界國際(香港)有限公司",2006-04-11,,"Private, ltd by shares"217,1037577,"NEWSTA COMPANY LIMITED
新事達有限公司",2006-04-11,,"Private, ltd by shares"218,1037533,"NEXUM LIMITED (d2008-09-05)",2006-04-11,2008-09-05,"Private, ltd by shares"219,1037441,"NGAI WANG INDUSTRIAL LIMITED
毅宏實業有限公司",2006-04-11,2012-06-22,"Private, ltd by shares"220,1037535,"OCEAN MARINE SERVICE CO., LIMITED (d2015-12-04)",2006-04-11,2015-12-04,"Private, ltd by shares"221,1037590,"ONLINE TRADING CORP LIMITED
在綫交易有限公司",2006-04-11,2017-09-01,"Private, ltd by shares"222,1037383,"ORIENT ESCAPES LIMITED",2006-04-11,2012-05-11,"Private, ltd by shares"223,1037389,"ORIENTAL ASSETS HOLDING LIMITED",2006-04-11,,"Private, ltd by shares"224,1037459,"OUTDOWORLD TECHNOLOGY CO., LIMITED
奧度科技有限公司",2006-04-11,2010-12-03,"Private, ltd by shares"225,1037677,"OWL INDUSTRY (HK) CO., LIMITED
澳威萊實業有限公司",2006-04-11,2019-03-29,"Private, ltd by shares"226,1037606,"PAIFANG MANAGEMENT LIMITED
滙牌坊管理有限公司",2006-04-11,,"Private, ltd by shares"227,1037434,"PANTAC GEAR INDUSTRIES LIMITED
輝騰工業(亞洲)有限公司",2006-04-11,,"Private, ltd by shares"228,1037560,"PARISFECO INTERNATIONAL BUSINESS TRAVEL (HK) LIMITED
巴黎斯飛科國際商旅 (香港) 有限公司",2006-04-11,2014-08-22,"Private, ltd by shares"229,1037499,"PARTIC (ASIA) CONSULTANTS LIMITED
百業(亞洲)顧問有限公司",2006-04-11,,"Private, ltd by shares"230,1037370,"Partners Asset Management (HK) Limited
博大資產管理(香港)有限公司",2006-04-11,,"Private, ltd by shares"231,1037553,"PETRO TIAN HE (INTERNATIONAL) INDUSTRIAL HOLDINGS LIMITED
天和石化(國際)實業集團股份有限公司",2006-04-11,2010-02-12,"Private, ltd by shares"232,1037476,"PHILIP KITCHEN SANITATION (HOLAND) INT'L LIMITED
飛利浦廚衛(荷蘭)國際有限公司",2006-04-11,2018-09-21,"Private, ltd by shares"233,1037608,"PLATINUM RESOURCES LIMITED (d2010-12-03)",2006-04-11,2010-12-03,"Private, ltd by shares"234,1037367,"PRAISE PHOENIX HOLDINGS LIMITED
嘉鳳集團有限公司",2006-04-11,2010-12-03,"Private, ltd by shares"235,1037447,"PRESITEX CORPORATION (HONG KONG) LIMITED
統鼎聯合(香港)有限公司",2006-04-11,2008-03-28,"Private, ltd by shares"236,1037680,"PROGEN. INDUSTRIAL COMPANY LIMITED
寶興工業有限公司",2006-04-11,,"Private, ltd by shares"237,1037564,"PUBLIC RESOURCES (HOLDINGS) CO., LIMITED
大眾能源化工集團有限公司",2006-04-11,2007-06-22,"Private, ltd by shares"238,1037365,"R&amp;A INTERNATIONAL LIMITED
奧德瑞國際有限公司",2006-04-11,,"Private, ltd by shares"239,1037403,"RICH TIME INTERNATIONAL TRADING LIMITED
時達國際貿易有限公司",2006-04-11,,"Private, ltd by shares"240,1037408,"RICHWAY INVESTMENT (GROUP) LIMITED (d2008-12-19)
時富投資(集團)有限公司",2006-04-11,2008-12-19,"Private, ltd by shares"241,1037474,"RICHWOOD CO., LIMITED (d2015-09-11)
富森木業有限公司",2006-04-11,2015-09-11,"Private, ltd by shares"242,1037486,"ROYAL PET FOOD (HK) LIMITED
香港英皇寵物食品有限公司",2006-04-11,2012-05-11,"Private, ltd by shares"243,1037624,"SAMWO (HK) INDUSTRIAL CO., LIMITED
三和(香港)實業有限公司",2006-04-11,2008-11-07,"Private, ltd by shares"244,1037528,"SANSIBLE CORPORATION LIMITED
成豐號有限公司",2006-04-11,,"Private, ltd by shares"245,1037508,"SEA CHEERFUL IRONWARE COMPANY LIMITED
海興五金有限公司",2006-04-11,2019-01-25,"Private, ltd by shares"246,1037576,"SEA POWER RECYCLE COMPANY LIMITED
海裕環保處理有限公司",2006-04-11,,"Private, ltd by shares"247,1037440,"SHARP ADVANCE LIMITED
可鋒有限公司",2006-04-11,,"Private, ltd by shares"248,1037531,"SHD INTERNATIONAL (CHINA) CO., LIMITED
速航達國際(中國)有限公司",2006-04-11,2014-08-15,"Private, ltd by shares"249,1037363,"SILVER BASE WINE &amp; SPIRIT LIMITED
銀基洋酒有限公司",2006-04-11,,"Private, ltd by shares"250,1037614,"SILVERSTAR INVESTMENTS LIMITED
銀達投資有限公司",2006-04-11,,"Private, ltd by shares"251,1037594,"SINO PETROLEUM INTERNATIONAL LIMITED
香港中油國際有限公司",2006-04-11,,"Private, ltd by shares"252,1037498,"SKY HOLY INTERNATIONAL FINANCIAL (HONG KONG) INVESTMENT HOLDING LIMITED
天聖國際金融(香港)投資集團有限公司",2006-04-11,2012-05-11,"Private, ltd by shares"253,1037607,"SMARTGREEN LIMITED
卓鈞有限公司",2006-04-11,,"Private, ltd by shares"254,1037512,"SMS SPECIAL-MARKETING-SHOES LIMITED",2006-04-11,2009-05-08,"Private, ltd by shares"255,1037568,"SOKON TECHNOLOGY (HK) LIMITED
創裕豐科技(香港)有限公司",2006-04-11,,"Private, ltd by shares"256,1037413,"SOUTH PACIFIC INVESTMENT (GROUP) LIMITED
南洋投資(集團)有限公司",2006-04-11,2019-01-25,"Private, ltd by shares"257,1037425,"SPEEDY ENTERPRISE LIMITED
高捷企業有限公司",2006-04-11,2012-05-11,"Private, ltd by shares"258,1037410,"SPEEDY INVESTMENT DEVELOPMENT LIMITED
快捷投資發展有限公司",2006-04-11,,"Private, ltd by shares"259,1037520,"SPLASH TRADING LIMITED (d2015-06-05)",2006-04-11,2015-06-05,"Private, ltd by shares"260,1037445,"STANDARD STAR LIMITED
準星有限公司",2006-04-11,2018-12-21,"Private, ltd by shares"261,1037430,"STAR INTERNATIONAL HOLDINGS LIMITED (d2012-08-10)
日星國際集團有限公司",2006-04-11,2012-08-10,"Private, ltd by shares"262,1037399,"SUN INVESTMENT DEVELOPMENT LIMITED
太陽投資發展有限公司",2006-04-11,,"Private, ltd by shares"263,1037661,"SUN MEI SHI ENGINEERING LIMITED
新美時工程有限公司",2006-04-11,,"Private, ltd by shares"264,1037542,"SUNDIA (HONG KONG) CHEMICAL CO., LIMITED
香港新迪雅化工有限公司",2006-04-11,,"Private, ltd by shares"265,1037455,"SUNTONE LIMITED (d2008-03-07)
申通有限公司",2006-04-11,2008-03-07,"Private, ltd by shares"266,1037392,"SUPER INVESTMENT DEVELOPMENT LIMITED
順豪投資發展有限公司",2006-04-11,2019-09-20,"Private, ltd by shares"267,1037427,"SUPER WAY LOGISTICS LIMITED
駿昇物流有限公司",2006-04-11,2012-05-11,"Private, ltd by shares"268,1037460,"SUPEROR INT'L (HK) CO., LIMITED
超域國際(香港)有限公司",2006-04-11,2012-05-11,"Private, ltd by shares"269,1037483,"SURPLUS HONG KONG GROUP LIMITED (d2009-04-17)
時利香港集團有限公司",2006-04-11,2009-04-17,"Private, ltd by shares"270,1037442,"SURPLUS KEY LIMITED
馳裕有限公司",2006-04-11,,"Private, ltd by shares"271,1037451,"SUSHI MASA (HONG KONG) LIMITED
壽司正(香港)有限公司",2006-04-11,2018-01-12,"Private, ltd by shares"272,1037446,"TAK SHING HONG DEVELOPMENT LIMITED
德成行發展有限公司",2006-04-11,,"Private, ltd by shares"273,1037565,"TARAZ LIMITED
塔拉孜有限公司",2006-04-11,,"Private, ltd by shares"274,1037620,"TAYLOR WOODS EDUCATION GROUP LIMITED
泰來教育集團控股有限公司",2006-04-11,2010-12-03,"Private, ltd by shares"275,1037405,"TEAM ON INVESTMENT DEVELOPMENT LIMITED
天安投資發展有限公司",2006-04-11,2008-09-19,"Private, ltd by shares"276,1037637,"TEWANG SCIENCE &amp; TECHNOLOGY HK COMPANY LIMITED
特旺科技香港有限公司",2006-04-11,2012-05-11,"Private, ltd by shares"277,1037561,"THINKVIEW (HONG KONG) LIMITED
暢想視界(香港)有限公司",2006-04-11,2019-05-03,"Private, ltd by shares"278,1037458,"TIMES TOPYOUNG (KOREA) INVESTMENT DEV. LIMITED
時代天元(韓國)投資發展有限公司",2006-04-11,2010-12-03,"Private, ltd by shares"279,1037522,"TINGTA COMPANY LIMITED
鐵斯天龍有限公司",2006-04-11,2011-09-30,"Private, ltd by shares"280,1037654,"TOPCON BEIJING (H.K.) LIMITED
北京拓普康(香港)有限公司",2006-04-11,,"Private, ltd by shares"281,1037396,"TOPRICH INVESTMENT DEVELOPMENT LIMITED
富豪投資發展有限公司",2006-04-11,,"Private, ltd by shares"282,1037602,"TOYOO INTERNATIONAL ELECTRONICS TECHNOLOGY LIMITED
東洋國際電子科技有限公司",2006-04-11,2010-12-03,"Private, ltd by shares"283,1037437,"TRANS-GLOBAL ENGINEERING LIMITED (d2010-12-03)
寰宇工程有限公司",2006-04-11,2010-12-03,"Private, ltd by shares"284,1037393,"TREASURE ISLAND (ASIA) LIMITED
寶山(亞洲)有限公司",2006-04-11,2010-05-14,"Private, ltd by shares"285,1037651,"TRIPLEX CONSTRUCTION LIMITED (d2010-04-23)
毅傑建設有限公司",2006-04-11,2010-04-23,"Private, ltd by shares"286,1037514,"TROSENV ELECTRONICS (HONG KONG) CO., LIMITED
創盛威電子(香港)有限公司",2006-04-11,2012-05-11,"Private, ltd by shares"287,1037511,"TURTLE &amp; THE HARE COMPANY LIMITED",2006-04-11,,"Private, ltd by shares"288,1037657,"UK ROYAL YILISHABAI INTERNATIONAL GROUP LIMITED
英國皇家伊儷莎白國際集團有限公司",2006-04-11,2011-08-12,"Private, ltd by shares"289,1037462,"UNFURL INTERNATIONAL LIMITED
展翅國際有限公司",2006-04-11,2008-03-07,"Private, ltd by shares"290,1037454,"UNFURL LIMITED (d2008-03-07)
展翅有限公司",2006-04-11,2008-03-07,"Private, ltd by shares"291,1037489,"UNION INTERNATIONAL CONTRACTORS LIMITED",2006-04-11,2012-05-11,"Private, ltd by shares"292,1037415,"UNION POWER HOLDINGS LIMITED
順力集團有限公司",2006-04-11,,"Private, ltd by shares"293,1037453,"UNITED MANUFACTURING INDUSTRIES COMPANY LIMITED
聯合制造有限公司",2006-04-11,,"Private, ltd by shares"294,1037582,"USA HOLLYWOOD (CHINA) GROUP LIMITED
美國好萊塢(中國)集團有限公司",2006-04-11,2020-01-03,"Private, ltd by shares"295,1037571,"VITTHAL PANDURANG INTERNATIONAL LIMITED
威派國際貿易有限公司",2006-04-11,,"Private, ltd by shares"296,1037537,"W&amp;T ENGINEERING CONSULTANTS LIMITED
宏天工程顧問有限公司",2006-04-11,,"Private, ltd by shares"297,1037579,"WAH YUE PROPERTY AGENCY LIMITED
華裕地產代理有限公司",2006-04-11,,"Private, ltd by shares"298,1037493,"WAHAHA GROUP (HONG KONG) INTERNATIONAL LIMITED
娃哈哈集團(香港)國際有限公司",2006-04-11,2010-07-30,"Private, ltd by shares"299,1037504,"WAI SHUN AIR-CONDITIONING ENGINEERING LIMITED
威順冷氣工程有限公司",2006-04-11,2013-06-21,"Private, ltd by shares"300,1037642,"WAI TAT MANUFACTORY LIMITED
偉達皮具五金有限公司",2006-04-11,2008-04-18,"Private, ltd by shares"301,1037552,"WAI TAT TRADING &amp; TRANSPORTATION COMPANY LIMITED
偉達貿易運輸有限公司",2006-04-11,,"Private, ltd by shares"302,1037418,"WANG KING TAI LIMITED
宏景泰有限公司",2006-04-11,,"Private, ltd by shares"303,1037376,"WANHE INTERNATIONAL INVESTMENT GROUP (HONG KONG) CORPORATION LIMITED
萬合國際投資集團(香港)有限公司",2006-04-11,2012-05-11,"Private, ltd by shares"304,1037629,"WARMHOUSE INDUSTRIAL LIMITED",2006-04-11,2014-08-15,"Private, ltd by shares"305,1037635,"WASIONY TECHNOLOGY (HK) CO., LIMITED
華夏芯科技(香港)有限公司",2006-04-11,,"Private, ltd by shares"306,1037609,"WEALTHMOOD LIMITED
福濠有限公司",2006-04-11,,"Private, ltd by shares"307,1037519,"WEIYE INTERNATIONAL LIMITED
偉燕國際有限公司",2006-04-11,,"Private, ltd by shares"308,1037555,"WELL KONG NAM RESTAURANT LIMITED
薈江南菜館有限公司",2006-04-11,2008-09-12,"Private, ltd by shares"309,1037395,"WELLTEC (HK) INTERNATIONAL FINANCIAL INVEST HOLDING GROUP LIMITED
華大(香港)國際金融投資控股集團有限公司",2006-04-11,,"Private, ltd by shares"310,1037682,"WINDERMERE LIMITED (HK)
威成利有限公司",2006-04-11,,"Private, ltd by shares"311,1037587,"WINDOWS KING CONSTRUCTION LIMITED
鋁窗王工程有限公司",2006-04-11,2008-10-17,"Private, ltd by shares"312,1037597,"Winland Container Lines Limited",2006-04-11,2015-06-05,"Private, ltd by shares"313,1037424,"WINSON INVESTMENT (GROUP) LIMITED (d2009-08-21)
永成投資(集團)有限公司",2006-04-11,2009-08-21,"Private, ltd by shares"314,1037377,"WISH ENTERPRISES CO., LIMITED
希望企業有限公司",2006-04-11,2017-11-17,"Private, ltd by shares"315,1037621,"WISING FOUNDATION LIMITED
華興創建有限公司",2006-04-11,,"Private, ltd by shares"316,1037428,"WOODLAND DECORATION LIMITED
浩森裝飾工程有限公司",2006-04-11,2010-06-04,"Private, ltd by shares"317,1037536,"XAGO Retail (HK) Limited",2006-04-11,,"Private, ltd by shares"318,1037638,"YENGGI LIMITED
盈姿有限公司",2006-04-11,,"Private, ltd by shares"319,1037627,"YF PACKAGING INDUSTRIAL LIMITED
藝豐包裝實業有限公司",2006-04-11,2011-12-16,"Private, ltd by shares"320,1037525,"YIFU － ROOSEVELT LIMITED
益富 － 羅斯福有限公司",2006-04-11,2007-09-07,"Private, ltd by shares"321,1037659,"YU SHEN TECHNOLOGY (HONGKONG) CO., LIMITED
宇深科技(香港)有限公司",2006-04-11,2010-12-03,"Private, ltd by shares"