,Reg no.,Name,Incorp-orated,Dissolved,Type1,1019603,"1 PAGE NET (CHINA) CO., LIMITED
首頁網絡(中國)有限公司",2006-01-16,2014-07-04,"Private, ltd by shares"2,1019639,"180PLUS ASIA PACIFIC CORPORATION LIMITED",2006-01-16,2008-08-15,"Private, ltd by shares"3,1019632,"A 2 Z CO., LIMITED",2006-01-16,2015-04-24,"Private, ltd by shares"4,1019554,"A. L. TRADING LIMITED
晟銨貿易有限公司",2006-01-16,,"Private, ltd by shares"5,1019725,"ALLISON CONSULTING LIMITED (d2010-06-11)
歷迅顧問有限公司",2006-01-16,2010-06-11,"Private, ltd by shares"6,1019561,"AMERICA VAIENTINO INT'L INVESTMENT LIMITED
美國華倫天奴國際投資有限公司",2006-01-16,2010-06-11,"Private, ltd by shares"7,1019486,"AMUSEMAN PARK LIMITED",2006-01-16,,"Private, ltd by shares"8,1019606,"ANGELUS EVENT ORGANIZER LIMITED",2006-01-16,2012-01-13,"Private, ltd by shares"9,1019449,"ANOTECH INTERNATIONAL HOLDINGS LIMITED
安諾特國際控股有限公司",2006-01-16,,"Private, ltd by shares"10,1019517,"APEX VANS EXPRESS LIMITED
浩鉦運輸有限公司",2006-01-16,2017-09-08,"Private, ltd by shares"11,1019598,"ARCO ASIA CO., LIMITED",2006-01-16,,"Private, ltd by shares"12,1019682,"ARTEK MICROELECTRONICS (HK) CO., LIMITED
炬才微電子(香港)有限公司",2006-01-16,,"Private, ltd by shares"13,1019499,"ASCENT INFORMATION MANAGEMENT LIMITED
晴朗資訊管理有限公司",2006-01-16,2014-10-31,"Private, ltd by shares"14,1019588,"ASIA NOBLE METAL (HK) LIMITED
亞洲貴金屬(香港)有限公司",2006-01-16,2010-10-08,"Private, ltd by shares"15,1019493,"ASIA PINE CHEMICAL HONGKONG LIMITED
亞洲博恩化工香港有限公司",2006-01-16,2012-08-24,"Private, ltd by shares"16,1019581,"ASIA SHOJI CO., LIMITED
亞洲商事有限公司",2006-01-16,,"Private, ltd by shares"17,1019491,"ASIAN INSTITUTE OF CHINESE CULTURE LIMITED (THE)
亞洲中華文化研究院有限公司",2006-01-16,2017-12-29,"Ltd by guarantee"18,1019467,"ATLANTA ADVANCED COMMUNICATIONS HOLDINGS LIMITED
亞迅集團有限公司",2006-01-16,2013-03-15,"Private, ltd by shares"19,1019715,"AUSTWAH INDUSTRIES LIMITED
澳思華實業有限公司",2006-01-16,2015-04-24,"Private, ltd by shares"20,1019522,"BEYOND GLOBAL CO., LIMITED
環球致遠有限公司",2006-01-16,,"Private, ltd by shares"21,1019705,"BROADWAY CONSULTANTS LIMITED (d2008-06-13)
博達顧問有限公司",2006-01-16,2008-06-13,"Private, ltd by shares"22,1019658,"BUDDHA DORDENMA IMAGE LIMITED",2006-01-16,2007-09-14,"Private, ltd by shares"23,1019468,"CAMILLA FINANCE LIMITED",2006-01-16,2012-06-08,"Private, ltd by shares"24,1019667,"CANADA LIBONT PLANT PROTECTION LIMITED
加拿大植物保護有限公司",2006-01-16,2012-01-13,"Private, ltd by shares"25,1019511,"CANWIN ENTERPRISES LIMITED
建煌企業有限公司",2006-01-16,,"Private, ltd by shares"26,1019617,"CARLON SHIPPING LIMITED",2006-01-16,,"Private, ltd by shares"27,1019559,"CASH HANDLING SOLUTIONS LIMITED (d2008-04-18)
捷現有限公司",2006-01-16,2008-04-18,"Private, ltd by shares"28,1019624,"CD DRAGON LIMITED",2006-01-16,2012-01-13,"Private, ltd by shares"29,1019566,"CHAO YANG INTERNATIONAL INVESTMENT LIMITED
朝陽國際投資有限公司",2006-01-16,2011-08-12,"Private, ltd by shares"30,1019519,"CHINA SOCIAL WORKERS BUILDING CONSTRUCTION LIMITED
中國社工大廈建設有限公司",2006-01-16,2012-01-13,"Private, ltd by shares"31,1019642,"CHINA TAISHEN TECHNOLOGY GROUP LIMITED
中國泰申科技集團有限公司",2006-01-16,2019-11-15,"Private, ltd by shares"32,1019574,"CHUN KING (PROFESSIONAL) SANITARY SERVICES LIMITED
晉景(專業)清潔服務有限公司",2006-01-16,,"Private, ltd by shares"33,1019612,"CNJU ELECTRONIC (H.K.) CO., LIMITED
辰駒電子(香港)有限公司",2006-01-16,,"Private, ltd by shares"34,1019586,"COACH HILL CONSTRUCTION ENGINEERING LIMITED
灝峯建築工程有限公司",2006-01-16,2015-12-18,"Private, ltd by shares"35,1019694,"COCODUCK LIMITED",2006-01-16,2008-11-14,"Private, ltd by shares"36,1019670,"Company Registration Number 1019670 Limited
公司註冊編號 1019670 有限公司",2006-01-16,2017-01-20,"Private, ltd by shares"37,1019623,"COSMETICS RESOURCES INT'L LIMITED
美源國際股份有限公司",2006-01-16,,"Private, ltd by shares"38,1019503,"CP MARINE TECHNOLOGY LIMITED
華誼船舶設備有限公司",2006-01-16,,"Private, ltd by shares"39,1019472,"CUMIC STEEL LIMITED
中聯物產有限公司",2006-01-16,,"Private, ltd by shares"40,1019616,"CWELL INTERNATIONAL CO., LIMITED",2006-01-16,,"Private, ltd by shares"41,1019587,"DALY GARMENTS CO., LIMITED
達俐服裝有限公司",2006-01-16,,"Private, ltd by shares"42,1019611,"DANIEL MEDICAL MANAGEMENT &amp; INVESTMENT LIMITED
丹尼奧醫療管理及投資有限公司",2006-01-16,2008-05-30,"Private, ltd by shares"43,1019622,"DB-GYL Energy Limited
古優拉都邦能源有限公司",2006-01-16,2010-10-29,"Private, ltd by shares"44,1019490,"DECO INVESTMENT (H.K.) CO., LIMITED
香港德之凱投資有限公司",2006-01-16,2018-10-05,"Private, ltd by shares"45,1019657,"DELUXES CO. LIMITED
利華潮流有限公司",2006-01-16,2008-01-18,"Private, ltd by shares"46,1019628,"DIAMOND ASIA LIMITED
迪文亞洲有限公司",2006-01-16,,"Private, ltd by shares"47,1019507,"DIGILIFE EXPLORER LIMITED
數碼生活有限公司",2006-01-16,2007-06-22,"Private, ltd by shares"48,1019645,"Dong-Yun International Co., Limited
東韻國際有限公司",2006-01-16,,"Private, ltd by shares"49,1019494,"DRAGON FLY INTERNATIONAL (HONG KONG) GROUP LIMITED
天龍國際(香港)集團有限公司",2006-01-16,2010-06-11,"Private, ltd by shares"50,1019577,"DREAMSTORE HONG KONG LIMITED",2006-01-16,,"Private, ltd by shares"51,1019731,"DRESS CODE INTERNATIONAL CO LIMITED
服裝規則國際有限公司",2006-01-16,2009-07-03,"Private, ltd by shares"52,1019562,"DUROSTONE (ASIA) LIMITED",2006-01-16,2014-02-28,"Private, ltd by shares"53,1019652,"E-Tong Trading (Hong Kong) Company Limited
依潼貿易(香港)有限公司",2006-01-16,2007-08-03,"Private, ltd by shares"54,1019464,"East Asia Radio Technologies Limited
東亞電台科技有限公司",2006-01-16,2019-09-25,"Private, ltd by shares"55,1019681,"EAST INNOVATION (HONGKONG) CO., LIMITED
創意東方(香港)有限公司",2006-01-16,,"Private, ltd by shares"56,1019457,"EASTTOP INTERNATIONAL (H.K) LIMITED
東浚國際(香港)有限公司",2006-01-16,,"Private, ltd by shares"57,1019527,"EMERSON ELECTRONICS LIMITED
安迅電子有限公司",2006-01-16,,"Private, ltd by shares"58,1019701,"EMPRESS CONSULTANTS LIMITED
凱昇顧問有限公司",2006-01-16,,"Private, ltd by shares"59,1019609,"EXCEL CONSULTING AND INVESTMENT COMPANY LIMITED",2006-01-16,2010-06-18,"Private, ltd by shares"60,1019716,"EXCELLENT PROPERTY AGENCY LIMITED
卓越物業代理有限公司",2006-01-16,2010-06-11,"Private, ltd by shares"61,1019448,"EYEWORKZ LIMITED",2006-01-16,2017-09-01,"Private, ltd by shares"62,1019453,"FAIRY FOX (HK) GROUP LIMITED
聖天狐(香港)國際集團有限公司",2006-01-16,,"Private, ltd by shares"63,1019521,"FASHION DEVELOPMENT INTERNATIONAL LIMITED
時尚發展國際有限公司",2006-01-16,2019-09-27,"Private, ltd by shares"64,1019576,"FEDERAL MERCHANDISING (H.K.) LIMITED
臻懋股份有限公司",2006-01-16,2007-12-07,"Private, ltd by shares"65,1019549,"FINE JEWELLERY (D &amp; M) LIMITED
美鑽珠寶制造有限公司",2006-01-16,2015-04-24,"Private, ltd by shares"66,1019534,"FINLAND HARVEST PATH GROUP LIMITED (d2010-06-11)
芬蘭豐之道集團有限公司",2006-01-16,2010-06-11,"Private, ltd by shares"67,1019707,"FIRST CHAMPION LOGISTICS LIMITED
冠軍物流有限公司",2006-01-16,2018-08-31,"Private, ltd by shares"68,1019514,"First-Class Management Consultants Limited
甲級管理顧問有限公司",2006-01-16,2012-01-13,"Private, ltd by shares"69,1019531,"FONG'S INTERNATIONAL HOLDINGS LIMITED
方氏國際集團有限公司",2006-01-16,2012-05-04,"Private, ltd by shares"70,1019498,"FORESIGHT TECHNOLOGIES LIMITED
遠見科技有限公司",2006-01-16,2016-05-06,"Private, ltd by shares"71,1019495,"FRANCE HIBEL INT'L GROUP LIMITED
法國喜倍兒國際集團有限公司",2006-01-16,2012-01-13,"Private, ltd by shares"72,1019672,"FRANCE LPOSMAN FASHION LIMITED
法國洛普斯曼服飾有限公司",2006-01-16,2010-06-11,"Private, ltd by shares"73,1019661,"FRANCE MINGLANG INTERNATIONAL INDUSTRIAL (HK) LIMITED (d2010-06-11)
法國名郎國際實業(香港)有限公司",2006-01-16,2010-06-11,"Private, ltd by shares"74,1019538,"FRANCE VALENCOUSI (INTERNATIONAL) CO., LIMITED
法國瓦倫古斯(國際)有限公司",2006-01-16,2019-03-15,"Private, ltd by shares"75,1019717,"FUJI TECH (ASIA) CO., LIMITED
富士通(亞洲)有限公司",2006-01-16,,"Private, ltd by shares"76,1019690,"FUSION (CHINA) INVESTMENTS COMPANY LIMITED
匯科(中國)投資有限公司",2006-01-16,2014-03-21,"Private, ltd by shares"77,1019706,"GARTON INTERNATIONAL LIMITED (HK)",2006-01-16,,"Private, ltd by shares"78,1019619,"German Fu An Group (Hong Kong) Holdings Company Limited
德國福安集團(香港)控股有限公司",2006-01-16,2010-06-11,"Private, ltd by shares"79,1019456,"GERMANY BOSCH INTERNATIONAL GROUP LIMITED
德國博世國際集團有限公司",2006-01-16,2010-09-24,"Private, ltd by shares"80,1019662,"GERMANY FEIPUSEN CROP SCIENCE LIMITED
德國菲浦森作物科學有限公司",2006-01-16,2012-01-13,"Private, ltd by shares"81,1019544,"GERMANY PENINSULA MECHANICAL INT'L GROUP LIMITED
德國半島機械國際集團有限公司",2006-01-16,2012-01-13,"Private, ltd by shares"82,1019636,"GIB TECHNOLOGY LIMITED
億為科技有限公司",2006-01-16,2018-04-06,"Private, ltd by shares"83,1019528,"GIFTLINK ENTERPRISE LIMITED
禮滙推廣有限公司",2006-01-16,,"Private, ltd by shares"84,1019679,"GLOBAL EQUITY SERVICES LIMITED
東源鴻實業有限公司",2006-01-16,2013-06-21,"Private, ltd by shares"85,1019506,"GOLDEN PURITY INDUSTRIAL LIMITED
金淳科技有限公司",2006-01-16,,"Private, ltd by shares"86,1019565,"GOLFSTOKS.HK LIMITED",2006-01-16,2015-04-24,"Private, ltd by shares"87,1019569,"GOONWA PRECISION MOULD FITTINGS (HK) LIMITED
冠華精密模具配件(香港)有限公司",2006-01-16,,"Private, ltd by shares"88,1019573,"GRACE WU LIMITED (d2007-09-21)
胡尚君有限公司",2006-01-16,2007-09-21,"Private, ltd by shares"89,1019552,"GREAT POWER INDUSTRIAL LIMITED (d2013-07-12)
紅五洲實業有限公司",2006-01-16,2013-07-12,"Private, ltd by shares"90,1019697,"GREECE PAPULUOSI PHOSPHATIZATION INDUSTRY GROUP LIMITED
希臘帕普洛斯磷化工業集團有限公司",2006-01-16,2010-06-11,"Private, ltd by shares"91,1019591,"GREENAWN OUTDOOR PRODUCT COMPANY LIMITED
格綠朗戶外用品有限公司",2006-01-16,2008-05-30,"Private, ltd by shares"92,1019686,"H.K AOTAI SHIP CO., LIMITED
香港奧泰航運有限公司",2006-01-16,2016-09-09,"Private, ltd by shares"93,1019685,"H.K BLACK CAT PUMP INDUSTRY LIMITED
香港黑貓泵業有限公司",2006-01-16,2015-04-24,"Private, ltd by shares"94,1019693,"H.K FIVE FORTUNE PROSPEROUS JEWELLERY (GROUP) LIMITED
香港五福呈祥珠寶(集團)有限公司",2006-01-16,2012-01-13,"Private, ltd by shares"95,1019712,"H.K SHANGRI-LA INT'L INVESTMENT LIMITED
香格里拉國際投資有限公司",2006-01-16,2010-03-05,"Private, ltd by shares"96,1019550,"HAI HUA SHIPPING CO., LIMITED
洲海航運有限公司",2006-01-16,,"Private, ltd by shares"97,1019648,"HAKUNA MATATA BOATING LIMITED
悠艇有限公司",2006-01-16,2008-04-25,"Private, ltd by shares"98,1019477,"HAPPINESS HOUSE LIMITED (HK)
開心創作有限公司",2006-01-16,2018-05-25,"Private, ltd by shares"99,1019631,"HE YUAN INTERNATIONAL COMMUNICATION TECHNOLOGY CO., LIMITED
和源國際通信科技有限公司",2006-01-16,2009-06-26,"Private, ltd by shares"100,1019655,"HEALTH-FIT CONSULTING LIMITED
盈康富健康咨詢有限公司",2006-01-16,2012-02-03,"Private, ltd by shares"101,1019610,"HI-TECH MACHINERY LIMITED (d2012-03-16)
恒達機電有限公司",2006-01-16,2012-03-16,"Private, ltd by shares"102,1019568,"HK BAODELONG INT'L INV. GROUP LIMITED
香港寶德龍國際投資集團有限公司",2006-01-16,2010-06-11,"Private, ltd by shares"103,1019659,"HK BIG FOREST INT'L INVESTMENT LIMITED
香港大森林國際投資有限公司",2006-01-16,2010-06-11,"Private, ltd by shares"104,1019671,"HK DIAMOND CROCODILE INVESTMENT LIMITED
香港鑽石鱷魚投資有限公司",2006-01-16,2010-06-11,"Private, ltd by shares"105,1019602,"HK FANGSHENG YIDA TECHNOLOGIES CO., LIMITED
香港方聖易達科技有限公司",2006-01-16,,"Private, ltd by shares"106,1019482,"HK GANGTONG ELECTRIC DEVELOPMENT LIMITED
香港港通電器開發有限公司",2006-01-16,2012-01-13,"Private, ltd by shares"107,1019556,"HK RONGTAI ELECTRONICS LIMITED
香港榮泰電子有限公司",2006-01-16,,"Private, ltd by shares"108,1019692,"HK SEAWAVE MACHINERY MANUFACTURE COMPANY LIMITED
香港斯威弗機械製造有限公司",2006-01-16,2012-01-13,"Private, ltd by shares"109,1019585,"HK SITIET INT'L ECONOMIC &amp; TRADING CO., LIMITED
香港施蒂特國際經貿有限公司",2006-01-16,2015-04-24,"Private, ltd by shares"110,1019675,"HK YUAN XIN PROJECT DESIGN DECORATE LIMITED
香港元信工程設計裝飾有限公司",2006-01-16,2013-03-15,"Private, ltd by shares"111,1019629,"HONG KONG AI SI NI LE SANITARY PRODUCTS COMPANY LIMITED
香港艾絲妮樂衛生用品有限公司",2006-01-16,2008-11-28,"Private, ltd by shares"112,1019462,"HONG KONG BEL BIOLOGY INTERNATIONAL GROUP COMPANY LIMITED
香港貝爾生物國際集團有限公司",2006-01-16,2010-06-11,"Private, ltd by shares"113,1019673,"HONG KONG CHI FU TRADING LIMITED
香港致富貿易有限公司",2006-01-16,,"Private, ltd by shares"114,1019508,"HONG KONG DEYOU ENTERPRISE LIMITED
香港德有企業有限公司",2006-01-16,2010-06-11,"Private, ltd by shares"115,1019640,"HONG KONG ISHA LIMITED
香港安康會有限公司",2006-01-16,2017-10-06,"Ltd by guarantee"116,1019480,"HONG KONG JIAHE INDUSTRIAL INTERNATIONAL GROUP LIMITED
香港嘉禾實業國際集團有限公司",2006-01-16,2010-06-11,"Private, ltd by shares"117,1019626,"HONG KONG JIN FU YA FURNITURE GROUP LIMITED
香港金富雅傢俱集團有限公司",2006-01-16,2012-01-13,"Private, ltd by shares"118,1019641,"HONG KONG MING BAI FURNITURE GROUP LIMITED
香港名柏家具集團有限公司",2006-01-16,2010-06-11,"Private, ltd by shares"119,1019638,"HONG KONG NEW RIVER (GROUP) COMPANY LIMITED
香港新河(集團)有限公司",2006-01-16,2006-12-22,"Private, ltd by shares"120,1019590,"HONG KONG OUSHA (PENG ZHAN) HANDBAG INDUSTRIAL LIMITED
香港歐莎(鵬展)手袋實業有限公司",2006-01-16,2010-06-11,"Private, ltd by shares"121,1019579,"HONG KONG ROSEWOOD COMPANY LIMITED
香港薔薇貿易有限公司",2006-01-16,2010-06-11,"Private, ltd by shares"122,1019479,"HONG KONG ROYAL FLOWER INTERNATIONAL FASHION LIMITED
香港蒂王花國際服飾有限公司",2006-01-16,2015-11-13,"Private, ltd by shares"123,1019584,"HONG KONG RUILONG GROUP LIMITED
香港瑞龍集團有限公司",2006-01-16,,"Private, ltd by shares"124,1019604,"Hong Kong Wan Zhong New Century Industrial and Trading Limited
香港萬眾新世紀工貿有限公司",2006-01-16,2015-09-18,"Private, ltd by shares"125,1019627,"HONG KONG YUE XING FURNITURE GROUP LIMITED
香港月星傢俱集團有限公司",2006-01-16,2012-01-13,"Private, ltd by shares"126,1019649,"HONG YUAN INVESTMENT LIMITED
宏遠興業投資有限公司",2006-01-16,2018-01-26,"Private, ltd by shares"127,1019727,"HONGKONG ASIA PACIFIC INT'L TRADING LIMITED (b2006-01-16)
香港亞太國際貿易有限公司",2006-01-16,,"Private, ltd by shares"128,1019714,"HONGKONG DSS ENTERPRISES LIMITED
香港迪賽思實業有限公司",2006-01-16,2015-04-24,"Private, ltd by shares"129,1019678,"HONGKONG ROYALTY DA NI FASHION INT'L LIMITED
香港皇家達妮國際集團時裝有限公司",2006-01-16,2017-09-01,"Private, ltd by shares"130,1019666,"HONGKONG ROYALWALL WINERY CO., LIMITED
香港皇家長城葡萄酒業有限公司",2006-01-16,2010-06-11,"Private, ltd by shares"131,1019476,"HONGKONG SOUNDKING TECHNOLOGY LIMITED
香港音王科技有限公司",2006-01-16,,"Private, ltd by shares"132,1019601,"HONGKONG TSUENYING DEVELOPMENT INVESTMENT (GROUP) LIMITED
香港全殷國際投資(集團)有限公司",2006-01-16,2012-01-13,"Private, ltd by shares"133,1019567,"HONGKONG YEQI ELECTRONIC CO., LIMITED
香港業祺電子有限公司",2006-01-16,2012-01-13,"Private, ltd by shares"134,1019600,"HONGKONG YLD DIGITAL TECHNOLOGIES CO., LIMITED
香港友聯達科技有限公司",2006-01-16,2012-01-13,"Private, ltd by shares"135,1019537,"HOZU TRADE DEVELOPMENT COMPANY LIMITED
禾子貿易發展有限公司",2006-01-16,2009-08-21,"Private, ltd by shares"136,1019548,"HUNG TAI GROUP (HONG KONG) COMPANY LIMITED
鴻大集團(香港)有限公司",2006-01-16,,"Private, ltd by shares"137,1019492,"HYUNDAI HOSE SEMICON CO. LIMITED
現代好時半導體有限公司",2006-01-16,2012-07-06,"Private, ltd by shares"138,1019465,"INTERCORP LIMITED
國際商務咨詢有限公司",2006-01-16,,"Private, ltd by shares"139,1019547,"INTERNATIONAL TOWN TRAVELING LIMITED
國際城鎭旅遊有限公司",2006-01-16,2010-06-11,"Private, ltd by shares"140,1019651,"ITALENA JEWELLERY (HOLDING) LIMITED
伊泰蓮娜首飾(集團)有限公司",2006-01-16,2020-07-17,"Private, ltd by shares"141,1019450,"ITALY ARISTON KITCHEN ELECTRIC CO., LIMITED (d2010-06-11)
意大利阿裏斯頓廚房電器有限公司",2006-01-16,2010-06-11,"Private, ltd by shares"142,1019665,"ITALY PIZAZZ PLAYBOY SHOES&amp;DRESS (HK) LIMITED
意大利瀟灑花花公子鞋服(香港)有限公司",2006-01-16,2010-06-11,"Private, ltd by shares"143,1019660,"ITALY SENMANI INTERNATIONAL GROUP HOLDING LIMITED
意大利聖曼尼國際集團控股有限公司",2006-01-16,2010-06-11,"Private, ltd by shares"144,1019459,"ITALY YILKING (INT'L) INDUSTRY LIMITED
意大利意利王(國際)實業有限公司",2006-01-16,2015-04-24,"Private, ltd by shares"145,1019551,"ITALY ZUO SHI WEI . SHARK GROUP LIMITED
意大利佐士威．鯊魚集團有限公司",2006-01-16,2010-06-11,"Private, ltd by shares"146,1019466,"JAMES SAWYER HONG KONG LIMITED",2006-01-16,2007-11-02,"Private, ltd by shares"147,1019470,"JAMES SAWYER SUPPLY COMPANY LIMITED",2006-01-16,2015-04-24,"Private, ltd by shares"148,1019475,"JAPAN BAMBOO (H.K.) CO., LIMITED
日本竹材(香港)有限公司",2006-01-16,,"Private, ltd by shares"149,1019689,"JAPAN JINGDU JICHUAN CHEMICAL INDUSTRY COMPANY LIMITED
日本京都吉川化工株式會社有限公司",2006-01-16,2010-06-11,"Private, ltd by shares"150,1019455,"JAPAN NANJUE INDUSTRIAL SEWING MACHINE (HK) LIMITED
日本男爵工業縫紉機(香港)有限公司",2006-01-16,2012-01-13,"Private, ltd by shares"151,1019555,"JAPAN SOLAR ENERGY (HK) LIMITED
日本太陽能(香港)有限公司",2006-01-16,,"Private, ltd by shares"152,1019502,"JB INTERNATIONAL INDUSTRY LIMITED
金百國際實業有限公司",2006-01-16,,"Private, ltd by shares"153,1019704,"JET SUCCESS LOGISTICS LIMITED
捷昇物流有限公司",2006-01-16,2018-05-11,"Private, ltd by shares"154,1019720,"JIA HUI INTERNATIONAL GROUP LIMITED
佳輝國際集團有限公司",2006-01-16,2008-07-11,"Private, ltd by shares"155,1019593,"JIN XIU CRAFT TEXTILE LIMITED
錦繡工藝紡織有限公司",2006-01-16,2010-10-08,"Private, ltd by shares"156,1019644,"JLC BUSINESS SERVICES LIMITED (d2011-06-10)",2006-01-16,2011-06-10,"Private, ltd by shares"157,1019560,"KAETAT INDUSTRIAL COMPANY LIMITED
嘉一達實業有限公司",2006-01-16,,"Private, ltd by shares"158,1019542,"KALIBRIO LIMITED
加力碧有限公司",2006-01-16,,"Private, ltd by shares"159,1019501,"KANEDA INTERNATIONAL (HK) LIMITED
金田國際(香港) 創研有限公司",2006-01-16,,"Private, ltd by shares"160,1019729,"KANG NAN INT'L TRADING CO LIMITED
香港康楠國際商貿有限公司",2006-01-16,2009-07-10,"Private, ltd by shares"161,1019535,"KH-C CORPORATION LIMITED",2006-01-16,2010-06-11,"Private, ltd by shares"162,1019592,"KINGCLE ENTERPRISE COMPANY LIMITED
金格企業有限公司",2006-01-16,2018-06-01,"Private, ltd by shares"163,1019630,"KINGFULL ENTERPRISE (HK) COMPANY LIMITED
鼎豐企業(香港)有限公司",2006-01-16,,"Private, ltd by shares"164,1019571,"KINGLUMI PHOTOELECTRIC TECHNOLOGY CO., LIMITED
金流明光電技術有限公司",2006-01-16,2010-06-11,"Private, ltd by shares"165,1019473,"KONG CHEONG ENGINEERING LIMITED
港昌機電工程有限公司",2006-01-16,,"Private, ltd by shares"166,1019451,"KOREA BUBUGAO (INT'L) GROUP COMPANY LIMITED
韓國步步高(國際)集團有限公司",2006-01-16,2012-01-13,"Private, ltd by shares"167,1019691,"Kwok Yuen Hardware Electrical and Plumbing Co. Limited
國源五金水電有限公司",2006-01-16,,"Private, ltd by shares"168,1019663,"LANDSTAR (HONG KONG) INVESTMENT CO., LIMITED
陸達(香港)投資有限公司",2006-01-16,2014-06-27,"Private, ltd by shares"169,1019505,"LARGE ASIA MOTOR LIMITED
大亞洲汽車有限公司",2006-01-16,2009-05-29,"Private, ltd by shares"170,1019713,"LEADTIME TELECOM INTERNATIONAL CO., LIMITED
領時通信國際集團有限公司",2006-01-16,,"Private, ltd by shares"171,1019582,"LEGEND TEAM INTERNATIONAL LIMITED (d2012-01-13)",2006-01-16,2012-01-13,"Private, ltd by shares"172,1019546,"LES BON BON COMPANY LIMITED
樂樂齋有限公司",2006-01-16,2013-03-15,"Private, ltd by shares"173,1019518,"LHL INVESTMENTS PTY. LIMITED",2006-01-16,2015-04-24,"Private, ltd by shares"174,1019536,"LIFESCIENCE INVESTMENT INT'L CO., LIMITED
香港生命科學國際投資有限公司",2006-01-16,,"Private, ltd by shares"175,1019656,"LIOZOC (HK) CO. LIMITED
汛盛(香港)有限公司",2006-01-16,2008-05-23,"Private, ltd by shares"176,1019543,"LIXING INV. INTERNATIONAL ENTERPRISES LIMITED
力行投資國際事業有限公司",2006-01-16,2010-06-11,"Private, ltd by shares"177,1019580,"LMC DUTY FREE COMPANY LIMITED",2006-01-16,,"Private, ltd by shares"178,1019708,"LOEN HOLDINGS COMPANY LIMITED
羅恩控股有限公司",2006-01-16,2009-05-08,"Private, ltd by shares"179,1019460,"LOGOSON ARTS &amp; CRAFTS CO., LIMITED
樂歌生工藝品有限公司",2006-01-16,,"Private, ltd by shares"180,1019469,"LUCKY GOLD INT'L INVESTMENT LIMITED
吉金國際投資有限公司",2006-01-16,2010-10-22,"Private, ltd by shares"181,1019726,"M.A.C. Trading Company Limited
泓泰貿易有限公司",2006-01-16,2010-06-11,"Private, ltd by shares"182,1019621,"MARCHE INTERNATIONAL HOLDINGS LIMITED",2006-01-16,2012-09-28,"Private, ltd by shares"183,1019634,"MC INTERNATIONAL TRADING LIMITED
美晨國際貿易有限公司",2006-01-16,,"Private, ltd by shares"184,1019733,"MCIA LIMITED
小康啟動有限公司",2006-01-16,2020-09-25,"Ltd by guarantee"185,1019625,"MECHATRO TECH COMPANY LIMITED
美卡達技研有限公司",2006-01-16,,"Private, ltd by shares"186,1019488,"MEGA UNION INTERNATIONAL INDUSTRIAL LIMITED
萬聯國際實業有限公司",2006-01-16,,"Private, ltd by shares"187,1019711,"MING LI INTERNATIONAL INDUSTRIAL COMPANY LIMITED
明麗國際實業有限公司",2006-01-16,2019-03-08,"Private, ltd by shares"188,1019680,"MINSHENG BUS CO., LIMITED
民生巴士有限公司",2006-01-16,2010-06-11,"Private, ltd by shares"189,1019594,"MODERN INDUSTRIAL DEVELOPMENT LIMITED
現代展拓實業(中國)有限公司",2006-01-16,2016-06-10,"Private, ltd by shares"190,1019620,"MOON FOOK JEWELLERY CO., LIMITED
滿福珠寶有限公司",2006-01-16,,"Private, ltd by shares"191,1019564,"MUTUAL-B HOMEWARES CO., LIMITED
利華木業有限公司",2006-01-16,2010-06-11,"Private, ltd by shares"192,1019615,"N.H. LEATHERS LIMITED
穌哈皮革有限公司",2006-01-16,2010-06-11,"Private, ltd by shares"193,1019524,"NA HAI TECHNOLOGY LIMITED
納海科技有限公司",2006-01-16,2008-07-11,"Private, ltd by shares"194,1019489,"NANYUAN SHIPPING CO., LIMITED
南遠船務有限公司",2006-01-16,2017-09-15,"Private, ltd by shares"195,1019533,"NEST WORLDS INTERNATIONAL GROUP (INDONESIA) LIMITED
印尼巢天地國際集團有限公司",2006-01-16,2010-06-11,"Private, ltd by shares"196,1019525,"NICER FASHION LIMITED
儷新時裝有限公司",2006-01-16,,"Private, ltd by shares"197,1019734,"NINGBO TOPLITE CO., LIMITED
寧波普特有限公司",2006-01-16,2019-03-08,"Private, ltd by shares"198,1019481,"NUCO INTERNATIONAL COMPANY LIMITED",2006-01-16,2009-05-15,"Private, ltd by shares"199,1019509,"O.D.M. GROUP LIMITED",2006-01-16,2011-06-03,"Private, ltd by shares"200,1019718,"OMNI HOME GARDEN COMPANY LIMITED
西班牙真魚庭國際家居集團有限公司",2006-01-16,2019-07-05,"Private, ltd by shares"201,1019653,"Omni-Directional (Holdings) Limited
全方位(控股)有限公司",2006-01-16,2010-06-11,"Private, ltd by shares"202,1019732,"OTOS COMPANY LIMITED
匯津貿易有限公司",2006-01-16,2018-04-27,"Private, ltd by shares"203,1019597,"PAN-WIN TECHNOLOGY (HK) LIMITED
博源科技(香港)有限公司",2006-01-16,2010-10-08,"Private, ltd by shares"204,1019553,"Panda Tech HK Limited
熊貓科技(香港)有限公司",2006-01-16,,"Private, ltd by shares"205,1019698,"PANOCEAN ENGINEERING LIMITED
泛海工程有限公司",2006-01-16,,"Private, ltd by shares"206,1019532,"PASAR LAKSA LIMITED
有星味有限公司",2006-01-16,2007-09-07,"Private, ltd by shares"207,1019605,"PASSION MANUFACTURING CO., LIMITED
百乘工業製造有限公司",2006-01-16,2019-11-15,"Private, ltd by shares"208,1019618,"PERCEPTION RESEARCH SERVICES INTERNATIONAL LIMITED",2006-01-16,2015-05-22,"Private, ltd by shares"209,1019523,"PERFECT FOODSTUFF DEVELOPMENT INTERNATIONAL LIMITED
柏輝發展國際有限公司",2006-01-16,2007-10-26,"Private, ltd by shares"210,1019557,"Pitera International Trading Limited
比德納國際貿易有限公司",2006-01-16,2009-11-27,"Private, ltd by shares"211,1019570,"PO FAI PRECISION LIMITED
寶暉精密有限公司",2006-01-16,,"Private, ltd by shares"