,Reg no.,Name,Incorp-orated,Dissolved,Type212,1019458,"PRINCE OF PEACE CHARITY FOUNDATION LIMITED
和平之君慈善基金有限公司",2006-01-16,,"Ltd by guarantee"213,1019635,"PROMINENT DESIGN CO. LIMITED
博聞設計有限公司",2006-01-16,2015-04-24,"Private, ltd by shares"214,1019633,"PROSPERITY RUBBER &amp; PLASTICS TRADING COMPANY LIMITED
宏達興(香港)橡塑商貿有限公司",2006-01-16,2017-01-13,"Private, ltd by shares"215,1019595,"PURPLE ACCESSORIES CO., LIMITED
紫金服飾有限公司",2006-01-16,2020-11-06,"Private, ltd by shares"216,1019454,"RATIONAL SUCCESS INTERNATIONAL TRADING LIMITED",2006-01-16,2018-08-31,"Private, ltd by shares"217,1019650,"REFLECTURE LIMITED",2006-01-16,2020-09-25,"Private, ltd by shares"218,1019719,"RESOURCES PROMOTION &amp; MARKETING CO., LIMITED
大域拓展有限公司",2006-01-16,2008-08-08,"Private, ltd by shares"219,1019447,"Robert Half Hong Kong Limited",2006-01-16,,"Private, ltd by shares"220,1019730,"ROSA Holdings Limited (HK)",2006-01-16,,"Private, ltd by shares"221,1019520,"SAINT MAXIM LIMITED
陞懋有限公司",2006-01-16,2014-08-15,"Private, ltd by shares"222,1019485,"SE ENTERPRISE LIMITED
迅利企業有限公司",2006-01-16,2019-01-11,"Private, ltd by shares"223,1019723,"SELFISHAD NETWORK COMPANY LIMITED
自私自利廣告頻道有限公司",2006-01-16,2012-01-13,"Private, ltd by shares"224,1019668,"SENSENG INTERNATIONAL TRADING CO., LIMITED
天承國際貿易有限公司",2006-01-16,,"Private, ltd by shares"225,1019558,"ServoTest Systems Company Limited",2006-01-16,2016-11-04,"Private, ltd by shares"226,1019541,"SHENG SHI INTERNATIONAL (HK) DEVELOPMENT LIMITED
盛世國際(香港)發展有限公司",2006-01-16,,"Private, ltd by shares"227,1019677,"SHENZHEN SEEHIGH INTERNATIONAL TRADE COMPANY LIMITED
燊臻通世海國際貿易有限公司",2006-01-16,2012-09-14,"Private, ltd by shares"228,1019710,"Silver River Health &amp; Facial Industry Co., Limited
銀河健康美容產業有限公司",2006-01-16,2019-08-02,"Private, ltd by shares"229,1019516,"SILVERBASE INTERIOR DESIGN LIMITED
銀基室內設計有限公司",2006-01-16,2008-11-14,"Private, ltd by shares"230,1019504,"SILVERBASE PROPERTY INVESTMENT LIMITED
銀基地產物業有限公司",2006-01-16,2014-06-06,"Private, ltd by shares"231,1019695,"SILVERLINING INTERNATIONAL INVESTMENT (GROUP) LIMITED
綠怡國際發展(集團)有限公司",2006-01-16,2010-06-11,"Private, ltd by shares"232,1019596,"SINECERITY TEXTILE LIMITED",2006-01-16,2010-06-11,"Private, ltd by shares"233,1019646,"SINGULAR INTERNATIONAL LIMITED
翔飛國際有限公司",2006-01-16,,"Private, ltd by shares"234,1019664,"SINGWOOD DEVELOPMENT CO., LIMITED
星活發展有限公司",2006-01-16,,"Private, ltd by shares"235,1019703,"SINO UNION GARMENT LIMITED
中聯製衣有限公司",2006-01-16,,"Private, ltd by shares"236,1019643,"Sinogerma Investments Limited
中德投資諮詢有限公司",2006-01-16,2008-03-28,"Private, ltd by shares"237,1019513,"SMARTLINE INDUSTRIES LIMITED
永燁實業有限公司",2006-01-16,,"Private, ltd by shares"238,1019583,"SOBO NEWTECH CORPORATION LIMITED",2006-01-16,2008-05-02,"Private, ltd by shares"239,1019683,"SOEVER INVESTMENT LIMITED
信佑投資有限公司",2006-01-16,2012-04-20,"Private, ltd by shares"240,1019614,"SoundPower Industrial Co., (H.K.) Limited
香港聲威實業有限公司",2006-01-16,2012-01-13,"Private, ltd by shares"241,1019471,"STELUX HOLDINGS LIMITED
寶光實業(集團)有限公司",2006-01-16,,"Private, ltd by shares"242,1019526,"Strategic Alliance Management Services Limited",2006-01-16,,"Private, ltd by shares"243,1019684,"SUN AND STAR INFINITY (HK) LIMITED",2006-01-16,2015-04-24,"Private, ltd by shares"244,1019530,"SUNRISE ORIENT LIMITED",2006-01-16,2012-06-08,"Private, ltd by shares"245,1019724,"SUPERIOR FOOD (ASIA) LIMITED
優越食品亞洲代理有限公司",2006-01-16,2016-09-09,"Private, ltd by shares"246,1019461,"SUSHI ONE LIMITED",2006-01-16,,"Private, ltd by shares"247,1019500,"TAESAN INTERNATIONAL HOLDINGS LIMITED",2006-01-16,2011-06-30,"Private, ltd by shares"248,1019687,"TAIWAN BENLI SARTORIUS (H.K) LIMITED
臺灣本力縫紉機(香港)有限公司",2006-01-16,2012-01-13,"Private, ltd by shares"249,1019699,"TAIWAN JYI SHYANG U&amp;P GROUP LIMITED
台灣吉祥鋁塑板集團有限公司",2006-01-16,2018-10-05,"Private, ltd by shares"250,1019539,"TCI TECH CRAFT INTERNATIONAL LIMITED",2006-01-16,2009-02-13,"Private, ltd by shares"251,1019607,"TELLY ELECTRONICS LIMITED (d2010-06-11)
泰利電子有限公司",2006-01-16,2010-06-11,"Private, ltd by shares"252,1019512,"THIVOL CONSULTING CO. LIMITED
中港金融服務顧問有限公司",2006-01-16,,"Private, ltd by shares"253,1019484,"TOPMAX INTERNATIONAL DEVELOPMENT LIMITED
拓霸國際發展有限公司",2006-01-16,2010-06-11,"Private, ltd by shares"254,1019702,"TOYO CONSULTANTS LIMITED
東洋顧問有限公司",2006-01-16,,"Private, ltd by shares"255,1019540,"TRADE CONCEPT INT'L GROUP LIMITED
信懋國際集團有限公司",2006-01-16,2020-10-23,"Private, ltd by shares"256,1019654,"TRICON INDUSTRIAL (ASIA) CO., LIMITED
全康實業(亞洲)有限公司",2006-01-16,2018-05-25,"Private, ltd by shares"257,1019676,"U.S.A OX GROUP BEER HOLDING LIMITED
美國公牛集團啤酒股份有限公司",2006-01-16,2012-01-13,"Private, ltd by shares"258,1019515,"Unusual Productions (China) Limited
特高娛樂制作有限公司",2006-01-16,,"Private, ltd by shares"259,1019497,"USA STIWELL PETROCHEMICAL BIOLOGY INT'L LIMITED
美國史迪威石化生物國際有限公司",2006-01-16,2015-04-24,"Private, ltd by shares"260,1019483,"USHIO LIMITED
牛尾有限公司",2006-01-16,,"Private, ltd by shares"261,1019545,"VAir (Hong Kong) Limited
思路空運(香港)有限公司",2006-01-16,2009-05-08,"Private, ltd by shares"262,1019529,"VIRTUS FOUNDATION LIMITED
明德慈善教育基金有限公司",2006-01-16,,"Ltd by guarantee"263,1019478,"WACRO ELECTRIC (HK) CO., LIMITED
萬家樂電器(香港)有限公司",2006-01-16,2010-06-11,"Private, ltd by shares"264,1019463,"WANG YI TING INTERNATIONAL FOUNDATION LIMITED
王一亭國際文化基金會有限公司",2006-01-16,,"Ltd by guarantee"265,1019572,"WEI CHANG BUSINESS LIMITED
偉昌商貿有限公司",2006-01-16,2011-12-30,"Private, ltd by shares"266,1019452,"WELL ASIA DEVELOPMENT (H.K.) LIMITED
宏亞發展(香港)有限公司",2006-01-16,,"Private, ltd by shares"267,1019696,"WELL HONOR ENGINEERING LIMITED
信豐工程有限公司",2006-01-16,2013-07-05,"Private, ltd by shares"268,1019700,"WELLMATE MOTORS COMPANY LIMITED
匯銘車行有限公司",2006-01-16,,"Private, ltd by shares"269,1019709,"WESONIC ELECTRONICS LIMITED
滙力電子有限公司",2006-01-16,,"Private, ltd by shares"270,1019613,"WILSON TOYS CO. LIMITED
匯盛玩具有限公司",2006-01-16,2012-01-13,"Private, ltd by shares"271,1019688,"WIND SOFT LIMITED",2006-01-16,2010-06-11,"Private, ltd by shares"272,1019474,"Wing Ngai Travel Limited
榮毅旅運有限公司",2006-01-16,2015-04-24,"Private, ltd by shares"273,1019721,"WINSON DECORATION &amp; DESIGN WORKS LIMITED
威信裝修設計工程有限公司",2006-01-16,,"Private, ltd by shares"274,1019589,"XIANGYU COMMUNICATION LIMITED
翔宇通訊技術有限公司",2006-01-16,,"Private, ltd by shares"275,1019647,"YANG TI TECHNOLOGY DEVELOPMENT LIMITED
楊鐵科技開發有限公司",2006-01-16,2012-01-13,"Private, ltd by shares"276,1019674,"YEHEHUA'S PALACE LIMITED
愛尊聆有限公司",2006-01-16,,"Private, ltd by shares"277,1019637,"YEN CHENG TRADING CO., LIMITED
晏承貿易有限公司",2006-01-16,2013-05-03,"Private, ltd by shares"278,1019578,"YI PEI TONG INDUSTRIAL LIMITED
億倍通實業有限公司",2006-01-16,,"Private, ltd by shares"279,1019510,"YIHAO (HONG KONG) CRAFTS CO., LIMITED
藝豪(香港)工藝品有限公司",2006-01-16,,"Private, ltd by shares"280,1019728,"YISHENG ORGANIC INTERNATIONAL LIMITED
易生國際有限公司",2006-01-16,,"Private, ltd by shares"281,1019608,"YONGFENG TRADING (HK) CO., LIMITED
永豐貿易(香港)有限公司",2006-01-16,,"Private, ltd by shares"282,1019496,"YONGHEXING HK CO., LIMITED
永合興香港有限公司",2006-01-16,2017-09-01,"Private, ltd by shares"283,1019563,"YU HOI INTERNATIONAL TRADING CORPORATION LIMITED
裕海國際貿易有限公司",2006-01-16,2008-05-02,"Private, ltd by shares"284,1019599,"YU XUAN INDUSTRIES (HK) LIMITED
宇軒實業(香港)有限公司",2006-01-16,,"Private, ltd by shares"285,1019722,"YUAN LI TONG (H.K.) ELECTRONICS LIMITED
源利通(香港)電子有限公司",2006-01-16,,"Private, ltd by shares"286,1019669,"YULU INTERNATIONAL GROUP CO., LIMITED
禦露國際集團有限公司",2006-01-16,2009-11-20,"Private, ltd by shares"287,1019487,"YUNXING TECHNOLOGY (HONG KONG) LIMITED
雲星科技(香港)有限公司",2006-01-16,,"Private, ltd by shares"288,1019575,"ZELIA INTERNATIONAL LIMITED",2006-01-16,,"Private, ltd by shares"