,Reg no.,Name,Incorp-orated,Dissolved,Type1,0653283,"A C TECHNOLOGY LIMITED
毅時科技有限公司",1998-08-28,2011-07-15,"Private, ltd by shares"2,0653274,"ACERICH ENTERPRISES LIMITED (d2005-08-19)
榮順企業有限公司",1998-08-28,2005-08-19,"Private, ltd by shares"3,0653230,"ACEWIN INDUSTRIAL LIMITED
榮順實業有限公司",1998-08-28,2019-01-29,"Private, ltd by shares"4,0653333,"ADVANCE INTERNATIONAL CONSOLIDATION LIMITED
先進國際集運有限公司",1998-08-28,2016-04-15,"Private, ltd by shares"5,0653280,"ALLIED SINO (HONG KONG) LIMITED
聯中(香港)有限公司",1998-08-28,2005-06-30,"Private, ltd by shares"6,0653262,"APEX (FAR EAST) LIMITED
成峰(遠東)有限公司",1998-08-28,2013-12-27,"Private, ltd by shares"7,0653326,"ASIA OFFICE MACHINE TRADING COMPANY LIMITED
亞洲商業機械貿易有限公司",1998-08-28,2007-01-26,"Private, ltd by shares"8,0653237,"ASTG CONTAINER LINE LIMITED
亞洲聯運有限公司",1998-08-28,,"Private, ltd by shares"9,0653318,"AUSTRALIA AGRICULTURE PRODUCT INVESTMENT (HK) LIMITED
澳洲農業產業投資(香港)有限公司",1998-08-28,2005-08-19,"Private, ltd by shares"10,0653260,"BALTI (HK) CO. LIMITED
保迪(香港)有限公司",1998-08-28,2008-01-11,"Private, ltd by shares"11,0653247,"BIOSCOR INTERNATIONAL (U.S.A.) LIMITED",1998-08-28,2003-06-20,"Private, ltd by shares"12,0653271,"C &amp; Y COMPANY LIMITED",1998-08-28,,"Private, ltd by shares"13,0653268,"C.F.M. INTERNATIONAL COMPANY LIMITED",1998-08-28,2009-03-06,"Private, ltd by shares"14,0653248,"CANDID MANUFACTURING LIMITED
金正工業有限公司",1998-08-28,2003-04-04,"Private, ltd by shares"15,0653314,"CHAMPION CENTRAL SECRETARIES LIMITED (d2001-12-21)
長盛秘書有限公司",1998-08-28,2001-12-21,"Private, ltd by shares"16,0653321,"CHANG HONG INDUSTRIAL LIMITED
長弘工業有限公司",1998-08-28,2005-08-19,"Private, ltd by shares"17,0653240,"CHARM SINCERE INTERNATIONAL LIMITED
創隆國際有限公司",1998-08-28,2002-12-06,"Private, ltd by shares"18,0653311,"CHEUNG TAI REAL ESTATE (AGENT) LIMITED
祥泰地產(代理)有限公司",1998-08-28,2005-08-19,"Private, ltd by shares"19,0653303,"CHINA NATIONAL LETEX IMPORT &amp; EXPORT (GROUP) COMPANY LIMITED
中國利得仕進出口(集團)有限公司",1998-08-28,,"Private, ltd by shares"20,0653315,"CHINA RAILWAY GUANGDONG (HK) CO. LIMITED
中國鐵廣(香港)有限公司",1998-08-28,2005-08-19,"Private, ltd by shares"21,0653337,"CITY PROFIT INDUSTRIAL LIMITED (d2005-08-19)
港盈實業有限公司",1998-08-28,2005-08-19,"Private, ltd by shares"22,0653227,"CITYLINK TELEPHONE COMPANY LIMITED
連城電話有限公司",1998-08-28,2002-05-03,"Private, ltd by shares"23,0653277,"COMPETITIVE DYNAMICS INTERNATIONAL (CHINA) LIMITED",1998-08-28,,"Private, ltd by shares"24,0653286,"CONCEPTAL CONSULTANCY CORPORATION LIMITED
三思專業顧問有限公司",1998-08-28,,"Private, ltd by shares"25,0653257,"COSCOSHIP (HONG KONG) LIMITED
中遠船貿(香港)有限公司",1998-08-28,2003-07-11,"Private, ltd by shares"26,0653342,"DEVELUTION (H.K.) LIMITED
帝萬羅琴(香港)有限公司",1998-08-28,2003-08-29,"Private, ltd by shares"27,0653335,"EVER UNION LIMITED (d2002-01-04)
永聯興業有限公司",1998-08-28,2002-01-04,"Private, ltd by shares"28,0653338,"FAITHFUL WAY INDUSTRIAL LIMITED
誠威實業有限公司",1998-08-28,2004-03-26,"Private, ltd by shares"29,0653294,"FIRST ASIA INVESTMENTS HOLDING LIMITED
第一亞洲投資集團有限公司",1998-08-28,2005-08-19,"Private, ltd by shares"30,0653264,"FORTUNE EXPRESS (HONG KONG) LIMITED (d2003-06-20)
福通(香港)有限公司",1998-08-28,2003-06-20,"Private, ltd by shares"31,0653329,"FOUNDATION CHAIN LIMITED
偉碧有限公司",1998-08-28,2005-08-19,"Private, ltd by shares"32,0653273,"GOLDEN TIMES TRANSPORTATION SERVICES COMPANY LIMITED
金時貨運服務有限公司",1998-08-28,2009-03-27,"Private, ltd by shares"33,0653308,"GRAPEVINE INTERNATIONAL (H.K.) LIMITED",1998-08-28,2012-07-27,"Private, ltd by shares"34,0653307,"GREAT REWARD GLOBAL ENTERPRISE LIMITED
順豐環球企業有限公司",1998-08-28,2005-08-19,"Private, ltd by shares"35,0653319,"HAW TEXTILE LIMITED
海威紡織有限公司",1998-08-28,,"Private, ltd by shares"36,0653229,"HINWAY (H.K.) LIMITED
興匯(香港)有限公司",1998-08-28,,"Private, ltd by shares"37,0653327,"HKSHOP LIMITED",1998-08-28,2002-11-15,"Private, ltd by shares"38,0653275,"HONCA LIMITED
廣嘉有限公司",1998-08-28,,"Private, ltd by shares"39,0653254,"HONG KONG KINGLANDS INVESTMENT LIMITED
香港帝冠投資有限公司",1998-08-28,2005-08-19,"Private, ltd by shares"40,0653293,"HONG KONG SAR MOTORING SCHOOL LIMITED
香港特區駕駛學校有限公司",1998-08-28,2007-01-05,"Private, ltd by shares"41,0653269,"HONG KONG XI BA INTERNATIONAL HOLDING LIMITED
香港西霸國際集團有限公司",1998-08-28,2005-08-19,"Private, ltd by shares"42,0653310,"HUGEBASE FINANCE INVESTMENT CO., LIMITED
廣鉅財務投資有限公司",1998-08-28,2005-08-19,"Private, ltd by shares"43,0653325,"HUNG FAI (H.K.) DECORATION AND DESIGN LIMITED
洪輝(香港)裝飾設計工程有限公司",1998-08-28,2005-08-19,"Private, ltd by shares"44,0653249,"INTERNATIONAL RAILWAY GROUP LIMITED
國際鐵路系統集團有限公司",1998-08-28,2005-08-19,"Private, ltd by shares"45,0653281,"JENSMART INTERNATIONAL LIMITED
俊輝國際有限公司",1998-08-28,,"Private, ltd by shares"46,0653320,"JIAN WEI LIMITED (d2007-08-17)
金威泰富有限公司",1998-08-28,2007-08-17,"Private, ltd by shares"47,0653241,"JOY LEGEND INDUSTRIAL LIMITED
中通實業有限公司",1998-08-28,2007-09-21,"Private, ltd by shares"48,0653276,"JWIN INTERNATIONAL (HONG KONG) CO., LIMITED
智垣國際有限公司",1998-08-28,2017-06-30,"Private, ltd by shares"49,0653317,"KARCE ELECTRONICS LIMITED
卡西電子有限公司",1998-08-28,2020-09-30,"Private, ltd by shares"50,0653231,"KARREX LIMITED (b1998-08-28)",1998-08-28,,"Private, ltd by shares"51,0653253,"KO-IN (HONG KONG) LIMITED
高音(香港)有限公司",1998-08-28,2003-04-04,"Private, ltd by shares"52,0653304,"LEGEND STAR (ENTERTAINMENT) LIMITED
利星娛樂有限公司",1998-08-28,2008-03-28,"Private, ltd by shares"53,0653339,"LUCKY PLACE INTERNATIONAL LIMITED
合福國際有限公司",1998-08-28,2005-08-19,"Private, ltd by shares"54,0653250,"LUCKY VOYAGER LIMITED",1998-08-28,2001-11-30,"Private, ltd by shares"55,0653252,"M &amp; M INTERNATIONAL REMOVAL LIMITED
禮成國際搬運有限公司",1998-08-28,2000-09-15,"Private, ltd by shares"56,0653259,"MAINSTREAM AUTOMATION (INTERNATIONAL) LIMITED
銘誠自動工程(國際)有限公司",1998-08-28,2010-07-23,"Private, ltd by shares"57,0653344,"MASON (FAR EAST) INDUSTRIES COMPANY LIMITED
美臣(遠東)實業有限公司",1998-08-28,2003-01-24,"Private, ltd by shares"58,0653242,"MASTER FUND INDUSTRIAL LIMITED
康暉實業有限公司",1998-08-28,2006-02-24,"Private, ltd by shares"59,0653341,"MILD EAST INTERNATIONAL LIMITED
萬怡國際有限公司",1998-08-28,2007-06-01,"Private, ltd by shares"60,0653235,"MILES &amp; COMPANY LIMITED",1998-08-28,2003-02-28,"Private, ltd by shares"61,0653305,"MIMYA ADVERTISE DESIGN COMPANY LIMITED
美雅廣告印刷設計有限公司",1998-08-28,,"Private, ltd by shares"62,0653282,"MOP (HONG KONG) LIMITED
華大(香港)有限公司",1998-08-28,,"Private, ltd by shares"63,0653272,"MSI COMPUTER INTERNATIONAL COMPANY LIMITED
微峰國際有限公司",1998-08-28,2002-11-08,"Private, ltd by shares"64,0653309,"NAM KEI SCAFFOLDING ENGINEERING LIMITED
南基棚業工程有限公司",1998-08-28,,"Private, ltd by shares"65,0653224,"NEW WEALTH HOLDINGS LIMITED
裕新集團有限公司",1998-08-28,,"Private, ltd by shares"66,0653270,"NEWTECH (ASIA) LIMITED
泰燊(亞洲)有限公司",1998-08-28,1999-12-30,"Private, ltd by shares"67,0653284,"NEXTED LIMITED (d2015-07-24)",1998-08-28,2015-07-24,"Private, ltd by shares"68,0653324,"NORTHERN METAL INDUSTRY LIMITED
北方金屬工業有限公司",1998-08-28,2005-08-19,"Private, ltd by shares"69,0653312,"OB KOGYO (HK) LIMITED (b1998-08-28)
奧美工業(香港)有限公司",1998-08-28,,"Private, ltd by shares"70,0653267,"ONWAY CHINA CONSULTANTS LIMITED
安捷中國資詢顧問有限公司",1998-08-28,2003-11-28,"Private, ltd by shares"71,0653258,"OVERSEAS IMPORT EXPORT LIMITED (d2005-08-19)",1998-08-28,2005-08-19,"Private, ltd by shares"72,0653279,"PARIMCO (HONG KONG) LIMITED
百利高香港(1988)有限公司",1998-08-28,,"Private, ltd by shares"73,0653265,"PIONEER SUN INTERNATIONAL LIMITED
豐日國際有限公司",1998-08-28,2005-08-19,"Private, ltd by shares"74,0653238,"POLYLON LIMITED
寶利隆有限公司",1998-08-28,2002-02-22,"Private, ltd by shares"75,0653226,"PRINCE NICE LIMITED
隆麗有限公司",1998-08-28,2002-10-18,"Private, ltd by shares"76,0653289,"PRO'8 CORPORATE ADVISORS LIMITED
普勤企劃諮詢有限公司",1998-08-28,2004-06-25,"Private, ltd by shares"77,0653295,"PROPERTY AGENCIES ASSOCIATION (HONG KONG) LIMITED
地產代理聯會(香港)有限公司",1998-08-28,2010-02-19,"Ltd by guarantee"78,0653323,"PROSPERITY CORPORATE SERVICES LIMITED (d2001-11-23)",1998-08-28,2001-11-23,"Private, ltd by shares"79,0653232,"RAINBOW ENTERPRISES (INTERNATIONAL) LIMITED
靈寶企業(國際)有限公司",1998-08-28,2002-05-17,"Private, ltd by shares"80,0653340,"RAPID PROFIT INTERNATIONAL LIMITED
潤佳國際有限公司",1998-08-28,2011-11-25,"Private, ltd by shares"81,0653236,"RENT A TRUCK LIMITED
租車易有限公司",1998-08-28,,"Private, ltd by shares"82,0653334,"RICHES LIMITED (d2017-04-28)
富城興業有限公司",1998-08-28,2017-04-28,"Private, ltd by shares"83,0653313,"RIKIHO COATING (CHINA) LIMITED
力邦塗料(中國)有限公司",1998-08-28,,"Private, ltd by shares"84,0653332,"SIK SIK FURNITURE LIMITED
適式傢俬有限公司",1998-08-28,2003-03-21,"Private, ltd by shares"85,0653288,"SILICON TECHNOLOGY LIMITED (d2005-01-28)
萬達科技有限公司",1998-08-28,2005-01-28,"Private, ltd by shares"86,0653285,"SINCERE CHANCE INTERNATIONAL HOLDING LIMITED
鑫慶雄國際集團有限公司",1998-08-28,2008-01-11,"Private, ltd by shares"87,0653243,"SINO EXPRESS INTERNATIONAL DEVELOPMENT LIMITED (d2007-01-05)
中通國際發展有限公司",1998-08-28,2007-01-05,"Private, ltd by shares"88,0653266,"SINO EXPRESS INTERNATIONAL INVESTMENT LIMITED
中通國際投資有限公司",1998-08-28,2003-06-20,"Private, ltd by shares"89,0653244,"SMARTURN INTERNATIONAL LIMITED
信泰國際有限公司",1998-08-28,2002-08-02,"Private, ltd by shares"90,0653297,"SOFA INTERNATIONAL LIMITED",1998-08-28,2014-01-03,"Private, ltd by shares"91,0653290,"SOUTH CHINA INDUSTRIAL INTERNATIONAL INVESTMENT (HOLDINGS) COMPANY LIMITED
中南實業國際投資(集團)有限公司",1998-08-28,2006-11-24,"Private, ltd by shares"92,0653261,"SPEEDEAL (HK) LIMITED",1998-08-28,2002-11-22,"Private, ltd by shares"93,0653316,"STAF (HK) CO., LIMITED",1998-08-28,2015-01-23,"Private, ltd by shares"94,0653263,"STANDARD TELECOM (HK) COMPANY LIMITED
標準電訊(香港)有限公司",1998-08-28,2005-10-28,"Private, ltd by shares"95,0653246,"STARMEDIA ASIA LIMITED",1998-08-28,2007-01-05,"Private, ltd by shares"96,0653256,"SURELUXE METALS LIMITED
崇立金屬有限公司",1998-08-28,,"Private, ltd by shares"97,0653331,"SWEET HEART (FOOD) LIMITED
心都甜食品有限公司",1998-08-28,2004-01-30,"Private, ltd by shares"98,0653330,"TACTWISE CO., LIMITED
緯宏有限公司",1998-08-28,2001-02-16,"Private, ltd by shares"99,0653301,"TAK PO AIR-CONDITIONING (HK) CO. LIMITED
德寶冷氣(香港)有限公司",1998-08-28,,"Private, ltd by shares"100,0653223,"TEAM MAX LIMITED
榮文有限公司",1998-08-28,,"Private, ltd by shares"101,0653292,"THERMO-SERV H.K. LIMITED",1998-08-28,2005-08-19,"Private, ltd by shares"102,0653300,"TIN FUNG WATCH GLASSES INDUSTRIAL CO., LIMITED
田豐錶面鏡片實業有限公司",1998-08-28,2001-02-02,"Private, ltd by shares"103,0653225,"TOP MASTER LIMITED (d2007-07-06)
恒英有限公司",1998-08-28,2007-07-06,"Private, ltd by shares"104,0653322,"TOP ONE ADVERTISEMENT LIMITED
第一廣告有限公司",1998-08-28,2002-10-11,"Private, ltd by shares"105,0653233,"TOPVIEW ENTERPRISES LIMITED
利景企業有限公司",1998-08-28,2000-11-10,"Private, ltd by shares"106,0653255,"TUEN MUN COMPUTER CAR WASHING AND LUBRICATING SERVICE COMPANY LIMITED
屯門電腦洗車唧油服務有限公司",1998-08-28,2007-02-09,"Private, ltd by shares"107,0653287,"UNET SYSTEMS LIMITED
統一網絡有限公司",1998-08-28,2009-07-10,"Private, ltd by shares"108,0653239,"UNI-TECH FINANCIAL SOLUTION LIMITED",1998-08-28,2001-05-18,"Private, ltd by shares"109,0653228,"UNILAND HOLDINGS LIMITED (d2013-11-29)
裕隆集團有限公司",1998-08-28,2013-11-29,"Private, ltd by shares"110,0653234,"UNILINK INTERNATIONAL LIMITED (d2005-08-19)
裕業國際有限公司",1998-08-28,2005-08-19,"Private, ltd by shares"111,0653298,"UNION TELECOMMUNICATIONS SERVICES CO. LIMITED
聯亞通訊服務有限公司",1998-08-28,2004-02-13,"Private, ltd by shares"112,0653251,"UNITRON (H.K.) LIMITED
優力創(香港)有限公司",1998-08-28,2007-03-02,"Private, ltd by shares"113,0653302,"UP-GRADE TEXTILE LIMITED
弘達紡織實業有限公司",1998-08-28,2003-04-25,"Private, ltd by shares"114,0653343,"VCI DESIGN &amp; CONTRACTING COMPANY LIMITED
形石設計工程有限公司",1998-08-28,2002-08-30,"Private, ltd by shares"115,0653296,"W3 LIMITED (HK)",1998-08-28,2019-05-10,"Private, ltd by shares"116,0653245,"WAH TAT INTERNATIONAL DEVELOPMENT LIMITED
華達國際發展有限公司",1998-08-28,2004-05-14,"Private, ltd by shares"117,0653299,"WAI HING STEEL IRON ENGINEERING LIMITED
惠興鋼鐵工程有限公司",1998-08-28,2015-01-02,"Private, ltd by shares"118,0653328,"WARNER (HOLDINGS) LIMITED
華納(控股)有限公司",1998-08-28,2011-05-06,"Private, ltd by shares"119,0653336,"WINBEL MANUFACTURING CORPORATION LIMITED
英博製造企業有限公司",1998-08-28,2008-01-11,"Private, ltd by shares"120,0653306,"WINNER AIR CARGO CO., LIMITED
利運航空貨運有限公司",1998-08-28,2005-08-19,"Private, ltd by shares"121,0653278,"YONG WEI INTERNATIONAL CARGO AGENCIES LIMITED
永威國際貨運代理有限公司",1998-08-28,2011-09-30,"Private, ltd by shares"122,0653291,"YU CHEN COMPANY LIMITED
宇慶有限公司",1998-08-28,,"Private, ltd by shares"