,Reg no.,Name,Incorp-orated,Dissolved,Type439,1372183,"YAN WING ENTERPRISE LIMITED
欣榮企業有限公司",2009-09-11,2014-04-11,"Private, ltd by shares"440,1372520,"YH FASHION HONG KONG CO., LIMITED
英紅服飾香港有限公司",2009-09-11,2019-03-22,"Private, ltd by shares"441,1372325,"YING YIU INDUSTRIAL (HONG KONG) LIMITED
盈耀實業(香港)有限公司",2009-09-11,,"Private, ltd by shares"442,1372613,"YIWU CIKI IMP &amp; EXP CO., LIMITED
義烏市正凱進出口有限公司",2009-09-11,,"Private, ltd by shares"443,1372351,"YONG ENG GLOBAL PROJECTS MANAGEMENT LIMITED
永恩項目管理有限公司",2009-09-11,2011-12-30,"Private, ltd by shares"444,1372197,"YUAN TECHNOLOGY LIMITED (d2012-02-17)
寓安科技有限公司",2009-09-11,2012-02-17,"Private, ltd by shares"445,1372413,"ZHAOHANG (H.K.) INTERIOR ARCHITECTURE DESIGN LIMITED
朝航(香港)室內建築設計有限公司",2009-09-11,2015-01-23,"Private, ltd by shares"446,1372499,"ZHISHENG TECHNOLOGY CO., LIMITED
智晟科技有限公司",2009-09-11,2018-03-02,"Private, ltd by shares"447,1372524,"ZHONGFA XINGPAN DRESS (HONGKONG) GROUP LIMITED
中法星盤服飾(香港)集團有限公司",2009-09-11,2016-05-06,"Private, ltd by shares"448,1372599,"ZHONGSHAN SENCAR ELECTRONICS CO., LIMITED
中山勝科電子有限公司",2009-09-11,2015-03-06,"Private, ltd by shares"449,1372522,"ZHONGTAILI TRADING (H.K) CO., LIMITED
中泰利貿易(香港)有限公司",2009-09-11,,"Private, ltd by shares"450,1372378,"ZY International Industry Co., Limited
香港正元有限公司",2009-09-11,,"Private, ltd by shares"