,Reg no.,Name,Incorp-orated,Dissolved,Type212,1372236,"HONGKONG RICHMO CO., LIMITED
香港慧得貿易有限公司",2009-09-11,2013-12-20,"Private, ltd by shares"213,1372317,"HONGKONG SINCERELY CO., LIMITED
香港銘佳有限公司",2009-09-11,,"Private, ltd by shares"214,1372356,"HONGKONG TIANYAN TECHNOLOGY LIMITED
香港天顏科技有限公司",2009-09-11,2013-12-20,"Private, ltd by shares"215,1372448,"HONGKONG WINNERGROUP IMP.&amp;EXP. CO., LIMITED
香港葳爾貿易有限公司",2009-09-11,2015-01-23,"Private, ltd by shares"216,1372488,"HONGKONG XIN YU XUAN INTERNATIONAL GROUP LIMITED
香港鑫雨宣國際集團有限公司",2009-09-11,2015-01-23,"Private, ltd by shares"217,1372258,"HONGKONG YFL INDUSTRY LIMITED
香港亞非拉實業有限公司",2009-09-11,2017-05-05,"Private, ltd by shares"218,1372252,"HONGKONG ZE YUN INVESTMENT GROUP CO., LIMITED
香港澤昀投資集團有限公司",2009-09-11,2015-10-02,"Private, ltd by shares"219,1372193,"HONTIN OCEAN RESOURCES LIMITED
瀚天海洋資源有限公司",2009-09-11,,"Private, ltd by shares"220,1372370,"HOPE INTERNATIONAL HOLDINGS CO., LIMITED
厚樸國際控股有限公司",2009-09-11,2017-05-05,"Private, ltd by shares"221,1372486,"HOSOK Heels Limited",2009-09-11,2015-01-23,"Private, ltd by shares"222,1372286,"Hot Energy Limited
炬創有限公司",2009-09-11,,"Private, ltd by shares"223,1372538,"HOUR GLASS MEDIA LIMITED",2009-09-11,2015-09-11,"Private, ltd by shares"224,1372540,"HUA SAN DE CO., LIMITED
華三德有限公司",2009-09-11,2015-01-23,"Private, ltd by shares"225,1372219,"HUA XIN TECHNOLOGY CO., LIMITED
華鑫科技有限公司",2009-09-11,,"Private, ltd by shares"226,1372468,"HUACAI INTERNATIONAL SERVICE GROUP LIMITED
華財國際服務集團有限公司",2009-09-11,,"Private, ltd by shares"227,1372577,"HUADE CARPET (CHINA) CO., LIMITED
華德地毯(中國)有限公司",2009-09-11,,"Private, ltd by shares"228,1372278,"HUANGHE DIAMOND GROUP LIMITED
黃河鑽石集團有限公司",2009-09-11,,"Private, ltd by shares"229,1372340,"HUANGMING SOLAR ENERGY NEW ENERGY INT'L LIMITED
皇明太陽能新能源國際有限公司",2009-09-11,2013-12-20,"Private, ltd by shares"230,1372503,"HUNG FOOK INTERNATIONAL INDUSTRIAL (HK) CO., LIMITED
鴻福國際實業(香港)有限公司",2009-09-11,,"Private, ltd by shares"231,1372186,"HVAC ENGINEERING CO., LIMITED
中意暖通工程有限公司",2009-09-11,,"Private, ltd by shares"232,1372168,"ICAN ELECTRONIC CO., LIMITED
艾康電子有限公司",2009-09-11,2015-01-23,"Private, ltd by shares"233,1372263,"IMAY SOLUTIONS COMPANY LIMITED
億美科技(香港)有限公司",2009-09-11,2013-09-19,"Private, ltd by shares"234,1372376,"INTERNATIONAL BIOMECHANICS LIMITED
國際生物力學有限公司",2009-09-11,2019-12-27,"Private, ltd by shares"235,1372343,"INTERNATIONAL YUKANGTANG (HK) MEDICAL TECHNOLOGY LIMITED
國際禦康堂(香港)醫藥科技有限公司",2009-09-11,2013-12-20,"Private, ltd by shares"236,1372327,"ITALY BOSS.BL SHOES &amp; CLOTHES GROUP LIMITED
意大利豹斯保羅鞋服集團有限公司",2009-09-11,2015-07-24,"Private, ltd by shares"237,1372243,"ITALY BUDLEE INTERNATIONAL INVESTMENT CO., LIMITED
意大利搏得利國際投資有限公司",2009-09-11,2013-03-01,"Private, ltd by shares"238,1372514,"J-TECH INTERNATIONAL CO., LIMITED
傑一科技(香港)有限公司",2009-09-11,,"Private, ltd by shares"239,1372299,"JACreative CONSULTANCY LIMITED",2009-09-11,2012-05-04,"Private, ltd by shares"240,1372184,"JAE CHINESE MEDICINE SPECIALIST MEDICAL CENTRE LIMITED
固本中醫專科醫療中心有限公司",2009-09-11,,"Private, ltd by shares"241,1372362,"Japan Guanjia Ink (HongKong) Limited
日本冠嘉油墨(香港)有限公司",2009-09-11,2013-12-20,"Private, ltd by shares"242,1372511,"JIAYANG STRATEGY MEDIA (HONGKONG) GROUP CO., LIMITED
嘉洋策劃傳媒(香港)集團有限公司",2009-09-11,2017-05-12,"Private, ltd by shares"243,1372419,"JIN CHENG INTERNATIONAL LIMITED
錦誠國際(香港)有限公司",2009-09-11,,"Private, ltd by shares"244,1372418,"JIN LI TRADING (HK) LIMITED
金力貿易(香港)有限公司",2009-09-11,2012-02-17,"Private, ltd by shares"245,1372382,"JiuZhou International (HongKong) Industrial Corporation., Limited
九洲國際(香港)實業有限公司",2009-09-11,2013-12-20,"Private, ltd by shares"246,1372346,"JIXIANG TECHNOLOGY (HK) LIMITED
吉祥豐科技(香港)有限公司",2009-09-11,,"Private, ltd by shares"247,1372590,"JK TEA CO., LIMITED
常青茶業有限公司",2009-09-11,,"Private, ltd by shares"248,1372539,"JOHNSON-MANU (SHENZHEN) CO., LIMITED
江盛精密工業(深圳)有限公司",2009-09-11,,"Private, ltd by shares"249,1372312,"JUDELI (HK) GROUP CHEMICAL CO., LIMITED
聚得利(香港)集團化工有限公司",2009-09-11,2017-05-05,"Private, ltd by shares"250,1372552,"JUNGLE JUICE HONG KONG LIMITED",2009-09-11,2015-01-23,"Private, ltd by shares"251,1372234,"JYB CAROTENOIDS INTERNATIONAL LIMITED",2009-09-11,,"Private, ltd by shares"252,1372174,"KALITYC ASIA LIMITED",2009-09-11,2013-11-15,"Private, ltd by shares"253,1372348,"KANAS INTERNATIONAL LIMITED",2009-09-11,,"Private, ltd by shares"254,1372402,"KELI INTERNATIONAL LIMITED (d2015-07-24)
科立國際有限公司",2009-09-11,2015-07-24,"Private, ltd by shares"255,1372306,"KEYBAGE GROUP CO., LIMITED
凱利集團發展有限公司",2009-09-11,2017-05-05,"Private, ltd by shares"256,1372507,"KF YUAN LIMITED
嘉豐源實業有限公司",2009-09-11,2016-02-12,"Private, ltd by shares"257,1372372,"KHATER TRADING CO., LIMITED
華誠貿易有限公司",2009-09-11,2020-11-13,"Private, ltd by shares"258,1372456,"KK LEATHER MANUFACTURER LIMITED
聚豐皮具有限公司",2009-09-11,,"Private, ltd by shares"259,1372422,"KnC Consulting Co., Limited",2009-09-11,2015-01-23,"Private, ltd by shares"260,1372609,"KOO IMPACT LIMITED",2009-09-11,2013-12-20,"Private, ltd by shares"261,1372611,"KSR LIGHTING (CHINA) LIMITED",2009-09-11,,"Private, ltd by shares"262,1372449,"LAND BOND GROUP CO., LIMITED
聯邦實業集團有限公司",2009-09-11,2016-05-06,"Private, ltd by shares"263,1372280,"Lasia International Trading Limited",2009-09-11,2015-01-23,"Private, ltd by shares"264,1372213,"LEDWARES INDUSTRIAL CO., LIMITED
詮鑫實業有限公司",2009-09-11,2017-05-05,"Private, ltd by shares"265,1372313,"LEFT AND RIGHT MEDIA LIMITED
左右媒體有限公司",2009-09-11,,"Private, ltd by shares"266,1372450,"LEI TE TRADING LIMITED
雷特國際貿易集團有限公司",2009-09-11,2011-03-25,"Private, ltd by shares"267,1372298,"LOFTY IDEAL COMPANY LIMITED
卓念企業有限公司",2009-09-11,2019-07-05,"Private, ltd by shares"268,1372580,"LONG VISION (HK) TRADING COMPANY LIMITED
致遠(香港)貿易有限公司",2009-09-11,,"Private, ltd by shares"269,1372556,"LONG VISION ASIA CO., LIMITED
朗維亞洲國際有限公司",2009-09-11,,"Private, ltd by shares"270,1372379,"LPS INTERNATIONAL LIMITED",2009-09-11,2017-07-14,"Private, ltd by shares"271,1372415,"LUCK WAY ELECTRONIC LIMITED
耐威電子有限公司",2009-09-11,2017-05-12,"Private, ltd by shares"272,1372169,"Lung Hang International Investment Limited
龍亨國際投資有限公司",2009-09-11,2011-02-18,"Private, ltd by shares"273,1372433,"M &amp; G INTERNATIONAL CO., LIMITED
名嘉國際有限公司",2009-09-11,2020-03-27,"Private, ltd by shares"274,1372386,"MAK ATTACK LIMITED",2009-09-11,,"Private, ltd by shares"275,1372500,"MANMON LIMITED",2009-09-11,2016-06-03,"Private, ltd by shares"276,1372256,"MASAM ENTERPRISE LIMITED
瑪賽姆企業有限公司",2009-09-11,2015-01-23,"Private, ltd by shares"277,1372311,"MASTER HILL LIMITED
萬峰行有限公司",2009-09-11,,"Private, ltd by shares"278,1372318,"MASTER LUCK LIMITED (d2019-04-04)
萬福行有限公司",2009-09-11,2019-04-04,"Private, ltd by shares"279,1372287,"MAXI WINES LIMITED",2009-09-11,2013-10-11,"Private, ltd by shares"280,1372592,"MAXWELL-GUIDER TECHNOLOGY LIMITED
麥斯威科技有限公司",2009-09-11,,"Private, ltd by shares"281,1372309,"MAXWORLD TRADING LIMITED (HK)
明和貿易有限公司",2009-09-11,,"Private, ltd by shares"282,1372272,"Medi Esthetic HongKong Limited",2009-09-11,,"Private, ltd by shares"283,1372209,"MEIDI SANITARY WARE (HK) GROUP LIMITED
美的衛浴(香港)集團有限公司",2009-09-11,2013-12-20,"Private, ltd by shares"284,1372586,"MEIKY (HK) ELECTRONICS CO., LIMITED
美琪(香港)電子有限公司",2009-09-11,2017-05-05,"Private, ltd by shares"285,1372255,"MFS (WAREHOUSE) LIMITED
冠名(倉儲)有限公司",2009-09-11,,"Private, ltd by shares"286,1372421,"Miyazaki (HK) Limited
宮崎(香港)有限公司",2009-09-11,,"Private, ltd by shares"287,1372528,"MK2 Jewellery Limited
賀珠寶有限公司",2009-09-11,,"Private, ltd by shares"288,1372403,"MOBILE DATA ONLINE INTERNATIONAL (HONG KONG) LIMITED
美迪歐國際(香港)有限公司",2009-09-11,2014-12-19,"Private, ltd by shares"289,1372198,"MORNING STAR EDUCATION INSTITUTE COMPANY LIMITED
創建教育機構有限公司",2009-09-11,2014-02-28,"Private, ltd by shares"290,1372310,"MORNINGHAN TECHNOLOGY CO., LIMITED
瀚思卡爾科技有限公司",2009-09-11,2013-12-20,"Private, ltd by shares"291,1372319,"NANHAI PLASTIC (HONG KONG) LIMITED
南海化輕(香港)有限公司",2009-09-11,2017-06-30,"Private, ltd by shares"292,1372470,"NEOSWAY TECHNOLOGY LIMITED
尼奧科技有限公司",2009-09-11,,"Private, ltd by shares"293,1372233,"NeuElement Limited",2009-09-11,,"Private, ltd by shares"294,1372289,"NEW SPACE TIME LIMITED",2009-09-11,2017-05-05,"Private, ltd by shares"295,1372323,"NEWGOOD CORPORATION LIMITED
新佳行有限公司",2009-09-11,,"Private, ltd by shares"296,1372254,"NGAI SUM DEVELOPMENT LIMITED
藝心發展有限公司",2009-09-11,,"Private, ltd by shares"297,1372483,"NINGBO BAODEAN INDUSTRIES &amp; TRADING CO., LIMITED
寧波保德安實業有限公司",2009-09-11,2013-03-01,"Private, ltd by shares"298,1372566,"NINGBO FRIEND TRADING LIMITED
寧波富潤德貿易有限公司",2009-09-11,,"Private, ltd by shares"299,1372431,"NIPPON TUNGSTEN (HONG KONG) CO., LIMITED
恩悌(香港)有限公司",2009-09-11,2017-12-29,"Private, ltd by shares"300,1372497,"OCEAN ACHIEVEMENT CONSULTING COMPANY LIMITED
海成顧問有限公司",2009-09-11,2013-12-20,"Private, ltd by shares"301,1372439,"OCEAN EAGLE INTERNATIONAL LIMITED (d2010-11-05)
海鷹國際有限公司",2009-09-11,2010-11-05,"Private, ltd by shares"302,1372239,"OCEAN PLEASANT SHIPPING LIMITED",2009-09-11,2019-06-28,"Private, ltd by shares"303,1372504,"Oceana Group (HK) Limited
海恩集團(香港)有限公司",2009-09-11,,"Private, ltd by shares"304,1372594,"OEM HUB CO., LIMITED",2009-09-11,2012-09-07,"Private, ltd by shares"305,1372547,"OKOS SERVICES LIMITED",2009-09-11,,"Private, ltd by shares"306,1372366,"OMI DESIGN CO., LIMITED
歐米設計有限公司",2009-09-11,2013-12-20,"Private, ltd by shares"307,1372250,"ONE BILLION GLOBAL FAMILY LIMITED
一億環球有限公司",2009-09-11,2015-03-06,"Private, ltd by shares"308,1372281,"One Tree Hill Co. Limited",2009-09-11,2012-11-16,"Private, ltd by shares"309,1372404,"ONE TWO THREE (HK) LIMITED
123(香港)有限公司",2009-09-11,2016-05-06,"Private, ltd by shares"310,1372587,"Original World Connection Limited (The)",2009-09-11,2012-01-27,"Private, ltd by shares"311,1372300,"P&amp;G NURSING GOODS (HK) LIMITED
寶潔護理用品(香港)有限公司",2009-09-11,2018-05-25,"Private, ltd by shares"312,1372477,"PACIFIC STEEL CABLE AND WIRE TRADING COMPANY LIMITED",2009-09-11,2015-03-20,"Private, ltd by shares"313,1372354,"Pan Asia Communication Company Limited",2009-09-11,,"Private, ltd by shares"314,1372589,"PANOCEAN MARITIME SERVICES (HONG KONG) CO., LIMITED
泛海海事服務(香港)有限公司",2009-09-11,,"Private, ltd by shares"315,1372330,"PENGYAN ELECTRONICS CORPORATION LIMITED
鵬研電子有限公司",2009-09-11,,"Private, ltd by shares"316,1372608,"PINK AND BLACK LIMITED (HK)
昇泉集團有限公司",2009-09-11,,"Private, ltd by shares"317,1372201,"PIONEER CROWN HOLDINGS LIMITED (d2012-02-24)
先創集團有限公司",2009-09-11,2012-02-24,"Private, ltd by shares"318,1372513,"POETRY PRESS (CHINA) LIMITED
詩壇出版社(中國)有限公司",2009-09-11,,"Private, ltd by shares"319,1372181,"PRIMA PACIFIC LIMITED
太盈有限公司",2009-09-11,2015-10-09,"Private, ltd by shares"320,1372410,"PROSPERO GLOBAL PRODUCTIONS LIMITED",2009-09-11,2015-09-04,"Private, ltd by shares"321,1372260,"Pure Concept Marketing Limited
潮善市場策劃有限公司",2009-09-11,2012-04-13,"Private, ltd by shares"322,1372331,"Q DIM SUM COMPANY LIMITED
明點心有限公司",2009-09-11,,"Private, ltd by shares"323,1372491,"QIHUI INTERNATIONAL CO., LIMITED
綺惠國際有限公司",2009-09-11,2019-02-15,"Private, ltd by shares"324,1372228,"Quoi Company Limited
啥有限公司",2009-09-11,,"Private, ltd by shares"325,1372598,"RAIN SIGHT INTERNATIONAL GROUP CO., LIMITED
景澤國際集團有限公司",2009-09-11,2017-05-05,"Private, ltd by shares"326,1372442,"Rami Consulting Limited",2009-09-11,2015-01-23,"Private, ltd by shares"327,1372400,"RAYHO INTERNATIONAL HOLDINGS (H.K) CO., LIMITED
瑞和國際控股(香港)有限公司",2009-09-11,,"Private, ltd by shares"328,1372270,"REACH TALENT TECHNOLOGY (HK) CO., LIMITED
瑞特科技(香港)有限公司",2009-09-11,,"Private, ltd by shares"329,1372216,"RED TOMATO LIMITED (d2011-03-11)",2009-09-11,2011-03-11,"Private, ltd by shares"330,1372396,"RELIANCE INTERIOR DECORATION COMPANY LIMITED
廉誠室內裝修有限公司",2009-09-11,,"Private, ltd by shares"331,1372465,"RENEW SUN CONSULT LIMITED",2009-09-11,,"Private, ltd by shares"332,1372380,"RICH COMMUNICATIONS HONG KONG LIMITED
利智香港有限公司",2009-09-11,2018-02-02,"Private, ltd by shares"333,1372329,"RICH EASY CORPORATION LIMITED
易富行有限公司",2009-09-11,,"Private, ltd by shares"334,1372265,"RIGHT PARTNER ENTERPRISE LIMITED",2009-09-11,,"Private, ltd by shares"335,1372230,"RISHENG (CHINA) CHEMICAL LIMITED
日勝(中國)化工有限公司",2009-09-11,2019-05-10,"Private, ltd by shares"336,1372459,"Rock Foundation Limited (The)",2009-09-11,,"Ltd by guarantee"337,1372244,"RSB INTERNATIONAL LIMITED
瑞世國際有限公司",2009-09-11,2015-07-24,"Private, ltd by shares"338,1372223,"SAQCN INNOVATION TECHNOLOGY (HK) LIMITED
賽其創新科技(香港)有限公司",2009-09-11,,"Private, ltd by shares"339,1372463,"SBC TRADING (HONGKONG) LIMITED",2009-09-11,,"Private, ltd by shares"340,1372374,"SD GROUP LIMITED (d2018-01-12)
艾斯蒂控股有限公司",2009-09-11,2018-01-12,"Private, ltd by shares"341,1372585,"SDL Skin (Hong Kong) Limited
新德利(香港)有限公司",2009-09-11,,"Private, ltd by shares"342,1372435,"SHANGHAI EASTERN TEXTILES (HONGKONG) CO., LIMITED",2009-09-11,,"Private, ltd by shares"343,1372453,"SHANGHAI JIXIANG (HK) MATERIAL LIMITED
上海吉祥材料有限公司",2009-09-11,,"Private, ltd by shares"344,1372349,"SHANGHAI PEOPLE CO., LIMITED
上海人民有限公司",2009-09-11,,"Private, ltd by shares"345,1372170,"SHANGHAI XINCHAO PUMP INDUSTRIAL LIMITED (d2017-05-05)
上海新潮泵業有限公司",2009-09-11,2017-05-05,"Private, ltd by shares"346,1372533,"SHEEN FAITH HOLDINGS LIMITED
善輝集團有限公司",2009-09-11,,"Private, ltd by shares"347,1372600,"SHENFU INTERNATIONAL CAPITAL INVESTMENT GROUP SHARE LIMITED
神富國際資本投資集團股份有限公司",2009-09-11,2018-05-25,"Private, ltd by shares"348,1372443,"SHENZHEN OSEEBE TECHNOLOGY CO., LIMITED
深圳市歐希比科技有限公司",2009-09-11,2016-05-06,"Private, ltd by shares"349,1372575,"Shenzhen Xinyuan Electronics Company Limited
深圳欣源電子有限公司",2009-09-11,,"Private, ltd by shares"350,1372457,"SHEPHERDO LIMITED
施華德有限公司",2009-09-11,,"Private, ltd by shares"351,1372549,"SHIND INDUSTRIAL LIMITED
新同實業(香港)有限公司",2009-09-11,,"Private, ltd by shares"352,1372180,"SHINING HILLS FASHION JEWELLERY LIMITED
心悅時尚首飾有限公司",2009-09-11,,"Private, ltd by shares"353,1372302,"SHUI ON NURSING HOME HOLDINGS LIMITED
瑞安護老院集團有限公司",2009-09-11,,"Private, ltd by shares"354,1372558,"SHUN CHANG SHENG TECHNOLOGY (HK) LIMITED
順昌盛科技(香港)有限公司",2009-09-11,2013-12-20,"Private, ltd by shares"355,1372512,"SHUN FAT ROAST LIMITED
順發燒味有限公司",2009-09-11,,"Private, ltd by shares"356,1372574,"SINGCHEN TECHNOLOGY (HK) LIMITED
信誠科技(香港)有限公司",2009-09-11,,"Private, ltd by shares"357,1372478,"SINO ASSOCIATES GLOBAL LIMITED
賽諾國際商務有限公司",2009-09-11,,"Private, ltd by shares"358,1372427,"SINO INTERNATIONAL (HONG KONG) INVESTMENT LIMITED
東信國際投資(香港)有限公司",2009-09-11,2018-04-27,"Private, ltd by shares"359,1372227,"SINOLOHAS LIMITED
中國樂活有限公司",2009-09-11,,"Private, ltd by shares"360,1372359,"Sinotech Power Group Holding Limited
中國光電集團控股有限公司",2009-09-11,,"Private, ltd by shares"361,1372285,"SINOWIN CONSULTANTS LIMITED
東興顧問有限公司",2009-09-11,,"Private, ltd by shares"362,1372405,"SIRECTIFIER ELECTRONIC (HK) CO., LIMITED
矽萊克電子股份(香港)有限公司",2009-09-11,2011-03-11,"Private, ltd by shares"363,1372332,"SKY ERA LIMITED
天時行有限公司",2009-09-11,,"Private, ltd by shares"364,1372334,"SKY FIRST LIMITED
天明行有限公司",2009-09-11,,"Private, ltd by shares"365,1372338,"SKY ONE LIMITED (d2017-09-29)
天一行有限公司",2009-09-11,2017-09-29,"Private, ltd by shares"366,1372262,"SMILE INTERNATIONAL TRADING LIMITED
施邁歐國際貿易有限公司",2009-09-11,,"Private, ltd by shares"367,1372565,"SOLARIS PRO LIMITED",2009-09-11,2018-04-27,"Private, ltd by shares"368,1372167,"SOUTHERN WIND (CHINA) COMPANY LIMITED
南風(中國)有限公司",2009-09-11,2015-07-10,"Private, ltd by shares"369,1372429,"Spare Parts Direct Limited",2009-09-11,,"Private, ltd by shares"370,1372294,"STAR FANCY LIMITED
宜星行有限公司",2009-09-11,,"Private, ltd by shares"371,1372408,"STARAY LIGHTING ELECTRONICS LIMITED
星耀燈飾電子有限公司",2009-09-11,2012-01-27,"Private, ltd by shares"372,1372364,"STEELUNI TRADING CO., LIMITED
華鋼國際貿易有限公司",2009-09-11,2011-04-08,"Private, ltd by shares"373,1372489,"SUCCESS CIVIL &amp; FOUNDATION ENGINEERING LIMITED (d2015-01-23)
泰成建造工程有限公司",2009-09-11,2015-01-23,"Private, ltd by shares"374,1372352,"SUCCESS INTERNATIONAL GROUP (HONG KONG) LIMITED
成功國際集團(香港)有限公司",2009-09-11,,"Private, ltd by shares"375,1372518,"SUCCESS IPO INVESTMENT LIMITED",2009-09-11,,"Private, ltd by shares"376,1372191,"SUN JUICE LIMITED (d2015-09-11)",2009-09-11,2015-09-11,"Private, ltd by shares"377,1372290,"SUN MORAL LIMITED
德輝行有限公司",2009-09-11,2016-03-11,"Private, ltd by shares"378,1372177,"SUN RAMS LIMITED",2009-09-11,2015-07-31,"Private, ltd by shares"379,1372452,"SUNFLOWER TIANJIN CO., LIMITED
晶源泰國際貿易有限公司",2009-09-11,2019-01-25,"Private, ltd by shares"380,1372211,"SUNFLY APPLIANCES (SHUNDE) LIMITED
新飛家電(順德)有限公司",2009-09-11,2013-12-20,"Private, ltd by shares"381,1372296,"SUNFORD HOLDINGS LIMITED
順福集團有限公司",2009-09-11,,"Private, ltd by shares"382,1372387,"SUPERIOR LION ENTERPRISES LIMITED
優獅企業有限公司",2009-09-11,2012-04-20,"Private, ltd by shares"383,1372204,"TAIWAN BOTU HOUSE &amp; HOME GROUP LIMITED
台灣博圖家居集團有限公司",2009-09-11,2015-07-24,"Private, ltd by shares"384,1372476,"Taiwan Queyou Electrical Device Limited
臺灣雀友機電設備有限公司",2009-09-11,2013-12-20,"Private, ltd by shares"385,1372316,"TC INTERNATIONAL TRADING (HK) CO., LIMITED
同燦國際貿易(香港)有限公司",2009-09-11,2015-01-23,"Private, ltd by shares"386,1372266,"TECHMOR INTERNATIONAL LIMITED
德力馬(國際)有限公司",2009-09-11,2018-02-15,"Private, ltd by shares"387,1372355,"TEX PROJECT LIMITED",2009-09-11,,"Private, ltd by shares"388,1372200,"THINKING (HK) ENTERPRISES LIMITED
興勤(香港)企業有限公司",2009-09-11,,"Private, ltd by shares"389,1372461,"THRANGU DHARMAKARA PUBLICATION LIMITED
創古文化有限公司",2009-09-11,,"Ltd by guarantee"390,1372458,"TIANXIANXIAO (HK) BIOLOGICAL MEDICINE TECHNOLOGY CHINA CO., LIMITED
天纖笑(香港)生物醫藥科技中國有限公司",2009-09-11,2016-05-06,"Private, ltd by shares"391,1372545,"TOGETHER INTERNATIONAL BUSINESS CO., LIMITED
香港億合國際商務有限公司",2009-09-11,2016-05-06,"Private, ltd by shares"392,1372172,"TONGAR LIMITED
唐佳有限公司",2009-09-11,2017-04-21,"Private, ltd by shares"393,1372412,"TOPCOD GROUP (HONG KONG) LIMITED
特普高集團(香港)有限公司",2009-09-11,,"Private, ltd by shares"394,1372383,"TORC LIMITED (d2012-01-13)",2009-09-11,2012-01-13,"Private, ltd by shares"395,1372282,"TOTAL CHINA LIMITED
豐華行有限公司",2009-09-11,,"Private, ltd by shares"396,1372328,"TRENDCO INVESTMENT LIMITED
祥高投資有限公司",2009-09-11,2015-10-09,"Private, ltd by shares"397,1372537,"Troy International Limited
天壹國際有限公司",2009-09-11,,"Private, ltd by shares"398,1372214,"TUNIS NABEUL FERTILIZER LIMITED
突尼斯納布勒化肥有限公司",2009-09-11,2013-12-20,"Private, ltd by shares"399,1372495,"UA CONTAINERS LIMITED
亞洲聯合貨櫃有限公司",2009-09-11,,"Private, ltd by shares"400,1372492,"UKY INTERNATIONAL CO., LIMITED
鑫群國際有限公司",2009-09-11,2011-10-28,"Private, ltd by shares"401,1372490,"UNIFLEX COMPANY LIMITED
優越行有限公司",2009-09-11,,"Private, ltd by shares"402,1372399,"UNIFY CURRENCY FULL WEALTH INVESTMENT LIMITED
滙通盈富投資有限公司",2009-09-11,2018-05-25,"Private, ltd by shares"403,1372390,"UNITE TECH PRECISION (HK) CO., LIMITED
聯科精密(香港)有限公司",2009-09-11,2018-05-25,"Private, ltd by shares"404,1372202,"United Asia Nursing Care Limited
聯合亞洲護理有限公司",2009-09-11,2011-09-02,"Private, ltd by shares"405,1372532,"UNITRANS FREIGHT SOLUTION LIMITED
天坤物流有限公司",2009-09-11,2019-06-14,"Private, ltd by shares"406,1372297,"UNIVERSAL WORLDEVENTS ASIA LIMITED",2009-09-11,2018-06-22,"Private, ltd by shares"407,1372482,"UPTOP FURNISHINGS CO., LIMITED
上品家居實業有限公司",2009-09-11,,"Private, ltd by shares"408,1372569,"USA JAMES (GROUP) HOLDINGS LIMITED
美國詹姆斯(集團)控股有限公司",2009-09-11,,"Private, ltd by shares"409,1372212,"USA JOYJEE PARKERISING GROUP LIMITED
美國嘉吉磷化集團有限公司",2009-09-11,2013-12-20,"Private, ltd by shares"410,1372320,"VIIA Digital Limited
緯亞數碼有限公司",2009-09-11,,"Private, ltd by shares"411,1372471,"VIOVIA COMMUNICATION COMPANY LIMITED
紫游資訊有限公司",2009-09-11,2012-08-03,"Private, ltd by shares"412,1372428,"VIRTUE &amp; WISDOM LINK BOOKS LIMITED
德慧文化圖書有限公司",2009-09-11,,"Private, ltd by shares"413,1372494,"VIVID FASHION GARMENT CO., LIMITED
廣州多彩數碼印花有限公司",2009-09-11,2015-01-23,"Private, ltd by shares"414,1372496,"VKC FOREX (HK) LIMITED",2009-09-11,2012-02-24,"Private, ltd by shares"415,1372363,"VNVTECH COMPANY LIMITED
斯伯森科技有限公司",2009-09-11,2015-07-24,"Private, ltd by shares"416,1372480,"Waltshire Capital Advisors Limited",2009-09-11,2017-09-29,"Private, ltd by shares"417,1372369,"WANHONG ELECTRONICS CO., LIMITED
萬宏電子有限公司",2009-09-11,,"Private, ltd by shares"418,1372353,"WEALTH GAIN INVESTMENT DEVELOPMENT LIMITED
盈富投資發展有限公司",2009-09-11,,"Private, ltd by shares"419,1372190,"Webs s'up Production Company Limited
唯工作室有限公司",2009-09-11,,"Private, ltd by shares"420,1372185,"WELL SYSTEM CORPORATION LIMITED
瑞勤有限公司",2009-09-11,2015-07-24,"Private, ltd by shares"421,1372481,"WELLCOME ASSETS MANAGEMENT LIMITED
宏廣資產管理有限公司",2009-09-11,2016-04-29,"Private, ltd by shares"422,1372593,"WESCCO CHEMICAL LIMITED
上海善島化工有限公司",2009-09-11,2015-01-23,"Private, ltd by shares"423,1372246,"WHI LIMITED (THE)
嘉源(亞洲)投資有限公司",2009-09-11,,"Private, ltd by shares"424,1372171,"WILL LOGISTICS AND INDUSTRIAL LIMITED",2009-09-11,,"Private, ltd by shares"425,1372279,"WILL UNION LIMITED
志聯行有限公司",2009-09-11,2011-12-30,"Private, ltd by shares"426,1372584,"WIN BEST HOLDINGS (HK) LIMITED
盈旺控股(香港)有限公司",2009-09-11,2013-12-20,"Private, ltd by shares"427,1372588,"WINCO PREMIER INTERIOR DESIGN LIMITED
域高室內設計工程有限公司",2009-09-11,,"Private, ltd by shares"428,1372508,"WINCOM INDUSTRIAL LIMITED
盈科實業有限公司",2009-09-11,2013-05-24,"Private, ltd by shares"429,1372440,"Wisdom Resources Management Consultant Limited
智慧資源管理顧問有限公司",2009-09-11,,"Private, ltd by shares"430,1372292,"WORLD FAIR DEVELOPMENT LIMITED (d2014-07-11)
偉發發展有限公司",2009-09-11,2014-07-11,"Private, ltd by shares"431,1372576,"World In Progress Limited",2009-09-11,2013-09-19,"Private, ltd by shares"432,1372222,"WORLDFIRE INDUSTRIAL CO., LIMITED",2009-09-11,2018-03-16,"Private, ltd by shares"433,1372612,"WSKE ELECTRONICS (HK) CO., LIMITED
文思卡爾電子(香港)有限公司",2009-09-11,,"Private, ltd by shares"434,1372284,"XIERY INTERNATIONAL HOLDINGS LIMITED
西瑞國際控股有限公司",2009-09-11,,"Private, ltd by shares"435,1372534,"XINYUAN INDUSTRIAL CO., LIMITED (d2013-12-20)
鑫源工貿有限公司",2009-09-11,2013-12-20,"Private, ltd by shares"436,1372237,"XUFENG (HK) TRADING LIMITED
香港旭豐貿易有限公司",2009-09-11,,"Private, ltd by shares"437,1372373,"Y &amp; Y GLOBAL FOOD TRADING LIMITED
業揚貿易有限公司",2009-09-11,2012-05-11,"Private, ltd by shares"438,1372350,"Y&amp;T INTERNATIONAL BUSINESS CO., LIMITED
翌天國際商務有限公司",2009-09-11,,"Private, ltd by shares"