,Reg no.,Name,Incorp-orated,Dissolved,Type1,1372436,"1000 COLORS HOLDING LIMITED",2009-09-11,2018-03-23,"Private, ltd by shares"2,1372314,"ACCUEARTH ASIA CO., LIMITED",2009-09-11,2017-05-26,"Private, ltd by shares"3,1372247,"Ace Firm Limited
亞石貿易有限公司",2009-09-11,2019-01-04,"Private, ltd by shares"4,1372203,"ACTIVE POWER CORPORATION LIMITED
活力興業有限公司",2009-09-11,,"Private, ltd by shares"5,1372407,"AEW VIA HK 1 Limited",2009-09-11,,"Private, ltd by shares"6,1372268,"ALL CHINA FEDERATION OF CULTURE &amp; EDUCATION PRESS (GROUP) CO., LIMITED
中國文教聯出版社(集團)股份有限公司",2009-09-11,,"Private, ltd by shares"7,1372205,"ALL-WORLD-SOURCING LIMITED",2009-09-11,2020-10-09,"Private, ltd by shares"8,1372288,"ANCIENT INVESTMENT LIMITED",2009-09-11,2013-12-20,"Private, ltd by shares"9,1372420,"ANDA ONE INDUSTRIAL CO., LIMITED
安得萬實業有限公司",2009-09-11,2017-01-20,"Private, ltd by shares"10,1372344,"ANGEL INVESTMENT HOLDINGS LIMITED
安佳投資集團有限公司",2009-09-11,,"Private, ltd by shares"11,1372283,"ANPA INTERNATIONAL (HK) LIMITED
安栢國際(香港)有限公司",2009-09-11,2012-06-22,"Private, ltd by shares"12,1372502,"ANSA INTERNATIONAL TRADING CONSULTATION CO., LIMITED
安薩國際貿易諮詢有限公司",2009-09-11,,"Private, ltd by shares"13,1372560,"ARKID INTERNATIONAL LIMITED",2009-09-11,2014-03-07,"Private, ltd by shares"14,1372394,"ARTISTIC MOVES LIMITED",2009-09-11,2017-04-13,"Private, ltd by shares"15,1372339,"ASTON BIOPHARMACEUTICALS (U.K.) LIMITED
英國阿斯頓生物藥業有限公司",2009-09-11,2013-12-20,"Private, ltd by shares"16,1372195,"Aurora Borealis International Limited
宸曦國際有限公司",2009-09-11,,"Private, ltd by shares"17,1372322,"AUVIX LIMITED",2009-09-11,2017-03-31,"Private, ltd by shares"18,1372603,"AY PLUS DEVELOPMENT (HK) CO., LIMITED
香港艾顏佳實業發展有限公司",2009-09-11,,"Private, ltd by shares"19,1372341,"Bag to Basics Limited",2009-09-11,2018-01-19,"Private, ltd by shares"20,1372259,"Beacon Hill Garden Limited
畢架山苑有限公司",2009-09-11,,"Private, ltd by shares"21,1372274,"Belos Capital Consulting Limited
貝羅斯資本顧問有限公司",2009-09-11,,"Private, ltd by shares"22,1372245,"BESTRICH CORPORATION LIMITED (d2011-08-19)
富明行有限公司",2009-09-11,2011-08-19,"Private, ltd by shares"23,1372414,"BIG POWER INVESTMENT LIMITED (d2014-02-28)
力量投資有限公司",2009-09-11,2014-02-28,"Private, ltd by shares"24,1372377,"BILL ENGINEERING LIMITED
彪工程有限公司",2009-09-11,,"Private, ltd by shares"25,1372597,"BILLION KING MACHINE (HONG KONG) LIMITED
億騰機械(香港)有限公司",2009-09-11,,"Private, ltd by shares"26,1372441,"BLACK PEONY INTERNATIONAL LIMITED
黑牡丹國際有限公司",2009-09-11,2011-01-21,"Private, ltd by shares"27,1372182,"BLUEGIGA TECHNOLOGIES LIMITED
藍兆科技有限公司",2009-09-11,2016-12-16,"Private, ltd by shares"28,1372516,"BLUESABER PROJECTS (HK) LIMITED",2009-09-11,,"Private, ltd by shares"29,1372423,"BOSTON (HONG KONG) HOLDINGS LIMITED
波士頓(香港)控股有限公司",2009-09-11,2016-05-06,"Private, ltd by shares"30,1372291,"C.Y. (HK) LIMITED
卓億物流(香港)有限公司",2009-09-11,2013-01-25,"Private, ltd by shares"31,1372337,"CAC Capital Advisors Limited
建銀中信投資顧問有限公司",2009-09-11,2015-04-02,"Private, ltd by shares"32,1372176,"CaSaal Wine Limited
卡莎酒業有限公司",2009-09-11,2018-04-17,"Private, ltd by shares"33,1372557,"CATALYST ADVERTISING LIMITED (d2015-09-11)",2009-09-11,2015-09-11,"Private, ltd by shares"34,1372454,"CHANGBAO (HONG KONG) TRADING CO., LIMITED
長葆香港貿易有限公司",2009-09-11,,"Private, ltd by shares"35,1372437,"CHANNEL INT'L STEEL LOGISTICS INVESTMENT LIMITED
海峽國際鋼鐵物流投資有限公司",2009-09-11,2016-05-06,"Private, ltd by shares"36,1372304,"CHANNEL RICH INVESTMENT LIMITED
祥發投資有限公司",2009-09-11,,"Private, ltd by shares"37,1372466,"CHARHODEN INTERNATIONAL DEVELOPMENT CO., LIMITED
夏．赫丹國際發展有限公司",2009-09-11,,"Private, ltd by shares"38,1372479,"CHARTER STRATEGIC (INTERNATIONAL) LIMITED",2009-09-11,2015-10-09,"Private, ltd by shares"39,1372175,"CHEEY KITCHEN APPLIANCES (CHINA) LIMITED
櫻花廚房電器(中國)有限公司",2009-09-11,2013-12-20,"Private, ltd by shares"40,1372451,"CHINA BJG EUROPE &amp; ASIA BIO-TECH LIMITED
中國北極光歐亞生物科技有限公司",2009-09-11,2013-12-20,"Private, ltd by shares"41,1372596,"CHINA BUILD EDUCATE GROUP MANAGE LIMITED
中國建設教育集團管理有限公司",2009-09-11,2015-01-23,"Private, ltd by shares"42,1372426,"CHINA GREAT INVESTMENT GROUP CO., LIMITED
中國國瑞投資集團有限公司",2009-09-11,2018-11-09,"Private, ltd by shares"43,1372460,"CHINA HAND KEY INDUSTRIAL LIMITED
中航基實業有限公司",2009-09-11,,"Private, ltd by shares"44,1372530,"CHINA HUA JU CULTURE DEVELOPMENT LIMITED
中國華聚文化發展有限公司",2009-09-11,2013-12-20,"Private, ltd by shares"45,1372510,"CHINA HUIXIA GROUP LIMITED
中國輝夏集團有限公司",2009-09-11,2013-12-20,"Private, ltd by shares"46,1372604,"CHINA INTERNATIONAL CULTURE INVESTMENT GROUP LIMITED
中華國際文化投資集團有限公司",2009-09-11,,"Private, ltd by shares"47,1372367,"China International Dance Federation CO., Limited
中國國際舞蹈聯合會有限公司",2009-09-11,2013-12-20,"Private, ltd by shares"48,1372358,"CHINA NON-GOVERNMENT EDUCATION INFORMATION (HK) LIMITED
中國民辦教育信息網有限公司",2009-09-11,2017-05-05,"Private, ltd by shares"49,1372385,"CHINA RESOURCES FUND LIMITED
中國戰略資源管理有限公司",2009-09-11,,"Private, ltd by shares"50,1372248,"CHINA STAGE LIMITED
華進行有限公司",2009-09-11,2018-01-05,"Private, ltd by shares"51,1372582,"CHINA STANDARD ENERGY SOURCES GROUP CO., LIMITED
中國標準能源集團有限公司",2009-09-11,,"Private, ltd by shares"52,1372474,"CHINA TAIWAN XIANBAIDU RESTAURANT MANAGEMENT LIMITED
中國臺灣鮮百度餐飲管理有限公司",2009-09-11,2018-05-25,"Private, ltd by shares"53,1372523,"CHINA TIANCHENG GROUP LIMITED (d2017-07-07)
中國天成集團有限公司",2009-09-11,2017-07-07,"Private, ltd by shares"54,1372210,"CHINA TOWER TECHNOLOGY LIMITED
中鑫科技有限公司",2009-09-11,,"Private, ltd by shares"55,1372199,"CHINA TRADE PROPERTIES LIMITED
華商置業有限公司",2009-09-11,2013-03-08,"Private, ltd by shares"56,1372515,"CHINA YAN-HUANG SECURITY FOUNDATION LIMITED
中華炎黃安全基金會有限公司",2009-09-11,2012-09-07,"Private, ltd by shares"57,1372521,"CHINA YINGJIE INDUSTRY LIMITED
中國英捷實業有限公司",2009-09-11,,"Private, ltd by shares"58,1372548,"CHINATEX ENGINEERING LIMITED",2009-09-11,2013-02-01,"Private, ltd by shares"59,1372432,"CHUNG KONG KAI LOK INTERNATIONAL LIMITED
松江佳樂國際有限公司",2009-09-11,,"Private, ltd by shares"60,1372525,"CIECAC INTERNATIONAL HOLDINGS COMPANY LIMITED
希爾佳國際控股有限公司",2009-09-11,,"Private, ltd by shares"61,1372505,"CO-DOING TECHNOLOGY CO., LIMITED
合渡技術有限公司",2009-09-11,,"Private, ltd by shares"62,1372392,"COALITION SOCIAL ENTERPRISE LIMITED
群力社企有限公司",2009-09-11,,"Private, ltd by shares"63,1372345,"CommAsia Holdings HK Limited",2009-09-11,2015-07-24,"Private, ltd by shares"64,1372425,"Connected Solutions Limited (HK)",2009-09-11,2019-12-20,"Private, ltd by shares"65,1372467,"CPL INTERNATIONAL LIMITED (d2019-02-01)
華晟國際有限公司",2009-09-11,2019-02-01,"Private, ltd by shares"66,1372251,"CURRENT SUCCESS LIMITED
長成行有限公司",2009-09-11,2015-07-24,"Private, ltd by shares"67,1372221,"CY SPRAYING &amp; PURIFICATION TECHNOLOGY LIMITED
翔源噴霧淨化科技有限公司",2009-09-11,,"Private, ltd by shares"68,1372196,"DAHUA GROUP INTERNATIONAL INVESTMENT LIMITED
大華集團國際投資有限公司",2009-09-11,2018-11-09,"Private, ltd by shares"69,1372276,"DaWall Limited",2009-09-11,2015-01-23,"Private, ltd by shares"70,1372333,"DAZZLES ADVERTISING INTERNATIONAL COMPANY LIMITED
炫視國際廣告有限公司",2009-09-11,2013-12-20,"Private, ltd by shares"71,1372381,"DEFENG INDUSTRY (HONGKONG) CO., LIMITED
德峰實業(香港)有限公司",2009-09-11,2015-01-23,"Private, ltd by shares"72,1372583,"DELBEN INTERNATIONAL COMPANY LIMITED
德爾賓國際有限公司",2009-09-11,,"Private, ltd by shares"73,1372371,"DGD ENTERPRISE GROUP LIMITED
登高登集團有限公司",2009-09-11,,"Private, ltd by shares"74,1372397,"DICK FUNG INDUSTRIAL (HK) LIMITED
迪豐實業(香港)有限公司",2009-09-11,2014-12-19,"Private, ltd by shares"75,1372269,"DIMENSION CREATION INTERNATIONAL PROFESSIONAL SERVICES LIMITED
創維國際專業服務有限公司",2009-09-11,,"Private, ltd by shares"76,1372527,"DONGGUAN RONGDA IRONWARE TRINKET LIMITED
東莞榮達五金飾品有限公司",2009-09-11,2016-12-30,"Private, ltd by shares"77,1372406,"DR. ANDREW C. Y. HO &amp; ASSOCIATES LIMITED
何仲賢醫務中心有限公司",2009-09-11,,"Private, ltd by shares"78,1372462,"DYNA ENGINEERING H.K. COMPANY LIMITED
大通機械工程香港有限公司",2009-09-11,2018-04-13,"Private, ltd by shares"79,1372401,"E - TOP (HONG KONG) LIMITED
易海拓(香港)有限公司",2009-09-11,,"Private, ltd by shares"80,1372542,"EA BUSINESS SERVICES LIMITED
東亞商務有限公司",2009-09-11,,"Private, ltd by shares"81,1372544,"EAGLEFLY GROUP LIMITED
鵬飛集團有限公司",2009-09-11,2018-03-23,"Private, ltd by shares"82,1372253,"EARN TREND LIMITED (d2013-05-03)
利得行有限公司",2009-09-11,2013-05-03,"Private, ltd by shares"83,1372424,"EAST DRAGON INT'L INDUSTRIAL LIMITED
東龍國際實業有限公司",2009-09-11,2015-11-27,"Private, ltd by shares"84,1372610,"EASTERN EAGLE INTERNATIONAL TRADING CO., LIMITED",2009-09-11,,"Private, ltd by shares"85,1372232,"EASTERN GOLDEN DRAGON (HK) DEVELOPMENT LIMITED
香港東方金龍發展有限公司",2009-09-11,,"Private, ltd by shares"86,1372447,"EASTTOP MARKET LIMITED
東鼎市場有限公司",2009-09-11,2011-07-08,"Private, ltd by shares"87,1372217,"EASY GRAND CHINA CO., LIMITED
易嘉中國有限公司",2009-09-11,,"Private, ltd by shares"88,1372375,"EDISA TRADING COMPANY LIMITED
伊締莎貿易有限公司",2009-09-11,,"Private, ltd by shares"89,1372501,"EGO INTERNATIONAL HOLDINGS CO., LIMITED
易購科技股份有限公司",2009-09-11,2013-12-20,"Private, ltd by shares"90,1372173,"Elecmat Technology Company Limited
潤振實業股份有限公司",2009-09-11,,"Private, ltd by shares"91,1372606,"ENVIRONMENTAL ENERGY SAVING HOLDINGS LIMITED
節能環保控股有限公司",2009-09-11,,"Private, ltd by shares"92,1372249,"EQHEALTH PRODUCTS COMPANY LIMITED",2009-09-11,2016-03-18,"Private, ltd by shares"93,1372189,"EUCA TECHNOLOGIES LIMITED",2009-09-11,,"Private, ltd by shares"94,1372188,"EVER UNION CORPORATION LIMITED
永宇有限公司",2009-09-11,,"Private, ltd by shares"95,1372568,"EXCEED GLOBAL PETROLEUM&amp;CHEMICAL COMPANY LIMITED",2009-09-11,,"Private, ltd by shares"96,1372336,"EXCELLO PARTNERSHIP ASIA LIMITED
益熙合伙人亞洲有限公司",2009-09-11,,"Private, ltd by shares"97,1372487,"FAITH WILL ASIA PACIFIC COMPANY LIMITED
信志亞太有限公司",2009-09-11,2017-05-05,"Private, ltd by shares"98,1372194,"FAMOUS MASTER PROPERTIES LIMITED
鴻達置業有限公司",2009-09-11,2016-04-22,"Private, ltd by shares"99,1372361,"FAR BOOM PIECE GOODS TRADING LIMITED
興林建業有限公司",2009-09-11,2020-09-18,"Private, ltd by shares"100,1372166,"FASHION SOLUTION LIMITED (d2011-04-15)",2009-09-11,2011-04-15,"Private, ltd by shares"101,1372257,"FAST GAIN LIMITED
快達行有限公司",2009-09-11,2015-06-12,"Private, ltd by shares"102,1372271,"FD-SEMAPHORE INTERNATIONAL LIMITED
賽門福國際有限公司",2009-09-11,2013-12-20,"Private, ltd by shares"103,1372561,"FIC INTERNATIONAL CO., LIMITED
柳柳國貿有限公司",2009-09-11,2015-01-23,"Private, ltd by shares"104,1372607,"FINE FAME INVESTMENT HOLDINGS LIMITED
新鑫礦業控股有限公司",2009-09-11,,"Private, ltd by shares"105,1372261,"FINEWELL CORPORATION LIMITED
佳輝行有限公司",2009-09-11,2013-05-03,"Private, ltd by shares"106,1372303,"FIRST SUCCESS CORPORATION LIMITED
領成行有限公司",2009-09-11,,"Private, ltd by shares"107,1372551,"FMR313 LIMITED",2009-09-11,2018-05-25,"Private, ltd by shares"108,1372360,"FOCUS TECHNOLOGY (HK) DEVELOP LIMITED
焦點科技(香港)開發有限公司",2009-09-11,2013-12-20,"Private, ltd by shares"109,1372546,"FORDRICH GROUP CO., LIMITED",2009-09-11,2011-03-11,"Private, ltd by shares"110,1372591,"FOREVER JEWELRY (H.K) CO., LIMITED
永恆珠寶(國際)有限公司",2009-09-11,,"Private, ltd by shares"111,1372559,"FORTUNE AGRICULTURE TRADING COMPANY LIMITED
福群貿易有限公司",2009-09-11,,"Private, ltd by shares"112,1372384,"FortuneTT Limited",2009-09-11,2010-12-03,"Private, ltd by shares"113,1372573,"FRANCE CASTEL GROUP GRAPE WINE INDUSTRY LIMITED
法國卡斯特集團葡萄酒業有限公司",2009-09-11,2013-12-20,"Private, ltd by shares"114,1372335,"FRANCE DIOR BOOT DRESS INT'L GROUP (ASIA) LIMITED
法國迪奧波登服飾國際集團(亞洲)有限公司",2009-09-11,2013-12-20,"Private, ltd by shares"115,1372578,"FRANCE PIERRE CARDIN HOME TEXTILES LIMITED
法國皮爾卡丹家紡有限公司",2009-09-11,2016-05-06,"Private, ltd by shares"116,1372562,"FRANCE VICSNO INT'L CLOTHING LIMITED
法國威克思諾國際服裝有限公司",2009-09-11,2013-12-20,"Private, ltd by shares"117,1372473,"FRAZZIL BRAND (FRANCE) GROUP LIMITED
法姿品牌(法國)集團有限公司",2009-09-11,,"Private, ltd by shares"118,1372469,"FuFeng Information Consulting (Hong Kong) Co., Limited
香港福豐信息諮詢有限公司",2009-09-11,2015-01-23,"Private, ltd by shares"119,1372411,"FUJI DESIGN (HK) LIMITED
富士設計(香港)有限公司",2009-09-11,,"Private, ltd by shares"120,1372277,"FULLMAX CONSULTANTS LIMITED
豐明顧問有限公司",2009-09-11,,"Private, ltd by shares"121,1372206,"Fusion Consulting International Limited
聯合國際顧問有限公司",2009-09-11,2015-07-10,"Private, ltd by shares"122,1372273,"FUTIAN (H.K.) COMPANY LIMITED
富田(香港)金屬製品有限公司",2009-09-11,,"Private, ltd by shares"123,1372438,"G-LUX MARINE &amp; CONSULTANTS COMPANY LIMITED
高樂士海事顧問有限公司",2009-09-11,,"Private, ltd by shares"124,1372225,"G-STAR APPLIANCES CO., LIMITED
聚星電器有限公司",2009-09-11,2018-06-22,"Private, ltd by shares"125,1372301,"GAIN HARVEST INDUSTRIAL LIMITED
佳裕實業有限公司",2009-09-11,2015-03-06,"Private, ltd by shares"126,1372581,"GERMANY FURUGU INT'L GROUP LIMITED
德國福爾加國際集團有限公司",2009-09-11,2013-12-20,"Private, ltd by shares"127,1372535,"GERMANY KEPAI CHEMICAL ENGINEERING INTERNATIONAL LIMITED
德國科派化工國際有限公司",2009-09-11,,"Private, ltd by shares"128,1372365,"GERMANY SLDR TOOL CO., LIMITED
德國聖力得爾工具有限公司",2009-09-11,,"Private, ltd by shares"129,1372526,"GERMANY WALDRICH (HONG KONG) CO., LIMITED
德國瓦德里希(香港)有限公司",2009-09-11,,"Private, ltd by shares"130,1372218,"Ginnian Medical Equipment Co., Limited
金易醫療器械科技有限公司",2009-09-11,2017-05-19,"Private, ltd by shares"131,1372563,"GIOVANNI INTERNATIONAL (H.K.) LIMITED
祖灣尼國際有限公司",2009-09-11,2012-03-30,"Private, ltd by shares"132,1372357,"GK FURNITURE (HK) LIMITED
高康家具(香港)有限公司",2009-09-11,2017-05-05,"Private, ltd by shares"133,1372614,"GLASSES-JH INTERNATIONAL CO., LIMITED
嘉豪眼鏡國際有限公司",2009-09-11,2012-11-16,"Private, ltd by shares"134,1372541,"GLOBAL CARBON CAPITAL LIMITED
全球碳資產有限公司",2009-09-11,,"Private, ltd by shares"135,1372347,"Globe Mold &amp; Cutting Company Limited",2009-09-11,,"Private, ltd by shares"136,1372179,"GOLDEN BIG LIMITED (d2011-08-12)
金巨有限公司",2009-09-11,2011-08-12,"Private, ltd by shares"137,1372192,"GOLDEN HEALTH INTERNATIONAL LIMITED
金康國際有限公司",2009-09-11,2014-12-12,"Private, ltd by shares"138,1372315,"GOLDEN INTERNATIONAL ELECTRIC (HK) LIMITED
金的國際電子(香港)有限公司",2009-09-11,2015-01-23,"Private, ltd by shares"139,1372224,"GRAND GIFT CO., LIMITED
宏偉達有限公司",2009-09-11,,"Private, ltd by shares"140,1372398,"Grand Ocean Investment and Development Limited",2009-09-11,2016-02-19,"Private, ltd by shares"141,1372178,"GRAND TECH CORPORATION LIMITED
吉達有限公司",2009-09-11,,"Private, ltd by shares"142,1372531,"GREEN FOR BLUE COMPANY LIMITED
青風有限公司",2009-09-11,,"Private, ltd by shares"143,1372295,"Green Harvest International Trade Co., Limited
國潤立豐國際貿易有限公司",2009-09-11,2018-04-27,"Private, ltd by shares"144,1372264,"GROUP MILLION LIMITED (d2015-03-06)
萬滙行有限公司",2009-09-11,2015-03-06,"Private, ltd by shares"145,1372517,"GUANGDONG FOSHAN JINGCAI CERAMIC CO., LIMITED (d2017-05-05)
廣東佛山晶彩陶瓷有限公司",2009-09-11,2017-05-05,"Private, ltd by shares"146,1372567,"GUANGDONG XINSHICHU COMMERCIAL COOKER LIMITED
廣東新世廚商用廚具有限公司",2009-09-11,2016-05-06,"Private, ltd by shares"147,1372536,"GUANGZHOU ZHI CHENG INDUSTRY CO., LIMITED
廣州志成實業有限公司",2009-09-11,,"Private, ltd by shares"148,1372393,"GULFWIK LIMITED",2009-09-11,,"Private, ltd by shares"149,1372235,"H. C. LEUNG BIO-TECHNOLOGY LIMITED
瀚中生物科技有限公司",2009-09-11,2019-04-12,"Private, ltd by shares"150,1372207,"H.K BONITA ENTERPRISES CO., LIMITED
香港博立達實業有限公司",2009-09-11,2013-12-20,"Private, ltd by shares"151,1372529,"H.K. DEAL LED LIGHTING CO., LIMITED
香港迪爾照明有限公司",2009-09-11,2020-06-12,"Private, ltd by shares"152,1372187,"H.K. KING-TALL INT'L GROUP LIMITED
香港鈴鐸國際集團有限公司",2009-09-11,,"Private, ltd by shares"153,1372455,"H.K. PEACE HUANGPU INTERNATIONAL INVESTMENT CO., LIMITED
香港和記黃埔國際投資有限公司",2009-09-11,2013-12-20,"Private, ltd by shares"154,1372391,"HACHINOHE COMPANY LIMITED
八戶有限公司",2009-09-11,2015-01-23,"Private, ltd by shares"155,1372464,"HADRON TECHNOLOGY LIMITED
強源科技有限公司",2009-09-11,2013-08-02,"Private, ltd by shares"156,1372430,"Happy Industrial (China) Limited
多樂實業(中國)有限公司",2009-09-11,2012-11-30,"Private, ltd by shares"157,1372602,"HAZE CORPORATE SERVICES LIMITED
晞盛國際有限公司",2009-09-11,,"Private, ltd by shares"158,1372308,"HEAD POWER LIMITED (d2018-11-02)
領威行有限公司",2009-09-11,2018-11-02,"Private, ltd by shares"159,1372554,"HEJU ELECTRONICS (HK) LIMITED
合聚電子(香港)有限公司",2009-09-11,,"Private, ltd by shares"160,1372434,"HENG FEI INTERNATIONAL TRADING LIMITED
恒飛國際貿易有限公司",2009-09-11,2012-01-13,"Private, ltd by shares"161,1372388,"HENG RUN (HONGKONG) KNITTING INDUSTRY LIMITED
恒潤(香港)針織實業有限公司",2009-09-11,2016-05-06,"Private, ltd by shares"162,1372389,"Hengtong Weiye (HK) Group Co., Limited
亨通偉業(香港)集團有限公司",2009-09-11,,"Private, ltd by shares"163,1372555,"HESTIUN FINANCE HONG KONG LIMITED",2009-09-11,2018-04-27,"Private, ltd by shares"164,1372553,"HESTIUN HEALTHCARE LIMITED",2009-09-11,2018-04-27,"Private, ltd by shares"165,1372446,"HFIC International Limited",2009-09-11,2016-08-05,"Private, ltd by shares"166,1372579,"HIGH LEADING (HONG KONG) INTERNATIONAL LIMITED
匯利企業(香港)有限公司",2009-09-11,2020-03-27,"Private, ltd by shares"167,1372572,"HISUN (HK) GROUP CO., LIMITED
香港禧尚集團有限公司",2009-09-11,2018-02-23,"Private, ltd by shares"168,1372226,"HK B&amp;N LIMITED
香港博諾投資發展有限公司",2009-09-11,2011-12-30,"Private, ltd by shares"169,1372307,"HK BYT COSMETICS INTERNATIONAL TRADING LIMITED
香港佰媛堂化妝品國際貿易有限公司",2009-09-11,2017-05-05,"Private, ltd by shares"170,1372305,"HK COLORFUL CHILDHOD INFANT EDUCATION CONSULTATION MANAGEMENT LIMITED
香港七彩童年早教諮詢管理有限公司",2009-09-11,2013-12-20,"Private, ltd by shares"171,1372601,"HK HINGFONG SEIKO LIMITED
香港興放精工有限公司",2009-09-11,2015-10-30,"Private, ltd by shares"172,1372564,"HK JIAQI FOODSTUFF TRADE LIMITED
香港嘉琪食品貿易有限公司",2009-09-11,2013-12-20,"Private, ltd by shares"173,1372615,"HK JINGHAO (INT'L) MEDICAL APPARATUS LIMITED
香港晶浩(國際)醫療器械有限公司",2009-09-11,2016-12-16,"Private, ltd by shares"174,1372342,"HK Machinery Import &amp; Export Group Co., Limited
香港機械進出口集團有限公司",2009-09-11,2015-07-24,"Private, ltd by shares"175,1372444,"HK YIJIA (INT'L) HEALTH INDUSTRY GROUP CO., LIMITED
香港頤嘉(國際)健康產業集團有限公司",2009-09-11,,"Private, ltd by shares"176,1372417,"HOME MOVING SERVICE LIMITED
家居搬屋服務有限公司",2009-09-11,,"Private, ltd by shares"177,1372493,"HONG KONG BEITEER INTERNATIONAL TRADING LIMITED
香港貝特爾國際貿易有限公司",2009-09-11,2020-03-27,"Private, ltd by shares"178,1372416,"HONG KONG CHUNG CHING ENTERPRISE DEVELOPMENT LIMITED (d2013-12-20)
香港中正實業發展有限公司",2009-09-11,2013-12-20,"Private, ltd by shares"179,1372275,"HONG KONG DRAGON TOWN COMMERCIAL AND TRADE CO., LIMITED
香港龍市商貿有限公司",2009-09-11,,"Private, ltd by shares"180,1372498,"HONG KONG FEIROU INTERNATIONAL TRADING LIMITED
香港菲鷺國際貿易有限公司",2009-09-11,,"Private, ltd by shares"181,1372321,"HONG KONG HAOXIN INDUSTRIAL LIMITED
香港豪欣實業有限公司",2009-09-11,2013-09-19,"Private, ltd by shares"182,1372506,"HONG KONG HENG TEL INTERNATIONAL LIMITED
香港恒泰國際有限公司",2009-09-11,2012-01-27,"Private, ltd by shares"183,1372293,"HONG KONG LIANFU HARDWARE TECHNOLOYG LIMITED
香港聯福五金科技有限公司",2009-09-11,2020-04-03,"Private, ltd by shares"184,1372220,"HONG KONG LINDA TRADING CO., LIMITED
香港琳達貿易有限公司",2009-09-11,2014-02-14,"Private, ltd by shares"185,1372395,"HONG KONG MCN TECHNOLOGY CO., LIMITED
香港美思科技有限公司",2009-09-11,2015-01-23,"Private, ltd by shares"186,1372445,"HONG KONG MICROWELL LIMITED
香港晶美微電子有限公司",2009-09-11,,"Private, ltd by shares"187,1372571,"HONG KONG SCENERY TRADING CO., LIMITED
香港景辰貿易有限公司",2009-09-11,2019-04-12,"Private, ltd by shares"188,1372485,"HONG KONG SHIQIANG GROUP (INTERNATIONAL) HEALTH COMPANY LIMITED
香港世強集團(國際)健康有限公司",2009-09-11,,"Private, ltd by shares"189,1372368,"HONG KONG SUNRISE PHARMACEUTICALS CO., LIMITED
香港朝陽藥業有限公司",2009-09-11,,"Private, ltd by shares"190,1372595,"HONG KONG VAST SKY INTERNATIONAL TRADE LIMITED
香港昊天國際貿易有限公司",2009-09-11,,"Private, ltd by shares"191,1372326,"Hong Kong Wai Kong Industrial &amp; Trading Limited
香港滙江工貿有限公司",2009-09-11,2016-08-05,"Private, ltd by shares"192,1372215,"HONG KONG WAN HUA LIMITED
香港萬華有限公司",2009-09-11,2015-01-23,"Private, ltd by shares"193,1372472,"HONG KONG WINNING TECHNOLOGY DEVELOPMENT LIMITED
香港正楹科技發展有限公司",2009-09-11,,"Private, ltd by shares"194,1372484,"HONG KONG XVISION LOGISTIC LIMITED
香港立諾恒輝物流有限公司",2009-09-11,2015-02-06,"Private, ltd by shares"195,1372475,"HONG KONG YEARN BUSINESS TECHNOLOGY CO., LIMITED
香港港宜商務科技有限公司",2009-09-11,,"Private, ltd by shares"196,1372605,"HONG KONG YIJIA FITMENT CO., LIMITED
香港億嘉傢俱有限公司",2009-09-11,2015-01-23,"Private, ltd by shares"197,1372409,"HONGFUDI (HK) CO., LIMITED
鴻富迪(香港)有限公司",2009-09-11,2011-03-11,"Private, ltd by shares"198,1372229,"HONGKONG C&amp;T ZHONGGUI YUFU INTERNATIONAL INVESTMENT LIMITED
香港斯恩特仲貴玉富國際投資有限公司",2009-09-11,2015-01-23,"Private, ltd by shares"199,1372240,"HONGKONG CENTURY STAR TRADING CO., LIMITED
香港世紀之星貿易有限公司",2009-09-11,2013-12-20,"Private, ltd by shares"200,1372242,"HONGKONG EASYWAY INTERNATIONAL CO., LIMITED
香港一威國際有限公司",2009-09-11,2015-01-23,"Private, ltd by shares"201,1372208,"HONGKONG FASHION INTERNATIONAL COSMETICS LIMITED
香港時尚薈國際化妝品科技發展有限公司",2009-09-11,2019-05-24,"Private, ltd by shares"202,1372509,"HONGKONG FREELY ENTERPRISE DEVELOPMENT LIMITED
香港夫義實業發展有限公司",2009-09-11,,"Private, ltd by shares"203,1372519,"HONGKONG FUYUAN TRADE CO., LIMITED
香港富源貿易有限公司",2009-09-11,,"Private, ltd by shares"204,1372241,"HONGKONG GLOBALFAMOUS TRADING CO., LIMITED
香港全球知名貿易有限公司",2009-09-11,2015-01-23,"Private, ltd by shares"205,1372543,"HONGKONG HAITIAN BIOLOGIC TECHNOLOGY COMPANY LIMITED
香港海天生物科技有限公司",2009-09-11,2016-05-06,"Private, ltd by shares"206,1372550,"HONGKONG JIUJIU EAST INT'L GROUP CO., LIMITED
香港久久東方國際集團有限公司",2009-09-11,,"Private, ltd by shares"207,1372267,"HONGKONG LUOLIN INT'L INVESTMENT LIMITED
香港洛林國際投資有限公司",2009-09-11,2013-12-20,"Private, ltd by shares"208,1372238,"HONGKONG MAXWAVE COMMUNICATION ELECTRONICS CO., LIMITED
香港麥韋通訊電子有限公司",2009-09-11,2015-01-23,"Private, ltd by shares"209,1372231,"HONGKONG MINMETALS CORPORATION LIMITED
香港五礦集團有限公司",2009-09-11,2015-01-23,"Private, ltd by shares"210,1372570,"HONGKONG MSFINLAND FASHION CO., LIMITED
香港蔓斯芬蘭服飾有限公司",2009-09-11,2015-01-23,"Private, ltd by shares"211,1372324,"HONGKONG OLFEI INTERNATIONAL TRADING LIMITED
香港奧飛國際貿易有限公司",2009-09-11,2015-02-18,"Private, ltd by shares"