,Reg no.,Name,Incorp-orated,Dissolved,Type1,0999858,"225 LIMITED (d2007-07-13)",2005-10-06,2007-07-13,"Private, ltd by shares"2,0999785,"A LIMITED (d2018-07-06)",2005-10-06,2018-07-06,"Private, ltd by shares"3,0999868,"AD WORKS COMPANY LIMITED
盈豐行工程有限公司",2005-10-06,2015-02-13,"Private, ltd by shares"4,0999705,"ADARA GROUP LIMITED (d2007-05-25)",2005-10-06,2007-05-25,"Private, ltd by shares"5,0999740,"AFFECTION COMPANY LIMITED
雅妃有限公司",2005-10-06,,"Private, ltd by shares"6,0999911,"ALL IN ONE MEDIA LIMITED
串媒體有限公司",2005-10-06,,"Private, ltd by shares"7,0999935,"AMERICA JOIN WELL FUND ASSOCIATION LIMITED
美國友邦基金會有限公司",2005-10-06,2010-03-05,"Private, ltd by shares"8,0999908,"AMSUN LIMITED
暉訊有限公司",2005-10-06,2013-03-15,"Private, ltd by shares"9,0999897,"ANDA ELECTRONIC EQUIPMENT (H.K.) LIMITED
安達電子設備(香港)有限公司",2005-10-06,2016-02-19,"Private, ltd by shares"10,0999737,"ANL COMPANY LIMITED
桂高有限公司",2005-10-06,,"Private, ltd by shares"11,0999771,"ASIA CHARMING LIMITED (d2006-12-15)
捷寧有限公司",2005-10-06,2006-12-15,"Private, ltd by shares"12,0999775,"ASIAN STRONG LIMITED (d2015-02-13)
輝鉅有限公司",2005-10-06,2015-02-13,"Private, ltd by shares"13,0999779,"AVIAN GUITARS LIMITED",2005-10-06,,"Private, ltd by shares"14,0999689,"BANNER BATTERIES (HK) LIMITED",2005-10-06,,"Private, ltd by shares"15,0999902,"BEST PROFIT HOLDINGS LIMITED
佳富集團有限公司",2005-10-06,,"Private, ltd by shares"16,0999855,"BEST RIVER ASIA LIMITED
商匯亞洲有限公司",2005-10-06,2010-04-30,"Private, ltd by shares"17,0999843,"BEST TRIUMPH INTERNATIONAL LIMITED (d2007-02-16)
致勝國際有限公司",2005-10-06,2007-02-16,"Private, ltd by shares"18,0999926,"BIG PLANET INTERNATIONAL TRAVEL LIMITED
大星球國際旅遊有限公司",2005-10-06,2010-03-05,"Private, ltd by shares"19,0999789,"BOLDVIC DEVELOPMENT CO. LIMITED
博匯發展有限公司",2005-10-06,,"Private, ltd by shares"20,0999900,"BOTEX COMPANY LIMITED
寶源興業有限公司",2005-10-06,2014-04-25,"Private, ltd by shares"21,0999761,"BRAVOS INVESTMENT LIMITED
巴菲斯投資有限公司",2005-10-06,2007-05-04,"Private, ltd by shares"22,0999756,"BTM INTERNATIONAL LIMITED (d2016-06-03)
天貝國際有限公司",2005-10-06,2016-06-03,"Private, ltd by shares"23,0999682,"BUILDMAT INTERNATIONAL LIMITED
壁墁特國際有限公司",2005-10-06,2010-10-08,"Private, ltd by shares"24,0999744,"CACTUS TECHNOLOGIES LIMITED
仙人掌科技有限公司",2005-10-06,,"Private, ltd by shares"25,0999898,"CALIFORNIA FOCUS CHEMICAL INDUSTRY GROUP LIMITED
美國加州弗克斯化工集團有限公司",2005-10-06,2011-06-17,"Private, ltd by shares"26,0999773,"CANTIX LIMITED (d2011-12-02)
勤藝有限公司",2005-10-06,2011-12-02,"Private, ltd by shares"27,0999875,"CGT INTERNATIONAL LIMITED (d2010-11-19)",2005-10-06,2010-11-19,"Private, ltd by shares"28,0999833,"CHAMP WEALTH LIMITED (d2007-05-11)
富錩有限公司",2005-10-06,2007-05-11,"Private, ltd by shares"29,0999944,"Chanokio Limited
基奧有限公司",2005-10-06,,"Private, ltd by shares"30,0999802,"CHARMING HEALTH TEA FACTORY LIMITED
釆茗健康茶廠有限公司",2005-10-06,2013-10-11,"Private, ltd by shares"31,0999945,"CHINA ALLIANCE PROPERTIES LIMITED
中合置業有限公司",2005-10-06,,"Private, ltd by shares"32,0999854,"China Horse Cultural Museum Limited
中國馬文化博物館有限公司",2005-10-06,,"Private, ltd by shares"33,0999856,"CHINA HWANENG ELECTRIC GROUP LIMITED
中國華能電氣集團有限公司",2005-10-06,,"Private, ltd by shares"34,0999842,"CHINA MASTER GLOBE LIMITED
華遠環球有限公司",2005-10-06,2007-03-09,"Private, ltd by shares"35,0999710,"China Pharmaceutical (HK) Corporation Limited
中國製藥(香港)股份有限公司",2005-10-06,,"Private, ltd by shares"36,0999896,"CHINA-EU HOLDINGS GROUP LIMITED
中歐控股集團有限公司",2005-10-06,2018-07-06,"Private, ltd by shares"37,0999693,"CHUN CHUNG PLASTIC &amp; METAL MFG. COMPANY LIMITED
震中五金塑膠廠有限公司",2005-10-06,2020-09-25,"Private, ltd by shares"38,0999859,"CITIPAK PACIFIC LOGISTICS LIMITED
南太平洋物流有限公司",2005-10-06,,"Private, ltd by shares"39,0999780,"COMPFITT GLOBAL RD &amp; M LIMITED",2005-10-06,2020-11-06,"Private, ltd by shares"40,0999932,"CONFUSE LIMITED",2005-10-06,,"Private, ltd by shares"41,0999727,"CONIC INVESTMENT LIMITED
康寧投資有限公司",2005-10-06,2008-11-28,"Private, ltd by shares"42,0999891,"COWIN ACCESSORIES LIMITED
創維配飾有限公司",2005-10-06,2009-07-31,"Private, ltd by shares"43,0999853,"CREATIVE KING LIMITED
君巧有限公司",2005-10-06,,"Private, ltd by shares"44,0999941,"CREDEN (HONG KONG) CO. LIMITED
香港科頓有限公司",2005-10-06,,"Private, ltd by shares"45,0999821,"Datavideo HK Limited
洋銘科技香港有限公司",2005-10-06,,"Private, ltd by shares"46,0999690,"DHHL LIMITED
戴合力有限公司",2005-10-06,2020-07-17,"Private, ltd by shares"47,0999714,"DILANOE ASIA PACIFIC LIMITED
狄蘭奴亞太有限公司",2005-10-06,2011-11-11,"Private, ltd by shares"48,0999884,"DOCHARM INTERNATIONAL INVESTMENT (HK) CO., LIMITED
東辰國際投資(香港)有限公司",2005-10-06,,"Private, ltd by shares"49,0999782,"DORFORD LIMITED (HK)
達嘉有限公司",2005-10-06,,"Private, ltd by shares"50,0999877,"DOUBLE POWER HOLDINGS LIMITED
加力集團有限公司",2005-10-06,2007-12-21,"Private, ltd by shares"51,0999834,"DRAGON DAWN LIMITED (d2010-10-08)
龍昕有限公司",2005-10-06,2010-10-08,"Private, ltd by shares"52,0999828,"DRAGON EXPERT LIMITED (d2012-07-27)
龍巧有限公司",2005-10-06,2012-07-27,"Private, ltd by shares"53,0999795,"DRAGON POLE LIMITED
龍崗有限公司",2005-10-06,,"Private, ltd by shares"54,0999791,"DRAGON PRIME LIMITED
龍原有限公司",2005-10-06,,"Private, ltd by shares"55,0999849,"DRAGON SHADE LIMITED
龍影有限公司",2005-10-06,2011-06-17,"Private, ltd by shares"56,0999741,"EASTERN NANO LIMITED
東隆工程有限公司",2005-10-06,,"Private, ltd by shares"57,0999883,"EDUCATIONAL DEVELOPMENT INTERNATIONAL PUBLICATION LIMITED
教育發展國際出版社有限公司",2005-10-06,2007-03-16,"Private, ltd by shares"58,0999869,"ELECTRIC TRADING LIMITED (d2012-11-16)",2005-10-06,2012-11-16,"Private, ltd by shares"59,0999848,"ELEGANT WINGS INVESTMENT LIMITED
緻永投資有限公司",2005-10-06,2015-07-31,"Private, ltd by shares"60,0999696,"ETIN HONG KONG LIMITED
倚天香港有限公司",2005-10-06,,"Private, ltd by shares"61,0999723,"EURO ASIA INTERNATIONAL TRADING LIMITED
歐亞國際貿易有限公司",2005-10-06,2013-12-24,"Private, ltd by shares"62,0999687,"EVERY TREND FASHION LIMITED
鴻誠服裝有限公司",2005-10-06,2015-02-13,"Private, ltd by shares"63,0999938,"EXCEL (H.K.) INTERNATIONAL TRADE COMPANY LIMITED
超越(香港)國際貿易有限公司",2005-10-06,,"Private, ltd by shares"64,0999942,"FANCY DECO CO., LIMITED
恒瑞工藝有限公司",2005-10-06,2018-07-06,"Private, ltd by shares"65,0999716,"FASHION CLOTHING (HK) LIMITED",2005-10-06,,"Private, ltd by shares"66,0999715,"FAST NEWS TECHNOLOGY COMPANY LIMITED
快訊科技有限公司",2005-10-06,,"Private, ltd by shares"67,0999777,"FATON CHEMICAL (A&amp;P) CO., LIMITED
方頓化學(亞太)有限公司",2005-10-06,2010-03-05,"Private, ltd by shares"68,0999847,"FIRST ADVANCE INTERNATIONAL LIMITED
一進國際有限公司",2005-10-06,2007-02-16,"Private, ltd by shares"69,0999844,"FIRST ADVANCE INVESTMENT LIMITED
一進投資有限公司",2005-10-06,2008-02-06,"Private, ltd by shares"70,0999840,"FIRST CROWN ASIA LIMITED
一冠亞洲有限公司",2005-10-06,2007-02-16,"Private, ltd by shares"71,0999850,"FIRST REACH TRADING LIMITED
壹達貿易有限公司",2005-10-06,2007-12-21,"Private, ltd by shares"72,0999815,"FOREVER PROPEROUS INTERNATIONAL CULTURE INDUSTRY COMPANY LIMITED
永盛國際文化實業有限公司",2005-10-06,2010-03-05,"Private, ltd by shares"73,0999881,"FORTRESS HOLDINGS LIMITED",2005-10-06,,"Private, ltd by shares"74,0999683,"FRANCE MISILAN FASHION GROUP LIMITED
法國米絲瀾服飾集團有限公司",2005-10-06,2010-03-05,"Private, ltd by shares"75,0999762,"FRANCE O'LAYEDY INTERNATIONAL (GROUP) CO., LIMITED
法國歐萊雅黛國際集團有限公司",2005-10-06,2010-03-05,"Private, ltd by shares"76,0999734,"FRANCE T.D. BIRD (INTERNATIONAL) LEATHER LIMITED
法國天地鳥(國際)皮具有限公司",2005-10-06,2010-03-05,"Private, ltd by shares"77,0999845,"FULLY SHINE INVESTMENT LIMITED (d2007-12-21)
富朗投資有限公司",2005-10-06,2007-12-21,"Private, ltd by shares"78,0999803,"FUTURE HOLDING CO LIMITED",2005-10-06,2006-10-20,"Private, ltd by shares"79,0999703,"FUYINGNA INTERNATIONAL LIMITED
富盈娜國際有限公司",2005-10-06,2010-03-05,"Private, ltd by shares"80,0999778,"GARTIC LIMITED
華特有限公司",2005-10-06,2019-08-30,"Private, ltd by shares"81,0999915,"GENGSHUO DIRECT-MARKET INT'L GROUP LIMITED
耕碩直銷國際集團有限公司",2005-10-06,,"Private, ltd by shares"82,0999940,"Glenville Industries Limited",2005-10-06,2015-03-27,"Private, ltd by shares"83,0999688,"GLOBALTECH ENVIRONMENTAL LIMITED",2005-10-06,2011-06-17,"Private, ltd by shares"84,0999852,"GOLDEN LEAVES INVESTMENT LIMITED
金葉投資有限公司",2005-10-06,2007-12-21,"Private, ltd by shares"85,0999846,"GOLDEN PIECE LIMITED
金枝有限公司",2005-10-06,2006-07-28,"Private, ltd by shares"86,0999776,"GOLDFUL ASIA INTERNATIONAL LIMITED
金亞洲國際有限公司",2005-10-06,2015-02-13,"Private, ltd by shares"87,0999798,"GOLDRISE WORLDWIDE LIMITED
冠高環球有限公司",2005-10-06,2013-08-02,"Private, ltd by shares"88,0999766,"GOODWILL PLACEMENT SERVICES LIMITED
家譽僱請有限公司",2005-10-06,,"Private, ltd by shares"89,0999955,"GREATER ACHIEVE LIMITED",2005-10-06,2011-12-30,"Private, ltd by shares"90,0999708,"GREEN HEALTH LIFE INTERNATIONAL LIMITED
康壹家國際有限公司",2005-10-06,,"Private, ltd by shares"91,0999685,"H.K SHUANGLANG BOTE SHOES &amp; CLOTHES LIMITED
香港爽浪柏特鞋服有限公司",2005-10-06,2010-03-05,"Private, ltd by shares"92,0999748,"H.K. CHEUNG YI DAAT TECHNOLOGY LIMITED
香港祥爾達科技有限公司",2005-10-06,2011-06-17,"Private, ltd by shares"93,0999758,"H.K. LUSENBAOLUO INT'L ORGANIZATION CO., LIMITED
香港盧森堡羅國際機構有限公司",2005-10-06,2010-03-05,"Private, ltd by shares"94,0999724,"HANG ON INVESTMENTS LIMITED
恒安地產有限公司",2005-10-06,2010-04-30,"Private, ltd by shares"95,0999684,"HANNS MANUFACTURING LIMITED
漢時製品有限公司",2005-10-06,2009-07-31,"Private, ltd by shares"96,0999820,"HANYO INTERNATIONAL CO., LIMITED
漢業國際有限公司",2005-10-06,2016-01-22,"Private, ltd by shares"97,0999953,"HARVEST MEDIA LIMITED (d2010-03-05)
利豐媒體有限公司",2005-10-06,2010-03-05,"Private, ltd by shares"98,0999722,"HENNY INTERNATIONAL LIMITED
協城國際有限公司",2005-10-06,2007-08-31,"Private, ltd by shares"99,0999934,"HEUNG LI BA BA (HONG KONG) INTERNATIONAL COMPANY LIMITED
香里巴巴(香港)國際有限公司",2005-10-06,2009-04-17,"Private, ltd by shares"100,0999904,"HI-TREASURE LIMITED
高固有限公司",2005-10-06,2008-05-09,"Private, ltd by shares"101,0999774,"HIGH-CO INTERNATIONAL LIMITED
振鎧國際有限公司",2005-10-06,,"Private, ltd by shares"102,0999879,"HING ON INDUSTRIES LIMITED
興安實業有限公司",2005-10-06,,"Private, ltd by shares"103,0999818,"HING YIP INDUSTRIAL HOLDING LIMITED
興業實業集團有限公司",2005-10-06,2011-06-17,"Private, ltd by shares"104,0999880,"HIWAY TELECOM (HK) CO., LIMITED",2005-10-06,,"Private, ltd by shares"105,0999747,"HK CAIDIE (INT'L) COSMETIC LIMITED
香港彩蝶(國際)化妝品有限公司",2005-10-06,2011-06-17,"Private, ltd by shares"106,0999919,"HK HXR HEALTHY-TECH INT'L LIMITED
香港花想容健康科技國際有限公司",2005-10-06,2010-03-05,"Private, ltd by shares"107,0999822,"HK JIN HUA HOLDING INTERNATIONAL LIMITED
香港金華控股國際有限公司",2005-10-06,,"Private, ltd by shares"108,0999916,"HK TRENDY JINGMEI (INT'L) SHOES LIMITED
香港時尚靚媚(國際)鞋業有限公司",2005-10-06,2010-03-05,"Private, ltd by shares"109,0999763,"HONG KONG BEST SOUVENIRS LIMITED
香港必買手信有限公司",2005-10-06,2010-03-05,"Private, ltd by shares"110,0999732,"HONG KONG EAST PACIFIC INTERNATIONAL GROUP LIMITED
香港東大洋國際集團有限公司",2005-10-06,,"Private, ltd by shares"111,0999718,"HONG KONG JAYO INTERNATIONAL GROUP LIMITED
香港嘉友國際集團有限公司",2005-10-06,,"Private, ltd by shares"112,0999939,"HONG KONG JIAHAO INVESTMENT (HOLDING) COMPANY LIMITED
香港嘉豪投資(控股)有限公司",2005-10-06,2010-03-05,"Private, ltd by shares"113,0999695,"HONG KONG JIN JIANG HOU ZE CLAN ASSOCIATION LIMITED
香港晉江厚澤鄉親會有限公司",2005-10-06,2013-12-27,"Ltd by guarantee"114,0999712,"HONG KONG KAO HONG LIMITED
香港僑康有限公司",2005-10-06,2010-01-08,"Private, ltd by shares"115,0999878,"HONG KONG RICHES FURNITURE GROUP LIMITED
香港富貴家私集團有限公司",2005-10-06,2010-03-05,"Private, ltd by shares"116,0999691,"HONG KONG SHANG-YU TECHNOLOGY CO., LIMITED
香港上裕科技有限公司",2005-10-06,2013-05-31,"Private, ltd by shares"117,0999892,"HONG KONG SUPER REAL INTERNATIONAL GROUP LIMITED
香港展生國際集團有限公司",2005-10-06,2010-10-08,"Private, ltd by shares"118,0999702,"HONGKONG 3SUN TECHNOLOGY CO., LIMITED
香港三智科技有限公司",2005-10-06,2019-10-04,"Private, ltd by shares"119,0999861,"HONGKONG DONGBAO IMPORT &amp; EXPORT LIMITED
香港東寶進出口有限公司",2005-10-06,2011-10-21,"Private, ltd by shares"120,0999841,"HONGKONG FEIDA JEWELLERY GROUP LIMITED
香港飛大珠寶集團有限公司",2005-10-06,2020-04-29,"Private, ltd by shares"121,0999936,"HONGKONG LUCKYWAY INT'L CO., LIMITED
香港祥濤國際有限公司",2005-10-06,2015-07-31,"Private, ltd by shares"122,0999743,"HONGKONG SUNNY INTERNATIONAL LIMITED
香港燦日國際有限公司",2005-10-06,2010-03-05,"Private, ltd by shares"123,0999694,"HONGKONG WA CONG (INT'L) TECHNOLOGY LIMITED
香港華創(國際)科技有限公司",2005-10-06,2012-03-02,"Private, ltd by shares"124,0999906,"HONGKONG WATER UTILITY HOLDINGS LIMITED (d2013-01-11)
香港水務集團有限公司",2005-10-06,2013-01-11,"Private, ltd by shares"125,0999937,"HONGKONG ZHONGHENG INT'L GROUP FOODS IMPORT &amp; EXPORT CO. LIMITED
香港中恒國際集團食品進出口有限公司",2005-10-06,2008-04-18,"Private, ltd by shares"126,0999946,"HUA YING CHINA LIMITED
華盈中國有限公司",2005-10-06,,"Private, ltd by shares"127,0999721,"HUA YING FUNDS COMPANY LIMITED
華盈基金有限公司",2005-10-06,,"Private, ltd by shares"128,0999882,"HUXUE.LAKESNOW FOOD GROUP HONGKONG CO., LIMITED
香港湖雪．萊克思奴食品集團有限公司",2005-10-06,2018-07-06,"Private, ltd by shares"129,0999832,"I.T. PROFESSIONAL SOLUTION COMPANY LIMITED
創毅資訊方案有限公司",2005-10-06,2007-08-10,"Private, ltd by shares"130,0999768,"I/O COMPUTER LIMITED
菱一電腦有限公司",2005-10-06,2008-03-20,"Private, ltd by shares"131,0999752,"IF TELECOM LIMITED
意法電訊有限公司",2005-10-06,2011-06-17,"Private, ltd by shares"132,0999783,"iFREE GROUP Financial Holdings (HK) Limited
愛訊集團金控(香港)有限公司",2005-10-06,,"Private, ltd by shares"133,0999922,"INNOVATION TRADE CO. LIMITED",2005-10-06,2010-07-23,"Private, ltd by shares"134,0999804,"INTECGY GROUP LIMITED
創能新科技集團有限公司",2005-10-06,2020-09-30,"Private, ltd by shares"135,0999866,"INTERNATIONAL ADVANCED TECHNOLOGY LIMITED
國際夜光産品製造有限公司",2005-10-06,2010-03-05,"Private, ltd by shares"136,0999920,"ITALY SIBOSHA JEWELRY (H.K) INT'L GROUP LIMITED
意大利斯鉑莎珠寶(香港)國際集團有限公司",2005-10-06,2010-11-12,"Private, ltd by shares"137,0999895,"IVT ELECTRONIC LIMITED
艾煒特電子有限公司",2005-10-06,2017-06-16,"Private, ltd by shares"138,0999751,"IWIN TECHNOLOGY (HK) LIMITED
漢徽科技(香港)有限公司",2005-10-06,2012-12-28,"Private, ltd by shares"139,0999796,"J ACE CO., LIMITED
杰斯有限公司",2005-10-06,2015-02-13,"Private, ltd by shares"140,0999830,"Jargon Company Limited",2005-10-06,,"Private, ltd by shares"141,0999893,"JBL (HONG KONG) INDUSTRIAL LIMITED
聚寶隆(香港)實業有限公司",2005-10-06,,"Private, ltd by shares"142,0999860,"JIANG XIN SHIPPING COMPANY LIMITED
江信船務有限公司",2005-10-06,,"Private, ltd by shares"143,0999889,"JIAYI SCI-TECH DEVELOPMENT CORPORATION LIMITED
佳益科技發展有限公司",2005-10-06,,"Private, ltd by shares"144,0999755,"JING CHENG INTERNATIONAL INDUSTRY CO., LIMITED
晶誠國際實業有限公司",2005-10-06,,"Private, ltd by shares"145,0999807,"JUMBO REWARD LIMITED
逸盈有限公司",2005-10-06,,"Private, ltd by shares"146,0999887,"JUST CHOICE INTERNATIONAL RECURITMENT LIMITED
栢成(國際)僱傭有限公司",2005-10-06,2010-03-05,"Private, ltd by shares"147,0999805,"KANLORD LIMITED (d2015-05-08)
勤暉有限公司",2005-10-06,2015-05-08,"Private, ltd by shares"148,0999692,"KENG FUNG INTERNATIONAL INDUSTRIES LIMITED
鑫豐國際實業有限公司",2005-10-06,,"Private, ltd by shares"149,0999731,"KONIC ELECTRONICS LIMITED
康力電子有限公司",2005-10-06,,"Private, ltd by shares"150,0999704,"KOREA GREEN GRASS COMPANY LIMITED
韓國青青草株式會社有限公司",2005-10-06,2010-03-05,"Private, ltd by shares"151,0999862,"KOREA HOF LIMITED",2005-10-06,2011-06-24,"Private, ltd by shares"152,0999890,"KYC LIMITED",2005-10-06,2017-03-03,"Private, ltd by shares"153,0999812,"LANCER ENTERPRISE LIMITED (d2010-12-24)
藍詩國際有限公司",2005-10-06,2010-12-24,"Private, ltd by shares"154,0999948,"Le Chateau Entertainment Limited
麗夏朵娛樂有限公司",2005-10-06,2008-12-24,"Private, ltd by shares"155,0999765,"LEAD SYSTEMS INTERNATIONAL LIMITED",2005-10-06,2009-04-30,"Private, ltd by shares"156,0999956,"LEATEK TECHNOLOGIES INTERNATIONAL LIMITED
朗易通科技國際有限公司",2005-10-06,,"Private, ltd by shares"157,0999925,"LEE HING METAL MANUFACTORY CO. LIMITED
利興五金製品有限公司",2005-10-06,,"Private, ltd by shares"158,0999713,"LEGEND INDUSTRIES (HK) LIMITED
滙進實業(香港)有限公司",2005-10-06,2013-04-12,"Private, ltd by shares"159,0999823,"LI SI DA LIMITED
麗思達有限公司",2005-10-06,2010-03-05,"Private, ltd by shares"160,0999949,"LIANG JINGJING (INTERNATIONAL) CAR-ACCESSORY INDUSTRIAL LIMITED
亮晶晶(國際)汽配實業有限公司",2005-10-06,2010-03-05,"Private, ltd by shares"161,0999921,"LIVEN INTERNATIONAL TRADING CO., LIMITED
利維國際貿易有限公司",2005-10-06,,"Private, ltd by shares"162,0999735,"Lok Chang Travel Limited
樂暢遊旅遊有限公司",2005-10-06,2015-02-13,"Private, ltd by shares"163,0999857,"LOWER EASTSIDE LIMITED (d2011-06-17)
緻永國際有限公司",2005-10-06,2011-06-17,"Private, ltd by shares"164,0999914,"LOYAL TAK LIMITED
隆盛達有限公司",2005-10-06,2009-05-29,"Private, ltd by shares"165,0999874,"MANY PROFIT HOLDINGS LIMITED (d2006-07-28)
鉅盈集團有限公司",2005-10-06,2006-07-28,"Private, ltd by shares"166,0999754,"MIDDLEBY ASIA LIMITED",2005-10-06,,"Private, ltd by shares"167,0999863,"Millennium Logistics (China) Limited
千禧國際貨運(中國)有限公司",2005-10-06,,"Private, ltd by shares"168,0999720,"MULTI GLORY (HK) LIMITED (d2008-04-11)
盈高(香港)有限公司",2005-10-06,2008-04-11,"Private, ltd by shares"169,0999738,"NANO-A LIMITED",2005-10-06,2019-04-12,"Private, ltd by shares"170,0999729,"NEW CHOICE CONSULTANTS LIMITED (d2014-04-04)
新怡顧問有限公司",2005-10-06,2014-04-04,"Private, ltd by shares"171,0999905,"NEW INVESTMENTS LIMITED (d2013-11-22)
利智投資有限公司",2005-10-06,2013-11-22,"Private, ltd by shares"172,0999745,"NEW SPHERE INVESTMENT SERVICE COMPANY LIMITED
新領域投資服務有限公司",2005-10-06,2011-06-17,"Private, ltd by shares"173,0999817,"NEW-IDEA (HK) CO., LIMITED
新芽(香港)有限公司",2005-10-06,2007-09-14,"Private, ltd by shares"174,0999871,"NEWLAND INTERNATIONAL TRADING LIMITED
新澤國際貿易有限公司",2005-10-06,,"Private, ltd by shares"175,0999749,"NEWSMART COMMUNICATION HONG KONG CO., LIMITED
新智能通訊(香港)有限公司",2005-10-06,,"Private, ltd by shares"176,0999753,"NEXT STEP LIMITED (HK)
力事達有限公司",2005-10-06,,"Private, ltd by shares"177,0999797,"NEXTRA TECHNOLOGY LIMITED
耐特科技有限公司",2005-10-06,2019-09-06,"Private, ltd by shares"178,0999736,"OCEAN LINK INDUSTRIES LIMITED (d2011-06-17)
海聯實業有限公司",2005-10-06,2011-06-17,"Private, ltd by shares"179,0999739,"OCTAGON SHIPPING LINE (HK) LIMITED",2005-10-06,2010-04-01,"Private, ltd by shares"180,0999913,"OIL COUNTRY TECHNOLOGY LIMITED",2005-10-06,,"Private, ltd by shares"181,0999952,"OMNICARE SYSTEM LIMITED
全意軟件有限公司",2005-10-06,,"Private, ltd by shares"182,0999894,"ON FIELD HOLDINGS LIMITED
安輝控股有限公司",2005-10-06,2015-04-30,"Private, ltd by shares"183,0999742,"ONFULL INVESTMENT LIMITED
安富利投資有限公司",2005-10-06,,"Private, ltd by shares"184,0999918,"ORIENTAL LAKE SHIPPING CORPORATION LIMITED
東湖船務有限公司",2005-10-06,2009-08-07,"Private, ltd by shares"185,0999825,"OSPOP LIMITED",2005-10-06,2015-06-05,"Private, ltd by shares"186,0999814,"OUTSTANDING TALENT LIMITED (d2011-05-20)
智巨有限公司",2005-10-06,2011-05-20,"Private, ltd by shares"187,0999851,"PEACEFUL DRAGON LIMITED
龍逸有限公司",2005-10-06,2015-07-31,"Private, ltd by shares"188,0999809,"PEACEFUL STATE LIMITED
逸邦有限公司",2005-10-06,2011-09-16,"Private, ltd by shares"189,0999770,"Pecuniapay Limited",2005-10-06,,"Private, ltd by shares"190,0999759,"PLATRONIC INTERNATIONAL TRADING (H.K.) LIMITED
普創國際貿易(香港)有限公司",2005-10-06,2009-01-02,"Private, ltd by shares"191,0999717,"POINTER (HK) LIMITED
怡中(香港)有限公司",2005-10-06,2019-03-08,"Private, ltd by shares"192,0999829,"PRETTY WOMAN GROUP LIMITED
迪健集團有限公司",2005-10-06,2015-12-18,"Private, ltd by shares"193,0999816,"PRIVA HONG KONG LIMITED",2005-10-06,,"Private, ltd by shares"194,0999709,"PRODUCT SOURCE MARKETING LIMITED
創溢洋行有限公司",2005-10-06,,"Private, ltd by shares"195,0999836,"PROFIT ADD ASIA LIMITED
利晉亞洲有限公司",2005-10-06,2007-12-21,"Private, ltd by shares"196,0999907,"Quest Therapy Services Limited",2005-10-06,,"Private, ltd by shares"197,0999950,"QUN SHENG HARDWARE MANUFACTURE CO., LIMITED
群盛五金有限公司",2005-10-06,,"Private, ltd by shares"198,0999725,"QUNJIE JEWELERY LIMITED
群傑飾品有限公司",2005-10-06,2017-06-16,"Private, ltd by shares"199,0999698,"R&amp;S ENTERPRISE LIMITED
瑞盛企業有限公司",2005-10-06,,"Private, ltd by shares"200,0999699,"RAINBOW GARMENT INTERNATIONAL CO., LIMITED
香港旭昇國際貿易有限公司",2005-10-06,2020-07-17,"Private, ltd by shares"201,0999760,"RAISE (H.K.) TECHNICAL CO., LIMITED
香港銳智科技有限公司",2005-10-06,2015-03-06,"Private, ltd by shares"202,0999826,"RBL Automated Recycling Limited",2005-10-06,2013-06-14,"Private, ltd by shares"203,0999819,"REFINED INTERNATIONAL (HONGKONG) LIMITED
瑞凡德國際(香港)有限公司",2005-10-06,2008-03-14,"Private, ltd by shares"204,0999943,"RI CHENG INT'L ELECTRONIC (H.K.) LIMITED
日晟國際電子有限公司",2005-10-06,,"Private, ltd by shares"205,0999930,"RICHALL INTERNATIONAL ENTERPRISE (HK) CO., LIMITED
香港瑞驁國際實業有限公司",2005-10-06,2012-06-15,"Private, ltd by shares"206,0999917,"SAGE MEDIATECH INCORPORATION LIMITED
衛達科技與媒體集團有限公司",2005-10-06,2007-10-18,"Private, ltd by shares"207,0999793,"SAMCON LIMITED (d2014-01-17)
深榮有限公司",2005-10-06,2014-01-17,"Private, ltd by shares"208,0999784,"SCOLL METHODS HONG KONG LIMITED
拉波尼香港有限公司",2005-10-06,,"Private, ltd by shares"209,0999839,"SEA BASIS INDUSTRIES LIMITED
海基實業有限公司",2005-10-06,,"Private, ltd by shares"210,0999808,"SENDIX LIMITED
凱翠有限公司",2005-10-06,,"Private, ltd by shares"211,0999947,"SHANGHAI AUTEX GROUP LIMITED (d2015-05-15)
上海澳太斯集團有限公司",2005-10-06,2015-05-15,"Private, ltd by shares"212,0999811,"SHANGHAI YALI KNITTING SOCKS CO., LIMITED",2005-10-06,2010-03-05,"Private, ltd by shares"213,0999810,"SHARP WINNER LIMITED
銳順有限公司",2005-10-06,,"Private, ltd by shares"214,0999903,"SHENZHEN DAWN CO., LIMITED
深圳黎明有限公司",2005-10-06,2011-06-17,"Private, ltd by shares"215,0999706,"SHERWOOD INTERNATIONAL (ENVIRONMENTAL) LIMITED
迅活國際(環保)有限公司",2005-10-06,2014-01-17,"Private, ltd by shares"216,0999909,"SHINE MANOR LIMITED
尚志有限公司",2005-10-06,,"Private, ltd by shares"217,0999790,"SHING LAM TRADING LIMITED
盛林貿易有限公司",2005-10-06,2010-03-05,"Private, ltd by shares"218,0999813,"SHINY BRIGHTER LIMITED
駿瑩有限公司",2005-10-06,,"Private, ltd by shares"219,0999876,"SHUN CHEONG INTERNATIONAL TRADING LIMITED
信昌國際貿易有限公司",2005-10-06,2015-04-17,"Private, ltd by shares"220,0999912,"SILVER PROFIT HOLDINGS LIMITED (d2008-01-25)
銀利集團有限公司",2005-10-06,2008-01-25,"Private, ltd by shares"221,0999697,"SINDA GROUP (HONGKONG) CO., LIMITED
鑫達集團(香港)有限公司",2005-10-06,2019-12-13,"Private, ltd by shares"222,0999910,"SINO POINT LIMITED (d2009-07-17)
信丰有限公司",2005-10-06,2009-07-17,"Private, ltd by shares"223,0999730,"SINO YIELD ENTERPRISE LIMITED (d2009-05-08)
中怡企業有限公司",2005-10-06,2009-05-08,"Private, ltd by shares"224,0999954,"SLASH PACIFIC LIMITED
思歷環球有限公司",2005-10-06,2008-02-29,"Private, ltd by shares"