,Reg no.,Name,Incorp-orated,Dissolved,Type225,0999838,"SMART MIND GROUP LIMITED
明思集團有限公司",2005-10-06,2007-03-16,"Private, ltd by shares"226,0999872,"SMART TREND ASIA LIMITED
俊興亞洲有限公司",2005-10-06,2007-12-21,"Private, ltd by shares"227,0999886,"STARLIGHT PLASTIC MATERIAL (HONGKONG) LIMITED
星光塑膠原料(香港)有限公司",2005-10-06,,"Private, ltd by shares"228,0999726,"STATE INDUSTRIAL LIMITED
華國實業有限公司",2005-10-06,2011-06-17,"Private, ltd by shares"229,0999719,"StraTation Consultants Limited
思行顧問有限公司",2005-10-06,,"Private, ltd by shares"230,0999787,"STRONG RICHEST LIMITED
泓升有限公司",2005-10-06,2017-07-10,"Private, ltd by shares"231,0999711,"SUCCESS PRINTING COMPANY LIMITED
信利印刷有限公司",2005-10-06,,"Private, ltd by shares"232,0999865,"SUN HOLDINGS LIMITED (HK)",2005-10-06,,"Private, ltd by shares"233,0999888,"SUNRAYS (HONG KONG) LIMITED
日晟(香港)有限公司",2005-10-06,2010-09-30,"Private, ltd by shares"234,0999769,"SUNRISE PROMOTION LIMITED
星輝推廣有限公司",2005-10-06,2009-07-24,"Private, ltd by shares"235,0999801,"SUPERIOR DRAGON LIMITED (d2009-01-09)
龍首有限公司",2005-10-06,2009-01-09,"Private, ltd by shares"236,0999806,"SUPERIOR SKILL LIMITED
逸巧有限公司",2005-10-06,2008-05-30,"Private, ltd by shares"237,0999728,"SYSTONICS TECHNOLOGY CO., LIMITED (d2012-01-27)
芯同科技有限公司",2005-10-06,2012-01-27,"Private, ltd by shares"238,0999686,"TAIWAN HUAYA BABY FASHION (INT'L) HOLDING LIMITED
臺灣華雅嬰兒服飾(國際)股份有限公司",2005-10-06,2014-01-17,"Private, ltd by shares"239,0999764,"TIARA LIMITED (HK)",2005-10-06,,"Private, ltd by shares"240,0999835,"TINPO HOLDINGS INDUSTRIAL COMPANY LIMITED
天保集團實業有限公司",2005-10-06,2012-06-15,"Private, ltd by shares"241,0999933,"TOMMY LEE HANDBAGS MANUFACTURING LIMITED
志峰手袋廠有限公司",2005-10-06,,"Private, ltd by shares"242,0999733,"TONIKA ELECTRONICS MANUFACTORY (HK) LIMITED
創嘉電子(香港)有限公司",2005-10-06,2015-12-04,"Private, ltd by shares"243,0999772,"TOPEVER TECHNOLOGY LIMITED
拓豪科技有限公司",2005-10-06,2010-04-23,"Private, ltd by shares"244,0999767,"TPBR HONG KONG LIMITED
夏禹香港有限公司",2005-10-06,2019-02-01,"Private, ltd by shares"245,0999837,"TRI-CHANNEL ASIA LIMITED
協通亞洲有限公司",2005-10-06,2007-03-09,"Private, ltd by shares"246,0999867,"TRIWAYS INTERNATIONAL FREIGHT FORWARDING COMPANY LIMITED
翠威國際貨物運輸代理有限公司",2005-10-06,2020-07-03,"Private, ltd by shares"247,0999700,"TY DENTAL SERVICES LIMITED
天一牙科服務有限公司",2005-10-06,,"Private, ltd by shares"248,0999746,"U.S.A OLD LEIPENG (H.K) OPTICS GLASSES GROUP LIMITED
美國老蕾朋(香港)光學眼鏡集團有限公司",2005-10-06,2011-06-17,"Private, ltd by shares"249,0999924,"U.S.A. CARGILL INT'L CHEMISTRY INDUSTRY GROUP LIMITED
美國嘉吉國際化學工業集團有限公司",2005-10-06,2010-03-05,"Private, ltd by shares"250,0999824,"U.S.A. MOBIL OIL GROUP LIMITED
美國美孚油品集團有限公司",2005-10-06,2010-03-05,"Private, ltd by shares"251,0999792,"UNISSON MEDICAL LIMITED
友尼仲藥業有限公司",2005-10-06,,"Private, ltd by shares"252,0999701,"UNITED GROUP (HONGKONG) INT'L CO., LIMITED
聯合集團(香港)有限公司",2005-10-06,2010-03-05,"Private, ltd by shares"253,0999831,"UNIVERSAL RESOURCES ENTERPRISES LIMITED
世能國際企業有限公司",2005-10-06,2012-12-28,"Private, ltd by shares"254,0999927,"US KOMON APPLIANCES (HK) LIMITED
美國科蒙電器(香港)有限公司",2005-10-06,2010-03-05,"Private, ltd by shares"255,0999928,"VECTOR DATA RECOVERY (HK) COMPANY LIMITED
韓新數據恢復(香港)有限公司",2005-10-06,,"Private, ltd by shares"256,0999799,"VENDAX LIMITED
穎誠有限公司",2005-10-06,2018-06-01,"Private, ltd by shares"257,0999788,"VICTORY CHOICE LIMITED
英超有限公司",2005-10-06,,"Private, ltd by shares"258,0999885,"VIGOR CREATIVE PRODUCTIONS LIMITED
積極創作有限公司",2005-10-06,,"Private, ltd by shares"259,0999757,"WEISS CLEANSING SUPPLIES LIMITED
威氏清潔用品有限公司",2005-10-06,2015-09-18,"Private, ltd by shares"260,0999923,"WELCOME INTERNATIONAL GROUP CO., LIMITED
唯康國際集團有限公司",2005-10-06,2011-06-17,"Private, ltd by shares"261,0999800,"WELL CONCEPT GLOBAL PROCUREMENT LIMITED",2005-10-06,,"Private, ltd by shares"262,0999786,"WELL CONCEPT HEALTH AND BEAUTY LIMITED",2005-10-06,2010-08-13,"Private, ltd by shares"263,0999873,"WESTERN BUSINESS DEVELOPMENT LIMITED (d2010-07-30)
威業發展有限公司",2005-10-06,2010-07-30,"Private, ltd by shares"264,0999951,"WIN GRACE INDUSTRIAL LIMITED (d2007-09-28)
合昶實業有限公司",2005-10-06,2007-09-28,"Private, ltd by shares"265,0999750,"WIN-STARR INTERNATIONAL INDUSTRY TRADING CO., LIMITED
運思達國際實業貿易有限公司",2005-10-06,,"Private, ltd by shares"266,0999901,"WINTON (HONG KONG) ENTERPRISE LIMITED
榮進(香港)有限公司",2005-10-06,2010-03-05,"Private, ltd by shares"267,0999794,"WISDOM UNIVERSE LIMITED
智宇有限公司",2005-10-06,,"Private, ltd by shares"268,0999931,"WO LEE TRADING (HK) LIMITED
和利貿易(香港)有限公司",2005-10-06,2009-02-06,"Private, ltd by shares"269,0999870,"WUI FAT INDUSTRIAL LIMITED
滙發實業有限公司",2005-10-06,2011-06-17,"Private, ltd by shares"270,0999929,"WXW(HONGKONG) DRESS LIMITED
萬星威(香港)時裝有限公司",2005-10-06,2010-03-05,"Private, ltd by shares"271,0999827,"XIAMEN BOXIANG IMP.&amp;EXP. CO., LIMITED
廈門搏翔進出口有限公司",2005-10-06,2017-02-03,"Private, ltd by shares"272,0999781,"XIAMEN SEA-LIGHT ELECTRONICS CO., LIMITED
香港豪利特電子有限公司",2005-10-06,2011-06-17,"Private, ltd by shares"273,0999707,"YES ART INDUSTRIAL (HK) CO., LIMITED
奕傑實業(香港)有限公司",2005-10-06,,"Private, ltd by shares"274,0999864,"YUE LI (H.K.) DEVELOPMENT LIMITED (d2006-11-03)
越荔(香港)發展有限公司",2005-10-06,2006-11-03,"Private, ltd by shares"275,0999899,"ZAKSPEED ASIA LIMITED",2005-10-06,2011-06-24,"Private, ltd by shares"