,Reg no.,Name,Incorp-orated,Dissolved,Type1,1593586,"101goals Co., Limited
101目標網有限公司",2011-04-28,2013-03-22,"Private, ltd by shares"2,1593446,"3am Limited",2011-04-28,,"Private, ltd by shares"3,1593658,"9 VAKO (HK) LIMITED",2011-04-28,,"Private, ltd by shares"4,1593742,"A LINK ENTERPRISE CO., LIMITED
香港優聯企業有限公司",2011-04-28,,"Private, ltd by shares"5,1593285,"ACCORD GROUP (HONG KONG) HOLDINGS LIMITED
協和集團(香港)控股有限公司",2011-04-28,,"Private, ltd by shares"6,1593329,"ACE DRAGON TECHNOLOGY LIMITED
銀龍科技有限公司",2011-04-28,2012-03-23,"Private, ltd by shares"7,1593871,"ACHILLES PRODUCTION LIMITED",2011-04-28,2015-06-12,"Private, ltd by shares"8,1593616,"Acube Limited (HK)",2011-04-28,,"Private, ltd by shares"9,1593410,"ADGS ADVISORY LIMITED",2011-04-28,,"Private, ltd by shares"10,1593491,"ADIS (HongKong) Co., Limited
愛迪斯(香港)有限公司",2011-04-28,,"Private, ltd by shares"11,1593681,"AI EUROPE LIMITED (d2015-06-12)",2011-04-28,2015-06-12,"Private, ltd by shares"12,1593749,"ALCORP Limited (HK)",2011-04-28,,"Private, ltd by shares"13,1593368,"Alex Marine &amp; Offshore (Hong Kong) Service Co., Limited
阿裡克斯船務(香港)有限公司",2011-04-28,,"Private, ltd by shares"14,1593593,"ALFA SHIP MANAGERS (CHINA) CO., LIMITED
阿爾法(中國)船舶管理有限公司",2011-04-28,,"Private, ltd by shares"15,1593834,"ALGES ASIA PACIFIC LIMITED
歐格思亞太有限公司",2011-04-28,,"Private, ltd by shares"16,1593703,"ALIKARIM LIMITED
阿里卡裏姆有限公司",2011-04-28,2015-06-12,"Private, ltd by shares"17,1593267,"ALISTAR INTERNATIONAL TRADE CO., LIMITED",2011-04-28,2015-06-12,"Private, ltd by shares"18,1593392,"ALL SHARP LIMITED (d2017-08-04)
銳全有限公司",2011-04-28,2017-08-04,"Private, ltd by shares"19,1593258,"ALL-TECH ELECTRONICS CO., LIMITED
沃特科技電子有限公司",2011-04-28,,"Private, ltd by shares"20,1593519,"Alliance Property Limited (HK)
聯業地產有限公司",2011-04-28,,"Private, ltd by shares"21,1593401,"ALLIED-UNION GLOBAL INSTITUTE &amp; FOUNDATION LIMITED",2011-04-28,,"Private, ltd by shares"22,1593788,"ALONG (HK) ENGINE EQUIPMENTS LIMITED
香港亞龍動力設備有限公司",2011-04-28,2017-10-06,"Private, ltd by shares"23,1593253,"AMBERITE FINANCE LIMITED
安倍財務有限公司",2011-04-28,,"Private, ltd by shares"24,1593768,"AMERICA MGARTIST PETROLEUM CHEMICAL GROUP LIMITED
美國美工石油化工集團有限公司",2011-04-28,2016-12-16,"Private, ltd by shares"25,1593403,"AMERICAN ALICE FURNITURE CO., LIMITED
美國愛孋絲家私有限公司",2011-04-28,,"Private, ltd by shares"26,1593674,"ANHUI HUAWEI CHEMICALS GROUP LIMITED
安徽華威化工集團有限公司",2011-04-28,2015-12-18,"Private, ltd by shares"27,1593710,"AOTWO CO., LIMITED
凹凸有限公司",2011-04-28,2020-11-06,"Private, ltd by shares"28,1593249,"ASIA COMMERCIAL FUNDING LIMITED",2011-04-28,2018-09-07,"Private, ltd by shares"29,1593695,"ASIA INTERNATIONAL ART AND CULTURE ASSOCIATION LIMITED
亞洲國際文化藝術總會有限公司",2011-04-28,2017-11-03,"Private, ltd by shares"30,1593358,"ASIA SOIL LIMITED
亞泥有限公司",2011-04-28,2014-03-28,"Private, ltd by shares"31,1593576,"ASIA SOURCING CENTER LIMITED",2011-04-28,2013-11-01,"Private, ltd by shares"32,1593675,"ASIA'S WORLD PUBLISHING LIMITED",2011-04-28,2015-06-12,"Private, ltd by shares"33,1593827,"ASIAN INTERNATIONAL FUND INVESTMENT MANAGEMENT CO., LIMITED
亞洲國際基金投資管理有限公司",2011-04-28,2017-07-07,"Private, ltd by shares"34,1593760,"ASKAOLIGHTING CO., LIMITED
愛思考燈飾有限公司",2011-04-28,,"Private, ltd by shares"35,1593472,"ASMJ GENERAL TRADING COMPANY LIMITED
艾斯瑪姬綜合貿易有限公司",2011-04-28,2020-01-17,"Private, ltd by shares"36,1593312,"AVANTGROUP LIMITED",2011-04-28,2020-07-03,"Private, ltd by shares"37,1593476,"AZZURA CORPORATE ADVISORY LIMITED
恩倫企業諮詢有限公司",2011-04-28,,"Private, ltd by shares"38,1593700,"BAIHUI INTERNATIONAL BUSINESSINFORMATION LIMITED
百匯國際商務資訊有限公司",2011-04-28,2017-07-07,"Private, ltd by shares"39,1593365,"BAND ONE EDUCATION COMPANY LIMITED
一等教育有限公司",2011-04-28,,"Private, ltd by shares"40,1593661,"BAXLEY LABORATORIES LIMITED",2011-04-28,,"Private, ltd by shares"41,1593683,"BB CARE SERVICE LIMITED
金牌陪月服務有限公司",2011-04-28,2015-02-18,"Private, ltd by shares"42,1593255,"BBH HAIRPRODUCTS COMPANY LIMITED
巴比美髮用品有限公司",2011-04-28,,"Private, ltd by shares"43,1593528,"Bealy Sports Co., Limited
貝利集團有限公司",2011-04-28,2012-06-15,"Private, ltd by shares"44,1593781,"BEIJING WANFULIN NEW ENERGY TECHNOLOGY CO., LIMITED
北京萬福臨新能源科技有限公司",2011-04-28,,"Private, ltd by shares"45,1593408,"BENLI GROUP LIMITED
奔利集團有限公司",2011-04-28,,"Private, ltd by shares"46,1593272,"BHAP HK Investment Limited
海納川香港投資有限公司",2011-04-28,,"Private, ltd by shares"47,1593770,"BILLION TRENDY (ASIA) LIMITED
億進(亞洲)有限公司",2011-04-28,,"Private, ltd by shares"48,1593348,"Bitech Business Systems Limited
比科商業系統有限公司",2011-04-28,2014-10-24,"Private, ltd by shares"49,1593698,"BLACK SWAN &amp; COMPANY LIMITED",2011-04-28,,"Private, ltd by shares"50,1593655,"BLUE C TRADING COMPANY LIMITED",2011-04-28,,"Private, ltd by shares"51,1593620,"BLUE POWER IMPORT&amp;EXPORT CO., LIMITED
拓達工貿有限公司",2011-04-28,2018-09-28,"Private, ltd by shares"52,1593651,"BMI Investment Managers Limited
邦盟滙駿投資經理有限公司",2011-04-28,2014-10-17,"Private, ltd by shares"53,1593379,"BO HO (HONG KONG) LIMITED
寶豪(香港)有限公司",2011-04-28,,"Private, ltd by shares"54,1593847,"Bob Asset Management Holding Group (China) Co., Limited
博邦華夏資產管理控股集團(中國)有限公司",2011-04-28,2015-06-12,"Private, ltd by shares"55,1593469,"BORON PHARMATECH CO., LIMITED
博恩泰克醫藥科技有限公司",2011-04-28,2015-06-12,"Private, ltd by shares"56,1593585,"Bosman Enterprise Limited
博斯曼企業有限公司",2011-04-28,,"Private, ltd by shares"57,1593594,"Boudrie Advisory Limited",2011-04-28,,"Private, ltd by shares"58,1593302,"BRICK CONSULTANT LIMITED",2011-04-28,2017-09-01,"Private, ltd by shares"59,1593843,"BRITAIN JIEJIANPAI INVESTMENT MANAGEMENT CO., LIMITED
英國節減排投資管理有限公司",2011-04-28,2015-06-12,"Private, ltd by shares"60,1593872,"BROADWAY PRECISION TECHNOLOGY LIMITED",2011-04-28,,"Private, ltd by shares"61,1593539,"C S GLOBAL GEOTHERMAL POWER GROUP LIMITED
環球地熱集團有限公司",2011-04-28,2013-12-27,"Private, ltd by shares"62,1593394,"C-Max Company Limited",2011-04-28,,"Private, ltd by shares"63,1593357,"C.A.N.A. PLACEMENT SERVICES LIMITED
家傭僱請中心有限公司",2011-04-28,,"Private, ltd by shares"64,1593677,"Cardone Hong Kong Limited",2011-04-28,2016-12-16,"Private, ltd by shares"65,1593461,"CARNIVAL STATE RICH (HK) LIMITED
嘉匯道富(香港)有限公司",2011-04-28,,"Private, ltd by shares"66,1593713,"Centennial College
明德學院",2011-04-28,,"Ltd by guarantee"67,1593316,"CENTRAL TRADE INDUSTRIAL LIMITED
中商實業有限公司",2011-04-28,2013-12-20,"Private, ltd by shares"68,1593654,"CEVAL INDUSTRY CO., LIMITED
誠化實業有限公司",2011-04-28,2018-04-06,"Private, ltd by shares"69,1593731,"CHADSTONE ENTERPRISE LIMITED
卓俞企業有限公司",2011-04-28,,"Private, ltd by shares"70,1593457,"CHAISING ENTREPRENEURIAL LIMITED
齊昇創業有限公司",2011-04-28,2017-12-01,"Private, ltd by shares"71,1593508,"CHAMPION SPORTS INDUSTRY LIMITED",2011-04-28,,"Private, ltd by shares"72,1593556,"CHANG TONG INTERNATIONAL LIMITED
昌通國際有限公司",2011-04-28,2015-12-18,"Private, ltd by shares"73,1593305,"CHARM BLOOM INTERNATIONAL LIMITED
昌耀國際有限公司",2011-04-28,2015-06-12,"Private, ltd by shares"74,1593273,"CHEERFUL LUCK LIMITED
招倫有限公司",2011-04-28,,"Private, ltd by shares"75,1593663,"Chengji Toys &amp; Gifts Company Limited
成記玩具禮品有限公司",2011-04-28,,"Private, ltd by shares"76,1593448,"CHI SHING TRADING DEVELOPMENT LIMITED
志成貿易發展有限公司",2011-04-28,,"Private, ltd by shares"77,1593407,"CHINA CULTURE AND ART FEDERATION LIMITED
中華文化藝術聯合總會有限公司",2011-04-28,2015-06-12,"Private, ltd by shares"78,1593499,"CHINA EAVE-PETS CO., LIMITED
中國屋簷寵物有限公司",2011-04-28,2018-02-09,"Private, ltd by shares"79,1593336,"CHINA EVERRUN INDUSTRY CO., LIMITED
中國恒潤實業有限公司",2011-04-28,,"Private, ltd by shares"80,1593306,"CHINA HEART INVESTMENT LIMITED
華心投資有限公司",2011-04-28,2013-09-06,"Private, ltd by shares"81,1593425,"China Hong Kong KaXuan Trade Development Limited
中國香港卡軒貿易發展有限公司",2011-04-28,2015-06-12,"Private, ltd by shares"82,1593415,"China Hu Hang Corporation Limited
中國滬航集團有限公司",2011-04-28,,"Private, ltd by shares"83,1593704,"CHINA INT'L GLOBAL ASSOCIATION LIMITED
中華國際全球協會有限公司",2011-04-28,2020-01-17,"Private, ltd by shares"84,1593340,"CHINA INTERNATIONAL NEW MEDIA GROUP LIMITED
中國國際新媒體集團有限公司",2011-04-28,,"Private, ltd by shares"85,1593614,"China International Petro-chemical Resources Trading Company Limited
中國國際石化資源貿易有限公司",2011-04-28,,"Private, ltd by shares"86,1593396,"China Islands Investment Rental Group Limited
中國海島投資租賃集團有限公司",2011-04-28,2015-12-18,"Private, ltd by shares"87,1593337,"CHINA NEWS INTERNATIONAL GROUP LIMITED
中國新聞國際集團有限公司",2011-04-28,2019-04-04,"Private, ltd by shares"88,1593828,"China Oriental Life Science Research Institute Limited
中國東方生命科學研究院有限公司",2011-04-28,2017-07-07,"Private, ltd by shares"89,1593858,"China Petro-chemical Resources Trading Company Limited
中國石化資源貿易有限公司",2011-04-28,,"Private, ltd by shares"90,1593311,"CHINA RELIANCE INTERNATIONAL INVESTMENT MANAGEMENT LIMITED
華信國際投資管理有限公司",2011-04-28,2017-12-01,"Private, ltd by shares"91,1593754,"China SanRenXing Learning Ability Training Limited
中國三人行學習力培訓有限公司",2011-04-28,2015-06-12,"Private, ltd by shares"92,1593279,"CHINA SEA P. C. TECHNOLOGY (HK) LIMITED
中海塑化科技(香港)有限公司",2011-04-28,,"Private, ltd by shares"93,1593537,"CHINA SEA-ENERGY INTERNATIONAL TRADING., LIMITED
中國海能國際貿易有限公司",2011-04-28,2015-06-12,"Private, ltd by shares"94,1593540,"CHINA SEA-ENERGY NATURAL GAS INVESTMENT., LIMITED
中國海能天然氣投資有限公司",2011-04-28,2019-04-26,"Private, ltd by shares"95,1593323,"China Stream New Industry Holdings Limited
中國源暢新產業控股有限公司",2011-04-28,2019-02-08,"Private, ltd by shares"96,1593454,"CHINA TOFUL INTERNATIONAL GROUP INVESTMENT LIMITED
中國通福國際集團投資有限公司",2011-04-28,2018-09-21,"Private, ltd by shares"97,1593367,"China Unicorn Investment Group Holding Company Limited
中國獨角獸投資集團控股有限公司",2011-04-28,,"Private, ltd by shares"98,1593310,"CHINA WOOD TRADING LIMITED
華松貿易有限公司",2011-04-28,2016-12-16,"Private, ltd by shares"99,1593375,"CHINA XINYUAN ENERGY LIMITED
中國鑫遠能源有限公司",2011-04-28,2013-03-22,"Private, ltd by shares"100,1593246,"ChinaLord Global Investment Trading Limited
華諾環球投資有限公司",2011-04-28,,"Private, ltd by shares"101,1593560,"Chinese National Transportation Science and Technology Development Company Limited
中交國運科技投資有限公司",2011-04-28,2016-12-16,"Private, ltd by shares"102,1593421,"CHINESE NEW IMPRESSION ART INSTITUTE CO., LIMITED
中國新印象藝術研究院有限公司",2011-04-28,2013-08-02,"Private, ltd by shares"103,1593377,"CHIT HO (HONG KONG) LIMITED
捷豪(香港)有限公司",2011-04-28,2015-03-06,"Private, ltd by shares"104,1593492,"CHONGFUKONG ENTERPRISE MANAGEMENT LIMITED
創富港企業管理有限公司",2011-04-28,2016-12-02,"Private, ltd by shares"105,1593327,"CHONGQING JIDA MOTORCYCLE CO., LIMITED
重慶吉達摩托車製造有限公司",2011-04-28,,"Private, ltd by shares"106,1593626,"Circle Direct Import&amp;Export Co., Limited
中環進出口有限公司",2011-04-28,2019-02-08,"Private, ltd by shares"107,1593774,"CLAST TECHNOLOGY CO., LIMITED
科萊斯特科技有限公司",2011-04-28,2017-12-01,"Private, ltd by shares"108,1593729,"Click Buya Limited
激買有限公司",2011-04-28,2014-11-07,"Private, ltd by shares"109,1593628,"CLOUD PEAK (HOLDINGS) LIMITED
雲鼎實業(集團)有限公司",2011-04-28,2015-12-31,"Private, ltd by shares"110,1593389,"COLD MAGIC EFATAR (HK) CO., LIMITED
高美怡輝(香港)有限公司",2011-04-28,,"Private, ltd by shares"111,1593608,"Company Registration Number 1593608 Limited
公司註冊編號 1593608 有限公司",2011-04-28,,"Private, ltd by shares"112,1593639,"Company Registration Number 1593639 Limited
公司註冊編號 1593639 有限公司",2011-04-28,2016-01-08,"Private, ltd by shares"113,1593772,"Company Registration Number 1593772 Limited
公司註冊編號 1593772 有限公司",2011-04-28,,"Private, ltd by shares"114,1593814,"Company Registration Number 1593814 Limited
公司註冊編號 1593814 有限公司",2011-04-28,,"Private, ltd by shares"115,1593431,"Concept III (Asia) Co., Limited",2011-04-28,2020-01-24,"Private, ltd by shares"116,1593480,"Concreative Sports Surfaces Co., Limited
匯創體育地材有限公司",2011-04-28,2019-10-11,"Private, ltd by shares"117,1593721,"CONTINENTAL ASIA PACIFIC COMPANY LIMITED
至富亞太有限公司",2011-04-28,,"Private, ltd by shares"118,1593386,"CORE MOLD GROUP LIMITED
科睿模具集團有限公司",2011-04-28,2015-06-12,"Private, ltd by shares"119,1593656,"Cornerstone Equity Limited (HK)",2011-04-28,,"Private, ltd by shares"120,1593621,"CP Wealth Limited (HK)",2011-04-28,,"Private, ltd by shares"121,1593708,"Creative Idea Trading Company Limited
博雅創思貿易有限公司",2011-04-28,2016-08-05,"Private, ltd by shares"122,1593248,"CRYSTAL METAL CO., LIMITED
明瑞五金有限公司",2011-04-28,2014-10-31,"Private, ltd by shares"123,1593416,"CS-iTEC Co. Limited",2011-04-28,2018-09-28,"Private, ltd by shares"124,1593444,"CTL Recruitment &amp; Consultation Service Limited",2011-04-28,,"Private, ltd by shares"125,1593430,"CXY INTERNATIONAL TRADING CO., LIMITED
長相依國際貿易有限公司",2011-04-28,2018-03-02,"Private, ltd by shares"126,1593322,"CYBER POWER SYSTEMS (HK) LIMITED
碩天科技(香港)有限公司",2011-04-28,,"Private, ltd by shares"127,1593727,"DALI INTERNATIONAL LIMITED (d2015-12-18)
達勵企業有限公司",2011-04-28,2015-12-18,"Private, ltd by shares"128,1593442,"DALJIR GENERAL TRADING COMPANY LIMITED
達爾吉亞綜合貿易有限公司",2011-04-28,2020-01-17,"Private, ltd by shares"129,1593520,"DARK HORSE TOOL MANUFACTURING CO., LIMITED
黑馬工具製造有限公司",2011-04-28,2015-10-09,"Private, ltd by shares"130,1593573,"Dawe Education Investment &amp; Development Limited
達為教育投資開發有限公司",2011-04-28,2015-12-18,"Private, ltd by shares"131,1593671,"DECO WAHEDYAR CO., LIMITED
迪克瓦哈德亞有限公司",2011-04-28,,"Private, ltd by shares"132,1593716,"DELIGHTED SPEED INTERNATIONAL LIMITED
意迅國際有限公司",2011-04-28,,"Private, ltd by shares"133,1593689,"DELTA LOGISTICS HK LIMITED
戴爾塔物流有限公司",2011-04-28,,"Private, ltd by shares"134,1593467,"DEVANSHU OVERSEAS TRADING COMPANY LIMITED
德帆書海外貿易有限公司",2011-04-28,,"Private, ltd by shares"135,1593545,"DF (HK) INTERNATIONAL CO., LIMITED
香港天麗國際有限公司",2011-04-28,2016-11-11,"Private, ltd by shares"136,1593455,"DHARA ENTERPRISES LIMITED",2011-04-28,,"Private, ltd by shares"137,1593653,"DI-VINO SERVICES LIMITED",2011-04-28,2014-12-05,"Private, ltd by shares"138,1593861,"DIAMOND WORKSHOP JEWELLERY LIMITED
鑽石工房珠寶有限公司",2011-04-28,2013-12-06,"Private, ltd by shares"139,1593696,"DILIGENT WILL (HONG KONG) LIMITED
毅勤(香港)有限公司",2011-04-28,2018-06-22,"Private, ltd by shares"140,1593838,"DIRECT SUCCESS DEVELOPMENT LIMITED
凱王發展有限公司",2011-04-28,2015-12-18,"Private, ltd by shares"141,1593352,"Disposal Limited",2011-04-28,2015-05-22,"Private, ltd by shares"142,1593341,"Dog Limited",2011-04-28,2015-05-22,"Private, ltd by shares"143,1593438,"DONG GUAN HOU JIE GUANG EN SHOES MATERIAL CO., LIMITED
東莞市厚街廣恩鞋材有限公司",2011-04-28,2019-02-08,"Private, ltd by shares"144,1593740,"DOWIN ASSET MANAGEMENT (HOLDINGS) LIMITED
德盈資產管理(控股)有限公司",2011-04-28,2014-09-05,"Private, ltd by shares"145,1593423,"DR. DRUG MEDICAL GROUP (CHINA) CO., LIMITED
藥博士醫藥集團(中國)股份有限公司",2011-04-28,2016-12-16,"Private, ltd by shares"146,1593701,"Dragon Interior Limited (The)
永威龍窗簾工程有限公司",2011-04-28,,"Private, ltd by shares"147,1593414,"DYNAMIC CHINA HOLDING INVESTMENT LIMITED
華太集團投資有限公司",2011-04-28,,"Private, ltd by shares"148,1593250,"EASY TONE HONGKONG TRADING CO., LIMITED
利通香港貿易有限公司",2011-04-28,2020-01-10,"Private, ltd by shares"149,1593644,"EERDUOSIJUCAIYANG CASHMERE PRODUCTS LIMITED
鄂爾多斯聚財羊羊絨制品有限公司",2011-04-28,2019-12-20,"Private, ltd by shares"150,1593398,"EKIT TECHNOLOGY CO., LIMITED
易傑科技有限公司",2011-04-28,2016-12-16,"Private, ltd by shares"151,1593433,"ELIM ENTERPRISE CO., LIMITED
以琳企業有限公司",2011-04-28,,"Private, ltd by shares"152,1593385,"ELLOT'S HEALTH-TECHNOLOGY LIMITED
爾諾健康科技有限公司",2011-04-28,,"Private, ltd by shares"153,1593852,"ELTANIN JEWELLERY MFG. CO. LIMITED
力勤首飾製造有限公司",2011-04-28,,"Private, ltd by shares"154,1593473,"Elves Eyes Fashion International Co., Limited
艾薇艾斯時尚國際有限公司",2011-04-28,2015-06-12,"Private, ltd by shares"155,1593784,"ELYCO BAGS MEY CO., LIMITED
艾利科爾手袋廠有限公司",2011-04-28,,"Private, ltd by shares"156,1593578,"ENERGY SERVICES COMPANY (MIDDLE EAST) LIMITED
能源服務(中東)有限公司",2011-04-28,2016-12-16,"Private, ltd by shares"157,1593632,"EngHo International Business (HK) Co., Limited
英浩國際商務(香港)有限公司",2011-04-28,2017-12-01,"Private, ltd by shares"158,1593669,"ENOL INTERNATIONAL CO., LIMITED
艾諾國際有限公司",2011-04-28,,"Private, ltd by shares"159,1593686,"ETA HOLDING CO., LIMITED
埃塔控股有限公司",2011-04-28,,"Private, ltd by shares"160,1593550,"EUROTECH INVESTMENT LIMITED",2011-04-28,,"Private, ltd by shares"161,1593490,"EVER GIFT FAR EAST LIMITED
常富遠東有限公司",2011-04-28,2017-12-01,"Private, ltd by shares"162,1593868,"Ever Great Group (H.K.) Limited
遠大集團(香港)有限公司",2011-04-28,2019-02-08,"Private, ltd by shares"163,1593531,"Ever High Technology Limited (d2016-05-13)
比天高科技有限公司",2011-04-28,2016-05-13,"Private, ltd by shares"164,1593649,"EVERLONG MARKETING LIMITED
永萊拓展有限公司",2011-04-28,,"Private, ltd by shares"165,1593424,"EXPERTS INDUSTRIAL (HK) LIMITED
愛博士實業（香港）有限公司",2011-04-28,2016-02-26,"Private, ltd by shares"166,1593542,"F&amp;N INTERNATIONAL COMPANY LIMITED
凡寧(國際)財稅諮詢有限公司",2011-04-28,2019-02-08,"Private, ltd by shares"167,1593458,"Fairy Land Jewelry Limited",2011-04-28,2017-12-01,"Private, ltd by shares"168,1593802,"FAITH LUCK CORPORATION LIMITED
信祥有限公司",2011-04-28,,"Private, ltd by shares"169,1593813,"FASHION ARC LIMITED",2011-04-28,2017-12-01,"Private, ltd by shares"170,1593338,"Faxtz Limited",2011-04-28,2015-05-22,"Private, ltd by shares"171,1593864,"FIGO INDUSTRIAL COMPANY LIMITED
飛高實業有限公司",2011-04-28,,"Private, ltd by shares"172,1593522,"Findingdream Group Co., Limited
藍海國際實業有限公司",2011-04-28,2015-06-12,"Private, ltd by shares"173,1593464,"FIRST PLUS IMP &amp; EXP CO., LIMITED
益嘉行(寧波)對外貿易有限公司",2011-04-28,,"Private, ltd by shares"174,1593293,"FIRST PROSPECT LIMITED (HK)
首瑞有限公司",2011-04-28,2019-02-08,"Private, ltd by shares"175,1593603,"FLAME HK TRADING CO., LIMITED
香港聖火貿易有限公司",2011-04-28,2016-12-16,"Private, ltd by shares"176,1593488,"FORTUNE (HK) ELECTRONICS CO., LIMITED
和昌電子有限公司",2011-04-28,2014-10-31,"Private, ltd by shares"177,1593734,"FOUNTAIN DEVELOPMENT LIMITED
源泉發展有限公司",2011-04-28,,"Private, ltd by shares"178,1593761,"FRANCE ACCENT INT'L GROUP LIMITED
法國雅紳國際集團有限公司",2011-04-28,2015-06-12,"Private, ltd by shares"179,1593349,"FRANCE ALPS INT'L GROUP LIMITED
法國阿爾俾斯國際集團有限公司",2011-04-28,2016-12-16,"Private, ltd by shares"180,1593470,"FRANCE ANDOR LADY FUR FASHION LIMITED
法國雅黛夫人裘皮服飾有限公司",2011-04-28,2015-06-12,"Private, ltd by shares"181,1593478,"FRANCE BINNU GROUP FINERY LIMITED
法國賓奴集團服飾有限公司",2011-04-28,2015-06-12,"Private, ltd by shares"182,1593294,"FRANCE DASHAN RUNTAI FASHION INT'L GROUP LIMITED
法國大山潤泰服飾國際集團有限公司",2011-04-28,2015-06-12,"Private, ltd by shares"183,1593252,"FRANCE ESICALON INTERNATIONAL GROUP CO., LIMITED
法國伊斯古隆國際集團有限公司",2011-04-28,2015-12-18,"Private, ltd by shares"184,1593292,"FRIENDSHIP GLASS ENGINEERING COMPANY LIMITED
滙友玻璃工程有限公司",2011-04-28,2012-06-15,"Private, ltd by shares"185,1593840,"FRONT REACH ENTERPRISES LIMITED
達銳企業有限公司",2011-04-28,2012-02-24,"Private, ltd by shares"186,1593397,"Fu Wan Bags Products Factory Limited
惠州市富文行手袋製品有限公司",2011-04-28,,"Private, ltd by shares"187,1593453,"FULLBEST GROUP DEVELOPMENT LIMITED
添財集團發展有限公司",2011-04-28,,"Private, ltd by shares"188,1593664,"FULLGAR CANTEEN LIMITED
富嘉食堂有限公司",2011-04-28,2015-12-18,"Private, ltd by shares"189,1593282,"Future Cartridge Technology Co., Limited
福啟電子科技有限公司",2011-04-28,,"Private, ltd by shares"190,1593274,"FUXING CHINA GROUP LIMITED",2011-04-28,,"Private, ltd by shares"191,1593296,"GAINER (HK) HARDWARE CO., LIMITED
香港戈諾尼裝飾五金有限公司",2011-04-28,,"Private, ltd by shares"192,1593592,"GAMMA PRODUCT COMPANY LIMITED",2011-04-28,,"Private, ltd by shares"193,1593494,"GCM GLOBAL MANAGEMENT LIMITED (d2015-12-18)",2011-04-28,2015-12-18,"Private, ltd by shares"194,1593733,"GE LI INTERNATIONAL (HK) LIMITED
格利國際(香港)有限公司",2011-04-28,2013-04-26,"Private, ltd by shares"195,1593405,"GEARBOX LIMITED (d2014-01-17)",2011-04-28,2014-01-17,"Private, ltd by shares"196,1593640,"GENESIS GLOBAL TRADING LIMITED
始創環球貿易有限公司",2011-04-28,,"Private, ltd by shares"197,1593256,"GERMAN DE LAISI MOTOR LIMITED
德國德萊斯電機有限公司",2011-04-28,2015-06-12,"Private, ltd by shares"198,1593728,"GERMAN LINK HOLDINGS LIMITED
德菱控股有限公司",2011-04-28,2015-12-18,"Private, ltd by shares"199,1593745,"Germany DaZhong Petro-Chemical Group (Beijing) Limited
德國大眾石化集團(北京)有限公司",2011-04-28,,"Private, ltd by shares"200,1593514,"Germany Yadeli Stationery Industry Co., Limited
德國雅德力文具實業有限公司",2011-04-28,2014-10-17,"Private, ltd by shares"201,1593726,"GIANTHAND (HK) DEVELOPMENT LIMITED
正浩(香港)發展有限公司",2011-04-28,2020-01-24,"Private, ltd by shares"202,1593409,"GL FINANCE LIMITED
格霖金融有限公司",2011-04-28,,"Private, ltd by shares"203,1593685,"GLAD SHEEN HOLDINGS LIMITED
欣澤集團有限公司",2011-04-28,2015-12-18,"Private, ltd by shares"204,1593848,"GLOBAL ENDEAVOURS LIMITED",2011-04-28,2016-12-09,"Private, ltd by shares"205,1593625,"GLOBAL ENERGY INVESTMENT HOLDING (CHINA) LIMITED
環球能源投資控股(中國)有限公司",2011-04-28,2019-02-08,"Private, ltd by shares"206,1593326,"Global Optical Holdings Limited
全球光通控股有限公司",2011-04-28,,"Private, ltd by shares"207,1593419,"GLOBAL PETROCHEMICAL INT'L TRADING LIMITED
環球石化國際貿易有限公司",2011-04-28,,"Private, ltd by shares"208,1593789,"GLOCAL CONSULTING LIMITED (HK)
格洛克顧問有限公司",2011-04-28,,"Private, ltd by shares"209,1593773,"GLORY TRENDY LIMITED
順安有限公司",2011-04-28,2015-06-12,"Private, ltd by shares"210,1593636,"GOLD RICE BOWL DELICIOUS FOOD LIMITED
金飯碗美食有限公司",2011-04-28,,"Private, ltd by shares"211,1593320,"GOLDEN BEST (HONG KONG) LIMITED
金正(香港)有限公司",2011-04-28,,"Private, ltd by shares"212,1593527,"Golden Dragon (China) Finery Co., Limited
金絲龍(中國)服飾有限公司",2011-04-28,,"Private, ltd by shares"213,1593571,"GOLDEN JUBILEE GROUP HOLDINGS LIMITED
金禧集團控股有限公司",2011-04-28,2013-11-08,"Private, ltd by shares"214,1593799,"GOLDEN WORLD (PRIVATE EQUITY) COMPANY LIMITED
世黃(私慕)金界有限公司",2011-04-28,2016-12-16,"Private, ltd by shares"215,1593819,"GOLDENCERT INTERNATIONAL COMPANY LIMITED
九鼎正達國際有限公司",2011-04-28,,"Private, ltd by shares"216,1593826,"GOLDWING INTERNATION H.K. LIMITED
戈微國際香港有限公司",2011-04-28,,"Private, ltd by shares"217,1593313,"GOOD ALLIANCE TRADING LIMITED
正聯貿易有限公司",2011-04-28,,"Private, ltd by shares"218,1593623,"GOOD RECIPE LIMITED
良坊有限公司",2011-04-28,,"Private, ltd by shares"219,1593718,"GOODA TECHNOLOGY CO., LIMITED
巨達科技有限公司",2011-04-28,,"Private, ltd by shares"220,1593812,"GRADE INVESTMENT CO., LIMITED",2011-04-28,2015-06-12,"Private, ltd by shares"