,Reg no.,Name,Incorp-orated,Dissolved,Type428,1593643,"MIADORE LIMITED
美愛多有限公司",2011-04-28,2019-02-08,"Private, ltd by shares"429,1593692,"Mid Europe Invest Limited",2011-04-28,2017-12-01,"Private, ltd by shares"430,1593673,"MING DONG HONG KONG TRADING LIMITED
明東香港貿易有限公司",2011-04-28,,"Private, ltd by shares"431,1593391,"MIRACLE CHOICE LIMITED (d2013-11-29)
仟益佳有限公司",2011-04-28,2013-11-29,"Private, ltd by shares"432,1593532,"MIRACLE CNC MACHINERY CO., LIMITED",2011-04-28,2017-09-29,"Private, ltd by shares"433,1593474,"MIX FASHION LIMITED",2011-04-28,2015-06-12,"Private, ltd by shares"434,1593529,"MOCHA INTERNATIONAL COMPANY LIMITED
摩卡國際有限公司",2011-04-28,,"Private, ltd by shares"435,1593739,"MONIGAIN TRANSPORTATION LIMITED
裕隆運輸有限公司",2011-04-28,2012-08-10,"Private, ltd by shares"436,1593711,"MORE SQUARE LIMITED
多多有限公司",2011-04-28,,"Private, ltd by shares"437,1593295,"MUTUAL UNIVERSAL LIMITED
寰惠有限公司",2011-04-28,2015-07-03,"Private, ltd by shares"438,1593269,"NATIONWIDE HIGH QUALITY STRATEGY PROMOTION UNION LIMITED
全國優質品牌戰略推廣聯合會有限公司",2011-04-28,2019-02-08,"Private, ltd by shares"439,1593631,"Natural Food Online Limited
天然食品在線有限公司",2011-04-28,,"Private, ltd by shares"440,1593622,"Negative Black Limited",2011-04-28,2016-04-22,"Private, ltd by shares"441,1593562,"NEW FRONTIER COMMUNICATION LIMITED
新境界通訊有限公司",2011-04-28,2013-08-23,"Private, ltd by shares"442,1593552,"NEW TREND MANUFACTORY (ASIA) LIMITED
創藝製品(亞洲)有限公司",2011-04-28,,"Private, ltd by shares"443,1593857,"NEWTEX (HONG KONG) LIMITED",2011-04-28,2012-11-02,"Private, ltd by shares"444,1593359,"Nhu Edge Communications, Limited",2011-04-28,2013-11-01,"Private, ltd by shares"445,1593393,"NICK TRADE CONCERN LIMITED
力貿興業有限公司",2011-04-28,2015-05-29,"Private, ltd by shares"446,1593412,"NimbusFly Creations Co. Limited
筋斗雲創作有限公司",2011-04-28,2016-05-27,"Private, ltd by shares"447,1593792,"NINGBO BOLI IMPORT &amp; EXPORT CO., LIMITED
寧波博力進出口有限公司",2011-04-28,,"Private, ltd by shares"448,1593436,"NINGBO NEW STAR IMP &amp; EXP CO. LIMITED
寧波新星進出口有限公司",2011-04-28,2019-06-21,"Private, ltd by shares"449,1593521,"NIXON TECHNOQUEST LIMITED",2011-04-28,2015-06-12,"Private, ltd by shares"450,1593498,"Normanton Corporation Limited
諾曼頓有限公司",2011-04-28,2015-06-12,"Private, ltd by shares"451,1593530,"O-BEST INTERNATIONAL (US) CO., LIMITED
歐貝國際(美國)有限公司",2011-04-28,2015-12-18,"Private, ltd by shares"452,1593672,"OASIS REAL ESTATE CONSULTANT LIMITED
藍資產投資顧問有限公司",2011-04-28,2015-12-18,"Private, ltd by shares"453,1593314,"OCEAN BRIGHT ENTERPRISES LIMITED (d2013-04-05)
海明企業有限公司",2011-04-28,2013-04-05,"Private, ltd by shares"454,1593308,"OCEAN WORLD INVESTMENT LIMITED
海康投資有限公司",2011-04-28,,"Private, ltd by shares"455,1593780,"OCRA INCORPORATIONS LIMITED",2011-04-28,2020-01-17,"Private, ltd by shares"456,1593475,"ORIENTAL HIGH REACH COMPANY LIMITED
東方海潤有限公司",2011-04-28,,"Private, ltd by shares"457,1593715,"ORIGINAL ARTS LIMITED
原來藝術有限公司",2011-04-28,2012-11-16,"Private, ltd by shares"458,1593815,"OURDOMAINS LIMITED
香港愛名網絡有限公司",2011-04-28,,"Private, ltd by shares"459,1593765,"PACIFIC FOUNDER LIMITED
輝裕有限公司",2011-04-28,,"Private, ltd by shares"460,1593266,"PACIFIC RENEWABLE ENERGY LIMITED
東方新能源有限公司",2011-04-28,2016-08-05,"Private, ltd by shares"461,1593344,"PACIFIC SUN SKY INVESTMENT (HK) LIMITED
太平洋聖鵬投資(香港)有限公司",2011-04-28,,"Private, ltd by shares"462,1593811,"PARTNER FASHION INTERNATIONAL CO., LIMITED
香港派特諾國際有限公司",2011-04-28,2019-10-04,"Private, ltd by shares"463,1593287,"PEAK FIELD LIMITED
頂田有限公司",2011-04-28,,"Private, ltd by shares"464,1593251,"PengGuang International Trade Limited
鵬光國際貿易有限公司",2011-04-28,,"Private, ltd by shares"465,1593846,"PERFECT TIME HOLDINGS LIMITED
時柏集團有限公司",2011-04-28,,"Private, ltd by shares"466,1593387,"PIZZAZZ COMMUNICATION LIMITED",2011-04-28,,"Private, ltd by shares"467,1593452,"PLB Group (HK) Limited",2011-04-28,,"Private, ltd by shares"468,1593790,"PLF INVESTMENT COMPANY LIMITED",2011-04-28,,"Private, ltd by shares"469,1593309,"POLY-TRANS LOGISTICS LIMITED
保利達物流有限公司",2011-04-28,,"Private, ltd by shares"470,1593697,"POP PARK INDUSTRIAL CO., LIMITED
波普公園實業有限公司",2011-04-28,2016-12-16,"Private, ltd by shares"471,1593437,"POWER PEACEFUL (HONG KONG) INTERNATIONAL TRADING LIMITED
強泰(香港)國際商貿有限公司",2011-04-28,2015-12-18,"Private, ltd by shares"472,1593301,"PROFIT MAN HOLDINGS LIMITED
利民集團有限公司",2011-04-28,,"Private, ltd by shares"473,1593746,"QMP SERVICES QUALITY MANAGEMENT PROJECTS LIMITED
郝漢服務品質管理項目有限公司",2011-04-28,2018-05-25,"Private, ltd by shares"474,1593798,"R&amp;D NAVIGATOR ELECTRONICS TECHNOLOGY (HK) CO., LIMITED
聚研航電子科技有限公司",2011-04-28,,"Private, ltd by shares"475,1593548,"R&amp;G Garment Manufacturing Limited",2011-04-28,,"Private, ltd by shares"476,1593706,"RANGE COVER CO., LIMITED
攬盛有限公司",2011-04-28,2016-12-16,"Private, ltd by shares"477,1593862,"RE-ADD INTERNATIONAL LIMITED
睿亞國際有限公司",2011-04-28,2016-12-16,"Private, ltd by shares"478,1593536,"REACH FIRST TRADING CO., LIMITED
娜宇貿易有限公司",2011-04-28,2013-10-25,"Private, ltd by shares"479,1593732,"RED BULL INT'L GROUP (HK) LIMITED
紅牛國際集團(香港)有限公司",2011-04-28,2019-09-20,"Private, ltd by shares"480,1593849,"Refined Holdings Limited (HK)
銳帆德控股有限公司",2011-04-28,,"Private, ltd by shares"481,1593477,"REHAB INTERNATIONAL GENERAL TRADING CO., LIMITED
雷哈布綜合國際貿易有限公司",2011-04-28,2019-12-06,"Private, ltd by shares"482,1593719,"RENOWNED FORTUNE (HONG KONG) LIMITED
譽福(香港)有限公司",2011-04-28,,"Private, ltd by shares"483,1593280,"Rescue Ring Limited",2011-04-28,2015-05-22,"Private, ltd by shares"484,1593271,"RICH CAN LIMITED
溢行有限公司",2011-04-28,,"Private, ltd by shares"485,1593468,"RICH HONG KONG INVESTMENT LIMITED
豊碩香港投資有限公司",2011-04-28,,"Private, ltd by shares"486,1593730,"RICH VALLEY CORPORATION LIMITED
亨谷有限公司",2011-04-28,2019-02-08,"Private, ltd by shares"487,1593610,"RICHBURRY LIMITED
富寶利有限公司",2011-04-28,,"Private, ltd by shares"488,1593558,"RIME ENVIRONMENTAL ENGINEERING LIMITED",2011-04-28,2015-06-12,"Private, ltd by shares"489,1593870,"ROCATE WINE LIMITED
羅卡得酒業有限公司",2011-04-28,,"Private, ltd by shares"490,1593854,"ROKKS LIMITED",2011-04-28,2019-02-08,"Private, ltd by shares"491,1593601,"RONTECH PETROLEUM (HONG KONG) LIMITED
融泰石油(香港)有限公司",2011-04-28,2019-04-26,"Private, ltd by shares"492,1593822,"ROPIN INTERNATIONAL LIMITED
香港樂品(國際)食品有限公司",2011-04-28,2015-06-12,"Private, ltd by shares"493,1593541,"ROSEWOMAN INTERNATIONAL (HK) LIMITED
羅絲維曼國際(香港)有限公司",2011-04-28,2016-12-16,"Private, ltd by shares"494,1593466,"Royal International Furniture Co., Limited
皇家國際傢俱有限公司",2011-04-28,2015-06-12,"Private, ltd by shares"495,1593617,"RSE CORPORATION LIMITED",2011-04-28,2018-09-14,"Private, ltd by shares"496,1593384,"RUILONGXIN TECHNOLOGY CO., LIMITED
瑞隆鑫科技有限公司",2011-04-28,2015-06-12,"Private, ltd by shares"497,1593502,"RUNON HONG KONG CO., LIMITED",2011-04-28,,"Private, ltd by shares"498,1593260,"S1 CO., LIMITED",2011-04-28,2015-12-18,"Private, ltd by shares"499,1593303,"SAINT-ROSE (AMERICAN) ELECTRIC APPLIANCE GROUP LIMITED
聖羅斯(美國)電器集團有限公司",2011-04-28,2015-12-18,"Private, ltd by shares"500,1593516,"SAKULA INDUSTRY CO., LIMITED",2011-04-28,2019-09-06,"Private, ltd by shares"501,1593633,"SAMERIC LOGISTICS LIMITED
新銳物流有限公司",2011-04-28,,"Private, ltd by shares"502,1593839,"SEASHINE INTERNATIONAL LIMITED
海湸國際有限公司",2011-04-28,,"Private, ltd by shares"503,1593547,"SEATREASURE INTERNATIONAL CORP. LIMITED
海鈺國際有限公司",2011-04-28,,"Private, ltd by shares"504,1593796,"SEAWAY SHIPPING DEVELOPMENT LIMITED
海通船務發展有限公司",2011-04-28,2015-12-18,"Private, ltd by shares"505,1593369,"SENMAX HONG KONG CO., LIMITED
香港三沐進出口有限公司",2011-04-28,2015-12-18,"Private, ltd by shares"506,1593307,"SENSEDEVIL GAMES LIMITED
森魔遊戲有限公司",2011-04-28,,"Private, ltd by shares"507,1593869,"SHANGHAI DONGPU INDUSTRY CO., LIMITED
上海冬普管業有限公司",2011-04-28,2015-06-12,"Private, ltd by shares"508,1593817,"SHANGHAI QIANBAIDU TEXTILE CO., LIMITED
上海千百度紡織品有限公司",2011-04-28,2016-12-16,"Private, ltd by shares"509,1593795,"SHEEN POWER (HONG KONG) LIMITED
澤鴻(香港)有限公司",2011-04-28,2012-08-17,"Private, ltd by shares"510,1593665,"SHEN ZHEN ATLAS BENG IMPORT AND EXPORT CO., LIMITED
深圳市寰琫進出口有限公司",2011-04-28,,"Private, ltd by shares"511,1593518,"SHENZHEN CHARRAY TECHNOLOGY CO., LIMITED
深圳嘉瑞科技有限公司",2011-04-28,2016-12-16,"Private, ltd by shares"512,1593493,"SHENZHEN HAOMEI TECHNOLOGY CO., LIMITED
深圳昊美科技有限公司",2011-04-28,2015-06-12,"Private, ltd by shares"513,1593404,"SHENZHEN ORILIGHTING COMPANY LIMITED
深圳東方光電有限公司",2011-04-28,2015-06-12,"Private, ltd by shares"514,1593343,"SHENZHEN RELAGIES WELDING EQUIPMENT CO., LIMITED
深圳瑞凌佳士焊接設備有限公司",2011-04-28,2016-04-29,"Ltd by guarantee"515,1593570,"ShenZhen Triple Views Limited
三重視角文化傳播有限公司",2011-04-28,2015-06-12,"Private, ltd by shares"516,1593427,"SHUN KING FURNITURE CO. LIMITED
順景傢俬有限公司",2011-04-28,,"Private, ltd by shares"517,1593662,"SIGURE CO., LIMITED",2011-04-28,,"Private, ltd by shares"518,1593642,"Sino Mining Consultancy Limited",2011-04-28,2016-10-28,"Private, ltd by shares"519,1593441,"SISCO (HK) INVESTMENT LIMITED
香港馳高投資有限公司",2011-04-28,2014-10-31,"Private, ltd by shares"520,1593299,"SKY DYNAMIC INTERNATIONAL LIMITED
天祺國際有限公司",2011-04-28,2015-06-12,"Private, ltd by shares"521,1593333,"SKY TECH PROPERTIES LIMITED
天德置業有限公司",2011-04-28,,"Private, ltd by shares"522,1593588,"SKYEE DEEP LIMITED
天奕有限公司",2011-04-28,2016-10-14,"Private, ltd by shares"523,1593598,"SLV Global Limited",2011-04-28,,"Private, ltd by shares"524,1593803,"SMOOTH POWER INDUSTRIES LIMITED
順歷實業有限公司",2011-04-28,,"Private, ltd by shares"525,1593362,"SomeHome Limited
沁灝有限公司",2011-04-28,,"Private, ltd by shares"526,1593422,"Source It Direct Limited",2011-04-28,2013-10-11,"Private, ltd by shares"527,1593459,"SourceAge Inc. Limited
梭盛協作有限公司",2011-04-28,2020-01-17,"Private, ltd by shares"528,1593717,"SPARTAN SHI INVESTMENT GROUP (H.K.) LIMITED",2011-04-28,2017-06-30,"Private, ltd by shares"529,1593569,"SPEED CHINA LIMITED
速度中國有限公司",2011-04-28,,"Private, ltd by shares"530,1593291,"SPEIKE (ITALIAN) ELECTRIC APPLIANCE GROUP LIMITED
斯派克(意大利)電器集團有限公司",2011-04-28,2015-06-12,"Private, ltd by shares"531,1593495,"SPREAD GRAND LIMITED
領弘有限公司",2011-04-28,,"Private, ltd by shares"532,1593771,"STARRY GROUP LIMITED (HK)
星昌有限公司",2011-04-28,,"Private, ltd by shares"533,1593574,"STATE BOND CHINA DEVELOPMENT LIMITED
國邦中國發展有限公司",2011-04-28,,"Private, ltd by shares"534,1593863,"STONE CARE EXPERT LIMITED
石材護理專家有限公司",2011-04-28,,"Private, ltd by shares"535,1593351,"STRATEGIC TECH LIMITED (d2016-05-06)
拓科有限公司",2011-04-28,2016-05-06,"Private, ltd by shares"536,1593328,"STRONG METROPOLITAN LIMITED
際強有限公司",2011-04-28,,"Private, ltd by shares"537,1593463,"SUN HING PROPERTY (HK) LIMITED
新興置業(香港)有限公司",2011-04-28,2019-05-17,"Private, ltd by shares"538,1593821,"SUN SHIPPING DEVELOPMENT LIMITED
陽光船務發展有限公司",2011-04-28,2015-12-18,"Private, ltd by shares"539,1593563,"SUN SMART LOGISTICS LIMITED
新達集運有限公司",2011-04-28,,"Private, ltd by shares"540,1593554,"SUNGJIN M&amp;T (H.K) LIMITED",2011-04-28,2017-11-03,"Private, ltd by shares"541,1593759,"SUNHERO INTERNATIONAL GROUP CO., LIMITED
聖海諾國際集團有限公司",2011-04-28,2016-12-16,"Private, ltd by shares"542,1593555,"SUNMAX MARKETING COMPANY LIMITED
新美股份有限公司",2011-04-28,,"Private, ltd by shares"543,1593666,"SUPER RICH-IN LIMITED
歷升有限公司",2011-04-28,,"Private, ltd by shares"544,1593355,"SUPERTEK INTERNATIONAL COMPANY LIMITED
舒柏特國際有限公司",2011-04-28,2019-04-04,"Private, ltd by shares"545,1593778,"SURE-WIN JEWELRY CO., LIMITED
雙贏飾品國際有限公司",2011-04-28,,"Private, ltd by shares"546,1593515,"SWITZERLAND LA COWRY INTERNATIONAL COSMETICS LIMITED
瑞士海源國際化妝品有限公司",2011-04-28,,"Private, ltd by shares"547,1593873,"Synertac Global Technology Limited
新動力環球有限公司",2011-04-28,2015-06-12,"Private, ltd by shares"548,1593845,"T &amp; A ENTERPRISES LIMITED (d2017-03-10)
天淵企業有限公司",2011-04-28,2017-03-10,"Private, ltd by shares"549,1593372,"T.W UNIQUES SPORTS LIMITED
臺灣尤尼克斯體育用品有限公司",2011-04-28,,"Private, ltd by shares"550,1593758,"TAEKWONDO MASTERS ASSOCIATION (CHINA) GROUP CO., LIMITED
跆拳道高手會(中國)集團有限公司",2011-04-28,2015-06-12,"Private, ltd by shares"551,1593497,"TAIWAN RUIFENG SEWING MACHINERY MANUFACTURING LIMITED
臺灣瑞豐縫紉機械製造有限公司",2011-04-28,2015-12-18,"Private, ltd by shares"552,1593859,"TALENT DEVELOPMENT TRAINING CENTRE LIMITED
聰穎發展中心有限公司",2011-04-28,,"Private, ltd by shares"553,1593450,"THAI BEST INTERNATIONAL TRADING LIMITED
泰好國際貿易有限公司",2011-04-28,,"Private, ltd by shares"554,1593346,"THINKETRON MEDICAL DEVICES COMPANY LIMITED
思科創醫療設備有限公司",2011-04-28,2013-08-23,"Private, ltd by shares"555,1593435,"TIANTIANHE HK INTERNATIONAL TRADING CO., LIMITED
天天和(香港)國際貿易有限公司",2011-04-28,2013-12-20,"Private, ltd by shares"556,1593572,"TIMES SWIMWEAR PRINTING COMPANY LIMITED
時代印花有限公司",2011-04-28,,"Private, ltd by shares"557,1593286,"Tin Man VisaPro Consultancy Limited
天憫簽證顧問有限公司",2011-04-28,,"Private, ltd by shares"558,1593630,"Tin Tin Film Production Limited
天天影畫電影製作有限公司",2011-04-28,,"Private, ltd by shares"559,1593484,"TMT Communications Limited
拓美加電訊有限公司",2011-04-28,,"Private, ltd by shares"560,1593648,"TONI FOOD WHOLESALES LIMITED
東譽行食品批發有限公司",2011-04-28,2015-06-12,"Private, ltd by shares"561,1593791,"TOPKIM LIMITED
拓勁有限公司",2011-04-28,2019-04-18,"Private, ltd by shares"562,1593767,"TOPMOULD INDUSTRY LIMITET CO., LIMITED
托普模具實業有限公司",2011-04-28,,"Private, ltd by shares"563,1593533,"Trendy Taste Company Limited",2011-04-28,2014-03-28,"Private, ltd by shares"564,1593277,"TRILLIONS GAIN LIMITED
穫億有限公司",2011-04-28,,"Private, ltd by shares"565,1593667,"TRIPLE R INTERNATIONAL COMPANY LIMITED
三源貿易國際有限公司",2011-04-28,2018-03-16,"Private, ltd by shares"566,1593679,"TSINGHUA ELECTRONIC (HONG KONG) HOLDING CO., LIMITED
清華電子(香港)控股有限公司",2011-04-28,,"Private, ltd by shares"567,1593567,"Tupperware Budweiser Beer Group (China) Co., Limited
百威百惠啤酒集團(中國)有限公司",2011-04-28,2015-06-12,"Private, ltd by shares"568,1593544,"TWE Company Limited
科能亞洲有限公司",2011-04-28,2019-12-20,"Private, ltd by shares"569,1593370,"TWIN-TIGERS INTERNATIONAL ENTERPRISES LIMITED
雙虎國際企業有限公司",2011-04-28,2013-01-25,"Private, ltd by shares"570,1593413,"TWIST of PARTI PRIS LIMITED",2011-04-28,,"Private, ltd by shares"571,1593486,"UltraRadiant Systems Limited
耀光電能有限公司",2011-04-28,2018-11-30,"Private, ltd by shares"572,1593607,"UNI-STAR INTERNATIONAL FREIGHT FORWARDING (HK) CO., LIMITED
中灝國際貨運代理(香港)有限公司",2011-04-28,,"Private, ltd by shares"573,1593317,"UNION UNIVERSE CO., LIMITED",2011-04-28,2017-07-07,"Private, ltd by shares"574,1593395,"UNION WIN INDUSTRIAL (CHINA) LIMITED
展億實業(中國)有限公司",2011-04-28,,"Private, ltd by shares"575,1593290,"UNISON ELECTRONIC LIMITED
友信電子有限公司",2011-04-28,2015-06-19,"Private, ltd by shares"576,1593860,"UPRIGHT ENGINEERING COMPANY LIMITED
賢亮工程有限公司",2011-04-28,2017-11-24,"Private, ltd by shares"577,1593447,"USA QIANGSHENG GROUP CHEMICAL CO., LIMITED
美國強生集團化工有限公司",2011-04-28,2015-06-12,"Private, ltd by shares"578,1593485,"VALUE UNIVERSAL LIMITED
華譽環球有限公司",2011-04-28,2017-12-29,"Private, ltd by shares"579,1593553,"VANTAGE POWER GLOBAL LIMITED
寰球新能源有限公司",2011-04-28,,"Private, ltd by shares"580,1593705,"VI PU HOTEL MANAGEMENT GROUP LIMITED
唯璞酒店管理集團有限公司",2011-04-28,,"Private, ltd by shares"581,1593324,"VICTORY BEST (HONG KONG) LIMITED
勝裕(香港)有限公司",2011-04-28,,"Private, ltd by shares"582,1593779,"VIETNAM DAHAT METALS LIMITED
越南泰發金屬有限公司",2011-04-28,2016-12-16,"Private, ltd by shares"583,1593775,"VIETNAM RUCHI FERROALLOY LIMITED
越南路期鐵合金有限公司",2011-04-28,2016-12-16,"Private, ltd by shares"584,1593687,"VISION LEAP INTERNATIONAL LIMITED
景躍國際有限公司",2011-04-28,2015-12-18,"Private, ltd by shares"585,1593501,"VSEC (HONG KONG) LIMITED",2011-04-28,,"Private, ltd by shares"586,1593363,"W&amp;T TOOL AND DIE CO., LIMITED",2011-04-28,2018-04-06,"Private, ltd by shares"587,1593725,"WACC Creative Enterprise Limited
高峯創意企業有限公司",2011-04-28,2015-07-03,"Private, ltd by shares"588,1593688,"WANYIDA INDUSTRIAL (HK) CO., LIMITED
萬億達實業(香港)有限公司",2011-04-28,2015-07-31,"Private, ltd by shares"589,1593523,"WAYNAS ARCHITECTURAL HARDWARE LIMITED
和順金屬製品有限公司",2011-04-28,2018-12-07,"Private, ltd by shares"590,1593483,"WENZHOU EFUN VALVE CO., LIMITED
溫州一方閥門有限公司",2011-04-28,,"Private, ltd by shares"591,1593657,"WESTGATE CAPITAL (HONG KONG) LIMITED
香港西展投資有限公司",2011-04-28,2015-07-17,"Private, ltd by shares"592,1593546,"WESTORE UNION MINING INDUSTRY GROUP LIMITED
西部聯合礦業開發集團有限公司",2011-04-28,2014-08-29,"Private, ltd by shares"593,1593709,"WINBAND INTERNATIONAL INDUSTRY CO., LIMITED
宇邦國際實業有限公司",2011-04-28,,"Private, ltd by shares"594,1593561,"WING ON BIRD NEST MANOR LIMITED
永安燕窩莊有限公司",2011-04-28,2018-03-02,"Private, ltd by shares"595,1593381,"Wing's Catering (Jordan) Limited
榮式餐飲(佐敦)有限公司",2011-04-28,,"Private, ltd by shares"596,1593579,"WINNER RACING INTERNATIONAL CO., LIMITED",2011-04-28,2019-09-13,"Private, ltd by shares"597,1593330,"WIZ PARTNER CO., LIMITED
智詮實業有限公司",2011-04-28,,"Private, ltd by shares"598,1593429,"WLD LIMITED (d2014-04-25)
萬力達演藝傳媒有限公司",2011-04-28,2014-04-25,"Private, ltd by shares"599,1593804,"WONDER BEE INTERNATIONAL LIMITED",2011-04-28,2015-06-12,"Private, ltd by shares"600,1593332,"WORLD TECH ASIA LIMITED
盈達亞洲有限公司",2011-04-28,2014-10-31,"Private, ltd by shares"601,1593613,"Worldwide Scholar Limited",2011-04-28,2017-12-01,"Private, ltd by shares"602,1593769,"WOTNG INDUSTRY GROUP LIMITED
沃地實業集團有限公司",2011-04-28,,"Private, ltd by shares"603,1593549,"WULIANXING NUMERAL TECHNOLOGY LIMITED
伍聯興數碼科技有限公司",2011-04-28,,"Private, ltd by shares"604,1593680,"WYD INDUSTRIAL LIMITED
偉億達實業有限公司",2011-04-28,,"Private, ltd by shares"605,1593641,"X-TRONIX LIMITED",2011-04-28,2013-10-11,"Private, ltd by shares"606,1593596,"XIAMEN GELKEN GELATIN CO., LIMITED
鳳凰工貿有限公司",2011-04-28,,"Private, ltd by shares"607,1593434,"XIANGYUE GROUP LIMITED
祥悅集團有限公司",2011-04-28,2013-12-20,"Private, ltd by shares"608,1593611,"XIAOLI INTERNATIONAL (CHINA) LIMITED
曉立國際(中國)有限公司",2011-04-28,2016-12-16,"Private, ltd by shares"609,1593321,"XIN DING INVESTMENT LIMITED
鑫鼎投資有限公司",2011-04-28,2016-06-30,"Private, ltd by shares"610,1593736,"XINYUAN FASHION CO., LIMITED
欣媛服飾有限公司",2011-04-28,2014-07-11,"Private, ltd by shares"611,1593793,"XIRUI (INTERNATIONAL) TECHNOLOGY LIMITED
希銳(國際)科技有限公司",2011-04-28,,"Private, ltd by shares"612,1593361,"YAGORA SYSTEMS LIMITED
雅歌系統有限公司",2011-04-28,2015-10-23,"Private, ltd by shares"613,1593794,"YANJIAO WINE INDUSTRY SHARES LIMITED
燕郊酒業股份有限公司",2011-04-28,,"Private, ltd by shares"614,1593566,"YE SHAN SHIPPING LIMITED
冶山船務有限公司",2011-04-28,,"Private, ltd by shares"615,1593278,"YEXING KNITTING FACTORY LIMITED
業興毛織廠有限公司",2011-04-28,,"Private, ltd by shares"616,1593690,"Yiwu Seasun Crafts Co., Limited
義烏市海煦工藝品有限公司",2011-04-28,2015-08-14,"Private, ltd by shares"617,1593335,"YONG'S BROTHER INTERNATIONAL CORPORATION LIMITED",2011-04-28,,"Private, ltd by shares"618,1593753,"YOUNG FAIR CONSULTANTS LIMITED
鑫豐顧問有限公司",2011-04-28,,"Private, ltd by shares"619,1593865,"YUANDU INTERNATIONAL GROUP LIMITED
源都國際集團有限公司",2011-04-28,,"Private, ltd by shares"620,1593741,"YUANYUAN IMPORT &amp; EXPORT CO., LIMITED (d2019-04-12)",2011-04-28,2019-04-12,"Private, ltd by shares"621,1593830,"YUSHEN TRADING CO., LIMITED
宇珅貿易有限公司",2011-04-28,2019-01-11,"Private, ltd by shares"622,1593591,"YUYAO PRECISE PLASTIC CO., LIMITED
余姚普瑞思塑業有限公司",2011-04-28,2019-03-01,"Private, ltd by shares"623,1593276,"ZAETEK LIMITED",2011-04-28,,"Private, ltd by shares"624,1593535,"ZHAO YANG SHIPPING LIMITED
朝陽船務有限公司",2011-04-28,2019-01-04,"Private, ltd by shares"625,1593526,"ZHEJIANG TOOLMASTER EQUIPMENT CO., LIMITED
浙江瑪特設備有限公司",2011-04-28,,"Private, ltd by shares"626,1593855,"ZHEJIANG ZHONGCE CABLE CO., LIMITED
浙江中策線纜有限公司",2011-04-28,2015-06-12,"Private, ltd by shares"627,1593551,"ZHON NAN INTERNATIONAL INDUSTRY CO., LIMITED
中南國際實業(香港)有限公司",2011-04-28,2015-06-12,"Private, ltd by shares"628,1593440,"ZHONG HENG JI GROUP CO., LIMITED
中恒基集團有限公司",2011-04-28,2014-07-25,"Private, ltd by shares"629,1593534,"ZHUHAI NEWWAY TECHNOLOGY LIMITED
珠海市新路科技有限公司",2011-04-28,,"Private, ltd by shares"