,Reg no.,Name,Incorp-orated,Dissolved,Type221,1593842,"GRAND STYLE INVESTMENTS LIMITED
豪格投資有限公司",2011-04-28,,"Private, ltd by shares"222,1593283,"GRAND WINE GROUP LIMITED
瑋基酒業集團有限公司",2011-04-28,,"Private, ltd by shares"223,1593318,"GUANG YI INTERNATIONAL TRADING (HONG KONG) LIMITED
廣義國際貿易(香港)有限公司",2011-04-28,2016-01-29,"Private, ltd by shares"224,1593797,"GUANGDONG BINGNUOER COMMERCIAL REFRIGERATOR CO., LIMITED
廣東冰諾爾商用冷櫃有限公司",2011-04-28,2015-12-18,"Private, ltd by shares"225,1593525,"GUANGDONG FOSHAN DAQIN CERAMIC CO., LIMITED
廣東佛山大秦陶瓷有限公司",2011-04-28,2015-06-12,"Private, ltd by shares"226,1593756,"GUANGDONG GUANGZHOU ZHONGCHENG CULTURE PRODUCTS LIMITED
廣東省廣州市眾成文化用品有限公司",2011-04-28,2015-06-12,"Private, ltd by shares"227,1593801,"GUANGDONG WENRUI COMMERCIAL COOKER LIMITED
廣東雯瑞商用廚具有限公司",2011-04-28,2015-12-18,"Private, ltd by shares"228,1593297,"GUANGJU RONGCHANG ASSETS MANAGEMENT GROUP LIMITED
廣聚融昌資產管理集團有限公司",2011-04-28,2015-06-12,"Private, ltd by shares"229,1593757,"GUANGXI CHANGHE TRADING LIMITED
廣西長河貿易有限公司",2011-04-28,,"Private, ltd by shares"230,1593500,"GUO RONG FINANCE CORPORATION HOLDINGS LIMITED
國融行投資擔保股份有限公司",2011-04-28,,"Private, ltd by shares"231,1593808,"GUOGUANG HOLDING LIMITED",2011-04-28,,"Private, ltd by shares"232,1593851,"H.C. STARCK (HK) HOLDING LIMITED",2011-04-28,2019-11-22,"Private, ltd by shares"233,1593315,"HABA INTERNATIONAL TRADE CO., LIMITED
哈壩國際貿易有限公司",2011-04-28,2015-06-12,"Private, ltd by shares"234,1593538,"HABIBC BUSINESS TRADING COMPANY LIMITED
哈比卜可商務貿易有限公司",2011-04-28,2015-06-12,"Private, ltd by shares"235,1593763,"HAISHENGDA HK INDUSTRIAL LIMITED
海聲達香港實業有限公司",2011-04-28,2016-12-16,"Private, ltd by shares"236,1593590,"HANDAI GD TECHNOLOGY GLOBAL LIMITED",2011-04-28,,"Private, ltd by shares"237,1593600,"HANGYU HARDWARE CO., LIMITED
航宇五金有限公司",2011-04-28,2015-06-12,"Private, ltd by shares"238,1593724,"HANNUO INTERNATIONAL TRADING CO., LIMITED
漢諾國際貿易有限公司",2011-04-28,,"Private, ltd by shares"239,1593647,"HANSUNG GROUP (HK) COMPANY LIMITED
航星集團(香港)有限公司",2011-04-28,,"Private, ltd by shares"240,1593818,"HANYULAI SHOES (QINGDAO) CO., LIMITED
韓宇來鞋業(青島)有限公司",2011-04-28,2015-12-18,"Private, ltd by shares"241,1593373,"HAOHONG INDUSTRY (HONGKONG) LIMITED
浩鴻企業(香港)有限公司",2011-04-28,2015-10-02,"Private, ltd by shares"242,1593723,"HAPPY BABY INTERNATIONAL LIMITED",2011-04-28,2014-10-03,"Private, ltd by shares"243,1593702,"HAPPY MARINE TECHNICAL&amp;SERVICE CO., LIMITED",2011-04-28,,"Private, ltd by shares"244,1593456,"HAPPYLOI INDUSTRIAL LIMITED
喜萊實業有限公司",2011-04-28,2016-12-16,"Private, ltd by shares"245,1593581,"Harvest Full Limited (d2015-10-09)
禾富生化科技有限公司",2011-04-28,2015-10-09,"Private, ltd by shares"246,1593587,"HEALTH JOY GROUP INTERNATIONAL LIMITED
滙盈康集團國際有限公司",2011-04-28,,"Private, ltd by shares"247,1593511,"Heaven Thor Limited",2011-04-28,2015-12-18,"Private, ltd by shares"248,1593670,"HEDWIN TECHNOLOGY CO., LIMITED
海德旺科技有限公司",2011-04-28,,"Private, ltd by shares"249,1593406,"HEJIA LIMITED
禾嘉有限公司",2011-04-28,2018-06-29,"Private, ltd by shares"250,1593371,"HELI CHEMPHAR GROUP LIMITED
合力化工醫藥集團有限公司",2011-04-28,,"Private, ltd by shares"251,1593707,"HENGJU INT'L TEC-SERVICE GROUP LIMITED
恒聚(國際)技術服務集團有限公司",2011-04-28,,"Private, ltd by shares"252,1593800,"HESHIJIA (HK) TECHNOLOGY LIMITED
合室家(香港)科技有限公司",2011-04-28,2019-02-08,"Private, ltd by shares"253,1593844,"HIGH VALUE DEVELOPMENT LIMITED
綽高發展有限公司",2011-04-28,,"Private, ltd by shares"254,1593810,"HISEN GLOBAL TRADING LIMITED
海信環球貿易有限公司",2011-04-28,2020-10-23,"Private, ltd by shares"255,1593824,"HK CHANGQING BIOTECHNOLOGY INTERNATIONAL LIMITED
香港長青生物科技國際有限公司",2011-04-28,2019-02-08,"Private, ltd by shares"256,1593268,"HK CHENGBANG INT'L TRADING CO., LIMITED
香港成邦國際貿易有限公司",2011-04-28,2015-06-12,"Private, ltd by shares"257,1593347,"HK CINDA TRADING LIMITED
香港信達商貿有限公司",2011-04-28,,"Private, ltd by shares"258,1593543,"HK DEFUSEN TECHNOLOGY LIMITED
香港德福森科技有限公司",2011-04-28,2020-01-17,"Private, ltd by shares"259,1593496,"HK DINGYU INTERNATIONAL TRADING CO., LIMITED
香港鼎裕國際貿易有限公司",2011-04-28,2014-09-26,"Private, ltd by shares"260,1593660,"HK DUNHUANG CULTURE ART (GROUP) CO., LIMITED
香港敦煌文化藝術(集團)有限公司",2011-04-28,,"Private, ltd by shares"261,1593513,"HK FUNCH INTERNATIONAL INDUSTRY CO., LIMITED
香港梵馳國際實業有限公司",2011-04-28,,"Private, ltd by shares"262,1593399,"HK HEREN TRADE LIMITED
香港和仁貿易有限公司",2011-04-28,,"Private, ltd by shares"263,1593866,"HK HOI SUI CONSTRUCTION DECORATION DESIGN RESEARCH INSTITUTE LIMITED
香港凱瑞建築裝飾設計研究院有限公司",2011-04-28,,"Private, ltd by shares"264,1593635,"HK HUANGSHI BIOLOGICAL TECHNOLOGY DRINKS CO., LIMITED
香港皇氏生物科技飲品有限公司",2011-04-28,2020-01-17,"Private, ltd by shares"265,1593263,"HK HUIYE INTERNATIONAL GROUP LIMITED
香港匯業國際集團有限公司",2011-04-28,2019-02-08,"Private, ltd by shares"266,1593747,"HK JINLONG INDUSTRIAL INVESTMENT DEVELOPMENT LIMITED
香港錦隆實業投資發展有限公司",2011-04-28,2016-12-16,"Private, ltd by shares"267,1593645,"HK Magic Limited",2011-04-28,,"Private, ltd by shares"268,1593517,"HK QULE ANNA (INT'L) FINERY LIMITED
香港趣樂安娜(國際)服飾有限公司",2011-04-28,,"Private, ltd by shares"269,1593510,"HK RONGHAO PHOTOELECTRICITY TECHNOLOGY CO., LIMITED
香港榮浩光電科技有限公司",2011-04-28,2015-12-18,"Private, ltd by shares"270,1593388,"HK RQS BIOLOGY TECHNOLOGY LIMITED
香港瑞琪森生物科技有限公司",2011-04-28,2016-12-16,"Private, ltd by shares"271,1593504,"HK SAMITE BATHROOM LIMITED
香港薩米特衛浴有限公司",2011-04-28,2015-06-12,"Private, ltd by shares"272,1593471,"HK SHENSHI FURNITURE LIMITED
香港紳士家居有限公司",2011-04-28,2016-12-16,"Private, ltd by shares"273,1593751,"HK SHIJU DESIGN CO., LIMITED
香港世居國際軟裝配飾集團有限公司",2011-04-28,,"Private, ltd by shares"274,1593265,"HK SIHAIYIJIA INT'L INDUSTRIAL INVESTMENT DEVELOPMENT LIMITED
香港四海一家國際實業投資發展有限公司",2011-04-28,,"Private, ltd by shares"275,1593557,"HK SUSAN LADY BEAUTY ORGANIZATION INT'L GROUP LIMITED
香港蘇珊女子美麗機構國際集團有限公司",2011-04-28,2017-12-01,"Private, ltd by shares"276,1593823,"HK THINK INTERNATIONAL TRADING CO., LIMITED
香港信可國際貿易有限公司",2011-04-28,2020-10-16,"Private, ltd by shares"277,1593627,"HK TINGYUAN INT'L TRADING CO., LIMITED
香港庭源國際貿易有限公司",2011-04-28,2016-12-16,"Private, ltd by shares"278,1593418,"HK WANJIAXIN TECHNOLOGY DEVELOPMENT LIMITED
香港萬嘉新科技發展有限公司",2011-04-28,2015-06-12,"Private, ltd by shares"279,1593766,"HK WENFU INT'L GROUP HOLDINGS LIMITED
香港文富國際集團控股有限公司",2011-04-28,2015-12-18,"Private, ltd by shares"280,1593606,"HK YIN HE HOLDINGS LIMITED
香港銀合集團有限公司",2011-04-28,2014-01-17,"Private, ltd by shares"281,1593820,"HK YINGYUEFANG DRESS LIMITED
香港嬰悅房服飾有限公司",2011-04-28,2015-06-12,"Private, ltd by shares"282,1593524,"HK YURUISEN BEARINGS (SINO-FOREIGN JOINT VENTURE) CO., LIMITED
香港宇瑞森軸承(中外合資)有限公司",2011-04-28,2015-12-18,"Private, ltd by shares"283,1593353,"HK ZHANG TAI HOLDINGS LIMITED
香港長泰集團有限公司",2011-04-28,2015-06-12,"Private, ltd by shares"284,1593257,"HK.KENERTEC LIMITED
香港克拿鐵有限公司",2011-04-28,2012-09-14,"Private, ltd by shares"285,1593390,"HO YIN (HONG KONG) LIMITED
豪賢(香港)有限公司",2011-04-28,,"Private, ltd by shares"286,1593829,"HON FAR INTERNATIONAL CO., LIMITED
鴻遠國際實業有限公司",2011-04-28,2020-01-17,"Private, ltd by shares"287,1593693,"HON TENG TRADING COMPANY LIMITED
洪騰香港貿易有限公司",2011-04-28,2015-05-22,"Private, ltd by shares"288,1593786,"HONESTY (HONG KONG) ENGINEERING LIMITED
誠信(香港)工程有限公司",2011-04-28,,"Private, ltd by shares"289,1593748,"HONEY IDEA GROUP (HK) CO., LIMITED
元成實業(香港)有限公司",2011-04-28,,"Private, ltd by shares"290,1593850,"HONG DING INTERNATIONAL MINING LIMITED
弘鼎國際礦業有限公司",2011-04-28,2017-11-03,"Private, ltd by shares"291,1593659,"Hong Kong Acmeso Biotechnology Co., Limited
香港康卉美爍生物科技有限公司",2011-04-28,2015-04-17,"Private, ltd by shares"292,1593479,"HONG KONG BANG-S COMMUNICATION TECHNOLOGY LIMITED
香港邦時電子科技有限公司",2011-04-28,,"Private, ltd by shares"293,1593264,"HONG KONG BEAUTY TRADE LIMITED
香港美妝貿易有限公司",2011-04-28,2015-12-18,"Private, ltd by shares"294,1593304,"HONG KONG BELSANA INTERNATIONAL FASHION LIMITED
香港蓓珊娜國際時尚有限公司",2011-04-28,,"Private, ltd by shares"295,1593785,"HONG KONG BRITISH JILL INTERNATIONAL CO., LIMITED
香港英吉爾國際有限公司",2011-04-28,2013-10-18,"Private, ltd by shares"296,1593597,"HONG KONG CAIJUN TRADING LIMITED
香港彩隽貿易有限公司",2011-04-28,2015-03-13,"Private, ltd by shares"297,1593835,"HONG KONG COMMERCIAL PROPAGATE COMPANY LIMITED
香港商貿推廣有限公司",2011-04-28,2017-07-14,"Private, ltd by shares"298,1593345,"HONG KONG DUNG SUN TECHNOLOGY COMPANY LIMITED
香港東山科技有限公司",2011-04-28,,"Private, ltd by shares"299,1593568,"HONG KONG HENG FA INTERNATIONAL SHARES CO., LIMITED
香港恒發國際控股有限公司",2011-04-28,2015-06-12,"Private, ltd by shares"300,1593481,"Hong Kong Huahai International Holdings Limited
香港華海國際控股有限公司",2011-04-28,2015-06-12,"Private, ltd by shares"301,1593589,"HONG KONG HUAKAN MINING INVESTMENT CO., LIMITED
香港華勘礦業投資有限公司",2011-04-28,2017-06-16,"Private, ltd by shares"302,1593604,"HONG KONG JIADE TRADE LIMITED
香港佳得貿易有限公司",2011-04-28,2017-12-22,"Private, ltd by shares"303,1593259,"Hong Kong Jiao Tong Ren Ka Hotel Limited
香港胶東人家大酒店有限公司",2011-04-28,2020-03-27,"Private, ltd by shares"304,1593646,"HONG KONG JIN YUAN CO., LIMITED
香港錦源實業有限公司",2011-04-28,2017-02-10,"Private, ltd by shares"305,1593605,"HONG KONG LOVE HOME PRODUCTS LIMITED
香港愛家居制品有限公司",2011-04-28,,"Private, ltd by shares"306,1593364,"HONG KONG MIKE POLO CLOTHING INT'L LIMITED
香港麥克保羅服飾國際有限公司",2011-04-28,,"Private, ltd by shares"307,1593580,"HONG KONG NEPTUNE MOTOR COMPANY LIMITED
香港鼎智有限公司",2011-04-28,2018-10-05,"Private, ltd by shares"308,1593720,"Hong Kong Poverty Charitable Funds Association Limited
香港扶貧慈善基金會有限公司",2011-04-28,2017-05-12,"Ltd by guarantee"309,1593743,"HONG KONG SAN LI INTERNAIONAL FASHION LIMITED
香港三利國際服飾有限公司",2011-04-28,2020-01-17,"Private, ltd by shares"310,1593575,"HONG KONG SUM YUEN TECHNOLOGY LIMITED
香港森源科技有限公司",2011-04-28,2015-06-12,"Private, ltd by shares"311,1593638,"HONG KONG TIG ELECTRONIC TECH LIMITED
香港來格電子科技有限公司",2011-04-28,,"Private, ltd by shares"312,1593752,"HONG KONG WANGTUNE GROUP CAPITAL &amp; ASSET MANAGEMENT LIMITED
香港環通集團資金資產管理有限公司",2011-04-28,2019-02-08,"Private, ltd by shares"313,1593783,"HONG KONG ZHUO GEN INDUSTRIAL CORPORATION LIMITED
香港卓亙實業有限公司",2011-04-28,2015-06-12,"Private, ltd by shares"314,1593489,"HONG KONG ZYX LIMITED
香港友祥有限公司",2011-04-28,2019-02-08,"Private, ltd by shares"315,1593831,"HONGKONG BABY PLAN OVERSEAS SON SERVICE CO., LIMITED
香港寶貝計劃海外生子服務有限公司",2011-04-28,2015-06-12,"Private, ltd by shares"316,1593382,"HONGKONG BAISHENG INTERNATIONAL INVESTMENT LIMITED
香港百盛國際投資有限公司",2011-04-28,,"Private, ltd by shares"317,1593744,"HONGKONG CAILUN FOOD STOCK LIMITED
香港彩倫食品股份有限公司",2011-04-28,,"Private, ltd by shares"318,1593380,"HONGKONG CHANGWEI HOLDING GROUP LIMITED
香港長威控股集團有限公司",2011-04-28,2020-01-24,"Private, ltd by shares"319,1593650,"HONGKONG CHINA BOOM PRECISION METAL MOULD LIMITED
香港華卓精密五金模具有限公司",2011-04-28,,"Private, ltd by shares"320,1593805,"HONGKONG COAST BUSINESS CO., LIMITED
香港沿岸商業有限公司",2011-04-28,2017-12-01,"Private, ltd by shares"321,1593853,"HONGKONG COASTY INDUSTRIAL CO., LIMITED
香港鎧仕迪實業有限公司",2011-04-28,,"Private, ltd by shares"322,1593509,"HONGKONG FANDI (FRANCE) COSMETICS CO., LIMITED
香港梵帝(法國)化妝品有限公司",2011-04-28,2016-08-12,"Private, ltd by shares"323,1593439,"HONGKONG FINANCIAL SERVICE LIMITED
香港金融服務有限公司",2011-04-28,,"Private, ltd by shares"324,1593837,"HONGKONG GOLDEN CENTURY LIMITED
金世紀(香港)科技有限公司",2011-04-28,,"Private, ltd by shares"325,1593825,"HONGKONG HENGSHENG PRODUCES GROUP LIMITED
香港恒生物產集團有限公司",2011-04-28,2015-06-12,"Private, ltd by shares"326,1593443,"Hongkong High-Level Technologies Co., Limited
香港恆樂為科技有限公司",2011-04-28,2017-12-01,"Private, ltd by shares"327,1593281,"HONGKONG HONGQUAN GROUP CO., LIMITED
香港紅權集團有限公司",2011-04-28,2015-06-12,"Private, ltd by shares"328,1593334,"HONGKONG K&amp;T TEXTILES CO., LIMITED",2011-04-28,,"Private, ltd by shares"329,1593275,"HONGKONG LABTECH (CHINA) LIMITED
香港質檢科技(中國)有限公司",2011-04-28,,"Private, ltd by shares"330,1593465,"Hongkong Powerbalance Corp Limited
香港霸能有限公司",2011-04-28,,"Private, ltd by shares"331,1593342,"HONGKONG SHENSHI INT'L TRADE LIMITED
香港紳獅國際貿易有限公司",2011-04-28,2015-06-12,"Private, ltd by shares"332,1593782,"HONGKONG XIN YI INDUSTRY CO., LIMITED
香港鑫一實業有限公司",2011-04-28,,"Private, ltd by shares"333,1593445,"HONGKONG XINHONG INTERNATIONAL GROUP CO., LIMITED
香港鑫泓國際集團有限公司",2011-04-28,2015-12-18,"Private, ltd by shares"334,1593451,"HONGKONG XYM GROUP HOUSEHOLD CO., LIMITED
香港心悅美家居(集團)有限公司",2011-04-28,2015-12-18,"Private, ltd by shares"335,1593247,"HONGKONG YDC CO., LIMITED
香港裕達成有限公司",2011-04-28,2018-09-14,"Private, ltd by shares"336,1593634,"HONGKONG YIBI JEWELRY GROUP LIMITED
香港伊比珠寶集團有限公司",2011-04-28,2017-10-13,"Private, ltd by shares"337,1593682,"HONGKONG YIGEN BACKDROP INT'L LIMITED
香港藝根背景牆國際有限公司",2011-04-28,2015-06-12,"Private, ltd by shares"338,1593652,"HONGKONG YUHUAN TRADING LIMITED
香港玉寰貿易有限公司",2011-04-28,2017-09-15,"Private, ltd by shares"339,1593856,"HONGTAI DEVELOPMENT LIMITED
宏泰科技發展有限公司",2011-04-28,,"Private, ltd by shares"340,1593503,"HONOUR TOP INVESTMENT MANAGEMENT (HONG KONG) LIMITED
香港誠泰投資管理有限公司",2011-04-28,,"Private, ltd by shares"341,1593402,"HOTU (HK) LIMITED
宏圖控股(香港)集團有限公司",2011-04-28,2015-12-18,"Private, ltd by shares"342,1593624,"HSUYI (HONG KONG) CO. LIMITED
旭怡(香港)股份有限公司",2011-04-28,,"Private, ltd by shares"343,1593354,"HUA ENTERPRISE CO., LIMITED
華氏企業股份有限公司",2011-04-28,2016-12-16,"Private, ltd by shares"344,1593559,"HUACI TECHNOLOGY (CHINA) LIMITED
華旗科技(中國)有限公司",2011-04-28,2019-02-08,"Private, ltd by shares"345,1593738,"HUAYANG MUSICAL INSTRUMENT CO., LIMITED",2011-04-28,2015-12-18,"Private, ltd by shares"346,1593833,"HUISHENG INTERNATIONAL TRADE CO., LIMITED
匯升國際貿易有限公司",2011-04-28,2013-11-29,"Private, ltd by shares"347,1593612,"HUNDREDS IDEA LIMITED
思佰有限公司",2011-04-28,2016-12-16,"Private, ltd by shares"348,1593325,"HYW RESOURCES LIMITED
灝怡資源有限公司",2011-04-28,,"Private, ltd by shares"349,1593599,"ICAN STONE (HK) CO., LIMITED
艾簡石材(香港)有限公司",2011-04-28,,"Private, ltd by shares"350,1593331,"ICC Technology Co., Limited
博傲科技有限公司",2011-04-28,,"Private, ltd by shares"351,1593676,"ICI DESIGN CO., LIMITED",2011-04-28,,"Private, ltd by shares"352,1593487,"IDECOR ASIA (CHINA) CONSTRUCTION LIMITED
理卓建築裝飾工程(中國)有限公司",2011-04-28,2018-02-09,"Private, ltd by shares"353,1593699,"Imex International Industrial Limited
伊邁斯國際實業有限公司",2011-04-28,2018-12-14,"Private, ltd by shares"354,1593339,"INFINITY DIMENSION CO., LIMITED
香港領海科技集團有限公司",2011-04-28,,"Private, ltd by shares"355,1593832,"Innov In Asia Limited",2011-04-28,,"Private, ltd by shares"356,1593691,"INTEGRATED CONSULTANT LIMITED
集思顧問服務有限公司",2011-04-28,,"Private, ltd by shares"357,1593512,"INTERAT GLOBAL LINK CO. LIMITED
典策遺體附運服務有限公司",2011-04-28,,"Private, ltd by shares"358,1593270,"INTERNATIONAL ATHLETIC DANCE TEACHERS ASSOCIATION LIMITED
國際體育舞蹈教師協會有限公司",2011-04-28,2020-01-17,"Private, ltd by shares"359,1593383,"INTERNATIONAL EDUCATION GROUP (HK) LIMITED
國際教育集團(香港)有限公司",2011-04-28,2016-12-16,"Private, ltd by shares"360,1593602,"ITALY AMANI GROUP CO., LIMITED
意大利阿瑪尼集團有限公司",2011-04-28,2015-06-12,"Private, ltd by shares"361,1593619,"ITALY BINLI GARMENT COMPANY LIMITED
意大利賓利服飾有限公司",2011-04-28,2015-12-18,"Private, ltd by shares"362,1593684,"ITALY CARLO DI NIAO INTERNATIONAL GROUP LIMITED
意大利卡羅迪尼奧國際集團有限公司",2011-04-28,2015-06-12,"Private, ltd by shares"363,1593300,"ITALY FLD DRESS GROUP LIMITED
意大利法朗頓服飾集團有限公司",2011-04-28,,"Private, ltd by shares"364,1593426,"ITALY GRACEFULBEARING INTERNATIONAL TRADE CO., LIMITED
意大利格雷斯比琳國際貿易有限公司",2011-04-28,2016-12-16,"Private, ltd by shares"365,1593360,"ITALY KASA FASHION (HONGKONG) LIMITED
意大利卡薩時裝(香港)有限公司",2011-04-28,2015-06-12,"Private, ltd by shares"366,1593776,"ITALY MAYHANO GROUP CO., LIMITED
意大利美晗奴集團有限公司",2011-04-28,,"Private, ltd by shares"367,1593428,"ITALY ROMAN ARMANI INTERNATIONAL LEATHER PRODUCT LIMITED
意大利羅馬阿瑪尼國際皮具有限公司",2011-04-28,,"Private, ltd by shares"368,1593735,"JAE MUSICAL INSTRUMENTS LIMITED
佳懿樂器有限公司",2011-04-28,2013-12-27,"Private, ltd by shares"369,1593366,"JAPAN FUJI TRADE CO., LIMITED
日本富士貿易有限公司",2011-04-28,,"Private, ltd by shares"370,1593595,"JAPAN MESSI COSMETICS (HONGKONG) CO., LIMITED
日本美絲化妝品(香港)有限公司",2011-04-28,,"Private, ltd by shares"371,1593714,"JEHAD LIMITED
吉哈德有限公司",2011-04-28,,"Private, ltd by shares"372,1593750,"JELINNA INTERNATIONAL FASHION LIMITED
捷琳娜國際服飾有限公司",2011-04-28,2015-12-18,"Private, ltd by shares"373,1593582,"Jiali International Trade Holding Co., Limited
佳力國際貿易控股有限公司",2011-04-28,,"Private, ltd by shares"374,1593694,"JIANGSU KODE CHEMICAL CO., LIMITED
江蘇科德化工有限公司",2011-04-28,2018-07-06,"Private, ltd by shares"375,1593722,"JIN HONG INTERNATIONAL GROUP DEVELOPMENT LIMITED
錦鴻國際集團發展有限公司",2011-04-28,2014-10-31,"Private, ltd by shares"376,1593564,"JING YAN TECHNOLOGY CO., LIMITED
精研科技有限公司",2011-04-28,2019-08-23,"Private, ltd by shares"377,1593449,"JINGTIAN TECHNOLOGY COMPANY LIMITED
景天科技有限公司",2011-04-28,,"Private, ltd by shares"378,1593809,"Jinhua Betterway Supply Chain Management Co., Limited
金華佳程供應鏈管理有限公司",2011-04-28,2019-08-30,"Private, ltd by shares"379,1593420,"JINLIJIA (HONGKONG) TRADE CO., LIMITED
金麗佳(香港)貿易有限公司",2011-04-28,2019-02-08,"Private, ltd by shares"380,1593506,"JK-MOLD TECHNOLOGY CO., LIMITED
捷凱模具科技有限公司",2011-04-28,,"Private, ltd by shares"381,1593289,"JOINT MERCHANT LIMITED
招國有限公司",2011-04-28,,"Private, ltd by shares"382,1593261,"JOINWELL ELECTRONICS CO., LIMITED
捷爾微電子有限公司",2011-04-28,,"Private, ltd by shares"383,1593787,"JOLLY NEWS (HONG KONG) LIMITED
高訊(香港)有限公司",2011-04-28,2015-06-12,"Private, ltd by shares"384,1593460,"JR Moldes (HK) Limited",2011-04-28,2020-04-03,"Private, ltd by shares"385,1593841,"Jump Up Limited (HK)",2011-04-28,,"Private, ltd by shares"386,1593609,"JUVET (HONG KONG) COMPANY LIMITED
瑞士有喴(香港)有限公司",2011-04-28,,"Private, ltd by shares"387,1593507,"JX RENOVATION CO., LIMITED
錦繡國際有限公司",2011-04-28,,"Private, ltd by shares"388,1593836,"K-POWER CO., LIMITED (d2014-01-17)
健力堡有限公司",2011-04-28,2014-01-17,"Private, ltd by shares"389,1593374,"Kaiser Brokers Group Limited",2011-04-28,2017-10-13,"Private, ltd by shares"390,1593577,"KALI SUNSHINE INTERNATIONAL (HK) LIMITED",2011-04-28,2020-01-17,"Private, ltd by shares"391,1593668,"Kam Wai Properties Limited
金威置業股份有限公司",2011-04-28,2014-11-07,"Private, ltd by shares"392,1593764,"KEEN WISH INTERNATIONAL LIMITED
銳望國際有限公司",2011-04-28,2014-06-06,"Private, ltd by shares"393,1593400,"KENFULL LIMITED
簡富有限公司",2011-04-28,,"Private, ltd by shares"394,1593417,"KENTFORD LIMITED (d2012-10-19)
簡福有限公司",2011-04-28,2012-10-19,"Private, ltd by shares"395,1593254,"KEPENG DIGITAL CO., LIMITED
科鵬數碼有限公司",2011-04-28,2015-01-09,"Private, ltd by shares"396,1593618,"KIDS CREATION GARMENTS LIMITED",2011-04-28,2018-12-28,"Private, ltd by shares"397,1593482,"KIMARK INTERNATIONAL DEVELOP LIMITED
金馬國際拓展有限公司",2011-04-28,2015-09-11,"Private, ltd by shares"398,1593245,"KIMMAR CHIP INTERNATIONAL CO., LIMITED",2011-04-28,2016-09-30,"Private, ltd by shares"399,1593629,"KING COCONUT GROUP (HONG KONG) INTERNATIONAL LIMITED
大王椰集團(香港)國際有限公司",2011-04-28,2015-06-12,"Private, ltd by shares"400,1593712,"KINGDA INTERNATIONAL (HK) LIMITED
金達國際(香港)有限公司",2011-04-28,2013-10-11,"Private, ltd by shares"401,1593806,"KIRIN GROUP (CHINA) INVESTMENT LIMITED
麒麟集團(中國)投資有限公司",2011-04-28,2019-02-08,"Private, ltd by shares"402,1593298,"KOREA KINDLY GROUP (HONG KONG) LIMITED
韓國金英集團(香港)有限公司",2011-04-28,2019-02-08,"Private, ltd by shares"403,1593777,"KOREA PINGHE VALEO INT'L HOLDINGS LIMITED
韓國平和法雷奧國際控股有限公司",2011-04-28,2018-03-23,"Private, ltd by shares"404,1593505,"KOREA REKA MEANDER (HK) INT'L BUSINESS TRADE LIMITED
韓國雷卡米埃(香港)國際商貿有限公司",2011-04-28,2017-12-01,"Private, ltd by shares"405,1593411,"KOSPT E-COMMERCE LIMITED
開賽電子商務有限公司",2011-04-28,,"Private, ltd by shares"406,1593284,"LAB INDEX LIVING (HK) LIMITED",2011-04-28,2017-12-01,"Private, ltd by shares"407,1593565,"Lagardere Active Enterprises Hong Kong Limited
萊格廸香港有限公司",2011-04-28,,"Private, ltd by shares"408,1593356,"Leadmark (LMK) Limited
震展有限公司",2011-04-28,2015-12-18,"Private, ltd by shares"409,1593637,"LEAF SERVICES ASIA LIMITED",2011-04-28,,"Private, ltd by shares"410,1593350,"LFA HONG KONG LIMITED",2011-04-28,2013-11-15,"Private, ltd by shares"411,1593816,"LIDA TECHNOLOGY (HONGKONG) CO., LIMITED
林達科技(香港)有限公司",2011-04-28,2015-06-12,"Private, ltd by shares"412,1593376,"LIGHT CREATION LIMITED (d2013-01-11)
創耀節能環保有限公司",2011-04-28,2013-01-11,"Private, ltd by shares"413,1593755,"LINTEL INDUSTRIAL (SHENZHEN) COMPANY LIMITED
淩特爾實業(深圳)有限公司",2011-04-28,2015-06-12,"Private, ltd by shares"414,1593462,"LITOP INTERNATIONAL INVESTMENT LIMITED
利鼎國際投資有限公司",2011-04-28,2017-09-29,"Private, ltd by shares"415,1593867,"Location Ai Technology Limited
置訊科技有限公司",2011-04-28,,"Private, ltd by shares"416,1593737,"LONGFAR INDUSTRY TRADE LIMITED
隆華工貿有限公司",2011-04-28,2015-06-12,"Private, ltd by shares"417,1593319,"LONGLIQI INTERNATIONAL (HK) LIMITED
隆力奇國際(香港)有限公司",2011-04-28,,"Private, ltd by shares"418,1593807,"LONGMA TRADE DEVELOPMENT CO., LIMITED
龍瑪貿易發展有限公司",2011-04-28,2016-12-16,"Private, ltd by shares"419,1593378,"LOTOS SWITZERLAND SARL (H.K.) LIMITED
樂朵詩(香港)有限公司",2011-04-28,2020-01-17,"Private, ltd by shares"420,1593432,"LUCK HARVEST LIMITED (d2012-12-07)
福耕有限公司",2011-04-28,2012-12-07,"Private, ltd by shares"421,1593584,"LUCKTRONICS ELECTRONIC LIMITED
凱創力電子有限公司",2011-04-28,,"Private, ltd by shares"422,1593288,"MaoDa Clock &amp; Watch Enterprise (HK) Limited
茂達鐘錶企業(香港)有限公司",2011-04-28,2020-09-25,"Private, ltd by shares"423,1593762,"MASSIVE HERO LIMITED
君豐有限公司",2011-04-28,,"Private, ltd by shares"424,1593678,"MAXIME (HONG KONG) LIMITED",2011-04-28,,"Private, ltd by shares"425,1593615,"METALES EL ROSARIO (MER) LIMITED
宏海集團控股有限公司",2011-04-28,2015-12-18,"Private, ltd by shares"426,1593583,"METROPLUS CHINA LIMITED",2011-04-28,2016-04-29,"Private, ltd by shares"427,1593262,"Meyo Furniture Company Limited
美祐傢俱有限公司",2011-04-28,,"Private, ltd by shares"