,Reg no.,Name,Incorp-orated,Dissolved,Type1,0046612,"BINTANG PURANESIA INTERNATIONAL (H.K.) LIMITED",1976-03-19,1985-08-30,"Private, ltd by shares"2,0046640,"CHALLENGER LIMITED (THE)",1976-03-19,2002-05-10,"Private, ltd by shares"3,0046631,"CHEONG TAI SHIU ENTERPRISES LIMITED
昌泰兆企業有限公司",1976-03-19,1993-07-14,"Private, ltd by shares"4,0046662,"CINDERELLA GARMENT FACTORY LIMITED
新特利製衣有限公司",1976-03-19,1995-06-30,"Private, ltd by shares"5,0046617,"COUNT VALLEY (H.K.) LIMITED",1976-03-19,1991-05-31,"Private, ltd by shares"6,0046651,"DIRECT LINE COMPANY LIMITED",1976-03-19,1996-07-19,"Private, ltd by shares"7,0046648,"DITTO TEXTILES LIMITED (d2005-08-12)
的圖紡織有限公司",1976-03-19,2005-08-12,"Private, ltd by shares"8,0046660,"EASTERN EQUIPMENTS LIMITED
依時儀器有限公司",1976-03-19,1991-02-14,"Private, ltd by shares"9,0046627,"EASTERN PACIFIC DEVELOPMENT LIMITED
東太平洋發展有限公司",1976-03-19,,"Private, ltd by shares"10,0046666,"ECON TRADING COMPANY, LIMITED
易安貿易有限公司",1976-03-19,1990-08-08,"Private, ltd by shares"11,0046625,"EKLOW GARMENT FACTORY LIMITED
億高製衣廠有限公司",1976-03-19,2003-03-14,"Private, ltd by shares"12,0046614,"ELECTRONIC WATCH CENTRE LIMITED",1976-03-19,1988-11-05,"Private, ltd by shares"13,0046608,"ELKIN LIMITED (d1994-04-23)",1976-03-19,1994-04-23,"Private, ltd by shares"14,0046655,"ELMWOOD (HONG KONG) LIMITED",1976-03-19,2005-03-18,"Private, ltd by shares"15,0046611,"EXCORP HOLDINGS LIMITED",1976-03-19,,"Private, ltd by shares"16,0046642,"FAI HON ESTATES COMPANY LIMITED
輝漢地產有限公司",1976-03-19,1987-05-23,"Private, ltd by shares"17,0046620,"FINLAY INDUSTRIES (H.K.) LIMITED",1976-03-19,1995-05-13,"Private, ltd by shares"18,0046637,"FIRST NATIONAL ESTATE INVESTMENT LIMITED
寶通興業有限公司",1976-03-19,,"Private, ltd by shares"19,0046638,"GLENEALY INDUSTRIES LIMITED",1976-03-19,,"Private, ltd by shares"20,0046661,"GOOD LUCK FASHION GARMENT FACTORY LIMITED
冠立時裝製衣廠有限公司",1976-03-19,2015-02-06,"Private, ltd by shares"21,0046667,"GUANG YANG COMPANY LIMITED",1976-03-19,1995-10-27,"Private, ltd by shares"22,0046650,"HESCO AIRCONDITIONING COMPANY LIMITED
東方冷氣工程有限公司",1976-03-19,1995-07-28,"Private, ltd by shares"23,0046624,"HO AND IMAI CONSULTANTS (HONG KONG) LIMITED",1976-03-19,,"Private, ltd by shares"24,0046621,"Hyatt Hotels Consultancy Services Asia Pacific Limited
亞太區凱悅酒店諮詢服務有限公司",1976-03-19,,"Private, ltd by shares"25,0046665,"KWONG CHEUNG SHARK'S FIN COMPANY LIMITED
廣祥魚翅有限公司",1976-03-19,2002-03-08,"Private, ltd by shares"26,0046630,"LEE CHUEN FAT ENTERPRISES LIMITED
利全發企業有限公司",1976-03-19,1984-10-18,"Private, ltd by shares"27,0046633,"LEE FAT CHEUNG ENTERPRISES LIMITED
利發祥企業有限公司",1976-03-19,1995-06-30,"Private, ltd by shares"28,0046629,"LEE TAK CHEONG ENTERPRISES LIMITED
利德昌企業有限公司",1976-03-19,1986-02-11,"Private, ltd by shares"29,0046618,"MAN FUNG HONG LIMITED
民豐行有限公司",1976-03-19,,"Private, ltd by shares"30,0046658,"MARTINO FOOD LIMITED
馬天露飲食有限公司",1976-03-19,1984-08-17,"Private, ltd by shares"31,0046636,"MAYFAIR JEWELLERY &amp; COMPANY LIMITED
明芬珠寶貿易有限公司",1976-03-19,,"Private, ltd by shares"32,0046622,"NANSHA LIMITED",1976-03-19,1979-06-10,"Private, ltd by shares"33,0046644,"NEEPSEND INVESTMENT LIMITED
立新投資有限公司",1976-03-19,1994-07-21,"Private, ltd by shares"34,0046649,"NEWTONE (HUATU HONG) TRAVEL SERVICE LIMITED
新聲(華都行)旅遊有限公司",1976-03-19,2017-11-03,"Private, ltd by shares"35,0046615,"ON MING TRADING COMPANY LIMITED
安明貿易有限公司",1976-03-19,2002-03-08,"Private, ltd by shares"36,0046653,"ORIENTAL INNOVATIONS CORPORATION LIMITED
東方革新有限公司",1976-03-19,2002-03-08,"Private, ltd by shares"37,0046639,"PAN ASIA CONSTRUCTION CO. LIMITED
泛亞土木工程有限公司",1976-03-19,1995-06-30,"Private, ltd by shares"38,0046643,"PAS AIRCARGO SERVICE (HONG KONG) LIMITED
保時空運(香港)有限公司",1976-03-19,1992-08-28,"Private, ltd by shares"39,0046606,"PING JING COLLEGE OF COMMERCE LIMITED
平正商科書院有限公司",1976-03-19,1992-04-24,"Private, ltd by shares"40,0046654,"PULCO (HONG KONG) LIMITED",1976-03-19,1995-06-30,"Private, ltd by shares"41,0046659,"RIDGEWELL INVESTMENTS LIMITED (d1983-06-08)",1976-03-19,1983-06-08,"Private, ltd by shares"42,0046656,"RIVERSIDE RESTAURANT LIMITED (d2007-06-14)
畔溪小館有限公司",1976-03-19,2007-06-14,"Private, ltd by shares"43,0046657,"SERENA BAKERY LIMITED
喜年來西餅有限公司",1976-03-19,1984-08-17,"Private, ltd by shares"44,0046664,"SHEK MEE PLASTIC &amp; METAL MANUFACTURING COMPANY LIMITED
適美塑膠金屬製品有限公司",1976-03-19,1995-06-30,"Private, ltd by shares"45,0046613,"SHING HIM TRADING COMPANY LIMITED
誠謙貿易有限公司",1976-03-19,1986-10-30,"Private, ltd by shares"46,0046616,"SHING YIP ENGINEERING COMPANY LIMITED (d1995-06-30)
成業工程有限公司",1976-03-19,1995-06-30,"Private, ltd by shares"47,0046646,"SHINTA INDONESIAN ENTERPRISES LIMITED",1976-03-19,,"Private, ltd by shares"48,0046634,"SING TAO PLANET LIMITED",1976-03-19,2005-10-14,"Private, ltd by shares"49,0046632,"SORDAKH INTERNATIONAL LIMITED",1976-03-19,1988-01-23,"Private, ltd by shares"50,0046626,"SOUTH-EAST ASIA ELECTRIC &amp; ELECTRONICS COMPANY, LIMITED
東南亞電業有限公司",1976-03-19,2004-05-07,"Private, ltd by shares"51,0046669,"STOCK FINANCE LIMITED (d2006-12-01)",1976-03-19,2006-12-01,"Private, ltd by shares"52,0046623,"STRUCTURAL COMPONENTS (ASIA) LIMITED",1976-03-19,1995-09-22,"Private, ltd by shares"53,0046641,"SUN KAU ENTERPRISES LIMITED
新球企業有限公司",1976-03-19,2011-04-29,"Private, ltd by shares"54,0046652,"TAI KWONG CONSTRUCTION COMPANY LIMITED
大光建築有限公司",1976-03-19,1995-06-30,"Private, ltd by shares"55,0046645,"TAK PO HOLDINGS LIMITED
德寶控股有限公司",1976-03-19,,"Private, ltd by shares"56,0046647,"TIMOTHY'S COMPANY LIMITED",1976-03-19,1995-12-29,"Private, ltd by shares"57,0046635,"TOPFUL GARMENTS LIMITED
德福製衣廠有限公司",1976-03-19,1979-07-23,"Private, ltd by shares"58,0046628,"U.S. EXPORT CORPORATION (H.K.) LIMITED",1976-03-19,,"Private, ltd by shares"59,0046663,"UNICORN PACIFIC COMPANY LIMITED (d1988-03-30)",1976-03-19,1988-03-30,"Private, ltd by shares"60,0046619,"UNIVERSAL MARBLE LIMITED",1976-03-19,1995-07-28,"Private, ltd by shares"61,0046607,"WAI CHEUNG HONG TRADING COMPANY LIMITED
偉昌行貿易有限公司",1976-03-19,1995-06-30,"Private, ltd by shares"62,0046668,"WAI YEN ENTERPRISES COMPANY LIMITED",1976-03-19,,"Private, ltd by shares"63,0046609,"WEALTHFUL DYEING WORKS LIMITED
惠豐染廠有限公司",1976-03-19,1995-06-30,"Private, ltd by shares"64,0046610,"YUE SHING KNITTERS LIMITED
裕興針織廠有限公司",1976-03-19,2014-07-18,"Private, ltd by shares"