,Reg no.,Name,Incorp-orated,Dissolved,Type1,0070175,"ALAUS MIRROR FACTORY LIMITED
雅留斯鏡廠有限公司",1979-06-01,1996-03-29,"Private, ltd by shares"2,0070206,"ALLCARD TRADING LIMITED",1979-06-01,1993-08-25,"Private, ltd by shares"3,0070149,"ARCHER INDUSTRIES COMPANY LIMITED
雅捷實業有限公司",1979-06-01,2002-11-15,"Private, ltd by shares"4,0070207,"BEIJING HOLDINGS LIMITED
京泰實業(集團)有限公司",1979-06-01,,"Private, ltd by shares"5,0070189,"BELLWOOD INTERNATIONAL LIMITED (d1997-04-18)",1979-06-01,1997-04-18,"Private, ltd by shares"6,0070136,"BILLFLOW LIMITED
憶溢有限公司",1979-06-01,2002-11-15,"Private, ltd by shares"7,0070154,"BRIER INTERNATIONAL LIMITED",1979-06-01,1995-11-24,"Private, ltd by shares"8,0070125,"BUDDHIST MAN SANG HALL LIMITED
佛教愍生講堂有限公司",1979-06-01,,"Ltd by guarantee"9,0070150,"C. &amp; C. SOUNDAS COMPANY LIMITED
威達時有限公司",1979-06-01,1988-05-08,"Private, ltd by shares"10,0070158,"C. R. REALTY LIMITED",1979-06-01,2002-07-20,"Private, ltd by shares"11,0070201,"CAL-WESTERN TRADING COMPANY LIMITED
偉成高貿易(香港)有限公司",1979-06-01,,"Private, ltd by shares"12,0070182,"CAMPTON INVESTMENT LIMITED
甘棠企業有限公司",1979-06-01,1985-12-02,"Private, ltd by shares"13,0070172,"CHINA DOWN CENTER (KUNG KNUNG) LIMITED
中國羽絨(工農)有限公司",1979-06-01,1999-03-22,"Private, ltd by shares"14,0070153,"CHINA OVERSEAS LAND &amp; INVESTMENT LIMITED
中國海外發展有限公司",1979-06-01,,"Listed company"15,0070126,"CHU HAI CRICKET FANS CLUB LIMITED
珠海蟀友聯誼會有限公司",1979-06-01,1995-12-29,"Ltd by guarantee"16,0070133,"COFFEE OF THE WORLD LIMITED",1979-06-01,2002-11-15,"Private, ltd by shares"17,0070174,"DAO FAI INVESTMENT COMPANY LIMITED
道輝置業有限公司",1979-06-01,1998-04-24,"Private, ltd by shares"18,0070156,"DELTA MANAGEMENT LIMITED (d1996-05-31)",1979-06-01,1996-05-31,"Private, ltd by shares"19,0070186,"DESIGN FORUM LIMITED (d1997-04-25)",1979-06-01,1997-04-25,"Private, ltd by shares"20,0070168,"DOWLAND LIMITED (d1997-11-14)
多倫有限公司",1979-06-01,1997-11-14,"Private, ltd by shares"21,0070134,"DULCET INVESTMENT LIMITED",1979-06-01,2015-08-28,"Private, ltd by shares"22,0070210,"EASTER FINISHING COMPANY LIMITED
易達針織定型有限公司",1979-06-01,,"Private, ltd by shares"23,0070203,"EDGINGTON TRADING LIMITED",1979-06-01,1996-02-23,"Private, ltd by shares"24,0070145,"FERICH INTERNATIONAL LIMITED
宏域國際有限公司",1979-06-01,1997-10-22,"Private, ltd by shares"25,0070194,"FINANCIAL GEMS LIMITED",1979-06-01,1996-02-23,"Private, ltd by shares"26,0070180,"FINEBRAND FOOD MANUFACTURING LIMITED
嘉品食品廠有限公司",1979-06-01,1997-11-21,"Private, ltd by shares"27,0070204,"FITZMAURICE LIMITED (d2014-06-06)",1979-06-01,2014-06-06,"Private, ltd by shares"28,0070179,"FOOK WOO CHEUNG GINSENG COMPANY LIMITED
福和祥參行有限公司",1979-06-01,1996-12-27,"Private, ltd by shares"29,0070211,"FULCO PAPER PRODUCTS INDUSTRIAL COMPANY LIMITED
富國紙品實業有限公司",1979-06-01,1996-02-23,"Private, ltd by shares"30,0070167,"FULGENT LIMITED (HK)
富準有限公司",1979-06-01,,"Private, ltd by shares"31,0070143,"GREENBURG SHIPPING LIMITED",1979-06-01,1992-02-18,"Private, ltd by shares"32,0070146,"HAZELWORTH COMPANY LIMITED",1979-06-01,2016-12-09,"Private, ltd by shares"33,0070140,"HIP SHING HONG ESTATES INVESTMENT COMPANY LIMITED
協成行置業投資有限公司",1979-06-01,,"Private, ltd by shares"34,0070202,"HOWATSON TRADING LIMITED",1979-06-01,2000-09-15,"Private, ltd by shares"35,0070208,"INTERCONTINENTAL CEMENT COMPANY LIMITED
洲際水泥有限公司",1979-06-01,1986-10-08,"Private, ltd by shares"36,0070216,"JACE ELECTRONIC INDUSTRIES LIMITED",1979-06-01,1996-02-23,"Private, ltd by shares"37,0070181,"JAX MANUFACTURING COMPANY LIMITED
雅斯製衣廠有限公司",1979-06-01,1988-07-12,"Private, ltd by shares"38,0070155,"JET BRIGHT PRINTING LIMITED
捷名印刷有限公司",1979-06-01,,"Private, ltd by shares"39,0070192,"JET STEP LIMITED
績德有限公司",1979-06-01,,"Private, ltd by shares"40,0070193,"JUNICA LIMITED
祖利加有限公司",1979-06-01,1996-02-23,"Private, ltd by shares"41,0070162,"K. M. ABDUL RAZAK &amp; SONS LIMITED",1979-06-01,1995-11-24,"Private, ltd by shares"42,0070214,"KARI TRAVEL LIMITED",1979-06-01,2001-08-10,"Private, ltd by shares"43,0070190,"KING SPEAR COMPANY LIMITED",1979-06-01,1982-01-29,"Private, ltd by shares"44,0070169,"KISTEND LIMITED",1979-06-01,1994-08-26,"Private, ltd by shares"45,0070141,"KRASSNER SHIPPING LIMITED",1979-06-01,1995-12-29,"Private, ltd by shares"46,0070163,"KRONER INVESTMENT COMPANY LIMITED
拱照投資有限公司",1979-06-01,1996-03-29,"Private, ltd by shares"47,0070183,"LEJOK INTERNATIONAL (HONG KONG) LIMITED",1979-06-01,2001-01-12,"Private, ltd by shares"48,0070188,"LEVEL MEDICAL &amp; DIAGNOSTIC SERVICES LIMITED
敬業醫學化驗有限公司",1979-06-01,2001-11-07,"Private, ltd by shares"49,0070195,"LIP HING (YEUNG'S) MANUFACTORY LIMITED
立興(楊氏)製品廠有限公司",1979-06-01,,"Private, ltd by shares"50,0070178,"LUEN KAI FAT PROPERTIES LIMITED
聯啟發地產有限公司",1979-06-01,2000-08-04,"Private, ltd by shares"51,0070196,"MAC HIRAI LIMITED
平井有限公司",1979-06-01,1998-08-07,"Private, ltd by shares"52,0070212,"MANU-TRONIC LIMITED
昌明電子有限公司",1979-06-01,2011-04-21,"Private, ltd by shares"53,0070160,"MARWOOD TRADING (HONG KONG) LIMITED",1979-06-01,1995-11-24,"Private, ltd by shares"54,0070171,"MEEI SHEANG ENTERPRISE COMPANY, LIMITED
美享興業有限公司",1979-06-01,1996-03-29,"Private, ltd by shares"55,0070132,"MEGAVA COMPANY LIMITED",1979-06-01,2002-11-15,"Private, ltd by shares"56,0070166,"MODERN INN DEVELOPMENT LIMITED
現代酒店發展有限公司",1979-06-01,1995-04-21,"Private, ltd by shares"57,0070164,"MUNICH SPORTS GOODS LIMITED
慕尼克體育用品有限公司",1979-06-01,1995-11-24,"Private, ltd by shares"58,0070198,"N. R. G. POLYMERS LIMITED
理研塑膠有限公司",1979-06-01,1987-10-06,"Private, ltd by shares"59,0070191,"NIPPON EXPRESS (H.K.) COMPANY LIMITED
香港日通有限公司",1979-06-01,,"Private, ltd by shares"60,0070152,"OCEAN BUILDING SERVICES LIMITED",1979-06-01,1996-02-23,"Private, ltd by shares"61,0070128,"OEI HOLDINGS LIMITED",1979-06-01,1996-09-06,"Private, ltd by shares"62,0070187,"OI MAN ELECTRICAL APPLIANCE COMPANY LIMITED
愛民電業有限公司",1979-06-01,2012-07-20,"Private, ltd by shares"63,0070176,"OI WAH INDUSTRIAL COMPANY LIMITED
愛華實業有限公司",1979-06-01,,"Private, ltd by shares"64,0070151,"ORSTEAD H.K. LIMITED",1979-06-01,1992-09-25,"Private, ltd by shares"65,0070209,"OUTDOOR PEOPLE SPORTS LIMITED (THE)
假日戶外體育用品有限公司",1979-06-01,1998-05-15,"Private, ltd by shares"66,0070159,"PACKAGE TOURS (HONG KONG) LIMITED
縱橫旅遊有限公司",1979-06-01,,"Private, ltd by shares"67,0070205,"PHIBBS TRADING LIMITED",1979-06-01,,"Private, ltd by shares"68,0070130,"PINE-RIVER ENGINEERING COMPANY LIMITED
萬利華工程有限公司",1979-06-01,2002-04-12,"Private, ltd by shares"69,0070148,"SAFIELD (HONG KONG) LIMITED",1979-06-01,1989-12-29,"Private, ltd by shares"70,0070161,"SAMLY ELECTRONIC (HK) COMPANY, LIMITED
森利電子(香港)有限公司",1979-06-01,1995-11-24,"Private, ltd by shares"71,0070215,"SCI-TRONIC INDUSTRIAL LIMITED
佳力電子廠有限公司",1979-06-01,1992-10-25,"Private, ltd by shares"72,0070129,"SCOTIA TIMBER COMPANY LIMITED",1979-06-01,2001-02-16,"Private, ltd by shares"73,0070170,"SEA-VIEW HARBOUR TOUR COMPANY LIMITED
海景海上遊覽有限公司",1979-06-01,1998-08-01,"Private, ltd by shares"74,0070197,"SHINKO &amp; LEUNG (SECRETARIES) LIMITED",1979-06-01,2005-08-12,"Private, ltd by shares"75,0070165,"SIR DARLAINE (HONG KONG) COMPANY LIMITED
達連爵士(香港)洋行有限公司",1979-06-01,2002-11-15,"Private, ltd by shares"76,0070147,"STAG ENGINEERING H.K. LIMITED
德士機械工程有限公司",1979-06-01,2020-03-27,"Private, ltd by shares"77,0070177,"TALENTS INTERNATIONAL AGENCY (H.K.) LIMITED
綜藝國際娛樂(香港)有限公司",1979-06-01,1996-04-26,"Private, ltd by shares"78,0070135,"TELESCOPES INVESTMENT LIMITED",1979-06-01,1988-02-03,"Private, ltd by shares"79,0070131,"TIM SHAU (NEC) GARMENTS FACTORY LIMITED
添繡製衣廠有限公司",1979-06-01,1995-12-15,"Private, ltd by shares"80,0070200,"TIMKING COMPANY LIMITED
點金有限公司",1979-06-01,1995-11-24,"Private, ltd by shares"81,0070199,"TOLLAND COMPANY LIMITED",1979-06-01,2000-03-17,"Private, ltd by shares"82,0070173,"TOWN PROPERTIES MANAGEMENT LIMITED (d2002-11-15)
城市物業管理有限公司",1979-06-01,2002-11-15,"Private, ltd by shares"83,0070144,"VERBELLOW SHIPPING LIMITED",1979-06-01,1995-08-15,"Private, ltd by shares"84,0070142,"VERMICAL SHIPPING LIMITED",1979-06-01,1990-07-27,"Private, ltd by shares"85,0070184,"WAH TUNG ENTERPRISES LIMITED",1979-06-01,1993-05-28,"Private, ltd by shares"86,0070185,"WELJOY LIMITED
偉壯有限公司",1979-06-01,,"Private, ltd by shares"87,0070137,"WELLORD LIMITED (d1988-03-10)
衛和有限公司",1979-06-01,1988-03-10,"Private, ltd by shares"88,0070157,"WESTERN TECHNOLOGY DATA PROCESSING COMPANY LIMITED",1979-06-01,1995-11-24,"Private, ltd by shares"89,0070138,"WHITEWOOD LIMITED (d2000-03-17)
衛富有限公司",1979-06-01,2000-03-17,"Private, ltd by shares"90,0070139,"WILLIAM LEE (SEC.) &amp; ACCOUNTING TAXATION LIMITED
李偉明(秘書)會計稅務有限公司",1979-06-01,,"Private, ltd by shares"91,0070213,"YTT LUMBER LIMITED",1979-06-01,1991-08-30,"Private, ltd by shares"92,0070127,"YUNG MAO CHEMICALS COMPANY LIMITED
榮茂化學原料有限公司",1979-06-01,,"Private, ltd by shares"