,Reg no.,Name,Incorp-orated,Dissolved,Type1,0054224,"A K INDUSTRIAL COMPANY LIMITED
雅基實業有限公司",1977-07-08,,"Private, ltd by shares"2,0054222,"A-A DISTRIBUTORS LIMITED",1977-07-08,,"Private, ltd by shares"3,0054211,"ASIA-WETDOCKING LIMITED",1977-07-08,1982-10-31,"Private, ltd by shares"4,0054184,"BARRA COMPANY LIMITED",1977-07-08,1999-10-08,"Private, ltd by shares"5,0054212,"BITANGLER INVESTMENTS LIMITED",1977-07-08,1984-11-02,"Private, ltd by shares"6,0054185,"CANNA COMPANY LIMITED
堅勵有限公司",1977-07-08,2014-05-09,"Private, ltd by shares"7,0054181,"CERTACT INTERNATIONAL LIMITED",1977-07-08,2000-12-25,"Private, ltd by shares"8,0054191,"CHARGEURS INTERLINING (H.K.) LIMITED
霞日襯布(香港)有限公司",1977-07-08,,"Private, ltd by shares"9,0054200,"CONTDRESS LIMITED",1977-07-08,1989-04-03,"Private, ltd by shares"10,0054202,"Corgi International Limited
哥基國際有限公司",1977-07-08,2013-02-01,"Public, ltd by shares"11,0054169,"CUTE &amp; YOUNG COMPANY LIMITED
僑洋有限公司",1977-07-08,2004-12-10,"Private, ltd by shares"12,0054159,"DALEY BUILDING MATERIALS COMPANY LIMITED
德利磁磚潔具有限公司",1977-07-08,1995-09-29,"Private, ltd by shares"13,0054183,"DYNASTY EXPRESS COMPANY LIMITED
時代旅運有限公司",1977-07-08,,"Private, ltd by shares"14,0054196,"EFG ASIA LIMITED",1977-07-08,1998-07-20,"Private, ltd by shares"15,0054163,"ELITE FIRE &amp; SECURITY SERVICES (HONG KONG) LIMITED
怡利消防保安服務(香港)有限公司",1977-07-08,2000-09-15,"Private, ltd by shares"16,0054177,"EVER ONWARD SELF-ADHESIVE LABEL COMPANY LIMITED
永達膠貼商標有限公司",1977-07-08,,"Private, ltd by shares"17,0054209,"FOUNTAINING ENTERPRISE LIMITED
奉天承企業有限公司",1977-07-08,2000-03-17,"Private, ltd by shares"18,0054201,"FU HING OIL COMPANY LIMITED",1977-07-08,2002-08-15,"Private, ltd by shares"19,0054210,"GATEWAY INDUSTRIES (HK) LIMITED
嘉威實業(香港)有限公司",1977-07-08,1992-09-06,"Private, ltd by shares"20,0054158,"GHD LIMITED (HK)",1977-07-08,,"Private, ltd by shares"21,0054213,"GILBERTON ENTERPRISES LIMITED",1977-07-08,1980-11-28,"Private, ltd by shares"22,0054215,"GOLDEN LEAGUE INVESTMENTS LIMITED
金盟置業有限公司",1977-07-08,1989-08-09,"Private, ltd by shares"23,0054151,"GOLDEN PROMISE DEVELOPMENT COMPANY LIMITED
金信發展有限公司",1977-07-08,1986-09-02,"Private, ltd by shares"24,0054214,"GOLDEN SPECTRUM INVESTMENTS LIMITED
金光置業有限公司",1977-07-08,,"Private, ltd by shares"25,0054216,"HALLIFORD (HOLDINGS) LIMITED",1977-07-08,1988-08-20,"Private, ltd by shares"26,0054162,"HANG PONG PROPERTY MANAGEMENT COMPANY LIMITED
恒邦屋宇管理有限公司",1977-07-08,,"Private, ltd by shares"27,0054203,"HEUNG CHIN COMPANY LIMITED
向前有限公司",1977-07-08,1985-08-03,"Private, ltd by shares"28,0054193,"HING SHING ENGINEERING COMPANY LIMITED
興盛工程有限公司",1977-07-08,1993-05-15,"Private, ltd by shares"29,0054204,"HON SUM COMPANY LIMITED
漢心有限公司",1977-07-08,2002-11-01,"Private, ltd by shares"30,0054152,"HOPHA INTERNATIONAL CONSULTANTS LIMITED
鴻發國際顧問有限公司",1977-07-08,2005-07-08,"Private, ltd by shares"31,0054206,"INSTRUMENTATION LABORATORY (FAR EAST) LIMITED
實驗儀器(遠東)有限公司",1977-07-08,2004-06-18,"Private, ltd by shares"32,0054156,"JOHNCO INDUSTRIAL LIMITED
中好實業有限公司",1977-07-08,,"Private, ltd by shares"33,0054171,"KAI TAI SECURITIES LIMITED
啟泰證劵有限公司",1977-07-08,,"Private, ltd by shares"34,0054150,"KAIHEI EXCAVATION LIMITED
開平開發有限公司",1977-07-08,1993-04-19,"Private, ltd by shares"35,0054170,"KWONG LAM FONG LIMITED
廣林豐有限公司",1977-07-08,1996-07-26,"Private, ltd by shares"36,0054154,"LE POR PROPERTIES COMPANY LIMITED
利寶地產有限公司",1977-07-08,1996-12-20,"Private, ltd by shares"37,0054198,"LI-TUNG ELECTRONICS COMPANY LIMITED
利東電子有限公司",1977-07-08,2003-02-14,"Private, ltd by shares"38,0054178,"MAN MO KWONG MING COMPANY LIMITED
文武光明有限公司",1977-07-08,1996-01-26,"Private, ltd by shares"39,0054153,"MANNEX MANAGEMENT LIMITED (d1986-02-13)",1977-07-08,1986-02-13,"Private, ltd by shares"40,0054199,"MASTERCRAFT LIMITED (d1995-09-29)",1977-07-08,1995-09-29,"Private, ltd by shares"41,0054149,"MEAT PROVISIONS ASSOCIATION (SHATIN) LIMITED
沙田肉聯商會有限公司",1977-07-08,,"Ltd by guarantee"42,0054168,"MEI FAI HATS INTERNATIONAL MANUFACTURING COMPANY LIMITED
美輝製帽國際有限公司",1977-07-08,,"Private, ltd by shares"43,0054217,"MORLOP ENTERPRISES LIMITED",1977-07-08,1985-05-27,"Private, ltd by shares"44,0054180,"MUTIARA INTERNATIONAL COMPANY LIMITED
茂天娜國際有限公司",1977-07-08,2002-06-14,"Private, ltd by shares"45,0054194,"NAN FUNG FINANCE LIMITED
南豐財務有限公司",1977-07-08,,"Private, ltd by shares"46,0054197,"NATURAL RESOURCE CONSULTANTS LIMITED",1977-07-08,1983-02-25,"Private, ltd by shares"47,0054218,"NEPAL CARPET AND CRAFTS TRADING COMPANY LIMITED",1977-07-08,1996-02-23,"Private, ltd by shares"48,0054207,"NESLONGI COMPANY LIMITED",1977-07-08,2004-04-09,"Private, ltd by shares"49,0054192,"NGAR MAN PRINTING AND BINDING COMPANY LIMITED
雅文印製廠有限公司",1977-07-08,1996-01-26,"Private, ltd by shares"50,0054221,"OKETA LIMITED",1977-07-08,2008-05-23,"Private, ltd by shares"51,0054208,"PALADIN PRINTING AND PUBLISHING SERVICES LIMITED",1977-07-08,1985-10-25,"Private, ltd by shares"52,0054155,"PAN-WELL TRAVEL AND TRADING COMPANY LIMITED
百威旅運有限公司",1977-07-08,,"Private, ltd by shares"53,0054164,"PLAY-VOGUE INDUSTRIAL COMPANY LIMITED
珀力華實業有限公司",1977-07-08,,"Private, ltd by shares"54,0054165,"PROMOTION OF TRADE ASSOCIATION LIMITED
商業協進聯誼會有限公司",1977-07-08,1997-04-18,"Private, ltd by shares"55,0054205,"PUI LAM COMPANY LIMITED
霈霖有限公司",1977-07-08,1992-07-22,"Private, ltd by shares"56,0054186,"SCARBA COMPANY LIMITED",1977-07-08,1990-04-27,"Private, ltd by shares"57,0054160,"SECONDMENT LIMITED",1977-07-08,,"Private, ltd by shares"58,0054219,"SILICA TRADING LIMITED (d1986-02-01)",1977-07-08,1986-02-01,"Private, ltd by shares"59,0054176,"SILVER CROWN RESTAURANT LIMITED
銀冠海鮮酒家有限公司",1977-07-08,2003-02-14,"Private, ltd by shares"60,0054179,"SUN KWOK KWONG FURNITURE AND STEEL EQUIPMENTS LIMITED
新國光傢俬鋼具有限公司",1977-07-08,1999-01-03,"Private, ltd by shares"61,0054174,"TAI PO DEVELOPMENT COMPANY LIMITED
大埔發展有限公司",1977-07-08,1991-02-28,"Private, ltd by shares"62,0054187,"TAYBRIDGE LIMITED (d2004-06-18)",1977-07-08,2004-06-18,"Private, ltd by shares"63,0054167,"TIN WO TRADING COMPANY LIMITED
天和貿易有限公司",1977-07-08,1985-12-09,"Private, ltd by shares"64,0054220,"TOGGLE ENTERPRISES LIMITED",1977-07-08,1987-01-23,"Private, ltd by shares"65,0054161,"TOR CHAN TRADING LIMITED
多賺貿易有限公司",1977-07-08,2020-03-27,"Private, ltd by shares"66,0054188,"TOWNCOURT LIMITED",1977-07-08,,"Private, ltd by shares"67,0054223,"TRANS-INSULAR INTERNATIONAL LIMITED",1977-07-08,1995-09-29,"Private, ltd by shares"68,0054175,"TUEN MUN DEVELOPMENT COMPANY LIMITED
屯門發展有限公司",1977-07-08,,"Private, ltd by shares"69,0054189,"VALETA LIMITED (d1987-09-04)",1977-07-08,1987-09-04,"Private, ltd by shares"70,0054190,"VALONA LIMITED",1977-07-08,2005-01-27,"Private, ltd by shares"71,0054157,"VINCO PLASTIC INDUSTRIAL COMPANY LIMITED
榮高塑膠實業有限公司",1977-07-08,2003-12-24,"Private, ltd by shares"72,0054166,"WILSON PHARMACEUTICALS LIMITED
惠信葯品有限公司",1977-07-08,2003-02-14,"Private, ltd by shares"73,0054195,"WING LIPSON INDUSTRIES COMPANY LIMITED
永立信實業有限公司",1977-07-08,1993-02-16,"Private, ltd by shares"74,0054182,"WING TAT METAL WATCH BAND MANUFACTORY LIMITED
榮達金屬錶帶廠有限公司",1977-07-08,,"Private, ltd by shares"75,0054172,"WONG &amp; FUNG ASSOCIATES LIMITED",1977-07-08,1995-09-29,"Private, ltd by shares"76,0054173,"YICK YAT ENTERPRISES COMPANY, LIMITED
益溢企業有限公司",1977-07-08,,"Private, ltd by shares"