,Reg no.,Name,Incorp-orated,Dissolved,Type1,0082011,"ACCEL DEVELOPMENT LIMITED (d1994-10-19)",1980-05-13,1994-10-19,"Private, ltd by shares"2,0081941,"AGENTS-DISTRIBUTORS LIMITED
金山商品代理有限公司",1980-05-13,1998-08-28,"Private, ltd by shares"3,0081929,"AGI PETROLEUM COMPANY LIMITED",1980-05-13,1998-08-28,"Private, ltd by shares"4,0082010,"AGLARE ENTERPRISES LIMITED",1980-05-13,1996-03-29,"Private, ltd by shares"5,0082015,"ALBA TIME (HONG KONG) LIMITED
雅栢時計(香港)有限公司",1980-05-13,1995-01-11,"Private, ltd by shares"6,0081930,"ASIAN ELECTRONICS LIMITED (d2002-05-06)",1980-05-13,2002-05-06,"Private, ltd by shares"7,0082009,"BALAS (OVERSEAS) LIMITED",1980-05-13,,"Private, ltd by shares"8,0082008,"BEAM INVESTMENT LIMITED",1980-05-13,1998-08-28,"Private, ltd by shares"9,0082012,"BEST DEVELOPMENT COMPANY LIMITED
栢時發展有限公司",1980-05-13,2013-06-14,"Private, ltd by shares"10,0081970,"BHANABHAI (FAR EAST) LIMITED",1980-05-13,2004-06-11,"Private, ltd by shares"11,0081978,"CBC TOURS MANAGEMENT LIMITED",1980-05-13,2000-10-13,"Private, ltd by shares"12,0082006,"CEDECO LIMITED (d1996-02-09)
實達高有限公司",1980-05-13,1996-02-09,"Private, ltd by shares"13,0082014,"CHAP CING TEXTILE LIMITED",1980-05-13,1998-06-05,"Private, ltd by shares"14,0082023,"CHEUNG LOK PLASTIC MANUFACTORY LIMITED
長樂塑膠廠有限公司",1980-05-13,,"Private, ltd by shares"15,0081942,"CHIAP HANG INDUSTRIES LIMITED
捷恒實業有限公司",1980-05-13,1989-10-28,"Private, ltd by shares"16,0081963,"CIRCA PRODUCTIONS LIMITED",1980-05-13,2018-10-12,"Private, ltd by shares"17,0081934,"CITY-LINK AIR COURIER SERVICE LIMITED
捷時令快遞有限公司",1980-05-13,1989-02-28,"Private, ltd by shares"18,0082017,"CLAVERHOUSE LIMITED (d1996-03-29)",1980-05-13,1996-03-29,"Private, ltd by shares"19,0081951,"DAILYWIN WATCH PRODUCTS MFG. LIMITED
得利鐘錶製品廠有限公司",1980-05-13,,"Private, ltd by shares"20,0082002,"DANDY INTERIOR PRODUCTS LIMITED
天地裝飾材料有限公司",1980-05-13,,"Private, ltd by shares"21,0082019,"DELMON ELECTRONICS LIMITED
德望電子有限公司",1980-05-13,1996-05-31,"Private, ltd by shares"22,0081985,"DESIRABLE INTERNATIONAL FASHIONS LIMITED
顯達時裝國際有限公司",1980-05-13,2010-04-08,"Private, ltd by shares"23,0082016,"DRUMCLOG LIMITED",1980-05-13,1996-05-31,"Private, ltd by shares"24,0082022,"ELEC CONSULTANCY COMPANY LIMITED
義力顧問有限公司",1980-05-13,1984-01-20,"Private, ltd by shares"25,0081998,"EMANO TRADING LIMITED",1980-05-13,2000-04-07,"Private, ltd by shares"26,0081980,"EQUUS TRICOTS LIMITED",1980-05-13,,"Private, ltd by shares"27,0082030,"FAT YEUNG INVESTMENT COMPANY LIMITED
發揚投資有限公司",1980-05-13,2011-05-13,"Private, ltd by shares"28,0081972,"GAYLAW INVESTMENT COMPANY LIMITED
基羅置業有限公司",1980-05-13,2011-09-30,"Private, ltd by shares"29,0081949,"GEMLAB LIMITED",1980-05-13,1996-04-26,"Private, ltd by shares"30,0081931,"GENERAL INSTRUMENT SOUTHEAST ASIA LIMITED",1980-05-13,1983-09-20,"Private, ltd by shares"31,0082018,"GLENCOE ENTERPRISES LIMITED",1980-05-13,,"Private, ltd by shares"32,0081997,"GREDASY INTERNATIONAL COMPANY LIMITED",1980-05-13,1996-05-31,"Private, ltd by shares"33,0081933,"GRM ENTERPRISES LIMITED (d1997-04-18)",1980-05-13,1997-04-18,"Private, ltd by shares"34,0081952,"HOBSONIC INDUSTRIES LIMITED
豪新工業有限公司",1980-05-13,2004-04-08,"Private, ltd by shares"35,0081988,"HONG KONG SPORTSWEAR EXCHANGE LIMITED",1980-05-13,1996-05-31,"Private, ltd by shares"36,0082029,"HSING YEUNG INVESTMENT COMPANY LIMITED
星揚投資有限公司",1980-05-13,1993-07-01,"Private, ltd by shares"37,0082007,"ILLINOIS INVESTMENT LIMITED",1980-05-13,2007-08-03,"Private, ltd by shares"38,0081974,"IONG ON LIMITED
鏞安有限公司",1980-05-13,1989-02-21,"Private, ltd by shares"39,0081983,"J &amp; S TRADING COMPANY, LIMITED
美盈有限公司",1980-05-13,1986-08-27,"Private, ltd by shares"40,0081991,"JEC Enterprises Limited
精意企業有限公司",1980-05-13,,"Private, ltd by shares"41,0081940,"JECO SHIPPING LIMITED",1980-05-13,1996-06-28,"Private, ltd by shares"42,0081926,"K. K. YEUNG ASSOCIATION LIMITED",1980-05-13,1999-02-26,"Ltd by guarantee"43,0082024,"KAI SON COTTON COMPANY LIMITED
嘉新棉業有限公司",1980-05-13,1995-04-20,"Private, ltd by shares"44,0081946,"KIN WAH MARITIME LIMITED
建華海運有限公司",1980-05-13,1996-04-26,"Private, ltd by shares"45,0081994,"KING KONG ENTERPRISES LIMITED
京港企業有限公司",1980-05-13,2002-09-13,"Private, ltd by shares"46,0081992,"KINGAI JEWELLERY &amp; FURS LIMITED
京藝珠寶皮草有限公司",1980-05-13,2010-01-29,"Private, ltd by shares"47,0081959,"KOLF ELECTRONIC INDUSTRIAL LIMITED",1980-05-13,1998-02-20,"Private, ltd by shares"48,0081993,"KOOM NAM WAH WEDDING SUPPLIES LIMITED
冠南華結婚用品有限公司",1980-05-13,,"Private, ltd by shares"49,0081989,"LAWE WILLIAM (CHINA TRADE) LIMITED
偉寧極輝有限公司",1980-05-13,2000-02-18,"Private, ltd by shares"50,0081961,"LEAWOOD ENTERPRISES LIMITED
利活投資有限公司",1980-05-13,2002-09-13,"Private, ltd by shares"51,0081945,"LEECOM ENTERPRISES LIMITED
利江企業有限公司",1980-05-13,,"Private, ltd by shares"52,0081956,"LEICATEX DYEING FACTORY LIMITED
利嘉染廠有限公司",1980-05-13,2002-09-06,"Private, ltd by shares"53,0081927,"LEUNG CHU MANUFACTORY LIMITED
梁柱製造廠有限公司",1980-05-13,2011-10-21,"Private, ltd by shares"54,0081995,"LUNG FUNG FINANCE COMPANY LIMITED
隆豐財務有限公司",1980-05-13,1999-08-13,"Private, ltd by shares"55,0081939,"MANU-GEAR COMPANY LIMITED
敏而佳有限公司",1980-05-13,2002-09-13,"Private, ltd by shares"56,0081955,"MECO ELECTRICAL INDUSTRIES LIMITED
德寶電業有限公司",1980-05-13,,"Private, ltd by shares"57,0081960,"MUSTGET INTERNATIONAL INSURANCE AGENCY LIMITED
萬事得國際保險代理有限公司",1980-05-13,2006-05-26,"Private, ltd by shares"58,0081976,"OLIVETTI TECNOST H.K. LIMITED",1980-05-13,2006-10-07,"Private, ltd by shares"59,0081958,"ORIENTECHNICS LIMITED",1980-05-13,1996-06-28,"Private, ltd by shares"60,0082003,"ORKEM FAR EAST LIMITED
又更遠東有限公司",1980-05-13,1995-10-19,"Private, ltd by shares"61,0081975,"OUR GRACE TRADING LIMITED",1980-05-13,1994-12-30,"Private, ltd by shares"62,0082025,"OVERSEA CHINESE CONSULTANCY LIMITED",1980-05-13,2002-09-13,"Private, ltd by shares"63,0082021,"PAXXON LIMITED",1980-05-13,1996-04-26,"Private, ltd by shares"64,0081987,"PERDANA MANAGEMENT SERVICES LIMITED",1980-05-13,1994-04-29,"Private, ltd by shares"65,0081999,"PETERBILT COMPANY LIMITED",1980-05-13,,"Private, ltd by shares"66,0081954,"PHYSIX LIMITED",1980-05-13,2000-12-15,"Private, ltd by shares"67,0082000,"PING ON CONSTRUCTION COMPANY LIMITED
平安建築有限公司",1980-05-13,2009-01-02,"Private, ltd by shares"68,0082028,"PO CHAP HING INVESTMENT COMPANY LIMITED
寶集興投資有限公司",1980-05-13,1997-09-23,"Private, ltd by shares"69,0082026,"POWER CONSULTANCY LIMITED",1980-05-13,,"Private, ltd by shares"70,0082013,"PRIMITIVE AND ORIENTAL ART LIMITED",1980-05-13,1996-04-26,"Private, ltd by shares"71,0081957,"PRODUCTIVITY ENTERPRISE LIMITED
創利企業有限公司",1980-05-13,1992-10-06,"Private, ltd by shares"72,0081973,"PROFIT MOTION COMPANY LIMITED
利卓有限公司",1980-05-13,1999-09-10,"Private, ltd by shares"73,0081971,"RAVI'S COMMODITIES LIMITED",1980-05-13,1991-10-25,"Private, ltd by shares"74,0081986,"RAYTECH INDUSTRIAL COMPANY LIMITED
滙達電業有限公司",1980-05-13,1999-09-10,"Private, ltd by shares"75,0081928,"ROGER HOUGHTON MOTOR SURVEYS LIMITED",1980-05-13,,"Private, ltd by shares"76,0081996,"RTC EXPORT COMPANY LIMITED",1980-05-13,1996-05-31,"Private, ltd by shares"77,0081936,"RUNHIL LIMITED
運喜有限公司",1980-05-13,1991-09-27,"Private, ltd by shares"78,0081937,"RUNWISE LIMITED (HK)
運智有限公司",1980-05-13,,"Private, ltd by shares"79,0082005,"SHU KONG GARMENT COMPANY LIMITED
殊光製衣廠有限公司",1980-05-13,2002-12-06,"Private, ltd by shares"80,0081981,"SIMATELEX INDUSTRIAL COMPANY LIMITED
新瑪德實業有限公司",1980-05-13,,"Private, ltd by shares"81,0081967,"SIRIUS COMPANY LIMITED
昌驊洋行有限公司",1980-05-13,2014-02-21,"Private, ltd by shares"82,0081938,"STEPVIEW LIMITED (d1987-07-24)
置景有限公司",1980-05-13,1987-07-24,"Private, ltd by shares"83,0081982,"SUNDAIRY (HK) COMPANY LIMITED
新得利(香港)有限公司",1980-05-13,,"Private, ltd by shares"84,0081953,"SUNHALL LIMITED (d1985-04-24)
迅豪有限公司",1980-05-13,1985-04-24,"Private, ltd by shares"85,0081966,"TAI LOONG HONG MARINE PRODUCTS LIMITED
大隆行海產有限公司",1980-05-13,,"Private, ltd by shares"86,0081950,"TEONG KANG LIMITED",1980-05-13,1987-12-28,"Private, ltd by shares"87,0081943,"TEST-RITE INTERNATIONAL LIMITED",1980-05-13,2018-07-20,"Private, ltd by shares"88,0082020,"THREE FINE TRADING WAI CHOW BUS DEVELOPMENT COMPANY LIMITED
三雅貿易惠州巴士發展有限公司",1980-05-13,1996-04-26,"Private, ltd by shares"89,0082001,"TIN WO CONSTRUCTION COMPANY LIMITED
天和建築有限公司",1980-05-13,2000-11-10,"Private, ltd by shares"90,0081944,"TRADE PARTNERS LIMITED",1980-05-13,1989-06-28,"Private, ltd by shares"91,0081932,"UNIMATION MACHINERY LIMITED
堅力機械有限公司",1980-05-13,2011-12-09,"Private, ltd by shares"92,0081948,"UPTRONIC INDUSTRIES LIMITED
祥吉利實業有限公司",1980-05-13,1998-08-28,"Private, ltd by shares"93,0081964,"VINH LONG (33) COMMERCIAL COMPANY LIMITED",1980-05-13,1984-07-27,"Private, ltd by shares"94,0081968,"W.E. MOULSDALE AND COMPANY LIMITED",1980-05-13,2001-04-04,"Private, ltd by shares"95,0081962,"WAI MAY ELECTRONICS COMPANY LIMITED
威美電子有限公司",1980-05-13,2001-11-23,"Private, ltd by shares"96,0082027,"WAYFOONG SHIPPING SERVICES LIMITED",1980-05-13,1994-02-26,"Private, ltd by shares"97,0081990,"WELLSON ENTERPRISES LIMITED
威利晨企業有限公司",1980-05-13,,"Private, ltd by shares"98,0081977,"WHEEL WHEEL TRADING COMPANY LIMITED",1980-05-13,1996-04-26,"Private, ltd by shares"99,0082004,"WOTRACO COMPANY, LIMITED",1980-05-13,,"Private, ltd by shares"100,0081935,"WUN TUNG BUILDING MATERIALS COMPANY LIMITED
運通建築材料有限公司",1980-05-13,1996-06-28,"Private, ltd by shares"101,0081965,"YAT SUN DEVELOPMENT LIMITED
日新發展有限公司",1980-05-13,2002-09-13,"Private, ltd by shares"102,0081979,"YEUNG TSE KONG ENTERPRISES LIMITED
揚子江企業有限公司",1980-05-13,2000-04-21,"Private, ltd by shares"103,0081947,"YORKSMAN COMPANY LIMITED
保明有限公司",1980-05-13,1982-04-30,"Private, ltd by shares"104,0081984,"YOTAKA ENTERTAINMENT COMPANY LIMITED
神鷹娛樂有限公司",1980-05-13,,"Private, ltd by shares"105,0081969,"ZON (HOLDINGS) LIMITED",1980-05-13,1996-07-19,"Private, ltd by shares"