,Reg no.,Name,Incorp-orated,Dissolved,Type1,2580290,"BLOOMFIELD DEVELOPMENT GROUP LIMITED",2017-09-16,,"Private, ltd by shares"2,2580294,"CX Hong Kong Packaging Limited
高尚香港包裝有限公司",2017-09-16,,"Private, ltd by shares"3,2580289,"EVER HIGH HOLDINGS LIMITED
高恒集團有限公司",2017-09-16,,"Private, ltd by shares"4,2580293,"Huiming Group Limited
惠名集團有限公司",2017-09-16,,"Private, ltd by shares"5,2580291,"QUZHOU HUIBING REFRIGERANT COMPANY LIMITED
衢州徽冰制冷科技有限公司",2017-09-16,,"Private, ltd by shares"6,2580292,"Ying Do Technology Limited
應道科技有限公司",2017-09-16,,"Private, ltd by shares"